title,price,link_item,index,discount,sales,category
Quần Sịp Pump Cotton Kiểu Dáng Thể Thao Mới K222,65.000₫,https://tiki.vn/quan-sip-pump-cotton-kieu-dang-the-thao-moi-k222-p84823077.html?spid=84823438,1,,Đã bán 32,dolotnam
"Sịp Đùi- Quần Lót Nam Boxer Cotton Mềm Nhẹ Thoáng Khí Họa Tiết Chữ New K023 - Tím,XL",64.000₫,https://tiki.vn/sip-dui-quan-lot-nam-boxer-cotton-mem-nhe-thoang-khi-hoa-tiet-chu-new-k023-p84820809.html?spid=84820935,2,,,dolotnam
Hộp 3 Quần Sịp Đùi Nam Cao Cấp Kháng Khuẩn 5D 55-75kg,49.000₫,https://tiki.vn/hop-3-quan-sip-dui-nam-cao-cap-khang-khuan-5d-55-75kg-p139146175.html?spid=139146181,3,,,dolotnam
Boxer Nam thời trang,32.000₫,https://tiki.vn/boxer-nam-thoi-trang-p101949806.html?spid=101949835,4,,,dolotnam
,,https://tiki.vn/quan-boxer-nam-p101949803.html?spid=101949837,5,,,dolotnam
Quần lót dây bằng cotton thoải mái quyến rũ cho nam,50.000₫,https://tiki.vn/quan-lot-day-bang-cotton-thoai-mai-quyen-ru-cho-nam-p217185598.html?spid=217185599,6,,,dolotnam
10 quần sịp chéo cailin kaien 45-55kg,259.000₫,https://tiki.vn/10-quan-sip-cheo-cailin-kaien-45-55kg-p174086559.html?spid=174086564,7,,,dolotnam
COMBO 3 Quần Lót Nam Cao Câp Dệt Liền Đủ Màu Sắc Logo Thương Hiệu BABOYKA Thông Hơi Tốt,360.000₫,https://tiki.vn/combo-3-quan-lot-nam-cao-cap-det-lien-du-mau-sac-logo-thuong-hieu-baboyka-thong-hoi-tot-p175867727.html?spid=175867819,8,,,dolotnam
Quần Lót Nam Logo Thương Hiệu BABOYKA Chất Bambo Phối Kẻ Phong Cách Trẻ Trung,105.000,https://tiki.vn/quan-lot-nam-logo-thuong-hieu-baboyka-chat-bambo-phoi-ke-phong-cach-tre-trung-p175867662.html?spid=175867707,9,,,dolotnam
,,https://tiki.vn/combo-3-quan-lot-nam-phoi-hoa-tiet-ke-chat-bambo-co-gian-4-chieu-thoang-mat-de-chiu-khi-mac-p175867473.html?spid=175867495,10,,,dolotnam
Quần sịp Zakado dệt xám,105.000₫,https://tiki.vn/quan-sip-zakado-det-xam-p172835381.html?spid=172835383,11,,,dolotnam
Sịp tam giác Zakazo trơn cạp mềm - M,99.000₫,https://tiki.vn/sip-tam-giac-zakazo-tron-cap-mem-p172709094.html?spid=172709098,12,,,dolotnam
,,https://tiki.vn/mac-nhu-khong-mac-comb-4-quan-lot-nam-thong-hoi-thoang-khi-min-mat-nhu-lua-kem-hop-quan-sip-dui-p139450995.html?spid=139451031,13,,,dolotnam
Combo 4 quần Sịp chéo nam,90.000₫,https://tiki.vn/combo-4-quan-sip-cheo-nam-p120212619.html?spid=120212633,14,,,dolotnam
QUẦN LÓT NAM VIỆT TIẾN,135.000₫,https://tiki.vn/quan-lot-nam-viet-tien-p109516642.html?spid=109516650,15,,Đã bán 16,dolotnam
giá tem cty 65k -bán lẻ 44k -MS:6046( Freeman)cotton 4 chiều,44.000₫,https://tiki.vn/gia-tem-cty-65k-ban-le-44k-ms-6046-freeman-cotton-4-chieu-p107094875.html?spid=107095809,16,,,dolotnam
"MS:6005,quần lót nam thun lạnh 84% nylon -16%spandex",46.800₫,https://tiki.vn/ms-6005-quan-lot-nam-thun-lanh-84-nylon-16-spandex-p104946744.html?spid=104947304,17,,,dolotnam
,,https://tiki.vn/freeman-6517-sip-dui-chat-viscose-p108010088.html?spid=108010226,18,,,dolotnam
Quần lót nam thun lạnh - MS:6005,44.850₫,https://tiki.vn/ms-6005-quan-lot-nam-thun-lanh-84-nylon-16-spandex-p108011264.html?spid=108012966,19,,,dolotnam
"SỊP THUN TRƠN, sịp đùi nam, quần lót",50.000₫,https://tiki.vn/sip-thun-tron-sip-dui-nam-quan-lot-p121739961.html?spid=121740039,20,,,dolotnam
Set quần đùi nam thông hơi,160.000₫,https://tiki.vn/set-quan-dui-nam-thong-hoi-p124065733.html?spid=124065742,21,,,dolotnam
Quần lót cotton nam cao cấp co giãn thoáng khí QN02,43.560₫,https://tiki.vn/quan-lot-cotton-nam-cao-cap-co-gian-thoang-khi-qn02-p138889945.html?spid=138889994,22,,,dolotnam
CHUYÊN SỈ: QUẦN SỊP CHÉO THÔNG HƠI,210.000₫,https://tiki.vn/chuyen-si-quan-sip-cheo-thong-hoi-p122235566.html?spid=122235620,23,,,dolotnam
☆ Quần lót nam sịp boxer cotton thể thao thiết kế đẹp cao cấp,88.308₫,https://tiki.vn/quan-lot-nam-sip-boxer-cotton-the-thao-thiet-ke-dep-cao-cap-p150373221.html?spid=150373283,24,,,dolotnam
☆ Quần Lót Nam quần sịp nam tam giác cổ điển viền moi vải cotton co dãn đa chiều thấm hút mồ hôi tốt,64.680₫,https://tiki.vn/quan-lot-nam-quan-sip-nam-tam-giac-co-dien-vien-moi-vai-cotton-co-dan-da-chieu-tham-hut-mo-hoi-tot-p150374082.html?spid=150374150,25,,,dolotnam
,,https://tiki.vn/quan-lot-nam-tam-giac-sexy-thiet-ke-dep-thong-hoi-co-dan-da-chieu-p150373896.html?spid=150374074,26,,,dolotnam
Set 4 Quần Lót Nam Dáng Boxer Cotton Thấm Hút Mồ Hôi Quần Sịp Nam Thun Lạnh Co Giãn 4 Chiều,140.100₫,https://tiki.vn/set-4-quan-lot-nam-dang-boxer-cotton-tham-hut-mo-hoi-quan-sip-nam-thun-lanh-co-gian-4-chieu-p152691175.html?spid=152691204,27,,,dolotnam
Quần Lót Nam Cotton Thoáng Khí Quần Sịp Nam Thun Lạnh Thấm Mồ Hôi Co Giãn 4 Chiều,35.000₫,https://tiki.vn/quan-lot-nam-cotton-thoang-khi-quan-sip-nam-thun-lanh-tham-mo-hoi-co-gian-4-chieu-p152691308.html?spid=152691351,28,,,dolotnam
Quần lót nam rằn ri thời trang,48.000₫,https://tiki.vn/quan-lot-nam-ran-ri-thoi-trang-p152872628.html?spid=152872752,29,,Đã bán 9,dolotnam
Quần lót nam sexy STUD underwear U1032ALB02,965.000,https://tiki.vn/quan-lot-nam-sexy-stud-underwear-u1032alb02-p160608022.html?spid=160608030,30,,,dolotnam
,,https://tiki.vn/quan-lot-nam-sexy-stud-underwear-u1050alt05-p160607983.html?spid=160608011,31,,,dolotnam
Quần lót nam sexy STUD underwear U1044AJS22,965.000₫,https://tiki.vn/quan-lot-nam-sexy-stud-underwear-u1044ajs22-p160608094.html?spid=160608101,32,,,dolotnam
Quần lót nam sexy STUD Jock U1063BJS12,965.000₫,https://tiki.vn/quan-lot-nam-sexy-stud-jock-u1063bjs12-p160607985.html?spid=160608012,33,,,dolotnam
Quần sịp tam giác 100% cotton kháng khuẩn khử mùi YG YV0040N của Nhật,175.000₫,https://tiki.vn/quan-sip-tam-giac-100-cotton-khang-khuan-khu-mui-yg-yv0040n-cua-nhat-p178153776.html?spid=178153784,34,,,dolotnam
đồ lót COTTON BASIC - Bibi Set,72.000₫,https://tiki.vn/do-lot-cotton-basic-bibi-set-p166547385.html?spid=166548084,35,,,dolotnam
,,https://tiki.vn/quan-lot-nam-armand-ar108-quan-tam-giac-thun-lanh-lung-bang-to-p167480705.html?spid=167480707,36,,,dolotnam
"Quần lót nam Armand AR102 lưng bảng to, lỗ thông hơi",55.000₫,https://tiki.vn/quan-lot-nam-armand-ar102-lung-bang-to-lo-thong-hoi-p167478523.html?spid=167478571,37,,,dolotnam
Quần đùi nam Rock QA308518 họa tiết ngẫu nhiên,145.000₫,https://tiki.vn/quan-dui-nam-rock-qa308518-hoa-tiet-ngau-nhien-p167476622.html?spid=167476642,38,,,dolotnam
Quần Lót Nam Mã 09 Cạp Nhỏ Co Dãn Tốt Siêu Thoáng Mát,67.500₫,https://tiki.vn/quan-lot-nam-ma-09-cap-nho-co-dan-tot-sieu-thoang-mat-p165242183.html?spid=165242191,39,,,dolotnam
Hộp 4 Quần lót nam - quần sịp nam thông hơi Nhật cao cấp,98.000₫,https://tiki.vn/hop-4-quan-lot-nam-quan-sip-nam-thong-hoi-nhat-cao-cap-p80941066.html?spid=253313311,40,,,dolotnam
