title,price,link_item,index,discount,sales,brand
"Váy ngủ viền ren gợi cảm, quyến rũ Lylylorem SX46",338.000₫,https://tiki.vn/vay-ngu-vien-ren-goi-cam-quyen-ru-lylylorem-sx46-p157260203.html?spid=157260207,1,-21%,,lylylorem
Áo lót su đúc cao cấp không đường may Lylylorem AL081,780.000₫,https://tiki.vn/ao-lot-su-duc-cao-cap-khong-duong-may-lylylorem-al081-p157542716.html?spid=157542720,2,,Đã bán 14,lylylorem
Bodysuit nữ ba lỗ LyLy JM068 áo liền thân sát nách ôm body thun co giãn phối cổ ren quyến rũ,450.000₫,https://tiki.vn/bodysuit-nu-ba-lo-lyly-jm068-ao-lien-than-sat-nach-om-body-thun-co-gian-phoi-co-ren-quyen-ru-p205980466.html?spid=205980482,3,,,lylylorem
Bộ đồ lót nữ có gọng họa tiết hoa nhí Lylylorem BL180,100.000,https://tiki.vn/bo-do-lot-nu-co-gong-hoa-tiet-hoa-nhi-lylylorem-bl180-p191548332.html?spid=191548346,4,,,lylylorem
,,https://tiki.vn/quan-dui-nu-ong-loe-lung-cao-sieu-mem-mai-thoang-mat-lylylorem-ql145-p189641346.html?spid=189641348,5,,,lylylorem
Quần mặc váy an toàn 2 lớp chống lộ cho nữ Lylylorem,48.500₫,https://tiki.vn/quan-mac-vay-an-toan-2-lop-chong-lo-cho-nu-lylylorem-p205978959.html?spid=205978993,6,,Đã bán 5,lylylorem
Bộ đồ lót đệm dày nâng ngực quyến rũ Lylylorem BL176,100.000₫,https://tiki.vn/bo-do-lot-dem-day-nang-nguc-quyen-ru-lylylorem-bl176-p175147283.html?spid=175413939,7,,Đã bán 1,lylylorem
Áo dán dây rút đệm bàn tay siêu nâng - AD004,55.000₫,https://tiki.vn/ao-dan-day-rut-dem-ban-tay-sieu-nang-ad004-p20330285.html?spid=51696890,8,,,lylylorem
"Quần lót nữ- QUuần lót cotton nữ kháng khuẩn, thoải mái, dễ chịu Lylylorem QL212",120.000,https://tiki.vn/quan-lot-nu-quuan-lot-cotton-nu-khang-khuan-thoai-mai-de-chiu-lylylorem-ql212-p230056781.html?spid=230056786,9,,,lylylorem
,,https://tiki.vn/bo-lot-nu-canh-tien-lylylorem-bl172-p205978245.html?spid=205978277,10,,,lylylorem
Bodysuit tay dài cổ V ren 2 bên sườn LyLy JM069 thun co giãn ôm sát body,450.000₫,https://tiki.vn/bodysuit-tay-dai-co-v-ren-2-ben-suon-lyly-jm069-thun-co-gian-om-sat-body-p205979990.html?spid=205980000,11,,,lylylorem
Váy đuôi cá Lylylorem TK010,249.000,https://tiki.vn/vay-duoi-ca-lylylorem-tk010-p205978176.html?spid=205978191,12,,,lylylorem
,,https://tiki.vn/bikini-2-in-1-swimsuit-1-manh-lylylorem-bk088-bo-do-boi-nu-hoa-tiet-vintage-hoa-that-no-xinh-xan-p230056936.html?spid=230056973,13,,,lylylorem
Váy ngủ lụa 2 dây viền ren chéo ngực - VN087T,158.000₫,https://tiki.vn/vay-ngu-lua-2-day-vien-ren-cheo-nguc-vn087t-p16258565.html?spid=50820899,14,,Đã bán 50,lylylorem
Bộ lót nữ phối lụa khuy cài trước Lylylorem BL174,100.000₫,https://tiki.vn/bo-lot-nu-phoi-lua-khuy-cai-truoc-lylylorem-bl174-p174085926.html?spid=175166904,15,,Đã bán 8,lylylorem
Quần lót nguyệt san chống tràn Lylylorem QL142,390.000₫,https://tiki.vn/quan-lot-nguyet-san-chong-tran-lylylorem-ql142-p189641113.html?spid=189641117,16,,Đã bán 6,lylylorem
"Áo lót đệm mỏng áo ngực nữ không gọng dễ mặc, ôm full bầu ngực cho người ngực lớn Lylylorem AL080",700.000,https://tiki.vn/ao-lot-dem-mong-ao-nguc-nu-khong-gong-de-mac-om-full-bau-nguc-cho-nguoi-nguc-lon-lylylorem-al080-p157530335.html?spid=157530355,17,,,lylylorem
,,https://tiki.vn/ao-nguc-nu-dem-vua-cup-ngang-om-nguc-chat-lieu-cotton-mem-mai-lylylorem-al191-p188833638.html?spid=188833644,18,,,lylylorem
"Áo ngực nữ chất su mịn không gọng 3 loại mút, thông thoáng an toàn cho da Lyly Lorem AL201",690.000₫,https://tiki.vn/ao-nguc-nu-chat-su-min-khong-gong-3-loai-mut-thong-thoang-an-toan-cho-da-lyly-lorem-al201-p193723706.html?spid=193723724,19,,Đã bán 5,lylylorem
Bikini 1 mảnh khoét eo BK083 bộ đồ bơi nữ Lylylorem swimsuit thiết kế cut-out vùng eo cực quyến rũ,550.000₫,https://tiki.vn/bikini-1-manh-khoet-eo-bk083-bo-do-boi-nu-lylylorem-swimsuit-thiet-ke-cut-out-vung-eo-cuc-quyen-ru-p230056735.html?spid=230056752,20,,Đã bán 2,lylylorem
Bộ lót đệm mỏng cao cấp bộ lót ren Quyến rũ lylylorem Bl200,100.000₫,https://tiki.vn/bo-lot-dem-mong-cao-cap-bo-lot-ren-quyen-ru-lylylorem-bl200-p157564536.html?spid=175426257,21,,Đã bán 11,lylylorem
Bộ lót ren không dây đệm dày cúp ngực cao cấp Lylylorem BL045,100.000₫,https://tiki.vn/bo-lot-ren-khong-day-dem-day-cup-nguc-cao-cap-lylylorem-bl045-p157667114.html?spid=175425025,22,,,lylylorem
Set Bikini len móc quần dài siêu sang Lylylorem BK078,550.000₫,https://tiki.vn/set-bikini-len-moc-quan-dai-sieu-sang-lylylorem-bk078-p205977835.html?spid=205977839,23,,,lylylorem
Váy ngủ dáng dài Lylylorem VN215 váy ngủ phong cách Châu Âu người phụ nữ hiện đại,350.000₫,https://tiki.vn/vay-ngu-dang-dai-lylylorem-vn215-vay-ngu-phong-cach-chau-au-nguoi-phu-nu-hien-dai-p205978864.html?spid=205978870,24,,,lylylorem
"Bikini - Bộ bơi nữ liền thân, thiết kế hai mặt linh hoạt độc quyền LyLy Lorem - BK087 - Xanh dương",600.000,https://tiki.vn/bikini-bo-boi-nu-lien-than-thiet-ke-hai-mat-linh-hoat-doc-quyen-lyly-lorem-bk087-p230056801.html?spid=230056841,25,,,lylylorem
,,https://tiki.vn/bo-boi-den-dai-tay-quan-cap-cao-ca-tinh-do-boi-dep-bk09-p205979236.html?spid=205979247,26,,,lylylorem
Dây lưng trong suốt dùng cho áo lót không dây Lylylorem,11.900₫,https://tiki.vn/day-lung-trong-suot-dung-cho-ao-lot-khong-day-lylylorem-p205978669.html?spid=205978674,27,,,lylylorem
Set váy choàng Lylylorem VN018,198.000₫,https://tiki.vn/set-vay-choang-lylylorem-vn018-p205977485.html?spid=205977492,28,,,lylylorem
Quần lót lọt khe cao cấp đúc phối ren Lylylorem QL056,80.000₫,https://tiki.vn/quan-lot-lot-khe-cao-cap-duc-phoi-ren-lylylorem-ql056-p205977999.html?spid=205978006,29,,,lylylorem
Bộ lót nữ Lylylorem BL178,290.000,https://tiki.vn/bo-lot-nu-lylylorem-bl178-p205978789.html?spid=205978798,30,,,lylylorem
,,https://tiki.vn/bo-lot-ren-lylylorem-ren-mem-mut-mong-xinh-xan-bl182-p205977574.html?spid=205977641,31,,,lylylorem
Quần lót nâng mông lưng cao định hình eo Lylylorem,234.000₫,https://tiki.vn/quan-lot-nang-mong-lung-cao-dinh-hinh-eo-lylylorem-p205979380.html?spid=205979415,32,,,lylylorem
Quần lót ren nơ cạp thấp Lylylorem QL005,37.500₫,https://tiki.vn/quan-lot-ren-no-cap-thap-lylylorem-ql005-p205978774.html?spid=205978778,33,,,lylylorem
Quần lưới lọt khe Lylylorem QL006,80.000₫,https://tiki.vn/quan-luoi-lot-khe-lylylorem-ql006-p205978529.html?spid=205978538,34,,Đã bán 1,lylylorem
Quần lót ren viền sóng Lylylorem QL126,99.000₫,https://tiki.vn/quan-lot-ren-vien-song-lylylorem-ql126-p205979724.html?spid=205979731,35,,,lylylorem
,,https://tiki.vn/bikini-1-manh-bo-do-boi-nu-bk090-lylylorem-that-no-xinh-xan-p230056673.html?spid=230056701,36,,,lylylorem
Bộ lót ngôi sao đệm dày siêu nâng mút dày phối ren cao cấp Lylylorem BL054,100.000₫,https://tiki.vn/bo-lot-ngoi-sao-dem-day-sieu-nang-mut-day-phoi-ren-cao-cap-lylylorem-bl054-p157585967.html?spid=175425846,37,,,lylylorem
Quần lót nữ thun mềm cạp thấp viền ren nhỏ nhắn Lylylorem QL113 freesize dưới 57kg,40.000₫,https://tiki.vn/quan-lot-nu-thun-mem-cap-thap-vien-ren-nho-nhan-lylylorem-ql113-freesize-duoi-57kg-p156234320.html?spid=156234326,38,,Đã bán 8,lylylorem
Áo lót nữ không dây Lylylorem,199.000₫,https://tiki.vn/ao-lot-nu-khong-day-lylylorem-p205977469.html?spid=205977503,39,,,lylylorem
Áo Bra Quây 2 Dây len gân Lylylorem BR039,300.000,https://tiki.vn/ao-bra-quay-2-day-len-gan-lylylorem-br039-p192462649.html?spid=192462655,40,,,lylylorem
