title,price,link_item,index,discount,sales,category
"Quần bò / Quần jean trẻ em cho bé trai dày dặn, chất cotton mềm mát, hàng QC mẫu mới",140.000₫,https://tiki.vn/quan-bo-quan-jean-tre-em-cho-be-trai-day-dan-chat-cotton-mem-mat-hang-qc-mau-moi-2021-p113246427.html?spid=113248160,1,-12%,Đã bán 11,thoitrangmevabe
Mũ len cho bé trùm kín mặt cổ tai trán lót nỉ ấm mềm min bé trai bé gái- mu len cho be,59.000₫,https://tiki.vn/mu-len-cho-be-trum-kin-mat-co-tai-tran-lot-ni-am-mem-min-be-trai-be-gai-mu-len-cho-be-p83617467.html?spid=83617496,2,-23%,Đã bán 2,thoitrangmevabe
"Quần áo bé trai, đồ bộ in 3D thấm hút mồ hôi tốt, co giãn 4 chiều mềm mại, in hoạt hình cực hót, set, thời trang, bộ đồ, đồ cho trẻ em, bé trai từ 8-28kg",66.000₫,https://tiki.vn/quan-ao-be-trai-do-bo-in-3d-tham-hut-mo-hoi-tot-co-gian-4-chieu-mem-mai-in-hoat-hinh-cuc-hot-set-thoi-trang-bo-do-do-cho-tre-em-be-trai-tu-8-28kg-p173751815.html?spid=173751857,3,-5%,Đã bán 674,thoitrangmevabe
Sandal Biti's bé gái BRG000300HOG Siêu Bền,303.000₫,https://tiki.vn/sandal-biti-s-be-gai-brg000300hog-sieu-ben-p270964663.html?spid=270964679,4,-12%,Đã bán 2,thoitrangmevabe
Quần legging bầu QA5139,99.000₫,https://tiki.vn/quan-legging-bau-qa5139-p14417764.html?spid=48128244,5,-13%,Đã bán 84,thoitrangmevabe
Đồ bộ ba lỗ 3D Hình Doremon Xanh Nhạt cho bé trai 10-40kg,170.000₫,https://tiki.vn/do-bo-ba-lo-3d-hinh-doremon-xanh-nhat-cho-be-trai-10-40kg-p51307422.html?spid=51307432,6,-15%,Đã bán 15,thoitrangmevabe
"Áo khoác gió bé trai 2-7 tuổi 2 lớp in hình ngộ nghĩnh, Áo gió cho bé xuất Hàn bên trong lót cotton hàng Quảng Châu",199.000₫,https://tiki.vn/ao-khoac-gio-be-trai-3-8-tuoi-2-lop-in-hinh-ngo-nghinh-ao-gio-cho-be-xuat-han-ben-trong-lot-cotton-hang-quang-chau-p198276722.html?spid=198277076,7,-28%,Đã bán 5,thoitrangmevabe
"Vớ Trắng Cho Bé Đi Múa, Tất mang giày thể thao",23.750₫,https://tiki.vn/vo-trang-cho-be-di-mua-tat-mang-giay-the-thao-p205988060.html?spid=205988062,8,-47%,Đã bán 19,thoitrangmevabe
Bộ Quần Áo Nỉ Cho Bé Dài Tay Mùa Thu Đông Chất Vải Nỉ Da Cá In Hình Cún Bam Bam Siêu Dễ Thương Cho Bé Từ 6-28kg,195.000₫,https://tiki.vn/bo-quan-ao-ni-cho-be-dai-tay-mua-thu-dong-chat-vai-ni-da-ca-in-hinh-cun-bam-bam-sieu-de-thuong-cho-be-tu-6-28kg-p145678842.html?spid=145679454,9,-40%,Đã bán 7,thoitrangmevabe
Sandal Eva Phun Bé Gái Biti's BEG001700 Siêu Nhẹ,299.000₫,https://tiki.vn/sandal-eva-phun-be-gai-biti-s-beg001700-sieu-nhe-p273233845.html?spid=273233855,10,-12%,Đã bán 2,thoitrangmevabe
"Quần Chíp Bé Gái,Quần Lót Bé Gái Set hộp 5 Chiếc Kháng Khuẩn 100% Cotton hàng Xuất",169.000₫,https://tiki.vn/quan-chip-be-gai-quan-lot-be-gai-set-hop-5-chiec-khang-khuan-100-cotton-hang-xuat-p100835953.html?spid=100835968,11,,Đã bán 10,thoitrangmevabe
Quần thun dài bo gấu 4LOVA cho bé trai nhiều màu sắc,69.000₫,https://tiki.vn/quan-thun-dai-bo-gau-4lova-cho-be-trai-nhieu-mau-sac-p198344276.html?spid=198344932,12,,Đã bán 4,thoitrangmevabe
"Bộ Minky Mom Cộc Tay, Ngắn Tay. Bộ Mimky Mom siêu mềm mịn mát cho bé trai bé gái, Size Từ 80-150(8-32KG)",60.000₫,https://tiki.vn/bo-minky-mom-coc-tay-ngan-tay-bo-mimky-mom-sieu-mem-min-mat-cho-be-trai-be-gai-size-tu-80-150-8-32kg-p137733495.html?spid=137733571,13,,Đã bán 28,thoitrangmevabe
"Mũ len cho bé, Nón len tai mèo ngộ nghĩnh cho bé trai bé gái",23.000₫,https://tiki.vn/mu-len-cho-be-non-len-tai-meo-ngo-nghinh-cho-be-trai-be-gai-p73936053.html?spid=73936060,14,,Đã bán 28,thoitrangmevabe
Mặt Nạ Hóa Trang Cáo Hồ Ly Anime Nhật Bản Siêu Hot,35.000₫,https://tiki.vn/mat-na-hoa-trang-cao-ho-ly-anime-nhat-ban-sieu-hot-p116379976.html?spid=116380023,15,,Đã bán 50,thoitrangmevabe
Quần lót bé gái cotton Mỹ kháng khuẩn quần chíp dáng boxer đùi ONOFF 11UN23A002,69.000₫,https://tiki.vn/quan-lot-be-gai-onoff-in-7-ngay-mem-mai-thoang-mat-11un22a002-p203922592.html?spid=203922651,16,,Đã bán 12,thoitrangmevabe
"Áo gile len xinh bé gái, mẫu thêu cài cúc dễ thương, chất len mềm mại dễ chịu khi mặc, sợi len đanh chắc bền đẹp | MA30",160.000₫,https://tiki.vn/ao-gile-len-xinh-be-gai-mau-theu-cai-cuc-de-thuong-chat-len-mem-mai-de-chiu-khi-mac-soi-len-danh-chac-ben-dep-ma30-p204416448.html?spid=204416454,17,,Đã bán 2,thoitrangmevabe
Áo thun bé gái 8 đến 32 kg croptop in Minnee tay ngắn cổ tròn form lớn cho bé 6 tháng đến 8 tuổi 04939-04928,62.000₫,https://tiki.vn/ao-thun-croptop-in-minnee-tay-ngan-co-tron-form-lon-cho-be-0-5-13-tuoi-tu-10-den-38-kg-04939-04928-p50318002.html?spid=50318118,18,,Đã bán 25,thoitrangmevabe
Nón lưỡi trai Khủng Long cho bé trai 2-7t. Phụ kiện cho bé trai,75.000₫,https://tiki.vn/non-luoi-trai-khung-long-cho-be-trai-2-7t-phu-kien-cho-be-trai-p88088106.html?spid=88088114,19,,Đã bán 120,thoitrangmevabe
Vớ cao dưới gối kiểu công chúa xinh xắn dành cho bé gái 35CM 42CM - 2,29.000₫,https://tiki.vn/vo-cao-duoi-goi-kieu-cong-chua-xinh-xan-danh-cho-be-gai-35cm-42cm-p178770979.html?spid=178771019,20,,Đã bán 19,thoitrangmevabe
Váy bé gái tay cánh tiên in Bướm 14-38 kg MEEJENA - 100% COTTON 4C - 1934,129.000₫,https://tiki.vn/vay-be-gai-tay-canh-tien-in-buom-14-38-kg-meejena-100-cotton-4c-1934-p198779148.html?spid=198779195,21,,Đã bán 9,thoitrangmevabe
"BỘ ĐỒ THUN BÉ TRAI CATRIO in XE ĐẠP là bộ phông trẻ em gồm QUẦN ĐÙI + ÁO SÁT NÁCH, vải 100% cotton, phù hợp với các bé trai từ 13 tuổi(50kg) đến 18 tuổi(60kg) mặc ở nhà, đi chơi rất thoáng mát",143.200₫,https://tiki.vn/bo-phong-be-trai-catrio-la-bo-do-quan-dui-va-ao-sat-nach-cotton-tre-em-tu-13t-18t-60kg-in-xe-dap-p173784094.html?spid=173784118,22,,Đã bán 7,thoitrangmevabe
"Bộ liền thân tam giác, bodychip ngắn tay họa tiết cho bé sơ sinh Boube, vải Cotton organic thoáng mát - Size 0-9M",111.000₫,https://tiki.vn/bo-lien-than-tam-giac-bodychip-ngan-tay-hoa-tiet-cho-be-so-sinh-boube-vai-cotton-organic-thoang-mat-size-0-9m-p273158439.html?spid=273158445,23,,Đã bán 3,thoitrangmevabe
Áo khoác có nón bé gái họa tiết Gấu Nâu thun tổ ong. - AICDBGPRFZRM - AIN Closet,165.000₫,https://tiki.vn/ao-khoac-co-non-be-gai-hoa-tiet-gau-nau-thun-to-ong-aicdbgprfzrm-ain-closet-p263333648.html?spid=263333660,24,,Đã bán 5,thoitrangmevabe
"Áo phông bé trai ngắn tay Easy Baby , áo thun chất cotton cực mềm, thoáng khí cho bé từ 10-20kg (ST-1208B)",79.000₫,https://tiki.vn/ao-phong-be-trai-ngan-tay-easy-baby-ao-thun-chat-cotton-cuc-mem-thoang-khi-cho-be-tu-10-20kg-st-1208b-p197536085.html?spid=197536125,25,,Đã bán 6,thoitrangmevabe
Áo thun bé gái 8- 32 kg croptop in báo đốm tay ngắn cho bé gái 1 đến 8 tuổi 04372-04360,62.000₫,https://tiki.vn/ao-thun-croptop-10-den-38-kg-in-bao-dom-tay-ngan-cho-be-gai-1-13-tuoi-04372-04360-p49635714.html?spid=49635716,26,,Đã bán 18,thoitrangmevabe
Quần nỉ bo gấu cho bé trai 2-10 tuổi,122.500₫,https://tiki.vn/quan-ni-bo-gau-cho-be-trai-2-10-tuoi-p139467914.html?spid=139467950,27,,Đã bán 8,thoitrangmevabe
"Áo vắt sữa, áo rảnh tay, áo bầu và cho con bú",115.000₫,https://tiki.vn/ao-vat-sua-ao-ranh-tay-ao-bau-va-cho-con-bu-p69990738.html?spid=73192533,28,,Đã bán 13,thoitrangmevabe
"Set bàn chải, rơ lưỡi silicon siêu mềm cho bé 0-18 tháng (hàng chuẩn hình thỏ, cà rốt)",62.000₫,https://tiki.vn/set-ban-chai-ro-luoi-silicon-sieu-mem-cho-be-0-18-thang-hang-chuan-hinh-tho-ca-rot-p176618426.html?spid=208127714,29,,Đã bán 18,thoitrangmevabe
Đồ bộ cộc tay Raglan Lullaby cho bé gái NH603P [Thời Trang trẻ em cao cấp - chính hãng Lullaby Store,175.500₫,https://tiki.vn/do-bo-coc-tay-raglan-lullaby-cho-be-gai-nh603p-thoi-trang-tre-em-cao-cap-chinh-hang-lullaby-store-p96131370.html?spid=96131557,30,,Đã bán 68,thoitrangmevabe
"Đồ bộ bé trai từ 6-18kg chất nỉ da cá, Bộ thu đông dài tay cho bé trai in hình chú gấu cực yêu Moon House",119.000₫,https://tiki.vn/do-bo-be-trai-tu-6-18kg-chat-ni-da-ca-bo-thu-dong-dai-tay-cho-be-trai-in-hinh-chu-gau-cuc-yeu-moon-house-p240466645.html?spid=240466655,31,,Đã bán 3,thoitrangmevabe
"Nón cho bé gái pony đáng yêu, hàng cao cấp, chất đẹp thoáng mát vô cùng",141.900₫,https://tiki.vn/non-cho-be-gai-pony-dang-yeu-hang-cao-cap-chat-dep-thoang-mat-vo-cung-p95749043.html?spid=95749048,32,,Đã bán 6,thoitrangmevabe
Cánh bướm thiên thần CÓ ĐÈN kèm Gậy và vương miện cho bé gái,33.000₫,https://tiki.vn/canh-buom-thien-than-co-den-kem-gay-va-vuong-mien-cho-be-gai-do-choi-smart-baby-p171666472.html?spid=171666504,33,,Đã bán 81,thoitrangmevabe
"Váy Ngủ Nữ 2 Dây Chất thun Sữa mặc mùa hè cực mát, bầu bí bon chen V284",83.000₫,https://tiki.vn/vay-ngu-nu-2-day-chat-thun-sua-mac-mua-he-cuc-mat-bau-bi-bon-chen-v284-p148641518.html?spid=148641608,34,,Đã bán 15,thoitrangmevabe
Quần jean cho bé gái từ 3 đến 7 tuổi tương đương 13 đến 28kg,160.000₫,https://tiki.vn/quan-jean-cho-be-gai-tu-3-den-7-tuoi-tuong-duong-13-den-28kg-p123544500.html?spid=123544504,35,,Đã bán 23,thoitrangmevabe
Bộ áo thun cotton mặc nhà bé trai tay ngắn hình in iBasic HOMB007T và quần HOMB007B,215.000₫,https://tiki.vn/bo-ao-thun-cotton-mac-nha-be-trai-tay-ngan-hinh-in-ibasic-homb007t-va-quan-homb007b-p213861641.html?spid=213861653,36,,Đã bán 3,thoitrangmevabe
Dép Eva Phun Disney Bé Trai Biti's BEB000997DOO,166.000₫,https://tiki.vn/dep-eva-phun-disney-be-trai-biti-s-beb000997doo-p271960694.html?spid=271960714,37,,Đã bán 3,thoitrangmevabe
"Áo len bé trai phối kẻ 8-16 tuổi, Áo len cho bé size đại hàng Quảng Châu đanh sợi không bai xù",219.000₫,https://tiki.vn/ao-len-be-trai-phoi-ke-8-16-tuoi-ao-len-cho-be-size-dai-hang-quang-chau-danh-soi-khong-bai-xu-p138067326.html?spid=200723622,38,,Đã bán 3,thoitrangmevabe
Quần tất len giả bốt cho bé gái phong cách Hàn Quốc cho bé từ 3 - 12 tuôi,125.000₫,https://tiki.vn/quan-tat-len-gia-bot-cho-be-gai-phong-cach-han-quoc-cho-be-tu-3-12-tuoi-p74905234.html?spid=74905238,39,,Đã bán 8,thoitrangmevabe
Mũ cho bé (3 tuổi - 6 tuổi) nón bé trai HIPHOP SNAPBACK Chữ BOY dễ thương Cute (Ảnh thật),40.321₫,https://tiki.vn/mu-cho-be-3-tuoi-6-tuoi-non-be-trai-hiphop-snapback-chu-boy-de-thuong-cute-anh-that-p273392917.html?spid=273392923,40,,Đã bán 2,thoitrangmevabe
