title,price,link_item,index,discount,sales,category
(VẢI XUẤT DƯ XỊN) SET 3 QUẦN LEGGING DÀI/QUẦN DÀI HOẠ TIẾT THUN COTTON 4 CHIỀU CHO BÉ GÁI 9-41KG,115.000₫,https://tiki.vn/set-3-quan-legging-cotton-4-chieu-cho-be-gai-10-41kg-p130361694.html?spid=130361736,1,-41%,Đã bán 54,thoitrangmevabe
Dây thun buộc tóc cho bé - dây chun buộc tóc cho bé gái- dây thun cột tóc cho bé- đúng như mô tả,39.000₫,https://tiki.vn/day-thun-buoc-toc-cho-be-day-chun-buoc-toc-cho-be-gai-day-thun-cot-toc-cho-be-dung-nhu-mo-ta-p94155393.html?spid=94155440,2,-7%,Đã bán 14,thoitrangmevabe
Giày lười trẻ em Crocs Classic - 206991-2Y2,895.000₫,https://tiki.vn/giay-luoi-tre-em-crocs-classic-206991-2y2-p249155292.html?spid=249155304,3,-45%,Đã bán 1,thoitrangmevabe
Áo cờ đỏ sao vàng trẻ em sao đặc hàng shop chất liệu cotton Ocean Uniform,35.000₫,https://tiki.vn/ao-co-do-sao-vang-tre-em-sao-dac-hang-shop-chat-lieu-cotton-ocean-uniform-p125355180.html?spid=125355190,4,-15%,Đã bán 6,thoitrangmevabe
Sét 10 đôi Tất vớ cho trẻ em 4 tuổi đến 12 tuổi,160.000₫,https://tiki.vn/set-10-doi-tat-vo-cho-tre-em-4-tuoi-den-12-tuoi-p49124374.html?spid=71015374,5,-28%,Đã bán 5,thoitrangmevabe
Xăng đan bé trai 1 2 3 4 5 tuổi quai ngang nhựa dẻo cao cấp êm nhẹ chống trơn trượt màu xanh cam quai dán tiện dụng phù hợp trẻ em nam đi học đi biển phong cách Hàn Quốc ST76,90.000₫,https://tiki.vn/xang-dan-be-trai-1-2-3-4-5-tuoi-quai-ngang-nhua-deo-cao-cap-em-nhe-chong-tron-truot-mau-xanh-cam-quai-dan-tien-dung-phu-hop-tre-em-nam-di-hoc-di-bien-phong-cach-han-quoc-st76-p176802410.html?spid=176802428,6,-46%,Đã bán 7,thoitrangmevabe
ĐẦM BẦU VÁY BẦU CÔNG SỞ VOAN 2 MÀU (sau sanh có dây kéo cho bé bú ),320.000₫,https://tiki.vn/dam-bau-vay-bau-cong-so-voan-2-mau-sau-sanh-co-day-keo-cho-be-bu-p150787070.html?spid=150787128,7,,Đã bán 3,thoitrangmevabe
Sandal cho bé gái - giày đi học cho bé gái ( Mẫu mới nhất in hình công chúa ) TTV59,189.000₫,https://tiki.vn/sandal-cho-be-gai-giay-di-hoc-cho-be-gai-mau-moi-nhat-in-hinh-cong-chua-ttv59-p95501568.html?spid=95501575,8,,Đã bán 19,thoitrangmevabe
DÉP QUAI NGANG BÉ GÁI Bita's DENGI.60 (Cam + Hồng + Hồng sen) gấu và thỏ,130.000₫,https://tiki.vn/dep-quai-ngang-be-gai-bita-s-dengi-60-cam-hong-hong-sen-gau-va-tho-p203697201.html?spid=203697203,9,,,thoitrangmevabe
Sandal Bitis bé trai,295.000₫,https://tiki.vn/sandal-bitis-be-trai-p192713998.html?spid=192714040,10,,Đã bán 3,thoitrangmevabe
"Chân váy cho bé gái Bigfox Miss Meow size đại, chân váy 2 lớp cotton dày dặn size trẻ em 3,4,5..,10,11 tuổi",149.000₫,https://tiki.vn/chan-vay-cho-be-gai-bigfox-miss-meow-size-dai-chan-vay-2-lop-cotton-day-dan-size-tre-em-3-4-5-10-11-tuoi-p196548625.html?spid=196548627,11,,Đã bán 2,thoitrangmevabe
Sandal Thể Thao Bé Trai Biti's,330.000₫,https://tiki.vn/sandal-the-thao-be-trai-biti-s-p273364581.html?spid=273364601,12,,,thoitrangmevabe
Đồ chơi Gấu Bông minecraft chính hãng Mojang,79.000₫,https://tiki.vn/do-choi-gau-bong-minecraft-chinh-hang-mojang-p160277501.html?spid=160277555,13,,Đã bán 22,thoitrangmevabe
Sandal bé gái Bita's SOB.262 (Trắng + Cam),240.000₫,https://tiki.vn/sandal-be-gai-bita-s-sob-262-trang-cam-p140467216.html?spid=140467390,14,,Đã bán 7,thoitrangmevabe
"Quần legging (555) Bà bầu đơn giản, thoải mái, dễ phối đồ",84.420₫,https://tiki.vn/quan-legging-555-ba-bau-don-gian-thoai-mai-de-phoi-do-p146573504.html?spid=146573529,15,,Đã bán 13,thoitrangmevabe
ÁO SƠ MI DÀI TAY BÉ GÁI,145.000₫,https://tiki.vn/ao-so-mi-dai-tay-be-gai-p199028711.html?spid=199028741,16,,Đã bán 1,thoitrangmevabe
Sandal đế bằng bé gái Bita's SOB.283 (Xanh ngọc + Đen + Hồng sen),285.000₫,https://tiki.vn/sandal-de-bang-be-gai-bita-s-sob-283-xanh-ngoc-den-hong-sen-p262405549.html?spid=262405559,17,,,thoitrangmevabe
"Cha và con trai, mã G71. Áo thun hàng hiệu Goking, form unisex cho nam nữ, trẻ em, bé trai gái. Áo phông in đẹp, quà tặng cao cấp cho gia đình, cặp đôi, doanh nghiệp, hội nhóm",69.000₫,https://tiki.vn/cha-va-con-trai-ma-g71-ao-thun-tre-em-in-sieu-dep-cho-be-trai-be-gai-ao-phong-thoat-nhiet-goking-hang-hieu-cao-cap-p170808444.html?spid=248494149,18,,Đã bán 8,thoitrangmevabe
Quần legging bé gái (21-40kg) quần dài thun cotton siêu dày dặn co giãn loại 1,61.000₫,https://tiki.vn/quan-legging-be-gai-phoi-ren-22-40kg-cotton-sieu-day-dan-co-gian-loai-1-p103519794.html?spid=103521800,19,,Đã bán 37,thoitrangmevabe
ĐẦM BẦU VÁY BẦU CÔNG SỞ THÊU PHONG CÁCH DÂN TỘC,350.000₫,https://tiki.vn/dam-bau-vay-bau-cong-so-theu-phong-cach-dan-toc-p150787359.html?spid=150787376,20,,Đã bán 2,thoitrangmevabe
Áo thun dài tay xuất Nhật cao cấp cho bé,99.000₫,https://tiki.vn/ao-thun-dai-tay-xuat-nhat-cao-cap-cho-be-p33115563.html?spid=33115568,21,,Đã bán 6,thoitrangmevabe
"Giày đi học bé gái - Giày thể thao bé gái, mẫu mới nhất TTV49",175.000₫,https://tiki.vn/giay-di-hoc-be-gai-giay-the-thao-be-gai-mau-moi-nhat-ttv49-p82941093.html?spid=82941095,22,,Đã bán 77,thoitrangmevabe
Combo 2 nón sơ sinh cotton cho bé,35.000₫,https://tiki.vn/combo-2-non-so-sinh-cotton-cho-be-p38330269.html?spid=38330274,23,,Đã bán 66,thoitrangmevabe
"Đầm bé gái,váy trẻ em, hồng phối zen xinh xắn size 1 đến 8 tuổi",100.000₫,https://tiki.vn/dam-be-gai-vay-tre-em-hong-phoi-zen-xinh-xan-size-0-den-6-tuoi-p190506378.html?spid=190506384,24,,Đã bán 6,thoitrangmevabe
"Mũ tai bèo vải Cotton mềm mỏng thoáng khí, nón chống nắng thời trang cho bé trai, bé gái 1-10 tuổi",65.000₫,https://tiki.vn/mu-tai-beo-vai-cotton-mem-mong-thoang-khi-non-chong-nang-thoi-trang-cho-be-trai-be-gai-1-10-tuoi-p245912159.html?spid=245912208,25,,Đã bán 7,thoitrangmevabe
Giày thể thao Biti's Hunter bé trai (Size 30-34),618.450₫,https://tiki.vn/giay-the-thao-biti-s-hunter-be-trai-size-30-34-p205813838.html?spid=205813848,26,,Đã bán 1,thoitrangmevabe
"Giày chống trượt tập đi cho bé trai, bé gái nhiề size",32.000₫,https://tiki.vn/giay-chong-truot-tap-di-cho-be-trai-be-gai-nhie-size-p89210926.html?spid=89210980,27,,Đã bán 61,thoitrangmevabe
Quần legging dài bé gái cotton xuất dư mềm mịn co giãn 9-20kg,44.000₫,https://tiki.vn/quan-legging-dai-be-gai-cotton-xuat-du-mem-min-co-gian-9-20kg-p103520318.html?spid=103520632,28,,Đã bán 5,thoitrangmevabe
Đầm voan công chúa cho bé gái màu hồng xanh dự tiệc múa hóa trang đẹp size 12-35kg hàng Quảng Châu cao cấp kèm cài tóc,363.000₫,https://tiki.vn/dam-voan-cong-chua-cho-be-gai-mau-hong-xanh-du-tiec-mua-hoa-trang-dep-size-12-35kg-hang-quang-chau-cao-cap-kem-cai-toc-p271423359.html?spid=271423393,29,,,thoitrangmevabe
Túi vải canvas Mr Vui T001 cho bé gái đi học thêm ( kích thước 32 x 29 x 10 cm),126.650₫,https://tiki.vn/tui-vai-canvas-mr-vui-t001-cho-be-gai-di-hoc-them-kich-thuoc-32-x-29-x-10-cm-p263502559.html?spid=263502563,30,,Đã bán 1,thoitrangmevabe
"pizama - đồ bộ cho bé - ngẫu nhiên (bé gái),L (9-12kg)",135.000₫,https://tiki.vn/pizama-do-bo-cho-be-p126592344.html?spid=126592695,31,,Đã bán 1,thoitrangmevabe
Dép lê quai ngang hình công chúa cho bé gái chất cao su mềm êm chân,110.000₫,https://tiki.vn/dep-le-quai-ngang-hinh-cong-chua-cho-be-gai-chat-cao-su-mem-em-chan-p272565013.html?spid=272565021,32,,,thoitrangmevabe
Bộ Áo Và Mũ Bác Sĩ Cho Bé Yêu Tập Làm Bác Sĩ 1-12 tuổi (Loại 1 chất dày mềm đẹp),90.000₫,https://tiki.vn/bo-ao-va-mu-bac-si-cho-be-yeu-tap-lam-bac-si-1-12-tuoi-loai-1-chat-day-mem-dep-p181785713.html?spid=181785770,33,,Đã bán 2,thoitrangmevabe
Áo dài bé gái cách tân 4LOVA hoạ tiết rực rỡ từ 1-10 tuổi,259.000₫,https://tiki.vn/ao-dai-be-gai-cach-tan-4lova-hoa-tiet-ruc-ro-tu-1-10-tuoi-p198343109.html?spid=198343523,34,,Đã bán 1,thoitrangmevabe
"Đầm bé gái,váy trẻ em 2 dây siêu xinh cho bé , size 1 đến 8 tuổi",110.000₫,https://tiki.vn/dam-be-gai-vay-tre-em-2-day-sieu-xinh-cho-be-size-1-den-8-tuoi-p262977506.html?spid=262977508,35,,Đã bán 3,thoitrangmevabe
Váy yếm bé gái họa tiết Hoa Cúc xanh denim - AICDBGQZZWH6 - AIN Closet,155.000₫,https://tiki.vn/vay-yem-be-gai-hoa-tiet-hoa-cuc-xanh-denim-aicdbgqzzwh6-ain-closet-p200979314.html?spid=200979318,36,,Đã bán 7,thoitrangmevabe
"Set mũ, bao tay, bao chân cao cấp cho bé sơ sinh từ 0 - 6 tháng tuổi",37.000₫,https://tiki.vn/set-mu-bao-tay-bao-chan-cao-cap-cho-be-so-sinh-tu-0-6-thang-tuoi-p134974994.html?spid=134975007,37,,Đã bán 26,thoitrangmevabe
Dép bé gái/ bé trai kiểu dáng Hàn Quốc chống trơn trượt _ Color,144.000₫,https://tiki.vn/dep-be-gai-be-trai-kieu-dang-han-quoc-chong-tron-truot-_-color-p80120244.html?spid=80120252,38,,Đã bán 4,thoitrangmevabe
Chân váy xếp ly cho bé gái phối đồ hiphop năng động size 14-50kg mẫu mới (kèm chip),183.600₫,https://tiki.vn/chan-vay-xep-ly-cho-be-gai-phoi-do-hiphop-nang-dong-size-14-50kg-mau-moi-kem-chip-p263790253.html?spid=263790507,39,,,thoitrangmevabe
"Balo cho bé Mẫu giáo, Tiểu học UEK - Siêu nhẹ, chống thấm nước",339.000₫,https://tiki.vn/balo-di-hoc-uek-sieu-nhe-chong-tham-nuoc-su-tu-lai-dia-bay-p59081550.html?spid=252724974,40,,Đã bán 5,thoitrangmevabe
