title,price,link_item,index,discount,sales,brand
Áo Khoác hoodie áo khoác nam nữ zip hoodie In Toàn Thân Nỉ Thun In Họa Tiết Chữ MERSESK Thanh lịch trendy Popular Thông thường Form rộng Couple Có Dây Kéo Nón 2 Lớp Kiểu Rộng Unisex Thu Đông,140.000₫,https://tiki.vn/ao-khoac-hoodie-ao-khoac-nam-nu-zip-hoodie-in-toan-than-ni-thun-in-hoa-tiet-chu-mersesk-thanh-lich-trendy-popular-thong-thuong-form-rong-couple-co-day-keo-non-2-lop-kieu-rong-unisex-thu-dong-p273270877.html?spid=273270889,1,,Đã bán 1,Jinrinteen
"Áo Khoác Dù Chống Nắng 123SHOP Cho Nam Nữ Đôi Có 3 Màu, Ulzzang Unisex in hình PIKa Form Rộng Jacket",99.000₫,https://tiki.vn/ao-khoac-du-chong-nang-123shop-cho-nam-nu-doi-co-3-mau-ulzzang-unisex-in-hinh-pika-form-rong-jacket-p84471364.html?spid=84471382,2,,Đã bán 1,Jinrinteen
"Áo hoodie 3 lon nước happy dập nổi, Áo nỉ hoodie tay phồng 3 ly nước happy chất nỉ mềm nhẹ, không bai xù, form dáng rộng hàn quốc, size dưới 68kg",99.000₫,https://tiki.vn/ao-hoodie-3-lon-nuoc-happy-dap-noi-ao-ni-hoodie-tay-phong-3-ly-nuoc-happy-chat-ni-mem-nhe-khong-bai-xu-form-dang-rong-han-quoc-size-duoi-68kg-p84558858.html?spid=84558864,3,,,Jinrinteen
"Áo khoác dù 2 lớp cá tính, Áo khoác dù Bomber in chữ phối màu Unisex nam nữ,Áo khoác dù Bomber IN chữ 2 lớp Unisex nhiều màu, Áo Khoác Dù Bomber Nam Nữ in Chữ Đẹp, Dù 2 Lớp Dày Dặn",99.000₫,https://tiki.vn/ao-khoac-du-2-lop-ca-tinh-ao-khoac-du-bomber-in-chu-phoi-mau-unisex-nam-nu-ao-khoac-du-bomber-in-chu-2-lop-unisex-nhieu-mau-ao-khoac-du-bomber-nam-nu-in-chu-dep-du-2-lop-day-dan-p88020868.html?spid=88020878,4,,,Jinrinteen
,,https://tiki.vn/ao-khoac-du-bomber-the-thao-in-chu-g-ao-khoac-du-kieu-bomber-logo-chu-g-phong-cach-ao-bomber-chu-g-unisex-nam-nu-ao-bomber-nu-chu-g-tu-6-ao-khoac-gio-bomber-phoi-tay-gia-da-g-nam-nu-hang-dep-p100821601.html?spid=100821603,5,,,Jinrinteen
"Áo Khoác Phối sọc trắng Vintage,Áo khoác gió nam nữ 2 lớp, Áo khoác dù cặp cổ trụ thể thao mẫu mới siu hot, Áo khoác unisex cổ đứng vải dù phối 2 màu độc lạ họa tiết chữ đi mưa,cản gió,chống nắng, Áo Khoác bomber Ulzzang Form Rộng TRƠN Jacket",99.000₫,https://tiki.vn/ao-khoac-phoi-soc-trang-vintage-ao-khoac-gio-nam-nu-2-lop-ao-khoac-du-cap-co-tru-the-thao-mau-moi-siu-hot-ao-khoac-unisex-co-dung-vai-du-phoi-2-mau-doc-la-hoa-tiet-chu-di-mua-can-gio-chong-nang-ao-khoac-bomber-ulzzang-form-rong-tron-jacket-p217520058.html?spid=217520062,6,,Đã bán 1,Jinrinteen
"Đồ bộ 3 Màu tanktop chữ NGCESTT gồm áo tanktop, quần đùi, áo ba lỗ, Cực đẹp,vải cotton mềm mịn thoáng mát",95.000₫,https://tiki.vn/set-bo-3-mau-tanktop-chu-ngcestt-gom-ao-tanktop-quan-dui-ao-ba-lo-cuc-dep-vai-cotton-mem-min-thoang-mat-p171824387.html?spid=171824463,7,,Đã bán 5,Jinrinteen
"Áo Khoác Hoodie Nỉ Trơn Có Mũ Nhiều Màu Unisex Nam Nữ Form Rộng Ulzzang, Áo Khoác Nỉ Hoodie Trơn Unisex - Thun Dài Tay Form Rộng Dáng Suông Có Mũ và Khóa Nam Nữ Cực HOT, khoác hoodie trơn nón nữ form rộng",103.000₫,https://tiki.vn/ao-khoac-hoodie-ni-tron-co-mu-nhieu-mau-unisex-nam-nu-form-rong-ulzzang-kn05-p138503820.html?spid=138503826,8,,Đã bán 1,Jinrinteen
"Áo Hoodie Zip in hình Big C form rộng unisex brand Calem Club chất nỉ lót bông, áo khoác hoodie cặp đôi",135.000,https://tiki.vn/ao-hoodie-zip-in-hinh-big-c-form-rong-unisex-brand-calem-club-chat-ni-lot-bong-ao-khoac-hoodie-cap-doi-p272060384.html?spid=272060392,9,,,Jinrinteen
,,https://tiki.vn/ao-hoodie-chong-nang-cho-nam-cho-nu-co-mu-chat-khoac-ni-unisex-co-3-mau-form-rong-ulzzang-p84472323.html?spid=84472333,10,,,Jinrinteen
Áo Khoác Nỉ Cadigan SWEETIE 3 Màu,106.000₫,https://tiki.vn/ao-khoac-ni-cadigan-sweetie-3-mau-p82895920.html?spid=82895924,11,,,Jinrinteen
"Áo Sweater Nữ Nỉ Form Rộng Nam Unisex SKY Ulzzang, Áo Sweater Tay Dài Nam Nữ Ulzzang Unisex Form Rộng Vải Nỉ in, ÁO SWEATER FORM RỘNG UNISEX ULZZANG - ÁO CẶP NỈ THU ĐÔNG CHO NAM NỮ",103.000,https://tiki.vn/ao-sweater-nu-ni-form-rong-nam-unisex-sky-ulzzang-p138503818.html?spid=138503819,12,,,Jinrinteen
,,https://tiki.vn/ao-khoac-ni-tron-oversize-phong-cach-ulzzang-ao-hoodie-ni-mu-to-form-rong-a-o-khoa-c-hoodie-ni-da-y-ke-o-form-ro-ng-unisex-dau-quan-han-quoc-ao-khoac-chong-nang-ao-khoac-mua-thu-dong-p132992708.html?spid=132992709,13,,,Jinrinteen
"Áo bomber nam nữ phối tay unisex in họa tiết MASKA form rộng 2 màu trẻ trung cá tính, Áo khoác nữ tay bồng kiểu cúc bấm trẻ trung cá tính, Áo khoác bomber khóa kéo phối tay MASKA dáng rộng phong cách Nano Ulzzang",99.000₫,https://tiki.vn/ao-bomber-nam-nu-phoi-tay-unisex-in-hoa-tiet-maska-form-rong-2-mau-tre-trung-ca-tinh-ao-khoac-nu-tay-bong-kieu-cuc-bam-tre-trung-ca-tinh-ao-khoac-bomber-khoa-keo-phoi-tay-maska-dang-rong-phong-cach-nano-ulzzang-p132988868.html?spid=132988880,14,,,Jinrinteen
"Áo Sweater Nelly Phong Cách Unisex Hình Gấu, Áo sweater Nelly nỉ phối gấu bông Cá Tính áo nỉ không mũ, Áo khoác hoodie nam nữ gấu from rộng dấu quần quảng châu phong cách hàn quốc",99.000₫,https://tiki.vn/ao-sweater-nelly-phong-cach-unisex-hinh-gau-ao-sweater-nelly-ni-phoi-gau-bong-ca-tinh-ao-ni-khong-mu-ao-khoac-hoodie-nam-nu-gau-from-rong-dau-quan-quang-chau-phong-cach-han-quoc-p133940867.html?spid=133940868,15,,Đã bán 2,Jinrinteen
"Áo hoodie nỉ ngoại in PASSIONATE phong cách trẻ trung năng động, áo khoác hoodie unisex ulzzang có nón from rộng phong cách hàn quốc",100.000₫,https://tiki.vn/ao-hoodie-ni-ngoai-in-passionate-phong-cach-tre-trung-nang-dong-ao-khoac-hoodie-unisex-ulzzang-co-non-from-rong-phong-cach-han-quoc-p107858926.html?spid=107858928,16,,,Jinrinteen
Áo khoác sơ mi Nhung form rộng Nam Nữ,169.000,https://tiki.vn/ao-khoac-so-mi-nhung-form-rong-nam-nu-4young-sm-n300-p185465523.html?spid=185465534,17,,,Jinrinteen
,,https://tiki.vn/ao-khoac-hoodie-thisiss-ulzzang-unisex-fammilyshop-p191124872.html?spid=191124906,18,,,Jinrinteen
Áo khoác cardigan unisex form rộng CHỮ CÁI phối túi hộp chất lượng giá rẻ ulzzang hottrend - Tim Đen < 60kg,89.000₫,https://tiki.vn/ao-khoac-cardigan-unisex-form-rong-chu-cai-ac02-lechau-phoi-tui-hop-chat-luong-gia-re-ulzzang-hottrend-p195703817.html?spid=195703823,19,,,Jinrinteen
"áo khoác nỉ beerfest volleyball độc đẹp, Áo khoác nỉ Hoodie in chữ ulzzang basic, Áo Khoác Thun Nỉ Unisex Dây Kéo Form Rộng In mủ to chống nắng, Áo khoác hoodie Chống Rét Cho Nam nữ Cho Cặp Đôi nón Chất Nỉ Unisex Form rộng",100.000₫,https://tiki.vn/ao-khoac-ni-beerfest-volleyball-doc-dep-ao-khoac-ni-hoodie-in-chu-ulzzang-basic-ao-khoac-thun-ni-unisex-day-keo-form-rong-in-mu-to-chong-nang-ao-khoac-hoodie-chong-ret-cho-nam-nu-cho-cap-doi-non-chat-ni-unisex-form-rong-p193330092.html?spid=193330093,20,,Đã bán 5,Jinrinteen
"Áo kiểu rút dây dáng ôm cổ tròn ngắn tay, áo croptop dây rút, Áo Thun Kiểu Bigsize Rút Sườn 2 Bên,Áo Kiểu Big size Chất Thun Borib Loại 1 Tôn Dáng Tôn Eo, Áo thun nữ tay ngắn cổ tròn rút dây hai bên, dáng croptop qua rốn co giãn mạnh",89.000₫,https://tiki.vn/ao-kieu-rut-day-dang-om-co-tron-ngan-tay-ao-croptop-day-rut-ao-thun-kieu-bigsize-rut-suon-2-ben-ao-kieu-big-size-chat-thun-borib-loai-1-ton-dang-ton-eo-ao-thun-nu-tay-ngan-co-tron-rut-day-hai-ben-dang-croptop-qua-ron-co-gian-manh-p220688459.html?spid=220688471,21,,,Jinrinteen
"Áo Khoác Hoodie Nỉ Bông Unisex WISH màu XÁM Nam nữ unisex/Áo hoodie có mũ form rộng, Áo Hoodie nỉ chữ WISH-9 màu xám unisex ảnh thật, Áo Khoác Hoodie Nỉ Form Rộng Mũ To Số 9 Wish Chất Nỉ Dày Hot Trend Unisex Nam Nữ",100.000₫,https://tiki.vn/ao-khoac-hoodie-ni-bong-unisex-wish-mau-xam-nam-nu-unisex-ao-hoodie-co-mu-form-rong-ao-hoodie-ni-chu-wish-9-mau-xam-unisex-anh-that-ao-khoac-hoodie-ni-form-rong-mu-to-so-9-wish-chat-ni-day-hot-trend-unisex-nam-nu-p191513094.html?spid=191513096,22,,,Jinrinteen
"Quần Ống Rộng Suông Nữ Phối Dây Trendy Ullzang Unisex Nam Nữ, Quần Thun da cá dáng ống suông, ống rộng thiết kế basic chun co giãn, Quần thun ống rộng siêu hack dáng chất thun da cá dày dặn kèm ảnh thật shop tự chụp",99.000₫,https://tiki.vn/quan-ong-rong-suong-nu-phoi-day-trendy-ullzang-unisex-nam-nu-quan-thun-da-ca-dang-ong-suong-ong-rong-thiet-ke-basic-chun-co-gian-quan-thun-ong-rong-sieu-hack-dang-chat-thun-da-ca-day-dan-kem-anh-that-shop-tu-chup-p176549647.html?spid=176549649,23,,,Jinrinteen
Áo Khoác Bomber Nhung 2 Lớp Thêu D Form Unisex Nam Nữ,167.000₫,https://tiki.vn/ao-khoac-bomber-nhung-2-lop-theu-d-form-unisex-nam-nu-p153471819.html?spid=153471826,24,,Đã bán 1,Jinrinteen
"Áo Hoodie INSANE l Freaky Bear, Áo Hoodie Nam Nữ Unisex , Áo Khoác Hoodie Cặp Đôi Local Brand Form Rộng Có Mũ Hàn Quốc Cute Chống Nắng Giá Xưởng",150.000,https://tiki.vn/ao-hoodie-insane-l-freaky-bear-ao-hoodie-nam-nu-unisex-ao-khoac-hoodie-cap-doi-local-brand-form-rong-co-mu-han-quoc-cute-chong-nang-gia-xuong-p271978668.html?spid=271978674,25,,,Jinrinteen
,,https://tiki.vn/quan-jogger-ong-rong-day-rut-in-chu-chat-da-ca-day-dan-quan-jogger-nu-cao-cap-ong-bo-de-dang-phoi-do-ca-tinh-mac-thoang-mat-the-thao-p270240178.html?spid=270240188,26,,,Jinrinteen
Áo khoác hoodie chui đầu unisex Lala Susu - Áo có mũ form rộng chất vải nỉ bông ngoại phong cách ullzzang 3 màu dáng rộng có mũ trùm đầu thời trang nam nữ in chữ LALA SUSU đường phố trẻ trung tay bồng,135.000₫,https://tiki.vn/ao-khoac-hoodie-chui-dau-unisex-lala-susu-ao-co-mu-form-rong-chat-vai-ni-bong-ngoai-phong-cach-ullzzang-3-mau-dang-rong-co-mu-trum-dau-thoi-trang-nam-nu-in-chu-lala-susu-duong-pho-tre-trung-tay-bong-p273460749.html?spid=273460755,27,,,Jinrinteen
"Áo Hoodie Form Rộng Nam Nữ Logo rftromoments, Áo Hoodie nỉ "" REMT"" unisex (Ảnh shop tự chụp) Ulzzang, mũ áo trùm đầu 2 lớp phong cách Hàn Quốc",120.000₫,https://tiki.vn/ao-hoodie-form-rong-nam-nu-logo-rftromoments-ao-hoodie-ni-remt-unisex-anh-shop-tu-chup-ulzzang-mu-ao-trum-dau-2-lop-phong-cach-han-quoc-p272286866.html?spid=272286868,28,,,Jinrinteen
"Áo khoác gió nhăn croptop in hình form rộng, Áo khoác chống nắng ngắn rộng mùa hè phong cách hàn quốc nữ, áo khoác ngoài gió nhẹ thể thao thời trang",160.000₫,https://tiki.vn/ao-khoac-gio-nhan-croptop-in-hinh-form-rong-ao-khoac-chong-nang-ngan-rong-mua-he-phong-cach-han-quoc-nu-ao-khoac-ngoai-gio-nhe-the-thao-thoi-trang-p271767306.html?spid=271767316,29,,,Jinrinteen
"Áo Khoác Gió Local Brand PHỐI 2 LỚP, Áo Khoác Dù thể thao cổ cao Logo Jacket Form Rộng Oversize Local Brand Nam Nữ Unisex",125.000,https://tiki.vn/ao-khoac-gio-local-brand-phoi-2-lop-ao-khoac-du-the-thao-co-cao-logo-jacket-form-rong-oversize-local-brand-nam-nu-unisex-p272387773.html?spid=272387783,30,,,Jinrinteen
,,https://tiki.vn/ao-khoac-ni-danh-cho-nam-cho-nu-va-cap-doi-kieu-sweater-khong-mu-form-rong-unisex-hinh-chu-co-2-mau-trang-den-p82895716.html?spid=82895718,31,,,Jinrinteen
Quần baggy nam nữ/ quần kaki basic nam nữ / quần basic nam nữ,106.000₫,https://tiki.vn/quan-baggy-nam-nu-quan-kaki-basic-nam-nu-quan-basic-nam-nu-p79192968.html?spid=79192984,32,,Đã bán 3,Jinrinteen
"ÁO cardigan, áo cadigan bông cúc có 2 túi trước tiện lợi, áo cardigan phong cách unisex ulzzang trẻ trung from rộng thụng thình quảng châu",99.000₫,https://tiki.vn/ao-cardigan-ao-cadigan-bong-cuc-co-2-tui-truoc-tien-loi-ao-cardigan-phong-cach-unisex-ulzzang-tre-trung-from-rong-thung-thinh-quang-chau-p91530845.html?spid=91530851,33,,,Jinrinteen
Áo thun tay lỡ unisex form rộng Bad Rabit nam nữ phong cách ulzzang Wind,89.000₫,https://tiki.vn/ao-thun-tay-lo-unisex-form-rong-bad-rabit-nam-nu-phong-cach-ulzzang-wind-p95059806.html?spid=95059820,34,,,Jinrinteen
Áo thun ba lỗ unisex tanktop form rộng Bướm Đen sát nách nam nữ ulzzang Wind,89.000₫,https://tiki.vn/ao-thun-ba-lo-unisex-tanktop-form-rong-buom-den-sat-nach-nam-nu-ulzzang-wind-p95059458.html?spid=95059462,35,,Đã bán 1,Jinrinteen
,,https://tiki.vn/quan-baggy-wind-ong-suong-unisex-caro-ong-rong-nam-nu-ullzang-p95059870.html?spid=95059897,36,,,Jinrinteen
Áo Khoác Dù Nam Nữ Rain,112.000₫,https://tiki.vn/ao-khoac-du-nam-nu-rain-p95059903.html?spid=95059942,37,,Đã bán 2,Jinrinteen
"Áo khoác mũ gấu biboo, áo khoác gấu biboo, áo khoác chống nắng chống lạnh, áo khoác có nón, áo khoác nam nữ đều mặc được, Áo khoác nữ . áo khoác nam",99.000₫,https://tiki.vn/ao-khoac-mu-gau-biboo-ao-khoac-gau-biboo-ao-khoac-chong-nang-chong-lanh-ao-khoac-co-non-ao-khoac-nam-nu-deu-mac-duoc-ao-khoac-nu-ao-khoac-nam-p90752306.html?spid=90752316,38,,Đã bán 4,Jinrinteen
Áo khoác trơn cánh dơi có khoen dây rút,99.000₫,https://tiki.vn/ao-khoac-tron-canh-doi-co-khoen-day-rut-p57629947.html?spid=57629948,39,,Đã bán 2,Jinrinteen
"Áo chui đầu, áo sweater, áo sweater nam nữ đều mặc được, áo chui đầu cho cả nam và nữ, áo sweater hoạt hình, áo sweater kute, áo sweater quảng châu",99.000₫,https://tiki.vn/ao-chui-dau-ao-sweater-ao-sweater-nam-nu-deu-mac-duoc-ao-chui-dau-cho-ca-nam-va-nu-ao-sweater-hoat-hinh-ao-sweater-kute-ao-sweater-quang-chau-p76255592.html?spid=76255593,40,,Đã bán 2,Jinrinteen
