title,price,link_item,index,discount,sales,brand
Áo Khoác Bomber Nỉ In Bear Box Form rộng Unisex Nam Nữ Couple - Lana Store,110.000₫,https://tiki.vn/ao-khoac-bomber-ni-in-bear-box-form-rong-unisex-nam-nu-couple-lana-store-p107336024.html?spid=107336034,1,,,Jinrinteen
Áo Bomber Dù 2 Lớp Bóng Chày G Form chuẩn Unisex Nam Nữ,103.000₫,https://tiki.vn/ao-bomber-du-2-lop-bong-chay-g-form-chuan-unisex-nam-nu-p107336214.html?spid=107336222,2,,Đã bán 4,Jinrinteen
"ÁO KHOÁC BOMBER (RA), ÁO KHOÁC NHUNG ORIGINAL, Áo Khoác Nhung Bomber, Bomber Da Lộn 2 lớp Chất Đẹp ,HotTrend 2021, Áo khoác bomber vải nhung",156.000₫,https://tiki.vn/ao-khoac-bomber-ra-ao-khoac-nhung-original-ao-khoac-nhung-bomber-bomber-da-lon-2-lop-chat-dep-hottrend-2021-ao-khoac-bomber-vai-nhung-p91532992.html?spid=91532996,3,,Đã bán 1,Jinrinteen
"ÁO KHOÁC NHUNG TĂM KIỂU BOMBER IN LOGO 2000 - HÀNG IN BAO ĐẸP, Áo khoác bomber nhung - Áo Bomber jacket nhung gân cao cấp UNISEX chuẩn form nam nữ",156.000,https://tiki.vn/ao-khoac-nhung-tam-kieu-bomber-in-logo-2000-hang-in-bao-dep-ao-khoac-bomber-nhung-ao-bomber-jacket-nhung-gan-cao-cap-unisex-chuan-form-nam-nu-p112251649.html?spid=112251650,4,,,Jinrinteen
,,https://tiki.vn/ao-khoac-nhung-kieu-bomber-logo-in-chu-g-sieu-chat-nhung-day-dan-min-mang-tp-ao-khoac-bong-chay-logo-theu-toan-than-sac-net-phoi-tay-dep-p112251026.html?spid=112251028,5,,,Jinrinteen
"Áo khoác cardigan nữ chất nỉ bông phối màu,áo sweater unisex gài nút có túi in hoạ tiết kèm video",100.000₫,https://tiki.vn/ao-khoac-cardigan-nu-chat-ni-bong-phoi-mau-ao-sweater-unisex-gai-nut-co-tui-in-hoa-tiet-kem-video-p109817085.html?spid=109817137,6,,Đã bán 1,Jinrinteen
Áo khoác kaki sơ mi tay lỡ FORM RỘNG vải mềm mịn,128.000₫,https://tiki.vn/ao-khoac-kaki-so-mi-tay-lo-form-rong-vai-mem-min-p109834811.html?spid=109834835,7,,,Jinrinteen
"Áo khoác dù ulzzang/Áo khoác dù unisex form rộng kiểu bomber có nón in hoạ tiết thời trang teen hè, Áo khoác bomber ,áo khoác dù 2 lớp dáng unisex form rộng , phong cách ulzzang in hình",103.000₫,https://tiki.vn/ao-khoac-du-ulzzang-ao-khoac-du-unisex-form-rong-kieu-bomber-co-non-in-hoa-tiet-thoi-trang-teen-he-ao-khoac-bomber-ao-khoac-du-2-lop-dang-unisex-form-rong-phong-cach-ulzzang-in-hinh-p114055855.html?spid=114055869,8,,Đã bán 1,Jinrinteen
"ÁO KHOÁC CARDIGAN NỈ MARCUS FORM RỘNG UNISEX, ÁO CARDIGAN CHỮ N SỐ 18 PHỐI VIỀN ĐẸP PHONG CÁCH HÀN QUỐC, Áo khoác bomber Marcus nhiều màu ULZZANG CÓ TÚI Ô VUÔNG",99.000₫,https://tiki.vn/ao-khoac-cardigan-ni-marcus-form-rong-unisex-ao-cardigan-chu-n-so-18-phoi-vien-dep-phong-cach-han-quoc-ao-khoac-bomber-marcus-nhieu-mau-ulzzang-co-tui-o-vuong-p112141252.html?spid=112141253,9,,,Jinrinteen
,,https://tiki.vn/1-4-ao-thun-nam-unisex-form-rong-in-hinh-cho-pug-sieu-ngau-ao-thun-nam-unisex-form-rong-tay-lo-wash-tee-ao-thun-nam-nu-unisex-form-rong-in-hinh-cho-bull-sieu-ngau-p114279721.html?spid=114279722,10,,,Jinrinteen
"ÁO HOODIES UNISEX MÀU ĐỎ TÊN LỬA áo khoác hoodie nỉ nam nữ,Áo Khoác Hoodie Nỉ Ngoại in hình tên lữa unisex ulzzang nam nữ",110.000₫,https://tiki.vn/ao-hoodies-unisex-mau-do-ten-lua-ao-khoac-hoodie-ni-nam-nu-p117901595.html?spid=117901616,11,,Đã bán 1,Jinrinteen
"Áo Thun Nam nữ form rộng tay lỡ màu trắng,Áo Thun Tay Lỡ Form Rộng Unisex Nam Nữ in chữ RELAX chất cotton siêu mịn,Jins Store",94.000₫,https://tiki.vn/ao-thun-nam-nu-form-rong-tay-lo-mau-trang-p117901626.html?spid=117901635,12,,,Jinrinteen
,,https://tiki.vn/ao-hoodie-nam-nu-unisex-form-rong-khoa-zip-trung-ran-unisex-hoodie-ni-p117900893.html?spid=117900948,13,,,Jinrinteen
"ĐỒ BỘ MẶC NHÀ NAM NỮ THỜI TRANG MÙA HÈ CỰC ĐẸP IN LOANG BÒ SỮA ĐẸP, CHẤT THUN LẠNH MÁT MẼ, PHONG CÁCH TRẺ TRUNG CÁ TÍNH - JINS STORE",103.000₫,https://tiki.vn/do-bo-mac-nha-gia-sap-san-set-quan-ao-hoat-hinh-form-rong-unisex-bo-sua-danh-cho-nam-nu-p117154003.html?spid=117154113,14,,,Jinrinteen
"ÁO KHOÁC UNISEX NAM NỮ KIỂU CARDIGAN THUN NỈ NGOẠI, NÚT BẤM IN HÌNH MY LIFE PHONG CÁCH HÀN QUỐC, CỰC MỚI HOT HÈ 2021 THỜI TRANG MỚI NHẤT HIỆN NAY",109.000₫,https://tiki.vn/ao-khoac-cardigan-ni-ngoai-nam-nu-cuc-phong-cach-hottrend-2021-mau-moi-nhat-hien-nay-p118589898.html?spid=118590395,15,,,Jinrinteen
"ÁO KHOÁC NAM NỮ HOODIE THUN NỈ,THIẾT KẾ MÀU SẮC XINH ĐỘNG,ĐẶC BIỆT LÀ CHẤT LIỆU VÃI THOÁNG MÁT IN HÌNH LI TRÀ SỬA TRÂN CHÂU SIÊU ĐÁNG YÊU-Jins Store",117.000₫,https://tiki.vn/ao-khoac-ni-nu-thiet-ke-mau-sac-xinh-dong-dac-biet-la-chat-lieu-vai-thoang-mat-lana-fashion-p118589606.html?spid=118590419,16,,,Jinrinteen
"QUẦN SHORT THUN DA CÁ NAM NỮ ĐỀU MẶC ĐƯỢC,QUẦN TRƠN 2 MÀU ( ĐEN & XANH DƯƠNG )THIẾT KẾ ỐNG RỘNG THÂN QUẦN KẺ SỌC CÁ TÍNH CHẤT THUN CO GIẢN 4 CHIỀU THOÁNG MÁT-JINS STORE",99.000₫,https://tiki.vn/quan-short-nu-ke-soc-ca-tinh-chat-thun-co-gian-4-chieu-thoang-mat-lana-fashion-p118588498.html?spid=118588608,17,,,Jinrinteen
,,https://tiki.vn/freeship-do-bo-thun-nu-cham-bi-mat-cuoi-sieu-hot-p117154980.html?spid=117154981,18,,,Jinrinteen
"Áo cardigan unisex nam nữ,Áo khoác bomber kiểu bóng chày form rộng chất nỉ bông che nắng tránh tia UV",102.000₫,https://tiki.vn/ao-cardigan-unisex-nam-nu-ao-khoac-bomber-kieu-bong-chay-form-rong-chat-ni-bong-che-nang-tranh-tia-uv-p114055889.html?spid=114055904,19,,,Jinrinteen
"Quần short nữ ulzzang kiểu dáng thể thao chất thun co giãn thoáng mát, quần ống rộng tua kèm video, Quần Short Nữ Kiểu Dáng Thể Thao, Quần Short Nam Nữ Ống Rộng",88.000₫,https://tiki.vn/quan-short-nu-ulzzang-kieu-dang-the-thao-chat-thun-co-gian-thoang-mat-quan-ong-rong-tua-kem-video-quan-short-nu-kieu-dang-the-thao-quan-short-nam-nu-ong-rong-p114055886.html?spid=114055914,20,,,Jinrinteen
"ÁO KHOÁC NỮ THUN NỈ NGOẠI CÓ DÂY KÉO IN CHỮ A HOA CÚC SIÊU HOT , MÀU SẮC TƯƠI TRẺ( XANH- HỒNG) HÀI HÒA,THIẾT KẾ HỌA HOA CÚC TIẾT SIÊU ĐÁNG YÊU-JINS STORE",106.000₫,https://tiki.vn/ao-khoac-ni-nu-mau-sac-tinh-te-hai-hoa-thiet-ke-hoa-tiet-sieu-ngau-lana-fashion-p118588460.html?spid=118588509,21,,,Jinrinteen
"Áo hoodie unisex form rộng WIND Nỉ Lục Lăng, áo hoodie nam nữ ullzang",112.000₫,https://tiki.vn/free-ship-hoan-xu-ao-hoodie-unisex-form-rong-wind-ni-luc-lang-ao-hoodie-nam-nu-ullzang-wind-p117155009.html?spid=117155026,22,,,Jinrinteen
Áo khoác bomber dù unisex nam nữ form rộng kiểu bóng chày phong cách hàn,103.000₫,https://tiki.vn/ao-khoac-bomber-du-unisex-nam-nu-form-rong-kieu-bong-chay-phong-cach-han-p114056070.html?spid=114056133,23,,,Jinrinteen
Áo khoác cadigan nỉ ngoại MIF CLUB,99.000₫,https://tiki.vn/ao-khoac-cadigan-ni-ngoai-mif-club-p71919713.html?spid=71919717,24,,Đã bán 3,Jinrinteen
"Áo khoác nỉ Sweater dành cho nam cho nữ và cặp đôi kiểu Sweater không mũ , form rộng unisex hình chữ có 3 màu trắng đen",106.000,https://tiki.vn/ao-khoac-ni-sweater-danh-cho-nam-cho-nu-va-cap-doi-kieu-sweater-khong-mu-form-rong-unisex-hinh-chu-co-3-mau-trang-den-p82895820.html?spid=82895824,25,,,Jinrinteen
,,https://tiki.vn/ao-khoac-cadigan-kieu-bomber-sieu-dep-p71919784.html?spid=71919788,26,,,Jinrinteen
"Áo hoodie chống nắng dành cho nam cho nữ và cặp đôi có 2 màu, unisex form rộng in hình mèo và chuột ulzzang 123SHOP",99.000₫,https://tiki.vn/ao-hoodie-chong-nang-danh-cho-nam-cho-nu-va-cap-doi-co-2-mau-unisex-form-rong-in-hinh-meo-va-chuot-ulzzang-123shop-p84472301.html?spid=84472303,27,,Đã bán 3,Jinrinteen
"Áo Khoác Nỉ Cadigan, áo cadigan from rộng ulzzang unisex quảng châu, áo khoác cadigan chống nắng, mặc ấm, tránh mưa thời trang",99.000₫,https://tiki.vn/ao-khoac-ni-cadigan-ao-cadigan-from-rong-ulzzang-unisex-quang-chau-ao-khoac-cadigan-chong-nang-mac-am-tranh-mua-thoi-trang-p91530887.html?spid=91530893,28,,,Jinrinteen
Áo khoác hoodie nỉ nam nữ thần bài thời trang,98.000₫,https://tiki.vn/ao-khoac-hoodie-ni-nam-nu-than-bai-thoi-trang-p79192890.html?spid=79192892,29,,,Jinrinteen
"Áo Thun Ba Lỗ In Hình Bướm, Áo thun 3 lỗ, Áo Ba Lỗ Bướm Ulazzang, Áo thun tanktop áo ba lỗ unisex, Áo thun ba lỗ Nam Nữ cổ tròn",89.000₫,https://tiki.vn/ao-thun-ba-lo-in-hinh-buom-ao-thun-3-lo-ao-ba-lo-buom-ulazzang-ao-thun-tanktop-ao-ba-lo-unisex-ao-thun-ba-lo-nam-nu-co-tron-p88081905.html?spid=88081906,30,,,Jinrinteen
,,https://tiki.vn/ao-khoac-mu-gau-biboo-cao-cap-ao-khoac-bearboo-ao-khoac-nu-ao-khoac-nam-ao-khoac-cap-doi-vai-ni-ngoai-chu-biboo-chong-nang-chong-lanh-tot-p89560789.html?spid=89560795,31,,,Jinrinteen
Áo khoác hoodie có dây kéo in chữ sau lưng vải đẹp,128.000₫,https://tiki.vn/ao-khoac-hoodie-co-day-keo-in-chu-sau-lung-vai-dep-p79192994.html?spid=79192996,32,,,Jinrinteen
Áo Khoác HOODIE Phối Họa Tiết Unisex,99.000₫,https://tiki.vn/ao-khoac-hoodie-phoi-hoa-tiet-unisex-p76295247.html?spid=76295251,33,,,Jinrinteen
Áo khoác nỉ nam nữ basic áo khoác ulzzang 2 màu cực đẹp form rộng bo gấu tay phồng hàn quốc,94.000₫,https://tiki.vn/ao-khoac-ni-nam-nu-basic-ao-khoac-ulzzang-2-mau-cuc-dep-form-rong-bo-gau-tay-phong-han-quoc-p171824297.html?spid=171824313,34,,Đã bán 3,Jinrinteen
ÁO KHOÁC BOMBER NAM NỮ VẢI MERO CAO CẤP PHONG CÁCH BÓNG CHÀY THỜI TRANG LOGO THÊU NGẦU HÓT TRIEND MỚI NHẤT 2022,99.000₫,https://tiki.vn/ao-khoac-bomber-nam-nu-vai-mero-cao-cap-phong-cach-bong-chay-thoi-trang-logo-theu-ngau-hot-triend-moi-nhat-2021-4-danh-g-p171810013.html?spid=171810017,35,,,Jinrinteen
,,https://tiki.vn/ao-khoac-bomber-ni-ao-bomber-cardigan-cai-nut-cotton-cao-cap-tran-bong-day-min-form-unisex-nam-nu-40-65kg-p171824687.html?spid=171824695,36,,,Jinrinteen
"Áo hoodie tay phồng form rộng chất nỉ ngoại cao cấp oversize, Áo Hoodie Nữ Dáng Rộng Có Mũ Tay Dài thời trang, Áo khoác hoodie nỉ trơn unisex chất dày dặn cao cấp có khóa kéo dáng thụng",100.000₫,https://tiki.vn/ao-hoodie-tay-phong-form-rong-chat-ni-ngoai-cao-cap-oversize-p170440423.html?spid=170440429,37,,Đã bán 2,Jinrinteen
Áo Hoodie In Hình Family Chất Nỉ Mịn Đẹp Áo Khoác Nỉ Bông In Gia Đình Đẹp,112.000₫,https://tiki.vn/ao-hoodie-in-hinh-family-chat-ni-min-dep-ao-khoac-ni-bong-in-gia-dinh-dep-p153471776.html?spid=153471787,38,,,Jinrinteen
Áo Hoodie Bear Nỉ Ngoại Tay Phồng Chất Đẹp Như Ảnh ️ Áo Khoác Nỉ Bông In Gấu Hoạt Hình,112.000₫,https://tiki.vn/ao-hoodie-bear-ni-ngoai-tay-phong-chat-dep-nhu-anh-ao-khoac-ni-bong-in-gau-hoat-hinh-p153471728.html?spid=153471737,39,,,Jinrinteen
Áo Bomber Dù Rajder Chất 2 Lớp Thoáng Mát Form Rộng Unisex,112.000,https://tiki.vn/ao-bomber-du-rajder-chat-2-lop-thoang-mat-form-rong-unisex-p153471684.html?spid=153471688,40,,,Jinrinteen
