title,price,link_item,index,discount,sales,category
Tã Caryn Quần M16,180.000₫,https://tiki.vn/ta-caryn-quan-m16-p198967863.html?spid=198967864,1,-37%,,tabim
TÃ QUẦN CARYN M32,350.000₫,https://tiki.vn/ta-quan-caryn-m32-p199126166.html?spid=199126167,2,-28%,Đã bán 3,tabim
Combo 2 Gói Khăn Ướt Max Cool 30 Tờ Có Hương ( 30 Tờ x 2 ),19.800₫,https://tiki.vn/combo-2-goi-khan-uot-max-cool-30-to-co-huong-30-to-x-2-p180847809.html?spid=180847810,3,,Đã bán 21,tabim
Combo 10 bịch bỉm/tã quần cao cấp Mijuku - XXL,1.700.000₫,https://tiki.vn/combo-10-bich-bim-ta-quan-cao-cap-mijuku-xxl-p58362568.html?spid=58362569,4,,Đã bán 3,tabim
Combo 10 bịch bỉm/tã quần cao cấp Mijuku - XXXL,1.750.000₫,https://tiki.vn/combo-10-bich-bim-ta-quan-cao-cap-mijuku-xxxl-p58361564.html?spid=58361565,5,,,tabim
Tã Dán Người Cao Tuổi Size M 20 Miếng Caryn Vòng Hông 61 Đến 106 Cm - Bỉm Dán Người Già Size M20 Siêu Thấm,188.400₫,https://tiki.vn/ta-dan-nguoi-cao-tuoi-size-m-20-mieng-caryn-vong-hong-61-den-106-cm-bim-dan-nguoi-gia-size-m20-sieu-tham-p260920193.html?spid=260920197,6,,,tabim
Sỉ- Miếng Lót Sơ Sinh Huggies Newborn 2 (NB2 40 Miếng) Mẫu Mới - HSD luôn mới,84.300₫,https://tiki.vn/si-mieng-lot-so-sinh-huggies-newborn-2-nb2-40-mieng-mau-moi-hsd-luon-moi-p216351118.html?spid=216351119,7,,,tabim
Sỉ- Tã quần Unidry XXL44 Siêu Mỏng Ultra Thin - Mẫu mới nhất - Date luôn mới,255.500₫,https://tiki.vn/si-ta-quan-unidry-xxl44-sieu-mong-ultra-thin-mau-moi-nhat-date-luon-moi-p205246069.html?spid=205246070,8,,Đã bán 1,tabim
Sỉ- Tã quần Unidry L68 Siêu Mỏng Ultra Thin - Mẫu mới nhất - Date luôn mới,303.500₫,https://tiki.vn/si-ta-quan-unidry-l68-sieu-mong-ultra-thin-mau-moi-nhat-date-luon-moi-p205246051.html?spid=205246052,9,,,tabim
Bỉm dán/quần Nabizam Magic Soft siêu mềm mại thấm hút cho bé yêu,377.000₫,https://tiki.vn/bi-m-dan-qua-n-nabizam-magic-soft-sieu-mem-mai-tham-hut-cho-be-yeu-p149240133.html?spid=149240163,10,,Đã bán 4,tabim
Combo 4 bịch tã bỉm Dán/Quần Nabizam nội địa Hàn đủ size từ 4-20KG,1.450.000₫,https://tiki.vn/combo-4-bich-ta-bim-dan-quan-nabizam-noi-dia-han-du-size-tu-4-20kg-p119474165.html?spid=144189741,11,,,tabim
ta quan hingig 100 mieng size 5XL,250.000₫,https://tiki.vn/ta-quan-yubest-gold-size-l-78-mieng-p80098785.html?spid=80098787,12,,Đã bán 250,tabim
Khăn ướt Bebesup I CAN Flushable 42 tờ,39.000₫,https://tiki.vn/khan-uot-bebesup-i-can-flushable-42-to-p222680060.html?spid=222680061,13,,,tabim
Khăn ướt cho bé SEPTONA Baby Wipes Travel Lô Hội 20 tờ,45.000₫,https://tiki.vn/khan-uot-cho-be-septona-baby-wipes-travel-lo-hoi-20-to-p197412214.html?spid=197412215,14,,,tabim
Khăn ướt cho bé SEPTONA Baby Wipes LID CHAMOMILE 64 tờ,85.000₫,https://tiki.vn/khan-uot-cho-be-septona-baby-wipes-lid-chamomile-64-to-p197410479.html?spid=197410480,15,,,tabim
"Tã/Bỉm Dán Nabizam Magic Soft Nội Địa Hàn Êm Mỏng, Siêu Thấm Hút Size XL Cho Bé Trên 12kg, 32 Miếng",476.000₫,https://tiki.vn/ta-bim-dan-nabizam-magic-soft-noi-dia-han-em-mong-sieu-tham-hut-size-xl-cho-be-tren-12kg-32-mieng-p207779585.html?spid=207779586,16,,Đã bán 2,tabim
[COMBO 2 BỊCH] Bỉm - Tã quần Kibie Hàn Quốc size,540.000₫,https://tiki.vn/combo-2-bich-bim-ta-quan-kibie-han-quoc-size-xxl-p82446326.html?spid=82446327,17,,Đã bán 5,tabim
Tã Quần Cao Cấp Moony Nhật Bản bé trai XL38 [Tặng 8 miếng Moony Natural cùng size],359.000₫,https://tiki.vn/ta-quan-cao-cap-moony-nhat-ban-be-trai-xl38-tang-8-mieng-moony-natural-cung-size-p58163756.html?spid=72752856,18,,,tabim
Tã dán Sweet Daddy CLASSIC chính hãng - Size M58/L54/XL50/XXL44,530.000₫,https://tiki.vn/ta-dan-sweet-daddy-classic-chinh-hang-size-m58-l54-xl50-xxl44-p173608820.html?spid=173608828,19,,,tabim
Tã Quần Siêu Mềm Siêu Thấm Đủ Size M 22 Miếng - Bỉm Quần Nyna Chính Hãng,118.000₫,https://tiki.vn/ta-quan-sieu-mem-sieu-tham-du-size-m-22-mieng-bim-quan-nyna-chinh-hang-p171543707.html?spid=171543711,20,,,tabim
"Khăn ướt em bé ENJOY Không Mùi (Xanh) mềm mại, dưỡng ẩm, tiện dụng, đạt chuẩn sức khỏe SGS - Gói 80 tờ",22.500₫,https://tiki.vn/khan-uot-baby-80-to-enjoy-khong-mui-p59134275.html?spid=59134279,21,,Đã bán 126,tabim
"Combo 2 Bịch Bỉm Dán NABIZAM Ultra Thin Nội Địa Hàn Siêu Mỏng, Mềm, Chống Tràn Size XL Cho Bé Trên 12kg, 32 Miếng/Bịch",952.000₫,https://tiki.vn/combo-2-bich-bim-dan-nabizam-ultra-thin-noi-dia-han-sieu-mong-mem-chong-tran-size-xl-cho-be-tren-12kg-32-mieng-bich-p207779241.html?spid=207779245,22,,,tabim
"COMBO 4 Tã/Bỉm Quần Nabizam Ultra Thin Nội Địa Hàn Siêu Mỏng Nhẹ, Rãnh Chống Tràn Linh Hoạt Size 3XL20 Cho Bé Từ 20-25kg",1.680.000₫,https://tiki.vn/combo-4-ta-bim-quan-nabizam-ultra-thin-noi-dia-han-sieu-mong-nhe-ranh-chong-tran-linh-hoat-size-3xl20-cho-be-tu-20-25kg-p207779185.html?spid=207779190,23,,Đã bán 1,tabim
Combo 2 gói Tã quần Jo 3S Plus M72/L64/XL56/XXL48,730.000₫,https://tiki.vn/combo-2-goi-ta-quan-jo-3s-plus-m72-l64-xl56-xxl48-p117383435.html?spid=117383443,24,,Đã bán 7,tabim
Combo 2 gói Tã quần JoeCo công nghệ Nhật size M72/L66/XL60/XXL54,640.000₫,https://tiki.vn/combo-2-goi-ta-quan-joeco-cong-nghe-nhat-size-m72-l66-xl60-xxl54-p214592118.html?spid=214592120,25,,Đã bán 2,tabim
Tã quần Moony Natural M46 tặng hộp 4 miếng tã quần Moony Natural M,359.000₫,https://tiki.vn/ta-quan-moony-natural-m46-tang-hop-4-mieng-ta-quan-moony-natural-m-p74995207.html?spid=247335799,26,,Đã bán 1,tabim
Tã Quần Siêu Mềm Size XL 18 Bỉm Quần Nyna Chính Hãng,118.000₫,https://tiki.vn/ta-quan-sieu-mem-size-xl-18-bim-quan-nyna-chinh-hang-p171543752.html?spid=171543753,27,,,tabim
"Tã dán Double Love Size S68 - M60 - L56 - XL52 bỉm siêu mỏng, thấm hút nhanh, chống tràn, chống hăm",270.000₫,https://tiki.vn/ta-dan-double-love-size-s68-m60-l56-xl52-bim-sieu-mong-tham-hut-nhanh-chong-tran-chong-ham-p180499432.html?spid=180499440,28,,,tabim
Combo Tã/bỉm dán Dry-Pro S26 (3kg-7kg) + tặng 1 gói khăn ướt Pur 80 tờ cho bé,165.000₫,https://tiki.vn/combo-ta-bim-dan-dry-pro-s26-3kg-7kg-tang-1-goi-khan-uot-pur-80-to-cho-be-p149126393.html?spid=149126394,29,,,tabim
Tã quần Sweet Daddy CLASSIC chính hãng - Size L52/XL50/XXL48,530.000₫,https://tiki.vn/ta-quan-sweet-daddy-classic-chinh-hang-size-l52-xl50-xxl48-p175111108.html?spid=175111110,30,,Đã bán 1,tabim
"Tã Quần/Dán BabiesOrganic Size NB76,S66,M56,L46,M54,L50,XL46,XXL40,XXXL38 Tinh Chất Lô Hội, Mỏng Thoáng Khí",232.000₫,https://tiki.vn/ta-quan-dan-babiesorganic-size-nb76-s66-m56-l46-m54-l50-xl46-xxl40-xxxl38-tinh-chat-lo-hoi-mong-thoang-khi-p183032078.html?spid=183032082,31,,Đã bán 5,tabim
Combo 3 gói Bỉm tã quần ROSE BABY size XXL 24 miếng (15-20kg),399.000₫,https://tiki.vn/combo-3-goi-bim-ta-quan-rose-baby-size-xxl-24-mieng-15-20kg-p273207147.html?spid=273207148,32,,,tabim
Combo 5 gói Bỉm tã quần ROSE BABY size L 28 miếng (9-14kg),665.000₫,https://tiki.vn/combo-5-goi-bim-ta-quan-rose-baby-size-l-28-mieng-9-14kg-p273206769.html?spid=273206770,33,,,tabim
Bỉm tã quần ROSE BABY size XL 26 miếng (12-17kg),135.000₫,https://tiki.vn/bim-ta-quan-rose-baby-size-xl-26-mieng-12-17kg-p273192776.html?spid=273192777,34,,,tabim
Bỉm tã dán ROSE BABY size M 48 miếng (6-11kg),190.000₫,https://tiki.vn/bim-ta-dan-rose-baby-size-m-48-mieng-6-11kg-p273196762.html?spid=273196763,35,,,tabim
Tã/bỉm quần Molfix Thiên nhiên Ultra M76 (6kg - 11kg) - Gói 76 miếng,310.000₫,https://tiki.vn/ta-bim-quan-molfix-thien-nhien-ultra-m76-6kg-11kg-goi-76-mieng-p225200034.html?spid=225200035,36,,,tabim
Tã/bỉm quần Molfix Thiên nhiên Ultra XL34 (12kg - 17kg) - Gói 34 miếng,215.000₫,https://tiki.vn/ta-bim-quan-molfix-thien-nhien-ultra-xl34-12kg-17kg-goi-34-mieng-p225200800.html?spid=225200801,37,,,tabim
Miếng lót sơ sinh Molfix Thiên nhiên Super Jumbo Newborn 1 (dưới 1 tháng tuổi) - Gói 90 miếng,145.000₫,https://tiki.vn/mieng-lot-so-sinh-molfix-thien-nhien-super-jumbo-newborn-1-duoi-1-thang-tuoi-goi-90-mieng-p225200865.html?spid=225200866,38,,,tabim
[New] Tã quần JoeCo công nghệ Nhật size S40/M72/L66/XL60/XXL54,320.000₫,https://tiki.vn/new-ta-quan-joeco-cong-nghe-nhat-size-s40-m72-l66-xl60-xxl54-p208169565.html?spid=208169571,39,,,tabim
Combo 4 Gói Tã Quần Cao Cấp Moony Nhật Bản size M58,1.324.000₫,https://tiki.vn/combo-4-goi-ta-quan-cao-cap-moony-nhat-ban-size-m58-p69377407.html?spid=69377408,40,,,tabim
