title,price,link_item,index,discount,sales,brand
Áo thun polo,115.000₫,https://tiki.vn/ao-thun-polo-p271972762.html?spid=271972768,1,,,VONESA
Quan Jeans baggy nam ống rộng mã TRR-01 Style hàn quốc,129.000₫,https://tiki.vn/quan-jeans-baggy-nam-ong-rong-ma-trr-01-style-han-quoc-p187829944.html?spid=187830011,2,,,VONESA
Áo khoác dù trơn nam nữ cao cấp,141.000₫,https://tiki.vn/ao-khoac-du-tron-nam-nu-cao-cap-p187840642.html?spid=187840659,3,,,VONESA
Áo hoodie phản quang thủy thủ mặt trăng nam nữ,160.000,https://tiki.vn/ao-hoodie-phan-quang-thuy-thu-mat-trang-nam-nu-p187840612.html?spid=187840627,4,,,VONESA
,,https://tiki.vn/ao-thun-nu-unisex-tay-lo-form-rong-love-at-first-sight-vai-day-min-p190359196.html?spid=190359258,5,,,VONESA
Áo thun nam in hình chiến binh Hàn Quốc vải dày mịn TEE19S158,53.000₫,https://tiki.vn/ao-thun-nam-in-hinh-chien-binh-han-quoc-vai-day-min-tee19s158-p190361004.html?spid=190361661,6,,,VONESA
Áo thun unisex chibi siêu anh hừng form rộng vải dày mịn 2019T977,53.000₫,https://tiki.vn/ao-thun-unisex-chibi-sieu-anh-hung-form-rong-vai-day-min-2019t977-p190360435.html?spid=190360532,7,,,VONESA
Áo phông nam chữ kiểu phong cách unisex màu xám,53.000₫,https://tiki.vn/ao-phong-nam-chu-kieu-phong-cach-unisex-mau-xam-p190360788.html?spid=190361400,8,,,VONESA
Áo thun nam nữ tay lỡ chữ kiểu rock vải dày mịn 20T2753,24.900₫,https://tiki.vn/ao-thun-nam-nu-tay-lo-chu-kieu-rock-vai-day-min-20t2753-p190359496.html?spid=190360222,9,,,VONESA
,,https://tiki.vn/ao-thun-tay-lo-unisex-form-rong-viet-nam-tuyet-voi-trang-den-p190359917.html?spid=190360768,10,,,VONESA
Áo thun nam form rộng tay lỡ Hàn Quốc đẹp độc lạ vải dày mịn BST18,39.900₫,https://tiki.vn/ao-thun-nam-form-rong-tay-lo-han-quoc-dep-doc-la-vai-day-min-bst18-p190359677.html?spid=190361817,11,,,VONESA
Áo thun unisex phong cách cá tính đẹp rẻ 2019S555,56.300₫,https://tiki.vn/ao-thun-unisex-phong-cach-ca-tinh-dep-re-2019s555-p190363819.html?spid=190364236,12,,,VONESA
,,https://tiki.vn/ao-thun-nam-in-hinh-cho-dom-cuop-bien-han-quoc-vai-day-min-tee19s112-p190365438.html?spid=190365892,13,,,VONESA
Áo thun unisex supre cá tính màu trắng 2019T874,53.000₫,https://tiki.vn/ao-thun-unisex-supre-ca-tinh-mau-trang-2019t874-p190365081.html?spid=190365528,14,,,VONESA
Áo phông nam hổ 7 màu phong cách unisex màu xám,53.000₫,https://tiki.vn/ao-phong-nam-ho-7-mau-phong-cach-unisex-mau-xam-p190365603.html?spid=190365901,15,,,VONESA
Áo thun unisex form rộng Beautyful galaxy vải dày mịn đẹp 2019T1919,53.000₫,https://tiki.vn/ao-thun-unisex-form-rong-beautyful-galaxy-vai-day-min-dep-2019t1919-p190365709.html?spid=190366848,16,,,VONESA
Áo thun unisex quý ông cá tính form rộng vải dày mịn 2019T1236,53.000₫,https://tiki.vn/ao-thun-unisex-quy-ong-ca-tinh-form-rong-vai-day-min-2019t1236-p190365437.html?spid=190365591,17,,Đã bán 1,VONESA
,,https://tiki.vn/ao-thun-unisex-goku-dep-mau-trang-2019t823-p190364869.html?spid=190365040,18,,,VONESA
Áo thun gia đình đẹp in thỏ đeo kính nhảy dabbing dễ thương cao cấp,139.150₫,https://tiki.vn/ao-thun-gia-dinh-dep-in-tho-deo-kinh-nhay-dabbing-de-thuong-cao-cap-p190365498.html?spid=190365575,19,,,VONESA
Áo thun unisex form rộng họa tiết Supre đẹp vải dày mịn 2019T1773,53.000₫,https://tiki.vn/ao-thun-unisex-form-rong-hoa-tiet-supre-dep-vai-day-min-2019t1773-p190368729.html?spid=190369584,20,,,VONESA
Áo phông nam độc lạ cá tính phong cách unisex màu xám,53.000₫,https://tiki.vn/ao-phong-nam-doc-la-ca-tinh-phong-cach-unisex-mau-xam-p190372050.html?spid=190372531,21,,,VONESA
Áo thun unisex form rộng họa tiết Toroto phong cách Nhật Bản vải dày mịn 2020T2474,53.000₫,https://tiki.vn/ao-thun-unisex-form-rong-hoa-tiet-toroto-phong-cach-nhat-ban-vai-day-min-2020t2474-p190371512.html?spid=190372553,22,,,VONESA
Áo thun nam nữ form rộng họa tiết đẹp vải dày mịn 20T2770,24.900₫,https://tiki.vn/ao-thun-nam-nu-form-rong-hoa-tiet-dep-vai-day-min-20t2770-p190369194.html?spid=190372117,23,,,VONESA
Áo thun nam in hình mortal Hàn Quốc vải dày mịn TEE19S151,53.000₫,https://tiki.vn/ao-thun-nam-in-hinh-mortal-han-quoc-vai-day-min-tee19s151-p190374331.html?spid=190374720,24,,,VONESA
Áo thun unisex form rộng thứ 5 vải dày mịn 20T2718,24.900₫,https://tiki.vn/ao-thun-unisex-form-rong-thu-5-vai-day-min-20t2718-p190371375.html?spid=190374395,25,,,VONESA
,,https://tiki.vn/ao-thun-unisex-han-quoc-hoa-tiet-hoat-hinh-thoi-trang-atn474-p190373525.html?spid=190373675,26,,,VONESA
Áo thun nam đẹp hình nhân vật hoạt hình cá tính màu xám nhạt vải dày mịn TEEGR534,53.000₫,https://tiki.vn/ao-thun-nam-dep-hinh-nhan-vat-hoat-hinh-ca-tinh-mau-xam-nhat-vai-day-min-teegr534-p190375878.html?spid=190376503,27,,,VONESA
Áo thun unisex form rộng in ngôi sao giữa ngực vải dày mịn 2019T1176,53.000₫,https://tiki.vn/ao-thun-unisex-form-rong-in-ngoi-sao-giua-nguc-vai-day-min-2019t1176-p190374483.html?spid=190374622,28,,,VONESA
Áo phông nam mặt người phong cách unisex màu xám,53.000₫,https://tiki.vn/ao-phong-nam-mat-nguoi-phong-cach-unisex-mau-xam-p190375269.html?spid=190375821,29,,,VONESA
Áo phông nam độc lạ cá tính phong cách unisex màu xám,53.000₫,https://tiki.vn/ao-phong-nam-doc-la-ca-tinh-phong-cach-unisex-mau-xam-p190376211.html?spid=190377060,30,,,VONESA
,,https://tiki.vn/ao-thun-unisex-form-rong-18-cong-vai-day-min-2019t2178-p190375167.html?spid=190375720,31,,,VONESA
Áo thun unisex form rộng khủng long T Rex vải dày mịn 2019T1766,53.000₫,https://tiki.vn/ao-thun-unisex-form-rong-khung-long-t-rex-vai-day-min-2019t1766-p190375877.html?spid=190376766,32,,,VONESA
Áo thun nam đẹp hình quỷ đầu lâu skull cá tính màu xám nhạt vải dày mịn TEEGR489,53.000₫,https://tiki.vn/ao-thun-nam-dep-hinh-quy-dau-lau-skull-ca-tinh-mau-xam-nhat-vai-day-min-teegr489-p190378051.html?spid=190378205,33,,,VONESA
Áo thun nam tay lỡ họa tiết samurai form rộng vải dày mịn 2020T2611,53.000₫,https://tiki.vn/ao-thun-nam-tay-lo-hoa-tiet-samurai-form-rong-vai-day-min-2020t2611-p190378229.html?spid=190378744,34,,,VONESA
Áo thun unisex chibi cá tính màu trắng 2019T802,53.000₫,https://tiki.vn/ao-thun-unisex-chibi-ca-tinh-mau-trang-2019t802-p190378355.html?spid=190379077,35,,,VONESA
,,https://tiki.vn/ao-thun-unisex-this-is-my-friday-form-rong-vai-day-min-2019t978-p190378209.html?spid=190379350,36,,,VONESA
Áo phông nam nữ họa tiết siêu anh hùng form rộng vải dày mịn 2020T2871,53.000₫,https://tiki.vn/ao-phong-nam-nu-hoa-tiet-sieu-anh-hung-form-rong-vai-day-min-2020t2871-p190378038.html?spid=190379195,37,,,VONESA
Áo thun gia đình đẹp in it is family dễ thương cao cấp,139.150₫,https://tiki.vn/ao-thun-gia-dinh-dep-in-it-is-family-de-thuong-cao-cap-p190380766.html?spid=190380842,38,,,VONESA
Áo phông nam độc lạ cá tính phong cách unisex màu xám,53.000₫,https://tiki.vn/ao-phong-nam-doc-la-ca-tinh-phong-cach-unisex-mau-xam-p190362908.html?spid=190363843,39,,,VONESA
Áo thun nam tay lỡ form rộng họa tiết cá tính đẹp độc lạ vải dày mịn bst30,39.900₫,https://tiki.vn/ao-thun-nam-tay-lo-form-rong-hoa-tiet-ca-tinh-dep-doc-la-vai-day-min-bst30-p190359896.html?spid=190360904,40,,,VONESA
