title,price,link_item,index,discount,sales,brand
Áo Sơ Mi Nam In Chữ Cao Cấp Hàng Shop,145.000₫,https://tiki.vn/ao-so-mi-nam-in-chu-cao-cap-hang-shop-p104114563.html?spid=104114702,1,,,VONESA
ÁO SƠ MI NAM ECKO UNLTD CỰC NAM TÍNH | FORM CHUẨN,159.000₫,https://tiki.vn/ao-so-mi-nam-ecko-unltd-cuc-nam-tinh-form-chuan-p104114851.html?spid=104114959,2,,,VONESA
Áo Sơ Mi Nam Trắng Họa Tiết Sói Cao Cấp SM44,155.000₫,https://tiki.vn/ao-so-mi-nam-trang-hoa-tiet-soi-cao-cap-sm44-p104120733.html?spid=104120942,3,,,VONESA
Áo sơ mi nam trắng tay dài họa tiết cao cấp SM308,143.550,https://tiki.vn/ao-so-mi-nam-trang-tay-dai-hoa-tiet-cao-cap-sm308-p104120688.html?spid=104120850,4,,,VONESA
,,https://tiki.vn/ao-so-mi-nam-vien-co-hoa-tiet-thu-phap-cao-cap-hang-dep-p104127602.html?spid=104127728,5,,,VONESA
BST Áo Sơ Mi Nam Họa Tiết Giá Tốt | Form Chuẩn Shop,145.900₫,https://tiki.vn/bst-ao-so-mi-nam-hoa-tiet-gia-tot-form-chuan-shop-p104127750.html?spid=104128120,6,,,VONESA
ÁO SƠ MI NAM HỌA TIẾT ĐẠI BÀNG CAO CẤP SM11,145.000₫,https://tiki.vn/ao-so-mi-nam-hoa-tiet-dai-bang-cao-cap-sm11-p104131561.html?spid=104131898,7,,,VONESA
Áo Sơ Mi Nam Họa Tiết Chữ Thư Pháp Cao Cấp,150.500₫,https://tiki.vn/ao-so-mi-nam-hoa-tiet-chu-thu-phap-cao-cap-p104128953.html?spid=104129255,8,,,VONESA
SIÊU PHẨMÁO SƠ MI NAM THƯ PHÁP CHIM BAY CAO CẤP | HÀNG SHOP A55,145.500,https://tiki.vn/sieu-pham-ao-so-mi-nam-thu-phap-chim-bay-cao-cap-hang-shop-a55-p104130576.html?spid=104130731,9,,,VONESA
,,https://tiki.vn/ao-doi-so-mi-in-chu-sieu-dep-ao-so-mi-cap-nam-nu-dep-ms155-p101780167.html?spid=101780171,10,,,VONESA
"ÁO KHOÁC MẶC 2 MẶT vải dù có túi, áo khoác gió, áo khoác nam , áo khoác đôi, áo khoác cặp",157.000₫,https://tiki.vn/ao-khoac-mac-2-mat-vai-du-co-tui-ao-khoac-gio-ao-khoac-nam-ao-khoac-doi-ao-khoac-cap-p101790152.html?spid=101790328,11,,Đã bán 1,VONESA
"Áo thun cotton khoá zip,áo thun nam nữ,áo thun khoá hông",113.000,https://tiki.vn/ao-thun-cotton-khoa-zip-ao-thun-nam-nu-ao-thun-khoa-hong-p101789614.html?spid=101789638,12,,,VONESA
,,https://tiki.vn/ao-thun-tay-lo-nam-nu-unisex-jitsu-sieu-dep-thun-cotton-day-min-p104111705.html?spid=104111725,13,,,VONESA
Áo thun BABY SHARK bé trai Brother siêu dễ thương | hàng đẹp BS04 | Áo Chất Store,62.000₫,https://tiki.vn/ao-thun-baby-shark-be-trai-brother-sieu-de-thuong-hang-dep-bs04-ao-chat-store-p104111773.html?spid=104112008,14,,,VONESA
"Áo thun Nam Nữ Vonesa, áo phông Unisex Nam Nữ có Size từ 25-84kg B10",40.000₫,https://tiki.vn/ao-thun-nam-nu-vonesa-ao-phong-unisex-nam-nu-co-size-tu-25-84kg-b10-p107411668.html?spid=107411676,15,,Đã bán 9,VONESA
"Áo thun Nam Nữ Vonesa, áo phông Unisex Nam Nữ có Size từ 25-84kg B2",45.000₫,https://tiki.vn/ao-thun-nam-nu-vonesa-ao-phong-unisex-nam-nu-co-size-tu-25-84kg-b2-p107338756.html?spid=107338764,16,,Đã bán 3,VONESA
Áo thun nam nữ Vonesa thời trang cực chất cotton mềm mịn cá tính đủ size 25-84 kg,24.000₫,https://tiki.vn/ao-thun-nam-nu-vonesa-thoi-trang-cuc-chat-cotton-mem-min-ca-tinh-du-size-25-84-kg-p115827413.html?spid=115827415,17,,,VONESA
,,https://tiki.vn/ao-so-mi-nam-hoa-tiet-vien-tay-p48466829.html?spid=48466831,18,,,VONESA
Áo khoác jeans nam cá tính #300,249.000₫,https://tiki.vn/ao-khoac-jeans-nam-ca-tinh-300-p57306275.html?spid=57306277,19,,,VONESA
Áo sơ mi nam tay dài viền cổ đen,207.000₫,https://tiki.vn/ao-so-mi-nam-tay-dai-vien-co-den-p77629914.html?spid=77629920,20,,,VONESA
Áo sơ mi nam họa tiết đầu lâu và đại bàng,219.000₫,https://tiki.vn/ao-so-mi-nam-hoa-tiet-dau-lau-va-dai-bang-p76159649.html?spid=76159655,21,,,VONESA
Sơ mi nam trắng viền vai và tay thời trang,165.000₫,https://tiki.vn/so-mi-nam-trang-vien-vai-va-tay-thoi-trang-p77619060.html?spid=77619062,22,,,VONESA
Áo Khoác Nam Đen,175.000₫,https://tiki.vn/ao-khoac-nam-den-p38118352.html?spid=38118354,23,,Đã bán 6,VONESA
Áo Sơ Mi Nam 127,85.000₫,https://tiki.vn/ao-so-mi-nam-127-p31204631.html?spid=31204633,24,,,VONESA
Áo sơ mi nam viền tay họa tiết thánh giá,207.000,https://tiki.vn/ao-so-mi-nam-vien-tay-hoa-tiet-thanh-gia-p76162192.html?spid=76162194,25,,,VONESA
,,https://tiki.vn/ao-thun-hoa-tiet-hoat-hinh-cuc-chat-p76150418.html?spid=76150430,26,,,VONESA
Sơ mi nam viền vai họa tiết sói và chữ tàu thời trang,165.000₫,https://tiki.vn/so-mi-nam-vien-vai-hoa-tiet-soi-va-chu-tau-thoi-trang-p77619443.html?spid=77619449,27,,,VONESA
Áo sơ mi nam tay dài viền giữa họa tiết chữ I'M JUST ME,219.000₫,https://tiki.vn/ao-so-mi-nam-tay-dai-vien-giua-hoa-tiet-chu-i-m-just-me-p77629638.html?spid=77629644,28,,,VONESA
Sơ mi nam viền tay họa tiết núi non và chữ tàu thời trang,165.000₫,https://tiki.vn/so-mi-nam-vien-tay-hoa-tiet-nui-non-va-chu-tau-thoi-trang-p77619076.html?spid=77619080,29,,,VONESA
Áo sơ mi nam viền cổ đen trắng họa tiết côn trùng,207.000,https://tiki.vn/ao-so-mi-nam-vien-co-den-trang-hoa-tiet-con-trung-p77619492.html?spid=77619496,30,,,VONESA
,,https://tiki.vn/so-mi-lua-3d-in-hoa-tinh-te-p74178765.html?spid=74178767,31,,,VONESA
Áo sơ mi nam tay dài họa tiết ngôi sao,207.000₫,https://tiki.vn/ao-so-mi-nam-tay-dai-hoa-tiet-ngoi-sao-p77629950.html?spid=77629952,32,,Đã bán 1,VONESA
Áo sơ mi nam nâu đen họa tiết bắt mắt,219.000₫,https://tiki.vn/ao-so-mi-nam-nau-den-hoa-tiet-bat-mat-p74179126.html?spid=74179128,33,,,VONESA
Áo sơ mi nam dài tay họa tiết bồ công anh và chim,175.000₫,https://tiki.vn/ao-so-mi-nam-dai-tay-hoa-tiet-bo-cong-anh-va-chim-p76167137.html?spid=76167139,34,,,VONESA
Áo Sơ Mi Nam BM81,95.000₫,https://tiki.vn/ao-so-mi-nam-bm81-p44055709.html?spid=44055713,35,,,VONESA
,,https://tiki.vn/ao-so-mi-nam-tay-dai-vien-vai-hoa-tiet-ong-p77629688.html?spid=77629698,36,,,VONESA
Áo sơ mi nam viền cổ đen họa tiết hoa hồng,219.000₫,https://tiki.vn/ao-so-mi-nam-vien-co-den-hoa-tiet-hoa-hong-p77629653.html?spid=77629655,37,,Đã bán 1,VONESA
Jean nam túi tự,207.000₫,https://tiki.vn/jean-nam-tui-tu-p74974914.html?spid=74974930,38,,Đã bán 1,VONESA
Áo sơ mi nam viền cổ đen,95.000₫,https://tiki.vn/ao-so-mi-nam-vien-co-den-p76161988.html?spid=76161994,39,,,VONESA
Áo sơ mi nam dài tay viền vai xanh đỏ họa tiết rồng,165.000,https://tiki.vn/ao-so-mi-nam-dai-tay-vien-vai-xanh-do-hoa-tiet-rong-p76165809.html?spid=76165811,40,,,VONESA
