title,price,link_item,index,discount,sales,category
ÁO KHOÁC NHẸ CÁ TÍNH TRẺ TRUNG_TB 348.4,99.000₫,https://tiki.vn/ao-khoac-nhe-ca-tinh-tre-trung_tb-348-4-p108246361.html?spid=108246363,1,,Đã bán 1,aokhoacnu
Set áo dạ Tweed cổ nơ kèm chân váy cao cấp sang trọng kiểu hàn quốc nhà Socomo B732022,450.000₫,https://tiki.vn/set-ao-da-tweed-co-no-kem-chan-vay-cao-cap-sang-trong-kieu-han-quoc-nha-socomo-b732022-p206817980.html?spid=206817988,2,-12%,,aokhoacnu
ÁO KHOÁC DẠ 2 NÚT CỔ VEST DÁNG DÀI CAO CẤP,489.000₫,https://tiki.vn/ao-khoac-da-2-nut-co-vest-dang-dai-cao-cap-p75407009.html?spid=150553317,3,-12%,,aokhoacnu
Áo khoác nữ áo khoác blazer nữ MÀU GHI XÁM MẪU MỚI NHẤT 2 lớp và có đệm vai,298.000₫,https://tiki.vn/ao-khoac-nu-ao-khoac-blazer-nu-mau-ghi-xam-mau-moi-nhat-2-lop-va-co-dem-vai-p273277189.html?spid=273277199,4,-12%,,aokhoacnu
,,https://tiki.vn/ao-khoac-chong-nang-thoi-trang-co-mu-hinh-canh-doi-chong-tia-uv-khoi-bui-p88798421.html?spid=88798427,5,-48%,,aokhoacnu
OLV - Áo khoác Carina Coat In Black,390.000₫,https://tiki.vn/olv-ao-khoac-carina-coat-in-black-p249590152.html?spid=249590154,6,-12%,,aokhoacnu
ÁO KHOÁC PHAO NỮ 3 LỚP CÓ NÓN PHONG CÁCH HIỆN ĐẠI TRẺ TRUNG,140.000₫,https://tiki.vn/ao-khoac-phao-nu-3-lop-co-non-phong-cach-hien-dai-tre-trung-p114328946.html?spid=114980004,7,-12%,Đã bán 2,aokhoacnu
ÁO KHOÁC DÙ BOMBER NAM NỮ UNISEX PHONG CÁCH TRẺ THỜI TRANG CỦA PHÁI ĐẸP,49.000₫,https://tiki.vn/ao-khoac-du-bomber-nam-nu-unisex-phong-cach-tre-thoi-trang-cua-phai-dep-p180402268.html?spid=180402310,8,-12%,,aokhoacnu
Áo Khoác Dù lửng tay phối Unisex (M150 - Ảnh thật),129.000₫,https://tiki.vn/ao-khoac-du-lung-tay-phoi-unisex-m150-anh-that-p263316090.html?spid=263316167,9,,,aokhoacnu
,,https://tiki.vn/ao-khoac-da-nguoi-gia-ngd15-p5465201.html?spid=5465217,10,,,aokhoacnu
Áo khoác hoodie Nam Nữ chất nỉ Dây kéo In OUTERITY form rộng unsiex thời trang Hottrend TP0038,59.000₫,https://tiki.vn/ao-khoac-hoodie-nam-nu-chat-ni-day-keo-in-outerity-form-rong-unsiex-thoi-trang-hottrend-tp0038-p217094922.html?spid=217094924,11,,,aokhoacnu
ÁO KHOÁC NAM NỮ CHẤT NỈ PHỐI CHỮ THIẾT KẾ TRẺ TRUNG CỰC COOL CỰC TREND UT AKS300 BAO ĐẸP,35.000₫,https://tiki.vn/ao-khoac-nam-nu-chat-ni-phoi-chu-thiet-ke-tre-trung-cuc-cool-cuc-trend-ut-aks300-bao-dep-p180402321.html?spid=180402420,12,,Đã bán 1,aokhoacnu
,,https://tiki.vn/ao-khoac-nu-phong-cach-tre-trung-kieu-dang-moi-ma-d0831-p208216840.html?spid=208216846,13,,,aokhoacnu
"Áo blazer nữ tay dài phong cách công sở, Áo Blazer Linen nữ, Chất linen cao cấp, hàng 1 lớp, 2 túi, 2 cúc ARCTIC HUNTER AH03",263.000₫,https://tiki.vn/ao-blazer-nu-ao-blazer-linen-tay-dai-phong-cach-cong-so-chat-linen-cao-cap-hang-1-lop-2-tui-2-cuc-arctic-hunter-ah03-p199058646.html?spid=199058650,14,,,aokhoacnu
"Áo khoác dạ nữ cổ tròn, dáng suông, chất dày dặn, hàng nhập cao cấp Ak34",219.000₫,https://tiki.vn/ao-khoac-da-nu-co-tron-dang-suong-chat-day-dan-hang-nhap-cao-cap-ak34-p210428059.html?spid=210428061,15,,Đã bán 1,aokhoacnu
Áo Dệt Kim Ngắn Tay Cổ Tròn Kẻ Sọc Xinh Xắn Cho Nữ ARTIC HUNTER AH42,131.000₫,https://tiki.vn/ao-det-kim-ngan-tay-co-tron-ke-soc-xinh-xan-cho-nu-artic-hunter-ah42-p195149359.html?spid=195149360,16,,,aokhoacnu
"Áo Khoác Nữ Đẹp, Áo Khoác Nữ Form Rộng, Áo Khoác Nữ Chống Nắng Chất Gân Quảng Châu Cao Cấp Dày Dặn Có Túi Trong Tay Xỏ Ngón Thương Hiệu Baw AK93 (Hình thật shop tự chụp)",150.000₫,https://tiki.vn/ao-khoac-nu-dep-ao-khoac-nu-form-rong-ao-khoac-nu-chong-nang-chat-gan-quang-chau-cao-cap-day-dan-co-tui-trong-tay-xo-ngon-thuong-hieu-baw-ak93-hinh-that-shop-tu-chup-p272280022.html?spid=272280032,17,,,aokhoacnu
,,https://tiki.vn/bo-vest-nu-cong-so-ke-soc-mau-xanh-den-cuc-thanh-lich-duki-store-p78968494.html?spid=78968587,18,,,aokhoacnu
Áo khoác kaki parka nữ lót lông Za dáng dài hàng xuất mẫu 2021 có mũ tháo lắp - AP-G01,859.000₫,https://tiki.vn/ao-khoac-kaki-parka-nu-lot-long-za-dang-dai-hang-xuat-mau-2021-co-mu-thao-lap-ap-g01-p141515893.html?spid=153651337,19,,Đã bán 1,aokhoacnu
Áo Khoác Jean Nữ Nón Trùm Tay Phối Nỉ,168.000₫,https://tiki.vn/ao-khoac-jean-nu-non-trum-tay-phoi-ni-p22051960.html?spid=48901759,20,,Đã bán 1,aokhoacnu
"Áo Blazer- Áo Vest Nữ Chất Linen Cao Cấp, Hàng Đẹp Có Túi Bz04",263.000₫,https://tiki.vn/ao-blazer-ao-vest-nu-chat-linen-cao-cap-hang-dep-co-tui-bz04-p206127333.html?spid=206127339,21,,,aokhoacnu
"Áo khoác mỏng, áo cardigan nữ vải thun mềm xẻ tà AK10",219.000₫,https://tiki.vn/ao-khoac-mong-ao-cardigan-nu-vai-thun-mem-xe-ta-ak10-p127365768.html?spid=127365774,22,,Đã bán 2,aokhoacnu
Áo chống nắng thông hơi túi cuộn cho bạn nữ THỜI TRANG,110.000₫,https://tiki.vn/ao-chong-nang-thong-hoi-tui-cuon-cho-ban-nu-thoi-trang-p86024853.html?spid=161224529,23,,,aokhoacnu
Áo khoác len gile cho người già áo khoác len trung niên nữ,299.000₫,https://tiki.vn/ao-khoac-len-gile-cho-nguoi-gia-ao-khoac-len-trung-nien-nu-p263809288.html?spid=263809292,24,,Đã bán 3,aokhoacnu
"Áo kiểu nữ, áo khoác nhẹ hoa ren cao cấp",245.000₫,https://tiki.vn/ao-kieu-nu-ao-khoac-nhe-hoa-ren-cao-cap-p248419720.html?spid=248419732,25,,Đã bán 2,aokhoacnu
,,https://tiki.vn/ao-len-cadigan-dang-ngan-cai-cuc-cho-nu-2021-mau-do-p164491545.html?spid=164491555,26,,,aokhoacnu
Áo khoác da nữ xịn sò cá tính cho nàng mạnh mẽ chất lừ hot hit thu hút ánh nhìn thời trang kim gia,249.000₫,https://tiki.vn/ao-khoac-da-nu-xin-so-ca-tinh-cho-nang-manh-me-chat-lu-hot-hit-thu-hut-anh-nhin-thoi-trang-kim-gia-p173816703.html?spid=173816709,27,,,aokhoacnu
"Áo Khoác Nỉ in Couple Baby, Chất Nỉ Bông Mịn Đẹp Áo Khoác Hoodie Zip Unisex Nam Nữ, Áo Khoác Hoodie Nỉ Bông Dây Kéo Zip Baby FACE SMILE Form rộng Unisex Nam Nữ Cá Tính Ulzzang KUN",102.000₫,https://tiki.vn/ao-khoac-ni-in-couple-baby-chat-ni-bong-min-dep-ao-khoac-hoodie-zip-unisex-nam-nu-p136581729.html?spid=136581883,28,,Đã bán 35,aokhoacnu
Áo Khoác Cardigan Hàn Quốc Thêu Sắc Nét -Chất NỈ Ngoại Form Unisex Nam Nữ Mặc Cặp thoitrangsihienlinh,90.000₫,https://tiki.vn/ao-khoac-cardigan-han-quoc-theu-sac-net-chat-ni-ngoai-form-unisex-nam-nu-mac-cap-thoitrangsihienlinh-p108364902.html?spid=127123051,29,,Đã bán 22,aokhoacnu
"Áo Hoodie Nỉ Unisex Form Rộng Xanh Rêu EIGHT Hot Trend, Áo khoác hoodie xanh rêu EIGHT chống nắng vải nỉ lót bông nam nữ unisex, Áo thun tay nối form rộng chữ in vải mềm mịn",150.000₫,https://tiki.vn/ao-hoodie-ni-unisex-form-rong-xanh-reu-eight-hot-trend-ao-khoac-hoodie-xanh-reu-eight-chong-nang-vai-ni-lot-bong-nam-nu-unisex-ao-thun-tay-noi-form-rong-chu-in-vai-mem-min-p270068783.html?spid=270803565,30,,Đã bán 1,aokhoacnu
,,https://tiki.vn/ao-khoac-nu-cham-bi-phuc-an-4033-p8058340.html?spid=8058364,31,,,aokhoacnu
ÁO KHOÁC DẠ DÁNG DÀI BIGSIZE CHO NGƯỜI BÉO MẬP_TB 138,819.000₫,https://tiki.vn/ao-khoac-da-dang-dai-bigsize-cho-nguoi-beo-map_tb-138-p195749227.html?spid=195749239,32,,,aokhoacnu
ÁO KHOÁC DẠ CAO CẤP,550.000₫,https://tiki.vn/ao-khoac-da-cao-cap-p45292441.html?spid=45292447,33,,,aokhoacnu
ÁO KHOÁC LÔNG CỔ TRỤ CHIPI MỀM MỊN ĐẸP ẤM,119.000₫,https://tiki.vn/ao-khoac-long-co-tru-chipi-mem-min-dep-am-p193858691.html?spid=193858699,34,,Đã bán 2,aokhoacnu
"Áo khoác len, áo cardigan len nữ 2 túi xẻ tà nhiều màu Haint Boutique HB15",219.000₫,https://tiki.vn/ao-khoac-len-ao-cardigan-len-nu-2-tui-xe-ta-nhieu-mau-haint-boutique-hb15-p72331718.html?spid=72331724,35,,Đã bán 14,aokhoacnu
,,https://tiki.vn/a-o-khoa-c-dirtycoins-love-corduroy-shirt-jacket-brown-p263494442.html?spid=263494446,36,,,aokhoacnu
Áo Sweater - Áo Khoác Nỉ Nam Nữ Unisex 20INCH 3 Màu,112.000₫,https://tiki.vn/ao-sweater-ao-khoac-ni-nam-nu-unisex-20inch-3-mau-p87217905.html?spid=87217907,37,,Đã bán 7,aokhoacnu
"Áo khoác hoodie chống nắng 123SHOP dành cho nam nữ Thuê Trái Tim, Nỉ ngoại form rộng Có Dây Kéo unisex ulzzang",100.000₫,https://tiki.vn/ao-khoac-hoodie-chong-nang-123shop-danh-cho-nam-nu-thue-trai-tim-ni-ngoai-form-rong-co-day-keo-unisex-ulzzang-p84471379.html?spid=84471409,38,,Đã bán 15,aokhoacnu
ÁO VEST BLAZER PHỐI SỌC,189.000₫,https://tiki.vn/ao-vest-blazer-phoi-soc-p40939641.html?spid=40939657,39,,Đã bán 155,aokhoacnu
Áo Khoác Nữ Xỏ Ngón Comfort Dây Kéo Túi Màu,174.600₫,https://tiki.vn/ao-khoac-nu-xo-ngon-comfort-day-keo-tui-p8067870.html?spid=8067954,40,,Đã bán 133,aokhoacnu
