title,price,link_item,index,discount,sales,category
Set áo vest blazer nữ + chân váy ngắn xếp ly - SV01 - WFStudios,549.000₫,https://tiki.vn/set-ao-vest-blazer-nu-chan-vay-ngan-xep-ly-sv01-wfstudios-p140212782.html?spid=140212806,1,,Đã bán 27,aokhoacnu
Áo len nữ cộc tay hến 9 màu lựa chọn,89.000₫,https://tiki.vn/ao-len-nu-coc-tay-hen-9-mau-lua-chon-p270068509.html?spid=270068517,2,-12%,Đã bán 6,aokhoacnu
"Áo Khoác Nỉ Cinder Chất Nỉ Ngoại Siêu Mịn, Áo Khoác Hoodie Zip Cinder Basic Kéo Khóa, Áo Hoodie Zip Nam Nữ Form Rộng In Lụa Cao Cấp",99.000₫,https://tiki.vn/ao-khoac-ni-cinder-chat-ni-ngoai-sieu-min-ao-khoac-hoodie-zip-cinder-basic-keo-khoa-ao-hoodie-zip-nam-nu-form-rong-in-lua-cao-cap-p196812234.html?spid=196812244,3,-34%,Đã bán 8,aokhoacnu
Áo Blazer công sở Áo vest nữ đẹp áo vest kiểu hàn đẹp kiểu hàn quốc,241.000₫,https://tiki.vn/ao-blazer-cong-so-ao-vest-nu-dep-ao-vest-kieu-han-dep-kieu-han-quoc-p249385020.html?spid=249385022,4,-34%,Đã bán 1,aokhoacnu
,,https://tiki.vn/ao-len-nu-body-chat-len-mem-min-co-gau-cach-dieu-hang-nhap-quang-chau-p129820842.html?spid=129820858,5,,,aokhoacnu
Áo khoác kaki ulzzang mịn mát,77.800₫,https://tiki.vn/ao-khoac-kaki-ulzzang-min-mat-p68643196.html?spid=69839368,6,,Đã bán 1,aokhoacnu
Áo Khoác Nữ Form Rộng Thêu Logo Bò Sữa COW Vải Nhung Gân Phong Cách Ulzzang,158.000₫,https://tiki.vn/ao-khoac-nu-form-rong-theu-logo-bo-sua-cow-vai-nhung-gan-phong-cach-ulzzang-p178542201.html?spid=196305780,7,,Đã bán 4,aokhoacnu
Áo len cổ cao viền kẻ,199.000₫,https://tiki.vn/ao-len-co-cao-vien-ke-p207746705.html?spid=207746713,8,,,aokhoacnu
"Áo Khoác Vest, Blazer Nữ NA23 Sọc Caro Cao Cấp có đệm vai",278.000₫,https://tiki.vn/ao-khoac-vest-blazer-nu-na23-soc-caro-cao-cap-co-dem-vai-p269958387.html?spid=269958395,9,,Đã bán 5,aokhoacnu
,,https://tiki.vn/ao-khoac-det-kim-mua-thu-va-mua-dong-phong-cach-han-quoc-ma-1180-p200724599.html?spid=200724601,10,,,aokhoacnu
"Áo khoác zip nỉ lót bông form rộng EATILEXD unisex (nam nữ mặc được), áo khoác nỉ hoodie dây kéo in ngôi sao full áo, Áo Khoác nỉ EATILEXD (Ảnh shop tự chụp)",119.000₫,https://tiki.vn/ao-khoac-zip-ni-lot-bong-form-rong-eatilexd-unisex-nam-nu-mac-duoc-ao-khoac-ni-hoodie-day-keo-in-ngoi-sao-full-ao-ao-khoac-ni-eatilexd-anh-shop-tu-chup-p205618207.html?spid=205618216,11,,Đã bán 19,aokhoacnu
Áo khoác da khóa kéo lót lông xinh,379.000₫,https://tiki.vn/ao-khoac-da-khoa-keo-lot-long-xinh-p146596705.html?spid=160874562,12,,,aokhoacnu
,,https://tiki.vn/vest-bo-thoi-trang-cong-so-nu-p253572361.html?spid=253572382,13,,,aokhoacnu
"Áo khoác len nữ, áo cardigan nữ xẻ tà mẫu mới DV15",249.000₫,https://tiki.vn/ao-khoac-cardigan-nu-xe-ta-mau-moi-dv15-p125858279.html?spid=125858281,14,,Đã bán 3,aokhoacnu
"Áo khoác nhung nữ , áo khoác nữ kiểu croptop vải nhung túi hộp , hàng chuẩn shop",165.000₫,https://tiki.vn/ao-khoac-nhung-nu-ao-khoac-nu-kieu-croptop-vai-nhung-tui-hop-hang-chuan-shop-p90070163.html?spid=91326413,15,,Đã bán 10,aokhoacnu
Áo Khoác Thun Nỉ Hoodie FASHION In Hình UNOFFICIAL Dáng Rộng Nam Nữ Nón 2 Lớp Chuẩn Form Freesize Dưới 70Kg,128.000₫,https://tiki.vn/ao-khoac-thun-ni-hoodie-fashion-in-hinh-unofficial-dang-rong-nam-nu-non-2-lop-chuan-form-freesize-duoi-70kg-p109359164.html?spid=109359175,16,,Đã bán 7,aokhoacnu
ÁO KHOÁC PHAO NỮ MŨ LÔNG PHONG CÁCH HÀN QUỐC,576.000₫,https://tiki.vn/ao-khoac-phao-nu-mu-long-phong-cach-han-quoc-p103344585.html?spid=129875189,17,,,aokhoacnu
,,https://tiki.vn/ao-phao-beo-nu-co-mu-vien-long-ao-khoac-phao-nu-thu-dong-bo-tay-3-mau-p141347597.html?spid=148541896,18,,,aokhoacnu
"Áo khoác hoodie trơn nam nữ form rộng Yinxx, áo nỉ hoodie zip unisex HDZ800",100.000₫,https://tiki.vn/ao-khoac-hoodie-tron-nam-nu-form-rong-yinxx-ao-ni-hoodie-zip-unisex-hdz800-p145557128.html?spid=182842634,19,,Đã bán 7,aokhoacnu
ÁO KHOÁC JEAN CÓ NÓN (NÓN THÁO RỜI TỰ DO ),262.500₫,https://tiki.vn/ao-khoac-jean-co-non-non-thao-roi-tu-do-p117000283.html?spid=117000314,20,,,aokhoacnu
"Áo Dệt Kim, Áo Len Dài Tay Dáng Rộng Cổ Trofn Pha Ren Thời Trang Hàn Quốc Cho Nữ Mùa Thu Đông Haint Boutique",175.000₫,https://tiki.vn/ao-det-kim-ao-len-dai-tay-dang-rong-co-trofn-pha-ren-thoi-trang-han-quoc-cho-nu-mua-thu-dong-haint-boutique-p194963453.html?spid=194963454,21,,Đã bán 1,aokhoacnu
Áo Khoác Bomber Nam Nữ - Áo Khoác Nỉ Uniex hoodie  phối màu Siêu Hot -( kèm ảnh,122.000₫,https://tiki.vn/ao-khoac-bomber-nam-nu-ao-khoac-ni-uniex-hoodie-phoi-mau-sieu-hot-kem-anh-p152842331.html?spid=153489226,22,,Đã bán 1,aokhoacnu
"Áo khoác gió cao cấp 2 lớp , chất gió bạc , chống nước , chống gió",211.250₫,https://tiki.vn/ao-khoac-gio-cao-cap-2-lop-chat-gio-bac-chong-nuoc-chong-gio-p124707998.html?spid=124708050,23,,Đã bán 7,aokhoacnu
"Áo gió nữ dáng Mangto- Hàng cao cấp, dài tới gối ,vải gió xước, chống thấm, chống mốc, cản bụi, giữ nhiệt, thời trang, sang trọng",2.200.000₫,https://tiki.vn/ao-gio-nu-dang-mangto-hang-cao-cap-dai-toi-goi-vai-gio-xuoc-chong-tham-chong-moc-can-bui-giu-nhiet-thoi-trang-sang-trong-p68574055.html?spid=68574073,24,,Đã bán 10,aokhoacnu
"Áo khoác vest nữ cổ lụa ngắn tay lỡ, blazer nữ công sở form suông thiết kế trẻ trung chất tuyết mưa màu đen trắng xanh dễ phối đồ đi chơi dạo phố sự kiện tiệc cưới lễ hội",400.000₫,https://tiki.vn/ao-khoac-vest-nu-co-lua-ngan-tay-lo-blazer-nu-cong-so-form-suong-thiet-ke-tre-trung-chat-tuyet-mua-mau-den-trang-xanh-de-phoi-do-di-choi-dao-pho-su-kien-tiec-cuoi-le-hoi-p193099510.html?spid=193099534,25,,Đã bán 18,aokhoacnu
,,https://tiki.vn/ao-khoac-nu-ao-paka-tran-long-lot-long-cuu-tui-cheo-co-day-rut-eo-p154190315.html?spid=162597797,26,,,aokhoacnu
"Áo Vest Blazer nữ dáng lửng tay lỡ ve chồng, chất vải Linen Premium, thời trang phong cách trẻ",280.000₫,https://tiki.vn/ao-vest-blazer-nu-dang-lung-tay-lo-ve-chong-chat-vai-linen-premium-thoi-trang-phong-cach-tre-lahstore-p206335846.html?spid=206335850,27,,,aokhoacnu
Áo khoác nữ slim 4 túi dây kéo 4044_Den,200.000₫,https://tiki.vn/ao-khoac-nu-slim-4-tui-day-keo-4044_den-p5981171.html?spid=5981175,28,,Đã bán 83,aokhoacnu
ÁO SWEATER TRƠN UNISEX NAM NỮ (NHIỀU MÀU),85.000₫,https://tiki.vn/ao-sweater-tron-unisex-nam-nu-nhieu-mau-p164986982.html?spid=189673535,29,,Đã bán 5,aokhoacnu
(Có sẵn) Mã WAMT10K giảm ngay 10k cho đơn bất kì Áo khoác len cài nút gỗ ulzzang áo len dày nón giả phong cách hàn,208.000₫,https://tiki.vn/ao-khoac-len-cai-nut-go-ulzzang-ao-len-day-non-gia-phong-cach-han-p94658902.html?spid=94658908,30,,Đã bán 7,aokhoacnu
,,https://tiki.vn/ao-khoac-hoodie-form-rong-den-khoa-keo-sieu-hot-danh-cho-nam-va-nu-hang-co-san-p249248654.html?spid=249248684,31,,,aokhoacnu
ÁO KHOÁC DẠ NỮ MĂNG TÔ,660.000₫,https://tiki.vn/ao-khoac-da-nu-mang-to-p73623038.html?spid=73623058,32,,Đã bán 8,aokhoacnu
Áo khoác nữ Kaki hàn quốc cao cấp Áo mangto ( măng tô ) 2 lớp dày dặn dáng ngắn form rộng siêu ấm vào mùa đông siêu rẻ trẻ đẹp nhất,449.000₫,https://tiki.vn/ao-khoac-nu-kaki-han-quoc-cao-cap-ao-mangto-mang-to-2-lop-day-dan-dang-ngan-form-rong-sieu-am-vao-mua-dong-sieu-re-tre-dep-nhat-p154474005.html?spid=154474007,33,,,aokhoacnu
ÁO SWEATER UNISEX IN LOGO LY NƯỚC (NHIỀU MÀU),88.000₫,https://tiki.vn/ao-sweater-unisex-in-logo-ly-nuoc-nhieu-mau-p164985736.html?spid=164986524,34,,Đã bán 40,aokhoacnu
Áo khoác nỉ kiểu dáng hoodie form nữ viền kẻ phom rộng 3 màu,98.000₫,https://tiki.vn/ao-khoac-ni-kieu-dang-hoodie-form-nu-vien-ke-phom-rong-3-mau-p141260870.html?spid=145759904,35,,Đã bán 14,aokhoacnu
,,https://tiki.vn/ao-hoodie-chu-nguc-harsii-from-rong-tay-bong-ao-hoodie-unisex-form-rong-p191426435.html?spid=252658833,36,,,aokhoacnu
"Áo khoác blazer, áo vest nữ kiểu Hàn Quốc tay lỡ, chất vải đẹp, nhiều màu Blz04 - Thời trang công sở WFstudios",365.000₫,https://tiki.vn/ao-khoac-blazer-ao-vest-nu-kieu-han-quoc-tay-lo-chat-vai-dep-nhieu-mau-blz04-thoi-trang-cong-so-wfstudios-p145575913.html?spid=145575940,37,,Đã bán 58,aokhoacnu
( HÀNG SẴN)Áo Khoác Phao Dáng Dài Mũ Trùm Đầu Trung Niên Sang Trọng AK121 - Hàng Quảng Châu Cao Cấp,545.000₫,https://tiki.vn/hang-san-ao-khoac-phao-dang-dai-mu-trum-dau-trung-nien-sang-trong-ak121-hang-quang-chau-cao-cap-p86882350.html?spid=86882371,38,,Đã bán 5,aokhoacnu
ÁO PHAO NỮ CHẦN BÔNG 3 LỚP CỔ CAO,648.700₫,https://tiki.vn/ao-phao-nu-chan-bong-3-lop-co-cao-p83519093.html?spid=83519298,39,,Đã bán 1,aokhoacnu
Áo khoác nữ kẻ sọc hàn quốc cao cấp Áo mangto ( măng tô ) 2 lớp dày dặn dáng ngắn form rộng siêu ấm vào mùa đông siêu rẻ trẻ đẹp nhất,449.000₫,https://tiki.vn/ao-khoac-nu-ke-soc-han-quoc-cao-cap-ao-mangto-mang-to-2-lop-day-dan-dang-ngan-form-rong-sieu-am-vao-mua-dong-sieu-re-tre-dep-nhat-p154489900.html?spid=154489902,40,,Đã bán 2,aokhoacnu
