title,price,link_item,index,discount,sales,category
"Áo Khoác Dù Thỏ 7 Màu Siêu Đẹp (HotTrend) (Kèm Video, Hình Thật), áo khoác dù nam nữ couple đều mặc được",96.000₫,https://tiki.vn/cm-ao-khoac-du-tho-7-mau-sieu-dep-hottrend-kem-video-hinh-that-p127351763.html?spid=127351792,1,-12%,,aokhoacnu
Áo Cardigan Nỉ Bông Dày Dặn Form Rộng Siêu Đẹp Áo Khoác Cardigan Nữ Chất Thun Cotton FLORAL FUN,96.000₫,https://tiki.vn/ao-cardigan-ni-bong-day-dan-form-rong-sieu-dep-ao-khoac-cardigan-nu-chat-thun-cotton-floral-fun-ak3374-p127352833.html?spid=127352857,2,-12%,Đã bán 2,aokhoacnu
Áo khoác Blazer Vest họa tiết phản quang ulzzang Korea,439.000₫,https://tiki.vn/ao-khoac-blazer-vest-hoa-tiet-phan-quang-ulzzang-korea-p144220807.html?spid=144220808,3,-12%,,aokhoacnu
OLV - Áo khoác Sadia Cardigan,390.000₫,https://tiki.vn/olv-a-o-khoa-c-sadia-cardigan-p208687086.html?spid=208687088,4,-19%,,aokhoacnu
,,https://tiki.vn/ao-jacket-kaki-dang-dai-jacklane-ao-khoac-dai-tay-unisex-jack-lane-p160516410.html?spid=160516425,5,,,aokhoacnu
Áo khoác Hoodie Nỉ FRIEN Unisex Form Rộng phong cách Hàn Quốc,95.000₫,https://tiki.vn/ao-khoac-hoodie-ni-frien-unisex-form-rong-phong-cach-han-quoc-sayhey-clothing-p195708753.html?spid=195708758,6,,,aokhoacnu
"Áo Hoodie - Khoác Nỉ Ngoại Có Nón Mũ Chữ ALAPAMA - Cặp Đôi Nam Nữ Chống Nắng , Lạnh - Form Rộng Unisex Hàn Quốc Đẹp",93.000₫,https://tiki.vn/ao-hoodie-khoac-ni-ngoai-co-non-mu-chu-alapama-cap-doi-nam-nu-chong-nang-lanh-form-rong-unisex-han-quoc-dep-p193066969.html?spid=193372651,7,,,aokhoacnu
Áo Khoác Hoodie Zip ABC Form Rộng Oversize Unisex Vải Nỉ,109.000₫,https://tiki.vn/ao-khoac-hoodie-zip-abc-form-rong-oversize-unisex-vai-ni-yowol-sg-p200854106.html?spid=200854118,8,,,aokhoacnu
Áo len mỏng nữ thu đông cổ tim tay cánh rơi - Xám,99.000₫,https://tiki.vn/ao-len-mong-nu-thu-dong-co-tim-tay-canh-roi-lahstore-xam-p199544863.html?spid=199544864,9,,Đã bán 1,aokhoacnu
,,https://tiki.vn/ao-sweater-rong-ao-khoac-ni-ngoai-nu-sanh-dieu-in-chu-paean-sieu-hot-at-p203455536.html?spid=203455537,10,,,aokhoacnu
Áo khoác nỉ nữ chất nỉ dày dặn nón rộng logo in chữ ARP có 2 màu nâu kem thích hợp đi học đi chơi,89.000₫,https://tiki.vn/ao-khoac-ni-nu-chat-ni-day-dan-non-rong-logo-in-chu-arp-co-2-mau-nau-kem-thich-hop-di-hoc-di-choi-p202595865.html?spid=202595877,11,,Đã bán 2,aokhoacnu
Áo khoác dù Jacket ATYS màu đen phối xám form rộng unisex nam nữ,119.000₫,https://tiki.vn/ao-khoac-du-jacket-atys-mau-den-phoi-xam-form-rong-unisex-nam-nu-p185712927.html?spid=202769573,12,,,aokhoacnu
,,https://tiki.vn/a-o-khoa-c-ni-logo-prod-cha-t-lie-u-2-chat-form-to-ro-ng-khoa-ke-o-ao-khoac-hoodie-zip-jacket-prod-maker-original-day-keo-form-rong-nam-nu-vai-ni-bong-ulzzang-anh-that-co-san-p205192265.html?spid=205192281,13,,,aokhoacnu
"Áo khoác nữ , áo khoác áo hoodie nam nữ mặc chữ POWR vải nỉ ngoại dày mịn",100.000₫,https://tiki.vn/ao-khoac-nu-ao-khoac-ao-hoodie-nam-nu-mac-chu-powr-vai-ni-ngoai-day-min-p90065969.html?spid=210154505,14,,Đã bán 1,aokhoacnu
"Áo khoác nỉ ngoại form rộng 2 nón in gấu SATURD, Áo khoác dây kéo nữ freesize dưới 65kg",97.000₫,https://tiki.vn/ao-khoac-ni-ngoai-form-rong-2-non-in-gau-saturd-ao-khoac-day-keo-nu-freesize-duoi-65kg-p204250455.html?spid=212568506,15,,,aokhoacnu
Áo Khoác Hoodie Zip ONE Form Rộng Oversize Unisex Vải Chân Cua - Yowol SG,97.000₫,https://tiki.vn/ao-khoac-hoodie-zip-one-form-rong-oversize-unisex-vai-chan-cua-yowol-sg-p202422388.html?spid=212561072,16,,,aokhoacnu
"Áo Khoác Dù Có Nón 2 Lớp Form Rộng Nam Nữ Hoạ Tiết CAMPING [ẢNH THẬT] Phối Màu Có Túi Trong Unisex, Áo khoác dù in CAMPING WHAT (Ảnh shop tự chụp), [sẵn] Áo Khoác Dù Dài Tay Camping 2 Màu",99.000₫,https://tiki.vn/ao-khoac-du-co-non-2-lop-form-rong-nam-nu-hoa-tiet-camping-anh-that-phoi-mau-co-tui-trong-unisex-ao-khoac-du-in-camping-what-anh-shop-tu-chup-san-ao-khoac-du-dai-tay-camping-2-mau-p252098945.html?spid=252098955,17,,,aokhoacnu
,,https://tiki.vn/ao-khoac-hoodies-nam-nu-kieu-trong-dau-logo-theu-dessuu-phoi-mau-thoi-trang-p270506727.html?spid=270506745,18,,,aokhoacnu
"Áo phao béo nữ hàng Việt Nam cai cấp loại1 , chất dày ấm mặc siêu xinh",450.000₫,https://tiki.vn/ao-phao-beo-nu-hang-viet-nam-cai-cap-loai1-chat-day-am-mac-sieu-xinh-p154192550.html?spid=272564361,19,,,aokhoacnu
Áo Khoác Nỉ Unisex Phúc An - Xanh Đen,160.000₫,https://tiki.vn/ao-khoac-ni-unisex-phuc-an-xanh-den-p301788.html?spid=2773849,20,,Đã bán 7,aokhoacnu
áo khoác blazer cảo nhà XOài dư xịn,520.000₫,https://tiki.vn/ao-khoac-blazer-cao-nha-xoai-du-xin-p270467212.html?spid=270467213,21,,,aokhoacnu
Áo Chống Nắng GU Chất Vải Kim Cương Chống Tia UV Co Dãn 4 Chiều Siêu Thoáng Mát ANA101,119.000₫,https://tiki.vn/ao-cho-ng-na-ng-gu-cha-t-va-i-kim-cuong-cho-ng-tia-uv-co-da-n-4-chie-u-sieu-thoa-ng-ma-t-ana101-p116104918.html?spid=116104979,22,,,aokhoacnu
"Áo Blazer nữ, Áo vest nữ, dáng dài, dài tay, form vest ôm eo, nút kim loại - Blazer Scorpi B08",899.000₫,https://tiki.vn/ao-blazer-nu-ao-vest-nu-dang-dai-dai-tay-form-vest-om-eo-nut-kim-loai-blazer-scorpi-b08-p263413484.html?spid=263413502,23,,,aokhoacnu
Áo Khoác Cardigan Nữ Cao Cấp HATI,298.000₫,https://tiki.vn/ao-khoac-cardigan-nu-cao-cap-hati-p72137507.html?spid=72137525,24,,Đã bán 6,aokhoacnu
Áo khoác vest blazer nữ cao cấp NA38,408.000₫,https://tiki.vn/ao-khoac-vest-blazer-nu-cao-cap-na38-p16525501.html?spid=52127501,25,,Đã bán 23,aokhoacnu
,,https://tiki.vn/ao-khoac-vest-nu-sang-trong-hati-001-p52136184.html?spid=52136188,26,,,aokhoacnu
Áo Khoác Vest Jean Nữ Cổ Bẻ Phối Túi Thanh Lịch,178.000₫,https://tiki.vn/ao-khoac-vest-jean-nu-co-be-phoi-tui-thanh-lich-p23203107.html?spid=59279203,27,,Đã bán 12,aokhoacnu
áo nắng thời trang - thanh phúc shop,150.000₫,https://tiki.vn/ao-nang-thoi-trang-thanh-phuc-shop-p271983118.html?spid=271983228,28,,,aokhoacnu
ÁO KAKI LÓT LÔNG DÂY RÚT EO PHONG CÁCH HÀN QUỐC MŨ LÔNG ĐẸP,437.500₫,https://tiki.vn/ao-kaki-lot-long-day-rut-eo-phong-cach-han-quoc-mu-long-dep-p114292324.html?spid=114292573,29,,,aokhoacnu
Hoodie - Áo Hoodie Form Rộng Unisex Chất Nỉ Bông In Chữ THỎ TRÁI TIM Nam Nữ Mặc Đều Được,126.000₫,https://tiki.vn/hoodie-ao-hoodie-form-rong-unisex-chat-ni-bong-in-chu-tho-trai-tim-nam-nu-mac-deu-duoc-p272725655.html?spid=272725665,30,,,aokhoacnu
,,https://tiki.vn/ao-khoac-phao-nu-co-long-sang-trong-hati-akp999-p43896098.html?spid=43896114,31,,,aokhoacnu
ÁO KHOÁC LEN DỆT KIM SANG TRONG_áo len nữ họa tiết thổ cẩm hàng quảng châu cao cấp,219.000₫,https://tiki.vn/ao-khoac-len-det-kim-sang-trong_ao-len-nu-hoa-tiet-tho-cam-hang-quang-chau-cao-cap-p116005849.html?spid=144096277,32,,Đã bán 11,aokhoacnu
"Áo blazer nữ công sở họa tiết trơn, thiết kế 2 túi xinh, lên chuẩn form CS04",263.000₫,https://tiki.vn/ao-blazer-nu-cong-so-hoa-tiet-tron-thiet-ke-2-tui-xinh-len-chuan-form-cs04-p198958695.html?spid=198958707,33,,,aokhoacnu
"Áo blazer nữ, áo khoác vest công sở đóng cúc, kiểu dáng cơ bản, chất linen bột đẹp CS04",263.000₫,https://tiki.vn/ao-blazer-nu-ao-khoac-vest-cong-so-dong-cuc-kieu-dang-co-ban-chat-linen-bot-dep-cs04-p199262649.html?spid=199262663,34,,,aokhoacnu
ÁO CHỐNG NẮNG TOÀN THÂN CARDINA NỮ - BC9 - XL,404.000₫,https://tiki.vn/ao-chong-nang-toan-than-cardina-nu-bc9-xl-p82502656.html?spid=87104555,35,,Đã bán 1,aokhoacnu
,,https://tiki.vn/ao-nhung-co-voan-dinh-cuc-tieu-thu-sieu-xinh-futuristix-a498-p179549334.html?spid=179549337,36,,,aokhoacnu
ÁO KHOÁC OTIS CLUB HOODIE FULL LOGO,350.000₫,https://tiki.vn/ao-khoac-otis-club-hoodie-full-logo-p174648881.html?spid=174648898,37,,,aokhoacnu
"Áo khoác gió coach Track Jacket 2 lớp, nam nữ unisex, form rộng",499.000₫,https://tiki.vn/ao-khoac-gio-coach-track-jacket-2-lop-nam-nu-unisex-form-rong-p222327773.html?spid=222327842,38,,,aokhoacnu
Áo phao mũ lông Áo phao béo nữ Quảng Châu lông mũ tháo rời hàng L1,420.000₫,https://tiki.vn/ao-phao-mu-long-ao-phao-beo-nu-quang-chau-long-mu-thao-roi-hang-l1-p190238201.html?spid=190238221,39,,,aokhoacnu
"Áo ren, Áo kimono Đi Biển,Áo Choàng Kimono Đi Biển Áo Khoác Voan Kimono Đi Biển Đi Chơi",189.000₫,https://tiki.vn/a-o-ren-ao-kimono-di-bie-n-ao-choang-kimono-di-bien-ao-khoac-voan-kimono-di-bien-di-choi-p115439905.html?spid=115439950,40,,,aokhoacnu
