title,price,link_item,index,discount,sales,brand
Bột rửa chén FINISH hương chanh 2.5kg - Dành cho máy rửa chén - Nhập khẩu từ Đức,558.639₫,https://tiki.vn/bot-rua-chen-finish-huong-chanh-2-5kg-danh-cho-may-rua-chen-nhap-khau-tu-duc-p118285434.html?spid=189595640,1,-30%,,finish
Bột rửa bát Finish hương chanh 2.5kg,529.916₫,https://tiki.vn/bot-rua-bat-finish-huong-chanh-2-5kg-p121315427.html?spid=127599379,2,,Đã bán 8,finish
Combo Viên rửa bát finish Quantum Ultimate 50 Viên + muối rửa bát finish 1.2kg + nước làm bóng finish 40ml dùng cho Máy rửa bát chén ( combo finish rửa bát cao cấp nhất hiện nay ),549.000₫,https://tiki.vn/combo-vien-rua-bat-finish-quantum-ultimate-50-vien-muoi-rua-bat-finish-1-2kg-nuoc-lam-bong-finish-40ml-dung-cho-may-rua-bat-chen-combo-finish-rua-bat-cao-cap-nhat-hien-nay-p215542087.html?spid=217740595,3,,Đã bán 20,finish
Viên rửa bát Finish Classic hương chanh 110 viên - 2 chức năng,359.000,https://tiki.vn/vien-rua-bat-finish-classic-huong-chanh-110-vien-2-chuc-nang-p205486074.html?spid=141656127,4,,Đã bán 4,finish
,,https://tiki.vn/combo-vien-rua-bat-finish-classic-120-vien-muoi-finish-1-5kg-nuoc-lam-bong-finish-750ml-p141582859.html?spid=146870199,5,,,finish
Tinh dầu khử mùi hương chanh Finish EU,99.000₫,https://tiki.vn/tinh-dau-khu-mui-huong-chanh-finish-eu-p102539027.html?spid=103824355,6,,Đã bán 4,finish
Nước làm bóng Finish (Dầu bóng Finish) chai 750ml,135.000₫,https://tiki.vn/nuoc-lam-bong-finish-dau-bong-finish-chai-750ml-p122910188.html?spid=126244629,7,,Đã bán 3,finish
"Bột rửa bát Finish 4,5 kg + muối rửa bát Finish 1,2 kg + nuớc làm bóng Finish 400ml (Đức )",788.999₫,https://tiki.vn/bot-rua-bat-finish-4-5-kg-muoi-rua-bat-finish-1-2-kg-nuoc-lam-bong-finish-400ml-duc-p121327208.html?spid=174619485,8,,,finish
Viên rửa bát Finish Quantum max túi 60 viên,259.000,https://tiki.vn/vien-rua-bat-finish-quantum-max-tui-60-vien-p206254447.html?spid=273307646,9,,,finish
,,https://tiki.vn/muoi-rua-chen-finish-dishwasher-salt-1-5kg-qt017383-p58845582.html?spid=148856382,10,,,finish
Gel rửa chén bát hữu cơ sinh học Finish Eco 0%,355.115₫,https://tiki.vn/gel-rua-chen-bat-huu-co-sinh-hoc-finish-eco-0-p182754591.html?spid=188095740,11,,,finish
Viên rửa bát Finish Classic - 100 viên / hộp (Hương Chanh),289.900,https://tiki.vn/vien-rua-bat-finish-classic-100-vien-hop-huong-chanh-p85271568.html?spid=103823984,12,,,finish
,,https://tiki.vn/combo-vien-ve-sinh-may-rua-chen-bat-finish-vi-3-vien-tinh-dau-treo-khu-mui-may-rua-chen-finish-p206303640.html?spid=125756487,13,,,finish
"Combo Gel rửa bát finsih Eco 900ml + Nước làm bóng bát Finish Eco 400ml + Muối rửa bát chén 1,5kg",589.999₫,https://tiki.vn/combo-gel-rua-bat-finsih-eco-900ml-nuoc-lam-bong-bat-finish-eco-400ml-muoi-rua-bat-chen-1-5kg-p206294726.html?spid=141655772,14,,Đã bán 6,finish
"Combo Bột Rửa Bát Finish Nhật 2,2kg + Bóng Finish 400ml + Muối Finish 1,2kg",608.978₫,https://tiki.vn/combo-bot-rua-bat-finish-nhat-2-2kg-bong-finish-400ml-muoi-finish-1-2kg-p53088383.html?spid=188119856,15,,Đã bán 2,finish
Bột rửa bát Finish 2.5kg dùng cho Máy rửa bát chén tặng túi zip 3 kẹo Senjaku Nhật Bản,559.000₫,https://tiki.vn/bot-rua-bat-finish-2-5kg-dung-cho-may-rua-bat-chen-tang-tui-zip-3-keo-senjaku-nhat-ban-p67731846.html?spid=206146370,16,,,finish
"Nước làm bóng và khô chén, đĩa Finish Dishwasher Rinse Aid Shinier & Drier Dishes Lemon Sparkle 800ml QT004996 - hương chanh",159.000,https://tiki.vn/nuoc-lam-bong-va-kho-chen-dia-finish-dishwasher-rinse-aid-shinier-drier-dishes-lemon-sparkle-800ml-qt004996-huong-chanh-p58956213.html?spid=206146313,17,,,finish
,,https://tiki.vn/vien-rua-chen-bat-finish-all-in-one-max-48-vien-dung-cho-may-rua-bat-chen-p206295972.html?spid=272892030,18,,,finish
Viên rửa chén Finish hàng Đức 90 viên classic,299.000₫,https://tiki.vn/vien-rua-chen-finish-hang-duc-90-vien-classic-p207933076.html?spid=141655447,19,,,finish
Combo Nước rửa bát Finish 1.5L + Muối Finish 1.2kg + Nước làm bóng bát Finish 750ml000,149.000₫,https://tiki.vn/combo-nuoc-rua-bat-finish-1-5l-muoi-finish-1-2kg-nuoc-lam-bong-bat-finish-750ml000-p134760870.html?spid=134760880,20,,,finish
Muối rửa bát Finish hộp 4kg - Nhập Khẩu EU,169.000₫,https://tiki.vn/muoi-rua-bat-finish-hop-4kg-nhap-khau-eu-p134760665.html?spid=214494245,21,,Đã bán 11,finish
Viên rửa chén bát Finish Quantum Max 60 viên hương táo chanh,368.507₫,https://tiki.vn/vien-rua-chen-bat-finish-quantum-max-60-vien-huong-tao-chanh-p127459369.html?spid=181910475,22,,Đã bán 2,finish
Combo Muối rửa bát Finish 1.5kg+ Bột rửa bát Finish 2.5kg+ Bóng finish 400ml (NK EU ),799.000₫,https://tiki.vn/combo-muoi-rua-bat-finish-1-5kg-bot-rua-bat-finish-2-5kg-bong-finish-400ml-nk-eu-p122910514.html?spid=126096739,23,,,finish
"Nước làm bóng và khô bát, đĩa Finish Dishwasher Rinse & Shine Aid Regular 400ml QT017391, nước trợ xả máy rửa bát",133.113₫,https://tiki.vn/nuoc-lam-bong-va-kho-bat-dia-finish-dishwasher-rinse-shine-aid-regular-400ml-qt017391-nuoc-tro-xa-may-rua-bat-p186690578.html?spid=188229002,24,,,finish
Nước làm bóng Finish 750ml,45.100₫,https://tiki.vn/nuoc-lam-bong-finish-750ml-p134760260.html?spid=141655822,25,,,finish
,,https://tiki.vn/vien-rua-bat-finish-quantum-max-tui-60-vien-p121327160.html?spid=126245866,26,,,finish
Combo bột bóng muối Finish cho máy rửa chén,799.000₫,https://tiki.vn/combo-bot-bong-muoi-finish-cho-may-rua-chen-p121327222.html?spid=125753745,27,,Đã bán 2,finish
Viên rửa bát tổng hợp FINISH 100 viên,339.000₫,https://tiki.vn/vien-rua-bat-tong-hop-finish-100-vien-p23936893.html?spid=51719146,28,,Đã bán 27,finish
Combo Viên rửa bát Finish 100 viên + Nước làm bóng finish 750ml dùng cho máy rửa bát,429.000₫,https://tiki.vn/combo-vien-rua-bat-finish-100-vien-nuoc-lam-bong-finish-750ml-dung-cho-may-rua-bat-p205422896.html?spid=217504325,29,,Đã bán 43,finish
Viên vệ sinh máy rửa bát Finish - Vỉ 3 viên,136.900,https://tiki.vn/vie-n-ve-sinh-ma-y-ru-a-ba-t-finish-vi-3-vie-n-p206303465.html?spid=103697796,30,,,finish
,,https://tiki.vn/muoi-rua-chen-bat-finish-1-2kg-kem-tui-zip-p121315651.html?spid=127339272,31,,,finish
Viên rửa chén bát Finish Eco Powerball 0% - Túi 70 viên,398.999₫,https://tiki.vn/vien-rua-chen-bat-finish-eco-powerball-0-tui-70-vien-p121315607.html?spid=167307204,32,,Đã bán 1,finish
Combo: Viên rửa Finish Classic 100 viên + Muối Finish 1.2kg + Nước làm bóng Finish 400ml,597.000₫,https://tiki.vn/combo-vien-rua-finish-classic-100-vien-muoi-finish-1-2kg-nuoc-lam-bong-finish-400ml-p162150564.html?spid=176566412,33,,,finish
Muối rửa chén bát Finish 1.2kg (Hàng EU ),99.000₫,https://tiki.vn/muoi-rua-chen-bat-finish-1-2kg-hang-eu-p122910731.html?spid=141656077,34,,Đã bán 3,finish
Combo Gel rửa bát Finish All in 1 Shine&Protect 650ml +Muối Finish 4kg + Nước làm bóng Finish 400ml hương chanh,1.020.000,https://tiki.vn/combo-gel-rua-bat-finish-all-in-1-shine-protect-650ml-muoi-finish-4kg-nuoc-lam-bong-finish-400ml-huong-chanh-p141469175.html?spid=141469176,35,,,finish
,,https://tiki.vn/nuoc-lam-bong-finish-500ml-danh-cho-may-rua-bat-hang-chinh-hang-p273648449.html?spid=273648455,36,,,finish
Combo Viên rửa bát Finish All in 1 max 48 viên hương chanh + Muối Finish 4kg + Nước làm bóng Finish 400ml hương chanh,1.010.000₫,https://tiki.vn/combo-vien-rua-bat-finish-all-in-1-max-48-vien-huong-chanh-muoi-finish-4kg-nuoc-lam-bong-finish-400ml-huong-chanh-p143498299.html?spid=143498300,37,,,finish
"Bột rửa bát somat blốc 2,4kg",195.700₫,https://tiki.vn/bo-t-ru-a-ba-t-somat-blo-c-2-4kg-p122910525.html?spid=122910535,38,,,finish
100 Viên rửa bát Finish Classic / hộp - Hãng Bosch khuyên sử dụng,344.000₫,https://tiki.vn/100-vien-rua-bat-finish-classic-hop-hang-bosch-khuyen-su-dung-p122910395.html?spid=122910403,39,,,finish
Viên rửa chén Finish tổng hợp hộp ( Hàng chính hãng ),374.920,https://tiki.vn/vien-rua-chen-finish-tong-hop-hop-100-vien-hang-chinh-hang-p122910394.html?spid=122910401,40,,,finish
