title,price,link_item,index,discount,sales,category
Áo khoác thể thao nam Under Armour Storwindstrike Full-Zip - 1377383-410,1.617.000₫,https://tiki.vn/ao-khoac-the-thao-nam-under-armour-storwindstrike-full-zip-1377383-410-p271092677.html?spid=271092682,1,-40%,,aovest
Áo khoác da nam lót lông Gabo Fashion mẫu mới cao cấp AD032,395.000₫,https://tiki.vn/ao-khoac-da-nam-lot-long-gabo-fashion-mau-moi-cao-cap-ad032-p171326383.html?spid=198627066,2,-57%,,aovest
"Áo Màu Ngẫu Nhiên [ XẢ HÀNG ] Từ 80Kg Đổ Lại Mặc Bao Đẹp, Áo Khoác Dù Đẹp Thời Trang",64.000₫,https://tiki.vn/ao-khoa-c-du-nam-ca-u-vai-ez220-p70630832.html?spid=70630848,3,-35%,Đã bán 6,aovest
ÁO KHOÁC KAKI NAM,239.000₫,https://tiki.vn/ao-khoac-kaki-nam-p79458490.html?spid=79458496,4,-66%,Đã bán 3,aovest
Field jacket olive,1.699.000₫,https://tiki.vn/field-jacket-olive-p206481285.html?spid=206481289,5,-35%,,aovest
"áo gile phao ấm Unisex Hàng VNXK,năng động KN4",310.000₫,https://tiki.vn/ao-gile-phao-am-unisex-hang-vnxk-nang-dong-kn4-p179417339.html?spid=179417406,6,-14%,Đã bán 1,aovest
Áo Khoác Da Nam Đen Lót Lông Cao Cấp ShopN6 AKD06,275.000₫,https://tiki.vn/ao-khoac-da-nam-den-lot-long-cao-cap-shopn6-akd06-p12108954.html?spid=12108956,7,-38%,Đã bán 31,aovest
Áo Khoác Gió Nam Giordano 01071018,742.000₫,https://tiki.vn/ao-khoac-gio-nam-giordano-01071018-p146621968.html?spid=146621986,8,-42%,Đã bán 1,aovest
Áo khoác phao nam nữ lông vũ mùa đông form hàn quốc siêu nhẹ dày dặn giữ nhiệt tốt,329.000₫,https://tiki.vn/ao-khoac-phao-nam-nu-long-vu-mua-dong-form-han-quoc-sieu-nhe-day-dan-giu-nhiet-tot-p144505882.html?spid=151440380,9,,,aovest
Áo khoác da nam,345.000₫,https://tiki.vn/ao-khoac-da-nam-p207642865.html?spid=207642871,10,,Đã bán 3,aovest
Áo Vest Thời Trang Phối Viền Trắng Túi Đen,189.000₫,https://tiki.vn/ao-vest-nam-thoi-trang-phoi-vien-trang-tui-den-p6939439.html?spid=72226661,11,,Đã bán 11,aovest
(ảnh thật) Áo khoác nỉ sọc 3 vạch năng động dáng thể thao cá tính,129.000₫,https://tiki.vn/anh-that-ao-khoac-ni-soc-3-vach-nang-dong-dang-the-thao-ca-tinh-p189943991.html?spid=189943999,12,,,aovest
Áo phóng viên - áo gile lính cao cấp ARM-1114 (Xanh mực),700.000₫,https://tiki.vn/ao-phong-vien-ao-gile-linh-cao-cap-arm-1114-xanh-muc-p190231380.html?spid=190231386,13,,Đã bán 1,aovest
Áo khoác nam TEZO vải gió hai lớp 6 màu kháng nước kháng bụi cản gió giữ ấm cơ thể 2109AG2T01,599.000₫,https://tiki.vn/ao-khoac-nam-tezo-vai-gio-hai-lop-6-mau-khang-nuoc-khang-bui-can-gio-giu-am-co-the-2109ag2t01-p129746934.html?spid=129746942,14,,Đã bán 1,aovest
"áo vest nam phong cách châu âu cổ điển nam tính cực chất, hàng thiết kế cao cấp tinh tế và năng động - N45",357.500₫,https://tiki.vn/ao-vest-nam-phong-cach-chau-au-co-dien-nam-tinh-cuc-chat-hang-thiet-ke-cao-cap-tinh-te-va-nang-dong-n45-p215069749.html?spid=215069759,15,,,aovest
"Áo Khoác Dù Chống Nắng dành cho nam nữ và cặp đôi Có 2 Màu, Unisex Form Rộng DELLI Jacket Ulzzang",99.000₫,https://tiki.vn/ao-khoac-du-chong-nang-danh-cho-nam-nu-va-cap-doi-co-2-mau-unisex-form-rong-delli-jacket-ulzzang-p80620917.html?spid=101948148,16,,Đã bán 10,aovest
ÁO KHOÁC BOMBER NAM NỮ CỰC CHẤT,88.000₫,https://tiki.vn/ao-khoac-bomber-nam-nu-cuc-chat-p159054187.html?spid=161923165,17,,Đã bán 12,aovest
Áo khoác Nỉ Cardigan ️Áo khoác Bomber Nam nữ cao cấp bông dày mịn form rộng MY LIFE,89.000₫,https://tiki.vn/ao-khoac-ni-cardigan-ao-khoac-bomber-nam-nu-cao-cap-bong-day-min-form-rong-my-life-p176292868.html?spid=176292902,18,,Đã bán 1,aovest
Áo Blazer Nam TRAZ Form Rộng dài tay dáng unisex màu đen nâu phong cách Hàn Quốc,499.000₫,https://tiki.vn/ao-blazer-nam-traz-form-rong-dai-tay-dang-unisex-mau-den-nau-phong-cach-han-quoc-p201833659.html?spid=201833707,19,,,aovest
Áo nam AP36 - áo khoác nam - Áo khoác phao nam lót lông áo có mũ cao cấp phong cách HQ Hotrend,699.000₫,https://tiki.vn/ao-nam-ap36-ao-khoac-nam-ao-khoac-phao-nam-lot-long-ao-co-mu-cao-cap-phong-cach-hq-hotrend-p72008178.html?spid=80179197,20,,Đã bán 2,aovest
Áo gile nam ôm body màu xanh đen chất liệu vải dày mịn,220.000₫,https://tiki.vn/ao-gile-nam-om-body-mau-xanh-den-chat-lieu-vai-day-min-p53283479.html?spid=53283481,21,,Đã bán 28,aovest
"Áo khoác da cá GOKING 6 túi, form unisex cho nam nữ, trẻ em. Áo chống lạnh, giữ ấm, chống nắng. Hàng hiệu cao cấp vnxk",295.000₫,https://tiki.vn/ao-khoac-nam-goking-vai-thun-da-ca-100-cotton-4-chieu-chong-nang-hieu-qua-p31594559.html?spid=56333890,22,,Đã bán 295,aovest
ÁO LÔNG NAM PHỐI MÀU HOẠ TIẾT PHONG CÁCH HÀN QUỐC,346.500₫,https://tiki.vn/ao-long-nam-phoi-mau-hoa-tiet-phong-cach-han-quoc-p215855990.html?spid=215856019,23,,,aovest
Áo Khoác Big Size Nam Nữ Áo Khoác Dù Nam Nữ Có Nón Chống Nắng Chống Nóng Chống Lạnh Chống Gió Chống Tia UV Lót Lưới Cao Cấp AD68 - ShopN6,145.000₫,https://tiki.vn/ao-khoac-big-size-nam-nu-ao-khoac-du-nam-nu-co-non-chong-nang-chong-nong-chong-lanh-chong-gio-chong-tia-uv-lot-luoi-cao-cap-ad68-shopn6-p92164623.html?spid=92164625,24,,Đã bán 16,aovest
Áo Phao Lông Vũ Cực Mềm Nhẹ Dày Dặn - Áo Khoác Nam Lông Vũ Mẫu Mới Nhất,535.000₫,https://tiki.vn/ao-phao-long-vu-mem-nhe-day-dan-p84670470.html?spid=200931099,25,,,aovest
Áo dạ nam dáng lửng cổ đức cao cấp trẻ trung mẫu mới NAD102,2.350.000₫,https://tiki.vn/ao-da-nam-dang-lung-co-duc-cao-cap-tre-trung-mau-moi-nad102-p207163740.html?spid=273183662,26,,,aovest
"Áo Khoác Nam Bomber Da Lộn Lót Lông Cừu Siêu Ấm, Lịch Lãm Trẻ Trung, Hàng Đẹp Loại 1",388.700₫,https://tiki.vn/ao-khoac-nam-bomber-da-lon-lot-long-cuu-sieu-am-lich-lam-tre-trung-hang-dep-loai-1-p96551223.html?spid=96551270,27,,,aovest
ÁO KHOÁC DÙ CAO CẤP,149.000₫,https://tiki.vn/ao-khoac-du-cao-cap-p117585823.html?spid=117585841,28,,,aovest
"ÁO KHOÁC KAKI NAM CỰC CHẤT PHONG CÁCH , SIÊU XỊN , CHẤT , NGẦU CHO ANH EM THỜI TRANG MỚI KINGSHOP79",249.000₫,https://tiki.vn/ao-khoac-kaki-nam-cuc-chat-phong-cach-sieu-xin-chat-ngau-cho-anh-em-thoi-trang-moi-kingshop79-p109408556.html?spid=109409552,29,,Đã bán 6,aovest
Áo khoác Jean nam thêu chữ,244.000₫,https://tiki.vn/ao-khoac-jean-nam-theu-chu-p74970036.html?spid=74970040,30,,Đã bán 4,aovest
"Áo khoác jean may 3 mạc nối, áo khoác bò nam phong cách hàn quốc unisex",166.000₫,https://tiki.vn/ao-khoac-jean-may-3-mac-noi-ao-khoac-bo-nam-phong-cach-han-quoc-unisex-p76600829.html?spid=101870972,31,,Đã bán 2,aovest
"ÁO KHOÁC GIÓ 2 LỚP NAM LÓT LƯỚI DÀY DẶN CHỐNG GIÓ CHỐNG NẮNG, TRẺ TRUNG, NĂNG ĐỘNG",130.000₫,https://tiki.vn/ao-khoac-gio-2-lop-nam-lot-luoi-day-dan-chong-gio-chong-nang-tre-trung-nang-dong-p122361333.html?spid=123573253,32,,Đã bán 1,aovest
"ÁO KHOÁC DÙ ,ÁO KHOÁC DÙ BOMBER NAM CỰC ĐẸP - PHONG CÁCH HÀN QUỐC - 2021 THỜI TRANG MỚI KINGSHOP79",107.000₫,https://tiki.vn/ao-khoac-du-ao-khoac-du-bomber-nam-cuc-dep-phong-cach-han-quoc-2021-thoi-trang-moi-kingshop79-p109407224.html?spid=125487668,33,,Đã bán 69,aovest
Áo Khoác Bomber Nam Mã 84,219.000₫,https://tiki.vn/ao-khoac-bomber-nam-ma-84-p29165993.html?spid=29166001,34,,Đã bán 7,aovest
Áo khoác da nam lộn lót lông vải mền mịn có túi trong DKD01,249.000₫,https://tiki.vn/ao-khoac-da-nam-lon-lot-long-vai-men-min-co-tui-trong-dkd01-p272241781.html?spid=272241793,35,,Đã bán 1,aovest
ÁO KHOÁC DÙ NAM 2 LỚP GIẤU NÓN,129.000₫,https://tiki.vn/ao-khoac-du-nam-2-lop-giau-non-p64235669.html?spid=74532464,36,,Đã bán 34,aovest
Áo Vest Nam Titishop EVN194 Màu Kem,599.000₫,https://tiki.vn/ao-vest-nam-titishop-evn194-mau-kem-p70091212.html?spid=70091218,37,,,aovest
"Áo khoác dù nam Dokafashion phối nón có túi trong và 2 túi ngoài dây kéo, vải dù ấm áp, cản gió hiệu quả EZAK23",185.000₫,https://tiki.vn/ao-khoac-du-nam-dokafashion-phoi-non-co-tui-trong-va-2-tui-ngoai-day-keo-vai-du-am-ap-can-gio-hieu-qua-ez24-p199631537.html?spid=199631539,38,,Đã bán 1,aovest
"Áo Khoác Nỉ Chữ F426 BORD Có Nón Mũ 2 Lớp , Phối Rap Lăng -FREESHIP - Kiểu Hoodie Khóa Kéo Zip Nam Nữ Cặp Đôi",93.000₫,https://tiki.vn/ao-khoac-ni-chu-f426-bord-co-non-mu-2-lop-phoi-rap-lang-freeship-kieu-hoodie-khoa-keo-zip-nam-nu-cap-doi-p206270711.html?spid=207007753,39,,,aovest
Áo khoác dạ nam dáng vest trẻ trung NAD43,2.050.000₫,https://tiki.vn/ao-khoac-da-nam-dang-vest-tre-trung-nad43-p34702350.html?spid=34702358,40,,Đã bán 1,aovest
