title,price,link_item,index,discount,sales,category
áo khoác phao nam mũ lông cao cấp lớp ngoài chống nước,299.000₫,https://tiki.vn/ao-khoac-phao-nam-mu-long-cao-cap-lop-ngoai-chong-nuoc-p119218216.html?spid=129736274,1,-10%,Đã bán 2,aovest
"Áo khoác blazer nam ,áo vest nam balzer nam màu trắng phong cách Hàn Quốc ADK0012- DUKI STORE",812.000₫,https://tiki.vn/ao-khoac-blazer-nam-ao-vest-nam-balzer-nam-mau-trang-phong-cach-han-quoc-adk0012-duki-store-p272896426.html?spid=272896438,2,-35%,,aovest
"Bộ Áo Điều Hoà Nhật Bản Pin Dung Lượng 40.000mah Cao Cấp Chạy 18-20 Tiếng, Tặng Đá Khô Làm Mát, Bảo Hành 12 Tháng Lỗi 1 Đổi 1",900.000₫,https://tiki.vn/bo-ao-dieu-hoa-nhat-ban-pin-dung-luong-40-000mah-cao-cap-chay-18-20-tieng-tang-da-kho-lam-mat-bao-hanh-12-thang-loi-1-doi-1-p251465395.html?spid=251465399,3,-45%,Đã bán 14,aovest
Áo Gió Thể Thao Nam Salomon Agile Jacket M - L40111300 Size,1.944.000₫,https://tiki.vn/ao-gio-the-thao-nam-salomon-agile-jacket-m-l40111300-p2813051.html?spid=2816821,4,-36%,,aovest
Áo khoác nam áo khoác-002,179.000₫,https://tiki.vn/ao-khoac-nam-ao-khoac-002-p23452310.html?spid=23452314,5,-26%,Đã bán 37,aovest
Hàng cao cấp | Bộ đồ vest nam đẹp trẻ trung - DUKI STORE,1.380.000₫,https://tiki.vn/hang-cao-cap-bo-do-vest-nam-dep-tre-trung-duki-store-p78967779.html?spid=78967839,6,-35%,Đã bán 4,aovest
Áo phao thô style Nam,300.000₫,https://tiki.vn/ao-phao-tho-style-nam-p49461032.html?spid=49461036,7,-24%,Đã bán 20,aovest
áo khoác kaki nam lót dù caro trơn thấm hút tốt phong cách trẻ 2022,185.000₫,https://tiki.vn/ao-khoac-kaki-nam-lot-du-caro-tron-tham-hut-tot-phong-cach-tre-2022-p182710825.html?spid=198617557,8,-50%,Đã bán 8,aovest
"áo gile phối màu cực chất, phong cách hàn quốc sang trọng và nam tính, phom ôm cuốn hút - N43",260.000₫,https://tiki.vn/ao-gile-phoi-mau-cuc-chat-phong-cach-han-quoc-sang-trong-va-nam-tinh-phom-om-cuon-hut-n43-p215069703.html?spid=215069713,9,-28%,,aovest
"Áo vest nam, áo blazer nam 1 nút Hàn Quốc kẻ caro vintage cực sang BDK0002 - DUKI STORE",749.000₫,https://tiki.vn/ao-vest-nam-ao-blazer-nam-1-nut-han-quoc-ke-caro-vintage-cuc-sang-bdk0002-duki-store-p272967135.html?spid=272967137,10,-20%,,aovest
Áo vest nam Cao Cấp full size màu Đỏ Rượu - Size S,495.000₫,https://tiki.vn/product-p77601043.html?spid=77601053,11,,Đã bán 7,aovest
"Áo Khoác Dù Nam Hai Lớp Chống Nước Có Mũ, Chống Nước, Chống Nóng Cao Cấp, Nhiều Màu Lựa Chọn",139.000₫,https://tiki.vn/ao-khoac-du-nam-hai-lop-chong-nuoc-co-mu-chong-nuoc-chong-nong-cao-cap-nhieu-mau-lua-chon-p74348924.html?spid=74348936,12,,Đã bán 3,aovest
Áo khoác nam lót lông Sans50 big size 150kg 140kg 130kg 120kg bigsize 110kg 100kg 90kg 80kg đại hàn dày dặn mũ tháo rời,699.999₫,https://tiki.vn/ao-khoac-nam-lot-long-sans50-big-size-150kg-140kg-130kg-120kg-bigsize-110kg-100kg-90kg-80kg-dai-han-day-dan-mu-thao-roi-p205506848.html?spid=205506854,13,,Đã bán 2,aovest
Áo Khoác Da Nam Cao Cấp Lót Lông Cực Mịn,430.000₫,https://tiki.vn/ao-khoac-da-nam-cao-cap-lot-long-cuc-min-p37031704.html?spid=37031706,14,,Đã bán 7,aovest
Áo vest Nam Titishop Đen VN303,350.000₫,https://tiki.vn/ao-vest-nam-titishop-den-vn303-p14872667.html?spid=20160343,15,,Đã bán 7,aovest
Áo khoác dù dày nam 2 lớp chống nắng gió lạnh cao cấp ShopN6 - KAD46 (Nhiều Màu),159.000₫,https://tiki.vn/ao-khoac-du-day-nam-2-lop-chong-nang-gio-lanh-cao-cap-shopn6-kad46-nhieu-mau-p51714411.html?spid=51714415,16,,Đã bán 328,aovest
"Áo khoác gió cách nhiệt GOKING, form unisex cho nữ nam. Ngoài vải dù, trong lót vải cào cách nhiệt. Hàng Việt Nam chất lượng cao",235.000₫,https://tiki.vn/ao-khoac-nam-2-lop-goking-vai-du-am-ap-can-gio-hieu-qua-thich-hop-dong-va-thu-dong-mau-do-p14694657.html?spid=44452770,17,,Đã bán 332,aovest
Áo Khoác Dù Nam Chống Nắng Giordano UPF 50+ Chất Mỏng Nhẹ Có Thể Gấp Gọn Windbreaker 01072011,699.000₫,https://tiki.vn/ao-khoac-du-nam-chong-nang-giordano-upf-50-chat-mong-nhe-co-the-gap-gon-windbreaker-01072011-p193233136.html?spid=193233162,18,,Đã bán 9,aovest
"áo sơ mi, áo sơ mi nam dài tay thiết kế cổ vest phong cách thượng hải cực năng động và sang chảnh - T12",230.750₫,https://tiki.vn/ao-khoac-nam-dai-tay-thiet-ke-co-vest-phong-cach-thuong-hai-cuc-nang-dong-va-sang-chanh-t12-p215072158.html?spid=215072185,19,,,aovest
Áo Măng Tô Kaki Nam Dáng Dài Áo Khoác Nam Kaki Dáng Dài Sans20 Sans Shop,1.090.000₫,https://tiki.vn/ao-mang-to-kaki-nam-dang-dai-ao-khoac-nam-kaki-dang-dai-sans20-sans-shop-p101656788.html?spid=101658244,20,,Đã bán 11,aovest
"Áo khoác dù nam , áo khoác gió nam , áo khoác nam có túi trong vải dù 2 lớp chống nắng chống lạnh tốt",109.000₫,https://tiki.vn/ao-khoac-du-nam-ao-khoac-gio-nam-ao-khoac-nam-co-tui-trong-vai-du-2-lop-chong-nang-chong-lanh-tot-p72304064.html?spid=72520896,21,,Đã bán 71,aovest
"Áo khoác dù nam, áo gió nam cao cấp, chống nắng, chống bám bụi – FORMEN SHOP – FMHN005",159.000₫,https://tiki.vn/ao-khoac-du-nam-ao-gio-nam-cao-cap-chong-nang-chong-bam-bui-formen-shop-fmhn005-p75628604.html?spid=75628624,22,,Đã bán 40,aovest
Áo khoác thời trang nam Oneill Fifty Two Pullover - FA2110109-HBL,550.000₫,https://tiki.vn/ao-khoac-thoi-trang-nam-oneill-fifty-two-pullover-fa2110109-hbl-p249943075.html?spid=249943079,23,,,aovest
Vest nam áo vest nam chất liệu Jean cao cấp. Chất vải dày dặn thiết kế 1 hàng 3 nút thể thao phong cách độc đáo N54,355.000₫,https://tiki.vn/vest-nam-ao-vest-nam-chat-lieu-jean-cao-cap-chat-vai-day-dan-thiet-ke-1-hang-3-nut-the-thao-phong-cach-doc-dao-n54-p272150280.html?spid=272150300,24,,,aovest
Áo khoác gió đẹp️️Áo khoác Mùa đông Nam Hàn Quốc Cao Cấp,207.000₫,https://tiki.vn/ao-khoac-gio-dep-freeship-ao-khoac-mua-dong-nam-han-quoc-cao-cap-p86025135.html?spid=143144513,25,,Đã bán 19,aovest
{SIÊU PHẨM MÙA ĐÔNG} ÁO KHOÁC NAM /ÁO KHOÁC NAM NỈ NGOẠI LÓT LÔNG GIỮ NHIỆT SIÊU ẤM ÁP CHO MÙA ĐÔNG CÓ SIZE 3XL,212.000₫,https://tiki.vn/sieu-pham-mua-dong-ao-khoac-nam-ao-khoac-nam-ni-ngoai-lot-long-giu-nhiet-sieu-am-ap-cho-mua-dong-co-size-3xl-p114332729.html?spid=114336460,26,,Đã bán 51,aovest
Áo gile nam,550.000₫,https://tiki.vn/ao-gile-nam-p40344309.html?spid=40344311,27,,Đã bán 7,aovest
áo khoác da nam 09,290.000₫,https://tiki.vn/ao-khoac-da-nam-09-p73192796.html?spid=75335620,28,,Đã bán 8,aovest
Áo Bomber Nam/ Áo Khoác Nỉ dày dặn Face đen form rộng Unisex Nam Nữ Ulzzang,100.000₫,https://tiki.vn/a-o-bomber-nam-ao-khoac-ni-da-y-da-n-face-den-form-rong-unisex-nam-nu-ulzzang-maylanstore-p108336042.html?spid=141260409,29,,Đã bán 29,aovest
ÁO HOODIE - ÁO KHOÁC NỈ NGOẠI Dây full zip (Ảnh Thật) HOOIDE MỚI in TIM XANH,95.000₫,https://tiki.vn/ao-hoodie-ao-khoac-ni-ngoai-day-full-zip-anh-that-hooide-moi-in-tim-xanh-p262036114.html?spid=262036118,30,,,aovest
Áo khoác nam vải kaki cách nhiệt phong cách lính Mĩ,440.000₫,https://tiki.vn/ao-khoac-nam-vai-kaki-cach-nhiet-phong-cach-linh-mi-p168283387.html?spid=168283395,31,,Đã bán 5,aovest
Áo măng tô nam dáng ngắn trẻ trung NMT36,3.100.000₫,https://tiki.vn/ao-mang-to-nam-dang-ngan-tre-trung-nmt36-p34707007.html?spid=34707324,32,,Đã bán 2,aovest
"Áo khoác bomber da lộn cao cấp LADOS 2034 - 2 lớp, lót dù, có túi trong",325.000₫,https://tiki.vn/ao-khoac-bomber-da-lon-cao-cap-lados-2034-2-lop-lot-du-co-tui-trong-p163148968.html?spid=163149013,33,,Đã bán 3,aovest
Áo Khoác Nam Big Size Áo Khoác Kaki Nam Chống Nắng Chống Gió Chống Lạnh Chống Nóng Có Cổ Dày Hai Lớp Đồ Phượt Hàn Quốc Cao Cấp KK51 - ShopN6,189.000₫,https://tiki.vn/ao-khoac-nam-big-size-ao-khoac-kaki-nam-chong-nang-chong-gio-chong-lanh-chong-nong-co-co-day-hai-lop-do-phuot-han-quoc-cao-cap-kk51-shopn6-p93206831.html?spid=93206843,34,,Đã bán 33,aovest
"Áo gile nam, áo phóng viên, áo gile lính 1204",450.000₫,https://tiki.vn/ao-gile-nam-ao-phong-vien-ao-gile-linh-1204-p187913098.html?spid=187913172,35,,Đã bán 17,aovest
Bộ vest nam màu xanh ngọc cực sang trọng - DUKI STORE,839.000₫,https://tiki.vn/bo-vest-nam-mau-xanh-ngoc-cuc-sang-trong-duki-store-p78967671.html?spid=78967726,36,,Đã bán 6,aovest
Khoác jean nam,185.000₫,https://tiki.vn/khoac-jean-nam-p212036057.html?spid=212036065,37,,,aovest
Áo Khoác Pilot - Áo Khoác Pilot Lính,1.250.000₫,https://tiki.vn/ao-khoac-pilot-ao-khoac-pilot-linh-p93038427.html?spid=93038429,38,,Đã bán 2,aovest
"Áo khoác da nam , áo da nam . áo khoác nam",155.000₫,https://tiki.vn/ao-khoac-da-nam-ao-da-nam-ao-khoac-nam-p74037420.html?spid=207332431,39,,Đã bán 4,aovest
Áo khoác kaki nam phối túi hộp dây kéo cao cấp UT182,162.000₫,https://tiki.vn/ao-khoac-kaki-nam-phoi-tui-hop-day-keo-cao-cap-ut182-p173813775.html?spid=173813791,40,,Đã bán 29,aovest
