title,price,link_item,index,discount,sales,category
Quần lót nữ annie QE 4536 trơn lưng cao,57.000₫,https://tiki.vn/quan-lot-nu-annie-qe-4536-tron-lung-cao-p167480327.html?spid=167480362,1,-34%,Đã bán 22,dolotnu
Combo 5 Quần Lót Nữ Cotton Lưng Miley Lingerie - FDS1104,313.000₫,https://tiki.vn/combo-5-quan-lot-cotton-lua-phoi-ren-plus-size-miley-lingerie-nature-wind-fcp_11-p109567589.html?spid=109567599,2,-32%,Đã bán 41,dolotnu
Áo Lót Bralette SepSweet lụa mỏng mềm mịn B048,125.000₫,https://tiki.vn/ao-lot-bralette-sepsweet-lua-mong-mem-min-b048-p84826649.html?spid=84828240,3,-50%,Đã bán 12,dolotnu
"Aó gen tay định hình bắp tay lưng vai nách hỗ trợ nâng ngực - Áo lót định hình nâng ngực giảm mỡ gen nịt thon gọn bắp tay sau phẫu thuật, hút mỡ",260.000₫,https://tiki.vn/ao-gen-tay-dinh-hinh-bap-tay-lung-vai-nach-ho-tro-nang-nguc-ao-lot-dinh-hinh-nang-nguc-giam-mo-gen-nit-thon-gon-bap-tay-sau-phau-thuat-hut-mo-p181986604.html?spid=181986606,4,-5%,Đã bán 25,dolotnu
Đai nịt bụng sau sinh 3 nấc móc cài định hình eo thon gọn,40.000₫,https://tiki.vn/dai-nit-bung-sau-sinh-3-nac-moc-cai-dinh-hinh-eo-thon-gon-p72746514.html?spid=91876903,5,-20%,Đã bán 5,dolotnu
Hộp 10 Miếng Dán Ngực Silicon Siêu Tiện Lợi Tái Sử Dụng Nhiều Lần,48.000₫,https://tiki.vn/hop-10-mieng-dan-nguc-silicon-sieu-tien-loi-tai-su-dung-nhieu-lan-p193909439.html?spid=253311262,6,-50%,Đã bán 10,dolotnu
Set Đồ Lót Ren Có Gọng Không Đệm Siêu Mỏng S073,235.000₫,https://tiki.vn/set-do-lot-ren-co-gong-khong-dem-sieu-mong-s073-p84821012.html?spid=84822947,7,-44%,Đã bán 5,dolotnu
"Quần lót su đúc, quần mặc trong váy, áo dài mềm mịn không lộ viền siêu mềm mát chống lộ, chống cuộn QS105",25.500₫,https://tiki.vn/quan-lot-su-duc-quan-mac-trong-vay-ao-dai-mem-min-khong-lo-vien-sieu-mem-mat-chong-lo-chong-cuon-qs105-p73486525.html?spid=149507780,8,-67%,Đã bán 60,dolotnu
Áo Ngực Quai Trong Đệm Dày Mặc Đầm Hở Lưng Hở Vai,125.000₫,https://tiki.vn/ao-nguc-quai-trong-dem-day-mac-dam-ho-lung-ho-vai-p83033277.html?spid=177010521,9,-21%,Đã bán 9,dolotnu
"Quần lọt khe, chất su đúc xịn Thái Lan 986",35.000₫,https://tiki.vn/quan-lot-khe-chat-su-duc-xin-thai-lan-986-p104792654.html?spid=104792655,10,-5%,Đã bán 4,dolotnu
Gen bắp tay lưng & nách Aó định hình sau hút mỡ cánh tay Aó gen vai cánh tay áo nịt bắp tay,550.000₫,https://tiki.vn/gen-bap-tay-lung-nach-ao-dinh-hinh-sau-hut-mo-canh-tay-ao-gen-vai-canh-tay-ao-nit-bap-tay-p73825077.html?spid=73825079,11,-5%,Đã bán 12,dolotnu
Sét Quần Đùi Mặc Váy Cotton thông hơi big size màu ngẫu nhiên hàng việt nam(từ 45kg đến 90kg),144.000₫,https://tiki.vn/set-quan-dui-mac-vay-cotton-thong-hoi-big-size-mau-ngau-nhien-hang-viet-nam-tu-45kg-den-90kg-p174175646.html?spid=174175659,12,-5%,Đã bán 2,dolotnu
"Áo lót nữ mỏng, không đệm mút, không gọng Vicci AV.08 mềm mại, thoáng mát tạo cảm giác dễ chịu, thoải mái tuyệt đối, phù hợp cho người ngực to, bà bầu, phụ nữ trung niên",95.000₫,https://tiki.vn/ao-lot-nu-mong-khong-dem-mut-khong-gong-vicci-av-08-mem-mai-thoang-mat-tao-cam-giac-de-chiu-thoai-mai-tuyet-doi-phu-hop-cho-nguoi-nguc-to-ba-bau-phu-nu-trung-nien-p273220015.html?spid=273220017,13,,Đã bán 1,dolotnu
Quần lót lọt khe Quần lót nữ chất liệu Cotton cao cấp mềm mịn,32.000₫,https://tiki.vn/quan-lot-lot-khe-quan-lot-nu-chat-lieu-cotton-cao-cap-mem-min-p263693409.html?spid=263693417,14,,Đã bán 4,dolotnu
Combo 5 Quần Đùi Mặc Váy Cotton hàng việt nam màu ngẫu nhiên 01,109.250₫,https://tiki.vn/combo-5-quan-dui-mac-vay-cotton-hang-viet-nam-mau-ngau-nhien-01-p101280975.html?spid=109427882,15,,Đã bán 8,dolotnu
Quần lót nữ xẻ đáy quốn hút - Màu xanh biển,35.000₫,https://tiki.vn/quan-lot-nu-xe-day-quon-hut-mau-xanh-bien-p23240506.html?spid=23240507,16,,Đã bán 6,dolotnu
Quần nữ kết dây sexy lọt khe gợi cảm - Màu hồng đậm,25.000₫,https://tiki.vn/quan-nu-ket-day-sexy-lot-khe-goi-cam-mau-hong-dam-p38705224.html?spid=48057313,17,,Đã bán 41,dolotnu
Mút ngực định hình Oval cho Áo tập yoga gym Hibi Sports MUT009 - 1 cặp,32.000₫,https://tiki.vn/mut-nguc-dinh-hinh-oval-cho-ao-tap-yoga-gym-hibi-sports-mut009-1-cap-p174086636.html?spid=174086642,18,,Đã bán 237,dolotnu
COMBO 6 TRUNG TÍNH - Quần Lót Nữ Đúc Su cao cấp thun lạnh không đường may kháng khuẩn LeMOMIZI Size M-XXL dscombo5,90.000₫,https://tiki.vn/combo-6-trung-tinh-quan-lot-nu-duc-su-cao-cap-thun-lanh-khong-duong-may-khang-khuan-lemomizi-size-m-xxl-dscombo5-p208292933.html?spid=208292950,19,,Đã bán 3,dolotnu
Hộp 30 Miếng Dán Ngực Cao Cấp,28.000₫,https://tiki.vn/hop-30-mieng-dan-nguc-dan-nhu-hoa-cao-cap-p201677317.html?spid=201677322,20,,Đã bán 16,dolotnu
"Quần lót nữ eo thấp da báo sexy nóng bỏng, quần lót sexy - Tada",57.800₫,https://tiki.vn/quan-lot-nu-eo-thap-da-bao-sexy-nong-bong-quan-lot-sexy-tada-p169868754.html?spid=169868755,21,,Đã bán 4,dolotnu
Combo 5 quần lót nữ cotton dễ thương Freesize - Kiểu hoa hồng Rosie (giao màu ngẫu nhiên),120.750₫,https://tiki.vn/combo-5-quan-lot-nu-cotton-de-thuong-freesize-kieu-hoa-hong-rosie-giao-mau-ngau-nhien-p113373678.html?spid=143888666,22,,Đã bán 3,dolotnu
Quần lót nữ ONOFF chất liệu cotton USA mềm mại - H16BU18005,79.000₫,https://tiki.vn/quan-lot-nu-onoff-chat-lieu-cotton-usa-mem-mai-h16bu18005-p161706533.html?spid=161708116,23,,Đã bán 15,dolotnu
Bộ đồ lót mèo xinh xắn,55.000₫,https://tiki.vn/bo-do-lot-meo-xinh-xan-p97033581.html?spid=97033582,24,,Đã bán 3,dolotnu
quần lót su không viền loại cao cấp,35.000₫,https://tiki.vn/quan-lot-su-khong-vien-loai-cao-cap-p176288899.html?spid=176288902,25,,Đã bán 22,dolotnu
Miếng dán ngực chống mồ hôi - Hộp 2 set,150.000₫,https://tiki.vn/mieng-dan-nguc-chong-mo-hoi-hop-2-set-p208303307.html?spid=208303308,26,,Đã bán 11,dolotnu
FRESHIP 50K - Áo lót thể thao nữ 2020 (Chuyên tập Gym) A03,44.000₫,https://tiki.vn/freship-50k-ao-lot-the-thao-nu-2020-chuyen-tap-gym-a03-p86562276.html?spid=86562278,27,,Đã bán 4,dolotnu
Áo Lót Mút Dày Nâng Ngực Tự Nhiên Basic Soft Doomm By Sabina Invisible Wire By Sabina SBH8890,199.000₫,https://tiki.vn/ao-lot-mut-day-nang-nguc-tu-nhien-basic-soft-doomm-by-sabina-invisible-wire-by-sabina-sbh8890-p201514545.html?spid=201514780,28,,Đã bán 5,dolotnu
Áo Lót Có Gọng Cup Ngang Đệm Vừa BRNC104,149.000₫,https://tiki.vn/ao-lot-co-gong-cup-ngang-dem-vua-brde104-p241792553.html?spid=241792563,29,,Đã bán 3,dolotnu
Áo Lót Ngực Big Size Có Gọng Mút mỏng Cup D Ôm Trọn,248.000₫,https://tiki.vn/ao-lot-nguc-big-size-co-gong-mut-mong-cup-d-om-tron-p161207976.html?spid=161208095,30,,Đã bán 5,dolotnu
"Bộ 2 miếng Mút đệm, Mút lót độn ngực hình tròn( dày 3cm ) dành cho Bra, Bikini, Đồ tập Yoga, Gym",52.250₫,https://tiki.vn/bo-2-mieng-mut-dem-mut-lot-don-nguc-hinh-tron-day-3cm-danh-cho-bra-bikini-do-tap-yoga-gym-p136818293.html?spid=191267613,31,,Đã bán 35,dolotnu
"Combo 5 quần lót nữ cotton Cuncon dùng 1 lần cao cấp mềm mại thoáng mát đi du lịch, công tác size từ 50-80kg",34.000₫,https://tiki.vn/combo-5-quan-lot-nu-cotton-cuncon-dung-1-lan-cao-cap-mem-mai-thoang-mat-di-du-lich-cong-tac-size-tu-50-80kg-p259574993.html?spid=259574999,32,,Đã bán 18,dolotnu
ÁO LÁ HỌC SINH COTTON TĂM 2 LỚP MÚT MỎNG 007,28.500₫,https://tiki.vn/ao-la-hoc-sinh-cotton-tam-2-lop-mut-mong-007-p93100635.html?spid=93100637,33,,Đã bán 152,dolotnu
"Quần lót lọt khe, quần hở đáy sexy quyến rũ thêu hoa",29.000₫,https://tiki.vn/quan-lot-lot-khe-quan-ho-day-sexy-quyen-ru-theu-hoa-p134364175.html?spid=134364177,34,,Đã bán 1,dolotnu
Gen nịt bụng cao cấp - Đai định hình chuẩn Hy Lạp - Đai latex giảm mỡ sau sinh,285.000₫,https://tiki.vn/gen-nit-bung-cao-cap-dai-dinh-hinh-chuan-hy-lap-dai-latex-giam-mo-sau-sinh-p101125834.html?spid=198871756,35,,Đã bán 6,dolotnu
Quần Lót Cotton Chống Tràn Nguyệt San P075,52.000₫,https://tiki.vn/quan-lot-cotton-chong-tran-nguyet-san-p075-p84821936.html?spid=84823565,36,,Đã bán 122,dolotnu
Quần Lót Nữ - Quần Đùi Mặc Trong Váy Su Thông Hơi,28.500₫,https://tiki.vn/quan-lot-nu-quan-dui-mac-trong-vay-su-thong-hoi-p6535821.html?spid=51154796,37,,Đã bán 55,dolotnu
"Quần Lót Su MIUHOME Cao Cấp Không Viền, Không Đường May, Thoáng Mát, Kháng Khuẩn QS05",19.000₫,https://tiki.vn/quan-lot-su-miuhome-cao-cap-khong-vien-khong-duong-may-thoang-mat-khang-khuan-qs05-p271169866.html?spid=271169890,38,,Đã bán 18,dolotnu
Quần Độn Hông Loirechic QDH01,259.000₫,https://tiki.vn/quan-don-hong-loirechic-qdh01-p250376561.html?spid=250376565,39,,Đã bán 2,dolotnu
áo lót dán nâng ngực silicon tặng dây trong đệm dày,89.000₫,https://tiki.vn/ao-lot-dan-nang-nguc-silicon-tang-day-trong-dem-day-p126868925.html?spid=271350774,40,,Đã bán 5,dolotnu
