title,price,link_item,index,discount,sales,category
Áo Thun Polo Nam ALIGRO trơn chất liệu CVC cao cấp Form dáng SlimFit ôm vừa vặn màu Hồng ALGPLO42,299.000₫,https://tiki.vn/ao-thun-polo-nam-aligro-tron-chat-lieu-cvc-cao-cap-form-dang-slimfit-om-vua-van-mau-hong-algplo42-p249227576.html?spid=249227581,1,-34%,,aothun
Áo ba lỗ sát nách nam KING khoác 3 lỗ tanktop co giãn tốt đẹp,79.000₫,https://tiki.vn/ao-ba-lo-sat-nach-nam-king-khoac-3-lo-tanktop-co-gian-tot-dep-p247245271.html?spid=247245435,2,-20%,,aothun
Áo polo nam ADINO màu ghi phối viền vải cotton co giãn dáng slimfit trẻ trung AP72,139.000₫,https://tiki.vn/ao-polo-nam-adino-mau-ghi-phoi-vien-vai-cotton-co-gian-dang-slimfit-tre-trung-ap72-p146234462.html?spid=146234464,3,-50%,Đã bán 15,aothun
"Combo 2 áo thun gân 3 lỗ, áo tank top nam chất cotton thương hiệu Fezzio",177.500,https://tiki.vn/combo-2-ao-thun-3-lo-rip-100-cotton-4-chieu-fezzio-p71064903.html?spid=71064907,4,,,aothun
,,https://tiki.vn/ao-ba-lo-nam-100-cotton-ao-coc-tay-nam-100-cotton-p270880907.html?spid=270880921,5,-50%,,aothun
Áo thun Local Brand Teeworld Mẹ Biết Mẹ Buồn T-shirt,249.000₫,https://tiki.vn/ao-thun-local-brand-teeworld-me-biet-me-buon-t-shirt-p207874042.html?spid=207874048,6,-34%,Đã bán 4,aothun
"Áo thun nam dài tay cổ bẻ màu đỏ ALIGRO chất liệu Cotton cao cấp mềm nhẹ, thiết kế trẻ trung ALGAPD005",205.000₫,https://tiki.vn/ao-phong-dai-tay-algapd005-ol-p146632711.html?spid=146632713,7,,,aothun
"Áo thun nam cổ tròn tay ngắn, chất thun cao cấp, trẻ trung, năng động – FORMEN SHOP – FMPS080",139.000₫,https://tiki.vn/ao-thun-nam-co-tron-tay-ngan--chat-thun-cao-cap--tre-trung--nang-dong---formen-shop---fmps080-p45438648.html?spid=45438664,8,-11%,Đã bán 94,aothun
Áo thun unisex tay lỡ HATER THE BAD GOD vải dày mịn cực đẹp mẫu hot 2021,230.000,https://tiki.vn/ao-thun-unisex-tay-lo-hater-the-bad-god-vai-day-min-cuc-dep-mau-hot-2021-p151521935.html?spid=151521989,9,,,aothun
,,https://tiki.vn/com-bo-2-ao-3-lo-cotton-rip-4-chieu-100-cotton-fezzio-p71064995.html?spid=148807951,10,,,aothun
Áo Polo Nam Enkoni Xanh Navy Cổ Sọc Chuẩn Form - M,429.000₫,https://tiki.vn/ao-polo-nam-enkoni-xanh-navy-co-soc-chuan-form-p252867673.html?spid=252867677,11,-63%,,aothun
ÁO THUN CLOUD 9 - TRẮNG,210.000,https://tiki.vn/ao-thun-cloud-9-trang-p135602332.html?spid=135602357,12,-40%,,aothun
,,https://tiki.vn/ao-thun-ba-lo-nam-dep-in-1975-tren-nap-tui-ao-tanktop-thun-cotton-co-dan-4-chieu-sang-xin-min-ulzzang-p176385017.html?spid=176385032,13,,,aothun
Áo thun polo nam cá sấucó cổ bẻ sọc ngang trung niên vải cao cấp ND036,155.000₫,https://tiki.vn/ao-thun-polo-nam-ca-sauco-co-be-soc-ngang-nexx-dee-trung-nien-vai-cao-cap-nd036-p111117053.html?spid=111117069,14,,Đã bán 1,aothun
Áo thun tay lỡ cotton trơn [ áo thun tay lỡ unisex nam nữ mặc được,34.000₫,https://tiki.vn/ao-thun-tay-lo-cotton-tron-ao-thun-tay-lo-unisex-nam-nu-mac-duoc-p73236732.html?spid=190464174,15,,Đã bán 3,aothun
Áo Polo nam Novelty cổ sơ mi có túi NATMCLMCLR191119N,346.000₫,https://tiki.vn/ao-polo-nam-novelty-co-so-mi-co-tui-natmclmclr191119n-p76008619.html?spid=76008621,16,,,aothun
Áo Kangol Unisex T-Shirt 6325101871,480.000,https://tiki.vn/ao-kangol-unisex-t-shirt-6325101871-p261798777.html?spid=261798787,17,,,aothun
,,https://tiki.vn/ao-thun-tay-ngan-thoi-trang-unisex-fila-beach-party-oversize-f-box-fw2rsf1003x-cpk-p251788523.html?spid=251788529,18,,,aothun
Áo thun tay lỡ nam NIRVANA form rộng unisex cực chất giá siêu rẻ,78.000₫,https://tiki.vn/ao-thun-tay-lo-nam-nirvana-form-rong-unisex-cuc-chat-gia-sieu-re-p263506737.html?spid=263506739,19,,,aothun
"Áo thun polo, thời trang nam họa tiết thêu PACK H, bo viền phối sọc tinh tế - FORMEN SHOP - FMPS208",250.000₫,https://tiki.vn/ao-thun-polo-thoi-trang-nam-hoa-tiet-theu-pack-h-bo-vien-phoi-soc-tinh-te-formen-shop-fmps208-p214666377.html?spid=214666411,20,,Đã bán 15,aothun
"TOKYO JAPAN, mã G53. Áo thun nam nữ siêu đẹp. Áo phông thoát nhiệt Goking hàng hiệu",168.000₫,https://tiki.vn/tokyo-japan-ma-g53-ao-thun-nam-nu-sieu-dep-ao-phong-thoat-nhiet-goking-hang-hieu-p164308730.html?spid=164309066,21,,Đã bán 6,aothun
(bigsizenam<130kg) Quần short jean rách big size nam màu đen,285.000₫,https://tiki.vn/bigsizenam-130kg-quan-short-jean-rach-big-size-nam-mau-den-p179163639.html?spid=179164416,22,,Đã bán 2,aothun
Áo Thun Unisex Cổ Tròn Cotton 3 Lá VNXK,185.000₫,https://tiki.vn/a-o-thun-unisex-co-tro-n-cotton-3-la-vnxk-p159009742.html?spid=159009822,23,,Đã bán 1,aothun
Áo Thun Nam UNISEX chữ KHÙM - CÓ BIG SIZE,43.120₫,https://tiki.vn/ao-thun-nam-unisex-chu-khum-co-big-size-p178003125.html?spid=178003150,24,,Đã bán 2,aothun
"Áo Thun Nam Ngắn Tay Chandi, Chất Thun Cotton Xịn Mẫu Mới NT19",199.000,https://tiki.vn/ao-thun-nam-ngan-tay-chandi-chat-thun-cotton-xin-mau-moi-nt19-p87011578.html?spid=87011583,25,,,aothun
,,https://tiki.vn/product-p91281538.html?spid=133164791,26,,,aothun
Áo thun tay lỡ unisex One Piece cực hot | Áo luffy tay lỡ form rộng đẹp AC5,79.000₫,https://tiki.vn/ao-thun-tay-lo-unisex-one-piece-cuc-hot-ao-luffy-tay-lo-form-rong-dep-ac5-p75769672.html?spid=91963961,27,,,aothun
Áo Phông One Piece,140.400₫,https://tiki.vn/ao-phong-one-piece-p91941185.html?spid=91941209,28,,,aothun
Áo Thun Trafalgar D. Water Law Cực Chất | Áo Thun Đảo Hải Tặc One Piece | One Piece T-shirt,53.000₫,https://tiki.vn/ao-thun-trafalgar-d-water-law-cuc-chat-ao-thun-dao-hai-tac-one-piece-one-piece-t-shirt-p104149036.html?spid=104149533,29,,Đã bán 6,aothun
"Áo polo nam nữ phối 4 màu, đủ size , chất cotton poly form áo đẹp, trẻ trung",95.000₫,https://tiki.vn/ao-polo-nam-nu-phoi-4-mau-du-size-chat-cotton-poly-form-ao-dep-tre-trung-p270702997.html?spid=270703021,30,,,aothun
,,https://tiki.vn/ao-thun-nam-soc-doc-co-tron-vai-tron-mat-cao-cap-form-the-thao-nhieu-mau-p75370678.html?spid=75370738,31,,,aothun
ONWAYS - Áo thun Nam Graphic No.5,379.000₫,https://tiki.vn/onways-ao-thun-nam-graphic-no-5-p195185849.html?spid=195185871,32,,,aothun
Áo Kangol UNISEX T-SHIRT 6225101989,315.000₫,https://tiki.vn/ao-kangol-unisex-t-shirt-6225101989-p197622350.html?spid=197622352,33,,,aothun
Áo Kangol Unisex T-Shirt 6325101831,480.000₫,https://tiki.vn/ao-kangol-unisex-t-shirt-6325101831-p261798731.html?spid=261798739,34,,,aothun
BST 6 Áo LUFFY ONE PIECE Cao Cấp| Áo One Piece Luffy Đảo Hải Tặc Đẹp OP10 | Áo Chất Store,59.000₫,https://tiki.vn/bst-6-ao-luffy-one-piece-cao-cap-ao-one-piece-luffy-dao-hai-tac-dep-op10-ao-chat-store-p90416575.html?spid=273445873,35,,,aothun
,,https://tiki.vn/ao-thun-nam-thai-lan-chinh-hang-1a-p203933253.html?spid=203933277,36,,,aothun
(big size < 115kg) áo thun nam ngắn tay không cổ big size,144.000₫,https://tiki.vn/big-size-115kg-ao-thun-nam-ngan-tay-khong-co-big-size-p179163690.html?spid=179164015,37,,,aothun
Áo Thun Tay Lỡ In Heo Mạc Chược,122.200₫,https://tiki.vn/ao-thun-tay-lo-in-heo-mac-chuoc-p84382967.html?spid=84382978,38,,,aothun
Áo thun unisex siêu hot chuẩn chất lượng GMT,31.360₫,https://tiki.vn/ao-thun-unisex-sieu-hot-chuan-chat-luong-gmt-p105306030.html?spid=105306080,39,,,aothun
Áo thun nam cổ tim dài tay đẹp nhiều màu ( hàng cao cấp ),76.140₫,https://tiki.vn/ao-thun-nam-co-tim-dai-tay-dep-nhieu-mau-hang-cao-cap-p138749504.html?spid=138751293,40,,,aothun
