title,price,link_item,index,discount,sales,category
Áo thun NEEDS OF WISDOM Mini Embroidered Nowsaigon Tee,333.000₫,https://tiki.vn/ao-thun-needs-of-wisdom-mini-embroidered-nowsaigon-tee-p115885735.html?spid=115886416,1,,,aothun
"(̀ ̣) Áo thu đông nam dài tay chất cotton co giãn cao cấp, giữ ấm cơ thể, áo dáng ôm cao cấp",208.000₫,https://tiki.vn/ao-thu-dong-nam-dai-tay-chat-cotton-co-gian-cao-cap-giu-am-co-the-ao-dang-om-cao-cap-p92451542.html?spid=92451593,2,-40%,Đã bán 2,aothun
"Áo thun nam cổ tròn form vừa TS21SS30C-RG - BLUE, BLUE",320.000₫,https://tiki.vn/ao-thun-nam-co-tron-form-vua-ts21ss30c-rg-p184309106.html?spid=184309120,3,-40%,Đã bán 1,aothun
Áo Thun Tay Dài Revzone Yamaha Motor Saigon,547.000,https://tiki.vn/ao-thun-tay-dai-revzone-yamaha-motor-saigon-p273611740.html?spid=262830252,4,-15%,,aothun
,,https://tiki.vn/new-timberland-ao-polo-nam-af-ss-timberchill-polo-tb0a6rbn-p252432731.html?spid=252432745,5,-30%,,aothun
Áo polo nam Under Armour Playoff - 1327037-048,1.017.000₫,https://tiki.vn/ao-polo-nam-under-armour-playoff-1327037-048-p263651897.html?spid=263651910,6,,,aothun
Áo thun tay ngắn thời trang unisex Fila Heritage Loose Fit Logo - FW2RSF2068X-DNA,597.000₫,https://tiki.vn/ao-thun-tay-ngan-thoi-trang-unisex-fila-heritage-loose-fit-logo-fw2rsf2068x-dna-p251788695.html?spid=251788697,7,-20%,,aothun
Áo giữ nhiệt nam lót nỉ cổ 3 phân,90.000₫,https://tiki.vn/ao-giu-nhiet-nam-lot-ni-co-3-phan-p73188636.html?spid=207992491,8,,,aothun
Áo cờ đỏ sao vàng người lớn,60.000₫,https://tiki.vn/ao-co-do-sao-vang-nguoi-lon-p120508524.html?spid=262804206,9,,,aothun
,,https://tiki.vn/ao-thun-nam-cotton-co-be-soc-ngang-p58534396.html?spid=95212660,10,,,aothun
Áo Thun Nam Có Cổ Tay Ngắn Polo Cao Cấp Thời Trang 3390,159.000₫,https://tiki.vn/ao-thun-nam-co-co-tay-ngan-polo-cao-cap-thoi-trang-3390-p86257890.html?spid=86257906,11,,,aothun
Áo thun nam họa tiết Bad Boy,113.000,https://tiki.vn/ao-thun-nam-hoa-tiet-bad-boy-p74867262.html?spid=74867266,12,,Đã bán 2,aothun
,,https://tiki.vn/ao-nhung-nam-hinh-dai-bang-p38082168.html?spid=38082172,13,,,aothun
Áo Thun Nam Polo PONIVA,157.000₫,https://tiki.vn/ao-thun-nam-polo-poniva-p82642878.html?spid=82643073,14,,,aothun
(VIDEO) Áo thun hoạt hình trẻ em đội bay siêu đẳng Super Wings SW02 | Áo Chất Store,67.000₫,https://tiki.vn/video-ao-thun-hoat-hinh-tre-em-doi-bay-sieu-dang-super-wings-sw02-ao-chat-store-p104157813.html?spid=104157940,15,,Đã bán 1,aothun
Áo thun trơn nam form rộng phong cách hàn quốc vải poly cotton mịn MÀU XÁM SIÊU SALE !! SIÊU SALE,11.000₫,https://tiki.vn/ao-thun-tron-nam-form-rong-phong-cach-han-quoc-vai-poly-cotton-min-mau-xam-sieu-sale-sieu-sale-p97861400.html?spid=116142752,16,,Đã bán 3,aothun
Áo Thun Nam Mẫu Thun Trơn Mặc Nhà Mọi Lứa Tuổi,50.000₫,https://tiki.vn/ao-thun-nam-mau-thun-tron-mac-nha-moi-lua-tuoi-p98632220.html?spid=115778682,17,,,aothun
,,https://tiki.vn/ao-phong-dai-tay-algapd015-ol-p146663604.html?spid=146663606,18,,,aothun
"Áo Lao động Rằn Ri , Áo Bảo Hộ Lao Động Đủ Màu",199.000₫,https://tiki.vn/ao-lao-dong-ran-ri-ao-bao-ho-lao-dong-du-mau-p161028709.html?spid=211299134,19,,,aothun
OWEN - Áo polo nam Owen màu trắng 220345 - Áo thun ngắn tay có cổ nam,382.500₫,https://tiki.vn/owen-ao-polo-nam-owen-mau-trang-220345-ao-thun-ngan-tay-co-co-nam-p247666840.html?spid=247666850,20,,,aothun
"ÁO BA LỖ NAM, TRẮNG TRUYỀN THỐNG CAO CẤP",24.000₫,https://tiki.vn/ao-ba-lo-nam-trang-truyen-thong-cao-cap-p86378916.html?spid=95859359,21,,Đã bán 15,aothun
Áo T-SHIRT tay lỡ_bóng chày Henley tay áo 3/4_cổ tròn có nút thể thao đơn giản_Hàng US chất lượng cao_ZIMEGO,599.000₫,https://tiki.vn/ao-t-shirt-tay-lo_phong-cach-the-thao-don-gian_hang-us-chat-luong-cao_zimego-p271217495.html?spid=271217499,22,,,aothun
Áo Thun Tay Lỡ Local Brand BASIC Cotton 100 form rộng nam nữ Unisex (AT3000L - Full Box - Kèm Video Ảnh Thật),149.000₫,https://tiki.vn/ao-thun-tay-lo-local-brand-basic-cotton-100-form-rong-nam-nu-unisex-at3000l-full-box-kem-video-anh-that-p263312455.html?spid=263312531,23,,,aothun
"ÁO THUN NAM TAY LỠ FORM RỘNG,4 MÀU SẮC CHỌN LỰA",65.000₫,https://tiki.vn/ao-thun-nam-tay-lo-form-rong-4-mau-sac-chon-lua-p114321738.html?spid=114322578,24,,Đã bán 11,aothun
"Chọi gà, mã G178. Áo thun in tranh Đông Hồ siêu đẹp cho nam nữ, cặp đôi, gia đình, doanh nghiệp. Áo phông Goking hàng hiệu, quà tặng cao cấp",69.000₫,https://tiki.vn/choi-ga-ma-g178-ao-thun-in-tranh-dong-ho-sieu-dep-cho-nam-nu-cap-doi-ao-phong-goking-hang-hieu-cao-cap-p251563754.html?spid=251564013,25,,,aothun
,,https://tiki.vn/ao-one-piece-luffy-att-02-ao-thun-anime-manga-one-piece-monkey-d-luffy-unisex-nam-nu-p74532752.html?spid=79662934,26,,,aothun
Áo thun nam tay ngắn cổ tròn body streetwear phông unisex basic tee cotton teen oversize đen trắng giá rẻ SMIPLEST,53.000₫,https://tiki.vn/ao-thun-nam-tay-ngan-co-tron-body-streetwear-phong-unisex-basic-tee-cotton-teen-oversize-den-trang-gia-re-smiplest-p117922344.html?spid=188837092,27,,Đã bán 3,aothun
"Simple Box - 2 Áo ba lỗ nam, 3 quần lót nam Boxer, 5 đôi tất cao cấp MRM Manlywear",488.000₫,https://tiki.vn/simple-box-2-ao-ba-lo-nam-3-quan-lot-nam-boxer-5-doi-tat-cao-cap-mrm-manlywear-p179746796.html?spid=179746818,28,,Đã bán 2,aothun
Áo Thun Tay Lỡ In Nhiệt SWE Bướm,109.200₫,https://tiki.vn/ao-thun-tay-lo-in-nhiet-swe-buom-p84381461.html?spid=84381471,29,,,aothun
ÁO THUN NAM DÀI TAY PHỐI MÀU THU ĐÔNG,149.000,https://tiki.vn/ao-thun-nam-dai-tay-phoi-mau-thu-dong-p147771578.html?spid=147771584,30,,,aothun
,,https://tiki.vn/ao-thun-dang-rong-cho-husky-sieu-chat-2020-p82746184.html?spid=82746542,31,,,aothun
Áo thun Polo-Shirt Organic SURE Fashion Nam Trắng,1.299.000₫,https://tiki.vn/ao-thun-polo-shirt-organic-sure-fashion-nam-trang-p253128783.html?spid=253128785,32,,,aothun
"Áo phông cổ bẻ Goking, form unisex cho nam nữ, công ty, đội nhóm, đồng phục cao cấp. Áo thun polo cá sấu hàng hiệu xuất khẩu",138.000₫,https://tiki.vn/ao-phong-ca-sau-nam-goking-hang-hieu-cao-cap-xuat-khau-p34964186.html?spid=204644202,33,,Đã bán 89,aothun
Áo Ba Lỗ lên form cực ngầu,76.000₫,https://tiki.vn/ao-ba-lo-len-form-cuc-ngau-p149415339.html?spid=169354943,34,,Đã bán 15,aothun
Áo thun ba lỗ tanktop,75.000₫,https://tiki.vn/ao-thun-ba-lo-tanktop-p242652947.html?spid=242652949,35,,,aothun
,,https://tiki.vn/ao-thun-polo-nam-khatoco-p252600185.html?spid=252600191,36,,,aothun
Áo Cộc Tay Nam Trắng Mịn Chất Mát THUNTRANG04,99.000₫,https://tiki.vn/ao-coc-tay-nam-trang-min-chat-mat-thuntrang04-p13730495.html?spid=13730503,37,,Đã bán 22,aothun
Áo Thun Nam Cotton Có Cổ TC115 F2,599.000₫,https://tiki.vn/ao-thun-nam-cotton-co-co-tc115-f2-p179128462.html?spid=179128515,38,,Đã bán 3,aothun
Áo Phông Polo Nam Slim Fit Dmax PL0S129 Cổ Dệt Cộc Tay,455.000₫,https://tiki.vn/ao-phong-polo-nam-slim-fit-dmax-pl0s129-co-det-coc-tay-p118103947.html?spid=118103951,39,,,aothun
Combo 2 Áo lót nam cổ tim tay ngắn FREEMAN TSF311,245.100,https://tiki.vn/ao-lot-nam-co-tim-tay-ngan-freeman-tsf311-combo-2-p90483829.html?spid=90483848,40,,,aothun
