title,price,link_item,index,discount,sales,category
áo khoác mũ thu đông hiphop thời trang nam nữ alan walker (đen),99.000₫,https://tiki.vn/ao-khoac-mu-thu-dong-hiphop-thoi-trang-nam-nu-alan-walker-den-p160831457.html?spid=160831488,1,-11%,Đã bán 1,aokhoacnu
Áo Khoác Jean Nữ Trẻ Trung,154.000₫,https://tiki.vn/ao-khoac-jean-nu-tre-trung-p49552166.html?spid=68773408,2,,Đã bán 18,aokhoacnu
"Áo Khoác Nữ Đẹp, Áo Khoác Nữ Form Rộng, Áo Khoác Nữ Chống Nắng Cao Cấp Có Túi Trong Tay Xỏ Ngón Thương Hiệu Baw AK91 (Hình thật shop tự chụp)",258.000₫,https://tiki.vn/ao-khoac-nu-dep-ao-khoac-nu-form-rong-ao-khoac-nu-chong-nang-cao-cap-co-tui-trong-tay-xo-ngon-thuong-hieu-baw-ak91-hinh-that-shop-tu-chup-p272424518.html?spid=272424520,3,-12%,,aokhoacnu
Áo vest croptop nữ dáng công sở hàn quốc áo khoác blazer nữ dáng ngắn đính khuy sang chảnh 2 lớp cao cấp dễ phối đồ mặc đi làm,289.000,https://tiki.vn/ao-vest-croptop-nu-dang-cong-so-han-quoc-ao-khoac-blazer-nu-dang-ngan-dinh-khuy-sang-chanh-2-lop-cao-cap-de-phoi-do-mac-di-lam-p229698178.html?spid=229698192,4,,,aokhoacnu
,,https://tiki.vn/ao-khoac-da-nu-chat-lu-ca-tinh-thiet-ke-manh-me-chat-da-xin-so-2020-ab0089-p98156818.html?spid=98156961,5,-40%,,aokhoacnu
Áo Len Mỏng Dệt Kim Tay Ngắn Kẻ Cổ Tròn Kiểu Hàn Quốc Form Rộng Haint Boutique Al42,131.000₫,https://tiki.vn/ao-len-mong-det-kim-tay-ngan-ke-co-tron-kieu-han-quoc-form-rong-haint-boutique-al42-p194477543.html?spid=194477544,6,-37%,,aokhoacnu
Áo khoác ren tà ngắn 06 C107,149.000₫,https://tiki.vn/ao-khoac-ren-ta-ngan-06-c107-p19646743.html?spid=19646745,7,,Đã bán 449,aokhoacnu
ÁO SWEATER NAM NỮ IN THẦN MÈO (NHIỀU MÀU),100.000₫,https://tiki.vn/ao-sweater-nam-nu-in-than-meo-nhieu-mau-p164985060.html?spid=164985115,8,-40%,Đã bán 3,aokhoacnu
Áo Khoác Jean nữ Thời Trang Thêu Họa Tiết - Áo khoác Bò Nữ Cao Cấp Thương Hiệu Chandi Onesize Từ 45kg Đến Dưới 60kg JN3,279.000,https://tiki.vn/ao-khoac-jean-nu-thoi-trang-theu-hoa-tiet-ao-khoac-bo-nu-cao-cap-thuong-hieu-chandi-onesize-tu-45kg-den-duoi-60kg-jn3-p169129807.html?spid=169129809,9,,,aokhoacnu
,,https://tiki.vn/ao-khoac-jennie-ni-chan-cua-form-rong-nam-nu-unisex-p126210158.html?spid=190154819,10,,,aokhoacnu
"áo phao béo nữ có mũ viền lông, áo khoác phao nữ thu đông kiểu hàn quốc siêu ấm",350.000₫,https://tiki.vn/ao-phao-beo-nu-co-mu-vien-long-ao-khoac-phao-nu-thu-dong-kieu-han-quoc-sieu-am-p141099733.html?spid=197746908,11,,Đã bán 1,aokhoacnu
"Áo vest blazer nữ Linen Premium, dáng lửng 2 ve ngóc trẻ trung ArcticHunter",299.000,https://tiki.vn/ao-vest-blazer-nu-linen-premium-dang-lung-2-ve-ngoc-tre-trung-arctichunter-p214595246.html?spid=214595270,12,,Đã bán 1,aokhoacnu
,,https://tiki.vn/ao-khoac-len-cadigan-hoa-tiet-ke-caro-soc-mem-min-freesize-arctic-hunter-ah13-p199565888.html?spid=199565892,13,,,aokhoacnu
"Áo Khoác Hoodie Viền Tay Bồng Nữ Jacket form rộng có mũ màu ĐEN ,HỒNG, XANH, TÍM THAN Ulzzang- KHOÁC NỈ TRƠN PHONG CÁCH HÀN QUỐC",110.000₫,https://tiki.vn/ao-khoac-hoodie-vien-tay-bong-nu-jacket-form-rong-co-mu-mau-den-hong-xanh-tim-than-ulzzang-p162030289.html?spid=162030295,14,,,aokhoacnu
"Áo khoác hoodie nỉ form rộng có mũ nam nữ unisex, áo khoác chống nắng from rộng Nam mũ đội 2 lớp to, áo khoác nam nữ giá rẻ học sinh, Áo Khoác Nỉ Ngoại AOA DUMBLE - Áo Hoodie Zip Trơn Nỉ Bông Thời Trang Cao Cấp",99.000₫,https://tiki.vn/ao-khoac-hoodie-ni-form-rong-co-mu-nam-nu-unisex-ao-khoac-chong-nang-from-rong-nam-mu-doi-2-lop-to-ao-khoac-nam-nu-gia-re-hoc-sinh-ao-khoac-ni-ngoai-aoa-dumble-ao-hoodie-zip-tron-ni-bong-thoi-trang-cao-cap-p260646276.html?spid=260646286,15,,,aokhoacnu
Áo vest 2 lớp GBQ024 LAMER L65B20T031,490.000₫,https://tiki.vn/ao-vest-2-lop-gbq024-lamer-l65b20t031-p75999561.html?spid=75999565,16,,,aokhoacnu
Áo hoodie nam nữ thu đông ấm áp chất nỉ mềm mại siêu dễ thương in chữ HARSII,158.000,https://tiki.vn/ao-hoodie-nam-nu-thu-dong-am-ap-chat-ni-mem-mai-sieu-de-thuong-in-chu-harsii-p191426460.html?spid=191426462,17,,,aokhoacnu
,,https://tiki.vn/ao-len-nu-phom-dang-rong-chat-day-co-tron-chui-dau-phong-cach-han-hang-quang-chau-arctic-hunter-p194785610.html?spid=194785611,18,,,aokhoacnu
Áo khoác lông nữ hàn quốc mũ lông thêu mặt gấu đáng yêu hàng 2 lớp dày mịn đẹp,145.000₫,https://tiki.vn/ao-khoac-long-nu-han-quoc-mu-long-theu-mat-gau-dang-yeu-hang-2-lop-day-min-dep-p272361561.html?spid=272361567,19,,,aokhoacnu
Áo khoác thời trang nữ Fila Regular Small Logo - FW2JKF1035F-BLK,1.677.000₫,https://tiki.vn/ao-khoac-thoi-trang-nu-fila-regular-small-logo-fw2jkf1035f-blk-p251788816.html?spid=251788818,20,,,aokhoacnu
"Áo khoác len dáng ngắn, áo cardigan len đóng cúc phối ren mẫu mới thu đông AK02",158.000₫,https://tiki.vn/ao-khoac-len-dang-ngan-ao-cardigan-len-dong-cuc-phoi-ren-mau-moi-thu-dong-ak02-p120794225.html?spid=120794227,21,,Đã bán 23,aokhoacnu
Áo Nữ Măng Tô Kaki,450.000₫,https://tiki.vn/ao-nu-mang-to-kaki-p16154027.html?spid=16154049,22,,Đã bán 78,aokhoacnu
Vest nữ công sở đen sọc trắng LUD Fashion,659.000₫,https://tiki.vn/vest-nu-cong-so-den-soc-trang-lud-fashion-p127617601.html?spid=127617635,23,,,aokhoacnu
Áo len mongtoghi dài tay kẻ đen trắng lưới rách cá tính nữ 170,25.000₫,https://tiki.vn/ao-len-mongtoghi-dai-tay-ke-den-trang-luoi-rach-ca-tinh-nu-170-p271887176.html?spid=271887180,24,,,aokhoacnu
Áo Khoác Dạ Cổ Trụ Dáng Dài Sang Trọng,800.000,https://tiki.vn/ao-khoac-da-co-tru-dang-dai-sang-trong-p203558528.html?spid=203558530,25,,,aokhoacnu
,,https://tiki.vn/ao-khoac-len-ao-cardigan-len-dong-cuc-ak36-p120794762.html?spid=120794766,26,,,aokhoacnu
Áo khoác nữ Áo khoát nữ kaki chống nắng Meizifei hàng bao chất đẹp cá tính-A096,173.250₫,https://tiki.vn/ao-khoac-nu-ao-khoat-nu-kaki-chong-nang-meizifei-hang-bao-chat-dep-ca-tinh-a096-p67847238.html?spid=113228674,27,,,aokhoacnu
"Bộ vest nữ cổ viền ve màu cốm thanh lịch, trẻ trung - DUKI STORE",539.000₫,https://tiki.vn/bo-vest-nu-co-vien-ve-mau-com-thanh-lich-tre-trung-duki-store-p78967788.html?spid=78967905,28,,Đã bán 18,aokhoacnu
"Áo khoác cardigan len nữ form rộng, len rệt tổ ong dày dặn ấm áp ArcticHunter, thời trang thương hiệu chính hãng - Be",220.000₫,https://tiki.vn/ao-khoac-cardigan-len-nu-form-rong-len-ret-to-ong-day-dan-am-ap-arctichunter-thoi-trang-thuong-hieu-chinh-hang-be-p199932581.html?spid=199932582,29,,Đã bán 1,aokhoacnu
"Áo vest blazer nhung tăm 2 lớp dáng lửng trẻ trung ArcticHunter, thời trang thương hiệu chính hãng",320.000,https://tiki.vn/ao-vest-blazer-nhung-tam-2-lop-dang-lung-tre-trung-arctichunter-thoi-trang-thuong-hieu-chinh-hang-p199054277.html?spid=199054283,30,,Đã bán 1,aokhoacnu
,,https://tiki.vn/ao-len-nu-coc-tay-cai-khuy-co-tron-tron-nhieu-mau-p117045819.html?spid=117045828,31,,,aokhoacnu
"Áo cardigan nữ , áo cardigan nam , áo khoác cardigan nam nữ mặc vải nỉ ngoại chống nắng chống lạnh tốt",100.000₫,https://tiki.vn/ao-cardigan-nu-ao-cardigan-nam-ao-khoac-cardigan-nam-nu-mac-vai-ni-ngoai-chong-nang-chong-lanh-tot-p72455126.html?spid=72520960,32,,Đã bán 35,aokhoacnu
"Áo khoác nhẹ giả vest - nhiều size và màu form dáng chuẩn thích hợp mặc đi làm, dạo phố",230.000₫,https://tiki.vn/ao-khoac-nhe-gia-vest-nhieu-size-va-mau-form-dang-chuan-thich-hop-mac-di-lam-dao-pho-p98003787.html?spid=98003801,33,,Đã bán 15,aokhoacnu
"áo khoác Blackpink Hoodies, Áo khoác hoodie nữ Born Pink giống Black Pink dễ thương, áo hoodie nữ mặc concert, Áo nỉ dái tay áo hoodie World Tour JISOO JENNIE Rose LISA",100.000₫,https://tiki.vn/ao-khoac-blackpink-hoodies-ao-khoac-hoodie-nu-born-pink-giong-black-pink-de-thuong-ao-hoodie-nu-mac-concert-ao-ni-dai-tay-ao-hoodie-world-tour-jisoo-jennie-rose-lisa-p270712832.html?spid=270712848,34,,Đã bán 3,aokhoacnu
Áo lông vũ siêu nhẹ Olmesa,420.000,https://tiki.vn/ao-long-vu-sieu-nhe-olmesa-sale-420k-p128312166.html?spid=128312372,35,,,aokhoacnu
,,https://tiki.vn/ao-khoac-vest-blazer-nu-phong-cach-han-quoc-2-tui-chat-dui-xuoc-cao-cap-ma-sp11-p112195251.html?spid=167507309,36,,,aokhoacnu
Áo khoác thời trang nữ Fila Drewe Sherpa - LW231138-172,957.000₫,https://tiki.vn/ao-khoac-thoi-trang-nu-fila-drewe-sherpa-lw231138-172-p213721685.html?spid=213721689,37,,,aokhoacnu
"Áo len nữ mỏng phối lưới, cổ tròn xinh xắn, style nhẹ nhàng nữ tính Al32",129.000₫,https://tiki.vn/ao-len-nu-mong-phoi-luoi-co-tron-xinh-xan-style-nhe-nhang-nu-tinh-al32-p199119675.html?spid=199119676,38,,,aokhoacnu
Áo khoác cardigan len nữ A416,165.000₫,https://tiki.vn/ao-khoac-cardigan-len-nu-a416-p148823856.html?spid=148823872,39,,Đã bán 94,aokhoacnu
Hàng Sẵn_ Áo len đan nữ mùa thu dáng ngắn,215.000,https://tiki.vn/hang-san_-ao-len-dan-nu-mua-thu-dang-ngan-p196350119.html?spid=196350137,40,,,aokhoacnu
