title,price,link_item,index,discount,sales,brand
Bộ Bài Bói Tarot Of The Cloisters Tarot Waite-Smith Cao Cấp Bản Đẹp,119.000₫,https://tiki.vn/bo-bai-boi-tarot-of-the-cloisters-tarot-waite-smith-cao-cap-ban-dep-p38839437.html?spid=73937400,1,,Đã bán 1,nifoki
Bộ Bài Bói Alchemy 1977 England Tarot Cao Cấp Bản Đẹp,119.000₫,https://tiki.vn/bo-bai-boi-alchemy-1977-england-tarot-cao-cap-ban-dep-p38839402.html?spid=73937348,2,,,nifoki
Bộ Tranh Ghép Xếp Hình 1000 Pcs Jigsaw Puzzle (Tranh ghép 70*50cm) Moulin Rouge Bản Thú Vị Cao Cấp,109.000₫,https://tiki.vn/bo-tranh-ghep-xep-hinh-1000-pcs-jigsaw-puzzle-tranh-ghep-70-50cm-moulin-rouge-ban-thu-vi-cao-cap-p72469624.html?spid=73937143,3,,Đã bán 4,nifoki
Bộ Bài Tarot Bói Smith Waite Tarot Cao Cấp,79.000₫,https://tiki.vn/bo-bai-tarot-boi-smith-waite-tarot-cao-cap-p270847775.html?spid=270847777,4,,,nifoki
,,https://tiki.vn/bo-bai-boi-tarot-z-deck-new-cao-cap-p46906926.html?spid=73938070,5,,,nifoki
Bộ Tranh Ghép Xếp Hình 1000 Pcs Jigsaw Puzzle Hot Air Balloon Festival Thú Vị Cao Cấp,109.000₫,https://tiki.vn/bo-tranh-ghep-xep-hinh-1000-pcs-jigsaw-puzzle-hot-air-balloon-festival-thu-vi-cao-cap-p68603221.html?spid=73938072,6,,,nifoki
Bộ Tranh Ghép Xếp Hình 1000 Chi Tiết Time Square Thú Vị Cao Cấp,109.000₫,https://tiki.vn/bo-tranh-ghep-xep-hinh-1000-chi-tiet-time-square-thu-vi-cao-cap-p68602990.html?spid=73938056,7,,Đã bán 1,nifoki
Bộ Bài Bói The Gilded Tarot New Cao Cấp,119.000₫,https://tiki.vn/bo-bai-boi-the-gilded-tarot-new-cao-cap-p46907658.html?spid=73938074,8,,,nifoki
Bộ Bài Bói Tarot Aleister Crowley Thoth Tarot New Cao Cấp,119.000,https://tiki.vn/bo-bai-boi-tarot-aleister-crowley-thoth-tarot-new-cao-cap-p46909273.html?spid=73938085,9,,Đã bán 2,nifoki
,,https://tiki.vn/bo-bai-boi-tarot-queen-of-the-moon-oracle-card-deck-cao-cap-dep-p52378292.html?spid=73938116,10,,,nifoki
Bộ Bài Bói Tarot Mystical Wisdom Card Deck Cao Cấp Đẹp,119.000₫,https://tiki.vn/bo-bai-boi-tarot-mystical-wisdom-card-deck-cao-cap-dep-p52376490.html?spid=73938102,11,,Đã bán 5,nifoki
Bộ Bài Bói Tarot Everyday Witch Oracle Card Deck Cao Cấp Đẹp,119.000,https://tiki.vn/bo-bai-boi-tarot-everyday-witch-oracle-card-deck-cao-cap-dep-p52380784.html?spid=73938128,12,,,nifoki
,,https://tiki.vn/bo-bai-boi-tarot-conscious-spirit-oracle-deck-cao-cap-p52369571.html?spid=73938110,13,,,nifoki
Bộ Tarot Oracle of the Fairies Bài Bói New,119.000₫,https://tiki.vn/bo-tarot-oracle-of-the-fairies-bai-boi-new-p57471112.html?spid=74178586,14,,Đã bán 5,nifoki
Bộ Bài Bói Tarot Gilded Reverie Lenormand – Expanded Edition Cards Cao Cấp,119.000₫,https://tiki.vn/bo-bai-boi-tarot-gilded-reverie-lenormand-expanded-edition-cards-cao-cap-p36760094.html?spid=74179564,15,,,nifoki
Bộ Tranh Ghép Xếp Hình 1000 Pcs Jigsaw Puzzle Tranh Ghép (75*50cm) Chó Cưng Bản Đẹp Cao Cấp,109.000₫,https://tiki.vn/bo-tranh-ghep-xep-hinh-1000-pcs-jigsaw-puzzle-tranh-ghep-75-50cm-cho-cung-ban-dep-cao-cap-p72058890.html?spid=73937381,16,,Đã bán 2,nifoki
Bộ Tarot Crazy Sexy Love Notes Cards New,119.000,https://tiki.vn/bo-tarot-crazy-sexy-love-notes-cards-new-p63588595.html?spid=74179287,17,,,nifoki
,,https://tiki.vn/bo-bai-kawaii-tarot-cards-p63577954.html?spid=74179340,18,,,nifoki
Bộ Tranh Ghép Xếp Hình 2000 Pcs Jigsaw Puzzle(70*100cm) Bản Cao Cấp Tổng Hợp Những Mẫu Hot Nhất,279.000₫,https://tiki.vn/bo-tranh-ghep-xep-hinh-2000-pcs-jigsaw-puzzle-70-100cm-ban-cao-cap-tong-hop-nhung-mau-hot-nhat-p118209005.html?spid=118209015,19,,Đã bán 5,nifoki
Bộ Bài Tarot Bói REBEL DECK - The Oracle with Attitude - Oracle Deck (60 Cards) Siêu Hot,199.000₫,https://tiki.vn/bo-bai-tarot-boi-rebel-deck-the-oracle-with-attitude-oracle-deck-60-cards-sieu-hot-p46910526.html?spid=73938096,20,,Đã bán 4,nifoki
Bộ Bài Bói Animal Totem Tarot Leeza Robertson Tarot Cao Cấp,119.000₫,https://tiki.vn/bo-bai-boi-animal-totem-tarot-leeza-robertson-tarot-hop-sat-cao-cap-p32427548.html?spid=73882249,21,,,nifoki
Combo Bộ Bài Bói The Rider Waite Tarot và Túi Nhung Cao Cấp,119.000₫,https://tiki.vn/combo-bo-bai-boi-the-rider-waite-tarot-va-tui-nhung-cao-cap-p32835143.html?spid=73934491,22,,Đã bán 13,nifoki
Bộ Bài Tây Đen M Stand Cao Cấp 54 Lá Chất Liệu Giấy Đen Nhám Sang Trọng Tinh Tế Thẻ Bài Sưu Tầm Đáng Yêu,39.000₫,https://tiki.vn/bo-bai-tay-den-m-stand-cao-cap-54-la-chat-lieu-giay-den-nham-sang-trong-tinh-te-the-bai-suu-tam-dang-yeu-p273909995.html?spid=273909996,23,,,nifoki
Bộ Bài Tarot The Magician Cao Câp,129.000₫,https://tiki.vn/bo-bai-tarot-the-magician-cao-cap-p32410614.html?spid=73885291,24,,,nifoki
Bộ bài Uno No Mercy 165 thẻ bài cuộc chơi nâng cấp +10 luật chơi khắc nghiệt trò chơi thẻ bài Board Game Việt,90.000₫,https://tiki.vn/bo-bai-uno-no-mercy-165-the-bai-cuoc-choi-nang-cap-10-luat-choi-khac-nghiet-tro-choi-the-bai-board-game-viet-p273876465.html?spid=273876466,25,,,nifoki
,,https://tiki.vn/vong-quay-trung-thuong-dieu-ky-25-cm-10-o-co-the-viet-but-long-len-lam-qua-trao-giai-giao-cu-day-hoc-va-su-kien-p273588218.html?spid=273474361,26,,,nifoki
Bộ Bài Oracle Sacred Destiny 52 Lá Bài Tặng File Tiếng Anh Và Đá Thanh Tẩy,90.000₫,https://tiki.vn/bo-bai-oracle-sacred-destiny-52-la-bai-tang-file-tieng-anh-va-da-thanh-tay-p94674229.html?spid=94674245,27,,Đã bán 3,nifoki
Vòng quay ăn nhậu uống rượu bia Drinking Game Roulette 25 cm 16 ô nội dung thú vị giải trí trong bữa tiệc,115.000₫,https://tiki.vn/vong-quay-an-nhau-uong-ruou-bia-drinking-game-roulette-25-cm-16-o-noi-dung-thu-vi-giai-tri-trong-bua-tiec-p273588254.html?spid=273554380,28,,,nifoki
Bộ Tarot de la Nuit New,119.000₫,https://tiki.vn/bo-tarot-de-la-nuit-new-p63582832.html?spid=74179282,29,,Đã bán 2,nifoki
Bộ Tranh Ghép Xếp Hình 1000 Pcs Jigsaw Puzzle Tranh Ghép (75*50cm) Xe Cổ Đỏ Bản Đẹp Cao Cấp,109.000,https://tiki.vn/bo-tranh-ghep-xep-hinh-1000-pcs-jigsaw-puzzle-tranh-ghep-75-50cm-xe-co-do-ban-dep-cao-cap-p72061086.html?spid=73937571,30,,,nifoki
,,https://tiki.vn/bo-tranh-ghep-xep-hinh-1000-pcs-jigsaw-puzzle-tranh-ghep-70-50cm-locket-colosseum-ban-thu-vi-cao-cap-p72469805.html?spid=73937290,31,,,nifoki
Bộ Bài BóiThe Fountain Tarot: Illustrated Deck and 79 cards Tarot Cao Cấp Bản Đẹp,119.000₫,https://tiki.vn/bo-bai-boithe-fountain-tarot-illustrated-deck-and-79-cards-tarot-cao-cap-ban-dep-p38838654.html?spid=73937440,32,,Đã bán 3,nifoki
Bộ Tranh Ghép Xếp Hình 1000 Pcs Jigsaw Puzzle Tranh Ghép (75*50cm) Taj Mahal Bản Đẹp Cao Cấp,109.000₫,https://tiki.vn/bo-tranh-ghep-xep-hinh-1000-pcs-jigsaw-puzzle-tranh-ghep-75-50cm-taj-mahal-ban-dep-cao-cap-p72058057.html?spid=73937401,33,,Đã bán 3,nifoki
Bộ Bài Romance Angels Oracle Cards Cao Cấp,99.000₫,https://tiki.vn/bo-bai-romance-angels-oracle-cards-cao-cap-p270847019.html?spid=270847021,34,,,nifoki
Bộ Bài Smith Waite Tarot H3 – Borderless Edition Cao Cấp,139.000,https://tiki.vn/bo-bai-smith-waite-tarot-h3-borderless-edition-cao-cap-p270847619.html?spid=270847621,35,,,nifoki
,,https://tiki.vn/bo-tranh-ghep-hinh-1000-pcs-75-50cm-jigsaw-puzzle-mieng-ghep-go-cao-cap-p113535088.html?spid=113535097,36,,,nifoki
Bộ Bài Bói Chrysalis Tarot Cao Cấp New Cao Cấp,119.000₫,https://tiki.vn/bo-bai-boi-chrysalis-tarot-cao-cap-new-cao-cap-p46260911.html?spid=73938036,37,,,nifoki
Bộ Bài Bói Tarot Oracle of Visions Card Deck Cao Cấp Đẹp,119.000₫,https://tiki.vn/bo-bai-boi-tarot-oracle-of-visions-card-deck-cao-cap-dep-p52376930.html?spid=73938124,38,,,nifoki
Bộ Bài Bói Tarot Illuminati Kit Deck New Cao Cấp,119.000₫,https://tiki.vn/bo-bai-boi-tarot-illuminati-kit-deck-new-cao-cap-p46908263.html?spid=73938066,39,,Đã bán 2,nifoki
Bộ Bài Bói Wild Unknown Archetypes 78 cards New Đẹp,119.000,https://tiki.vn/bo-bai-boi-wild-unknown-archetypes-78-cards-new-dep-p53468095.html?spid=73938178,40,,,nifoki
