title,price,link_item,index,discount,sales,category
"Kem cấp ẩm, dưỡng trắng da và ngăn ngừa mụn Wonmom 50g",175.000₫,https://tiki.vn/kem-cap-am-duong-trang-da-va-ngan-ngua-mun-wonmom-50g-p221251717.html?spid=260640554,1,-41%,,chamsocme
"Sữa Tắm Thảo Mộc Mềm Mại, Sáng Hồng Da Cho Mẹ Bầu Wonmom 250ml",115.000₫,https://tiki.vn/sua-tam-thao-moc-mem-mai-sang-hong-da-cho-me-bau-wonmom-250ml-p221251788.html?spid=260629349,2,-47%,,chamsocme
"Bộ xông hơi thải độc, tái tạo da cơ bản Wonmom ( 1 Hộp xông mặt + 1 Scrub nghệ tẩy mặt )",245.000₫,https://tiki.vn/bo-xong-hoi-thai-doc-tai-tao-da-co-ban-wonmom-1-hop-xong-mat-1-scrub-nghe-tay-mat-p221251701.html?spid=260640673,3,,,chamsocme
Máy hút sữa Spectra 9S 2019 Combo quà tặng,2.480.000₫,https://tiki.vn/may-hut-sua-spectra-9s-2019-combo-qua-tang-p35339881.html?spid=36340051,4,,Đã bán 3,chamsocme
"Cốt Bồ Kết Đánh Bay Gàu, Kích Thích Mọc Tóc Wonmom 250ml",125.000₫,https://tiki.vn/cot-bo-ket-danh-bay-gau-kich-thich-moc-toc-wonmom-250ml-p221251840.html?spid=260451936,5,,,chamsocme
"Bộ xông hơi thải độc, tái tạo và làm sạch da chuyên sâu Wonmom",399.000₫,https://tiki.vn/bo-xong-hoi-thai-doc-tai-tao-va-lam-sach-da-chuyen-sau-wonmom-p221251645.html?spid=260673147,6,,,chamsocme
Combo kem sữa nghệ toàn thân và thảo mộc vệ sinh cho mẹ Wonmom,420.000₫,https://tiki.vn/combo-kem-sua-nghe-toan-than-va-thao-moc-ve-sinh-cho-me-wonmom-p221251880.html?spid=260671787,7,,,chamsocme
SET 2 QUẦN QUẦN LÓT BẦU - QLNU14,45.000₫,https://tiki.vn/set-2-quan-quan-lot-bau-qlnu14-p94572065.html?spid=94572177,8,,,chamsocme
Combo Máy Hút Sữa Spectra M1 + Máy hâm sữa 3 chức năng FatzBaby FB3003SL,2.095.000₫,https://tiki.vn/combo-may-hut-sua-spectra-m1-may-ham-sua-3-chuc-nang-fatzbaby-fb3003sl-p23503639.html?spid=59273957,9,,,chamsocme
Máy Hút Sữa Spectra M1 + Tặng kèm Van 1 chiều máy hút sữa Spectra,2.095.000₫,https://tiki.vn/may-hut-sua-spectra-m1-tang-kem-van-1-chieu-may-hut-sua-spectra-p41432310.html?spid=59273798,10,,,chamsocme
Bộ dưỡng trắng hồng da toàn thân Wonmom (1 kem sữa nghệ + 1 scrub cafe tẩy tế bào chết toàn thân),395.000₫,https://tiki.vn/bo-duong-trang-hong-da-toan-than-wonmom-1-kem-sua-nghe-1-scrub-cafe-tay-te-bao-chet-toan-than-p221251827.html?spid=260673469,11,,,chamsocme
Bộ tắm gội toàn diện từ thảo mộc Wonmom ( 1 Dầu gội cốt bồ kết + 1 Sữa tắm cho mẹ + 1 Scrub café tẩy body ),420.000₫,https://tiki.vn/bo-tam-goi-toan-dien-tu-thao-moc-wonmom-1-dau-goi-cot-bo-ket-1-sua-tam-cho-me-1-scrub-cafe-tay-body-p221251640.html?spid=260673546,12,,,chamsocme
"Kem Sữa Nghệ Dưỡng Trắng Hồng Tự Nhiên, Mịn Màng Da Toàn Thân Wonmom 180g",220.000₫,https://tiki.vn/kem-sua-nghe-duong-trang-hong-tu-nhien-min-mang-da-toan-than-wonmom-180g-p221251752.html?spid=260640659,13,,Đã bán 1,chamsocme
Hộp 50 túi trữ sữa Sunmum chính hãng Thái Lan (250ml) có 3 khóa kéo,82.000₫,https://tiki.vn/hop-50-tui-tru-sua-sunmum-chinh-hang-thai-lan-250ml-co-3-khoa-keo-p168054797.html?spid=262076710,14,,Đã bán 1,chamsocme
Gen bụng cao cấp làm đẹp cho mẹ Bảo Nhiên,180.000₫,https://tiki.vn/gen-bung-cao-cap-lam-dep-cho-me-bao-nhien-p44665617.html?spid=44665618,15,,Đã bán 2,chamsocme
MÁY HÚT SỮA ĐIỆN RẢNH TAY VÀ KHÔNG DÂY CÓ PIN SẠC FREEMAX 2 FATZBABY FB1202CW (1 CHIẾC)/2 CHIẾC,1.139.000₫,https://tiki.vn/may-hut-sua-dien-ranh-tay-va-khong-day-co-pin-sac-freemax-2-fatzbaby-fb1202cw-1-chiec-2-chiec-p157425939.html?spid=254896485,16,,,chamsocme
Máy Hút Sữa Đôi Spectra 9 Plus - Tặng Kèm 10 Khăn Sữa In Hình Xuất Nhật,2.895.000₫,https://tiki.vn/may-hut-sua-doi-spectra-9-plus-tang-kem-10-khan-sua-in-hinh-xuat-nhat-p16205881.html?spid=98155783,17,,,chamsocme
Máy hút sữa Hai bên spectra M1 có Pin sạc Hàn Quốc chính hãng Tặng kèm 30 túi trữ sữa,2.095.000₫,https://tiki.vn/may-hut-sua-hai-ben-spectra-m1-co-pin-sac-han-quoc-chinh-hang-tang-kem-30-tui-tru-sua-p92806939.html?spid=98153869,18,,,chamsocme
Dầu chống rạn 70g,85.000₫,https://tiki.vn/dau-chong-ran-70g-p51273326.html?spid=92512733,19,,,chamsocme
Bộ 3 bình trữ sữa Faztbaby FB0120NH 150ml Màu,95.000₫,https://tiki.vn/bo-3-binh-tru-sua-faztbaby-fb0120n-150ml-p67851824.html?spid=107423412,20,,Đã bán 6,chamsocme
Gen Nịt Bụng Cao Cấp Bảo Nhiên,135.000₫,https://tiki.vn/gen-nit-bung-cao-cap-bao-nhien-p15229271.html?spid=76753040,21,,Đã bán 4,chamsocme
Máy hút sữa điện đôi - Chorus 2 - FB1182MX,670.000₫,https://tiki.vn/may-hut-sua-dien-doi-chorus-2-fb1182mx-p75581508.html?spid=97499863,22,,Đã bán 3,chamsocme
"Spectra 9 Plus , Cup hút sữa rảnh tay Spectra Size 17/19/21/24mm",3.400.000₫,https://tiki.vn/spectra-9-plus-cup-hut-sua-ranh-tay-spectra-size-17-19-21-24mm-p73175192.html?spid=73175196,23,,Đã bán 1,chamsocme
Hộp 10 Túi Thảo Mộc Xông Vùng Kín Cho Mẹ Sau Sinh Wonmom,128.000₫,https://tiki.vn/hop-10-tui-thao-moc-xong-vung-kin-cho-me-sau-sinh-wonmom-p116409457.html?spid=157832651,24,,Đã bán 1,chamsocme
Miếng massage hình cánh hoa Unimom CSB5568,88.000₫,https://tiki.vn/mieng-massage-hinh-canh-hoa-unimom-csb5568-p107152524.html?spid=107152525,25,,Đã bán 1,chamsocme
Van Silicon Cup Hút Sữa Spectra Handsfree,47.250₫,https://tiki.vn/van-silicon-cup-hut-sua-spectra-handsfree-p24823922.html?spid=59271776,26,,Đã bán 6,chamsocme
"Dầu Gội Cốt Bồ Kết Sạch Gàu, Nuôi Dưỡng Tóc Đen Mượt Wonmom 250ml",132.000₫,https://tiki.vn/dau-goi-cot-bo-ket-sach-gau-nuoi-duong-toc-den-muot-wonmom-250ml-p221251843.html?spid=257842755,27,,,chamsocme
"Quần lót bầu cotton cạp chéo imom care, kháng khuẩn, khử mùi, thông hơi cực tốt - QLB2",50.000₫,https://tiki.vn/quan-lot-bau-cotton-cap-cheo-imom-care-khang-khuan-khu-mui-thong-hoi-cuc-tot-qlb2-p216435872.html?spid=216435903,28,,,chamsocme
Cốc hứng sữa silicone Gen.2 100/150ml kèm Nắp đậy Haakaa,515.000₫,https://tiki.vn/combo-coc-hung-sua-silicone-gen-2-100-150ml-va-nap-day-haakaa-p170391073.html?spid=170391075,29,,Đã bán 1,chamsocme
QUẦN LÓT DÙNG 1 LẦN NARIS - COTTON (LOẠI 1),31.000₫,https://tiki.vn/quan-lot-dung-1-lan-naris-cotton-loai-1-p94632496.html?spid=272357137,30,,Đã bán 61,chamsocme
"Bán lẻ TẤM ĐỆM LÓT SẢN PHỤ, NGƯỜI GIÀ SIÊU THẤM HÚT",30.000₫,https://tiki.vn/hsd-2026-27-ban-le-tam-dem-lot-san-phu-nguoi-gia-caryn-sieu-tham-hut-p247541277.html?spid=247541283,31,,,chamsocme
Quần mặc trong váy bầu VB221 Chất Liệu Cotton Thun Co giãn Thấm Hút Mồ Hôi,55.000₫,https://tiki.vn/quan-mac-trong-vay-bau-vb221-chat-lieu-cotton-thun-co-gian-tham-hut-mo-hoi-p97979225.html?spid=97979229,32,,Đã bán 11,chamsocme
"Gối bà bầu cao cấp 2 trong 1 imom, có kèm gối ôm cho bà bầu, có thể dùng được cả sau khi sinh con - GB2in1",359.000₫,https://tiki.vn/goi-ba-bau-cao-cap-2-trong-1-imom-co-kem-goi-om-cho-ba-bau-co-the-dung-duoc-ca-sau-khi-sinh-con-gb2in1-p216435813.html?spid=271441550,33,,,chamsocme
Bộ Chậu Xông Vùng Kín Sau Sinh Gấp Gọn Bằng Nhựa Gắn Bồn Cầu Để Nhà Tắm Tiện Lợi Với Vòi Tự Xịt Nước,91.000₫,https://tiki.vn/bo-chau-xong-vung-kin-sau-sinh-gap-gon-bang-nhua-gan-bon-cau-de-nha-tam-tien-loi-voi-voi-tu-xit-nuoc-p114188471.html?spid=177270246,34,,,chamsocme
Áo lót cho con bú 100% cotton loại 1,40.000₫,https://tiki.vn/ao-lot-cho-con-bu-100-cotton-loai-1-p116776079.html?spid=116776088,35,,,chamsocme
SÉT 25 GÓI QUẦN LÓT GIẤY CHO MẸ (GÓI 5 CHIẾC),130.000₫,https://tiki.vn/set-25-goi-quan-lot-giay-cho-me-goi-5-chiec-p93245578.html?spid=93245591,36,,,chamsocme
Combo 3 áo cho con bú 100% cotton cực đẹp,115.000₫,https://tiki.vn/combo-3-ao-cho-con-bu-100-cotton-cuc-dep-p116776213.html?spid=116776225,37,,,chamsocme
5 Chiếc quần lót giấy,11.700₫,https://tiki.vn/5-chiec-quan-lot-giay-p93246416.html?spid=93246419,38,,,chamsocme
Đai nịt bụng ngắn 23cm Hi Lạp,279.000₫,https://tiki.vn/dai-nit-bung-latex-ngan-23cm-hi-lap-p118714474.html?spid=118714568,39,,Đã bán 1,chamsocme
Áo lót cho con bú chấm bi,75.400₫,https://tiki.vn/ao-lot-cho-con-bu-cham-bi-p93246266.html?spid=93246294,40,,,chamsocme
