title,price,link_item,index,discount,sales,category
Miếng Lót Thấm Sữa Giặt Được Bằng Vải Goodmama (Hộp 8 Miếng),95.000₫,https://tiki.vn/mieng-lot-tham-sua-giat-duoc-bang-vai-goodmama-hop-8-mieng-p967273.html?spid=21368014,1,-5%,Đã bán 699,chamsocme
"Núm Trợ Ti Maymom, Chất Liệu Silicone Siêu Mềm, Giúp Mẹ Cho Bú Dễ Dàng Hơn, Dùng Được Cho Trẻ Sơ Sinh và Em Bé",95.000₫,https://tiki.vn/num-tro-ti-maymom-chat-lieu-silicone-sieu-mem-giup-me-cho-bu-de-dang-hon-dung-duoc-cho-tre-so-sinh-va-em-be-p203441035.html?spid=13420778,2,-50%,Đã bán 39,chamsocme
Đai nịt bụng dưới 8129,190.000₫,https://tiki.vn/dai-nit-bung-duoi-8129-p272586744.html?spid=272586759,3,-12%,Đã bán 5,chamsocme
"Tai nghe thai nhi - Tai nghe bà bầu, máy nghe nhạc cho mẹ và bé",228.000₫,https://tiki.vn/tai-nghe-thai-nhi-tai-nghe-ba-bau-may-nghe-nhac-cho-me-va-be-p192445160.html?spid=192445161,4,-50%,Đã bán 5,chamsocme
Ghế xông hơi vùng kín bằng gỗ có lớp bọc cách nhiệt,235.000₫,https://tiki.vn/ghe-xong-hoi-vung-kin-bang-go-co-lop-boc-cach-nhiet-p33578617.html?spid=51048067,5,-20%,Đã bán 136,chamsocme
3 Áo Lót Bầu Và Sau SInh Có Cúc Bấm,89.800₫,https://tiki.vn/3-ao-lot-bau-va-sau-sinh-co-cuc-bam-thai-lan-p23083860.html?spid=52374870,6,-45%,Đã bán 210,chamsocme
Gối Ôm Chữ U Đa Năng cho Bà Bầu - Gối Ngủ cho Mẹ Bầu chính hãng Zcare - chứng nhận Độc Quyền bởi bộ Khoa học công nghệ,619.000₫,https://tiki.vn/goi-om-chu-u-da-nang-cho-ba-bau-goi-ngu-cho-me-bau-chinh-hang-zcare-chung-nhan-doc-quyen-boi-bo-khoa-hoc-cong-nghe-p51622180.html?spid=51622181,7,-15%,Đã bán 95,chamsocme
"Áo Ngực cho mẹ Bầu mẫu mới 2023 và cho con bú Chất Liệu Su Non mềm mát không gọng bigsize thương hiệu BAW, mã KQA21",94.050₫,https://tiki.vn/ao-nguc-cho-me-bau-mau-moi-2023-va-cho-con-bu-chat-lieu-su-non-mem-mat-khong-gong-bigsize-thuong-hieu-baw-ma-kqa21-p272348653.html?spid=272348669,8,-18%,Đã bán 16,chamsocme
Áo lót Medela Hands-free Pumping Bustier - Áo hút sữa rảnh tay cho các mẹ,1.300.000₫,https://tiki.vn/ao-lot-medela-hands-free-pumping-bustier-ao-hut-sua-ranh-tay-cho-cac-me-p251264126.html?spid=251264134,9,-4%,Đã bán 2,chamsocme
"Nồi xông hơi dùng cho lều xông hơi, thùng xông đầu, phòng xông hơi",359.000₫,https://tiki.vn/noi-xong-hoi-dung-cho-leu-xong-hoi-thung-xong-dau-phong-xong-hoi-p128596787.html?spid=144200572,10,-12%,Đã bán 14,chamsocme
1 Van chân không FatzBaby Chorus 2 - Fatz - phụ kiện cho máy hút sữa điện đôi - mã Máy FB1182MX,25.000₫,https://tiki.vn/1-van-chan-khong-fatzbaby-chorus-2-fatz-phu-kien-cho-may-hut-sua-dien-doi-ma-may-fb1182mx-p184035626.html?spid=184035627,11,-5%,Đã bán 26,chamsocme
Balo Bỉm Sữa Đa Năng Tích Hợp Nôi Cho Bé Gấp Gọn Nhiều Ngăn Giữ Nhiệt Túi Bỉm Sữa Vải Chống Bụi Chống Thấm Nước Cao Cấp Ba Lô Giường Gấp Di Động Cho Bé Quai Cầm Thông Minh,399.000₫,https://tiki.vn/balo-bim-sua-da-nang-tich-hop-noi-cho-be-gap-gon-nhieu-ngan-giu-nhiet-tui-bim-sua-vai-chong-bui-chong-tham-nuoc-cao-cap-ba-lo-giuong-gap-di-dong-cho-be-quai-cam-thong-minh-p209396234.html?spid=209396236,12,-10%,Đã bán 179,chamsocme
"Phễu Hút Sữa Maymom Myfit, Phụ Kiện Thay Thế Máy Vắt Sữa Medela, Spectra, Avent, Unimom, Rozabi, Cimilre",110.000₫,https://tiki.vn/pheu-hut-sua-maymom-myfit-phu-kien-thay-the-may-vat-sua-medela-spectra-avent-unimom-rozabi-cimilre-p198696813.html?spid=198696838,13,-20%,Đã bán 111,chamsocme
Lều Xông Hơi Cao Cấp Mộc Miên ( Nhiều Màu Lựa Chọn),499.000₫,https://tiki.vn/leu-xong-hoi-p263396342.html?spid=6012869,14,,Đã bán 401,chamsocme
"Áo Hút Sữa Rảnh Tay FatzBaby Có Dây Chất Vải Xịn Mịn Ôm Chặt Bầu Ngực Hút Sữa Dễ Dàng, Áo Ngực Vắt Sữa Kiêm Áo Lót Tiện Lợi, Thoáng Mát Không Gây Khó Chịu",89.000₫,https://tiki.vn/ao-hut-sua-ranh-tay-fatzbaby-co-day-chat-vai-xin-min-om-chat-bau-nguc-hut-sua-de-dang-ao-nguc-vat-sua-kiem-ao-lot-tien-loi-thoang-mat-khong-gay-kho-chiu-p208187004.html?spid=208187006,15,,Đã bán 66,chamsocme
"Xông Tắm Sau Sinh Dao'spa Mama, hộp 3 chai (250ml/chai) - Tặng 1 chai tắm bé Dao'spa baby 150ml - DK Pharma",322.000₫,https://tiki.vn/xong-tam-sau-sinh-dao-spa-mama-hop-3-chai-250ml-chai-tang-1-chai-tam-be-dao-spa-baby-150ml-dk-pharma-p270272982.html?spid=270272983,16,,Đã bán 2,chamsocme
"Áo Lót Bầu Sau Sinh Cho Con Bú Chống Chảy Xệ Cao Cấp Chất Liệu Tencel, Họa Tiết Chấm Bi - Thương Hiệu Mothersbaby Hàn Quốc",580.000₫,https://tiki.vn/ao-lot-bau-sau-sinh-cho-con-bu-chong-chay-xe-cao-cap-chat-lieu-tencel-hoa-tiet-cham-bi-thuong-hieu-mothersbaby-han-quoc-p270849158.html?spid=270849168,17,,Đã bán 4,chamsocme
Van silicon cho máy hút sữa Freemax 5 fatzbaby FB1212SJ,66.000₫,https://tiki.vn/van-silicon-cho-may-hut-sua-freemax-5-fatzbaby-fb1212sj-p248295567.html?spid=248295568,18,,Đã bán 3,chamsocme
"Lá thảo dược phơi khô giải cảm, xông hơi toàn thân - Gói 100g - Hút chân không",30.000₫,https://tiki.vn/la-xong-thao-duoc-phoi-kho-giai-cam-xong-hoi-toan-than-goi-100g-gom-9-loai-thao-duoc-hut-chan-khong-p116391771.html?spid=116391772,19,,Đã bán 255,chamsocme
"Combo 3 Bao Quần Lót Miễn Giặt Mẹ Bầu MOTHERHOOD, 4 Cái/Bao",144.000₫,https://tiki.vn/combo-3-bao-quan-lot-me-bau-motherhood-4-cai-bao-p272059977.html?spid=272059979,20,,Đã bán 3,chamsocme
Áo lót bầu và sau sinh cho con bú- Sunbaby,62.000₫,https://tiki.vn/ao-lot-bau-va-sau-sinh-cho-con-bu-sunbaby-p21509748.html?spid=21509756,21,,Đã bán 341,chamsocme
Máy hút sữa điện đôi GoMini Pigeon (HSD: 03/2025),1.592.000₫,https://tiki.vn/may-hut-sua-dien-doi-gomini-pigeon-p104144579.html?spid=104144611,22,,Đã bán 45,chamsocme
"Máy Hút Sữa Không Dây Mama's Choice, Vắt Sữa Rảnh Tay Mọi Lúc Mọi Nơi, Pin Sạc Tiện Lợi, BH 1 Đổi 1 Mới 12 Tháng - 1 Máy",1.690.000₫,https://tiki.vn/may-hut-sua-khong-day-mama-s-choice-vat-sua-ranh-tay-moi-luc-moi-noi-pin-sac-tien-loi-bh-1-doi-1-moi-12-thang-1-may-p73642514.html?spid=73642515,23,,Đã bán 193,chamsocme
Máy hút sữa cầm tay Medela Harmony,890.000₫,https://tiki.vn/medela-may-hut-sua-cam-tay-harmony-p176937871.html?spid=176937873,24,,Đã bán 17,chamsocme
"Gối bà bầu cánh tiên imom giảm đau lưng, nhức mỏi, cải thiện giấc ngủ, nâng đỡ và bảo vệ bụng bầu - GB1",350.000₫,https://tiki.vn/goi-ba-bau-canh-tien-imom-giam-dau-lung-nhuc-moi-cai-thien-giac-ngu-nang-do-va-bao-ve-bung-bau-gb1-p216435794.html?spid=216435798,25,,Đã bán 8,chamsocme
Máy hút sữa Medela Pump in style MaxFlow | Máy hút sữa điện đôi có túi xách và bộ bảo quản lạnh.,5.790.000₫,https://tiki.vn/may-hut-sua-medela-pump-in-style-max-flow-may-hut-sua-dien-doi-co-tui-xach-va-bo-bao-quan-lanh-p270708234.html?spid=270708235,26,,Đã bán 4,chamsocme
Hộp 50 túi trữ sữa Sunmum chính hãng Thái Lan (250ml) có 3 khóa kéo,72.000₫,https://tiki.vn/hop-50-tui-tru-sua-sunmum-chinh-hang-thai-lan-250ml-co-3-khoa-keo-p43919482.html?spid=141789450,27,,Đã bán 183,chamsocme
"Muối ngâm chân thảo mộc giảm đau nhức, chống sưng phù, thơm tho bàn chân và thư giãn cơ thể Wonmom 350g",67.000₫,https://tiki.vn/muoi-ngam-chan-thao-moc-giam-dau-nhuc-chong-sung-phu-thom-tho-ban-chan-va-thu-gian-co-the-wonmom-350g-p2790345.html?spid=12075546,28,,Đã bán 95,chamsocme
"Quần lót bầu , chip bầu cạp chéo A09 THÔNG HƠI - KHÁNG KHUẨN - THOÁNG KHÍ - SIÊU MỀM MẠI",45.000₫,https://tiki.vn/quan-lot-bau-chip-bau-cap-cheo-a09-thong-hoi-khang-khuan-thoang-khi-sieu-mem-mai-p205541313.html?spid=205541330,29,,Đã bán 126,chamsocme
"Gối cho bà bầu cao cấp 2 in 1, vừa là gối cánh tiên kết hợp chữ F",318.000₫,https://tiki.vn/goi-cho-ba-bau-cao-cap-2-in-1-vua-la-goi-canh-tien-ket-hop-chu-f-p196791072.html?spid=196791075,30,,Đã bán 39,chamsocme
Hộp 50 túi trữ sữa Sunmum Thái Lan 250ml,71.200₫,https://tiki.vn/hop-50-tui-tru-sua-sunmum-thai-lan-250ml-p142339285.html?spid=142339341,31,,Đã bán 370,chamsocme
Máy hút sữa bằng điện Philips Avent 394.11,7.450.000₫,https://tiki.vn/may-hut-sua-bang-dien-philips-avent-394-11-p269897780.html?spid=110580481,32,,Đã bán 44,chamsocme
Balo Bỉm Sữa Cao Cấp Mama's Choice 4in1 | Balo Cho Mẹ Bỉm Sữa và Bé Yêu | Lớp Giữ Nhiệt Dày Dặn và Chống Thấm | Nhiều Ngăn Siêu Tiện Dụng,299.000₫,https://tiki.vn/balo-bim-sua-cao-cap-mama-s-choice-4in1-balo-cho-me-bim-sua-va-be-yeu-lop-giu-nhiet-day-dan-va-chong-tham-nhieu-ngan-sieu-tien-dung-p60192179.html?spid=60192181,33,,Đã bán 94,chamsocme
"Nồi xông hơi điện Cao Cấp dung tích 4 lít, dùng xông hơi cho Phụ Nữ Sau Sinh, cho gia đình, Spa - Hàng Chính Hãng",1.330.000₫,https://tiki.vn/noi-xong-hoi-dien-dung-tich-4-lit-hang-chinh-hang-p73252758.html?spid=73252759,34,,Đã bán 113,chamsocme
Máy Hút Sữa Điện Đôi FatzBaby -Resonance 3 -FB1160VN,1.166.000₫,https://tiki.vn/may-hut-sua-dien-doi-fatzbaby-resonance-3-fb1160vn-p80385765.html?spid=80386686,35,,Đã bán 20,chamsocme
Máy hút sữa điện rảnh tay không dây Fatzbaby Fatz Freemax 4 - FB1276RH (1 bên),1.288.000₫,https://tiki.vn/may-hut-sua-dien-ranh-tay-khong-day-fatzbaby-fatz-freemax-4-fb1276rh-1-ben-p206144178.html?spid=206144179,36,,Đã bán 14,chamsocme
Thảo mộc xông tắm sau sinh Wonmom 150Gr (6 Túi /hộp),171.000₫,https://tiki.vn/thao-moc-xong-tam-sau-sinh-wonmom-150gr-6-tui-hop-p221251756.html?spid=221251759,37,,Đã bán 17,chamsocme
"Gối ôm bà bầu cao cấp imom 3 trong 1, thay thế dáng cánh tiên, chữ U, tháo rời dễ dàng, sử dụng cho mẹ và bé - GB3in1",600.000₫,https://tiki.vn/goi-om-ba-bau-cao-cap-imom-3-trong-1-thay-the-dang-canh-tien-chu-u-thao-roi-de-dang-su-dung-cho-me-va-be-gb3in1-p216435810.html?spid=216435823,38,,Đã bán 6,chamsocme
"Balo bỉm sữa - Phụ kiện cho mẹ, ngăn chứa rộng, giữ ấm sữa, chính hãng Miti - BL7001",199.200₫,https://tiki.vn/balo-bim-sua-phu-kien-cho-me-ngan-chua-rong-giu-am-sua-chinh-hang-miti-bl7001-p74885751.html?spid=74885757,39,,Đã bán 14,chamsocme
"Túi xách bỉm sữa Umoo đa năng phong cách Hàn Quốc cho mẹ, túi xách chống nước cực kỳ tiện dụng",379.000₫,https://tiki.vn/tui-xach-bim-sua-umoo-da-nang-phong-cach-han-quoc-cho-me-tui-xach-chong-nuoc-cuc-ky-tien-dung-p173871886.html?spid=173871888,40,,Đã bán 10,chamsocme
