title,price,link_item,index,discount,sales,brand
Áo thun nữ in chữ DAY mtt183 ( Trắng ),53.000₫,https://tiki.vn/ao-thun-nu-in-chu-day-mtt183-trang-p190378351.html?spid=190378943,1,,,VONESA
Áo thun unisex form rộng Nhật Bản đẹp độc lạ phong cách cá tính vải dày mịn 2019T2307,53.000₫,https://tiki.vn/ao-thun-unisex-form-rong-nhat-ban-dep-doc-la-phong-cach-ca-tinh-vai-day-min-2019t2307-p190379393.html?spid=190380130,2,,,VONESA
Áo thun tay lỡ form rộng họa tiết hoạt hình phong cách Nhật Bản vải dày mịn 2020T2437,53.000₫,https://tiki.vn/ao-thun-tay-lo-form-rong-hoa-tiet-hoat-hinh-phong-cach-nhat-ban-vai-day-min-2020t2437-p190379360.html?spid=190380100,3,,,VONESA
Áo thun unisex form rộng đi học dễ thương thời trang cá tính vải dày mịn 2019T1366,53.000₫,https://tiki.vn/ao-thun-unisex-form-rong-di-hoc-de-thuong-thoi-trang-ca-tinh-vai-day-min-2019t1366-p190385006.html?spid=190386149,4,,,VONESA
,,https://tiki.vn/ao-thun-form-rong-unisex-phong-cach-ca-tinh-vai-day-min-2019t22027-p190385097.html?spid=190385235,5,,,VONESA
Áo thun tay lỡ Hàn Quốc form rộng in hình câu nói hay vải dày mịn TEEWO124,53.000₫,https://tiki.vn/ao-thun-tay-lo-han-quoc-form-rong-in-hinh-cau-noi-hay-vai-day-min-teewo124-p190386779.html?spid=190387383,6,,,VONESA
Áo thun gia đình đẹp in doraemon hóa goku dễ thương cao cấp,139.150₫,https://tiki.vn/ao-thun-gia-dinh-dep-in-doraemon-hoa-goku-de-thuong-cao-cap-p190388834.html?spid=190388917,7,,,VONESA
Áo thun unisex nam nữ tay lỡ in năm sinh theo yêu cầu cao cấp vải dày mịn,53.000₫,https://tiki.vn/ao-thun-unisex-nam-nu-tay-lo-in-nam-sinh-theo-yeu-cau-cao-cap-vai-day-min-p190386776.html?spid=190387755,8,,,VONESA
Áo thun tay lỡ Hàn Quốc form rộng in hình cô dâu chú rẻ dễ thương vải dày mịn TEEWO116,53.000₫,https://tiki.vn/ao-thun-tay-lo-han-quoc-form-rong-in-hinh-co-dau-chu-re-de-thuong-vai-day-min-teewo116-p190387714.html?spid=190387852,9,,,VONESA
,,https://tiki.vn/ao-thun-nu-form-rong-hoa-tiet-hoat-hinh-vai-day-min-teew404-p190387563.html?spid=190388205,10,,,VONESA
Áo thun nữ in hình phong cách cá tính mtt140 ( Trắng ),53.000₫,https://tiki.vn/ao-thun-nu-in-hinh-phong-cach-ca-tinh-mtt140-trang-p190389260.html?spid=190389427,11,,,VONESA
Áo thun tay lỡ pug siêu ngầu vải dày mịn 2020T3026,53.000₫,https://tiki.vn/ao-thun-tay-lo-pug-sieu-ngau-vai-day-min-2020t3026-p190387810.html?spid=190388459,12,,,VONESA
,,https://tiki.vn/ao-thun-form-rong-tay-lo-nhat-ban-dep-doc-la-vai-day-min-2020t2359-p190388281.html?spid=190389747,13,,,VONESA
Áo thun nữ tay lỡ form rộng phong cách Nhật Bản đẹp độc lạ vải dày mịn 2020T1617,53.000₫,https://tiki.vn/ao-thun-nu-tay-lo-form-rong-phong-cach-nhat-ban-dep-doc-la-vai-day-min-2020t1617-p190389892.html?spid=190390945,14,,,VONESA
Áo phông nam ngôi sao đen phong cách unisex màu xám,53.000₫,https://tiki.vn/ao-phong-nam-ngoi-sao-den-phong-cach-unisex-mau-xam-p190382445.html?spid=190383056,15,,,VONESA
Áo thun unisex form rộng quỷ vương mập Hàn Quốc vải dày mịn 2019T2062,53.000₫,https://tiki.vn/ao-thun-unisex-form-rong-quy-vuong-map-han-quoc-vai-day-min-2019t2062-p190383151.html?spid=190383286,16,,,VONESA
Áo phông unisex nam nữ form rộng tay lỡ chữ SOUL đẹp vải dày mịn,53.000₫,https://tiki.vn/ao-phong-unisex-nam-nu-form-rong-tay-lo-chu-soul-dep-vai-day-min-p190381503.html?spid=190383526,17,,,VONESA
,,https://tiki.vn/ao-thun-unisex-form-rong-nhat-ban-dep-doc-la-phong-cach-ca-tinh-vai-day-min-2019t2352-p190383620.html?spid=190384314,18,,,VONESA
Áo thun cặp đôi in hình Super Cat form rộng phong cách hàn quốc,78.150₫,https://tiki.vn/ao-thun-cap-doi-in-hinh-super-cat-form-rong-phong-cach-han-quoc-p190386367.html?spid=190386523,19,,,VONESA
Áo thun nữ Hàn Quốc in hình đôi môi mtt176 ( Trắng ),36.000₫,https://tiki.vn/ao-thun-nu-han-quoc-in-hinh-doi-moi-mtt176-trang-p190388410.html?spid=190388556,20,,,VONESA
Áo phông unisex tay lỡ form rộng nam nữ họa tiết đôi cánh thiên thần vải dày mịn 2021T3181,53.000₫,https://tiki.vn/ao-phong-unisex-tay-lo-form-rong-nam-nu-hoa-tiet-doi-canh-thien-than-vai-day-min-2021t3181-p190387985.html?spid=190389391,21,,,VONESA
Áo thun unisex in goku độc lạ chất vải dày mịn 2019ts599,53.000₫,https://tiki.vn/ao-thun-unisex-in-goku-doc-la-chat-vai-day-min-2019ts599-p190387377.html?spid=190388019,22,,,VONESA
Áo thun cặp đôi in hình thần tượng BTS chibi form rộng phong cách hàn quốc,78.150₫,https://tiki.vn/ao-thun-cap-doi-in-hinh-than-tuong-bts-chibi-form-rong-phong-cach-han-quoc-p190390400.html?spid=190390529,23,,,VONESA
Áo thun form rộng unisex hình GoKu chất vải đẹp2019ts731,53.000₫,https://tiki.vn/ao-thun-form-rong-unisex-hinh-goku-chat-vai-dep2019ts731-p190389796.html?spid=190389941,24,,,VONESA
Áo thun gia đình đẹp in du lịch dễ thương cao cấp,139.150,https://tiki.vn/ao-thun-gia-dinh-dep-in-du-lich-de-thuong-cao-cap-p190392180.html?spid=190392265,25,,,VONESA
,,https://tiki.vn/ao-thun-unisex-form-rong-cun-con-de-thuong-vai-day-min-2019t2152-p190389962.html?spid=190390627,26,,,VONESA
Áo thun cặp đôi in hìnhcún Alaska form rộng phong cách hàn quốc,78.150₫,https://tiki.vn/ao-thun-cap-doi-in-hinhcun-alaska-form-rong-phong-cach-han-quoc-p190392151.html?spid=190392313,27,,,VONESA
Đầm MAXI MOCKING MẶC 2 KIỂU 6 MÀU Y HÌNH,175.000₫,https://tiki.vn/dam-maxi-mocking-mac-2-kieu-6-mau-y-hinh-p241775900.html?spid=241775904,28,,,VONESA
Baggy nữ đủ màu,138.000₫,https://tiki.vn/baggy-nu-du-mau-p212254769.html?spid=212254783,29,,,VONESA
baggy nữ đủ màu,138.000,https://tiki.vn/baggy-nu-du-mau-p212255073.html?spid=212255083,30,,,VONESA
,,https://tiki.vn/dam-bet-vai-vai-to-xuoc-anh-sieu-xinh-p212564431.html?spid=212564433,31,,,VONESA
Áo khoác bomber nỉ nút,145.000₫,https://tiki.vn/ao-khoac-bomber-ni-nut-p208591165.html?spid=208591178,32,,,VONESA
ĐẦM NHUNG PHỐI REN KÈM PHỤ KIỆN( CÓ MÚT NGỰC) 2 MÀU Y HÌNH,195.000₫,https://tiki.vn/dam-nhung-phoi-ren-kem-phu-kien-co-mut-nguc-2-mau-y-hinh-p208591004.html?spid=208591008,33,,,VONESA
áo thun in hình con rồng - M,65.000₫,https://tiki.vn/ao-thun-in-hinh-con-rong-p230001031.html?spid=230001071,34,,,VONESA
áo thun in hình con trâu,53.000₫,https://tiki.vn/ao-thun-in-hinh-con-trau-p229983412.html?spid=229983428,35,,,VONESA
,,https://tiki.vn/ao-thun-in-hinh-de-thuong-p230049375.html?spid=230049379,36,,,VONESA
ĐẦM GẤM TAPTA HOA KÈM DÂY CỔ ĐÍNH HOA,175.000₫,https://tiki.vn/dam-gam-tapta-hoa-kem-day-co-dinh-hoa-p230211198.html?spid=230211200,37,,,VONESA
SÉT ĐẦM BODY & ÁO QUÁ ĐẸP :d :d :d MÀU Y HÌNH,175.000₫,https://tiki.vn/set-dam-body-ao-qua-dep-d-d-d-mau-y-hinh-p242651433.html?spid=242651434,38,,,VONESA
ÁO THUN IN LOGO,75.000₫,https://tiki.vn/ao-thun-in-logo-p242747431.html?spid=242747432,39,,,VONESA
ĐẦM TẦNG LƯỚI SIÊU HOT,195.000,https://tiki.vn/dam-tang-luoi-sieu-hot-p242759368.html?spid=242759372,40,,,VONESA
