title,price,link_item,index,discount,sales,category
Áo sơ mi ngắn tay rằn ri lính cao cấp Aber ARM-852,650.000₫,https://tiki.vn/ao-so-mi-ngan-tay-ran-ri-linh-cao-cap-aber-arm-852-p198569564.html?spid=198569586,1,-10%,Đã bán 1,aosomi
Áo sơ mi nam ngắn tay form Slim fit,440.000₫,https://tiki.vn/ao-so-mi-nam-vitimen-ngan-tay-form-slim-fit-p248601147.html?spid=248601151,2,-32%,,aosomi
OWEN - Áo Sơ mi dài tay Owen Regularfit chất sợi tre kẻ ca rô xanh 220937,549.000₫,https://tiki.vn/owen-a-o-so-mi-da-i-tay-owen-regularfit-chat-soi-tre-ke-ca-ro-xanh-220937-p208322218.html?spid=208322240,3,,,aosomi
Áo Sơ Mi Nam Dài Tay Công Sở Thương Hiệu Thời Trang Belluni 161B5,850.000,https://tiki.vn/ao-so-mi-nam-dai-tay-cong-so-thuong-hieu-thoi-trang-belluni-161b5-p262034978.html?spid=262034982,4,,,aosomi
,,https://tiki.vn/ao-so-mi-nam-dai-tay-cong-so-thuong-hieu-thoi-trang-belluni-161-b6-p262034929.html?spid=262034931,5,-20%,,aosomi
Áo Sơmi Nam Ngắn Tay Công Sở Form Slimfit - Họa Tiết Kẻ Sọc - VITINO,385.000₫,https://tiki.vn/ao-somi-nam-ngan-tay-cong-so-form-slimfit-hoa-tiet-ke-soc-vitino-p180962849.html?spid=180962853,6,-11%,Đã bán 1,aosomi
"Áo sơ mi nam tay dài màu trắng, thương hiệu Amaing, vải sơi tre mềm, mượt, mát, phong cách công sở, thân suông, vạt bầu",239.000₫,https://tiki.vn/ao-so-mi-nam-tay-dai-mau-trang-thuong-hieu-amaing-vai-soi-tre-mem-muot-mat-phong-cach-cong-so-than-suong-vat-bau-p153957178.html?spid=153957208,7,-34%,,aosomi
ÁO SƠMI NAM CÔNG SỞ DÀI TAY SLIMFIT VITINO ASD152,325.000₫,https://tiki.vn/ao-somi-nam-cong-so-dai-tay-slimfit-vitino-asd152-p157071747.html?spid=157071749,8,,,aosomi
Áo đồng phục bảo vệ vải kate ford mát tay dài kèm logo,225.000,https://tiki.vn/ao-dong-phuc-bao-ve-vai-kate-ford-mat-tay-dai-kem-logo-p216901557.html?spid=216901569,9,,,aosomi
,,https://tiki.vn/ao-so-mi-tay-dai-valentino-creations-v18-014756-wh1-p272621074.html?spid=272621082,10,,,aosomi
"Áo sơ mi đũi nam cổ trụ tay ngắn 3 khuy ngực ArcticHunter, thời trang trẻ, thương hiệu chính hãng",179.000₫,https://tiki.vn/ao-so-mi-dui-nam-co-tru-tay-ngan-3-khuy-nguc-arctichunter-thoi-trang-tre-thuong-hieu-chinh-hang-p66611034.html?spid=66611038,11,,Đã bán 3,aosomi
Áo Sơ Mi Ngắn Tay Nam Linen Shirt Giordano 01043206,889.000,https://tiki.vn/ao-so-mi-ngan-tay-nam-linen-shirt-giordano-01043206-p262550370.html?spid=262550378,12,,,aosomi
,,https://tiki.vn/ao-so-mi-nam-tay-ngan-form-slim-khatoco-a1mn438s1-cnma001-2102-n-p30684522.html?spid=30684532,13,,,aosomi
Áo sơ mi nam tay dài form suông Khatoco A1MD468T1-CNCR110-2409-D,374.400₫,https://tiki.vn/ao-so-mi-nam-tay-dai-form-suong-khatoco-a1md468t1-cncr110-2409-d-p248689866.html?spid=248689868,14,,,aosomi
Áo sơ mi nam ngắn tay Novelty Regular fit sọc caro NSMMCTMTCR220932N,325.000₫,https://tiki.vn/ao-so-mi-nam-ngan-tay-novelty-regular-fit-soc-caro-nsmmctmtcr220932n-p215161289.html?spid=215161297,15,,,aosomi
ÁO SƠ MI CARO ÁO KHOÁC SƠ MI NAM NỮ MẶC,87.000₫,https://tiki.vn/product-p90071009.html?spid=92901020,16,,Đã bán 5,aosomi
Áo sơ mi nam kẻ sọc BBR vàng,128.000,https://tiki.vn/ao-so-mi-nam-ke-soc-bbr-vang-p105622376.html?spid=115251383,17,,Đã bán 4,aosomi
,,https://tiki.vn/ao-so-mi-lua-nam-body-cuc-dep-thoi-trang-phong-cach-hoa-nam-than-nam-moi-p75390033.html?spid=76171459,18,,,aosomi
"Áo Sơ Mi Nam Dài Tay Vải Lụa Trơn Cao Cấp Co dãn nhẹ, thoáng khí",115.000₫,https://tiki.vn/ao-so-mi-nam-dai-tay-vai-lua-tron-cao-cap-co-dan-nhe-thoang-khi-p178514221.html?spid=193525012,19,,Đã bán 31,aosomi
ÁO SƠ MI NAM TAY NGẮN DR BASIC CHUẨN MEN THỜI TRANG NAM 1986,137.000₫,https://tiki.vn/ao-so-mi-nam-tay-ngan-dr-basic-chuan-men-thoi-trang-nam-1986-p201861381.html?spid=201861402,20,,,aosomi
Áo Sơ Mi Nam Công Sở Trung Niên Anton Somianton Xanh Trơn Ngắn Tay Vải Cotton - XSN14,195.000₫,https://tiki.vn/ao-so-mi-nam-cong-so-trung-nien-anton-somianton-xanh-tron-ngan-tay-va-i-cotton-xsn14-p200002811.html?spid=200002821,21,,Đã bán 2,aosomi
Áo Sơ Mi Nam Trắng Trơn - XXL,80.000₫,https://tiki.vn/ao-so-mi-nam-trang-tron-xxl-p8985726.html?spid=19762645,22,,Đã bán 57,aosomi
,,https://tiki.vn/ao-so-mi-nam-ngan-tay-co-tui-vai-dui-p253196664.html?spid=253196683,23,,,aosomi
"Áo sơmi nam, áo sơmi dáng ôm body phối màu độc lạ thiết kế trẻ trung, lịch lãm H39",199.000₫,https://tiki.vn/ao-somi-nam-ao-somi-dang-om-body-phoi-mau-doc-la-thiet-ke-tre-trung-lich-lam-h39-p263272937.html?spid=263272943,24,,,aosomi
"Áo sơ mi, áo sơ mi nam dài tay cổ vest phối 2 màu đen trắng cực độc cực chất N22",209.000₫,https://tiki.vn/ao-so-mi-ao-so-mi-nam-dai-tay-co-vest-phoi-2-mau-den-trang-cuc-doc-cuc-chat-n22-p263329179.html?spid=263329181,25,,,aosomi
"Áo sơmi nam flamingo bird đẹp, mềm mịn ngắn tay - Monument 1527/XL - Mỹ",850.000₫,https://tiki.vn/ao-somi-nam-flamingo-bird-dep-mem-min-ngan-tay-monument-1527-xl-my-p269851927.html?spid=269889999,26,,,aosomi
Áo sơ mi nam cổ bẻ cao cấp,250.000,https://tiki.vn/ao-so-mi-nam-co-be-cao-cap-p105375352.html?spid=105375358,27,,,aosomi
,,https://tiki.vn/ao-so-mi-hoa-tiet-titishop-sm1130-p14706558.html?spid=14706560,28,,,aosomi
"ÁO SƠ MI HOA VĂN TAY NGẮN IN HÌNH CÂY DỪA, ĐƯỜNG PHỐ BIG SIZE NAM",250.000₫,https://tiki.vn/ao-so-mi-hoa-van-tay-ngan-in-hinh-cay-dua-duong-pho-big-size-nam-p205306211.html?spid=205306217,29,,,aosomi
Áo Sơ Mi Nam Nữ Hoa Hướng Dương Nhỏ,325.000₫,https://tiki.vn/ao-so-mi-nam-nu-hoa-huong-duong-nho-p84381202.html?spid=84381208,30,,,aosomi
Sơ mi tay ngắn bbr kate cotton big size nam tới 135kg,270.000₫,https://tiki.vn/so-mi-tay-ngan-bbr-kate-cotton-big-size-nam-toi-135kg-p213485376.html?spid=213485419,31,,Đã bán 3,aosomi
Sơ mi nam cao cấp kẻ caro,650.000,https://tiki.vn/so-mi-nam-cao-cap-ke-caro-p143007336.html?spid=143007342,32,,,aosomi
,,https://tiki.vn/khatoco-ao-so-mi-dai-tay-khatoco-dang-tailor-fit-chong-nhan-mat-min-vai-soi-tre-cotton-p203448454.html?spid=203448458,33,,,aosomi
Áo Sơ Mi Nam Nữ Mix Hình Vuông Nâu,325.000₫,https://tiki.vn/ao-so-mi-nam-nu-mix-hinh-vuong-nau-p84381378.html?spid=84381390,34,,,aosomi
Áo sơ mi nam denim MUSLAND cổ bẻ phối túi ngực 5 màu thời trang 2020A500,390.000₫,https://tiki.vn/ao-so-mi-nam-denim-musland-co-be-phoi-tui-nguc-5-mau-thoi-trang-2020a500-p155915783.html?spid=155916470,35,,,aosomi
"Áo Blu, Blouse Bác sĩ Cộc Tay dáng dài ngang gối vải thô cotton cao cấp (Giá lẻ = Giá sỉ)",149.000₫,https://tiki.vn/ao-blu-blouse-bac-si-coc-tay-dang-dai-ngang-goi-vai-tho-cotton-cao-cap-gia-le-gia-si-p196184581.html?spid=196184622,36,,,aosomi
Áo sơ mi nam mặt trời vũ trụ mẫu cực hot,89.000₫,https://tiki.vn/ao-so-mi-nam-mat-troi-vu-tru-mau-cuc-hot-p182130962.html?spid=182130964,37,,,aosomi
,,https://tiki.vn/ao-so-mi-nam-ngan-tay-phoi-caro-mau-xr01-thoi-trang-cao-cap-poniva-chat-kate-mem-min-tao-cam-giac-thoai-mai-khi-mac-p111709742.html?spid=111709804,38,,,aosomi
Áo Sơ Mi Lụa Hộp 1 Áo Dài Tay Nam Kiểu Dáng Body Lịch Lãm Và Sang Trọng - Mặc Là Đẹp - Mã SMLH,103.000₫,https://tiki.vn/ao-so-mi-lua-hop-1-ao-dai-tay-nam-kieu-dang-body-lich-lam-va-sang-trong-mac-la-dep-ma-smlh-p126728780.html?spid=126728944,39,,Đã bán 3,aosomi
Áo thun áo phông nam trung niên cao cấp ẢNH THẬT,179.000₫,https://tiki.vn/ao-thun-ao-phong-nam-trung-nien-cao-cap-anh-that-p129299206.html?spid=129299509,40,,,aosomi
