title,price,link_item,index,discount,sales,category
"Áo sơ mi nam tay ngắn họa tiết hoa AKUBA form regular, chất liệu mango vải nhẹ, mát, thấm hút tốt | 02B464",415.000₫,https://tiki.vn/ao-so-mi-nam-tay-ngan-hoa-tiet-hoa-akuba-form-regular-chat-lieu-mango-vai-nhe-mat-tham-hut-tot-02b464-p178593350.html?spid=178593362,1,,Đã bán 3,aosomi
ÁO SƠ MI NAM TAY NGẮN PHỐI HỌA TIẾT CON VẸT SIÊU CHẤT,85.000₫,https://tiki.vn/ao-so-mi-nam-tay-ngan-phoi-hoa-tiet-con-vet-sieu-chat-p263441879.html?spid=263441891,2,,,aosomi
ÁO SƠ MI CARO NAM DÀI TAY THỜI TRANG CAO CẤP AKHOI967+ TẶNG KÈM ÁO THUN TRƠN( TRẮNG/ĐEN),154.000₫,https://tiki.vn/ao-so-mi-caro-nam-dai-tay-thoi-trang-cao-cap-akhoi967-tang-kem-ao-thun-tron-trang-den-p147443409.html?spid=147443591,3,,Đã bán 5,aosomi
Sơ mi trắng tay dài xuất khẩu Docker basic cho bé và nam 30-58 kg,224.420,https://tiki.vn/so-mi-trang-tay-dai-xuat-khau-docker-basic-cho-be-va-nam-30-58-kg-p270489150.html?spid=270489160,4,,,aosomi
,,https://tiki.vn/ao-so-mi-nam-vai-dui-xuoc-cao-cap-ngan-tay-p93005248.html?spid=93005319,5,,,aosomi
Áo Sơ Mi Nam Caro Tay Dài,145.000₫,https://tiki.vn/ao-so-mi-nam-caro-tay-dai-p53519901.html?spid=197211928,6,,,aosomi
Áo thun ngắn tay chống nắng nam Columbia Tech Trail™ - 1768702004,990.000₫,https://tiki.vn/ao-thun-ngan-tay-chong-nang-nam-columbia-tech-trail-1768702004-p263491713.html?spid=263491718,7,,,aosomi
Viettien - Áo sơ mi nam dài tay ca rô 1Q0397 regular dáng rộng chất liệu sợi tre gỗ sồi,580.000₫,https://tiki.vn/viettien-ao-so-mi-nam-dai-tay-ca-ro-1q0397-regular-dang-rong-chat-lieu-soi-tre-go-soi-p204435772.html?spid=204435780,8,,Đã bán 1,aosomi
Viettien - Áo sơ mi nam dài tay họa tiết 1R0445 regular chất liệu sợi sen,670.000,https://tiki.vn/viettien-ao-so-mi-nam-dai-tay-hoa-tiet-1r0445-regular-chat-lieu-soi-sen-p177269891.html?spid=177269901,9,,Đã bán 3,aosomi
,,https://tiki.vn/ao-so-mi-ngan-tay-caro-tencel-spun-regular-fit-345-vinh-tien-vat-bau-p247341959.html?spid=247341975,10,,,aosomi
Áo Sơ Mi Bigsize Ngắn Tay Caro Bamboo Regular Fit 425 Vĩnh Tiến - Nhiều Màu,425.000₫,https://tiki.vn/ao-so-mi-bigsize-ngan-tay-caro-bamboo-regular-fit-425-vinh-tien-nhieu-mau-p270660464.html?spid=270660508,11,,,aosomi
Áo Sơ Mi Dài Tay Caro Tencel-Spun Regular Fit 375 Vĩnh Tiến,375.000,https://tiki.vn/ao-so-mi-dai-tay-caro-tencel-spun-regular-fit-375-vinh-tien-p246202301.html?spid=246202351,12,,Đã bán 1,aosomi
,,https://tiki.vn/ao-so-mi-nam-ao-so-mi-nam-tay-dai-chat-lua-min-phoi-hoa-tiet-cao-cap-julido-store-mau-moi-ms-p262651463.html?spid=262651473,13,,,aosomi
Áo Thô Đũi Nam Trơn Cổ Tròn Chất Liệu Thoáng Mát Phong Cách Tối Giản,182.250₫,https://tiki.vn/ao-tho-dui-nam-tron-co-tron-chat-lieu-thoang-mat-phong-cach-toi-gian-p106607978.html?spid=106608545,14,,Đã bán 6,aosomi
Áo Sơ Mi Nam Ngắn Tay SMH83 - SMH83,180.000₫,https://tiki.vn/ao-so-mi-nam-ngan-tay-smh83-smh83-p15054486.html?spid=15054488,15,,Đã bán 5,aosomi
Áo Sơ Mi Nam Ngắn Tay Viền Cổ Phối Túi QK8522,157.000₫,https://tiki.vn/ao-so-mi-nam-ngan-tay-vien-co-phoi-tui-qk8522-p83158034.html?spid=83158050,16,,,aosomi
Áo sơ mi nam tay dài họa tiết trang báo,219.000,https://tiki.vn/ao-so-mi-nam-tay-dai-hoa-tiet-trang-bao-p75411100.html?spid=75411106,17,,,aosomi
,,https://tiki.vn/ao-so-mi-nam-ngan-tay-mau-vang-p28042213.html?spid=28624898,18,,,aosomi
Áo sơ mi cọc tay nam,84.200₫,https://tiki.vn/ao-so-mi-coc-tay-nam-p41264466.html?spid=41264478,19,,Đã bán 16,aosomi
Sơ mi nam họa tiết vẹt thời trang,175.000₫,https://tiki.vn/so-mi-nam-hoa-tiet-vet-thoi-trang-p77618621.html?spid=77618623,20,,,aosomi
Áo sơ mi nam dài tay màu đen không túi,108.000₫,https://tiki.vn/ao-so-mi-nam-dai-tay-mau-den-khong-tui-p52337325.html?spid=52337331,21,,Đã bán 37,aosomi
Áo Sơ Mi Nam Ngắn Tay Phối Caro BBR,169.000,https://tiki.vn/ao-so-mi-nam-ngan-tay-phoi-caro-p83160886.html?spid=83160955,22,,,aosomi
,,https://tiki.vn/ao-so-mi-nam-caro-mau-xanh-301c-p28312527.html?spid=85184253,23,,,aosomi
Áo Sơ Mi Nam Kate Dài Tay Cổ Trụ,157.000₫,https://tiki.vn/ao-so-mi-nam-kate-dai-tay-co-tru-p82643656.html?spid=82643808,24,,,aosomi
Áo Sơ Mi Đôi Chữ Love Siêu Cá Tính,99.000₫,https://tiki.vn/ao-so-mi-doi-chu-love-sieu-ca-tinh-p91964287.html?spid=91964356,25,,Đã bán 9,aosomi
Áo Sơ Mi Nam Phối Viền Họa Tiết Rồng Cao Cấp,99.000₫,https://tiki.vn/ao-so-mi-nam-phoi-vien-hoa-tiet-rong-cao-cap-p104115083.html?spid=104115217,26,,,aosomi
Áo sơ mi nam trắng tay dài họa tiết hoa hồng cao cấp SM304,115.000,https://tiki.vn/ao-so-mi-nam-trang-tay-dai-hoa-tiet-hoa-hong-cao-cap-sm304-p104151865.html?spid=104151889,27,,,aosomi
,,https://tiki.vn/ao-so-mi-nam-dai-tay-phoi-caro-chat-kate-mem-min-thoang-mat-tao-cam-giac-thoai-mai-khi-mac-p73730989.html?spid=104260346,28,,,aosomi
Áo Sơ Mi Nam Phối Viền Họa Tiết Versace Cao Cấp,136.500₫,https://tiki.vn/ao-so-mi-nam-phoi-vien-hoa-tiet-versace-cao-cap-p104116771.html?spid=104117273,29,,,aosomi
Áo Sơ Mi Nam Cổ Trụ Tay Dài Phối Viền Ngực Mẫu,163.000₫,https://tiki.vn/ao-so-mi-nam-co-tru-tay-dai-phoi-vien-nguc-mau-p83161525.html?spid=83161570,30,,Đã bán 1,aosomi
"Aó khoác sơ mi nam caro , áo hoác sơ mi nữ caro , áo caro nam , áo caro nữ , áo khoác UNISEX kiểu dáng sơ mi sọc caro nhuyễn màu xanh , áo sơ mi caro có nón",104.000₫,https://tiki.vn/ao-khoac-so-mi-nam-caro-ao-hoac-so-mi-nu-caro-ao-caro-nam-ao-caro-nu-ao-khoac-unisex-kieu-dang-so-mi-soc-caro-nhuyen-mau-xanh-ao-so-mi-caro-co-non-p88007961.html?spid=103510719,31,,Đã bán 7,aosomi
Áo sơ mi cặp a2,330.000,https://tiki.vn/ao-so-mi-cap-a2-p25402727.html?spid=25402737,32,,,aosomi
,,https://tiki.vn/ao-khoac-so-mi-caro-nam-nu-form-to-p113065444.html?spid=171991720,33,,,aosomi
Áo Khoác Sơ Mi Caro KẺ UNISEX NAM NỮ Dài Tay 2 màu (đỏ-vàng),84.000₫,https://tiki.vn/ao-khoac-so-mi-caro-ke-unisex-nam-nu-dai-tay-2-mau-do-vang-p113066157.html?spid=171991770,34,,Đã bán 2,aosomi
"Áo sơ mi nam dài tay SỌC caro phối túi hàng vnxk cực đẹp , vải kate xuất không xù - ASM012",380.000₫,https://tiki.vn/ao-so-mi-nam-dai-tay-soc-caro-phoi-tui-hang-vnxk-cuc-dep-vai-kate-xuat-khong-xu-asm012-p159127138.html?spid=159127146,35,,,aosomi
"Aó Sơ Mi Trắng Nam Tay Ngắn, Dài Dáng Ôm Slim Fit Cao Cấp Hàn Quốc(Vải Dêt 30 Phần Trăm Từ Tre Bambo, Gỗ Sồi)",450.000₫,https://tiki.vn/ao-so-mi-trang-nam-tay-ngan-dai-dang-om-slim-fit-cao-cap-han-quoc-vai-det-30-phan-tram-tu-tre-bambo-go-soi-p177785009.html?spid=177785015,36,,,aosomi
Áo Sơ Mi Nam Tay Ngắn AE Short Sleeve Eagle Logo Oxford Shirt - Size XS/S/M/L/XL,450.000,https://tiki.vn/ao-so-mi-nam-tay-ngan-ae-short-sleeve-eagle-logo-oxford-shirt-size-xs-s-m-l-xl-p180893377.html?spid=180893381,37,,,aosomi
,,https://tiki.vn/ao-so-mi-tay-ngan-next-oxford-striped-shirt-size-xs-p180894056.html?spid=180894060,38,,,aosomi
"Sơ Mi Nam màu trắng in họa tiết cây anh đào TMSTORE, chất vải lụa cao cấp mền mịn thoáng mát – TMASMN35",195.000₫,https://tiki.vn/so-mi-nam-mau-trang-in-hoa-tiet-cay-anh-dao-tmstore-chat-vai-lua-cao-cap-men-min-thoang-mat-tmasmn35-p148954802.html?spid=153498682,39,,Đã bán 1,aosomi
ÁO SƠ MI NGẮN TAY NAM CỰC HOT PHONG CÁCH DÀNH CHO DÂN CHƠI KME FASHION,97.000₫,https://tiki.vn/ao-so-mi-ngan-tay-nam-cuc-hot-phong-cach-danh-cho-dan-choi-kme-fashion-p165883930.html?spid=165884309,40,,Đã bán 1,aosomi
