title,price,link_item,index,discount,sales,category
Áo len cổ lọ phối màu viền cổ và tay phong cách trẻ trung AL03 Micado,136.950₫,https://tiki.vn/ao-len-co-lo-phoi-mau-vien-co-va-tay-phong-cach-tre-trung-al03-micado-p169202153.html?spid=169202157,1,-45%,Đã bán 5,aoni
Áo len nam May 10 mã 200119455ON Ghi-202,129.000₫,https://tiki.vn/ao-len-nam-may-10-ma-200119455on-ghi-202-p155767650.html?spid=155767655,2,-40%,Đã bán 6,aoni
Áo len nam cổ lọ xanh than,103.400₫,https://tiki.vn/ao-len-nam-co-lo-xanh-than-p130814496.html?spid=130814529,3,-35%,,aoni
Aó len nam ấm đẹp thời trang,263.000₫,https://tiki.vn/ao-len-nam-am-dep-thoi-trang-p17461198.html?spid=17461204,4,-72%,Đã bán 3,aoni
áo len nam cổ 3p Quảng Châu cao cấp,350.000₫,https://tiki.vn/ao-len-nam-co-3p-quang-chau-cao-cap-p130815072.html?spid=151798835,5,-30%,Đã bán 4,aoni
Áo Len Nam Aligro Dài Tay Aligro ALEND029,438.900₫,https://tiki.vn/ao-len-nam-aligro-dai-tay-aligro-alend029-p9848985.html?spid=9848991,6,-53%,Đã bán 3,aoni
"Áo Sweater Nam 5S FASHION POSITIVE, Chất Nỉ Cotton, Cổ Tròn, Thêu Chữ Nổi Bật, Trẻ Trung (ANO23023)",285.000₫,https://tiki.vn/ao-sweater-nam-5s-fashion-positive-chat-ni-cotton-co-tron-theu-chu-noi-bat-tre-trung-ano23023-p273286857.html?spid=273286879,7,-49%,,aoni
Áo cổ lọ len nam nữ TB12,138.000₫,https://tiki.vn/ao-co-lo-len-nam-nu-t12-p6961943.html?spid=125788570,8,-25%,Đã bán 1,aoni
Áo len nam cổ tim hàng Quảng Châu,250.000₫,https://tiki.vn/ao-len-nam-co-tim-hang-quang-chau-p130814217.html?spid=130814239,9,-24%,Đã bán 2,aoni
Áo thể thao nam fasvin AD19802.20 áo thun nam chất vải mềm mại co giãn thoải mái,69.000₫,https://tiki.vn/ao-the-thao-nam-fasvin-ad19802-20-ao-thun-nam-chat-vai-mem-mai-co-gian-thoai-mai-p100368516.html?spid=100369832,10,,,aoni
Áo len nam cổ lọ vàng cao cấp,440.000₫,https://tiki.vn/ao-len-nam-co-lo-vang-cao-cap-p130815510.html?spid=130815579,11,,Đã bán 2,aoni
ÁO LEN NAM ÁO LEN VIỆT CAO CẤP ÁO LEN CỔ LỌ - AL7116,177.000₫,https://tiki.vn/ao-len-nam-ao-len-viet-cao-cap-ao-len-co-lo-al7116-p47258335.html?spid=80270540,12,,Đã bán 1,aoni
Áo len nam HÀN QUỐC trẻ trung LNA06,430.000₫,https://tiki.vn/ao-len-nam-han-quoc-tre-trung-lna06-p273363528.html?spid=273363558,13,,,aoni
áo len nam dài tay cho bố cho ông người trung tuổi cao tuổi và thanh niên có cỡ từ 50kg đến 80kg có độ dày vừa phải mặc ngoài áo sơ mi rất phù hợp thời tiết lạnh mã 881305 màu cổ vịt,199.000₫,https://tiki.vn/a-o-len-nam-da-i-tay-cho-bo-cho-ong-nguo-i-trung-tuo-i-cao-tuo-i-va-thanh-nien-co-co-tu-50kg-de-n-80kg-co-do-da-y-vu-a-pha-i-ma-c-ngoa-i-a-o-so-mi-ra-t-phu-ho-p-tho-i-tie-t-la-nh-ma-881305-ma-u-co-vi-t-p273373960.html?spid=273373964,14,,Đã bán 1,aoni
Bộ nỉ hoddie có mũ nam dài tay ALIGRO chất liệu nỉ 100% cotton màu navy ALGBN.15,805.000₫,https://tiki.vn/bo-ni-hoddie-co-mu-nam-dai-tay-aligro-chat-lieu-ni-100-cotton-mau-navy-algbn-15-p261984765.html?spid=261984767,15,,,aoni
Áo len nam May 10 mã 200119453ON Bộ đội-129,129.000₫,https://tiki.vn/ao-len-nam-may-10-ma-200119453on-bo-doi-129-p155763970.html?spid=155763976,16,,Đã bán 10,aoni
Áo len nam dài tay cổ tròn kiểu dáng Hàn Quốc phong cách trẻ trung ấn tượng - AOLEN.02,281.000₫,https://tiki.vn/ao-len-nam-dai-tay-co-tron-kie-u-da-ng-ha-n-quo-c-phong-cach-tre-trung-an-tuong-aolen-02-p201067778.html?spid=201067808,17,,,aoni
Áo len nam dài tay AEE92,299.000₫,https://tiki.vn/ao-len-nam-dai-tay-aee92-p22481060.html?spid=36377279,18,,,aoni
Áo len cao cổ nam Basic chất mịn,220.000₫,https://tiki.vn/ao-len-cao-co-nam-basic-chat-min-lahstore-p199538733.html?spid=199538747,19,,,aoni
Áo len nam May 10 mã 200119455ON Đỏ đun-115,129.000₫,https://tiki.vn/ao-len-nam-may-10-ma-200119455on-do-dun-115-p155769333.html?spid=155769337,20,,Đã bán 7,aoni
Áo len cổ tròn nam phong cách Hàn Quốc mã 2138,254.000₫,https://tiki.vn/ao-len-co-tron-nam-phong-cach-han-quoc-ma-2138-p203475251.html?spid=205059528,21,,Đã bán 1,aoni
Áo khoác len cho người già cao tuổi áo len trung niên nam cổ V sabg trọng,249.000₫,https://tiki.vn/ao-khoac-len-cho-nguoi-gia-cao-tuoi-ao-len-trung-nien-nam-co-v-sabg-trong-p202491065.html?spid=202491082,22,,Đã bán 2,aoni
Áo len nam loại dày BS35 - BS35,250.000₫,https://tiki.vn/ao-len-nam-loai-day-bs35-bs35-p15519104.html?spid=15519150,23,,Đã bán 12,aoni
ÁO LEN NAM ĐỎ ĐÔ,215.000₫,https://tiki.vn/ao-len-nam-do-do-p22400774.html?spid=22400780,24,,Đã bán 7,aoni
Áo len nam kẻ sọc,239.000₫,https://tiki.vn/ao-len-nam-ke-soc-p48093873.html?spid=48093883,25,,Đã bán 8,aoni
Áo len nam cổ tròn sợi pha cotton - xuongaolen.com,198.000₫,https://tiki.vn/ao-len-nam-co-tron-soi-pha-cotton-xuongaolen-com-p130814258.html?spid=130814280,26,,Đã bán 8,aoni
Áo Len Sapa Hoạ Tiết Thổ Cẩm,314.000₫,https://tiki.vn/ao-len-sapa-hoa-tiet-tho-cam-p163582024.html?spid=163582025,27,,,aoni
Áo Len nam thời trang đẹp AE02,219.000₫,https://tiki.vn/ao-len-nam-thoi-trang-dep-ae02-p14901081.html?spid=14901087,28,,Đã bán 1,aoni
Áo Len Nam Lót Lông AE128,250.000₫,https://tiki.vn/ao-len-nam-lot-long-ae128-p8120643.html?spid=272271289,29,,,aoni
Áo len dài tay nam thời trang Hàn Quốc SAL214 Xanh than,189.000₫,https://tiki.vn/ao-len-dai-tay-nam-thoi-trang-han-quoc-sal214-xanh-than-p25281818.html?spid=25281824,30,,Đã bán 25,aoni
"Áo len cổ lọ nam nữ, áo rất ấm T012",150.000₫,https://tiki.vn/ao-len-co-lo-nam-nu-ao-rat-am-t012-p247245272.html?spid=247245403,31,,,aoni
SWE - Áo Sweater nam nữ F-LOVE KNIT chất vải len dệt co dãn dài tay thời trang trẻ trung,600.000₫,https://tiki.vn/swe-ao-sweater-nam-nu-f-love-knit-chat-vai-len-det-co-dan-dai-tay-thoi-trang-tre-trung-p204784198.html?spid=204784220,32,,Đã bán 2,aoni
Áo Len Nam Cho Người Lớn Tuổi FGT02 (Size,390.000₫,https://tiki.vn/ao-len-nam-cho-nguoi-lon-tuoi-fgt02-p7175047.html?spid=7175051,33,,Đã bán 19,aoni
Áo len cổ tròn dài tay nam ô vuông AL10 chất liệu mịn không xù lông giữ ấm cực tốt phong cách trẻ trung Micado,189.000₫,https://tiki.vn/ao-len-co-tron-dai-tay-nam-o-vuong-al10-chat-lieu-min-khong-xu-long-giu-am-cuc-tot-phong-cach-tre-trung-micado-p180536237.html?spid=180536251,34,,Đã bán 2,aoni
Áo len nam cổ lọ chất len cotton,126.500₫,https://tiki.vn/ao-len-nam-co-lo-chat-len-cotton-p130815790.html?spid=130815829,35,,,aoni
Áo Len Nam Cổ Lọ Loại Dày Bs58,396.000₫,https://tiki.vn/ao-len-nam-co-lo-loai-day-bs58-p11850820.html?spid=120575033,36,,Đã bán 2,aoni
Áo Len Nam Cổ Lọ Form Ôm BS77,199.000₫,https://tiki.vn/ao-len-nam-co-lo-form-om-bs77-den-p8075680.html?spid=8075690,37,,Đã bán 16,aoni
Áo Len Nam Loại Dày BS19 (Size,350.000₫,https://tiki.vn/ao-len-nam-loai-day-bs19-p8065903.html?spid=8065905,38,,Đã bán 4,aoni
Aó len nam thời trang siêu đẹp AE155,347.000₫,https://tiki.vn/ao-len-nam-thoi-trang-sieu-dep-ae155-p34722450.html?spid=34722458,39,,Đã bán 1,aoni
Áo len dài tay ALEND051,599.500₫,https://tiki.vn/ao-len-dai-tay-aligro-alend051-p9820497.html?spid=9820501,40,,,aoni
