title,price,link_item,index,discount,sales,category
Áo Sweater Unisex Tay Dài Brnad Form Rộng Vải Nỉ Bông Cổ Polo Phong Cách Ulzzang,49.500₫,https://tiki.vn/ao-sweater-unisex-tay-dai-brnad-form-rong-vai-ni-bong-co-polo-phong-cach-ulzzang-p249254442.html?spid=249254488,1,-12%,Đã bán 1,aokhoacnu
Áo Sweater Nữ Form Rộng Nỉ Bông Hàn Quốc In Hình Bé Cắt Tóc Siêu Xinh Siêu Rõ Unisex SENAVA,95.000₫,https://tiki.vn/ao-sweater-nu-form-rong-ni-bo-ng-han-quoc-in-hi-nh-be-ca-t-to-c-sie-u-xinh-sie-u-ro-unisex-senava-ak04-p193370629.html?spid=193370633,2,-44%,,aokhoacnu
(HÀNG SẴN) Áo Khoác Da Cho Nữ Xuân Thu Thiết Kế Retro KD10 - Hàng Quảng Châu Cao Cấp,398.000₫,https://tiki.vn/hang-san-ao-khoac-da-cho-nu-xuan-thu-thiet-ke-retro-kd10-hang-quang-chau-cao-cap-p272231130.html?spid=272231132,3,-49%,Đã bán 1,aokhoacnu
Áo khoác hoodie Chống Rét Cho Nam nữ Cho Cặp Đôi nón tai thỏ Chất Nỉ Unisex Form rộng Có 4 Màu Ulzzang,59.000₫,https://tiki.vn/ao-khoac-hoodie-chong-ret-cho-nam-nu-cho-cap-doi-non-tai-tho-chat-ni-unisex-form-rong-co-4-mau-ulzzang-p84471575.html?spid=205358322,4,-45%,,aokhoacnu
,,https://tiki.vn/ao-khoac-vest-blazer-nu-dui-viet-vai-linen-han-form-rong-tui-dap-kieu-dang-cong-so-be-dv09-p272240121.html?spid=272240125,5,-5%,,aokhoacnu
(HÀNG SẴN) Áo Khoác Dạ Dáng Ngắn Thu Đông Cho Mẹ AD01 - Hàng Quảng Châu Cao Cấp,435.000₫,https://tiki.vn/hang-san-ao-khoac-da-dang-ngan-thu-dong-cho-me-ad01-hang-quang-chau-cao-cap-p270827565.html?spid=270827579,6,,Đã bán 1,aokhoacnu
"(Hàng sẵn) Áo phao lót lông cao cấp, Áo parka siêu đẹp cho nữ BB221 RumHana Fashion",319.000₫,https://tiki.vn/hang-san-ao-phao-lot-long-cao-cap-ao-parka-sieu-dep-cho-nu-bb221-rumhana-fashion-p104665186.html?spid=104665296,7,,Đã bán 24,aokhoacnu
Áo vest xinh diện bốn mùa mẫu kẻ tay lỡ có túi,229.000₫,https://tiki.vn/ao-vest-xinh-dien-bon-mua-mau-ke-tay-lo-co-tui-p182305840.html?spid=182305850,8,-12%,Đã bán 2,aokhoacnu
Áo Khoác Nữ Xỏ Ngón Comfort Phúc An 4034 Màu,180.000,https://tiki.vn/ao-khoac-nu-xo-ngon-comfort-phuc-an-4034-p8068749.html?spid=8068795,9,,,aokhoacnu
,,https://tiki.vn/ao-da-nu-dang-dai-p152560141.html?spid=152560149,10,,,aokhoacnu
Áo len nữ form rộng hoạ tiết kẻ ngang trẻ trung AH09,140.000₫,https://tiki.vn/ao-len-nu-form-rong-hoa-tiet-ke-ngang-tre-trung-ah09-p125392397.html?spid=125392398,11,,Đã bán 18,aokhoacnu
Áo khoác hoodie nỉ form rộng cho nữ áo hoodie zip trơn 1 màu xám sành điệu,108.000,https://tiki.vn/ao-khoac-hoodie-ni-form-rong-cho-nu-ao-hoodie-zip-tron-1-mau-xam-sanh-dieu-shopmap-p176292373.html?spid=176292387,12,,,aokhoacnu
,,https://tiki.vn/ao-phao-5-mau-long-chon-ao-khoac-nu-chat-phao-tran-mu-thao-roi-mewshop-ninh-binh-p124903481.html?spid=127624481,13,,,aokhoacnu
(HÀNG SẴN) Áo Khoác Dạ Cashmera Dài Cho Nữ AD06 - Hàng Quảng Châu Cao Cấp,685.000₫,https://tiki.vn/hang-san-ao-khoac-da-cashmera-dai-cho-nu-ad06-hang-quang-chau-cao-cap-p271782422.html?spid=271782428,14,,Đã bán 1,aokhoacnu
Hàng Sẵn_ Áo gile ngắn cổ điển phong cách retro Hadu shop,119.000₫,https://tiki.vn/hang-san_-ao-gile-ngan-co-dien-phong-cach-retro-hadu-shop-p196350067.html?spid=196350077,15,,Đã bán 3,aokhoacnu
Áo vest nữ blazer hàn quốc [HÀNG CAO CẤP] form chuẩn công sở dễ phối đồ,299.000₫,https://tiki.vn/ao-vest-nu-blazer-han-quoc-hang-cao-cap-form-chuan-cong-so-de-phoi-do-p145297132.html?spid=145297140,16,,Đã bán 97,aokhoacnu
Áo Khoác Nỉ Bông Cardigan Form Rộng Nam Nữ Unisex Thêu Tiếng Hàn Ngực Ulzzang,99.000₫,https://tiki.vn/ao-khoac-ni-bong-cardigan-form-rong-nam-nu-unisex-theu-tieng-han-nguc-ulzzang-nupakachi-p169348891.html?spid=169348904,17,,Đã bán 1,aokhoacnu
,,https://tiki.vn/ao-khoac-mang-to-dai-qua-goi-p68995116.html?spid=68995120,18,,,aokhoacnu
Áo Khoác Nữ Chống Nắng 3 trong 1 ( miễn ship),99.000₫,https://tiki.vn/ao-khoac-nu-chong-nang-3-trong-1-mien-ship-p87670369.html?spid=87670929,19,,Đã bán 47,aokhoacnu
Áo Khoác Nỉ Chữ SWEEDER Có Nón Mũ 2 Lớp - Kiểu Hoodie Có Khóa Kéo Zip Nam Nữ Cặp Đôi - Thu Đông,94.000₫,https://tiki.vn/ao-khoac-ni-chu-sweeder-co-non-mu-2-lop-kieu-hoodie-co-khoa-keo-zip-nam-nu-cap-doi-thu-dong-p207291848.html?spid=212266620,20,,Đã bán 4,aokhoacnu
"(SẴN HÀNG) ÁO GILE PHAO SIÊU ẤM CÚC CÀI, ÁO KHOÁC GILE NỮ 2021",175.000₫,https://tiki.vn/san-hang-ao-gile-phao-sieu-am-cuc-cai-ao-khoac-gile-nu-2021-p115242214.html?spid=115242232,21,,Đã bán 11,aokhoacnu
"Áo Khoác Nữ Đẹp, Áo Khoác Nữ Form Rộng, Áo Khoác Nữ Chống Nắng Chất Quảng Châu Cao Cấp Dày Dặn Có Túi Trong Tay Xỏ Ngón Thương Hiệu Baw AK94 (Hình thật shop tự chụp)",149.000₫,https://tiki.vn/ao-khoac-nu-dep-ao-khoac-nu-form-rong-ao-khoac-nu-chong-nang-chat-quang-chau-cao-cap-day-dan-co-tui-trong-tay-xo-ngon-thuong-hieu-baw-ak94-hinh-that-shop-tu-chup-p272283822.html?spid=272283830,22,,,aokhoacnu
"Áo Khoác Cardigan Teelab Basic Logo, Áo khoác nỉ logo nam nữ phong cách Hàn Quốc Dáng Ngắn Form Rộng Thời Trang Mùa Hè Mới Cho Nữ",170.000₫,https://tiki.vn/ao-khoac-cardigan-teelab-basic-logo-ao-khoac-ni-logo-nam-nu-phong-cach-han-quoc-dang-ngan-form-rong-thoi-trang-mua-he-moi-cho-nu-p272408673.html?spid=272408675,23,,,aokhoacnu
(ÁO PHAO NỮ MŨ LÔNG ĐẠI HÀN PHONG CÁCH HÀN QUỐC),299.000₫,https://tiki.vn/ao-phao-nu-mu-long-dai-han-phong-cach-han-quoc-p120775592.html?spid=149784707,24,,Đã bán 3,aokhoacnu
ÁO KHOÁC LEN_ ÁO LEN NỮ,169.000,https://tiki.vn/ao-khoac-len_-ao-len-nu-p115770782.html?spid=115770882,25,,,aokhoacnu
,,https://tiki.vn/ao-len-tay-bong-nu-kieu-co-lo-ngan-tay-dang-om-det-kim-long-tho-sieu-mem-min-hang-quang-chau-cao-cap-tre-trung-p205958856.html?spid=205958872,26,,,aokhoacnu
Áo khoác Cardigan len nữ họa tiết trẻ trung đủ size Đũi Việt DV36,219.000₫,https://tiki.vn/ao-khoac-cardigan-len-nu-hoa-tiet-tre-trung-du-size-dui-viet-dv36-p73241396.html?spid=73241414,27,,Đã bán 17,aokhoacnu
Áo Khoác Nữ Trẻ Trung Phong Cách Hàn Quốc AK003 MayHomes Thời Trang Dễ Thương Kiểu Mũ Trùm Đầu,166.250₫,https://tiki.vn/ao-khoac-nu-tre-trung-phong-cach-han-quoc-ak003-mayhomes-thoi-trang-de-thuong-kieu-mu-trum-dau-p201768663.html?spid=201768665,28,,Đã bán 13,aokhoacnu
"Áo blazer- Áo vest nữ công sở, chất liệu đũi, dáng suông basic CS05",179.000₫,https://tiki.vn/ao-blazer-ao-vest-nu-cong-so-chat-lieu-dui-dang-suong-basic-cs05-p200915931.html?spid=200915935,29,,Đã bán 2,aokhoacnu
Áo khoác thể thao nữ Oneill Women Of The Wave - 1750033-13013,550.000,https://tiki.vn/ao-khoac-the-thao-nu-oneill-women-of-the-wave-1750033-13013-p270783823.html?spid=270783833,30,,,aokhoacnu
,,https://tiki.vn/ao-gile-len-nu-co-cuc-thiet-ke-phong-cach-han-quoc-gl03-p133892652.html?spid=271968867,31,,,aokhoacnu
(HÀNG SẴN) Áo Khoác Phao Nữ Ngắn Trẻ Trung Năng Động AK101 - Hàng Quảng Châu Cao Cấp,325.000₫,https://tiki.vn/hang-san-ao-khoac-phao-nu-ngan-tre-trung-nang-dong-ak101-hang-quang-chau-cao-cap-p125022439.html?spid=125022747,32,,Đã bán 8,aokhoacnu
"Áo len nữ, áo len dài tay cổ tròn thu đông AL46",219.000₫,https://tiki.vn/ao-len-nu-ao-len-dai-tay-co-tron-thu-dong-al46-p133888803.html?spid=133888812,33,,,aokhoacnu
Áo Khoác Phao Nữ 3 Lớp Chần Bông Lông Vũ Cực Ấm Đặc Biệt Nón Có Thể Tháo Rời Được,208.000₫,https://tiki.vn/ao-khoac-phao-nu-3-lop-chan-bong-long-vu-cuc-am-dac-biet-non-co-the-thao-roi-duoc-p167618772.html?spid=208748190,34,,Đã bán 1,aokhoacnu
(HÀNG SẴN) Áo Khoác Phao Lông Vũ Dáng Dài Phong Cách Châu Âu AK199 - Hàng Quảng Châu Cao Cấp,745.000,https://tiki.vn/hang-san-ao-khoac-phao-long-vu-dang-dai-phong-cach-chau-au-ak99-hang-quang-chau-cao-cap-p167543259.html?spid=167543317,35,,,aokhoacnu
,,https://tiki.vn/set-ao-vest-blazer-nu-ngan-tay-2-tui-hang-thiet-ke-cao-cap-sv04-wfstudios-p140212881.html?spid=140212893,36,,,aokhoacnu
"Áo Khoác Hoodie Chống Nắng Dành cho nam và nữ In Hình PUPPY Có 6 Màu, unisex nỉ ngoại form rộng ulzzang, Áo Khoác Hoodie 0707",103.000₫,https://tiki.vn/ao-khoac-hoodie-chong-nang-danh-cho-nam-va-nu-in-hinh-puppy-co-6-mau-unisex-ni-ngoai-form-rong-ulzzang-ao-khoac-hoodie-0707-p80935515.html?spid=80935517,37,,Đã bán 27,aokhoacnu
"Áo khoác nữ thoát nhiệt Nhật Bản GOKING, 100% cotton siêu thoáng mát, thấm hút mồ hôi, khử mùi, kháng khuẩn, chống UV, chống nắng nhẹ",275.000₫,https://tiki.vn/ao-khoac-nu-thoat-nhiet-nhat-ban-goking-100-cotton-sieu-thoang-mat-tham-hut-mo-hoi-khu-mui-khang-khuan-chong-uv-p13894753.html?spid=56323343,38,,Đã bán 525,aokhoacnu
Áo khoác len nữ KN32,199.000₫,https://tiki.vn/ao-khoac-len-nu-kn31-p20620638.html?spid=20620644,39,,Đã bán 5,aokhoacnu
Áo Khoác Hoodie Nỉ Bông Dây Kéo Zip Baby FACE SMILE Form rộng Unisex Nam Nữ Cá Tính Ulzzang KUN,100.000,https://tiki.vn/ao-khoac-hoodie-ni-bong-day-keo-zip-baby-face-smile-form-rong-unisex-nam-nu-ca-tinh-ulzzang-kun-p134387651.html?spid=140173683,40,,,aokhoacnu
