title,price,link_item,index,discount,sales,category
Áo len lông nhung nữ dáng ngắn màu ngịt Hadu shop,274.800₫,https://tiki.vn/ao-len-long-nhung-nu-dang-ngan-mau-ngit-hadu-shop-p208389114.html?spid=208389117,1,,Đã bán 2,aokhoacnu
"Áo Khoác Cardigan Nam Nữ Form Rộng Chất Nỉ Mềm Mịn In Chữ Nổi GOODs Mẫu Mới Được Nhiều Bạn Trẻ Yêu Thích, Áo khoác Cardigan Nỉ Bông Thêu GOODS Phối Viên Nâu Cúc Gài PHONG CÁCH Hàn Quốc Cao Cấp Sau Lưng In Hình Cute, Áo khoác ngoài dài tay",100.000₫,https://tiki.vn/ao-khoac-cardigan-nam-nu-form-rong-chat-ni-mem-min-in-chu-noi-goods-mau-moi-duoc-nhieu-ban-tre-yeu-thich-ao-khoac-cardigan-ni-bong-theu-goods-phoi-vien-nau-cuc-gai-phong-cach-han-quoc-cao-cap-sau-lung-in-hinh-cute-ao-khoac-ngoai-dai-tay-p271271520.html?spid=271271522,2,-12%,Đã bán 1,aokhoacnu
"Áo khoác chống nắng nữ chống tia UV cực tốt, thoáng mát, mềm mịn, co dãn 4 chiều",108.000₫,https://tiki.vn/ao-khoac-chong-nang-nu-chong-tia-uv-cuc-tot-thoang-mat-mem-min-co-dan-4-chieu-p89302345.html?spid=169494842,3,,Đã bán 8,aokhoacnu
Áo khoác cardigan nữ dài tay dáng dài Dv32,263.000,https://tiki.vn/ao-khoac-cardigan-nu-dai-tay-dang-dai-dv32-p137519028.html?spid=137519034,4,,,aokhoacnu
,,https://tiki.vn/ao-khoac-dirtycoins-print-cardigan-ao-khoac-cardigan-ban-phoi-tuoi-tre-lan-hoai-niem-cho-gen-z-ao-cardigan-nu-phong-cach-han-quoc-xinh-xan-ao-khoac-thu-dong-nu-chat-lieu-gan-form-rong-vai-dep-khong-xu-p102743436.html?spid=102743440,5,-12%,,aokhoacnu
Áo len nữ cổ tim ngắn tay AL64,131.000₫,https://tiki.vn/ao-len-nu-co-tim-ngan-tay-al64-p121754697.html?spid=121754702,6,-44%,Đã bán 1,aokhoacnu
Áo Khoác Phao Nữ hàng Quảng Châu + Ảnh thật,300.000₫,https://tiki.vn/ao-khoac-phao-nu-hang-quang-chau-anh-that-p97741883.html?spid=272069080,7,-30%,,aokhoacnu
Áo khoác len dáng dài cardigan cho bầu bí bon chen,242.000₫,https://tiki.vn/ao-khoac-len-dang-dai-cardigan-cho-bau-bi-bon-chen-p129498711.html?spid=129498738,8,,Đã bán 1,aokhoacnu
"Áo gile nữ 2 túi cơi ,áo vest cổ tim sát nách 3 màu xinh xắn",125.000,https://tiki.vn/ao-gile-nu-2-tui-coi-ao-vest-co-tim-sat-nach-3-mau-xinh-xan-p230231512.html?spid=230231526,9,,,aokhoacnu
,,https://tiki.vn/ao-len-nu-cardigan-kieu-dai-thoi-trang-xinh-ald01-mayhomes-p178058698.html?spid=178059512,10,,,aokhoacnu
"Áo khoác len nữ trung niên, áo len dệt kim nữ cho mẹ cổ V phong cách hàn quốc",128.000₫,https://tiki.vn/ao-khoac-len-nu-trung-nien-ao-len-det-kim-nu-cho-me-co-v-phong-cach-han-quoc-p253090184.html?spid=253090186,11,,Đã bán 2,aokhoacnu
Áo Khoác Nữ Hàn Quốc Thun Nỉ Ngoại Free Size 70kg AK67,105.800,https://tiki.vn/ao-khoac-nu-han-quoc-thun-ni-ngoai-free-size-70kg-ak67-p68834216.html?spid=69884262,12,,,aokhoacnu
,,https://tiki.vn/ao-blazer-nu-ao-vest-dai-tay-khoac-ngoai-phong-cach-han-quoc-mau-trang-2-lop-p273504100.html?spid=255175666,13,,,aokhoacnu
"Áo len nữ chất len dày dặn, mềm mại phong cách Hàn Quốc",139.000₫,https://tiki.vn/ao-len-nu-chat-len-day-dan-mem-mai-phong-cach-han-quoc-p146589501.html?spid=146589503,14,,Đã bán 4,aokhoacnu
Áo Vest Blazer Nữ Linen Beige Dài Tay,289.000₫,https://tiki.vn/ao-vest-blazer-nu-linen-beige-dai-tay-p58130519.html?spid=73210435,15,,Đã bán 16,aokhoacnu
Áo phao nữ nhồi bông siêu nhẹ (mũ tháo rời),259.000₫,https://tiki.vn/ao-phao-nu-nhoi-bong-sieu-nhe-mu-thao-roi-p92491507.html?spid=124061072,16,,Đã bán 3,aokhoacnu
Áo khoác hoodie nỉ dây kéo form rộng HEART Ulzzang (ẢNH THẬT),59.000₫,https://tiki.vn/ao-khoac-hoodie-ni-day-keo-form-rong-heart-ulzzang-anh-that-p85011311.html?spid=205358502,17,,,aokhoacnu
,,https://tiki.vn/ao-khoac-ni-bong-ngoai-cardigan-reception-f-unisex-nam-nu-couple-mac-cute-bomber-jackets-thoitrangteenthienha-p106987617.html?spid=155703690,18,,,aokhoacnu
Áo Khoác Dù Nữ - Áo Khoác Mỏng Chống Nắng Nhiều Họa Tiết,98.000₫,https://tiki.vn/ao-khoac-du-nu-ao-khoac-mong-chong-nang-nhieu-hoa-tiet-p272268673.html?spid=272268677,19,,,aokhoacnu
Áo len nữ vặn thừng áo khoác ngoài mùa xuân và mùa thu Phong cách hàn quốc,242.000₫,https://tiki.vn/ao-len-nu-van-thung-ao-khoac-ngoai-mua-xuan-va-mua-thu-phong-cach-han-quoc-p123870489.html?spid=134791146,20,,,aokhoacnu
Áo khoác phao nữ KN78,890.000₫,https://tiki.vn/ao-khoac-phao-nu-kn78-p15232667.html?spid=15232676,21,,Đã bán 6,aokhoacnu
Áo hoodie nỉ có nón in hoạt hình cô bé nasa dễ thương chất liệu Nỉ Thu Đông hè Nam Nữ Unisex Form Rộng G5,53.000₫,https://tiki.vn/ao-hoodie-ni-co-non-in-hoat-hinh-co-be-nasa-de-thuong-chat-lieu-ni-thu-dong-he-nam-nu-unisex-form-rong-g5-p249240688.html?spid=249240714,22,,Đã bán 1,aokhoacnu
Áo KHOÁC Hoodie HOOD Ulzzang Unisex,95.000₫,https://tiki.vn/ao-khoac-hoodie-hood-ulzzang-unisex-fammilyshop-p191124700.html?spid=191124704,23,,Đã bán 1,aokhoacnu
ÁO KHOÁC PHAO NỮ PHONG CÁCH HÀN QUỐC - 667_51603675,298.000₫,https://tiki.vn/ao-khoac-phao-nu-phong-cach-han-quoc-667_51603675-p135496483.html?spid=135496491,24,,Đã bán 2,aokhoacnu
Áo Len Tăm Cổ 3 Phân Hàng Cao Cấp áo dài tay nữ chất len tăm,68.000₫,https://tiki.vn/ao-len-tam-co-3-phan-hang-cao-cap-ao-dai-tay-nu-chat-len-tam-p194444145.html?spid=194444239,25,,,aokhoacnu
,,https://tiki.vn/ao-khoac-da-co-tron-dang-ngan-p199177735.html?spid=199177739,26,,,aokhoacnu
Áo Sweater Trơn Chất Nỉ Lót Bông Màu Xanh Lá - Sweater Unisex - MM,109.000₫,https://tiki.vn/ao-sweater-tron-chat-ni-lot-bong-mau-xanh-la-sweater-unisex-mm-p108422405.html?spid=108422409,27,,,aokhoacnu
"áo khoác nữ thu đông 2 lớp, áo khoác lông viền dạ cúc ngọc điệu đà",175.000₫,https://tiki.vn/ao-khoac-nu-thu-dong-2-lop-ao-khoac-long-vien-da-cuc-ngoc-dieu-da-p204988851.html?spid=151455960,28,,Đã bán 26,aokhoacnu
"Áo Sweater chui đầu nam nữ dễ thương harry potter - Chất liệu nỉ bông ngoại mềm mịn, giữ ấm tốt, làm áo cặp, Áo sweater 70kg nỉ ngoại harry potter siêu đẹp, Áo Sweater Form Rộng Unisex Tay Bồng Nam Nữ Mặc Được Chất Nỉ Bông Hàng Xuất Dày Đẹp",99.000₫,https://tiki.vn/ao-sweater-chui-dau-nam-nu-de-thuong-harry-potter-chat-lieu-ni-bong-ngoai-mem-min-giu-am-tot-lam-ao-cap-ao-sweater-70kg-ni-ngoai-harry-potter-sieu-dep-ao-sweater-form-rong-unisex-tay-bong-nam-nu-mac-duoc-chat-ni-bong-hang-xuat-day-dep-p151921669.html?spid=151921670,29,,Đã bán 15,aokhoacnu
ÁO PHAO LÔNG VŨ HÀN QUỐC CHẤT SIÊU ĐẸP (clip cận chất),202.000,https://tiki.vn/ao-phao-long-vu-han-quoc-chat-sieu-dep-clip-can-chat-p124903573.html?spid=127626309,30,,,aokhoacnu
,,https://tiki.vn/ao-vest-blazer-nu-linen-demi-tay-lo-tre-trung-lahstore-thoi-trang-he-thu-2021-p100321358.html?spid=100321366,31,,,aokhoacnu
"Áo khoác vest, áo blazer nữ xinh xắn nhiều màu DV05",175.000₫,https://tiki.vn/ao-khoac-vest-blazer-nu-xinh-xan-nhieu-mau-dv05-p126032643.html?spid=126032653,32,,Đã bán 3,aokhoacnu
Áo Blazer Nữ Croptop Ngắn Tay Áo khoác Vest cộc nữ Chất Tuyết Mưa Cao Cấp Hàng Thiết Kế Tay Lỡ Dáng Ngắn Hàn Quốc,169.000₫,https://tiki.vn/ao-blazer-nu-croptop-ngan-tay-ao-khoac-vest-coc-nu-chat-tuyet-mua-cao-cap-hang-thiet-ke-tay-lo-dang-ngan-han-quoc-p241773516.html?spid=241773526,33,,Đã bán 4,aokhoacnu
ÁO SWEATER UNISEX IN THỎ CUTE (NHIỀU MÀU),83.000₫,https://tiki.vn/ao-sweater-unisex-in-tho-cute-nhieu-mau-p164986176.html?spid=164986841,34,,Đã bán 4,aokhoacnu
"Áo Sweater tay dài gấu hello starry SKY from rộng quảng châu, ÁO Hoodie HELLO unisex ulzzang, Áo Nỉ Sweater Gấu Hello Siêu Xinh Áo Nỉ Dáng Rộng Hot Hit",99.000₫,https://tiki.vn/ao-sweater-tay-dai-gau-hello-starry-sky-from-rong-quang-chau-ao-hoodie-hello-unisex-ulzzang-ao-ni-sweater-gau-hello-sieu-xinh-ao-ni-dang-rong-hot-hit-p125802234.html?spid=125802236,35,,,aokhoacnu
,,https://tiki.vn/ao-len-nu-dang-dai-2-tui-truoc-khuy-suon-tre-trung-arctichunter-thoi-trang-thu-dong-2022-p200950817.html?spid=200950823,36,,,aokhoacnu
Áo dạ tweed khoác ngoài váy hai dây áo khoác ngoài nữ vải dạ tweed cao cấp sang trọng phù hợp đi tiệc đi chơi đi dạo phố,385.000₫,https://tiki.vn/ao-da-tweed-khoac-ngoai-vay-hai-day-ao-khoac-ngoai-nu-vai-da-tweed-cao-cap-sang-trong-phu-hop-di-tiec-di-choi-di-dao-pho-p247820735.html?spid=247820747,37,,,aokhoacnu
Áo khoác nữ - Áo khoác nữ,165.000₫,https://tiki.vn/ao-khoac-nu-ao-khoac-nu-p16591021.html?spid=27731981,38,,Đã bán 36,aokhoacnu
Áo khoác len dệt kim cardigan rộng rãi dày lười học sinh giản dị mềm mại,259.000₫,https://tiki.vn/ao-khoac-len-det-kim-cardigan-rong-rai-day-luoi-hoc-sinh-gian-di-mem-mai-p123871391.html?spid=123871409,39,,Đã bán 34,aokhoacnu
Áo Khoác 6 Túi Nữ Chống Nắng Cotton Cao Cấp (ad01),169.000,https://tiki.vn/ao-khoac-6-tui-nu-chong-nang-cotton-cao-cap-ad01-p87671094.html?spid=87671848,40,,,aokhoacnu
