title,price,link_item,index,discount,sales,category
"Áo Oversize BOBUI Đỏ Phản Quang , Tee Bobui Saigon Reflective RED",160.000₫,https://tiki.vn/ao-oversize-bobui-do-phan-quang-tee-bobui-saigon-reflective-red-p108339745.html?spid=110651459,1,,Đã bán 5,aothun
Áo Thun Nam Cổ Polo Phối Màu Viền,157.000₫,https://tiki.vn/ao-thun-nam-co-polo-phoi-mau-vien-p82642753.html?spid=82642914,2,,Đã bán 1,aothun
"Áo phông Oversize Brooklyn, JACKLANE, Áo cộc tay Unisex Jack Lane",280.000₫,https://tiki.vn/ao-phong-oversize-brooklyn-jacklane-ao-coc-tay-unisex-jack-lane-p160517516.html?spid=160517651,3,-50%,Đã bán 1,aothun
Áo thun Teeworld Sài Gòn Retro Nam Nữ Trắng Đen Form Rộng Unisex,359.000,https://tiki.vn/ao-thun-teeworld-retro-saigon-nam-nu-trang-den-form-rong-unisex-p196207027.html?spid=196207029,4,,,aothun
,,https://tiki.vn/ao-polo-nam-co-be-phoi-soc-blook-vai-ca-sau-cotton-cvc-cao-cap-co-gian-da-chieu-tham-hut-nhanh-ben-mau-slimfit-35620-p196314768.html?spid=196314778,5,,,aothun
Áo thun dài tay có túi ALNE phông Unisex nam nữ tee oversize form rộng pull Ulzzang Streetwear thu đông vải mềm,124.000₫,https://tiki.vn/ao-thun-dai-tay-co-tui-alne-phong-unisex-nam-nu-tee-oversize-form-rong-pull-ulzzang-streetwear-thu-dong-vai-mem-p143352921.html?spid=143352978,6,-55%,,aothun
Áo phông trắng nam cổ tròn dáng ôm nhẹ,59.000₫,https://tiki.vn/ao-phong-trang-nam-co-tron-dang-om-nhe-p51108550.html?spid=83607632,7,-32%,Đã bán 4,aothun
Áo giữ nhiệt Nam cổ ba phân,54.000₫,https://tiki.vn/ao-giu-nhiet-nam-co-ba-phan-p72069940.html?spid=127219690,8,-38%,,aothun
Áo Polo nam thun cotton trơn basic,151.800,https://tiki.vn/ao-polo-nam-thun-cotton-tron-basic-p79972457.html?spid=87610805,9,,,aothun
,,https://tiki.vn/ao-thun-3-lo-nam-the-thao-tap-gym-qshop-ab444-p260686278.html?spid=260686286,10,,,aothun
Áo thun cặp đôi Cotton màu đỏ đô in hình mẫu 35,389.000₫,https://tiki.vn/ao-thun-cap-doi-cotton-mau-do-do-in-hinh-mau-35-p11004900.html?spid=11004940,11,-17%,,aothun
Áo Converse Play All Day Ss Tee Creative 10025272-A01,385.000,https://tiki.vn/ao-converse-play-all-day-ss-tee-creative-10025272-a01-p273189574.html?spid=273196497,12,-35%,,aothun
,,https://tiki.vn/ao-thun-nam-co-tron-tay-ngan--chat-thun-cao-cap--tre-trung--nang-dong---formen-shop---fmps148-p74420077.html?spid=74420083,13,-20%,,aothun
Áo Ba lỗ gym nam NO PAIN NO GAIN quả tạ/Thể hiện niềm đam mê cháy bỏng với thể thao,135.000₫,https://tiki.vn/ao-ba-lo-gym-nam-no-pain-no-gain-qua-ta-the-hien-niem-dam-me-chay-bong-voi-the-thao-p272345761.html?spid=272345779,14,,,aothun
"Áo Ba lỗ gym nam No Dream No Gain/Áo balo thể thao, tập gym",135.000₫,https://tiki.vn/ao-ba-lo-gym-nam-no-dream-no-gain-ao-balo-the-thao-tap-gym-p272345618.html?spid=272345658,15,,,aothun
Áo Phông Nam PoLo Ngắn Tay 8 Màu Thời Trang AVIANO,129.000₫,https://tiki.vn/ao-phong-nam-polo-ngan-tay-8-mau-thoi-trang-aviano-p163545116.html?spid=163545176,16,,Đã bán 18,aothun
Áo Thun Polo Nam Cao Cấp VIỆT PHÁP / Form Basic - Chất liệu cotton co dãn thấm hút mồ hồi tốt 67701,227.000,https://tiki.vn/ao-thun-polo-nam-cao-cap-viet-phap-form-basic-chat-lieu-cotton-co-dan-tham-hut-mo-hoi-tot-67701-p273041214.html?spid=273215427,17,,,aothun
,,https://tiki.vn/ao-thun-polo-nam-cao-cap-viet-phap-form-basic-chat-lieu-cotton-co-dan-tham-hut-mo-hoi-tot-3207-p273046433.html?spid=273046471,18,,,aothun
Áo thun nam Polo NOVELTY không túi kiểu dáng Melange 210104N,199.000₫,https://tiki.vn/ao-thun-nam-polo-novelty-khong-tui-kieu-dang-melange-210104n-p94365443.html?spid=94365447,19,,Đã bán 2,aothun
Áo Thun 4 Chiều Sọc Cao Cấp VIỆT PHÁP / Form Suông- Chất liệu cotton co dãn và thấm hút mồ hôi tốt 2211,351.000₫,https://tiki.vn/ao-thun-4-chieu-soc-cao-cap-viet-phap-form-suong-chat-lieu-cotton-co-dan-va-tham-hut-mo-hoi-tot-2211-p272939977.html?spid=272940005,20,,,aothun
(bigsizenam <130kg) JEAN DÀI MÀU XANH BẠC KHÔNG RÁCH BIG SIZE NAM,360.000₫,https://tiki.vn/bigsizenam-130kg-jean-dai-mau-xanh-bac-khong-rach-big-size-nam-p179161656.html?spid=179161679,21,,Đã bán 1,aothun
"Áo thun polo nam, áo thun cá sấu nam hoạ tiết có cổ bẻ trẻ trung niên big size 3xl CB17",155.000₫,https://tiki.vn/ao-thun-polo-nam-ao-thun-ca-sau-nam-hoa-tiet-co-co-be-tre-trung-nien-big-size-3xl-cb17-p262908866.html?spid=262908882,22,,,aothun
"Bộ 4 áo thun nam cổ bẻ cao cấp ( Tặng 1 dây nịt da ) DokaFashion, chất liệu thun cá sấu 4 chiều ngoại nhập - Trắng, Xanh dương, Đen, Xanh cổ vịt",348.500₫,https://tiki.vn/bo-4-ao-thun-nam-co-be-cao-cap-dokafashion-chat-lieu-thun-ca-sau-4-chieu-ngoai-nhap-trang-xanh-duong-den-xanh-co-vit-p56748419.html?spid=56748429,23,,Đã bán 19,aothun
"Surfing California, mã G76. Áo thun du lịch siêu đẹp. Áo phông hàng hiệu GOKING cho nam nữ, trẻ em, teen, trung niên. Quà tặng cao cấp",69.000₫,https://tiki.vn/surfing-california-ma-g76-ao-thun-nam-nu-in-sieu-dep-ao-phong-thoat-nhiet-goking-hang-hieu-cao-cap-p164313632.html?spid=249012300,24,,Đã bán 25,aothun
"Áo thun cổ bẻ nam phối màu trẻ trung, chất thun mềm mịn thoải mái hoạt động - FORMEN SHOP - FMPS162",159.000,https://tiki.vn/ao-thun-co-be-nam-phoi-mau-tre-trung-chat-thun-mem-min-thoai-mai-hoat-dong-formen-shop-fmps162-p146360819.html?spid=146360821,25,,,aothun
,,https://tiki.vn/a-o-thun-dirtycoins-casual-t-shirt-p271760820.html?spid=271760828,26,,,aothun
Áo Thun Nam có túi form suông Khatoco A2MN438R2-VNCR216-2411-N,363.540₫,https://tiki.vn/ao-thun-nam-co-tui-form-suong-khatoco-a2mn438r2-vncr216-2411-n-p268736387.html?spid=268736389,27,,,aothun
Áo thun tay lỡ form rộng unisex THE BAD GOD chất lượng,98.000₫,https://tiki.vn/ao-thun-tay-lo-form-rong-unisex-the-bad-god-chat-luong-p197686514.html?spid=197686518,28,,,aothun
"[MUA 1 TẶNG 1] AO THỂ THAO AVP04NEW VINA AUTHENTIC CAO CẤP, CO GIẢN, DỄ HOẠT ĐỘNG, THẤM HÚT MỒ HÔI, HỢP THỜI TRANG",10.000₫,https://tiki.vn/mua-1-tang-1-ao-the-thao-avp04new-vina-authentic-cao-cap-co-gian-de-hoat-dong-tham-hut-mo-hoi-hop-thoi-trang-p252401548.html?spid=253189441,29,,,aothun
Áo Thun Nam Cổ Bẻ Viền Tay Thời Trang Poniva,157.000,https://tiki.vn/ao-thun-nam-co-be-vien-tay-thoi-trang-poniva-p83161336.html?spid=83161706,30,,,aothun
,,https://tiki.vn/ao-thun-tay-dai-nam-nu-form-rong-co-tron-du-5-mau-basic-den-trang-xanh-hong-chat-phong-cao-cap-unisex-guf-p75637055.html?spid=85509838,31,,,aothun
"NEVER SAY LOSE, mã G43. Áo thun nam nữ siêu đẹp. Áo phông thoát nhiệt Goking hàng hiệu",168.000₫,https://tiki.vn/never-say-lose-ma-g43-ao-thun-nam-nu-sieu-dep-ao-phong-thoat-nhiet-goking-hang-hieu-p164251213.html?spid=164252000,32,,Đã bán 24,aothun
"Áo Thun Dài Tay Unisex nam nữ form rộng Oversize, Sweater chất nỉ da cá cao cấp trơn basic, GENZ, Thương hiệu Việt",135.000₫,https://tiki.vn/ao-thun-dai-tay-unisex-nam-nu-form-rong-oversize-sweater-chat-ni-da-ca-cao-cap-tron-basic-genz-thuong-hieu-viet-p170270037.html?spid=170270049,33,,Đã bán 3,aothun
Áo Thun Cotton In Cao Cấp VIỆT PHÁP /Form Luxury / Thoáng mát - co dãn tốt- chất liệu cotton mềm mịn thấm hút mồ hôi 34564,313.000₫,https://tiki.vn/ao-thun-cotton-in-cao-cap-viet-phap-form-luxury-thoang-mat-co-dan-tot-chat-lieu-cotton-mem-min-tham-hut-mo-hoi-34564-p272857275.html?spid=272857313,34,,Đã bán 3,aothun
"[HOT TREND] Áo giữ nhiệt nam dài tay, áo thu đông cho nam cổ 3 cm, hàng cao cấp",45.000₫,https://tiki.vn/hot-trend-ao-giu-nhiet-nam-dai-tay-ao-thu-dong-cho-nam-co-3-cm-hang-cao-cap-p213714401.html?spid=273041645,35,,,aothun
,,https://tiki.vn/ao-phong-nam-co-co-tay-ngan-mau-dep-chat-vai-thun-cotton-100-atn0510-p136150696.html?spid=247863591,36,,,aothun
Áo Thun Ba Lỗ Nam Phong Cách Hàn Nhiều Màu,84.000₫,https://tiki.vn/ao-thun-ba-lo-nam-phong-cach-han-nhieu-mau-p78544461.html?spid=78544467,37,,Đã bán 36,aothun
Áo Thun Ba Lỗ Nam Khatoco A4MN170R2-VNMA004-2407-N,136.000₫,https://tiki.vn/ao-thun-ba-lo-nam-khatoco-a4mn170r2-vnma004-2407-n-p243044570.html?spid=243044578,38,,Đã bán 1,aothun
Áo Đồng Phục Quán Cafe Mẫu Đẹp - Áo Cá Sấu Đen Trơn Phối Màu,87.000₫,https://tiki.vn/ao-dong-phuc-quan-cafe-mau-den-phoi-mau-p70283045.html?spid=70283085,39,,Đã bán 4,aothun
Áo Thun Ngắn Tay Cổ Tròn Trơn người lớn và trẻ em,49.000₫,https://tiki.vn/ao-thun-ngan-tay-co-tron-tron-nguoi-lon-va-tre-em-p184822412.html?spid=184824235,40,,Đã bán 21,aothun
