title,price,link_item,index,discount,sales,category
Áo thun nam có cổ tay ngắn vải Cotton 100% co giãn. mềm mịn mặc mát - ATNFA,150.000₫,https://tiki.vn/ao-thun-nam-co-co-tay-ngan-vai-cotton-100-co-gian-mem-min-mac-mat-atnfa-p143868074.html?spid=189914124,1,-15%,Đã bán 2,aothun
OWEN - Áo Polo nam Owen màu XANH ĐEN chất thun lạnh 231210 - Áo thun nam ngắn tay có cổ,527.000₫,https://tiki.vn/owen-ao-polo-nam-owen-mau-xanh-den-chat-thun-lanh-231210-ao-thun-nam-ngan-tay-co-co-p240891625.html?spid=240891850,2,-10%,,aothun
Áo thun dài tay nam Fasvin AD23596.HN chất vải thể thao mềm mại co giãn hàng đẹp chính hãng,269.000₫,https://tiki.vn/ao-thun-dai-tay-nam-fasvin-ad23596-hn-chat-vai-the-thao-mem-mai-co-gian-hang-dep-chinh-hang-p272178517.html?spid=272178527,3,-45%,,aothun
MLB - Áo polo nam tay ngắn Classic Monogram 3LPQM0133,3.590.000,https://tiki.vn/mlb-ao-polo-nam-tay-ngan-classic-monogram-3lpqm0133-50bks-p252879147.html?spid=252879149,4,,,aothun
,,https://tiki.vn/ao-thun-polo-nam-tay-ngan-unisex-thuong-hieu-chandi-thiet-ke-co-be-theu-khong-bong-troc-khi-giat-pln2-p171021058.html?spid=262871139,5,-20%,,aothun
Áo thun cổ V dài tay nam nữ phong cách Hàn Quốc,200.000₫,https://tiki.vn/ao-thun-co-v-dai-tay-nam-nu-phong-cach-han-quoc-p203944085.html?spid=203944089,6,,,aothun
"Elegant Box - 2 Áo thun nam, 2 quần short đùi nam rằn ri, 5 đôi tất nam cao cấp thương hiệu MRM Manlywear",589.000₫,https://tiki.vn/elegant-box-2-ao-thun-nam-2-quan-short-dui-nam-ran-ri-5-doi-tat-nam-cao-cap-thuong-hieu-mrm-manlywear-p179735521.html?spid=179735529,7,,Đã bán 9,aothun
POLOMAN - Áo Polo Nam Công Sở Hàn Quốc - Polo Cao Cấp Thời Thượng Odin - Áo Phông Cổ Bẻ,599.000₫,https://tiki.vn/poloman-ao-polo-nam-cong-so-han-quoc-polo-cao-cap-thoi-thuong-odin-ao-phong-co-be-p149642648.html?spid=149642698,8,-17%,Đã bán 5,aothun
Áo polo phối tay nhiều màu độc đáo big size nam tới 140kg,250.000,https://tiki.vn/ao-polo-phoi-tay-nhieu-mau-doc-dao-big-size-nam-toi-140kg-p246851703.html?spid=246851729,9,,,aothun
,,https://tiki.vn/ao-ba-lo-tank-top-the-thao-nam-tsimple-ver-02-nhieu-mau-p99508026.html?spid=99508057,10,,,aothun
Combo 02 áo thun ba lỗ nam Novelty màu ngẫu nhiên,210.000₫,https://tiki.vn/combo-02-ao-thun-ba-lo-nam-novelty-giao-mau-ngau-nhien-p47470601.html?spid=47470610,11,,Đã bán 126,aothun
Áo thun nam trơn basic Sans350 vải lưới thoáng khí mát mẻ thể thao lạnh cổ tròn đen trắng xám phông bigsize 3XL 4XL 5XL,59.999₫,https://tiki.vn/ao-thun-nam-tron-basic-sans350-vai-luoi-thoang-khi-mat-me-the-thao-lanh-co-tron-den-trang-xam-m-l-xl-2xl-3xl-4xl-5xl-p194039686.html?spid=194039716,12,,,aothun
,,https://tiki.vn/ao-thun-nam-3d-gia-re-nhat-ao-nam-big-size-binh-dinh-quan-ao-cho-nguoi-map-lun-p98660066.html?spid=98660426,13,,,aothun
"Áo ba lỗ nam thể thao, Áo ba lỗ nam nữ",73.000₫,https://tiki.vn/ao-ba-lo-nam-the-thao-ao-ba-lo-nam-nu-p98660805.html?spid=98661226,14,,Đã bán 2,aothun
Áo giữ nhiệt cao cấp Wika,120.000₫,https://tiki.vn/ao-giu-nhiet-cao-cap-wika-p202743101.html?spid=202743121,15,,Đã bán 3,aothun
Áo Polo Premium Local Brand Teeworld Monogram Unisex Nam Nữ Form Rộng,318.000₫,https://tiki.vn/ao-polo-local-brand-teeworld-monogram-unisex-nam-nu-form-rong-p251266891.html?spid=251266895,16,,Đã bán 1,aothun
Áo thun nam tay dài,115.000,https://tiki.vn/ao-thun-nam-tay-dai-p271518335.html?spid=271518339,17,,,aothun
,,https://tiki.vn/ao-thun-nam-co-lo-p66897309.html?spid=66897321,18,,,aothun
"WALK INTO THE WILD, mã G88. Áo thun in đẹp cho nam nữ, form unisex. Áo phông GOKING hàng hiệu, quà tặng cao cấp cho gia đình, cặp đôi, hội nhóm, doanh nghiệp",99.000₫,https://tiki.vn/walk-into-the-wild-ma-g88-ao-thun-nam-nu-in-sieu-dep-ao-phong-thoat-nhiet-goking-hang-hieu-cao-cap-p164312832.html?spid=212948809,19,,,aothun
Áo Thun Nam Khatoco A2MN398R2-VNSC040-2410-N - Xanh dương,318.400₫,https://tiki.vn/ao-thun-nam-khatoco-a2mn398r2-vnsc040-2410-n-xanh-duong-p235856324.html?spid=235856328,20,,Đã bán 2,aothun
"Enjoy Your Life, mã G146. Áo thun polo cổ trụ cho nam nữ, form unisex. Áo phông cá sấu hàng hiệu Goking, quà tặng cao cấp cho gia đình, cặp đôi, doanh nghiệp",178.000₫,https://tiki.vn/enjoy-your-life-ma-g146-ao-thun-polo-goking-form-unisex-cho-nam-nu-doi-nhom-cong-ty-ao-phong-co-be-dong-phuc-cao-cap-vai-ca-sau-3d-p203930529.html?spid=203930570,21,,Đã bán 10,aothun
Viettien - Áo thun nam có cổ màu nâu sáng 6M3136 regular,519.000₫,https://tiki.vn/viettien-ao-thun-nam-co-co-mau-nau-sang-6m3136-regular-p176788192.html?spid=176788196,22,,,aothun
Áo lót Nam cotton trắng siêu đẹp,54.000₫,https://tiki.vn/ao-lot-nam-cotton-trang-sieu-dep-p125725750.html?spid=127532394,23,,Đã bán 36,aothun
Áo thun polo nam Khatoco,438.000₫,https://tiki.vn/ao-thun-polo-nam-khatoco-p192976831.html?spid=192976853,24,,,aothun
"Áo thun nam dài tay màu trơn đơn giản, áo thun cổ tròn lịch lãm, chất thun cotton dày dặn và thoáng mát",86.000₫,https://tiki.vn/ao-thun-nam-dai-tay-mau-tron-don-gian-ao-thun-co-tron-lich-lam-chat-thun-cotton-day-dan-va-thoang-mat-p75541240.html?spid=196137803,25,,,aothun
,,https://tiki.vn/ao-polo-nam-co-be-ngan-tay--chat-lieu-vai-ca-sau-cotton-cao-cap--tre-trung--nang-dong---formen-shop---fmps106-p54361500.html?spid=54361506,26,,,aothun
Áo Thun nam POLO vải Thun Lạnh chất 100% cotton 4 chiều cao cấp sang trọng lịch lãm-PLO219,79.000₫,https://tiki.vn/ao-thun-nam-polo-vai-thun-lanh-chat-100-cotton-4-chieu-cao-cap-sang-trong-lich-lam-plo219-p176137840.html?spid=176674574,27,,Đã bán 1,aothun
Áo Thun Polo Tay Ngắn Valentino Creations - VSSP-23007-B-KH3,4.190.000₫,https://tiki.vn/ao-thun-polo-tay-ngan-valentino-creations-vssp-23007-b-kh3-p270752759.html?spid=270752767,28,,,aothun
"Áo thun Nam Nữ Không cổ MICKEY CIMT-0025 mẫu mới cực đẹp, có size bé cho trẻ em / áo thun Anime Manga Unisex Nam Nữ, áo phông thiết kế cổ tròn basic cộc tay thoáng mát",40.000₫,https://tiki.vn/ao-thun-nam-nu-khong-co-mickey-cimt-0025-mau-moi-cuc-dep-co-size-be-cho-tre-em-ao-thun-anime-manga-unisex-nam-nu-ao-phong-thiet-ke-co-tron-basic-coc-tay-thoang-mat-p112709752.html?spid=112709766,29,,Đã bán 1,aothun
"Áo thun polo thời trang nam phong cách trẻ trung, lịch lãm - FORMEN SHOP - FMPS191",250.000,https://tiki.vn/ao-thun-polo-thoi-trang-nam-phong-cach-tre-trung-lich-lam-formen-shop-fmps191-p191055924.html?spid=191055928,30,,Đã bán 3,aothun
,,https://tiki.vn/ao-thun-nam-polo-ngan-tay-8-mau-thoi-trang-cao-cap-aviano-p163543299.html?spid=163543311,31,,,aothun
Áo Thun Nam có túi form suông Khatoco A2MN438R2-VNCR215-2411-N,363.540₫,https://tiki.vn/ao-thun-nam-co-tui-form-suong-khatoco-a2mn438r2-vncr215-2411-n-p268622828.html?spid=268622834,32,,,aothun
Áo ba lỗ nam Maxtino 100% cotton xuất Nhật,65.000₫,https://tiki.vn/ao-ba-lo-nam-maxtino-100-cotton-xuat-nhat-p170336462.html?spid=170336487,33,,,aothun
Áo thun nam tay lỡ Toounique cotton phông unisex phong cách đường phố basic,149.000₫,https://tiki.vn/ao-thun-nam-tay-lo-toounique-cotton-phong-unisex-phong-cach-duong-pho-basic-p177055299.html?spid=177055309,34,,Đã bán 1,aothun
Áo Thun Có Cổ Andromeda Vải Cá Sấu 4 Chiều Nhiều Màu Nam Nữ,89.000₫,https://tiki.vn/ao-thun-co-co-andromeda-vai-ca-sau-4-chieu-nhieu-mau-nam-nu-p184822808.html?spid=184824136,35,,,aothun
,,https://tiki.vn/ao-polo-nam-converse-ss-polo-shirt-10024739-a02-p262590911.html?spid=262590915,36,,,aothun
Áo Thun Nam Có Cổ Tay Ngắn Polo Cao Cấp Thời Trang 3390,180.000₫,https://tiki.vn/ao-thun-nam-co-co-tay-ngan-polo-cao-cap-thoi-trang-3390-p85258698.html?spid=85258704,37,,Đã bán 1,aothun
Áo Thun Polo Tay Dài Valentino Creations - VLST-22002-B-BL2,5.590.000₫,https://tiki.vn/ao-thun-polo-tay-dai-valentino-creations-vlst-22002-b-bl2-p273295154.html?spid=273295160,38,,,aothun
Áo phông unisex nam nữ tay lỡ thun form rộng teen cổ tròn oversize cotton giá rẻ basic đen trắng tee pull TOM,45.000₫,https://tiki.vn/ao-phong-unisex-nam-nu-tay-lo-thun-form-rong-teen-co-tron-oversize-cotton-gia-re-basic-den-trang-tee-pull-tom-p117921773.html?spid=188837678,39,,Đã bán 17,aothun
Áo thun nam cộc tay trung niên-A2102,80.000₫,https://tiki.vn/ao-thun-nam-coc-tay-trung-nien-a2102-p260222494.html?spid=260222504,40,,,aothun
