title,price,link_item,index,discount,sales,category
"Máy Đưa Võng Tự Động Cao Cấp Vinanoi Asanta AS100 - Sức Đưa 100 Kg Cho Cả Mẹ Và Bé, Dùng Được Khi Cúp Điện",621.000₫,https://tiki.vn/may-dua-vong-tu-dong-cao-cap-vinanoi-as100-suc-dua-100-kg-cho-ca-me-va-be-dung-duoc-khi-cup-dien-p221225144.html?spid=221225147,1,-10%,Đã bán 23,dodungchobe
Máy hâm sữa tiệt trùng điện tử 4 bình - Quatro 1 - Fatzbaby FB3015CY tích hợp 6 chức năng,768.000₫,https://tiki.vn/may-ham-sua-tiet-trung-dien-tu-4-binh-quatro-1-fatzbaby-fb3015cy-tich-hop-6-chuc-nang-p135837281.html?spid=135837290,2,-18%,Đã bán 2,dodungchobe
Dụng Cụ Hút Mũi Hình Gấu Làm Từ Silicon Cao Cấp An Toàn Cho Trẻ Sơ Sinh,58.000₫,https://tiki.vn/dung-cu-hut-mui-hinh-gau-lam-tu-silicon-cao-cap-an-toan-cho-tre-so-sinh-p205482836.html?spid=205482837,3,-3%,Đã bán 32,dodungchobe
Set 2 Khăn Tắm Bonny 4 Lớp 90x90Cm Chất Liệu Tre Lụa Mềm Mại Kháng Khuẩn Siêu Thấm Hút An Toàn Cho Da Bé (Hàng Cao Cấp),270.000₫,https://tiki.vn/set-2-khan-tam-bonny-4-lop-90x90cm-chat-lieu-tre-lua-mem-mai-khang-khuan-sieu-tham-hut-an-toan-cho-da-be-hang-cao-cap-p100625065.html?spid=100625066,4,-18%,Đã bán 53,dodungchobe
"Khóa Tủ Lạnh An Toàn Cho Bé, Khóa Ngăn Kéo Và Cánh Tủ Quần Áo",5.000₫,https://tiki.vn/khoa-tu-lanh-an-toan-cho-be-khoa-ngan-keo-va-canh-tu-quan-ao-p198519111.html?spid=198519113,5,-5%,Đã bán 21,dodungchobe
Nhiệt kế hồng ngoại 3 trong 1 Omron MC 720,918.000₫,https://tiki.vn/nhiet-ke-hong-ngoai-3-trong-1-omron-mc-720-p38408974.html?spid=69323873,6,-29%,Đã bán 57,dodungchobe
Sữa Tắm Dưỡng Ẩm Arau Baby (400ml),131.200₫,https://tiki.vn/sua-tam-duong-am-arau-baby-400ml-p2152229.html?spid=2159461,7,-5%,Đã bán 146,dodungchobe
Ty giả Philips Avent ty ngậm giả Núm ti giả ngậm thông khí chỉnh nha Không chứ BPA an toàn cho bé hàng chính hãng Tặng móc khóa xinh xắn thương hiệu Bamboo Life,169.000₫,https://tiki.vn/ty-gia-philips-avent-ty-ngam-gia-num-ti-gia-ngam-thong-khi-chinh-nha-khong-chu-bpa-an-toan-cho-be-hang-chinh-hang-tang-moc-khoa-xinh-xan-thuong-hieu-bamboo-life-p116638233.html?spid=187659662,8,-23%,Đã bán 16,dodungchobe
"Xe đẩy gấp gọn cho bé Yoboo YB-0067 bánh xe có phanh, tựa lưng chống gù điều chỉnh nhiều góc độ - Hàng chính hãng",929.000₫,https://tiki.vn/xe-day-em-be-yoboo-gap-gon-tien-loi-chat-luong-nhat-ban-p196312570.html?spid=196312571,9,-9%,Đã bán 2,dodungchobe
Chậu tắm cho bé gấp gọn báo nhiệt độ thau tắm cho trẻ sơ sinh từ 0-5 tuổi cài vòi hoa sen,345.000₫,https://tiki.vn/chau-tam-cho-be-gap-gon-bao-nhiet-do-thau-tam-cho-tre-so-sinh-tu-0-5-tuoi-cai-voi-hoa-sen-p86751629.html?spid=139842634,10,-39%,Đã bán 45,dodungchobe
Kéo Cắt Móng Tay Cho Bé Mother-K Hàn Quốc KM13046,89.100₫,https://tiki.vn/keo-cat-mong-tay-cho-be-mother-k-han-quoc-km13046-p491450.html?spid=74683192,11,-3%,Đã bán 9,dodungchobe
[CAO CẤP] DẦU TRÀM CUNG ĐÌNH DIAMOND 50ML,220.000₫,https://tiki.vn/cao-cap-dau-tram-cung-dinh-diamond-50ml-p87668368.html?spid=87668369,12,-14%,Đã bán 175,dodungchobe
Núm ty ngậm thông khí Philips Avent hình thú (phiên bản Lime) cho trẻ từ 0-6 tháng tuổi _ vỉ đôi,245.000₫,https://tiki.vn/num-ty-ngam-thong-khi-philips-avent-hinh-thu-phien-ban-lime-cho-tre-tu-0-6-thang-tuoi-_-vi-doi-p109084626.html?spid=109084628,13,-5%,Đã bán 172,dodungchobe
Kutieskin 30gr Kem mẩn ngứa – hăm Kutieskin,96.000₫,https://tiki.vn/kutieskin-30gr-kem-boi-diu-da-cho-be-bi-muoi-dot-con-trung-can-p74769722.html?spid=74769723,14,-5%,Đã bán 701,dodungchobe
"Gối cho con bú và ngủ cao cấp, đa năng Có dây đeo, gối kê đầu, chống trượt, chóng trào ngược",265.000₫,https://tiki.vn/goi-cho-con-bu-va-ngu-cao-cap-da-nang-co-day-deo-goi-ke-dau-chong-truot-chong-trao-nguoc-p255227431.html?spid=255227437,15,-18%,Đã bán 1,dodungchobe
"10 Khăn xô, khăn sữa 2, 3, 4 lớp cho bé",19.500₫,https://tiki.vn/10-khan-xo-khan-sua-2-3-4-lop-cho-be-p90365082.html?spid=186582026,16,-17%,Đã bán 27,dodungchobe
Máy hâm sữa Fatzbaby Mono 2 FB3002SL,328.000₫,https://tiki.vn/may-ham-sua-fatzbaby-mono-2-fb3002sl-p11253564.html?spid=273497653,17,-23%,,dodungchobe
Núm ty ban đêm Philips Avent cho trẻ từ 0-6 tháng tuổi SCF376/10,265.000₫,https://tiki.vn/num-ty-ban-dem-philips-avent-cho-tre-tu-0-6-thang-tuoi-scf376-10-p192833833.html?spid=192833835,18,,Đã bán 41,dodungchobe
"Kem Chống Hăm Dưỡng Da 3 Tác Động Chicco Baby Moments Nappy Cream, cho Bé Từ 0 Tháng, 100ml (Chính Hãng)",248.000₫,https://tiki.vn/kem-chong-ham-duong-da-3-tac-dong-chicco-baby-moments-nappy-cream-cho-be-tu-0-thang-100ml-chinh-hang-p102616765.html?spid=102616766,19,,Đã bán 22,dodungchobe
Combo Nước Rửa Bình Arau Baby ( Bình 500ml + Túi 450ml),245.000₫,https://tiki.vn/combo-nuoc-rua-binh-arau-baby-binh-500ml-tui-450ml-p682289.html?spid=52459092,20,,Đã bán 70,dodungchobe
Combo Gốc Thực Vật NGB1 Peace Mass Nước Giặt Xả 2 in 1 3.6 lít + Nước Rửa Chén 500ml,290.700₫,https://tiki.vn/ngb1-combo-huu-co-peace-mass-nuoc-giat-xa-2-in-1-3-6-lit-nuoc-rua-chen-500ml-p150937886.html?spid=150937887,21,,Đã bán 16,dodungchobe
"Chiếu Sợi Tre, Chiếu Em Bé Thoáng Mát (60 x 110cm)",102.000₫,https://tiki.vn/chieu-soi-tre-chieu-em-be-thoang-mat-60-x-110cm-p20331303.html?spid=185915406,22,,Đã bán 9,dodungchobe
Combo Sản Phẩm Gốc Thực Vật Peace NGB3 Mass - Nước Giặt Xả 2 in 1 3.6l + Nước Rửa Chén 3.6 lít (Thuộc nhóm Sản phẩm Lành tính / Hữu cơ),410.400₫,https://tiki.vn/ngb3-combo-huu-co-peace-mass-nuoc-giat-xa-2-in-1-3-6-lit-nuoc-rua-chen-3-6-lit-p150937965.html?spid=150937966,23,,Đã bán 10,dodungchobe
Cuộn 10m thun may lưng quần thun luồn quần đủ size 1.5mm 2.0mm 2.5mm 3.0mm chun thợ may,39.500₫,https://tiki.vn/cuon-10m-thun-may-lung-quan-thun-luon-quan-du-size-1-5mm-2-0mm-2-5mm-3-0mm-chun-tho-may-p144180252.html?spid=144180264,24,,Đã bán 8,dodungchobe
Tấm lót chống thấm cho bé thay tã 4 lớp vải sợi tre Bamboo cao cấp kháng khuẩn và thoáng khí Comfybaby PAD,169.000₫,https://tiki.vn/new-tam-lot-chong-tham-thay-ta-cho-be-4-lop-soi-tre-bamboo-cao-cap-comfybaby-tu-nhien-khang-khuan-thoang-khi-pad-p113459535.html?spid=113459550,25,,Đã bán 105,dodungchobe
Gối định hình cho bé,219.000₫,https://tiki.vn/goi-dinh-hinh-cho-be-p32311209.html?spid=146939278,26,,Đã bán 7,dodungchobe
Xe Đẩy Hai Chiều 109 Cho Bé 3 Tư Thế,599.000₫,https://tiki.vn/xe-day-hai-chieu-109-cho-be-3-tu-the-p34138913.html?spid=51137988,27,,Đã bán 82,dodungchobe
Cọ rửa bình sữa siêu bền Munchkin tự đứng tặng 2 zipper 12cm,99.000₫,https://tiki.vn/co-rua-binh-sua-sieu-ben-munchkin-tu-dung-tang-2-zipper-12cm-p73437628.html?spid=73437641,28,,Đã bán 141,dodungchobe
"Gối Cao Su Non Cho Em Bé Loại Cao Cấp Chính Hãng Tila-Tila Thương Hiệu Đức Mã TG02 Chống Méo Đầu, Bẹp Đầu, Nghẹo Cổ, Còm Lưng Bé",251.000₫,https://tiki.vn/goi-cao-su-non-cho-be-so-sinh-tila-tila-ma-tg02-chong-meo-dau-bep-dau-ngheo-co-com-lung-be-hang-chinh-hang-p98161309.html?spid=98161311,29,,Đã bán 92,dodungchobe
Kem Chống Nắng Cho Trẻ Sơ Sinh Và Em Bé Mustela Spf 50+ (40ml),407.400₫,https://tiki.vn/kem-chong-nang-cho-tre-so-sinh-va-em-be-mustela-spf-50-40ml-p4105491.html?spid=91278024,30,,Đã bán 22,dodungchobe
"Bịt Ổ Điện Cao Cấp Giữ An Toàn Cho Trẻ ECODEALS - Tiện dụng cho mẹ, an toàn cho bé",12.000₫,https://tiki.vn/bit-o-dien-cao-cap-giu-an-toan-cho-tre-ecodeals-hang-chinh-hang-p198386038.html?spid=263338612,31,,Đã bán 851,dodungchobe
"Que Lấy Ráy Tai/ Dụng Cụ Vệ Sinh Tai Bằng Tre Chắc Chắn,An Toàn",8.550₫,https://tiki.vn/que-lay-ray-tai-dung-cu-ve-sinh-tai-bang-tre-chac-chan-an-toan-p207810182.html?spid=207810183,32,,Đã bán 68,dodungchobe
"[Tặng kèm túi] Túi ngủ cho bé tiểu học 60x175cm, vải tencel mềm mịn, thoáng mát",749.550₫,https://tiki.vn/tang-kem-tui-tui-ngu-cho-be-tieu-hoc-60x175cm-vai-tencel-mem-min-thoang-mat-p262870737.html?spid=270990353,33,,Đã bán 2,dodungchobe
"Ghế rung, nhún đa năng cho bé",135.000₫,https://tiki.vn/ghe-rung-nhun-da-nang-cho-be-p36377504.html?spid=111001539,34,,Đã bán 5,dodungchobe
Máy đưa võng /đưa nôi tự động cho bé - sức đưa 100kg,380.000₫,https://tiki.vn/may-dua-vong-dua-noi-tu-dong-cho-be-suc-dua-100kg-p56314975.html?spid=138445466,35,,Đã bán 17,dodungchobe
Cắt Móng Tay Cho Bé Mother-K Hàn Quốc KM13139,89.100₫,https://tiki.vn/cat-mong-tay-cho-be-mother-k-han-quoc-km13139-p491453.html?spid=52813762,36,,Đã bán 26,dodungchobe
THANH CHẮN GIƯỜNG KHỦNG LONG - ANH LAM STORE - AN TOÀN CHO BÉ (GIÁ 01 THANH),228.000₫,https://tiki.vn/thanh-chan-giuong-khung-long-anh-lam-store-an-toan-cho-be-gia-01-thanh-p198934679.html?spid=273084961,37,,Đã bán 3,dodungchobe
Combo 2 Sữa Tắm Gội cho bé Carrie Junior (700g/chai): 1 Hương Grapeberry + 1 Hương Cherry,296.000₫,https://tiki.vn/combo-2-sua-tam-goi-cho-be-carrie-junior-700g-chai-1-huong-grapeberry-1-huong-cherry-p263797114.html?spid=263797120,38,,Đã bán 11,dodungchobe
"Địu em bé, địu cho trẻ sơ sinh từ 0 đến 3 tuổi, vải lưới thoáng mát, nhỏ gọn tiện lợi",97.995₫,https://tiki.vn/diu-em-be-diu-cho-tre-so-sinh-tu-0-den-3-tuoi-vai-luoi-thoang-mat-nho-gon-tien-loi-p198294816.html?spid=209406523,39,,Đã bán 5,dodungchobe
Địu bốn tư thế cho bé - Giao màu ngẫu nhiên,85.000₫,https://tiki.vn/diu-bon-tu-the-cho-be-giao-mau-ngau-nhien-p5753813.html?spid=165929059,40,,Đã bán 21,dodungchobe
