title,price,link_item,index,discount,sales,category
Nước súc miệng cho trẻ em Listerine Kids Mouthwash hương berry (250ml),57.000₫,https://tiki.vn/nuoc-suc-mieng-cho-tre-em-listerine-kids-mouthwash-huong-berry-250ml-p180380036.html?spid=180380037,1,-18%,Đã bán 32,dodungchobe
Đai Địu Em Bé 4 Tư Thế Royal,63.999₫,https://tiki.vn/dai-diu-em-be-4-tu-the-royal-p175176406.html?spid=205311854,2,-5%,Đã bán 23,dodungchobe
Ty ngậm Medela Baby Soft Silicon 0 - 6 tháng - Có hộp đựng tiệt trùng - Silicone mềm nguyên mảnh - Không chứa BPA,175.000₫,https://tiki.vn/ty-ngam-medela-baby-pacifier-soft-silicon-0-6-thang-co-hop-dung-tiet-trung-silicone-mem-khong-chua-bpa-p198239776.html?spid=198239782,3,-40%,Đã bán 15,dodungchobe
Kem chống hăm Bubchen 150ml,159.000₫,https://tiki.vn/kem-chong-ham-bubchen-150ml-p51058526.html?spid=51058528,4,-14%,Đã bán 118,dodungchobe
"Xe đẩy 3 bánh 310 có mái che, giỏ, để chân kiêm xe đạp 3in1 yên tựa da",390.000₫,https://tiki.vn/xe-day-3-banh-310-co-mai-che-gio-de-chan-kiem-xe-dap-3in1-yen-tua-da-p97763798.html?spid=272992172,5,-17%,Đã bán 15,dodungchobe
"Ghế ăn dặm gấp gọn cao cấp Umoo mới nhất 2021, có bánh xe và điều chỉnh được độ cao",571.000₫,https://tiki.vn/ghe-an-dam-gap-gon-cao-cap-umoo-moi-nhat-2021-co-banh-xe-va-dieu-chinh-duoc-do-cao-p134440669.html?spid=185913601,6,-14%,Đã bán 46,dodungchobe
Bộ 2 Khóa Cửa Tủ An Toàn Cho Bé - Nhiều Loại,50.000₫,https://tiki.vn/bo-2-khoa-cua-tu-an-toan-cho-be-nhieu-loai-p51110091.html?spid=157493385,7,-17%,Đã bán 13,dodungchobe
"Combo Tiết Kiệm: Nước rửa bình sữa Arau Baby 450 - Mẫu Mới, Hàng Có Tem Phụ Chính Hãng",210.000₫,https://tiki.vn/combo-tiet-kiem-nuo-c-ru-a-bi-nh-su-a-arau-baby-450-mau-moi-hang-co-tem-phu-chinh-hang-p93152375.html?spid=93152379,8,-33%,Đã bán 23,dodungchobe
b.box Disney Bình nước 360 độ cho bé tập uống nước 240ml,315.000₫,https://tiki.vn/disney-binh-nuoc-bbox-360-do-cho-be-tap-uong-nuoc-hang-chinh-hang-p67821209.html?spid=67821223,9,-24%,Đã bán 164,dodungchobe
Ghế Rung Nhún Có Giá Treo Đồ Chơi Cho Bé ( Giao Màu Ngẫu Nhiên ),150.000₫,https://tiki.vn/ghe-rung-nhun-co-gia-treo-do-choi-cho-be-giao-mau-ngau-nhien-p20447614.html?spid=56084695,10,-8%,Đã bán 59,dodungchobe
"Khăn tắm cho bé, KT 70 * 140cm, siêu mềm",45.000₫,https://tiki.vn/khan-tam-cho-be-kt-70-140cm-sieu-mem-p115894145.html?spid=115894248,11,-10%,Đã bán 21,dodungchobe
Máy báo khóc 2 chiều kiểm soát nhiệt độ ban đêm 2.4Ghz,1.319.000₫,https://tiki.vn/may-bao-khoc-2-chieu-kiem-soat-nhiet-do-ban-dem-2-4ghz-p47088708.html?spid=50743591,12,,Đã bán 109,dodungchobe
Bình sữa cổ thường Pur Advanced 60ml (1800),79.000₫,https://tiki.vn/binh-sua-co-thuong-pur-advanced-60ml-1800-p113919077.html?spid=113919078,13,,Đã bán 34,dodungchobe
Đai An Toàn Xe Máy Cho Bé,98.000₫,https://tiki.vn/dai-an-toan-xe-may-cho-be-p15491007.html?spid=101728151,14,,Đã bán 37,dodungchobe
"Gối lá đinh lăng chống mồ hôi trộm, chống giật mình cho bé sơ sinh",39.000₫,https://tiki.vn/goi-la-dinh-lang-chong-mo-hoi-trom-chong-giat-minh-cho-be-so-sinh-p73936865.html?spid=73936869,15,,Đã bán 18,dodungchobe
KHĂN TẮM ADEN SỢI TRE HỘP 2 CÁI MẪU MỚI,169.000₫,https://tiki.vn/khan-ta-m-aden-so-i-tre-ho-p-2-ca-i-mau-moi-p99679926.html?spid=99679930,16,,Đã bán 15,dodungchobe
Máy đưa võng nguyên bộ Mmbaby,321.100₫,https://tiki.vn/may-dua-vong-nguyen-bo-mmbayby-p73688143.html?spid=73688144,17,,Đã bán 87,dodungchobe
Bình sữa cổ rộng PP Plus họa tiết xanh/hồng Pigeon 160ml (SS),138.000₫,https://tiki.vn/binh-sua-co-rong-pp-plus-hoa-tiet-xanh-hong-pigeon-160ml-ss-p104153295.html?spid=104153319,18,,Đã bán 88,dodungchobe
Đai Xe Máy Phản Quang Dạng Lưới Thoáng Khí Cho Bé,186.888₫,https://tiki.vn/dai-xe-may-phan-quang-dang-luoi-thoang-khi-cho-be-p55094185.html?spid=261975039,19,,Đã bán 4,dodungchobe
"Dụng cụ uống thuốc, ăn sữa cho bé Haakaa. Chất liệu silicone cao cấp. Không chứa BPA, PVC và phthalate",172.000₫,https://tiki.vn/dung-cu-uong-thuoc-an-sua-cho-be-silicone-haakaa-ban-chay-hang-dau-the-gioi-my-anh-p129742459.html?spid=129742462,20,,Đã bán 42,dodungchobe
"Gel tắm làm sạch mụn lưng Loturelle 250ml, nguồn gốc thiên nhiên - Hàng Chính Hãng",169.000₫,https://tiki.vn/sua-tam-cho-em-be-da-nhay-cam-loturelle-250ml-p1266031.html?spid=1276901,21,,Đã bán 560,dodungchobe
Bình Sữa Pigeon Softouch PP Plus Disney Baby - Màu Tím,234.000₫,https://tiki.vn/binh-sua-pigeon-softouch-pp-plus-disney-baby-mau-tim-160ml-240ml-p180855714.html?spid=180855720,22,,Đã bán 10,dodungchobe
Nôi ngủ cạnh giường Joie Roomie Gray Flannel,3.660.000₫,https://tiki.vn/noi-ngu-canh-giuong-joie-roomie-gray-flannel-p123153485.html?spid=123153486,23,,Đã bán 3,dodungchobe
Núm ty ban đêm Philips Avent cho trẻ từ 6-18 tháng tuổi 376.21,245.000₫,https://tiki.vn/num-ty-ban-dem-philips-avent-cho-tre-tu-6-18-thang-tuoi-376-21-p109127772.html?spid=181134656,24,,,dodungchobe
BẤM MÓNG TAY AN TOÀN CHO TRẺ SƠ SINH NUK DÙNG CHO BÉ TỪ 0 THÁNG TUỔI,59.000₫,https://tiki.vn/bam-mong-tay-an-toan-cho-tre-so-sinh-nuk-dung-cho-be-tu-0-thang-tuoi-p109882431.html?spid=109882432,25,,Đã bán 84,dodungchobe
"XE 3 BÁNH CÓ BÀN ĐẠP, CẦN ĐẨY NHẠC 2021",420.000₫,https://tiki.vn/xe-3-banh-co-ban-dap-can-day-nhac-2021-p76239345.html?spid=76454673,26,,Đã bán 10,dodungchobe
"Vòng đeo tay, miếng dán tránh muỗi Kincho",189.000₫,https://tiki.vn/vong-deo-tay-mieng-dan-tranh-muoi-kincho-p191291832.html?spid=191291836,27,,Đã bán 22,dodungchobe
"Thìa tập ăn bề mặt kháng khuẩn Tommee Tippee Easigrip, cho bé từ 6 tháng",95.000₫,https://tiki.vn/thia-tap-an-be-mat-khang-khuan-tommee-tippee-easigrip-cho-be-tu-6-thang-p273098982.html?spid=273098987,28,,Đã bán 34,dodungchobe
gối cao su non cho bé tránh méo đầu,56.000₫,https://tiki.vn/goi-cao-su-non-cho-be-tranh-meo-dau-p78929111.html?spid=78929113,29,,Đã bán 8,dodungchobe
"Nắp, Cổ bình sữa dùng cho bình sữa Avent Natural cổ rộng P07 (Bán riêng bộ phận)",20.000₫,https://tiki.vn/nap-co-binh-sua-dung-cho-binh-sua-avent-natural-co-rong-p07-ban-rieng-bo-phan-p206144504.html?spid=206144506,30,,Đã bán 5,dodungchobe
"Thanh chặn giường nâng hạ 1 bên, thanh chắn giường cao 103cm có 3 màu",219.000₫,https://tiki.vn/thanh-chan-giuong-2021-nang-ha-1-ben-hieu-pakey-thanh-chan-giuong-cao-103cm-co-3-mau-p127845231.html?spid=200664205,31,,Đã bán 12,dodungchobe
XE 3 BÁNH CẦN ĐẨY CAO CẤP 618 CÓ ĐÈN VÀ NHẠC CHO BÉ,385.000₫,https://tiki.vn/xe-3-banh-can-day-cao-cap-618-co-den-va-nhac-cho-be-p67060949.html?spid=77056754,32,,Đã bán 148,dodungchobe
Bộ mài dũa móng tay 6 đầu dũa đa năng dành cho bé,87.299₫,https://tiki.vn/bo-mai-dua-mong-tay-6-dau-dua-da-nang-danh-cho-be-p37295439.html?spid=66728963,33,,Đã bán 5,dodungchobe
Chăn tuyết trẻ em mền mại ấm áp,89.950₫,https://tiki.vn/chan-tuyet-tre-em-men-mai-am-ap-p122909551.html?spid=172540504,34,,Đã bán 3,dodungchobe
"Yếm ăn dặm silicon cho bé ,có máng chống thấm đồ dùng cao cấp hình thú siêu cute tiện dụng -Thương Hiệu Unmei",55.000₫,https://tiki.vn/yem-an-dam-silicon-cho-be-co-mang-chong-tham-do-dung-cao-cap-hinh-thu-sieu-cute-tien-dung-thuong-hieu-unmei-p192860737.html?spid=192860748,35,,Đã bán 10,dodungchobe
Xe nhạc tập đi cho bé,260.000₫,https://tiki.vn/xe-nhac-tap-di-cho-be-chinh-hang-nhua-viet-nhat-xe-tron-p121033812.html?spid=121033814,36,,Đã bán 15,dodungchobe
VÒNG DÂY ĐAI ĐEO TAY DẮT TRẺ EM CHỐNG ĐI LẠC - DÂY LÕI THÉP SIÊU NHẸ - PHÁT SÁNG BUỔI TỐI – DÂY CUỘN LÒ XO GỌN GÀNG - DH2011,135.000₫,https://tiki.vn/vong-day-dai-deo-tay-dat-tre-em-chong-di-lac-day-loi-thep-sieu-nhe-phat-sang-buoi-toi-day-cuon-lo-xo-gon-gang-dh2011-p59404601.html?spid=108962494,37,,Đã bán 173,dodungchobe
Gối Cho Bé Kuku KU2002 Kèm Vỏ Gối (30 x 40 cm),179.100₫,https://tiki.vn/goi-cho-be-kuku-ku2002-kem-vo-goi-30-x-40-cm-p144634.html?spid=54528116,38,,Đã bán 16,dodungchobe
"Máy Phát Tiếng Ồn Trắng White Noise Giúp Bé Ngủ Ngon, Sâu Giấc, Xóa Bớt Tiếng Ồn Xung Quanh",168.000₫,https://tiki.vn/may-phat-tieng-on-trang-white-noise-giup-be-ngu-ngon-sau-giac-xoa-bot-tieng-on-xung-quanh-p185296255.html?spid=185296256,39,,Đã bán 18,dodungchobe
Miếng Lót Chống Thấm 2 Mặt Cao Cấp Cho Bé,6.800₫,https://tiki.vn/mieng-lot-chong-tham-2-mat-cao-cap-cho-be-p159102827.html?spid=159102829,40,,Đã bán 242,dodungchobe
