title,price,link_item,index,discount,sales,category
XE 3 BÁNH CẦN ĐẨY CAO CẤP 618 CÓ ĐÈN VÀ NHẠC CHO BÉ - Xanh,420.000₫,https://tiki.vn/xe-3-banh-can-day-cao-cap-618-co-den-va-nhac-cho-be-xanh-p74444933.html?spid=91324339,1,-10%,Đã bán 51,dodungchobe
Bộ 3 chai Sữa Tắm Gội Trẻ Em Lactacyd Baby Extra Milky Làm Sạch Dịu Nhẹ và Dưỡng Ẩm Vượt Trội 250ml/chai,273.000₫,https://tiki.vn/bo-3-chai-sua-tam-goi-tre-em-lactacyd-baby-extra-milky-lam-sach-diu-nhe-va-duong-am-vuot-troi-250ml-chai-p79733940.html?spid=79733951,2,-3%,Đã bán 27,dodungchobe
Kem Dưỡng Da Mặt Cho Trẻ Sơ Sinh Và Em Bé Da Chàm Thể Tạng Mustela (40ml),358.900₫,https://tiki.vn/kem-duong-da-mat-cho-tre-so-sinh-va-em-be-da-cham-the-tang-mustela-40ml-p201774388.html?spid=201774389,3,-30%,Đã bán 35,dodungchobe
Bộ khay ăn dặm từ sợi tre Bamboo Life cho bé BL002 hàng chính hãng Dụng cụ ăn dặm cho bé Đồ dùng ăn dặm cho bé Bộ chén bát ăn dặm cho bé,129.000₫,https://tiki.vn/bo-khay-an-dam-tu-soi-tre-bamboo-life-cho-be-bl002-hang-chinh-hang-dung-cu-an-dam-cho-be-do-dung-an-dam-cho-be-bo-chen-bat-an-dam-cho-be-p86734623.html?spid=92712093,4,-28%,Đã bán 270,dodungchobe
Bình sữa cổ hẹp PP Wesser 60ml/140ml/250ml,123.000₫,https://tiki.vn/binh-sua-co-hep-pp-wesser-60ml-140ml-250ml-p249171583.html?spid=250007668,5,-8%,,dodungchobe
Ghế nằm ăn bột cho bé cỡ lớn (họa tiết ngẫu nhiên),599.000₫,https://tiki.vn/ghe-nam-an-bot-cho-be-co-lon-hoa-tiet-ngau-nhien-p7168507.html?spid=21612211,6,-23%,Đã bán 49,dodungchobe
"Set 3 Khăn Sữa Sợi Tre Lụa 4 Lớp Bonny Hàng Cao Cấp Thấm Hút Tốt, Kháng Khuẩn (Kích thước: 30x30Cm)",55.000₫,https://tiki.vn/set-3-khan-sua-soi-tre-lua-4-lop-bonny-hang-cao-cap-tham-hut-tot-khang-khuan-kich-thuoc-30x30cm-p97823805.html?spid=97823806,7,-3%,Đã bán 228,dodungchobe
Nước Rửa Bình Sữa Pigeon Hương Yuzu (New 2022),116.000₫,https://tiki.vn/nuo-c-ru-a-bi-nh-su-a-pigeon-huong-yuzu-new-2022-700ml-p188895424.html?spid=188895428,8,-20%,Đã bán 98,dodungchobe
"Gạc Rơ Lưỡi, Vệ Sinh Răng Miệng Cho Bé Dr Papie (1 hộp 30 gói)",125.000₫,https://tiki.vn/gac-ro-luoi-ve-sinh-rang-mieng-cho-be-dr-papie-1-hop-30-goi-p84705786.html?spid=145291142,9,-32%,Đã bán 80,dodungchobe
Xe tròn tập đi cao cấp cho bé hình Thỏ đáng yêu có nhạc và đèn,279.000₫,https://tiki.vn/xe-tro-n-ta-p-di-cao-ca-p-cho-be-hinh-tho-dang-yeu-co-nha-c-va-de-n-p122072381.html?spid=273206897,10,-5%,Đã bán 2,dodungchobe
Bình sữa Pigeon PPSU Plus thế hệ III phiên bản Nhật hình Gấu 160ml/240ml,438.000₫,https://tiki.vn/binh-sua-pigeon-ppsu-plus-the-he-iii-phien-ban-nhat-hinh-gau-p197656014.html?spid=197656016,11,-8%,Đã bán 18,dodungchobe
Nôi Cũi Gỗ Quế Cũi Trẻ Em Cũi Cho Bé Màu Trắng Kích Thước [120x80x96cm] Cũi Có 3 Nấc Nâng Hạ Giát Chịu Lực Tới 60kg Tặng Bánh Xe Hàng Xuất Khẩu,1.695.000₫,https://tiki.vn/noi-cui-go-que-cui-tre-em-cui-cho-be-mau-trang-kich-thuoc-120x80x96cm-cui-co-3-nac-nang-ha-giat-chiu-luc-toi-60kg-tang-banh-xe-hang-xuat-khau-p93355811.html?spid=93356013,12,,Đã bán 34,dodungchobe
"Nhộng chũn cho bé cao cấp Babyup. Nhộng ngủ cho trẻ sơ sinh Giúp bé ngủ ngon, sâu giấc, chống giật mình - Nhộng ngủ Vải cotton co giãn 4 chiều, mềm mại thoáng mát - Có khóa kéo 2 chiều",209.000₫,https://tiki.vn/nhong-chun-cho-be-cao-cap-babyup-giup-be-ngu-ngon-sau-giac-chong-giat-minh-nhong-ngu-vai-cotton-co-gian-4-chieu-mem-mai-thoang-mat-co-khoa-keo-2-chieu-p81237364.html?spid=81237370,13,,Đã bán 405,dodungchobe
Máy Hâm sữa & thức ăn siêu tốc Philips Avent,899.000₫,https://tiki.vn/may-ham-sua-thuc-an-sieu-toc-philips-avent-p110638857.html?spid=188382592,14,,Đã bán 2,dodungchobe
Tinh dầu tràm Con Dơi ( Nguyên chất 100%),126.000₫,https://tiki.vn/tinh-dau-tram-con-doi-nguyen-chat-100-p55576959.html?spid=55576960,15,,Đã bán 644,dodungchobe
Máy hút mũi bằng điện cho bé,124.998₫,https://tiki.vn/may-hut-mui-bang-dien-cho-be-p21189331.html?spid=115695982,16,,Đã bán 5,dodungchobe
Bình sữa Pigeon PPSU Plus thế hệ III Thú cưng,459.000₫,https://tiki.vn/binh-sua-pigeon-ppsu-plus-the-he-iii-thu-cung-p197712330.html?spid=197712335,17,,Đã bán 5,dodungchobe
Combo 2 Sữa Tắm Gội Cho Bé Carrie Junior Hương Tinh Chất Sữa (700g/chai),296.000₫,https://tiki.vn/combo-2-sua-tam-goi-cho-be-carrie-junior-huong-grapeberry-700g-chai-p263797122.html?spid=263797123,18,,Đã bán 8,dodungchobe
Sữa Tắm Gội Cho Trẻ Sơ Sinh Và Em Bé Da Nhạy Cảm Mustela (300ml),378.300₫,https://tiki.vn/sua-tam-goi-cho-tre-so-sinh-va-em-be-da-nhay-cam-mustela-300ml-p4105721.html?spid=91278035,19,,Đã bán 35,dodungchobe
Bộ 2 bình sữa Mô phỏng tự nhiên bằng nhựa Philips Avent cho trẻ từ 6 tháng 330ml (SCF696/23),565.000₫,https://tiki.vn/bo-2-binh-sua-mo-phong-tu-nhien-bang-nhua-philips-avent-cho-tre-tu-6-thang-330ml-scf696-23-p121535015.html?spid=121535016,20,,Đã bán 120,dodungchobe
Sữa tắm gội cho bé Perfecta Baby dạng gel 3 trong 1 an toàn dịu nhẹ,175.000₫,https://tiki.vn/sua-tam-goi-cho-be-perfecta-baby-dang-gel-3-trong-1-an-toan-diu-nhe-p252684706.html?spid=252684707,21,,Đã bán 14,dodungchobe
Bộ Cắt Móng Tay An Toàn Cho Bé,86.000₫,https://tiki.vn/bo-cat-mong-tay-an-toan-cho-be-p83682442.html?spid=83682448,22,,Đã bán 42,dodungchobe
Kem đánh răng dành cho trẻ em Valentine kiddy 100g - Sao Thái Dương,45.000₫,https://tiki.vn/kem-danh-rang-danh-cho-tre-em-valentine-kiddy-50g-sao-thai-duong-p131504810.html?spid=131504821,23,,Đã bán 24,dodungchobe
Bình sữa Pigeon T-Ester Plus – Logo,367.000₫,https://tiki.vn/binh-sua-pigeon-t-ester-plus-logo-200ml-300ml-p180855744.html?spid=180855746,24,,Đã bán 33,dodungchobe
Nước Rửa Bình Sữa Wesser Dạng Gói (500ml),80.000₫,https://tiki.vn/nuoc-rua-binh-sua-wesser-dang-goi-500ml-p629718.html?spid=52647356,25,,Đã bán 221,dodungchobe
CHE Ổ CẮM ELPA AN-101B,47.000₫,https://tiki.vn/che-o-cam-elpa-an-101b-p74496465.html?spid=74496466,26,,Đã bán 38,dodungchobe
Máy Nghe Tiếng Ồn Trắng,169.000₫,https://tiki.vn/may-nghe-tieng-on-trang-p26479084.html?spid=54349231,27,,Đã bán 96,dodungchobe
"Xe Tập Đi Bằng Gỗ Con Gà, Xe Đẩy Bằng Gỗ Cho Bé Nhanh Biết Đi",122.000₫,https://tiki.vn/xe-tap-di-bang-go-con-ga-xe-day-bang-go-cho-be-nhanh-biet-di-p113935189.html?spid=177493547,28,,Đã bán 120,dodungchobe
Núm ty ngậm thông khí Philips Avent hình thú (phiên bản Lime) cho trẻ từ 6-18 tháng tuổi _ vỉ đôi,245.000₫,https://tiki.vn/num-ty-ngam-thong-khi-philips-avent-hinh-thu-phien-ban-lime-cho-tre-tu-6-18-thang-tuoi-_-vi-doi-p109334060.html?spid=109334062,29,,Đã bán 163,dodungchobe
Thang bô vệ sinh có nắp thu nhỏ bồn cầu gấp gọn tiện lợi dùng cho bé trai và bé gái có sẵn tay vịn đi kèm,182.000₫,https://tiki.vn/thang-bo-ve-sinh-co-nap-thu-nho-bon-cau-gap-gon-tien-loi-dung-cho-be-trai-va-be-gai-co-san-tay-vin-di-kem-p74942105.html?spid=262801080,30,,Đã bán 11,dodungchobe
KHĂN TẮM XÔ 6 LỚP NHĂN(105x105cm),79.000₫,https://tiki.vn/khan-tam-xo-6-lop-nhan-105x105cm-p99680187.html?spid=99680245,31,,Đã bán 41,dodungchobe
Thu nhỏ bồn cầu có tay vịn cho bé,87.000₫,https://tiki.vn/thu-nho-bon-cau-co-tay-vin-cho-be-p32180062.html?spid=67036314,32,,Đã bán 29,dodungchobe
Ủ (KHĂN) QUẤN TAY CHO BÉ SƠ SINH NGỦ NGON,149.000₫,https://tiki.vn/u-quan-tay-anna-eve-cho-be-so-sinh-ngu-ngon-p99680148.html?spid=99680158,33,,Đã bán 30,dodungchobe
"Ghế gội đầu có tay vịn, 4 nấc điều chỉnh",379.000₫,https://tiki.vn/ghe-goi-dau-co-tay-vin-4-nac-dieu-chinh-p269898762.html?spid=269898766,34,,Đã bán 4,dodungchobe
Bình Sữa Pigeon Softouch PP Plus Disney Baby - Màu Vàng,234.000₫,https://tiki.vn/binh-sua-pigeon-softouch-pp-plus-disney-baby-mau-vang-160ml-240ml-p180855730.html?spid=180855732,35,,Đã bán 13,dodungchobe
NÓN / MŨ BẢO HIỂM CHO BÉ TẬP ĐI/ NGỒI CHO BÉ 8 THÁNG - 5 TUỔI - GIAO MÀU NGẪU NHIÊN,179.550₫,https://tiki.vn/non-mu-bao-hiem-mau-moi-mau-ngau-nhien-cho-be-8-thang-5-tuoi-p71691342.html?spid=71691346,36,,Đã bán 217,dodungchobe
Dụng cụ lấy ráy tai có đèn soi kèm hộp đựng cho bé màu xanh,3.900₫,https://tiki.vn/dung-cu-lay-ray-tai-co-den-soi-kem-hop-dung-cho-be-ma-u-xanh-p36694107.html?spid=57788562,37,,Đã bán 99,dodungchobe
Bộ 2 Khăn Tắm Cao Cấp Cho Bé Sơ Sinh ( Giao màu ngẫu nhiên ),46.000₫,https://tiki.vn/bo-2-khan-tam-cao-cap-cho-be-so-sinh-giao-mau-ngau-nhien-p21439073.html?spid=49373927,38,,Đã bán 76,dodungchobe
BỘ 2 TI GIẢ NUK HAPPYDAYS SILICONE,149.000₫,https://tiki.vn/bo-2-ti-gia-nuk-happydays-silicone-p46258811.html?spid=76216149,39,,Đã bán 50,dodungchobe
Phấn trẻ em Kodomo Newborn & Sensitive Skin 180g,30.000₫,https://tiki.vn/phan-tre-em-kodomo-newborn-sensitive-skin-180g-p272225983.html?spid=272225984,40,,Đã bán 14,dodungchobe
