title,price,link_item,index,discount,sales,category
"Quần Jean, quần thời trang, quần Nam Rách Gối Kiểu Hàn Quốc Co Giãn",148.000₫,https://tiki.vn/quan-jean-nam-rach-goi-kieu-han-quoc-co-gian-p7147077.html?spid=100627107,1,,Đã bán 10,quannam
Quần jean nam chất bò trung niên ống suông trơn đẹp cao cấp big size,245.000₫,https://tiki.vn/quan-jean-nam-chat-bo-trung-nien-ong-suong-tron-dep-cao-cap-big-size-vn29c-p169409635.html?spid=199737870,2,,Đã bán 2,quannam
quần jean nam cao cấp co giãn loại quần jean xuất khẩu form chuẩn,145.000₫,https://tiki.vn/quan-jean-nam-cao-cap-co-gian-loai-quan-jean-xuat-khau-form-chuan-p76698842.html?spid=146251897,3,-40%,Đã bán 20,quannam
Quần short khaki nam Khatoco Q3M398R0-ININ133-2410-0,317.400,https://tiki.vn/quan-short-khaki-nam-khatoco-q3m398r0-inin133-2410-0-p273586403.html?spid=273586409,4,,,quannam
,,https://tiki.vn/quan-short-khaki-nam-novelty-mau-trang-hoa-tiet-nskmhcnctr1811800-p184914168.html?spid=184914172,5,,,quannam
quần yếm kaki màu vàng,304.000₫,https://tiki.vn/qua-n-ye-m-kaki-ma-u-va-ng-p269644376.html?spid=269644429,6,,,quannam
bomber dù khoá kéo có túi sau khoác nam cao cấp 2 màu,743.000₫,https://tiki.vn/bomber-du-khoa-keo-co-tui-sau-khoac-nam-cao-cap-2-mau-p269646784.html?spid=269646907,7,,,quannam
quần baggy ống rộng khoá gối,264.000₫,https://tiki.vn/quan-baggy-ong-rong-khoa-goi-p269647372.html?spid=269647472,8,,,quannam
Baggy jeans quần jeans ống rộng có dây ở gối,264.000,https://tiki.vn/baggy-jeans-quan-jeans-ong-rong-co-day-o-goi-p269647165.html?spid=269647201,9,,,quannam
,,https://tiki.vn/short-jean-den-in-chu-nhe-duo-i-de-p-big-size-nam-tu-80-de-n-130kg-p195506648.html?spid=195506652,10,,,quannam
QUẦN NGỦ NAM - Ca Rôt Sang Trọng - Chất Kate Thoải Mái Thoáng Mát,49.000₫,https://tiki.vn/quan-ngu-nam-ca-rot-sang-trong-chat-kate-thoai-mai-thoang-mat-p151802136.html?spid=151802343,11,,,quannam
( ̀ ̛́ ̉ ́ 50%) Quần Short Nam Kaki Mềm Mịn 4 Màu Trẻ Trung Phong Cách Hàn Quốc,182.000,https://tiki.vn/50-quan-short-nam-kaki-mem-min-4-mau-tre-trung-phong-cach-han-quoc-p92448887.html?spid=92448907,12,,,quannam
,,https://tiki.vn/quan-pant-kaki-tui-hop-cao-cap-p269645061.html?spid=269645409,13,,,quannam
Quần Lửng Nam Chất Liệu Thô Đũi Mềm Mát Màu Xanh Lam,210.000₫,https://tiki.vn/quan-lung-nam-chat-lieu-tho-dui-mem-mat-mau-xanh-lam-p270855360.html?spid=270855362,14,,,quannam
"Vải may quần tây nam nữ, may vest cao cấp Liên Phương, co giãn tốt, mặc mát, không nhăn- 0101",889.000₫,https://tiki.vn/vai-may-quan-tay-nam-nu-may-vest-cao-cap-lien-phuong-co-gian-tot-mac-mat-khong-nhan-0101-p197669175.html?spid=197669177,15,,,quannam
Quần đùi nam chất kate cotton thương hiệu Fezzio chính hãng,77.000₫,https://tiki.vn/quan-short-kate-spandex-fezzio-100-cotton-chinh-hang-fz-05-neo-p110948866.html?spid=139988060,16,,Đã bán 18,quannam
Quần Short Nam Basic Akuba 904 Nhiều Màu,379.000,https://tiki.vn/quan-short-nam-basic-akuba-904-nhieu-mau-p54354372.html?spid=54354384,17,,,quannam
,,https://tiki.vn/quan-tay-0ly-slimfit-482-vinh-tien-nhieu-mau-p247420906.html?spid=247420916,18,,,quannam
Quần Jean Nam Màu Xám Co Giãn Phong Cách Thời Trang Hàn Quốc Cao Cấp ms705,145.000₫,https://tiki.vn/quan-jean-nam-mau-xam-co-gian-phong-cach-thoi-trang-han-quoc-cao-cap-ms705-p104065801.html?spid=104067198,19,,Đã bán 2,quannam
"Quần kaki jogger khóa chíp Dài Bo chun nam nữ - Chất Vải Kaki Kiểu Thể Thao UNISEX sáu Màu Đen.xám,,xanh,đỏ,rêu... 05x",87.000₫,https://tiki.vn/quan-kaki-jogger-khoa-chip-dai-bo-chun-nam-nu-chat-vai-kaki-kieu-the-thao-unisex-sau-mau-den-xam-xanh-do-reu-05x-p249249715.html?spid=249249787,20,,,quannam
Quần Đùi Nam PEAK Basketball Ghi Cam F7222051,890.000₫,https://tiki.vn/quan-dui-nam-peak-basketball-ghi-cam-f7222051-p184284243.html?spid=184284245,21,,Đã bán 2,quannam
Quần Jogger khóa đùi cực nam tính trẻ trung,260.000₫,https://tiki.vn/quan-jogger-khoa-dui-cuc-nam-tinh-tre-trung-p214655162.html?spid=214655166,22,,,quannam
"Quần Jean Nam Quần Bò Nam Rách Gối Màu Xanh Trơn, Thời Trang Cao Cấp Mẫu Mới MS08",279.000₫,https://tiki.vn/quan-jean-nam-quan-bo-nam-rach-goi-mau-xanh-tron-thoi-trang-cao-cap-mau-moi-ms08-p252090859.html?spid=252090869,23,,,quannam
Quần kaki trơn nam nữ,87.000₫,https://tiki.vn/quan-kaki-tron-nam-nu-p187839981.html?spid=187839990,24,,,quannam
Quần ngố nam viền túi,65.000₫,https://tiki.vn/quan-ngo-nam-vien-tui-p127557970.html?spid=169803466,25,,,quannam
,,https://tiki.vn/quan-short-kaki-cotton-tui-hop-unisex-nam-nu-thoi-trang-han-p109816952.html?spid=109816993,26,,,quannam
Quần âu nam dáng ôm co giãn nhẹ quần tây nam dáng ôm cao cấp - Xanh than - Size 28,106.000₫,https://tiki.vn/quan-au-nam-dang-om-co-gian-nhe-quan-tay-nam-dang-om-cao-cap-xanh-than-size-28-p68141325.html?spid=95411612,27,,Đã bán 5,quannam
QUẦN KAKI NAM ỐNG ĐỨNG - Aligro ALGK055,607.200₫,https://tiki.vn/quan-kaki-nam-ong-dung-aligro-algk055-p90752462.html?spid=90752468,28,,Đã bán 3,quannam
"Quần kaki nam chất kaki co giãn 4 chiều, ống côn thời trang, dáng ôm body trẻ trung, không bai xù, giặt được máy giặt",119.000₫,https://tiki.vn/quan-kaki-nam-chat-kaki-co-gian-4-chieu-ong-con-thoi-trang-dang-om-body-tre-trung-khong-bai-xu-giat-duoc-may-giat-p72308045.html?spid=95468358,29,,Đã bán 3,quannam
Quần Thể Thao Suông + Sọc Đen 3 Sọc Đen Trắng,79.000₫,https://tiki.vn/quan-the-thao-suong-soc-den-3-soc-den-trang-p133080564.html?spid=156332821,30,,,quannam
,,https://tiki.vn/quan-the-thao-nam-nu-quan-jogger-ong-suong-3-soc-1-soc-chat-day-dan-vai-cao-cap-joger-p124766433.html?spid=141296646,31,,,quannam
Quần nỉ lót lông nam,150.000₫,https://tiki.vn/quan-ni-lot-long-nam-p118330109.html?spid=138893239,32,,Đã bán 10,quannam
Quần Short Kaki Nam,128.700₫,https://tiki.vn/quan-short-kaki-nam-p23416794.html?spid=59211978,33,,Đã bán 6,quannam
Quần kaki unisex,85.000₫,https://tiki.vn/quan-kaki-unisex-p48485929.html?spid=50416111,34,,Đã bán 26,quannam
Quần short golf nam ALIGRO nhiều màu chất vải co giãn chống nhăn cực tốt QSMOG.1,632.000,https://tiki.vn/quan-short-golf-nam-aligro-nhieu-mau-chat-vai-co-gian-chong-nhan-cuc-tot-qsmog-1-p253864694.html?spid=253864698,35,,,quannam
,,https://tiki.vn/quan-short-kaki-lung-thun-co-gian-thoai-mai-p81583207.html?spid=81583423,36,,,quannam
Quần Đùi Nam Vải Cotton Kẻ Karo Mềm Size 50-80kg,33.000₫,https://tiki.vn/quan-dui-nam-vai-cotton-ke-karo-mem-size-50-80kg-p125737997.html?spid=269843611,37,,,quannam
Quần Jean Nam Xước Màu Xanh Đậm XANHDAM02,159.000₫,https://tiki.vn/quan-jean-nam-xuoc-mau-xanh-dam-xanhdam02-p12427618.html?spid=12427628,38,,Đã bán 47,quannam
Quần Đũi Nam Short Trắng SHORTTRANG98,125.000₫,https://tiki.vn/quan-dui-nam-short-trang-shorttrang98-p54497642.html?spid=54497650,39,,Đã bán 7,quannam
Combo 4 Quần Ngủ Nam Cotton Dmax,396.000,https://tiki.vn/combo-4-quan-ngu-nam-cotton-dmax-p110361852.html?spid=110361872,40,,,quannam
