title,price,link_item,index,discount,sales,category
Quần Baggy công sở cạp bèo cao,115.700₫,https://tiki.vn/quan-baggy-cong-so-cap-beo-cao-p90194711.html?spid=90194914,1,,Đã bán 2,quannu
Quần giả váy phối cúc cực xinh Dáng chữ A - khóa sau giọt lệ trẻ trung năng động,160.000₫,https://tiki.vn/quan-gia-vay-phoi-cuc-cuc-xinh-dang-chu-a-khoa-sau-giot-le-tre-trung-nang-dong-p102956835.html?spid=102957727,2,,,quannu
"Quần baggy nam ống rộng, quần ống suông nam dáng Baggy vải lụa hàn co giãn, không nhăn không xù AU01 PROMAN",119.000₫,https://tiki.vn/quan-baggy-nam-ong-rong-quan-ong-suong-nam-dang-baggy-vai-lua-han-co-gian-khong-nhan-khong-xu-au01-proman-p201117745.html?spid=201117884,3,,,quannu
Quần suông nữ ống rộng Vitex thời trang Hàn Quốc,149.000₫,https://tiki.vn/quan-suong-nu-ong-rong-vitex-thoi-trang-han-quoc-p195542401.html?spid=195542473,4,,,quannu
,,https://tiki.vn/quan-dui-gia-vay-nu-chat-kaki-cap-cao-lung-thun-sieu-dep-thoi-trang-banamo-fashion-quan-gia-vay-699-p196325391.html?spid=196326699,5,,,quannu
quần short nữ quần đùi nữ cạp chun chất đũi sần nhẹ mát,43.000₫,https://tiki.vn/quan-short-nu-quan-dui-nu-cap-chun-chat-dui-sa-n-nhe-ma-t-p113056517.html?spid=113056535,6,,Đã bán 13,quannu
Quần Vải Nữ Ống Rộng Chất Cát Hàn Cạp Chun Co Dãn Hàng Đẹp,88.000₫,https://tiki.vn/quan-vai-nu-ong-rong-chat-cat-han-cap-chun-co-dan-hang-dep-p170895675.html?spid=170895681,7,,,quannu
"Quần baggy nữ, quần tây công sở",125.000₫,https://tiki.vn/quan-baggy-nu-quan-tay-cong-so-p174470320.html?spid=174470435,8,,,quannu
QUẦN JEAN ỐNG RỘNG DÁNG SUÔNG QUẦN BÒ CẠP CAO TÔN DÁNG CHẤT ĐẸP THỜI TRANG NỮ BANAMO FASHION BÒ SUÔNG 966,124.000₫,https://tiki.vn/quan-jean-ong-rong-dang-suong-quan-bo-cap-cao-ton-dang-chat-dep-thoi-trang-nu-banamo-fashion-bo-suong-966-p196328426.html?spid=196328725,9,,,quannu
,,https://tiki.vn/quan-legging-cap-cao-nit-bung-p104665279.html?spid=104665494,10,,,quannu
Quần Baggy Ống Suông Basic Phong Cách Unisex Hottren thời trang nam nữ trẻ trung năng động,66.000₫,https://tiki.vn/quan-baggy-ong-suong-basic-phong-cach-unisex-hottren-thoi-trang-nam-nu-tre-trung-nang-dong-p249246963.html?spid=249246979,11,,,quannu
Quần Short Nữ Lưng Cao Màu Sắc Trơn Đơn Giản Dễ Phối Đồ,189.000₫,https://tiki.vn/quan-short-nu-lung-cao-mau-sac-tron-don-gian-de-phoi-do-p168711355.html?spid=168711409,12,,,quannu
,,https://tiki.vn/quan-short-nu-vai-tuyet-mua-cao-cap-cach-dieu-sieu-xinh-cuc-ton-dang-p102955853.html?spid=102955864,13,,,quannu
Quần Tây Ống Loe Cạp Cao Siêu Hack Dáng Loại 1 RumHana,123.750₫,https://tiki.vn/quan-tay-ong-loe-cap-cao-sieu-hack-dang-loai-1-rumhana-p104665178.html?spid=104665360,14,,,quannu
QUẦN LEGGING 4 TÚI VỚI CHẤT LIỆU UMI HÀN CAO CẤP RUMHANA,123.750₫,https://tiki.vn/quan-legging-4-tui-voi-chat-lieu-umi-han-cao-cap-rumhana-p104664422.html?spid=104664521,15,,,quannu
"Quần đũi baggy nữ chất đũi có khoá thật nhiều màu, mặc nhẹ cực thích",169.000₫,https://tiki.vn/quan-dui-baggy-nu-chat-dui-co-khoa-that-nhieu-mau-mac-nhe-cuc-thich-p102956385.html?spid=102957209,16,,Đã bán 1,quannu
Quần culottes đũi lửng nhật mềm mát lưng thun cúc trước,50.000₫,https://tiki.vn/quan-culottes-dui-lung-nhat-mem-mat-lung-thun-cuc-truoc-p108507051.html?spid=108508109,17,,,quannu
,,https://tiki.vn/quan-cotton-nu-dep-p173417459.html?spid=173418034,18,,,quannu
Quần baggy nữ cạp chun nhún bèo quần baggy tây chất nhung tăm siêu sang Banamo Fashion 851,84.000₫,https://tiki.vn/quan-baggy-nu-cap-chun-nhun-beo-quan-baggy-tay-chat-nhung-tam-sieu-sang-banamo-fashion-851-p196328648.html?spid=196329094,19,,,quannu
QUẦN (DÀI),200.000₫,https://tiki.vn/quan-dai-p94011572.html?spid=94011594,20,,,quannu
Quần Short nữ ngắn tôn mông DK522/Quần nữ/Ôm body/Cân mọi vóc dáng,255.000₫,https://tiki.vn/quan-short-nu-ngan-ton-mong-dk522-quan-nu-om-body-can-moi-voc-dang-p272113158.html?spid=272113168,21,,,quannu
Quần Lót Nữ Lụa Sữa Nơ Ruy Băng Hai Sườn Ngang Eo Xuất Đông Âu ( QL:496 ) Hàng Loại Đẹp,57.000₫,https://tiki.vn/quan-lot-nu-lua-sua-no-ruy-bang-hai-suon-ngang-eo-xuat-dong-au-ql-496-hang-loai-dep-p198698312.html?spid=198698320,22,,Đã bán 1,quannu
"(ảnh thật) Quần tây nữ, quần công sở dáng baggy fom đẹp",206.000₫,https://tiki.vn/anh-that-quan-tay-nu-quan-cong-so-dang-baggy-fom-dep-p118141529.html?spid=118141732,23,,Đã bán 1,quannu
Quần loe 2 khuy đáng dài sang chảnh,82.000₫,https://tiki.vn/quan-loe-2-khuy-dang-dai-sang-chanh-p93602171.html?spid=93602187,24,,,quannu
Quần loe cạp cao 2 cúc dáng dài,79.000₫,https://tiki.vn/quan-loe-cap-cao-2-cuc-dang-dai-p93603011.html?spid=93603023,25,,,quannu
,,https://tiki.vn/qua-n-tay-den-tra-ng-nude-lung-thun-ca-p-cao-phi-a-sau-co-lung-thun-suong-o-ng-om-hi-nh-tha-t-shop-chu-p-p152520668.html?spid=152520704,26,,,quannu
"Bộ đồ thun nữ bigsize quần đùi sort ngắn áo form rộng mặc đi chơi thể thao, đô bộ mặc nhà bao đẹp mát mịn mẫu mới hot",280.000₫,https://tiki.vn/bo-do-thun-nu-bigsize-quan-dui-sort-ngan-ao-form-rong-mac-di-choi-the-thao-do-bo-mac-nha-bao-dep-mat-min-mau-moi-hot-p253038437.html?spid=253038461,27,,,quannu
Quần Ống Rộng Lưng Cao In Họa Tiết HOYANG QHY13,589.000₫,https://tiki.vn/quan-ong-rong-lung-cao-in-hoa-tiet-hoyang-qhy13-p248467767.html?spid=248467786,28,,,quannu
LAAS Quần ống đứng tag túi đen thanh lịch sang trọng,1.000.000₫,https://tiki.vn/laas-quan-ong-dung-tag-tui-den-thanh-lich-sang-trong-p178571929.html?spid=178571937,29,,,quannu
Quần Tây Baggy Công Sở Xếp Ly HOYANG QHY11,735.000₫,https://tiki.vn/quan-tay-baggy-cong-so-xep-ly-hoyang-qhy11-p248465287.html?spid=248465298,30,,,quannu
,,https://tiki.vn/quan-ong-suong-cong-so-nu-gillee-tuyet-mua-co-ban-p115290278.html?spid=115290296,31,,,quannu
Quần Jean Suông Ống Rộng Cut Eo - J60 - Đen,785.000₫,https://tiki.vn/quan-jean-suong-ong-rong-cut-eo-j60-p271128891.html?spid=271128895,32,,,quannu
Quần baggy nữ lưng chun cạp cao vải quần tây công sở mã 888,125.000₫,https://tiki.vn/quan-baggy-nu-lung-chun-cap-cao-vai-quan-tay-cong-so-ma-888-p174220472.html?spid=174220523,33,,Đã bán 9,quannu
Quần tây ống loe 1 cúc lưng cao dáng dài nhiều màu thời trang Milofa,118.000₫,https://tiki.vn/quan-tay-ong-loe-1-cuc-lung-cao-dang-dai-nhieu-mau-thoi-trang-milofa-p174220356.html?spid=174220374,34,,Đã bán 3,quannu
Quần ống loe cạp cao dài 100cm hack chân tôn dáng màu đen nâu kem thời trang 451,77.420₫,https://tiki.vn/quan-ong-loe-cap-cao-dai-100cm-hack-chan-ton-dang-mau-den-nau-kem-thoi-trang-451-p192424836.html?spid=192425032,35,,,quannu
,,https://tiki.vn/quan-short-dui-nu-suri-chat-dui-vai-co-gian-mem-min-4-mau-de-phoi-duoc-nhieu-kieu-ao-khac-nhau-p144629536.html?spid=144629568,36,,,quannu
Quần jean nữ ôm trơn xanh đậm siêu đẹp thời trang jean nữ ôm trơn 7610,149.000₫,https://tiki.vn/quan-jean-nu-om-tron-xanh-dam-sieu-dep-thoi-trang-jean-nu-om-tron-7610-p194443255.html?spid=194443327,37,,,quannu
Quần nữ trung niên chất umi màu đen cho các bà các mẹ thời trang 705,148.000₫,https://tiki.vn/quan-nu-trung-nien-chat-umi-mau-den-cho-cac-ba-cac-me-thoi-trang-705-p192420941.html?spid=192421033,38,,,quannu
Quần Tất Lót Lông Túi Tím Siêu Ấm Siêu Đẹp,48.000₫,https://tiki.vn/quan-tat-lot-long-tui-tim-sieu-am-sieu-dep-p118117280.html?spid=118117285,39,,,quannu
Quần ống rộng khóa trước lưng cao thời trang nữ 933,89.000₫,https://tiki.vn/quan-ong-rong-khoa-truoc-lung-cao-thoi-trang-nu-933-p192427488.html?spid=192428758,40,,,quannu
