title,price,link_item,index,discount,sales,category
Quần Ngố Nữ Jogger GENVIET DQ311M2164,410.000₫,https://tiki.vn/quan-ngo-nu-jogger-genviet-dq311m2164-p166089706.html?spid=166089720,1,-12%,,quannu
Quần Jeans Ống Loe Nữ Màu Cơ Bản Xiêu Xinh,300.000₫,https://tiki.vn/quan-jeans-ong-loe-nu-mau-co-ban-xieu-xinh-p174016399.html?spid=174016449,2,-37%,Đã bán 3,quannu
Quần short nữ mặc nhà chất thun cuốn lai màu đen CRQ030,32.760₫,https://tiki.vn/quan-short-nu-mac-nha-chat-thun-cuon-lai-mau-den-crq030-p154096680.html?spid=154096683,3,-55%,Đã bán 3,quannu
Quần Sọt Jean Nữ Mẫu Trơn Lai Lật In Chữ Hàng Hot,99.000₫,https://tiki.vn/quan-sot-jean-nu-mau-tron-lai-lat-in-chu-hang-hot-p252098768.html?spid=252098778,4,-12%,,quannu
,,https://tiki.vn/quan-baggy-nu-cap-cao-kem-dai-hang-vnxk-chat-vitex-han-phu-hop-di-hoc-di-choi-di-lam-hang-dat-may-ky-p263303536.html?spid=263303619,5,-21%,,quannu
Quần Đùi Ngủ Nữ Mặc Nhà Chất Cotton Mềm Mại -Freesize TT002,16.000₫,https://tiki.vn/quan-dui-ngu-nu-mac-nha-chat-cotton-mem-mai-freesize-tt002-p116803708.html?spid=192724488,6,-15%,Đã bán 4,quannu
Quần tây 9 tấc lưng thun nữ loại tốt,399.000₫,https://tiki.vn/quan-tay-9-tac-lung-thun-nu-loai-tot-p102047718.html?spid=102047738,7,-17%,,quannu
Quần baggy nữ lưng cao thời trang Eden - Q013,329.000₫,https://tiki.vn/quan-baggy-nu-lung-cao-thoi-trang-eden-q013-p92325759.html?spid=92325766,8,,Đã bán 8,quannu
Quần baggy công sở nữ thời trang Eden xếp li. Chất liệu kaki mềm. Dễ phối trang phục - Q008,279.000₫,https://tiki.vn/quan-baggy-cong-so-nu-thoi-trang-eden-xep-li-chat-lieu-kaki-mem-de-phoi-trang-phuc-q008-p61268990.html?spid=93182459,9,,Đã bán 88,quannu
,,https://tiki.vn/quan-ong-suong-dang-dai-eo-thon-khoa-suon-chat-tuyet-mua-nhieu-mau-p103481068.html?spid=103481088,10,,,quannu
QUẦN DÀI KAKI XUÔNG RỘNG TIN NỮ XẮN GẤU LƯNG THUN GIẢN ĐƠN,87.700₫,https://tiki.vn/quan-dai-kaki-xuong-rong-tin-nu-xan-gau-lung-thun-gian-don-p66610628.html?spid=67872568,11,,Đã bán 22,quannu
Quần tây baggy công sở bigsize lưng thun nữ,131.000₫,https://tiki.vn/quan-tay-baggy-cong-so-bigsize-lung-thun-nu-p67225104.html?spid=77117855,12,,Đã bán 10,quannu
,,https://tiki.vn/quan-dui-nu-ke-caro-chat-tho-mem-mat-cho-mua-he-ct542-p253103816.html?spid=253103832,13,,,quannu
"Quần ống rộng, chất liệu Linen, quần kiểu nữ form rộng rãi, thoải mái NeSa Shop QKH.39",145.000₫,https://tiki.vn/quan-ong-rong-chat-lieu-linen-quan-kieu-nu-form-rong-rai-thoai-mai-nesa-shop-qkh-39-p207272740.html?spid=207272770,14,,Đã bán 9,quannu
Quần baggy nam nữ ống rộng xuông thể thao thiết kế cao cấp dễ phối đồ cực chất in họa tiết,71.000₫,https://tiki.vn/quan-baggy-nam-nu-ong-rong-xuong-the-thao-thiet-ke-cao-cap-de-phoi-do-cuc-chat-in-hoa-tiet-p262659951.html?spid=262659953,15,,,quannu
QUẦN ÔM KAKI body(size 40-60kg),107.500₫,https://tiki.vn/quan-om-kaki-body-size-40-60kg-p173413996.html?spid=173414607,16,,Đã bán 9,quannu
Quần Đùi Nữ CCHAT Cạp Xếp Ly Hai Nắp Túi Chất Liệu Tuytsi Cao Cấp 53ONS2008AT,129.000₫,https://tiki.vn/quan-dui-nu-cchat-cap-xep-ly-hai-nap-tui-chat-lieu-tuytsi-cao-cap-53ons2008at-p230220033.html?spid=230220041,17,,,quannu
,,https://tiki.vn/qua-n-jean-nu-ra-ch-tra-ng-va-den-p20558877.html?spid=20558885,18,,,quannu
Quần baggy kaki lưng thun dây rút ( HÌNH THẬT CUỐI ),76.000₫,https://tiki.vn/quan-baggy-kaki-lung-thun-day-rut-hinh-that-cuoi-p42629485.html?spid=50499484,19,,Đã bán 24,quannu
Quần ống suông nữ cạp cao tôn dáng sang chảnh dáng tiểu thư culottes,85.000₫,https://tiki.vn/quan-ong-suong-nu-cap-cao-ton-dang-sang-chanh-dang-tieu-thu-culottes-p103436598.html?spid=103437700,20,,Đã bán 54,quannu
quần ống rộng nữ suông rút dây cạp chun kiểu cullotes trẻ trung 3 màu,90.000₫,https://tiki.vn/quan-ong-rong-nu-suong-rut-day-cap-chun-kieu-cullotes-tre-trung-3-mau-p230202364.html?spid=230202368,21,,Đã bán 1,quannu
Quần jean nữ baggy cotton lưng cao - quần bò baggy big size cotton lưng cao,254.800₫,https://tiki.vn/quan-jean-nu-baggy-cotton-lung-cao-quan-bo-baggy-big-size-cotton-lung-cao-p84765315.html?spid=84765580,22,,Đã bán 3,quannu
Quần Ống Rộng Dáng Suông Kaki Nam Nữ Ulzzang,123.000₫,https://tiki.vn/quan-ong-rong-dang-suong-kaki-nam-nu-ulzzang-p143666615.html?spid=190229530,23,,Đã bán 9,quannu
"Quần sooc nữ đùi chất đũi thô mát, mặc ở nhà hay đi chơi đều xinh",29.000₫,https://tiki.vn/quan-sooc-nu-dui-chat-dui-tho-mat-mac-o-nha-hay-di-choi-deu-xinh-p103431894.html?spid=205350665,24,,,quannu
Quần tây nữ vải co giãn QT01,131.000₫,https://tiki.vn/quan-tay-nu-vai-co-gian-qt01-p90642830.html?spid=90642877,25,,Đã bán 2,quannu
,,https://tiki.vn/quan-jean-ong-dung-suong-nhe-lung-cao-tui-nguoc-doc-dao-tulidu-quan-bo-nu-ong-dung-co-gian-p197147996.html?spid=197148007,26,,,quannu
Quần phi bóng mặc áo dài hoặc bà ba đủ màu đủ size S-5XL,105.000₫,https://tiki.vn/quan-phi-bong-mac-ao-dai-hoac-ba-ba-du-mau-du-size-s-5xl-p178256074.html?spid=178256152,27,,Đã bán 6,quannu
"Quần Legging Trơn Nữ Co Dãn, Cực Mềm Thoải Mái Sanduoer (TRẮNG )",75.000₫,https://tiki.vn/quan-legging-tron-nu-co-dan-cuc-mem-thoai-mai-sanduoer-trang-p17469475.html?spid=17469476,28,,Đã bán 10,quannu
"Quần Short nữ mặc nhà, quần đùi nữ vải Cotton Modal thoáng mát nhiều màu mã VAQ0107",69.000₫,https://tiki.vn/quan-short-nu-mac-nha-quan-dui-nu-vai-cotton-modal-thoang-mat-nhieu-mau-ma-vaq0107-p155792215.html?spid=155792622,29,,Đã bán 41,quannu
Quần Vải Dù Nữ Cao Cấp Jogger Mới Của Shop Năm 2020,88.000₫,https://tiki.vn/quan-vai-du-nu-cao-cap-jogger-moi-cua-shop-nam-2020-p57808435.html?spid=69403785,30,,Đã bán 9,quannu
,,https://tiki.vn/quan-jean-baggy-nu-theu-hoa-tiet-hang-cao-cap-xuat-khau-qb10-p17207935.html?spid=66255646,31,,,quannu
Quần pyjama nữ vải cotton suông rộng họa tiết kẻ caro đỏ đen (C343),182.000₫,https://tiki.vn/quan-pyjama-nu-vai-cotton-suong-rong-hoa-tiet-ke-caro-do-den-c343-p179555703.html?spid=179555707,32,,,quannu
Quần ống rộng kéo dài chân,83.900₫,https://tiki.vn/quan-ong-rong-keo-dai-chan-p67281966.html?spid=76070571,33,,Đã bán 50,quannu
Quần ống rộng gân tăm dáng dáng nhiều màu,76.000₫,https://tiki.vn/quan-ong-rong-gan-tam-dang-dang-nhieu-mau-p107351969.html?spid=107351975,34,,Đã bán 47,quannu
quần ống rộng suông nữ dây rút lưng thun vải kaki năng động,89.000₫,https://tiki.vn/quan-ong-rong-suong-nu-day-rut-lung-thun-vai-kaki-nang-dong-p181713640.html?spid=181713650,35,,Đã bán 9,quannu
,,https://tiki.vn/quan-bom-the-thao-nu-dang-thung-phu-hop-moi-voc-dang-p161944176.html?spid=161944198,36,,,quannu
Quần jeans nữ ống loe dài màu đen JLN003,331.000₫,https://tiki.vn/qua-n-jeans-nu-o-ng-loe-da-i-ma-u-den-jln003-p35188454.html?spid=35188462,37,,Đã bán 51,quannu
Quần tây công sở_Q02,199.000₫,https://tiki.vn/quan-tay-cong-so_q02-p10576055.html?spid=10576093,38,,Đã bán 653,quannu
Quần đũi lửng nữ ống rộng suông lỡ cạp chun lưng thun - Có cúc khóa - Màu Đen Nâu Kem S0 H01,55.000₫,https://tiki.vn/quan-dui-lung-nu-ong-rong-suong-lo-cap-chun-lung-thun-co-cuc-khoa-mau-den-nau-kem-s0-h01-p249241537.html?spid=249241575,39,,,quannu
"Quần ống suông - Đen,Size 36tu 55-60kg",140.000₫,https://tiki.vn/quan-ong-suong-p126678103.html?spid=126678140,40,,Đã bán 1,quannu
