title,price,link_item,index,discount,sales,category
Quần Lót Nữ Sloggi Comfort Midi Triumph (GT- VN),129.000₫,https://tiki.vn/quan-lot-nu-sloggi-comfort-midi-triumph-p6991613.html?spid=7033659,1,-28%,Đã bán 98,dolotnu
Bộ 2 Quần Lót nữ Gấu Lụa Lạnh màu trắng đen cao cấp thương hiệu Baw mã KQA7,70.000₫,https://tiki.vn/bo-2-quan-lot-nu-gau-lua-lanh-mau-trang-den-cao-cap-thuong-hieu-baw-ma-kqa7-p272318689.html?spid=272318691,2,-56%,Đã bán 1,dolotnu
HÓT-Áo Lót Cài Trước Su Mỏng Không Gọng Mặc Cực Êm - CHILLHOUSE,65.000₫,https://tiki.vn/hot-ao-lot-cai-truoc-su-mong-khong-gong-mac-cuc-em-chillhouse-p113058712.html?spid=113058729,3,-15%,Đã bán 14,dolotnu
10 quần lót nữ beautiful spring mã 5402 size f,212.000₫,https://tiki.vn/10-quan-lot-nu-beautiful-spring-ma-5402-size-f-p16654482.html?spid=51071984,4,-13%,Đã bán 17,dolotnu
quần mặc váy ren tầng hàn quốc siêu đẹp,48.000₫,https://tiki.vn/quan-mac-vay-ren-tang-han-quoc-sieu-dep-p32905871.html?spid=51066087,5,-40%,Đã bán 28,dolotnu
Bra ren hoa không gọng kèm mút nâng ngực thiết kế quyến rũ - đen,79.000₫,https://tiki.vn/bra-ren-hoa-khong-gong-kem-mut-nang-nguc-thiet-ke-quyen-ru-p184334674.html?spid=184334676,6,-55%,Đã bán 3,dolotnu
Set túi ví 3 quần lót nữ su lạnh phối nơ viền ren - Freesize 40-60kg,69.000₫,https://tiki.vn/set-tui-vi-3-quan-lot-nu-su-lanh-phoi-no-vien-ren-p273457632.html?spid=273457559,7,-20%,,dolotnu
Áo Lót Nữ Cao Cấp LUPERI SP847 Siêu Mềm Mát Lạnh Mút Mỏng Bản 4 Móc Ôm Gọn Lưng Chắc Chắn,265.000₫,https://tiki.vn/ao-lot-nu-cao-cap-luperi-sp847-sieu-mem-mat-lanh-mut-mong-ban-4-moc-om-gon-lung-chac-chan-p168311864.html?spid=168311876,8,-22%,,dolotnu
Combo 10 quần lót nữ thun lạnh lọt khe MQ368,190.000₫,https://tiki.vn/combo-10-quan-lot-nu-thun-lanh-lot-khe-mq368-p77775428.html?spid=77963122,9,,Đã bán 2,dolotnu
"Quần định hình sau hút mỡ Đùi,Quần định hình sau hút mỡ vùng bụng,hông",1.350.000₫,https://tiki.vn/quan-dinh-hinh-sau-hut-mo-dui-quan-dinh-hinh-sau-hut-mo-vung-bung-hong-p74429749.html?spid=74429769,10,,Đã bán 3,dolotnu
Combo 5 Quần Đùi Mặc Trong Váy Gen Bụng Xuất Nhật.,98.000₫,https://tiki.vn/combo-5-quan-dui-mac-trong-vay-gen-bung-xuat-nhat-p101279091.html?spid=199165717,11,,Đã bán 2,dolotnu
Combo 10 Quần Lót Nữ Ren Lụa Cao Cấp Sexy Siêu Đẹp Hàng Xuất LR04,157.000₫,https://tiki.vn/combo-10-quan-lot-nu-ren-lua-cao-cap-sexy-sieu-dep-hang-xuat-lr04-p48245170.html?spid=109581640,12,,Đã bán 4,dolotnu
"Áo lót không gọng, cup B, Anny T10 , Áo ngực cao cấp đệm dày, ren mềm mại - Da",140.000₫,https://tiki.vn/ao-lot-khong-gong-cup-b-anny-t10-ao-nguc-cao-cap-dem-day-ren-mem-mai-p272248053.html?spid=272248059,13,,,dolotnu
"Áo lót nữ nâng ngực mỏng, có gọng Vicci AV.05 cúp chéo phối viền ren, dây vai có thể tháo rời, mềm mại, thoáng mát tạo cảm giác dễ chịu, thoải mái tuyệt đối",198.000₫,https://tiki.vn/ao-lot-nu-nang-nguc-mong-co-gong-vicci-av-05-cup-cheo-phoi-vien-ren-day-vai-co-the-thao-roi-mem-mai-thoang-mat-tao-cam-giac-de-chiu-thoai-mai-tuyet-doi-p271128079.html?spid=271128101,14,,,dolotnu
Áo lá nữ sinh WANNABE AL48S áo tập thể thao chất su kiểu dáng ba lỗ không gọng có mút không hằn không cứng rất thoải mái,200.000₫,https://tiki.vn/ao-la-nu-sinh-wannabe-al48s-kieu-dang-ba-lo-khong-gong-co-mut-mem-mai-thoai-mai-p197900309.html?spid=197900313,15,,,dolotnu
Bộ Đồ Lót Cotton Không Gọng Mút Mỏng Lưng Logo Being Me Miley Lingerie,245.000₫,https://tiki.vn/bo-do-lot-cotton-khong-gong-mut-mong-lung-logo-being-me-miley-lingerie-p263107965.html?spid=263107969,16,,,dolotnu
Bộ 5 Quần Lót Ren Nữ sang trọng cao cấp thời trang thương hiệu Baw mã KQA5,131.000₫,https://tiki.vn/bo-5-quan-lot-ren-nu-sang-trong-cao-cap-thoi-trang-thuong-hieu-baw-ma-kqa5-p272310378.html?spid=272310380,17,,,dolotnu
Quần lót nữ mông ren lụa sexy mát mẻ,45.000₫,https://tiki.vn/quan-lot-nu-mong-ren-lua-sexy-mat-me-p187025232.html?spid=187025236,18,,,dolotnu
"Áo lót nữ đẹp ️️ Áo lót nữ dây rút cup ren - Áo lót nữ đệm dày, chống tụt siêu nâng ngực quyến rũ",30.000₫,https://tiki.vn/ao-lot-nu-dep-freeship-ao-lot-nu-day-rut-cup-ren-ao-lot-nu-dem-day-chong-tut-sieu-nang-nguc-quyen-ru-p168581547.html?spid=168581703,19,,,dolotnu
[Hàng cao cấp] Áo lót Victoria’s Secret không gọng trơn mịn,280.000₫,https://tiki.vn/hang-cao-cap-ao-lot-victoria-s-secret-khong-gong-tron-min-p188790531.html?spid=188790537,20,,,dolotnu
Quần lót nữ annie QE 14830 quần cotton phối ren,39.000₫,https://tiki.vn/quan-lot-nu-annie-qe-14830-quan-cotton-phoi-ren-p195561096.html?spid=195561119,21,,Đã bán 3,dolotnu
"Quần lót nữ viền ren quyến rũ, xuyên thấu sexy gợi cảm mã 033",40.000₫,https://tiki.vn/quan-lot-nu-vien-ren-quyen-ru-xuyen-thau-sexy-goi-cam-ma-sa032209-p204607171.html?spid=204607179,22,,,dolotnu
Quần lót nữ giấy Ruby loại 1 (combo 6 quần),39.000₫,https://tiki.vn/quan-lot-nu-giay-ruby-loai-1-combo-6-quan-p253080095.html?spid=253080103,23,,,dolotnu
Áo Lót Ren Không Gọng Đệm Mỏng Nâng Ngực Siêu Thoáng B449,195.000₫,https://tiki.vn/ao-lot-ren-khong-gong-dem-mong-nang-nguc-sieu-thoang-b449-p84823762.html?spid=116875802,24,,,dolotnu
Áo ngực nữ Charmila không gọng chất liệu ren cao cấp mang đến vẻ trẻ trung quyến rũ AN10,219.000₫,https://tiki.vn/ao-nguc-nu-charmila-khong-gong-chat-lieu-ren-cao-cap-mang-den-ve-tre-trung-quyen-ru-an10-p185966999.html?spid=185967009,25,,Đã bán 1,dolotnu
"Quần lót ren mềm, mỏng, mát, quần lót ren đẹp siêu mềm",10.000₫,https://tiki.vn/quan-lot-ren-mem-mong-mat-quan-lot-ren-dep-sieu-mem-p121400784.html?spid=121400819,26,,Đã bán 13,dolotnu
Combo 10 quần lót thun lạnh ren trước Nhiều màu hàng việt nam,160.000₫,https://tiki.vn/combo-10-quan-lot-thun-lanh-ren-truoc-nhieu-mau-hang-viet-nam-p14333362.html?spid=96272608,27,,,dolotnu
HÓT-BỘ ĐỒ LÓT NHÚN NƠ THÔNG HƠI KẺ CUTE - CHILLHOUSE,63.700₫,https://tiki.vn/hot-bo-do-lot-nhun-no-thong-hoi-ke-cute-chillhouse-p113059367.html?spid=113059440,28,,Đã bán 4,dolotnu
Áo ngực bra gân tăm ốc cho nữ dưới 60kg,37.960₫,https://tiki.vn/ao-nguc-bra-gan-tam-oc-cho-nu-duoi-60kg-p76592721.html?spid=76592727,29,,,dolotnu
Hộp 10 miếng dán đầu ngực silicon cao cấp,69.999₫,https://tiki.vn/hop-10-mieng-dan-dau-nguc-silicon-cao-cap-p214776377.html?spid=262806158,30,,Đã bán 2,dolotnu
Quần lót lọt khe nơ ren - hồng nhạt,29.000₫,https://tiki.vn/qua-n-lot-lot-khe-no-ren-hong-nhat-p44666447.html?spid=44666448,31,,Đã bán 2,dolotnu
Bộ Bodysuit Gợi Cảm Nữ Tính (Không kèm tất) - B.Lingerie,195.000₫,https://tiki.vn/bo-bodysuit-goi-cam-nu-tinh-khong-kem-tat-b-lingerie-p269896747.html?spid=269896833,32,,,dolotnu
"Bộ đồ lót Nữ Annie 8131b Đồng Bộ Chất Liệu Co Giãn, Đàn Hồi, Thoáng Khí Kiểu Dáng Năng Động, Thời Trang",217.600₫,https://tiki.vn/bo-do-lot-nu-annie-8131b-dong-bo-chat-lieu-co-gian-dan-hoi-thoang-khi-kieu-dang-nang-dong-thoi-trang-p207855035.html?spid=207855085,33,,Đã bán 1,dolotnu
"Áo Lót Teen, Áo Bra Học Sinh Màu Trắng Atuner ANT010 Chất Liệu 100% Cotton Kèm Thiết Kế Mặt Lưng Dạng Lưới Thông Thoáng",109.000₫,https://tiki.vn/ao-lot-teen-ao-bra-hoc-sinh-mau-trang-atuner-ant010-chat-lieu-100-cotton-kem-thiet-ke-mat-lung-dang-luoi-thong-thoang-p109692870.html?spid=199519026,34,,Đã bán 126,dolotnu
Quần lót thun lạnh họa tiết da báo 2559 ( chọn màu ),40.950₫,https://tiki.vn/quan-lot-thun-lanh-hoa-tiet-da-bao-2559-chon-mau-p167220756.html?spid=167220765,35,,,dolotnu
Áo Lót NữÁo Bra Học Sinh 3 Dây Có Đệm Ngực,11.789₫,https://tiki.vn/ao-lot-nu-ao-bra-hoc-sinh-3-day-co-dem-nguc-p145676938.html?spid=183743024,36,,Đã bán 21,dolotnu
Bộ Gen Định Hình Toàn Thân Nâng Ngực Nịt Bụng Cao Cấp,180.000₫,https://tiki.vn/bo-gen-dinh-hinh-toan-than-nang-nguc-nit-bung-cao-cap-p116777140.html?spid=116777196,37,,Đã bán 16,dolotnu
Quần Lót Nữ Ren Hoa Lá - B.Lingerie,70.000₫,https://tiki.vn/quan-lot-nu-ren-hoa-la-b-lingerie-p270487205.html?spid=270487238,38,,,dolotnu
Quần lót nữ thái lan 604 – Chất su đúc mát lạnh,34.000₫,https://tiki.vn/quan-lot-nu-thai-lan-604-chat-su-duc-mat-lanh-p104793327.html?spid=230052704,39,,,dolotnu
Quần Lót Chống Tràn Nguyệt San Trơn Cotton Thoáng Khí Cạp Vừa P471,38.000₫,https://tiki.vn/quan-lot-chong-tran-nguyet-san-tron-cotton-thoang-khi-cap-vua-p471-p198460500.html?spid=198461020,40,,Đã bán 21,dolotnu
