title,price,link_item,index,discount,sales,category
"Combo 10 Quần lót nữ cotton trơn cao cấp Vicci 102 cạp thấp, mềm mại, êm ái, kháng khuẩn khử mùi",450.000₫,https://tiki.vn/combo-10-quan-lot-nu-cotton-tron-cao-cap-vicci-102-cap-thap-mem-mai-em-ai-khang-khuan-khu-mui-p271983553.html?spid=271983559,1,-50%,Đã bán 2,dolotnu
Bộ 5 Quần Lót Ren phối nơ cực sexy thương hiệu Baw mã KQA10,166.000₫,https://tiki.vn/bo-5-quan-lot-ren-phoi-no-cuc-sexy-thuong-hieu-baw-ma-kqa10-p272327988.html?spid=272327990,2,-45%,Đã bán 1,dolotnu
Áo Ngực Su Hình Lá Nâng Ngực Không Gọng Đệm 3cm Tạo Khe Quyến Rũ Thương Hiệu Baw mã AN02,87.000₫,https://tiki.vn/ao-nguc-su-hinh-la-nang-nguc-khong-gong-dem-3cm-tao-khe-quyen-ru-thuong-hieu-baw-ma-an02-p82865098.html?spid=82865106,3,-56%,Đã bán 456,dolotnu
Quần su mặc trong váy đùi đúc thông hơi COCO LAND,39.000₫,https://tiki.vn/quan-su-mac-trong-vay-dui-duc-thong-hoi-coco-land-p175793043.html?spid=196813051,4,-56%,Đã bán 1,dolotnu
Quần lót nữ buộc dây Siêu Sexy - Trắng,33.000₫,https://tiki.vn/quan-lot-nu-buoc-day-sieu-sexy-trang-p80931779.html?spid=80931780,5,-52%,Đã bán 26,dolotnu
Đai nịt bụng latex Hy Lạp 25 xương-Gen nịt bụng lưng thẳng eo thon-Đai định hình latex,313.000₫,https://tiki.vn/dai-nit-bung-latex-hy-lap-25-xuong-gen-nit-bung-lung-thang-eo-thon-dai-dinh-hinh-latex-p171717030.html?spid=171717180,6,-35%,Đã bán 2,dolotnu
"Bộ 5 quần lót su lạnh siêu mỏng thanh lịch, thương hiệu Baw mã KQA4",131.000₫,https://tiki.vn/bo-5-quan-lot-su-lanh-sieu-mong-thanh-lich-thuong-hieu-baw-ma-kqa4-p272310040.html?spid=272310048,7,-45%,Đã bán 3,dolotnu
"Bộ Đồ Lót Nữ, Áo Ngực Đúc Su Không Gọng mút kép nâng ngực cúp ngang tạo khe siêu quyến rũ thương hiêu Baw mã AN10",87.000₫,https://tiki.vn/bo-do-lot-nu-ao-nguc-duc-su-khong-gong-mut-kep-nang-nguc-cup-ngang-tao-khe-sieu-quyen-ru-thuong-hieu-baw-ma-an10-p83852768.html?spid=83852800,8,-20%,Đã bán 132,dolotnu
"Bộ 5 Quần Lót thông hơi thoáng khí kháng khuẩn, thời trang thương hiệu Baw mã KQA13",105.000₫,https://tiki.vn/bo-5-quan-lot-thong-hoi-thoang-khi-khang-khuan-thoi-trang-thuong-hieu-baw-ma-kqa12-p272332699.html?spid=272332701,9,-13%,Đã bán 1,dolotnu
"Quần Mặc Trong Váy, Quần Bảo Hộ Co Dãn Tốt Chống Lộ An Toàn Siêu Co Dãn Siêu Hot",24.500₫,https://tiki.vn/quan-mac-trong-vay-quan-bao-ho-co-dan-tot-chong-lo-an-toan-sieu-co-dan-sieu-hot-p153789610.html?spid=153789629,10,-28%,Đã bán 16,dolotnu
Áo Ngực Nâng Ngực Ren Nữ Mút Dày 4cm Active Miley Lingerie - Trắng Kem BRL14001,229.000₫,https://tiki.vn/ao-nguc-nang-nguc-ren-nu-mut-day-4cm-active-miley-lingerie-trang-kem-brl14001-p74389326.html?spid=74389332,11,-58%,Đã bán 22,dolotnu
"Áo Ngực Không Gọng Chất Liệu Ren Cao Cấp, Áo Lót Bra Không Gọng dây mảnh Thương Hiệu Baw mã NT235",87.000₫,https://tiki.vn/ao-nguc-khong-gong-chat-lieu-ren-cao-cap-ao-lot-bra-khong-gong-day-manh-thuong-hieu-baw-ma-nt235-p242493812.html?spid=242493816,12,-33%,Đã bán 16,dolotnu
Gen định hình thành bụng hông đùi sau hút mỡ bụng Gen sau hút mỡ,1.884.000₫,https://tiki.vn/gen-dinh-hinh-thanh-bung-hong-dui-sau-hut-mo-bung-gen-sau-hut-mo-p83686315.html?spid=83686318,13,-49%,Đã bán 1,dolotnu
Quần lót tàng hình nữ ONOFF - 16UY22A024,79.000₫,https://tiki.vn/quan-lot-tang-hinh-nu-onoff-16uy22a024-p192116815.html?spid=192116823,14,-45%,Đã bán 10,dolotnu
Quần lót nữ cotton Mỹ kháng khuẩn dáng bikini 16UR23A035,69.000₫,https://tiki.vn/quan-lot-nu-cotton-my-khang-khuan-dang-bikini-16ur23a035-p272557633.html?spid=272557641,15,-16%,Đã bán 7,dolotnu
"Áo ngực annie , mouse mỏng, bảo vệ dáng ngực. Mã BFA 3012- cài trước",143.280₫,https://tiki.vn/ao-nguc-annie-mouse-mong-bao-ve-dang-nguc-ma-bfa-3012-cai-truoc-p155271469.html?spid=155271492,16,-34%,Đã bán 16,dolotnu
Quần Lót Nữ Cotton Họa Tiết Dễ Thương Co Giãn 4 Chiều Freesize dưới 60kg,10.000₫,https://tiki.vn/quan-lot-nu-cotton-hoa-tiet-de-thuong-co-gian-4-chieu-freesize-duoi-60kg-p210400366.html?spid=210400367,17,-20%,Đã bán 36,dolotnu
Combo 3 quần lót nữ cotton co dãn 4 chiều Flexi Miley Lingerie - Màu ngẫu nhiên,99.000₫,https://tiki.vn/combo-3-quan-lot-nu-cotton-co-dan-4-chieu-flexi-miley-lingerie-mau-ngau-nhien-p79436541.html?spid=79436545,18,-62%,Đã bán 7,dolotnu
Set 3 quần lót nữ lưng cao trơn cotton iBasic PANW147,199.000₫,https://tiki.vn/set-3-quan-lot-nu-lung-cao-tron-cotton-ibasic-panw147-p201854920.html?spid=201854924,19,-35%,Đã bán 17,dolotnu
"Quần lót nữ thun lạnh Vicci 106 cạp lưng vừa, mỏng, nhẹ, mềm mại, thoáng khí",35.000₫,https://tiki.vn/quan-lot-nu-thun-lanh-vicci-106-cap-lung-vua-mong-nhe-mem-mai-thoang-khi-p248801986.html?spid=248802002,20,-13%,Đã bán 14,dolotnu
"Áo Ngực Không Gọng Chất Liệu Cotton Cao Cấp, Áo Lót Bra Không Gọng dây mảnh Thương Hiệu Baw mã NT730",87.000₫,https://tiki.vn/ao-nguc-khong-gong-chat-lieu-cotton-cao-cap-ao-lot-bra-khong-gong-day-manh-thuong-hieu-baw-ma-nt730-p97708021.html?spid=97708025,21,-50%,Đã bán 254,dolotnu
Combo 3 áo lót học sinh không mút phối ren iBasic BRAT003,399.000₫,https://tiki.vn/combo-3-ao-lot-hoc-sinh-phoi-ren-ibasic-brat003-p119285148.html?spid=119285150,22,-25%,Đã bán 76,dolotnu
Bộ đồ lót yếm váy ngắn sexy,79.000₫,https://tiki.vn/bo-do-lot-yem-vay-ngan-sexy-p177205963.html?spid=177205965,23,-45%,Đã bán 6,dolotnu
Áo Định Hình Sau Phẫu Thuật Nâng Ngực,1.430.000₫,https://tiki.vn/ao-dinh-hinh-sau-phau-thuat-nang-nguc-p76454321.html?spid=76454323,24,,Đã bán 11,dolotnu
Quần lót nữ ren khoe mông sexy,45.000₫,https://tiki.vn/quan-lot-nu-ren-khoe-mong-sexy-p134501681.html?spid=134501687,25,,Đã bán 9,dolotnu
Quần Lót Mặc Trong Váy,22.000₫,https://tiki.vn/quan-lot-mac-trong-vay-p108568982.html?spid=184476522,26,,Đã bán 6,dolotnu
Quần Lót Trơn Triumph Blissy 09 Mini - Trắng (Size,59.000₫,https://tiki.vn/quan-lot-tron-triumph-blissy-09-mini-trang-p3146291.html?spid=3149467,27,,Đã bán 160,dolotnu
"Miếng dán ti ngực, dán ngực silicon sử dụng nhiều lần siêu dính PINKAHA",22.500₫,https://tiki.vn/mieng-dan-ti-nguc-dan-nguc-su-dung-nhieu-lan-sieu-dinh-jocosi-0122-p210407361.html?spid=210407370,28,,Đã bán 8,dolotnu
Quần lót nữ Triumph Simply Everyday Basic Hipster 2526 lưng vừa gen nhẹ,115.000₫,https://tiki.vn/quan-lot-nu-triumph-simply-everyday-basic-hipster-2526-lung-vua-gen-nhe-p51489130.html?spid=76272538,29,,Đã bán 332,dolotnu
"Áo lót nữ trơn nâng ngực mút mỏng có gọng Triumph Everyday Romance WHP 7709 cúp quả sâu ôm ngực hoàn hảo, phù hợp với chị em có ngực vừa và lớn, chảy sệ",1.299.000₫,https://tiki.vn/ao-nguc-nu-ao-lot-nu-triumph-7709-co-gong-mut-mong-om-nang-day-nguc-p109981374.html?spid=109981382,30,,Đã bán 7,dolotnu
Combo 4 Quần Lót Nữ Melange High-Cut Miley Lingerie Màu Vàng và Hồng - FDS1214-0914,208.000₫,https://tiki.vn/combo-4-quan-lot-nu-melange-high-cut-miley-lingerie-mau-vang-va-hong-fds1214-0914-p212263609.html?spid=212263617,31,,Đã bán 5,dolotnu
áo lót ko gọng cúp B dành cho vòng ngực khủng,70.000₫,https://tiki.vn/ao-lot-ko-gong-cup-b-danh-cho-vong-nguc-khung-p102939605.html?spid=142210817,32,,Đã bán 7,dolotnu
"Quần lót nữ thái lan 5134 – big size, Chất cotton mềm mại",34.000₫,https://tiki.vn/quan-lot-nu-thai-lan-5134-big-size-chat-cotton-mem-mai-p104792356.html?spid=189182469,33,,Đã bán 82,dolotnu
Quần Lót Không Viền May Màu Trơn Fashion Soft Collection By Sabina SUXK108,137.500₫,https://tiki.vn/quan-lot-khong-vien-may-mau-tron-fashion-soft-collection-by-sabina-suxk108-p108917322.html?spid=108917324,34,,Đã bán 12,dolotnu
"Áo lót thái lan Bee Na 8569 - áo ngực mút mỏng, quả to, có gọng, bảng áo chống xệ, dành cho bạn ngực lớn",110.000₫,https://tiki.vn/ao-lot-thai-lan-bee-na-8569-ao-nguc-mut-mong-qua-to-co-gong-bang-ao-chong-xe-danh-cho-ban-nguc-lon-p104791685.html?spid=104791715,35,,Đã bán 43,dolotnu
Combo 10 quần lót su thông hơi 1524 màu như hình,169.000₫,https://tiki.vn/combo-10-quan-lot-su-thong-hoi-1524-mau-nhu-hinh-p16718358.html?spid=200827387,36,,,dolotnu
"Áo Lót Không Gọng Thông Hơi, Áo Ngực Su Đúc Đệm Bàn Tay Ôm Gọn Ngực S03",119.000₫,https://tiki.vn/ao-lot-khong-gong-thong-hoi-ao-nguc-su-duc-dem-ban-tay-om-gon-nguc-s03-p122183166.html?spid=271135996,37,,Đã bán 10,dolotnu
"Áo lót su trơn họa tiết ô vuông thông hơi NÂNG NGỰC bàn tay, ko gọng ASK01 - CHILL HOUSE",39.650₫,https://tiki.vn/ao-lot-su-tron-hoa-tiet-o-vuong-thong-hoi-nang-nguc-ban-tay-ko-gong-ask01-chill-house-p113056894.html?spid=113057163,38,,Đã bán 23,dolotnu
"Áo Ngực Không Gọng Chất Liệu Ren Cao Cấp, Áo Lót Bra Không Gọng dây mảnh Thương Hiệu Baw mã NT234",87.000₫,https://tiki.vn/ao-nguc-khong-gong-chat-lieu-ren-cao-cap-ao-lot-bra-khong-gong-day-manh-thuong-hieu-baw-ma-nt234-p242492375.html?spid=242492377,39,,Đã bán 6,dolotnu
Quần lót nữ dáng bikini chất liệu Modal air siêu thoáng mát - A26BU2103008,169.000₫,https://tiki.vn/quan-lot-nu-dang-bikini-chat-lieu-modal-air-sieu-thoang-mat-a26bu2103008-p192649191.html?spid=192649221,40,,Đã bán 5,dolotnu
