title,price,link_item,index,discount,sales,category
Quần lót nam ren lưới thoáng mát - QL06A,95.000₫,https://tiki.vn/quan-lot-nam-ren-luoi-thoang-mat-ql06a-p103473889.html?spid=103473897,1,-30%,Đã bán 15,dolotnam
Combo 4 Quần Lót Nam Quần Sịp Nam Sợi Cotton Cao Cấp MRM FASHION Mix 3 Màu TẶNG Đôi Tất Nam Cao Cấp,239.000₫,https://tiki.vn/combo-4-quan-sip-nam-quan-lot-nam-soi-cotton-cao-cap-mrm-fashion-mix-3-mau-tang-doi-tat-nam-cao-cap-p52198702.html?spid=52198720,2,-53%,Đã bán 20,dolotnam
Quần lót nam 274,29.000₫,https://tiki.vn/quan-lot-nam-274-p101949478.html?spid=101949607,3,-44%,Đã bán 2,dolotnam
Quần lót mềm mại thoáng khí đáy chữ U lưng thấp gợi cảm cho nam,49.000₫,https://tiki.vn/quan-lot-mem-mai-thoang-khi-day-chu-u-lung-thap-goi-cam-cho-nam-p205299127.html?spid=205299131,4,,,dolotnam
,,https://tiki.vn/quan-lot-boxer-nam-luoi-thun-thoang-mau-xanh-duong-p15094432.html?spid=15095561,5,-20%,,dolotnam
Quần lót nam Boxer shorts logo - RAT-A-TA,130.500₫,https://tiki.vn/quan-lot-nam-boxer-shorts-logo-rat-a-ta-p133436880.html?spid=133436886,6,,,dolotnam
Quần lót nam mạc nhật thông hơi cao cấp siêu mềm mát,155.400₫,https://tiki.vn/quan-lot-nam-mac-nhat-thong-hoi-cao-cap-sieu-mem-mat-p120857619.html?spid=120857827,7,-50%,,dolotnam
Quần lót Nam tam giác thun cotton - A139,110.000₫,https://tiki.vn/quan-lot-nam-tam-giac-thun-cotton-a139-p200681936.html?spid=200681938,8,-15%,,dolotnam
Quần Sì Nam Thun Bigsize Quần Sịp Quần Lót Nam 90kg Thoáng Mát Hàng Chất Lượng,27.500₫,https://tiki.vn/quan-si-nam-thun-bigsize-quan-sip-quan-lot-nam-90kg-thoang-mat-hang-chat-luong-p177712213.html?spid=177712219,9,-42%,,dolotnam
,,https://tiki.vn/set-05-quan-sip-nam-xuat-nhat-tam-giac-thong-hoi-cao-cap-40kg-95kg-p132356528.html?spid=188657664,10,,,dolotnam
Combo 5 Quần Sịp Đùi Nam Thông Hơi Nhật Bản - MS88 - Hộp MJ 5 cái nhiều màu,78.000₫,https://tiki.vn/combo-5-quan-sip-dui-nam-thong-hoi-nhat-ban-ms88-p5862059.html?spid=26086299,11,,Đã bán 39,dolotnam
Quần lót nam trong suốt gợi cảm,39.000₫,https://tiki.vn/quan-lot-nam-trong-suot-goi-cam-p68961444.html?spid=68961445,12,,,dolotnam
,,https://tiki.vn/quan-lot-nam-mat-voi-sexy-goi-cam-cho-nam-mau-van-p68962509.html?spid=68962510,13,,,dolotnam
Combo 10 quần lót cao cấp 1024,216.000₫,https://tiki.vn/combo-10-quan-lot-cao-cap-1024-p174175698.html?spid=174175707,14,,,dolotnam
"Áo ba lỗ mặc nhà thể thao nam Chất Thun Co Giãn, Năng Động Thoải Mái Mùa Hè PROMAN",32.000₫,https://tiki.vn/ao-ba-lo-mac-nha-the-thao-nam-chat-thun-co-gian-nang-dong-thoai-mai-mua-he-proman-p201115949.html?spid=201115992,15,,Đã bán 4,dolotnam
Quần lót tam giác Nam - TL06,95.000₫,https://tiki.vn/quan-lot-tam-giac-nam-tl06-p83389711.html?spid=83389717,16,,Đã bán 12,dolotnam
Hộp 5 Quần Lót Đùi Nam Thông Hơi Cao Cấp,105.000,https://tiki.vn/hop-5-quan-lot-dui-nam-thong-hoi-cao-cap-p252614320.html?spid=252614330,17,,,dolotnam
,,https://tiki.vn/quan-lot-nam-mau-do-day-dai-thoai-mai-p44094364.html?spid=48090384,18,,,dolotnam
"Quần Lót Nam Brave Person B1161 - Thiết Kế Kiểu Dáng Sexy Thể Hiện Phong Cách Cá Tính, Chất Liệu Co Giãn Thoát Mát Vải Khô Nhanh",84.000₫,https://tiki.vn/quan-lot-nam-phong-cach-b1161-p208405543.html?spid=208405547,19,,,dolotnam
COMBO QUẦN LÓT,100.000₫,https://tiki.vn/combo-quan-lot-p182478929.html?spid=182478930,20,,,dolotnam
Quần lót nam Private Structure Underwear Mini Brief BATMU1915 Black BK,495.000₫,https://tiki.vn/quan-lot-nam-private-structure-underwear-mini-brief-batmu1915-black-bk-p160609417.html?spid=160609418,21,,,dolotnam
"quần lót nam relax dệt kim cao cấp chính hãng, quần sịp nam relax underwear rltk14",104.000₫,https://tiki.vn/quan-lot-nam-relax-det-kim-cao-cap-chinh-hang-quan-sip-nam-relax-underwear-rltk14-p159382032.html?spid=159382048,22,,Đã bán 56,dolotnam
Quần Lót Nam Woada Brief Cotton Thông Hơi LK009,65.000₫,https://tiki.vn/quan-lot-nam-woada-brief-cotton-thong-hoi-lk009-p11955962.html?spid=11955990,23,,Đã bán 20,dolotnam
Quần lót nam KVF- quần G-string nhiều dây hấp dẫn,55.000₫,https://tiki.vn/quan-lot-nam-kvf-quan-g-string-nhieu-day-hap-dan-p204053252.html?spid=204053258,24,,,dolotnam
Quần Lót Pink Play Cá Tính Mới B216,55.000₫,https://tiki.vn/quan-lot-pink-play-ca-tinh-moi-b216-p109917211.html?spid=109917648,25,,Đã bán 13,dolotnam
,,https://tiki.vn/quan-lot-nam-tam-giac-cainuo-kafu-ma-wln05-p109916869.html?spid=109917912,26,,,dolotnam
Quần lót nam thun lạnh boxer iBasic PANM085 - Mix ran ri,89.000₫,https://tiki.vn/quan-lot-nam-thun-lanh-boxer-ibasic-panm085-p107960701.html?spid=107960707,27,,Đã bán 22,dolotnam
Quần lót nam lọt khe gợi cảm,39.000₫,https://tiki.vn/quan-lot-nam-lot-khe-goi-cam-p68961823.html?spid=68961831,28,,Đã bán 160,dolotnam
Hộp 5 Quần Lót Boxer Nam SZone Cá Tính Hộp Quần Sịp Hình Sao,199.000₫,https://tiki.vn/hop-5-quan-lot-boxer-nam-szone-ca-tinh-hop-quan-sip-hinh-sao-p55662229.html?spid=55662231,29,,Đã bán 109,dolotnam
QUẦN LÓT NAM - LỌT KHE SEXY - THUN COTTON,49.000₫,https://tiki.vn/quan-lot-nam-lot-khe-sexy-thun-cotton-p151800968.html?spid=151801196,30,,,dolotnam
,,https://tiki.vn/5-quan-sip-nam-thun-lanh-4-chieu-x-men-underwear-p21923322.html?spid=170496194,31,,,dolotnam
"Quần lót nam ARISTINO dáng boxer, quần sịp đùi nam chất liệu Modal mềm mại, thoáng mát gấp 2 lần so với sợi vải thông thường - ABX1616",104.000₫,https://tiki.vn/quan-lot-nam-aristino-dang-boxer-quan-sip-dui-nam-chat-lieu-modal-mem-mai-thoang-mat-gap-2-lan-so-voi-soi-vai-thong-thuong-abx1616-p134559536.html?spid=134559544,32,,Đã bán 144,dolotnam
Quần lót nam lọt khe xuyên thấu lưới nam đẹp,35.000₫,https://tiki.vn/quan-lot-nam-lot-khe-xuyen-thau-luoi-nam-dep-p199931804.html?spid=199931806,33,,Đã bán 19,dolotnam
"Quần lót nam, Quần ngủ nam lưới thể thao",99.000₫,https://tiki.vn/quan-ngu-nam-kiem-quan-lot-luoi-the-thao-p32316253.html?spid=32316263,34,,Đã bán 379,dolotnam
"Quần lót nam cao cấp thun cotton co giãn và thấm hút mồ hôi tốt, sịp nam tam giác kiểu dáng hiện đại trẻ trung, cạp to nam tính và co giãn thoải mái",135.000,https://tiki.vn/quan-lot-nam-cao-cap-thun-cotton-co-gian-va-tham-hut-mo-hoi-tot-sip-nam-tam-giac-kieu-dang-hien-dai-tre-trung-cap-to-nam-tinh-va-co-gian-thoai-mai-p71908855.html?spid=71908859,35,,,dolotnam
,,https://tiki.vn/combo-3-quan-lot-nam-khong-duong-may-trunk-seamless-ibasic-panm095-p141000723.html?spid=141000725,36,,,dolotnam
Quần lót nam dáng trunk modal rip cao cấp ONOFF 18UO23A023,99.500₫,https://tiki.vn/quan-lot-nam-dang-trunk-modal-rip-cao-cap-onoff-18uo23a023-p252138811.html?spid=252138819,37,,Đã bán 1,dolotnam
"Quần lót nam ONOFF Microfiber Mesh siêu mảnh, trẻ trung, nam tính - A27BU2109007",169.000₫,https://tiki.vn/quan-lot-nam-onoff-microfiber-mesh-sieu-manh-tre-trung-nam-tinh-a27bu2109007-p192666726.html?spid=192666777,38,,Đã bán 19,dolotnam
"Quần Lót Nam Boxer Thun Lạnh Lados 4116 - Thun lụa co giãn, dai, thoáng mát, thấm hút mồ hôi tốt",34.000₫,https://tiki.vn/quan-lot-nam-boxer-thun-lanh-lados-4116-thun-lua-co-gian-dai-thoang-mat-tham-hut-mo-hoi-tot-p156212090.html?spid=156212112,39,,Đã bán 45,dolotnam
"Bộ 3 quần sịp từ tính tăng sinh lý nam, Quần sịp gắn nam châm, Quần lót cải thiện SL nam",290.000,https://tiki.vn/bo-3-quan-sip-tu-tinh-tang-sinh-ly-nam-quan-sip-gan-nam-cham-quan-lot-cai-thien-sl-nam-p271829352.html?spid=271829361,40,,,dolotnam
