title,price,link_item,index,discount,sales,category
CHÂN VÁY XẾP LI DÁNG DÀI CHẤT KAKI LỤA SIÊU ĐẸP TẶNG KÈM ĐAI,390.000₫,https://tiki.vn/chan-vay-xep-li-dang-dai-chat-kaki-lua-sieu-dep-tang-kem-dai-p108100202.html?spid=108100230,1,,,chanvay
Váy xẻ đen Phoebe,950.000₫,https://tiki.vn/vay-xe-den-phoebe-p196332723.html?spid=196332729,2,,,chanvay
"Chân váy xòe vintage, có quần trong 2 màu đen, trắng",90.000₫,https://tiki.vn/chan-vay-3-tang-xoe-vintage-co-quan-trong-p148910271.html?spid=148910279,3,,,chanvay
CHÂN VÁY A CÚC CHÉO,160.000,https://tiki.vn/chan-vay-a-cuc-cheo-p144046459.html?spid=144046504,4,,,chanvay
,,https://tiki.vn/chan-vay-dai-ke-p192381313.html?spid=192381328,5,,,chanvay
Váy da màu đen style bụi,110.000₫,https://tiki.vn/vay-da-mau-den-style-bui-p116136604.html?spid=175722953,6,,,chanvay
Váy xoè dài chữ A màu đen CRXDV26,101.500₫,https://tiki.vn/vay-xoe-dai-chu-a-mau-den-crxdv26-p154093949.html?spid=154093954,7,,,chanvay
Chân váy công sở váy bút chì CR48V01 màu đen thun UMI cao cấp,89.280₫,https://tiki.vn/chan-vay-cong-so-vay-but-chi-cr48v01-mau-den-thun-umi-cao-cap-p154096601.html?spid=154096605,8,,,chanvay
Chân váy xoè dài chữ A nhiều mảnh màu đen / xám / hồng/ tím CRXDV26,99.000₫,https://tiki.vn/chan-vay-xoe-dai-chu-a-nhieu-manh-mau-den-xam-hong-tim-crxdv26-p152625860.html?spid=154097932,9,,,chanvay
,,https://tiki.vn/chan-vay-cong-so-om-body-mau-den-ma-cr53v34r-p154097402.html?spid=154097413,10,,,chanvay
"Chân váy midi công sở, chất liệu vải tây co giãn thoải mái",170.000₫,https://tiki.vn/chan-vay-midi-cong-so-chat-lieu-vai-tay-co-gian-thoai-mai-p186359147.html?spid=186359155,11,,,chanvay
Chân váy xidan lụa co giản (có quần trong) Bigsize 60-85 ký,175.500,https://tiki.vn/chan-vay-xidan-lua-co-gian-co-quan-trong-bigsize-60-85-ky-p95137314.html?spid=95137328,12,,,chanvay
,,https://tiki.vn/quan-gia-vay-cuc-hoa-3-mau-den-xanh-than-nau-cuc-xinh-p102956723.html?spid=102957626,13,,,chanvay
Chân váy tennis dập ly cạp thêu chữ M khóa lệ hông chân váy nữ xếp ly có quần trong thời trang Banamo Fashion 599,103.000₫,https://tiki.vn/chan-vay-tennis-dap-ly-cap-theu-chu-m-khoa-le-hong-chan-vay-nu-xep-ly-co-quan-trong-thoi-trang-banamo-fashion-599-p196327252.html?spid=196327548,14,,,chanvay
Chân váy công sở dáng ôm CV15,190.000₫,https://tiki.vn/chan-vay-cong-so-dang-om-cv15-p125833870.html?spid=125834658,15,,,chanvay
Váy công sở váy bút chì màu đen CR48V01 chất thun umi co dãn,89.000₫,https://tiki.vn/vay-cong-so-vay-but-chi-mau-den-cr48v01-chat-thun-umi-co-dan-p154097096.html?spid=154097098,16,,,chanvay
CHÂN VÁY REN HÀN - CP KID,170.000,https://tiki.vn/chan-vay-ren-han-cp-kid-p167668161.html?spid=167669341,17,,,chanvay
,,https://tiki.vn/vay-ngan-tennis-xep-ly-p117463209.html?spid=117463217,18,,,chanvay
Chân váy công sở dài bigsize CR53V03 xẻ sau màu đen dài 53cm,136.000₫,https://tiki.vn/chan-vay-cong-so-dai-bigsize-cr53v03-xe-sau-mau-den-dai-53cm-p154094742.html?spid=154094872,19,,,chanvay
Chân váy ôm công sở CV36,185.000₫,https://tiki.vn/chan-vay-om-cong-so-cv36-p125829226.html?spid=125829249,20,,,chanvay
Chân váy công sở dài váy bút chì bigsize CR53V03 màu đen xẻ sau thun umi co dãn từ,151.700₫,https://tiki.vn/chan-vay-cong-so-dai-vay-but-chi-bigsize-cr53v03-mau-den-xe-sau-thun-umi-co-dan-tu-p154096973.html?spid=154096980,21,,,chanvay
Chân Váy Đầm Xòe Đẹp Nữ Tính - QA00158,132.000₫,https://tiki.vn/chan-vay-dam-xoe-dep-nu-tinh-qa00158-p110688909.html?spid=110688978,22,,,chanvay
Chân váy đuôi cá công sở đuôi cá ngắn siêu đẹp,168.000₫,https://tiki.vn/chan-vay-duoi-ca-cong-so-duoi-ca-ngan-sieu-dep-p102955407.html?spid=102955436,23,,,chanvay
Chân váy công sở dài bigsize CR70V11 màu đen xẻ sau D70 thun umi co dãn từ 45kg-85kg,196.100₫,https://tiki.vn/chan-vay-cong-so-dai-bigsize-cr70v11-mau-den-xe-sau-d70-thun-umi-co-dan-tu-45kg-85kg-p154098013.html?spid=154098025,24,,,chanvay
Váy chữ A ngắn xẻ trước màu đen/ màu trắng CRCAV16,162.500,https://tiki.vn/vay-chu-a-ngan-xe-truoc-mau-den-mau-trang-crcav16-p96749655.html?spid=96749710,25,,,chanvay
,,https://tiki.vn/chan-vay-ngan-nu-chat-da-mem-day-rut-2-ben-ca-tinh-mau-den-nau-kem-thoi-trang-banamo-fashion-5912-p196327310.html?spid=196328218,26,,,chanvay
Chân Váy Công Sở,125.000₫,https://tiki.vn/chan-vay-cong-so-p109545658.html?spid=109545665,27,,,chanvay
"Chân váy chữ A ngắn, lưng cao có quần lót trong thoải mái mặc đi làm, đi chơi siêu xinh",144.000₫,https://tiki.vn/chan-vay-chu-a-ngan-lung-cao-co-quan-lot-trong-thoai-mai-mac-di-lam-di-choi-sieu-xinh-p102956675.html?spid=102956832,28,,,chanvay
Chân váy jeans nữ dáng chữ A có quần chống lộ siêu đẹp thời trang Banamo Fashion váy jean 567,149.000₫,https://tiki.vn/chan-vay-jeans-nu-dang-chu-a-co-quan-chong-lo-sieu-dep-thoi-trang-banamo-fashion-vay-jean-567-p196325610.html?spid=196326202,29,,Đã bán 1,chanvay
Chân váy nữ dập ly lưới lưng thun thời trang ulzzang,175.500,https://tiki.vn/chan-vay-nu-dap-ly-luoi-lung-thun-thoi-trang-ulzzang-p96749744.html?spid=96749785,30,,,chanvay
,,https://tiki.vn/chan-vay-chu-a-xe-canh-2-ben-chat-tuyet-mua-anh-that-video-p149465286.html?spid=149465376,31,,,chanvay
Chân váy ôm công sở có quần liền trong CV39,190.000₫,https://tiki.vn/chan-vay-om-cong-so-co-quan-lien-trong-cv39-p125829458.html?spid=125829498,32,,,chanvay
Tặng mã váy thiết kế hè ( Tặng kèm tuban),66.000₫,https://tiki.vn/tang-ma-vay-thiet-ke-he-tang-kem-tuban-p146132198.html?spid=146132533,33,,,chanvay
Chân váy chữ A chất liệu kaki túi 2 bên ( ảnh thật + video thật ),94.000₫,https://tiki.vn/chan-vay-chu-a-chat-lieu-kaki-tui-2-ben-anh-that-video-that-p149465770.html?spid=149466137,34,,,chanvay
Chân váy dập ly 2 tầng 60-90kg,165.000,https://tiki.vn/chan-vay-dap-ly-2-tang-60-90kg-p177136551.html?spid=177136568,35,,,chanvay
,,https://tiki.vn/chan-vay-ngan-om-co-gian-xe-dui-truoc-cv28-p125833655.html?spid=125833799,36,,,chanvay
Quần Mặc Trong Váy ️️ Quần Mặc Váy Ngắn Coton - Quần Váy Dệt Gân Đính Nơ Điệu Đà Cao Cấp,30.000₫,https://tiki.vn/quan-mac-trong-vay-freeship-quan-mac-vay-ngan-coton-quan-vay-det-gan-dinh-no-dieu-da-cao-cap-p168581721.html?spid=168581828,37,,,chanvay
CHÂN VÁY XẾP LY DÀI ( dài váy 67cm) có video quay,198.000₫,https://tiki.vn/chan-vay-xep-ly-dai-dai-vay-67cm-co-video-quay-p113359969.html?spid=113360100,38,,,chanvay
S26 Chân váy midi trơn xếp ly,180.000₫,https://tiki.vn/s26-chan-vay-midi-tron-xep-ly-p169113520.html?spid=169113574,39,,,chanvay
Chân váy jean body,69.000₫,https://tiki.vn/chan-vay-jean-body-p121637391.html?spid=121637397,40,,,chanvay
