title,price,link_item,index,discount,sales,brand
"ÁO VEST BÉ TRAI CATRIO PCTX11719/17 LÀ ÁO KHOÁC VEST, ÁO ĐỜ MI TRẺ EM TỪ 2 tuổi_12 tuổi (12kg đến 49kg) thuộc bộ sưu tập quần áo trẻ em trang trọng cho mùa lễ hội tết tiệc cưới sự kiện sinh nhật, được làm bằng vải dạ cao cấp nhất, đẹp đến từng chi tiết",579.000₫,https://tiki.vn/ao-vest-be-trai-catrio-pctx11719-17-la-ao-khoac-vest-ao-do-mi-tre-em-tu-2-tuoi_12-tuoi-12kg-den-49kg-thuoc-bo-suu-tap-quan-ao-tre-em-trang-trong-cho-mua-le-hoi-tet-tiec-cuoi-su-kien-sinh-nhat-duoc-lam-bang-vai-da-cao-cap-nhat-dep-den-tung-chi-tiet-p212469817.html?spid=212469820,1,,,catrio
"BỘ THUN BÉ TRAI CATRIO IN BADMAN XANH MÀU TRẮNG là bộ đồ quần áo mùa hè trẻ em từ 9 tuổi 32kg đến 11 tuổi 40kg gồm ÁO NGẮN TAY + QUẦN ĐÙI vải 100% cotton đạt chuẩn xuất khẩu, thích hợp với các bé trai mặc ở nhà, đi chơi du lịch rất thoáng mát và hạnh phúc",159.200₫,https://tiki.vn/bo-phong-be-trai-catrio-in-bm-xanh-mau-trang-la-bo-do-tre-em-gom-ao-phong-ngan-tay-voi-quan-dui-cho-tre-em-9-tuoi-10-tuoi-12-tuoi-30kg-50kg-thuoc-bst-quan-ao-thoi-trang-tre-em-catrio-du-lich-mua-he-2021-p102740075.html?spid=102740079,2,,Đã bán 1,catrio
"ÁO THUN DÀI TAY BÉ TRAI CATRIO in BEDTIME màu XANH LÁ là áo phông trẻ em từ 5 tuổi 6T 7T 8 tuổi (20kg . 25 28 29 31kg) vải 100% cotton an toàn, thuộc BST quần áo trẻ em mùa thu đông CATRIO +quần dài cotton thành bộ đồ thu đông trẻ em tuyệt đẹp",95.200₫,https://tiki.vn/ao-thun-dai-tay-be-trai-catrio-hinh-bedtime-mau-xanh-la-la-ao-phong-tre-em-tu-5-tuoi-den-8-tuoi-20kg-den-31kg-vai-100-cotton-an-toan-thuoc-bst-quan-ao-tre-em-mua-thu-dong-catrio-2021-p136425122.html?spid=136425130,3,,,catrio
"ÁO THUN BÉ TRAI NGẮN TAY CATRIO HÌNH 3 MÁY ẢNH, MÀU ĐỎ là áo phông trẻ em từ 5 tuổi 20kg đến 12 tuổi 50kg, vải 100% cotton đạt chuẩn xuất khẩu, khi kết hợp với quần bò, quần short cotton CATRIO thành bộ đồ trẻ em tuyệt đẹp để đi du lịch, đi học, dạo phố",79.200₫,https://tiki.vn/ao-thun-be-trai-ngan-tay-catrio-hinh-3-may-anh-mau-do-la-ao-phong-tre-em-tu-5-tuoi-9-tuoi-den-12-tuoi-20kg-30kg-den-50kg-thuoc-bst-quan-ao-tre-em-catrio-du-lich-mua-he-2021-p110700063.html?spid=110700071,4,,,catrio
,,https://tiki.vn/a-o-thun-da-i-tay-be-trai-catrio-in-ba-y-khu-ng-long-ma-u-xanh-bie-n-la-a-o-phong-tay-da-i-tre-em-tu-8kg-10kg-12kg-14kg-16kg-30kg-co-tro-n-va-i-de-t-kim-co-gia-n-4-chie-u-qua-n-da-i-cotton-tha-nh-bo-do-thu-dong-cho-be-ra-t-de-p-p270965542.html?spid=270965548,5,,,catrio
"ÁO HOODIES BÉ TRAI là ÁO THUN CÓ MŨ TRẺ EM, áo nỉ có túi phía trước rất thời trang, vải 100% cotton dày và ấm vào mùa thu đông phù hợp với trẻ em cả bé trai và bé gái có cân nặng từ 30kg đến 70kg với hình in chữ OFFROAD độc đáo ở phía sau, màu XÁM ĐẬM",215.200₫,https://tiki.vn/ao-hoodies-be-trai-la-ao-thun-co-mu-tre-em-ao-ni-co-tui-phia-truoc-rat-thoi-trang-vai-100-cotton-day-va-am-vao-mua-thu-dong-phu-hop-voi-tre-em-ca-be-trai-va-be-gai-co-can-nang-tu-30kg-den-70kg-voi-hinh-in-chu-offroad-doc-dao-o-phia-sau-mau-xa-m-da-m-p271477096.html?spid=271477104,6,,,catrio
"BỘ THUN BÉ TRAI CATRIO IN PLAY YEAR MÀU CAM là bộ đồ mùa hè của bé trai từ 1 tuổi 12kg đến 4 tuổi 19kg, gồm QUẦN ĐÙI + ÁO SÁT NÁCH, vải 100% cotton đạt chuẩn xuất khẩu, thích hợp với trẻ em mặc ở nhà, đi chơi rất thoáng mát, giúp các bé hạnh phúc",127.200₫,https://tiki.vn/bo-phong-be-trai-catrio-in-play-year-mau-cam-la-bo-do-thun-tre-em-tu-1-tuoi-den-4-tuoi-20kg-den-23kg-thuoc-bst-quan-ao-thoi-trang-tre-em-catrio-mua-he-2021-p95057319.html?spid=95057323,7,,,catrio
Mua 2 chiếc quần đùi bé trai CATRIO từ 13 tuổi(50kg)_18 tuổi (70kg)=138.000 VNĐ sẽ tiết kiệm được 32k tiền vận chuyển đây là quần đùi trẻ em vải 100% cotton đạt chuẩn xuất khẩu khi kết hợp áo thun ngắn tay thành bộ đồ mùa hè cho bé mặc ở nhà đi chơi ĐEN,110.400₫,https://tiki.vn/mua-2-chiec-quan-dui-be-trai-catrio-tu-13-tuoi-50kg-_18-tuoi-70kg-138-000-vnd-se-tiet-kiem-duoc-32k-tien-van-chuyen-day-la-quan-dui-tre-em-vai-100-cotton-dat-chuan-xuat-khau-khi-ket-hop-ao-thun-ngan-tay-thanh-bo-do-mua-he-cho-be-mac-o-nha-di-choi-den-p261823363.html?spid=261823365,8,,,catrio
"ÁO THUN BÉ TRAI NGẮN TAY CATRIO in DEEDS là áo phông trẻ em từ 9 tuổi đến 18 tuổi (30kg đến 73kg) với chất liệu 100% cotton an toàn, áo thun bé trai thuộc BST quần áo thời trang trẻ em CATRIO mùa hè 2022",127.200,https://tiki.vn/ao-thun-be-trai-ngan-tay-catrio-in-deeds-la-ao-phong-tre-em-tu-9-tuoi-den-18-tuoi-30kg-den-73kg-voi-chat-lieu-100-cotton-an-toan-ao-thun-be-trai-thuoc-bst-quan-ao-thoi-trang-tre-em-catrio-mua-he-2022-p169918621.html?spid=169918624,9,,,catrio
,,https://tiki.vn/ao-hoodies-tre-em-catrio-in-ten-lu-a-la-ao-thun-dai-tay-co-mu-co-tui-thoi-trang-vai-100-cotton-day-am-mua-thu-dong-phu-hop-voi-tre-em-be-trai-be-gai-tu-9-tuo-i-32kg-16-tuo-i-55kg-ke-t-ho-p-qua-n-da-i-cotton-catrio-tha-nh-bo-do-de-p-ma-u-chuo-t-p270814929.html?spid=270814931,10,,,catrio
"ÁO HOODIES BÉ TRAI là ÁO THUN CÓ MŨ TRẺ EM, áo nỉ có túi phía trước rất thời trang, vải 100% cotton dày và ấm vào mùa thu đông phù hợp với trẻ em cả bé trai và bé gái có cân nặng từ 30kg đến 70kg với hình in chữ OFFROAD độc đáo ở phía sau, màu XÁM NHẠT",215.200₫,https://tiki.vn/ao-hoodies-be-trai-la-ao-thun-co-mu-tre-em-ao-ni-co-tui-phia-truoc-rat-thoi-trang-vai-100-cotton-day-va-am-vao-mua-thu-dong-phu-hop-voi-tre-em-ca-be-trai-va-be-gai-co-can-nang-tu-30kg-den-70kg-voi-hinh-in-chu-offroad-doc-dao-o-phia-sau-mau-xa-m-nha-t-p271477122.html?spid=271477126,11,,,catrio
"ÁO THUN DÀI TAY BÉ TRAI CATRIO in NUMBER ONE màu NAVY là áo phông trẻ em từ 9 tuổi 10T 12 tuổi (30kg 35kg 45kg 50kg) vải 100% cotton an toàn, thuộc BST quần áo trẻ em mùa thu đông CATRIO +quần dài cotton thành bộ đồ thu đông trẻ em đẹp",119.200,https://tiki.vn/ao-thun-dai-tay-be-trai-catrio-hinh-number-one-mau-navy-la-ao-phong-tre-em-tu-9-tuoi-den-12-tuoi-30kg-den-50kg-vai-100-cotton-an-toan-thuoc-bst-quan-ao-tre-em-mua-thu-dong-catrio-2021-p134021859.html?spid=134021863,12,,Đã bán 1,catrio
,,https://tiki.vn/3-chiec-quan-dui-be-trai-catrio-tu-5-tuoi-20kg-_8-tuoi-28kg-147-000-vnd-se-tiet-kiem-64k-tien-van-chuyen-cho-quy-khach-la-quan-dui-tre-em-vai-100-cotton-dat-chuan-xuat-khau-khi-ket-hop-ao-thun-ngan-tay-thanh-bo-do-mua-he-cho-be-mac-o-nha-di-choi-vit-p261815142.html?spid=261815150,13,,,catrio
"BỘ PHÔNG BÉ TRAI CATRIO IN THUYỀN MÀU NAVY là bộ đồ quần áo mùa hè trẻ em từ 10 tuổi 35kg đến 18 tuổi 70kg gồm ÁO NGẮN TAY + QUẦN ĐÙI vải 100% cotton đạt chuẩn xuất khẩu, thích hợp với các bé trai mặc ở nhà, đi chơi du lịch rất thoáng mát và hạnh phúc",159.200₫,https://tiki.vn/bo-thun-be-trai-catrio-in-thuyen-mau-xanh-navy-la-bo-do-tre-em-gom-ao-phong-ngan-tay-voi-quan-dui-cho-tre-em-10-tuoi-14tuoi-18-tuoi-35kg-73kg-thuoc-bst-quan-ao-thoi-trang-tre-em-catrio-du-lich-mua-he-2021-p102843442.html?spid=102843455,14,,Đã bán 10,catrio
ÁO THUN BÉ TRAI NGẮN TAY CATRIO in GOODLUCK là áo phông trẻ em từ 9T..18 tuổi (32kg...70kg) màu NAVY,111.200₫,https://tiki.vn/ao-thun-be-trai-ngan-tay-catrio-in-goodluck-la-ao-phong-tre-em-tu-9t-18-tuoi-32kg-70kg-mau-navy-p172988269.html?spid=172988277,15,,,catrio
Mua 2 chiếc quần đùi bé trai CATRIO từ 13 tuổi(50kg)_18 tuổi (70kg)=138.000 VNĐ sẽ tiết kiệm được 32k tiền vận chuyển đây là quần đùi trẻ em vải 100% cotton đạt chuẩn xuất khẩu khi kết hợp áo thun ngắn tay thành bộ đồ mùa hè cho bé mặc ở nhà đi chơi VỊT,110.400₫,https://tiki.vn/mua-2-chiec-quan-dui-be-trai-catrio-tu-13-tuoi-50kg-_18-tuoi-70kg-138-000-vnd-se-tiet-kiem-duoc-32k-tien-van-chuyen-day-la-quan-dui-tre-em-vai-100-cotton-dat-chuan-xuat-khau-khi-ket-hop-ao-thun-ngan-tay-thanh-bo-do-mua-he-cho-be-mac-o-nha-di-choi-vit-p261825174.html?spid=261825178,16,,,catrio
ÁO THUN BÉ TRAI NGẮN TAY CATRIO in GOODLUCK là áo phông trẻ em từ 9T..18 tuổi (32kg...70kg) màu XÁM,111.200,https://tiki.vn/ao-thun-be-trai-ngan-tay-catrio-in-goodluck-la-ao-phong-tre-em-tu-9t-18-tuoi-32kg-70kg-mau-xam-p173039318.html?spid=173039320,17,,,catrio
,,https://tiki.vn/ao-thun-be-trai-ngan-tay-catrio-in-deeds-la-ao-phong-tre-em-tu-9-tuoi-den-12-tuoi-30kg-den-50kg-mau-cam-voi-chat-lieu-100-cotton-an-toan-ao-thun-be-trai-thuoc-bst-quan-ao-thoi-trang-tre-em-catrio-mua-he-2022-p169933468.html?spid=169933474,18,,,catrio
Quần dài bé trai vải 100% cotton PHỐI SƯỜN màu NAVY pha XÁM in SAO CỜ là quần nỉ trẻ em CATRIO từ 9 tuổi (30kg) đến 18 tuổi (73kg) phù hợp thời tiết se lạnh mùa thu đông với kiểu dáng thể thao tuyệt đẹp,143.200₫,https://tiki.vn/quan-dai-be-trai-vai-100-cotton-phoi-suon-mau-navy-pha-xam-in-sao-co-la-quan-ni-tre-em-catrio-tu-9-tuoi-30kg-den-18-tuoi-73kg-phu-hop-thoi-tiet-se-lanh-mua-thu-dong-voi-kieu-dang-the-thao-tuyet-dep-p205415577.html?spid=205415579,19,,,catrio
"ÁO THUN DÀI TAY CHO BÉ TRAI TỪ 2 TUỔI ĐẾN 8 TUỔI IN HÌNH PARIS, THUỘC BỘ SƯU TẬP QUẦN ÁO TRẺ EM CATRIO MÙA THU ĐÔNG 2021",132.000₫,https://tiki.vn/ao-thun-dai-tay-cho-be-trai-tu-2-tuoi-den-8-tuoi-in-hinh-paris-thuoc-bo-suu-tap-quan-ao-tre-em-catrio-mua-thu-dong-2021-p68068102.html?spid=68068108,20,,Đã bán 2,catrio
"ÁO HOODIES TRẺ EM CATRIO in TÊN LỬA là áo thun dài tay có mũ có túi thời trang, vải 100% cotton dày, ấm mùa thu đông phù hợp với trẻ em bé trai, bé gái từ 9 tuổi 32kg .. 18 tuổi 70kg kết hợp quần dài cotton CATRIO thành bộ đồ đẹp MÀU XÁM",215.200₫,https://tiki.vn/ao-hoodies-tre-em-catrio-in-ten-lu-a-la-ao-thun-dai-tay-co-mu-co-tui-thoi-trang-vai-100-cotton-day-am-mua-thu-dong-phu-hop-voi-tre-em-be-trai-be-gai-tu-9-tuo-i-32kg-18-tuo-i-70kg-ke-t-ho-p-qua-n-da-i-cotton-catrio-tha-nh-bo-do-de-p-ma-u-xa-m-p270814994.html?spid=270814996,21,,,catrio
Quần thun dài bé trai vải 100% cotton PHỐI SƯỜN màu XÁM phối Navy in WORLD là quần nỉ trẻ em CATRIO từ 9 tuổi (30kg) đến 18 tuổi (73kg) phù hợp thời tiết se lạnh mùa thu đông với kiểu dáng thể thao tuyệt đẹp,143.200₫,https://tiki.vn/quan-thun-dai-be-trai-vai-100-cotton-phoi-suon-mau-xam-phoi-navy-in-world-la-quan-ni-tre-em-catrio-tu-9-tuoi-30kg-den-18-tuoi-73kg-phu-hop-thoi-tiet-se-lanh-mua-thu-dong-voi-kieu-dang-the-thao-tuyet-dep-p201376516.html?spid=201376518,22,,,catrio
BỘ THUN BÉ TRAI CATRIO IN đại bàng MÀU xanh navy LÀ BỘ ĐỒ PHÔNG SÁT NÁCH TRẺ EM TỪ 9 TUỔI ĐẾN 18 TUỔI (30KG ĐẾN 60KG) THUỘC BST QUẦN ÁO THỜI TRANG TRẺ EM CATRIO MÙA DU LỊCH,135.200₫,https://tiki.vn/bo-thun-be-trai-catrio-in-dai-bang-mau-xanh-navy-la-bo-do-phong-sat-nach-tre-em-tu-9-tuoi-den-18-tuoi-30kg-den-68kg-thuoc-bst-quan-ao-thoi-trang-tre-em-catrio-du-lich-mua-he-2021-p108002898.html?spid=108002903,23,,,catrio
ÁO THUN DÀI TAY BÉ TRAI CATRIO in SPACE TRÁI ĐẤT màu XANH CỐM là áo phông tay dài trẻ em từ 8kg 10kg 12 kg .. 30kg (8 tuổi) cổ tròn vải dệt kim co giãn 4 chiều + quần dài cotton thành bộ đồ thu đông cho bé rất đẹp,87.200₫,https://tiki.vn/a-o-thun-da-i-tay-be-trai-catrio-in-space-tra-i-da-t-ma-u-xanh-co-m-la-a-o-phong-tay-da-i-tre-em-tu-8kg-10kg-12-kg-30kg-8-tuo-i-co-tro-n-va-i-de-t-kim-co-gia-n-4-chie-u-qua-n-da-i-cotton-tha-nh-bo-do-thu-dong-cho-be-ra-t-de-p-p270976664.html?spid=270976668,24,,,catrio
"BỘ THUN BÉ TRAI CATRIO IN PLAY SOCCER MÀU NAVY là bộ đồ mùa hè của bé trai từ 1 tuổi 12kg đến 8 tuổi 31kg, gồm QUẦN ĐÙI + ÁO SÁT NÁCH, vải 100% cotton đạt chuẩn xuất khẩu, thích hợp với trẻ em mặc ở nhà, đi chơi rất thoáng mát, giúp các bé hạnh phúc",127.200,https://tiki.vn/bo-phong-be-trai-catrio-in-player-soccer-mau-xanh-navy-la-bo-do-thun-tre-em-tu-1-tuoi-den-8-tuoi-20kg-den-33kg-thuoc-bst-quan-ao-thoi-trang-tre-em-catrio-mua-he-2021-p95058218.html?spid=95058222,25,,,catrio
,,https://tiki.vn/bo-sat-nach-be-trai-100-cotton-chu-good-luck-catrio-9-12-tuoi-p55424951.html?spid=55424971,26,,,catrio
"QUẦN SHORT BÉ TRAI CATRIO IN NEVER MÀU NAVY là quần ngố, quần lửng trẻ em từ 9 tuổi 32kg đến 18 tuổi 70kg, vải dệt kiểu da cá 100% cotton an toàn đạt chuẩn xuất khẩu khi kết hợp với áo phông ngắn tay thành bộ đồ bé trai mặc đi học, đi chơi du lịch đẹp",111.200₫,https://tiki.vn/quan-lung-be-trai-catrio-in-never-la-quan-short-ngo-cotton-tre-em-tu-18t-den-9t-70kg_32kg-mau-navy-p185000010.html?spid=185000012,27,,,catrio
"BỘ THUN BÉ TRAI CATRIO IN BÓNG CHÀY MÀU NAVY là bộ đồ mùa hè của bé trai từ 5 tuổi 20kg đến 18 tuổi 60kg, gồm QUẦN ĐÙI + ÁO SÁT NÁCH, vải 100% cotton đạt chuẩn xuất khẩu, thích hợp với trẻ em mặc ở nhà, đi chơi rất thoáng mát, giúp các bé hạnh phúc",127.200₫,https://tiki.vn/bo-thun-be-trai-catrio-in-bong-chay-mau-navy-la-bo-do-phong-sat-nach-tre-em-tu-5-tuoi-den-8-tuoi-20kg-den-29kg-thuoc-bst-quan-ao-thoi-trang-tre-em-catrio-du-lich-mua-he-2021-p107793211.html?spid=107793217,28,,Đã bán 1,catrio
"BỘ THUN BÉ TRAI CATRIO IN BÓNG BẦU DỤC MÀU NAVY là bộ đồ mùa hè của bé trai từ 9 tuổi 32kg đến 18 tuổi 60kg, gồm QUẦN ĐÙI + ÁO SÁT NÁCH, vải 100% cotton đạt chuẩn xuất khẩu, thích hợp với trẻ em mặc ở nhà, đi chơi rất thoáng mát, giúp các bé hạnh phúc",135.200₫,https://tiki.vn/bo-thun-be-trai-catrio-in-bong-bau-duc-mau-navy-la-bo-do-mua-he-cua-be-trai-tu-9-tuoi-32kg-den-18-tuoi-60kg-gom-quan-dui-ao-sat-nach-vai-100-cotton-dat-chuan-xuat-khau-thich-hop-voi-tre-em-mac-o-nha-di-choi-rat-thoang-mat-giup-cac-be-hanh-phuc-p229731950.html?spid=229731952,29,,,catrio
"3 chiếc quần đùi bé trai CATRIO từ 5 tuổi(20kg)_8 tuổi (28kg)= 147.000 VNĐ sẽ tiết kiệm 64k tiền vận chuyển cho quý khách, là quần đùi trẻ em vải 100% cotton đạt chuẩn xuất khẩu khi kết hợp áo thun ngắn tay thành bộ đồ mùa hè cho bé mặc ở nhà đi chơi ĐEN",117.600,https://tiki.vn/3-chiec-quan-dui-be-trai-catrio-tu-5-tuoi-20kg-_8-tuoi-28kg-147-000-vnd-se-tiet-kiem-64k-tien-van-chuyen-cho-quy-khach-la-quan-dui-tre-em-vai-100-cotton-dat-chuan-xuat-khau-khi-ket-hop-ao-thun-ngan-tay-thanh-bo-do-mua-he-cho-be-mac-o-nha-di-choi-den-p261811231.html?spid=261811233,30,,,catrio
,,https://tiki.vn/ao-thun-be-trai-ngan-tay-catrio-in-dream-la-ao-phong-tre-em-tu-14-tuoi-den-18-tuoi-45kg-den-70kg-mau-navy-chat-lieu-100-cotton-an-toan-ao-thun-be-trai-thuoc-bst-quan-ao-thoi-trang-tre-em-catrio-p170759457.html?spid=170759459,31,,,catrio
"ÁO THUN DÀI TAY BÉ TRAI TỪ 1 TUỔI ĐẾN 8 TUỔI IN HÌNH BEDTIMES, THUỘC BỘ SƯU TẬP QUẦN ÁO TRẺ EM MÙA THU ĐÔNG CATRIO 2021",87.200₫,https://tiki.vn/ao-thun-dai-tay-be-trai-tu-1-tuoi-den-8-tuoi-in-hinh-bedtimes-thuoc-bo-suu-tap-quan-ao-tre-em-mua-thu-dong-catrio-2021-p67848535.html?spid=67848548,32,,Đã bán 1,catrio
"QUẦN ĐÙI NAM CATRIO MÀU 27 cho các bé lớn, nam trung niên, cao tuổi có cân nặng từ 40kg đến 83kg là quần short nam bé trai size đại, được làm từ vải may áo sơ mi thuộc BST quần short áo phông mùa hè CATRIO 2021",44.000₫,https://tiki.vn/quan-dui-nam-catrio-mau-27-cho-cac-be-lon-nam-trung-nien-cao-tuoi-co-can-nang-tu-40kg-den-83kg-la-quan-short-nam-be-trai-size-dai-duoc-lam-tu-vai-may-ao-so-mi-thuoc-bst-quan-short-ao-phong-mua-he-catrio-2021-p113644068.html?spid=113644074,33,,Đã bán 1,catrio
"QUẦN SHORT BÉ TRAI CATRIO IN VARSITY là quần ngố, quần lửng trẻ em từ 5 tuổi 20kg đến 14 tuổi 50kg, vải dệt kiểu da cá 100% cotton an toàn đạt chuẩn xuất khẩu, khi kết hợp với áo phông ngắn tay thành bộ đồ bé trai mặc đi học, đi chơi du lịch vui và đẹp",87.200₫,https://tiki.vn/quan-lung-cotton-be-trai-tu-5-tuoi-den-14-tuoi-catrio-hinh-varsity-82-ao-be-trai-ao-be-gai-do-bo-thun-be-trai-voi-chat-lieu-100-cotton-an-toan-la-quan-ao-tre-em-mua-he-truyen-thong-cua-thoi-trang-tre-em-catrio-p56108988.html?spid=56109026,34,,Đã bán 15,catrio
"BỘ THUN BÉ TRAI CATRIO IN BÓNG SAO MÀU XÁM là bộ đồ mùa hè của bé trai từ 1 tuổi 12kg đến 8 tuổi 29kg, gồm QUẦN ĐÙI + ÁO SÁT NÁCH, vải 100% cotton đạt chuẩn xuất khẩu, thích hợp với trẻ em mặc ở nhà, đi chơi rất thoáng mát, giúp các bé hạnh phúc",127.200,https://tiki.vn/bo-thun-be-trai-catrio-in-bong-sao-mau-xam-la-bo-do-mua-he-cua-be-trai-tu-1-tuoi-12kg-den-8-tuoi-29kg-gom-quan-dui-ao-sat-nach-vai-100-cotton-dat-chuan-xuat-khau-thich-hop-voi-tre-em-mac-o-nha-di-choi-rat-thoang-mat-giup-cac-be-hanh-phuc-p229713894.html?spid=229713908,35,,,catrio
,,https://tiki.vn/ao-phong-dai-tay-be-trai-catrio-hinh-deadpool-mau-do-la-ao-thun-cotton-dai-tay-tre-em-tu-9-tuoi-den-12-tuoi-30kg-den-50kg-thuoc-bst-quan-ao-tre-em-mua-thu-dong-catrio-2021-p121099479.html?spid=121099483,36,,,catrio
"BỘ THUN BÉ TRAI CATRIO in JUST màu TRẮNG là bộ đồ mùa hè trẻ em từ 1 tuổi 12kg đến 10 tuổi 35kg gồm có QUẦN ĐÙI + ÁO SÁT NÁCH vải 100% cotton an toàn đạt chuẩn xuất khẩu thích hợp các bé trai mặc ở nhà, đi chơi rất thoáng mạt và hạnh phúc",127.200₫,https://tiki.vn/bo-thun-be-trai-catrio-in-just-mau-trang-la-bo-do-mua-he-tre-em-tu-1-tuoi-12kg-den-10-tuoi-35kg-gom-co-quan-dui-ao-sat-nach-vai-100-cotton-an-toan-dat-chuan-xuat-khau-thich-hop-cac-be-trai-mac-o-nha-di-choi-rat-thoang-mat-va-hanh-phuc-p249016363.html?spid=249016375,37,,,catrio
"BỘ THUN BÉ TRAI CATRIO IN PLAY SOCCER MÀU XÁM là bộ đồ mùa hè của bé trai từ 1 tuổi 12kg đến 4 tuổi 19kg, gồm QUẦN ĐÙI + ÁO SÁT NÁCH, vải 100% cotton đạt chuẩn xuất khẩu, thích hợp với trẻ em mặc ở nhà, đi chơi rất thoáng mát, giúp các bé hạnh phúc",127.200₫,https://tiki.vn/bo-thun-be-trai-catrio-in-player-soccer-mau-xam-la-bo-do-thun-tre-em-tu-1-tuoi-den-4-tuoi-20kg-den-23kg-thuoc-bst-quan-ao-thoi-trang-tre-em-catrio-mua-he-2021-p95058546.html?spid=95058552,38,,,catrio
"BỘ THUN BÉ TRAI CATRIO IN FIND MÀU TRẮNG là bộ đồ quần áo mùa hè trẻ em từ 5 tuổi 20kg đến 18 tuổi 70kg gồm ÁO NGẮN TAY + QUẦN ĐÙI vải 100% cotton đạt chuẩn xuất khẩu, thích hợp với các bé trai mặc ở nhà, đi chơi du lịch rất thoáng mát và hạnh phúc",135.200₫,https://tiki.vn/bo-thun-be-trai-catrio-in-find-mau-trang-la-bo-do-quan-ao-mua-he-tre-em-tu-5-tuoi-20kg-den-18-tuoi-70kg-gom-ao-ngan-tay-quan-dui-vai-100-cotton-dat-chuan-xuat-khau-thich-hop-voi-cac-be-trai-mac-o-nha-di-choi-du-lich-rat-thoang-mat-va-hanh-phuc-p242423576.html?spid=242423578,39,,Đã bán 1,catrio
BỘ ĐỒ MÙA HÈ CỦA BÉ TRAI CATRIO là bộ THUN QUẦN ĐÙI+ÁO SÁT NÁCH in SN BADMAN cho bé từ 19kg đến 26kg,127.200,https://tiki.vn/bo-do-mua-he-cua-be-trai-catrio-la-bo-thun-quan-dui-ao-sat-nach-in-sn-badman-cho-be-tu-19kg-den-26kg-p185925493.html?spid=185925551,40,,,catrio
