title,price,link_item,index,discount,sales,category
"Áo thun gia đình Mẹ Là Số Một, Ba Là Số Một, Con Là Tất Cả ATGDTrắng10",50.000₫,https://tiki.vn/ao-thun-gia-dinh-me-la-so-mot-ba-la-so-mot-con-la-tat-ca-atgdtrang10-p86031353.html?spid=86031378,1,,Đã bán 3,dodoinam
"Áo thun gia đình Mẹ Là Số Một, Ba Là Số Một, Con Là Tất Cả ATGDXanh Ngọc10",50.000₫,https://tiki.vn/ao-thun-gia-dinh-me-la-so-mot-ba-la-so-mot-con-la-tat-ca-atgdxanh-ngoc10-p86031591.html?spid=86031595,2,,Đã bán 2,dodoinam
"Áo thun gia đình Ba Là Cây Nến Vàng, Mẹ Là Cây Nến Xanh, Con Là Cây Nến Hồng ATGDHồng Phấn16",50.000₫,https://tiki.vn/ao-thun-gia-dinh-ba-la-cay-nen-vang-me-la-cay-nen-xanh-con-la-cay-nen-hong-atgdhong-phan16-p86035907.html?spid=86035973,3,,Đã bán 2,dodoinam
"Áo thun gia đình Mẹ Là Số Một, Ba Là Số Một, Con Là Tất Cả ATGDXanh La10",50.000₫,https://tiki.vn/ao-thun-gia-dinh-me-la-so-mot-ba-la-so-mot-con-la-tat-ca-atgdxanh-la10-p86031518.html?spid=86031562,4,,,dodoinam
,,https://tiki.vn/ao-thun-gia-dinh-ca-nha-thuong-nhau-atgdvang15-p86035235.html?spid=86035259,5,,,dodoinam
Áo thun gia đình Baby Shark ATGD71-Xám,50.000₫,https://tiki.vn/ao-thun-gia-dinh-p101935325.html?spid=101935359,6,,Đã bán 10,dodoinam
Áo thun gia đình Cả Nhà Thương Nhau ATGDVàng15,50.000₫,https://tiki.vn/ao-thun-gia-dinh-ca-nha-thuong-nhau-atgdvang15-p101616371.html?spid=101616417,7,,,dodoinam
"Áo thun gia đình Bố Là Tất Cả, Mẹ Là Tất Cả, Con Là Trên Tất Cả ATGDXanh Lá17",50.000₫,https://tiki.vn/ao-thun-gia-dinh-bo-la-tat-ca-me-la-tat-ca-con-la-tren-tat-ca-atgdxanh-la17-p101639208.html?spid=101639271,8,,,dodoinam
Áo thun gia đình Chồng Là Nhất Vợ Là Nhì Con Là Tất Cả ATGD08-Xanh ngọc,50.000₫,https://tiki.vn/ao-thun-gia-dinh-chong-la-nhat-vo-la-nhi-con-la-tat-ca-atgd08-xanh-ngoc-p101456173.html?spid=101456181,9,,Đã bán 1,dodoinam
,,https://tiki.vn/ao-thun-gia-dinh-ca-nha-minh-la-cai-gi-nao-atgd09-xam-p101465054.html?spid=101465056,10,,,dodoinam
Áo thun gia đình Chồng Là Nhất Vợ Là Nhì Con Là Tất Cả ATGD08-Xám,50.000₫,https://tiki.vn/ao-thun-gia-dinh-chong-la-nhat-vo-la-nhi-con-la-tat-ca-atgd08-xam-p101455911.html?spid=101456002,11,,,dodoinam
"Áo thun gia đình Bố Là Tất Cả, Mẹ Là Tất Cả, Con Là Trên Tất Cả ATGDXám17",44.000₫,https://tiki.vn/ao-thun-gia-dinh-bo-la-tat-ca-me-la-tat-ca-con-la-tren-tat-ca-atgdxam17-p86037998.html?spid=86038034,12,,,dodoinam
,,https://tiki.vn/ao-thun-gia-dinh-happy-summer-atgd23-hong-phan-p101684947.html?spid=101684985,13,,,dodoinam
Áo thun gia đình Tiền nhiều để làm gì? ATGD72-Hồng Phấn,50.000₫,https://tiki.vn/ao-thun-gia-dinh-tien-nhieu-de-lam-gi-atgd72-hong-phan-p101956634.html?spid=101956652,14,,,dodoinam
Áo thun gia đình Tiền nhiều để làm gì? ATGDXanh Lá72,50.000₫,https://tiki.vn/ao-thun-gia-dinh-tien-nhieu-de-lam-gi-atgdxanh-la72-p85765087.html?spid=85765091,15,,Đã bán 1,dodoinam
"Áo thun gia đình Mẹ Là Số Một, Ba Là Số Một, Con Là Tất Cả ATGDHồng Phấn10",50.000₫,https://tiki.vn/ao-thun-gia-dinh-me-la-so-mot-ba-la-so-mot-con-la-tat-ca-atgdhong-phan10-p86031282.html?spid=86031344,16,,Đã bán 2,dodoinam
áo gia đình thu đông màu đen,137.000,https://tiki.vn/ao-gia-dinh-thu-dong-mau-den-p90771006.html?spid=90771934,17,,,dodoinam
,,https://tiki.vn/ao-gia-dinh-i-love-my-family-p105118820.html?spid=105119694,18,,,dodoinam
"ÁO thun NHÓM, ÁO lớp, ÁO thun GIA ĐÌNH màu đỏ {full size",35.000₫,https://tiki.vn/ao-thun-nhom-lop-gia-dinh-mau-do-full-size-p105119974.html?spid=105120845,19,,Đã bán 6,dodoinam
"{Đủ size} ÁO NHÓM, Áo Team, Áo Lớp, ÁO GIA ĐÌNH - CHƠI TRỘI ... CÓ HỘI",39.000₫,https://tiki.vn/du-size-ao-nhom-team-lop-gia-dinh-choi-troi-co-hoi-p105121857.html?spid=105123484,20,,,dodoinam
"ÁO NHÓM, áo team, ÁO GIA ĐÌNH, áo thun nhóm - BIỂN HÈ {đủ size",39.000₫,https://tiki.vn/ao-nhom-team-gia-dinh-bien-he-du-size-p105122119.html?spid=105124346,21,,,dodoinam
"Áo gia đình, áo thun team, áo nhóm, áo lớp - NARI GOLD",39.000₫,https://tiki.vn/ao-gia-dinh-thun-team-nhom-lop-nari-gold-p105122229.html?spid=105123790,22,,,dodoinam
"Áo thun nhóm , áo team, áo lớp, áo gia đình - WE ARE 1 {full sze} có cả bộ",40.000₫,https://tiki.vn/ao-thun-nhom-team-lop-gia-dinh-we-are-1-full-sze-co-ca-bo-p105121826.html?spid=105122714,23,,,dodoinam
"{full size} Áo thun gia đình, nhóm, lớp đi biển cực xinh",45.000₫,https://tiki.vn/ao-thun-gia-dinh-nhom-lop-di-bien-cuc-xinh-p105118297.html?spid=105118449,24,,Đã bán 10,dodoinam
"Áo thun gia đình, áo nhóm, áo team, áo lớp - ĐƯA NHAU ĐI TRỐN",35.000₫,https://tiki.vn/ao-thun-gia-dinh-nhom-team-lop-dua-nhau-di-tron-p105122269.html?spid=105122582,25,,,dodoinam
,,https://tiki.vn/ao-thun-di-bien-nhom-team-gia-dinh-p105118404.html?spid=105118436,26,,,dodoinam
"Áo nhóm, áo lớp, áo gia đình MÀU ĐỎ - HAPPY TIME {đủ size",35.000₫,https://tiki.vn/ao-nhom-lop-gia-dinh-mau-do-happy-time-du-size-p105119191.html?spid=105120608,27,,,dodoinam
"Áo thun gia đình, áo nhóm, áo team, áo lớp - I lOVE YOU",39.000₫,https://tiki.vn/ao-thun-gia-dinh-nhom-team-lop-i-love-you-p105121000.html?spid=105121337,28,,,dodoinam
"ÁO NHÓM, ÁO GIA ĐÌNH Thu đông",59.000₫,https://tiki.vn/ao-nhom-gia-dinh-thu-dong-p105119801.html?spid=105120145,29,,,dodoinam
"{full size} ÁO thun TEAM, ÁO NHÓM, ÁO LỚP, ÁO GIA ĐÌNH - Có anh em làm được hết",35.000₫,https://tiki.vn/full-size-ao-thun-team-nhom-lop-gia-dinh-co-anh-em-lam-duoc-het-p105119676.html?spid=105121008,30,,,dodoinam
,,https://tiki.vn/ao-thun-nhom-team-lop-gia-dinh-di-bien-full-size-p105120063.html?spid=105121957,31,,,dodoinam
"Áo team, áo nhóm, áo lớp, á gia đình, áo thun đi biển {full size",28.000₫,https://tiki.vn/ao-team-nhom-lop-gia-dinh-di-bien-full-size-p105121764.html?spid=105122495,32,,,dodoinam
"Áo THUN nhóm, Áo gia đình cực HOT - NY Ffull size",29.000₫,https://tiki.vn/ao-thun-nhom-gia-dinh-cuc-hot-ny-ffull-size-p105119641.html?spid=105120319,33,,Đã bán 2,dodoinam
"ÁO NHÓM, ÁO GIA ĐÌNH Thu đông - NOEL",100.000₫,https://tiki.vn/ao-nhom-gia-dinh-thu-dong-noel-p105122121.html?spid=105122429,34,,,dodoinam
Áo gia đình 4 người đủ size - màu vàng (GD299VD2),91.000₫,https://tiki.vn/ao-gia-dinh-4-nguoi-du-size-mau-vang-gd299vd2-p95913866.html?spid=95913968,35,,Đã bán 12,dodoinam
,,https://tiki.vn/ao-thun-dong-phuc-gia-dinh-mau-trang-in-trai-tim-cau-vong-atn6346-p76611523.html?spid=76612604,36,,,dodoinam
Áo Thun Đôi Tình Nhân Tay Ngắn Màu Trắng In 3D ATN3442,90.000₫,https://tiki.vn/ao-thun-doi-tinh-nhan-tay-ngan-mau-trang-in-3d-atn3442-p76632908.html?spid=76633015,37,,,dodoinam
Áo Sơ Mi Cặp Đôi Đen Tia X Cao Cấp | Áo Đôi Nam Nữ Đẹp C03,99.000₫,https://tiki.vn/ao-so-mi-cap-doi-den-tia-x-cao-cap-ao-doi-nam-nu-dep-c03-p90420079.html?spid=273448878,38,,,dodoinam
Bộ áo khoác điều hoà quạt điều hoà 12V - 20.000MAH thời gian sử dụng 14h - GILE GHI,1.290.000₫,https://tiki.vn/bo-ao-khoac-dieu-hoa-quat-dieu-hoa-12v-20-000mah-thoi-gian-su-dung-14h-p271737937.html?spid=271738184,39,,,dodoinam
Áo Sơ Mi Cặp Đôi Đen Tia X Cao Cấp | Áo Đôi Nam Nữ Đẹp C03,99.000₫,https://tiki.vn/ao-so-mi-cap-doi-den-tia-x-cao-cap-ao-doi-nam-nu-dep-c03-p91911753.html?spid=273421586,40,,,dodoinam
