title,price,link_item,index,discount,sales,category
"Set 2 Miếng Tã/Bỉm Dán NABIZAM Magic Soft Mỏng Nhẹ, Chống Tràn NB50/S44/M40/L36/XL32 Cho Bé Từ 3-15kg,32-50 Miếng/Bịch",12.160₫,https://tiki.vn/set-2-mieng-ta-bim-dan-nabizam-magic-soft-mong-nhe-chong-tran-nb50-s44-m40-l36-xl32-cho-be-tu-3-15kg-32-50-mieng-bich-p207779274.html?spid=207779281,1,-15%,Đã bán 2,tabim
Khăn ướt BEBESUP PREMIER số 1 Hàn Quốc,25.000₫,https://tiki.vn/khan-uot-bebesup-premier-so-1-han-quoc-p222680062.html?spid=222680064,2,-7%,,tabim
"(Bịch Tiết Kiệm) Khăn Khô, Khăn Vải Khô Đa Năng UNMEI Vân Trơn/Vân Nổi 600g An Toàn Cho Da Em Bé",85.000₫,https://tiki.vn/bich-tiet-kiem-khan-kho-khan-vai-kho-da-nang-unmei-van-tron-van-noi-600g-an-toan-cho-da-em-be-p272234963.html?spid=272234965,3,-21%,,tabim
[Tặng Kèm Giá Siêu Rẻ] Combo 10 Gói Khăn Ướt Aiko Kháng Khuẩn Xanh/Khăn Ướt Không Mùi Hồng 100 tờ/gói,299.000₫,https://tiki.vn/tang-kem-gia-sieu-re-combo-10-goi-khan-uot-aiko-khang-khuan-xanh-khan-uot-khong-mui-hong-100-to-goi-p257834848.html?spid=257834850,4,-30%,Đã bán 3,tabim
Combo 2 Tã/bỉm dán Merries size S - 82 + 6 miếng (Cho bé 4-8kg),700.000₫,https://tiki.vn/combo-2-ta-bim-dan-merries-size-s-82-6-mieng-cho-be-4-8kg-p36934171.html?spid=242416129,5,-7%,Đã bán 1,tabim
"Miếng lót em bé ENJOY Cao Cấp ngày và đêm cho bé từ 3-5kg, mềm mại, thấm hút, chuẩn chất lượng Châu Âu - Gói 56 Miếng",64.600₫,https://tiki.vn/mieng-lot-em-be-enjoy-n56-p58970592.html?spid=58970593,6,-28%,Đã bán 12,tabim
Tã/bỉm dán Molfix Thiên nhiên Jumbo XL62 (12kg - 17kg) - Gói 62 miếng,275.000₫,https://tiki.vn/ta-bim-dan-molfix-thien-nhien-jumbo-xl62-12kg-17kg-goi-62-mieng-p225201213.html?spid=225201214,7,-17%,Đã bán 1,tabim
Tã/bỉm quần Molfix Thiên nhiên Ultra L68 (9kg - 13kg) - Gói 68 miếng,310.000₫,https://tiki.vn/ta-bim-quan-molfix-thien-nhien-ultra-l68-9kg-13kg-goi-68-mieng-p225200054.html?spid=225200055,8,-27%,,tabim
Tã/bỉm quần Molfix Thiên nhiên Ultra L38 (9kg - 13kg) - Gói 38 miếng,215.000₫,https://tiki.vn/ta-bim-quan-molfix-thien-nhien-ultra-l38-9kg-13kg-goi-38-mieng-p225200764.html?spid=225200765,9,-26%,,tabim
Tã/bỉm quần Molfix Thiên nhiên Ultra XXL30 (15kg - 25kg) - Gói 30 miếng,215.000₫,https://tiki.vn/ta-bim-quan-molfix-thien-nhien-ultra-xxl30-15kg-25kg-goi-30-mieng-p225200816.html?spid=225200817,10,,,tabim
Tã/bỉm dán Molfix Thiên nhiên Jumbo M76 (6kg - 11kg) - Gói 76 miếng,275.000₫,https://tiki.vn/ta-bim-dan-molfix-thien-nhien-jumbo-m76-6kg-11kg-goi-76-mieng-p225201179.html?spid=225201180,11,,,tabim
COMBO 3 BỊCH TÃ QUẦN ROSE BABY XXXL22 MIẾNG TRÊN 17KG,399.000₫,https://tiki.vn/combo-3-bich-ta-quan-rose-baby-xxxl22-mieng-tren-17kg-p273197019.html?spid=273197020,12,,,tabim
COMBO 5 BỊCH TÃ QUẦN ROSE BABY XXXL22 MIẾNG TRÊN 17KG,665.000₫,https://tiki.vn/combo-5-bich-ta-quan-rose-baby-xxxl22-mieng-tren-17kg-p273197190.html?spid=273197191,13,,,tabim
Khăn Giấy Cotton Khô Và Ướt Cho Bé KuKu KU1119,61.750₫,https://tiki.vn/khan-giay-cotton-kho-va-uot-cho-be-kuku-ku1119-p53980232.html?spid=53980233,14,,Đã bán 2,tabim
[Mẫu mới] Tã dán Unidry sơ sinh Newborn mới - 40 miếng,125.000₫,https://tiki.vn/mau-moi-ta-dan-unidry-so-sinh-newborn-moi-40-mieng-p273612599.html?spid=273612601,15,,,tabim
Bỉm quần Moony XL38 (bé gái 12-22kg),390.000₫,https://tiki.vn/bim-quan-moony-xl38-be-gai-12-17kg-p252794688.html?spid=252794689,16,,,tabim
Tã dán Merries M56+4 Nhật Bản (cho bé từ 6-11kg),405.000₫,https://tiki.vn/ta-dan-merries-m64-nhat-ban-cho-be-tu-6-11kg-p116930584.html?spid=116930591,17,,Đã bán 3,tabim
Khăn giấy ướt Agassi 10 tờ,6.320₫,https://tiki.vn/khan-giay-uot-agassi-10-to-p248595867.html?spid=248595871,18,,Đã bán 9,tabim
Combo 3 Gói Tã Quần Cao Cấp Moony Nhật Bản size XXL26 bé gái,862.500₫,https://tiki.vn/combo-3-goi-ta-quan-cao-cap-moony-nhat-ban-size-xxl26-be-gai-p59141679.html?spid=70719596,19,,,tabim
Combo 2 Tã/bỉm dán Merries size NB - 90 miếng (Cho bé dưới 5kg),770.000₫,https://tiki.vn/combo-2-ta-bi-m-dan-merries-size-nb-90-mieng-cho-be-duoi-5kg-p13308993.html?spid=52391321,20,,,tabim
Thùng 10 gói khăn giấy ướt con vịt vàng+ tặng kèm thùng nhựa tiện dụng siêu đáng yêu,164.000₫,https://tiki.vn/thung-10-goi-khan-giay-uot-con-vit-vang-tang-kem-thung-nhua-tien-dung-sieu-dang-yeu-p176431027.html?spid=182326499,21,,Đã bán 1,tabim
Tã dán người lớn Livedo Nhật Bản Size L,550.000₫,https://tiki.vn/ta-dan-nguoi-lon-livedo-nhat-ban-size-l-p272226706.html?spid=272226707,22,,,tabim
Combo Tã - Bỉm quần người lớn (size M) và Miếng lót đêm,1.100.000₫,https://tiki.vn/combo-ta-bim-quan-nguoi-lon-size-m-va-mieng-lot-dem-p272228752.html?spid=272228753,23,,,tabim
Tã/ Bỉm quần Nabizam nội địa Hàn M32 miếng (6-11kg),400.000₫,https://tiki.vn/ta-bim-quan-nabizam-noi-dia-han-m32-mieng-6-11kg-p247667480.html?spid=247667481,24,,,tabim
"Combo 3 bao khăn ướt tắm khô quick-nurse, 50 miếng/bao",126.000₫,https://tiki.vn/combo-3-bao-khan-uot-tam-kho-quick-nurse-50-mieng-bao-p271487578.html?spid=271487579,25,,,tabim
"Bao khăn ướt tắm khô quick-nurse, 50 miếng/bao",60.000₫,https://tiki.vn/bao-khan-uot-tam-kho-quick-nurse-50-mieng-p271487612.html?spid=271487613,26,,,tabim
"Tả Bỉm Dán/Quần Cao Cấp Siêu Mỏng, Siêu Thấm Hút - KUB, Size Tả Dán S66/M54/L46/XL40, Tả Quần L38/XL36/XXL34",525.000₫,https://tiki.vn/ta-bim-dan-quan-cao-cap-sieu-mong-sieu-tham-hut-kub-size-ta-dan-s66-m54-l46-xl40-ta-quan-l38-xl36-xxl34-p159313659.html?spid=159313677,27,,Đã bán 1,tabim
Combo 3 Khăn ướt Mamamy 100 tờ và 1 Chai dung dịch rửa tay khô 100ml Luck Lady,189.000₫,https://tiki.vn/combo-3-khan-uot-mamamy-100-to-va-1-chai-dung-dich-rua-tay-kho-100ml-luck-lady-p191444877.html?spid=191444879,28,,Đã bán 1,tabim
"Combo 6 gói khăn ướt Mamamay 80 tờ/gói kháng khuẩn, an toàn cho bé",264.000₫,https://tiki.vn/combo-6-goi-khan-uot-mamamay-80-to-goi-khang-khuan-an-toan-cho-be-p89482307.html?spid=89482320,29,,Đã bán 5,tabim
"Combo 5 Khăn Ướt Đa Năng Không Mùi Niva 100 Tờ Tiện Dụng, Diệt Khuẩn, An Toàn Cho Trẻ Sơ Sinh Phụ Nữ Mang Thai",195.300₫,https://tiki.vn/combo-5-khan-uot-da-nang-khong-mui-niva-100-to-tien-dung-diet-khuan-an-toan-cho-tre-so-sinh-phu-nu-mang-thai-p197666779.html?spid=197666781,30,,,tabim
Tả quần Babies Organnic size XXL 40 miếng / bịch >15kg,232.000₫,https://tiki.vn/ta-quan-babies-organnic-size-xxl-40-mieng-bich-15kg-p111657900.html?spid=111657902,31,,Đã bán 10,tabim
Combo 2 Gói Tã Dán Cao Cấp Moony Nhật Bản M64 (64 Miếng ),569.900₫,https://tiki.vn/combo-2-goi-ta-dan-cao-cap-moony-nhat-ban-m64-64-mieng-p58136602.html?spid=70719593,32,,Đã bán 2,tabim
[COMBO 4 BỊCH] Bỉm quần Moony natural L36,1.149.500₫,https://tiki.vn/combo-4-bich-bim-quan-moony-natural-l36-p59104704.html?spid=201601689,33,,Đã bán 4,tabim
[COMBO 2 BỊCH] Bỉm quần Moony natural M 46,555.000₫,https://tiki.vn/combo-2-bich-bim-quan-moony-natural-m-46-p57501992.html?spid=76002417,34,,,tabim
Bỉm Dán MOONY NATURAL S58,286.900₫,https://tiki.vn/bim-ta-dan-moony-natural-bong-organic-s58-58-mieng-noi-dia-nhat-p53458206.html?spid=201845078,35,,Đã bán 1,tabim
Tã/bỉm dán Molfix Thiên nhiên Jumbo XL38 (12kg - 17kg) - Gói 38 miếng,185.000₫,https://tiki.vn/ta-bim-dan-molfix-thien-nhien-jumbo-xl38-12kg-17kg-goi-38-mieng-p225201049.html?spid=225201050,36,,,tabim
Tã dán UniDry Siêu khô thoáng gói Jumbo mới size M76/L68/XL62,232.000₫,https://tiki.vn/ta-dan-unidry-sieu-kho-thoang-goi-jumbo-moi-size-m76-l68-xl62-p273301442.html?spid=273691297,37,,,tabim
"Combo 2 Gói Khăn giấy ướt cho trẻ sơ sinh Huggies không mùi, gói 64 tờ",70.000₫,https://tiki.vn/combo-2-goi-khan-giay-uot-cho-tre-so-sinh-huggies-khong-mui-goi-64-to-p13752012.html?spid=68966294,38,,Đã bán 40,tabim
Bỉm dán Moony Natural Size M46,350.000₫,https://tiki.vn/bich-bim-bong-organic-moony-natural-size-m-dan-46-mieng-6-11kg-noi-dia-nhat-p54607517.html?spid=113407132,39,,Đã bán 9,tabim
Tặng thêm miếng - Tã Quần Huggies Dry size XXL28 (28 miếng + khuyến mãi- cho bé 16-25kg),215.000₫,https://tiki.vn/ta-quan-huggies-dry-size-xxl30-30-mieng-cho-be-16-25kg-p94857530.html?spid=94857531,40,,Đã bán 2,tabim
