title,price,link_item,index,discount,sales,category
XẢ HÀNGVáy suông 4C cho con ti sz s-XL,128.700₫,https://tiki.vn/xa-hang-vay-suong-4c-cho-con-ti-sz-s-xl-p95172344.html?spid=95172548,1,,,thoitrangbau
"(Sỉ, lẻ) QUẦN MẶC TRONG VÁY BẦU CẠP CHÉO QV005 (có video, ảnh thật)",45.000₫,https://tiki.vn/si-le-quan-mac-trong-vay-bau-cap-cheo-qv005-co-video-anh-that-p135900878.html?spid=135900918,2,,Đã bán 3,thoitrangbau
VÁY BẦU VẢI TOLE LANH BIGSIZE 80 KÝ,100.000₫,https://tiki.vn/vay-bau-vai-tole-lanh-bigsize-80-ky-p105800684.html?spid=105800702,3,,,thoitrangbau
BỘ LỬNG BẦU CHẤT THÔ LOẠI ĐẸP,98.000₫,https://tiki.vn/bo-lung-bau-chat-tho-loai-dep-p107279022.html?spid=107279094,4,,,thoitrangbau
,,https://tiki.vn/quan-leging-bau-p105799556.html?spid=105799570,5,,,thoitrangbau
Móc nới áo ngực (3 nấc) phù hợp với áo lót trơn cúc mở,11.340₫,https://tiki.vn/moc-noi-ao-nguc-3-nac-phu-hop-voi-ao-lot-tron-cuc-mo-p146572957.html?spid=146572978,6,,Đã bán 1,thoitrangbau
Quần lót bầu cạp chéo in hình ngộ nghĩnh QL-A7 (giao màu ngẫu nhiên),36.540₫,https://tiki.vn/quan-lot-bau-cap-cheo-in-hinh-ngo-nghinh-ql-a7-giao-mau-ngau-nhien-p146572920.html?spid=146572979,7,,,thoitrangbau
BỘ QUẦN ÁO LÓT BẦU MADE IN THÁI LAN,102.000₫,https://tiki.vn/bo-quan-ao-lot-bau-made-in-thai-lan-p107279113.html?spid=107279188,8,,,thoitrangbau
"Váy dạ ,nhung bầu (váy mặc Đông vải dày )",130.000,https://tiki.vn/vay-da-nhung-bau-vay-mac-dong-vai-day-p105800199.html?spid=105800214,9,,,thoitrangbau
,,https://tiki.vn/ao-bau-theu-hoa-chat-lua-a25-p146574661.html?spid=146574881,10,,,thoitrangbau
Quần tất bầu 320D có chun điều chỉnh bụng,128.520₫,https://tiki.vn/quan-tat-bau-320d-co-chun-dieu-chinh-bung-p107278971.html?spid=107278977,11,,,thoitrangbau
quần lót bầu-quần lót cạp chéo chữ v cao cấp đẹp QL001,21.000₫,https://tiki.vn/quan-lot-bau-quan-lot-cap-cheo-chu-v-cao-cap-dep-ql001-p148637659.html?spid=148637864,12,,,thoitrangbau
,,https://tiki.vn/ao-nguc-bau-mut-mong-khong-gong-cotton-trang-p177712706.html?spid=177712707,13,,,thoitrangbau
Bộ đồ bầu và sau sinh LỬNG chất lanh thái siêu mát có khóa ngực cho bé ti BL836,132.300₫,https://tiki.vn/bo-do-bau-va-sau-sinh-lung-chat-lanh-thai-sieu-mat-co-khoa-nguc-cho-be-ti-bl836-p146573520.html?spid=146573599,14,,Đã bán 1,thoitrangbau
Váy bầu cotton cao cấpthiết kế sang chảnhchất cotton siêu đẹp V222,137.340₫,https://tiki.vn/vay-bau-cotton-cao-cap-thiet-ke-sang-chanh-chat-cotton-sieu-dep-v222-p146572541.html?spid=146572570,15,,,thoitrangbau
Quần bầu jean thật cạp chéo có chun chỉnh,137.340₫,https://tiki.vn/quan-bau-jean-that-cap-cheo-co-chun-chinh-p146574349.html?spid=146574374,16,,,thoitrangbau
Quần Bầu Baggy Đũi Siêu Mềm Mịn CÓ TAG MÈO (Vạt chéo có chun chỉnh),152.460,https://tiki.vn/quan-bau-baggy-dui-sieu-mem-min-co-tag-meo-vat-cheo-co-chun-chinh-p146573763.html?spid=146573837,17,,,thoitrangbau
,,https://tiki.vn/ao-bau-cong-so-size-nho-va-size-to-p105799987.html?spid=105800002,18,,,thoitrangbau
"QUẦN LÓT NỮ THÔNG HƠI PHA REN CẠP CAO CHẤT ĐẸP 5885, (ảnh thật phía sau các bạn nhé)",13.734₫,https://tiki.vn/quan-lot-nu-thong-hoi-pha-ren-cap-cao-chat-dep-5885-anh-that-phia-sau-cac-ban-nhe-p146572061.html?spid=146572072,19,,Đã bán 1,thoitrangbau
Váy Bầu giả yếm phối sơ mi V36,149.940₫,https://tiki.vn/vay-bau-gia-yem-phoi-so-mi-v36-p146574992.html?spid=146575017,20,,,thoitrangbau
Combo đồ lót bầu 2 áo thông hơi 2 quần,142.380₫,https://tiki.vn/combo-do-lot-bau-2-ao-thong-hoi-2-quan-p146572847.html?spid=146572960,21,,,thoitrangbau
ĐẦM BẦU BÉO SUÔNG V589,310.400₫,https://tiki.vn/dam-bau-beo-suong-v589-p252639760.html?spid=252639770,22,,,thoitrangbau
Quần bầu kaki baggy đi làm đi chơi,343.000₫,https://tiki.vn/quan-bau-kaki-baggy-di-lam-di-choi-p252639757.html?spid=252639818,23,,,thoitrangbau
"Đầm bầu dự tiệc dáng suông dài, Đầm maxi nữ ngắn tay chất thun B35",199.000₫,https://tiki.vn/dam-bau-du-tiec-dang-suong-dai-dam-maxi-nu-ngan-tay-chat-thun-b35-p183521303.html?spid=183521305,24,,,thoitrangbau
[ 1 hộp - 30 gói ] Ngũ cốc bầu Lạc Lạc plus hộp 30 gói/600gram - Tặng quà cho bé,257.140,https://tiki.vn/1-hop-30-goi-ngu-coc-bau-lac-lac-plus-hop-30-goi-600gram-tang-qua-cho-be-p230110789.html?spid=230110790,25,,,thoitrangbau
,,https://tiki.vn/ao-lot-bau-loai-tron-cuc-mo-mac-ca-sau-sinh-cho-con-bu-alb01-p164582805.html?spid=164582824,26,,,thoitrangbau
Áo Bầu Xinh Cổ Sơ Mi Pha Ren Kẻ Caro Tay Lửng Đuôi Tôm AB05,149.000₫,https://tiki.vn/ao-bau-xinh-co-so-mi-pha-ren-ke-caro-tay-lung-duoi-tom-ab05-p183701356.html?spid=183701358,27,,,thoitrangbau
"Váy bầu dáng suông mặc hè chất liệu linen, Đầm bầu sơ mi nữ kèm đai eo B161",249.000₫,https://tiki.vn/vay-bau-dang-suong-mac-he-chat-lieu-linen-dam-bau-so-mi-nu-kem-dai-eo-b161-p185990156.html?spid=185990158,28,,,thoitrangbau
"Đầm bầu, đầm trơn xếp tầng đơn giản nhưng không kém phần sang trọng Db16",219.000₫,https://tiki.vn/dam-bau-dam-tron-xep-tang-don-gian-nhung-khong-kem-phan-sang-trong-db16-p196971443.html?spid=196971451,29,,,thoitrangbau
"Áo choàng cho con bú, áo choàng khi đi ra ngoài",58.000₫,https://tiki.vn/ao-choang-cho-con-bu-ao-choang-khi-di-ra-ngoai-p87534644.html?spid=87909511,30,,Đã bán 1,thoitrangbau
,,https://tiki.vn/dam-bau-suong-linen-thiet-ke-kieu-dang-so-mi-co-tui-cheo-db61-p196991992.html?spid=196992010,31,,,thoitrangbau
Váy bầu thiết kế dự tiệc công sở mùa hè dáng suông chân váy xòe cổ cánh sen - VB3,199.000₫,https://tiki.vn/vay-bau-thiet-ke-du-tiec-cong-so-mua-he-dang-suong-chan-vay-xoe-co-canh-sen-vb3-p119112344.html?spid=119112379,32,,,thoitrangbau
ĐẦM BẦU VÁY BẦU HOA CÚC DỄ THƯƠNG,94.000₫,https://tiki.vn/dam-bau-vay-bau-hoa-cuc-de-thuong-p163581405.html?spid=163581425,33,,,thoitrangbau
"Váy bầu cao cấp LOVELY & DIARY màu xám xinh xắn, nhìn xao xuyến (Quà tặng: 1 quần lót cotton 100%)",200.000₫,https://tiki.vn/vay-bau-cao-cap-lovely-diary-mau-xam-xinh-xan-nhin-xao-xuyen-qua-tang-1-quan-lot-cotton-100-p186123408.html?spid=186123409,34,,,thoitrangbau
Đầm bầu Trắng dáng suông thời trang chất cát hàn freesize 45-65kg,147.000,https://tiki.vn/dam-bau-trang-dang-suong-thoi-trang-chat-cat-han-freesize-45-65kg-p129491797.html?spid=129491800,35,,,thoitrangbau
,,https://tiki.vn/vay-bau-thoi-trang-thiet-ke-dang-suong-a-sat-nach-mau-hong-chat-voan-2-lop-p129498358.html?spid=129498366,36,,,thoitrangbau
Bộ đồ sau sinh,336.000₫,https://tiki.vn/bo-do-sau-sinh-p129497422.html?spid=129497451,37,,,thoitrangbau
Váy bầu thời trang,147.000₫,https://tiki.vn/vay-bau-thoi-trang-p129499615.html?spid=129499637,38,,,thoitrangbau
Váy bầu thiết kế xinh 45-68kg Đầm bầu công sở dáng dài,174.000₫,https://tiki.vn/vay-bau-thiet-ke-xinh-45-68kg-dam-bau-cong-so-dang-dai-p129499603.html?spid=129499619,39,,,thoitrangbau
Váy thời trang bầu dáng dài chất cotton mát mùa hè cộc tay đẹp 40-65kg,179.000,https://tiki.vn/vay-thoi-trang-bau-dang-dai-chat-cotton-mat-mua-he-coc-tay-dep-40-65kg-p129495394.html?spid=129495423,40,,,thoitrangbau
