title,price,link_item,index,discount,sales,category
Quần Ống Rộng Cạp Cao Phối Caro - QD09,90.000₫,https://tiki.vn/quan-ong-rong-cap-cao-phoi-caro-qd09-p73527646.html?spid=83201243,1,-49%,,quannu
"Quần short LINEN TƯNG Nhiều màu - Bigsize. Form rộng, hai túi sâu rộng. Hình thật. JUNE Q02",340.000₫,https://tiki.vn/quan-short-linen-tung-nhieu-mau-fullsize-form-rong-hai-tui-sau-rong-hinh-that-june-q02-p164058146.html?spid=164058205,2,-30%,,quannu
Quần suông ống rộng nam nữ 3 sọc vải thun cotton 4 chiều quần thể thao basic,79.000₫,https://tiki.vn/quan-suong-ong-rong-nam-nu-3-soc-vai-thun-cotton-4-chieu-quan-the-thao-basic-p146231563.html?spid=146231571,3,-37%,,quannu
"quần tăm ống suông - 3(xám),freesize dưới 55kg",150.000,https://tiki.vn/quan-tam-ong-suong-p192384892.html?spid=192384915,4,,,quannu
,,https://tiki.vn/quan-sooc-dui-p115770154.html?spid=115770233,5,,,quannu
Quần jogger nỉ nữ chất tổ ong cạp chung phong cách ulzzang Q968,160.000₫,https://tiki.vn/quan-jogger-ni-nu-chat-to-ong-cap-chung-phong-cach-ulzzang-q968-p177201500.html?spid=177201542,6,,,quannu
Quần đùi nữ năng động,59.000₫,https://tiki.vn/quan-dui-nu-nang-dong-p138676993.html?spid=138676997,7,,,quannu
Quần baggy ống xuông lưng cao khóa sườn dáng dài chất liệu tuyết mưa loại 1 mát mịn siêu hot,89.000₫,https://tiki.vn/quan-baggy-ong-xuong-lung-cao-khoa-suon-da-ng-da-i-chat-lieu-tuyet-mua-loai-1-mat-min-sieu-hot-p111038892.html?spid=106747259,8,,Đã bán 2,quannu
Quần Đũi Nữ Bagy Cao Cấp,79.000₫,https://tiki.vn/quan-dui-nu-bagy-cao-cap-p93602417.html?spid=93602551,9,,,quannu
,,https://tiki.vn/nh12820-quan-suong-ong-rong-p135523051.html?spid=135523076,10,,,quannu
Quần legging hàn đẹp rẻ,100.000₫,https://tiki.vn/quan-legging-han-dep-re-p127338787.html?spid=127338807,11,,,quannu
Quần JOGGER nỉ bom tổ ong siêu hot siêu xịn vải không bai xù,92.000₫,https://tiki.vn/quan-jogger-ni-bom-to-ong-sieu-hot-sieu-xin-vai-khong-bai-xu-p194444931.html?spid=194444965,12,,,quannu
,,https://tiki.vn/quan-legging-nu-dang-dai-cap-cao-xuat-xin-ct-jeans-cao-cap-lung-cao-p180867400.html?spid=180867415,13,,,quannu
Quần jean thêu họa tiết QBD22 dáng dài,347.000₫,https://tiki.vn/quan-jean-theu-hoa-tiet-qbd22-dang-dai-p90325847.html?spid=90325849,14,,,quannu
QUẦN JOGGER THỂ THAO NỮ VIỀN VẠCH PHẢN QUANG CHỤP PLASH,87.000₫,https://tiki.vn/quan-jogger-the-thao-nu-vien-vach-phan-quang-chup-plash-p56821826.html?spid=74818093,15,,Đã bán 17,quannu
Quần thô đũi nữ form rộng dáng lửng,200.000₫,https://tiki.vn/quan-tho-dui-nu-form-rong-dang-lung-qt01-p62827437.html?spid=73615184,16,,Đã bán 6,quannu
Quần jean Nữ Ống Loe Dài Chít Thân Xẻ Gấu Đẹp Store 257,290.000,https://tiki.vn/quan-jean-nu-ong-loe-dai-chit-than-xe-gau-dep-store-257-p157031455.html?spid=157031469,17,,,quannu
,,https://tiki.vn/quan-kaki-nu-suong-san-ong-loai-1-tang-1-doi-tat-nu-de-thuong-p117463451.html?spid=170449591,18,,,quannu
Quần đùi nữ phong cách hàn quốc,69.000₫,https://tiki.vn/quan-dui-nu-phong-cach-han-quoc-p81773364.html?spid=89176299,19,,Đã bán 3,quannu
Quần jogger len tăm nữ - quần jogger thun gân,96.000₫,https://tiki.vn/quan-jogger-len-tam-nu-quan-jogger-thun-gan-p189338553.html?spid=201687582,20,,,quannu
Quần âu nữ thời trang công sở thiết kế chất vải cao cấp ống loe nhẹ,149.000₫,https://tiki.vn/quan-au-nu-thoi-trang-cong-so-thiet-ke-chat-vai-cao-cap-ong-loe-nhe-p177270353.html?spid=177270354,21,,,quannu
Quần Jeans Nữ Co Giãn Tôn Dáng Cao cấp,235.000₫,https://tiki.vn/quan-jeans-nu-co-gian-ton-dang-cao-cap-p252712640.html?spid=252712683,22,,,quannu
"Quần Đùi Nữ Mặc Nhà SANMAY Sooc Ngắn Thể Thao lưng thun vải đẹp, màu đen hồng Hàn Quốc QD005",50.000₫,https://tiki.vn/quan-dui-nu-mac-nha-sanmay-sooc-ngan-the-thao-lung-thun-vai-dep-mau-den-hong-han-quoc-qd005-p144759229.html?spid=269367548,23,,,quannu
"Quần đùi nữ mặc nhà lưng cao Yinxx, quần sooc nữ ngắn thể thao lưng thun QS100",42.000₫,https://tiki.vn/quan-dui-nu-mac-nha-lung-cao-yinxx-quan-sooc-nu-ngan-the-thao-lung-thun-qs100-p139106489.html?spid=269367549,24,,Đã bán 5,quannu
QUẦN JEAN NỮ TRƠN,230.000,https://tiki.vn/quan-jean-nu-tron-p24536091.html?spid=26398779,25,,,quannu
,,https://tiki.vn/quan-dai-legging-cap-cao-nu-tap-gym-yoga-nang-mong-ton-vong-3-ch126-p196673843.html?spid=196673874,26,,,quannu
{Có NowShip nha} QUẦN NGỐ ĐÙI MÀU TRƠN - BIKER THÁI LAN 2 SIZE - LEGGING TRÊN GỐI RAINBOW,90.000₫,https://tiki.vn/quan-ngo-dui-mau-tron-biker-thai-lan-2-size-legging-tren-goi-rainbow-p108566522.html?spid=108566629,27,,Đã bán 20,quannu
Quần Jogger thun len tăm bo gấu kiểu dáng thể thao,48.000₫,https://tiki.vn/quan-jogger-thun-len-tam-bo-gau-kieu-dang-the-thao-p72820315.html?spid=135557900,28,,,quannu
El Valor - Quần Dài Nữ Ống Suông Vải Linen đi chơi đi làm dễ mặc dễ phối vải cực mát chất vải mềm,450.000₫,https://tiki.vn/el-valor-quan-dai-nu-ong-suong-vai-linen-di-choi-di-lam-de-mac-de-phoi-vai-cuc-mat-chat-vai-mem-p157413330.html?spid=157413348,29,,,quannu
quần nữ khóa thật chun sau.chất đui ống rộng suông,69.000₫,https://tiki.vn/quan-nu-khoa-that-chun-sau-chat-dui-ong-rong-suong-p259548137.html?spid=259548286,30,,,quannu
,,https://tiki.vn/quan-dui-nam-nu-quan-short-nu-thun-quan-unisex-p253143015.html?spid=253143024,31,,,quannu
Quần Tây Nữ Thời Trang HNOSS Ống Rộng Nắp Túi Giả HNQDA022,249.000₫,https://tiki.vn/quan-tay-nu-thoi-trang-hnoss-ong-rong-nap-tui-gia-hnqda022-p205825783.html?spid=205825821,32,,Đã bán 1,quannu
Quần ngắn thể thao nữ New Balance Impact Run 2In1 Short - WS21270_BK,1.050.000₫,https://tiki.vn/quan-ngan-the-thao-nu-new-balance-impact-run-2in1-short-ws21270_bk-p271268441.html?spid=271268450,33,,,quannu
"Quần Legging lửng nữ siêu tôn dáng giúp nâng mông , co giãn 4 chiều thoải mái, chất liệu thoáng mát , có đủ size lựa chọn",44.000₫,https://tiki.vn/quan-legging-nu-legging-dui-lung-ngan-nu-sieu-ton-dang-quan-legging-lung-dui-the-thao-p174621819.html?spid=174621870,34,,Đã bán 61,quannu
QUẦN JEANS BAGGY NỮ LƯNG CAO TRƠN FORM CHUẨN – QUẦN BÒ NGỐ BASIC,174.000,https://tiki.vn/quan-jeans-baggy-nu-lung-cao-tron-form-chuan-quan-bo-ngo-basic-p69030145.html?spid=76299246,35,,,quannu
,,https://tiki.vn/quan-short-thoi-trang-nu-hnoss-ong-rong-hnqsh009-p191801004.html?spid=191801008,36,,,quannu
Quần tây nữ lưng thun túi đứng,295.000₫,https://tiki.vn/quan-tay-nu-lung-thun-tui-dung-p78633113.html?spid=109223359,37,,,quannu
QUẦN JEANS TRẮNG XUÔNG MERCIDENIM ( koreastyle),400.000₫,https://tiki.vn/quan-jeans-trang-xuong-mercidenim-koreastyle-p143330095.html?spid=143330135,38,,,quannu
Quần Jeans Đen Ống Loe (kèm clip) màu đen dành cho nữ,150.000₫,https://tiki.vn/quan-jeans-den-ong-loe-kem-clip-mau-den-danh-cho-nu-p152189158.html?spid=152189165,39,,,quannu
Quần baggy Kaki đẹp. Quần Kaki nam nữ,69.000₫,https://tiki.vn/quan-baggy-kaki-dep-quan-kaki-nam-nu-p249230424.html?spid=249230445,40,,,quannu
