title,price,link_item,index,discount,sales,category
Quần jean nữ ống suông OR126,235.000₫,https://tiki.vn/quan-jean-nu-ong-suong-or126-p125835492.html?spid=125835638,1,,,quannu
Quần suông ống rộng khuyết eo tôn dáng màu xanh và đen dành cho nữ - Hàng chuẩn QCCC,249.000₫,https://tiki.vn/quan-suong-ong-rong-khuyet-eo-ton-dang-mau-xanh-va-den-danh-cho-nu-hang-chuan-qccc-p157482965.html?spid=157482979,2,-70%,,quannu
Quần ống rộng nữ chất thun tăm 4 màu quần sớ ống xuông nữ quần ống sớ nữ Banamo Fashion,83.000₫,https://tiki.vn/quan-ong-rong-nu-chat-thun-tam-4-mau-quan-so-ong-xuong-nu-quan-ong-so-nu-banamo-fashion-p110897275.html?spid=110897323,3,,Đã bán 1,quannu
Quần Ống Loe Nữ DOMEI Màu Đen,149.000,https://tiki.vn/quan-ong-loe-nu-domei-mau-den-p185226364.html?spid=185226380,4,,,quannu
,,https://tiki.vn/quan-bom-jogger-len-tam-the-thao-5-mau-cho-nu-hang-chuan-qccc-p157482798.html?spid=157482816,5,,,quannu
Quần JOGGER nỉ bom tổ ong siêu hot siêu xịn vải không bai xù thời trang Banamo Fashion 294,114.000₫,https://tiki.vn/quan-jogger-ni-bom-to-ong-sieu-hot-sieu-xin-vai-khong-bai-xu-thoi-trang-banamo-fashion-294-p152874477.html?spid=152874522,6,,Đã bán 2,quannu
Quần legging Qc siêu dày dặn bên trong có 1 lớp lông ạ,75.000₫,https://tiki.vn/quan-legging-qc-sieu-day-dan-ben-trong-co-1-lop-long-a-p135459665.html?spid=135459668,7,,,quannu
( HÀNG SẴN) Quần Lông Cừu Thời Trang Mùa Đông Cho Mẹ AQ13 - Hàng Quảng Châu Cao Cấp,255.000₫,https://tiki.vn/hang-san-quan-lung-cao-long-cuu-thoi-trang-mua-dong-cho-me-aq13-hang-quang-chau-cao-cap-p270821187.html?spid=270821195,8,,,quannu
Quần Thổ Cẩm Boho Vintage,409.000,https://tiki.vn/quan-tho-cam-boho-vintage-p98640306.html?spid=98640331,9,,Đã bán 1,quannu
,,https://tiki.vn/quan-vai-nu-cong-so-dang-baggy-ong-dung-quan-tay-nu-lung-cao-p168075959.html?spid=168075965,10,,,quannu
"Quần Baggy Nữ Công Sở Cạp Cao Cúc Chéo LUPERI Không Xù Vải, Cắn Chỉ, Chất Đũi Xước Cao Cấp LFQD2103",465.000₫,https://tiki.vn/quan-baggy-nu-cong-so-cap-cao-cuc-cheo-luperi-khong-xu-vai-can-chi-chat-dui-xuoc-cao-cap-lfqd2103-p168310985.html?spid=168311006,11,,,quannu
Quần Ống loe Đen Trắng cạp Cao dáng dài Quá Gót Gấu Thường CT JEANS,588.000,https://tiki.vn/quan-ong-loe-den-trang-cap-cao-dang-dai-qua-got-gau-thuong-ct-jeans-p180866580.html?spid=180866630,12,,,quannu
,,https://tiki.vn/quan-jean-nu-boyfriend-baggy-xuoc-9-tac-co-gian-ct-jeans-p180866638.html?spid=180866665,13,,,quannu
Quần jean nữ boyfriend baggy đen trắng trơn co giãn CT JEANS,382.500₫,https://tiki.vn/quan-jean-nu-boyfriend-baggy-den-trang-tron-co-gian-ct-jeans-p180867382.html?spid=180867441,14,,,quannu
"Quần tây, quần âu suông nữ công sở Haint Boutique QT26",149.000₫,https://tiki.vn/quan-tay-quan-au-suong-nu-cong-so-haint-boutique-qt26-p50691053.html?spid=56422564,15,,Đã bán 16,quannu
Áo nỉ lót lông cừu siêu ấm nam nữ mặc đều đẹp 398,239.000₫,https://tiki.vn/ao-ni-lot-long-cuu-sieu-am-nam-nu-mac-deu-dep-398-p192426422.html?spid=192426426,16,,,quannu
Quần nữ mặc nhà vải cotton kẻ sọc ngang phong cách (C331),198.000,https://tiki.vn/quan-nu-mac-nha-vai-cotton-ke-soc-ngang-phong-cach-c331-p138896720.html?spid=138896722,17,,,quannu
,,https://tiki.vn/quan-bo-big-size-dang-dai-theu-co-trang-de-thuong-qbd23-p70192463.html?spid=70192465,18,,,quannu
Quần jean ống rộng Unisex QJ004 - Quần jeans ống suông lưng cao qua rốn - Không dãn Xanh trơn,235.000₫,https://tiki.vn/quan-jean-ong-rong-unisex-qj004-quan-jeans-ong-suong-lung-cao-qua-ron-khong-dan-xanh-tron-p155179979.html?spid=155180017,19,,,quannu
Quần Kẻ Nữ - Quần Caro Lưng Cao Dáng Rộng Ống Suông dây kéo trước lưng thun sau ulzzang bigsize MS 04,109.000₫,https://tiki.vn/quan-ke-nu-quan-caro-lung-cao-dang-rong-ong-suong-day-keo-truoc-lung-thun-sau-ulzzang-bigsize-ms-04-p94654536.html?spid=163476256,20,,,quannu
Quần đũi lửng ống rộng(size 40-65kg),115.500₫,https://tiki.vn/quan-dui-lung-ong-rong-size-40-65kg-p154201115.html?spid=154201161,21,,,quannu
Quần dài nữ Baggy kẻ sọc caro lưng thun,104.500₫,https://tiki.vn/quan-dai-nu-baggy-ke-soc-caro-lung-thun-p92489126.html?spid=124054671,22,,Đã bán 24,quannu
"Quần Thun Dài Phối Sọc Ống Rộng, Jogger Line Ống Suông Ulzzang Unisex Dáng Rộng - MM",119.900₫,https://tiki.vn/quan-thun-dai-phoi-soc-ong-rong-jogger-line-ong-suong-ulzzang-unisex-dang-rong-mm-p174510660.html?spid=174510668,23,,Đã bán 3,quannu
Quần ỐNG SUÔNG KAKI Unisex (FORM TRÊN MẮT CÁ CHÂN),89.000₫,https://tiki.vn/quan-ong-suong-kaki-unisex-form-tren-mat-ca-chan-1hitshop-p190808249.html?spid=190808284,24,,,quannu
Quần jeans nữ 9 tấc ống loe màu sáng,229.000,https://tiki.vn/qua-n-jeans-nu-9-ta-c-o-ng-loe-ma-u-sa-ng-p252713047.html?spid=252713123,25,,Đã bán 1,quannu
,,https://tiki.vn/quan-short-jean-nu-quan-bo-nu-ngan-mau-xanh-lung-cao-ca-tinh-cao-cap-2021-murad_fashion-jn5013-p103977262.html?spid=247330988,26,,,quannu
Quần Jeans Nữ Ống Loe Dài Màu Đen Lưng Cao Co Giãn,249.000₫,https://tiki.vn/quan-jeans-nu-ong-loe-dai-mau-den-lung-cao-co-gian-p208771472.html?spid=208771494,27,,,quannu
Quần Tây ôm cotton co giãn 4 chiều,199.000₫,https://tiki.vn/quan-tay-om-cotton-co-gian-4-chieu-p17676766.html?spid=17676776,28,,Đã bán 2,quannu
Quần Short Nữ cao cấp Dn20040708,58.000₫,https://tiki.vn/quan-short-nu-cao-cap-dn20040708-p52232314.html?spid=52232316,29,,Đã bán 20,quannu
Quần Jeans Nữ Ôm Dáng,185.000,https://tiki.vn/quan-jeans-nu-om-dang-p42688541.html?spid=42688543,30,,,quannu
,,https://tiki.vn/quan-baggy-quan-tay-cong-so-cao-cap-gau-lech-vai-tuyet-mua-chuan-cao-cap-p36551594.html?spid=269843530,31,,,quannu
Quần Jogger Caro Vàng,550.000₫,https://tiki.vn/quan-jogger-caro-vang-p31589335.html?spid=31589342,32,,,quannu
Quần làm cong mông tạo dáng - Bộ 2 cái đen và kem Pants curl the buttocks,313.200₫,https://tiki.vn/quan-lam-cong-mong-tao-dang-bo-2-cai-den-va-kem-pants-curl-the-buttocks-p148694651.html?spid=148694654,33,,,quannu
quần sooc nữ đùi chất đũi mát,31.000₫,https://tiki.vn/quan-sooc-nu-dui-chat-dui-mat-p93049629.html?spid=114993863,34,,Đã bán 6,quannu
"Quần tất lót lông siêu dày, ấm dành cho bạn nữ",59.000₫,https://tiki.vn/quan-tat-lot-long-sieu-day-am-danh-cho-ban-nu-p105533649.html?spid=105533663,35,,,quannu
,,https://tiki.vn/quan-legging-meo-lot-long-am-ap-mem-nhe-p72871993.html?spid=92498761,36,,,quannu
Sườn Xám Cổ Tàu Trung Hoa Lụa Ánh Kim Tone Đỏ Sang Trọng Mia Dress,490.000₫,https://tiki.vn/suon-xam-co-tau-trung-hoa-lua-anh-kim-tone-do-sang-trong-mia-dress-p215535626.html?spid=215535630,37,,,quannu
quần baggy đũi cạp chun nhiều màu,79.000₫,https://tiki.vn/quan-baggy-dui-cap-chun-nhieu-mau-p93051168.html?spid=113249410,38,,Đã bán 8,quannu
Quần Legging Vicci Cao Cấp Màu Nhũ Cạp Cao 11P,135.000₫,https://tiki.vn/quan-legging-vicci-cao-cap-mau-nhu-cap-cao-11p-p12710239.html?spid=12710243,39,,Đã bán 12,quannu
OLV - Quần Flare Jeans in Black,520.000,https://tiki.vn/olv-quan-flare-jeans-in-black-p253671413.html?spid=253671415,40,,,quannu
