title,price,link_item,index,discount,sales,category
Quần Dài Unisex Sọc 3 LINE COLOR Chất Thun - Quần Dài Thể Thao Nam Nữ Cực Xinh,76.000₫,https://tiki.vn/quan-dai-unisex-soc-3-line-color-chat-thun-quan-dai-the-thao-nam-nu-cuc-xinh-p103058637.html?spid=162350527,1,-46%,Đã bán 1,quannu
Quần Linen Dáng Suông Trẻ Trung,159.000₫,https://tiki.vn/quan-linen-dang-suong-tre-trung-p195443997.html?spid=175785759,2,-12%,,quannu
Quần Ngố Jean Dáng Suông Ôm,149.000₫,https://tiki.vn/quan-ngo-jean-dang-suong-om-p176000760.html?spid=176000761,3,-12%,,quannu
Quần âu nữ thời trang công sở thiết kế chất vải cao cấp,179.000,https://tiki.vn/quan-au-nu-thoi-trang-cong-so-thiet-ke-chat-vai-cao-cap-p177018400.html?spid=177018401,4,-12%,,quannu
,,https://tiki.vn/quan-au-nu-dang-suong-ong-loe-nhe-chat-lieu-thun-cao-cap-ton-dang-haling-p177792297.html?spid=177792298,5,-52%,,quannu
Quần satin chạy chỉ ánh vàng sang trọng,1.000.000₫,https://tiki.vn/quan-satin-chay-chi-anh-vang-sang-trong-p262015827.html?spid=262015829,6,,,quannu
Quần legging nữ dáng dài cạp cao C’EST TOI,209.000₫,https://tiki.vn/quan-legging-nu-dang-dai-cap-cao-c-est-toi-p192297805.html?spid=192297806,7,-25%,,quannu
Quần đũi BAGGY nữ thái lưng thun cạp chun cao dáng đứng Vải đũi có BIG SIZE (hàng loại 1) - QN10,65.000₫,https://tiki.vn/quan-dui-baggy-nu-thai-lung-thun-cap-chun-cao-dang-dung-vai-dui-co-big-size-hang-loai-1-quan-ysl-qn10-p171516007.html?spid=171516046,8,,,quannu
Quần Short Lưng Cao Vải Nhung Thời Trang Cá Tính Cho Nữ (không kèm thắt lưng),50.000₫,https://tiki.vn/quan-short-lung-cao-vai-nhung-thoi-trang-ca-tinh-cho-nu-khong-kem-that-lung-p163574291.html?spid=163574303,9,,,quannu
,,https://tiki.vn/quan-dai-gym-nu-p106856051.html?spid=106856217,10,,,quannu
Quần jeans skinny nữ màu đen lưng cao chính hãng,370.000₫,https://tiki.vn/quan-jeans-skinny-nu-mau-den-lung-cao-chinh-hang-p51074268.html?spid=51074274,11,,Đã bán 20,quannu
Quần Legging lửng thun giả Jeans cao cấp,99.000₫,https://tiki.vn/quan-legging-lung-thun-gia-jeans-cao-cap-p38325014.html?spid=83204449,12,,,quannu
,,https://tiki.vn/quan-baggy-nu-lung-thun-vai-dui-thiet-ke-doc-dao-00115-p19751389.html?spid=27560367,13,,,quannu
Quần kẻ CARO ỐNG RỘNG có dây CHUN ỐNG cực đẹp,128.000₫,https://tiki.vn/quan-ke-caro-ong-rong-co-day-chun-ong-cuc-dep-p98028119.html?spid=169278005,14,,,quannu
(Big size) quần giả váy vạt chéo G004C,140.000₫,https://tiki.vn/big-size-quan-gia-vay-vat-cheo-g004c-p146773067.html?spid=146773088,15,,Đã bán 2,quannu
(BIG SIZE) Quần sooc dạ đẹp cạp cao,150.000₫,https://tiki.vn/big-size-quan-sooc-da-dep-cap-cao-p146779936.html?spid=146779944,16,,,quannu
Quần Baggy Kẻ Caro Lửng Nữ Cạp Thun Mát Mẻ,95.000₫,https://tiki.vn/quan-baggy-ke-caro-lung-nu-cap-thun-mat-me-p57693857.html?spid=136474024,17,,Đã bán 2,quannu
,,https://tiki.vn/quan-kaki-lung-cao-co-gian-p116997380.html?spid=116997756,18,,,quannu
"Quần Cao Cấp Nữ Tập Gym, Yoga , Aerobic siêu nhẹ ,siêu co giãn - Q108",829.000₫,https://tiki.vn/quan-cao-cap-nu-tap-gym-yoga-aerobic-sieu-nhe-sieu-co-gian-q108-p146935528.html?spid=146935538,19,,,quannu
QUẦN BAGGY VẢI TÔN DÁNG ỐNG ĐỨNG,112.000₫,https://tiki.vn/quan-baggy-vai-ton-dang-ong-dung-p25456592.html?spid=57938593,20,,,quannu
"Quần short nữ, Quần đùi nữ chất đũi cạp chun Đũi Việt Q36",87.000₫,https://tiki.vn/quan-short-nu-quan-dui-nu-chat-dui-cap-chun-dui-viet-q36-p172471691.html?spid=172471705,21,,,quannu
Quần tây ống côn công sở nữ Qt22,131.000₫,https://tiki.vn/quan-tay-ong-con-cong-so-nu-qt22-p48887149.html?spid=57269152,22,,Đã bán 4,quannu
"Quần ống rộng nữ 1 ly chất vải Linen Premium sang trọng ArcticHunter (Xanh than, Xanh rêu)",250.000₫,https://tiki.vn/quan-ong-rong-nu-1-ly-chat-vai-linen-premium-sang-trong-arctichunter-xanh-than-xanh-reu-p203883548.html?spid=203883560,23,,Đã bán 1,quannu
Quần jogger nữ Hiền Trần BOUTIQUE dáng dài cạp chun dây buộc kiểu dáng trơn basic,167.000₫,https://tiki.vn/quan-jogger-nu-hien-tran-boutique-dang-dai-cap-chun-day-buoc-kieu-dang-tron-basic-p99220584.html?spid=99220638,24,,Đã bán 1,quannu
"QUẦN LỬNG LEGGING NỮ PHỐI LƯỚI ĐA NĂNG TẬP THỂ THAO, ĐI CHƠI",112.000,https://tiki.vn/quan-lung-legging-nu-phoi-luoi-da-nang-tap-the-thao-di-choi-p272019393.html?spid=272019413,25,,,quannu
,,https://tiki.vn/qua-n-ke-nu-o-ng-ro-ng-p47261238.html?spid=78011769,26,,,quannu
Quần Dài Không Li De Leah - Xanh Navy (Size,750.000₫,https://tiki.vn/quan-dai-khong-li-de-leah-xanh-navy-p5501159.html?spid=5501163,27,,Đã bán 5,quannu
Quần Baggy Nữ Công Sở Vải Tuyết Mưa Dáng Đẹp,74.000₫,https://tiki.vn/quan-baggy-nu-cong-so-vai-tuyet-mua-dang-dep-p68680419.html?spid=114468019,28,,Đã bán 25,quannu
"Quần Dài Jogger Nữ 2 Sọc Trắng Thời Trang Đi Chơi,Đi Học, Tập Gym,Yoga,Zumba,Nhảy,Aerobic",113.000₫,https://tiki.vn/quan-dai-jogger-nu-2-soc-trang-thoi-trang-di-choi-di-hoc-tap-gym-yoga-zumba-nhay-aerobic-p59409731.html?spid=59409753,29,,Đã bán 23,quannu
Quần baggy nữ phối khuyên dây da Hiền Trần BOUTIQUE chất liệu Umi co giãn cao cấp,142.000,https://tiki.vn/quan-baggy-nu-phoi-khuyen-day-da-hien-tran-boutique-chat-lieu-umi-co-gian-cao-cap-p132097453.html?spid=132097461,30,,Đã bán 5,quannu
,,https://tiki.vn/quan-baggy-nu-hien-tran-boutique-lung-cap-cao-dai-roi-do-cong-so-di-hoc-form-dep-mau-den-be-p176813547.html?spid=176813561,31,,,quannu
Quần short nữ cạp khóa chất đũi siêu mát quần sooc đũi khuy trước chun sau 922,62.000₫,https://tiki.vn/quan-short-nu-cap-khoa-chat-dui-sieu-mat-quan-sooc-dui-khuy-truoc-chun-sau-922-p270246182.html?spid=270246208,32,,,quannu
Quần short thun ống rộng dáng unisex nam nữ cá tính có bigsize,75.000₫,https://tiki.vn/quan-short-thun-ong-rong-dang-unisex-nam-nu-ca-tinh-co-bigsize-p253143246.html?spid=253143260,33,,,quannu
Quần yếm short kaki màu hot trend có size từ 40 đén 55kg,155.000₫,https://tiki.vn/quan-yem-short-kaki-mau-hot-trend-co-size-tu-40-den-55kg-p263403573.html?spid=263403616,34,,Đã bán 1,quannu
Quần Short Nữ Thời Trang JUNO Vạt Chéo JNQSH019,274.000,https://tiki.vn/quan-short-nu-thoi-trang-juno-vat-cheo-jnqsh019-p270660163.html?spid=270660169,35,,,quannu
,,https://tiki.vn/quan-nu-kaki-co-gian-p118164907.html?spid=118164940,36,,,quannu
OLV - Quần Bonita Shorts In Red,420.000₫,https://tiki.vn/olv-quan-bonita-shorts-in-red-p210452744.html?spid=210452746,37,,,quannu
Bộ Áo Thun Quần Short Nữ Thêu Chữ N Vải Thun Gân Dáng Rộng,198.000₫,https://tiki.vn/bo-ao-thun-quan-short-nu-theu-chu-n-vai-thun-gan-dang-rong-p268905373.html?spid=268905388,38,,,quannu
Quần Jeans Nữ Skinny Loang Cạp Cao Dáng Ôm Trơn - XANH,258.000₫,https://tiki.vn/quan-jeans-nu-skinny-loang-cap-cao-dang-om-tron-p270048350.html?spid=270048354,39,,,quannu
Quần short jean nữ lưng cao ngang gối Aaa Jeans,349.000,https://tiki.vn/quan-short-jean-nu-lung-cao-ngang-goi-aaa-jeans-p202640107.html?spid=202640147,40,,,quannu
