title,price,link_item,index,discount,sales,category
"Tất Len Bốt Cho Bé Gái, Tất Len Cao Cổ Phong Cách Hàn Quốc Cho Bé Gái",21.000₫,https://tiki.vn/tat-len-bot-cho-be-gai-tat-len-cao-co-phong-cach-han-quoc-cho-be-gai-p101044184.html?spid=272554302,1,-20%,,thoitrangmevabe
Balô kéo bé trai( sẵn hàng ),541.200₫,https://tiki.vn/balo-keo-be-trai-san-hang-p84914530.html?spid=84914610,2,-50%,Đã bán 5,thoitrangmevabe
Set 5 đôi tất trẻ em xuất Hàn cao cấp ngựa Pony cho bé (1-12 tuổi),65.000₫,https://tiki.vn/set-5-doi-tat-tre-em-xuat-han-cao-cap-ngua-pony-cho-be-1-12-tuoi-p178724342.html?spid=178724353,3,-6%,Đã bán 22,thoitrangmevabe
ĐỒ ĐI BIỂN ĐỦ SIZE TỪ 7 ĐẾN 100KG,115.700₫,https://tiki.vn/do-di-bien-du-size-tu-7-den-100kg-p169570158.html?spid=169570598,4,-44%,Đã bán 1,thoitrangmevabe
"Áo phông dài tay, áo thun unisex cho bé trai gái , chất liệu cotton mềm mại màu trắng, đen, cam, rêu",99.000₫,https://tiki.vn/ao-phong-dai-tay-ao-thun-unisex-cho-be-trai-gai-chat-lieu-cotton-mem-mai-mau-trang-den-cam-reu-p213038654.html?spid=213038678,5,-12%,,thoitrangmevabe
Áo len bé gái cực xinh ạ,155.000₫,https://tiki.vn/ao-len-be-gai-cuc-xinh-a-p108525535.html?spid=108526092,6,-7%,Đã bán 1,thoitrangmevabe
Vớ tất cổ cao bé gái 4-5 tuổi Basic ELLE EBK01,25.000₫,https://tiki.vn/vo-tat-co-cao-be-gai-4-5-tuoi-basic-elle-ebk01-p73313255.html?spid=73313261,7,-5%,Đã bán 2,thoitrangmevabe
QUẦN JEAN DÀI CHO BÉ TRAI SIZE TỪ 29-62kg MỀM MỊN CO GIÃN - QT253,258.700₫,https://tiki.vn/quan-jean-dai-cho-be-trai-size-tu-29-62kg-mem-min-co-gian-qt253-p94562273.html?spid=94562691,8,-20%,,thoitrangmevabe
Mũ lưỡi trai hình gấu dễ thương cho bé | Mũ trẻ em,89.000₫,https://tiki.vn/mu-luoi-trai-hinh-gau-de-thuong-cho-be-mu-tre-em-p156273360.html?spid=156273364,9,-11%,Đã bán 5,thoitrangmevabe
Quần áo trẻ em (combo 5bộ quần áo sơ sinh quần áo trẻ sơ sinh như hình),118.000₫,https://tiki.vn/quan-ao-tre-em-combo-5bo-quan-ao-so-sinh-quan-ao-tre-so-sinh-nhu-hinh-p114682368.html?spid=114682389,10,,Đã bán 182,thoitrangmevabe
Dobikids - Combo 2c Áo thun cho bé gái thun cotton 4 chiều loại 1 size bé 09-28kg,181.000₫,https://tiki.vn/dobikids-combo-2c-ao-thun-cho-be-gai-thun-cotton-4-chieu-loai-1-size-be-09-28kg-p103518007.html?spid=103518049,11,,Đã bán 1,thoitrangmevabe
"Váy tutu màu trắng - Trắng,1-3 tháng(3-5kg)",110.000₫,https://tiki.vn/vay-tutu-mau-trang-p122374723.html?spid=122375214,12,,Đã bán 1,thoitrangmevabe
"Sandal Dép Quai Hậu Tập Đi Cho Bé Gái, Nơ Đính Đá Từ 9 Tháng Đến 3 Tuổi Mã A9",105.000₫,https://tiki.vn/sandal-dep-quai-hau-tap-di-cho-be-gai-no-dinh-da-tu-9-thang-den-3-tuoi-ma-a9-p249381500.html?spid=249381530,13,,Đã bán 1,thoitrangmevabe
Balo đeo chống gù học sinh tiểu học Hasun HS805,248.000₫,https://tiki.vn/balo-deo-chong-gu-hoc-sinh-tieu-hoc-hasun-hs805-p20339457.html?spid=25960151,14,,Đã bán 11,thoitrangmevabe
Set kẹp tóc bé gái ngộ nghĩnh nhiều hình 14 chi tiết PKT0012B,28.000₫,https://tiki.vn/set-kep-toc-be-gai-ngo-nghinh-nhieu-hinh-14-chi-tiet-pkt0012b-p98023002.html?spid=108908107,15,,Đã bán 30,thoitrangmevabe
Trang Phục Hóa Trang Phù Thủy Cosplay Halloween,180.000₫,https://tiki.vn/trang-phuc-hoa-trang-phu-thuy-cosplay-halloween-p272903142.html?spid=272903146,16,,,thoitrangmevabe
Quần legging bé gái quần dài cho bé thun co giãn 4 chiều mềm mịn dày co giãn từ 8-20kg,49.500₫,https://tiki.vn/quan-legging-be-gai-thun-co-gian-4-chieu-phoi-ren-tu-8-20kg-p103520193.html?spid=103521643,17,,Đã bán 23,thoitrangmevabe
Giày lười trẻ em Crocs FW Classic Clog Toddler Glitter Shimmer/Multi - 206992-0ZT,448.000₫,https://tiki.vn/giay-luoi-tre-em-crocs-fw-classic-clog-toddler-glitter-shimmer-multi-206992-0zt-p199200731.html?spid=199200739,18,,,thoitrangmevabe
Đồ bơi bé gái liền chân váy,180.000₫,https://tiki.vn/do-boi-be-gai-lien-chan-vay-p167437409.html?spid=167437427,19,,Đã bán 28,thoitrangmevabe
áo khoác gió bé trai size đại áo 2 lớp thời trang từ 5-14 tuổi 0188,110.000₫,https://tiki.vn/ao-khoac-gio-be-trai-size-dai-ao-2-lop-thoi-trang-tu-5-14-tuoi-0188-p157164244.html?spid=157164316,20,,Đã bán 14,thoitrangmevabe
Vương miện cài tóc công chúa siêu xinh cho bé gái,25.000₫,https://tiki.vn/vuong-mien-cai-toc-cong-chua-sieu-xinh-cho-be-gai-p84778783.html?spid=84778789,21,,Đã bán 68,thoitrangmevabe
Bộ 42 Món Đồ Dùng Dành Cho Bé Sơ Sinh Cao Cấp 0 - 6 tháng( 5 áo tay ngan + 5 khăn sữa + 2 nón + 10 cặp bao tay + 10 cặp bao chân + 10 tã dán đóng tã),175.780₫,https://tiki.vn/bo-42-mon-do-dung-danh-cho-be-so-sinh-cao-cap-0-6-thang-5-ao-5-khan-sua-2-non-10-cap-bao-tay-10-cap-bao-chan-10-ta-dan-dong-ta-p23040697.html?spid=75599785,22,,Đã bán 38,thoitrangmevabe
Đồ bộ bé trai và đồ bộ bé gái QATE876 QATE892 - Quần áo trẻ em cộc tay,45.000₫,https://tiki.vn/do-bo-be-trai-va-do-bo-be-gai-qate876-qate892-quan-ao-tre-em-coc-tay-p170737287.html?spid=170737305,23,,Đã bán 13,thoitrangmevabe
Giày thể thao công chúa Elsa cho bé gái - giày đi học bé gái - BG222,175.000₫,https://tiki.vn/giay-the-thao-cong-chua-elsa-cho-be-gai-giay-di-hoc-be-gai-bg222-p172001201.html?spid=172001219,24,,Đã bán 17,thoitrangmevabe
Váy đầm công chúa bé gái dài sát nách màu trắng DBG084,650.000₫,https://tiki.vn/vay-dam-cong-chua-be-gai-dai-sat-nach-mau-trang-dbg084-p176401664.html?spid=176401688,25,,Đã bán 9,thoitrangmevabe
Giày Thể Thao Biti's Bé Gái DSG004900TRG,418.000₫,https://tiki.vn/giay-the-thao-biti-s-be-gai-dsg004900trg-p212110160.html?spid=212110166,26,,Đã bán 5,thoitrangmevabe
Giày thể thao bé trai xanh đen đỏ xuất Âu siêu nhẹ kháng khuẩn cao cấp năng động và cá tính phù hợp cho trẻ em 3 - 12 tuổi đi học chạy bộ chơi bóng chuyền bóng rổ NHÍM SHOP GH21,365.000₫,https://tiki.vn/giay-the-thao-be-trai-xanh-den-do-xuat-au-sieu-nhe-khang-khuan-cao-cap-nang-dong-va-ca-tinh-phu-hop-cho-tre-em-3-12-tuoi-di-hoc-chay-bo-choi-bong-chuyen-bong-ro-nhim-shop-gh21-p179712364.html?spid=179712379,27,,Đã bán 13,thoitrangmevabe
Khăn ống cotton giữ ấm họa tiết cho bé trai bé gái,50.000₫,https://tiki.vn/khan-ong-cotton-giu-am-hoa-tiet-cho-be-trai-be-gai-p137831470.html?spid=137831474,28,,Đã bán 24,thoitrangmevabe
áo khoác bé trai bé gái áo dù 2 lớp size đại Hàn Quốc cute từ 5 đến 14 tuổi D502,110.000₫,https://tiki.vn/ao-khoac-be-trai-be-gai-ao-du-2-lop-size-dai-han-quoc-cute-tu-5-den-14-tuoi-d502-p157164195.html?spid=157164229,29,,Đã bán 22,thoitrangmevabe
Set 50 Món Đồ Sơ Sinh Cho Bé (Gồm 10 Tả Dán MINH HOÀNG + 05 áo BOSINI + 05 Khăn sữa 04 Lớp BABY JERRY+ 5 tấm lót PHÚ MỸ HƯNG + 10 cặp bao tay bao chân + 5 nón),232.500₫,https://tiki.vn/set-50-mon-do-so-sinh-cho-be-p25106526.html?spid=68621261,30,,Đã bán 136,thoitrangmevabe
Đồng Hồ Trẻ Em Hình Thú,149.000₫,https://tiki.vn/dong-ho-tre-em-hinh-thu-p6303973.html?spid=6303989,31,,Đã bán 259,thoitrangmevabe
đồng hồ bé gái có đèn,60.000₫,https://tiki.vn/dong-ho-be-gai-co-den-p141567690.html?spid=141567700,32,,Đã bán 21,thoitrangmevabe
Giày Chạy Bé Gái Biti's BSG002700TIM (Tím),540.000₫,https://tiki.vn/giay-chay-be-gai-biti-s-bsg002700tim-tim-p271478815.html?spid=271478827,33,,Đã bán 1,thoitrangmevabe
Đồ Bộ Bầu Và Sau Sinh Ngắn Tay Chất Liệu Đũi Hàn Cao Cấp Nhiều Màu Hoa Nhí Siêu Mát Nhẹ Tênh ( Kèm Ảnh Thật ),290.000₫,https://tiki.vn/do-bo-bau-va-sau-sinh-ngan-tay-chat-lieu-dui-han-cao-cap-nhieu-mau-hoa-nhi-sieu-mat-nhe-tenh-kem-anh-that-p262049575.html?spid=262057170,34,,Đã bán 5,thoitrangmevabe
Balo chống gù cho bé đi học cặp sách form hộp cao cấp an toàn BF2357,425.000₫,https://tiki.vn/balo-chong-gu-cho-be-di-hoc-cap-sach-form-hop-cao-cap-an-toan-bf2357-p196148663.html?spid=196148667,35,,Đã bán 6,thoitrangmevabe
Áo dài cách tân bé trai,123.500₫,https://tiki.vn/ao-dai-cach-tan-be-trai-p156652383.html?spid=156652397,36,,Đã bán 2,thoitrangmevabe
Giày Thể Thao Bé Gái Biti's Hunter DSGH00300TRG (Trắng),272.000₫,https://tiki.vn/giay-the-thao-be-gai-biti-s-hunter-dsgh00300trg-trang-p110360703.html?spid=116909924,37,,Đã bán 6,thoitrangmevabe
Giày thể thao cho bé trai và bé gái T11 đen,230.000₫,https://tiki.vn/giay-the-thao-cho-be-trai-va-be-gai-t11-den-p16224972.html?spid=16224974,38,,Đã bán 70,thoitrangmevabe
"ÁO VEST BÉ TRAI CATRIO PCT18921/15 là áo đờ mi trẻ em từ 2 tuổi (12kg) đến 10 tuổi (34kg) thuộc BST quần áo complet & veston trẻ em CATRIO mùa cưới hỏi, lễ tết, sinh nhật",579.000₫,https://tiki.vn/ao-vest-be-trai-catrio-pct18921-15-la-ao-do-mi-tre-em-tu-2-tuoi-12kg-den-7-tuoi-28kg-thuoc-bst-quan-ao-complet-veston-tre-em-catrio-mua-cuoi-hoi-le-tet-sinh-nhat-p140174663.html?spid=140174665,39,,Đã bán 1,thoitrangmevabe
"Mũ len ngôi sao kèm khăn ống quàng cổ cho bé trai và bé gái từ 2 - 8 tuổi , 2 lớp dày dặn giữ ấm vùng đầu , vùng tai và còn có khăn bảo vệ cả cổ bé trong thời tiết giá lạnh của mùa đông ",115.000₫,https://tiki.vn/mu-len-ngoi-sao-kem-khan-ong-quang-co-cho-be-trai-va-be-gai-tu-2-8-tuoi-2-lop-day-dan-giu-am-vung-dau-vung-tai-va-con-co-khan-bao-ve-ca-co-be-trong-thoi-tiet-gia-lanh-cua-mua-dong-p271654449.html?spid=271654450,40,,,thoitrangmevabe
