title,price,link_item,index,discount,sales,category
Áo thun nam tay dài thời trang Hàn Quốc MT-01,75.000₫,https://tiki.vn/ao-thun-nam-tay-dai-thoi-trang-han-quoc-mt-01-p14838760.html?spid=56105427,1,-26%,Đã bán 114,aothun
Áo phông nam nữ unisex tay lỡ thun form rộng teen cổ tròn oversize cotton giá rẻ basic đen trắng tee pull MAGMANS,55.000₫,https://tiki.vn/ao-phong-nam-nu-unisex-tay-lo-thun-form-rong-teen-co-tron-oversize-cotton-gia-re-basic-den-trang-tee-pull-magmans-p117919594.html?spid=193110742,2,-50%,Đã bán 6,aothun
Áo Thun DirtyCoins Internet Friends Relaxed T-shirt - Black,289.000₫,https://tiki.vn/a-o-thun-dirtycoins-internet-friends-relaxed-t-shirt-black-p271760882.html?spid=271760890,3,,Đã bán 3,aothun
Áo Polo Nam Viền Cổ thanh lịch vải POLY CÁ SẤU cao cấp thoáng mát chuẩn form - SU 259,140.000,https://tiki.vn/ao-polo-nam-vien-co-thanh-lich-vai-poly-ca-sau-cao-cap-thoang-mat-chuan-form-su-259-p191390920.html?spid=191391001,4,-30%,Đã bán 1,aothun
,,https://tiki.vn/ao-phong-cho-nam-va-nu-ao-thun-nam-big-size-ao-thun-nam-danh-cho-nguoi-beo-p98664432.html?spid=98666097,5,-40%,,aothun
"Áo thun nam ngắn tay HOANG NHAT cổ tròn vải cotton thun lạnh mặc mát thiết kế đẹp, thun unisex thời trang Hàn Quốc - A021",200.000₫,https://tiki.vn/ao-thun-nam-tay-ngan-body-thoi-trang-han-quoc-chat-vai-cotton-mem-min-khong-xu-a021-p159123622.html?spid=159123781,6,-30%,Đã bán 6,aothun
Áo PoLo Ngắn Tay 5 Màu Thiết Kế Phong Cách Thời Trang Cao Cấp ZERO,100.000₫,https://tiki.vn/ao-polo-ngan-tay-5-mau-thiet-ke-phong-cach-thoi-trang-cao-cap-zero-p172482304.html?spid=172482338,7,,Đã bán 25,aothun
"Áo Ghi Lê Bảo Hộ Lao Động Nhiều Màu Sắc Kèm Sợi Phản Quang, Đồ Bảo Hộ Lao Động Kĩ Sư Công Trình",99.000₫,https://tiki.vn/ao-ghi-le-bao-ho-lao-dong-nhieu-mau-sac-kem-soi-phan-quang-do-bao-ho-lao-dong-ki-su-cong-trinh-p195236360.html?spid=195236416,8,,Đã bán 11,aothun
"Áo Thun Nam Ngắn Tay Chandi, Chất Thun Cotton Xịn Mẫu Mới NT20",220.000,https://tiki.vn/ao-thun-nam-ngan-tay-chandi-chat-thun-cotton-xin-mau-moi-nt20-p87012003.html?spid=87012011,9,-11%,,aothun
,,https://tiki.vn/ao-thun-nam-co-be-tay-ngan-tre-trung-chat-lieu-cotton-cao-cap-mau-thuu48-p58244931.html?spid=58244933,10,,,aothun
Áo polo thể thao nam Under Armour Performance 3.0 - 1377374-012,1.099.000₫,https://tiki.vn/ao-polo-the-thao-nam-under-armour-performance-3-0-1377374-012-p271268606.html?spid=271268613,11,-50%,,aothun
Áo thun ba lỗ nam hàn Quốc màu Vàng,118.000,https://tiki.vn/ao-thun-ba-lo-nam-han-quoc-mau-vang-p32497935.html?spid=92880688,12,,Đã bán 3,aothun
,,https://tiki.vn/ao-thun-luoi-nam-the-thao-at02a-p45824687.html?spid=45824722,13,,,aothun
[NEW 2023] Timberland Áo Polo Nam AF SS Timberfresh Polo TB0A6861,2.490.000₫,https://tiki.vn/new-2023-timberland-ao-polo-nam-af-ss-timberfresh-polo-tb0a6861-p225191387.html?spid=225191401,14,,,aothun
Áo polo thể thao nam Under Armour Isochill - 1377366-100,1.437.000₫,https://tiki.vn/ao-polo-the-thao-nam-under-armour-isochill-1377366-100-p270461052.html?spid=270461060,15,,,aothun
"GAME OVER, mã G52. Áo thun in chữ siêu đẹp cho nam nữ, form unisex. Áo phông hàng hiệu Goking, quà tặng cao cấp cho gia đình, cặp đôi, doanh nghiệp",99.000₫,https://tiki.vn/game-over-ma-g52-ao-thun-nam-nu-sieu-dep-ao-phong-thoat-nhiet-goking-hang-hieu-p164311125.html?spid=212079997,16,,Đã bán 3,aothun
Combo Áo + Mũ Áo thun cộc tay màu đen in hình Rank thách đấu game Free Fire tặng nón lưới chai thêu cao cấp,109.000,https://tiki.vn/combo-ao-mu-ao-thun-coc-tay-mau-den-in-hinh-rank-thach-dau-game-free-fire-tang-non-luoi-chai-theu-cao-cap-p73745244.html?spid=73745248,17,,,aothun
,,https://tiki.vn/mua-2-cai-ao-phong-nam-ngan-tay-catrio-se-tiet-kiem-duoc-28k_34-000d-la-ao-phong-trang-ao-thun-ngan-tay-ao-lot-trong-cho-bo-ong-nguoi-trung-tuoi-vai-100-cotton-co-tron-ao-lot-mau-trang-mac-lot-ben-trong-ao-so-mi-mac-o-nha-di-ngu-rat-thoang-mat-p261829475.html?spid=261829481,18,,,aothun
Áo Thun Nam Basic Oversize Couple TX MTS 1006,259.000₫,https://tiki.vn/ao-thun-nam-basic-oversize-couple-tx-mts-1006-p101298375.html?spid=101298448,19,,,aothun
"Áo thun nam tay dài cổ tròn, chất cotton 4 chiều , áo dài tay nhiều màu dáng ôm thời trang",69.560₫,https://tiki.vn/ao-thun-nam-tay-dai-co-tron-chat-cotton-4-chieu-ao-dai-tay-nhieu-mau-dang-om-thoi-trang-p138748869.html?spid=138752902,20,,Đã bán 14,aothun
Combo 3 Áo Ba Lỗ Cổ Vuông Nam Cá Tính,149.000₫,https://tiki.vn/combo-3-ao-ba-lo-co-vuong-nam-ca-tinh-p246730278.html?spid=246730380,21,,Đã bán 14,aothun
Áo phông nam tay ngắn cổ tròn chất cotton in họa tiết cực đẹp,39.000₫,https://tiki.vn/ao-phong-nam-tay-ngan-co-tron-chat-cotton-in-hoa-tiet-cuc-dep-p69090037.html?spid=69090067,22,,Đã bán 114,aothun
"BORN FREE, mã G290-logo. Áo thun polo nam nữ, form unisex. Áo phông cổ trụ Goking, vải cá sấu 3D, công nghệ chống nhăn Nhật Bản",148.000₫,https://tiki.vn/born-free-ma-g290-logo-ao-thun-polo-nam-nu-form-unisex-ao-phong-co-tru-goking-vai-ca-sau-3d-cong-nghe-chong-nhan-nhat-ban-p203951820.html?spid=203951868,23,,Đã bán 3,aothun
Áo thun nam tay lỡ form rộng Unisex Methata Freesize mặc vừa từ 45 - 70kg,40.000₫,https://tiki.vn/ao-thun-nam-tay-lo-form-rong-unisex-methata-freesize-mac-vua-tu-45-70kg-p46601617.html?spid=75418561,24,,Đã bán 11,aothun
"Áo thun nam cổ tròn tay ngắn, chất thun cao cấp, trẻ trung, năng động – FORMEN SHOP – FMPS168",149.000,https://tiki.vn/ao-thun-cotton-nam-co-tron-form-rong-in-hinh-ca-tinh-tre-trung-formen-shop-fmps168-p133868386.html?spid=133868394,25,,,aothun
,,https://tiki.vn/ao-ba-lo-co-vuong-nam-phong-cach-han-quoc-sa455-p24038276.html?spid=124209324,26,,,aothun
Áo thun cờ đỏ sao vàng Việt Nam unisex nam nữ đủ size M L XL XXL,93.500₫,https://tiki.vn/ao-thun-co-do-sao-vang-viet-nam-unisex-nam-nu-du-size-m-l-xl-xxl-p155740570.html?spid=155740608,27,,Đã bán 1,aothun
Áo Thun Trơn Andromeda Cổ Tròn Ngắn Tay Nhiều Màu Cho Cả Nam và Nữ Vải Dày Mịn,49.000₫,https://tiki.vn/ao-thun-tron-andromeda-co-tron-ngan-tay-nhieu-mau-cho-ca-nam-va-nu-vai-day-min-p184822619.html?spid=184824554,28,,Đã bán 9,aothun
Áo Thun Nam Nữ tay ngắn in hình ATND1501,33.000₫,https://tiki.vn/ao-thun-nam-nu-tay-ngan-in-hinh-atnd1501-p76316467.html?spid=76316626,29,,,aothun
Áo thun dài tay cổ tim nam,78.000₫,https://tiki.vn/ao-thun-dai-tay-co-tim-nam-p115955390.html?spid=138489059,30,,,aothun
,,https://tiki.vn/chi-nh-ha-ng-owen-ao-polo-nam-nga-n-tay-owen-20290-ao-thun-co-co-nam-p103702275.html?spid=103702295,31,,,aothun
Áo Thun Dài Tay Nam Thu Đông T0004 - M,305.000₫,https://tiki.vn/ao-thun-dai-tay-nam-thu-dong-t0004-p201914425.html?spid=201914429,32,,Đã bán 2,aothun
[NEW] Timberland Áo Thun Unisex Back Graphic T-Shirt TB0A6QHD,1.290.000₫,https://tiki.vn/new-timberland-ao-thun-unisex-back-graphic-t-shirt-tb0a6qhd-p251575704.html?spid=251575708,33,,,aothun
Áo Polo nam Novelty Regular fit NATMINMCLR210081N,355.000₫,https://tiki.vn/ao-polo-nam-novelty-regular-fit-natminmclr210081n-p186816216.html?spid=186816218,34,,,aothun
Áo Polo nam Regular fit NATMINMCLR210091N,355.000,https://tiki.vn/ao-polo-nam-regular-fit-natminmclr210091n-p186843719.html?spid=186843721,35,,,aothun
,,https://tiki.vn/ao-vans-digitally-free-ss-tee-vn0000nnblk-p214829000.html?spid=214829006,36,,,aothun
(HCM) ÁO THUN NAM NỮ CỔ TRÒN TAY NGẮN - THỜI TRANG GENZ - PHONG CÁCH BOY PHỐ ĐẲNG CẤP THỜI TRANG NAM 1986,124.000₫,https://tiki.vn/hcm-ao-thun-nam-nu-co-tron-tay-ngan-thoi-trang-genz-phong-cach-boy-pho-dang-cap-thoi-trang-nam-1986-p201865461.html?spid=201865480,37,,,aothun
"Áo thun nam Fasvin TS20234.HN vải cotton mềm mịn thoáng mát không bai không xù, bền màu",109.500₫,https://tiki.vn/ao-thun-nam-fasvin-ts20234-hn-vai-cotton-mem-min-thoang-mat-khong-bai-khong-xu-ben-mau-p100366994.html?spid=100367956,38,,Đã bán 7,aothun
ÁO BA LỖ TRƠN ĐỦ MÀU BIG SIZE NAM 80 TỚI 130KG,125.000₫,https://tiki.vn/a-o-ba-lo-tron-du-ma-u-big-size-nam-80-to-i-130kg-p194130253.html?spid=194130257,39,,,aothun
Áo thun nam G-Mark Gunze 5020 (áo ba lỗ size XXL) màu xám.,125.000,https://tiki.vn/ao-lot-nam-gunze-5020-ao-ba-lo-size-xxl-mau-xam-p167476149.html?spid=167476165,40,,,aothun
