title,price,link_item,index,discount,sales,category
"áo hoodie in Chữ Love, áo khoác hoodie couple trái tim phong cách hàn quốc phù hợp cho nam nữ Oversize Ulzzang thu đông local brand",127.000₫,https://tiki.vn/ao-hoodie-in-chu-love-ao-khoac-hoodie-couple-trai-tim-phong-cach-han-quoc-phu-hop-cho-nam-nu-oversize-ulzzang-thu-dong-local-brand-p272449566.html?spid=272449576,1,-28%,,aohoodie
Áo hoodie nam nữ unisex nỉ bông dày dặn sweater fom rộng hàn quốc ulzzang In Chữ 2 Mặt LET CHILL,136.000₫,https://tiki.vn/ao-hoodie-nam-nu-unisex-ni-bong-day-dan-sweater-fom-rong-han-quoc-ulzzang-in-chu-2-mat-let-chill-p273650931.html?spid=273650950,2,,,aohoodie
Áo sweater nỉ bông cotton dày mịn - hoodie form rộng unisex Murabed - 2N Unisex,199.000₫,https://tiki.vn/ao-sweater-ni-bong-cotton-day-min-hoodie-form-rong-unisex-murabed-2n-unisex-p217176969.html?spid=217176971,3,,Đã bán 1,aohoodie
Áo Hoodie KENVIBE Form Rộng Unisex Tay Phồng Nón Rộng 2 Lớp Siêu Phẩm Hip Hop Nam nữ Cao Cấp Chất Dày Dặn Mềm Mịn Cho Các Tình Yêu Fashion Phong cách trẻ trung chống nắng tốt,137.000₫,https://tiki.vn/ao-hoodie-kenvibe-form-rong-unisex-tay-phong-non-rong-2-lop-sieu-pham-hip-hop-nam-nu-cao-cap-chat-day-dan-mem-min-cho-cac-tinh-yeu-fashion-phong-cach-tre-trung-chong-nang-tot-p273805583.html?spid=273805591,4,,,aohoodie
Áo sweater nỉ ngoại hoa hướng dương cực xinh cho các bạn trẻ THỜI TRANG KING FASHION,112.000₫,https://tiki.vn/ao-sweater-ni-ngoai-hoa-huong-duong-cuc-xinh-cho-cac-ban-tre-thoi-trang-king-fashion-p109408291.html?spid=109408593,5,,,aohoodie
ÁO HODDIES CÓ MŨ TÚI HỘP CỰC CHẤT CHO CÁC BẠN TRẺ THỜI TRANG KING FASHION,99.000₫,https://tiki.vn/ao-hoddies-co-mu-tui-hop-cuc-chat-cho-cac-ban-tre-thoi-trang-king-fashion-p109407782.html?spid=109408770,6,,,aohoodie
"ÁO HÔM DOODIES LOANG NAM NỮ,MÀU SẮC ĐA DẠNG VÔ CÙNG XINH XẮN THỜI TRANG KING STORE",150.000₫,https://tiki.vn/ao-hom-doodies-loang-nam-nu-mau-sac-da-dang-vo-cung-xinh-xan-thoi-trang-king-store-p109408827.html?spid=109411246,7,,,aohoodie
Áo Hoodie Nam Đôn Chề Level In Chữ Vàng Siêu Đẹp - Áo Hoodie Nam Nữ Đôn Chề Level In Chữ Great Love Vạt Áo Siêu Nét Cho Các Boy Girl dạp Phố Đi Học Đi,137.000₫,https://tiki.vn/ao-hoodie-nam-don-che-level-in-chu-vang-sieu-dep-ao-hoodie-nam-nu-don-che-level-in-chu-great-love-vat-ao-sieu-net-cho-cac-boy-girl-dap-pho-di-hoc-di-p273815001.html?spid=273815005,8,,,aohoodie
Áo Khoác Mũ Trùm Đầu Faster Sons Reeves,1.468.000₫,https://tiki.vn/ao-khoac-mu-trum-dau-faster-sons-reeves-p273623300.html?spid=273623310,9,,,aohoodie
"áo khoác hoodie, áo hoodie in lá bài",111.900₫,https://tiki.vn/ao-khoac-hoodie-ao-hoodie-in-la-bai-p76375074.html?spid=76375076,10,,,aohoodie
Áo khoác Hoodie nam nữ KD132,99.000₫,https://tiki.vn/ao-khoac-hoodie-nam-nu-kd132-p4952139.html?spid=44713946,11,,Đã bán 6,aohoodie
"Áo Hoodie Nam Nữ , áo hoodie cặp Unisex form rộng, áo khoác hoodie đôi phong cách ulzzang, áo hoodie hàn quốc, áo khoác hoodie có mủ, áo hoodie đẹp",123.700₫,https://tiki.vn/ao-hoodie-nam-nu-ao-hoodie-cap-unisex-form-rong-ao-khoac-hoodie-doi-phong-cach-ulzzang-ao-hoodie-han-quoc-ao-khoac-hoodie-co-mu-ao-hoodie-dep-p91753894.html?spid=91753899,12,,Đã bán 1,aohoodie
Áo khoác thun nỉ ngoại ulzzang mới về,119.000₫,https://tiki.vn/ao-khoac-thun-ni-ngoai-ulzzang-moi-ve-p73668534.html?spid=73668540,13,,,aohoodie
Áo Hoodie Nỉ Bông BASIC WHITE Unisex,100.000₫,https://tiki.vn/ao-hoodie-ni-bong-basic-white-unisex-p26297961.html?spid=45165771,14,,Đã bán 3,aohoodie
Áo hoodie chất PE in hoạt hình,89.000₫,https://tiki.vn/ao-hoodie-chat-pe-in-hoat-hinh-p72967416.html?spid=72967418,15,,Đã bán 2,aohoodie
Hoodie Hồng Phấn Unisex Phom Thụng,97.900₫,https://tiki.vn/hoodie-hong-phan-unisex-phom-thung-p70640552.html?spid=72586472,16,,Đã bán 1,aohoodie
Áo hoodies nam nữ couple phong cách cá tính cực chất cực ngầu free style,93.000₫,https://tiki.vn/ao-hoodies-nam-nu-couple-phong-cach-ca-tinh-cuc-chat-cuc-ngau-free-style-p75544152.html?spid=76748042,17,,,aohoodie
"Áo hoodie nam , áo hoodie nữ , áo hoodie vải nỉ ngoại",113.000₫,https://tiki.vn/ao-hoodie-nam-ao-hoodie-nu-ao-hoodie-vai-ni-ngoai-ao-hoodie-ulzzang-ao-hoodie-unisex-ao-hoodie-nam-nu-deu-mac-duoc-p74768970.html?spid=74768974,18,,Đã bán 1,aohoodie
Áo hoodie nỉ ngoại in chữ,99.000₫,https://tiki.vn/ao-hoodie-ni-ngoai-in-chu-p72745833.html?spid=72745835,19,,Đã bán 6,aohoodie
Áo khoác hoodie nam nữ nỉ,100.000₫,https://tiki.vn/ao-khoac-hoodie-nam-nu-ni-p10187170.html?spid=48756480,20,,Đã bán 4,aohoodie
Áo hoodie chất PE in hoạt hình,107.900₫,https://tiki.vn/ao-hoodie-chat-pe-in-hoat-hinh-p73160924.html?spid=73160926,21,,Đã bán 5,aohoodie
"COMBO 2 CÁI ÁO HOODIE IN MẶT GẤU DỄ THƯƠNG, ÁO HOODIE CẶP DỄ THƯƠNG",190.000₫,https://tiki.vn/combo-2-cai-ao-hoodie-in-mat-gau-de-thuong-ao-hoodie-cap-de-thuong-p73927927.html?spid=73927929,22,,,aohoodie
Áo hoodie in hình lá phong thun nỉ ngoại mới về,99.000₫,https://tiki.vn/ao-hoodie-in-hinh-la-phong-thun-ni-ngoai-moi-ve-p73491664.html?spid=73491666,23,,,aohoodie
Áo Hoodie Trơn Màu Xanh Chuối Cao Cấp Dáng Rộng Unisex Nam Nữ Mặc Được - MM,120.000₫,https://tiki.vn/ao-hoodie-tron-mau-xanh-chuoi-cao-cap-dang-rong-unisex-nam-nu-mac-duoc-mm-p106365376.html?spid=106365378,24,,Đã bán 1,aohoodie
ÁO HOODIE THUN NỈ NGOẠI,126.000₫,https://tiki.vn/ao-hoodie-thun-ni-ngoai-p73495795.html?spid=73495801,25,,Đã bán 1,aohoodie
Áo Sweater Trơn Chất Nỉ Lót Bông Màu Đỏ Đô - Sweater Unisex - MM,109.000₫,https://tiki.vn/ao-sweater-tron-chat-ni-lot-bong-mau-do-do-sweater-unisex-mm-p108418311.html?spid=108418317,26,,,aohoodie
"Áo hoodie nam nữ thun nỉ ngoại in EVERESE năng động, cá tính năng động",102.000₫,https://tiki.vn/ao-hoodie-nam-nu-thun-ni-ngoai-in-everese-nang-dong-ca-tinh-nang-dong-p114430014.html?spid=114430029,27,,,aohoodie
Áo Khoác Hoodie Nam Nữ NEW Siêu Hot Chất Nỉ Dày Dặn Siêu Đẹp Áo Hoodie Nam Nữ Form Rộng Unisex HÌNH HỌC,96.000₫,https://tiki.vn/ao-khoac-hoodie-nam-nu-new-sieu-hot-chat-ni-day-dan-sieu-dep-ao-hoodie-nam-nu-form-rong-unisex-hinh-hoc-ak3305-p127352996.html?spid=127353013,28,,,aohoodie
"Áo khoác Hoodie Nam, Hoodie Basic Unisex Nỉ From Rộng NÓN 2 LỚP PHẢN QUANG 7 MÀU, Áo Khoác Nỉ Hoodie Nam Nữ 2 Lớp Dày Dặn Cotton Phong Cách Hàn Quốc Free Size Dưới 70kg",129.000₫,https://tiki.vn/ao-khoac-hoodie-nam-hoodie-basic-unisex-ni-from-rong-non-2-lop-phan-quang-7-mau-p138491656.html?spid=138491663,29,,Đã bán 3,aohoodie
"Áo Hoodie Nỉ Lót Bông form rộng Gấu Feel Good (nam nữ đều mặc đc), Áo Hoodie GYG Unisex Feel Good No Big Deal Form Rộng Oversize Phong Cách Hàn Quốc",99.000₫,https://tiki.vn/ao-hoodie-ni-lot-bong-form-rong-gau-feel-good-nam-nu-deu-mac-dc-ao-hoodie-gyg-unisex-feel-good-no-big-deal-form-rong-oversize-phong-cach-han-quoc-p151946260.html?spid=151946264,30,,,aohoodie
Áo Hoodie Thun Nỉ Cao Cấp Phối Tay Và Thân Có Nón Mũ 2 Lớp Kiểu Rộng Unisex Nam Nữ Couple - Áo Khoác Nỉ,133.000₫,https://tiki.vn/ao-hoodie-thun-ni-cao-cap-phoi-tay-va-than-co-non-mu-2-lop-kieu-rong-unisex-nam-nu-couple-ao-khoac-ni-p271410314.html?spid=271590846,31,,,aohoodie
Áo khoác nam nữ nỉ ngoại hoodie puppprsooo,108.000₫,https://tiki.vn/ao-khoac-nam-nu-ni-ngoai-hoodie-puppprsooo-p135273112.html?spid=142259667,32,,Đã bán 1,aohoodie
Áo hoodie,115.000₫,https://tiki.vn/ao-hoodie-p272371462.html?spid=272371472,33,,,aohoodie
Áo hoodie nỉ xanh mint trái tim (ảnh thật),109.000₫,https://tiki.vn/ao-hoodie-ni-xanh-mint-trai-tim-anh-that-p137506427.html?spid=177968689,34,,,aohoodie
Áo hoodie phản quang thủy thủ mặt trăng nam nữ,160.000₫,https://tiki.vn/ao-hoodie-phan-quang-thuy-thu-mat-trang-nam-nu-p187840612.html?spid=187840627,35,,,aohoodie
Áo Hoodie Under Broke Form Rộng Unisex Hàn Quốc - Khoác Nỉ Nam Nữ Có Nón Mũ Chống Nắng - Thu Đông,94.000₫,https://tiki.vn/ao-hoodie-under-broke-form-rong-unisex-han-quoc-khoac-ni-nam-nu-co-non-mu-chong-nang-thu-dong-p207292443.html?spid=212266341,36,,Đã bán 2,aohoodie
Bộ nỉ ALIGRO cổ tròn màu xanh rêu BN.12,850.000₫,https://tiki.vn/bo-ni-aligro-co-tron-mau-xanh-reu-bn-12-p213495247.html?spid=213495257,37,,,aohoodie
Áo khoác Hoodie chất Nỉ Cao Cấp form rộng thêu chữ nổi BADBLOOD có BIG Size _ Áo khoác chui đầu unisex có khoá zip cổ,145.000₫,https://tiki.vn/ao-khoac-hoodie-chat-ni-cao-cap-form-rong-theu-chu-noi-badblood-co-big-size-_-ao-khoac-chui-dau-unisex-co-khoa-zip-co-p207853442.html?spid=207853480,38,,,aohoodie
Hoodie nỉ ngoại form dày,165.000₫,https://tiki.vn/hoodie-ni-ngoai-form-day-p210946357.html?spid=210946369,39,,,aohoodie
Áo Hoodie Túi Chữ BANUR COMMUNIT - FREESHIP - Khoác Nỉ Ngoại Có Nón Mũ 2 Lớp Nam Nữ Cặp Đôi Mặc _ Chống Nắng Thu Đông,93.000₫,https://tiki.vn/ao-hoodie-tui-chu-banur-communit-freeship-khoac-ni-ngoai-co-non-mu-2-lop-nam-nu-cap-doi-mac-_-chong-nang-thu-dong-p206246387.html?spid=207008069,40,,,aohoodie
