title,price,link_item,index,discount,sales,brand
áo thun tết ĐI KHẮP TRÁI ĐẤT,57.000₫,https://tiki.vn/ao-thun-tet-p213713122.html?spid=213713132,1,,,VONESA
ÁO THUN TẾT HÌNH AN KHANG THỊNH VƯỢNG,57.000₫,https://tiki.vn/ao-thun-tet-hinh-an-khang-thinh-vuong-p213969569.html?spid=213969587,2,,Đã bán 3,VONESA
ÁO THUN TẾT IN HÌNH CHÚNG TA LÀ MỘT GIA ĐÌNH,57.000₫,https://tiki.vn/ao-thun-tet-in-hinh-chung-ta-la-mot-gia-dinh-p213861524.html?spid=213861542,3,,,VONESA
ÁO KHOÁC NỈ,145.000,https://tiki.vn/ao-khoac-ni-p212427432.html?spid=212427436,4,,,VONESA
,,https://tiki.vn/quan-thun-jogger-logo-in-khong-bong-troc-chat-2-da-mem-min-quan-jogger-hoat-hinh-quan-jogger-quan-the-thao-quan-thoi-trang-nam-nu-p198788181.html?spid=198788185,5,,,VONESA
áo thun in chữ love,75.000₫,https://tiki.vn/ao-thun-in-chu-love-p242644044.html?spid=242644046,6,,,VONESA
áo thun nam in hình mẫu mới nhất,57.000₫,https://tiki.vn/ao-thun-nam-in-hinh-mau-moi-nhat-p243033905.html?spid=243033907,7,,,VONESA
áo thun nam nữ mẫu mới nhất,57.000₫,https://tiki.vn/ao-thun-nam-nu-mau-moi-nhat-p243037842.html?spid=243037848,8,,,VONESA
áo thun nam in chữ mẫu mới nhất,99.000₫,https://tiki.vn/ao-thun-nam-in-chu-mau-moi-nhat-p252811843.html?spid=252811853,9,,,VONESA
,,https://tiki.vn/ao-thun-nam-nu-in-hinh-de-thuong-p249382941.html?spid=249382953,10,,,VONESA
Áo thun in chữ Treno - Ghiền Fashion,57.000₫,https://tiki.vn/ao-thun-in-chu-treno-p249387815.html?spid=249387819,11,,,VONESA
"Quần dài in hoạt hình,chất da cá dày mịn",95.000₫,https://tiki.vn/quan-dai-in-hoat-hinh-chat-da-ca-day-min-p220677967.html?spid=220677971,12,,,VONESA
,,https://tiki.vn/ao-thun-nam-nu-in-chu-we-are-family-p247441779.html?spid=247441791,13,,,VONESA
QUẦN JOGGER 1 LINE ĐÓNG CÚC SIÊU XỊN XÒ,90.000₫,https://tiki.vn/quan-jogger-1-line-dong-cuc-sieu-xin-xo-p207283177.html?spid=207283180,14,,,VONESA
Áo sơ mi nam vải đũi dài tay nhiều màu sắc cao cấp tinh tế sang trọng,135.000₫,https://tiki.vn/ao-so-mi-nam-vai-dui-dai-tay-nhieu-mau-sac-cao-cap-tinh-te-sang-trong-p270243864.html?spid=270242576,15,,,VONESA
"Quần jocker nam nữ chất thun da cá dày mịn, form dưới 70kg lai có dây rút",145.000₫,https://tiki.vn/quan-jocker-nam-nu-chat-thun-da-ca-day-min-form-duoi-70kg-lai-co-day-rut-p270957625.html?spid=270957631,16,,,VONESA
Áo thun ba lỗ phản quang,79.000₫,https://tiki.vn/ao-thun-ba-lo-phan-quang-p263034033.html?spid=263034041,17,,,VONESA
,,https://tiki.vn/ao-thun-in-dai-bang-cuc-ngau-phong-cach-tre-trung-ca-tinh-chat-thun-men-min-thoang-mat-tham-hut-mo-hoi-tot-p253299284.html?spid=253299292,18,,,VONESA
Thun nam ngắn tay in chữ Hatebreed,53.000₫,https://tiki.vn/thun-nam-ngan-tay-in-chu-hatebreed-p253298891.html?spid=253298893,19,,,VONESA
Áo thun polo,95.000₫,https://tiki.vn/ao-thun-polo-p271285950.html?spid=271285952,20,,,VONESA
Áo thun nam polo mẫu mới,95.000₫,https://tiki.vn/ao-thun-nam-polo-mau-moi-p271316379.html?spid=271316383,21,,,VONESA
"áo Polo nam nữ thêu 2 bên ngực, chất cotton Poly lên form siêu đẹp",95.000₫,https://tiki.vn/ao-polo-nam-nu-theu-2-ben-nguc-chat-cotton-poly-len-form-sieu-dep-p270706394.html?spid=270706398,22,,,VONESA
Áo thun polo,95.000₫,https://tiki.vn/ao-thun-polo-p271286154.html?spid=271286158,23,,,VONESA
"Sơ mi nam nhung vân caro cao cấp Chất lụa nhung vân caro mềm mại, thoáng mát",165.000₫,https://tiki.vn/so-mi-nam-nhung-van-caro-cao-cap-chat-lua-nhung-van-caro-mem-mai-thoang-mat-p270770046.html?spid=270770060,24,,,VONESA
Áo thun One Piece Đảo Hải Tặc Law Wanted OP72,140.400,https://tiki.vn/ao-thun-one-piece-dao-hai-tac-law-wanted-op72-p90427170.html?spid=273424858,25,,,VONESA
,,https://tiki.vn/ao-thun-tay-lo-nam-form-rong-in-hinh-co-gai-nghe-nhac-vai-day-min-teewo175-p190451728.html?spid=190451736,26,,,VONESA
Áo thun tay lỡ nam Hàn Quốc form rộng in hình neo cá tính vải dày mịn TEEWOTL40,44.500₫,https://tiki.vn/ao-thun-tay-lo-nam-han-quoc-form-rong-in-hinh-neo-ca-tinh-vai-day-min-teewotl40-p190451743.html?spid=190451749,27,,,VONESA
Áo phông tay lỡ nam nữ cún con đeo kính vải dày mịn 2021T3276,53.000₫,https://tiki.vn/ao-phong-tay-lo-nam-nu-cun-con-deo-kinh-vai-day-min-2021t3276-p190453837.html?spid=190453859,28,,,VONESA
Áo thun unisex độc lạ chữ kiểu Samurai form rộng vải dày mịn 2019T1828,53.000₫,https://tiki.vn/ao-thun-unisex-doc-la-chu-kieu-samurai-form-rong-vai-day-min-2019t1828-p190422101.html?spid=190423502,29,,,VONESA
Áo thun unisex độc lạ Samurai form rộng vải dày mịn 2019T1817,53.000₫,https://tiki.vn/ao-thun-unisex-doc-la-samurai-form-rong-vai-day-min-2019t1817-p190421988.html?spid=190422788,30,,,VONESA
,,https://tiki.vn/ao-thun-nam-in-hinh-trai-tim-han-quoc-vai-day-min-tee19s83-p190423541.html?spid=190423986,31,,,VONESA
Áo thun unisex form rộng mario mập Hàn Quốc vải dày mịn 2019T2058,53.000₫,https://tiki.vn/ao-thun-unisex-form-rong-mario-map-han-quoc-vai-day-min-2019t2058-p190423812.html?spid=190424109,32,,,VONESA
Áo thun tay lỡ form rộng nam nữ unisex Hero vải dày mịn 2022T3457,53.000₫,https://tiki.vn/ao-thun-tay-lo-form-rong-nam-nu-unisex-hero-vai-day-min-2022t3457-p190422443.html?spid=190425380,33,,,VONESA
Áo thun unisex nhiều đôi mắt đẹp rẻ 2019S497,53.000₫,https://tiki.vn/ao-thun-unisex-nhieu-doi-mat-dep-re-2019s497-p190424600.html?spid=190424738,34,,,VONESA
Áo thun nam nữ trà sữa dễ thương vải dày mịn 2020T3001,53.000₫,https://tiki.vn/ao-thun-nam-nu-tra-sua-de-thuong-vai-day-min-2020t3001-p190424340.html?spid=190425638,35,,,VONESA
,,https://tiki.vn/ao-thun-unisex-hypebeast-style-form-rong-vai-day-min-2019t925-p190424906.html?spid=190425372,36,,,VONESA
Áo thun nam in hình thiên thần Hàn Quốc vải dày mịn TEE19S121,53.000₫,https://tiki.vn/ao-thun-nam-in-hinh-thien-than-han-quoc-vai-day-min-tee19s121-p190424819.html?spid=190425273,37,,,VONESA
Áo thun unisex độc lạ Samurai form rộng vải dày mịn 2019T1826,53.000₫,https://tiki.vn/ao-thun-unisex-doc-la-samurai-form-rong-vai-day-min-2019t1826-p190425983.html?spid=190427042,38,,,VONESA
Áo thun unisex độc lạ Samurai form rộng vải dày mịn 2019T1863,53.000₫,https://tiki.vn/ao-thun-unisex-doc-la-samurai-form-rong-vai-day-min-2019t1863-p190424888.html?spid=190426283,39,,,VONESA
Áo thun tay lỡ nam form rộng in hình cáo già vải dày mịn TEEWO152,44.500₫,https://tiki.vn/ao-thun-tay-lo-nam-form-rong-in-hinh-cao-gia-vai-day-min-teewo152-p190427284.html?spid=190427582,40,,,VONESA
