title,price,link_item,index,discount,sales,brand
Chân váy len dáng ôm basic dễ phối đồ VAY96,155.000₫,https://tiki.vn/chan-vay-len-dang-om-basic-de-phoi-do-vay96-p73493520.html?spid=80958984,1,,Đã bán 8,SongAnEco
Quần bò jean baggy thêu hình em bé dễ tương QB32,299.000₫,https://tiki.vn/quan-bo-jean-baggy-theu-hinh-em-be-de-tuong-qb32-p57759426.html?spid=57759434,2,,Đã bán 5,SongAnEco
Váy xòe dáng dài 3 lớp dễ thương đính hoa nổi VAY84 free size,185.000₫,https://tiki.vn/vay-xoe-dang-dai-3-lop-de-thuong-dinh-hoa-noi-vay84-free-size-p70208988.html?spid=70208990,3,,Đã bán 2,SongAnEco
Áo khoác bò lưng kẻ sọc phối cá tính ABS03,99.000₫,https://tiki.vn/ao-khoac-bo-lung-ke-soc-phoi-ca-tinh-abs03-p70193286.html?spid=70193290,4,,,SongAnEco
,,https://tiki.vn/chan-vay-luoi-tutu-xoe-to-cham-bi-nho-hang-dep-vay58-3-lop-p90322928.html?spid=90322946,5,,,SongAnEco
Quần bò thêu dáng dài QBD26,715.000₫,https://tiki.vn/quan-bo-theu-dang-dai-qbd26-p90321868.html?spid=90321875,6,,,SongAnEco
Chân váy chữ A vải kaki cao cấp túi ngang free size mẫu mới nhiều mầu VAY22,178.700₫,https://tiki.vn/chan-vay-chu-a-vai-kaki-cao-cap-tui-ngang-free-size-mau-moi-nhieu-mau-vay22-p90325853.html?spid=90326192,7,,Đã bán 6,SongAnEco
Váy lanh lụa retro cotton mềm VAY51,198.700₫,https://tiki.vn/vay-lanh-lua-retro-cotton-mem-vay51-p90323764.html?spid=90323777,8,,Đã bán 2,SongAnEco
Quần jean baggy thêu hoa hàng xuất QB19,347.000,https://tiki.vn/quan-jean-baggy-theu-hoa-hang-xuat-qb19-p90323738.html?spid=90323757,9,,,SongAnEco
,,https://tiki.vn/chan-vay-dinh-kim-sa-zizac-mac-2-kieu-vay46-chat-lieu-co-gian-free-size-p90324014.html?spid=90324024,10,,,SongAnEco
Chân váy xòe xếp ly chấm bi dáng dài Free size VAY65 mẫu mới,199.000₫,https://tiki.vn/chan-vay-xoe-xep-ly-cham-bi-dang-dai-free-size-vay65-mau-moi-p90323236.html?spid=90323647,11,,Đã bán 1,SongAnEco
Áo Free size cổ chữ V không tay chất len sợi loại 1 không xù không bai nhão AO2,142.000,https://tiki.vn/ao-free-size-co-chu-v-khong-tay-chat-len-soi-loai-1-khong-xu-khong-bai-nhao-ao2-p90325027.html?spid=90325628,12,,Đã bán 2,SongAnEco
,,https://tiki.vn/quan-bo-theu-vai-mem-baggy-qb15-p90326078.html?spid=90326086,13,,,SongAnEco
Quần bò thêu dáng dài QBD20 hàng xuất,347.000₫,https://tiki.vn/quan-bo-theu-dang-dai-qbd20-hang-xuat-p90325784.html?spid=90325790,14,,,SongAnEco
Chân váy lưới cổ tích đuôi cá dễ thương VAY88 free size,152.000₫,https://tiki.vn/chan-vay-luoi-co-tich-duoi-ca-de-thuong-vay88-free-size-p70209015.html?spid=70209017,15,,Đã bán 1,SongAnEco
Chân váy ren 2 lớp dễ thương VAY73,152.000₫,https://tiki.vn/chan-vay-ren-2-lop-de-thuong-vay73-p59152267.html?spid=59152271,16,,Đã bán 1,SongAnEco
Áo sơ mi công sở và dạo phố vải cao cấp không nhăn SM05,138.000,https://tiki.vn/ao-so-mi-cong-so-va-dao-pho-vai-cao-cap-khong-nhan-sm05-p20824265.html?spid=20831330,17,,Đã bán 2,SongAnEco
,,https://tiki.vn/quan-jean-baggy-thoi-trang-qb15-ca-tinh-p48038596.html?spid=48038598,18,,,SongAnEco
Áo lỗ cánh dơi mặc ngoài áo 2 dây và đồ bơi 2 mảnh AO27 họa tiết quả trám Free size,152.000₫,https://tiki.vn/ao-lo-canh-doi-mac-ngoai-ao-2-day-va-do-boi-2-manh-ao27-hoa-tiet-qua-tram-free-size-p54455882.html?spid=54470309,19,,Đã bán 3,SongAnEco
Chân váy ren xòe chất liệu cao cấp phong các Vintage dễ thương,189.000₫,https://tiki.vn/chan-vay-ren-xoe-chat-lieu-cao-cap-phong-cac-vintage-de-thuong-p107530527.html?spid=107530533,20,,,SongAnEco
Bikini len móc thời trang biển mua hè phong cách châu âu AB03,205.000₫,https://tiki.vn/bikini-len-moc-thoi-trang-bien-mua-he-phong-cach-chau-au-ab03-p57769211.html?spid=57769219,21,,Đã bán 1,SongAnEco
Váy lưới cổ tích đa tầng dễ thương VAY85,145.000₫,https://tiki.vn/vay-luoi-co-tich-da-tang-de-thuong-vay85-free-size-p70207275.html?spid=70207283,22,,,SongAnEco
Chân váy gấu 2 tầng ren dễ thương free size VAY145,195.000₫,https://tiki.vn/chan-vay-gau-2-tang-ren-de-thuong-free-size-vay145-p107484104.html?spid=107484108,23,,Đã bán 1,SongAnEco
Chân váy xòe xếp tầng dáng dài dễ thương VAY136 free size,185.000₫,https://tiki.vn/chan-vay-xoe-xep-tang-dang-dai-de-thuong-vay136-free-size-p136462746.html?spid=136462750,24,,,SongAnEco
Áo sơ mi công sở và dạo phố dáng thụng không nhăn SM03,138.000,https://tiki.vn/ao-so-mi-cong-so-va-dao-pho-dang-thung-khong-nhan-sm03-p20824279.html?spid=20829653,25,,,SongAnEco
,,https://tiki.vn/chan-vay-ren-tulle-tutu-dai-thoi-trang-cao-cap-song-an-eco-vay18-free-size-p35155477.html?spid=39319297,26,,,SongAnEco
Chân váy lưới mix ren dễ thương tặng vòng chỉ đỏ may mắn free size VAY24,145.000₫,https://tiki.vn/chan-vay-luoi-mix-ren-de-thuong-tang-vong-chi-do-may-man-free-size-vay24-p71210386.html?spid=71210388,27,,Đã bán 1,SongAnEco
Áo khoác bò dáng lửng tay dài dễ thương QBS05,150.000₫,https://tiki.vn/ao-khoac-bo-dang-lung-tay-dai-de-thuong-qbs05-p70193331.html?spid=70193335,28,,Đã bán 2,SongAnEco
Áo len nữ cardigan kiểu Hàn Quốc kẻ ngang trẻ trung AO34 free size,160.000₫,https://tiki.vn/ao-len-nu-cardigan-kieu-han-quoc-ke-ngang-tre-trung-ao34-free-size-p68279775.html?spid=68279777,29,,,SongAnEco
Chân váy len basic dễ phối đồ VAY95,147.000,https://tiki.vn/chan-vay-len-basic-de-phoi-do-vay95-p73493158.html?spid=80959006,30,,,SongAnEco
,,https://tiki.vn/quan-jean-theu-hoa-dang-baggy-thung-qb08-p90322829.html?spid=90322864,31,,,SongAnEco
Quần bò thêu họa tiết dáng baggy QB13,347.000₫,https://tiki.vn/quan-bo-theu-hoa-tiet-dang-baggy-qb13-p90323013.html?spid=90323018,32,,,SongAnEco
Váy lưới dáng xòe họa tiết chân đẹp VAY52,258.700₫,https://tiki.vn/vay-luoi-dang-xoe-hoa-tiet-chan-dep-vay52-p90325878.html?spid=90325917,33,,Đã bán 1,SongAnEco
Váy xếp ly lưới tutu VAY50,208.000₫,https://tiki.vn/vay-xep-ly-luoi-tutu-vay50-p90323267.html?spid=90323688,34,,Đã bán 1,SongAnEco
Áo len lụa đính đá vuông AO04 cực sang chảnh mẫu mới,159.000,https://tiki.vn/ao-len-lua-dinh-da-vuong-ao04-cuc-sang-chanh-mau-moi-p23228792.html?spid=23228796,35,,,SongAnEco
,,https://tiki.vn/ao-khoac-bo-tay-xuong-cao-xuoc-ca-tinh-abs02-p70193271.html?spid=70193273,36,,,SongAnEco
Chân váy lót ren 3 lớp dễ thương VAY142 free size,229.000₫,https://tiki.vn/chan-vay-lot-ren-3-lop-de-thuong-vay142-free-size-p107475246.html?spid=107475252,37,,Đã bán 1,SongAnEco
Chân váy kẻ caro đính cúc trẻ trung năng động free size VAY153,195.000₫,https://tiki.vn/chan-vay-ke-caro-dinh-cuc-tre-trung-nang-dong-free-size-vay153-p107539134.html?spid=107539138,38,,Đã bán 3,SongAnEco
Váy xếp ly phối ren đính hạt cao cấp Free size,263.000₫,https://tiki.vn/vay-xep-ly-phoi-ren-dinh-hat-cao-cap-free-size-p176663454.html?spid=176663456,39,,,SongAnEco
Áo sơ mi công sở và dạo phố vải cao cấp SM07 bán chạy,250.000,https://tiki.vn/ao-so-mi-cong-so-va-dao-pho-vai-cao-cap-sm07-ban-chay-p20824275.html?spid=20831484,40,,,SongAnEco
