title,price,link_item,index,discount,sales,category
Bộ Cosplay Mèo Siêu Xinh Kèm Phụ Kiện MS 5124,119.000₫,https://tiki.vn/bo-cosplay-meo-sieu-xinh-kem-phu-kien-ms-5124-p152631960.html?spid=152631962,1,-8%,,dongu
Combo 2 váy ngủ kèm quần lót lọt khe,115.000₫,https://tiki.vn/combo-2-vay-ngu-kem-quan-lot-lot-khe-p68961959.html?spid=68961965,2,-1%,Đã bán 2,dongu
Váy Ngủ Ren 2 Dây Phối Hoa Cao Cấp MS1118,87.000₫,https://tiki.vn/vay-ngu-ren-2-day-phoi-hoa-cao-cap-ms1118-p152634495.html?spid=152634516,3,-15%,,dongu
Đầm Ngủ Sexy|Váy Ngủ Quyễn RũFreeship - Có VideoPhi Lụa Satin Quyến Rũ(H),119.000,https://tiki.vn/dam-ngu-sexy-vay-ngu-quyen-ru-co-videophi-lua-satin-quyen-ru-h-p104302279.html?spid=104302350,4,-31%,,dongu
,,https://tiki.vn/do-bo-nu-do-ngu-mac-nha-lung-vai-lua-mango-cao-cap-bl-100-hoa-tiet-hoa-nhi-de-thuong-size-45-65kg-p176901162.html?spid=176901194,5,,,dongu
"Bộ mặc nhà nữ, bộ lông dày đẹp túi kẻ hàn quốc",229.000₫,https://tiki.vn/bo-mac-nha-nu-bo-long-day-dep-tui-ke-han-quoc-p194453129.html?spid=194453137,6,,Đã bán 1,dongu
Bộ đùi dây phi bóng( sai L 38-50kg) sai xl 50-58kg,140.000₫,https://tiki.vn/bo-dui-day-phi-bong-sai-l-38-50kg-sai-xl-50-58kg-p173415205.html?spid=173416192,7,,,dongu
"Set bộ đũi trắng dài tay 2 túi hộp nhiều màu sắc b130 HASCOO DD - Trắng 1 túi, Trắng 1 túi",200.000₫,https://tiki.vn/set-bo-dui-trang-dai-tay-2-tui-hop-nhieu-mau-sac-b130-hascoo-dd-p252175183.html?spid=252175187,8,,,dongu
"Đồ bộ nữ,đồ ngủ mặc nhà lửng quần 9 tấc vải lụa họa tiết caro dễ thương",135.000,https://tiki.vn/do-bo-nu-do-ngu-mac-nha-lung-quan-9-tac-vai-lua-hoa-tiet-caro-de-thuong-p191003524.html?spid=191003607,9,,,dongu
,,https://tiki.vn/do-bo-nu-do-ngu-mac-nha-lung-9-tac-vai-lua-hoa-tiet-hoa-cuc-sieu-cung-p191453434.html?spid=191453489,10,,,dongu
AO KHOAC GIO BE TRAI KHUNG LONG,176.000₫,https://tiki.vn/ao-khoac-gio-be-trai-khung-long-p187185933.html?spid=187185947,11,,,dongu
"ĐỒ BỘ MẶC NHÀ NHIHOUSE71 QUẦN DÀI TAY NGẮN PHỐI NẸP LỤA SATIN SANG, TINH TẾ CÓ TÚI 50 - 75KG",185.000,https://tiki.vn/do-bo-mac-nha-nhihouse71-quan-dai-tay-ngan-phoi-nep-lua-satin-sang-tinh-te-co-tui-50-75kg-p92049710.html?spid=92049733,12,,,dongu
,,https://tiki.vn/do-bo-nu-do-ngu-mac-nha-lung-vai-lua-hoa-tiet-hoa-nhi-sieu-xinh-size-45-65kg-p191351415.html?spid=191351429,13,,,dongu
"Mặt Nạ Hóa Trang Dự Tiệc Ren Bông, đồ chơi hóa trang vũ hội",72.000₫,https://tiki.vn/mat-na-hoa-trang-du-tiec-ren-bong-do-choi-hoa-trang-vu-hoi-p119646920.html?spid=119646928,14,,Đã bán 5,dongu
Bộ cosplay jum tai thỏ nhung sexy MS5118,94.000₫,https://tiki.vn/bo-cosplay-jum-tai-tho-nhung-sexy-ms5118-p152631532.html?spid=152631584,15,,,dongu
"Đầm ngủ lụa 2 dây sexy quyến rũ, vảy ngủ lụa hàng Quảng Châu cao cấp hở lưng sexy D232",330.000₫,https://tiki.vn/dam-ngu-lua-2-day-sexy-quyen-ru-vay-ngu-lua-hang-quang-chau-cao-cap-ho-lung-sexy-d232-p272842991.html?spid=272842994,16,,,dongu
đồ bộ mặc nhà vải kate,190.000,https://tiki.vn/do-bo-mac-nha-vai-kate-p244131918.html?spid=244131938,17,,,dongu
,,https://tiki.vn/set-quan-short-ao-croptop-celine-ullzang-anh-that-co-san-p178578149.html?spid=178578159,18,,,dongu
"đồ bộ mặc nhà mẫu lửng, chất kate hàn",225.000₫,https://tiki.vn/do-bo-mac-nha-mau-lung-p174740785.html?spid=174740829,19,,Đã bán 5,dongu
Tất lưới toàn thân Body Stocking màu đen sexy quyến rũ hàng cao cấp - cosplay phòng ngủ,115.000₫,https://tiki.vn/tat-luoi-toan-than-body-stocking-mau-den-sexy-quyen-ru-hang-cao-cap-cosplay-phong-ngu-p114853311.html?spid=114853317,20,,,dongu
Bộ Đồ Satin Dài Nữ Vincy Thoáng Mát BSD021W11,786.000₫,https://tiki.vn/bo-do-satin-dai-nu-vincy-thoang-mat-bsd021w11-p198698842.html?spid=198698850,21,,,dongu
"Cosplay hầu gái với tạp dề, quần lót lọt khe và phụ kiện - SMS475",109.000₫,https://tiki.vn/cosplay-hau-gai-voi-tap-de-quan-lot-lot-khe-va-phu-kien-sms475-p271533236.html?spid=271533252,22,,,dongu
Bodysuit ren thun tay dài gợi cảm TK1334,200.000₫,https://tiki.vn/bodysuit-ren-thun-tay-dai-goi-cam-tk1334-p139450857.html?spid=139450861,23,,Đã bán 1,dongu
Đầm Ngủ Phi Lụa Wannabe DN602 Hai Dây Cúp Mút Thoải Mái Nhẹ Nhàng,550.000₫,https://tiki.vn/dam-ngu-phi-lua-wannabe-dn602-hai-day-cup-mut-thoai-mai-nhe-nhang-p225972159.html?spid=225972169,24,,Đã bán 1,dongu
Bộ pijama nữ cotton tay dài quần dài xuân hè thu màu sắc ngọt ngào dễ thương BK08,185.000,https://tiki.vn/bo-pijama-nu-cotton-tay-da-i-qua-n-da-i-xuan-he-thu-ma-u-sa-c-ngo-t-nga-o-de-thuong-bk08-p136836446.html?spid=136836499,25,,Đã bán 1,dongu
,,https://tiki.vn/vay-ngu-lua-duoi-ca-dang-dai-mac-nha-sang-trong-kin-dao-du-mau-du-size-hantu-dc-p126236002.html?spid=126236008,26,,,dongu
Váy ngủ đầm ngủ ren hoa xuyên thấu thoáng mát + Quần lót sexy,102.850₫,https://tiki.vn/vay-ngu-dam-ngu-ren-hoa-xuyen-thau-thoang-mat-quan-lot-sexy-p178240768.html?spid=178240770,27,,Đã bán 5,dongu
Bộ Cotton Mặc Nhà Cổ Tim Áo Cộc Quần Dài Cho Nữ Trung Niên,249.000₫,https://tiki.vn/bo-cotton-mac-nha-co-tim-ao-coc-quan-dai-cho-nu-trung-nien-p53057450.html?spid=81007306,28,,Đã bán 1,dongu
Váy Ngủ sexy phi lụa cao cấp - Đỏ,115.000₫,https://tiki.vn/vay-ngu-sexy-phi-lua-cao-cap-do-p59180634.html?spid=59180635,29,,Đã bán 8,dongu
"Váy ngủ, Váy 2 dây hoa nhí, Váy dáng suông, Đầm ngủ thiết kế lụa mềm mát",50.000₫,https://tiki.vn/va-y-ngu-va-y-2-day-hoa-nhi-va-y-da-ng-suong-da-m-ngu-thie-t-ke-lu-a-me-m-ma-t-p127527298.html?spid=127527316,30,,,dongu
,,https://tiki.vn/bo-quan-ao-ngu-nu-2-day-vien-ren-mac-nha-mua-he-do-mac-o-nha-nu-dui-chat-lua-lanh-tole-nhieu-mau-de-thuong-p148013464.html?spid=148013488,31,,,dongu
Áo choàng ngủ lụa satin dáng dài họa tiết - Vaperla,394.375₫,https://tiki.vn/ao-choang-ngu-lua-satin-dang-dai-hoa-tiet-vaperla-p69273736.html?spid=69273750,32,,Đã bán 24,dongu
Đồ ngủ Cosplay sexy dây đan phía trước,68.000₫,https://tiki.vn/do-ngu-cosplay-sexy-day-dan-phia-truoc-p71047186.html?spid=130293760,33,,,dongu
Áo choàng ngủ WANNABE KI010 áo khoác ngủ kimono dạng cơ bản trơn đơn giản dễ mặc sang trọng,500.000₫,https://tiki.vn/ao-choang-ngu-phi-lua-wannabe-kimono-ki010-p16060589.html?spid=16060612,34,,Đã bán 9,dongu
Bộ quần áo trung niên nữ cho bà cho mẹ-bộ đũi ống sớ sang trọngs,299.000,https://tiki.vn/bo-quan-ao-trung-nien-nu-cho-ba-cho-me-bo-dui-ong-so-sang-trongs-p180050464.html?spid=180050475,35,,Đã bán 1,dongu
,,https://tiki.vn/dam-tole-nu-vincy-thoang-mat-ddk033s11-p248651307.html?spid=248651311,36,,,dongu
Bộ Đồ Thun Dài Nữ Vincy Thoáng Mát BTD090W21,898.000₫,https://tiki.vn/bo-do-thun-dai-nu-vincy-thoang-mat-btd090w21-p208904565.html?spid=198342369,37,,,dongu
Set đồ cosplay thỏ ngọc sexy với áo bodysuit 2 dây hở mông - SMS012,99.000₫,https://tiki.vn/set-do-cosplay-tho-ngoc-sexy-voi-ao-bodysuit-2-day-ho-mong-sms012-p271532211.html?spid=272547638,38,,,dongu
Váy ngủ xuyên thấu hở lưng kèm quần lót lọt khe sexy P89 - Đầm ngủ hở lưng gợi cảm - Đồ ngủ nữ sexy,159.000₫,https://tiki.vn/vay-ngu-xuyen-thau-ho-lung-kem-quan-lot-lot-khe-sexy-p89-dam-ngu-ho-lung-goi-cam-do-ngu-nu-sexy-p198944748.html?spid=198944752,39,,,dongu
Đồ mặc nhà đồ bộ dài nữ lụa in họa tiết hoa có túi siêu dễ thương siêu mát dưới 70kg,160.000,https://tiki.vn/do-mac-nha-nu-lua-cao-cap-in-hoa-tiet-hoa-co-tui-sieu-de-thuong-sieu-mat-duoi-70kg-p84839625.html?spid=84839629,40,,,dongu
