title,price,link_item,index,discount,sales,category
Áo phông đôi nam nữ hàng sẵn,81.900₫,https://tiki.vn/ao-phong-doi-nam-nu-hang-san-p262586192.html?spid=262586302,1,,,dodoi
Áo sweater nam nữ,390.000₫,https://tiki.vn/ao-sweater-nam-nu-p167980638.html?spid=167980647,2,,,dodoi
Áo đôi: Váy form body phối màu + Áo thun nam,270.000₫,https://tiki.vn/ao-doi-vay-form-body-phoi-mau-ao-thun-nam-p105338348.html?spid=105338592,3,,Đã bán 1,dodoi
Áo đôi chữ tàu tim bo gấu TH6,517.000,https://tiki.vn/ao-doi-chu-tau-tim-bo-gau-th6-p158473215.html?spid=158473249,4,,,dodoi
,,https://tiki.vn/ao-da-ma-21106-p192383602.html?spid=192383615,5,,,dodoi
"Áo đôi, áo thun đôi, áo cặp, áo nam nữ uniex from rộng",132.000₫,https://tiki.vn/ao-doi-ao-thun-doi-ao-cap-ao-nam-nu-uniex-from-rong-p106654925.html?spid=106654944,6,,,dodoi
QUẦN ĐÔI ĐI BIỂN XINH LUNG LINH - giá 1 quần,49.000₫,https://tiki.vn/quan-doi-di-bien-xinh-lung-linh-gia-1-quan-p248270217.html?spid=248270320,7,,,dodoi
Hoodie đôi in thỏ tai cụp (có 4 màu),120.000₫,https://tiki.vn/hoodie-doi-in-tho-tai-cup-co-4-mau-p105336815.html?spid=105337197,8,,,dodoi
Áo Thun Gia Đình Tay Dài Bo Họa Tiết Con Tuần Lộc 2020,75.000₫,https://tiki.vn/ao-thun-gia-dinh-tay-dai-bo-hoa-tiet-con-tuan-loc-2020-p147003929.html?spid=147003937,9,,,dodoi
,,https://tiki.vn/ao-thun-meo-ami-ao-tay-ngan-co-tron-mau-trang-sgk021t-p95907612.html?spid=95907946,10,,,dodoi
Áo cặp tình nhân thời trang,170.000₫,https://tiki.vn/ao-cap-tinh-nhan-thoi-trang-p107972084.html?spid=107972105,11,,,dodoi
"Đồ đồ đôi đi biển xinh xắn chất vải bao đẹp in sắc nét, giá 1 bộ luôn quần và áo",79.000₫,https://tiki.vn/do-do-doi-di-bien-xinh-xan-chat-vai-bao-dep-in-sac-net-gia-1-bo-luon-quan-va-ao-p248272765.html?spid=248274711,12,,,dodoi
,,https://tiki.vn/ao-thun-cotton-100-sieu-thoang-mat-p105336399.html?spid=105336505,13,,,dodoi
Áo Thun Gia Đình Mặt Cười Vẽ Màu,79.000₫,https://tiki.vn/ao-thun-gia-dinh-mat-cuoi-ve-mau-p172588454.html?spid=172588460,14,,,dodoi
Áo thun đôi tay dài Unisex (có bán lẻ),110.000₫,https://tiki.vn/ao-thun-doi-tay-dai-unisex-co-ban-le-p105337927.html?spid=105338195,15,,,dodoi
Áo phông đi biển cho cả gia đình,72.000₫,https://tiki.vn/ao-phong-di-bien-cho-ca-gia-dinh-p108634467.html?spid=108634513,16,,,dodoi
"Áo gia đình đẹp, phong cách",80.000₫,https://tiki.vn/ao-gia-dinh-dep-phong-cach-p97046683.html?spid=97046728,17,,,dodoi
,,https://tiki.vn/do-doi-di-bien-cute-cho-cap-doi-nhom-gia-dinh-hang-loai-1-p248269984.html?spid=248270073,18,,,dodoi
SET ÁO GIA ĐÌNH HÌNH CÁ MẬP,79.000₫,https://tiki.vn/set-ao-gia-dinh-hinh-ca-map-p167215759.html?spid=167216035,19,,,dodoi
Áo gia đình thun cotton tay ngắn,130.000₫,https://tiki.vn/ao-gia-dinh-thun-cotton-tay-ngan-p149067913.html?spid=149067925,20,,,dodoi
Áo sơ mi cặp có cổ sơmi đôi đẹp hàn quốc giá rẻ loang đen đỏ TCS,176.000₫,https://tiki.vn/ao-so-mi-cap-co-co-somi-doi-dep-han-quoc-gia-re-loang-den-do-tcs-p96542659.html?spid=96542692,21,,,dodoi
Áo thun cotton tay dài unisex (có 3 màu) (có bán lẻ),110.000₫,https://tiki.vn/ao-thun-cotton-tay-dai-unisex-co-3-mau-co-ban-le-p105336409.html?spid=105336890,22,,,dodoi
Áo Thun Gia Đình In Hình Cây Dừa - I796,79.000₫,https://tiki.vn/ao-thun-gia-dinh-in-hinh-cay-dua-i796-p167217417.html?spid=167217784,23,,,dodoi
"Đồ đôi, đồ teambuilding đi biển áo in họa tiết xinh xắn chất vải đẹp, đủ size",94.700₫,https://tiki.vn/do-doi-do-teambuilding-di-bien-ao-in-hoa-tiet-xinh-xan-chat-vai-dep-du-size-p169568682.html?spid=169569896,24,,,dodoi
"áo đôi bắn tim AD8, chất đẹp",50.000₫,https://tiki.vn/ao-doi-ban-tim-ad8-chat-dep-p126188346.html?spid=126189472,25,,,dodoi
,,https://tiki.vn/ao-nhom-di-choi-dc63-du-lich-bien-phong-thun-chat-dep-bo-di-ma-song-lop-minh-chua-18-doan-ket-ta-chap-het-p126185519.html?spid=126188294,26,,,dodoi
Áo gia đình size 5-100kg,130.000₫,https://tiki.vn/ao-gia-dinh-size-5-100kg-p149068398.html?spid=149068509,27,,,dodoi
Áo Thun Cặp Đôi so Cute In Họa Tiết thả tim xinh xắn chất thun đẹp,79.000₫,https://tiki.vn/ao-thun-cap-doi-so-cute-in-hoa-tiet-tha-tim-xinh-xan-chat-thun-dep-p248274846.html?spid=248276080,28,,,dodoi
"áo nhóm đi chơi DC79, du lịch biển, phông, thun, chất đẹp, Chơi trội phải có hội, ai say khiêng về",50.000₫,https://tiki.vn/ao-nhom-di-choi-dc79-du-lich-bien-phong-thun-chat-dep-choi-troi-phai-co-hoi-ai-say-khieng-ve-p126184868.html?spid=126188173,29,,,dodoi
Áo Thun Đôi Tay Lỡ Logo MY đơn giản,43.120₫,https://tiki.vn/ao-thun-doi-tay-lo-logo-my-don-gian-p178004051.html?spid=178004053,30,,,dodoi
,,https://tiki.vn/ao-gia-dinh-thun-cotton-loai-1-p149068685.html?spid=149068811,31,,,dodoi
Áo Phông Đôi Nam Nữ Họa Tiết Khối Màu,79.000₫,https://tiki.vn/ao-phong-doi-nam-nu-hoa-tiet-khoi-mau-p167217376.html?spid=167217750,32,,,dodoi
QC188 QUẦN VIỀN REN,89.000₫,https://tiki.vn/qc188-quan-vien-ren-p169112774.html?spid=169112806,33,,,dodoi
"áo nhóm đi chơi DC34, du lịch, biển, phông, thun,cotton, xách balo lên và đi,CỐI XAY GIÓ,summer",45.000₫,https://tiki.vn/ao-nhom-di-choi-dc34-du-lich-bien-phong-thun-cotton-xach-balo-len-va-di-coi-xay-gio-summer-p126184170.html?spid=126186052,34,,,dodoi
"Áo thun cặp đôi xinh xắn, chất vải đẹp, giá 1 áo",79.000₫,https://tiki.vn/ao-thun-cap-doi-xinh-xan-chat-vai-dep-gia-1-ao-p248272834.html?spid=248273187,35,,,dodoi
,,https://tiki.vn/do-doi-di-bien-mau-moi-dep-sang-chanh-quan-soc-xanh-ao-in-hoa-tiet-dua-hau-hello-summer-gia-1-bo-gom-1-quan-1-ao-p248270308.html?spid=248270925,36,,,dodoi
Áo Thun Đôi Họa Tiết Nhịp Tim Xinh Xắn,79.000₫,https://tiki.vn/ao-thun-doi-hoa-tiet-nhip-tim-xinh-xan-p167214275.html?spid=167215151,37,,,dodoi
Áo thun đôi xinh xắn chất vải đẹp,79.000₫,https://tiki.vn/ao-thun-doi-xinh-xan-chat-vai-dep-p198359518.html?spid=198359536,38,,,dodoi
"áo nhóm đi chơi DC64, du lịch biển, phông, thun, chất đẹp,bơ đi mà sống,lớp mình chưa 18, LÀM HẾT SỨC CHƠI HẾT MÌNH",50.000₫,https://tiki.vn/ao-nhom-di-choi-dc64-du-lich-bien-phong-thun-chat-dep-bo-di-ma-song-lop-minh-chua-18-lam-het-suc-choi-het-minh-p126184396.html?spid=126189581,39,,,dodoi
Quần đôi đi biển xinh lung linh ( giá 1 quần ),49.000₫,https://tiki.vn/quan-doi-di-bien-xinh-lung-linh-gia-1-quan-p248271293.html?spid=248271567,40,,,dodoi
