title,price,link_item,index,discount,sales,category
Áo Đôi Rocking Dance Nam Nữ S,159.000₫,https://tiki.vn/ao-doi-rocking-dance-nam-nu-p10816714.html?spid=10816728,1,-5%,Đã bán 1,dodoi
Áo Đôi Chữ Love Đỏ Nam Nữ,159.000₫,https://tiki.vn/ao-doi-chu-love-do-nam-nu-p10816498.html?spid=10816508,2,-5%,Đã bán 2,dodoi
Bộ Áo Thun Đôi Anh chỉ cần Yêu Em Thôi Màu Trắng Nam Nữ,225.000₫,https://tiki.vn/bo-ao-thun-doi-anh-chi-can-yeu-em-thoi-mau-trang-nam-nu-p11053757.html?spid=11053829,3,,,dodoi
Bộ Áo Thun Đôi Tim Yêu Màu Trắng Nam Nữ,225.000,https://tiki.vn/bo-ao-thun-doi-tim-yeu-mau-trang-nam-nu-p10952988.html?spid=10952992,4,,,dodoi
,,https://tiki.vn/bo-ao-thun-doi-chipi-den-cuoi-con-duong-nam-nu-p10860397.html?spid=10860401,5,-5%,,dodoi
Bộ Áo Thun Đôi Paris Màu Trắng Nam Nữ,225.000₫,https://tiki.vn/bo-ao-thun-doi-paris-mau-trang-nam-nu-p11053370.html?spid=11053392,6,,Đã bán 1,dodoi
Bộ Áo Thun Đôi Chữ Love Xanh Hồng Nam Nữ L,270.000₫,https://tiki.vn/bo-ao-thun-doi-chu-love-xanh-hong-nam-nu-p10861853.html?spid=10861899,7,,,dodoi
Bộ Áo Thun Đôi ChiPi Hôn Cute Màu Trắng,159.000₫,https://tiki.vn/bo-ao-thun-doi-chipi-hon-cute-mau-trang-p11119882.html?spid=11119886,8,,,dodoi
Bộ Áo Thun Đôi Happy Family Cute Màu Trắng Nam Nữ M,159.000,https://tiki.vn/bo-ao-thun-doi-happy-family-cute-mau-trang-nam-nu-p11107030.html?spid=11107064,9,,,dodoi
,,https://tiki.vn/bo-ao-thun-doi-nam-nu-a23-p11644453.html?spid=11644517,10,,,dodoi
Bộ Áo Thun Đôi Vân Tay Tim Màu Trắng Nam Nữ,159.000₫,https://tiki.vn/bo-ao-thun-doi-van-tay-tim-mau-trang-nam-nu-p11121456.html?spid=11121484,11,,,dodoi
Bộ Áo Thun Đôi Nam Nữ A80 XXXL,159.000,https://tiki.vn/bo-ao-thun-doi-nam-nu-a80-p11528072.html?spid=11528144,12,,,dodoi
,,https://tiki.vn/bo-ao-thun-doi-nam-nu-a69-p11526365.html?spid=11526383,13,,,dodoi
Bộ Áo Thun Đôi Nam Nữ A66,159.000₫,https://tiki.vn/bo-ao-thun-doi-nam-nu-a66-p11525883.html?spid=11525951,14,,,dodoi
Bộ Áo Thun Đôi Nam Nữ A71,159.000₫,https://tiki.vn/bo-ao-thun-doi-nam-nu-a71-p11526697.html?spid=11526721,15,,Đã bán 2,dodoi
Bộ Áo Thun Đôi Nam Nữ A57,159.000₫,https://tiki.vn/bo-ao-thun-doi-nam-nu-a57-p11524115.html?spid=11524183,16,,,dodoi
Bộ Áo Thun Đôi Nam Nữ A65,159.000,https://tiki.vn/bo-ao-thun-doi-nam-nu-a65-p11525727.html?spid=11525791,17,,,dodoi
,,https://tiki.vn/bo-ao-thun-doi-chipi-meo-dang-yeu-mau-trang-nam-nu-p11092484.html?spid=11092514,18,,,dodoi
Bộ Áo Thun Đôi Nam Nữ A13 L,159.000₫,https://tiki.vn/bo-ao-thun-doi-nam-nu-a13-p11519354.html?spid=11519390,19,,,dodoi
Bộ Áo Thun Đôi Chipi Happy Valentine's Day Đáng Yêu Màu Trắng Nam Nữ XL,225.000₫,https://tiki.vn/bo-ao-thun-doi-chipi-happy-valentine-s-day-dang-yeu-mau-trang-nam-nu-p11088383.html?spid=11088453,20,,Đã bán 1,dodoi
Bộ Áo Thun Đôi Chó Mặt Xệ Màu Trắng Nam Nữ,159.000₫,https://tiki.vn/bo-ao-thun-doi-cho-mat-xe-mau-trang-nam-nu-p11104801.html?spid=11104823,21,,,dodoi
Bộ Áo Thun Đôi Chipi Hươu-Bướm Màu Trắng Nam Nữ,159.000₫,https://tiki.vn/bo-ao-thun-doi-chipi-huou-buom-mau-trang-nam-nu-p11098219.html?spid=11098261,22,,,dodoi
Bộ Áo Thun Đôi Chipi Pig Mùa Đông Màu Trắng Nam Nữ S,159.000₫,https://tiki.vn/bo-ao-thun-doi-chipi-pig-mua-dong-mau-trang-nam-nu-p11099674.html?spid=167859811,23,,,dodoi
Bộ Áo Thun Đôi Chipi Hươu Cao Cổ Màu Trắng Nam Nữ,159.000₫,https://tiki.vn/bo-ao-thun-doi-chipi-huou-cao-co-mau-trang-nam-nu-p11097493.html?spid=167859735,24,,,dodoi
Bộ Áo Thun Đôi Nam Nữ A36,159.000,https://tiki.vn/bo-ao-thun-doi-nam-nu-a36-p11521324.html?spid=11521390,25,,Đã bán 1,dodoi
,,https://tiki.vn/bo-ao-thun-doi-nguoi-tuyet-mau-trang-nam-nu-p11095308.html?spid=11095348,26,,,dodoi
"Áo gia đình , Đồ gia đình tết 2022",30.000₫,https://tiki.vn/ao-gia-dinh-do-gia-dinh-tet-2022-p207327387.html?spid=207327607,27,,,dodoi
"SET BỘ NỈ DÀI UNISEX DÀY DẶN NHIỀU MÀU MẶC ĐỒNG PHỤC NHÓM, MẶC ĐI ĐÀ LẠT CÁ TÍNH Có Tách Lẻ",49.000₫,https://tiki.vn/set-bo-ni-dai-unisex-day-dan-nhieu-mau-mac-dong-phuc-nhom-mac-di-da-lat-ca-tinh-co-tach-le-p249242189.html?spid=249242253,28,,,dodoi
"Áo Thun cặp Nam-Nữ in hình mèo cực dễ thương , thích hợp cho các cặp đôi trẻ trung, năng động, cho các nhóm bạn đi đêm, đi phượt, bão, nhìn đã mắt, bao ngầu, bao chất, (giá trên dành cho 1 sản phẩm) - S",130.000₫,https://tiki.vn/ao-thun-cap-nam-nu-in-hinh-meo-cuc-de-thuong-thich-hop-cho-cac-cap-doi-tre-trung-nang-dong-cho-cac-nhom-ban-di-dem-di-phuot-bao-nhin-da-mat-bao-ngau-bao-chat-p75777691.html?spid=75777693,29,,Đã bán 9,dodoi
Đồ chơi Máy Bay Xốp Đồ Chơi Vận Động Cho Bé,99.000₫,https://tiki.vn/do-choi-may-bay-xop-do-choi-van-dong-cho-be-p199701503.html?spid=199701507,30,,,dodoi
,,https://tiki.vn/ao-doi-sweater-nam-nu-mm10-ao-doi-sweater-in-meo-chem-y-nghia-vai-ni-bong-in-hinh-de-thuong-p248326730.html?spid=248326732,31,,,dodoi
Nhiệt Kế Đo Nước Tắm Cho Bé Cao Cấp Tiện Lợi An Toàn Ngộ Nghĩnh,44.999₫,https://tiki.vn/nhiet-ke-do-nuoc-tam-cho-be-cao-cap-tien-loi-an-toan-ngo-nghinh-p199950210.html?spid=209551699,32,,Đã bán 3,dodoi
Áo thun nam cổ tròn đẹp đủ màu sản xuất tại việt nam 99k / 1 chiếc,94.000₫,https://tiki.vn/ao-thun-nam-co-tron-dep-du-mau-san-xuat-tai-viet-nam-99k-1-chiec-p160399773.html?spid=160399893,33,,,dodoi
Áo thun Ih nom uh nit hình mặt nạ kim cương phông basic tee ngắn cổ tròn cộc tay,418.523₫,https://tiki.vn/ao-thun-ih-nom-uh-nit-hinh-mat-na-kim-cuong-phong-basic-tee-ngan-co-tron-coc-tay-tai-shopvietso1-p160399800.html?spid=160399872,34,,,dodoi
Bộ Đồ Lam In Họa Tiết 5D,327.750,https://tiki.vn/bo-do-lam-in-hoa-tiet-5d-p273438512.html?spid=273438518,35,,Đã bán 7,dodoi
,,https://tiki.vn/ao-sweater-ni-chui-tron-nhieu-mau-lua-chon-bat-trend-p160399015.html?spid=160399107,36,,,dodoi
Áo hoodie nỉ trơn baisic HT12,284.000₫,https://tiki.vn/ao-hoodie-ni-tron-baisic-ht12-p160398781.html?spid=160398809,37,,,dodoi
Áo gia đình màu đỏ 3/4/5 người,45.000₫,https://tiki.vn/ao-gia-dinh-mau-do-3-4-5-nguoi-p207325636.html?spid=207325647,38,,,dodoi
Cặp quần đôi mẫu mới đẹp ( giá combo 2 quần),119.000₫,https://tiki.vn/cap-quan-doi-mau-moi-dep-gia-combo-2-quan-p248275471.html?spid=248275546,39,,,dodoi
Áo rút 2 bên 60-90kg,119.000,https://tiki.vn/ao-rut-2-ben-60-90kg-p177136510.html?spid=177136511,40,,,dodoi
