title,price,link_item,index,discount,sales,brand
Áo Khoác Nhung tăm 2 lớp thêu chữ R Nam Nữ freesize dưới 65kg,158.000₫,https://tiki.vn/ao-khoac-nhung-tam-2-lop-theu-chu-r-nam-nu-freesize-duoi-65kg-thoitranglt-p190320721.html?spid=190320736,1,,,NHUH20
Áo Khoác Cardigan W Xanh Mặt Cười Ulzzang,94.000₫,https://tiki.vn/ao-khoac-cardigan-w-xanh-mat-cuoi-ulzzang-p204041479.html?spid=204041481,2,,,NHUH20
"Áo thun unisex phản quang form rộng tay lỡ in slogan Vui Lòng Đứng Xa 2M cực trend, áo phông nam nữ mặc mùa hè",79.000₫,https://tiki.vn/ao-thun-unisex-phan-quang-form-rong-tay-lo-in-slogan-vui-long-dung-xa-2m-cuc-trend-ao-phong-nam-nu-mac-mua-he-p176384956.html?spid=176384964,3,,,NHUH20
Áo Hoodies Nữ Chui Đầu Có Nón In Chữ Chất Nỉ Mềm Mịn Form Rộng Mặc Đẹp Thoải Mái Thời Trang FASHION,102.000,https://tiki.vn/ao-hoodies-nu-chui-dau-co-non-in-chu-chat-ni-mem-min-form-rong-mac-dep-thoai-mai-thoi-trang-super-fashion-p197296665.html?spid=197296683,4,,,NHUH20
,,https://tiki.vn/ao-khoac-du-nu-phoi-kieu-dang-lung-form-rong-chat-lieu-vai-mat-me-day-rut-ao-tien-loi-ao-dep-hang-hot-trend-ao-khoac-croptop-du-phoi-mau-logo-in-noi-co-day-rut-lai-hoa-tiet-in-chu-noi-chay-soc-tay-thoi-trang-duong-pho-p271985669.html?spid=271985681,5,,,NHUH20
Áo Bomber Jacket Dù 2 Lớp STURDUR Unisex Nam Nữ (Ảnh Thật/Có sẵn),109.000₫,https://tiki.vn/ao-bomber-jacket-du-2-lop-sturdur-unisex-nam-nu-anh-that-co-san-p156189009.html?spid=156189049,6,,Đã bán 1,NHUH20
"Áo Khoác bomber Dù 2 Lớp Style Bóng Chày Unisex Nam Nữ in chữ FOREST phong cách Hàn Quốc, Áo khoác dù Bomber form rộng 2 lớp GAKD10 Áo khoác nam nữ phong cách Hàn Quốc",100.000₫,https://tiki.vn/ao-khoac-bomber-du-2-lop-style-bong-chay-unisex-nam-nu-in-chu-forest-phong-cach-han-quoc-p169349102.html?spid=169349113,7,,,NHUH20
ÁO HOODIE - ÁO KHOÁC NỈ NGOẠI (Ảnh Thật) HOOIDE MỚI HỌA TIẾT IN CHỮ AIBAMA DỄ THƯƠNG,107.000₫,https://tiki.vn/ao-hoodie-ao-khoac-ni-ngoai-anh-that-hooide-moi-hoa-tiet-in-chu-aibama-de-thuong-p195707958.html?spid=195707990,8,,,NHUH20
"ÁO KHOÁC HOODEI ZIP IT'S WHAT IT'S DÀNH CHO NAM NỮ - Nỉ LOCAL BRAND, Áo khoác hoodie có nón",105.000,https://tiki.vn/ao-khoac-hoodei-zip-it-s-what-it-s-danh-cho-nam-nu-ni-local-brand-ao-khoac-hoodie-co-non-p260791427.html?spid=260791431,9,,,NHUH20
,,https://tiki.vn/ao-khoac-nu-super-fashion-co-non-2-lop-co-day-keo-fom-rong-hot-trend-p197595836.html?spid=197595849,10,,,NHUH20
Áo Khoác Cardigan Nỉ Bông Bomber Form Rộng Unisex Nam Nữ Hàn Quốc In TT 20-21 Ulzzang,91.000₫,https://tiki.vn/ao-khoac-cardigan-ni-bong-bomber-form-rong-unisex-nam-nu-han-quoc-in-tt-20-21-ulzzang-nupakachi-p169348849.html?spid=169348853,11,,,NHUH20
ÁO HOODIE - ÁO KHOÁC NỈ NGOẠI FORM RỘNG TAY PHỒNG NỈ DÀY DẶN FRIEN FRIEN (Ảnh Thật) HOOIDE MỚI,99.000₫,https://tiki.vn/ao-hoodie-ao-khoac-ni-ngoai-form-rong-tay-phong-ni-day-dan-frien-frien-anh-that-hooide-moi-p178577454.html?spid=178577483,12,,,NHUH20
,,https://tiki.vn/ao-hoodie-ao-khoac-ni-bong-bo-sua-form-rong-unisex-nam-nu-hot-trend-2021-p169348803.html?spid=169348806,13,,,NHUH20
Áo khoác bomber dù SKULL form rộng Unisex Áo khoác nam nữ 2 lớp Chống Nắng ulzzang Jacket Bomber,106.000₫,https://tiki.vn/ao-khoac-bomber-du-skull-form-rong-unisex-ao-khoac-nam-nu-2-lop-chong-nang-ulzzang-jacket-bomber-zalofa-p157412776.html?spid=157412789,14,,,NHUH20
Áo Khoác zip nỉ bông mùa đông thêu tag X CHILD màu kem form rộng nam nữ unisex,105.000₫,https://tiki.vn/ao-khoac-zip-ni-bong-mua-dong-theu-tag-x-child-mau-kem-form-rong-nam-nu-unisex-p254117741.html?spid=254117743,15,,,NHUH20
Áo Khoác Hoodie Zip TODAY IS MY FRIDAY Form Rộng Vải Nỉ Bông Tay Dài Phong Cách Ulzzang Nam Nữ Unisex (Ảnh Thật/ Có Sẵn),115.000₫,https://tiki.vn/ao-khoac-hoodie-zip-today-is-my-friday-form-rong-vai-ni-bong-tay-dai-phong-cach-ulzzang-nam-nu-unisex-anh-that-co-san-p198672454.html?spid=198672471,16,,,NHUH20
"ÁO THUN TAY DÀI IN HÌNH CHÚ BÁO HỒNG CHẤT THUN NỈ NGOẠI, ÁO HOODIES CHUI ĐẦU PHONG CÁCH HÀN QUỐC, NĂNG ĐỘNG ĐA DẠNG",106.000,https://tiki.vn/ao-hoodie-pe-khong-non-chat-vai-mem-min-in-hinh-bao-hong-cuc-xinh-p162030498.html?spid=162030499,17,,,NHUH20
,,https://tiki.vn/ao-thun-cotton-tay-ngan-phong-cach-han-quoc-co-tron-in-hinh-gau-va-dau-tay-thoi-trang-mua-he-p248260060.html?spid=248260064,18,,,NHUH20
Áo Sweater Bánh Màu Be Chất Nỉ Lót Bông Dày Dặn Ấm Áp- Áo Nỉ Cổ Tròn Ulzzang,100.000₫,https://tiki.vn/ao-sweater-banh-mau-be-chat-ni-lot-bong-day-dan-am-ap-ao-ni-co-tron-ulzzang-p191521207.html?spid=191603593,19,,,NHUH20
Áo Khoác Nỉ Form Rộng Dây Kéo SENTINIAL ulzzang unisex ( ảnh thật + hàng sẵn ),100.000₫,https://tiki.vn/ao-khoac-ni-form-rong-day-keo-sentinial-ulzzang-unisex-anh-that-hang-san-p192729135.html?spid=192729142,20,,Đã bán 2,NHUH20
Áo Khoác Dù Bomber 2 Lớp In W Kiểu Dáng Lửng Craptop Phối Cúc Bấm Năng Động Trẻ Trung,100.000₫,https://tiki.vn/ao-khoac-du-bomber-2-lop-in-w-kieu-dang-lung-craptop-phoi-cuc-bam-nang-dong-tre-trung-tp63-p193370488.html?spid=193370519,21,,,NHUH20
Áo Khoác Dù Bomber Unisex Sentinials Kiểu Dáng Hàn Quốc Siêu Ngầu Hot Trend Siêu Hot - TP,100.000₫,https://tiki.vn/ao-khoac-du-bomber-unisex-sentinials-kieu-dang-han-quoc-sieu-ngau-hot-trend-sieu-hot-tp-p193370444.html?spid=193370460,22,,,NHUH20
Áo Sơ Mi Tay Lỡ BUNNY Vải Kaki Chéo Form Rộng Ulzzang Unisex,124.000₫,https://tiki.vn/ao-so-mi-tay-lo-bunny-vai-kaki-cheo-form-rong-ulzzang-unisex-p198672435.html?spid=198672439,23,,,NHUH20
"Áo Hoodie Nỉ Bông 2 NÓN THÊU CERTAYN Form Rộng FREE SIZE Unisex Ulzzang, Áo hoodies nữ chất nỉ form rộng chất dầy dặn có mũ - Áo nỉ lót lông Quảng Châu cao cấp",100.000₫,https://tiki.vn/ao-hoodie-ni-bong-2-non-theu-certayn-form-rong-free-size-unisex-ulzzang-nupakachi-p169348646.html?spid=169348680,24,,Đã bán 3,NHUH20
Áo Thun cotton Tay Ngắn In Hình Gấu Phong Cách Hàn Quốc Cho Nữ,98.000₫,https://tiki.vn/ao-thun-cotton-tay-ngan-in-hinh-gau-phong-cach-han-quoc-cho-nu-p243037766.html?spid=243037770,25,,,NHUH20
,,https://tiki.vn/ao-khoac-du-jacket-form-rong-swd-unsiex-nam-nu-phong-cach-ulzzang-thoi-trang-hottrend-de-mac-p193370463.html?spid=193370483,26,,,NHUH20
Áo hoodie form rộng Unisex nỉ ngoại BAN%( ảnh thật 100%),105.000₫,https://tiki.vn/ao-hoodie-form-rong-unisex-ni-ngoai-ban-anh-that-100-p197172605.html?spid=197172627,27,,,NHUH20
Áo cardigan nữ form rộng in họa tiết chữ R dễ thương Fashion,91.000₫,https://tiki.vn/ao-cardigan-nu-form-rong-in-hoa-tiet-chu-r-de-thuong-super-fashion-p197595971.html?spid=197596025,28,,,NHUH20
Áo Khoác Bomber Jacket - Áo Khoác Nỉ Lót Bông Form Rộng Unisex in icon Smile,100.000₫,https://tiki.vn/ao-khoac-bomber-jacket-ao-khoac-ni-lot-bong-form-rong-unisex-in-icon-smile-p169347500.html?spid=169347538,29,,Đã bán 1,NHUH20
"Áo thun unisex form rộng tay lỡ in phản quang in hình lá bài độc lạ, áo phông nam nữ đẹp mặc mát mùa hè",79.000₫,https://tiki.vn/ao-thun-unisex-form-rong-tay-lo-in-phan-quang-in-hinh-la-bai-doc-la-ao-phong-nam-nu-dep-mac-mat-mua-he-p176380395.html?spid=176380403,30,,,NHUH20
,,https://tiki.vn/ao-khoac-bomber-varsity-jacket-gau-du-das-2-lop-form-rong-nam-nu-unisex-tre-trung-nang-dong-ulzzang-p176310601.html?spid=176310607,31,,,NHUH20
"Áo Khoác Hoodie in SHIN cậu bé bút chì,chât Nỉ Basic Unisex Form Rộng Tay Phồng Mũ To 2 Lớp",102.000₫,https://tiki.vn/ao-khoac-hoodie-in-shin-cau-be-but-chi-chat-ni-basic-unisex-form-rong-tay-phong-mu-to-2-lop-p246231190.html?spid=246231252,32,,Đã bán 1,NHUH20
Áo Khoác Nhung Gân JONEY Form Rộng Tay Dài Unisex Nam Nữ Ulzzang (Ảnh Thật),158.000₫,https://tiki.vn/a-o-khoa-c-nhung-gan-joney-form-ro-ng-tay-da-i-unisex-nam-nu-ulzzang-a-nh-tha-t-p169347658.html?spid=169347715,33,,,NHUH20
Áo Khoác Bomber BOB Jacket Form Rộng Vải Khaki Dày Dặn Phong Cách Ulzzang Unisex,127.000₫,https://tiki.vn/ao-khoac-bomber-bob-jacket-form-rong-vai-khaki-day-dan-phong-cach-ulzzang-unisex-p186285172.html?spid=186285182,34,,,NHUH20
Áo Khoác Zip Kéo Nỉ Form Rộng Icon Thêu SMILE 2 màu nam và nữ mặc,105.000,https://tiki.vn/ao-khoac-zip-keo-ni-form-rong-icon-theu-smile-pqk-2-mau-nam-va-nu-mac-p204847622.html?spid=204847665,35,,,NHUH20
,,https://tiki.vn/ao-khoac-du-unisex-nam-nu-co-cao-2-lop-phoi-hoa-tiet-hinh-nguoi-phong-cach-nang-dong-ca-tinh-hot-trend-moi-ao-khoac-doi-p217510820.html?spid=217510830,36,,,NHUH20
"Áo khoác VENCEDE 1988 jacket da lộn 2 lớp unisex nam nữ (Ảnh thật/có sẵn), Bomber Jacket chất nhung gân dày dặn lót dù / Nam nữ unisex",167.000₫,https://tiki.vn/ao-khoac-vencede-1988-jacket-da-lon-2-lop-unisex-nam-nu-anh-that-co-san-p178578022.html?spid=178578042,37,,,NHUH20
"Áo nỉ sweater nam nữ unisex Jelly Steve form rộng dài tay basic, áo sweater nam nữ tay bồng Ullzang Hàn Quốc",84.000₫,https://tiki.vn/ao-ni-sweater-nam-nu-unisex-jelly-steve-form-rong-dai-tay-basic-ao-sweater-nam-nu-tay-bong-ullzang-han-quoc-p182587359.html?spid=182587371,38,,,NHUH20
Áo KHOÁC Hoodie KEEPNAIVE Ulzzang Unisex Áo khoác hoodie zip chất liệu nỉ có mũ dài tay khoá kéo,89.000₫,https://tiki.vn/ao-khoac-hoodie-keepnaive-ulzzang-unisex-f-s-shop68-p182587463.html?spid=182587471,39,,,NHUH20
Áo khoác ulzzang nam nữ form rộng thể thao in CS 2 mặt trước sau tay phối trắng - khoác nỉ bomber bóng chày,129.000,https://tiki.vn/ao-khoac-ni-bomber-bong-chay-ao-khoac-ulzzang-hoddie-sweater-nam-nu-form-rong-the-thao-p162030200.html?spid=162030208,40,,,NHUH20
