title,price,link_item,index,discount,sales,brand
Áo Sweater Susu Girl Phối Layer Form Rộng Unisex Ulzzang,104.000₫,https://tiki.vn/ao-sweater-susu-girl-phoi-layer-form-rong-unisex-ulzzang-p177996448.html?spid=177996457,1,,,NIU24
Áo khoác BOMBER nam nữ Unisex Nhung gân CAO CẤP CAO78,154.000₫,https://tiki.vn/ao-khoac-bomber-nam-nu-unisex-nhung-gan-cao-cap-cao78-tp476-p177995758.html?spid=177995796,2,,,NIU24
Áo Khoác Bomber Da Lộn Lửng Nữ Unisex Mẫu Mới chữ B Siêu Đẹp Thời Trang,167.000₫,https://tiki.vn/ao-khoac-bomber-da-lon-lung-nu-unisex-mau-moi-chu-b-sieu-dep-thoi-trang-tp774-p177995410.html?spid=177995456,3,,Đã bán 2,NIU24
Áo khoác lửng croptop nỉ ngoại tay phồng cánh dơi unisex ulzzang siêu hot,98.500₫,https://tiki.vn/ao-khoac-lung-croptop-ni-ngoai-tay-phong-canh-doi-unisex-ulzzang-sieu-hot-tp845-p177995308.html?spid=177995312,4,,,NIU24
,,https://tiki.vn/ao-khoac-nhung-gan-nu-nut-bam-form-rong-phoi-hoa-tiet-chu-gau-phong-cach-sieu-dep-gia-re-tp723-p177995372.html?spid=177995405,5,,,NIU24
"Áo Khoác Nam,Áo Khoác Bomber Nam Nữ Phối Họa Tiết 666 Phong Cách Thời Trang Hàn Quốc ,Chất Nỉ Loại 1",98.000₫,https://tiki.vn/ao-khoac-nam-ao-khoac-bomber-nam-nu-phoi-hoa-tiet-666-phong-cach-thoi-trang-han-quoc-chat-ni-loai-1-tp834-p177995689.html?spid=177995731,6,,,NIU24
Áo Sweater Nữ Form Rộng Potter Vải Nỉ Bông Phong Cách,102.000₫,https://tiki.vn/ao-sweater-nu-form-rong-potter-vai-ni-bong-phong-cach-ulzzang-tuni-store-p177996939.html?spid=177996941,7,,,NIU24
Áo Khoác Nhẹ Nữ BMO Vải Kaki Mềm Có Zip Kéo Phối Cổ Bẻ Phong Cách Hàn Quốc Cute Cá Tính Hot Trend Mới,136.000₫,https://tiki.vn/ao-khoac-nhe-nu-bmo-vai-kaki-mem-co-zip-keo-phoi-co-be-phong-cach-han-quoc-cute-ca-tinh-hot-trend-moi-p178585063.html?spid=178585106,8,,,NIU24
"Áo khoác gió bomber nam nữ cúc bấm chữ S chất dù 2 lớp form rộng , áo khoác ulzzang unisex",97.500₫,https://tiki.vn/a-o-khoa-c-gio-bomber-nam-nu-cu-c-ba-m-chu-s-cha-t-du-2-lo-p-form-ro-ng-a-o-khoa-c-ulzzang-unisex-tp9433-p177995279.html?spid=177995301,9,,,NIU24
,,https://tiki.vn/ao-khoac-bomber-nam-nu-ni-ngoai-nut-bam-phoi-chu-r-kem-mat-cuoi-ngho-nghinh-de-thuong-tp847-p177995263.html?spid=177995269,10,,,NIU24
"Áo Khoác Dù , Áo Khoác Gió Nữ Dây kéo kèm logo Cổ Trụ Phong Cách Cực Chất Thời Trang Hàn Quốc",117.500₫,https://tiki.vn/ao-khoac-du-ao-khoac-gio-nu-day-keo-kem-logo-co-tru-phong-cach-cuc-chat-thoi-trang-han-quoc-tp846-p177995703.html?spid=177995741,11,,,NIU24
"Áo Bomber nam nữ Blakck Miackk , vải dù mero hai lớp phối dây kéo, phong cách street wear cá tính Siêu Đẹp",102.000,https://tiki.vn/ao-bomber-nam-nu-blakck-miackk-vai-du-mero-hai-lop-phoi-day-keo-phong-cach-street-wear-ca-tinh-sieu-dep-wedo-p178585198.html?spid=178585240,12,,,NIU24
,,https://tiki.vn/ao-khoac-bomber-nam-goein-r-chat-vai-du-l2-lop-lot-ca-tinh-wedo-p178585459.html?spid=178585498,13,,,NIU24
Áo Hoodie Nữ FEEL GOOD Chất Nỉ POS Cao Cấp Thiết Kế Tay Phồng Dáng Rộng Cá Tính Siêu Đẹp,103.000₫,https://tiki.vn/ao-hoodie-nu-feel-good-chat-ni-pos-cao-cap-thiet-ke-tay-phong-dang-rong-ca-tinh-sieu-dep-p178584871.html?spid=178584996,14,,,NIU24
Áo khoác Bomber nam nữ in vua bài BLACKA chất vải dù 2 lớp lót cực chất,102.000₫,https://tiki.vn/ao-khoac-bomber-nam-nu-in-vua-bai-blacka-chat-vai-du-2-lop-lot-cuc-chat-wedo-p178585050.html?spid=178585059,15,,,NIU24
Áo Khoác Nhung Nữ Cổ Bẻ 2 Lớp Lót Dù Logo Thêu Số 09 Kiểu BOMBER Độc Lạ Hot Trend Mới,162.000₫,https://tiki.vn/ao-khoac-nhung-nu-co-be-2-lop-lot-du-logo-theu-so-09-kieu-bomber-doc-la-hot-trend-moi-p178585596.html?spid=178585610,16,,,NIU24
"Áo khoác thun nỉ hai nón xinh xắn mẫu in hình gấu, áo khoác nỉ nữ NÓN 2 LỚP IN SATUDR ấn tượng , phong cách mới HOT TREND 2022, Áo Khoác Hoodie Nỉ SATUDR OREAN AGE hình Gấu 2 lớp nón - Nam Nữ Unisex Couple",55.000₫,https://tiki.vn/ao-khoac-thun-ni-hai-non-xinh-xan-mau-in-hinh-gau-sumisu-shop-p171510881.html?spid=171510912,17,,,NIU24
,,https://tiki.vn/ao-khoac-nhung-ao-nhung-bomer-logo-cau-vong-nam-nu-cuc-bam-sumisu-shop-001-p171510867.html?spid=171510879,18,,,NIU24
"Áo khoác bomber, áo khoác bóng chày nam nữ mẫu thêu họa tiết kỹ đẹp, Áo khoác bomber nỉ form rộng Unisex Áo bomber nỉ Cardigan trần bông trẻ",137.000₫,https://tiki.vn/ao-khoac-bomber-ao-khoac-bong-chay-nam-nu-mau-theu-hoa-tiet-ky-dep-sumisu-shop-p171510923.html?spid=171510927,19,,Đã bán 1,NIU24
"Áo Bomber Dù 2 Lớp Bóng Chày In S Cá Tính Unisex Nam Nữ, Áo khoác bomber jacket dù thu đông nam nữ style bóng chày cá tính, ÁO KHOÁC DÙ BOMBER UNISEX PHONG CÁCH BÓNG CHÀY PHỐI CHỮ S THỜI TRANG TRẺ NĂNG ĐỘNG",99.000₫,https://tiki.vn/ao-bomber-du-2-lop-bong-chay-in-s-ca-tinh-unisex-nam-nu-lana-store-p166412588.html?spid=166412596,20,,,NIU24
"Áo Hoodie Gauduck Logo Thêu Nỉ Ngoại Áo Khoác Nỉ Tay Phồng Unisex Form Nam Nữ, Áo Khoác Hoodie Form Rộng, Áo Hoodie Nam Nữ Form Rộng Freesize Dưới 65kg Bông Dày Dặn Phong Cách",95.000₫,https://tiki.vn/ao-hoodie-gauduck-logo-theu-ni-ngoai-ao-khoac-ni-tay-phong-unisex-form-nam-nu-p166412549.html?spid=166412564,21,,,NIU24
"Áo Khoác Cardigan Nỉ Bông Thêu Cún Love.Cherry Ulzzang Puppy.Lazzy, Áo Khoác Nỉ Bông Cardigan PUPPY LAZY 07.07 Unisex, Áo khoác nỉ CARDIGAN PUPPY LAZY,CARDIGAN THÊU CHỮ HQ",96.000₫,https://tiki.vn/ao-khoac-cardigan-ni-bong-theu-cun-love-cherry-ulzzang-puppy-lazzy-p166412514.html?spid=166412528,22,,,NIU24
"Áo Khoác Cardigan Nỉ Bông LT In Siêu Đẹp Cute Unisex Freesize, Áo khoác nỉ bông Cardigan nam nữ form rộng Freesize Cao Cấp, Áo khoác nỉ bông Cardigan AWESOME Cute Áo Khoác Nữ Unisex Form Rộng Freesize Dưới 68kg",99.000₫,https://tiki.vn/ao-khoac-cardigan-ni-bong-lt-in-sieu-dep-cute-unisex-freesize-p166412445.html?spid=166412454,23,,,NIU24
Áo Hoodie HATE.R Ulzzang Unisex,98.000₫,https://tiki.vn/ao-hoodie-hate-r-ulzzang-unisex-1hitshop-p184313208.html?spid=184313218,24,,,NIU24
[sẵn] Áo varsity/bomber tay dài chữ WZS (ảnh thật tại shop),172.000,https://tiki.vn/san-ao-varsity-bomber-tay-dai-chu-wzs-anh-that-tai-shop-p184314139.html?spid=184314150,25,,,NIU24
,,https://tiki.vn/ao-khoac-tay-dai-form-rong-theu-chu-thisneverthat-anh-that-tai-shop-tanazi-closet-p184314082.html?spid=184314093,26,,,NIU24
Áo khoác bomber da lộn form rộng unisex phong cách hàn quốc thêu chữ VENCEDE 1988,178.000₫,https://tiki.vn/ao-khoac-bomber-da-lon-form-rong-unisex-phong-cach-han-quoc-theu-chu-vencede-1988-p186436094.html?spid=186436106,27,,,NIU24
Áo khoác from rộng unisex áo khoác dù hai lớp cổ sơ mi bẻ thêu logo phối sọc vàng,126.000₫,https://tiki.vn/ao-khoac-from-rong-unisex-ao-khoac-du-hai-lop-co-so-mi-be-theu-logo-phoi-soc-vang-p186436003.html?spid=186436016,28,,,NIU24
"Áo khoác hoodie from rộng, Áo khoác nỉ ngoại chống nắng có lớp trong Certayn",104.000₫,https://tiki.vn/ao-khoac-hoodie-from-rong-ao-khoac-ni-ngoai-chong-nang-co-lop-trong-certayn-p186436450.html?spid=186436502,29,,,NIU24
ÁO THUN TAY DÀI/ ÁO PHONG DÀI TAY CHẤT THUN COTTON NAM/NỮ UNISEX _ HÌNH THẬT,89.000₫,https://tiki.vn/ao-thun-tay-dai-ao-phong-dai-tay-chat-thun-cotton-nam-nu-unisex-_-hinh-that-p185993609.html?spid=185993615,30,,,NIU24
,,https://tiki.vn/ao-khoac-cardigan-kaki-nhung-gan-1-lop-theu-so-57-phoi-mau-unisex-ulzzang-nam-nu-p190794645.html?spid=190794648,31,,,NIU24
"Áo Khoác Nhung Kaki Sơ Mi Cổ Bẻ Kiểu Bomber 2 Lớp Lót Dù Màu Đen,Mint.Xanh,Hồng - ThêuThêu 09 Nam Nữ",164.000₫,https://tiki.vn/ao-khoac-nhung-kaki-so-mi-co-be-kieu-bomber-2-lop-lot-du-mau-den-mint-xanh-hong-theutheu-09-nam-nu-p191126226.html?spid=191126300,32,,Đã bán 1,NIU24
Áo Khoác Nỉ In Bear Gấu Nam Nữ RẺ ĐẸPÁo Hoodie Hàn Quốc Unisex Chất Thun Tay Dài Kiểu Unisex Couple Jackets,95.000₫,https://tiki.vn/ao-khoac-ni-in-bear-gau-nam-nu-freeship-re-dep-ao-hoodie-han-quoc-unisex-chat-thun-tay-dai-kieu-unisex-couple-jackets-p191126143.html?spid=191126220,33,,,NIU24
"Áo Khoác Da Lộn Kiểu Nữ Unisex 2 Lớp Lót dù -Có Nón Và Khóa Kéo Màu Nâu , Đen ,Kem,Xanh -Logo Thêu Cực Nét Mùa Thu Đông",148.000₫,https://tiki.vn/ao-khoac-da-lon-kieu-nu-unisex-2-lop-lot-du-co-non-va-khoa-keo-mau-nau-den-kem-xanh-logo-theu-cuc-net-mua-thu-dong-p191127130.html?spid=191127167,34,,,NIU24
"Áo Khoác Cardigan Thêu R Nỉ Ngoại Hàng Shop - UNISEX - Màu Mint , Tím Và Xanh Ngọc",95.000₫,https://tiki.vn/ao-khoac-cardigan-theu-r-ni-ngoai-hang-shop-freeship-unisex-mau-mint-tim-va-xanh-ngoc-p191126478.html?spid=191126540,35,,,NIU24
,,https://tiki.vn/set-bo-do-nu-croptop-chu-c-mac-nha-the-thao-do-ngu-freeship-re-dep-ao-thun-phoi-quan-rong-short-dui-mua-he-p191126603.html?spid=191126624,36,,,NIU24
Áo Khoác Dù 2 Lớp SWEEDER Nam Nữ Phối màu Đen - Trắng Unisex Form Rộng r Jacket GOLDEN DREAM,105.000₫,https://tiki.vn/ao-khoac-du-2-lop-sweeder-nam-nu-phoi-mau-den-trang-unisex-form-rong-r-jacket-golden-dream-p799-p182587725.html?spid=182587736,37,,,NIU24
Aó Khoác Nhung Tăm Nữ Cổ Bẻ Thêu Chữ SYMBOLIC Phối Tay Trắng Cá Tính Dễ Thương GOLDEN DREAM,150.000₫,https://tiki.vn/ao-khoac-nhung-tam-nu-co-be-theu-chu-symbolic-phoi-tay-trang-ca-tinh-de-thuong-golden-dream-p239-p182587826.html?spid=182587857,38,,,NIU24
Áo Khoác Hoodie Nữ Kiểu Croptop Phối Viền Sọc Tay Có Nón Vải Thun Nỉ Ngoại Mềm Mịn Phong Cách Thời Trang Cá Tính Mới,103.000₫,https://tiki.vn/ao-khoac-hoodie-nu-kieu-croptop-phoi-vien-soc-tay-co-non-vai-thun-ni-ngoai-mem-min-phong-cach-thoi-trang-ca-tinh-moi-p183914816.html?spid=183914822,39,,,NIU24
(Chất da lộn cao cấp) Áo khoác bomber nữ phong cách Hàn Quốc thêu chữ 1986,154.000,https://tiki.vn/cha-t-da-lo-n-cao-ca-p-ao-khoac-bomber-nu-phong-ca-ch-han-quoc-theu-chu-1986-p183920436.html?spid=183920463,40,,,NIU24
