title,price,link_item,index,discount,sales,category
Áo khoác bomber hoạ tiết 2 lớp chất bố cotton form rộng unisex,285.000₫,https://tiki.vn/ao-khoac-bomber-hoa-tiet-2-lop-chat-bo-cotton-form-rong-unisex-p272388092.html?spid=272388098,1,-37%,,aovest
ÁO KHOÁC DA BÓNG THỜI TRANG NAM CỰC HOT,185.000₫,https://tiki.vn/ao-khoac-da-bong-thoi-trang-nam-cuc-hot-p146510705.html?spid=208741973,2,-30%,,aovest
"Áo khoác dù, nón liền, phối dây kéo-DU8",189.000₫,https://tiki.vn/a-o-khoa-c-du-no-n-lie-n-pho-i-day-ke-o-du8-p7567343.html?spid=7567359,3,-30%,Đã bán 8,aovest
Áo Khoác Nam K850T003,599.000₫,https://tiki.vn/ao-khoac-nam-t003-p206945173.html?spid=206945179,4,-30%,,aovest
Áo Khoác Nam K850T002,599.000₫,https://tiki.vn/ao-khoac-nam-t002-p206908735.html?spid=206908741,5,-13%,,aovest
Áo jacket nam in chìm nón rời Novelty màu đen 2203242,384.000₫,https://tiki.vn/ao-jacket-nam-in-chi-m-no-n-ro-i-novelty-mau-den-2203242-p198783743.html?spid=198783753,6,-25%,,aovest
Áo Khoác Dù Dày Hai Lớp Siêu Bền Cao Cấp ADL29 ShopN6,209.000₫,https://tiki.vn/ao-khoac-du-day-hai-lop-sieu-ben-cao-cap-adl29-shopn6-p20832463.html?spid=20832465,7,,Đã bán 8,aovest
Áo Khoác Dù 2 Lớp Chống Nắng - HD100,148.000₫,https://tiki.vn/ao-khoac-du-2-lop-chong-nang-hd100-p24582350.html?spid=71090595,8,,Đã bán 16,aovest
Áo Khoác DirtyCoins Logo Striped Track Jacket - Black,539.000₫,https://tiki.vn/a-o-khoa-c-dirtycoins-logo-striped-track-jacket-black-p272357183.html?spid=272357185,9,,,aovest
Áo Khoác KaKi Nam Hàn Quốc,250.000₫,https://tiki.vn/ao-khoac-kaki-nam-han-quoc-p117583693.html?spid=117583859,10,,,aovest
Áo khoác BERRIE JACKET - dáng vừa màu hồng đất,1.035.000₫,https://tiki.vn/ao-khoac-berrie-jacket-dang-vua-mau-hong-dat-p169270173.html?spid=169270178,11,,,aovest
"Bộ suit công sở may đo, thiết kế hai hàng khuy đơn, BASIC-SUIT-5 kiểu dáng Slim Fit, phong cách thanh lịch và sang trọng - HY.WO",2.145.000₫,https://tiki.vn/bo-suit-cong-so-may-do-theo-yeu-cau-thiet-ke-hai-hang-khuy-don-basic-suit-5-kieu-dang-slim-fit-phong-cach-thanh-lich-va-sang-trong-hy-wo-p242441706.html?spid=242441707,12,,,aovest
Áo Bomber Jacket Vitara,459.000₫,https://tiki.vn/ao-bomber-jacket-vitara-p130295428.html?spid=130295449,13,,,aovest
Áo Khoác Nam Da Lộn Phong Cách Hàn Quốc 2 lớp lót J3619,595.000₫,https://tiki.vn/ao-khoac-nam-da-lon-phong-cach-han-quoc-2-lop-lot-j3619-p198049841.html?spid=198049849,14,,,aovest
ÁO KHOÁC “TVD BEEBEE FULLZIP CROPPED HOODIE”,850.000₫,https://tiki.vn/ao-khoac-tvd-beebee-fullzip-cropped-hoodie-p151764233.html?spid=151764238,15,,,aovest
Áo Khoác Dù Dày Cao Cấp,159.000₫,https://tiki.vn/ao-khoac-du-day-cao-cap-p117583231.html?spid=117583607,16,,,aovest
Áo Khoác Free Fire In Hình Samuzai Có Khóa Kéo Chất Nỉ Dầy Dặn Kiểu Dáng Boomber,160.000₫,https://tiki.vn/ao-khoac-free-fire-in-hinh-samuzai-co-khoa-keo-chat-ni-day-dan-kieu-dang-boomber-p72020437.html?spid=72020441,17,,,aovest
ÁO KHOÁC BOMBER NAM VÀI DÙ CAO CẤP 2021,149.000₫,https://tiki.vn/ao-khoac-bomber-nam-vai-du-cao-cap-2021-p182710474.html?spid=182710518,18,,,aovest
ÁO KHOÁC DÙ DÀY viên cổ NAM PHONG CÁCH LỊCH LÃM,169.000₫,https://tiki.vn/ao-khoac-du-day-vien-co-nam-phong-cach-lich-lam-p117584777.html?spid=117585003,19,,,aovest
Áo Chống Nắng Kẻ Nam 1 Lớp,80.000₫,https://tiki.vn/ao-chong-nang-ke-nam-1-lop-p117582928.html?spid=117582938,20,,,aovest
Áo Hoodie Free Fire Nỉ Màu Trắng In Hình Caroline,145.000₫,https://tiki.vn/ao-free-fire-ao-khoac-caroline-hinh-in-3d-chat-ni-mem-min-phu-hop-danh-cho-ca-nam-va-nu-p72011848.html?spid=72011850,21,,Đã bán 1,aovest
"áo khoác dù dày nam nữ cao câp, chất vải xịn phối màu cực trẻ trung hot 2021",191.400₫,https://tiki.vn/ao-khoac-du-day-nam-nu-cao-cap-chat-vai-xin-phoi-mau-cuc-tre-trung-hot-2021-p182711005.html?spid=182711071,22,,,aovest
Áo Khoác Dù Dày Cao Cấp,160.000₫,https://tiki.vn/ao-khoac-du-day-cao-cap-p117583183.html?spid=117583409,23,,,aovest
"Áo da lộn lót lông siêu ấm, áo da lộn nam lót lông cực dày",325.000₫,https://tiki.vn/ao-da-lon-lot-long-sieu-am-ao-da-lon-nam-lot-long-cuc-day-p86146502.html?spid=92450754,24,,Đã bán 10,aovest
Áo Vest Nam Titishop AVN132,624.000₫,https://tiki.vn/ao-vest-nam-titishop-avn132-p9417046.html?spid=9417062,25,,,aovest
Áo Khoác Bomber Nỉ Ngoại Siêu Dày Áo Khoác Unisex Form Rộng Nam Nữ Mặc Cực Chất,125.000₫,https://tiki.vn/ao-khoac-bomber-ni-ngoai-sieu-day-ao-khoac-unisex-form-rong-nam-nu-mac-cuc-chat-p125605025.html?spid=137524486,26,,Đã bán 3,aovest
Áo Bomber Jackets/ Áo Khoác Nhung Gân Thêu Logo 2000 Cúc Bấm Unisex Nam Nữ Form Rộng Ulzzang,153.000₫,https://tiki.vn/ao-bomber-jackets-ao-khoac-nhung-gan-theu-logo-2000-cuc-bam-unisex-nam-nu-form-rong-ulzzang-p134387399.html?spid=152694728,27,,,aovest
Áo Khoác Hoodies Super Fashion Nam Nữ Phối 2 Túi Hộp Cùng Chữ Thời Trang Cực Teen,94.000₫,https://tiki.vn/ao-khoac-hoodies-super-fashion-nam-nu-phoi-2-tui-hop-cung-chu-thoi-trang-cuc-teen-p197596087.html?spid=197596104,28,,,aovest
Áo Khoác Dù 2 Lớp THÊU CHỮ RESUAPRE 2023 Ulzzang Nam Nữ Unisex Form Rộng Bomber Jacket Hot Trend 2023 Unisex,100.000₫,https://tiki.vn/ao-khoac-du-2-lop-theu-chu-resuapre-2022-ulzzang-nam-nu-unisex-form-rong-bomber-jacket-hot-trend-2022-life-unisex-p195708537.html?spid=195708548,29,,,aovest
Áo khoác bóng chày đen chất vải dày dặn form rộng unisex nam nữ,93.000₫,https://tiki.vn/ao-khoac-bong-chay-den-chat-vai-day-dan-form-rong-unisex-nam-nu-p108333385.html?spid=145945849,30,,Đã bán 2,aovest
Áo Khoác Nam Nữ Unisex In CINDER Dù 2 Lớp Dày Dặn From Rộng,93.000₫,https://tiki.vn/ao-khoac-nam-nu-unisex-in-cinder-du-2-lop-day-dan-from-rong-p244167373.html?spid=249007430,31,,,aovest
Áo khoác dù SOTO nam nữ chất vải gió 2 lớp form rộng cổ đứng cao cấp,93.000₫,https://tiki.vn/ao-khoac-du-soto-nam-nu-chat-vai-gio-2-lop-form-rong-co-dung-cao-cap-p242444488.html?spid=242729666,32,,Đã bán 2,aovest
"Áo dạ nam dáng dài 3 khuy trẻ trung, chất dạ 2 lớp ấm áp, thời trang thu đông 2021",513.000₫,https://tiki.vn/ao-da-nam-dang-dai-3-khuy-tre-trung-chat-da-2-lop-am-ap-thoi-trang-thu-dong-2021-p126415600.html?spid=126415610,33,,Đã bán 1,aovest
(HCM) ÁO KHOÁC KAKI NAM CÓ MŨ SIÊU CHẤT HOT HIT 2022,206.000₫,https://tiki.vn/hcm-ao-khoac-kaki-nam-co-mu-sieu-chat-hot-hit-2022-p201884777.html?spid=201884841,34,,Đã bán 1,aovest
(HCM) ÁO KHOÁC NỈ B.E.TT.E.R THỜI TRANG NAM NỮ HOTTREND SIÊU XỊN - THỜI TRANG THU ĐÔNG MỚI LẠ CHO BẠN TRẺ,110.000₫,https://tiki.vn/hcm-ao-khoac-ni-b-e-tt-e-r-thoi-trang-nam-nu-hottrend-sieu-xin-thoi-trang-thu-dong-moi-la-cho-ban-tre-p201877801.html?spid=201877815,35,,,aovest
Áo Khoác Kaki Túi Hộp 3 Màu ( kèm ảnh thật ),395.850₫,https://tiki.vn/ao-khoac-kaki-tui-hop-3-mau-kem-anh-that-p87221103.html?spid=113227083,36,,,aovest
Áo Khoác Nam Kaki Phối Nón Phong Cách Hàn Quốc Cao Cấp AK38,262.500₫,https://tiki.vn/ao-khoac-nam-kaki-phoi-non-phong-cach-han-quoc-cao-cap-ak38-p73408935.html?spid=113225828,37,,,aovest
Hàng cao cấp | Bộ vest nam màu xanh đen cực sang trọng - DUKI STORE,1.019.000₫,https://tiki.vn/hang-cao-cap-bo-vest-nam-mau-xanh-den-cuc-sang-trong-duki-store-p78968249.html?spid=78968284,38,,Đã bán 3,aovest
"Áo vest nam, áo blazer nam 6 nút Hàn Quốc màu xanh coban sang EDK0011 - DUKI STORE",649.000₫,https://tiki.vn/ao-vest-nam-ao-blazer-nam-6-nut-han-quoc-mau-xanh-coban-sang-edk0011-duki-store-p272451659.html?spid=272451665,39,,,aovest
Áo khoác NOWSAIGON Coaches Jacket,420.000₫,https://tiki.vn/ao-khoac-nowsaigon-coaches-jacket-p115886077.html?spid=115886177,40,,Đã bán 1,aovest
