title,price,link_item,index,discount,sales,category
"Sữa cho trẻ sơ sinh từ 0-1 tuổi Meiji nội địa Nhật giúp bé phát triển cân đối chiều cao, cân nặng, trí não - QuaTangMe Extaste",1.180.000₫,https://tiki.vn/sua-bot-cong-thuc-meiji-hohoemi-milk-cho-be-0-den-12-thang-tuoi-800g-nhap-khau-nhat-p270845213.html?spid=11385930,1,-2%,Đã bán 721,dinhduongchobe
COMBO 2 HỘP BỘT ĂN DẶM RIDIELAC GOLD 4 VỊ MẶN - HỘP GIẤY 200G,133.000₫,https://tiki.vn/combo-2-hop-bot-an-dam-ridielac-gold-4-vi-man-hop-giay-200g-p26730971.html?spid=54618999,2,-3%,Đã bán 50,dinhduongchobe
Thùng 24 Hộp Sữa Enfagrow A+4 360 Brain Plus Vanilla (180ml/Hộp),324.000₫,https://tiki.vn/thung-24-hop-sua-enfagrow-a-4-360-brain-plus-vanilla-180ml-hop-p22273046.html?spid=55666681,3,-6%,Đã bán 177,dinhduongchobe
Sữa Bột Vinamilk Dielac Alpha Step 3 Hộp Thiếc (1500g),355.000₫,https://tiki.vn/sua-bot-vinamilk-dielac-alpha-step-3-hop-thiec-1500g-p10710898.html?spid=158647079,4,-4%,Đã bán 38,dinhduongchobe
Sữa Bột Vinamilk Dielac Alpha 1 - Hộp Thiếc 400g,132.000₫,https://tiki.vn/sua-bot-vinamilk-dielac-alpha-1-hop-thiec-400g-p13749531.html?spid=13749532,5,-6%,Đã bán 354,dinhduongchobe
SỮA BỘT OPTIMUM GOLD 3 1450G (CHO TRẺ TỪ 1 - 2 TUỔI),645.000₫,https://tiki.vn/sua-bot-optimum-gold-3-1450g-cho-tre-tu-1-2-tuoi-p94762040.html?spid=149963860,6,-10%,Đã bán 54,dinhduongchobe
Sản phẩm dinh dưỡng công thức Nestlé NAN SUPREME 3 lon 800g (CÔNG THỨC BỔ SUNG 2HM-O),520.000₫,https://tiki.vn/san-pham-dinh-duong-cong-thuc-nestle-nan-supreme-3-lon-800g-cong-thuc-bo-sung-2hm-o-p50422449.html?spid=67520318,7,-22%,Đã bán 228,dinhduongchobe
"Combo 3 lon sản phẩm dinh dưỡng y học Nutren Junior cho trẻ từ 1-12 tuổi 850g tăng trưởng 3 chuẩn: Thế chất, Đề kháng, Tư duy - Tặng khăn choàng tắm bé con voi",1.789.000₫,https://tiki.vn/combo-2-lon-san-pham-dinh-duong-y-hoc-nutren-junior-cho-tre-tu-1-12-tuoi-850g-tang-truong-3-chuan-the-chat-de-khang-tu-duy-tang-khan-choang-tam-be-con-voi-p186095383.html?spid=186095384,8,-8%,Đã bán 68,dinhduongchobe
Sữa Bột Abbott Pediasure B/A hương Vani Ít Ngọt Lon 400g,417.000₫,https://tiki.vn/sua-bot-abbott-pediasure-b-a-huong-vani-it-ngot-lon-400g-p260385886.html?spid=260385887,9,-55%,,dinhduongchobe
Thùng 6 lon Sữa bột công thức HiPP 4 Organic Combiotic 800g (6 lon x 800g),3.807.000₫,https://tiki.vn/thung-6-lon-sua-bot-cong-thuc-hipp-4-organic-combiotic-800g-6-lon-x-800g-p124716612.html?spid=124716613,10,-6%,Đã bán 26,dinhduongchobe
Thùng sữa bột pha sẵn Nutricare Hanie Kid - dinh dưỡng cho trẻ biếng ăn & suy dinh dưỡng trên 1 tuổi (110ml x 48 hộp),415.000₫,https://tiki.vn/thung-sua-bot-pha-san-nutricare-hanie-kid-dinh-duong-cho-tre-bieng-an-suy-dinh-duong-tren-1-tuoi-110ml-x-48-hop-p49023186.html?spid=49023187,11,-8%,Đã bán 308,dinhduongchobe
"Sữa mát tăng cân, cải thiện biếng ăn và táo bón Babego 3 tuổi trở lên,400G",270.000₫,https://tiki.vn/sua-mat-tang-can-cai-thien-bieng-an-va-tao-bon-babego-3-tuoi-tro-len-400g-p55141389.html?spid=55141390,12,-43%,Đã bán 26,dinhduongchobe
Sữa bột Abbott Similac Total Protection 2 (900g),709.000₫,https://tiki.vn/sua-bot-abbott-similac-total-protection-2-900g-p176427429.html?spid=176427430,13,-5%,Đã bán 8,dinhduongchobe
Sữa bột Dielac Alpha Gold IQ Step 4 - Hộp thiếc 1500g (dành cho trẻ 2-6 tuổi),439.000₫,https://tiki.vn/sua-bot-dielac-alpha-gold-iq-step-4-hop-thiec-1500g-danh-cho-tre-2-6-tuoi-p10710912.html?spid=95750220,14,-61%,Đã bán 34,dinhduongchobe
"Thùng 6 lon sữa bột dinh dưỡng công thức HiPP 2 Organic Combiotic chất lượng hữu cơ tự nhiên an toàn, bổ sung Omega 3 (DHA & ALA) dành cho trẻ từ 6 đến 12 tháng tuổi (6 lon x 800g)",4.061.000₫,https://tiki.vn/thung-6-lon-sua-bot-dinh-duong-cong-thuc-hipp-2-organic-combiotic-chat-luong-huu-co-tu-nhien-an-toan-bo-sung-omega-3-dha-ala-danh-cho-tre-tu-6-den-12-thang-tuoi-6-lon-x-800g--p116572117.html?spid=116572119,15,-13%,Đã bán 274,dinhduongchobe
Sữa Bột Vinamilk Dielac Alpha Gold IQ Step 2 Dành Cho Bé Từ 6 -12 Tháng - Hộp 400g,269.000₫,https://tiki.vn/sua-bot-vinamilk-dielac-alpha-gold-iq-step-2-danh-cho-be-tu-6-12-thang-hop-400g-p8421200.html?spid=53584445,16,,Đã bán 8,dinhduongchobe
Bộ 2 Lon sữa bột Nestlé NAN OPTIPRO PLUS 4 850g/lon với 5HMO Giúp tiêu hóa tốt + Tăng cường đề kháng (2 - 6 tuổi) - Tặng Máy đọc thẻ tiếng Anh,875.000₫,https://tiki.vn/bo-2-lon-sua-bot-nestle-nan-optipro-plus-4-850g-lon-voi-5hmo-giup-tieu-hoa-tot-tang-cuong-de-khang-2-6-tuoi-tang-may-doc-the-tieng-anh-p273452842.html?spid=273452843,17,,Đã bán 7,dinhduongchobe
"Fitolabs D3 - K2 dạng nhỏ giọt, bổ sung vitamin D3 K2 giúp bé tăng chiều cao",98.000₫,https://tiki.vn/fitolabs-d3-k2-dang-nho-giot-bo-sung-vitamin-d3-k2-giup-be-tang-chieu-cao-p125652930.html?spid=125652933,18,,Đã bán 44,dinhduongchobe
Sữa Bột Enfagrow A+ 3 (870g),480.000₫,https://tiki.vn/sua-bot-enfagrow-a-3-870g-p13442217.html?spid=37843458,19,,Đã bán 56,dinhduongchobe
"Kẹo Dẻo Healthy Care Kids Gummy Omega 3 250 Viên Cho Bé Bổ Sung Dinh Dưỡng, Tăng Sức Đề Kháng, Hỗ trợ Tim Mạch, Phát Triển Khả Năng Tư Duy Cho Bé",350.000₫,https://tiki.vn/keo-deo-healthy-care-kids-gummy-omega-3-250-vien-cho-be-bo-sung-dinh-duong-tang-suc-de-khang-ho-tro-tim-mach-phat-trien-kha-nang-tu-duy-cho-be-p105043761.html?spid=253247891,20,,Đã bán 2,dinhduongchobe
Sữa Bột Enfamil A+ 1 (870g),545.000₫,https://tiki.vn/sua-bot-enfamil-a-1-870g-p13442223.html?spid=37834746,21,,Đã bán 85,dinhduongchobe
Sữa Bột Friso Gold 4 Cho Trẻ Từ 2-4 Tuổi 1400g - HSD luôn mới,667.000₫,https://tiki.vn/sua-bot-friso-gold-4-cho-tre-tu-2-4-tuoi-1400g-hsd-luon-moi-p103511021.html?spid=103511022,22,,Đã bán 8,dinhduongchobe
"Lốc 61 - Combo 6 Cháo Tươi Baby Sài Gòn Food 240G (Gà, Thịt Bằm, Bò, Tôm, Lươn, Cá Hồi)",137.000₫,https://tiki.vn/loc-61-combo-6-chao-tuoi-baby-sai-gon-food-240g-ga-thit-bam-bo-tom-luon-ca-hoi-p190108475.html?spid=190108476,23,,Đã bán 34,dinhduongchobe
Vitamin C cho trẻ trên 1 tuổi Brauer Baby & Kids Liquid Vitamin C tăng sức đề kháng (100ml) - QuaTangMe Extaste,345.000₫,https://tiki.vn/vitamin-c-dang-nuoc-brauer-baby-kids-liquid-vitamin-c-cho-tre-tren-1-tuoi-100ml-p23303402.html?spid=23303403,24,,Đã bán 30,dinhduongchobe
"Thùng sữa nước trái cây Smarta Grow (vị cam), giúp trẻ tăng chiều cao, phát
triển não bộ, dinh dưỡng cho trẻ thấp còi (48 hộp x 180ml)",347.000₫,https://tiki.vn/thung-sua-nuoc-trai-cay-smarta-grow--vi-cam---giup-tre-tang-chieu-cao--phat-trien-nao-bo--dinh-duong-cho-tre-thap-coi--48-hop-x-180ml--p117639114.html?spid=117639115,25,,Đã bán 40,dinhduongchobe
(Tặng bình nước) Vitamin D3K2 Lineabon tăng chiều cao tốt đa cho bé,295.000₫,https://tiki.vn/tang-binh-nuoc-vitamin-d3k2-lineabon-tang-chieu-cao-tot-da-cho-be-p242105277.html?spid=242105278,26,,Đã bán 6,dinhduongchobe
"Sữa Grow Plus Xanh 1,5kg hộp to ( trẻ từ 1 tuổi trở lên)",430.000₫,https://tiki.vn/su-a-grow-plus-xanh-1-5kg-hop-to-tre-tu-1-tuoi-tro-len-p125786885.html?spid=187423414,27,,Đã bán 15,dinhduongchobe
Sữa Aptamil New Zealand số 2 900g - 1 hộp,691.000₫,https://tiki.vn/su-a-aptamil-new-zealand-so-2-900g-1-hop-p116931125.html?spid=116931126,28,,Đã bán 30,dinhduongchobe
Sữa Aptamil Úc số 2 Profutura 900G (6-12 tháng),950.000₫,https://tiki.vn/sua-aptamil-uc-so-2-profutura-900g-6-12-thang-p197409750.html?spid=197409751,29,,,dinhduongchobe
Combo 2 lon Sữa bột công thức HiPP 1 Organic Combiotic 350g (dành cho trẻ sơ sinh) (2 lon x 350g),630.000₫,https://tiki.vn/combo-2-lon-sua-bot-cong-thuc-hipp-1-organic-combiotic-350g-danh-cho-tre-so-sinh-2-lon-x-350g-p136837119.html?spid=136837120,30,,Đã bán 10,dinhduongchobe
Siro Ho cho bé Doppelherz Aktiv Kinder Thymepect Cough Syrup (Chai 100ml),216.000₫,https://tiki.vn/siro-ho-cho-be-doppelherz-aktiv-kinder-thymepect-cough-syrup-chai-100ml-p16166568.html?spid=39317413,31,,Đã bán 78,dinhduongchobe
COMBO 48 HỘP SỮA BỘT PHA SẴN DIELAC GROW PLUS 110ML,403.000₫,https://tiki.vn/combo-48-hop-sua-bot-pha-san-dielac-grow-plus-110ml-p22784987.html?spid=106208719,32,,Đã bán 22,dinhduongchobe
2 Hộp Sữa Bột Morinaga Chilmil Số 2 (850g) Dành cho trẻ từ 6 -36 tháng tuổi,897.900₫,https://tiki.vn/2-hop-sua-bot-morinaga-chilmil-so-2-850g-danh-cho-tre-tu-6-36-thang-tuoi-p36630057.html?spid=50073577,33,,Đã bán 7,dinhduongchobe
"Sữa bột dinh dưỡng Nutri Plus Weight Gain dành cho người gầy, tăng cân hiệu quả Sunbaby NTSBTH2019",380.000₫,https://tiki.vn/sua-bot-dinh-duong-nutri-plus-weight-gain-danh-cho-nguoi-gay-tang-can-hieu-qua-sunbaby-ntsbth2019-p42926142.html?spid=42926143,34,,Đã bán 131,dinhduongchobe
"Bột ăn dặm dinh dưỡng Sữa, Hoa quả, Bắp HiPP Organic 250g",133.500₫,https://tiki.vn/bot-an-dam-dinh-duong-sua-hoa-qua-bap-hipp-organic-250g-p95035832.html?spid=95035833,35,,Đã bán 249,dinhduongchobe
2 Hộp Nutifood GrowPLUS+ Đỏ 1500 Gr : sữa dành cho trẻ từ 1- 10 tuổi bị suy dinh dưỡng thấp còi,1.120.000₫,https://tiki.vn/2-hop-nutifood-growplus-do-1500-gr-sua-danh-cho-tre-tu-1-10-tuoi-bi-suy-dinh-duong-thap-coi-p45578929.html?spid=45578930,36,,Đã bán 41,dinhduongchobe
"[COMBO 2 HỘP] Sữa Tăng Cân Cho Bé ETOMIL KID AZ Mỗi Hộp 900G - Bù Đắp Năng Lượng Và Dưỡng Chất Cho Trẻ Biếng Ăn, Nhẹ Cân",936.700₫,https://tiki.vn/combo-2-hop-sua-etomil-kid-az-nang-luong-cao-danh-cho-tre-bieng-an-nhe-can-va-suy-dinh-duong-tu-1-10-tuoi-hop-900gr-p201699259.html?spid=201699260,37,,Đã bán 17,dinhduongchobe
"Vitamin tổng hợp cho trẻ Úc Healthy Care Kids Gummy Multivitamin bổ sung dinh dưỡng giúp tăng sức đề kháng, ăn ngon, ngủ ngon - Massel Official",371.000₫,https://tiki.vn/vitamin-tong-hop-cho-tre-uc-healthy-care-kids-gummy-multivitamin-bo-sung-dinh-duong-giup-tang-suc-de-khang-an-ngon-ngu-ngon-massel-official-p271586541.html?spid=116835805,38,,Đã bán 90,dinhduongchobe
Sữa dê Kabrita số 1 cho trẻ 0-12 tháng - Lon 800g,850.000₫,https://tiki.vn/date-t7-2024-sua-de-kabrita-so-1-cho-tre-lon-800g-p270688083.html?spid=270688084,39,,Đã bán 1,dinhduongchobe
Thùng sữa nước Nutricare Metacare ECO giúp trẻ phát triển toàn diện (110ml),296.000₫,https://tiki.vn/thung-sua-nuoc-nutricare-metacare-eco-phat-trien-toan-dien-cho-tre-tu-1-tuoi-110ml-x-48-hop-p112101672.html?spid=112101673,40,,Đã bán 110,dinhduongchobe
