title,price,link_item,index,discount,sales,category
"Set nón cói, khoác cardigan best seller",135.000₫,https://tiki.vn/set-non-coi-khoac-cardigan-best-seller-p118849194.html?spid=118849207,1,-52%,,aokhoacnu
Áo Khoác Nữ KaKi Nhung Tâm Hàng QC Thêu Gấu Nút Bấm Bomber Jackets Dù Lót Trong THÊU GẤU - AK1066,182.000₫,https://tiki.vn/ao-khoac-nu-kaki-nhung-tam-hang-qc-theu-gau-nut-bam-bomber-jackets-du-lot-trong-theu-gau-ak1066-p124065506.html?spid=157416583,2,-9%,,aokhoacnu
Áo Khoác Nỉ chui Đầu Nữ in Giờ Nón Lướn Trùm Đầu Form Rộng Che Nắng Tốt Thời Trang FASHION,106.000₫,https://tiki.vn/ao-khoac-ni-chui-dau-nu-in-gio-non-luon-trum-dau-form-rong-che-nang-tot-thoi-trang-super-fashion-p197291122.html?spid=197291229,3,,,aokhoacnu
Áo len trơn basic cổ tròn nhiều màu xinh mẫu thu đông 2020,273.000,https://tiki.vn/ao-len-tron-basic-co-tron-nhieu-mau-xinh-mau-thu-dong-2020-p86533711.html?spid=86533734,4,,,aokhoacnu
,,https://tiki.vn/ao-sweater-nam-nu-unisex-form-rong-doi-len-ni-ngoai-local-brand-dep-cap-doi-ulzzang-han-quoc-oversize-day-min-zip-kldt-p176634730.html?spid=176634735,5,,,aokhoacnu
Áo Khoác Dạ Nữ Măng Tô,555.000₫,https://tiki.vn/ao-khoac-da-nu-mang-to-p16153617.html?spid=87939141,6,,,aokhoacnu
Áo khoác Kaki form rộng túi hộp,167.000₫,https://tiki.vn/ao-khoac-kaki-form-rong-tui-hop-p15806534.html?spid=46353774,7,,Đã bán 31,aokhoacnu
Áo len dệt kim mùa thu và mùa đông phong cách Hàn Quốc mã L13758,285.000₫,https://tiki.vn/ao-len-det-kim-mua-thu-va-mua-dong-phong-cach-han-quoc-ma-l13758-p200820271.html?spid=200820277,8,,,aokhoacnu
Bộ vest nữ caro quần short,360.000,https://tiki.vn/bo-vest-nu-caro-quan-short-p208195177.html?spid=208195183,9,,,aokhoacnu
,,https://tiki.vn/ao-khoac-jean-nu-titishop-nt85-p13781056.html?spid=13781060,10,,,aokhoacnu
Áo khoác dù Jacket Nam Nữ ulzzang form rộng Hàn Quốc - TÂM SHOP,88.000₫,https://tiki.vn/a-o-khoac-du-jacket-nam-nu-ulzzang-form-rong-han-quoc-tam-shop-p249235406.html?spid=249235410,11,,,aokhoacnu
ÁO LEN LÔNG THỎ MỀM,115.000,https://tiki.vn/ao-len-long-tho-mem-p117325030.html?spid=117325035,12,,,aokhoacnu
,,https://tiki.vn/ao-khoac-hoodie-zip-hori-form-rong-phoi-3-soc-vai-ni-bong-tay-dai-phong-cach-ulzzang-nam-nu-unisex-anh-that-co-san-p191477476.html?spid=196877479,13,,,aokhoacnu
Áo khoác nỉ unisex form rộng Nỉ Trơn nam nữ phong cách ulzzang Wind,103.000₫,https://tiki.vn/ao-khoac-ni-unisex-form-rong-ni-tron-nam-nu-phong-cach-ulzzang-wind-p95059744.html?spid=95059754,14,,Đã bán 15,aokhoacnu
Áo khoác Kaki phối 6 túi hộp chất kaki ngoại Form rộng Unisex Nam Nữ Couple đều mặc được thời trang kim gia,134.000₫,https://tiki.vn/ao-khoac-kaki-phoi-6-tui-hop-chat-kaki-ngoai-form-rong-unisex-nam-nu-couple-deu-mac-duoc-thoi-trang-kim-gia-p98154139.html?spid=142203830,15,,,aokhoacnu
Áo Khoác nỉ Nam Nữ Áo Hoodie Có Dây Kéo - Unisex Khoác Chống Nắng Mặc Cười Cute. Áo Khoác Hoodie Nam Nữ Có Dây Kéo,107.000₫,https://tiki.vn/ao-khoac-ni-nam-nu-ao-hoodie-co-day-keo-unisex-khoac-chong-nang-mac-cuoi-cute-ao-khoac-hoodie-nam-nu-co-day-keo-p114415791.html?spid=114415819,16,,Đã bán 90,aokhoacnu
ÁO KHOÁC CARDIGAN NỮ VẢI NỈ BÔNG DÀY MIN NHIỀU MÀU CÚN CON,139.000,https://tiki.vn/ao-khoac-cardigan-nu-vai-ni-bong-day-min-nhieu-mau-cun-con-p117903466.html?spid=117903472,17,,,aokhoacnu
,,https://tiki.vn/set-vest-lung-p50738499.html?spid=50738519,18,,,aokhoacnu
"Áo vest blaze nữ Linen Demi ArcticHunter, thời trang hè thu 2021",320.000₫,https://tiki.vn/ao-vest-blaze-nu-linen-demi-arctichunter-thoi-trang-he-thu-2021-p100310846.html?spid=100310848,19,,Đã bán 6,aokhoacnu
"Áo khoác nhẹ, áo vest blazer 1 lớp mỏng ve vuông 2 túi ốp, chất vải Linen bột Premium, thích hợp mùa xe lạnh - Vàng",280.000₫,https://tiki.vn/ao-khoac-nhe-ao-vest-blazer-1-lop-mong-ve-vuong-2-tui-op-chat-vai-linen-bot-premium-thich-hop-mua-xe-lanh-p203967502.html?spid=203967508,20,,,aokhoacnu
ÁO KHOÁC JEAN NỮ PHỐI DÂY KÉO AK636,249.000₫,https://tiki.vn/ao-khoac-jean-nu-phoi-day-keo-ak636-p180051047.html?spid=180051049,21,,Đã bán 1,aokhoacnu
"áo khoác bomber lửng, áo khoác nữ lửng tay dài, Áo khoác bomber croptop nữ dáng lửng bấm cúc hàn quốc, Áo khoác da croptop basic, áo khoác da nữ phong cách cá tính trẻ trung năng động mặc đi chơi đi học đi làm",160.000₫,https://tiki.vn/ao-khoac-bomber-lung-ao-khoac-nu-lung-tay-dai-ao-khoac-bomber-croptop-nu-dang-lung-bam-cuc-han-quoc-ao-khoac-da-croptop-basic-ao-khoac-da-nu-phong-cach-ca-tinh-tre-trung-nang-dong-mac-di-choi-di-hoc-di-lam-p217164430.html?spid=217164432,22,,,aokhoacnu
Áo Sweater Nỉ Chữ Tím Unisex,96.000₫,https://tiki.vn/ao-sweater-ni-chu-tim-unisex-p120146772.html?spid=180317959,23,,Đã bán 1,aokhoacnu
Áo khoác nỉ hoodie trơn Unisex - Hoodie CHỢ BẾN THÀNH form rộng có mũ dáng suông basic ulzzang nam nữ HOT,47.000₫,https://tiki.vn/ao-khoac-ni-hoodie-tron-unisex-hoodie-cho-ben-thanh-form-rong-co-mu-dang-suong-basic-ulzzang-nam-nu-hot-p249249250.html?spid=249249283,24,,,aokhoacnu
Áo bomber chất nỉ cotton siêu rẻ phù hợp nam nữ có đánh giá video và ảnh thật,117.000,https://tiki.vn/ao-bomber-chat-ni-cotton-sieu-re-phu-hop-nam-nu-co-danh-gia-video-va-anh-that-p173627548.html?spid=173627566,25,,,aokhoacnu
,,https://tiki.vn/ao-khoac-kaki-tui-hop-4-tui-nam-nu-p187840329.html?spid=187840339,26,,,aokhoacnu
Áo khoác kaki túi hộp nam nữ,115.000₫,https://tiki.vn/ao-khoac-kaki-tui-hop-nam-nu-p187840474.html?spid=187840486,27,,,aokhoacnu
Áo veston nữ May 10 mã 040222207ONGG VL006,849.000₫,https://tiki.vn/ao-veston-nu-may-10-ma-040222207ongg-vl006-p273558012.html?spid=273558023,28,,,aokhoacnu
Áo khoác thể thao Hiye - JKF015,162.000₫,https://tiki.vn/ao-khoac-the-thao-hiye-jkf015-p12617471.html?spid=12617493,29,,Đã bán 3,aokhoacnu
Áo len nữ thời trang dáng rộng - AG68,250.000,https://tiki.vn/ao-len-nu-thoi-trang-dang-rong-ag68-p122344905.html?spid=122344921,30,,,aokhoacnu
,,https://tiki.vn/ao-khoac-da-nu-2-tui-don-gian-dui-viet-dv34-p71540320.html?spid=71540326,31,,,aokhoacnu
Áo Cardigan Nữ Họa Tiết Xinh Thời Trang Korea Ak36,209.000₫,https://tiki.vn/ao-cardigan-nu-hoa-tiet-xinh-thoi-trang-korea-ak36-p133893770.html?spid=133893776,32,,Đã bán 2,aokhoacnu
Áo khoác len dây kéo,160.000₫,https://tiki.vn/ao-khoac-len-day-keo-p126677869.html?spid=126677944,33,,Đã bán 2,aokhoacnu
"Áo khoác bomber nam nữ vải nỉ dày mịn áo ấm 3 size, mẫu logo ngôi nhà",135.000₫,https://tiki.vn/ao-khoac-bomber-nam-nu-vai-ni-day-min-ao-am-3-size-mau-logo-ngoi-nha-sumisu-shop-p171510865.html?spid=171510916,34,,,aokhoacnu
Áo Hoodie Chữ WZSOFFICAL - Khoác Nỉ Có Có Nón Mũ - ĐẸP- Form Rộng Unisex Hàn Quốc Cặp Đôi Nam Nữ COUPLE - Chống Nắng,96.000₫,https://tiki.vn/ao-hoodie-chu-wzsoffical-khoac-ni-co-co-non-mu-dep-form-rong-unisex-han-quoc-cap-doi-nam-nu-couple-chong-nang-p202384724.html?spid=202803422,35,,,aokhoacnu
,,https://tiki.vn/ao-phao-beo-ao-phao-nu-ao-dai-han-p168608012.html?spid=208748413,36,,,aokhoacnu
"Áo khoác dù phối "" WZS "" / form rộng unisex (Ảnh shop tự chụp)",103.000₫,https://tiki.vn/ao-khoac-du-phoi-wzs-form-rong-unisex-anh-shop-tu-chup-p262690523.html?spid=262690531,37,,,aokhoacnu
áo măng tô dài,585.000₫,https://tiki.vn/ao-mang-to-dai-p192385329.html?spid=192385330,38,,,aokhoacnu
Áo len khoác trung niên hàng quốc len cao cấp,220.000₫,https://tiki.vn/ao-len-khoac-trung-nien-hang-quoc-len-cao-cap-p173417192.html?spid=173417237,39,,,aokhoacnu
Áo khoác da biker nữ phối zipper đen siêu chất FuturistiX ak176,790.000,https://tiki.vn/ao-khoac-da-biker-nu-phoi-zipper-den-sieu-chat-futuristix-ak176-p179549340.html?spid=179549347,40,,,aokhoacnu
