title,price,link_item,index,discount,sales,category
"Áo khoác len nữ dáng lửng, kiểu dáng cơ bản, thời trang thu đông 2020",99.000₫,https://tiki.vn/ao-khoac-len-nu-dang-lung-kieu-dang-co-ban-thoi-trang-thu-dong-2020-p71691449.html?spid=71691467,1,,Đã bán 50,aokhoacnu
"Áo sweater nam nữ mặc , áo hoodie áo cặp đôi , áo khoác áo thun tay dài nam nữ mặc in chú hớt tóc vải nỉ ngoại dày mịn",92.000₫,https://tiki.vn/ao-sweater-nam-nu-mac-ao-hoodie-ao-cap-doi-ao-khoac-ao-thun-tay-dai-nam-nu-mac-in-chu-hot-toc-vai-ni-ngoai-day-min-p77736330.html?spid=78021895,2,-12%,Đã bán 25,aokhoacnu
"Áo Sweater Nam Nữ Form Rộng Phối Layer 2 Lớp Có Màu Basic Xám, Đen Chất Da Cá Hàn Cao Cấp GUF",89.000₫,https://tiki.vn/ao-sweater-nam-nu-form-rong-phoi-layer-2-lop-co-mau-basic-xam-den-chat-da-ca-han-cao-cap-guf-p73981131.html?spid=75068476,3,-12%,Đã bán 27,aokhoacnu
Áo vest blazer nữ kẻ caro linen dày dặn thời trang Hàn Quốc,304.000,https://tiki.vn/ao-vest-blazer-nu-ke-caro-linen-day-dan-thoi-trang-han-quoc-p172490390.html?spid=172490424,4,,,aokhoacnu
,,https://tiki.vn/ao-len-ren-hoa-nu-tay-dai-co-cao-3-phan-phong-cach-han-quoc-p148985429.html?spid=148985435,5,-12%,,aokhoacnu
"Áo len nữ thiết kế phối ren cổ và tay nữ tính xinh xắn, nhiều màu lựa chọn Al50",199.000₫,https://tiki.vn/ao-len-nu-thiet-ke-phoi-ren-co-va-tay-nu-tinh-xinh-xan-nhieu-mau-lua-chon-al50-p195446416.html?spid=195446420,6,,,aokhoacnu
"Áo khoác hoodie chống nắng dành cho nam nữ Thêu Trái Tim, Nỉ ngoại form rộng Có Dây Kéo unisex ulzzang",97.000₫,https://tiki.vn/ao-khoac-hoodie-chong-nang-danh-cho-nam-nu-theu-trai-tim-ni-ngoai-form-rong-co-day-keo-unisex-ulzzang-p142717766.html?spid=155716172,7,,Đã bán 10,aokhoacnu
(HÀNG SẴN) Áo Khoác Len Mỏng Trung Niên Lịch Sự AL67 - Hàng Quảng Châu Cao Cấp,225.000₫,https://tiki.vn/hang-san-ao-khoac-len-mong-trung-nien-lich-su-al67-hang-quang-chau-cao-cap-p270678831.html?spid=272001718,8,,Đã bán 1,aokhoacnu
Áo len dệt kim nữ freesize 2022,161.100₫,https://tiki.vn/ao-len-det-kim-nu-freesize-2022-p242717357.html?spid=242717359,9,,,aokhoacnu
,,https://tiki.vn/ao-da-nu-kieu-dang-tay-lo-tre-trung-de-mix-do-n5-p134380891.html?spid=134381101,10,,,aokhoacnu
"Áo khoác nam nữ Hoodie nỉ trơn Basic in 5D form rộng tay bồng khóa kéo có mũ Ulzzang couple màu đen, trắng, Áo hoodie zip nữ tay phồng chú chó và con người,áo thu đông nữ chất nỉ ngoại dày mịn mũ 2 lớp",100.000₫,https://tiki.vn/ao-khoac-nam-nu-hoodie-ni-tron-basic-in-5d-form-rong-tay-bong-khoa-keo-co-mu-ulzzang-gia-re-couple-mau-den-trang-ao-hoodie-zip-nu-tay-phong-chu-cho-va-con-nguoi-2-mau-den-trang-ao-thu-dong-nu-chat-ni-ngoai-day-min-mu-2-lop-p180044750.html?spid=180044752,11,,Đã bán 3,aokhoacnu
Áo chống nắng toàn thân nữ vải lanh vải bò Jean 2 lớp 3 lớp dài kín chân - Ao chong nang nu toan than,157.101₫,https://tiki.vn/ao-chong-nang-toan-than-nu-vai-lanh-vai-bo-jean-2-lop-3-lop-dai-kin-chan-ao-chong-nang-nu-toan-than-p83616451.html?spid=188492154,12,,,aokhoacnu
,,https://tiki.vn/ao-khoac-ni-lot-bong-form-rong-work-unisex-nam-nu-mac-duoc-ao-hoodie-ni-work-anh-that-chup-tai-shop-ao-hoodie-chu-work-ao-khoac-ni-cotton-work-ao-khoac-hoodie-zip-chong-nang-mac-am-p196443208.html?spid=196443210,13,,,aokhoacnu
Áo len nữ cardigan dáng dài phong cách Hàn Quốc chất len mềm mại siêu xinh,179.000₫,https://tiki.vn/ao-len-nu-cardigan-dang-dai-phong-cach-han-quoc-chat-len-mem-mai-sieu-xinh-p130774839.html?spid=130774841,14,,Đã bán 6,aokhoacnu
Áo khoác mặc ngoài áo khoác ngắn dệt kim áo len cardigan phong cách Hàn,238.000₫,https://tiki.vn/ao-khoac-mac-ngoai-ao-khoac-ngan-det-kim-ao-len-cardigan-phong-cach-han-p123870368.html?spid=123870383,15,,Đã bán 52,aokhoacnu
Áo khoác phao dáng ngắn phối màu mũ nổi bật dày dặn ấm áp mùa đông,300.000₫,https://tiki.vn/ao-khoac-phao-dang-ngan-phoi-mau-mu-noi-bat-day-dan-am-ap-mua-dong-p164831505.html?spid=272056520,16,,,aokhoacnu
"Áo Chống Nắng Dáng Ngắn Có Túi Cuộn Atuner AT 029, Vải Cotton, Mỏng Nhẹ, Thông Hơi, Chống Tia UV",79.000₫,https://tiki.vn/ao-chong-nang-dang-ngan-co-tui-cuon-atuner-at-029-vai-cotton-mong-nhe-thong-hoi-chong-tia-uv-p102508214.html?spid=102508217,17,,,aokhoacnu
,,https://tiki.vn/ao-khoac-phao-nu-p7973539.html?spid=7973541,18,,,aokhoacnu
Áo len nữ dài tay ấm áp Dv18,175.000₫,https://tiki.vn/ao-len-nu-dai-tay-am-ap-dv18-p136841436.html?spid=136841443,19,,Đã bán 6,aokhoacnu
"Áo khoác vest nữ, blazer dáng suông chất nhung tăm mềm mịn Haint Boutique",308.000₫,https://tiki.vn/ao-khoac-vest-nu-blazer-dang-suong-chat-nhung-tam-mem-min-p212049771.html?spid=212049779,20,,,aokhoacnu
Áo khoác len choàng - Màu Hồng - Freesize từ40-68kg,165.000₫,https://tiki.vn/ao-khoac-len-choang-p126677759.html?spid=126678041,21,,Đã bán 1,aokhoacnu
Áo khoác dạ kẻ 2 lớp dáng dài,399.000₫,https://tiki.vn/ao-khoac-da-ke-2-lop-tieu-thu-dang-dai-p272128752.html?spid=272128755,22,,,aokhoacnu
ÁO KHOÁC CHỐNG NẮNG NAM NỮ,117.900₫,https://tiki.vn/ao-khoac-chong-nang-nam-nu-p72746558.html?spid=72746560,23,,Đã bán 7,aokhoacnu
"Áo Blazer nữ form rộng dáng dài 2 túi bổ nắp trẻ trung ArcticHunter, thời trang thương hiệu chính hãng - Xanh than",320.000₫,https://tiki.vn/ao-blazer-nu-form-rong-dang-dai-2-tui-bo-nap-tre-trung-arctichunter-thoi-trang-thuong-hieu-chinh-hang-xanh-than-p206873407.html?spid=206873409,24,,,aokhoacnu
"Áo Khoác Nữ Đẹp, Áo Khoác Nữ Form Rộng, Áo Khoác Nữ Chống Nắng Gân Nhung Phối Sọc Cao Cấp Có Túi Trong Tay Xỏ Ngón Thương Hiệu Baw AK95 (Hình thật shop tự chụp)",258.000,https://tiki.vn/ao-khoac-nu-dep-ao-khoac-nu-form-rong-ao-khoac-nu-chong-nang-gan-nhung-phoi-soc-cao-cap-co-tui-trong-tay-xo-ngon-thuong-hieu-baw-ak95-hinh-that-shop-tu-chup-p272431046.html?spid=272431050,25,,,aokhoacnu
,,https://tiki.vn/ao-khoac-nu-cadigan-len-mong-khoac-ngoai-chat-lieu-det-kim-ca-2-mau-ca-tinh-p130873874.html?spid=130873878,26,,,aokhoacnu
Áo khoác cardigan nữ dáng dài có túi phối cúc trước ngực DV33,351.000₫,https://tiki.vn/ao-khoac-cardigan-nu-dang-dai-co-tui-phoi-cuc-truoc-nguc-dv33-p137519111.html?spid=137519121,27,,Đã bán 5,aokhoacnu
"Bộ vest nữ, áo vest nữ Hàn Quốc màu trắng đẹp sang trọng DKX0008 - DUKI STORE",649.000₫,https://tiki.vn/bo-vest-nu-ao-vest-nu-han-quoc-mau-trang-dep-sang-trong-dkx0008-duki-store-p229952259.html?spid=229952263,28,,,aokhoacnu
Áo khoác nữ dây kéo basic ulzzang - Áo khoác nỉ bông dày dặn có zipper màu đẹp,106.000₫,https://tiki.vn/ao-khoac-nu-day-keo-basic-ulzzang-ao-khoac-ni-bong-day-dan-co-zipper-mau-dep-p37737335.html?spid=70667719,29,,Đã bán 42,aokhoacnu
"Áo khoác cardigan cặp phối viền chất nỉ bông dày dặn cao cấp, Áo khoác cardigan cặp chất nỉ bông form rộng nam nữ phù hợp giá tốt, Áo khoác nỉ cardigan form rộng, áo khoác cardigan chống nắng chống lạnh tốt",99.000₫,https://tiki.vn/ao-khoac-cardigan-cap-phoi-vien-chat-ni-bong-day-dan-cao-cap-p170440384.html?spid=170440392,30,,,aokhoacnu
,,https://tiki.vn/ao-hoodie-tay-phong-panda-de-thuong-chat-ni-bong-min-dep-form-rong-unisex-nam-nu-couple-p111097618.html?spid=146247419,31,,,aokhoacnu
(Ảnh thật)Áo phao lông vũ đại hàn siêu ấm,460.000₫,https://tiki.vn/anh-that-ao-phao-long-vu-dai-han-sieu-am-p117673059.html?spid=193536629,32,,Đã bán 1,aokhoacnu
"áo Khoác cardigan nỉ bông W (ảnh thật shop tự chụp), Áo khoác Nỉ Cardigan ️Áo khoác Bomber Nam nữ cao cấp bông dày mịn form rộng Unisex",106.000₫,https://tiki.vn/khoac-cardigan-ni-bong-w-anh-that-shop-tu-chup-p203983501.html?spid=203983510,33,,,aokhoacnu
Áo khoác nữ mũ lông - Áo kaki Phao nữ mũ lông Hàn Quốc,450.000₫,https://tiki.vn/ao-khoac-nu-mu-long-ao-kaki-phao-nu-mu-long-han-quoc-p128259873.html?spid=196825796,34,,,aokhoacnu
Áo Vest Nữ Dài F’Amor - Xanh Nhạt (Size,1.150.000,https://tiki.vn/ao-vest-nu-dai-f-amor-xanh-nhat-p9859912.html?spid=9859914,35,,,aokhoacnu
,,https://tiki.vn/couple-tx-ao-khoac-nu-du-raglan-phoi-mau-wop-2033-p249667517.html?spid=249667519,36,,,aokhoacnu
Áo Khoác Nữ Dệt Kim Vải Siêu Đẹp,245.000₫,https://tiki.vn/ao-khoac-nu-det-kim-vai-sieu-dep-p271682905.html?spid=271682913,37,,,aokhoacnu
Áo khoác cardigan len kẻ ô Phong cách Hàn của giới trẻ,199.000₫,https://tiki.vn/ao-khoac-cardigan-len-ke-o-phong-cach-han-cua-gioi-tre-p199708225.html?spid=199708227,38,,Đã bán 4,aokhoacnu
"Áo choàng vai liền tay chống nắng nữ vải thun lạnh thoáng mát dài che phủ tay mặc áo dây, lái xe ô tô",55.800₫,https://tiki.vn/ao-choang-vai-lien-tay-chong-nang-nu-vai-thun-lanh-thoang-mat-dai-che-phu-tay-mac-ao-day-lai-xe-o-to-p205712408.html?spid=205712453,39,,,aokhoacnu
Áo khoác phao nữ dáng dài 3 lớp hàng Việt Nam LC,450.000,https://tiki.vn/ao-khoac-phao-nu-dang-dai-tre-dep-cho-mua-dong-am-ap-day-3-lop-vai-du-lot-bong-hang-viet-nam-lc-p37811150.html?spid=126873402,40,,,aokhoacnu
