title,price,link_item,index,discount,sales,category
Quần gen bụng sau sinh cao cấp chấn liệu co dãn 4 chiều thoáng mát,84.500₫,https://tiki.vn/quan-gen-bung-sau-sinh-cao-cap-chan-lieu-co-dan-4-chieu-thoang-mat-p155268951.html?spid=155268955,1,-25%,Đã bán 19,dolotnu
Áo Lót Đúc Su Nâng Ngực Không Gọng Xuất Nhật Áo Ngực Đệ Thông Hơi Chống Ung Thư,65.000₫,https://tiki.vn/a-o-lot-duc-su-nang-nguc-khong-go-ng-xua-t-nha-t-ao-nguc-de-m-mo-ng-thong-hoi-cho-ng-ung-thu-p181247724.html?spid=181247809,2,,Đã bán 41,dolotnu
"Quần Lót Nữ, Bộ 5 Quần Lót Ren Nữ Cao Cấp Mềm Mịn Hàng Thương Gia, Quần Lót Nữ Kháng Khuẩn, Quần Lót Nữ Co Giãn Tốt Thương Hiệu Baw Mã QLN1508",150.000₫,https://tiki.vn/quan-lot-nu-bo-5-quan-lot-ren-nu-cao-cap-mem-min-hang-thuong-gia-quan-lot-nu-khang-khuan-quan-lot-nu-co-gian-tot-thuong-hieu-baw-ma-qln1508-p164712589.html?spid=164712591,3,-17%,Đã bán 1,dolotnu
Áo Lót Chống Tụt Đệm Mỏng LOIRECHIC BRQ02 Dây Đầm Có Viền Cao Su Tặng kèm dây áo,169.000,https://tiki.vn/ao-lot-chong-tut-dem-mong-loirechic-brq02-day-dam-co-vien-cao-su-tang-kem-day-ao-p72204483.html?spid=72204485,4,,,dolotnu
,,https://tiki.vn/quan-lot-cotton-size-nho-nu-duoi-50kg-2300-p242106148.html?spid=242106157,5,,,dolotnu
Quần lót nữ gợi cảm QL1690 - Quần lót nữ sexy,25.000₫,https://tiki.vn/quan-lot-nu-goi-cam-bt1690-quan-lot-nu-sexy-p165600199.html?spid=165600201,6,-16%,Đã bán 28,dolotnu
"Đồ lót Thái | Áo ngực mút dày, form đẹp - Áo lót thái lan Siterhood #2227",95.000₫,https://tiki.vn/do-lot-thai-ao-nguc-mut-day-form-dep-ao-lot-thai-lan-2227-p104791588.html?spid=104791653,7,-28%,Đã bán 13,dolotnu
Áo Lót Mút Mỏng Vừa Phối Ren Habpy Lady By Sabina HBXLP0003,383.000₫,https://tiki.vn/ao-lot-mut-mong-vua-phoi-ren-habpy-lady-by-sabina-hbxlp0003-p87616804.html?spid=87616839,8,,Đã bán 20,dolotnu
"Quần lót ren thun lạnh cao cấp Bee Na Thái Lan 056 chất vải mềm mại, nhiều size",45.000₫,https://tiki.vn/quan-lot-ren-thun-lanh-cao-cap-bee-na-thai-lan-056-chat-vai-mem-mai-nhieu-size-p194198191.html?spid=194198199,9,,Đã bán 6,dolotnu
,,https://tiki.vn/combo-3-ao-lot-hoc-sinh-ngan-khong-mut-ibasic-va111-p119285172.html?spid=119285187,10,,,dolotnu
Quần lót nữ lọt khe ren sexy xếp hình hoa - Màu đỏ,25.000₫,https://tiki.vn/quan-lot-nu-lot-khe-ren-sexy-xep-hinh-hoa-mau-do-p23100042.html?spid=23100043,11,-58%,Đã bán 162,dolotnu
Áo Lót Đệm Mỏng Cài Trước Đệm Mỏng,190.000,https://tiki.vn/ao-lot-dem-mong-cai-truoc-dem-mong-p83033717.html?spid=83033741,12,-22%,Đã bán 6,dolotnu
,,https://tiki.vn/quan-lot-nu-duc-su-phoi-ren-sexy-goi-cam-thoang-mat-khang-khuan-ma-9085-p95110454.html?spid=117385535,13,,,dolotnu
Áo lót nữ chống tụt không dây mặc đầm hở vai,155.000₫,https://tiki.vn/ao-lot-nu-chong-tut-khong-day-mac-dam-ho-vai-p83033911.html?spid=83033919,14,-20%,Đã bán 2,dolotnu
"Áo ngực bản to che mỡ lưng đệm mỏng có gọng nâng đỡ bầu ngực, tạo khe tự nhiên, Áo lót nữ định hình HÀNG CAO CẤP",179.000₫,https://tiki.vn/ao-nguc-ban-to-che-mo-lung-dem-mong-co-gong-nang-do-bau-nguc-tao-khe-tu-nhien-ao-lot-nu-dinh-hinh-hang-cao-cap-p214723228.html?spid=214723232,15,,Đã bán 5,dolotnu
"Áo Lót Hở Lưng Chống Tụt Có Gọng Nâng Đẩy Tạo Khe, Áo Ngực Không Dây Hở Lưng Dán Silicon Cup Ngang Hàng Cao Cấp",119.000₫,https://tiki.vn/ao-lot-ho-lung-chong-tut-co-gong-nang-day-tao-khe-ao-nguc-khong-day-ho-lung-dan-silicon-cup-ngang-hang-cao-cap-p263588603.html?spid=263588609,16,,Đã bán 2,dolotnu
"Combo 2 Cặp Miếng Dán Ngực Silicon Hình Cánh Hoa và Matte Tàng Hình Cho Phái Nữ, Miếng Dán Miley Lingerie",189.000,https://tiki.vn/combo-2-cap-mieng-dan-nguc-silicon-hinh-canh-hoa-va-matte-tang-hinh-cho-phai-nu-mieng-dan-miley-lingerie-p262383568.html?spid=262383569,17,,,dolotnu
,,https://tiki.vn/bo-do-lot-co-chu-v-phoi-quan-boy-short-soi-vai-thien-nhien-miley-lingerie-p263087317.html?spid=263087321,18,,,dolotnu
Quần lót nữ annie QE 8126 trơn phối ren phía sau,59.000₫,https://tiki.vn/quan-lot-nu-annie-qe-8126-tron-phoi-ren-phia-sau-p167479971.html?spid=167479989,19,,Đã bán 10,dolotnu
"Áo ngực mặc áo đầm hở lưng,chống tụt không dây cúp ngang Thái Lan",69.000₫,https://tiki.vn/ao-nguc-mac-ao-dam-ho-lung-chong-tut-khong-day-cup-ngang-thai-lan-p124239272.html?spid=124239305,20,,Đã bán 15,dolotnu
Áo ngực nữ cài trước chất ren phối su Charmila không gọng mã AN29,319.000₫,https://tiki.vn/ao-nguc-nu-cai-truoc-chat-ren-phoi-su-charmila-khong-gong-ma-an29-p210530286.html?spid=210530290,21,,Đã bán 3,dolotnu
Áo Ngực Scoptop Nữ. Áo Lót Bra Phi Bóng 8 Móc Cài Sau Cao Cấp,45.000₫,https://tiki.vn/ao-nguc-scoptop-nu-ao-lot-bra-phi-bong-8-moc-cai-sau-cao-cap-p179501028.html?spid=179501038,22,,Đã bán 1,dolotnu
Quần lót ren lọt khe - đen,29.000₫,https://tiki.vn/quan-lot-ren-lot-khe-den-p44723066.html?spid=44723067,23,,Đã bán 39,dolotnu
"Áo lót Bra Corset không gọng đệm dày 6cm siêu nâng đẩy tạo khe tự nhiên, Áo ngực bản to che mỡ lưng mỡ nách nâng ngực HQ",220.000₫,https://tiki.vn/ao-lot-bra-corset-khong-gong-dem-day-6cm-sieu-nang-day-tao-khe-tu-nhien-ao-nguc-ban-to-che-mo-lung-mo-nach-nang-nguc-hq-p262844321.html?spid=262844333,24,,,dolotnu
Áo định hình ngực sau phẫu thuật nâng ngực và treo sa trễ ngực.,550.000,https://tiki.vn/ao-dinh-hinh-nguc-sau-phau-thuat-nang-nguc-va-treo-sa-tre-nguc-p73156563.html?spid=73156564,25,,Đã bán 2,dolotnu
,,https://tiki.vn/ao-lot-nu-mong-ren-3-moc-big-size-395-p74820156.html?spid=74820168,26,,,dolotnu
Combo 4 Quần Lót Nữ Phối Ren Miley Lingerie Active FMM0205-0405-1105-1205,180.000₫,https://tiki.vn/combo-4-quan-lot-nu-phoi-ren-miley-lingerie-active-fmm0205-0405-1105-1205-p58068724.html?spid=58068728,27,,Đã bán 20,dolotnu
SIÊU SALE - Áo lót Boya ren mút mỏng có gọng BOYA 522B,90.000₫,https://tiki.vn/sieu-sale-ao-lot-boya-ren-mut-mong-co-gong-boya-522b-p96779045.html?spid=142087020,28,,Đã bán 36,dolotnu
"Áo lót nữ ren nâng ngực không gọng Triumph Sculpt Breeze HU 1749 đệm mút vừa siêu nhẹ, mượt mà và thoáng khí",1.499.000₫,https://tiki.vn/ao-lot-nu-ren-nang-nguc-khong-gong-triumph-sculpt-breeze-hu-1749-dem-mut-vua-sieu-nhe-muot-ma-va-thoang-khi-p203275541.html?spid=203275551,29,,Đã bán 3,dolotnu
Quần lót ren lưới lọt khe cao cấp KẺ SỌC THÊU HỌA TIẾT Siêu thoáng mát cho nữ,28.600₫,https://tiki.vn/quan-lot-ren-luoi-lot-khe-cao-cap-ke-soc-theu-hoa-tiet-sieu-thoang-mat-cho-nu-p270791947.html?spid=270791969,30,,,dolotnu
,,https://tiki.vn/ao-lot-bralette-cotton-sieu-nhe-mem-mong-thoang-khi-b289-p84827368.html?spid=84828001,31,,,dolotnu
Đai nịt bụng Latex Hy Lạp 25 xương chuẩn Hy Lạp_ Đai nịt bụng định hình eo thon chất liệu cao su non Latex,245.000₫,https://tiki.vn/dai-nit-bung-latex-hy-lap-25-xuong-chuan-hy-lap_-dai-nit-bung-dinh-hinh-eo-thon-chat-lieu-cao-su-non-latex-p171717374.html?spid=171718096,32,,,dolotnu
Áo lót cup mút nước BARE B2030001,899.000₫,https://tiki.vn/ao-lot-cup-mut-nuoc-bare-b2030001-p150582004.html?spid=150582014,33,,Đã bán 1,dolotnu
Quần lót nữ cotton lọt khe - Màu đen,29.000₫,https://tiki.vn/quan-lot-nu-cotton-lot-khe-mau-den-p23232414.html?spid=23232419,34,,Đã bán 61,dolotnu
"Áo lót định hình bản to chống hằn,giảm mỡ lưng,chống chảy xệ,Áo ngực nâng ngực không gọng đệm vừa tạo khe tự nhiên",230.000,https://tiki.vn/ao-lot-dinh-hinh-ban-to-chong-han-giam-mo-lung-chong-chay-xe-ao-nguc-nang-nguc-khong-gong-dem-vua-tao-khe-tu-nhien-p263644929.html?spid=263644935,35,,,dolotnu
,,https://tiki.vn/ao-gen-dinh-hinh-bap-tay-sau-hut-mo-bap-tay-co-dinh-nguc-sau-phau-thuat-nang-nguc-treo-sa-tre-p199169223.html?spid=199169235,36,,,dolotnu
Áo ngực cài trước Lovely mút dày 303,129.000₫,https://tiki.vn/ao-nguc-cai-truoc-lovely-mut-day-303-p221009227.html?spid=221009229,37,,,dolotnu
"Combo 3 Quần lót nữ lụa tàng hình,đũng kháng khuẩn,co giãn 4 chiều,mềm mại,thoáng mát, cạp cao không lộ viền",116.000₫,https://tiki.vn/combo-3-quan-lot-nu-lua-tang-hinh-dung-khang-khuan-co-gian-4-chieu-mem-mai-thoang-mat-cap-cao-khong-lo-vien-p203932673.html?spid=204642617,38,,Đã bán 10,dolotnu
Quần lót mặc váy ren nơ cao cấp,24.000₫,https://tiki.vn/quan-lot-mac-vay-ren-no-cao-cap-p20677767.html?spid=51025513,39,,Đã bán 13,dolotnu
Bộ 2 Quần Lót Nữ Cotton Phối Ren Miley Lingerie FCB_04,99.000₫,https://tiki.vn/bo-2-quan-lot-nu-cotton-phoi-ren-miley-lingerie-fcb_04-p21145963.html?spid=21145967,40,,,dolotnu
