title,price,link_item,index,discount,sales,category
Quần lót nữ lọt khe ren hình con bướm sexy Q405 - Quần lọt khe nữ gợi cảm - Quần chip nữ - Quần lót nữ - Freesize 45kg - 57kg - Đỏ,69.000₫,https://tiki.vn/quan-lot-nu-lot-khe-ren-hinh-con-buom-sexy-bt0112-quan-lot-khe-nu-goi-cam-quan-chip-nu-quan-lot-nu-freesize-45kg-57kg-do-p184518602.html?spid=184518603,1,-30%,Đã bán 5,dolotnu
Dán đầu ngực trong iBasic PK013,59.000₫,https://tiki.vn/dan-dau-nguc-trong-ibasic-pk013-p108841227.html?spid=108841232,2,-25%,Đã bán 62,dolotnu
Áo lót vải cotton không gọng không đệm,73.125₫,https://tiki.vn/ao-lot-vai-cotton-khong-gong-khong-dem-p95247224.html?spid=95247550,3,,Đã bán 17,dolotnu
Áo Nịt Ngực Dây Kéo Trước Cao Cấp Dành Cho Tomboy SB Trans - Áo Lót Bó Ép Nịt Làm Nhỏ Ngực Tomboy Thể Thao Gym Thun Ba Lỗ Gen Thun Không Viền Dây Khóa Kéo Trước Bigsize Nguyễn Nguyên,199.000,https://tiki.vn/ao-nit-nguc-day-keo-truoc-cao-cap-danh-cho-tomboy-sb-trans-p76463862.html?spid=76463880,4,,,dolotnu
,,https://tiki.vn/quan-gen-bung-cap-cao-xuat-nhat-danh-tan-bung-mo-p155327283.html?spid=155327287,5,,,dolotnu
Quần Lót Nữ Lọt Khe Ren Quyến Rũ Buộc Hông Gợi Cảm Chất Cotton Chống Bai Chống Xù Lông Freesize Dưới 65Kg,28.000₫,https://tiki.vn/quan-lot-nu-lot-khe-ren-quyen-ru-buoc-hong-goi-cam-chat-cotton-chong-bai-chong-xu-long-freesize-duoi-65kg-p196025052.html?spid=196025058,6,-9%,Đã bán 14,dolotnu
Quần Lót Nữ Mặc Trong Váy Có Túi Bên - 5Star,42.000₫,https://tiki.vn/quan-lot-nu-mac-trong-vay-co-tui-ben-5star-p42869174.html?spid=42869178,7,-18%,Đã bán 22,dolotnu
Quần lót nữ ren sexy hàn quốc kháng khuẩn C34 - quần lót đúc vic phối ren - Quần lót nữ sexy tam giác – Quần lót lọt khe,31.200₫,https://tiki.vn/quan-lot-nu-ren-sexy-han-quoc-khang-khuan-c34-quan-lot-duc-vic-phoi-ren-quan-lot-nu-sexy-tam-giac-quan-lot-lot-khe-p85902127.html?spid=85902162,8,,Đã bán 26,dolotnu
"Áo lót ren không đệm, có gọng hàng cao cấp MS 2004",38.999₫,https://tiki.vn/ao-lot-ren-khong-dem-co-gong-hang-cao-cap-ms-2004-p93715164.html?spid=194847247,9,-43%,,dolotnu
,,https://tiki.vn/ao-lot-quay-chong-tut-co-gong-khong-dem-ren-sieu-mong-b121-p84820217.html?spid=84821436,10,-42%,,dolotnu
Quần lót lọt khe nữ xẻ mông gắn chuông,35.000₫,https://tiki.vn/quan-lot-lot-khe-nu-xe-mong-gan-chuong-p253097974.html?spid=253097978,11,,Đã bán 2,dolotnu
Bộ 2 Quần Lót Thun lạnh Sớ Lụa Miley Lingerie FWS_00 Combo1,79.000₫,https://tiki.vn/bo-2-quan-lot-thun-lanh-so-lua-miley-lingerie-fws_00-nau-den-p44620622.html?spid=44620626,12,,,dolotnu
,,https://tiki.vn/quan-lot-nu-lung-vua-marguerite-0201d-chat-lieu-vai-modal-thien-nhien-tu-than-go-soi-mem-min-va-thoang-mat-co-kha-nang-phong-ngua-vi-khuan-than-thien-voi-lan-da-p143225996.html?spid=143226010,13,,,dolotnu
Bộ đồ lót lọt khe ren nữ gợi cảm,20.000₫,https://tiki.vn/bo-do-lot-lot-khe-ren-nu-goi-cam-p102890449.html?spid=102890453,14,,Đã bán 13,dolotnu
"Áo ngực bra su học sinh BeeNa 2106 không gọng mút nhẹ, co giản thoải mái",95.000₫,https://tiki.vn/ao-nguc-bra-su-hoc-sinh-beena-2106-khong-gong-mut-nhe-co-gian-thoai-mai-p199049134.html?spid=199049136,15,,,dolotnu
Áo Lót Không Gọng Mút Dày Siêu Nâng Ngực Màu Trơn Habpy Lady By Sabina HBXLP0005,383.000₫,https://tiki.vn/ao-lot-khong-gong-mut-day-sieu-nang-nguc-mau-tron-habpy-lady-by-sabina-hbxlp0005-p87616279.html?spid=87616292,16,,Đã bán 43,dolotnu
Quần lót nữ annie 2160 quần lót phối ren thêu,79.000₫,https://tiki.vn/quan-lot-nu-annie-2160-quan-lot-phoi-ren-theu-p167482603.html?spid=167482610,17,,,dolotnu
,,https://tiki.vn/ao-lot-nu-bra-aeon-ao-nguc-tron-mut-mong-p167482027.html?spid=208253205,18,,,dolotnu
Combo 18 Quần Lót Giấy Vải Thun Cotton Giặt Được Loại Đẹp,72.800₫,https://tiki.vn/combo-18-quan-lot-giay-vai-thun-cotton-giat-duoc-loai-day-dep-p47663982.html?spid=191500241,19,,Đã bán 58,dolotnu
"Áo lót nữ annie Bra 8131 cúp B áo nâng ngực vừa, xẻ V sâu",130.000₫,https://tiki.vn/ao-lot-nu-annie-bra-8131-cup-b-ao-nang-nguc-vua-xe-v-sau-p186133274.html?spid=186133286,20,,Đã bán 1,dolotnu
Áo Lót Ren Lưới Nâng Ngực Không Gọng Sexy B390,152.000₫,https://tiki.vn/a-o-lo-t-ren-luo-i-nang-ngu-c-khong-go-ng-sexy-b390-p84821625.html?spid=84821788,21,,Đã bán 23,dolotnu
Áo lót hở lưng dáng chữ U cao cấp Lylylorem AL193,450.000₫,https://tiki.vn/a-o-lo-t-ho-lu-ng-dang-chu-u-cao-cap-lylylorem-al193-p188835490.html?spid=188835502,22,,Đã bán 4,dolotnu
Combo 10 quần lót nữ không đường may iBasic V189,729.000₫,https://tiki.vn/combo-10-quan-lot-nu-khong-duong-may-ibasic-v189-p145990224.html?spid=145990229,23,,Đã bán 16,dolotnu
Quần lót lọt khe ren hoa trắng cao cấp,19.000₫,https://tiki.vn/quan-lot-lot-khe-ren-hoa-trang-cao-cap-p85668646.html?spid=85668648,24,,Đã bán 54,dolotnu
Áo lót nữ đệm vừa áo ngực siêu nâng đẩy ngực tốt Lylylorem AL082,164.000,https://tiki.vn/ao-lot-nu-dem-vua-ao-nguc-sieu-nang-day-nguc-tot-lylylorem-al082-p157055978.html?spid=157055998,25,,,dolotnu
,,https://tiki.vn/quan-lot-nu-spring-cao-cap-big-size-5425-p244298043.html?spid=244298050,26,,,dolotnu
Quần lót nữ lọt khe mông kèm xích to,55.000₫,https://tiki.vn/quan-lot-nu-lot-khe-mong-kem-xich-to-p249874390.html?spid=249874391,27,,Đã bán 1,dolotnu
Quần lót nữ lọt khe bướm sexy - Tím,25.000₫,https://tiki.vn/quan-lot-nu-lot-khe-buom-sexy-tim-p73509325.html?spid=73509326,28,,Đã bán 24,dolotnu
"Quần đùi tập gym, mang váy, độn mông độn hông cao cấp Miss J xuất Nhật",99.000₫,https://tiki.vn/quan-dui-tap-gym-mang-vay-don-mong-don-hong-cao-cap-miss-j-xuat-nhat-p120519518.html?spid=120519575,29,,Đã bán 3,dolotnu
Quần Lót Nữ Tam Giác Cao Cấp. Lưng Thấp Siêu Gợi Cảm. Quần Lót Nữ Sexy,55.000₫,https://tiki.vn/quan-lot-nu-tam-giac-cao-cap-lung-thap-sieu-goi-cam-quan-lot-nu-sexy-p147960965.html?spid=147960981,30,,,dolotnu
,,https://tiki.vn/ao-lot-khong-gong-mut-mong-vua-cup-ngang-day-lung-khong-vien-may-mau-tron-pretty-perfect-by-sabina-sbu8014-p108916840.html?spid=108916883,31,,,dolotnu
Quần lót nữ ren hipster iBasic PANW137,91.000₫,https://tiki.vn/quan-lot-nu-ren-hipster-ibasic-panw137-p193321823.html?spid=193321861,32,,Đã bán 2,dolotnu
"Áo ngực không gọng, mút mỏng 643",85.000₫,https://tiki.vn/ao-nguc-khong-gong-mut-mong-t643-p104794940.html?spid=104795041,33,,Đã bán 20,dolotnu
Combo 6 Quần Lót Nữ Sớ Gỗ Miley Lingerie FWS (Size,227.000₫,https://tiki.vn/combo-6-quan-lot-so-go-mot-tuan-miley-lingerie-color_fws1120_0600_0700_0800_1100_1110-p53501916.html?spid=53501922,34,,Đã bán 136,dolotnu
Quần gen bụng mặc váy nâng mông nữ co dãn 4 chiều cao cấp,84.500₫,https://tiki.vn/quan-gen-bung-mac-vay-nang-mong-nu-co-dan-4-chieu-cao-cap-p183921232.html?spid=183921234,35,,,dolotnu
,,https://tiki.vn/set-bo-do-lot-cao-cap-luperi-ny837-mau-mac-p100743763.html?spid=100743771,36,,,dolotnu
COMBO 3 Quần Lót Su Đúc Không Đường May LOIRECHIC QSD03 Thoải Mái,270.000₫,https://tiki.vn/combo-3-quan-lot-su-duc-khong-duong-may-loirechic-qsd03-thoai-mai-p73166774.html?spid=73166778,37,,Đã bán 102,dolotnu
Áo Lót Đúc Su Bàn Tay Lá Không Gọng Đệm Dày Nâng Ngực,48.888₫,https://tiki.vn/ao-lot-duc-su-ban-tay-la-khong-gong-dem-day-nang-nguc-p191693499.html?spid=191693523,38,,Đã bán 1,dolotnu
Quần lót lọt khe dây ren quần lót nữ sexy hàng quảng châu cao cấp,26.208₫,https://tiki.vn/quan-lot-lot-khe-day-ren-quan-lot-nu-sexy-hang-quang-chau-cao-cap-p120857977.html?spid=120858170,39,,Đã bán 10,dolotnu
ÁO LÓT NỮ CÀI TRƯỚC MỎNG REN THÊU 518,85.000₫,https://tiki.vn/ao-lot-nu-cai-truoc-mong-ren-theu-518-p244298605.html?spid=244298629,40,,Đã bán 5,dolotnu
