title,price,link_item,index,discount,sales,category
"Quần ống rộng suông kiểu nhật, mặc mát lạnh trong ngày hè",69.000₫,https://tiki.vn/quan-ong-rong-suong-kieu-nha-t-mac-mat-lanh-trong-ngay-he-p103432350.html?spid=103434123,1,-50%,Đã bán 209,quannu
"Quần jean nữ Lưng Cao Julido Store, chất jean co dãn 4 chiều ống ôm chân mẫu MH02",150.000₫,https://tiki.vn/quan-jean-nu-lung-cao-julido-store-chat-jean-co-dan-4-chieu-ong-om-chan-mau-mh02-p74309403.html?spid=74309405,2,-78%,Đã bán 196,quannu
"Quần Jean Ống Rộng Nữ Lưng Cao 2 Nút, Túi đắp Mẫu Mới Thuydieushop96",149.000₫,https://tiki.vn/quan-jean-ong-rong-nu-lung-cao-2-nut-tui-dap-mau-moi-thuydieushop96-p111069800.html?spid=111069821,3,-50%,Đã bán 2,quannu
Quần tây nữ quần baggy lưng cạp cao vải from đẹp thời trang âu công sở dày dặn dài màu đen đi học chuẩn,179.000,https://tiki.vn/quan-tay-nu-quan-baggy-lung-cap-cao-vai-from-dep-thoi-trang-au-cong-so-day-dan-dai-mau-den-di-hoc-chuan-p263303760.html?spid=263303805,4,-39%,,quannu
,,https://tiki.vn/quan-lung-ong-rong-vai-dui-gia-vay-p94081677.html?spid=116628845,5,,,quannu
Quần Short Nữ Cạp Cao 4 Khuy Cao Cấp Q110 RumHana,98.750₫,https://tiki.vn/quan-short-nu-cap-cao-4-khuy-cao-cap-q110-rumhana-p104664096.html?spid=104664182,6,-60%,Đã bán 8,quannu
Quần ống rộng nữ chất nhung tăm quần sớ ống xuông cạp chun nhìn chân dài miên man thời trang Banamo Fashion 951,59.000₫,https://tiki.vn/quan-ong-rong-nu-chat-nhung-tam-quan-so-ong-xuong-cap-chun-nhin-chan-dai-mien-man-thoi-trang-banamo-fashion-951-p110897825.html?spid=205369367,7,-42%,,quannu
Quần short nữ chất đũi sần kiểu nhật nhiều màu,45.000₫,https://tiki.vn/quan-short-nu-chat-dui-san-kieu-nhat-nhieu-mau-p106754313.html?spid=106754319,8,,Đã bán 53,quannu
Quần Lụa Cao Cấp Mặc Áo dài - Áo bà ba nhiều màu,136.500,https://tiki.vn/quan-lua-cao-cap-mac-ao-dai-ao-ba-ba-nhieu-mau-p106047036.html?spid=106047461,9,,,quannu
,,https://tiki.vn/quan-tay-nu-lung-cao-di-hoc-ong-dung-3-khuy-dep-cao-cap-han-quoc-dl006-p177188447.html?spid=177188518,10,,,quannu
HNOSS Quần culotles basic 65% Coton 35% Polyester BAC12002013GC,99.000₫,https://tiki.vn/hnoss-quan-culotles-basic-65-coton-35-polyester-bac12002013gc-p113408401.html?spid=113408411,11,,Đã bán 31,quannu
Quần ống rộng ArcticHunter dáng suông cạp cao 2 ly to Linen bột Hàn cạp đắp chéo trẻ trung sang trọng - QR03,269.000,https://tiki.vn/quan-ong-rong-arctichunter-dang-suong-cap-cao-2-ly-to-linen-bot-han-cap-dap-cheo-tre-trung-sang-trong-qr03-p270268574.html?spid=270268602,12,,,quannu
,,https://tiki.vn/quan-jean-dai-ong-rong-lung-cao-kem-tui-nho-quan-bo-nu-culottes-suong-t-22-p69029426.html?spid=101614505,13,,,quannu
Quần baggy nữ cạp lưng cao khuy lệch vải quần tây đen,39.000₫,https://tiki.vn/quan-baggy-nu-cap-lung-cao-khuy-lech-vai-quan-tay-den-p129404122.html?spid=205348621,14,,,quannu
quần jogger nữ bo gấu chất đũi lạ mắt,89.000₫,https://tiki.vn/quan-jogger-nu-bo-gau-chat-dui-la-mat-p108501844.html?spid=108501899,15,,Đã bán 7,quannu
Quần ống rộng quần ống suông lưng cao khoá sườn vải mềm,85.000₫,https://tiki.vn/quan-ong-rong-quan-ong-suong-lung-cao-khoa-suon-vai-mem-p110581106.html?spid=110581118,16,,Đã bán 30,quannu
Quần bò nữ rách màu trắng và đen,299.000,https://tiki.vn/qua-n-bo-nu-ra-ch-ma-u-tra-ng-va-den-p83605675.html?spid=83605762,17,,,quannu
,,https://tiki.vn/quan-dai-tui-hop-ong-rong-kaki-cotton-july-8-tui-cap-cao-nam-nu-unisex-p263326924.html?spid=263326940,18,,,quannu
Quần dài suông ống rộng mặc nhà mùa hè chất vải cotton lụa thoáng mát thoải mái mã Q0271,89.000₫,https://tiki.vn/quan-dai-suong-ong-rong-mac-nha-mua-he-chat-vai-cotton-lua-thoang-mat-thoai-mai-ma-q0271-p174888263.html?spid=208678899,19,,Đã bán 100,quannu
Quần suông ống rộng nữ đi học lưng cao màu đen dáng suông dài cho học sinh - Phối áo sơ mi đi làm công sở -Vải tuyết mưa,84.000₫,https://tiki.vn/quan-suong-ong-rong-nu-di-hoc-lung-cao-mau-den-dang-suong-dai-cho-hoc-sinh-phoi-ao-so-mi-di-lam-cong-so-vai-tuyet-mua-p85308364.html?spid=112102983,20,,Đã bán 19,quannu
QUẦN BAGGY JEAN NỮ( KÈM ẢNH THẬT ) THẮT ĐAI TRẺ TRUNG MÀU XANH NHẠT SANG TRỌNG TB10,125.000₫,https://tiki.vn/quan-baggy-jean-nu-kem-anh-that-that-dai-tre-trung-mau-xanh-nhat-sang-trong-tb10-p111070263.html?spid=111070307,21,,Đã bán 34,quannu
"Quần jean nữ Lưng Cao Julido Store, chất jean co dãn 4 chiều ống ôm chân mẫu MH03",150.000₫,https://tiki.vn/quan-jean-nu-lung-cao-julido-store-chat-jean-co-dan-4-chieu-ong-om-chan-mau-mh03-p74309526.html?spid=74309538,22,,Đã bán 183,quannu
Quần ống rộng lửng nữ đẹp khóa giả chất đũi mát mẻ xuất nhật Q13,91.875₫,https://tiki.vn/quan-ong-rong-lung-nu-dep-khoa-gia-chat-dui-mat-me-xuat-nhat-q13-p104665627.html?spid=104666360,23,,Đã bán 3,quannu
Quần short nữ lưng cao ống rộng DOLOXI kẻ caro cao cấp Q16,65.000₫,https://tiki.vn/quan-short-nu-lung-cao-ong-rong-doloxi-ke-caro-cao-cap-q16-p177188205.html?spid=177188290,24,,Đã bán 1,quannu
QUẦN JEAN DÀI ỐNG RỘNG LƯNG CAO RÁCH - QUẦN BÒ NỮ CULOTTES SUÔNG 59,250.000,https://tiki.vn/quan-jean-dai-ong-rong-lung-cao-rach-quan-bo-nu-culottes-suong-59-p262877621.html?spid=262877626,25,,,quannu
,,https://tiki.vn/quan-jeans-pha-soi-ca-phe-aaa-jeans-dang-skinny-lung-cao-ucsd-coffee-p62360188.html?spid=62360218,26,,,quannu
"Quần jean nữ Lưng Cao Julido Store, chất jean co dãn 4 chiều ống ôm chân mẫu Ms615",159.000₫,https://tiki.vn/quan-jean-nu-lung-cao-julido-store-chat-jean-co-dan-4-chieu-ong-om-chan-mau-ms615-p179526492.html?spid=179526504,27,,Đã bán 12,quannu
quần jogger nữ bo gấu chất đũi hai màu,85.000₫,https://tiki.vn/quan-jogger-nu-bo-gau-chat-dui-hai-mau-p106379297.html?spid=106379303,28,,Đã bán 77,quannu
quần ống rộng dáng dài gân tăm cạp chun nhiều màu mềm mát,78.000₫,https://tiki.vn/quan-ong-rong-dang-dai-gan-tam-cap-chun-nhieu-mau-mem-mat-p103525699.html?spid=103525707,29,,Đã bán 19,quannu
"Quần Legging Nữ Bosimaz MS015 dài không túi màu tiêu xám nhạt cao cấp, thun co giãn 4 chiều, vải đẹp dày, thoáng mát",135.000,https://tiki.vn/quan-legging-nu-bosimaz-ms015-dai-khong-tui-mau-tieu-xam-nhat-cao-cap-thun-co-gian-4-chieu-vai-dep-day-thoang-mat-p242753513.html?spid=242753531,30,,Đã bán 1,quannu
,,https://tiki.vn/quan-tay-ong-rong-khoa-truoc-vai-day-dvq2-p49030933.html?spid=49030941,31,,,quannu
Quần Ống Rộng Kiểu Bản Cạp To 3 Cúc Chất Tuytsi Cao Cấp 53QDS2010ST,309.000₫,https://tiki.vn/quan-ong-rong-kieu-ban-cap-to-3-cuc-chat-tuytsi-cao-cap-53qds2010st-p247823464.html?spid=247823480,32,,Đã bán 1,quannu
"Quần tây ống rộng nữ Linen tưng Prumium Basic trẻ trung, không kén dáng mặc ArcticHunter",250.000₫,https://tiki.vn/quan-tay-ong-rong-nu-linen-tung-prumium-basic-tre-trung-khong-ken-dang-mac-arctichunter-p202848915.html?spid=202848959,33,,Đã bán 12,quannu
Quần alibaba,170.000₫,https://tiki.vn/quan-alibaba-p144045705.html?spid=144045742,34,,Đã bán 1,quannu
"Quần ống rộng nữ, quần culottes nữ chất đũi chun lưng cúc khóa dáng lỡ",65.000₫,https://tiki.vn/qua-n-o-ng-ro-ng-nu-qua-n-culottes-nu-cha-t-du-i-chun-lung-cu-c-kho-a-da-ng-lo-p116577315.html?spid=116577322,35,,,quannu
,,https://tiki.vn/quan-dai-tui-hop-day-rut-ong-rong-kaki-mau-sac-3-mau-cap-cao-nam-nu-unisex-chat-vai-mem-mat-mua-he-p263644052.html?spid=263644058,36,,,quannu
"Quần kaki túi hộp Hiphop ống rộng xuông dài cargo pants trơn thời trang cho nữ/nam -hình thật shop chụp, Quần hộp 4 túi chất liệu kaki, from ống rộng, cạp trước phẳng sau chun dễ mặc",156.000₫,https://tiki.vn/quan-kaki-tui-hop-hiphop-ong-rong-xuong-dai-cargo-pants-tron-thoi-trang-cho-nu-nam-hinh-that-shop-chup-quan-hop-4-tui-chat-lieu-kaki-from-ong-rong-cap-truoc-phang-sau-chun-de-mac-p261114097.html?spid=261114109,37,,Đã bán 2,quannu
Quần ống rộng túi hộp eo dây rút vải kaki phong cách màu trơn 123,129.000₫,https://tiki.vn/quan-ong-rong-tui-hop-eo-day-rut-vai-kaki-phong-cach-mau-tron-123-p271316795.html?spid=271316799,38,,,quannu
"Quần Thun nữ kẻ caro 325, Cực đẹp đầy cá tính",87.000₫,https://tiki.vn/quan-thun-nu-ke-caro-325-cuc-dep-day-ca-tinh-p51408188.html?spid=52140736,39,,Đã bán 17,quannu
"Quần tây nữ Amazing ống đứng, màu xanh và đen, chất liệu tuyết mưa dày mềm, không nhăn, form suông cơ bản, đồng phục học sinh, công sở",163.000,https://tiki.vn/quan-tay-nu-amazing-ong-dung-mau-xanh-va-den-chat-lieu-tuyet-mua-day-mem-khong-nhan-form-suong-co-ban-dong-phuc-hoc-sinh-cong-so-p119068419.html?spid=119068421,40,,,quannu
