title,price,link_item,index,discount,sales,category
Quần jean ống suông nữ khoét eo cá tính có size từ 38kg đến 80kg,139.000₫,https://tiki.vn/quan-jean-ong-suong-nu-khoet-eo-ca-tinh-co-size-tu-38kg-den-80kg-p263403315.html?spid=263403372,1,-12%,,quannu
"Quần baggy kaki nữ ống nhỏ tôn dáng, dễ phối đồ",145.000₫,https://tiki.vn/quan-baggy-kaki-nu-ong-nho-ton-dang-de-phoi-do-p263403290.html?spid=263403339,2,-12%,Đã bán 1,quannu
Quần jogger nữ - ĐEN - HỒNG - BE - S-M-L-XL-2XL,55.000₫,https://tiki.vn/quan-jogger-nu-p158762149.html?spid=158762151,3,,,quannu
QUẦN JEANS ỐNG ĐỨNG ÔM ( MIDI STRAIGHT JEANS ),400.000,https://tiki.vn/quan-jeans-ong-dung-om-midi-straight-jeans-p143329538.html?spid=143329540,4,-20%,,quannu
,,https://tiki.vn/quan-jean-baggy-cap-cao-phoi-chun-hang-cao-cap_np01-p108098815.html?spid=108098857,5,-12%,,quannu
Quần jeans ống loe/ quần jeans nữ/ D0248x,301.950₫,https://tiki.vn/quan-jeans-ong-loe-quan-jeans-nu-d0248x-p108716235.html?spid=108716289,6,,Đã bán 5,quannu
(Ảnh thật) Quần baggy nhung mềm chuẩn loại 1 siêu tôn dáng,129.000₫,https://tiki.vn/anh-that-quan-baggy-nhung-mem-chuan-loai-1-sieu-ton-dang-p135715199.html?spid=135715207,7,,,quannu
Quần tây thun umi chất co dãn size từ (42kg-62kg) CRQ012,142.500₫,https://tiki.vn/quan-tay-thun-umi-chat-co-dan-size-tu-42kg-62kg-crq012-p154096317.html?spid=154096390,8,,,quannu
Quần baggy nữ dáng lửng lưng cao - chất đũi mát lạnh,169.000,https://tiki.vn/quan-baggy-nu-dang-lung-lung-cao-chat-dui-mat-lanh-p102956724.html?spid=102958419,9,,,quannu
,,https://tiki.vn/quan-dai-dui-nu-suri-vai-dui-min-mat-me-hang-cap-nua-thun-phia-sau-co-4-mau-that-tre-trung-p144629384.html?spid=144629414,10,,,quannu
Quần baggy unisex vải đẹp Dv03,149.000₫,https://tiki.vn/quan-baggy-unisex-vai-dep-dv03-p130491970.html?spid=130491993,11,,Đã bán 1,quannu
Quần Jean Nữ Lưng cao.,157.500,https://tiki.vn/quan-jean-nu-lung-cao-p136927458.html?spid=136927496,12,,,quannu
,,https://tiki.vn/quan-skinny-nu-lung-cao-p244902337.html?spid=244902339,13,,,quannu
Quần ống rộng chất đũi xước Nhật hàng thiết kế cao cấp ( Mã SP5),185.000₫,https://tiki.vn/quan-ong-rong-chat-dui-xuoc-nhat-hang-thiet-ke-cao-cap-ma-sp5-p179413068.html?spid=179413103,14,,Đã bán 13,quannu
Quần Jean Nam Ống Rộng Baggy SATU Dáng Suông Đứng Phong Cách Unisex Chất Vải Bò Cao Cấp Dày Dặn Hottrend Hàn Quốc 2022,139.000₫,https://tiki.vn/quan-jean-nam-ong-rong-baggy-satu-dang-suong-dung-phong-cach-unisex-chat-vai-bo-cao-cap-day-dan-hottrend-han-quoc-2022-p179437956.html?spid=179438071,15,,Đã bán 5,quannu
Quần jean beggy nữ dáng rộng hàng thêu xuất khẩu QB01,339.000₫,https://tiki.vn/quan-jean-beggy-nu-dang-rong-hang-theu-xuat-khau-qb01-p17192842.html?spid=17192844,16,,Đã bán 11,quannu
QUẦN ống rộng 3 sọc thể thao,60.000₫,https://tiki.vn/quan-ong-rong-3-soc-the-thao-p116051511.html?spid=192970983,17,,,quannu
,,https://tiki.vn/qua-n-short-jean-tho-i-trang-nu-p20263604.html?spid=20263606,18,,,quannu
Quần dài nữ vải đũi siêu mát bo gấu cách điệu,163.000₫,https://tiki.vn/quan-dai-nu-vai-dui-sieu-mat-bo-gau-cach-dieu-p97550866.html?spid=97550916,19,,Đã bán 2,quannu
"Quần nữ trung niên cho mẹ Q76 - Quần lửng cho người lớn tuổi trung tuổi thời trang cao cấp Legging, ống suông Bigsize",99.000₫,https://tiki.vn/quan-nu-trung-nien-cho-me-q76-quan-lung-cho-nguoi-lon-tuoi-trung-tuoi-thoi-trang-cao-cap-legging-ong-suong-bigsize-p249383460.html?spid=249383464,20,,Đã bán 3,quannu
Quần Jeans ống Loe Dài Trắng Đen Co Giãn,299.000₫,https://tiki.vn/quan-jeans-ong-loe-dai-trang-den-co-gian-p252712538.html?spid=252712638,21,,,quannu
Ngố nữ chất kaki,207.000₫,https://tiki.vn/ngo-nu-chat-kaki-p74969954.html?spid=74969958,22,,,quannu
Quần Jeans Nữ Ống Loe Màu Đen,309.000₫,https://tiki.vn/quan-jeans-nu-ong-loe-mau-den-p69303107.html?spid=69303109,23,,Đã bán 15,quannu
"Quần bò giấy , quần bò nữ ngố ống rộng ( mặc tới gối )",82.000₫,https://tiki.vn/quan-bo-giay-quan-bo-nu-ngo-ong-rong-mac-toi-goi-p119891975.html?spid=262345535,24,,Đã bán 3,quannu
Quần Tây Baggy Nữ Lưng Cạp Cao Quần Công Sở,575.000,https://tiki.vn/quan-tay-baggy-nu-lung-cap-cao-quan-cong-so-p262734815.html?spid=262734819,25,,,quannu
,,https://tiki.vn/quan-kaki-ong-suong-p50434897.html?spid=59609409,26,,,quannu
"Quần nữ ống rộng chất liệu đủi , phôm rộng rủ 91-117 - Trắng - M",119.000₫,https://tiki.vn/quan-nu-ong-rong-chat-lieu-dui-phom-rong-ru-91-117-trang-m-p24495145.html?spid=59314009,27,,Đã bán 75,quannu
Quần ống rộng nữ 2 khuy vải đũi cạp cao suông dài chun sau co dãn thoải mái 922,98.000₫,https://tiki.vn/quan-ong-rong-nu-2-khuy-vai-dui-cap-cao-suong-dai-chun-sau-co-dan-thoai-mai-922-p259548081.html?spid=259548092,28,,,quannu
quần bò nữ đẹp,168.000₫,https://tiki.vn/quan-bo-nu-dep-p55143141.html?spid=78010526,29,,,quannu
quần ống suông màu tím khóa trước 1 khuy chất tuyết mưa,89.000₫,https://tiki.vn/quan-ong-suong-mau-tim-khoa-truoc-1-khuy-chat-tuyet-mua-p108502618.html?spid=108504867,30,,,quannu
,,https://tiki.vn/quan-short-nu-linen-lung-cao-ong-rong-phong-cach-han-quoc-linen-short-dui-viet-p271994006.html?spid=271994014,31,,,quannu
HÌNH THẬT Quần culottes ống rộng Kaki đẹp. Quần Kaki nữ,85.000₫,https://tiki.vn/hinh-that-quan-culottes-ong-rong-kaki-dep-quan-kaki-nu-p67428791.html?spid=77032234,32,,Đã bán 1,quannu
OLV - Quần Wilson Straight Leg Jeans,472.000₫,https://tiki.vn/olv-quan-wilson-straight-leg-jeans-p253691061.html?spid=253691063,33,,,quannu
"Quần jean nữ ống rộng,quần baggy jean nữ ống suông rộng lưng cao phối viền cá tính",154.000₫,https://tiki.vn/quan-jean-nu-ong-rong-quan-baggy-jean-nu-ong-suong-rong-lung-cao-phoi-vien-ca-tinh-p271076690.html?spid=271076704,34,,Đã bán 1,quannu
Quần Đùi Nữ Cạp Liền Vạt Chéo Dáng A Chất Tafta Cao Cấp Mềm Mịn 53ONB2004AT,259.000,https://tiki.vn/quan-dui-nu-cap-lien-vat-cheo-dang-a-chat-tafta-cao-cap-mem-min-53onb2004at-p270205596.html?spid=270205610,35,,,quannu
,,https://tiki.vn/qua-n-jeans-nu-9-ta-c-o-ng-ro-ng-pho-i-tu-i-truo-c-p83606449.html?spid=83606480,36,,,quannu
Quần Ống Rộng Cạp Cao Phối Caro - QD09,90.000₫,https://tiki.vn/quan-ong-rong-cap-cao-phoi-caro-qd09-p73527646.html?spid=83201243,37,,,quannu
"Quần short LINEN TƯNG Nhiều màu - Bigsize. Form rộng, hai túi sâu rộng. Hình thật. JUNE Q02",340.000₫,https://tiki.vn/quan-short-linen-tung-nhieu-mau-fullsize-form-rong-hai-tui-sau-rong-hinh-that-june-q02-p164058146.html?spid=164058205,38,,,quannu
Quần suông ống rộng nam nữ 3 sọc vải thun cotton 4 chiều quần thể thao basic,79.000₫,https://tiki.vn/quan-suong-ong-rong-nam-nu-3-soc-vai-thun-cotton-4-chieu-quan-the-thao-basic-p146231563.html?spid=146231571,39,,,quannu
"quần tăm ống suông - 3(xám),freesize dưới 55kg",150.000,https://tiki.vn/quan-tam-ong-suong-p192384892.html?spid=192384915,40,,,quannu
