title,price,link_item,index,discount,sales,category
com bo 2 bich ta quan yubest angel size m 66 mieng 6-11kg,500.000₫,https://tiki.vn/com-bo-2-bich-ta-quan-yubest-angel-size-m-84-mieng-6-11kg-p85936583.html?spid=85936584,1,-41%,Đã bán 1,tabim
Tã quần Popolini size XL42 12-17kg,315.000₫,https://tiki.vn/ta-quan-popolini-size-xl42-12-17kg-p108896988.html?spid=108896989,2,-29%,Đã bán 1,tabim
COMBO 3 GÓI Khăn ướt Huggies chiết xuất Ca cao và Bơ hạt mỡ gói 72 miếng,96.000₫,https://tiki.vn/combo-3-goi-khan-uot-huggies-chiet-xuat-ca-cao-va-bo-hat-mo-goi-72-mieng-p129665785.html?spid=129665792,3,-31%,Đã bán 14,tabim
TÃ DÁN CARYN L40,410.000₫,https://tiki.vn/ta-dan-caryn-l40-p199127504.html?spid=199127505,4,,,tabim
COMBO 4 BỊCH Bỉm quần Moony natural M46,1.840.000₫,https://tiki.vn/combo-4-bich-bim-quan-moony-natural-m46-p59103745.html?spid=115012985,5,,,tabim
Miếng lót sơ sinh NB1 HUGGIES DRY 108 miếng + 8 miếng,223.500₫,https://tiki.vn/mieng-lot-so-sinh-nb1-huggies-dry-108-mieng-8-mieng-p212325566.html?spid=212325567,6,,Đã bán 5,tabim
Tặng 4 miếng | Tã Dán Trẻ Em Bobby Size S 80 Miếng ( S80 Cho Bé 4 Đến 8 Kg) Êm Mềm Khô Thoáng - Bỉm Dán Bobby Size S,294.600₫,https://tiki.vn/tang-4-mieng-ta-dan-tre-em-bobby-size-s-80-mieng-s80-cho-be-4-den-8-kg-em-mem-kho-thoang-bim-dan-bobby-size-s-p260921413.html?spid=260921415,7,,,tabim
Sỉ- Tã quần Unidry L54 Siêu Mỏng Ultra Thin - Mẫu mới nhất - Date luôn mới,255.500₫,https://tiki.vn/si-ta-quan-unidry-l54-sieu-mong-ultra-thin-mau-moi-nhat-date-luon-moi-p205246223.html?spid=205246224,8,,Đã bán 1,tabim
Sỉ- Miếng Lót Sơ Sinh Huggies Newborn 2 (NB2 60 Miếng) Tràm Trà Tự Nhiên Ngừa Hăm - HSD luôn mới,107.900₫,https://tiki.vn/si-mieng-lot-so-sinh-huggies-newborn-2-nb2-60-mieng-tram-tra-tu-nhien-ngua-ham-hsd-luon-moi-p216351095.html?spid=216351096,9,,,tabim
Sỉ- Tã quần Unidry XL48 Siêu Mỏng Ultra Thin - Mẫu mới nhất - Date luôn mới,255.500₫,https://tiki.vn/si-ta-quan-unidry-xl48-sieu-mong-ultra-thin-mau-moi-nhat-date-luon-moi-p208250997.html?spid=208250998,10,,,tabim
COMBO 3 GÓI TÃ/BỈM Nabizam NỘI ĐỊA HÀN / siêu mõng/ siêu mềm/ siêu thắm hút cho bé yêu,1.131.000₫,https://tiki.vn/combo-3-goi-ta-bim-nabizam-noi-dia-han-sieu-mong-sieu-mem-sieu-tham-hut-cho-be-yeu-p149240084.html?spid=149240124,11,,,tabim
Combo 22 Gói Khăn Ướt Max Cool Không Hương (100 Tờ x 22) - Xanh,539.000₫,https://tiki.vn/combo-22-goi-khan-uot-max-cool-khong-huong-100-to-x-22-xanh-p73319901.html?spid=73319902,12,,Đã bán 6,tabim
Khăn Khô Đa Năng Max Cool 270 Tờ,39.500₫,https://tiki.vn/khan-kho-da-nang-max-cool-270-to-p262456669.html?spid=262456670,13,,Đã bán 2,tabim
Khăn Ướt Yuniku 90 Tờ Không Hương ( 90 tờ ),29.000₫,https://tiki.vn/khan-uot-yuniku-90-to-khong-huong-90-to-p138488625.html?spid=138488626,14,,Đã bán 30,tabim
"Combo 2 Tã vải Quần short BabyCute size M, L - Giao mẫu ngẫu nhiên",220.000₫,https://tiki.vn/combo-2-ta-vai-quan-short-babycute-size-m-l-giao-mau-ngau-nhien-p22304407.html?spid=22304436,15,,Đã bán 47,tabim
tả quần hingiga size 6 XL 100 mieng,270.000₫,https://tiki.vn/ta-quan-yubest-size-xxl-66-mieng-p79747564.html?spid=79747565,16,,Đã bán 36,tabim
ta quan cao cap hingig size M 100 mieng 100 mieng size L 100 mieng size XL 100 mieng XXL 100 mieng XXXL,225.000₫,https://tiki.vn/ta-dan-yubest-night-size-s-84-mieng-p81616559.html?spid=81616563,17,,Đã bán 5,tabim
Combo 2 Tã/bỉm dán Merries size M - 64 + 4 miếng (Cho bé 6 - 11kg),729.000₫,https://tiki.vn/combo-2-ta-bim-dan-merries-size-m-64-4-mieng-cho-be-6-11kg-p36917148.html?spid=58959837,18,,,tabim
"COMBO 2 Tã/Bỉm Quần NABIZAM Magic Soft Nội Địa Hàn Cao Cấp, Khô Thoáng Hiệu Quả Size 2XL Cho Bé Trên 15kg,22 Miếng/Bịch",840.000₫,https://tiki.vn/combo-2-ta-bim-quan-nabizam-magic-soft-noi-dia-han-cao-cap-kho-thoang-hieu-qua-size-2xl-cho-be-tren-15kg-22-mieng-bich-p207779356.html?spid=207779358,19,,Đã bán 3,tabim
"COMBO 4 Bịch Tã/Bỉm Dán NABIZAM Ultrathin Nội Địa Hàn Cao Cấp, Mỏng Và Thấm Hút Tối Ưu Size M Cho Bé 6-11Kg 40 Miếng",1.904.000₫,https://tiki.vn/combo-4-bich-ta-bim-dan-nabizam-ultrathin-noi-dia-han-cao-cap-mong-va-tham-hut-toi-uu-size-m-cho-be-6-11kg-40-mieng-p207779250.html?spid=207779254,20,,,tabim
Tã Quần Siêu Mỏng Size XXL 44 Miếng Chính Hãng Nyna Gold Thấm Hút Cao Cho Bé Khô Thoảng Cả Ngày,334.000₫,https://tiki.vn/ta-quan-sieu-mong-size-xxl-44-mieng-chinh-hang-nynagold-tham-hut-cao-cho-be-kho-thoang-ca-ngay-p171543698.html?spid=171543702,21,,,tabim
Tã Quần Siêu Mỏng Size L 36 Miếng Nyna Gold Siêu Thấm Khô Thoáng Cho Bé,239.000₫,https://tiki.vn/ta-quan-sieu-mong-size-l36-mieng-nynagold-sieu-tham-kho-thoang-cho-be-p171543730.html?spid=171543733,22,,,tabim
Tã/bỉm dán Dry-Pro siêu mềm nhập khẩu Malaysia size S81 (3kg - 7kg) - Gói 81 miếng,330.000₫,https://tiki.vn/ta-bim-dan-dry-pro-sieu-mem-nhap-khau-malaysia-size-s81-3kg-7kg-goi-81-mieng-p147323622.html?spid=147323623,23,,,tabim
"Combo 2 Tã Quần Double Love cho bé Size M54– L50–XL46– XXl44 siêu mỏng, siêu thấm hút an toàn cho bé",570.000₫,https://tiki.vn/combo-2-ta-quan-double-love-cho-be-size-m54-l50-xl46-xxl44-sieu-mong-sieu-tham-hut-an-toan-cho-be-p178514742.html?spid=178514746,24,,,tabim
Tã/bỉm dán Dry-Pro siêu mềm nhập khẩu Malaysia size XL50 (13kg - 15kg) - Gói 50 miếng,300.000₫,https://tiki.vn/ta-bim-dan-dry-pro-sieu-mem-nhap-khau-malaysia-size-xl50-13kg-15kg-goi-50-mieng-p147325645.html?spid=147325647,25,,,tabim
Combo Tã/bỉm quần Dry-Pro XL16 (12kg-17kg) + tặng 1 gói khăn ướt Pur 80 tờ cho bé,165.000₫,https://tiki.vn/combo-ta-bim-quan-dry-pro-xl16-12kg-17kg-tang-1-goi-khan-uot-pur-80-to-cho-be-p150709778.html?spid=150709779,26,,,tabim
Tã Quần Siêu Mỏng Size M40 Miếng Nyna Gold Siêu Thấm Khô Thoáng Cho Bé Cả Ngày Vui Chơi,239.000₫,https://tiki.vn/ta-quan-sieu-mong-size-m40-mieng-nynagold-sieu-tham-kho-thoang-cho-be-ca-ngay-vui-choi-p171543735.html?spid=171543737,27,,,tabim
Combo tã/bỉm dán Dry-Pro S81 (3kg - 7kg) + tặng Túi nước rửa bình sữa Pur 450ml,420.000₫,https://tiki.vn/combo-ta-bim-dan-dry-pro-s81-3kg-7kg-tang-tui-nuoc-rua-binh-sua-pur-450ml-p150718740.html?spid=150718741,28,,,tabim
[COMBO 2 BỊCH] Bỉm/Tã quần Kibie Hàn Quốc size L,540.000₫,https://tiki.vn/combo-2-bich-bim-ta-quan-kibie-han-quoc-size-l-p102392429.html?spid=102392431,29,,Đã bán 13,tabim
Tã Quần Siêu Mềm Size XL 32 Miếng - Bỉm Quần Nyna Chính Hãng,203.000₫,https://tiki.vn/ta-quan-sieu-mem-size-xl-32-mieng-bim-quan-nyna-chinh-hang-p171543731.html?spid=171543734,30,,,tabim
Tã/bỉm quần Dry-Pro siêu thấm hút nhập khẩu Malaysia size M60 (7kg - 12kg) - Gói 60 miếng,330.000₫,https://tiki.vn/ta-bim-quan-dry-pro-sieu-tham-hut-nhap-khau-malaysia-size-m60-7kg-12kg-goi-60-mieng-p147327903.html?spid=147327904,31,,,tabim
Combo tã/bỉm quần Dry-Pro XL44 (12kg-17kg) + tặng Túi nước rửa bình sữa Pur 450ml,375.000₫,https://tiki.vn/combo-ta-bim-quan-dry-pro-xl44-12kg-17kg-tang-tui-nuoc-rua-binh-sua-pur-450ml-p150735555.html?spid=150735556,32,,,tabim
Tã Dán Người Lớn Size M/L 10 Miếng - Tã Người Già Nyna - Bỉm Dán Người Già Siêu Thấm,95.000₫,https://tiki.vn/ta-dan-nguoi-lon-size-m-l-10-mieng-ta-nguoi-gia-nyna-bim-dan-nguoi-gia-sieu-tham-p171543701.html?spid=171543705,33,,Đã bán 3,tabim
"Tã/Bỉm Quần Nabizam Ultra Thin Nội Địa Hàn Siêu Mỏng Nhẹ, Rãnh Chống Tràn Size 3XL20 Cho Bé Từ 20-25kg,20 Mếng/Bịch",420.000₫,https://tiki.vn/ta-bim-quan-nabizam-ultra-thin-noi-dia-han-sieu-mong-nhe-ranh-chong-tran-size-3xl20-cho-be-tu-20-25kg-20-meng-bich-p207779156.html?spid=207779157,34,,,tabim
"COMBO 4 Tã/Bỉm Quần NABIZAM Magic Soft Nội Địa Hàn Cao Cấp, Khô Thoáng Hiệu Quả Size 2XL Cho Bé Trên 15kg,22 Miếng/Bịch",1.680.000₫,https://tiki.vn/combo-4-ta-bim-quan-nabizam-magic-soft-noi-dia-han-cao-cap-kho-thoang-hieu-qua-size-2xl-cho-be-tren-15kg-22-mieng-bich-p207779355.html?spid=207779360,35,,,tabim
10 miếng bỉm Joeco,45.000₫,https://tiki.vn/10-mieng-bim-joeco-p262728563.html?spid=262728564,36,,,tabim
"Combo 2 Tã/Bỉm Quần Nabizam Ultra Thin Nội Địa Hàn Siêu Mỏng, Thấm Hút Tối Ưu Size 2XL22 Cho Bé Từ 15-20kg,22 Miếng/Bịch",840.000₫,https://tiki.vn/combo-2-ta-bim-quan-nabizam-ultra-thin-noi-dia-han-sieu-mong-tham-hut-toi-uu-size-2xl22-cho-be-tu-15-20kg-22-mieng-bich-p207779375.html?spid=207779383,37,,,tabim
"Khăn vải khô đa năng ENJOY sử dụng một lần mềm mại, dai, không mùi dùng làm khăn ăn, spa, nails salon - Hộp 100 tờ",30.000₫,https://tiki.vn/khan-vai-dung-mot-lan-enjoy-p59134217.html?spid=59134219,38,,Đã bán 12,tabim
Tã quần Jo 3S Plus size M72/L64/XL56/XXL48,365.000₫,https://tiki.vn/ta-quan-jo-3s-plus-p111357149.html?spid=111556297,39,,Đã bán 7,tabim
"COMBO 4 Tã/Bỉm Quần NABIZAM UltraThin Công Nghệ Thấm Hút Từ Hàn Quốc, Mỏng Nhẹ Và Chống Tràn Size XL /từ 12kg/26 miếng",1.680.000₫,https://tiki.vn/combo-4-ta-bim-quan-nabizam-ultrathin-cong-nghe-tham-hut-tu-han-quoc-mong-nhe-va-chong-tran-size-xl-tu-12kg-26-mieng-p207779439.html?spid=207779446,40,,Đã bán 3,tabim
