title,price,link_item,index,discount,sales,category
"Tủ sấy quần áo Kalite KL6880,công suất 900w, Diệt vi khuẩn, nấm mốc, di chuyển dễ dàng,tháo lắp linh hoạt- hàng chính hãng",1.190.000₫,https://tiki.vn/tu-say-quan-ao-kalite-kl6880-cong-suat-900w-diet-vi-khuan-nam-moc-di-chuyen-de-dang-thao-lap-linh-hoat-p273289325.html?spid=273289326,1,-25%,Đã bán 2,thietbij
Quạt Trần Panasonic F-56MPG-S – Bạc - Hàng chính hãng,2.389.000₫,https://tiki.vn/quat-tran-panasonic-f-56mpg-s-bac-hang-chinh-hang-p637446.html?spid=22152239,2,-5%,Đã bán 56,thietbij
"Máy Hút Bụi Cầm Tay Không Dây Sử Dụng Pin Sạc Lực Hút Mạnh Mẽ 16000PA Có Cán Dài Tặng Kèm 8 Đầu Hút Đa Năng, Hút Bụi Ô Tô Và Gia Đình – Hàng Chính Hãng",522.500₫,https://tiki.vn/may-hut-bui-cam-tay-khong-day-su-dung-pin-sac-luc-hut-manh-me-16000pa-co-can-dai-tang-kem-8-dau-hut-da-nang-hut-bui-o-to-va-gia-dinh-hang-chinh-hang-p212315260.html?spid=212315262,3,-23%,Đã bán 65,thietbij
"Máy Lọc Không Khí ULTTY SKJ-CR021 Dạng Quạt, Chế Độ Làm Mát 9 Cấp, Bộ Lọc HEPA H13 Loại Bỏ 99,97% Bụi Mịn, Vi Khuẩn, Virut - Màu Đen - Hàng Chính Hãng",4.505.000₫,https://tiki.vn/may-loc-khong-khi-ultty-skj-cr021-dang-quat-che-do-lam-mat-9-cap-bo-loc-hepa-h13-loai-bo-99-97-bui-min-vi-khuan-virut-mau-den-hang-chinh-hang-p91565152.html?spid=91565153,4,-50%,Đã bán 32,thietbij
,,https://tiki.vn/cay-nuoc-nong-lanh-de-ban-cao-cap-p54384147.html?spid=54384148,5,-35%,,thietbij
"Robot Hút Bụi Lau Nhà Thông Minh XIAOMI ROBOROCK S7 Max Ultra Tự Hút Rác Và Giặt Sấy Giẻ Lau Diện Tích Hoạt Động 300m2 Công Suất 74W Lực Hút 5,100 Pa - Hàng Chính Hãng",20.499.000₫,https://tiki.vn/robot-hut-bui-lau-nha-xiaomi-lydsto-g2-tu-dong-do-rac-dien-tich-hoat-dong-200m2-cong-suat-28w-hang-chinh-hang-p247761640.html?spid=195981260,6,-33%,Đã bán 8,thietbij
Robot Hút Bụi Lau Nhà Xiaomi Vacuum E10 / S10 / X10 / S10 PLUS EU Bản Quốc Tế - Hàng Chính Hãng FPT,4.193.000₫,https://tiki.vn/robot-hut-bui-lau-nha-xiaomi-vacuum-e10-s10-x10-eu-ban-quoc-te-chinh-hang-fpt-p270214784.html?spid=270214786,7,-50%,Đã bán 1,thietbij
Robot lau sàn hút bụi tự làm sạch thông minh Dreame Bot L20 Ultra - Bản quốc tế - Hàng chính hãng,23.990.000₫,https://tiki.vn/robot-lau-san-hut-bui-tu-lam-sach-thong-minh-dreame-bot-l20-ultra-ban-quoc-te-hang-chinh-hang-p270305953.html?spid=270305956,8,,,thietbij
Máy Lọc Không Khí Xiaomi Jya Fjord/ Jya Fjord Pro Có Khử UV Kết Nối App Phù Hợp Không Gian 60 m2 - Hàng Chính Hãng,5.299.000₫,https://tiki.vn/may-loc-khong-khi-xiaomi-mi-air-purifier-4-pro-xiaomi-jya-fjord-jya-fjord-pro-cam-ung-khu-uv-ket-noi-app-phu-hop-khong-gian-60-m2-hang-chinh-hang-p214106754.html?spid=214106757,9,-17%,Đã bán 37,thietbij
,,https://tiki.vn/may-loc-khong-khi-samsung-60m2-ax60r5080wd-hang-chinh-hang-p57489542.html?spid=178724112,10,-46%,,thietbij
Quạt không cánh thế hê mới lọc không khí bằng công nghệ ion cho không khí trong lành hơn( Hàng nhập khẩu),1.892.400₫,https://tiki.vn/quat-khong-canh-the-he-moi-loc-khong-khi-bang-cong-nghe-ion-cho-khong-khi-trong-lanh-hon-hang-nhap-khau-p187513168.html?spid=187513170,11,,Đã bán 20,thietbij
Máy hút bụi lau sàn làm sạch thông minh không dây Tineco Floor One S3 - Hàng chính hãng,7.590.000₫,https://tiki.vn/may-hut-bui-lau-san-lam-sach-thong-minh-khong-day-tineco-floor-one-s3-p120790044.html?spid=120790045,12,-6%,Đã bán 43,thietbij
,,https://tiki.vn/may-say-toc-panasonic-eh-nd37-p645-say-nhanh-voi-hieu-qua-tuong-duong-2000w-che-do-cham-soc-da-dau-bao-ve-nhiet-hang-chinh-hang-p200962904.html?spid=270975141,13,-42%,,thietbij
Phụ kiện Robot hút bụi lau nhà Dreame D9 / F9,195.000₫,https://tiki.vn/phu-kien-robot-hut-bui-lau-nha-xiaomi-dreame-d9-f9-hang-chinh-hang-p113400195.html?spid=113400203,14,-17%,Đã bán 31,thietbij
Quạt Trần Thông Minh Haiku Cocoa Bamboo 52 inch - Động Cơ EC Vận Hành Êm Ái Và Bền Bỉ - Có Điều Khiển Qua App Và Remote - Hàng Chính Hãng,36.000.000₫,https://tiki.vn/quat-tran-thong-minh-haiku-cocoa-bamboo-52-inch-dong-co-ec-van-hanh-em-ai-va-ben-bi-co-dieu-khien-qua-app-va-remote-hang-chinh-hang-p104791252.html?spid=104791256,15,-16%,,thietbij
"Máy lọc nước AQUA 11 cấp lọc có đèn UV diệt khuẩn gắn âm chậu rửa, tủ bếp",1.650.000₫,https://tiki.vn/may-loc-nuoc-aqua-11-cap-loc-co-den-uv-diet-khuan-gan-am-chau-rua-tu-bep-p217103433.html?spid=217103437,16,-42%,Đã bán 1,thietbij
Quạt treo tường Mitsubishi W16-RA CY-GY Xám Đậm - Hàng chính hãng,2.220.000₫,https://tiki.vn/quat-treo-tuong-mitsubishi-w16-ra-cy-gy-xam-dam-hang-chinh-hang-p212421924.html?spid=212421925,17,-10%,Đã bán 5,thietbij
,,https://tiki.vn/may-lam-mat-khong-khi-midea-aad10ar-quat-hoi-nuoc-hoi-da-quat-may-lanh-co-dieu-khien-chay-em-khong-gay-on-hang-chinh-hang-p105357403.html?spid=105357404,18,-27%,,thietbij
Máy Lọc Không Khí Philips AC0850/20 AC1715/20 – Hàng Chính Hãng,3.499.000₫,https://tiki.vn/may-loc-khong-khi-philips-ac0850-20-ac1715-20-hang-chinh-hang-p243051073.html?spid=67555662,19,-42%,Đã bán 18,thietbij
"Máy lọc nước nóng lạnh 10 lõi lọc Karofi KAD-N89, màng lọc RO chuẩn Mỹ 100GPD - Hàng Chính Hãng - Miễn phí lắp đặt toàn quốc",13.031.000₫,https://tiki.vn/may-loc-nuoc-nong-lanh-10-loi-loc-karofi-kad-n89-mang-loc-ro-chuan-my-100gpd-hang-chinh-hang-mien-phi-lap-dat-toan-quoc-p173176435.html?spid=173176436,20,-50%,Đã bán 43,thietbij
Máy Lọc Nước RO Tích Hợp Làm Nóng Lạnh Fujie WPD5300C - Hàng Chính Hãng,5.560.000₫,https://tiki.vn/may-loc-nuoc-ro-tich-hop-lam-nong-lanh-fujie-wpd5300c-hang-chinh-hang-p71149762.html?spid=71149763,21,-21%,Đã bán 29,thietbij
Máy sấy tóc Dyson Supersonic Hairdyer HD15 Limited Edition Hàng chính hãng,11.300.000₫,https://tiki.vn/may-say-toc-dyson-supersonic-hairdyer-hd15-limited-edition-hang-chinh-hang-p273381875.html?spid=273381876,22,,,thietbij
Quạt đứng điều khiển từ xa Senko hàng chính hãng - DR1608,693.000₫,https://tiki.vn/quat-dung-dieu-khien-tu-xa-senko-hang-chinh-hang-dr1608-p17014393.html?spid=152300041,23,-20%,Đã bán 26,thietbij
[MỚI RA MẮT] Máy hút bụi & lau sàn không dây Tefal X-Combo GF3039KO - Hàng chính hãng,9.900.000₫,https://tiki.vn/may-hut-bui-lau-san-khong-day-tefal-x-combo-gf3039ko-hang-chinh-hang-p225242156.html?spid=225242157,24,-43%,Đã bán 5,thietbij
Máy lọc không khí Daikin MC30VVM-A,2.890.000₫,https://tiki.vn/may-loc-khong-khi-daikin-mc30vvm-a-p272912787.html?spid=272912788,25,,Đã bán 2,thietbij
,,https://tiki.vn/may-hut-am-va-tao-i-on-electrolux-edh10trbw1-20l-dtsd-42m2-hang-chinh-hang-p171037796.html?spid=195716175,26,,,thietbij
"Quạt Điều Hòa Làm Mát Bằng Hơi Nước Dung Tích 40L, Công Suất 130W, Siêu Mát Với 3 Cấp Gió Giúp Làm Mát Nhanh, Tiết Kiệm Điện",1.174.000₫,https://tiki.vn/quat-dieu-hoa-lam-mat-bang-hoi-nuoc-dung-tich-40l-cong-suat-130w-sieu-mat-voi-3-cap-gio-giup-lam-mat-nhanh-tiet-kiem-dien-p90364348.html?spid=185914745,27,,Đã bán 1,thietbij
Quạt đứng Toshiba F-LSA10(H)VN (50W) - Xám - Hàng chính hãng,1.168.500₫,https://tiki.vn/quat-dung-toshiba-f-lsa10-h-vn-50w-xam-hang-chinh-hang-p26078293.html?spid=72207474,28,,Đã bán 12,thietbij
Bộ lọc nước tại vòi Philips AWP3753 - Hàng Chính Hãng,1.350.000₫,https://tiki.vn/bo-loc-nuoc-tai-voi-philips-awp3753-hang-chinh-hang-p188189693.html?spid=188189694,29,,Đã bán 51,thietbij
Bàn ủi hơi nước dạng đứng Gaabor GS2000M-WH04A công suất 2000W dung tích 3L 3 nấc điều chỉnh nhiệt độ - Hàng chính hãng,994.000₫,https://tiki.vn/ban-ui-hoi-nuoc-dang-dung-gaabor-gs2000m-wh04a-cong-suat-2000w-dung-tich-3l-3-nac-dieu-chinh-nhiet-do-hang-chinh-hang-p273396096.html?spid=273396097,30,,,thietbij
,,https://tiki.vn/may-loc-nuoc-unilever-pureit-pureit-delica-hang-chinh-hang-p70586449.html?spid=160561897,31,,,thietbij
Quạt Sưởi Phòng Tắm Sunhouse SHD3816W - Chính Hãng,880.000₫,https://tiki.vn/quat-suoi-phong-tam-sunhouse-shd3816w-chinh-hang-p40979155.html?spid=48411691,32,,Đã bán 7,thietbij
[SẢN PHẨM MỚI] Máy húi bụi không dây X-force Flex 9.60 TY2039WO - Tím - Hàng chính hãng,5.800.000₫,https://tiki.vn/may-hui-bui-khong-day-x-force-flex-9-60-ty2039wo-tim-p262454303.html?spid=262454304,33,,Đã bán 1,thietbij
"Robot Hút Bụi Lau Nhà, Tự Động Giặt Sấy Giẻ, Tự Gom Rác Tự Động Thêm Nước DREAME S10/L10S Ultra, Tạo Bản Đồ Siêu Nhanh, Camera AI, Diện Tích Hoạt Động 200m2, Áp Suất 5300 Pa, Công Suất 75W - Hàng Chính Hãng",9.099.000₫,https://tiki.vn/robot-hut-bui-lau-nha-xiaomi-roidmi-eva-tu-do-rac-giat-gie-say-kho-dien-tich-hoat-dong-250m2-cong-suat-48w-ap-suat-3200-pa-hang-chinh-hang-p210402680.html?spid=210402683,34,,Đã bán 9,thietbij
Máy Cạo Râu Du Lịch Philips S1103 - Hàng Chính Hãng,629.000₫,https://tiki.vn/may-cao-rau-du-lich-philips-s1103-hang-chinh-hang-p174162744.html?spid=174162746,35,,Đã bán 27,thietbij
,,https://tiki.vn/may-hut-bui-lau-san-lam-sach-thong-minh-khong-day-tineco-ifloor-2-hang-chinh-hang-p120797515.html?spid=120797516,36,,,thietbij
"Bàn ủi hơi nước đứng Tefal IXEO Power QT2020EO - Sản xuất tại Pháp, 2170W, 1.1L - Hàng chính hãng",11.990.000₫,https://tiki.vn/ban-ui-hoi-nuoc-dung-tefal-ixeo-power-qt2020eo-san-xuat-tai-phap-2170w-1-1l-hang-chinh-hang-p247765147.html?spid=247765148,37,,Đã bán 6,thietbij
Máy Lọc Không Khí Xiaomi Mi Air Purifier 4 (BHR5096GL) - Hàng Chính Hãng,4.999.000₫,https://tiki.vn/may-loc-khong-khi-xiaomi-mi-air-purifier-4-bhr5096gl-hang-chinh-hang-p163170723.html?spid=178756909,38,,Đã bán 2,thietbij
"Máy Lọc Nước RYO Hyundai RP901 Chuẩn Nước Khoáng Uống Trực Tiếp - Công Nghệ UF 5 Cấp Lọc, Nhập Khẩu Hàn Quốc - Hàng Chính Hãng",2.950.000₫,https://tiki.vn/lap-dat-don-gian-may-loc-nuoc-uong-khong-dung-dien-ryo-hyundai-rp901-han-quoc-cong-nghe-uf-luu-giu-khoang-chat-khong-nuoc-thai-cong-suat-7-000-lit-co-ban-loi-loc-thay-the-hang-chinh-hang-p169271077.html?spid=169271081,39,,Đã bán 17,thietbij
Quạt tháp MIDEA ZAF09MR điều khiển từ xa thông minh Hàng chính hãng,1.999.000₫,https://tiki.vn/quat-thap-midea-zaf09mr-dieu-khien-tu-xa-thong-minh-hang-chinh-hang-p257538220.html?spid=95750122,40,,Đã bán 119,thietbij
