title,price,link_item,index,discount,sales,brand
"Đầm len cổ 3 phân dáng xòe thu đông, chất len dày dặn, thời trang phong cách trẻ",160.000₫,https://tiki.vn/dam-len-co-3-phan-dang-xoe-thu-dong-lahstore-chat-len-day-dan-thoi-trang-phong-cach-tre-p132834526.html?spid=132834534,1,,Đã bán 1,LAHstore
"Áo len nhẹ nữ dệt quả trám trẻ trung, thời trang thu đông 2021 - Xám",89.000₫,https://tiki.vn/ao-len-nhe-nu-det-qua-tram-tre-trung-thoi-trang-thu-dong-2021-xam-p125710526.html?spid=125710527,2,,,LAHstore
Quần lót lọt khe hình cánh bướm,15.000₫,https://tiki.vn/quan-lot-lot-khe-hinh-canh-buom-p102683028.html?spid=102683030,3,,,LAHstore
Áo ngủ nữ dáng dài cát mỏng gợi cảm - Đen,219.000,https://tiki.vn/ao-ngu-nu-dang-dai-cat-mong-goi-cam-lahstore-den-p115874349.html?spid=115874351,4,,Đã bán 3,LAHstore
,,https://tiki.vn/ao-so-mi-dui-nhan-form-rong-phong-cach-tre-thoi-trang-xuan-he-2022-p175414315.html?spid=175414333,5,,,LAHstore
Áo sơ mi nữ form rộng cổ tầu chất thô đũi LAHSTORE phong cách Hàn Quốc,250.000₫,https://tiki.vn/ao-so-mi-nu-form-rong-co-tau-chat-tho-dui-lahstore-phong-cach-han-quoc-p181419452.html?spid=181419472,6,,Đã bán 1,LAHstore
"Đầm suông đũi cổ tròn phối túi hộp, thời trang hè thu",199.000₫,https://tiki.vn/dam-suong-dui-co-tron-phoi-tui-hop-thoi-trang-he-thu-2022-p181428489.html?spid=181428551,7,,Đã bán 4,LAHstore
"Set đồ bộ nữ mặc nhà đẹp LAHSTORE, kiểu dáng sát nách cổ bẻ, chất liệu linen cao cấp, form rộng thích hợp từ 45 đến 70kg",320.000₫,https://tiki.vn/set-do-bo-nu-mac-nha-dep-lahstore-kieu-dang-sat-nach-co-be-chat-lieu-linen-cao-cap-form-rong-thich-hop-tu-45-den-70kg-p181418356.html?spid=181418371,8,,,LAHstore
"Áo sơ mi nữ linen tay cánh rơi trẻ trung LAHSTORE, phong cách Hàn Quốc",189.000,https://tiki.vn/ao-so-mi-nu-linen-tay-canh-roi-tre-trung-lahstore-phong-ca-ch-ha-n-quo-c-p181417165.html?spid=181417177,9,,Đã bán 1,LAHstore
,,https://tiki.vn/ao-len-nu-co-3-phan-tran-gan-thung-am-ap-lahstore-thu-dong-2021-be-p181417863.html?spid=181417873,10,,,LAHstore
"Đồ bộ linen nữ mặc nhà sát nách cổ bẻ LAHSTORE, thích hợp từ 45 đến 70kg",320.000₫,https://tiki.vn/do-bo-linen-nu-mac-nha-sat-nach-co-be-lahstore-thich-hop-tu-45-den-70kg-p181418467.html?spid=181418481,11,,,LAHstore
"Đầm sơ mi cổ tầu tay lỡ form rộng trẻ trung, chất vải thô đũi mềm mát, thời trang phong Hàn",199.000,https://tiki.vn/dam-so-mi-co-tau-tay-lo-form-rong-tre-trung-chat-vai-tho-dui-mem-mat-thoi-trang-phong-han-p181428573.html?spid=181428595,12,,,LAHstore
,,https://tiki.vn/dam-suong-linen-co-tim-tay-ngan-tre-trung-thoi-trang-he-thu-2022-p181428890.html?spid=181428960,13,,,LAHstore
"Áo kiểu nữ cổ voan bèo nhẹ nhàng, thích hợp đi chơi du lịch, thời trang xuân hè 2022 - Vàng",82.600₫,https://tiki.vn/ao-kieu-nu-co-voan-beo-nhe-nhang-thich-hop-di-choi-du-lich-thoi-trang-xuan-he-2022-vang-p181428892.html?spid=181428929,14,,Đã bán 2,LAHstore
"Áo khoác nhẹ blazer demi Linen tay lỡ, thời trang thu đông 2022",280.000₫,https://tiki.vn/ao-khoac-nhe-blazer-demi-linen-tay-lo-lahstore-thoi-trang-thu-dong-2022-p204665068.html?spid=204665076,15,,,LAHstore
Set bộ đồ linen tưng premium tay cánh rơi trẻ trung - Áo xanh cốm + Quần trắng,380.000₫,https://tiki.vn/set-bo-do-linen-tung-premium-tay-canh-roi-tre-trung-lahstore-ao-xanh-com-quan-trang-p204669803.html?spid=204669811,16,,,LAHstore
Đầm suông linen tay hến thêu hoa ngực - Trắng gạo,290.000,https://tiki.vn/dam-suong-linen-tay-hen-theu-hoa-nguc-lahstore-trang-gao-p204671826.html?spid=204671832,17,,,LAHstore
,,https://tiki.vn/set-bo-linen-tung-premium-ao-tay-canh-doi-form-rong-tre-trung-kem-quan-short-lahstore-ao-trang-quan-hong-p204378182.html?spid=204378188,18,,,LAHstore
Đầm suông thêu hoa Linen tưng Premium sang trọng,450.000₫,https://tiki.vn/dam-suong-theu-hoa-linen-tung-premium-sang-trong-lahstore-p205218670.html?spid=205218672,19,,,LAHstore
Áo sơ mi nữ form rộng tay cộc túi hộp chất thô mát,250.000₫,https://tiki.vn/ao-so-mi-nu-form-rong-tay-coc-tui-hop-chat-tho-mat-lahstore-p199552821.html?spid=199552825,20,,,LAHstore
Set bộ linen bột Premium áo vest dáng lửng 4 khuy trước kèm quần ống rộng trẻ trung - Be muốn tiêu,294.000₫,https://tiki.vn/set-bo-linen-bot-premium-ao-vest-dang-lung-4-khuy-truoc-kem-quan-ong-rong-tre-trung-be-muon-tieu-p198614301.html?spid=198614325,21,,,LAHstore
Set bộ vest Blazer Linen ve vuông túi bổ 1 khuy Form rộng kèm quần short và áo 2 dây trẻ trung - Hồng sen,222.600₫,https://tiki.vn/set-bo-vest-blazer-linen-ve-vuong-tui-bo-1-khuy-form-rong-kem-quan-short-va-ao-2-day-tre-trung-hong-sen-p200731983.html?spid=200732007,22,,Đã bán 1,LAHstore
Set bộ linen tưng Premium Áo cổ 2 ve kèm quần dáng lửng trẻ trung - Xanh dương,499.000₫,https://tiki.vn/set-bo-linen-tung-premium-ao-co-2-ve-kem-quan-dang-lung-tre-trung-xanh-duong-p199554037.html?spid=199554039,23,,,LAHstore
Áo Blazer nữ form rộng dáng dài 2 túi bổ nắp trẻ trung - Xanh than,320.000₫,https://tiki.vn/ao-blazer-nu-form-rong-dang-dai-2-tui-bo-nap-tre-trung-lahstore-xanh-than-p207192877.html?spid=207192885,24,,,LAHstore
Set bộ Linen dáng lửng áo cổ tàu xẻ V trẻ trung - Áo xanh dương + Quần xanh than đậm,320.000,https://tiki.vn/set-bo-linen-dang-lung-ao-co-tau-xe-v-tre-trung-lahstore-ao-xanh-duong-quan-xanh-than-dam-p205618321.html?spid=205618327,25,,,LAHstore
,,https://tiki.vn/dam-suong-linen-bot-premium-tay-coc-co-tru-tui-cheo-p205820971.html?spid=205820985,26,,,LAHstore
"Đầm suông thêu hoa diện tết cho thêm rực rỡ, chất vải Linen tưng Premium mềm mát, tay hến trẻ trung",350.000₫,https://tiki.vn/dam-suong-theu-hoa-dien-tet-cho-them-ruc-ro-chat-vai-linen-tung-premium-mem-mat-tay-hen-tre-trung-lahstore-p206360720.html?spid=206360730,27,,,LAHstore
Đầm linen nữ dáng suông cổ V túi hộp dây thắt eo LAHSTORE phong cách Hàn Quốc,280.000₫,https://tiki.vn/da-m-linen-nu-da-ng-suong-co-v-tu-i-ho-p-day-tha-t-eo-lahstore-phong-ca-ch-ha-n-quo-c-p181417766.html?spid=181417775,28,,Đã bán 1,LAHstore
Áo khoác cardigan len nữ thêu hình cô gái LAHSTORE thu đông 2021,250.000₫,https://tiki.vn/a-o-khoa-c-cardigan-len-nu-the-u-hi-nh-co-ga-i-lahstore-thu-dong-2021-p181417188.html?spid=181417196,29,,,LAHstore
Đầm len suông rút eo phối ren đuôi cá sang trọng,150.000,https://tiki.vn/dam-len-suong-rut-eo-phoi-ren-duoi-ca-sang-trong-lahstore-p199548556.html?spid=199548564,30,,,LAHstore
,,https://tiki.vn/ao-so-mi-nu-co-duc-chat-tho-cotton-mem-dep-day-dan-lahstore-p199540381.html?spid=199540387,31,,,LAHstore
"Áo cardigan len nữ, len mịn thêu hình mèo",230.000₫,https://tiki.vn/ao-cardigan-len-nu-len-min-theu-hinh-meo-lahstore-p199548294.html?spid=199548296,32,,,LAHstore
Áo sơ mi nữ form rộng dài tay chất thô cotton mềm mát,280.000₫,https://tiki.vn/ao-so-mi-nu-form-rong-dai-tay-chat-tho-cotton-mem-mat-lahstore-p199552659.html?spid=199552663,33,,,LAHstore
Áo sơ mi nữ form rộng tay lỡ chất thô,260.000₫,https://tiki.vn/ao-so-mi-nu-form-rong-tay-lo-chat-tho-lahstore-p200720670.html?spid=200720676,34,,,LAHstore
"Đầm dáng xòe không tay phối màu trẻ trung, thời trang hè thu 2022",59.000₫,https://tiki.vn/dam-dang-xoe-khong-tay-phoi-mau-tre-trung-thoi-trang-he-thu-2022-p181428424.html?spid=181428442,35,,,LAHstore
,,https://tiki.vn/dam-suong-linen-tay-lo-co-chu-v-lahstore-chat-vai-linen-tu-nhien-mem-mat-p181418447.html?spid=181418457,36,,,LAHstore
"Áo sơ mi nữ đũi lụa chấm bi tay buộc nơ trẻ trung, chất mềm mát, thời trang hè thu 2022",139.000₫,https://tiki.vn/ao-so-mi-nu-dui-lua-cham-bi-tay-buoc-no-tre-trung-chat-mem-mat-thoi-trang-he-thu-2022-p175107029.html?spid=175107037,37,,Đã bán 11,LAHstore
Áo vest blazer nữ Linen tay lỡ xắn trẻ trung,320.000₫,https://tiki.vn/ao-vest-blazer-nu-linen-tay-lo-san-tre-trung-lahstore-p204645635.html?spid=204645655,38,,,LAHstore
Áo sơ mi nữ linen dài tay form rộng trẻ trung - Tím nhạt,250.000₫,https://tiki.vn/ao-so-mi-nu-linen-dai-tay-form-rong-tre-trung-lahstore-tim-nhat-p204660982.html?spid=204660988,39,,,LAHstore
Áo sơ mi Linen nữ cổ tàu tay bồng trẻ trung - Trắng,139.000,https://tiki.vn/ao-so-mi-linen-nu-co-tau-tay-bong-tre-trung-lahstore-trang-p205620179.html?spid=205620181,40,,,LAHstore
