title,price,link_item,index,discount,sales,category
Áo Thô Đũi Nam Trơn Cổ Tròn Chất Liệu Thoáng Mát Phong Cách Tối Giản,182.250₫,https://tiki.vn/ao-tho-dui-nam-tron-co-tron-chat-lieu-thoang-mat-phong-cach-toi-gian-p106607978.html?spid=106608545,1,,Đã bán 6,aosomi
Áo Sơ Mi Nam Ngắn Tay SMH83 - SMH83,180.000₫,https://tiki.vn/ao-so-mi-nam-ngan-tay-smh83-smh83-p15054486.html?spid=15054488,2,,Đã bán 5,aosomi
Áo Sơ Mi Nam Ngắn Tay Viền Cổ Phối Túi QK8522,157.000₫,https://tiki.vn/ao-so-mi-nam-ngan-tay-vien-co-phoi-tui-qk8522-p83158034.html?spid=83158050,3,,,aosomi
Áo sơ mi nam tay dài họa tiết trang báo,219.000,https://tiki.vn/ao-so-mi-nam-tay-dai-hoa-tiet-trang-bao-p75411100.html?spid=75411106,4,,,aosomi
,,https://tiki.vn/ao-so-mi-nam-ngan-tay-mau-vang-p28042213.html?spid=28624898,5,,,aosomi
Áo sơ mi cọc tay nam,84.200₫,https://tiki.vn/ao-so-mi-coc-tay-nam-p41264466.html?spid=41264478,6,,Đã bán 16,aosomi
Sơ mi nam họa tiết vẹt thời trang,175.000₫,https://tiki.vn/so-mi-nam-hoa-tiet-vet-thoi-trang-p77618621.html?spid=77618623,7,,,aosomi
Áo sơ mi nam dài tay màu đen không túi,108.000₫,https://tiki.vn/ao-so-mi-nam-dai-tay-mau-den-khong-tui-p52337325.html?spid=52337331,8,,Đã bán 37,aosomi
Áo Sơ Mi Nam Ngắn Tay Phối Caro BBR,169.000,https://tiki.vn/ao-so-mi-nam-ngan-tay-phoi-caro-p83160886.html?spid=83160955,9,,,aosomi
,,https://tiki.vn/ao-so-mi-nam-caro-mau-xanh-301c-p28312527.html?spid=85184253,10,,,aosomi
Áo Sơ Mi Nam Kate Dài Tay Cổ Trụ,157.000₫,https://tiki.vn/ao-so-mi-nam-kate-dai-tay-co-tru-p82643656.html?spid=82643808,11,,,aosomi
Áo Sơ Mi Đôi Chữ Love Siêu Cá Tính,99.000₫,https://tiki.vn/ao-so-mi-doi-chu-love-sieu-ca-tinh-p91964287.html?spid=91964356,12,,,aosomi
,,https://tiki.vn/ao-so-mi-nam-phoi-vien-hoa-tiet-rong-cao-cap-p104115083.html?spid=104115217,13,,,aosomi
Áo sơ mi nam trắng tay dài họa tiết hoa hồng cao cấp SM304,115.000₫,https://tiki.vn/ao-so-mi-nam-trang-tay-dai-hoa-tiet-hoa-hong-cao-cap-sm304-p104151865.html?spid=104151889,14,,,aosomi
"Áo Sơ Mi Nam Dài Tay Phối Caro Chất Kate Mềm Mịn, Thoáng Mát, Tạo Cảm Giác Thoải Mái Khi Mặc",100.000₫,https://tiki.vn/ao-so-mi-nam-dai-tay-phoi-caro-chat-kate-mem-min-thoang-mat-tao-cam-giac-thoai-mai-khi-mac-p73730989.html?spid=104260346,15,,Đã bán 6,aosomi
Áo Sơ Mi Nam Phối Viền Họa Tiết Versace Cao Cấp,136.500₫,https://tiki.vn/ao-so-mi-nam-phoi-vien-hoa-tiet-versace-cao-cap-p104116771.html?spid=104117273,16,,,aosomi
Áo Sơ Mi Nam Cổ Trụ Tay Dài Phối Viền Ngực Mẫu,163.000,https://tiki.vn/ao-so-mi-nam-co-tru-tay-dai-phoi-vien-nguc-mau-p83161525.html?spid=83161916,17,,Đã bán 1,aosomi
,,https://tiki.vn/ao-khoac-so-mi-nam-caro-ao-hoac-so-mi-nu-caro-ao-caro-nam-ao-caro-nu-ao-khoac-unisex-kieu-dang-so-mi-soc-caro-nhuyen-mau-xanh-ao-so-mi-caro-co-non-p88007961.html?spid=103510719,18,,,aosomi
Áo sơ mi cặp a2,330.000₫,https://tiki.vn/ao-so-mi-cap-a2-p25402727.html?spid=25402737,19,,Đã bán 13,aosomi
Áo khoác sơ mi caro nam nữ Form to,79.900₫,https://tiki.vn/ao-khoac-so-mi-caro-nam-nu-form-to-p113065444.html?spid=171991720,20,,Đã bán 5,aosomi
Áo Khoác Sơ Mi Caro KẺ UNISEX NAM NỮ Dài Tay 2 màu (đỏ-vàng),84.000₫,https://tiki.vn/ao-khoac-so-mi-caro-ke-unisex-nam-nu-dai-tay-2-mau-do-vang-p113066157.html?spid=171991770,21,,Đã bán 2,aosomi
"Áo sơ mi nam dài tay SỌC caro phối túi hàng vnxk cực đẹp , vải kate xuất không xù - ASM012",380.000₫,https://tiki.vn/ao-so-mi-nam-dai-tay-soc-caro-phoi-tui-hang-vnxk-cuc-dep-vai-kate-xuat-khong-xu-asm012-p159127138.html?spid=159127146,22,,,aosomi
"Aó Sơ Mi Trắng Nam Tay Ngắn, Dài Dáng Ôm Slim Fit Cao Cấp Hàn Quốc(Vải Dêt 30 Phần Trăm Từ Tre Bambo, Gỗ Sồi)",450.000₫,https://tiki.vn/ao-so-mi-trang-nam-tay-ngan-dai-dang-om-slim-fit-cao-cap-han-quoc-vai-det-30-phan-tram-tu-tre-bambo-go-soi-p177785009.html?spid=177785015,23,,,aosomi
Áo Sơ Mi Nam Tay Ngắn AE Short Sleeve Eagle Logo Oxford Shirt - Size XS/S/M/L/XL,450.000₫,https://tiki.vn/ao-so-mi-nam-tay-ngan-ae-short-sleeve-eagle-logo-oxford-shirt-size-xs-s-m-l-xl-p180893377.html?spid=180893381,24,,,aosomi
Áo Sơ Mi Tay Ngắn Next Oxford Striped Shirt - SIZE XS,250.000,https://tiki.vn/ao-so-mi-tay-ngan-next-oxford-striped-shirt-size-xs-p180894056.html?spid=180894060,25,,,aosomi
,,https://tiki.vn/so-mi-nam-mau-trang-in-hoa-tiet-cay-anh-dao-tmstore-chat-vai-lua-cao-cap-men-min-thoang-mat-tmasmn35-p148954802.html?spid=153498682,26,,,aosomi
ÁO SƠ MI NGẮN TAY NAM CỰC HOT PHONG CÁCH DÀNH CHO DÂN CHƠI KME FASHION,97.000₫,https://tiki.vn/ao-so-mi-ngan-tay-nam-cuc-hot-phong-cach-danh-cho-dan-choi-kme-fashion-p165883930.html?spid=165884309,27,,Đã bán 1,aosomi
Áo phông nam nữ gấu siêu ngầu vải dày mịn 2020T3044,53.000₫,https://tiki.vn/ao-phong-nam-nu-gau-sieu-ngau-vai-day-min-2020t3044-p190375105.html?spid=190375942,28,,,aosomi
Áo sơ mi nam Khatoco tay ngắn lai ngang,438.000₫,https://tiki.vn/ao-so-mi-nam-khatoco-tay-ngan-lai-ngang-p193005955.html?spid=193005959,29,,,aosomi
Áo sơ mi nam Khatoco tay dài,448.000,https://tiki.vn/ao-so-mi-nam-khatoco-tay-dai-p193040338.html?spid=193040348,30,,,aosomi
,,https://tiki.vn/ao-so-mi-nam-dai-tay-phong-cach-linh-arm-1007-xanh-linh-p198573882.html?spid=198573884,31,,,aosomi
Áo sơ mi nam dài tay rằn ri phong cách lính ARM-987,650.000₫,https://tiki.vn/ao-so-mi-nam-dai-tay-ran-ri-phong-cach-linh-arm-987-p198571381.html?spid=198571391,32,,,aosomi
Áo sơ mi nam cộc tay phong cách lính Army ARM-805,500.000₫,https://tiki.vn/ao-so-mi-nam-coc-tay-phong-cach-linh-army-arm-805-p198577070.html?spid=198577186,33,,,aosomi
Áo sơ mi Khatoco tay ngắn,468.000₫,https://tiki.vn/ao-so-mi-khatoco-tay-ngan-p270481678.html?spid=270481684,34,,,aosomi
Áo khoác sơ mi UNISEX phối caro đa năng dùng làm áo khoác hoặc sơ mi đều được in chữ G8 (kèm ảnh thật),89.000₫,https://tiki.vn/ao-khoac-so-mi-unisex-phoi-caro-da-nang-dung-lam-ao-khoac-hoac-so-mi-deu-duoc-in-chu-g8-kem-anh-that-p195194175.html?spid=261025204,35,,Đã bán 1,aosomi
,,https://tiki.vn/so-mi-nam-phoi-day-hot-chat-lua-mango-cao-cap-p272001357.html?spid=272001371,36,,,aosomi
Sơ mi nam cộc tay May 10 form RegularFit mã 010123190 3,405.000₫,https://tiki.vn/so-mi-nam-coc-tay-may-10-form-regularfit-ma-010123190-3-p270241907.html?spid=270241909,37,,,aosomi
Sơ mi nam cộc tay May 10 form RegularFit mã 010123190 4,405.000₫,https://tiki.vn/so-mi-nam-coc-tay-may-10-form-regularfit-ma-010123190-4-p270242361.html?spid=270242369,38,,,aosomi
OWEN LUXURY - Áo sơ mi dài tay Owen dòng cao cấp 91067,1.050.000₫,https://tiki.vn/owen-luxury-ao-so-mi-dai-tay-owen-dong-cao-cap-91067-p103702540.html?spid=103702562,39,,Đã bán 2,aosomi
Bộ áo và quần bảo hộ lao động vải kaki màu ghi,239.000,https://tiki.vn/bo-ao-va-quan-bao-ho-lao-dong-vai-kaki-mau-ghi-p69303085.html?spid=69507887,40,,,aosomi
