title,price,link_item,index,discount,sales,category
Áo Thun Nam Áo Thun Nam Cổ Bẻ Tay Ngắn Phối Họa Tiết Sư Tử Thời Trang Nam Phong Cách,125.000₫,https://tiki.vn/ao-thun-nam-freeship-ao-thun-nam-co-be-tay-ngan-phoi-hoa-tiet-su-tu-thoi-trang-nam-phong-cach-p111709364.html?spid=111709383,1,,Đã bán 17,aothun
Áo Thun Dài Tay Nam T0007,315.000₫,https://tiki.vn/ao-thun-dai-tay-nam-t0007-p201910913.html?spid=201910921,2,,,aothun
ÁO THUN NAM DÀI TAY CỔ TRỤ PHỐI NÚT,149.000₫,https://tiki.vn/ao-thun-nam-dai-tay-co-tru-phoi-nut-p80437373.html?spid=80437386,3,-10%,Đã bán 3,aothun
"Áo Polo nam cổ bẻ ngắn tay, chất liệu cao cấp, thoáng mát, bền màu, thiết kế trẻ trung – FORMEN SHOP – FMPS054 - XANH BÍCH - XL",159.000,https://tiki.vn/ao-polo-nam-co-be-ngan-tay--chat-lieu-cao-cap--thoang-mat--ben-mau--thiet-ke-tre-trung---formen-shop---fmps054-p20076156.html?spid=20076168,4,-31%,,aothun
,,https://tiki.vn/ao-thun-nam-co-tron-tsimple-phong-tron-tay-ngan-vai-cotton-cao-cap-chong-nhan-form-rong-a10104-p262515631.html?spid=262515639,5,-35%,,aothun
Áo Free Fire In 3D Màu Đen Alok,75.900₫,https://tiki.vn/ao-free-fire-in-3d-mau-den-alok-p68603245.html?spid=68603247,6,,Đã bán 49,aothun
Áo Polo nam ngắn tay kẻ ngang đỏ-navy-trắng ALGPLO96,472.500₫,https://tiki.vn/ao-polo-nam-ngan-tay-ke-ngang-do-navy-trang-algplo96-p270801422.html?spid=270801432,7,,Đã bán 1,aothun
Bộ thể thao nam TSIMPLE bộ quần áo cộc tay phối sọc vải cotton cá sấu cao cấp B01002,432.000₫,https://tiki.vn/bo-the-thao-nam-tsimple-bo-quan-ao-coc-tay-phoi-soc-vai-cotton-ca-sau-cao-cap-b01002-p271953985.html?spid=271954003,8,-64%,Đã bán 2,aothun
ÁO THUN NAM NỮ COTON BIG SIZE MSICROW GOOS,129.000,https://tiki.vn/ao-thun-nam-nu-coton-big-size-msicrow-goos-p174168358.html?spid=174168552,9,-21%,,aothun
,,https://tiki.vn/ao-polo-caro-det-kim-nu-tay-ngan-dang-rong-len-mongtogi-kieu-co-be-phoi-mau-thoi-trang-hang-dep-quang-chau-cao-cap-p192174199.html?spid=192174203,10,-25%,,aothun
ÁO THUN NAM COTTON CỔ BẺ SỌC PHỐI TÚI ĐẸP,159.000₫,https://tiki.vn/ao-thun-nam-cotton-co-be-soc-phoi-tui-dep-p81074966.html?spid=81075055,11,-53%,,aothun
"Áo polo nam nữ phối 4 màu, đủ size , chất cotton poly form áo đẹp, trẻ trung",95.000₫,https://tiki.vn/ao-polo-nam-nu-phoi-4-mau-du-size-chat-cotton-poly-form-ao-dep-tre-trung-p270703337.html?spid=270703351,12,-18%,,aothun
,,https://tiki.vn/ao-nam-thun-lanh-tron-cao-cap-p158758037.html?spid=158758425,13,,,aothun
Áo thun nam dập vân cao tần siêu mát siêu mềm,75.000₫,https://tiki.vn/ao-thun-nam-dap-van-cao-tan-sieu-mat-sieu-mem-p158758292.html?spid=158758858,14,,Đã bán 5,aothun
Áo Thun Nam Cổ Tròn TSIMPLE phông trơn tay ngắn vải Cotton cao cấp chống nhăn chuẩn form MSSATTCX,149.000₫,https://tiki.vn/ao-thun-nam-co-tron-tsimple-phong-tron-tay-ngan-vai-cotton-cao-cap-chong-nhan-chuan-form-mssattcx-p150685095.html?spid=150685119,15,-48%,Đã bán 136,aothun
"Áo Polo Nam Dài Tay Cổ Bẻ 5S FASHION, Chất Cotton Mềm, Thấm Hút, Ấm, Thiết Kế Trơn Dễ Mặc (APD23002)",240.000₫,https://tiki.vn/ao-polo-nam-dai-tay-co-be-5s-fashion-chat-cotton-mem-tham-hut-am-thiet-ke-tron-de-mac-apd23002-p272624708.html?spid=272624748,16,,Đã bán 2,aothun
"Áo Polo Nam 5S, Chất Liệu Viscose Kết Hợp Cotton Siêu Mát, Thấm Hút, Thiết Kế Lịch Lãm, Trẻ Trung (APC23031)",185.000,https://tiki.vn/ao-polo-nam-5s-chat-lieu-viscose-ket-hop-cotton-sieu-mat-tham-hut-thiet-ke-lich-lam-tre-trung-apc23031-p251283924.html?spid=251283936,17,,,aothun
,,https://tiki.vn/ao-thun-nam-ngan-tay-co-tron-giordano-01022250-p199535439.html?spid=199535449,18,,,aothun
Áo Thun Nam Có Cổ Logo Classic Polo Giordano 01011260,210.000₫,https://tiki.vn/ao-thun-nam-co-co-logo-classic-polo-giordano-01011260-p217477138.html?spid=217477191,19,,Đã bán 5,aothun
Áo Polo Nam Enkoni Coolmate Trendy - M,429.000₫,https://tiki.vn/ao-polo-nam-enkoni-coolmate-trendy-p252782518.html?spid=252782522,20,,,aothun
Áo thun tay lỡ form rộng - phông nam nữ cotton oversize - T shirt God said - 2N Unisex,99.000₫,https://tiki.vn/ao-thun-tay-lo-form-rong-phong-nam-nu-cotton-oversize-t-shirt-god-said-2n-unisex-p248985977.html?spid=248985979,21,,Đã bán 14,aothun
Áo thun nam ngắn tay cổ trụ thời trang SITAKI cao cấp ATN01,99.000₫,https://tiki.vn/ao-thun-nam-ngan-tay-co-tru-thoi-trang-sitaki-cao-cap-atn01-p71149014.html?spid=71149024,22,,Đã bán 95,aothun
"Áo ba lỗ nam, áo sát nách nam,sợi cotton cao cấp mềm mịn, thấm hút mồ hôi, siều thoáng mát, co giãn 4 chiều Mrm Manlywear",116.100₫,https://tiki.vn/ao-thun-ba-lo-nam-sat-nach-soi-cotton-mem-min-tham-hut-mo-hoi-thoang-mat-co-gian-4-chieu-mrm-manlywear-p68200548.html?spid=68200555,23,,Đã bán 315,aothun
"Áo Thun Nam, Áo Phông Nam Chấm Bi FAJA Cổ Bẻ, Chất Liệu Cao Cấp",99.000₫,https://tiki.vn/ao-thun-nam-ao-phong-nam-cham-bi-faja-co-be-chat-lieu-cao-cap-p20634650.html?spid=20634692,24,,Đã bán 460,aothun
Áo thun polo nam sọc ngang có cổ bẻ vải cá sấu cao cấp ND05,155.000,https://tiki.vn/ao-thun-polo-nam-soc-ngang-co-co-be-vai-ca-sau-cao-cap-nd05-p43862651.html?spid=43862671,25,,,aothun
,,https://tiki.vn/tokyo-ma-g91-ao-thun-nam-nu-in-sieu-dep-ao-phong-thoat-nhiet-goking-hang-hieu-cao-cap-p164313903.html?spid=252753621,26,,,aothun
"Áo lót bộ đội, ao lót nam tay ngắn cổ tròn cổ tim hàng chuẩn",55.000₫,https://tiki.vn/ao-lot-co-tron-co-tim-hang-chuan-p248415876.html?spid=263455928,27,,Đã bán 14,aothun
"Áo Polo Nam 5S FASHION Cotton, Thiết Kế Can Phối Trẻ Trung, Lịch Lãm, Tay Thêu Nổi Bật (APC23095)",199.000₫,https://tiki.vn/ao-polo-nam-5s-fashion-chat-lua-thiet-ke-det-bo-hieu-ung-theu-sang-trong-lich-lam-apc23094-p272425386.html?spid=272425388,28,,Đã bán 3,aothun
"Combo 2 áo ba lỗ nam/áo 3 lỗ nam, sợi cotton mềm mịn siêu thoáng mát, thấm hút mồ hôi cực tốt, co giãn 4 chiều MRM FASHION -MM",206.100₫,https://tiki.vn/combo-2-ao-ba-lo-nam-ao-lot-nam-cao-cap-mrm-fashion-mix-mau-p43333663.html?spid=43333677,29,,Đã bán 917,aothun
Áo Thun Nam Khatoco A2MN398R2-VNSC212-2411-N,329.340,https://tiki.vn/ao-thun-nam-khatoco-a2mn398r2-vnsc212-2411-n-p243051224.html?spid=243051232,30,,Đã bán 4,aothun
,,https://tiki.vn/ao-thun-co-co-nam-giordano-luxury-touch-polo-01010236-p122350671.html?spid=122820990,31,,,aothun
Combo 2 Áo thun thể thao nam MRM Active Pro thấm hút mồ hôi tốt co dãn thoải mái vận động,206.100₫,https://tiki.vn/combo-2-ao-thun-the-thao-nam-mrm-active-pro-tham-hut-mo-hoi-tot-co-dan-thoai-mai-van-dong-p193504415.html?spid=193504438,32,,Đã bán 125,aothun
"UNSTOPABLE, mã G60. Áo thun siêu đẹp cho cả gia đình. Form unisex cho nam nữ, trẻ em, bé trai gái. Quà tặng ý nghĩa cho bố mẹ, con cái, bạn bè, doanh nghiệp, hội nhóm",69.000₫,https://tiki.vn/unstopable-ma-g60-ao-thun-nam-nu-in-sieu-dep-ao-phong-thoat-nhiet-goking-hang-hieu-cao-cap-p164310643.html?spid=252679087,33,,Đã bán 9,aothun
Áo thun trơn nam form rộng vải poly cotton cho mọi lứa tuổi NHIÊU MÀU SIÊU SALE,11.000₫,https://tiki.vn/ao-thun-tron-nam-form-rong-vai-poly-cotton-cho-moi-lua-tuoi-nhieu-mau-sieu-sale-p97861305.html?spid=115790058,34,,Đã bán 15,aothun
Áo Phông Nam Polo Tay Ngắn Phối Màu Thời Trang VICERO,189.000,https://tiki.vn/ao-phong-nam-polo-tay-ngan-phoi-mau-thoi-trang-vicero-p105361476.html?spid=105361505,35,,,aothun
,,https://tiki.vn/ao-polo-nam-enkoni-basic-trang-vai-coolmate-p252869380.html?spid=252869384,36,,,aothun
Áo Thun Ba Lỗ Nam Sát Nách Vải Cotton Mềm Form Rộng In Chữ Phong Cách Thể Thao Thời Trang Zenkonu TOP NAM 260,39.000₫,https://tiki.vn/ao-thun-ba-lo-nam-sat-nach-vai-cotton-mem-form-rong-in-chu-phong-cach-the-thao-thoi-trang-zenkonu-top-nam-260-p248349581.html?spid=271727920,37,,Đã bán 3,aothun
"Áo thun bò sữa nam nữ mặc , áo thun form rộng tay lỡ bò sữa , áo thun unisex chấy cotton",87.000₫,https://tiki.vn/ao-thun-bo-sua-nam-nu-mac-ao-thun-form-rong-tay-lo-bo-sua-ao-thun-unisex-chay-cotton-p90065069.html?spid=91096871,38,,Đã bán 10,aothun
Áo Thun Nam Cổ Bẻ Ngắn Tay XV02 Thời Trang Top Fashion Shop Chất Vải Mềm Mịn Phong Cách Hàn Quốc,125.000₫,https://tiki.vn/ao-thun-nam-co-be-ngan-tay-xv02-thoi-trang-top-fashion-shop-chat-vai-mem-min-phong-cach-han-quoc-p105951107.html?spid=105951212,39,,Đã bán 2,aothun
Áo Thun Lót Nam Khatoco A3MN190R2-VNMA002-2407-N,151.000,https://tiki.vn/ao-thun-lot-nam-khatoco-a3mn190r2-vnma002-2407-n-p243045239.html?spid=243045249,40,,,aothun
