title,price,link_item,index,discount,sales,brand
"BỘ ĐỒ VEST BÉ TRAI CATRIO PCT2125/11 là đồ bộ suit trẻ em có 3 chi tiết: áo vest + quần dài +áo ghile gilet được thiết kế tuyệt đẹp cho bé trai từ 2 tuổi (12kg) đến 12 tuổi (50kg) mặc trong các dịp lễ Tết, biểu diễn, hội nghị, tiệc cưới sinh nhật dạ hội",769.000₫,https://tiki.vn/bo-do-vest-be-trai-catrio-pct2125-11-la-do-bo-suit-tre-em-co-3-chi-tiet-ao-vest-quan-dai-ao-ghile-gilet-duoc-thiet-ke-tuyet-dep-cho-be-trai-tu-2-tuoi-12kg-den-12-tuoi-50kg-mac-trong-cac-dip-le-tet-bieu-dien-hoi-nghi-tiec-cuoi-sinh-nhat-da-hoi-p270809745.html?spid=270809747,1,,,catrio
"QUẦN SHORT BÉ TRAI CATRIO IN VARSITY MÀU NAVY là quần ngố, quần lửng trẻ em từ 5 tuổi 20kg đến 14 tuổi 50kg, vải dệt kiểu da cá 100% cotton an toàn đạt chuẩn xuất khẩu, khi kết hợp với áo phông ngắn tay thành bộ đồ bé trai mặc đi học, đi chơi du lịch đẹp",87.200₫,https://tiki.vn/quan-short-be-trai-catrio-in-varsity-mau-navy-la-quan-ngo-quan-lung-tre-em-tu-5-tuoi-20kg-den-14-tuoi-50kg-vai-det-kieu-da-ca-100-cotton-an-toan-dat-chuan-xuat-khau-khi-ket-hop-voi-ao-phong-ngan-tay-thanh-bo-do-be-trai-mac-di-hoc-di-choi-du-lich-dep-p230203491.html?spid=230203495,2,,Đã bán 1,catrio
"ÁO THUN DÀI TAY BÉ TRAI CATRIO HÌNH ĐẠI BÀNG MÀU CAM là áo phông trẻ em từ 5 tuổi đến 7 tuổi (20kg đến 28kg), vải 100% cotton an toàn, thuộc BST quần áo trẻ em mùa thu đông CATRIO+ quần dài cotton thành bộ đồ thu đông trẻ em đẹp",95.200₫,https://tiki.vn/ao-thun-dai-tay-be-trai-catrio-hinh-dai-bang-mau-cam-la-ao-phong-tre-em-tu-5-tuoi-den-7-tuoi-20kg-den-28kg-vai-100-cotton-an-toan-thuoc-bst-quan-ao-tre-em-mua-thu-dong-catrio-2021-trang-size-12-45kg_49kg-p121010015.html?spid=121010017,3,,,catrio
Mua 2 chiếc quần đùi bé trai CATRIO từ 13 tuổi(50kg)_18 tuổi (70kg)=138.000 VNĐ sẽ tiết kiệm được 32k tiền vận chuyển đây là quần đùi trẻ em vải 100% cotton đạt chuẩn xuất khẩu khi kết hợp áo thun ngắn tay thành bộ đồ mùa hè cho bé mặc ở nhà đi chơi CHUỘT,110.400,https://tiki.vn/mua-2-chiec-quan-dui-be-trai-catrio-tu-13-tuoi-50kg-_18-tuoi-70kg-138-000-vnd-se-tiet-kiem-duoc-32k-tien-van-chuyen-day-la-quan-dui-tre-em-vai-100-cotton-dat-chuan-xuat-khau-khi-ket-hop-ao-thun-ngan-tay-thanh-bo-do-mua-he-cho-be-mac-o-nha-di-choi-chuot-p261824817.html?spid=261824819,4,,,catrio
,,https://tiki.vn/bo-thun-be-trai-catrio-in-bong-sao-mau-xam-la-bo-do-mua-he-cua-be-trai-tu-9-tuoi-32kg-den-18-tuoi-60kg-gom-quan-dui-ao-sat-nach-vai-100-cotton-dat-chuan-xuat-khau-thich-hop-voi-tre-em-mac-o-nha-di-choi-rat-thoang-mat-giup-cac-be-hanh-phuc-p229704938.html?spid=229704940,5,,,catrio
"ÁO HOODIES TRẺ EM CATRIO in XE ĐẠP BAY là áo thun dài tay có mũ có túi thời trang, vải 100% cotton dày, ấm mùa thu đông phù hợp với trẻ em bé trai, bé gái 9 tuổi 32kg-34kg kết hợp quần dài cotton CATRIO thành bộ đồ đẹp MÀU ĐỎ",215.200₫,https://tiki.vn/ao-hoodies-tre-em-catrio-in-xe-da-p-bay-la-ao-thun-dai-tay-co-mu-co-tui-thoi-trang-vai-100-cotton-day-am-mua-thu-dong-phu-hop-voi-tre-em-be-trai-be-gai-9-tuo-i-32kg-34kg-ke-t-ho-p-qua-n-da-i-cotton-catrio-tha-nh-bo-do-de-p-ma-u-do-p270815061.html?spid=270815062,6,,,catrio
Quần dài thun bé trai vải 100% cotton PHỐI SƯỜN màu NAVY pha XÁM in SAO CỜ là quần nỉ trẻ em CATRIO từ 9 tuổi (30kg) đến 18 tuổi (73kg) phù hợp thời tiết se lạnh mùa thu đông với kiểu dáng thể thao tuyệt đẹp,143.200₫,https://tiki.vn/quan-dai-thun-be-trai-vai-100-cotton-phoi-suon-mau-navy-pha-xam-in-sao-co-la-quan-ni-tre-em-catrio-tu-9-tuoi-30kg-den-18-tuoi-73kg-phu-hop-thoi-tiet-se-lanh-mua-thu-dong-voi-kieu-dang-the-thao-tuyet-dep-p201441620.html?spid=201441629,7,,,catrio
"ÁO THUN BÉ GÁI CATRIO cổ tròn, thêu chim chick, màu xám cho trẻ em từ 1 tuổi (12kg) đến 8 tuổi (30kg) thay thế áo len là BST quần áo trẻ em mùa thu đông CATRIO",135.200₫,https://tiki.vn/ao-thun-be-gai-catrio-co-tron-theu-chim-chick-mau-xam-cho-tre-em-tu-1-tuoi-12kg-den-8-tuoi-30kg-thay-the-ao-len-la-bst-quan-ao-tre-em-mua-thu-dong-catrio-p144574659.html?spid=144574675,8,,,catrio
ÁO THUN DÀI TAY BÉ TRAI CATRIO in SPACE TRÁI ĐẤT màu CAM là áo phông tay dài trẻ em từ 8kg 10kg 12 kg .. 30kg (8 tuổi) cổ tròn vải dệt kim co giãn 4 chiều + quần dài cotton thành bộ đồ thu đông cho bé rất đẹp,87.200₫,https://tiki.vn/a-o-thun-da-i-tay-be-trai-catrio-in-space-tra-i-da-t-ma-u-cam-la-a-o-phong-tay-da-i-tre-em-tu-8kg-10kg-12-kg-30kg-8-tuo-i-co-tro-n-va-i-de-t-kim-co-gia-n-4-chie-u-qua-n-da-i-cotton-tha-nh-bo-do-thu-dong-cho-be-ra-t-de-p-p270976487.html?spid=270976491,9,,,catrio
,,https://tiki.vn/ao-thun-be-trai-ngan-tay-catrio-hinh-3-may-anh-mau-navy-la-ao-phong-tre-em-tu-5-tuoi-10-tuoi-den-12-tuoi-20kg-30kg-den-50kg-thuoc-bst-quan-ao-tre-em-catrio-du-lich-mua-he-2021-p113377557.html?spid=113377559,10,,,catrio
QUẦN ĐÙI COTTON NAM CATRIO MÀU 20 CHO NGƯỜI TỪ 40KG 50KG ĐẾN 83KG LÀ QUẦN ĐÙI NAM ĐƯỢC LÀM TỪ VẢI ÁO SƠ MI THUỘC BST QUẦN SHORT ÁO PHÔNG MÙA HÈ CATRIO 2021,44.000₫,https://tiki.vn/quan-dui-cotton-nam-catrio-mau-20-cho-nguoi-tu-40kg-50kg-den-83kg-la-quan-dui-nam-duoc-lam-tu-vai-ao-so-mi-thuoc-bst-quan-short-ao-phong-mua-he-catrio-2021-p109005228.html?spid=109005234,11,,,catrio
"BỘ THUN BÉ TRAI CATRIO IN VARSITY MÀU XÁM là bộ đồ mùa hè của bé trai từ 1 tuổi 12kg đến 4 tuổi 25kg, gồm QUẦN ĐÙI + ÁO SÁT NÁCH, vải 100% cotton đạt chuẩn xuất khẩu, thích hợp với trẻ em mặc ở nhà, đi chơi rất thoáng mát, giúp các bé hạnh phúc",127.200,https://tiki.vn/bo-thun-be-trai-catrio-in-varsity-mau-xam-la-bo-do-thun-tre-em-tu-1-tuoi-den-4-tuoi-20kg-den-23kg-thuoc-bst-quan-ao-thoi-trang-tre-em-catrio-mua-he-2021-p95059336.html?spid=95059342,12,,,catrio
,,https://tiki.vn/ao-hoodies-tre-em-catrio-in-xe-da-p-bay-la-ao-thun-dai-tay-co-mu-co-tui-thoi-trang-vai-100-cotton-day-am-mua-thu-dong-phu-hop-voi-tre-em-be-trai-be-gai-9-tuo-i-32kg-34kg-ke-t-ho-p-qua-n-da-i-cotton-catrio-tha-nh-bo-do-de-p-ma-u-den-p270815049.html?spid=270815050,13,,,catrio
"BỘ THUN BÉ TRAI CATRIO in bóng tròn ATTITUDE màu XANH NAVY là bộ đồ trẻ em từ 5 tuổi 20kg đến 18 tuổi 60kg gồm có QUẦN ĐÙI + ÁO SÁT NÁCH vải 100% cotton an toàn đạt chuẩn xuất khẩu thích hợp các bé trai mặc ở nhà, đi chơi rất thoáng mạt và hạnh phúc",127.200₫,https://tiki.vn/bo-thun-be-trai-catrio-in-bong-tron-attitude-mau-xanh-navy-la-bo-do-tre-em-tu-5-tuoi-20kg-den-18-tuoi-60kg-gom-co-quan-dui-ao-sat-nach-vai-100-cotton-an-toan-dat-chuan-xuat-khau-thich-hop-cac-be-trai-mac-o-nha-di-choi-rat-thoang-mat-va-hanh-phuc-p247731372.html?spid=247731374,14,,,catrio
ÁO THUN DÀI TAY BÉ TRAI CATRIO in PARIS màu XÁM là áo phông tay dài trẻ em từ 8kg 10kg 12 kg .. 30kg (8 tuổi) cổ tròn vải dệt kim co giãn 4 chiều + quần dài cotton thành bộ đồ thu đông cho bé rất đẹp,87.200₫,https://tiki.vn/a-o-thun-da-i-tay-be-trai-catrio-in-paris-ma-u-xa-m-la-a-o-phong-tay-da-i-tre-em-tu-8kg-10kg-12-kg-30kg-8-tuo-i-co-tro-n-va-i-de-t-kim-co-gia-n-4-chie-u-qua-n-da-i-cotton-tha-nh-bo-do-thu-dong-cho-be-ra-t-de-p-p270968695.html?spid=270968697,15,,,catrio
"ÁO THUN DÀI TAY BÉ TRAI CATRIO HÌNH NUMBER ONE MÀU XÁM là áo phông trẻ em từ 9 tuổi 10 tuổi 11T 12 tuổi (30kg . 35kg . 40Kg . 50kg), vải 100% cotton an toàn, thuộc BST quần áo trẻ em mùa thu đông CATRIO kết hợp quần dài thành bộ đồ thu đông đẹp",119.200₫,https://tiki.vn/ao-thun-dai-tay-be-trai-catrio-hinh-number-one-mau-xam-la-ao-phong-tre-em-tu-9-tuoi-den-12-tuoi-30kg-den-50kg-vai-100-cotton-an-toan-thuoc-bst-quan-ao-tre-em-mua-thu-dong-catrio-2021-p134025373.html?spid=134025377,16,,Đã bán 2,catrio
"ÁO PHÔNG NGẮN TAY BÉ TRAI CATRIO vải 100% COTTON AN TOÀN in FIND AWAY OUT TỪ 13 TUỔI ĐẾN 18 TUỔI kết hợp quần lửng, quần ngố quần short bé trai tạo thành bộ đồ mùa hè trẻ em rất đẹp cho bé đi học, đi chơi du lịch =>BẤM VÀO SHOP XEM THÊM NHIỀU MẪU BÉ TRAI",127.200,https://tiki.vn/ao-phong-ngan-tay-be-trai-100-cotton-an-toan-catrio-hinh-find-away-out-tu-13-tuoi-den-18-tuoi-cung-voi-quan-lung-quan-ngo-quan-short-be-trai-duoc-lam-tu-chat-lieu-100-cotton-an-toan-la-quan-ao-tre-em-mua-he-truyen-thong-dep-catrio-p56863797.html?spid=56863809,17,,,catrio
,,https://tiki.vn/bo-thun-be-trai-in-snbm-catrio-mau-trang-la-bo-do-thun-tre-em-tu-2-tuoi-den-4-tuoi-20kg-den-25kg-thuoc-bst-quan-ao-thoi-trang-tre-em-catrio-mua-he-2021-p95043362.html?spid=95043364,18,,,catrio
"BỘ THUN BÉ TRAI CATRIO IN GOODLUCK MÀU NAVY là bộ đồ mùa hè của trẻ em từ 9 tuổi 32kg đến 12 tuổi 45kg, gồm QUẦN ĐÙI + ÁO SÁT NÁCH, vải 100% cotton an toàn đạt chuẩn xuất khẩu, thích hợp cho bé trai mặc ở nhà, đi chơi mùa hè thực sự thoáng mát",135.200₫,https://tiki.vn/bo-thun-be-trai-catrio-in-goodluck-mau-nau-la-bo-do-phong-sat-nach-tre-em-tu-9-tuoi-den-12-tuoi-30kg-den-68kg-thuoc-bst-quan-ao-thoi-trang-tre-em-catrio-du-lich-mua-he-2021-p108105784.html?spid=108105787,19,,Đã bán 11,catrio
"BỘ THUN BÉ TRAI CATRIO IN BÓNG BẦU DỤC MÀU TRẮNG là bộ đồ mùa hè của bé trai từ 9 tuổi 32kg đến 18 tuổi 60kg, gồm QUẦN ĐÙI + ÁO SÁT NÁCH, vải 100% cotton đạt chuẩn xuất khẩu, thích hợp với trẻ em mặc ở nhà, đi chơi rất thoáng mát, giúp các bé hạnh phúc",135.200₫,https://tiki.vn/bo-thun-be-trai-catrio-in-bong-bau-duc-mau-trang-la-bo-do-mua-he-cua-be-trai-tu-9-tuoi-32kg-den-18-tuoi-60kg-gom-quan-dui-ao-sat-nach-vai-100-cotton-dat-chuan-xuat-khau-thich-hop-voi-tre-em-mac-o-nha-di-choi-rat-thoang-mat-giup-cac-be-hanh-phuc-p229732847.html?spid=229732853,20,,,catrio
BỘ ĐỒ BÉ TRAI CATRIO là bộ phông QUẦN ĐÙI+ÁO SÁT NÁCH in Bóng chày cho bé từ 9T(32kg) đến12T(50kg),135.200₫,https://tiki.vn/bo-do-be-trai-catrio-la-bo-phong-quan-dui-ao-sat-nach-in-bong-chay-cho-be-tu-9t-32kg-den12t-50kg-p185921481.html?spid=185921491,21,,,catrio
"ÁO BÉ TRAI NGẮN TAY CATRIO hình AMAZING OCEAN cùng quẩn lửng, áo thun, áo phông chất liệu 100% cotton an toàn là quần áo trẻ em truyền thống của thời trang CATRIO",111.200₫,https://tiki.vn/ao-be-trai-ngan-tay-catrio-hinh-amazing-ocean-cung-quan-lung-ao-thun-ao-phong-chat-lieu-100-cotton-an-toan-la-quan-ao-tre-em-truyen-thong-cua-thoi-trang-catrio-p56376401.html?spid=56376447,22,,Đã bán 10,catrio
"ÁO THUN BÉ TRAI NGẮN TAY CATRIO hình sao kẻ, màu XANH LÁ là áo phông trẻ em từ 15 tuổi 55kg .. 18 tuổi 70kg thuộc BST quần áo mùa hè trẻ em CATRIO + quần đùi thành bộ đồ mùa hè bé trai đẹp",127.200₫,https://tiki.vn/ao-thun-be-trai-ngan-tay-catrio-hinh-sao-ke-mau-xanh-la-la-ao-phong-tre-em-tu-9-tuoi-den-12-tuoi-30kg-40kg-den-50kg-thuoc-bst-quan-ao-tre-em-catrio-du-lich-he-nam-2021-p115276043.html?spid=115276049,23,,,catrio
ÁO PHÔNG BÉ TRAI NGẮN TAY CATRIO là áo thun trẻ em tay ngắn từ 5 tuổi đến 12 tuổi (20kg-50kg) vải 100% Cotton in FULL SPEED thuộc BST quần áo trẻ em mùa hè CATRIO màu TRẮNG,79.200₫,https://tiki.vn/ao-phong-be-trai-ngan-tay-catrio-la-ao-thun-tre-em-tay-ngan-tu-5-tuoi-den-12-tuoi-20kg-50kg-vai-100-cotton-in-full-speed-thuoc-bst-quan-ao-tre-em-mua-he-catrio-mau-trang-p172438868.html?spid=172438872,24,,,catrio
"BỘ THUN BÉ TRAI CATRIO IN BADMAN XANH MÀU XANH LÁ là bộ đồ quần áo mùa hè trẻ em từ 9tuổi 32kg đến 12 tuổi 45kg gồm ÁO NGẮN TAY + QUẦN ĐÙI vải 100%cotton đạt chuẩn xuất khẩu, thích hợp với các bé trai mặc ở nhà, đi chơi du lịch rất thoáng mát và hạnh phúc",159.200,https://tiki.vn/bo-phong-be-trai-catrio-in-bm-xanh-mau-xanh-la-la-bo-do-tre-em-gom-ao-phong-ngan-tay-voi-quan-dui-cho-tre-em-6-tuoi-10-tuoi-14-tuoi-20-54kg-thuoc-bst-quan-ao-thoi-trang-tre-em-catrio-du-lich-mua-he-2021-p102737970.html?spid=102737974,25,,,catrio
,,https://tiki.vn/quan-short-be-trai-catrio-in-superior-mau-navy-la-quan-ngo-quan-lung-tre-em-tu-5-tuoi-20kg-den-14-tuoi-50kg-vai-det-kieu-da-ca-100-cotton-an-toan-dat-chuan-xuat-khau-khi-ket-hop-voi-ao-phong-ngan-tay-thanh-bo-do-be-trai-mac-di-hoc-di-choi-du-lich-dep-p230209097.html?spid=230209101,26,,,catrio
QUẦN ĐÙI COTTON NAM CATRIO MÀU 2 CHO NGƯỜI TỪ 40KG 50KG ĐẾN 83KG LÀ QUẦN ĐÙI NAM ĐƯỢC LÀM TỪ VẢI ÁO SƠ MI THUỘC BST QUẦN SHORT ÁO PHÔNG MÙA HÈ CATRIO 2021,44.000₫,https://tiki.vn/quan-dui-cotton-nam-catrio-mau-2-cho-nguoi-tu-40kg-50kg-den-83kg-la-quan-dui-nam-duoc-lam-tu-vai-ao-so-mi-thuoc-bst-quan-short-ao-phong-mua-he-catrio-2021-p109116186.html?spid=109116192,27,,Đã bán 2,catrio
"BỘ ĐỒ MÙA HÈ BÉ TRAI CATRIO IN SAO KẺ MÀU XANH BIỂN là bộ đồ mùa hè của bé trai từ 9 tuổi 32kg đến 18 tuổi 60kg, gồm QUẦN ĐÙI + ÁO SÁT NÁCH, vải 100% cotton đạt chuẩn xuất khẩu, thích hợp với trẻ em mặc ở nhà, đi chơi rất thoáng mát, giúp các bé hạnh phúc",135.200₫,https://tiki.vn/bo-do-mua-he-be-trai-catrio-in-sao-ke-mau-xanh-bien-la-bo-do-mua-he-cua-be-trai-tu-9-tuoi-32kg-den-18-tuoi-60kg-gom-quan-dui-ao-sat-nach-vai-100-cotton-dat-chuan-xuat-khau-thich-hop-voi-tre-em-mac-o-nha-di-choi-rat-thoang-mat-giup-cac-be-hanh-phuc-p228994592.html?spid=228994594,28,,,catrio
"ÁO VEST BÉ TRAI CATRIO PCT18947/33 là áo đờ mi trẻ em từ 8 tuổi (29kg) đến 12 tuổi (50kg) thuộc bộ sưu tập quần áo trẻ em trang trọng cho mùa lễ hội tết tiệc cưới sự kiện sinh nhật, được làm bằng vải dạ cao cấp nhất, đẹp đến từng chi tiết",639.000₫,https://tiki.vn/ao-vest-be-trai-catrio-pct18947-33-la-ao-do-mi-tre-em-tu-8-tuoi-29kg-den-12-tuoi-50kg-thuoc-bo-suu-tap-quan-ao-tre-em-trang-trong-cho-mua-le-hoi-tet-tiec-cuoi-su-kien-sinh-nhat-duoc-lam-bang-vai-da-cao-cap-nhat-dep-den-tung-chi-tiet-p212465523.html?spid=212465525,29,,,catrio
"ÁO THUN GIỮ NHIỆT CHO BÉ TRAI TỪ 1 TUỔI ĐẾN 8 TUỔI IN HÌNH PARIS, THUỘC BỘ SƯU TẬP QUẦN ÁO TRẺ EM MÙA THU ĐÔNG CATRIO 2021",87.200₫,https://tiki.vn/ao-thun-giu-nhiet-cho-be-trai-tu-1-tuoi-den-8-tuoi-in-hinh-paris-thuoc-bo-suu-tap-quan-ao-tre-em-mua-thu-dong-catrio-2021-p67741576.html?spid=67741700,30,,,catrio
,,https://tiki.vn/ao-thun-dai-tay-be-trai-catrio-hinh-number-one-mau-do-la-ao-phong-tre-em-tu-9-tuoi-den-12-tuoi-30kg-den-50kg-vai-100-cotton-an-toan-thuoc-bst-quan-ao-tre-em-mua-thu-dong-catrio-2021-p134025169.html?spid=134025171,31,,,catrio
"BỘ THUN BÉ TRAI CATRIO IN VARSITY MÀU ĐỎ là bộ đồ mùa hè của bé trai từ 1 tuổi 12kg đến 6 tuổi 25kg, gồm QUẦN ĐÙI + ÁO SÁT NÁCH, vải 100% cotton đạt chuẩn xuất khẩu, thích hợp với trẻ em mặc ở nhà, đi chơi rất thoáng mát, giúp các bé hạnh phúc",127.200₫,https://tiki.vn/bo-thun-be-trai-catrio-in-varsity-mau-do-la-bo-do-thun-tre-em-tu-1-tuoi-den-6-tuoi-20kg-den-25kg-thuoc-bst-quan-ao-thoi-trang-tre-em-catrio-mua-he-2021-p95059206.html?spid=95059212,32,,Đã bán 2,catrio
"QUẦN LỬNG BÉ TRAI CATRIO IN NEVER MÀU XANH CỔ VỊT là quần ngố, short trẻ em từ 9 tuổi 32kg đến 18 tuổi 70kg, vải dệt kiểu da cá 100% cotton an toàn đạt chuẩn xuất khẩu khi kết hợp với áo phông ngắn tay thành bộ đồ bé trai mặc đi học, đi chơi du lịch đẹp",111.200₫,https://tiki.vn/quan-lung-be-trai-catrio-in-hinh-never-mau-xanh-co-vit-la-quan-ngo-quan-lung-cho-tre-em-tu-9-tuoi-den-18-tuoi-30kg-den-70kg-vai-100-cotton-an-toan-thuoc-bst-quan-ao-tre-em-catrio-du-lich-mua-he-2021-p103475972.html?spid=103475976,33,,Đã bán 2,catrio
"BỘ THUN BÉ TRAI CATRIO IN LIVE MÀU ĐỎ ĐÔ là bộ đồ trẻ em từ 6 tuổi 23kg đến 12 tuổi 50kg gồm có QUẦN ĐÙI + ÁO SÁT NÁCH vải 100% cotton an toàn đạt chuẩn xuất khẩu thích hợp các bé trai mặc ở nhà, đi chơi rất thoáng mạt, được các mẹ yêu quý suốt 19 năm",127.200₫,https://tiki.vn/bo-thun-be-trai-catrio-in-live-mau-do-do-la-bo-do-phong-gom-ao-sat-nach-va-quan-dui-cua-tre-em-tu-6-tuoi-den-12-tuoi-20kg-den-50kg-thuoc-bst-quan-ao-thoi-trang-tre-em-catrio-du-lich-mua-he-2021-p110821004.html?spid=110821008,34,,,catrio
"BỘ THUN BÉ TRAI CATRIO in 4 Ô TÔ màu XANH LÁ, là bộ đồ trẻ em từ 5 tuổi đến 7 tuổi (28kg) gồm QUẦN ĐÙI +ÁO SÁT NÁCH, vải chuẩn 100% cotton, thích hợp với các bé trai mặc ở nhà, đi chơi du lịch mùa hè rất đẹp",127.200,https://tiki.vn/bo-thun-be-trai-catrio-la-bo-do-tre-em-tu-5t-8t-31kg-gom-quan-dui-ao-sat-nach-in-4-oto-mau-xanh-la-p174651240.html?spid=174651246,35,,Đã bán 2,catrio
,,https://tiki.vn/quan-dui-nam-la-quan-thun-ngan-be-trai-nguoi-trung-tuoi-nguoi-cao-tuoi-thanh-nien-tu-40_83kg-mau-29-p188992893.html?spid=188992899,36,,,catrio
"BỘ THUN BÉ TRAI CATRIO IN VOI STORMBER MÀU TRẮNG là bộ đồ mùa hè của bé trai từ 1 tuổi 12kg đến 4 tuổi 19kg, gồm QUẦN ĐÙI + ÁO SÁT NÁCH, vải 100% cotton đạt chuẩn xuất khẩu, thích hợp với trẻ em mặc ở nhà, đi chơi rất thoáng mát, giúp các bé hạnh phúc",127.200₫,https://tiki.vn/bo-thun-be-trai-in-voi-stomber-mau-trang-la-bo-do-thun-tre-em-tu-1-tuoi-den-8-tuoi-20kg-den-33kg-thuoc-bst-quan-ao-thoi-trang-tre-em-catrio-mua-he-2021-p95049197.html?spid=95049203,37,,,catrio
"ÁO ĐỜ MI BÉ TRAI CATRIO 11719/11 LÀ ÁO VEST TRẺ EM từ 2 tuổi đến 12 tuổi (12kg đến 50kg) phù hợp ngày lễ tết, tiệc cưới thuộc BST quần áo complet veston trẻ em CATRIO mùa thu đông 2021",511.200₫,https://tiki.vn/ao-do-mi-be-trai-catrio-11719-11-la-ao-vest-tre-em-tu-2-tuoi-den-12-tuoi-12kg-den-50kg-phu-hop-ngay-le-tet-tiec-cuoi-thuoc-bst-quan-ao-complet-veston-tre-em-catrio-mua-thu-dong-2021-p120427174.html?spid=120427188,38,,Đã bán 1,catrio
"QUẦN ĐÙI NAM CATRIO MÀU 22 cho các bé lớn, nam trung niên, cao tuổi có cân nặng từ 40kg đến 83kg là quần short nam bé trai size đại, được làm từ vải may áo sơ mi thuộc BST quần short áo phông mùa hè CATRIO 2021",44.000₫,https://tiki.vn/quan-dui-nam-catrio-mau-22-cho-cac-be-lon-nam-trung-nien-cao-tuoi-co-can-nang-tu-40kg-den-83kg-la-quan-short-nam-be-trai-size-dai-duoc-lam-tu-vai-may-ao-so-mi-thuoc-bst-quan-short-ao-phong-mua-he-catrio-2021-p113642972.html?spid=113642976,39,,Đã bán 8,catrio
"BỘ THUN BÉ TRAI CATRIO IN GOODLUCK MÀU XÁM là bộ đồ mùa hè của trẻ em từ 9 tuổi 32kg đến 12 tuổi 45kg, gồm QUẦN ĐÙI + ÁO SÁT NÁCH, vải 100% cotton an toàn đạt chuẩn xuất khẩu, thích hợp cho bé trai mặc ở nhà, đi chơi mùa hè thực sự thoáng mát",135.200,https://tiki.vn/bo-thun-be-trai-catrio-in-goodluck-mau-xam-la-bo-do-phong-sat-nach-tre-em-tu-9-tuoi-den-12-tuoi-30kg-den-50kg-thuoc-bst-quan-ao-thoi-trang-tre-em-catrio-du-lich-mua-he-2021-p108130104.html?spid=108130106,40,,,catrio
