title,price,link_item,index,discount,sales,category
"Vest nam đen một khuy The Suits House áo suits blazer quần âu crop gấu, form ôm, satorial, vải WOOL- VSAB002",2.500.000₫,https://tiki.vn/vest-nam-den-mot-khuy-the-suits-house-ao-suits-blazer-quan-au-crop-gau-form-om-satorial-vai-wool-vsab002-p177164085.html?spid=177164093,1,-30%,,aovest
(Sale off) ÁO KHOÁC KAKI Hiệu form rộng nam nữ Unisex (M560 - Kèm Video Ảnh Thật - Có Form Rộng XL 2XL 90kg),129.000₫,https://tiki.vn/sale-off-ao-khoac-kaki-hieu-form-rong-nam-nu-unisex-m560-kem-video-anh-that-co-form-rong-xl-2xl-90kg-p263315150.html?spid=263315378,2,-40%,,aovest
Áo Len Nam Aligro Lông Cừu Pha Lông Dê Cao Cấp Màu Tím Quả Trám ALEND020,451.500₫,https://tiki.vn/ao-len-nam-aligro-alend020-long-cuu-pha-long-de-cao-cap-tim-qua-tram-p3952379.html?spid=4026755,3,-45%,,aovest
Áo khoác dan cao cấp lót lông Korea,780.000₫,https://tiki.vn/ao-khoac-da-cao-cap-lot-long-korea-p69690860.html?spid=69690868,4,,,aovest
"Áo khoác dù bomber nam phong cách Hàn Quốc cực đẹp , siêu cá tính",95.000₫,https://tiki.vn/ao-khoac-du-bomber-nam-phong-cach-han-quoc-cuc-dep-sieu-ca-tinh-p114314032.html?spid=133811181,5,,Đã bán 3,aovest
Áo choàng măng tô nam dài hàng hiệu NMT98,1.850.000₫,https://tiki.vn/ao-choang-mang-to-nam-dai-hang-hieu-nmt98-p273383378.html?spid=273383396,6,,,aovest
Áo Khoác Jean Cambodia,450.000₫,https://tiki.vn/ao-khoac-jean-cambodia-p270832383.html?spid=270832391,7,,,aovest
Áo Khoác da trơn (Bomber) thời trang,369.000₫,https://tiki.vn/ao-bomber-da-tron-p204452766.html?spid=204452784,8,,,aovest
áo khoác lông dáng dài túi nắp,650.000₫,https://tiki.vn/ao-khoac-long-dang-dai-tui-nap-p192385701.html?spid=192385702,9,,,aovest
Áo Gile Đen SPX - Size 3XL 90kg-105kg,130.000₫,https://tiki.vn/ao-gile-den-spx-p195698750.html?spid=195698770,10,,,aovest
Áo Khoác Dù Bomber Nam Nữ ANGEL LAND In Thiên Thần LOVE,104.000₫,https://tiki.vn/ao-khoac-du-bomber-nam-nu-angel-land-in-thien-than-love-p103893334.html?spid=176504881,11,,,aovest
Áo khoác nỉ JACKER BOMBER UNDERTRAP - BOMBER NỈ PE SIÊU ẤM xanh dương,87.000₫,https://tiki.vn/ao-khoa-c-ni-jacker-bomber-undertrap-bomber-ni-pe-sieu-am-xanh-duong-p194584979.html?spid=205490048,12,,,aovest
Áo khoác nỉ bomber nam nữ chất nỉ lót bông dày dặn cúc bấm It's a trap cardigan missout HÀNG XỊN Áo Bomber Nam Nữ Shop,101.000₫,https://tiki.vn/ao-khoac-ni-bomber-nam-nu-chat-ni-lot-bong-day-dan-cuc-bam-it-s-a-trap-bith-store-p176403019.html?spid=176403030,13,,,aovest
Bộ vest nam 6 cúc màu xanh thanh lịch DKE0086 - DUKI STORE,975.000₫,https://tiki.vn/bo-vest-nam-6-cuc-mau-xanh-thanh-lich-dke0086-duki-store-p273018992.html?spid=273019000,14,,,aovest
Áo Khoác nam đẹp AKD327,299.000₫,https://tiki.vn/ao-khoac-nam-dep-akd327-p15364310.html?spid=15364318,15,,,aovest
Áo khoác dù trơn mặc quanh năm,219.000₫,https://tiki.vn/ao-khoac-du-tron-mac-quanh-nam-p75404662.html?spid=75404690,16,,Đã bán 8,aovest
"áo khoác dù JACKET KILL SYSTEM, Áo khoác dù kiểu bomber logo Kill System phong cách, ÁO KHOÁC DÙ NAM NỮ FORM RỘNG KILL SYSTEM SIÊU CHẤT MỚI VỀ, ÁO KHOÁC DÙ CÓ NÓN UNISEX ULZZANG PHONG CÁCH HÀN QUỐC",99.000₫,https://tiki.vn/ao-khoac-du-jacket-kill-system-ao-khoac-du-kieu-bomber-logo-kill-system-phong-cach-ao-khoac-du-nam-nu-form-rong-kill-system-sieu-chat-moi-ve-ao-khoac-du-co-non-unisex-ulzzang-phong-cach-han-quoc-p104913896.html?spid=104913902,17,,Đã bán 118,aovest
Áo khoác phao nam AN120,450.000₫,https://tiki.vn/ao-khoac-phao-nam-an120-p19636461.html?spid=19636471,18,,Đã bán 8,aovest
"Áo Khoác Nhung Gân Tăm Bomber Jackets Thêu Logo G.O.N.Z Cúc Bấm Unisex Nam Nữ Form Rộng Ulzzang, Áo Khoác Nhung Tăm Thêu Chữ G, Áo BomBer Bóng Chày Nam Nữ Phong Cách Hàn Quốc",166.000₫,https://tiki.vn/ao-khoac-nhung-gan-tam-bomber-jackets-theu-logo-g-o-n-z-cuc-bam-unisex-nam-nu-form-rong-ulzzang-p146515449.html?spid=146515495,19,,Đã bán 20,aovest
ÁO KHOÁC NHUNG NAM NỮ KIỂU BOMBER LOGO THÊU NỔI HOT TP,150.000₫,https://tiki.vn/ao-khoac-nhung-nam-nu-kieu-bomber-logo-theu-noi-hot-tp-p104705231.html?spid=157017288,20,,,aovest
Áo Khoác Dù Uniex 2 Lớp Chữ SWD -Trend- Bomber Khóa Zip Nam Nữ Cặp Đôi - Thu Đông Chống Nắng- Kiểu HÀn Quốc Đẹp,137.000₫,https://tiki.vn/ao-khoac-du-uniex-2-lop-chu-swd-trend-bomber-khoa-zip-nam-nu-cap-doi-thu-dong-chong-nang-kieu-han-quoc-dep-p202007132.html?spid=207008630,21,,,aovest
Áo gile nhí hàng xuất xưởng,60.000₫,https://tiki.vn/ao-gile-nhi-hang-xuat-xuong-p126119830.html?spid=134971671,22,,,aovest
"Áo khoác trái tym chất nỉ cotton giá rẻ bất ngờ có video và ảnh thật, Áo Khoác Nỉ Bomber Cardigan Form Rộng Chất Nỉ Bông Dày Dặn Nữ Unisex",100.000₫,https://tiki.vn/ao-khoac-trai-tym-chat-ni-cotton-gia-re-bat-ngo-co-video-va-anh-that-p162832750.html?spid=162832758,23,,Đã bán 3,aovest
Áo khoác nỉ Alanwalker,56.250₫,https://tiki.vn/ao-khoac-ni-alanwalker-p187841011.html?spid=187841027,24,,,aovest
"Áo khoác dù áo khoác gió nam , áo cặp đôi , áo khoác nam kiểu bomber chất vải dù lót das",120.000₫,https://tiki.vn/ao-khoac-du-ao-khoac-gio-nam-ao-cap-doi-ao-khoac-nam-kieu-bomber-chat-vai-du-lot-das-p90065331.html?spid=91325114,25,,Đã bán 3,aovest
"Áo khoác gió Monacus - Chất liệu vải dù pha sọc thể thao - Kiểu dáng hàn quốc trẻ trung, Áo khoác dù logo thêu trẻ trung, năng động, Áo khoác dù tay chạy sọc logo in đẹp",99.000₫,https://tiki.vn/ao-khoac-gio-monacus-chat-lieu-vai-du-pha-soc-the-thao-kieu-dang-han-quoc-tre-trung-ao-khoac-du-logo-theu-tre-trung-nang-dong-ao-khoac-du-tay-chay-soc-logo-in-dep-p176506283.html?spid=176506289,26,,,aovest
Áo Khoác Nam Không Nón Phúc An 2025_xamTrang,119.000₫,https://tiki.vn/ao-khoac-nam-khong-non-phuc-an-2025_xamtrang-p4427231.html?spid=4427235,27,,Đã bán 40,aovest
"Áo khoác gió nam 2 lớp chống nước tuyệt đối, Mẫu mới 2020",199.000₫,https://tiki.vn/ao-khoac-gio-nam-2-lop-chong-nuoc-tuyet-doi-mau-moi-2020-p74441399.html?spid=74441415,28,,,aovest
Áo khoác nhẹ nam việt tiến hoa văn đẹp 6P5050,595.000₫,https://tiki.vn/ao-khoac-nhe-nam-viet-tien-hoa-van-dep-6p5050-p94880555.html?spid=94880583,29,,,aovest
Áo Khoác Dù Local Brand TEELAB Jacket Mero 2 lớp dày form rộng Unisex cổ bẻ (D2100L - Full Box - Kèm Video Ảnh Thật),179.000₫,https://tiki.vn/ao-khoac-du-local-brand-teelab-jacket-mero-2-lop-day-form-rong-unisex-co-be-d2100l-full-box-kem-video-anh-that-p263312695.html?spid=263312726,30,,Đã bán 1,aovest
Áo Khoác Jean Nam Trơn In Chữ Cá Tính,273.000₫,https://tiki.vn/ao-khoac-jean-nam-tron-in-chu-ca-tinh-p91928966.html?spid=91928976,31,,Đã bán 1,aovest
Bộ vest nam 6 cúc màu ghi thanh lịch DKE0092 - DUKI STORE,938.000₫,https://tiki.vn/bo-vest-nam-6-cuc-mau-ghi-thanh-lich-dke0092-duki-store-p273018967.html?spid=273018977,32,,,aovest
Áo khoác kaki nam cổ bẻ túi đắp 2 bên DAK19,180.000₫,https://tiki.vn/ao-khoac-kaki-nam-co-be-tui-dap-2-ben-dak19-p273512246.html?spid=273512262,33,,,aovest
Áo chống nắng thông hơi cho bạn nam siêu đẹp,99.000₫,https://tiki.vn/ao-chong-nang-thong-hoi-cho-ban-nam-sieu-dep-p76828779.html?spid=169560602,34,,Đã bán 2,aovest
Áo Khoác Nỉ Khóa Kéo Mèo 3 Hoa,178.000₫,https://tiki.vn/ao-khoac-ni-khoa-keo-meo-3-hoa-p114353789.html?spid=114353807,35,,,aovest
Áo Khoác Jean Trắng Nam Hàn Quốc SUTU Phối Đồ Phong Cách Cá Tính Mạnh Mẽ Trẻ Trunng A3YEAS,580.000₫,https://tiki.vn/ao-khoac-jean-trang-nam-han-quoc-sutu-phoi-do-phong-cach-ca-tinh-manh-me-tre-trunng-a3yeas-p201832222.html?spid=201832308,36,,,aovest
ÁO KHOÁC BOMBER PHỐI TAY VIỀN TRẮNG,145.000₫,https://tiki.vn/ao-khoac-bomber-phoi-tay-vien-trang-p171682302.html?spid=171682343,37,,Đã bán 2,aovest
ÁO HOODIE - ÁO KHOÁC NỈ NGOẠI KIỂU DÁNG CÁNH DƠI TAY RỘNG (Ảnh Thật) HOOIDE MỚI FILTER,100.000₫,https://tiki.vn/ao-hoodie-ao-khoac-ni-ngoai-kieu-dang-canh-doi-tay-rong-anh-that-hooide-moi-filter-p199644909.html?spid=199644929,38,,,aovest
"Áo Vest nam Hàn Quốc phong cách, mốt trẻ - Size L",495.000₫,https://tiki.vn/ao-vest-nam-han-quoc-phong-cach-mot-tre-p77605098.html?spid=77605104,39,,,aovest
ÁO KHOÁC CARDIGAN NAM FORM RỘNG NỈ NGOẠI PHỐI CHỮ KIỂU DÁNG CÁ TÍNH CỦA ĐAM MÊ,78.000₫,https://tiki.vn/ao-khoac-cardigan-nam-form-rong-ni-ngoai-phoi-chu-kieu-dang-ca-tinh-cua-dam-me-p173817730.html?spid=173817775,40,,,aovest
