title,price,link_item,index,discount,sales,brand
Hộp 24 thanh Sữa bột công thức Meiji Hohoemi Milk cho bé 0 đến 12 tháng tuổi (27g/ thanh) - Nhập khẩu Nhật Bản,640.000₫,https://tiki.vn/hop-24-thanh-sua-bot-cong-thuc-meiji-hohoemi-milk-cho-be-0-den-12-thang-tuoi-27g-thanh-nhap-khau-nhat-ban-p11429714.html?spid=165679162,1,-50%,Đã bán 1,Meiji
Sữa meiji 0 (800gr) và meiji 1-3 (800gr) nội địa Nhật,481.000₫,https://tiki.vn/sua-meiji-0-800gr-va-meiji-1-3-800gr-noi-dia-nhat-p124658847.html?spid=124658849,2,-56%,Đã bán 6,Meiji
Sữa Bột Meiji Mama Dành Cho Phụ Nữ Mang Thai Và Cho Con Bú (350g),240.000₫,https://tiki.vn/sua-bot-meiji-mama-danh-cho-phu-nu-mang-thai-va-cho-con-bu-350g-p1055310.html?spid=205470424,3,-62%,Đã bán 5,Meiji
"Sữa cho trẻ sơ sinh, trẻ nhỏ 0-36 tháng tuổi Meiji Nhật giàu dưỡng chất kèm DHA giúp phát triển cân đối chiều cao, cân nặng, trí não cho bé - OZ Slim Store",538.000₫,https://tiki.vn/sua-cho-tre-so-sinh-tre-nho-0-36-thang-tuoi-meiji-nhat-giau-duong-chat-kem-dha-giup-phat-trien-can-doi-chieu-cao-can-nang-tri-nao-cho-be-oz-slim-store-p272336907.html?spid=219157267,4,-60%,Đã bán 43,Meiji
Sữa Meiji Nội Địa Số 0 Dạng Thanh (24 Thanh),760.000₫,https://tiki.vn/sua-meiji-noi-dia-so-0-dang-thanh-24-thanh-p2034515.html?spid=165679202,5,-51%,,Meiji
Sữa Bột Meiji Nội Địa Step Milk Số 9 (800g),550.000₫,https://tiki.vn/sua-bot-meiji-noi-dia-step-milk-so-9-800g-p3678043.html?spid=88740550,6,-51%,,Meiji
Sữa bột công thức Meiji Hohoemi Milk cho bé 0 đến 12 tháng tuổi (800g) - Nhập khẩu Nhật,600.000₫,https://tiki.vn/sua-bot-cong-thuc-meiji-hohoemi-milk-cho-be-0-den-12-thang-tuoi-800g-nhap-khau-nhat-p11385929.html?spid=88740810,7,-62%,,Meiji
Sữa Meiji Nội Địa Nhật Dạng Thanh Số 1- 3 Tuổi 48 Thanh ( Mẫu Mới ),1.440.000₫,https://tiki.vn/sua-meiji-noi-dia-nhat-dang-thanh-so-1-3-tuoi-48-thanh-mau-moi-p121171295.html?spid=184954307,8,-51%,Đã bán 2,Meiji
"Sữa Nhật Cho Bé Tăng Cân Từ 0 Đến 1 Tuổi Meiji Hỗ Trợ Tăng Hệ Miễn Dịch, Tạo Hệ Tiêu Hóa Tốt Hấp Thụ Dưỡng Chất Hiệu Quả Giúp Bé Phát Triển Cân Đối Nhất Cả Về Chiều Cao, Cân Nặng, Trí Não - 1 Hộp",860.000₫,https://tiki.vn/sua-nhat-cho-be-tang-can-tu-0-toi-1-tuoi-meiji-ho-tro-tang-he-mien-dich-tao-he-tieu-hoa-tot-hap-thu-duong-chat-hieu-qua-giup-be-phat-trien-can-doi-nhat-ca-ve-chieu-cao-can-nang-tri-nao-p122911154.html?spid=167461736,9,,,Meiji
"Bộ 2 Sữa Bột Dinh Dưỡng Meiji Dành Cho Bé Từ 1-3 Tuổi, hỗ trợ tăng cường hấp thụ, sức đề kháng, giúp trẻ phát triển toàn diện",970.000₫,https://tiki.vn/bo-2-sua-bot-dinh-duong-meiji-danh-cho-be-tu-1-3-tuoi-ho-tro-tang-cuong-hap-thu-suc-de-khang-giup-tre-phat-trien-toan-dien-p110208740.html?spid=199913113,10,,Đã bán 13,Meiji
Sữa Meiji nội địa số 0 - 800gr ( 0-1T),539.000₫,https://tiki.vn/sua-meiji-noi-dia-so-0-800gr-p174207561.html?spid=174207562,11,,Đã bán 22,Meiji
Sữa Meiji Hohoemi Số 0 (0- 1 Tuổi ) - Lon 800gr - Nội Địa Nhật Bản,600.000₫,https://tiki.vn/sua-meiji-hohoemi-so-0-0-1-tuoi-lon-800gr-noi-dia-nhat-ban-p82166247.html?spid=88740812,12,,,Meiji
Sữa Meiji 1-3 Dạng Thanh cho trẻ từ 1 tuổi đến 3 tuổi (24 Thanh),720.000₫,https://tiki.vn/sua-meiji-1-3-dang-thanh-cho-tre-tu-1-tuoi-den-3-tuoi-24-thanh-p4615719.html?spid=165679233,13,,Đã bán 2,Meiji
Hộp 24 thanh Sữa bột công thức Meiji Hohoemi Milk cho bé 1 đến 3 tuổi (28g/ thanh) - Nhập khẩu Nhật Bản,720.000₫,https://tiki.vn/hop-24-thanh-sua-bot-cong-thuc-meiji-hohoemi-milk-cho-be-1-den-3-tuoi-28g-thanh-nhap-khau-nhat-ban-p11719350.html?spid=165679231,14,,Đã bán 4,Meiji
"Sữa cho trẻ sơ sinh 0-1 tuổi Meiji Nhật giàu dưỡng chất kèm DHA giúp phát triển cân đối chiều cao, cân nặng, trí não cho bé - Massel Official",492.000₫,https://tiki.vn/sua-cho-tre-so-sinh-0-1-tuoi-meiji-nhat-giau-duong-chat-kem-dha-giup-phat-trien-can-doi-chieu-cao-can-nang-tri-nao-cho-be-massel-official-p271542128.html?spid=271542130,15,,Đã bán 23,Meiji
Sữa Meiji Step Số 9 (1-3 Tuổi ) - Lon 800gr - Nội Địa Nhật Bản,660.000₫,https://tiki.vn/sua-meiji-step-so-9-1-3-tuoi-lon-800gr-noi-dia-nhat-ban-p82223804.html?spid=167461863,16,,Đã bán 2,Meiji
Thanh Sữa Meiji Ezcube Growing Up Dạng Viên (5 Viên),40.000₫,https://tiki.vn/thanh-sua-meiji-ezcube-growing-up-dang-vien-5-vien-p180247372.html?spid=180247374,17,,Đã bán 4,Meiji
Sữa bột công thức Meiji Step Milk cho bé 1 đến 3 tuổi (800g) - Nhập khẩu Nhật,495.000₫,https://tiki.vn/sua-bot-cong-thuc-meiji-step-milk-cho-be-1-den-3-tuoi-800g-nhap-khau-nhat-p11386589.html?spid=199912690,18,,Đã bán 3,Meiji
Sữa Bột Meiji Nội Địa Số 0 (800g),860.000₫,https://tiki.vn/sua-bot-meiji-noi-dia-so-0-800g-p2034511.html?spid=167461839,19,,,Meiji
"Sữa cho trẻ 1-3 tuổi Meiji Nhật giàu dưỡng chất kèm DHA giúp phát triển cân đối chiều cao, cân nặng, trí não trẻ - Massel Official",381.000₫,https://tiki.vn/sua-nhat-cho-be-tang-can-tu-1-den-3-tuoi-meiji-ho-tro-tang-he-mien-dich-tao-he-tieu-hoa-tot-hap-thu-duong-chat-hieu-qua-giup-be-phat-trien-can-doi-nhat-ca-ve-chieu-cao-can-nang-tri-nao-2-hop-p271555561.html?spid=271555563,20,,Đã bán 1,Meiji
Sữa Meiji Số 0 Dạng Thanh 24 Thanh (648g),890.000₫,https://tiki.vn/sua-meiji-so-0-dang-thanh-24-thanh-648g-p10583664.html?spid=167461501,21,,Đã bán 3,Meiji
"Sữa Nhật cho bé tăng cân 1-3 tuổi Meiji Hỗ trợ hệ tiêu hóa tốt, hấp thụ dưỡng chất hiệu quả, phát triển chiều cao, cân nặng, trí não - Massel Official",617.000₫,https://tiki.vn/sua-nhat-cho-be-tang-can-1-3-tuoi-meiji-ho-tro-he-tieu-hoa-tot-hap-thu-duong-chat-hieu-qua-phat-trien-chieu-cao-can-nang-tri-nao-massel-official-p271556299.html?spid=124631356,22,,Đã bán 9,Meiji
"Sữa cho trẻ 1 - 3 tuổi Meiji Nhật giàu dưỡng chất kèm DHA giúp phát triển cân đối chiều cao, cân nặng, trí não trẻ - Massel Official",597.000₫,https://tiki.vn/sua-cho-tre-so-sinh-1-3-tuoi-meiji-nhat-giau-duong-chat-kem-dha-giup-phat-trien-can-doi-chieu-cao-can-nang-tri-nao-tre-massel-official-p271556758.html?spid=271556760,23,,Đã bán 5,Meiji
Sữa Meiji Ezcube Growing Up Dạng Viên (448g),359.000₫,https://tiki.vn/sua-meiji-ezcube-growing-up-dang-vien-448g-p1055316.html?spid=157062220,24,,Đã bán 37,Meiji
"Sữa cho trẻ sơ sinh 0-12 tháng tuổi Meiji Nhật giàu dưỡng chất kèm DHA giúp phát triển cân đối chiều cao, cân nặng, trí não cho bé - OZ Slim Store",492.000₫,https://tiki.vn/sua-cho-tre-so-sinh-0-12-thang-tuoi-meiji-nhat-giau-duong-chat-kem-dha-giup-phat-trien-can-doi-chieu-cao-can-nang-tri-nao-cho-be-oz-slim-store-p272322010.html?spid=272322012,25,,Đã bán 48,Meiji
Sữa Meiji số 0 Nhật Bản dạng thanh (24 thanh),688.000₫,https://tiki.vn/sua-meiji-so-0-nhat-ban-dang-thanh-24-thanh-p116929869.html?spid=273915420,26,,,Meiji
Meiji 1-3 800g,660.000₫,https://tiki.vn/meiji-1-3-800g-p42194167.html?spid=167461757,27,,Đã bán 4,Meiji
Sữa Thanh Meiji 0-1 Infant Formula Dạng Viên 540g,475.000₫,https://tiki.vn/sua-thanh-meiji-0-1-infant-formula-dang-vien-432g-p188908358.html?spid=188908359,28,,Đã bán 25,Meiji
3 Hộp Sữa Bột Meiji Mama Milk (350g),679.000₫,https://tiki.vn/3-hop-sua-bot-meiji-mama-milk-350g-p45549807.html?spid=205471062,29,,Đã bán 3,Meiji
Combo 2 lon Sữa Bột Meiji Nhập Khẩu Số 3-10 (800g) Tặng Ly thủy tinh,990.000₫,https://tiki.vn/combo-2-lon-sua-bot-meiji-nhap-khau-so-3-10-800g-tang-ly-thuy-tinh-p273687969.html?spid=273687970,30,,,Meiji
Combo 2 lon Sữa Bột Meiji Nhập Khẩu Số 1-3 (800g) Tặng Bình tập uống,990.000₫,https://tiki.vn/combo-2-lon-sua-bot-meiji-nhap-khau-so-1-3-800g-tang-binh-tap-uong-p273688097.html?spid=273688098,31,,,Meiji
Sữa Bột Meiji Nhập Khẩu Số 1-3 (800g) Tặng Gói dùng thử 3-10,495.000₫,https://tiki.vn/sua-bot-meiji-nhap-khau-so-1-3-800g-goi-dung-thu-3-10-p273670090.html?spid=273670091,32,,,Meiji
Combo 4 lon Sữa Bột Meiji Nhập Khẩu Số 3-10 (800g) Tặng Xe đạp 3 bánh,1.980.000₫,https://tiki.vn/combo-4-lon-sua-bot-meiji-nhap-khau-so-3-10-800g-tang-xe-dap-3-banh-p273687974.html?spid=273687975,33,,,Meiji
Sữa Bột Meiji Nhập Khẩu Số 3-10 (800g) Tặng Gói dùng thử 3-10,495.000₫,https://tiki.vn/sua-bot-meiji-nhap-khau-so-3-10-800g-tang-goi-dung-thu-3-10-p273687966.html?spid=273687967,34,,,Meiji
"Sữa Nhật cho bé tăng cân 1-3 tuổi Meiji Hỗ trợ hệ tiêu hóa tốt, hấp thụ dưỡng chất hiệu quả, phát triển chiều cao, cân nặng, trí não - Massel Official",617.000₫,https://tiki.vn/sua-nhat-cho-be-tang-can-1-3-tuoi-meiji-ho-tro-he-tieu-hoa-tot-hap-thu-duong-chat-hieu-qua-phat-trien-chieu-cao-can-nang-tri-nao-massel-official-p271556499.html?spid=271556501,35,,Đã bán 3,Meiji
Sữa Meiji Nội Địa Số 9 Dạng Thanh (24 Thanh),720.000₫,https://tiki.vn/sua-meiji-noi-dia-so-9-dang-thanh-24-thanh-p2034517.html?spid=165679241,36,,,Meiji
Combo 4 lon Sữa Bột Meiji Nhập Khẩu Số 1-3 (800g) Tặng Xe đạp 3 bánh,1.980.000₫,https://tiki.vn/combo-4-lon-sua-bot-meiji-nhap-khau-so-1-3-800g-xe-dap-3-banh-p273670080.html?spid=273670081,37,,,Meiji
"Sữa Nhật Cho Bé Tăng Cân Từ 0 Đến 1 Tuổi Meiji Hỗ Trợ Tăng Hệ Miễn Dịch, Tạo Hệ Tiêu Hóa Tốt Hấp Thụ Dưỡng Chất Hiệu Quả Giúp Bé Phát Triển Cân Đối Nhất Cả Về Chiều Cao, Cân Nặng, Trí Não - 1 Hộp x (24 Thanh x 5 Viên)",640.000₫,https://tiki.vn/sua-nhat-cho-be-tang-can-tu-0-den-1-tuoi-meiji-ho-tro-tang-he-mien-dich-tao-he-tieu-hoa-tot-hap-thu-duong-chat-hieu-qua-giup-be-phat-trien-can-doi-nhat-ca-ve-chieu-cao-can-nang-tri-nao-1-hop-x-24-thanh-x-5-vien-p125753141.html?spid=167457839,38,,,Meiji
Sữa Bột Meiji Mama Milk (350g),230.000₫,https://tiki.vn/sua-bot-meiji-mama-milk-350g-p10021605.html?spid=205471331,39,,Đã bán 6,Meiji
