title,price,link_item,index,discount,sales,brand
"Đầm suông linen form rộng cổ sơ mi 2 túi ốp sườn không kén dáng mặc ArcticHunter, thời trang phong cách trẻ",259.000₫,https://tiki.vn/dam-suong-linen-form-rong-co-so-mi-2-tui-op-suon-khong-ken-dang-mac-arctichunter-thoi-trang-phong-cach-tre-p109209060.html?spid=109209068,1,-12%,Đã bán 11,ARCTIC_HUNTER
Váy ngủ 2 dây phối ren ngực sexy chất liệu lụa mềm mịn cao cấp AH05,113.000₫,https://tiki.vn/vay-ngu-2-day-phoi-ren-nguc-sexy-chat-lieu-lua-mem-min-cao-cap-ah05-p179724383.html?spid=179724385,2,-12%,,ARCTIC_HUNTER
Đầm đũi nữ basic dáng suông dài. form rộng ngắn tay nhiều màu ARCTIC HUNTER AH71,263.000₫,https://tiki.vn/dam-dui-nu-basic-dang-suong-dai-form-rong-ngan-tay-nhieu-mau-arctic-hunter-ah71-p183558328.html?spid=183558336,3,,Đã bán 2,ARCTIC_HUNTER
"Áo len nữ trung niên cho mẹ cho bà, thiết kế nhẹ nhàng nhã nhặn Al18",175.000,https://tiki.vn/ao-len-nu-trung-nien-cho-me-cho-ba-thiet-ke-nhe-nhang-nha-nhan-al18-p202528072.html?spid=202528073,4,,Đã bán 1,ARCTIC_HUNTER
,,https://tiki.vn/ao-gile-len-mau-moi-thu-dong-gl05-p130792138.html?spid=140946854,5,,,ARCTIC_HUNTER
"Bộ đồ linen áo tay cánh rơi kèm quần short trẻ trung ArcticHunter, thời trang thương hiệu chính hãng",400.000₫,https://tiki.vn/bo-do-linen-ao-tay-canh-roi-kem-quan-short-tre-trung-arctichunter-thoi-trang-thuong-hieu-chinh-hang-p113351033.html?spid=113351037,6,-12%,Đã bán 31,ARCTIC_HUNTER
Đầm nữ tay ngắn họa tiết màu trẻ trung da67,169.000₫,https://tiki.vn/dam-nu-tay-ngan-hoa-tiet-mau-tre-trung-da67-p106304159.html?spid=106304402,7,,Đã bán 2,ARCTIC_HUNTER
"Đầm váy sơ mi nữ ngắn tay, Váy linen nữ cổ sơ mi dáng ngắn, suông trơn phong cách nữ công sở ARCTIC HUNTER",249.000₫,https://tiki.vn/dam-vay-so-mi-nu-ngan-tay-vay-linen-nu-co-so-mi-dang-ngan-suong-tron-phong-cach-nu-cong-so-arctic-hunter-p220666876.html?spid=220666880,8,,,ARCTIC_HUNTER
"Đầm Dáng Dài Dự Tiệc Sang Chảnh, Đầm Dài Qua Gối Dáng Suông Tay Lỡ Thắt Eo Chất Linen ARCTIC HUNTER",263.000,https://tiki.vn/dam-dang-dai-du-tiec-sang-chanh-dam-dai-qua-goi-dang-suong-tay-lo-that-eo-chat-linen-arctic-hunter-p199152035.html?spid=199152039,9,-12%,,ARCTIC_HUNTER
,,https://tiki.vn/ao-dui-nu-co-tau-arctic-huner-ao-vai-dui-mong-mat-nhieu-mau-sm172-p106304651.html?spid=106305090,10,-12%,,ARCTIC_HUNTER
"Set áo blazer nữ thiết kế tay dài cổ ve vuông, quần dài ống suông chất linen ARCTIC HUNTER AH02",527.000₫,https://tiki.vn/set-ao-blazer-nu-thiet-ke-tay-lo-co-ve-vuong-quan-dai-ong-rong-chat-linen-arctic-hunter-ah02-p272713108.html?spid=272713116,11,-12%,,ARCTIC_HUNTER
Chân váy midi ARCTIC HUNTER chân váy len gân dài công sở AH13,131.000,https://tiki.vn/chan-vay-midi-arctic-hunter-chan-vay-len-gan-dai-cong-so-ah13-p73787937.html?spid=73787939,12,,Đã bán 3,ARCTIC_HUNTER
,,https://tiki.vn/vay-ngu-2-day-lua-mem-min-quyen-ru-vay-mac-nha-nu-sexy-goi-cam-mua-he-sieu-mat-v05-p165922099.html?spid=165922105,13,,,ARCTIC_HUNTER
Áo vest blazer nữ khoác ngoài 2 cúc mẫu mới phong cách Hàn Quốc chất linen bột cao cấp ARCTIC HUNTER Hh08,282.000₫,https://tiki.vn/ao-vest-blazer-nu-khoac-ngoai-2-cuc-mau-moi-phong-cach-han-quoc-chat-linen-bot-cao-cap-arctic-hunter-hh08-p272304229.html?spid=272304245,14,-12%,,ARCTIC_HUNTER
Đầm thun 2 dây trơn suông co giãn ARCTIC HUNTER AH09,114.000₫,https://tiki.vn/dam-thun-2-day-tron-suong-co-gian-arctic-hunter-ah09-p56753526.html?spid=161945103,15,-12%,Đã bán 1,ARCTIC_HUNTER
"Áo kiểu nữ công sở ARCTIC HUNTER mẫu áo sơ mi cổ chữ V chất liệu mềm mại, không nhăn thoáng mát thích hợp thời tiết nắng nóng AH28",140.000₫,https://tiki.vn/ao-kieu-nu-cong-so-arctic-hunter-mau-ao-so-mi-co-chu-v-chat-lieu-mem-mai-khong-nhan-thoang-mat-thich-hop-thoi-tiet-nang-nong-ah28-p89572432.html?spid=89572444,16,,,ARCTIC_HUNTER
"ĐỒ NGỦ 2 DÂY THUN COTTON MỀM MỊN,ĐỒ NGỦ MẶC NHÀ V36",131.000,https://tiki.vn/do-ngu-2-day-thun-cotton-mem-min-do-ngu-mac-nha-v36-p165913207.html?spid=165913221,17,-12%,,ARCTIC_HUNTER
,,https://tiki.vn/ao-so-mi-nu-arctic-hunter-thiet-ke-co-v-tay-dai-cong-so-sm08-p77694459.html?spid=77694467,18,-12%,,ARCTIC_HUNTER
Áo sơ mi nữ công sở ARCTIC HUNTER thiết kế AH17,140.000₫,https://tiki.vn/ao-so-mi-nu-cong-so-arctic-hunter-thiet-ke-ah17-p79238997.html?spid=79239004,19,-12%,Đã bán 4,ARCTIC_HUNTER
"Bộ Đồ ngủ nữ, bộ mặc nhà áo 2 dây quần cộc nhiều họa tiết đẹp dễ thương Vn33",219.000₫,https://tiki.vn/dam-ngu-vay-ngu-2-day-thun-mem-min-de-thuong-vn33-p165912789.html?spid=165912791,20,,Đã bán 4,ARCTIC_HUNTER
"Đầm ôm tay cộc xẻ ta trước ArcticHunter, thời trang trẻ, phong cách Hàn Quốc (Xanh dương)",89.000₫,https://tiki.vn/dam-om-tay-coc-xe-ta-truoc-arctichunter-thoi-trang-tre-phong-cach-han-quoc-xanh-duong-p46652590.html?spid=67406421,21,,Đã bán 2,ARCTIC_HUNTER
"Đầm xòe voan hoa cổ V chấm bi điệu đà ArcticHunter, thời trang thương hiệu chính hãng",89.000₫,https://tiki.vn/dam-xoe-voan-hoa-co-v-cham-bi-dieu-da-arctichunter-thoi-trang-thuong-hieu-chinh-hang-p75376475.html?spid=75376479,22,-12%,Đã bán 1,ARCTIC_HUNTER
"Đầm xòe voan hoa vàng trẻ trung ArcticHunter, thời trang thương hiệu chính hãng - A1323",89.000₫,https://tiki.vn/dam-xoe-voan-hoa-vang-tre-trung-arctichunter-thoi-trang-thuong-hieu-chinh-hang-a1323-p75376762.html?spid=75376766,23,-12%,,ARCTIC_HUNTER
"Bộ mặc nhà sát nách lưng phối nút xe sau trẻ trung ArcticHunter, chất vải linen mềm mát, thời trang thương hiệu chính hãng",289.000₫,https://tiki.vn/bo-mac-nha-sat-nach-lung-phoi-nut-xe-sau-tre-trung-arctichunter-chat-vai-linen-mem-mat-thoi-trang-thuong-hieu-chinh-hang-p113334128.html?spid=113334142,24,,Đã bán 20,ARCTIC_HUNTER
"Đầm suông linen cổ phát V ArcticHunter, chất vải linen mềm mát, thích hợp mùa hè, thời trang thương hiệu chính hãng - Cam đất",250.000,https://tiki.vn/dam-suong-linen-co-phat-v-arctichunter-chat-vai-linen-mem-mat-thich-hop-mua-he-thoi-trang-thuong-hieu-chinh-hang-cam-dat-p90475888.html?spid=90475896,25,,,ARCTIC_HUNTER
,,https://tiki.vn/ao-kieu-nu-ta-cheo-sang-trong-ale25-p106304291.html?spid=106304348,26,-12%,,ARCTIC_HUNTER
Áo len lưới mỏng ngắn tay thu đông al30,114.000₫,https://tiki.vn/ao-len-luoi-mong-ngan-tay-thu-dong-al30-p121535034.html?spid=121535035,27,,,ARCTIC_HUNTER
"Áo len nữ mỏng cổ tròn tay lửng, tay phối lưới xinh, thời trang hè thu Al17",131.000₫,https://tiki.vn/ao-len-nu-mong-co-tron-tay-lung-tay-phoi-luoi-xinh-thoi-trang-he-thu-al17-p202526562.html?spid=202526564,28,,,ARCTIC_HUNTER
"Đầm suông linen form rộng cổ sơ mi không kén dáng mặc , thời trang thương hiệu chính hãng ARCTIC HUNTER",263.000₫,https://tiki.vn/dam-suong-linen-form-rong-co-so-mi-khong-ken-dang-mac-phong-cach-cong-so-arctic-hunter-p191124588.html?spid=191124592,29,,,ARCTIC_HUNTER
"Đầm suông nữ dáng dài 2 túi sườn, đầm form rộng cổ sơ mi phong cách cá tính thời trang thương hiệu chính hãng Da61",263.000,https://tiki.vn/dam-suong-nu-dang-dai-2-tui-suon-dam-form-rong-co-so-mi-phong-cach-ca-tinh-thoi-trang-thuong-hieu-chinh-hang-da61-p183314553.html?spid=183314565,30,,,ARCTIC_HUNTER
,,https://tiki.vn/dam-nu-dang-xoe-arctic-hunter-thiet-ke-tay-bup-sen-ah49-p83162343.html?spid=83162351,31,,,ARCTIC_HUNTER
Áo sơ mi nữ ARCTIC HUNTER trắng xinh AH45,131.000₫,https://tiki.vn/ao-so-mi-nu-arctic-hunter-trang-xinh-ah45-p98741276.html?spid=98741299,32,,,ARCTIC_HUNTER
"Bộ đồ ngủ mặc nhà nữ, set quần áo ngủ nữ 2 dây vải mềm mịn thoáng mát, hoạ tiết xinh xắn V24",131.000₫,https://tiki.vn/bo-do-ngu-mac-nha-nu-set-quan-ao-ngu-nu-2-day-vai-mem-min-thoang-mat-hoa-tiet-xinh-xan-v24-p160439161.html?spid=160439171,33,,,ARCTIC_HUNTER
"Quần mặc trong váy cho bà bầu chất cotton mềm mỏng thông hơi thoáng mát,dễ chịu có dây điều chỉnh vòng bụng QL05",169.000₫,https://tiki.vn/quan-mac-trong-vay-cho-ba-bau-chat-cotton-mem-mong-thong-hoi-thoang-mat-de-chiu-co-day-dieu-chinh-vong-bung-ql05-p164582351.html?spid=164582390,34,,Đã bán 9,ARCTIC_HUNTER
Quần nỉ nữ ARCTIC HUNTER AH03,131.000,https://tiki.vn/quan-ni-nu-arctic-hunter-ah03-p130271662.html?spid=130271670,35,,Đã bán 1,ARCTIC_HUNTER
,,https://tiki.vn/dam-suong-nu-thiet-ke-2-tui-suon-tay-ngan-rut-eo-chat-vai-dui-mem-mat-phong-cach-ulzzang-han-quoc-da70-p183319528.html?spid=183319536,36,,,ARCTIC_HUNTER
Áo Dệt Kim Mỏng Tay Dài Dáng Rộng Họa Tiết Kẻ Sọc Thời Trang ARCTIC HUNTER Al07,140.000₫,https://tiki.vn/ao-det-kim-mong-tay-dai-dang-rong-hoa-tiet-ke-soc-thoi-trang-arctic-hunter-al07-p197694326.html?spid=197694328,37,,,ARCTIC_HUNTER
"Đầm suông sơ mi da beo lượt đuôi tôm ArcticHunter, thời trang thương hiệu chính hãng",230.000₫,https://tiki.vn/dam-suong-so-mi-da-beo-luot-duoi-tom-arctichunter-thoi-trang-thuong-hieu-chinh-hang-p82361879.html?spid=82361884,38,,Đã bán 3,ARCTIC_HUNTER
"Đầm xòe voan hoa nền xanh hoa vàng ArcticHunter, thời trang thương hiệu chính hãng - A0210",89.000₫,https://tiki.vn/dam-xoe-voan-hoa-nen-xanh-hoa-vang-arctichunter-thoi-trang-thuong-hieu-chinh-hang-a0210-p75376529.html?spid=75376533,39,,Đã bán 4,ARCTIC_HUNTER
"Đầm suông linen cổ tim tay lỡ kèm đai rời ArcticHunter, thời trang thương hiệu chính hãng - Đen",250.000,https://tiki.vn/dam-suong-linen-co-tim-tay-lo-kem-dai-roi-arctichunter-thoi-trang-thuong-hieu-chinh-hang-den-p78578178.html?spid=78578186,40,,,ARCTIC_HUNTER
