title,price,link_item,index,discount,sales,category
Máy sấy quần áo diệt khuẩn gấp gọn TiLoKi KD-111 công suất 800W - Hàng Chính Hãng,1.000.000₫,https://tiki.vn/may-say-quan-ao-diet-khuan-gap-gon-tiloki-kd-111-cong-suat-800w-hang-chinh-hang-p183720729.html?spid=183720730,1,-48%,Đã bán 32,thietbigiadinh
Máy Lọc Không Khí Hàng Chính Hãng Levoit Core P350 40m2 Bộ Lọc HEPA 13 Lọc Lông/Mùi Thú Cưng Chó Mèo - Kháng Khuẩn - báo hiệu khi phải thay lõi lọc,3.990.000₫,https://tiki.vn/may-loc-khong-khi-chinh-hang-levoit-core-p350-40m2-bo-loc-hepa-13-loc-long-mui-thu-cung-cho-meo-khang-khuan-bao-hieu-khi-phai-thay-loi-loc-p135350132.html?spid=135350133,2,,Đã bán 15,thietbigiadinh
Vòi Karofi - Hàng chính hãng,160.000₫,https://tiki.vn/voi-karofi-hang-chinh-hang-p49192176.html?spid=89890440,3,,Đã bán 11,thietbigiadinh
Quạt thông gió nối ống phi 100 - Quạt hút đồng trục cấp khí tươi cho công trình nhà - Hàng chính hãng GDXLFJ siêu chống ồn,1.050.000₫,https://tiki.vn/quat-thong-gio-noi-ong-phi-100-quat-hut-dong-truc-cap-khi-tuoi-cho-cong-trinh-nha-hang-chinh-hang-gdxlfj-sieu-chong-on-p88798404.html?spid=88798405,4,-10%,Đã bán 30,thietbigiadinh
,,https://tiki.vn/may-duoi-toc-kemei-km-2518-dieu-chinh-5-muc-nhiet-su-dung-duoc-cho-moi-loai-toc-hang-chinh-hang-p175433142.html?spid=175433143,5,-1%,,thietbigiadinh
Máy sưởi thông minh nút vặn Smartmi Graphene GR-H - Hàng chính hãng,1.690.000₫,https://tiki.vn/may-suoi-thong-minh-smartmi-graphene-gr-h-hang-chinh-hang-p202612171.html?spid=202612175,6,-50%,Đã bán 3,thietbigiadinh
Pin tông đơ Codos T6,99.000₫,https://tiki.vn/pin-tong-do-codos-t6-p145301968.html?spid=145301970,7,-25%,Đã bán 11,thietbigiadinh
Máy hút bụi Dyson Gen5 detect Absolute - Model 2023 cao cấp xịn xò nhất nhà Dyson Hàng chính hãng,20.500.000₫,https://tiki.vn/may-hut-bui-dyson-gen5-detect-absolute-model-2023-cao-cap-xin-xo-nhat-nha-dyson-hang-chinh-hang-p272871956.html?spid=272871957,8,-33%,,thietbigiadinh
"Quạt Sưởi Gốm XIAOMI MINI DOUHE DH-QN04, Phù Hợp Diện Tích Hoạt Động 10 m2, Công Suất 600 W - Hàng Chính Hãng",529.000₫,https://tiki.vn/quat-suoi-gom-xiaomi-mini-douhe-dh-qn04-phu-hop-dien-tich-hoat-dong-10-m2-cong-suat-600-w-hang-chinh-hang-p200004557.html?spid=200004558,9,-50%,Đã bán 45,thietbigiadinh
,,https://tiki.vn/may-hut-bui-lau-nha-cam-tay-pin-roi-redkey-p7-cong-suat-250w-luc-hut-22-000-pa-hang-chinh-hang-p193738185.html?spid=193738187,10,,,thietbigiadinh
Tông Đơ Cắt Tóc Philips HC3525/15 – Hành Chính Hãng,1.325.000₫,https://tiki.vn/tong-do-cat-toc-philips-hc3525-15-bao-hanh-chinh-hang-2-nam-p174162748.html?spid=199568780,11,-50%,Đã bán 1,thietbigiadinh
Máy Hút Bụi Dyson V15 Detect Absolute - Hàng Chính Hãng,20.100.000₫,https://tiki.vn/may-hut-bui-dyson-v15-dectect-hang-chinh-hang-p107088562.html?spid=107088563,12,-41%,Đã bán 6,thietbigiadinh
,,https://tiki.vn/may-loc-khong-khi-hitachi-ep-tz30j-240v-wh-hang-chinh-hang-p270905056.html?spid=270905057,13,-5%,,thietbigiadinh
Robot Hút Bụi Lau Nhà Giặt Giẻ Dreame L10 Prime – Bản Quốc Tế - Hàng chính hãng,11.190.000₫,https://tiki.vn/robot-hut-bui-lau-nha-dreame-l10-prime-ban-quoc-te-hang-chinh-hang-p216870904.html?spid=216870905,14,,Đã bán 4,thietbigiadinh
"Máy Hút Ẩm Không Khí Chống Nồm, Chống Ẩm Mốc - Máy Hút Ẩm Thông Minh Cho Gia Đình",695.000₫,https://tiki.vn/may-hut-am-khong-khi-chong-nom-chong-am-moc-may-hut-am-thong-minh-cho-gia-dinh-p206141114.html?spid=206141115,15,,Đã bán 5,thietbigiadinh
Quạt bàn Senko sang trọng cao cấp B1216 màu ngẫu nhiên - Hàng Chính Hãng,295.000₫,https://tiki.vn/product-quat-ban-senko-sang-trong-cao-cap-b1216-mau-ngau-nhien-hang-chinh-hang-p129805645.html?spid=170444480,16,,,thietbigiadinh
"Quạt Đứng, Quạt Tích Điện Mi-Lux F188 Đối Lưu Không Khí Thế Hệ Mới Pin 8000mAh Tích Điện 20- 60 Giờ Gồm 4 Cấp Độ Gió, Tích Hợp Đèn Ngủ - Hàng Chính Hãng",1.589.000₫,https://tiki.vn/quat-tich-dien-mi-lux-f188-doi-luu-khong-khi-the-he-moi-pin-8000mah-tich-dien-20-60-gio-gom-4-cap-do-gio-tich-hop-den-ngu-hang-chinh-hang-p265546751.html?spid=170184319,17,,Đã bán 12,thietbigiadinh
,,https://tiki.vn/quat-dien-dieu-khien-tu-xa-quat-dien-co-nut-van-co-cong-suat-35w-dieu-chinh-goc-va-huong-xoay-cong-nghe-hien-dai-hang-nhap-khau-p176586181.html?spid=176586185,18,,,thietbigiadinh
"Máy May Cầm Tay Mini Siêu Tiện Lợi, Chỉ Cần Dùng Tay Bấm (Màu Ngẫu Nhiên) - GDHN Loại Tốt",48.000₫,https://tiki.vn/may-may-cam-tay-mini-sieu-tien-loi-chi-can-dung-tay-bam-mau-ngau-nhien-gdhn-loai-tot-p126533569.html?spid=263066505,19,,Đã bán 2,thietbigiadinh
Bộ Lọc Máy Lọc Không Khí Samsung 60m2 AX60R5080WD (CFX-D100/GB) - Hàng Chính Hãng,1.490.000₫,https://tiki.vn/bo-loc-may-loc-khong-khi-samsung-60m2-ax60r5080wd-cfx-d100-gb-hang-chinh-hang-p141258440.html?spid=141258441,20,,Đã bán 38,thietbigiadinh
Quạt Năng Lượng Mặt Trời - Quạt Tích Điện Năng Lượng Mặt Trời Nhiều Kiểu Dáng Hàng Chính Hãng TAI YANG SHEN,1.000.000₫,https://tiki.vn/quat-nang-luong-mat-troi-chinh-hang-tys-co-ket-noi-bluetooth-co-cong-usb-sac-dien-thoai-p248680077.html?spid=269962303,21,,Đã bán 34,thietbigiadinh
Máy Lọc Không Khí Daikin MC30VVM-A - Hàng Chính Hãng,3.028.000₫,https://tiki.vn/may-loc-khong-khi-daikin-mc30vvm-a-hang-chinh-hang-p146649593.html?spid=146649595,22,,Đã bán 2,thietbigiadinh
Quạt Hút Âm Tường Panasonic FV-20CUT1 - Hàng chính hãng,769.000₫,https://tiki.vn/quat-hut-am-tuong-panasonic-fv-20cut1-28w-hang-chinh-hang-p637585.html?spid=197540727,23,,,thietbigiadinh
"Robot lau nhà thông minh không dây, tự động lau sàn và hút bụi tiện lợi - RB01",199.900₫,https://tiki.vn/robot-lau-nha-thong-minh-khong-day-tu-dong-lau-san-va-hut-bui-tien-loi-rb01-p51947421.html?spid=66893797,24,,Đã bán 12,thietbigiadinh
"Tông đơ cắt tóc chấn viền không dây đa năng, hớt tóc, cạo râu, bấm viền chuyên nghiệp",195.000₫,https://tiki.vn/tong-do-cat-toc-chan-vien-khong-day-da-nang-hot-toc-cao-rau-bam-vien-chuyen-nghiep-p198270724.html?spid=198270728,25,,Đã bán 3,thietbigiadinh
,,https://tiki.vn/bong-den-hong-ngoai-um-suoi-cho-gia-suc-gia-cam-m-r125-200w-p26335954.html?spid=186271353,26,,,thietbigiadinh
Máy Hút Bụi Không Dây Cầm Tay DREAME T30 Pin Rời Thuận Tiện Sạc Điện Siêu Nhẹ Thời Gian Làm Việc 45 - 90 Phút Lực Hút 27KPa Công Suất Cao 550 W - Hàng Chính Hãng,8.789.000₫,https://tiki.vn/may-hut-bui-cam-tay-dreame-h11-max-cong-suat-200w-ap-suat-10-000-pa-hang-chinh-hang-p183567346.html?spid=183567347,27,,Đã bán 10,thietbigiadinh
"Adapter 24V 1.2A dùng cho máy bơm lọc nước, phun sương",89.000₫,https://tiki.vn/adapter-24v-1-2a-dung-cho-may-bom-loc-nuoc-phun-suong-p101454682.html?spid=104637612,28,,Đã bán 8,thietbigiadinh
"Quạt hút gió, hút mùi siêu trầm",410.000₫,https://tiki.vn/quat-hut-gio-hut-mui-sieu-tram-p43089207.html?spid=90525495,29,,Đã bán 11,thietbigiadinh
"Quạt treo tường, quạt Tefal Turbo Life VH657690 - 55W, 3 chế độ gió- hàng chính hãng",955.000₫,https://tiki.vn/quat-treo-tuong-quat-tefal-turbo-life-vh657690-55w-3-che-do-gio-hang-chinh-hang-p259563836.html?spid=259563837,30,,,thietbigiadinh
,,https://tiki.vn/may-cao-rau-kho-va-uot-philips-s5444-03-hang-chinh-hang-p248656112.html?spid=248656113,31,,,thietbigiadinh
"Robot Hút Bụi Lau Nhà XIAOMI DREAME D10 PLUS Tự Động Đổ Rác Tạo Bản Đồ Siêu Nhanh Diện Tích Hoạt Động 250m2, Lực Hút 4000 Pa - Hàng Nhập Khẩu",9.889.000₫,https://tiki.vn/robot-hut-bui-lau-nha-xiaomi-dreame-s10-tu-dong-giat-say-gie-tu-gom-rac-tu-dong-them-nuoc-tao-ban-do-sieu-nhanh-camera-ai-dien-tich-hoat-dong-200m2-ap-suat-5300-pa-cong-suat-75w-hang-nhap-khau-p248491740.html?spid=248491741,32,,Đã bán 1,thietbigiadinh
Máy hút ẩm thông minh Xiaomi Mijia WIDETECH 12L - Hàng Nhập Khẩu,3.789.000₫,https://tiki.vn/may-hut-am-thong-minh-xiaomi-mijia-widetech-12l-hang-nhap-khau-p178265007.html?spid=178265008,33,,Đã bán 12,thietbigiadinh
Máy hút ẩm và lọc không khí Estilo 3 in 1 Hàng chính hãng,6.300.000₫,https://tiki.vn/may-hut-am-va-loc-khong-khi-estilo-3-in-1-p273513868.html?spid=273513869,34,,,thietbigiadinh
Máy tạo kiểu tóc Dyson Airwrap Complete Long Xanh Vinca HS05 - Hàng chính hãng,14.900.000₫,https://tiki.vn/may-tao-kieu-toc-dyson-airwrap-complete-long-xanh-vinca-hs05-hang-chinh-hang-p199175612.html?spid=248910510,35,,,thietbigiadinh
,,https://tiki.vn/quat-hut-thong-gio-2-chieu-am-tuong-senko-hang-chinh-hang-h150-30w-p126022630.html?spid=179929471,36,,,thietbigiadinh
Máy Lọc Nước 9 Lõi Vỏ Tủ VTU Kangaroo KG110AVTU - Hàng Chính Hãng,5.010.000₫,https://tiki.vn/may-loc-nuoc-9-loi-vo-tu-vtu-kangaroo-kg110avtu-hang-chinh-hang-p29248561.html?spid=29248562,37,,Đã bán 3,thietbigiadinh
Quạt Mini Tích Điện - Mini Fan Di Động Tiện Lợi,199.000₫,https://tiki.vn/quat-mini-tich-dien-mini-fan-di-dong-tien-loi-p217654607.html?spid=74660345,38,,Đã bán 42,thietbigiadinh
Tông Đơ Cắt Tóc Chuyên Nghiệp Panasonic ER-GP80-K751 - Hàng Chính Hãng,3.839.000₫,https://tiki.vn/tong-do-cat-toc-chuyen-nghiep-panasonic-er-gp80-k751-hang-chinh-hang-p71513166.html?spid=270975145,39,,,thietbigiadinh
Quạt treo 1 dây Senko T1682 - Giao màu ngẫu nhiên - Hàng Chính Hãng,335.000₫,https://tiki.vn/quat-treo-1-day-senko-t1682-giao-mau-ngau-nhien-hang-chinh-hang-p78631499.html?spid=167062816,40,,Đã bán 2,thietbigiadinh
