title,price,link_item,index,discount,sales,brand
Thảm đàn piano đại dương đa năng Winfun 0860 - đồ chơi phát triển đa giác quan cho bé giai đoạn đầu đời,819.000₫,https://tiki.vn/tham-dan-piano-dai-duong-da-nang-winfun-0860-do-choi-phat-trien-da-giac-quan-cho-be-giai-doan-dau-doi-p245776218.html?spid=245776219,1,-37%,,winfun
Xe tập đi kết hợp xe chòi chân và xe scooter 3 trong 1 hình sư tử có nhạc cho bé Winfun 0855,859.000₫,https://tiki.vn/xe-tap-di-ket-hop-xe-choi-chan-va-xe-scooter-3-trong-1-hinh-su-tu-co-nhac-cho-be-winfun-0855-tang-do-choi-de-thuong-p94727020.html?spid=94727021,2,-39%,,winfun
Đồ chơi tắm vui nhộn hình bông hoa Winfun 7104,239.000₫,https://tiki.vn/do-choi-tam-vui-nhon-hinh-bong-hoa-winfun-7104-p26323520.html?spid=26468361,3,,Đã bán 27,winfun
Xúc xắc cầm tay hình con bướm Winfun WF0183,109.000,https://tiki.vn/xuc-xac-cam-tay-hinh-con-buom-winfun-wf0183-p7426715.html?spid=12873267,4,-35%,,winfun
,,https://tiki.vn/ban-nhac-cho-be-tap-dung-hoc-chu-do-choi-co-nhac-0801-hieu-winfun-giup-be-vua-choi-vua-hoc-phat-trien-ky-nang-p1360027.html?spid=13070402,5,-28%,,winfun
"Bộ đồ chơi giáo dục sớm, nhập vai: máy tính tiền tự động WINFUN 2515 kích thích bé phát triển trí tưởng tượng - BPA free",839.000₫,https://tiki.vn/bo-do-choi-giao-duc-som-nhap-vai-may-tinh-tien-tu-dong-winfun-2515-kich-thich-be-phat-trien-tri-tuong-tuong-bpa-free-p86406615.html?spid=86406616,6,,Đã bán 1,winfun
Thú bông xúc xắc hình hươu treo cũi Winfun 0117,159.000₫,https://tiki.vn/thu-bong-xuc-xac-hinh-huou-treo-cui-winfun-0117-p7533165.html?spid=12741302,7,-42%,Đã bán 19,winfun
Đồ chơi giáo dục sớm - Ipad học tiếng Anh sớm cùng bé Winfun 0732 - Phát triển trí tuệ ngôn ngữ,319.000₫,https://tiki.vn/do-choi-giao-duc-som-ipad-hoc-tieng-anh-som-cung-be-winfun-0732-phat-trien-tri-tue-ngon-ngu-p19789284.html?spid=40623071,8,-29%,Đã bán 12,winfun
Đồ chơi thú bông gặm nướu hình sư tử - hươu - khỉ Winfun 0117 - 0118 - 0119 treo nôi Kích thích thị giác cho bé,150.000,https://tiki.vn/do-choi-thu-bong-gam-nuou-winfun-0118-treo-noi-kich-thich-thi-giac-cho-be-p151708356.html?spid=151708372,9,-30%,,winfun
,,https://tiki.vn/do-choi-am-nhac-cho-be-dan-organ-dien-tu-cho-be-kem-mic-thu-am-va-ban-dj-winfun-2068-phat-trien-nang-khieu-am-nhac-p151708835.html?spid=151708849,10,,,winfun
"Trống đồ chơi cho bé phát nhạc vui nhộn, âm thanh động vật kích thích giác quan, bé luyện phối hợp tay mắt Winfun 2010-NL",389.000₫,https://tiki.vn/trong-do-choi-cho-be-phat-nhac-vui-nhon-am-thanh-dong-vat-kich-thich-giac-quan-be-luyen-phoi-hop-tay-mat-winfun-2010-nl-p186276336.html?spid=186276337,11,,Đã bán 4,winfun
Đồ chơi dụng cụ cơ khí hình xe tải - bé tập làm kỹ sư Winfun 0795-01 Phiên bản nói tiếng anh,429.000,https://tiki.vn/do-choi-dung-cu-co-khi-hinh-xe-tai-be-tap-lam-ky-su-winfun-0795-01-phien-ban-noi-tieng-anh-p249744241.html?spid=249744242,12,,,winfun
,,https://tiki.vn/do-choi-luyen-tu-duy-logic-cho-be-ngoi-nha-tren-cay-co-nhac-va-tieng-keu-dong-vat-ket-hop-tha-hinh-khoi-winfun-0786-p245891775.html?spid=245891776,13,,,winfun
"Đồ chơi treo nôi cho bé cảm ứng phát nhạc, biết nói tiếng anh, gấu mèo MoMo - người bạn đồng hành cùng tuổi thơ của bé Winfun 720020-01",499.000₫,https://tiki.vn/do-choi-treo-noi-cho-be-cam-ung-phat-nhac-biet-noi-tieng-anh-gau-meo-momo-nguoi-ban-dong-hanh-cung-tuoi-tho-cua-be-winfun-720020-01-p186276329.html?spid=186276333,14,,Đã bán 1,winfun
"Đồ chơi nhà tắm cho bé-set 2 món (random) sinh vật biển vô cùng dễ thương, hàng chính hãng",39.000₫,https://tiki.vn/do-choi-nha-tam-cho-be-set-2-mon-random-sinh-vat-bien-vo-cung-de-thuong-hang-chinh-hang-p180218726.html?spid=180218728,15,,Đã bán 12,winfun
Đồ chơi có nhạc Bàn nhạc đa năng Winfun 0801 kích thích phát triển giác quan và rèn luyện khả năng vận động cho bé,888.000₫,https://tiki.vn/do-choi-co-nhac-ban-nhac-da-nang-winfun-0801-kich-thich-phat-trien-giac-quan-va-ren-luyen-kha-nang-van-dong-cho-be-p192008435.html?spid=192008436,16,,,winfun
Đồ chơi vô lăng đua xe mô phỏng đường đua có âm thanh vui nhộn cho trẻ từ 12 tháng Winfun 0621-NL,499.000,https://tiki.vn/do-choi-vo-lang-dua-xe-mo-phong-duong-dua-co-am-thanh-vui-nhon-cho-tre-tu-12-thang-winfun-0621-nl-p186304399.html?spid=186304401,17,,,winfun
,,https://tiki.vn/cuon-sach-hoc-tieng-anh-co-nhac-hieu-do-choi-giao-duc-som-winfun-9019-p1360083.html?spid=13135566,18,,,winfun
"Thảm nằm chơi kèm thú bông, xúc xắc cho bé từ sơ sinh - đồ chơi vận động Winfun 710010-NI",1.190.000₫,https://tiki.vn/tham-nam-choi-kem-thu-bong-xuc-xac-cho-be-tu-so-sinh-d-o-choi-van-dong-winfun-7100-ni-p186304393.html?spid=186304397,19,,,winfun
Tháp xếp chồng nhựa hình cốc kết hợp thả bóng vui nhộn winfun 0737 - 9 tới 24 tháng - đồ chơi giáo dục phát triển tư duy,299.000₫,https://tiki.vn/thap-xep-chong-nhua-hinh-coc-ket-hop-tha-bong-vui-nhon-winfun-0737-9-toi-24-thang-do-choi-giao-duc-phat-trien-tu-duy-tang-do-choi-de-thuong-p94727121.html?spid=94727158,20,,Đã bán 1,winfun
"Vô lăng đồ chơi cho bé - chơi game đua xe có âm thanh vui nhộn, luyện phối hợp tay mắt, kích thích giác quan Winfun 0621-NL",499.000₫,https://tiki.vn/vo-lang-do-choi-cho-be-choi-game-dua-xe-co-am-thanh-vui-nhon-luyen-phoi-hop-tay-mat-kich-thich-giac-quan-winfun-0621-nl-p186276307.html?spid=186276312,21,,Đã bán 1,winfun
Thảm đàn Size lớn cho bé 130*48cm - nhảy cùng nhịp điệu Winfun 2507-NL,695.000₫,https://tiki.vn/tham-dan-size-lon-cho-be-130-48cm-nhay-cung-nhip-dieu-winfun-2507-nl-p249056594.html?spid=249056596,22,,Đã bán 1,winfun
"Đồ chơi Bàn nhạc tập đứng cho bé kiêm đập bóng vui nhộn, thả hình khối luyện tư duy có đèn nhạc Winfun 0812",899.000₫,https://tiki.vn/do-choi-ban-nhac-tap-dung-cho-be-kiem-dap-bong-vui-nhon-tha-hinh-khoi-luyen-tu-duy-co-den-nhac-winfun-0812-p1360029.html?spid=13070399,23,,Đã bán 9,winfun
Đồ chơi dụng cụ cơ khí hình xe tải - bé tập làm kỹ sư Winfun 0795-01 - Phiên bản nói tiếng anh,339.000₫,https://tiki.vn/do-choi-dung-cu-co-khi-hinh-xe-tai-be-tap-lam-ky-su-winfun-0795-01-phien-ban-noi-tieng-anh-p248787451.html?spid=248787452,24,,,winfun
Set 3 đồ chơi cầm tay xúc xắc chíp chíp - gặm nướu hổ gặm nướu sột soạt Winfun 3027,225.000,https://tiki.vn/set-3-do-choi-cam-tay-xuc-xac-chip-chip-gam-nuou-ho-gam-nuou-sot-soat-winfun-3027-p94727027.html?spid=107059662,25,,,winfun
,,https://tiki.vn/xe-tap-di-cho-be-kiem-tap-dung-choi-chan-kem-do-choi-tha-khoi-co-nhac-cho-tre-tu-6-den-36-thang-winfun-0875-p190669532.html?spid=190669533,26,,,winfun
"Đồ chơi sơ sinh - tiền giáo dục: Sư tử phát nhạc, học tiếng anh vui nhộn Winfun 0691-01",379.000₫,https://tiki.vn/do-choi-so-sinh-tien-giao-duc-su-tu-phat-nhac-hoc-tieng-anh-vui-nhon-winfun-0691-01-p249794716.html?spid=249794717,27,,,winfun
Đàn nhạc Piano đồ chơi động vật hoang dã mini WF002012,439.000₫,https://tiki.vn/dan-nhac-piano-do-choi-dong-vat-hoang-da-mini-wf002012-p7434685.html?spid=87582603,28,,Đã bán 5,winfun
"Đồ chơi treo nôi cũi, xe đẩy xoay tự động, máy tạo tiếng ồn trắng cho bé dễ đi vào giấc ngủ - Chú sóc múa ba lê Winfun 720015-NL",699.000₫,https://tiki.vn/do-choi-treo-noi-cui-xe-day-xoay-tu-dong-may-tao-tieng-on-trang-cho-be-de-di-vao-giac-ngu-chu-soc-mua-ba-le-winfun-720015-nl-p186276298.html?spid=186276299,29,,Đã bán 2,winfun
Xe Tập Đi Sư Tử Kết Hợp Xe Chòi Chân Scooter Winfun 0855NL,1.549.000,https://tiki.vn/xe-tap-di-su-tu-ket-hop-xe-choi-chan-scooter-winfun-0855nl-p1360071.html?spid=13106769,30,,Đã bán 1,winfun
,,https://tiki.vn/do-choi-oc-sen-keo-day-phat-nhac-kem-con-quay-ban-bong-winfun-0674-nl-p249744644.html?spid=249744645,31,,,winfun
Đồ chơi âm nhạc cho bé - Đàn piano cổ điển kèm mic thu âm - Winfun - 2045 đồ chơi cho bé 3 tuổi trở lên,999.000₫,https://tiki.vn/do-choi-am-nhac-cho-be-dan-piano-co-dien-kem-mic-thu-am-winfun-2045-do-choi-cho-be-3-tuoi-tro-len-tang-do-choi-de-thuong-p94727061.html?spid=94727101,32,,Đã bán 19,winfun
"Set 4 đồ chơi xúc xắc cầm tay, gặm nướu chủ đề động vật hoang dã Winfun 0634-NL",209.000₫,https://tiki.vn/set-4-do-choi-xuc-xac-cam-tay-gam-nuou-chu-de-dong-vat-hoang-da-winfun-0634-nl-p248744583.html?spid=248744584,33,,Đã bán 1,winfun
Đèn chiếu trăng sao ru ngủ phát tiếng ồn trắng Winfun 0825-NL hình bạn gấu dễ thương,379.000₫,https://tiki.vn/den-chieu-trang-sao-ru-ngu-phat-tieng-on-trang-winfun-0825-nl-hinh-ban-gau-de-thuong-p248741761.html?spid=248741762,34,,Đã bán 1,winfun
Xe tập đi kèm bàn nhạc cho bé khám phá thế giới Winfun 0878-NL,895.000,https://tiki.vn/xe-tap-di-kem-ban-nhac-cho-be-kham-pha-the-gioi-winfun-0878-nl-p249683243.html?spid=249683244,35,,,winfun
,,https://tiki.vn/do-choi-oc-sen-keo-day-phat-nhac-kem-con-quay-ban-bong-winfun-0674-nl-p249795056.html?spid=249795057,36,,,winfun
Thảm nằm chơi cho bé - Thay đổi theo từng giai đoạn phát triển của bé Winfun 710000-NL,1.190.000₫,https://tiki.vn/tham-nam-choi-cho-be-thay-doi-theo-tung-giai-doan-phat-trien-cua-be-winfun-710000-nl-p249802058.html?spid=249802059,37,,Đã bán 1,winfun
"Sóc nâu cảm ứng tập bò, đuổi bắt vui nhộn Winfun - 1148",939.000₫,https://tiki.vn/soc-nau-cam-ung-tap-bo-duoi-bat-vui-nhon-winfun-1148-p86406699.html?spid=86406703,38,,,winfun
"Set 3 đồ chơi xúc xắc cầm tay, gặm nướu chủ đề cầu vồng và mưa Winfun 3030-NL",335.000₫,https://tiki.vn/set-3-do-choi-xuc-xac-cam-tay-gam-nuou-chu-de-cau-vong-va-mua-winfun-3030-nl-p249789590.html?spid=249789591,39,,Đã bán 1,winfun
Xe ô tô đồ chơi thông minh điều khiển từ xa Winfun 1142 cho bé hình cún con cầu vồng có phát nhạc,792.000,https://tiki.vn/xe-o-to-do-choi-thong-minh-dieu-khien-tu-xa-winfun-1142-cho-be-hinh-cun-con-cau-vong-co-phat-nhac-p151708333.html?spid=151708340,40,,,winfun
