title,price,link_item,index,discount,sales,category
Váy thời trang bầu dáng dài chất cotton mát mùa hè cộc tay đẹp 40-65kg,179.000₫,https://tiki.vn/vay-thoi-trang-bau-dang-dai-chat-cotton-mat-mua-he-coc-tay-dep-40-65kg-p129495394.html?spid=129495423,1,,,thoitrangbau
Váy bầu thời trang thiết kế suông giá rẻ cộc tay mùa hè,158.000₫,https://tiki.vn/vay-bau-thoi-trang-thiet-ke-suong-gia-re-coc-tay-mua-he-p129493481.html?spid=129493530,2,,,thoitrangbau
Váy bầu đẹp dáng suông a chất lụa,210.000₫,https://tiki.vn/vay-bau-dep-dang-suong-a-chat-lua-p129494088.html?spid=129494160,3,,,thoitrangbau
Váy bầu đẹp dáng dài cotton dáng suông mùa hè,168.000₫,https://tiki.vn/vay-bau-dep-dang-dai-cotton-dang-suong-mua-he-p129499644.html?spid=129499646,4,,,thoitrangbau
,,https://tiki.vn/quan-sooc-bau-dui-bau-p129498931.html?spid=129498957,5,,,thoitrangbau
Bộ bầu pink,189.000₫,https://tiki.vn/bo-ba-u-pink-p129499630.html?spid=129499638,6,,,thoitrangbau
Váy bầu lanh mặc nhà chất lanh mát có tay bầu bí mặc thoải mái,126.000₫,https://tiki.vn/vay-bau-lanh-mac-nha-chat-lanh-mat-co-tay-bau-bi-mac-thoai-mai-p129494622.html?spid=129494655,7,,,thoitrangbau
Bộ đồ bầu mùa hè chất mát áo có khóa ti áo cộc quần ngố,158.000₫,https://tiki.vn/bo-do-bau-mua-he-chat-mat-ao-co-khoa-ti-ao-coc-quan-ngo-p129500061.html?spid=129500065,8,,,thoitrangbau
Váy bầu thiết kế mùa hè sát nách mát màu hồng chất voan 2 lớp,158.000₫,https://tiki.vn/vay-bau-thiet-ke-mua-he-sat-nach-mat-mau-hong-chat-voan-2-lop-p129492468.html?spid=129492477,9,,,thoitrangbau
,,https://tiki.vn/vay-bau-dep-2021-thoi-trang-thiet-ke-ke-soc-tay-lung-dang-xoe-p129494123.html?spid=129494132,10,,,thoitrangbau
Bộ pink mặc nhà và sau sinh mở nắp ti,147.000₫,https://tiki.vn/bo-pink-mac-nha-va-sau-sinh-mo-nap-ti-p129494795.html?spid=129494831,11,,,thoitrangbau
Quần legging bầu,126.000₫,https://tiki.vn/quan-legging-bau-p129500248.html?spid=129500254,12,,,thoitrangbau
,,https://tiki.vn/bo-do-bau-dep-ke-soc-mac-mat-quan-ngo-co-chun-chinh-p129495817.html?spid=129495851,13,,,thoitrangbau
"BỘ ĐỒ SAU SINH vạt chéo chất cotton,quần có chun chỉnh",158.000₫,https://tiki.vn/bo-do-sau-sinh-vat-cheo-chat-cotton-quan-co-chun-chinh-p129499169.html?spid=129499186,14,,,thoitrangbau
Bộ đồ sau sinh đẹp,210.000₫,https://tiki.vn/bo-do-sau-sinh-dep-p129499325.html?spid=129499345,15,,,thoitrangbau
Áo bầu xinh,210.000₫,https://tiki.vn/ao-bau-xinh-p129493735.html?spid=129493750,16,,,thoitrangbau
Váy bầu đẹp suông công sở chất thô lụa từ 45-70kg đầm bầu thiết kế,153.000₫,https://tiki.vn/vay-bau-dep-suong-cong-so-chat-tho-lua-tu-45-70kg-dam-bau-thiet-ke-p129493759.html?spid=129493773,17,,,thoitrangbau
,,https://tiki.vn/vay-bau-xinh-hai-day-thoi-trang-p129497611.html?spid=129497626,18,,,thoitrangbau
BỘ LANH SAU SINH ĐẸP 40-65Kg,189.000₫,https://tiki.vn/bo-lanh-sau-sinh-dep-40-65kg-p129496380.html?spid=129496388,19,,,thoitrangbau
Váy bầu thiết kế thời trang cao cấp Aidenshop đầm suông sau sinh nữ ren,280.000₫,https://tiki.vn/vay-bau-thiet-ke-thoi-trang-cao-cap-aidenshop-dam-suong-sau-sinh-nu-ren-p184766111.html?spid=184766127,20,,,thoitrangbau
Váy lanh bầu,95.000₫,https://tiki.vn/vay-lanh-bau-p129494412.html?spid=129494421,21,,,thoitrangbau
Váy bầu xinh chất cotton dáng suông thời trang,242.000₫,https://tiki.vn/vay-bau-xinh-chat-cotton-dang-suong-thoi-trang-p129493274.html?spid=129493299,22,,,thoitrangbau
Bộ bầu xinh ngố chất đũi mát mùa hè 2021 (kèm ảnh thật),158.000₫,https://tiki.vn/bo-bau-xinh-ngo-chat-dui-mat-mua-he-2021-kem-anh-that-p129500474.html?spid=129500477,23,,,thoitrangbau
Váy suông bầu thời trang dáng dài đầm bầu thiết kế chất cotton,158.000₫,https://tiki.vn/vay-suong-bau-thoi-trang-dang-dai-dam-bau-thiet-ke-chat-cotton-p129495733.html?spid=129495743,24,,,thoitrangbau
Bộ bầu thời trang bigsize mùa hè màu hồng hoa nhí chất mát đẹp hàng đẹp giá rẻ,142.000₫,https://tiki.vn/bo-bau-thoi-trang-bigsize-mua-he-mau-hong-hoa-nhi-chat-mat-dep-hang-dep-gia-re-p129495698.html?spid=129495704,25,,,thoitrangbau
,,https://tiki.vn/vay-bau-thoi-trang-thu-dong-dep-40-70kg-p129496505.html?spid=129496534,26,,,thoitrangbau
Vịt Phun Nước Bánh Xe Quay Đồ Chơi Cực Kỳ Hấp Dẫn Cho Bé,135.000₫,https://tiki.vn/vit-phun-nuoc-banh-xe-quay-do-choi-cuc-ky-hap-dan-cho-be-p198123627.html?spid=198123628,27,,Đã bán 6,thoitrangbau
Đồ bộ bầu chất đũi mát 40-70kg,168.000₫,https://tiki.vn/do-bo-bau-chat-dui-mat-40-70kg-p129494287.html?spid=129494301,28,,,thoitrangbau
QUẦN BẦU LÓT LÔNG THU ĐÔNG,99.000₫,https://tiki.vn/quan-bau-lot-long-thu-dong-p159241669.html?spid=159241675,29,,Đã bán 3,thoitrangbau
ĐỒ LÓT BẦU COMBO 2 ÁO 2 QUẦN BẦU KHÁNG KHUẨN CAO CẤP,149.000₫,https://tiki.vn/do-lot-bau-combo-2-ao-2-quan-bau-khang-khuan-cao-cap-p159241700.html?spid=159241741,30,,,thoitrangbau
,,https://tiki.vn/quan-bau-baggy-cong-so-chat-vai-umi-ong-dung-co-dap-bung-bigsize-quan-ao-bau-dep-mleeshop-p254903437.html?spid=254903441,31,,,thoitrangbau
Quần Tất Bầu | Quần Tất Cho Bà Bầu | Quần Tất Bà Bầu Mùa Thu Đông ,89.000₫,https://tiki.vn/quan-tat-bau-quan-tat-ba-bau-mua-thu-dong-p205233508.html?spid=205233509,32,,,thoitrangbau
"Đầm bầu big size, váy bầu size lớn cao cấp, váy đầm bầu nữ bigsize, MLEE SHOP",230.000₫,https://tiki.vn/dam-bau-big-size-vay-bau-size-lon-cao-cap-vay-dam-bau-nu-bigsize-mlee-shop-p254903471.html?spid=254903475,33,,,thoitrangbau
"Váy xông Sau Sinh, chân váy đi sinh loại cao cấp có chun chỉnh bụng",85.000₫,https://tiki.vn/vay-xong-sau-sinh-chan-vay-di-sinh-loai-cao-cap-co-chun-chinh-bung-p251755551.html?spid=251755553,34,,,thoitrangbau
QUẦN LÓT BẦU VÀ SAU SINH,45.000₫,https://tiki.vn/quan-lot-bau-va-sau-sinh-p159241972.html?spid=159242011,35,,,thoitrangbau
,,https://tiki.vn/quan-bau-jean-dang-om-mai-rach-sang-mau-qbn1213-p113192277.html?spid=113192285,36,,,thoitrangbau
QUẦN BẦU HÈ THU CHẤT VẢI PHONG CÁCH CÔNG SỞ TRẺ TRUNG QBN1225,355.000₫,https://tiki.vn/quan-bau-he-thu-chat-vai-phong-cach-cong-so-tre-trung-qbn1225-p113125508.html?spid=113125514,37,,,thoitrangbau
Áo bầu thu đông áo bầu len dáng dài ABL85,320.000₫,https://tiki.vn/ao-bau-thu-dong-ao-bau-len-dang-dai-abl85-p141582451.html?spid=141582453,38,,,thoitrangbau
Chân váy bầu thu đông xòe QBN1038,355.000₫,https://tiki.vn/chan-vay-bau-thu-dong-xoe-qbn1038-p126915440.html?spid=126915448,39,,,thoitrangbau
Áo bầu thu đông áo bầu dáng dài len ABL42,290.000₫,https://tiki.vn/ao-bau-thu-dong-ao-bau-dang-dai-len-abl42-p141526437.html?spid=141526438,40,,,thoitrangbau
