title,price,link_item,index,discount,sales,category
Bột Thông Cống Sumo Hộp (175g),35.000₫,https://tiki.vn/bot-thong-cong-sumo-hop-175g-p3265075.html?spid=75409552,1,-1%,Đã bán 581,chamsocnhacua
Bột Giặt Lix Extra Hương Hoa 6Kg EB006 - Tẩy Sạch Vết Bẩn Cực Mạnh,130.000₫,https://tiki.vn/bot-giat-lix-extra-huong-hoa-6kg-eb006-tay-sach-vet-ban-cuc-manh-p50256265.html?spid=78956325,2,-15%,Đã bán 34,chamsocnhacua
"SÁP THƠM CHÍNH HÃNG FITIS ,sáp đuổi côn trùng khử mùi kháng khuẩn",15.000₫,https://tiki.vn/sap-thom-chinh-hang-fitis-sap-duoi-con-trung-khu-mui-khang-khuan-p171047242.html?spid=171047243,3,-7%,Đã bán 30,chamsocnhacua
Hộp viên giặt xả MaxKleen 2 trong 1 hương Huyền diệu (20 viên/ hộp),105.000₫,https://tiki.vn/hop-vien-giat-xa-maxkleen-2-trong-1-huong-huyen-dieu-20-vien-hop-p270484224.html?spid=270484225,4,-8%,Đã bán 4,chamsocnhacua
Nước gel tẩy bồn cầu VIM xanh biển diệt khuẩn hương dịu nhẹ chai 880ml,38.000₫,https://tiki.vn/nuoc-gel-tay-bon-cau-vim-xanh-bien-diet-khuan-huong-diu-nhe-chai-880ml-p199947407.html?spid=199947410,5,-12%,Đã bán 20,chamsocnhacua
Bột rửa bát - Ly Somat 1.2kg - Đức,202.900₫,https://tiki.vn/bot-rua-bat-ly-somat-1-2kg-duc-p205293846.html?spid=56991293,6,-55%,Đã bán 156,chamsocnhacua
Miếng keo dán chuột Siêu Dính (có mồi) An toàn khi sử dụng,19.800₫,https://tiki.vn/mieng-keo-dan-chuot-sieu-dinh-co-moi-an-toan-khi-su-dung-p222557212.html?spid=222557214,7,-12%,Đã bán 12,chamsocnhacua
"Dầu gội Dược liệu Nguyên Xuân xanh (Dưỡng tóc, phục hồi hư tổn) 200ml",72.000₫,https://tiki.vn/dau-goi-duoc-lieu-nguyen-xuan-xanh-duong-toc-phuc-hoi-hu-ton-p157168453.html?spid=157168454,8,-10%,Đã bán 6,chamsocnhacua
Nước rửa chén Gift Natural Cám Gạo & Collagen _ Dịu nhẹ và nuôi dưỡng da tay,102.000₫,https://tiki.vn/nuoc-rua-chen-gift-natural-cam-gao-collagen-_-diu-nhe-va-nuoi-duong-da-tay-p134242966.html?spid=272117858,9,-23%,Đã bán 4,chamsocnhacua
Combo 2 Hộp viên giặt xả MaxKleen 2 trong 1 hương Huyền diệu (20 viên/ hộp),195.000₫,https://tiki.vn/combo-2-hop-vien-giat-xa-maxkleen-2-trong-1-huong-huyen-dieu-20-vien-hop-p270484139.html?spid=270484140,10,-12%,Đã bán 3,chamsocnhacua
Gel Khử Mùi Bồn Cầu Gel Thơm Khử Trùng Bồn Cầu Dạng Thạch Hình Bông Hoa Với 7 Mùi Thơm Cho Toilet,13.500₫,https://tiki.vn/gel-khu-mui-bon-cau-gel-thom-khu-trung-bon-cau-dang-thach-hinh-bong-hoa-voi-7-mui-thom-cho-toilet-p198254530.html?spid=198254549,11,-5%,Đã bán 13,chamsocnhacua
Nước rửa chén Sunlight Muối khoáng và Lô hội Can 3.6L,109.000₫,https://tiki.vn/nuoc-rua-chen-sunlight-muoi-khoang-va-lo-hoi-can-3-6l-p137480180.html?spid=137480185,12,-29%,Đã bán 21,chamsocnhacua
Túi Thơm Hương Quế Treo Tủ Quần Áo 100% Hương Tự Nhiên Hapaku,20.000₫,https://tiki.vn/tui-thom-huong-que-treo-tu-quan-ao-100-huong-tu-nhien-hapaku-p248523373.html?spid=248523374,13,-15%,Đã bán 43,chamsocnhacua
Nước Giặt Hữu Cơ Eco-Enzyme FUWA3E Chiết Xuất Từ Dứa An Toàn Cho Da Bảo Vệ Trẻ Em Tốt Cho Sức Khỏe Môi Trường,348.000₫,https://tiki.vn/nuoc-giat-huu-co-eco-enzyme-fuwa3e-chiet-xuat-tu-dua-an-toan-cho-da-bao-ve-tre-em-tot-cho-suc-khoe-moi-truong-p215811362.html?spid=215811366,14,-38%,,chamsocnhacua
SÁP THƠM ĐUỔI MUỖI CHỐNG MUỖI CỰC HIỆU QUẢ THÁI LAN ĐỦ MÀU,54.000₫,https://tiki.vn/sap-thom-duoi-muoi-chong-muoi-cuc-hieu-qua-thai-lan-du-mau-p104850029.html?spid=193002865,15,,Đã bán 34,chamsocnhacua
"Máy xịt thơm phòng tự động, xịt thơm phòng JD001, hương thơm dịu nhẹ, pin liền 500mAh, lưu hương 30 ngày",184.000₫,https://tiki.vn/may-xit-thom-phong-tu-dong-xit-thom-phong-bo-home-decor-jd001-huong-thom-diu-nhe-pin-lien-500mah-luu-huong-30-ngay-p263327493.html?spid=263327501,16,,Đã bán 51,chamsocnhacua
Nước Giặt Ariel Matic Hương Downy Thơm Dài Lâu 3.9kg/túi,199.000₫,https://tiki.vn/nuoc-giat-ariel-matic-huong-downy-thom-dai-lau-3-9kg-tui-p172997097.html?spid=172997099,17,,Đã bán 25,chamsocnhacua
Nước Giặt Bali,79.000₫,https://tiki.vn/nuoc-giat-bali-p208450232.html?spid=208450236,18,,,chamsocnhacua
Bột Giặt Tide HE Ultra Oxi Powder Laundry Detergent Original 7.1kg,943.920₫,https://tiki.vn/bot-giat-tide-he-ultra-oxi-powder-laundry-detergent-original-7-1kg-p270507642.html?spid=270507643,19,,,chamsocnhacua
"Túi Thơm Thảo Dược Treo Xe Hơi, Khử Mùi Xe, Hương Thơm Thư Giãn Hapaku - 1 Túi",105.000₫,https://tiki.vn/tui-thom-thao-duoc-treo-xe-hoi-khu-mui-xe-huong-thom-thu-gian-hapaku-p37488247.html?spid=37488249,20,,Đã bán 586,chamsocnhacua
Bình xịt tạo bọt tẩy rửa đa năng,40.000₫,https://tiki.vn/binh-xit-tao-bot-tay-rua-da-nang-p181926098.html?spid=181926099,21,,Đã bán 8,chamsocnhacua
"Combo 5 Viên Gỗ Long Não Khử Mùi Hút Ẩm , Đuổi Côn Trùng Hiệu Quả Siêu Tiện Dụng An Toàn Cho Sức Khoẻ",6.900₫,https://tiki.vn/combo-5-vien-go-long-nao-khu-mui-hut-am-duoi-con-trung-hieu-qua-sieu-tien-dung-an-toan-cho-suc-khoe-p247448290.html?spid=247448297,22,,Đã bán 13,chamsocnhacua
Chai xịt đuổi chuột gián và côn trùng hiệu quả cao cho ô tô nhà ở an toàn từ thiên nhiên,22.000₫,https://tiki.vn/chai-xit-duoi-chuot-gian-va-con-trung-hieu-qua-cao-cho-o-to-nha-o-an-toan-tu-thien-nhien-p220661539.html?spid=253253726,23,,,chamsocnhacua
Combo 2 Túi Nước Giặt Xả MaxKleen Thiên Nhiên Hương Vườn Hoa Thanh Khiết 2.2kg,264.000₫,https://tiki.vn/combo-2-tui-nuoc-giat-xa-maxkleen-thien-nhien-huong-vuon-hoa-thanh-khiet-2-2kg-p217266604.html?spid=217266605,24,,Đã bán 7,chamsocnhacua
Bột Giặt LIX Extra Hương Nước Hoa 5.5Kg EH554 - Tăng Gấp Đôi Sức Mạnh Giặt Tẩy,139.000₫,https://tiki.vn/bot-giat-lix-extra-huong-nuoc-hoa-5-5kg-eh055-tang-gap-doi-suc-manh-giat-tay-p189990461.html?spid=189990462,25,,Đã bán 149,chamsocnhacua
Thùng 3 Can Nước Lau Sàn Sunlight Hương Hoa Thiên Nhiên 3.6kg x3,239.000₫,https://tiki.vn/thung-3-can-nuoc-lau-san-sunlight-huong-hoa-thien-nhien-3-6kg-x3-p254188770.html?spid=254188772,26,,Đã bán 1,chamsocnhacua
Nước rửa rau quả và chén bát diệt khuẩn cao cấp trà xanh LION 1000ml Hàn Quốc,99.000₫,https://tiki.vn/nuoc-rua-rau-qua-va-chen-bat-diet-khuan-cao-cap-tra-xanh-lion-1000ml-han-quoc-p84712697.html?spid=84712698,27,,Đã bán 15,chamsocnhacua
Muối rửa chén bát Alio somat chuyên dùng cho máy,99.000₫,https://tiki.vn/muoi-rua-chen-bat-alio-somat-chuyen-dung-cho-may-p121326867.html?spid=141655666,28,,Đã bán 1,chamsocnhacua
"THÙNG 30 GÓI GIẤY RÚT CẦU VỒNG, GIẤY RÚT GẤU TRÚC MYLAN 3 LỚP",199.000₫,https://tiki.vn/thung-30-goi-giay-rut-cau-vong-giay-rut-gau-truc-mylan-3-lop-p170857548.html?spid=170857550,29,,Đã bán 4,chamsocnhacua
Nước Tẩy Đa Năng Kháng Khuẩn Mao Bao 600ml,44.000₫,https://tiki.vn/nuoc-tay-da-nang-khang-khuan-mao-bao-600ml-p576239.html?spid=4486209,30,,Đã bán 512,chamsocnhacua
Sáp Thơm Phòng Renuzit,39.000₫,https://tiki.vn/sap-thom-phong-renuzit-forever-raspberry-198g-p38382441.html?spid=39377367,31,,Đã bán 1.3k,chamsocnhacua
Nước tẩy quần áo On1 màu hương Tropical Blossom 800g N7601 khử mùi hôi ẩm mốc lưu hương thơm mát - Lixco Việt Nam,46.550₫,https://tiki.vn/nuoc-tay-quan-ao-on1-mau-huong-tropical-blossom-800g-n7601-khu-mui-hoi-am-moc-luu-huong-thom-mat-lixco-viet-nam-p222000723.html?spid=222000727,32,,Đã bán 23,chamsocnhacua
THUỐC LÂY NHIỄM DIỆT MỐI TẬN GỐC PMC 90 - 80GR - SẢN PHẨM CÔNG TY 111 LÁNG HẠ,120.000₫,https://tiki.vn/thuoc-lay-nhiem-diet-moi-tan-goc-pmc-90-80gr-chinh-hang-cong-ty-111-lang-ha-p270808155.html?spid=270808156,33,,Đã bán 2,chamsocnhacua
Nước giặt LIX Đậm đặc (Đỏ) tẩy sạch vết bẩn cực mạnh túi 3.5KGX2,189.000₫,https://tiki.vn/nuoc-giat-lix-dam-dac-do-tay-sach-vet-ban-cuc-manh-tui-3-5kgx2-p87378153.html?spid=87378154,34,,Đã bán 86,chamsocnhacua
Combo 3 Túi Viên Giặt Xả Đa Năng 4 Trong 1 KA Universal (40 Viên/ Túi),1.107.000₫,https://tiki.vn/combo-3-tui-vien-giat-xa-da-nang-4-trong-1-ka-universal-40-vien-tui-p179512955.html?spid=179512956,35,,Đã bán 9,chamsocnhacua
Giấy Ăn Gấu Trúc Cao Cấp Siêu Dai MINIIN - Giấy Rút Sợi Tre An Toàn Không Chất Tẩy Trắng,22.100₫,https://tiki.vn/giay-an-gau-truc-cao-cap-sieu-dai-miniin-giay-rut-soi-tre-an-toan-khong-chat-tay-trang-p171812394.html?spid=171812398,36,,Đã bán 58,chamsocnhacua
05 gói Thuốc diệt ruồi TOPFLY 10WG THU HÚT MẠNH – DIỆT RUỒI NHANH ( Gói 20g),240.000₫,https://tiki.vn/05-goi-thuoc-diet-ruoi-topfly-10wg-thu-hut-manh-diet-ruoi-nhanh-goi-20g-p190608208.html?spid=190608209,37,,Đã bán 1,chamsocnhacua
Nước tẩy rửa đa năng Enzym Bồ Hòn can dung tích 5l,468.000₫,https://tiki.vn/nuoc-tay-rua-da-nang-enzym-bo-hon-can-dung-tich-5l-p127052256.html?spid=127052259,38,,Đã bán 7,chamsocnhacua
"Bột Thông Cống yuhao, thông tắc bồn cầu, bồn rửa bát",12.999₫,https://tiki.vn/product-p91389760.html?spid=175875453,39,,Đã bán 26,chamsocnhacua
Nước xịt đa năng hữu cơ Bồ hòn và Tinh dầu Sả Chanh 500ml thương hiệu Ecocare,75.000₫,https://tiki.vn/nuoc-xit-da-nang-huu-co-bo-hon-va-tinh-dau-sa-chanh-500ml-thuong-hieu-ecocare-p50943158.html?spid=50943159,40,,Đã bán 201,chamsocnhacua
