title,price,link_item,index,discount,sales,category
Áo hoodie nam nữ màu y hình,125.000₫,https://tiki.vn/ao-hoodie-nam-nu-mau-y-hinh-p272420850.html?spid=272420852,1,-11%,,aohoodie
Áo hoodie màu y hình,135.000₫,https://tiki.vn/ao-hoodie-mau-y-hinh-p272293620.html?spid=272293622,2,-11%,,aohoodie
"Áo Hoodie GẤU empathy siêu kute Form Rộng Nỉ Bông Dáng Oversize Nam Nữ Unisex, áo khoác hoodie Nỉ GẤU EM cực đẹp mềm mịn chất thun thoáng mát nón to chống nắng",135.000₫,https://tiki.vn/ao-hoodie-gau-empathy-sieu-kute-form-rong-ni-bong-dang-oversize-nam-nu-unisex-ao-khoac-hoodie-ni-gau-em-cuc-dep-mem-min-chat-thun-thoang-mat-non-to-chong-nang-p271271978.html?spid=271271990,3,-30%,,aohoodie
Áo hoodie nam,115.000₫,https://tiki.vn/ao-hoodie-nam-p273688891.html?spid=273688893,4,,,aohoodie
Áo hoodie màu bất đối xứng story Mã: NT2122,220.000₫,https://tiki.vn/ao-hoodie-mau-bat-doi-xung-story-ma-nt2122-xanh-la-p35498600.html?spid=35733141,5,,,aohoodie
"Khăn quàng đeo cổ giữ ấm mùa đông, thoáng mát mùa hạ",85.000₫,https://tiki.vn/khan-quang-deo-co-giu-am-mua-dong-thoang-mat-mua-ha-p229967065.html?spid=229967069,6,,,aohoodie
Bộ Quần Áo Nỉ Thể Thao SOCS1997,295.000₫,https://tiki.vn/bo-quan-ao-ni-the-thao-socs1997-p268507430.html?spid=268507451,7,,,aohoodie
"Áo hoodie nam nữ form rộng Unisex HOLD, Áo sweater cặp đôi nỉ có mũ",136.000₫,https://tiki.vn/ao-hoodie-nam-nu-form-rong-unisex-hold-ao-sweater-cap-doi-ni-co-mu-p273651699.html?spid=273651711,8,,,aohoodie
Áo nỉ bông dài tay unisex lông cừu sIêu ấm dstudio,89.250₫,https://tiki.vn/ao-ni-bong-dai-tay-unisex-long-cuu-sieu-am-dstudio-p167220918.html?spid=167220942,9,,,aohoodie
ÁO HOODIES NAM FORM RỘNG Y NHƯ HÌNH,79.000₫,https://tiki.vn/ao-hoodies-nam-form-rong-y-nhu-hinh-p114329686.html?spid=115200448,10,,,aohoodie
Áo hoodies sweater phản quang có mũ cực đẹp dành cho nam nữ siêu hot MỚI NHẤT HIỆN NAY,158.000₫,https://tiki.vn/ao-hoodies-sweater-phan-quang-co-mu-cuc-dep-danh-cho-nam-nu-sieu-hot-moi-nhat-hien-nay-p151844673.html?spid=151845911,11,,,aohoodie
Áo nỉ bông gân tăm unisex lông cừu sIêu ấm dstudio,89.250₫,https://tiki.vn/ao-ni-bong-gan-tam-unisex-long-cuu-sieu-am-dstudio-p167162551.html?spid=167162599,12,,,aohoodie
Áo hoodies sweater phản quang siêu hot cực đẹp nam nữ đều mặc được MỚI NHẤT HIỆN NAY,158.000₫,https://tiki.vn/ao-hoodies-sweater-phan-quang-sieu-hot-cuc-dep-nam-nu-deu-mac-duoc-moi-nhat-hien-nay-p151844898.html?spid=151846518,13,,,aohoodie
ÁO HOODIE STAY AWAY BEAR - In Pet Siêu Bền Siêu Đẹp - Full Size Full Màu (HD4200 - Kèm Ảnh Thật) (TONI SHOP),179.000₫,https://tiki.vn/ao-hoodie-stay-away-bear-in-pet-sieu-ben-sieu-dep-full-size-full-mau-hd4200-kem-anh-that-toni-shop-p263312922.html?spid=263313134,14,,,aohoodie
Áo Khoác Hoodie Trơn(Nỉ Bông),159.000₫,https://tiki.vn/ao-khoac-hoodie-tron-ni-bong-p160400051.html?spid=160400136,15,,,aohoodie
Áo hoodie trơn cá tính DTR0919,158.000₫,https://tiki.vn/ao-hoodie-tron-ca-tinh-dtr0919-p160400160.html?spid=160400246,16,,,aohoodie
Áo khoác Hoodie phối cực Chất GA1,195.000₫,https://tiki.vn/ao-khoac-hoodie-phoi-cuc-chat-ga1-p6348617.html?spid=44295041,17,,Đã bán 4,aohoodie
Bộ nỉ ALIGRO cổ tròn màu navy BN.11,595.000₫,https://tiki.vn/bo-ni-aligro-co-tron-mau-navy-bn-11-p213495531.html?spid=213495537,18,,,aohoodie
"Áo khoác Jujutsu Kaisen, Áo Hoodie Anime in hình Gojo Satoru",78.000₫,https://tiki.vn/ao-khoac-jujutsu-kaisen-ao-hoodie-anime-in-hinh-gojo-satoru-p263320736.html?spid=263321519,19,,,aohoodie
TOP 4 ÁO HOODIE ONE PIECE cực đẹp in hình Luffy - Zoro - Ace OP độc đẹp giá siêu rẻ,169.000₫,https://tiki.vn/top-4-ao-hoodie-one-piece-cuc-dep-in-hinh-luffy-zoro-ace-op-doc-dep-gia-sieu-re-p263459020.html?spid=263459056,20,,,aohoodie
"Áo Hoodie One Piece, Áo in hình Luffy Gear 5 Nika cực chất",78.000₫,https://tiki.vn/ao-hoodie-one-piece-ao-in-hinh-luffy-gear-5-nika-cuc-chat-p263320410.html?spid=263320761,21,,,aohoodie
áo nỉ hoodie số 22 mác 9088,220.000₫,https://tiki.vn/ao-ni-hoodie-so-22-mac-9088-p192379719.html?spid=192379733,22,,,aohoodie
"áo nỉ hoodie bàn cờ - 3(be nhạt),freesize dưới 65kg",252.000₫,https://tiki.vn/ao-ni-hoodie-ban-co-p192379830.html?spid=192379848,23,,,aohoodie
ÁO HOODIE CÓ ZIP - TEAM NA`VI,380.000₫,https://tiki.vn/ao-hoodie-co-zip-team-na-vi-p135602793.html?spid=135602811,24,,,aohoodie
HOODIE NAM NỮ H18 - LOVE,335.000₫,https://tiki.vn/hoodie-nam-nu-h18-love-p102048314.html?spid=102048332,25,,,aohoodie
Áo nỉ mũ cam mắt X HS6,516.000₫,https://tiki.vn/ao-ni-mu-cam-mat-x-hs6-p158474251.html?spid=158474256,26,,,aohoodie
Áo hoodie Nâu 4 sọc tay mác túi H2A,510.000₫,https://tiki.vn/ao-hoodie-nau-4-soc-tay-mac-tui-h2a-p158493225.html?spid=158493228,27,,,aohoodie
ÁO HOODIE THIẾT KẾ NAM NỮ / XÁM ĐEN RÁP / AZIERLOCO,490.000₫,https://tiki.vn/ao-hoodie-thiet-ke-nam-nu-xam-den-rap-azierloco-p167980664.html?spid=167980672,28,,,aohoodie
ÁO HOODIE CÓ ZIP - TEAM CLOUD 9,380.000₫,https://tiki.vn/ao-hoodie-co-zip-team-cloud-9-p135602278.html?spid=135602302,29,,,aohoodie
Áo hoodie Gungchi H2A,505.000₫,https://tiki.vn/ao-hoodie-gungchi-h2a-p158474286.html?spid=158474320,30,,,aohoodie
Áo khoác vải nỉ big size nam 80 tới 130kg,320.000₫,https://tiki.vn/ao-khoac-vai-ni-big-size-nam-80-toi-130kg-p205715636.html?spid=205715649,31,,Đã bán 1,aohoodie
ÁO “TVD DAIRY COWS LIQUID FULLZIP HOODIE,490.000₫,https://tiki.vn/ao-tvd-dairy-cows-liquid-fullzip-hoodie-p151764709.html?spid=151764718,32,,,aohoodie
Áo hoodie MAG DA6,495.000₫,https://tiki.vn/ao-hoodie-mag-da6-p158474490.html?spid=158474505,33,,,aohoodie
Áo Sweater TireTrack Tay Dài 2 màu Đen Và Beige Nỉ Cotton - HIGHCLUB,510.000₫,https://tiki.vn/ao-sweater-tiretrack-tay-dai-2-mau-den-va-beige-ni-cotton-highclub-p193719952.html?spid=193719995,34,,,aohoodie
Áo nỉ mũ ENJOI HS6,516.000₫,https://tiki.vn/ao-ni-mu-enjoi-hs6-p158494017.html?spid=158494035,35,,,aohoodie
Áo hoodie logo chữ trắng DA6,495.000₫,https://tiki.vn/ao-hoodie-logo-chu-trang-da6-p158474722.html?spid=158474728,36,,,aohoodie
áo nỉ hoodie chữ bụng 2 mũ,224.000₫,https://tiki.vn/ao-ni-hoodie-chu-bung-2-mu-p192382099.html?spid=192382126,37,,,aohoodie
Áo Sweater Unisex TeeHolic Logo In Phồng Nổi THS.SG Màu Đen Trắng,249.000₫,https://tiki.vn/ao-sweater-unisex-teeholic-logo-in-phong-noi-ths-sg-mau-den-trang-p175836058.html?spid=175836091,38,,,aohoodie
Hoodie vải Lông Cừu OhNil,480.000₫,https://tiki.vn/hoodie-vai-long-cuu-ohnil-p134384547.html?spid=134384589,39,,,aohoodie
Áo hoodie Cotton XXL H2A,511.000₫,https://tiki.vn/ao-hoodie-cotton-xxl-h2a-p158494006.html?spid=158494012,40,,,aohoodie
