title,price,link_item,index,discount,sales,category
Màng Lọc Ro Rotex 75g - Dùng Cho Máy Lọc Nước Ro,117.000₫,https://tiki.vn/mang-loc-ro-rotex-75g-dung-cho-may-loc-nuoc-ro-p214909167.html?spid=214909168,1,-18%,Đã bán 12,thietbigiadinh
Máy cạo râu 3 lưỡi Panasonic ES-SL41-S453 - Hàng Chính Hãng,1.395.000₫,https://tiki.vn/may-cao-rau-3-luoi-panasonic-es-sl41-s453-hang-chinh-hang-p44682283.html?spid=255223516,2,-23%,Đã bán 161,thietbigiadinh
Máy lọc không khí xông tinh dầu Levoit LV-H128 - Hàng chính hãng,1.190.000₫,https://tiki.vn/may-loc-khong-khi-xong-tinh-dau-levoit-lv-h128-hang-chinh-hang-p272162972.html?spid=272162973,3,,Đã bán 1,thietbigiadinh
Máy Lọc Không Khí Xiaomi Mi Air Purifier 4 Pro Hàng chính hãng,990.000,https://tiki.vn/may-loc-khong-khi-xiaomi-mi-air-purifier-4-pro-hang-chinh-hang-p206561068.html?spid=206561070,4,-23%,,thietbigiadinh
,,https://tiki.vn/may-hut-am-stadler-form-albert-20l-hang-chinh-hang-p16616688.html?spid=253635586,5,-51%,,thietbigiadinh
"Tông đơ cắt tóc không dây Kemei KM-809A có màn hình LCD tiện dụng, có thể cắm điện trực tiếp",229.000₫,https://tiki.vn/tong-do-cat-toc-khong-day-kemei-km-809a-co-man-hinh-lcd-tien-dung-co-the-cam-dien-truc-tiep-p73628813.html?spid=104089625,6,,Đã bán 40,thietbigiadinh
Quạt Điện Đứng Senko L1638 - Công Suất 47W - Được Chọn Màu Tùy Thích - Hàng Chính Hãng,360.000₫,https://tiki.vn/quat-dien-dung-senko-l1638-cong-suat-47w-duoc-chon-mau-tuy-thich-hang-chinh-hang-p154155186.html?spid=154155196,7,,Đã bán 44,thietbigiadinh
"Máy Lọc Không Khí Cảm Biến, Tạo Ion Cho Diện Tích 50m2 Nagakawa NAG3502M - Hàng Chính Hãng",4.019.000₫,https://tiki.vn/may-loc-khong-khi-cam-bien-tao-ion-cho-dien-tich-50m2-nagakawa-nag3502m-hang-chinh-hang-p101502997.html?spid=101502998,8,-29%,Đã bán 21,thietbigiadinh
Quạt trần đảo chuyển hướng cơ Senko TD105 - Hàng chính hãng,405.000,https://tiki.vn/quat-tran-dao-chuyen-huong-co-senko-td105-hang-chinh-hang-p198530747.html?spid=270714802,9,-47%,,thietbigiadinh
,,https://tiki.vn/may-loc-khong-khi-sharp-fp-j60e-w-38w-hang-chinh-hang-p10131463.html?spid=191484136,10,-30%,,thietbigiadinh
"Quạt Hơi Nước Mini, Quạt Phun Sương Mini Tạo Ẩm Làm Mát Để Bàn",99.000₫,https://tiki.vn/quathoi-nuoc-mini-quat-phun-suong-mini-tao-am-lam-mat-de-ban-p252591735.html?spid=257847338,11,,Đã bán 5,thietbigiadinh
MÁY BẤM XÙ TÓC ĐA NĂNG TOKYO BẢN TO CỦA NHẬT,260.000,https://tiki.vn/may-bam-xu-toc-da-nang-tokyo-ban-to-cua-nhat-p111857940.html?spid=111857945,12,,,thietbigiadinh
,,https://tiki.vn/may-say-toc-dryer-philips-hp8108-p178462960.html?spid=178462961,13,-50%,,thietbigiadinh
Máy Hút Bụi Nệm Giường Cao Cấp Deerma CM818 - Hàng Nhập Khẩu,699.000₫,https://tiki.vn/may-hut-bui-nem-giuong-cao-cap-deerma-cm818-hang-nhap-khau-p160889219.html?spid=160889220,14,-38%,Đã bán 11,thietbigiadinh
Máy Sấy Tóc Công Nghệ Ion Âm SAMONO Không gây hư tóc Quạt gió mạnh mẽ Tiếng Ồn Thấp Công Suất 900W SW-HD900 HÀNG CHÍNH HÃNG BH 12 THÁNG,2.399.000₫,https://tiki.vn/may-say-toc-cong-nghe-ion-am-samono-khong-gay-hu-toc-quat-gio-manh-me-tieng-on-thap-cong-suat-900w-sw-hd900-hang-chinh-hang-bh-12-thang-p273407778.html?spid=273407782,15,-14%,,thietbigiadinh
Máy lọc nước Karofi KAQ-U98 tích hợp công nghệ Aiotec - Hàng chính hãng,5.873.000₫,https://tiki.vn/may-loc-nuoc-karofi-kaq-u98-tich-hop-cong-nghe-aiotec-hang-chinh-hang-p272302799.html?spid=272302864,16,,,thietbigiadinh
Đầu Hút Dyson Soft Roller Cleaner Head - Hàng Chính Hãng,3.650.000,https://tiki.vn/dau-hut-dyson-soft-roller-cleaner-head-hang-chinh-hang-p48167597.html?spid=48167598,17,-20%,,thietbigiadinh
,,https://tiki.vn/may-say-toc-bo-sung-ion-am-showsee-a1-1800w-cao-cap-chong-xu-roi-kho-toc-hang-chinh-hang-p175173294.html?spid=175173299,18,-37%,,thietbigiadinh
"Máy Hút Ẩm XIAOMI NEW WIDETECH 18L Cảm Ứng Hiển Thị Thông Số Có Kết Nối App Dung Tích 18 Lít Phù Hợp Không Gian 50 m2, Công Suất 240 W - Hàng Chính Hãng",4.499.000₫,https://tiki.vn/may-hut-am-xiaomi-new-widetech-cam-ung-hien-thi-thong-so-co-ket-noi-app-dung-tich-18-lit-phu-hop-khong-gian-50-m2-cong-suat-240-w-hang-chinh-hang-p249747302.html?spid=196808027,19,-49%,Đã bán 9,thietbigiadinh
Máy uốn tóc tự động xoay 360 VIVID VOGUE thông minh cao cấp Máy làm xoăn tóc mini tự động,134.000₫,https://tiki.vn/may-uon-toc-tu-dong-xoay-360-vivid-vogue-thong-minh-cao-cap-may-lam-xoan-toc-mini-tu-dong-p141131247.html?spid=239130993,20,,Đã bán 2,thietbigiadinh
Quạt để bàn văn phòng Mini Rhino F101 tích điện 3 chế độ gió hình bán nguyệt - Hàng chính hãng,149.000₫,https://tiki.vn/quat-de-ban-van-phong-mini-rhino-f101-tich-dien-3-che-do-gio-hinh-ban-nguyet-p248543725.html?spid=248543727,21,,Đã bán 4,thietbigiadinh
"Máy lọc nước nóng lạnh 10 lõi lọc, Karofi KAD-N69, Màng RO 100GPD Mỹ - Hàng Chính Hãng - Miễn Phí Lắp Đặt Toàn Quốc",12.065.800₫,https://tiki.vn/may-loc-nuoc-nong-lanh-10-loi-loc-karofi-kad-n69-mang-ro-100gpd-my-hang-chinh-hang-mien-phi-lap-dat-toan-quoc-p173177112.html?spid=173177113,22,,Đã bán 18,thietbigiadinh
Robot Hút Bụi Và Lau Nhà TP-Link Tapo RV30C Mop / RV30C Mop Plus Điều Hướng LiDar & Gyro Công Suất 4200Pa - Hàng Chính Hãng,9.899.000₫,https://tiki.vn/robot-hut-bui-va-lau-nha-tp-link-tapo-rv30c-mop-rv30c-mop-plus-dieu-huong-lidar-gyro-cong-suat-4200pa-hang-chinh-hang-p273448956.html?spid=273449081,23,,Đã bán 1,thietbigiadinh
Bàn ủi khô Philips HD1172/01- HÀNG CHÍNH HÃNG,315.000₫,https://tiki.vn/ban-ui-kho-philips-hd1172-01-hang-chinh-hang-p213866788.html?spid=213866789,24,,Đã bán 9,thietbigiadinh
MÁY LỌC KHÔNG KHÍ HAKAWA HK-K3 - HÀNG CHÍNH HÃNG,3.764.000,https://tiki.vn/may-loc-khong-khi-hakawa-hk-k3-hang-chinh-hang-p115992865.html?spid=115992866,25,,,thietbigiadinh
,,https://tiki.vn/quat-tran-panasonic-f-60mz2-12inch-hang-chinh-hang-p637371.html?spid=19742178,26,,,thietbigiadinh
"Quạt trần dành cho Trần Nhà THẤP 52DY-110BK - Quạt trần Hiện Đại sang trọng, tinh tế lắp đặt phòng khách, phòng ngủ",3.885.400₫,https://tiki.vn/quat-tran-danh-cho-tran-nha-thap-52dy-110bk-quat-tran-hien-dai-sang-trong-tinh-te-lap-dat-phong-khach-phong-ngu-p86631213.html?spid=86631222,27,,Đã bán 9,thietbigiadinh
Pin máy khâu bao cầm tay dùng cho dòng máy khâu bao pin nhỏ,340.000₫,https://tiki.vn/pin-may-khau-bao-cam-tay-dung-cho-dong-may-khau-bao-pin-nho-p192879534.html?spid=192879538,28,,,thietbigiadinh
"Màng lọc RO thay cho máy lọc nước Kangaroo, karofi và các máy trên thị trường - Chính hãng",230.000₫,https://tiki.vn/mang-loc-ro-thay-cho-may-loc-nuoc-kangaroo-karofi-va-cac-may-tren-thi-truong-chinh-hang-p54071296.html?spid=54071297,29,,Đã bán 91,thietbigiadinh
MÁY HÚT BỤI NỆM UV HONS HSBC-2100 - HÀNG NHẬP KHẨU CHÍNH HÃNG,1.650.000,https://tiki.vn/may-hut-bui-nem-uv-hons-hsbc-2100-hang-nhap-khau-chinh-hang-p73175487.html?spid=73175489,30,,,thietbigiadinh
,,https://tiki.vn/robot-lau-nha-the-he-moi-lau-nha-va-hut-bui-p16881605.html?spid=271303170,31,,,thietbigiadinh
Tủ sấy quần áo Sunhouse SHD2702 - Hàng chính hãng,925.850₫,https://tiki.vn/tu-say-quan-ao-sunhouse-shd2702-p217200734.html?spid=273353443,32,,,thietbigiadinh
"Quạt tích điện mini Sunhouse SHD7111, Công suất 7W, Có thể hoạt động liên tục 2-4.5 giờ, Hàng chính hãng - Bảo hành 12 tháng",289.000₫,https://tiki.vn/quat-tich-dien-mini-sunhouse-shd7111-cong-suat-7w-co-the-hoat-dong-lien-tuc-2-4-5-gio-bao-hanh-12-thang-p263293432.html?spid=263293434,33,,Đã bán 1,thietbigiadinh
"Quạt mini để bàn 3 cấp độ gió, phát 10 màu ánh sáng Led, dây nguồn cắm USB tiện lợi và nhỏ gọn",128.000₫,https://tiki.vn/quat-mini-de-ban-3-cap-do-gio-phat-10-mau-anh-sang-led-day-cam-usb-p185097299.html?spid=185097303,34,,Đã bán 6,thietbigiadinh
"Máy sưởi dầu Sunhouse SHD7084, Công suất 2400W, 13 lá phát nhiệt, làm ấm nhanh, Có giàn phơi - Hàng chính hãng, bảo hành 12 tháng",1.890.000,https://tiki.vn/may-suoi-dausunhouse-shd7084-cong-suat-2400w-voi-13-la-phat-nhiet-lam-am-nhanh-co-gian-phoi-hang-chinh-hang-bao-hanh-12-thang-p273314780.html?spid=273314781,35,,,thietbigiadinh
,,https://tiki.vn/may-hut-bui-cam-tay-vua-thoi-vua-hut-tien-loi-p14697669.html?spid=59453368,36,,,thietbigiadinh
"FZ-F30HFE Màng lọc Hepa Sharp dành cho Sharp F30E-C, J30E-A/B, A28EV-W, GM30E-B, JM30V-B, F30EV-W - Hàng chính hãng",679.000₫,https://tiki.vn/fz-f30hfe-mang-loc-hepa-sharp-danh-cho-sharp-f30e-c-j30e-a-b-a28ev-w-gm30e-b-jm30v-b-f30ev-w-p186349434.html?spid=186349437,37,,Đã bán 2,thietbigiadinh
Quạt Bàn KDK A40B - Vàng - Hàng chính hãng,1.758.900₫,https://tiki.vn/quat-ban-kdk-a40b-vang-hang-chinh-hang-p367120.html?spid=12353288,38,,Đã bán 3,thietbigiadinh
"Máy hút bụi cầm tay không dây JETZT XS23, hàng chính hãng",990.000₫,https://tiki.vn/may-hut-bui-cam-tay-khong-day-jetzt-xs23-hang-chinh-hang-p270906060.html?spid=270906061,39,,Đã bán 5,thietbigiadinh
Máy cạo râu khô và ướt Series 7000 cao cấp Philips Norelco S7788 - Hàng Nhập Khẩu,4.072.000,https://tiki.vn/may-cao-rau-kho-va-uot-series-7000-cao-cap-philips-norelco-s7788-day-nguon-usb-tien-loi-hang-nhap-khau-p263645611.html?spid=263645612,40,,,thietbigiadinh
