title,price,link_item,index,discount,sales
"Kem tắm tẩy tế bào chết body Felina Home Spa từ bơ nghiền nguyên trái giúp da sạch sâu, ẩm mịn chỉ sau 1 lần dùng",105.000₫,https://tiki.vn/kem-tam-tay-te-bao-chet-body-felina-home-spa-tu-bo-nghien-nguyen-trai-giup-da-sach-sau-am-min-chi-sau-1-lan-dung-p262782533.html?spid=262782537,1,-54%,
Dầu Massage Body Biyokea Luxury - Feeling Oil (tạo cảm giác) - 1000ml,1.555.000₫,https://tiki.vn/dau-massage-body-biyokea-luxury-feeling-oil-tao-cam-giac-1000ml-p20074440.html?spid=20074441,2,-5%,Đã bán 5
Muối ngâm chân thảo dược Sinh Dược CAO CẤP giảm hôi chân lưu thông khí huyết ngủ ngon giảm stress - 550gram,229.000₫,https://tiki.vn/muoi-ngam-chan-thao-duoc-sinh-duoc-cao-cap-giam-hoi-chan-luu-thong-khi-huyet-ngu-ngon-giam-stress-550gram-p179754775.html?spid=179754779,3,-5%,Đã bán 42
"Cây cào lưng 3 chức năng: gãi lưng , đấm lưng , massage đầu, tay, chân, vai",22.000₫,https://tiki.vn/cay-cao-lung-3-chuc-nang-gai-lung-dam-lung-massage-dau-tay-chan-vai-p14377890.html?spid=69377862,4,-48%,Đã bán 52
,,https://tiki.vn/thao-duoc-xong-hoi-t-care-90gr-giai-cam-ha-sot-cai-thien-tuan-hoan-mau-giam-met-moi-cho-nguoi-moi-om-day-phu-nu-sau-sinh-bai-tru-doc-to-thanh-loc-co-the-p53559517.html?spid=53559520,5,-12%,
Sữa Tắm Hạt Ý Dĩ REIHAKU hatomugi Trắng Da Nội Địa Nhật 800ml,105.000₫,https://tiki.vn/sua-tam-hat-y-di-hatomugi-trang-da-noi-dia-nhat-800ml-p140537939.html?spid=140537940,6,-35%,Đã bán 16
Xịt Rửa Tay Khô Cao Cấp BIMUNICA Kháng Khuẩn Dành Cho Trẻ Sơ Sinh Và Trẻ Nhỏ - 100ml An Toàn Không Cồn,156.750₫,https://tiki.vn/xit-rua-tay-kho-cao-cap-bimunica-khang-khuan-danh-cho-tre-so-sinh-va-tre-nho-100ml-an-toan-khong-con-p192880132.html?spid=192880133,7,,Đã bán 11
"Kem Chống Nắng, Dưỡng Da Cao Cấp Dành Cho Nam - DABO FOR MEN BLACK UV FORCE TONE UP CREAM 50ML",315.000₫,https://tiki.vn/kem-chong-nang-duong-da-cao-cap-danh-cho-nam-dabo-for-men-black-uv-force-tone-up-cream-50ml-p269893295.html?spid=269893296,8,-26%,Đã bán 2
Bông Tắm Dạng Tròn Size 10*10cm Siêu Mềm Mịn Bông tắm tròn,9.000₫,https://tiki.vn/bong-tam-dang-tron-size-10-10cm-sieu-mem-min-bong-tam-tron-p124702849.html?spid=124702864,9,-10%,Đã bán 7
,,https://tiki.vn/dung-dich-nuoc-rua-tay-kho-sat-khuan-alfasept-pure-5l-hieu-qua-vi-sinh-99-vi-khuan-than-thien-voi-da-tay-p115701327.html?spid=115701328,10,-30%,
"Dầu nóng xoa bóp, dầu massage STARBALM 50ml",190.000₫,https://tiki.vn/dau-nong-xoa-bop-dau-massage-starbalm-50ml-p35611269.html?spid=192989898,11,-22%,Đã bán 6
Xà bông thiên nhiên than tre DEGO PHARMA 100G - Sáng Da Mờ Thâm,68.000₫,https://tiki.vn/xa-bong-thien-nhien-than-tre-dego-pharma-100g-sang-da-mo-tham-p168217882.html?spid=168217883,12,-30%,Đã bán 20
,,https://tiki.vn/kem-duong-da-chan-shea-butter-150ml-p23098587.html?spid=23098588,13,-30%,
Set quà tặng cao cấp WEILAIYA : Sữa tắm Hoa Hồng giúp Cấp ẩm và Trắng da - Hương nước hoa ngọt ngào quyến rũ,500.000₫,https://tiki.vn/set-qua-tang-cao-cap-weilaiya-sua-tam-hoa-hong-giup-cap-am-va-trang-da-huong-nuoc-hoa-ngot-ngao-quyen-ru-p273166759.html?spid=273166760,14,-9%,Đã bán 1
Sữa tắm tinh chất trà xanh Welcos Green Tea Body Cleanser 740ml + Móc khóa,185.000₫,https://tiki.vn/sua-tam-tinh-chat-tra-xanh-welcos-green-tea-body-cleanser-740ml-moc-khoa-p15777977.html?spid=15777978,15,-19%,Đã bán 43
"Set Cạo Lông Vùng Kín Tại Nhà Loli The Wolf Gồm Bọt Cạo Lông Vùng Kín 120ml + Kem Dưỡng Da Vùng Kín Sau Cạo 50ml, Tặng Kèm Dầu Gội (Xả) Weilaiya Minisize Ngẫu Nhiên",249.000₫,https://tiki.vn/set-cao-long-vung-kin-tai-nha-loli-the-wolf-gom-bot-cao-long-vung-kin-120ml-kem-duong-da-vung-kin-sau-cao-50ml-tang-kem-dau-goi-weilaiya-minisize-p180378786.html?spid=180378787,16,,Đã bán 4
Combo 2 chai Sữa tắm trắng da cánh hoa hồng Damask Weilaiya Grand Rose Extracts Whitening Shower Gel 450ml tặng 1 Bông tắm Weilaiya,650.000₫,https://tiki.vn/combo-2-chai-sua-tam-trang-da-canh-hoa-hong-damask-weilaiya-grand-rose-extracts-whitening-shower-gel-450ml-tang-1-bong-tam-weilaiya-p152837757.html?spid=152837758,17,-19%,Đã bán 53
,,https://tiki.vn/nuoc-hoa-tesori-d-oriente-hoa-sen-100ml-p49127601.html?spid=49127602,18,-24%,
Sữa tắm Weilaiya trắng da cánh hoa hồng Damask 450ml,388.000₫,https://tiki.vn/sua-tam-weilaiya-trang-da-canh-hoa-hong-damask-450ml-p192729628.html?spid=196002827,19,,Đã bán 5
Xà bông Nghệ Sinh Dược xà bông MẬT ONG NGHỆ xà bông tắm thảo mộc chiết xuất thiên nhiên lành tính,70.000₫,https://tiki.vn/xa-bong-nghe-sinh-duoc-xa-bong-mat-ong-nghe-xa-bong-tam-thao-moc-chiet-xuat-thien-nhien-lanh-tinh-ecob-p179754764.html?spid=179754767,20,,Đã bán 279
Sữa Tắm Tinh Dầu Nước Hoa Bettina Barty Bath And Shower Gel 500ml(Hàng nội địa Đức),185.000₫,https://tiki.vn/sua-tam-tinh-dau-nuoc-hoa-bettina-barty-bath-and-shower-gel-500ml-hang-noi-dia-duc-p173665560.html?spid=173665566,21,,Đã bán 13
Xà Phòng Leviter Tinh Dầu Oải Hương (100g),31.500₫,https://tiki.vn/xa-phong-leviter-tinh-dau-oai-huong-100g-p4055037.html?spid=4161445,22,,Đã bán 97
[Hàng Chính Hãng] Combo Sữa Tắm Thiên Nhiên Mềm Mịn Hoa Hồng Purité 850ml/chai + Sáng Mịn Hoa Anh Đào 850ml/chai,449.000₫,https://tiki.vn/hang-chinh-hang-combo-sua-tam-thien-nhien-mem-min-hoa-hong-purite-850ml-chai-sang-min-hoa-anh-dao-850ml-chai-p92567962.html?spid=114756087,23,,Đã bán 9
Sữa dưỡng thể làm trắng sáng da ACM Depiwhite Whitening Body Milk 200ml,315.000₫,https://tiki.vn/sua-duong-the-lam-trang-sang-da-acm-depiwhite-whitening-body-milk-200ml-p78912258.html?spid=78912259,24,,Đã bán 38
Sữa Tắm Trắng Da Lục Tảo Cao Cấp HAWON - 800ml,102.000₫,https://tiki.vn/sua-tam-trang-da-luc-tao-cao-cap-hawon-800ml-p269893365.html?spid=269893366,25,,Đã bán 1
,,https://tiki.vn/sua-tam-huong-moc-lan-chiet-xuat-thao-duoc-tinh-chat-the-he-moi-min-mang-sang-trong-tot-cho-lan-da-luu-huong-toi-4-gio-p262797352.html?spid=262797353,26,,
Date xa 2024 TPHCM Sữa tắm hương nước hoa On: The Body Perfume 2021 - thương hiệu Hàn Quốc - hương White Pearl,209.000₫,https://tiki.vn/date-xa-2024-tphcm-sua-tam-huong-nuoc-hoa-on-the-body-perfume-2021-thuong-hieu-han-quoc-huong-white-pearl-p143915832.html?spid=143915833,27,,Đã bán 12
Lăn khử mùi trắng da Enchanteur Charming/Sensation/Delightful/Romantic/Magic 50ml,72.000₫,https://tiki.vn/lan-khu-mui-trang-da-enchanteur-charming-sensation-delightful-romantic-magic-50ml-tang-sua-tam-enchanteur100gr-p72957917.html?spid=72957919,28,,Đã bán 955
Kem chống nắng HelioCare Water Gel 360 bản mới nhất 2022,490.000₫,https://tiki.vn/kem-chong-nang-heliocare-water-gel-360-ban-moi-nhat-2022-p193967749.html?spid=193967751,29,,Đã bán 6
Lăn khử mùi Old Spice Fresh 85g - USA,132.000₫,https://tiki.vn/lan-khu-mui-old-spice-fresh-85g-usa-p124037456.html?spid=124037457,30,,Đã bán 42
,,https://tiki.vn/3-tuyp-nakiz-lively-butt-kem-thoa-tham-mong-ben-nach-lung-nhu-hoa-dau-goi-cui-cho-thai-lan-p115146679.html?spid=115146680,31,,
Kem Chống Nắng Giảm Nám & Sạm Da ACM Depiwhite M Protective Cream SPF50+ 40ml,462.000₫,https://tiki.vn/kem-chong-nang-giam-nam-sam-da-acm-depiwhite-m-protective-cream-spf50-40ml-p130171981.html?spid=130171985,32,,Đã bán 27
Sữa Tắm Lux Botanicals Hương Phong Lan Quyến Rũ 570g (562ml),110.000₫,https://tiki.vn/sua-tam-lux-botanicals-huong-phong-lan-quyen-ru-570g-562ml-p270139573.html?spid=270139574,33,,Đã bán 2
"Thảo Dược Ngâm Chân FUROMI Giúp Giảm Đau Xương Khớp, Khử Mùi Hôi, Thư Giãn Tốt Cho Sức Khỏe Hộp 20 Túi Lọc",129.000₫,https://tiki.vn/tha-o-duo-c-ngam-chan-furomi-giup-giam-dau-xuong-kho-p-khu-mui-hoi-thu-gian-tot-cho-suc-khoe-hop-20-tui-loc-p10017915.html?spid=10017916,34,,Đã bán 133
Sữa tắm trắng và dưỡng ẩm Enchanteur Charming nồng nàn duyên dáng White Creamy Body Wash 650gr,170.000₫,https://tiki.vn/sua-tam-trang-va-duong-am-enchanteur-charming-nong-nan-duyen-dang-white-creamy-body-wash-650gr-p15944195.html?spid=15944196,35,,Đã bán 72
,,https://tiki.vn/sua-tam-olay-ultra-moisture-bo-hat-mo-duong-am-887ml-p272195201.html?spid=272195203,36,,
Xịt khử mùi nước hoa Enchanteur Charming nồng nàn duyên dáng ngăn mồ hôi & mùi cơ thể 150ml,89.000₫,https://tiki.vn/xit-khu-mui-nuoc-hoa-enchanteur-charming-nong-nan-duyen-dang-ngan-mo-hoi-mui-co-the-150ml-p15944204.html?spid=15944205,37,,Đã bán 557
NODOL - Dung Dịch Khử Mùi Cơ Thể 80ml,46.000₫,https://tiki.vn/nodol-dung-dich-khu-mui-co-the-80ml-p149253695.html?spid=149253696,38,,Đã bán 23
Sữa Dưỡng Ẩm Toàn Thân Và Da Mặt Cetaphil Moisturizing Lotion (200ml),304.000₫,https://tiki.vn/sua-duong-am-toan-than-va-da-mat-cetaphil-moisturizing-lotion-200ml-p39089019.html?spid=115226317,39,,Đã bán 42
Xà Bông Thiên Nhiên Hạt Mùi Già Cỏ Mềm An Toàn Lành Da Quà Tết Độc Đáo Hương Thơm Tất Niên Hoàn Toàn Từ Thiên Nhiên 90g,180.000₫,https://tiki.vn/xa-bong-hat-mui-gia-co-mem-p16423415.html?spid=16423416,40,,Đã bán 111
