title,price,link_item,index,discount,sales,category
"Áo sơ mi form rộng kẻ sọc thời trang mặc đi làm, dạo phố - có nhiều size và màu, form dáng chuẩn",178.000₫,https://tiki.vn/ao-so-mi-form-rong-ke-soc-thoi-trang-mac-di-lam-dao-pho-co-nhieu-size-va-mau-form-dang-chuan-p105605500.html?spid=105605510,1,-50%,Đã bán 9,aonu
Áo Thun 3 Lỗ Sát Nách Thun Lạnh Nam Nữ,39.000₫,https://tiki.vn/ao-thun-3-lo-sat-nach-thun-lanh-nam-nu-p68940444.html?spid=271433967,2,,,aonu
Áo thun vặn trước VIEN TRAN V61S20H025-S2200,269.100₫,https://tiki.vn/ao-thun-van-truoc-vien-tran-v61s20h025-p51984420.html?spid=51984442,3,-15%,Đã bán 1,aonu
ÁO THUN BA LỖ NGƯỢC CROPTOP,36.000₫,https://tiki.vn/ao-thun-ba-lo-nguoc-croptop-p56806254.html?spid=110182522,4,,,aonu
,,https://tiki.vn/ao-hai-day-cheo-lung-nu-co-dem-nguc-nang-do-chat-vai-modal-tu-nhien-co-gian-tot-thoang-mat-nhieu-mau-ma-vaa0230-p155789170.html?spid=155789201,5,,,aonu
Áo thun có cổ nữ màu be (màu cafe) phối viền chìm ADINO vải cotton polyester mềm dáng slimfit công sở hơi ôm trẻ trung APN03,159.000₫,https://tiki.vn/ao-thun-co-co-nu-mau-be-mau-cafe-phoi-vien-chim-adino-vai-cotton-polyester-mem-dang-slimfit-cong-so-hoi-om-tre-trung-apn03-p213930295.html?spid=213930297,6,,Đã bán 21,aonu
COUPLE TX - Áo Polo Nữ Pique Slim Fit Phối Bo Cổ WPO 2024,379.000₫,https://tiki.vn/couple-tx-ao-polo-nu-pique-slim-fit-phoi-bo-co-wpo-2024-p208216949.html?spid=208216953,7,,Đã bán 2,aonu
ÁO THUN UNISEX 7 mem simmy sammy phong cận hero team PHÔNG NAM NỮ GIA ĐÌNH CẶP ĐÔI CÓ SIZE TRẺ EM CHO BÉ TRAI GÁI 3158,45.000₫,https://tiki.vn/ao-thun-unisex-7-mem-simmy-sammy-phong-can-hero-team-phong-nam-nu-gia-dinh-cap-doi-co-size-tre-em-cho-be-trai-gai-3158-p168528367.html?spid=205256615,8,,Đã bán 11,aonu
áo thun kiểu nữ sexy,69.000₫,https://tiki.vn/ao-thun-kieu-nu-sexy-p220678868.html?spid=220678870,9,,,aonu
,,https://tiki.vn/ao-croptop-thun-gan-ho-vai-tay-dai-ao-crt-khoet-ho-nguc-dai-tay-co-day-keo-truoc-han-quoc-sexy-om-body-mau-den-trang-cam-p113617535.html?spid=113617539,10,,,aonu
"Áo giữ nhiệt cho nữ, áo nữ giữ nhiệt",70.890₫,https://tiki.vn/ao-giu-nhiet-cho-nu-ao-nu-giu-nhiet-p76587498.html?spid=76587503,11,,Đã bán 1,aonu
Áo sơ mi nữ trắng cổ tròn hở vạt tay dài xếp li độc lạ,174.000,https://tiki.vn/ao-so-mi-nu-trang-co-tron-ho-vat-tay-dai-xep-li-doc-la-p97820948.html?spid=97820954,12,,Đã bán 1,aonu
,,https://tiki.vn/ao-phong-nu-co-tim-tay-ngan-tre-trung-mau-moi-nhat-p138752278.html?spid=138753262,13,,,aonu
Áo thun Polo Nữ chất vải Cotton co giãn chuẩn form,89.000₫,https://tiki.vn/ao-thun-polo-nu-chat-vai-cotton-co-gian-chuan-form-p217177182.html?spid=217177190,14,,Đã bán 1,aonu
"Áo nữ cổ vuông dài tay dáng croptop, Áo kiểu sang chảnh mặc 4 mùa",115.000₫,https://tiki.vn/ao-nu-co-vuong-dai-tay-dang-croptop-ao-kieu-sang-chanh-mac-4-mua-p193011679.html?spid=193011683,15,,,aonu
Áo crop thun 3 lỗ (4 màu),85.000₫,https://tiki.vn/ao-crop-thun-3-lo-4-mau-p125280341.html?spid=125280355,16,,,aonu
Áo sơ mi kẻ sọc phối khoen lưng đẹp,180.000,https://tiki.vn/ao-so-mi-ke-soc-phoi-khoen-lung-dep-p27733593.html?spid=27733597,17,,,aonu
,,https://tiki.vn/ao-thun-kem-bra-ba-lo-cotton-co-gian-p50335963.html?spid=93278540,18,,,aonu
ÁO CỔ ĐỔ SIÊU HOT NANA,124.000₫,https://tiki.vn/ao-co-do-sieu-hot-nana-p42559248.html?spid=42559258,19,,Đã bán 19,aonu
"Áo kiểu nữ họa tiết chấm bi cổ trụ đẹp, thích hợp mặc công sở hoặc dự tiệc",142.000₫,https://tiki.vn/ao-kieu-nu-hoa-tiet-cham-bi-co-tru-dep-thich-hop-mac-cong-so-hoac-du-tiec-p57712558.html?spid=57712560,20,,Đã bán 35,aonu
Áo hai dây nữ croptop buộc nơ ngực dáng ôm kiểu cánh tiên ống 2 dây bản lớn alohaboutique - nude,59.000₫,https://tiki.vn/ao-hai-day-nu-croptop-buoc-no-nguc-dang-om-kieu-canh-tien-ong-2-day-ban-lon-alohaboutique-p200557869.html?spid=200557879,21,,Đã bán 1,aonu
Áo croptop cổ v đắp chéo buộc nơ quyến rũ rất dễ mặc và phối đồ,50.000₫,https://tiki.vn/ao-croptop-co-v-dap-cheo-buoc-no-quyen-ru-rat-de-mac-va-phoi-do-p133165716.html?spid=133165732,22,,Đã bán 51,aonu
Cổ áo ren tháo rời mặc ngoài áo đầm không cổ - Mã CT02,90.000₫,https://tiki.vn/co-ao-ren-thao-roi-mac-ngoai-ao-dam-khong-co-ma-ct02-p76202500.html?spid=76202504,23,,Đã bán 1,aonu
Áo thun nữ MXM cổ tròn form ôm body in hình thun cotton 4 chiều từ 40-52kg ( ANU043 ),87.000₫,https://tiki.vn/ao-thun-nu-mxm-co-tron-form-om-body-in-hinh-thun-cotton-4-chieu-tu-40-52kg-anu043-p251276724.html?spid=251276740,24,,,aonu
Áo Kiểu CCHAT Trễ Vai Họa Tiết 2 Tầng Bèo Chất Thô Phong Cách Trẻ Trung 92ANT5001AT,159.000,https://tiki.vn/ao-kieu-cchat-tre-vai-hoa-tiet-2-tang-beo-chat-tho-phong-cach-tre-trung-92ant5001at-p190602289.html?spid=190602305,25,,,aonu
,,https://tiki.vn/gia-si-ao-lop-ao-nhom-ao-dong-phuc-di-bien-p248274109.html?spid=248274244,26,,,aonu
"Áo hai dây nữ lụa cao cấp, mát, mịn, không nhăn - AD01 - wfstudios",180.000₫,https://tiki.vn/ao-hai-day-nu-lua-cao-cap-mat-min-khong-nhan-ad01-wfstudios-p140213462.html?spid=140213509,27,,Đã bán 716,aonu
Áo Kiểu Tay Loe Cổ Bẻ,115.000₫,https://tiki.vn/ao-kieu-tay-loe-co-be-p14837862.html?spid=14837868,28,,Đã bán 7,aonu
ÁO THUN TAY DÀI UNISEX NAM NỮ _ HÌNH THẬT _ 99K,89.000₫,https://tiki.vn/ao-thun-tay-dai-unisex-nam-nu-_-hinh-that-_-freeship-99k-p85666195.html?spid=88021680,29,,Đã bán 3,aonu
Áo Thun Tay Dài Nam Nữ Form Rộng Cổ Tròn Đen Trắng Chất Phông Cao Cấp GU Fashion Basic Unisex,26.000₫,https://tiki.vn/ao-thun-tay-dai-nam-nu-form-rong-co-tron-den-trang-chat-phong-cao-cap-gu-fashion-basic-unisex-p68748852.html?spid=92667097,30,,,aonu
,,https://tiki.vn/ao-ren-luoi-theu-hoa-p128521370.html?spid=128521385,31,,,aonu
"Áo giữ nhiệt NỮ New Style siêu co giãn, mặc thoải mái",45.000₫,https://tiki.vn/ao-giu-nhiet-nu-new-style-sieu-co-gian-mac-thoai-mai-p124065986.html?spid=124066000,32,,,aonu
"áo thun khủng long chibi 6 chất đẹp,bao đổi trả",50.000₫,https://tiki.vn/ao-thun-khung-long-chibi-6-chat-dep-bao-doi-tra-p126172810.html?spid=126173639,33,,Đã bán 1,aonu
Áo logo BlackPink Áo phông thun in logo BlackPink,75.000₫,https://tiki.vn/ao-logo-blackpink-ao-phong-thun-in-logo-blackpink-p130420703.html?spid=130421955,34,,Đã bán 1,aonu
"Áo Sơ Mi Trắng Nữ Công Sở Chất Vải Cotton Không Nhăn, Form Suông [AS2",900.000,https://tiki.vn/ao-so-mi-trang-nu-cong-so-chat-vai-cotton-khong-nhan-form-suong-as2-p270134606.html?spid=270134610,35,,,aonu
,,https://tiki.vn/ao-thun-3-lo-nu-sat-nach-in-hinh-con-nai-vai-cotton-4-chieu-style-han-quoc-2022-sally-sn110-p197742691.html?spid=197743185,36,,,aonu
Áo sơ mi nữ cánh dơi họa tiết đẹp ảnh thật A4368 đủ size từ 40-90kg,205.000₫,https://tiki.vn/ao-so-mi-nu-canh-doi-hoa-tiet-dep-anh-that-a4368-du-size-tu-40-90kg-p271734686.html?spid=271734690,37,,,aonu
Áo sơ mi nữ họa tiết thời trang,125.000₫,https://tiki.vn/ao-so-mi-nu-hoa-tiet-thoi-trang-p22782215.html?spid=197214191,38,,,aonu
"áo thun nữ form nhỏ 30kg, áo phông tay lỡ phông dáng rộng unisex, ulzang, có size s",41.000₫,https://tiki.vn/ao-thun-nu-form-nho-30kg-ao-phong-tay-lo-phong-dang-rong-unisex-ulzang-co-size-s-p160173227.html?spid=198858249,39,,Đã bán 5,aonu
ÁO CỔ THUYỀN TAY PHỒNG MYNA,127.000,https://tiki.vn/ao-co-thuyen-tay-phong-myna-p52274781.html?spid=52274789,40,,,aonu
