title,price,link_item,index,discount,sales,brand
Combo Viên Finish 150 tabs + Muối Finish 1.2kg + Nước làm bóng bát Finish 750ml,529.000₫,https://tiki.vn/combo-vien-finish-150-tabs-muoi-finish-1-2kg-nuoc-lam-bong-bat-finish-750ml-p121326045.html?spid=127123054,1,,Đã bán 4,finish
Combo Bột rửa bát Finish 2.5kg+Muối rửa bát Finish 1.5kg+Bóng finish 400ml,788.000₫,https://tiki.vn/combo-bot-rua-bat-finish-2-5kg-muoi-rua-bat-finish-1-5kg-bong-finish-400ml-p122910003.html?spid=141656157,2,,,finish
combo Viên rửa chén bát Finish 90 viên + Muối làm mềm nuớc finish 1.2kg + nuớc làm bóng bát chén finish 400ml,519.000₫,https://tiki.vn/combo-vien-rua-chen-bat-finish-90-vien-muoi-lam-mem-nuoc-finish-1-2kg-nuoc-lam-bong-bat-chen-finish-400ml-p207932987.html?spid=141655484,3,,,finish
Combo 120 viên rửa bát finish + muối Finish 1.2kg + Nước làm bóng Finish 400ml dùng cho máy rửa bát,499.000,https://tiki.vn/combo-120-vien-rua-bat-finish-muoi-finish-1-2kg-nuoc-lam-bong-finish-400ml-dung-cho-may-rua-bat-p205472334.html?spid=271957041,4,,,finish
,,https://tiki.vn/gel-rua-finish-all-in-1-max-eco-0-900ml-p172160142.html?spid=174847388,5,,,finish
Combo 04 túi Viên Rửa Chén Bát Hương Chanh Finish Powerball All In 1 Max Lemon Sparkle 30 viên,620.000₫,https://tiki.vn/combo-04-tui-vien-rua-chen-bat-huong-chanh-finish-powerball-all-in-1-max-lemon-sparkle-30-vien-p166567268.html?spid=174597164,6,,Đã bán 2,finish
Combo viên rửa chén finish 48 viên + muối Somat 1.2kg + Nước làm bóng alio 1 lít dùng cho máy rửa bát,489.000₫,https://tiki.vn/combo-vien-rua-che-n-finish-48-vien-muoi-somat-1-2kg-nuoc-lam-bong-alio-1-li-t-dung-cho-may-rua-bat-p134759395.html?spid=134759404,7,,,finish
Muối Finish 1.5kg + Viên rửa bát Finish 85 viên (Đức) dùng cho máy rửa chén bát,399.000₫,https://tiki.vn/muoi-finish-1-5kg-vien-rua-bat-finish-85-vien-duc-dung-cho-may-rua-chen-bat-p53896152.html?spid=55752681,8,,Đã bán 5,finish
Viên rửa chén bát Finish Cao cấp Quantum Max 36 viên Finish EU,289.000,https://tiki.vn/vien-rua-chen-bat-finish-cao-cap-quantum-max-36-vien-finish-eu-p102521028.html?spid=133870489,9,,,finish
,,https://tiki.vn/combo-vien-finish-77-vien-muoi-finish-1-5kg-nuoc-lam-bong-finish-750ml-p134759766.html?spid=141655751,10,,,finish
Combo Muối Finish 1.2kg + 1150ml Nước làm bóng finish + Viên rửa bát Finish all in one 22 viên,99.000₫,https://tiki.vn/combo-muoi-finish-1-2kg-1150ml-nuoc-lam-bong-finish-vien-rua-bat-finish-all-in-one-22-vien-p134759643.html?spid=141655070,11,,Đã bán 1,finish
Combo bóng finish 1150ml + viên finish 77 tabs + 1.2kg muối rửa bát Finish,49.000₫,https://tiki.vn/combo-bong-finish-1150ml-vien-finish-77-tabs-1-2kg-muoi-rua-bat-finish-p134760685.html?spid=205284431,12,,,finish
,,https://tiki.vn/combo-vien-rua-bat-finish-all-in-one-90-muoi-finish-1-5kg-p134760133.html?spid=137827760,13,,,finish
Combo viên rửa bát 77 viên + Muôi finish 1.5kg + bóng finish 1150ml,139.000₫,https://tiki.vn/combo-vien-rua-bat-77-vien-muoi-finish-1-5kg-bong-finish-1150ml-p134758922.html?spid=141654917,14,,,finish
Combo Gel xà phòng rửa bát Finish Gel 1.5L+Nước làm bóng Finish 400ml Tặng 3 viên Finish,90.000₫,https://tiki.vn/combo-gel-xa-phong-rua-bat-finish-gel-1-5l-nuoc-lam-bong-finish-400ml-tang-3-vien-finish-p134758702.html?spid=134758731,15,,,finish
Hàng Đức Viên rửa bát Finish quantum viên rửa cao cấp dùng cho máy,249.000₫,https://tiki.vn/hang-duc-vien-rua-bat-finish-quantum-vien-rua-cao-cap-dung-cho-may-p121327177.html?spid=141656130,16,,Đã bán 1,finish
"Viên rửa chén bát Finish quantum túi 60 viên,vệ sinh máy , vỉ treo khử mùi Finish",94.999₫,https://tiki.vn/vien-rua-chen-bat-finish-quantum-tui-60-vien-ve-sinh-may-vi-treo-khu-mui-finish-p121325825.html?spid=190809127,17,,,finish
,,https://tiki.vn/vien-rua-chen-finish-allin1-hop100-vien-p121326999.html?spid=121327001,18,,,finish
Combo Nước bóng Finish 800ml+Nước vệ sinh máy + Viên rửa bát Finish 77v,129.000₫,https://tiki.vn/combo-nuoc-bong-finish-800ml-nuoc-ve-sinh-may-vien-rua-bat-finish-77v-p134760125.html?spid=141655900,19,,,finish
Viên rửa bát Finish All in 1 max- NHẬP KHẨU CHÍNH HÃNG,399.000₫,https://tiki.vn/vien-rua-bat-finish-all-in-1-max-nhap-khau-chinh-hang-p169737220.html?spid=171751836,20,,Đã bán 5,finish
"Bộ gồm viên rửa bát finish quantum 54 viên+nước làm bóng bát finish 750ml+muối rửa bát finish 1,5kg",649.000₫,https://tiki.vn/bo-gom-vien-rua-bat-finish-quantum-54-vien-nuoc-lam-bong-bat-finish-750ml-muoi-rua-bat-finish-1-5kg-p53876283.html?spid=54484405,21,,Đã bán 7,finish
"Combo Nước làm bóng Finish Eco 0%+Gel rửa bát Eco 650ml + Muối rửa bát finish1,5kg",499.000₫,https://tiki.vn/combo-nuoc-lam-bong-finish-eco-0-gel-rua-bat-eco-650ml-muoi-rua-bat-finish1-5kg-p205494982.html?spid=141655102,22,,Đã bán 1,finish
Combo Nước rửa bát Finish hữu cơ 900ml + Muối Finish 1.2kg + Nước làm bóng Finish 750ml0,109.000₫,https://tiki.vn/combo-nuoc-rua-bat-finish-huu-co-900ml-muoi-finish-1-2kg-nuoc-lam-bong-finish-750ml0-p134759897.html?spid=141655153,23,,,finish
Combo Viên rửa bát Finish All in one 100 viên + Muối Finish 4.0kg + Nước làm bóng Finish 1150ml,790.000₫,https://tiki.vn/combo-vien-rua-bat-finish-all-in-one-100-vien-muoi-finish-4-0kg-nuoc-lam-bong-finish-1150ml-p205422839.html?spid=242074552,24,,Đã bán 17,finish
Viên rửa bát Finish Quantum Max 70 viên,137.999,https://tiki.vn/vien-rua-bat-finish-quantum-max-70-vien-p134760826.html?spid=141655456,25,,,finish
,,https://tiki.vn/vien-rua-bat-finish-quantum-ultimate-51-vien-hop-p205414630.html?spid=215559893,26,,,finish
Combo Viên rửa chén Finish quantum 72 tabs + Muối Finish 1.5kg + Nước bóng finish 1150ml,99.000₫,https://tiki.vn/combo-vien-rua-chen-finish-quantum-72-tabs-muoi-finish-1-5kg-nuoc-bong-finish-1150ml-finish-edu-vn-p134759943.html?spid=141655142,27,,Đã bán 1,finish
Viên rửa bát chén Finish Quantum 60 viên (Nk Đức ),389.000₫,https://tiki.vn/vien-rua-bat-chen-finish-quantum-60-vien-nk-duc-p206254468.html?spid=126415703,28,,,finish
Viên Rửa Chén Bát Hương Chanh Finish Powerball All In 1 Max Lemon Sparkle 30 viên,289.000₫,https://tiki.vn/vien-rua-chen-bat-huong-chanh-finish-powerball-all-in-1-max-lemon-sparkle-30-vien-p166551298.html?spid=242073735,29,,Đã bán 1,finish
Combo Viên rửa bát Finish 77v + Muối Finish 1.5kg + Nước làm bóng bát Finish 400ml,139.000,https://tiki.vn/combo-vien-rua-bat-finish-77v-muoi-finish-1-5kg-nuoc-lam-bong-bat-finish-400ml-p134760190.html?spid=141655912,30,,,finish
,,https://tiki.vn/combo-vien-rua-bat-finish-77-v-muoi-finish-1-5kg-nuoc-lam-bong-finish-400ml-p134760729.html?spid=134760735,31,,,finish
"Bộ viên rửa bát finish hộp 100 viên và hộp muiối làm mềm nuớc somat 1,2kg ( Đức )",439.000₫,https://tiki.vn/bo-vien-rua-bat-finish-hop-100-vien-va-hop-muioi-lam-mem-nuoc-somat-1-2kg-duc-p121326619.html?spid=141656155,32,,,finish
Viên rửa bát Finish Quantum 72 viên - muoi Finish 1.2kg - Dùng cho Máy rửa bát,128.000₫,https://tiki.vn/vien-rua-bat-finish-quantum-max-70-vien-p205506946.html?spid=248754570,33,,,finish
"Bộ gồm viên rửa bát finish quantum 36 viên+nước làm bóng bát finish 800ml+muối rửa bát finish 1,5kg",439.000₫,https://tiki.vn/bo-gom-vien-rua-bat-finish-quantum-36-vien-nuoc-lam-bong-bat-finish-800ml-muoi-rua-bat-finish-1-5kg-p51929599.html?spid=128894387,34,,,finish
Túi 60 viên rửa chén Finish Quantum Dishwasher Tablets Apple & Lime hương táo,389.000,https://tiki.vn/tui-60-vien-rua-chen-finish-quantum-dishwasher-tablets-apple-lime-huong-tao-p206253062.html?spid=273506343,35,,,finish
,,https://tiki.vn/combo-3-tui-vien-rua-chen-bat-finish-powerball-quantum-21-vien-tui-p273836660.html?spid=273836661,36,,,finish
"combo Muối rửa bát Finish 1,5kg+Viên rửa chén bát Finish 77 viên dùng cho máy rửa bát",399.000₫,https://tiki.vn/combo-muoi-rua-bat-finish-1-5kg-vien-rua-chen-bat-finish-77-vien-dung-cho-may-rua-bat-p205387137.html?spid=205387140,37,,Đã bán 38,finish
Viên rửa chén Finish Classic 100 viên (Nhập khẩu EU ),339.000₫,https://tiki.vn/vien-rua-chen-finish-classic-100-vien-nhap-khau-eu-p122910557.html?spid=126492110,38,,,finish
[HCM] Nước làm bóng chén bát Finish Eco 0% - 400ml/ chai,148.999₫,https://tiki.vn/hcm-nuoc-lam-bong-chen-bat-finish-eco-0-400ml-chai-p124962527.html?spid=173879107,39,,Đã bán 5,finish
Nước làm bóng finish 400ml,109.000,https://tiki.vn/nuoc-lam-bong-finish-400ml-p121326997.html?spid=141655528,40,,,finish
