title,price,link_item,index,discount,sales,category
Đồ bộ thể thao nam againtc,108.000₫,https://tiki.vn/do-bo-the-thao-nam-againtc-p143417207.html?spid=171898547,1,-20%,,dongunam
Bộ quần áo thể thao nam,95.000₫,https://tiki.vn/bo-quan-ao-the-thao-nam-p187843092.html?spid=187843094,2,-21%,,dongunam
Bộ quần áo thun thể thao nam,95.000₫,https://tiki.vn/bo-quan-ao-thun-the-thao-nam-p187842548.html?spid=187842553,3,,,dongunam
Bộ quần áo thể thao nam nữ có sọc to trên ngực,75.000₫,https://tiki.vn/bo-quan-ao-the-thao-nam-nu-co-soc-to-tren-nguc-p187841624.html?spid=187841658,4,,,dongunam
,,https://tiki.vn/do-mac-nha-quan-shorts-eco-linen-lounge-shorts-size-m-l-xl-p178608473.html?spid=178608479,5,,,dongunam
Đồ Mặc Nhà Quần Shorts Eco-KATE Lounge Shorts YELOWW - SIZE L,130.000₫,https://tiki.vn/do-mac-nha-quan-shorts-eco-kate-lounge-shorts-yeloww-size-l-p178608425.html?spid=178608427,6,,,dongunam
Đồ Mặc Nhà Quần Shorts Eco-Cotton Lounge Shorts - SIZE S/M/L/XL/XXL,130.000₫,https://tiki.vn/do-mac-nha-quan-shorts-eco-cotton-lounge-shorts-size-s-m-l-xl-xxl-p178608428.html?spid=178608434,7,,,dongunam
"Bộ thun nam King168 , đồ bộ nam cao cấp Q02",96.000₫,https://tiki.vn/bo-thun-nam-king168-do-bo-nam-cao-cap-q02-p104163855.html?spid=197174013,8,,,dongunam
Đồ Mặc Nhà Quần Shorts Eco-KATE Lounge Shorts BLACK - SIZE M/L/XL,130.000,https://tiki.vn/do-mac-nha-quan-shorts-eco-kate-lounge-shorts-black-size-m-l-xl-p178608432.html?spid=178608438,9,,,dongunam
,,https://tiki.vn/do-mac-nha-quan-shorts-eco-linen-lounge-shorts-size-m-l-xl-p178608483.html?spid=178608489,10,,,dongunam
Đồ Bộ Mặc Nhà Cho Nam,481.950₫,https://tiki.vn/do-bo-mac-nha-cho-nam-p148063734.html?spid=148063742,11,,,dongunam
"Bộ Thể Thao Nam Chất Vải Lỗ Kim Co Giãn, Thoáng Mát, Mềm Mịn",259.000,https://tiki.vn/bo-the-thao-nam-cao-cap-chat-vai-lo-kim-co-gian-thoang-mat-mem-min-4-mau-tre-trung-p171175006.html?spid=171175030,12,,,dongunam
,,https://tiki.vn/bo-the-thao-nam-tay-ngan-co-tron-chat-lieu-lo-kim-hot-trend-mau-he-2022-cao-cap-p173388513.html?spid=173388521,13,,,dongunam
Bộ nỉ nam AM màu ghi BNM221-22 Sport1,1.350.000₫,https://tiki.vn/bo-ni-nam-am-mau-ghi-bnm221-22-sport1-p217773854.html?spid=217773868,14,,,dongunam
"Bộ đồ thể thao nam phối sọc, set đồ nam cộc tay mặc nhà chất thun thoáng mát có 4 màu Cực Chất",273.000₫,https://tiki.vn/bo-do-the-thao-nam-phoi-soc-set-do-nam-coc-tay-mac-nha-chat-thun-thoang-mat-co-4-mau-cuc-chat-p160156712.html?spid=219163763,15,,,dongunam
Bộ cổ tàu ngắn tay có túi cho người già,288.000₫,https://tiki.vn/bo-co-tau-ngan-tay-co-tui-cho-nguoi-gia-p252762926.html?spid=252762958,16,,,dongunam
BỘ MẶC NHÀ NAM TRUNG NIÊN CAO CẤP,292.000,https://tiki.vn/bo-mac-nha-nam-trung-nien-cao-cap-p252762906.html?spid=252762914,17,,,dongunam
,,https://tiki.vn/do-bo-nam-do-the-thao-nam-chat-thun-lanh-mem-min-p68722575.html?spid=269944310,18,,,dongunam
Combo 5 áo thun nam ROCK cao cấp,596.000₫,https://tiki.vn/combo-5-ao-thun-nam-rock-cao-cap-p207481018.html?spid=207481028,19,,,dongunam
"Bộ đồ Nam Thể Thao,bộ đồ cao cấp TBDA11",89.000₫,https://tiki.vn/bo-do-nam-cao-cap-tbda11-p21768360.html?spid=22028002,20,,Đã bán 8,dongunam
<FREE SHIP> SET ĐỒ BỘ THUN LẠNH NAM VẢI CO GIÃN TỐT (USA),77.000₫,https://tiki.vn/free-ship-set-do-bo-thun-lanh-nam-vai-co-gian-tot-usa-p130029279.html?spid=254206744,21,,,dongunam
Full set Legging Ao/Quần áo thời trang nam/Tôn vinh nét đẹp quý phái,350.000₫,https://tiki.vn/full-set-legging-ao-quan-ao-thoi-trang-nam-ton-vinh-net-dep-quy-phai-p272200673.html?spid=272200679,22,,,dongunam
quần áo mặc nhà cotton 9939,306.000₫,https://tiki.vn/quan-ao-mac-nha-cotton-9939-p51698232.html?spid=51698234,23,,Đã bán 8,dongunam
Bộ Nam Hè Free Fire Chất Liệu Cotton Set Bộ Quần Áo Nam In Hình B.Học Cực Chất Hot Trend 2020,141.000₫,https://tiki.vn/bo-nam-he-free-fire-chat-lieu-cotton-set-bo-quan-ao-nam-in-hinh-b-hoc-cuc-chat-hot-trend-2020-p87600608.html?spid=87600610,24,,Đã bán 3,dongunam
SET BỘ QUẦN ÁO NAM MẶC NHÀ VẢI ĐŨI CAO CẤP MẶC MÁT BỘ ĐŨI NAM,109.000,https://tiki.vn/set-bo-quan-ao-nam-mac-nha-vai-dui-cao-cap-mac-mat-bo-dui-nam-p207304596.html?spid=207306155,25,,,dongunam
,,https://tiki.vn/bo-do-pijama-nam-luxury-cao-cap-qshop-qm600-p199262708.html?spid=199262714,26,,,dongunam
"Bộ đồ pijama quần dài, tay dài mẫu mới QSHOP QM708",300.000₫,https://tiki.vn/bo-do-pijama-quan-dai-tay-dai-mau-moi-qshop-qm708-p253099459.html?spid=253099463,27,,,dongunam
Bộ Đồ Ngủ Nam Hoạt Hình Dài Tay DND18,180.000₫,https://tiki.vn/bo-do-ngu-nam-hoat-hinh-dai-tay-dnd18-p8143507.html?spid=8143511,28,,Đã bán 8,dongunam
Set Đồ Đi Biển Nam Nữ,273.000₫,https://tiki.vn/set-do-di-bien-nam-nu-p263407249.html?spid=263407282,29,,,dongunam
"(Loại 1) Thời trang trẻ em - Đồ bộ bé trai, bé gái, kiểu dáng HipHop thun cotton ngắn tay - SockiMall (210570)",123.000,https://tiki.vn/loai-1-thoi-trang-tre-em-do-bo-be-trai-be-gai-kieu-dang-hiphop-thun-cotton-ngan-tay-sockimall-210570-p204911332.html?spid=204912217,30,,,dongunam
,,https://tiki.vn/bo-cu-sy-nam-dai-loan-vai-tho-dai-tay-ngan-tay_quan-ao-di-chua-phat-tu-nam-p119258002.html?spid=119258008,31,,,dongunam
Bộ đồ pijama nam Luxury tay dài mềm mịn trơn láng QSHOP QM841,490.000₫,https://tiki.vn/bo-do-pijama-nam-luxury-tay-dai-mem-min-tron-lang-qshop-qm841-p273699356.html?spid=273699358,32,,,dongunam
Bộ đồ pijama cặp đồi Luxury tay dài QSHOP QM853,500.000₫,https://tiki.vn/bo-do-pijama-cap-doi-luxury-tay-dai-qshop-qm853-p273805017.html?spid=273805029,33,,,dongunam
Bộ đồ pijama nam Luxury tay dài mềm mịn QSHOP QM777,500.000₫,https://tiki.vn/bo-do-pijama-nam-luxury-tay-dai-mem-min-qshop-qm777-p271588515.html?spid=271588521,34,,,dongunam
Bộ đồ pijama nam quần ngắn tay ngắn QSHOP QM839,380.000,https://tiki.vn/bo-do-pijama-nam-quan-ngan-tay-ngan-qshop-qm839-p273699339.html?spid=273699343,35,,,dongunam
,,https://tiki.vn/bo-pyjama-huongtam-phi-bong-tay-ngan-nam-cao-cap-pnp02n-chat-lieu-vai-polyester-mem-mai-thoang-mat-khong-phai-mau-p273882272.html?spid=273882705,36,,,dongunam
Bộ quần áo thun cotton unisex nam nữ mặc hè siêu mát tặng kèm khẩu trang có video,120.000₫,https://tiki.vn/bo-quan-ao-thun-cotton-unisex-nam-nu-mac-he-sieu-mat-tang-kem-khau-trang-co-video-p109817098.html?spid=109817126,37,,Đã bán 4,dongunam
Bộ Quần Áo Nam SE75,282.000₫,https://tiki.vn/bo-quan-ao-nam-se75-p22254272.html?spid=22254278,38,,Đã bán 9,dongunam
Bộ Quần Áo Nam SE66,282.000₫,https://tiki.vn/bo-quan-ao-nam-se66-p22254337.html?spid=22254343,39,,Đã bán 6,dongunam
Bộ Quần Áo Nam SE65,282.000,https://tiki.vn/bo-quan-ao-nam-se65-p22254388.html?spid=22254394,40,,Đã bán 4,dongunam
