title,price,link_item,index,discount,sales,brand
"Áo vest linen nữ ve ngóc tay lỡ 2 túi bổ ArcticHunter, thời trang thương hiệu chính hãng",320.000₫,https://tiki.vn/ao-vest-linen-nu-ve-ngoc-tay-lo-2-tui-bo-arctichunter-thoi-trang-thuong-hieu-chinh-hang-p82386092.html?spid=82386100,1,-5%,Đã bán 14,ARCTIC_HUNTER
"Áo vest blazer nữ Linen dài tay trẻ trung, chất linen may mềm mịn, thời trang nữ công sở ARCTIC HUNTER AH04",299.000₫,https://tiki.vn/ao-vest-blazer-nu-linen-tay-lo-san-tre-trung-chat-linen-may-mem-min-thoi-trang-nu-cong-so-arctic-hunter-ah04-p199078126.html?spid=199078130,2,-5%,,ARCTIC_HUNTER
"Đầm suông linen xanh rêu cổ vuông ArcticHunter, thời trang xuân hè 2021",250.000₫,https://tiki.vn/dam-suong-linen-xanh-reu-co-vuong-arctichunter-thoi-trang-xuan-he-2021-p90475984.html?spid=90475988,3,,Đã bán 103,ARCTIC_HUNTER
"Áo sơ mi ngủ nữ voan cát mỏng cổ tầu gợi cảm trẻ trung ArcticHunter, thời trang thương hiệu chính hãng",129.000,https://tiki.vn/ao-so-mi-ngu-nu-voan-cat-mong-co-tau-goi-cam-tre-trung-arctichunter-thoi-trang-thuong-hieu-chinh-hang-p114638320.html?spid=114638326,4,-5%,,ARCTIC_HUNTER
,,https://tiki.vn/dam-suong-linen-trung-nien-co-tau-hang-khuy-giua-arctichunter-chat-vai-linen-tu-nhien-mem-mat-thoi-trang-thuong-hieu-chinh-hang-p74914927.html?spid=74914933,5,-40%,,ARCTIC_HUNTER
Áo Len Tay Cánh Dơi Mỏng Thời Trang Thu Đông Cho Nữ ARCTIC HUNTER,141.550₫,https://tiki.vn/ao-len-tay-canh-doi-mong-thoi-trang-thu-dong-cho-nu-arctic-hunter-p202558340.html?spid=202558341,6,,,ARCTIC_HUNTER
"Áo sơ mi nữ cổ tầu form rộng chất đũi ArcticHunter, thời trang trẻ, thương hiệu chính hãng",250.000₫,https://tiki.vn/ao-so-mi-nu-co-tau-form-rong-chat-dui-arctichunter-thoi-trang-tre-thuong-hieu-chinh-hang-p77700070.html?spid=77700076,7,,Đã bán 79,ARCTIC_HUNTER
"Đầm linen nữ thiết kế cổ V có túi, mix phong cách sơ mi thời trang, đầm đũi chất lượng cao AH72",299.000₫,https://tiki.vn/dam-nu-thiet-ke-co-v-co-tui-mix-phong-cach-so-mi-thoi-trang-dam-dui-chat-luong-cao-ah72-p181920231.html?spid=181920235,8,,Đã bán 17,ARCTIC_HUNTER
Áo Gile Nữ Len Dệt Kim Phong Cách Mùa Thu Đông Thời Trang ARCTIC HUNTER GL04,139.000,https://tiki.vn/ao-gile-nu-len-det-kim-phong-cach-mua-thu-dong-thoi-trang-arctic-hunter-gl04-p196234371.html?spid=196234377,9,,,ARCTIC_HUNTER
,,https://tiki.vn/ao-so-mi-nu-co-tru-ke-soc-den-trang-tre-trung-sm13-p106303771.html?spid=106303883,10,,,ARCTIC_HUNTER
"Đầm suông linen cổ tim tay lỡ ArcticHunter, chất vải linen mềm mát, thời trang xuân hè 2021 - Cam",260.000₫,https://tiki.vn/dam-suong-linen-co-tim-tay-lo-arctichunter-chat-vai-linen-mem-mat-thoi-trang-xuan-he-2021-cam-p93226196.html?spid=93226202,11,,Đã bán 40,ARCTIC_HUNTER
"Áo sơ mi nữ đũi lụa chấm bi xinh xắn ArcticHunter, thời trang thương hiệu chính hãng",150.000,https://tiki.vn/ao-so-mi-nu-dui-lua-cham-bi-xinh-xan-arctichunter-thoi-trang-thuong-hieu-chinh-hang-p102473321.html?spid=102473323,12,,,ARCTIC_HUNTER
,,https://tiki.vn/vay-mac-nha-vay-ngu-nu-2-day-duoi-ca-chat-vai-mem-min-mat-me-v15-p109981909.html?spid=109981959,13,,,ARCTIC_HUNTER
"Đầm suông linen tay lỡ kèm đai rời ArcticHunter, thời trang thương hiệu chính hãng - Đỏ đô",250.000₫,https://tiki.vn/dam-suong-linen-tay-lo-kem-dai-roi-arctichunter-thoi-trang-thuong-hieu-chinh-hang-do-do-p78586004.html?spid=78586010,14,,Đã bán 245,ARCTIC_HUNTER
"Đầm xòe không tay phối màu sang trọng ArcticHunter, thời trang trẻ, phong cách Hàn Quốc",89.000₫,https://tiki.vn/dam-xoe-khong-tay-phoi-mau-sang-trong-arctichunter-thoi-trang-tre-phong-cach-han-quoc-p46652777.html?spid=67406436,15,,Đã bán 1,ARCTIC_HUNTER
"Áo linen nữ cổ tròn vá vải trẻ trung ArcticHunter, thời trang thương hiệu chính hãng",159.000₫,https://tiki.vn/ao-linen-nu-co-tron-va-vai-tre-trung-arctichunter-thoi-trang-thuong-hieu-chinh-hang-p73606809.html?spid=73606811,16,,Đã bán 17,ARCTIC_HUNTER
Áo len dệt kim - Áo len mỏng mặc 4 mùa ARCTIC HUNTER AH57,139.000,https://tiki.vn/ao-thu-dong-nu-len-luoi-thiet-ke-tay-canh-roi-in-hoa-tiet-arctic-hunter-al57-p186745514.html?spid=186745516,17,,Đã bán 3,ARCTIC_HUNTER
,,https://tiki.vn/dam-suong-nu-co-so-mi-hoa-tiet-ke-soc-vai-tho-dui-mat-me-da132-p106305157.html?spid=106305159,18,,,ARCTIC_HUNTER
"Đầm sơ mi ngắn tay, Đầm linen suông nữ rút eo cổ sơ mi, phong cách retro ARCTIC HUNTER",299.000₫,https://tiki.vn/dam-so-mi-ngan-tay-dam-linen-suong-nu-rut-eo-co-so-mi-phong-cach-retro-arctic-hunter-p217482887.html?spid=217482903,19,,,ARCTIC_HUNTER
"Áo gile len cổ V dệt kim khoác ngoài phong cách thời trang Hàn quốc, Áo gile len màu nâu thu đông ARCTIC HUNTER AH04",122.550₫,https://tiki.vn/ao-gile-len-co-v-det-kim-khoac-ngoai-phong-cach-thoi-trang-han-quoc-ao-gile-len-mau-nau-thu-dong-arctic-hunter-ah04-p193777919.html?spid=193777920,20,,Đã bán 1,ARCTIC_HUNTER
"Đầm suông linen cổ phát V ArcticHunter, chất vải linen mềm mát, thích hợp mùa hè, thời trang thương hiệu chính hãng - Tím huế",250.000₫,https://tiki.vn/dam-suong-linen-co-phat-v-arctichunter-chat-vai-linen-mem-mat-thich-hop-mua-he-thoi-trang-thuong-hieu-chinh-hang-tim-hue-p89492839.html?spid=89492843,21,,Đã bán 45,ARCTIC_HUNTER
Đầm linen dáng suông cúc sau lưng thời trang cho phái nữ ARCTIC HUNTER,299.000₫,https://tiki.vn/dam-suong-chat-dui-co-tron-tron-tay-lo-chun-chat-dui-mem-mat-thoi-trang-nu-tre-trung-arctic-hunter-ah118-p196479694.html?spid=196479696,22,,Đã bán 2,ARCTIC_HUNTER
"Áo len nữ cổ tròn dài tay, chất len mềm mổng co giãn, nhiều màu thời trang thu đông ARCTIC HUNTER",199.000₫,https://tiki.vn/ao-len-nu-co-tron-dai-tay-chat-len-mem-mong-co-gian-nhieu-mau-thoi-trang-thu-dong-arctic-hunter-p203396522.html?spid=203396528,23,,,ARCTIC_HUNTER
Áo len nữ dài tay thu đông ARCTIC HUNTER AH14,249.000₫,https://tiki.vn/ao-len-nu-dai-tay-thu-dong-ah14-p143813990.html?spid=143813998,24,,Đã bán 3,ARCTIC_HUNTER
Áo len nữ cổ tròn mặc thu đông ARCTIC HUNTER len17,160.550,https://tiki.vn/ao-len-nu-co-tron-mac-thu-dong-arctic-hunter-len17-p44311544.html?spid=161950941,25,,Đã bán 2,ARCTIC_HUNTER
,,https://tiki.vn/quan-jeans-nu-cap-cao-dang-dai-ong-rong-arctichunter-thiet-ke-rach-dui-bui-bam-thoi-trang-phong-cach-han-quoc-p72224528.html?spid=72224532,26,,,ARCTIC_HUNTER
"Đầm Váy Suông Nữ Sát Nách Chất Đũi Mềm, Phong Cách Thanh Lịch ARCTIC HUNTER AH213",236.550₫,https://tiki.vn/dam-vay-suong-nu-sat-nach-chat-dui-mem-phong-cach-thanh-lich-arctic-hunter-ah213-p272452132.html?spid=272452136,27,,,ARCTIC_HUNTER
"Đầm thun nữ dáng suông thoải mái, nhiều màu xinh Db35",199.000₫,https://tiki.vn/dam-thun-nu-dang-suong-thoai-mai-nhieu-mau-xinh-db35-p113835399.html?spid=113835429,28,,Đã bán 1,ARCTIC_HUNTER
"Đầm suông đũi cổ trụ ArcticHunter, thời trang thương hiệu chính hãng",199.000₫,https://tiki.vn/dam-suong-dui-co-tru-arctichunter-thoi-trang-thuong-hieu-chinh-hang-p67048080.html?spid=67048090,29,,Đã bán 77,ARCTIC_HUNTER
"Đầm thun nữ dáng dài mặc nhà, đi chơi chất co giãn 4 chiều Db17",214.800,https://tiki.vn/dam-thun-nu-dang-dai-mac-nha-di-choi-chat-co-gian-4-chieu-db17-p114878992.html?spid=114878999,30,,Đã bán 1,ARCTIC_HUNTER
,,https://tiki.vn/vay-bau-thoi-trang-dam-bau-thiet-ke-cong-so-dang-suong-chat-linen-tu-nhien-mat-b72-p185990019.html?spid=185990027,31,,,ARCTIC_HUNTER
"Áo sơ mi nữ trơn ARCTIC HUNTER, sơ mi form rộng tay ngắn cổ bẻ vải thô đũi dáng suông nhiều màu sơ mi kiểu Hàn Quốc phù hợp sơ mi công sở, sơ mi học sinh SM21",149.000₫,https://tiki.vn/ao-so-mi-nu-tron-arctic-hunter-so-mi-form-rong-tay-ngan-co-be-vai-tho-dui-dang-suong-nhieu-mau-so-mi-kieu-han-quoc-phu-hop-so-mi-cong-so-so-mi-hoc-sinh-sm21-p166742880.html?spid=166742892,32,,,ARCTIC_HUNTER
"Áo vest blaze nữ Linen Demi ArcticHunter, thời trang hè thu 2021",320.000₫,https://tiki.vn/ao-vest-blaze-nu-linen-demi-arctichunter-thoi-trang-he-thu-2021-p100310846.html?spid=100310848,33,,Đã bán 6,ARCTIC_HUNTER
Quần lót bầu THÔNG HƠI CẠP CHÉO VIỀN REN xinh xắn siêu sịn mịn QL01,169.000₫,https://tiki.vn/quan-lot-bau-thong-hoi-cap-cheo-vien-ren-xinh-xan-sieu-sin-min-ql01-p164582691.html?spid=164582721,34,,,ARCTIC_HUNTER
Đầm Suông Linen Bigsize Tay Hến Rút Eo ARCTIC HUNTER,299.000,https://tiki.vn/dam-suong-linen-bigsize-tay-hen-rut-eo-arctic-hunter-p196574220.html?spid=196574222,35,,,ARCTIC_HUNTER
,,https://tiki.vn/dam-vay-so-mi-nu-dang-suong-ngan-tay-eo-co-day-rut-chat-lieu-linen-mem-mat-arctic-hunter-p217199938.html?spid=217199950,36,,,ARCTIC_HUNTER
Áo sơ mi nữ ARCTIC HUNTER tay lửng vải mịn mát AH116,179.000₫,https://tiki.vn/ao-so-mi-nu-arctic-hunter-tay-lung-vai-min-mat-ah116-p99373385.html?spid=99373407,37,,Đã bán 1,ARCTIC_HUNTER
"Đầm nữ, váy nữ mới bánh bèo tiểu thư cực xinh Ah10",199.000₫,https://tiki.vn/dam-nu-vay-nu-moi-banh-beo-tieu-thu-cuc-xinh-da10-p114878881.html?spid=114878889,38,,,ARCTIC_HUNTER
Áo khoác cardigan nữ phối cúc xinh xắn ARCTIC HUNTER AH03,199.000₫,https://tiki.vn/ao-khoac-cardigan-nu-phoi-cuc-xinh-xan-arctic-hunter-ah03-p125791621.html?spid=125791627,39,,,ARCTIC_HUNTER
"Đầm hoa nhí vintage, váy xòe đuôi cá thời trang ARCTIC HUNTER AH16",199.000,https://tiki.vn/dam-hoa-nhi-vintage-vay-xoe-duoi-ca-thoi-trang-arctic-hunter-ah16-p66636938.html?spid=161937362,40,,,ARCTIC_HUNTER
