title,price,link_item,index,discount,sales,brand
"Váy ngủ 2 dây, váy mặc nhà mùa hè dễ thương, mát mẻ AH37",141.550₫,https://tiki.vn/vay-ngu-2-day-vay-mac-nha-mua-he-de-thuong-mat-me-ah37-p179720048.html?spid=179720056,1,-5%,,ARCTIC_HUNTER
"Đầm suông nữ vải đũi mềm mát, thiết kế kiểu dáng sơ mi, có túi thời trang hè thu mới nhất AH75",299.000₫,https://tiki.vn/dam-suong-nu-vai-dui-mem-mat-thiet-ke-kieu-dang-so-mi-co-tui-hop-thoi-trang-he-thu-moi-nhat-ah75-p181921006.html?spid=185175004,2,,Đã bán 1,ARCTIC_HUNTER
"Áo sơ mi nữ ARCTIC HUNTER thiết kế cổ V, chất liệu đũi mềm, họa tiết kẻ sọc mix màu thời trang cho phái nữ",159.000₫,https://tiki.vn/ao-so-mi-nu-arctic-hunter-thiet-ke-co-v-ao-so-mi-nu-tay-lung-hoa-tiet-ke-soc-mix-mau-thoi-trang-ah93-p182474476.html?spid=182474478,3,-33%,Đã bán 2,ARCTIC_HUNTER
Áo sơ mi nữ công sở ARCTIC HUNTER AH32,141.550,https://tiki.vn/ao-so-mi-nu-cong-so-arctic-hunter-ah32-p145222500.html?spid=145222506,4,-5%,,ARCTIC_HUNTER
,,https://tiki.vn/dam-voan-hoa-nu-co-chu-v-tay-ngan-dam-duoi-ca-dang-xoe-arctic-hunter-ah177-p191376573.html?spid=191376581,5,,,ARCTIC_HUNTER
"Áo Lót Bầu Loại Trơn (Cúc Mở, Mặc Cả Sau Sinh Cho Con Bú) ALB01",189.000₫,https://tiki.vn/ao-lot-bau-loai-tron-cuc-mo-mac-ca-sau-sinh-cho-con-bu-alb01-p164582805.html?spid=164582824,6,,,ARCTIC_HUNTER
Áo Bầu Xinh Cổ Sơ Mi Pha Ren Kẻ Caro Tay Lửng Đuôi Tôm AB05,149.000₫,https://tiki.vn/ao-bau-xinh-co-so-mi-pha-ren-ke-caro-tay-lung-duoi-tom-ab05-p183701356.html?spid=183701358,7,,,ARCTIC_HUNTER
"Váy bầu dáng suông mặc hè chất liệu linen, Đầm bầu sơ mi nữ kèm đai eo B161",249.000₫,https://tiki.vn/vay-bau-dang-suong-mac-he-chat-lieu-linen-dam-bau-so-mi-nu-kem-dai-eo-b161-p185990156.html?spid=185990158,8,,,ARCTIC_HUNTER
"Đầm bầu, đầm trơn xếp tầng đơn giản nhưng không kém phần sang trọng Db16",219.000,https://tiki.vn/dam-bau-dam-tron-xep-tang-don-gian-nhung-khong-kem-phan-sang-trong-db16-p196971443.html?spid=196971451,9,,,ARCTIC_HUNTER
,,https://tiki.vn/dam-bau-suong-linen-thiet-ke-kieu-dang-so-mi-co-tui-cheo-db61-p196991992.html?spid=196992010,10,,,ARCTIC_HUNTER
"Đầm thun suông nữ cô tròn, tay loe cách điệu, họa tiết kẻ sọc ngang xinh D14",169.000₫,https://tiki.vn/dam-thun-suong-nu-co-tron-tay-loe-cach-dieu-hoa-tiet-ke-soc-ngang-xinh-d14-p270236354.html?spid=270236370,11,,,ARCTIC_HUNTER
Váy đuôi cá dáng babydoll đầm suông dáng rộng chất linen thoáng co giãn nhẹ ARCTIC HUNTER,259.000,https://tiki.vn/vay-duoi-ca-dang-babydoll-dam-suong-dang-rong-chat-linen-thoang-co-gian-nhe-arctic-hunter-p190537982.html?spid=190537984,12,,,ARCTIC_HUNTER
,,https://tiki.vn/ao-kieu-nu-ao-dui-nu-ngan-tay-co-tron-hoa-tiet-hoa-don-gian-chat-dui-mat-arctic-hunter-ah41-p269889605.html?spid=269889609,13,,,ARCTIC_HUNTER
Áo Lót Bầu Sau Sinh Cho Con Bú Chống Chảy Xệ Cao Cấp Chất Liệu Cotton Alb06,170.000₫,https://tiki.vn/ao-lot-bau-sau-sinh-cho-con-bu-chong-chay-xe-cao-cap-chat-lieu-cotton-alb06-p164582599.html?spid=164582647,14,,Đã bán 1,ARCTIC_HUNTER
Quần lót bầu cạp chéo kháng khuẩn cotton chất đẹp QL04,169.000₫,https://tiki.vn/quan-lot-bau-cap-cheo-khang-khuan-cotton-chat-dep-ql04-p164582416.html?spid=164582449,15,,,ARCTIC_HUNTER
Quần lót bầu cotton cạp cao có chun chỉnh bụng Ql02,169.000₫,https://tiki.vn/quan-lot-bau-cotton-cap-cao-co-chun-chinh-bung-ql02-p164582396.html?spid=164582450,16,,Đã bán 1,ARCTIC_HUNTER
Quần Gen Nịt BụngFREESIZEQuần Gen Bụng Chống Cuộn Viền Ren Cao Cho Bà Bầu Sau Sinh QR02,199.000,https://tiki.vn/quan-gen-nit-bung-freesize-quan-gen-bung-chong-cuon-vien-ren-cao-cho-ba-bau-sau-sinh-qr02-p164582536.html?spid=164582548,17,,,ARCTIC_HUNTER
,,https://tiki.vn/so-mi-nu-ke-soc-co-tron-ho-vai-arctichunter-vai-tho-mem-mat-thich-hop-mua-he-thoi-trang-tre-thuong-hieu-chinh-hang-p46782249.html?spid=67406417,18,,,ARCTIC_HUNTER
"Áo kiểu nữ vai trễ phối cổ nơ ArcticHunter, thời trang trẻ, phong cách Hàn Quốc",166.600₫,https://tiki.vn/ao-kieu-nu-vai-tre-phoi-co-no-arctichunter-thoi-trang-tre-phong-cach-han-quoc-p46308126.html?spid=58378914,19,,Đã bán 1,ARCTIC_HUNTER
"Đầm ôm dáng xòe đuôi cá ArcticHunter, thời trang trẻ, phong cách Hàn Quốc",89.000₫,https://tiki.vn/dam-om-dang-xoe-duoi-ca-arctichunter-thoi-trang-tre-phong-cach-han-quoc-p46653057.html?spid=67406425,20,,,ARCTIC_HUNTER
"Chân váy jeans dáng lửng khóa giữa ArcticHunter, thời trang phong cách trẻ - M",89.000₫,https://tiki.vn/chan-vay-jeans-dang-lung-khoa-giua-arctichunter-thoi-trang-phong-cach-tre-p73624028.html?spid=73624034,21,,,ARCTIC_HUNTER
"Áo vest linen nữ dáng lửng dày tay 2 túi nắp trẻ trung ArcticHunter, thời trang thương hiệu chính hãng - Đen",320.000₫,https://tiki.vn/ao-vest-linen-nu-dang-lung-day-tay-2-tui-nap-tre-trung-arctichunter-thoi-trang-thuong-hieu-chinh-hang-den-p113186611.html?spid=113186613,22,,Đã bán 1,ARCTIC_HUNTER
"Áo sơ mi nữ form rộng chất thô 2 túi ngực ArcticHunter, thời trang trẻ, phong cách Hàn Quốc, thương hiệu chính hãng",159.000₫,https://tiki.vn/ao-so-mi-nu-form-rong-chat-tho-2-tui-nguc-arctichunter-thoi-trang-tre-phong-cach-han-quoc-thuong-hieu-chinh-hang-p50194512.html?spid=67407582,23,,,ARCTIC_HUNTER
"Áo cardigan Linen nữ dáng dài 2 túi hộp ArcticHunter, thời trang phong cách Nhật Bản",250.000₫,https://tiki.vn/ao-cardigan-linen-nu-dang-dai-2-tui-hop-arctichunter-thoi-trang-phong-cach-nhat-ban-p73438742.html?spid=73438752,24,,Đã bán 15,ARCTIC_HUNTER
"Đầm suông voan kẻ xanh trẻ trung ArcticHunter, thời trang thương hiệu chính hãng",89.000₫,https://tiki.vn/dam-suong-voan-ke-xanh-tre-trung-arctichunter-thoi-trang-thuong-hieu-chinh-hang-p75390530.html?spid=75390534,25,,Đã bán 1,ARCTIC_HUNTER
,,https://tiki.vn/dam-xoe-cong-so-ho-vai-arctichunter-thoi-trang-thuong-hieu-chinh-hang-a1066-p75376540.html?spid=75376546,26,,,ARCTIC_HUNTER
"Đầm suông linen cổ đức sang trọng ArcticHunter, thời trang công sở 2021",250.000₫,https://tiki.vn/dam-suong-linen-co-duc-sang-trong-arctichunter-thoi-trang-cong-so-2021-p90475917.html?spid=90475923,27,,Đã bán 7,ARCTIC_HUNTER
Bộ đồ ngủ nữ 2 dây quyến rũ AH08,249.000₫,https://tiki.vn/bo-do-ngu-nu-2-day-quyen-ru-v08-p114878896.html?spid=114878915,28,,,ARCTIC_HUNTER
"Váy sơ mi suông dài tay, Đầm nữ chất thô đũi kẻ caro, kèm dây thắt eo thời trang công sở ARCTIC HUNTER Da187",299.000₫,https://tiki.vn/vay-so-mi-suong-dai-tay-dam-nu-chat-tho-dui-ke-caro-kem-day-that-eo-thoi-trang-cong-so-arctic-hunter-da187-p197684479.html?spid=197684487,29,,,ARCTIC_HUNTER
"Đầm Linen suông nữ rút eo, tay ngắn chất vải mềm mát, thời trang hè nữ công sở ARCTIC HUNTER AH169",299.000,https://tiki.vn/dam-linen-suong-nu-rut-eo-tay-ngan-chat-vai-mem-mat-thoi-trang-he-nu-cong-so-arctic-hunter-ah169-p187681232.html?spid=187681236,30,,,ARCTIC_HUNTER
,,https://tiki.vn/do-bo-mac-o-nha-thiet-ke-2-day-mat-me-hinh-dua-vn23-p106304200.html?spid=106304598,31,,,ARCTIC_HUNTER
Đầm midi suông trơn tay lỡ màu cốm nổi bật ARCTIC HUNTER Váy suông cộc tay phối khuy thiết kế basic mặc chơi,299.000₫,https://tiki.vn/dam-midi-suong-tron-tay-lo-mau-com-noi-bat-arctic-hunter-vay-suong-coc-tay-phoi-khuy-thiet-ke-basic-mac-choi-p197664677.html?spid=197664681,32,,,ARCTIC_HUNTER
"Đầm suông cổ sơ mi ARCTIC HUNTER, đầm lệch tà thời trang công sở AH92",199.000₫,https://tiki.vn/dam-suong-co-so-mi-arctic-hunter-dam-lech-ta-thoi-trang-cong-so-ah92-p151898929.html?spid=151898939,33,,,ARCTIC_HUNTER
"Áo thun nữ trắng giả yếm kẻ caro, thiết kế trẻ trung điệu đà, chất thun mềm co giãn ARCTIC HUNTER AH10",139.000₫,https://tiki.vn/ao-thun-nu-trang-gia-yem-ke-caro-thiet-ke-tre-trung-dieu-da-chat-thun-mem-co-gian-arctic-hunter-ah10-p269960091.html?spid=269960101,34,,,ARCTIC_HUNTER
"Đầm len nữ cao cấp, váy xòe phối ren ARCTIC HUNTER AH06",388.700,https://tiki.vn/dam-len-nu-cao-cap-vay-xoe-phoi-ren-arctic-hunter-ah06-p68723131.html?spid=161937135,35,,,ARCTIC_HUNTER
,,https://tiki.vn/ao-so-mi-nu-dai-tay-hoa-tiet-hoa-ah39-p98653510.html?spid=98653520,36,,,ARCTIC_HUNTER
"Đầm linen suông dáng dài, Đầm sơ mi nữ ngắn tay kèm dây thắt eo nhiều màu lựa chọn ARCTIC HUNTER AH75",299.000₫,https://tiki.vn/dam-linen-suong-dang-dai-dam-so-mi-nu-ngan-tay-kem-day-that-eo-nhieu-mau-lua-chon-arctic-hunter-ah75-p190320583.html?spid=190320591,37,,Đã bán 1,ARCTIC_HUNTER
"Đầm 2 dây, đầm mặc nhà vải mềm mịn thoáng mát nhiều màu Ah09",178.800₫,https://tiki.vn/dam-2-day-dam-mac-nha-vai-mem-min-thoang-mat-nhieu-mau-db09-p114878894.html?spid=114878906,38,,,ARCTIC_HUNTER
"Bộ sơ mi nữ form rộng và quần đùi trẻ trung, năng động chất liệu linen mềm ARCTIC HUNTER AH05",332.500₫,https://tiki.vn/bo-so-mi-nu-form-rong-va-quan-dui-tre-trung-nang-dong-chat-lieu-linen-mem-arctic-hunter-ah05-p273708178.html?spid=273708190,39,,,ARCTIC_HUNTER
Váy ngủ 2 dây thiết kế xẻ tà trước Vn13,141.550,https://tiki.vn/vay-ngu-2-day-thiet-ke-xe-ta-truoc-vn13-p106305121.html?spid=106305123,40,,,ARCTIC_HUNTER
