title,price,link_item,index,discount,sales,category
Áo thun nữ phong thụng dáng dài_ bầu bí bon chen thoải mái A093,70.000₫,https://tiki.vn/ao-thun-nu-phong-thung-dang-dai_-bau-bi-bon-chen-thoai-mai-a093-p148639087.html?spid=148639177,1,-49%,Đã bán 2,aonu
Áo sơ mi nữ trắng công sở MC A0074,139.000₫,https://tiki.vn/ao-so-mi-nu-trang-cong-so-mc-a0074-p21753427.html?spid=50323645,2,-12%,Đã bán 53,aonu
Áo thun Nữ croptop cổ tròn tay ngắn 7 màu cotton lạnh chất đẹp siêu co giãn chống bai xù,75.000₫,https://tiki.vn/ao-thun-nu-croptop-co-tron-tay-ngan-7-mau-cotton-lanh-chat-dep-sieu-co-gian-chong-bai-xu-p252657344.html?spid=252657516,3,-38%,Đã bán 26,aonu
"Áo croptop cổ vuông vạt yếm , crt tay ngắn ôm đẹp thun gân 100% cotton free size dưới 52 kg màu đen trắng",71.500₫,https://tiki.vn/ao-croptop-co-vuong-vat-yem-crt-tay-ngan-om-dep-thun-gan-100-cotton-free-size-duoi-52-kg-mau-den-trang-p142994964.html?spid=142995014,4,-4%,Đã bán 10,aonu
,,https://tiki.vn/ao-thun-nu-tay-lo-ao-phong-nam-nu-form-rong-freesize-vai-chat-cotton-min-mat-kita-unisex-mau-miss-out-p151554228.html?spid=151554234,5,-21%,,aonu
Áo sơ mi nữ cổ trụ kẻ sọc đen trắng trẻ trung sm13,140.000₫,https://tiki.vn/ao-so-mi-nu-co-tru-ke-soc-den-trang-tre-trung-sm13-p106303771.html?spid=106303883,6,-23%,Đã bán 5,aonu
Áo sơ mi nữ form rộng tay lỡ buộc dây 2 bên phong cách hàn quốc,75.000₫,https://tiki.vn/ao-so-mi-nu-form-rong-tay-lo-buoc-day-2-ben-phong-cach-han-quoc-p225938017.html?spid=225938019,7,-12%,Đã bán 2,aonu
Áo Sơ Mi Trắng Tay Dài,125.000₫,https://tiki.vn/ao-so-mi-trang-tay-dai-p247662076.html?spid=247662078,8,-12%,,aonu
Áo kiểu nữ tay ngắn thời trang Eden phối nút bọc - ASM170,279.000₫,https://tiki.vn/ao-kieu-nu-tay-ngan-thoi-trang-eden-phoi-nut-boc-asm170-p164227228.html?spid=164227232,9,-35%,Đã bán 25,aonu
,,https://tiki.vn/hang-san-ao-so-mi-lua-satin-hong-thiet-ke-phong-cach-chau-au-sm63-hang-quang-chau-cao-cap-p125021783.html?spid=250471112,10,,,aonu
Áo Sơ Mi Công Sở Nữ Cổ Chữ v Vải Tở Nhung Xếp Ly Kèm Phụ Kiện GOTI 3099,219.000₫,https://tiki.vn/ao-so-mi-cong-so-nu-co-chu-v-kem-phu-kien-o-co-goti-3099-p38073664.html?spid=38073670,11,,Đã bán 66,aonu
Áo giữ nhiệt thun lạnh siêu nhẹ,24.000₫,https://tiki.vn/ao-giu-nhiet-thun-lanh-sieu-nhe-p80415542.html?spid=200720566,12,,,aonu
,,https://tiki.vn/ao-thun-nu-ngan-tay-phong-cach-han-quoc-206352-p110165804.html?spid=115760794,13,,,aonu
Áo kiểu nữ cổ tròn viền đơn giản dễ thương,29.000₫,https://tiki.vn/ao-kieu-nu-co-tron-vien-don-gian-de-thuong-p91652010.html?spid=132003912,14,,Đã bán 9,aonu
"Áo sơ mi nữ form rộng trễ vai đuôi tôm vải Linen Premium trẻ trung, có 10 màu lựa chọn",250.000₫,https://tiki.vn/ao-so-mi-nu-form-rong-tre-vai-duoi-tom-vai-linen-premium-tre-trung-co-10-mau-lua-chon-lahstore-p206344273.html?spid=206344309,15,,Đã bán 18,aonu
"Áo Blouse Trắng, Bác Sĩ (Dài Tay), Nam Nữ, Áo Choàng Phòng Thí Nghiệm -VT0172",144.000₫,https://tiki.vn/ao-blouse-trang-bac-si-dai-tay-nam-nu-ao-choang-phong-thi-nghiem-vt0172-p147203631.html?spid=147203649,16,,Đã bán 102,aonu
"Bộ Blouse cổ tim Xanh Dương viền Trắng dành cho Nam Nữ - Bộ Scrubs đồng phục Kỹ thuật viên, Điều dưỡng, Dược sỹ, Y tá",96.000₫,https://tiki.vn/bo-blouse-co-tim-xanh-duong-vien-trang-danh-cho-nam-nu-bo-scrubs-dong-phuc-ky-thuat-vien-dieu-duong-duoc-sy-y-ta-p196184363.html?spid=196185243,17,,,aonu
,,https://tiki.vn/ao-thun-body-nu-tay-dai-phong-cach-141-p112804409.html?spid=138873982,18,,,aonu
(HÀNG SẴN) Áo Kiểu Nữ Dài Tay Trung Niên SM62 - Hàng Quảng Châu Cao Cấp,265.000₫,https://tiki.vn/hang-san-ao-kieu-nu-dai-tay-trung-nien-sm62-hang-quang-chau-cao-cap-p125020808.html?spid=125020898,19,,Đã bán 4,aonu
Áo Thun 3 Lỗ Nữ Sát Nách Vải Cotton Co Giãn 4 Chiều Cao Cấp In Chữ SUNDAY SN117 Sally Boutique,135.000₫,https://tiki.vn/ao-thun-3-lo-nu-sat-nach-vai-cotton-co-gian-4-chieu-cao-cap-in-chu-sunday-sally-sn117-p197742450.html?spid=197742595,20,,,aonu
"Siêu giảm giá. Áo phông trơn GOKING form ôm đẹp cho nữ, chất liệu thun 100% cotton siêu thoáng mát. Áo phông nữ hàng hiệu cao cấp",99.000₫,https://tiki.vn/ao-phong-tron-goking-form-om-dep-cho-nu-chat-lieu-thun-100-cotton-sieu-thoang-mat-p34316617.html?spid=44434900,21,,Đã bán 498,aonu
"Áo phông, áo thun nam nữ form rộng tay lỡ Unisex CÔ GÁI BÊN TRONG TRÀ SỮA Từ 50-70kg",45.000₫,https://tiki.vn/ao-phong-ao-thun-nam-nu-form-rong-tay-lo-unisex-co-ga-i-be-n-trong-tra-su-a-tu-50-70kg-p95940589.html?spid=205254897,22,,Đã bán 3,aonu
Áo thun tay lỡ form rộng unisex - Áo phông nam nữ oversize - T shirt the band,43.000₫,https://tiki.vn/ao-thun-tay-lo-form-rong-unisex-ao-phong-nam-nu-oversize-t-shirt-the-band-p141835465.html?spid=174392902,23,,Đã bán 14,aonu
"Áo thun croptop nữ tay lỡ , from rộng, freesize , thun cotton mềm mịn hình chú gấu",75.000₫,https://tiki.vn/ao-croptop-nu-tay-lo-from-rong-freesize-thun-cotton-mem-min-p148910215.html?spid=148910218,24,,Đã bán 3,aonu
Mã WAMT10K giảm ngay 10k cho đơn bất kì Áo thun mỏng cổ cao áo lót ulzzang,139.000₫,https://tiki.vn/ao-thun-mong-co-cao-ao-lot-ulzzang-p94658811.html?spid=94658818,25,,Đã bán 12,aonu
,,https://tiki.vn/ao-len-mongtoghi-nu-croptop-tay-ngan-det-kim-hoa-tiet-kieu-co-v-thoi-trang-phong-cach-hang-quang-chau-cao-cap-p192174210.html?spid=192174215,26,,,aonu
Áo thun tay lỡ form rộng - phông nam nữ cotton oversize - T shirt gấu Biesuo - 2N Unisex,99.000₫,https://tiki.vn/ao-thun-tay-lo-form-rong-phong-nam-nu-cotton-oversize-t-shirt-gau-biesuo-2n-unisex-p217176611.html?spid=217176615,27,,Đã bán 25,aonu
Áo Kiểu Nữ Thời Trang JUNO Dáng Croptop JNAKI022,299.000₫,https://tiki.vn/ao-kieu-nu-thoi-trang-juno-dang-croptop-jnaki022-p207910656.html?spid=207910673,28,,,aonu
Áo thun nữ ngắn tay cúc đóng mở chất vải Modal (gỗ Sồi) mềm mại tự nhiên mát lạnh mặc mùa hè mã VAA0360,149.000₫,https://tiki.vn/ao-thun-nu-ngan-tay-cuc-dong-mo-chat-vai-modal-go-soi-mem-mai-tu-nhien-mat-lanh-mac-mua-he-ma-vaa0360-p221276799.html?spid=221276805,29,,Đã bán 9,aonu
Áo Croptop Nữ Set croptop 2 món áo nữ SIÊU HOT,90.000₫,https://tiki.vn/ao-croptop-nu-set-croptop-2-mon-ao-nu-sieu-hot-p89250904.html?spid=96187160,30,,Đã bán 3,aonu
,,https://tiki.vn/ao-thun-tinh-yeu-tho-va-gau-ao-phong-nu-thoat-nhiet-nhat-ban-goking-p31603723.html?spid=85085068,31,,,aonu
Áo giữ nhiệt (có lót nỉ),69.000₫,https://tiki.vn/ao-giu-nhiet-co-lot-ni-p128308160.html?spid=128309836,32,,Đã bán 3,aonu
"Áo sơ mi nữ công sở, áo sơ mi nữ tay lỡ, áo sơ mi trơn đơn giản, màu xanh cốm hot trend HB116",140.000₫,https://tiki.vn/ao-so-mi-nu-cong-so-ao-so-mi-nu-tay-lo-ao-so-mi-tron-don-gian-mau-xanh-com-hot-trend-hb116-p175428288.html?spid=175428300,33,,Đã bán 3,aonu
"Áo croptop nữ tay lỡ , from rộng, freesize , thun cotton mềm mịn",84.000₫,https://tiki.vn/ao-croptop-nu-tay-lo-from-rong-freesize-thun-cotton-mem-min-p144379135.html?spid=144379140,34,,Đã bán 5,aonu
Áo thun nam nữ tay lỡ cô bé du bóng bay vải dày mịn 20T2759,24.900₫,https://tiki.vn/ao-thun-nam-nu-tay-lo-co-be-du-bong-bay-vai-day-min-20t2759-p190366428.html?spid=190369131,35,,,aonu
,,https://tiki.vn/ao-thun-the-thao-andromeda-co-soc-vai-ca-sau-me-nhe-mat-dong-phuc-dung-chung-nam-nu-p184824964.html?spid=184825886,36,,,aonu
"Áo sơ mi nữ Đũi Việt, áo sơ mi ngắn tay họa tiết xinh xắn SM69",219.000₫,https://tiki.vn/ao-so-mi-nu-dui-viet-ao-so-mi-ngan-tay-hoa-tiet-xinh-xan-sm69-p155766564.html?spid=155766566,37,,Đã bán 9,aonu
Áo Sơ Mi Nữ Kiểu Tay Bèo Cổ Nơ Dáng Suông Chất Voan Cao Cấp 12FNV2003ST,259.000₫,https://tiki.vn/ao-so-mi-nu-kieu-tay-beo-co-no-dang-suong-chat-voan-cao-cap-12fnv2003st-p263645658.html?spid=263645680,38,,,aonu
Áo Thun Nữ Tay Bèo Cánh Dơi Cổ Thuyền Thời Trang,100.000₫,https://tiki.vn/ao-thun-nu-tay-beo-canh-doi-co-thuyen-thoi-trang-p96311120.html?spid=96311140,39,,Đã bán 19,aonu
Áo thun nữ MXM cổ tròn ôm body cotton 4 chiều cực tôn dáng in chữ B.A.BE.S ( ANU006 ),85.000₫,https://tiki.vn/ao-thun-nu-mxm-co-tron-om-body-cotton-4-chieu-cuc-ton-dang-in-chu-b-a-be-s-anu006-p273257889.html?spid=54657214,40,,Đã bán 47,aonu
