title,price,link_item,index,discount,sales,brand
Bộ Đồ Lót Áo Cotton Có Gọng Đệm Vừa Nâng Ngực Lưng Logo Và Quần Lưng Xéo Đồng Bộ Miley Lingerie,313.000₫,https://tiki.vn/bo-do-lot-ao-cotton-co-gong-dem-vua-nang-nguc-lung-logo-va-quan-lung-xeo-dong-bo-miley-lingerie-p263087808.html?spid=263087810,1,-24%,,MileyLingerie
Combo 3 Quần Lót Cotton Lụa Plus Size Miley Lingerie Nature Wind FCP_11,190.000₫,https://tiki.vn/combo-3-quan-lot-cotton-lua-phoi-ren-plus-size-miley-lingerie-nature-wind-fcp_11-p109570000.html?spid=109570004,2,-20%,Đã bán 21,MileyLingerie
Combo 4 Quần Vải Cotton Tự Nhiên Viền Lưng Logo BeingMe Miley Lingerie,237.000₫,https://tiki.vn/bo-5-quan-lot-nu-cotton-phoi-ren-miley-lingerie-fcb02-p203176110.html?spid=203176112,3,-50%,,MileyLingerie
Áo Ngực Nữ Có Gọng Mút Vừa Miley Lingerie - Màu đen BRM01002,199.000,https://tiki.vn/ao-nguc-nu-co-gong-mut-vua-miley-lingerie-mau-den-brm01002-p68221251.html?spid=68221259,4,,,MileyLingerie
,,https://tiki.vn/combo-2-cap-mieng-dan-nguc-sieu-dinh-matte-hinh-trontai-su-dung-nhieu-lan-mieng-dan-tang-hinh-cho-nu-p262383371.html?spid=262383372,5,,,MileyLingerie
Đầm Ngủ Nữ Ngắn Có Tay Hoa Văn Natural Blow Miley Lingerie_DCP0301,385.000₫,https://tiki.vn/dam-ngu-nu-ngan-co-tay-hoa-van-natural-blow-miley-lingerie_dcp0301-p75976829.html?spid=75976833,6,-30%,Đã bán 2,MileyLingerie
Áo Ngực Cúp Ngang Phối Viền Ren Miley Lingerie BRM02212,229.000₫,https://tiki.vn/ao-nguc-cup-ngang-phoi-vien-ren-miley-lingerie-brm02212-p46823737.html?spid=46823749,7,-34%,Đã bán 2,MileyLingerie
Đồ Mặc Nhà Nữ Sát Nách Thun Lụa Cao Cấp Natural Blow Miley Lingerie_DBC0201,259.000₫,https://tiki.vn/do-mac-nha-nu-sat-nach-thun-lua-cao-cap-natural-blow-miley-lingerie_dbc0201-p75978313.html?spid=75978321,8,-55%,Đã bán 5,MileyLingerie
