title,price,link_item,index,discount,sales,category
Áo thun gia đình đẹp in vẽ gia đình mèo dễ thương cao cấp,139.150₫,https://tiki.vn/ao-thun-gia-dinh-dep-in-ve-gia-dinh-meo-de-thuong-cao-cap-p190439172.html?spid=190439248,1,,,dodoi
Áo thun FALI mtt148,23.400₫,https://tiki.vn/ao-thun-fali-mtt148-p190425830.html?spid=190425992,2,,,dodoi
Áo thun unisex môi gợi cảm form rộng vải dày mịn 2019T919,24.900₫,https://tiki.vn/ao-thun-unisex-moi-goi-cam-form-rong-vai-day-min-2019t919-p190373529.html?spid=190373680,3,,,dodoi
Áo thun tay lỡ in chữ study focused,46.800₫,https://tiki.vn/ao-thun-tay-lo-in-chu-study-focused-p190372237.html?spid=190374037,4,,,dodoi
,,https://tiki.vn/ao-thun-form-rong-unisex-hoa-tiet-ca-tinh-vai-day-min-2019t22073-p190371983.html?spid=190373554,5,,,dodoi
Áo thun unisex form rộng cún dadbing vải dày mịn đẹp 2019T1961,24.900₫,https://tiki.vn/ao-thun-unisex-form-rong-cun-dadbing-vai-day-min-dep-2019t1961-p190373513.html?spid=190373660,6,,,dodoi
Áo thun nam nữ chữ kiểu cá tính form rộng vải dày mịn 2020T2846,53.000₫,https://tiki.vn/ao-thun-nam-nu-chu-kieu-ca-tinh-form-rong-vai-day-min-2020t2846-p190374656.html?spid=190375921,7,,,dodoi
Áo thun unisex câu nói hay form rộng vải dày mịn 2019T976,24.900₫,https://tiki.vn/ao-thun-unisex-cau-noi-hay-form-rong-vai-day-min-2019t976-p190380395.html?spid=190380556,8,,,dodoi
Áo thun cặp đôi in hình thần tượng BTS chibi form rộng phong cách hàn quốc,78.150₫,https://tiki.vn/ao-thun-cap-doi-in-hinh-than-tuong-bts-chibi-form-rong-phong-cach-han-quoc-p190377985.html?spid=190378139,9,,,dodoi
,,https://tiki.vn/ao-thun-nam-in-hinh-su-tu-mtt230-p190360375.html?spid=190360553,10,,,dodoi
Áo thun unisex in sup độc lạ chất vải dày mịn 2019ts580,53.000₫,https://tiki.vn/ao-thun-unisex-in-sup-doc-la-chat-vai-day-min-2019ts580-p190361020.html?spid=190361671,11,,,dodoi
Áo thun Unisex form rộng vợ tôi biết hết Hàn Quốc vải dày mịn 2019T1536,53.000₫,https://tiki.vn/ao-thun-unisex-form-rong-vo-toi-biet-het-han-quoc-vai-day-min-2019t1536-p190360362.html?spid=190360982,12,,,dodoi
,,https://tiki.vn/ao-thun-form-rong-unisex-chu-run-kieu-vai-day-min-2019t22078-p190360165.html?spid=190360554,13,,,dodoi
FreeShip Đơn 50K ️Siêu Phẩm️ Áo thun nam nữ chữ kiểu tay lỡ đẹp vải dày mịn,53.000₫,https://tiki.vn/freeship-don-50k-sieu-pham-ao-thun-nam-nu-chu-kieu-tay-lo-dep-vai-day-min-p190360665.html?spid=190360795,14,,,dodoi
Áo thun tay lỡ nam nữ chim hạ trên cầu form rộng vải dày mịn 2020T2664,24.900₫,https://tiki.vn/ao-thun-tay-lo-nam-nu-chim-ha-tren-cau-form-rong-vai-day-min-2020t2664-p190363332.html?spid=190363497,15,,,dodoi
Áo thun tay lỡ Hàn Quốc form rộng in hình chibi thần tượng BTS vải dày mịn TEEWO128,53.000₫,https://tiki.vn/ao-thun-tay-lo-han-quoc-form-rong-in-hinh-chibi-than-tuong-bts-vai-day-min-teewo128-p190365367.html?spid=190365516,16,,,dodoi
Áo thun unisex Hàn Quốc in chữ kiểu người dơi vải dày mịn 2019T1080,53.000₫,https://tiki.vn/ao-thun-unisex-han-quoc-in-chu-kieu-nguoi-doi-vai-day-min-2019t1080-p190365408.html?spid=190366916,17,,,dodoi
,,https://tiki.vn/ao-thun-unisex-phong-cach-ca-tinh-mau-trang-2019t836-p190364985.html?spid=190365152,18,,,dodoi
Áo thun unisex phong cách cá tính đẹp rẻ 2019S566,53.000₫,https://tiki.vn/ao-thun-unisex-phong-cach-ca-tinh-dep-re-2019s566-p190366397.html?spid=190366847,19,,,dodoi
Áo thun cặp đôi in hình thần tượng J-Hope BTS chibi form rộng phong cách hàn quốc,53.000₫,https://tiki.vn/ao-thun-cap-doi-in-hinh-than-tuong-j-hope-bts-chibi-form-rong-phong-cach-han-quoc-p190367084.html?spid=190368196,20,,,dodoi
Áo thun gia đình đẹp in gia đình pepe big dễ thương cao cấp,139.150₫,https://tiki.vn/ao-thun-gia-dinh-dep-in-gia-dinh-pepe-big-de-thuong-cao-cap-p190428653.html?spid=190428738,21,,,dodoi
Áo thun unisex form rộng chữ kiểu cá tính vải dày mịn đẹp 2019T1977,53.000₫,https://tiki.vn/ao-thun-unisex-form-rong-chu-kieu-ca-tinh-vai-day-min-dep-2019t1977-p190419188.html?spid=190420356,22,,,dodoi
Áo thun cặp đôi trắng đen chữ kiểu đẹp vải dày mịn,53.000₫,https://tiki.vn/ao-thun-cap-doi-trang-den-chu-kieu-dep-vai-day-min-p190411760.html?spid=190413615,23,,,dodoi
Áo thun gia đình in chữ Chúc mừng 8-3,65.000₫,https://tiki.vn/ao-thun-gia-dinh-in-chu-chuc-mung-8-3-p217769833.html?spid=217769905,24,,,dodoi
Áo Sơ Mi Trắng Cặp Đôi Họa Tiết Cao Cấp | Áo Đôi Nam Nữ Đẹp C38,99.000₫,https://tiki.vn/ao-so-mi-trang-cap-doi-hoa-tiet-cao-cap-ao-doi-nam-nu-dep-c38-p90418857.html?spid=273449390,25,,,dodoi
,,https://tiki.vn/ao-so-mi-cap-doi-5-nut-cach-dieu-hoa-tiet-ao-doi-nam-nu-dep-p90419622.html?spid=273447997,26,,,dodoi
(VIDEO) Bst áo sơ mi đôi nam nữ phối viền họa tiết | Áo sơ mi cặp đẹp giá tốt | Áo Chất Store (Giá 1 Áo),59.000₫,https://tiki.vn/video-bst-ao-so-mi-doi-nam-nu-phoi-vien-hoa-tiet-ao-so-mi-cap-dep-gia-tot-ao-chat-store-gia-1-ao-p90418696.html?spid=273448389,27,,,dodoi
(SIÊU PHẨM) Áo sơ mi đôi phối màu búng tim cao cấp | Áo cặp sơ mi nam nữ đẹp (giá 1 áo) | Áo Chất Store,99.000₫,https://tiki.vn/sieu-pham-ao-so-mi-doi-phoi-mau-bung-tim-cao-cap-ao-cap-so-mi-nam-nu-dep-gia-1-ao-ao-chat-store-p90415758.html?spid=273450035,28,,,dodoi
SƠ MI ĐÔI NAM NỮ ĐẸP PHỐI VIỀN HỌA TIẾT CHIM BAY [GIÁ 1 ÁO,99.000₫,https://tiki.vn/so-mi-doi-nam-nu-dep-phoi-vien-hoa-tiet-chim-bay-gia-1-ao-p90420488.html?spid=273448579,29,,,dodoi
Set Đồ Đôi Váy Áo Mới Đẹp Tuyệt Vời,299.000,https://tiki.vn/set-do-doi-vay-ao-moi-dep-tuyet-voi-p273769052.html?spid=273769060,30,,,dodoi
,,https://tiki.vn/ao-so-mi-doi-nam-nu-chu-love-cao-cap-so-mi-cap-gia-re-p90428125.html?spid=273424490,31,,,dodoi
ÁO SƠ MI ĐÔI CỔ TRỤ HỌA TIẾT CHIM BAY CAO CẤP | GIÁ 1 ÁO,99.000₫,https://tiki.vn/ao-so-mi-doi-co-tru-hoa-tiet-chim-bay-cao-cap-gia-1-ao-p90423500.html?spid=273446446,32,,,dodoi
Siêu Phẩm Áo Sơ Mi Đôi Cá Tính,99.000₫,https://tiki.vn/sieu-pham-ao-so-mi-doi-ca-tinh-p90415382.html?spid=273458090,33,,,dodoi
Áo Sơ Mi Cặp Đôi Chữ Love Cao Cấp | Hàng Shop,99.000₫,https://tiki.vn/ao-so-mi-cap-doi-chu-love-cao-cap-hang-shop-p90425122.html?spid=273445293,34,,,dodoi
Mẫu chụp tại shop - váy áo đôi nam nữ họa tiết đi biển nhà Tina,199.000,https://tiki.vn/mau-chup-tai-shop-vay-ao-doi-nam-nu-hoa-tiet-di-bien-nha-tina-p271960437.html?spid=271960439,35,,,dodoi
,,https://tiki.vn/ao-thun-in-hinh-la-2-chung-ta-la-1-gia-dinh-p216914432.html?spid=216914438,36,,,dodoi
Mẫu đồ đôi họa tiết mới nhất Couple Tina 1 - AV008,299.000₫,https://tiki.vn/mau-do-doi-hoa-tiet-moi-nhat-couple-tina-1-av008-p264018000.html?spid=264018018,37,,,dodoi
ĐỒ ĐÔI CHỤP ẢNH CƯỚI GIÁ TỐT ( ẢNH THẬT),299.000₫,https://tiki.vn/do-doi-chup-anh-cuoi-gia-tot-anh-that-p162055346.html?spid=263983584,38,,,dodoi
ÁO VÁY ĐÔI NAM NỮ CHỤP ẢNH CƯỚI - CS166,299.000₫,https://tiki.vn/ao-vay-doi-nam-nu-chup-anh-cuoi-cs166-p140823000.html?spid=263983520,39,,,dodoi
Khẩu Trang Lụa Tơ Tằm 3 Lớp Kháng Khuẩn Người Lớn I Silk Face Mask,110.000,https://tiki.vn/khau-trang-lua-to-tam-3-lop-khang-khuan-nguoi-lon-i-silk-face-mask-p148680071.html?spid=148680085,40,,,dodoi
