title,price,link_item,index,discount,sales,brand
Máy Xay Sinh Tố Elmich BLE-1845 - 1.5 Lít - Hàng chính hãng,710.000₫,https://tiki.vn/may-xay-sinh-to-elmich-ble-1845-1-5l-hang-chinh-hang-p11311234.html?spid=20741561,1,,,Elmich
Bếp Điện Từ Cảm Ứng Elmich ICE-1831 - Mặt Kính Ceramic Cường Lực - Hàng Chính Hãng,1.550.000₫,https://tiki.vn/bep-dien-tu-cam-ung-elmich-ice-1831-mat-kinh-ceramic-cuong-luc-bao-hanh-chinh-hang-2-nam-p184497494.html?spid=184497496,2,,,Elmich
"Bếp điện từ đơn Elmich ICE-1831, Công suất 2100W, Mặt kính Ceramic siêu bền, Hàng chính hãng - Bảo hành 24 tháng",1.390.000₫,https://tiki.vn/bep-dien-tu-don-elmich-ice-1831-cong-suat-2100w-bao-hanh-24-thang-p242657535.html?spid=242657536,3,-11%,,Elmich
"Máy xay sinh tố Elmich BLE3888 1000W - Hàng chính hãng (Xanh nhạt, xanh đậm, Hồng phấn, Vàng kem)",1.289.000,https://tiki.vn/may-xay-sinh-to-elmich-ble3888-1000w-hang-chinh-hang-xanh-nhat-xanh-dam-hong-phan-vang-kem-p258894633.html?spid=258894641,4,-50%,Đã bán 1,Elmich
,,https://tiki.vn/noi-lau-hap-dien-elmich-3566-hang-chinh-hang-p39671288.html?spid=57555977,5,-20%,,Elmich
Bếp điện từ đơn Elmich ICE-3879 - Hàng chính hãng,1.599.000₫,https://tiki.vn/bep-dien-tu-don-elmich-ice-3879-hang-chinh-hang-p273322821.html?spid=273322822,6,-8%,,Elmich
"Máy Ép Trái Cây Tốc Độ Chậm Elmich JEE-3898 (Công Suất 240W, - Ống Tiếp Nguyên Liệu size Lớn 83mm) - Hàng chính hãng",3.890.000₫,https://tiki.vn/may-ep-trai-cay-toc-do-cham-elmich-jee-3898-cong-suat-240w-ong-tiep-nguyen-lieu-size-lon-83mm-hang-chinh-hang-p194125353.html?spid=194125354,7,,Đã bán 2,Elmich
"Bếp Từ Đơn Elmich Smartcook ICS-3869 (Công Suất 2100W, Điều Khiển Cảm Ứng, Mặt Kính Ceramic Cường Lực, Chống Sốc Nhiệt) - Hàng Chính Hãng",1.290.000₫,https://tiki.vn/bep-tu-don-elmich-smartcook-ics-3869-cong-suat-2100w-dieu-khien-cam-ung-mat-kinh-ceramic-cuong-luc-chong-soc-nhiet-hang-chinh-hang-p194141515.html?spid=194141516,8,-22%,Đã bán 10,Elmich
Bếp điện từ Elmich ICE-3874 - Hàng chính hãng,1.070.000,https://tiki.vn/bep-dien-tu-elmich-ice-3874-hang-chinh-hang-p153495047.html?spid=153495048,9,,,Elmich
,,https://tiki.vn/noi-com-dien-smartcook-elmich-rcs-0892-1-8l-hang-chinh-hang-p985220.html?spid=140546253,10,,,Elmich
"Máy Làm Sữa Hạt Đa Năng Cao Cấp 9 Chế Độ Nầu Elmich CBE3902, Hàng Chính Hãng",3.999.000₫,https://tiki.vn/may-lam-sua-hat-da-nang-cao-cap-9-che-do-nau-elmich-cbe3902-p262503921.html?spid=262503926,11,,,Elmich
Nồi Cơm Điện Elmich RCS-0893 (1.8L) - Vàng Đồng - Hàng chính hãng,560.000,https://tiki.vn/noi-com-dien-elmich-rcs-0893-1-8l-vang-dong-hang-chinh-hang-p909900.html?spid=46693762,12,,,Elmich
,,https://tiki.vn/am-dun-nuoc-sieu-toc-elmich-1l-kee-1775-p263580114.html?spid=263580115,13,,,Elmich
"Bếp Từ Đơn Elmich Smartcook ICS-3873 (Công Suất 2100W, Điều Khiển Cảm Ứng, Mặt Kính Ceramic Cường Lực, Chống Sốc Nhiệt) - Hàng Chính Hãng",1.329.000₫,https://tiki.vn/bep-tu-don-elmich-smartcook-ics-3873-cong-suat-2100w-dieu-khien-cam-ung-mat-kinh-ceramic-cuong-luc-chong-soc-nhiet-hang-chinh-hang-p194140444.html?spid=194140445,14,,Đã bán 9,Elmich
Máy Hút Ẩm Kiêm Lọc Không Khí ELMICH DE-3923 Dung Tích 20L Di Chuyển Dễ Dàng Diệt Khuẩn 99% Phù Hợp Không Gian 50 m2 Công Suất 370W - Hàng Chính Hãng,6.689.000₫,https://tiki.vn/may-hut-am-kiem-loc-khong-khi-elmich-de-3923-dung-tich-20l-di-chuyen-de-dang-diet-khuan-99-phu-hop-khong-gian-50-m2-cong-suat-370w-hang-chinh-hang-p217452938.html?spid=217452944,15,,,Elmich
Bếp điện từ Elmich ICE-1831 hàng chính hãng,1.035.000₫,https://tiki.vn/bep-dien-tu-elmich-ice-1831-hang-chinh-hang-p192146238.html?spid=192146239,16,,,Elmich
Máy xay sinh tố cầm tay Elmich BLE 3889 - Hàng chính hãng,899.000,https://tiki.vn/may-xay-sinh-to-cam-tay-elmich-ble-3889-p271027435.html?spid=271027436,17,,,Elmich
,,https://tiki.vn/may-vat-cam-elmich-eda-0809-p263580149.html?spid=263580150,18,,,Elmich
Máy Xay Sinh Tố Elmich BLE-1846 - Hàng Chính Hãng,1.429.000₫,https://tiki.vn/may-xay-sinh-to-elmich-ble-1846-hang-chinh-hang-p270805642.html?spid=270805643,19,,,Elmich
"Ấm đun siêu tốc Elmich KEE-1776 (Mầu Đỏ, Dung Tích 1,8 Lít, Công Suất 2200W, Có đồng hồ báo nhiệt độ nước) - Hàng Chính Hãng",1.690.000₫,https://tiki.vn/am-dun-sieu-toc-elmich-kee-1776-mau-do-dung-tich-1-8-lit-cong-suat-2200w-co-dong-ho-bao-nhiet-do-nuoc-hang-chinh-hang-p224123757.html?spid=224123760,20,,,Elmich
Bếp điện từ Elmich ICE-1832 hàng chính hãng,1.100.000₫,https://tiki.vn/bep-dien-tu-elmich-ice-1832-hang-chinh-hang-p142030151.html?spid=142030152,21,,Đã bán 1,Elmich
Máy xay thịt Elmich EDA0829 công xuất 350W dung tích cối 1.2 L - Hàng chính hãng,620.000₫,https://tiki.vn/may-xay-thit-elmich-eda0829-cong-xuat-350w-dung-tich-coi-1-2-l-hang-chinh-hang-p182787167.html?spid=183314434,22,,Đã bán 2,Elmich
Máy Ép Trái Cây Elmich JEE-3898 - Hàng Chính Hãng,3.119.200₫,https://tiki.vn/may-ep-trai-cay-elmich-jee-3898-hang-chinh-hang-p270804663.html?spid=270808897,23,,,Elmich
Bếp điện từ Elmich ICE-3874 - Hàng chính hãng,1.079.000₫,https://tiki.vn/bep-dien-tu-elmich-ice-3874-hang-chinh-hang-p201706249.html?spid=201706250,24,,,Elmich
"Nồi cơm điện tử Elmich 1,8L RCE-1790 Hàng chính hãng",1.690.000,https://tiki.vn/noi-com-dien-tu-elmich-1-8l-rce-1790-p132879750.html?spid=162994065,25,,,Elmich
,,https://tiki.vn/noi-ap-suat-smartcook-pcs-1800-5l-hang-chinh-hang-p11311238.html?spid=72537017,26,,,Elmich
Nồi cơm áp suất đa năng Elmich PCE-1806 (5L),2.690.000₫,https://tiki.vn/noi-com-ap-suat-da-nang-elmich-pce-1806-5l-p263580129.html?spid=263580130,27,,Đã bán 1,Elmich
Nồi cơm điện tử cao tần Elmich 1.5 lít RCE-3914 - Hàng chính hãng,2.649.000₫,https://tiki.vn/noi-com-dien-tu-cao-tan-elmich-1-5-lit-rce-3914-hang-chinh-hang-p250936191.html?spid=250936219,28,,,Elmich
"Máy xay đa năng Elmich FPE-3887 (Công Suất 300W - Xay sinh tố, Xay thịt, Xay thực phẩm khô) - Hàng Chính Hãng",1.850.000₫,https://tiki.vn/may-xay-da-nang-elmich-fpe-3887-cong-suat-300w-xay-sinh-to-xay-thit-xay-thuc-pham-kho-hang-chinh-hang-p203827202.html?spid=203827203,29,,Đã bán 1,Elmich
"Vỉ Nướng Điện Elmich EGE-3641 (Công suất 1800W, Điều Chỉnh Nhiệt 5 Cấp Độ) - Hàng Chính Hãng",1.890.000,https://tiki.vn/vi-nuong-dien-elmich-ege-3641-cong-suat-1800w-dieu-chinh-nhiet-5-cap-do-hang-chinh-hang-p201855165.html?spid=201855166,30,,,Elmich
,,https://tiki.vn/may-xay-sinh-to-elmich-ble-1844-hang-chinh-hang-p270805462.html?spid=270805463,31,,,Elmich
Ấm Siêu Tốc Đun Nước ELMICH 1.7L Bình Đun Nước Siêu Tốc Hiển Thị Nhiệt Độ EL3856W Hàng Chính Hãng,1.190.000₫,https://tiki.vn/am-sieu-toc-dun-nuoc-elmich-1-7l-binh-dun-nuoc-sieu-toc-hien-thi-nhiet-do-el3856w-hang-chinh-hang-p198207799.html?spid=236235888,32,,,Elmich
Nồi cơm điện tử Elmich RCE-1789 - 1.2 lít - Hàng chính hãng,1.390.000₫,https://tiki.vn/noi-com-dien-tu-elmich-rce-1789-1-2-lit-hang-chinh-hang-p155142298.html?spid=155142299,33,,Đã bán 2,Elmich
Nồi Cơm Điện Smartcook Elmich EL-7167 (1.8L) - Hàng chính hãng,650.000₫,https://tiki.vn/noi-com-dien-smartcook-elmich-el-7167-1-8l-hang-chinh-hang-p985228.html?spid=140544159,34,,Đã bán 8,Elmich
Bếp điện từ Elmich ICE-3874,1.435.000,https://tiki.vn/bep-dien-tu-elmich-ice-3874-p263580144.html?spid=263580145,35,,,Elmich
,,https://tiki.vn/am-dun-nuoc-sieu-toc-elmich-1l-kee-1775-hang-chinh-hang-p247892492.html?spid=247892493,36,,,Elmich
Máy ép trái cây Elmich JEE-3898,3.890.000₫,https://tiki.vn/may-ep-trai-cay-elmich-jee-3898-p263580142.html?spid=263580143,37,,,Elmich
Máy sấy bát Smartcook DDS-3906,2.599.000₫,https://tiki.vn/may-say-bat-smartcook-dds-3906-p263580148.html?spid=263580151,38,,,Elmich
Máy xay thịt đa năng Elmich EDA-0806 / EDA-0829 (Cối Thủy Tinh - Công suất 350W) - Hàng Chính Hãng,1.250.000₫,https://tiki.vn/may-xay-thit-da-nang-elmich-eda-0806-eda-0829-coi-thuy-tinh-cong-suat-350w-hang-chinh-hang-p253236215.html?spid=253236217,39,,,Elmich
"Nồi cơm điện tử Elmich 1,2L RCE-1789 Hàng chính hãng",1.370.000,https://tiki.vn/noi-com-dien-tu-elmich-1-2l-rce-1789-p132880276.html?spid=132880277,40,,Đã bán 5,Elmich
