title,price,link_item,index,discount,sales,brand
Nồi Nấu Chậm Bear DDZ-A08G2 - Phiên Bản Quốc Tế - Hàng Chính Hãng,391.000₫,https://tiki.vn/noi-nau-cham-bear-ddz-a08g2-phien-ban-quoc-te-hang-chinh-hang-p99081935.html?spid=248590692,1,-13%,,Bear
"Nồi Áp Suất Điện Đa Năng 5L Bear Ninh Xương, Hầm Gà, Nấu Cháo YLB-A50M1 - Hàng Chính Hãng",1.460.000₫,https://tiki.vn/noi-ap-suat-dien-da-nang-5l-bear-ninh-xuong-ham-ga-nau-chao-ylb-a50m1-hang-chinh-hang-p187063545.html?spid=263202970,2,-49%,Đã bán 3,Bear
"Nồi Kho Thịt, Nồi Chưng Yến, Nồi Nấu Chậm BEAR SUBE003 - Bản Tiếng Việt Kèm Khay Hấp Và 5 Thố Dung Tích 2.5 Lít Công Suất 380 W- Hàng Chính Hãng",1.169.000₫,https://tiki.vn/noi-kho-thit-noi-chung-yen-noi-nau-cham-bear-sube003-ban-tieng-viet-kem-khay-hap-va-5-tho-dung-tich-2-5-lit-cong-suat-380-w-hang-chinh-hang-p253328282.html?spid=106032492,3,,Đã bán 227,Bear
"Máy Xay Thực Phẩm Đa Năng, Máy Xay Ăn Dặm BEAR GR-B03V2 Xay Cực Êm An Toàn Vệ Sinh, Dung Tích 0.3 Lít Công Suất 120 W - Hàng Chính Hãng",539.000,https://tiki.vn/may-xay-thuc-pham-da-nang-may-xay-an-dam-bear-gr-b03v2-xay-cuc-em-an-toan-ve-sinh-dung-tich-0-3-lit-cong-suat-120-w-hang-chinh-hang-p250740073.html?spid=145467073,4,,,Bear
,,https://tiki.vn/noi-lau-dien-mini-noi-lau-nuong-bear-dkl-c12d1-dung-tich-1-2-lit-cong-suat-1200-w-hang-nhap-khau-p221265124.html?spid=124630372,5,-18%,,Bear
Máy xay sinh tố hoa quả cầm tay Bear LLJ-D04A1- Hàng chính hãng,449.000₫,https://tiki.vn/may-xay-sinh-to-hoa-qua-cam-tay-bear-llj-d04a1-hang-chinh-hang-p197722961.html?spid=242766546,6,-50%,Đã bán 7,Bear
"Lò nướng điện Bear DKX-F10K5 - Nhỏ gọn, dễ sử dụng - Hàng chính hãng",779.000₫,https://tiki.vn/lo-nuong-dien-bear-dkx-f10k5-nho-gon-de-su-dung-hang-chinh-hang-p270122391.html?spid=270122392,7,-5%,Đã bán 2,Bear
"Máy Làm Sữa Hạt Cách Âm, Máy Xay Nấu Sữa Hạt BEAR PBJ-B06W1 Dung Tích 1 Lít Công Suất 1000 W - Hàng Nhập Khẩu",1.989.000₫,https://tiki.vn/may-lam-sua-hat-cach-am-may-xay-nau-sua-hat-bear-pbj-b06w1-dung-tich-1-lit-cong-suat-1000-w-hang-nhap-khau-p229745776.html?spid=188208591,8,,Đã bán 3,Bear
"Nồi điện đa năng mini Bear P08D1, 0.8 lít, hầm cháo, nấu canh, nầu cơm...giữ ấm thức ăn, tiện lợi, kiểu dáng thời trang - Hàng Chính Hãng",695.000,https://tiki.vn/noi-dien-da-nang-mini-bear-p08d1-0-8-lit-ham-chao-nau-canh-nau-com-giu-am-thuc-an-tien-loi-kieu-dang-thoi-trang-hang-chinh-hang-p250757301.html?spid=271807577,9,,,Bear
,,https://tiki.vn/am-dun-sieu-toc-giu-nhiet-bear-sb-st17t-1800w-dung-tich-1-7l-cam-ung-de-dang-su-dung-hang-chinh-hang-p263274092.html?spid=270701833,10,-13%,,Bear
"Nồi Chưng Yến, Nồi Nấu Cháo, Nồi Nấu Chậm BEAR SUBE003/ DDZ-C25R6/ DDZ-B25Q3 Bản Tiếng Anh Có Lồng Hấp Tự Động Hoàn Toàn Chống Trào, Chống Cháy Dung Tích 2.5 Lít - Hàng Chính Hãng",1.116.250₫,https://tiki.vn/noi-chung-yen-noi-nau-chao-noi-nau-cham-bear-sube003-ddz-c25r6-ddz-b25q3-ban-tieng-anh-co-long-hap-tu-dong-hoan-toan-chong-trao-chong-chay-dung-tich-2-5-lit-hang-chinh-hang-p247705870.html?spid=272270487,11,-5%,,Bear
"Nồi Chưng Yến, Nồi Ninh Hấp, Nồi Cách Thủy, Nồi Nấu Cháo Chậm UNIE USC08W Chống Trào, Chống Cháy Gồm 6 Chương Trình Nấu Cài Sẵn Dung Tích 0.8 Lít Công Suất 200 W - Hàng Chính Hãng",879.000,https://tiki.vn/noi-chung-yen-noi-ninh-hap-noi-cach-thuy-noi-nau-chao-cham-unie-usc08w-chong-trao-chong-chay-gom-6-chuong-trinh-nau-cai-san-dung-tich-0-8-lit-cong-suat-200-w-hang-chinh-hang-p251257785.html?spid=164992303,12,-41%,,Bear
,,https://tiki.vn/may-danh-trung-tron-bot-cam-tay-bear-10-toc-do-cs-300w-anh-lam-store-p248703808.html?spid=248703810,13,,,Bear
"Nồi cơm điện Bear DFB-C40K6 - Dung tích 4L, Chống dính, Cài đặt Hẹn giờ - HÀNG CHÍNH HÃNG",1.290.000₫,https://tiki.vn/noi-com-dien-bear-dfb-c40k6-dung-tich-4l-chong-dinh-cai-dat-hen-gio-hang-chinh-hang-p273135225.html?spid=273135226,14,-41%,Đã bán 1,Bear
"Máy Xay Thịt, Xay Ăn Dặm Cho Bé BEAR QSJ-B02U2, Xay Cực Êm Dung Tích 0.6L, Công Suất 200W - Hàng Chính Hãng",422.750₫,https://tiki.vn/may-xay-thit-xay-an-dam-cho-be-bear-qsj-b02u2-xay-cuc-em-dung-tich-0-6l-cong-suat-200w-hang-chinh-hang-p188783663.html?spid=247669128,15,-48%,Đã bán 1,Bear
"Máy Xay Thực Phẩm Đa Năng, Máy Xay Ăn Dặm BEAR QSJ-D02Q1 Xay Cực Êm An Toàn Vệ Sinh Dung Tích 0.6 Lít Công Suất 200 W - Hàng Nhập Khẩu",659.000₫,https://tiki.vn/may-xay-thuc-pham-da-nang-may-xay-an-dam-bear-qsj-d02q1-xay-cuc-em-an-toan-ve-sinh-dung-tich-0-6-lit-cong-suat-200-w-hang-nhap-khau-p250752492.html?spid=123729255,16,-5%,Đã bán 29,Bear
Máy xay sinh tố cầm tay Bear BL-B35V1 - Hàng chính hãng,479.000,https://tiki.vn/may-xay-sinh-to-cam-tay-bear-bl-b35v1-hang-chinh-hang-p263960485.html?spid=263960486,17,,Đã bán 2,Bear
,,https://tiki.vn/may-xay-thit-thuc-pham-da-nang-bear-qsj-b02q1-gom-4-luoi-kep-2l-xay-thit-rau-cu-qua-tien-loi-hang-chinh-hang-p209888074.html?spid=247496290,18,-48%,,Bear
Máy Sinh Tố Cầm Tay BEAR LLJ-E03F1 Dùng PIN Sạc Dung Tích 300 ML Công Suất 50 W - Hàng Nhập Khẩu,599.000₫,https://tiki.vn/may-sinh-to-cam-tay-bear-llj-e03f1-dung-pin-sac-dung-tich-300-ml-cong-suat-50-w-hang-nhap-khau-p250731956.html?spid=123881160,19,-5%,Đã bán 11,Bear
Nồi chiên không dầu Bear QZG-F15G1 - Hàng Chính Hãng,2.109.000₫,https://tiki.vn/noi-chien-khong-dau-bear-qzg-f15g1-hang-chinh-hang-p273098531.html?spid=273098534,20,,Đã bán 3,Bear
Máy hút bụi giường nệm đa năng Bear CMY-B03M1 - Hàng Chính Hãng,1.790.000₫,https://tiki.vn/may-hut-bui-giuong-nem-da-nang-bear-cmy-b03m1-hang-chinh-hang-p208133109.html?spid=208133110,21,-49%,Đã bán 5,Bear
"Máy làm sữa hạt Bear 600ml nhiều chức năng nấu sữa, nấu cháo, xay sinh tố, đun nước - Hàng Chính Hãng",960.000₫,https://tiki.vn/may-lam-sua-hat-bear-600ml-nhieu-chuc-nang-nau-sua-nau-chao-xay-sinh-to-dun-nuoc-hang-chinh-hang-p270676465.html?spid=270676466,22,-42%,Đã bán 3,Bear
Máy Pha Cà Phê Mini Cá Nhân Và Gia Đình BEAR KFJ-403 Dung Tích 600 ML Công Suất 550 W - Hàng Chính Hãng,489.000₫,https://tiki.vn/may-pha-ca-phe-bear-ca-nhan-kfj-403-dung-tich-600-ml-cong-suat-550-w-hang-chinh-hang-p217729422.html?spid=124632033,23,,Đã bán 100,Bear
Bộ Nồi Lẩu Nướng Bear 3 khay 3in1 DHG-C40W2 - Hàng Chính Hãng,987.050₫,https://tiki.vn/bo-noi-lau-nuong-bear-3-khay-3in1-dhg-c40w2-hang-chinh-hang-p261961249.html?spid=271418958,24,,Đã bán 1,Bear
Máy pha cà phê Bear KFJ-A15L1 (CF-B15V1) Hàng Chính Hãng,2.330.000,https://tiki.vn/may-pha-ca-phe-bear-kfj-a15l1-cf-b15v1-hang-chinh-hang-p106591977.html?spid=253362029,25,-49%,,Bear
,,https://tiki.vn/noi-nau-cham-tu-sa-da-nang-4-5l-bear-ddz-b45z1-tang-kem-1-tho-su-lon-va-4-tho-su-nho-ham-thuc-an-mem-hen-gio-hang-chinh-hang-p273119896.html?spid=273119897,26,-8%,,Bear
"Máy Pha Cà Phê BEAR KFJ-A02N1 Pha Nespresso, Americano, Cappuccino Tạo Bọt Sữa Dễ Dàng Có Tạo Bọt Sữa Dung Tích 240 ML Công Suất 800 W - Hàng Chính Hãng",1.389.000₫,https://tiki.vn/may-pha-ca-phe-tu-dong-bear-kfj-a02n1-hang-chinh-hang-p123772063.html?spid=123772093,27,-5%,Đã bán 39,Bear
"Máy Nướng Bánh Mỳ, Máy Kẹp Bánh Mỳ Sandwich-Waffle 2 Khay BEAR SMZ-B05N1 Công Suất 450 W - Hàng Chính Hãng",413.250₫,https://tiki.vn/may-nuong-banh-sandwich-2-khay-bear-dbc-p06n2-2l-hang-chings-hang-p157431724.html?spid=271780945,28,,Đã bán 1,Bear
Nồi nấu chậm đa năng 2.5L Bear DDZ-B25Q3 - Hàng Chính Hãng,1.125.000₫,https://tiki.vn/noi-nau-cham-da-nang-2-5l-bear-ddz-b25q3-hang-chinh-hang-p207755025.html?spid=271946146,29,,Đã bán 1,Bear
"Nồi lẩu điện đa năng Bear 4L 1500W, nồi lẩu nướng đa năng 3in1, Anh Lam Store - Hàng chính hãng",759.050,https://tiki.vn/noi-lau-dien-da-nang-bear-4l-1500w-noi-lau-nuong-da-nang-3in1-anh-lam-store-p248703736.html?spid=248704201,30,,Đã bán 8,Bear
,,https://tiki.vn/noi-ap-suat-bear-ylb-a50p1-5-l-di-kem-2-long-noi-10-cong-thuc-nau-an-hen-gio-24-gio-hang-chinh-hang-ban-quoc-te-p273083756.html?spid=273083757,31,,,Bear
"Máy Pha Cà Phê Tự Động Espresso BEAR CF-B15V1 Với Công Thức Pha Nespresso, Americano, Cappuccino Tạo Bọt Sữa Dễ Dàng Áp Suất 15 Bar Công Suất 950 W - Hàng Chính Hãng",2.299.000₫,https://tiki.vn/may-pha-ca-phe-bear-cf-b15v1-voi-cong-thuc-pha-nespresso-americano-cappuccino-tao-bot-sua-de-dang-ap-suat-15-bar-cong-suat-950-w-hang-chinh-hang-p249766236.html?spid=147341134,32,,Đã bán 25,Bear
Máy Pha Cà Phê Mini BEAR KFJ-A07V1 Kiêm Pha Trà Thiết Kế Sang Trọng Phù Hợp Mọi Không Gian 0.7 Lít Công Suất 550 W - Hàng Chính Hãng,699.000₫,https://tiki.vn/may-pha-ca-phe-mini-bear-kfj-a07v1-kiem-pha-tra-thiet-ke-sang-trong-phu-hop-moi-khong-gian-0-7-lit-cong-suat-550-w-hang-chinh-hang-p217695390.html?spid=217695391,33,,Đã bán 2,Bear
Máy Xay Ăn Dặm Cho Bé BEAR GR-B03V2 0.3L 120W - Hàng Chính Hãng,460.000₫,https://tiki.vn/may-xay-an-dam-cho-be-bear-gr-b03v2-0-3l-120w-hang-chinh-hang-p145467072.html?spid=202782569,34,,,Bear
"Máy làm sữa hạt Bear 600ml, 6 chức năng, xay nấu sữa hạt, xay sinh tố đa năng ANH LAM STORE - Hàng chính hãng",907.250,https://tiki.vn/may-lam-sua-hat-bear-600ml-6-chuc-nang-xay-nau-sua-hat-xay-sinh-to-da-nang-p273514210.html?spid=273514247,35,,,Bear
,,https://tiki.vn/noi-com-dien-tu-bear-dfb-c30d1-hang-chinh-hang-p271665814.html?spid=271665815,36,,,Bear
"Máy Làm Sữa Hạt Cách Âm, Máy Xay Sữa Hạt BEAR PBJ-B06S2 9 Chức Năng Nấu Xay, Dung Tích 1.5 Lít Công Suất 800 W - Hàng Chính Hãng",2.649.000₫,https://tiki.vn/may-lam-sua-hat-cach-am-may-xay-sua-hat-bear-pbj-b06s2-9-chuc-nang-nau-xay-dung-tich-1-5-lit-cong-suat-800-w-hang-chinh-hang-p229740397.html?spid=124650588,37,,Đã bán 19,Bear
"Nồi nấu cháo chậm, ninh hầm cách thủy Bear DDZ-B08C1 dung tích 0.8L Kèm Lồng Hấp 1L Hàng chính hãng",413.000₫,https://tiki.vn/noi-nau-chao-cham-ninh-ham-cach-thuy-bear-ddz-b08c1-dung-tich-0-8l-kem-long-hap-1l-hang-chinh-hang-p59478503.html?spid=184343171,38,,Đã bán 26,Bear
"Máy pha cà phê mini Bear, máy pha cafe mini tự động dung tích 600ml, Anh Lam Store - Hàng chính hãng",522.500₫,https://tiki.vn/may-pha-ca-phe-mini-bear-may-pha-cafe-mini-tu-dong-dung-tich-600ml-anh-lam-store-p248703712.html?spid=273818850,39,,Đã bán 3,Bear
"Máy Trộn Bột Ủ Bột Lên Men, Máy Làm Bánh Tự Động BEAR HMJ-A70C1 Chống Dính Dung Tích 7 Lít Công Suất 250 W - Hàng Chính Hãng",2.289.000,https://tiki.vn/may-nhao-bot-va-u-bot-tu-dong-bear-hmj-a70c-7l-hang-chinh-hang-p127219206.html?spid=127219207,40,,Đã bán 2,Bear
