title,price,link_item,index,discount,sales,brand
"Áo khoác Dù 2 Lớp Chống Nắng chất liệu nhẹ thoải mái Couple Nam Nữ đều đẹp, Áo Khoác Dù 2 lớp In Hình Mặt Cười Unisex - Áo khoác Dù UNISEX Mặt Cười GMOYO, Áo khoác dù cardigan unisex form rộng Mặt Cười nam nữ ulzzang",115.000₫,https://tiki.vn/ao-khoac-du-2-lop-chong-nang-chat-lieu-nhe-thoai-mai-couple-nam-nu-deu-dep-ao-khoac-du-2-lop-in-hinh-mat-cuoi-unisex-ao-khoac-du-unisex-mat-cuoi-gmoyo-ao-khoac-du-cardigan-unisex-form-rong-mat-cuoi-nam-nu-ulzzang-p148680169.html?spid=148680173,1,,Đã bán 2,Jinrinteen
"Áo khoác bóng chày phong cách vintage đường phố thời trang 2022 cho nam, Áo Jacket, Áo Khoác Dày Dặn Sành Điệu M Nam, Áo Cardigan Chữ M Thêu Unisex, Áo khoác nỉ Cardigan M nỉ ngoại mềm mịn, áo khoác thời trang nam nữ",99.000₫,https://tiki.vn/ao-khoac-bong-chay-phong-cach-vintage-duong-pho-thoi-trang-2022-cho-nam-ao-jacket-ao-khoac-day-dan-sanh-dieu-m-nam-ao-cardigan-chu-m-theu-unisex-ao-khoac-ni-cardigan-m-ni-ngoai-mem-min-ao-khoac-thoi-trang-nam-nu-p173832691.html?spid=173832695,2,,Đã bán 1,Jinrinteen
"Áo hoodie nam nữ nỉ bông dày dặn form rộng unisex in chú hề SN WHITE, Áo khoác Hoodie logo in nổi ông già form dưới 70kg thun nỉ ngoại mềm mịn unisex dáng rộng unisex ullzang phong cách quảng châu",99.000₫,https://tiki.vn/ao-hoodie-nam-nu-ni-bong-day-dan-form-rong-unisex-in-chu-he-sn-white-ao-khoac-hoodie-logo-in-noi-ong-gia-form-duoi-70kg-thun-ni-ngoai-mem-min-unisex-dang-rong-unisex-ullzang-phong-cach-quang-chau-p127351353.html?spid=127351361,3,,,Jinrinteen
"Áo khoác Hoodie Nam, Hoodie Basic Unisex Nỉ From Rộng NÓN 2 LỚP PHẢN QUANG 7 MÀU, Áo Khoác Nỉ Hoodie Nam Nữ 2 Lớp Dày Dặn Phong Cách Hàn Quốc Free Size Dưới 70kg",127.000,https://tiki.vn/ao-khoac-hoodie-nam-hoodie-basic-unisex-ni-from-rong-non-2-lop-phan-quang-7-mau-p138491636.html?spid=138491642,4,,,Jinrinteen
,,https://tiki.vn/ao-thun-phan-quang-7-mau-hoat-hinh-nhieu-mau-lua-chon-chat-luong-in-decan-xin-xo-from-rong-duoi-70kg-chup-flash-ao-phong-phan-quang-bay-mau-dau-quan-in-hinh-chu-pmgk-leguanzhe-strength-hoid-on-handsome-doc-la-p129646361.html?spid=129646365,5,,,Jinrinteen
"Áo Bomber Dù 2 Lớp Mero F Courage 2 dày dặn chất dù đẹp có ảnh thật shop chụp, Áo Khoác Dù Unisex Kiểu Dáng Bomber - Áo khoác nữ nam bomber varsity jacket, áo bomber dù nữ nam unisex",99.000₫,https://tiki.vn/ao-bomber-du-2-lop-mero-f-courage-2-day-dan-chat-du-dep-co-anh-that-shop-chup-ao-khoac-du-unisex-kieu-dang-bomber-ao-khoac-nu-nam-bomber-varsity-jacket-ao-bomber-du-nu-nam-unisex-p134947077.html?spid=134947085,6,,Đã bán 5,Jinrinteen
"Áo Thun Tay Lỡ Unisex Form Rộng In Hình Ngộ Nghĩnh, Áo thun Unisex loang nhiều màu cá tính Unisex nam nữ áo thun tay lỡ from rộng nam nữ áo thun Unisex",103.000₫,https://tiki.vn/ao-thun-tay-lo-unisex-form-rong-in-hinh-ngo-nghinh-p169129714.html?spid=169129724,7,,,Jinrinteen
Quần Thể Thao Boly Nam Mèo Ngầu,89.000₫,https://tiki.vn/quan-the-thao-boly-nam-meo-ngau-p187853551.html?spid=187853576,8,,,Jinrinteen
Áo khoác cardigan nam nữ form rộng chất vải nỉ ngoại cao cấp,92.000₫,https://tiki.vn/ao-khoac-cardigan-nam-nu-form-rong-chat-vai-ni-ngoai-cao-cap-4young-cdg02-p185465658.html?spid=185465731,9,,,Jinrinteen
,,https://tiki.vn/ao-khoac-bomber-du-ao-khoac-chong-nang-form-rong-akd04-lechau-phoi-tay-tre-trung-p195703911.html?spid=195703933,10,,,Jinrinteen
"ÁO HODDIES CHẤT NỈ CỰC ẤM ÁP , FORM RỘNG HÀN QUỐC THỜI TRANG NAM NỮ Y HÌNH SIÊU ĐEP THỜI MỚI NHẤT HIỆN NAY",99.000₫,https://tiki.vn/ao-hoddies-chat-ni-cuc-am-ap-form-rong-han-quoc-thoi-trang-nam-nu-y-hinh-sieu-dep-thoi-moi-nhat-hien-nay-p195301904.html?spid=195302023,11,,,Jinrinteen
Áo hoodies nỉ ngoại form to y hình CÓ MŨ SIÊU XINH ĐẸP MẪU MỚI NHẤT HIỆN NAY,97.000₫,https://tiki.vn/ao-hoodies-ni-ngoai-form-to-y-hinh-co-mu-sieu-xinh-dep-mau-moi-nhat-hien-nay-p195301848.html?spid=195301891,12,,,Jinrinteen
,,https://tiki.vn/ao-thun-ba-lo-nam-hoa-tiet-hoat-hinh-cuc-dep-2021-mau-moi-nhat-hien-nay-p195302427.html?spid=195302452,13,,,Jinrinteen
"Áo Hoodie Nỉ Bông SuzaSport MISRACLEN Chất Liệu Cao Cấp ba màu xanh đen xám Phong Cách Hàn Quốc, áo Hoodie phong cách unisex được ưa chuộng nhất",105.000₫,https://tiki.vn/ao-hoodie-ni-bong-suzasport-misraclen-chat-lieu-cao-cap-ba-mau-xanh-den-xam-phong-cach-han-quoc-ao-hoodie-phong-cach-unisex-duoc-ua-chuong-nhat-p193335864.html?spid=193335865,14,,,Jinrinteen
(CÓ SẴN) Áo Hoodie Nỉ Bông form rộng OIOI unisex (nam nữ mặc được),105.000₫,https://tiki.vn/co-san-ao-hoodie-ni-bong-form-rong-oioi-unisex-nam-nu-mac-duoc-p196456015.html?spid=196456025,15,,,Jinrinteen
(có sẵn) Áo Khoác Dây Kéo chữ thêu form rộng CHAOS unisex (nam nữ mặc được),105.000₫,https://tiki.vn/co-san-ao-khoac-day-keo-chu-theu-form-rong-chaos-unisex-nam-nu-mac-duoc-p196456008.html?spid=196456014,16,,,Jinrinteen
"Áo Khoác Gió Hai Lớp In Bàn Cờ Cực Hót Unisex Mặc Cặp Đôi Siêu Đẹp, Áo Bomber / Áo Khoác Gió Nam Nữ 2 Lớp Form Rộng Unisex Họa Tiết Caro Phong Cách Hàn Quốc Siêu Cá Tính Rô",95.000₫,https://tiki.vn/ao-khoac-gio-hai-lop-in-ban-co-cuc-hot-unisex-mac-cap-doi-sieu-dep-ao-bomber-ao-khoac-gio-nam-nu-2-lop-form-rong-unisex-hoa-tiet-caro-phong-cach-han-quoc-sieu-ca-tinh-ro-p196812300.html?spid=196812310,17,,,Jinrinteen
,,https://tiki.vn/ao-hoodie-xanh-la-under-broken-hottrend-2022-sieu-chat-ao-hoodie-unisex-nam-nu-p196073148.html?spid=196073230,18,,,Jinrinteen
AK43_Áo Khoác Bomber G Tay Raglan_Chất Nỉ Ngoại Bông QC Bo Viền 2 Màu Len Dệt Kim Cao Cấp_Nỉ Bông dày Mịn Không Xù Lông,103.000₫,https://tiki.vn/ak43_ao-khoac-bomber-g-tay-raglan_chat-ni-ngoai-bong-qc-bo-vien-2-mau-len-det-kim-cao-cap_ni-bong-day-min-khong-xu-long-p174294308.html?spid=174294316,19,,,Jinrinteen
Bộ thun short thun cotton phù hợp nam nữ,108.000₫,https://tiki.vn/bo-thun-short-thun-cotton-phu-ho-p-nam-nu-p173627489.html?spid=173627520,20,,,Jinrinteen
"Áo khoác bomber chất da lộn logo thêu work hard cực ngầu hàng 2 lớp form dành cho nam nữ, áo khoác nhung chất da lộn make efforts A Habit",160.000₫,https://tiki.vn/ao-khoac-bomber-chat-da-lon-logo-theu-work-hard-cuc-ngau-hang-2-lop-form-danh-cho-nam-nu-ao-khoac-nhung-chat-da-lon-make-efforts-a-habit-p200619246.html?spid=200619254,21,,,Jinrinteen
"Áo khoác bóng chày 3 sọc cổ đứng có khóa kéo thời trang Hàn Quốc Unisex cho nam nữ, Áo khoác bóng chày dáng rộng unisex ullzang chống nắng thể thao, áo khoác dù gió 3 sọc dáng đẹp form rộng",99.000₫,https://tiki.vn/ao-khoac-bong-chay-3-soc-co-dung-co-khoa-keo-thoi-trang-han-quoc-unisex-cho-nam-nu-ao-khoac-bong-chay-dang-rong-unisex-ullzang-chong-nang-the-thao-ao-khoac-du-gio-3-soc-dang-dep-form-rong-phong-cach-the-thao-han-quoc-p174377098.html?spid=174377108,22,,Đã bán 4,Jinrinteen
"Áo khoác bomber bóng chày form rộng vải dù cao cấp Varsity dáng Unisex nam nữ, Áo Khoác Unisex Mặc Cặp, Áo Khoác Dù 2 lớp Nam Nữ Chống Nắng, Áo khoácgió FASHION vải dù cao cấp, Áo bomber Varsity dáng Unisex nam nữ",99.000₫,https://tiki.vn/ao-khoac-bomber-bong-chay-form-rong-vai-du-cao-cap-varsity-dang-unisex-nam-nu-ao-khoac-bomber-bong-chay-form-rong-unisex-mac-cap-ao-khoac-du-2-lop-nam-nu-chong-nang-ao-khoac-bong-chay-form-rong-fashion-vai-du-cao-cap-ao-bomber-varsity-dang-unisex-nam-nu-p174377320.html?spid=174377329,23,,Đã bán 13,Jinrinteen
"Áo hoodie nỉ ngoại logo easy living form to rộng dưới 90kg, Áo Hoodie EASY LIVING Với 5 Tone Màu Trendy, Áo Hoodie nỉ bông Easy Living unisex nam nữ nhiều màu (Ảnh thật/Có sẵn), Áo hoodie EASY LIVING mũ 2 lớp",156.000₫,https://tiki.vn/ao-hoodie-ni-ngoai-logo-easy-living-form-to-rong-duoi-90kg-ao-hoodie-easy-living-voi-5-tone-mau-trendy-ao-hoodie-ni-bong-easy-living-unisex-nam-nu-nhieu-mau-anh-that-co-san-ao-hoodie-easy-living-mu-2-lop-p212212619.html?spid=212212649,24,,,Jinrinteen
"Áo sơ mi họa tiết tay lỡ form rộng nam nữ đều mặc được in hình RABITWORD mới nhất, áo sơ mi unisex ulzzang phong cách hàn quốc",136.000,https://tiki.vn/ao-so-mi-hoa-tiet-tay-lo-form-rong-nam-nu-deu-mac-duoc-in-hinh-rabitword-moi-nhat-ao-so-mi-unisex-ulzzang-phong-cach-han-quoc-p270843582.html?spid=270843588,25,,,Jinrinteen
,,https://tiki.vn/ao-khoac-du-psalmist-club-nam-nu-du-2-lop-form-rong-unisex-kem-anh-that-ao-khoac-du-psalmist-club-phoi-tui-gia-ulzzang-jacket-sieu-chat-bomber-p263039495.html?spid=263039499,26,,,Jinrinteen
"Áo khoác dù Paradox - Occult Jacket, Áo khoác gió nam nữ Unisex 2 lớp dày dặn thời trang 2024, áo khoác cặp đôi thể thao đi phượt cực chất phong cách cá tính",115.000₫,https://tiki.vn/ao-khoac-du-paradox-occult-jacket-ao-khoac-gio-nam-nu-unisex-2-lop-day-dan-thoi-trang-2024-ao-khoac-cap-doi-the-thao-di-phuot-cuc-chat-phong-cach-ca-tinh-p273281303.html?spid=273281305,27,,,Jinrinteen
Áo sơ mi quốc dân in bông cúc,126.000₫,https://tiki.vn/ao-so-mi-quoc-dan-in-bong-cuc-p58969395.html?spid=58969399,28,,Đã bán 2,Jinrinteen
Áo Hoodie mới về thun nỉ ngoại in EVERESE,99.000₫,https://tiki.vn/ao-hoodie-moi-ve-thun-ni-ngoai-in-everese-p73494864.html?spid=73494868,29,,Đã bán 5,Jinrinteen
Áo khoác dù,99.000₫,https://tiki.vn/ao-khoac-du-p72338954.html?spid=72338962,30,,,Jinrinteen
,,https://tiki.vn/ao-khoac-du-bomber-bong-chay-theu-danh-cho-nam-nu-form-rong-ao-khoac-du-das-ao-khoac-du-nam-nu-mac-ao-khoac-gio-nam-nu-mac-ao-khoac-du-kieu-bomber-ao-khoac-cap-doi-ao-khoac-form-rong-p80935562.html?spid=80935564,31,,,Jinrinteen
"áo hoodie in phản quan, áo hoodie ulzzang, áo hoodie cá tính, áo hoodie nam nữ đều mặc được",118.000₫,https://tiki.vn/ao-hoodie-in-phan-quan-ao-hoodie-ulzzang-ao-hoodie-ca-tinh-ao-hoodie-nam-nu-deu-mac-duoc-p76255570.html?spid=76255574,32,,,Jinrinteen
Áo Khoác Dù sao hỏa,99.000₫,https://tiki.vn/ao-khoac-du-sao-hoa-p57743388.html?spid=57743390,33,,Đã bán 6,Jinrinteen
"áo hoodie in lá bài, áo hoodie tết, áo hoodie lá bài, áo lá bài, áo hoodie đôi, áo hoodie nam, áo hoodie nữ",100.000₫,https://tiki.vn/ao-hoodie-in-la-bai-ao-hoodie-tet-ao-hoodie-la-bai-ao-la-bai-ao-hoodie-doi-ao-hoodie-nam-ao-hoodie-nu-p76258510.html?spid=76258512,34,,Đã bán 2,Jinrinteen
QUẦN KAKI NAM TÚI HỘP LỬNG - VẢI KAKI MỊN CỰC CHẤT-SIÊU HOT / QUẦN KAKI LỬNG HỘP TÚI XANH,100.000,https://tiki.vn/quan-kaki-nam-tui-hop-lung-vai-kaki-min-cuc-chat-sieu-hot-quan-kaki-lung-hop-tui-xanh-p79437730.html?spid=79437732,35,,,Jinrinteen
,,https://tiki.vn/ao-khoac-du-nam-nu-soc-tay-dep-p57744655.html?spid=57744659,36,,,Jinrinteen
"Áo Thun Nam Unisex trắng đen In GKKRT, Áo Thun Tay Ngắn cổ tròn Dáng Rộng tay lỡ Hoạ Tiết In phong cách trẻ trung, áo thun hoạt hình nam nữ, áo thun ulzzang unissex đẹp",99.000₫,https://tiki.vn/ao-thun-nam-unisex-trang-den-in-gkkrt-ao-thun-tay-ngan-co-tron-dang-rong-tay-lo-hoa-tiet-in-phong-cach-tre-trung-ao-thun-hoat-hinh-nam-nu-ao-thun-ulzzang-unissex-dep-p91533018.html?spid=91533022,37,,Đã bán 8,Jinrinteen
"quần jogger, quần thể thao nam, quần nam dài, quần nữ dài, quần thể thao nam nữ đều mặc được, quần thun nam nữ, quần thun dài",89.000₫,https://tiki.vn/quan-jogger-quan-the-thao-nam-quan-nam-dai-quan-nu-dai-quan-the-thao-nam-nu-deu-mac-duoc-quan-thun-nam-nu-quan-thun-dai-p76401880.html?spid=76401882,38,,Đã bán 2,Jinrinteen
Áo Hoodie Không Xù lông Dành Cho Nam Cho Nữ Có Mũ Chất Nỉ Form rộng Unisex Sici Bea,117.000₫,https://tiki.vn/ao-hoodie-khong-xu-long-danh-cho-nam-cho-nu-co-mu-chat-ni-form-rong-unisex-sici-bea-p80936173.html?spid=80936175,39,,Đã bán 4,Jinrinteen
"áo thun phản quang unisex ulzzang chiếc lá, áo thun phản quang con gấu chữ ADLV, gấu love siêu kute, áo thun phản quang con cá, áo thun phản quang in chữ lạ độc đáo cá tính, ÁO NAM NỮ FORM RỘNG TAY LỠ, ÁO THUN NHÓM",99.000₫,https://tiki.vn/ao-thun-phan-quang-unisex-ulzzang-chiec-la-ao-thun-phan-quang-con-gau-chu-adlv-gau-love-sieu-kute-ao-thun-phan-quang-con-ca-ao-thun-phan-quang-in-chu-la-doc-dao-ca-tinh-ao-nam-nu-form-rong-tay-lo-ao-thun-nhom-p96900942.html?spid=96900970,40,,,Jinrinteen
