title,price,link_item,index,discount,sales,category
"Áo hoodie nữ nam khoác nỉ form rộng kiểu sweater unisex thêu chữ Sunlight, Áo hoodie nỉ ngoại ulzzang nam nữ unisex cặp đôi sweater local brand khoác zip choàng cardigan chống nắng",99.000₫,https://tiki.vn/ao-hoodie-nu-nam-khoac-ni-form-rong-kieu-sweater-unisex-theu-chu-sunlight-ao-hoodie-ni-ngoai-ulzzang-nam-nu-unisex-cap-doi-sweater-local-brand-khoac-zip-choang-cardigan-chong-nang-p192470522.html?spid=192470528,1,-22%,,aohoodie
ÁO HOODIE HARSII NỈ NAM NỮ HÀNG ĐÔNG ĐẸP HÌNH IN CHẤT LƯỢNG,110.000₫,https://tiki.vn/ao-hoodie-harsii-ni-nam-nu-hang-dong-dep-hinh-in-chat-luong-p192156254.html?spid=205674636,2,-11%,,aohoodie
ÁO HOODIE NAM NỮ NỈ NGOẠI CAO CẤP CHO MÙA THU ĐÔNG DƯỚI 78KG TKT,95.000₫,https://tiki.vn/ao-hoodie-nam-nu-ni-ngoai-cao-cap-cho-mua-thu-dong-duoi-78kg-tkt-p146503387.html?spid=205674667,3,-11%,,aohoodie
"Áo hoodie in R ngôi sao nón 2 lớp form dưới 70kg, Áo Khoác Jacket Hoodie Zip Nỉ Thu Đông Nam Nữ JUNE Unisex Form Rộng nón 2 lớp rộng trùm qua đầU",99.000₫,https://tiki.vn/ao-hoodie-in-r-ngoi-sao-non-2-lop-form-duoi-70kg-ao-khoac-jacket-hoodie-zip-ni-thu-dong-nam-nu-june-unisex-form-rong-non-2-lop-rong-trum-qua-dau-p205476865.html?spid=205476867,4,,,aohoodie
Áo hoodies sweater form to y hình pc hàn quốc tôn dáng cho các bạn trẻ VINA 1HIT,115.000₫,https://tiki.vn/ao-hoodies-sweater-form-to-y-hinh-pc-han-quoc-ton-dang-cho-cac-ban-tre-vina-1hit-p141587593.html?spid=270117186,5,,,aohoodie
Áo Khoác hoodie FEELGOOD Unisex Chất Nỉ Ngoại Cao Cấp Cặp Nam Nữ,89.000₫,https://tiki.vn/ao-khoac-hoodie-feelgood-unisex-chat-ni-ngoai-cao-cap-cap-nam-nu-p191126505.html?spid=191126562,6,,,aohoodie
Áo khoác bóng chày bomber chất nỉ in chữ A unisex ulzzang nam nữ,109.100₫,https://tiki.vn/ao-khoac-bong-chay-bomber-chat-ni-in-chu-a-unisex-ulzzang-nam-nu-p190794717.html?spid=190794718,7,,,aohoodie
Bomber nỉ nút,135.000₫,https://tiki.vn/bomber-ni-nut-p208213475.html?spid=208213479,8,,,aohoodie
Áo hoodie,145.000₫,https://tiki.vn/ao-hoodie-p208214518.html?spid=208214520,9,,,aohoodie
Áo hoodie,145.000₫,https://tiki.vn/ao-hoodie-p208214511.html?spid=208214517,10,,,aohoodie
Áo sweater bộ xương the white_Mẫu Áo khoác nỉ chùm đầu form rộng giữ ấm kiểu bomber ullzang unisex nam nữ,96.000₫,https://tiki.vn/ao-sweater-bo-xuong-the-white_mau-ao-khoac-ni-chum-dau-form-rong-giu-am-kieu-bomber-ullzang-unisex-nam-nu-p207853530.html?spid=207853549,11,,,aohoodie
Áo Hoodie Chữ I AM LOTSO BEAR GẤU Cặp Đôi Nam Nữ Siêu Xinh - FREESHIP - Khoác Nỉ Có Nón Mũ 2 Lớp Rộng Unisex Phối Túi,96.000₫,https://tiki.vn/ao-hoodie-chu-i-am-lotso-bear-gau-cap-doi-nam-nu-sieu-xinh-freeship-khoac-ni-co-non-mu-2-lop-rong-unisex-phoi-tui-p219457243.html?spid=225261544,12,,,aohoodie
Áo Mưa Trẻ Em KOJMAC Kids Raincoat Fashion Khủng Long Cao Cấp ( Tặng Túi smally Khoác Cho Bé Gái Trai Đi Mưa Dễ Thương ),189.000₫,https://tiki.vn/ao-mua-tre-em-kojmac-kids-raincoat-fashion-khung-long-cao-cap-tang-tui-smally-khoac-cho-be-gai-trai-di-mua-de-thuong-p219459449.html?spid=219459527,13,,,aohoodie
Áo hoodie in hình trái tim Mã: AX4172,230.000₫,https://tiki.vn/ao-hoodie-in-hinh-trai-tim-ma-ax4172-p73551181.html?spid=73551182,14,,,aohoodie
Áo Hoodie Liên Minh Huyền Thoại Tốc Chiến Logo League Of Lengend 2 Màu Đen Và Trắng Cực Chất Hình In Sắc Nét 2 Mặt Kiểu Dáng Trẻ Trung,145.000₫,https://tiki.vn/ao-hoodie-lien-minh-huyen-thoai-toc-chien-logo-league-of-lengend-2-mau-den-va-trang-cuc-chat-hinh-in-sac-net-2-mat-kieu-dang-tre-trung-p84770627.html?spid=84770641,15,,Đã bán 3,aohoodie
Áo Hoodie nỉ cao cấp thêu logo X2 Monogram XXME,450.000₫,https://tiki.vn/ao-hoodie-ni-cao-cap-theu-logo-x2-monogram-xxme-p175575020.html?spid=175575037,16,,,aohoodie
Bộ Quần Áo Nỉ Pijama Tăm,165.000₫,https://tiki.vn/bo-quan-ao-ni-pijama-tam-p268507016.html?spid=268507111,17,,,aohoodie
"ÁO KHOÁC NỈ HODDIES CÓ MŨ CỰC ĐẸP , THỜI TRANG CAO CẤP MẪU MỚI NHẤT HIỆN NAY",96.000₫,https://tiki.vn/ao-khoac-ni-hoddies-co-mu-cuc-dep-thoi-trang-cao-cap-mau-moi-nhat-hien-nay-p151843921.html?spid=151843974,18,,,aohoodie
"ÁO KHOÁC HOODIES NAM,THIẾT KẾ HỌA TIẾT TRƠN NHƯNG KHÔNG KÉM PHẦN SANG TRỌNG",97.000₫,https://tiki.vn/ao-khoac-hoodies-nam-thiet-ke-hoa-tiet-tron-nhung-khong-kem-phan-sang-trong-p114322997.html?spid=115201036,19,,,aohoodie
ÁO KHOÁC NAM HOODIES IN HỌA TIẾT MỚI NHẤT,79.000₫,https://tiki.vn/ao-khoac-nam-hoodies-in-hoa-tiet-moi-nhat-p114336770.html?spid=115205272,20,,,aohoodie
Áo ghi lê lưới phản quang 3 kéo khoác ngoài - 4 màu lựa chọn,55.000₫,https://tiki.vn/ao-ghi-le-luoi-phan-quang-3-keo-khoac-ngoai-4-mau-lua-chon-p216901284.html?spid=216901307,21,,,aohoodie
Áo nỉ bông dài tay unisex lông cừu sIêu ấm dstudio,93.450₫,https://tiki.vn/ao-ni-bong-dai-tay-unisex-long-cuu-sieu-am-dstudio-p167165999.html?spid=167166064,22,,,aohoodie
Áo sweater nỉ ngoại hoa hướng dương cực xinh cho các bạn trẻ THỜI TRANG,89.000₫,https://tiki.vn/ao-sweater-ni-ngoai-hoa-huong-duong-cuc-xinh-cho-cac-ban-tre-thoi-trang-p114320634.html?spid=115201745,23,,,aohoodie
( ) ÁO HOODIE Local Brand Unisex Nasa Nỉ Bông Form Rộng Nam Nữ (HD3000L - Full Size - Kèm Video Ảnh Thật),249.000₫,https://tiki.vn/ao-hoodie-local-brand-unisex-nasa-ni-bong-form-rong-nam-nu-hd3000l-full-size-kem-video-anh-that-p263314792.html?spid=263314863,24,,Đã bán 1,aohoodie
"Áo Hoodie Coupe Nam Nữ In Hình Cô Bé Cậu Bé Trà Sữa Vải Nỉ Form Rộng Unisex, Áo hoodie Màu Đen In Họa Tiết Hoạt Hình Dễ Thương Phong Cách Hàn Quốc Thời Trang Cho Cặp Đôi",137.000₫,https://tiki.vn/ao-hoodie-coupe-nam-nu-in-hinh-co-be-cau-be-tra-sua-vai-ni-form-rong-unisex-ao-hoodie-mau-den-in-hoa-tiet-hoat-hinh-de-thuong-phong-cach-han-quoc-thoi-trang-cho-cap-doi-p273662339.html?spid=273662347,25,,,aohoodie
Áo nỉ lót lông nam hoodie mẫu mới cực ấm có túi mũ hàng may kỹ Micado,139.000₫,https://tiki.vn/ao-ni-lot-long-nam-hoodie-mau-moi-cuc-am-co-tui-mu-hang-may-ky-micado-p142630119.html?spid=142630151,26,,,aohoodie
Nỉ Chui Trơn Màu Đỏ,159.000₫,https://tiki.vn/ni-chui-tron-mau-do-p160399597.html?spid=160399613,27,,,aohoodie
Áo nỉ Hoodie trơn unisex 5 màu (nam nữ đều mặc được),159.000₫,https://tiki.vn/video-that-ao-ni-hoodie-tron-unisex-5-mau-nam-nu-deu-mac-duoc-p160399294.html?spid=160399330,28,,,aohoodie
Áo khoác nam xỏ ngón nhẹ vải mè chống nhăn Phúc An 2034,140.000₫,https://tiki.vn/ao-khoac-nam-xo-ngon-nhe-vai-me-chong-nhan-phuc-an-2034-p221826742.html?spid=221826748,29,,,aohoodie
áo hoodie nam unisex from rộng HD2B6,99.000₫,https://tiki.vn/ao-hoodie-nam-unisex-from-rong-hd2b6-p24389233.html?spid=42469577,30,,Đã bán 21,aohoodie
MLB - Áo sweatshirt tay dài phom suông Classic Monogram Front Brushed Overfit 3AMTM0926,3.990.000₫,https://tiki.vn/mlb-ao-sweatshirt-tay-dai-phom-suong-classic-monogram-front-brushed-overfit-3amtm0926-50bks-p199646027.html?spid=199646056,31,,,aohoodie
"Áo Hoodie Đen Trắng Nam Nữ Anime Harajuku cool , Vải Nỉ Ngoại Dầy Dặn",125.100₫,https://tiki.vn/ao-hoodie-den-trang-nam-nu-anime-harajuku-cool-vai-ni-ngoai-day-dan-p261901400.html?spid=261901408,32,,,aohoodie
"Áo hoodie dây kéo nam nữ, Phản Quang Sói Pro, 2 Màu trắng đen, Vải Nỉ Ngoại, Anam Store",125.100₫,https://tiki.vn/ao-hoodie-day-keo-nam-nu-phan-quang-soi-pro-2-mau-trang-den-vai-ni-ngoai-anam-store-p261901426.html?spid=261901428,33,,,aohoodie
Áo Hoodie Nam Nữ Vải Nỉ Ngoại Dầy Dặn Friend Anam Store,125.100₫,https://tiki.vn/ao-hoodie-nam-nu-vai-ni-ngoai-day-dan-friend-anam-store-p261901320.html?spid=261901337,34,,,aohoodie
(HCM) ÁO HODDIES CỔ TRÙM ĐẦU FORM RỘNG - THỜI TRANG NAM NỮ THU ĐÔNG HÀN QUỐC SIÊU XỊN THỜI TRANG NAM 1986,99.000₫,https://tiki.vn/hcm-ao-hoddies-co-trum-dau-form-rong-thoi-trang-nam-nu-thu-dong-han-quoc-sieu-xin-thoi-trang-nam-1986-p205520009.html?spid=205520015,35,,,aohoodie
"Áo Hoodie Nam Nữ LUFFY 5 Vải Nỉ Ngoại Dầy Nón 2 Lớp Tay Bo Gân, Anam Store",125.100₫,https://tiki.vn/ao-hoodie-nam-nu-luffy-5-vai-ni-ngoai-day-non-2-lop-tay-bo-gan-anam-store-p261900233.html?spid=261900258,36,,,aohoodie
"Áo hoodie nam nữ vải nỉ ngoại, dầy dặn, Phản Quang 7 màu Rồng 2 Anam Store",126.650₫,https://tiki.vn/ao-hoodie-nam-nu-vai-ni-ngoai-day-dan-phan-quang-7-mau-rong-2-anam-store-p261900338.html?spid=261900400,37,,,aohoodie
"Áo Hoodie Nam Nữ ATTACK ON TITAN 3 Vải Nỉ Ngoại Dầy Nón 2 Lớp Tay Bo Gân, Anam Store",125.100₫,https://tiki.vn/ao-hoodie-nam-nu-attack-on-titan-3-vai-ni-ngoai-day-non-2-lop-tay-bo-gan-anam-store-p261900537.html?spid=261900559,38,,,aohoodie
"Áo Hoodie Nam Nữ Nỉ Ngoại Nam Nữ anime logo Naruto, Áo khoác thu đông vải dày, Anam Store",134.100₫,https://tiki.vn/ao-hoodie-nam-nu-ni-ngoai-nam-nu-anime-logo-naruto-ao-khoac-thu-dong-vai-day-anam-store-p261900408.html?spid=261900425,39,,,aohoodie
ÁO HOODIE FORM RỘNG NAM NỮ SMILE,125.100₫,https://tiki.vn/ao-hoodie-form-rong-nam-nu-smile-p261900653.html?spid=261900669,40,,,aohoodie
