title,price,link_item,index,discount,sales,category
Bàn ủi hơi nước du lịch mini BlueStone SIB-3819 (1200W) - Hàng Chính Hãng,579.000₫,https://tiki.vn/ban-ui-hoi-nuoc-du-lich-mini-bluestone-sib-3819-1200w-hang-chinh-hang-p48496923.html?spid=152447544,1,-17%,Đã bán 24,thietbigiadinh
Máy hút bụi cầm tay vừa thổi vừa hút,441.000₫,https://tiki.vn/may-hut-bui-cam-tay-vua-thoi-vua-hut-p214614823.html?spid=52245785,2,-4%,Đã bán 167,thietbigiadinh
ĐẦU LỌC NƯỚC 6 TẤNG SIÊU TIỆN LỢI - LỌC NƯỚC NGAY TẠI VÒI - ĐEM LẠI NGUỒN NƯỚC TINH KHIẾT (Giao Hàng Theo Mẫu Ngẫu Nhiên),19.800₫,https://tiki.vn/dau-loc-nuoc-6-tang-sieu-tien-loi-loc-nuoc-ngay-tai-voi-dem-lai-nguon-nuoc-tinh-khiet-giao-hang-theo-mau-ngau-nhien-p80614702.html?spid=96327977,3,,Đã bán 538,thietbigiadinh
Máy kẹp duỗi tóc Bản Lớn 369Pro Hàn Quốc chỉnh nhiệt cao cấp phủ gốm Tourmaline bảo vệ tóc kéo êm. kẹp mượt tóc,288.000,https://tiki.vn/may-kep-duoi-toc-vigor-pro-389l-han-quoc-chinh-nhiet-ban-lon-p135057194.html?spid=135057201,4,-44%,Đã bán 6,thietbigiadinh
,,https://tiki.vn/quat-lo-cong-nghiep-3ht-hang-chinh-hang-p110931703.html?spid=110931707,5,-40%,,thietbigiadinh
"Quạt Mini Đa Năng Để Bàn, Quạt Tích Điện SeaSy, Biên Độ Thổi Rộng 330 Độ, 3 Cấp Độ Gió Lớn, Tích Hợp Đèn Led, Thiết Kế Chống Ồn, Pin Dung Lượng Cao - Hàng Chính Hãng",219.000₫,https://tiki.vn/quat-mini-da-nang-de-ban-quat-tich-dien-seasy-bien-do-thoi-rong-330-do-3-cap-do-gio-lon-tich-hop-den-led-thiet-ke-chong-on-pin-dung-luong-cao-hang-chinh-hang-p262695560.html?spid=262695564,6,,Đã bán 9,thietbigiadinh
Mô tơ máy may gia đình 180W - thietbimaygiarenamduong,210.000₫,https://tiki.vn/mo-to-may-may-gia-dinh-180w-thietbimaygiarenamduong-p191282645.html?spid=191282647,7,,Đã bán 12,thietbigiadinh
Bộ lọc nước tại vòi SAMONO SW-WPW11 5 lớp lọc cao cấp - Hàng chính hãng,149.000₫,https://tiki.vn/bo-loc-nuoc-tai-voi-samono-sw-wpw11-5-lop-loc-cao-cap-hang-chinh-hang-p249277127.html?spid=249277128,8,,Đã bán 13,thietbigiadinh
"Máy Hút Bụi Cầm Tay Không Dây Đa Năng Cao Cấp 4in1 Seasy C8, Sạc Pin Không Dây, Công Suất Lớn, Giảm Thiểu Tiếng Ồn, Kèm Vòi Tiện Dụng, Dùng Trong Nhà, Ô Tô, Sô Fa, Đệm, Giường- Hàng Chính Hãng",309.000,https://tiki.vn/may-hut-bui-cam-tay-khong-day-da-nang-cao-cap-4in1-seasy-c8-sac-pin-khong-day-cong-suat-lon-giam-thieu-tieng-on-kem-voi-tien-dung-dung-trong-nha-o-to-so-fa-dem-giuong-hang-chinh-hang-p214595819.html?spid=214595820,9,,,thietbigiadinh
,,https://tiki.vn/may-loc-nuoc-de-ban-ro-philips-add6910-p188189672.html?spid=188189676,10,-18%,,thietbigiadinh
"MÁY CẠO RÂU MINI, MÁY CẠO RÂU 360 CHỐNG NƯỚC IPX7, SẠC USB",52.890₫,https://tiki.vn/may-cao-rau-mini-may-cao-rau-360-chong-nuoc-ipx7-sac-usb-p249092041.html?spid=251453131,11,-8%,Đã bán 28,thietbigiadinh
Máy làm mát không khí Magic Eco AC301 - Hàng chính hãng,2.070.000,https://tiki.vn/may-lam-mat-khong-khi-magic-eco-ac301-ha-ng-chi-nh-ha-ng-p184466417.html?spid=184466420,12,,,thietbigiadinh
,,https://tiki.vn/robot-hut-bui-lau-nha-ecovacs-deebot-t10-omni-quoc-te-tu-dong-giat-gie-va-hut-rac-tu-dong-say-kho-ket-noi-app-lam-mat-khong-khi-khu-mui-tro-ly-ao-yiko-cong-nghe-omo-3-0-luc-hut-5000-pa-phu-hop-dien-tich-200m2-cong-suat-50w-hang-chinh-hang-p262460494.html?spid=197652963,13,-56%,,thietbigiadinh
Bàn Ủi Hơi Nước Không Dây Panasonic NI-WL30VRA - Mặt Đế Silver Titan - Công Suất 1550W - Hàng Chính Hãng,1.410.000₫,https://tiki.vn/ban-ui-hoi-nuoc-khong-day-panasonic-ni-wl30vra-mat-de-silver-titan-cong-suat-1550w-hang-chinh-hang-p33597004.html?spid=33597005,14,,Đã bán 153,thietbigiadinh
"Cánh Quạt B4 : 3 Lá, 5 Lá, 7 Lá {HCM",40.000₫,https://tiki.vn/canh-quat-b4-3-la-5-la-7-la-hcm-p133162758.html?spid=185448381,15,,Đã bán 20,thietbigiadinh
Máy Hút Bụi Panasonic PAHB-MC-CG371AN46 (1600W) - Hàng Chính Hãng,2.079.000₫,https://tiki.vn/may-hut-bui-panasonic-pahb-mc-cg371an46-1600w-hang-chinh-hang-p631876.html?spid=44924589,16,-7%,Đã bán 7,thietbigiadinh
Máy Hút Bụi Perfect PF-SV07 - Hàng chính hãng,387.000,https://tiki.vn/may-hut-bui-perfect-pf-sv07-hang-chinh-hang-p176552554.html?spid=176552555,17,-18%,Đã bán 38,thietbigiadinh
,,https://tiki.vn/may-cao-rau-enchen-blackstone-dau-dao-cao-noi-3d-pin-sac-sieu-ben-p89654737.html?spid=177190789,18,,,thietbigiadinh
Quạt sạc tích điện kẹp bàn pin 10000mAh - Quạt tích điện để bàn cỡ lớn siêu khỏe,88.000₫,https://tiki.vn/quat-sac-tich-dien-kep-ban-pin-10000mah-quat-tich-dien-de-ban-co-lon-sieu-khoe-p188587662.html?spid=253118470,19,-45%,Đã bán 9,thietbigiadinh
"Quạt Đứng 5 Cánh Mitomo FCE-40 hàng chính hãng, Điều Khiển Từ Xa, Hẹn Giờ, Tiếng Ồn Thấp",1.159.000₫,https://tiki.vn/quat-dung-5-canh-mitomo-fce-40-hang-chinh-hang-dieu-khien-tu-xa-hen-gio-tieng-on-thap-p252405432.html?spid=252405434,20,-41%,Đã bán 3,thietbigiadinh
Bàn là hơi nước cầm tay gấp gọn siêu tiện lợi,290.990₫,https://tiki.vn/ban-la-hoi-nuoc-cam-tay-gap-gon-sieu-tien-loi-p214654744.html?spid=263086053,21,,Đã bán 3,thietbigiadinh
Combo 20 miếng dán giữ nhiệt 16 tiếng Kairo,298.990₫,https://tiki.vn/combo-20-mieng-dan-giu-nhiet-16-tieng-kairo-p113965558.html?spid=113965563,22,,Đã bán 4,thietbigiadinh
"Máy Cạo Râu Cầm Tay Smate ST-R102C, ST-R101C , Vỏ Kim Loại Sang Trọng Sạc Nhanh Type-C Kháng Nước IPX7 Bảo Vệ Da Mặt Có Chế Độ Khóa An Toàn",395.000₫,https://tiki.vn/may-cao-rau-cam-tay-smate-st-r102c-r101c-vo-kim-loai-sang-trong-sac-nhanh-type-c-khang-nuoc-ipx7-bao-ve-da-mat-co-che-do-khoa-an-toan-p152881151.html?spid=152881155,23,,Đã bán 16,thietbigiadinh
Bàn ủi hơi nước đứng công nghiệp SR-8000 Silver Star - Hàng chính hãng,3.900.000₫,https://tiki.vn/ban-ui-hoi-nuoc-dung-cong-nghiep-sr-8000-silver-star-hang-chinh-hang-p45944490.html?spid=45944491,24,,Đã bán 109,thietbigiadinh
Lò Sưởi Dầu 13 Thanh Tiross TS-926 (2900W) - Hàng Chính Hãng,2.750.000,https://tiki.vn/lo-suoi-dau-13-thanh-tiross-ts-926-2900w-hang-chinh-hang-p572229.html?spid=308109,25,,,thietbigiadinh
,,https://tiki.vn/bong-den-suoi-nha-tam-thuong-hieu-hare-p217849689.html?spid=217849690,26,,,thietbigiadinh
Lõi Lọc CF Pureit Lavita Nóng Thông Minh (DIY) - Hàng Chính Hãng,344.100₫,https://tiki.vn/loi-loc-cf-pureit-lavita-nong-thong-minh-diy-hang-chinh-hang-p126863136.html?spid=160561885,27,,Đã bán 85,thietbigiadinh
Máy ép tóc Philips BHS530/00 - Hàng Chính Hãng,1.625.000₫,https://tiki.vn/may-ep-toc-philips-bhs530-00-hang-chinh-hang-p162838907.html?spid=190624394,28,,Đã bán 85,thietbigiadinh
"Mâm quạt thay thế cho quạt đứng Senko - dùng cho các mã DTS1607, LTS1636, LTS1632, DTS1609, DCN1806, DCN1808 - Hàng chính hãng",95.000₫,https://tiki.vn/mam-quat-thay-the-cho-quat-dung-senko-dung-cho-cac-ma-dts1607-lts1636-lts1632-dts1609-dcn1806-dcn1808-hang-chinh-hang-p193928962.html?spid=247293524,29,,Đã bán 6,thietbigiadinh
"Gioăng cốc lọc 10 innch, 20 inch, vỏ màng, gioăng cao su máy lọc nước ( số lượng 01 cái)",6.000₫,https://tiki.vn/gioang-coc-loc-10-innch-20-inch-vo-mang-gioang-cao-su-may-loc-nuoc-so-luong-01-cai-p176707132.html?spid=176707135,30,,,thietbigiadinh
,,https://tiki.vn/tong-do-cat-toc-enchen-humming-bird-cho-salon-chuyen-nghiep-p111869083.html?spid=111869084,31,,,thietbigiadinh
MÁY DUỖI TÓC TOKYO 100% CAO CẤP,390.000₫,https://tiki.vn/may-duoi-toc-tokyo-100-cao-cap-p111857961.html?spid=111857980,32,,Đã bán 26,thietbigiadinh
"Máy phun sương tạo ẩm dùng cho ô tô, xe hơi nhãn hiệu Baseus CRJSQ01 - Hàng Nhập Khẩu",450.000₫,https://tiki.vn/may-phun-suong-tao-am-dung-cho-o-to-xe-hoi-nhan-hieu-baseus-crjsq01-hang-nhap-khau-p48221916.html?spid=52294778,33,,Đã bán 14,thietbigiadinh
Quạt Bàn Lifan B-106 - Trắng - Hàng chính hãng,180.000₫,https://tiki.vn/quat-ban-lifan-b-106-trang-hang-chinh-hang-p729897.html?spid=161390587,34,,Đã bán 16,thietbigiadinh
Quạt Treo Tường Lồng Nhựa Lifan T-109 - Xanh Dương - Hàng chính hãng,240.000,https://tiki.vn/quat-treo-tuong-long-nhua-lifan-t-109-xanh-duong-hang-chinh-hang-p729935.html?spid=174450264,35,,Đã bán 3,thietbigiadinh
,,https://tiki.vn/ban-ui-dien-panasonic-ni-u600cara-2300w-hang-chinh-hang-p1684277.html?spid=1684279,36,,,thietbigiadinh
"Máy Hút Bụi Cầm Tay Mini Không Dây 6000Mpa Siêu Tiện Lợi, Hút Bụi Xe Ô Tô, Giường Nệm, Hút Lông Chó Mèo Đa Chức Năng",69.000₫,https://tiki.vn/hla-may-hut-bui-cam-tay-mini-khong-day-sieu-tien-loi-hut-bui-xe-o-to-giuong-nem-hut-long-cho-meo-da-chuc-nang-p272453690.html?spid=272453691,37,,Đã bán 25,thietbigiadinh
"Bàn là hơi nước cầm tay LEBENLANG LBD528S nhập khẩu Đức, công suất 1500W - 300ml",603.000₫,https://tiki.vn/ban-la-hoi-nuoc-cam-tay-lebenlang-lbd528s-nhap-khau-duc-cong-suat-1500w-300ml-p242444398.html?spid=262665814,38,,Đã bán 394,thietbigiadinh
Cây Nước Nóng Lạnh Sunhouse SHD9602 - Hàng chính hãng,1.600.000₫,https://tiki.vn/cay-nuoc-nong-lanh-sunhouse-shd9602-hang-chinh-hang-p595750.html?spid=595794,39,,Đã bán 1.6k,thietbigiadinh
Lõi lọc Karofi số 4 (Màng lọc RO) - Hàng chính hãng,300.000,https://tiki.vn/loi-loc-karofi-so-4-mang-loc-ro-hang-chinh-hang-p7756048.html?spid=87500732,40,,,thietbigiadinh
