title,price,link_item,index,discount,sales,category
Áo bà già thêu hoa,190.000₫,https://tiki.vn/ao-ba-gia-theu-hoa-p126677200.html?spid=126677231,1,-5%,,thoitrangtrungnien
Áo trung niên Long Châu A3,125.000₫,https://tiki.vn/ao-trung-nien-long-chau-a3-p198515511.html?spid=198515512,2,,,thoitrangtrungnien
Bộ trung niên,115.700₫,https://tiki.vn/bo-trung-nien-p83413434.html?spid=83413517,3,,,thoitrangtrungnien
Đồ bộ xinh cho các chị em trung niên,174.000,https://tiki.vn/do-bo-xinh-cho-cac-chi-em-trung-nien-p108070133.html?spid=108070263,4,,,thoitrangtrungnien
,,https://tiki.vn/hang-san-bo-do-trung-nien-tay-lo-phoi-ren-sang-trong-ab12-hang-quang-chau-cao-cap-p125022693.html?spid=263579705,5,,,thoitrangtrungnien
(HÀNG SẴN) Áo Sơ Mi Ngắn Tay Trung Niên Đẹp SM19 - Hàng Quảng Châu Cao Cấp,225.000₫,https://tiki.vn/hang-san-ao-so-mi-ngan-tay-trung-nien-dep-sm19-hang-quang-chau-cao-cap-p86880499.html?spid=86880536,6,,Đã bán 3,thoitrangtrungnien
ĐỒ BỘ TRUNG NIÊN CHẤT VẢI THUN LẠNH,109.000₫,https://tiki.vn/do-bo-trung-nien-chat-vai-thun-lanh-p161027314.html?spid=161027536,7,,Đã bán 8,thoitrangtrungnien
nh540520-ÁO KIỂU TRUNG NIÊN VIỀN BÈO,360.000₫,https://tiki.vn/nh540520-ao-kieu-trung-nien-vien-beo-p135525999.html?spid=135526020,8,,,thoitrangtrungnien
áo kiểu trung niên cao cấp ( thời trang trung niên anitagreen) L10-721,289.000,https://tiki.vn/ao-kieu-trung-nien-cao-cap-thoi-trang-trung-nien-anitagreen-l10-721-p135526586.html?spid=135526805,9,,,thoitrangtrungnien
,,https://tiki.vn/ao-trung-nien-tay-dai-bi-cao-cap-p135535035.html?spid=135535036,10,,,thoitrangtrungnien
nh550520-ÁO KIỂU PHỐI MÀU TAY NGẮN,360.000₫,https://tiki.vn/nh550520-ao-kieu-phoi-mau-tay-ngan-p135529750.html?spid=135529761,11,,,thoitrangtrungnien
nh5820-ÁO KIỂU QUÝ CÔ 2 TÚI,315.000,https://tiki.vn/nh5820-ao-kieu-quy-co-2-tui-p135531524.html?spid=135531534,12,,,thoitrangtrungnien
,,https://tiki.vn/ao-hoa-trung-nien-tay-lo-che-bung-cao-cap-thoi-trang-trung-nien-anitagreen-gd05-1220-p135532038.html?spid=135532117,13,,,thoitrangtrungnien
tk141020-ÁO SƠ MI TRUNG NIÊN,239.200₫,https://tiki.vn/tk141020-ao-so-mi-trung-nien-p135530521.html?spid=135530554,14,,,thoitrangtrungnien
Q600220 ÁO VOAN TRUNG NIÊN THỜI TRANG,301.000₫,https://tiki.vn/q600220-ao-voan-trung-nien-thoi-trang-p135525795.html?spid=135525816,15,,,thoitrangtrungnien
tk341020-Áo so mi trung niên,360.000₫,https://tiki.vn/tk341020-ao-so-mi-trung-nien-p135524056.html?spid=135524120,16,,Đã bán 1,thoitrangtrungnien
nh380520-ÁO SƠ MI BÈO TAY NGẮN,315.000,https://tiki.vn/nh380520-ao-so-mi-beo-tay-ngan-p135525718.html?spid=135525742,17,,,thoitrangtrungnien
,,https://tiki.vn/ao-kieu-theu-hoa-thanh-lich-thoi-trang-trung-nien-anitagreen-nh660520-p135534849.html?spid=135534850,18,,,thoitrangtrungnien
nh230620-ÁO KIEU TRUNG NIÊN XẾP LY,360.000₫,https://tiki.vn/nh230620-ao-kieu-trung-nien-xep-ly-p135534993.html?spid=135534994,19,,,thoitrangtrungnien
áo trung niên cao cấp ( thời trang trung niên Anitagreen)tv60-221,240.000₫,https://tiki.vn/ao-trung-nien-cao-cap-thoi-trang-trung-nien-anitagreen-tv60-221-p135519418.html?spid=135519504,20,,,thoitrangtrungnien
Đầm trung niên bigsize - Đầm xòe A voan hoa tay ren TIFALU900,625.000₫,https://tiki.vn/dam-trung-nien-bigsize-dam-xoe-a-voan-hoa-tay-ren-tifalu900-p105630732.html?spid=105630740,21,,Đã bán 1,thoitrangtrungnien
"Áo len cho bà cài cúc dày dặn, ấm áp 2022",253.000₫,https://tiki.vn/ao-len-cho-ba-cai-cuc-day-dan-am-ap-2022-p175086614.html?spid=175086615,22,,,thoitrangtrungnien
ÁO KHOÁC LEN CARDIGAN TRUNG NIÊN_ ÁO LEN NỮ,209.000₫,https://tiki.vn/ao-khoac-len-cardigan-trung-nien_-ao-len-nu-p115770651.html?spid=115770682,23,,Đã bán 1,thoitrangtrungnien
Đồ bộ đồ mặc nhà trung niên cho bà cho mẹ vải tole lanh 2 da siêu mát không có rút dưới 70kg,132.050₫,https://tiki.vn/do-bo-do-mac-nha-trung-nien-cho-ba-cho-me-vai-tole-lanh-2-da-sieu-mat-khong-co-rut-duoi-70kg-p262875669.html?spid=262875691,24,,Đã bán 3,thoitrangtrungnien
GOTI - ÁO KIỂU TRUNG NIÊN DÁNG ÁO QUÝ BÀ CỔ BẺ TAY LỠ VẠT BẦU PHỐI NÚT 2 BÊN TÀ THỜI TRANG U50-60 TẶNG MẸ 3A13,229.000,https://tiki.vn/goti-ao-kieu-trung-nien-dang-ao-quy-ba-co-be-tay-lo-vat-bau-phoi-nut-2-ben-ta-thoi-trang-u50-u60-tang-me-3a13-p113546138.html?spid=113546406,25,,Đã bán 1,thoitrangtrungnien
,,https://tiki.vn/goti-ao-kieu-tang-me-trung-nien-dang-ao-so-mi-lua-in-hoa-tiet-cao-cap-thoi-trang-u50-60-3a29-p143559413.html?spid=143559433,26,,,thoitrangtrungnien
Bộ thun rẻ đẹp tay ngắn,73.650₫,https://tiki.vn/bo-thun-re-dep-tay-ngan-p154206833.html?spid=154206865,27,,,thoitrangtrungnien
Bộ tool lạnh đại cô trung niên(size 60-90kg,120.000₫,https://tiki.vn/bo-tool-lanh-dai-co-trung-nien-size-60-90kg-p154206020.html?spid=154206124,28,,,thoitrangtrungnien
Áo sơ mi nữ trung niên,230.000₫,https://tiki.vn/ao-so-mi-nu-trung-nien-p175422351.html?spid=175422353,29,,,thoitrangtrungnien
"Bộ đồ mặc nhà cho người trung niên, người lớn tuổi NG13",290.000,https://tiki.vn/bo-do-mac-nha-cho-nguoi-trung-nien-nguoi-lon-tuoi-ng13-p77681440.html?spid=77681448,30,,,thoitrangtrungnien
,,https://tiki.vn/ao-thun-nu-trung-nien-55-66kg-p185449460.html?spid=185449466,31,,,thoitrangtrungnien
Váy dáng suông thiết kế đơn giản đem lại sự sang trọng dành cho tuổi trung niên A44,550.000₫,https://tiki.vn/vay-dang-suong-thiet-ke-don-gian-dem-lai-su-sang-trong-danh-cho-tuoi-trung-nien-a44-mau-do-den-p71950852.html?spid=71950870,32,,Đã bán 1,thoitrangtrungnien
Váy dáng suông thiết kế đơn giản đem lại sự sang trọng A44,550.000₫,https://tiki.vn/vay-dang-suong-thiet-ke-don-gian-dem-lai-su-sang-trong-a44-xanh-ngoc-tim-p71949970.html?spid=71949980,33,,,thoitrangtrungnien
Áo choàng cashmere kè váy chất liệu nhung phong cách quý phái A41,425.000₫,https://tiki.vn/ao-choang-cashmere-ke-vay-chat-lieu-nhung-phong-cach-quy-phai-a41-p71985145.html?spid=71985151,34,,,thoitrangtrungnien
Áo thun nữ trung niên 65-85kg,280.000,https://tiki.vn/ao-thun-nu-trung-nien-65-85kg-p267259781.html?spid=267259793,35,,,thoitrangtrungnien
,,https://tiki.vn/vai-voan-chiffon-hoa-tiet-trang-tri-vuong-nen-tang-tong-xanh-mua-theo-met-p98679232.html?spid=98679236,36,,,thoitrangtrungnien
Vải may đầm Candy hoa văn chai nước hoa,120.000₫,https://tiki.vn/vai-may-dam-candy-hoa-van-chai-nuoc-hoa-p127251767.html?spid=127251781,37,,,thoitrangtrungnien
Vải voan chiffon hoa mai MS1220,65.000₫,https://tiki.vn/vai-voan-chiffon-hoa-mai-ms1220-p127251302.html?spid=127251339,38,,,thoitrangtrungnien
Vải lụa vân gỗ hoa đều nền màu đen MS3060,105.000₫,https://tiki.vn/vai-cotton-thun-100-hoa-hong-nen-mau-da-ms10601-p127252673.html?spid=127252678,39,,,thoitrangtrungnien
Vải tơ sọc ép lập thể báo tone màu cam,80.000₫,https://tiki.vn/vai-to-soc-ep-in-hoa-nho-tone-mau-pastel-p127252490.html?spid=127252492,40,,,thoitrangtrungnien
