title,price,link_item,index,discount,sales,category
Áo Lót Nữ Cotton Lụa Phối Ren Nature Wind Miley Lingerie BRC0913,200.000₫,https://tiki.vn/ao-lot-nu-cotton-lua-phoi-ren-nature-wind-miley-lingerie-brc0913-p85484996.html?spid=85485005,1,-57%,Đã bán 4,dolot
Quần lót lọt khe gợi cảm hình trái tim,25.000₫,https://tiki.vn/quan-lot-lot-khe-goi-cam-hinh-trai-tim-p73370505.html?spid=73370513,2,,Đã bán 26,dolot
Quần lót ren nữ form rộng mềm freesize Lylylorem QL105 từ 55-65kg - Giao màu ngẫu nhiên,40.000₫,https://tiki.vn/quan-lot-ren-nu-form-rong-mem-freesize-lylylorem-ql105-tu-55-65kg-giao-mau-ngau-nhien-p156239460.html?spid=156239462,3,-15%,Đã bán 59,dolot
"Áo lót Wacoal không gọng, nâng vừa, cup 3/4, trơn, dây liền, mút đúc IME1502",699.000₫,https://tiki.vn/ao-lot-wacoal-khong-gong-nang-vua-cup-3-4-tron-day-lien-mut-duc-ime1502-p203758227.html?spid=203758459,4,-61%,Đã bán 3,dolot
,,https://tiki.vn/ao-lot-khong-gong-dem-mong-thoai-mai-loirechic-brde143-p271798593.html?spid=271798595,5,,,dolot
Quần Lót Nữ gợi cảm quần chíp nữ đồ lót sexy chất liệu ren thêu cao cấp 1136,29.000₫,https://tiki.vn/quan-lot-nu-goi-cam-quan-chip-nu-do-lot-sexy-chat-lieu-ren-theu-cao-cap-1136-p96061253.html?spid=142210694,6,-32%,Đã bán 15,dolot
Bộ 3 Quần Lót Nữ Cotton Phối Ren Miley Lingerie FCB_03,149.000₫,https://tiki.vn/bo-3-quan-lot-nu-cotton-phoi-ren-miley-lingerie-fcb_03-p21147156.html?spid=21147160,7,,Đã bán 11,dolot
"1 Cặp Mút hình hạt đậu Độn Áo Lót, Áo Bơi Nâng Ngực Chất Lượng Xuất Khẩu, Siêu Nhẹ, Mềm Mịn, Tôn Vòng 1",20.000₫,https://tiki.vn/1-cap-mut-hinh-hat-dau-don-ao-lot-ao-boi-nang-nguc-chat-luong-xuat-khau-sieu-nhe-mem-min-ton-vong-1-p248269463.html?spid=248269493,8,,Đã bán 1,dolot
Quần lót nữ 50K Quần lót dây cột Ren Lưới siêu sexy Q17,24.000₫,https://tiki.vn/quan-lot-nu-freeship-50k-quan-lot-day-cot-ren-luoi-sieu-sexy-q17-p86561693.html?spid=86561708,9,-20%,Đã bán 10,dolot
,,https://tiki.vn/quan-lot-ren-nu-onoff-microfiber-soi-sieu-manh-mat-min-mong-nhe-16uj22a018-p213496863.html?spid=213496867,10,,,dolot
"Áo lót Nữ Triumph Fashion 468 WP ( Có Gọng , Không mút)",409.000₫,https://tiki.vn/ao-lot-nu-triumph-fashion-468-wp-co-gong-khong-mut-p273091608.html?spid=273091614,11,-21%,,dolot
Bản Nịt Ngực Không Viền Dành Cho Tomboy màu da,35.000₫,https://tiki.vn/ban-nit-nguc-khong-vien-danh-cho-tomboy-mau-da-p51152096.html?spid=51281479,12,-13%,Đã bán 209,dolot
,,https://tiki.vn/quan-don-mong-su-mem-min-that-mong-khong-lo-dem-lien-khong-xo-dich-mut-cao-cap-p192296950.html?spid=192297034,13,-37%,,dolot
"Áo Lót Thời Trang Dạng Ống Nữ Style Hàn Quốc Hiện Đại Vải Đẹp, Chất Cotton Co Dãn Siêu đẹp",100.000₫,https://tiki.vn/ao-lot-thoi-trang-dang-ong-nu-style-han-quoc-hien-dai-vai-dep-chat-cotton-co-dan-sieu-dep-p95044409.html?spid=95044419,14,,Đã bán 22,dolot
Bộ đồ lót liền thân gợi cảm cho nữ,119.000₫,https://tiki.vn/bo-do-lot-lien-than-goi-cam-cho-nu-p87720310.html?spid=87720312,15,,Đã bán 11,dolot
Quần Lót Mềm Giấu Đường May Phối Ren Cho Nữ - Quần lót xẻ dáy sexy - quần lót lọt khe C53,34.320₫,https://tiki.vn/quan-lot-mem-giau-duong-may-phoi-ren-cho-nu-quan-lot-xe-day-sexy-quan-lot-lot-khe-c53-p85902335.html?spid=85902398,16,,Đã bán 86,dolot
Combo 3 Quần Lót Lọt Khe Đúc Su Bóng Mịn Giao Màu Ngẫu Nhiên,58.300₫,https://tiki.vn/combo-3-quan-lot-lot-khe-duc-su-bong-min-giao-mau-ngau-nhien-p66605542.html?spid=68606606,17,,Đã bán 20,dolot
,,https://tiki.vn/combo-5-quan-lot-nu-thun-lanh-tron-627-p244299109.html?spid=244299115,18,,,dolot
Quần Gen Bụng Cạp Cao Định Hình Chống Cuộn Lylylorem QG05- HÀNG CHÍNH HÃNG,310.000₫,https://tiki.vn/quan-gen-bung-cap-cao-dinh-hinh-chong-cuon-lylylorem-qg05-hang-chinh-hang-p155924226.html?spid=155924228,19,,Đã bán 83,dolot
Áo lót nữ Bon Bon BV35146 áo ngực nâng trơn,465.000₫,https://tiki.vn/ao-lot-nu-bon-bon-bv35146-ao-nguc-nang-tron-p167474586.html?spid=167474714,20,,Đã bán 3,dolot
gen nịt bụng siết eo 8 xương thun dệt Sline giảm mỡ chống gập cuộn,125.000₫,https://tiki.vn/gen-nit-bung-siet-eo-8-xuong-thun-det-sline-giam-mo-chong-gap-cuon-p161904366.html?spid=161904529,21,,Đã bán 4,dolot
"Áo lót mút mỏng, có gọng phối ren hoa Bon bon - BV35151",509.000₫,https://tiki.vn/ao-mut-mong-co-gong-phoi-ren-hoa-bv35151-p148605995.html?spid=148606009,22,,Đã bán 1,dolot
Quần lót nữ cotton Mỹ kháng khuẩn dáng brief ONOFF 16UQ23A015,79.000₫,https://tiki.vn/quan-lot-nu-cotton-my-khang-khuan-dang-brief-onoff-16uq23a015-p272557198.html?spid=272557214,23,,,dolot
"Quần lót ren Wannabe QL32B lưng vừa, ôm sát cơ thể bật lên vẻ quyến rũ, gợi cảm",110.000₫,https://tiki.vn/quan-lot-ren-wannabe-ql32b-lung-vua-om-sat-co-the-bat-len-ve-quyen-ru-goi-cam-p97888641.html?spid=97888662,24,,Đã bán 8,dolot
"Áo lót trung niên cài trước, áo lót cho người già",108.000₫,https://tiki.vn/ao-lot-trung-nien-cai-truoc-ao-lot-cho-nguoi-gia-p179979931.html?spid=179979960,25,,Đã bán 5,dolot
,,https://tiki.vn/bo-3-quan-mac-vay-chat-lieu-cotton-tinh-te-lot-may-chong-viem-quan-chip-nu-khang-khuan-cao-cap-thuong-hieu-baw-nt726-p97683758.html?spid=97683760,26,,,dolot
"Quần Lót Nữ Cotton Modal Không Đường May Vicci Pro 038 Mềm Mại, Siêu Nhẹ, Kháng Khuẩn",80.000₫,https://tiki.vn/quan-lot-nu-cotton-modal-khong-duong-may-vicci-pro-038-mem-mai-sieu-nhe-khang-khuan-p199251635.html?spid=199251641,27,,Đã bán 6,dolot
Bra thiết kế Bộ đồ lót hoa sexy quần chữ y số lượng giới hạn,35.000₫,https://tiki.vn/bra-thiet-ke-bo-do-lot-hoa-sexy-quan-chu-y-so-luong-gioi-han-p171328826.html?spid=171328902,28,,Đã bán 2,dolot
Quần Độn Hông Miss J Cao Cấp Xuất Nhật 100,180.000₫,https://tiki.vn/quan-don-hong-miss-j-cao-cap-xuat-nhat-100-p120519664.html?spid=120519704,29,,Đã bán 10,dolot
Miếng dán nâng ngực silicon,49.999₫,https://tiki.vn/mieng-dan-nang-nguc-silicon-p166072603.html?spid=262806122,30,,Đã bán 1,dolot
,,https://tiki.vn/ao-lot-nu-khong-gong-dem-mong-dang-bra-danh-cho-nguoi-nguc-lon-lylylorem-al27-p156647685.html?spid=156647691,31,,,dolot
Quần Lót Chống Tràn Nguyệt San Cotton Tăm P152,44.000₫,https://tiki.vn/quan-lot-chong-tran-nguyet-san-cotton-tam-p152-p160104442.html?spid=160104464,32,,Đã bán 21,dolot
Sét 5 Cái Áo Lót Lá Học Sinh Cotton mềm mát hàng việt nam (Từ 30kg đến 70kg),126.000₫,https://tiki.vn/set-5-cai-ao-lot-la-hoc-sinh-cotton-mem-mat-hang-viet-nam-tu-30kg-den-70kg-p101280895.html?spid=101280933,33,,Đã bán 23,dolot
Bộ đồ lót thêu hoa hồng dây áo ngực quần lót lọt khe,65.000₫,https://tiki.vn/bo-do-lot-theu-hoa-hong-day-ao-nguc-quan-lot-lot-khe-p73718913.html?spid=73718914,34,,Đã bán 49,dolot
Quần lót ren lọt khe hở đáy sexy gợi cảm THE CELYNBRA,29.000₫,https://tiki.vn/quan-lot-ren-lot-khe-ho-day-sexy-goi-cam-the-celynbra-p263682996.html?spid=263683000,35,,Đã bán 7,dolot
,,https://tiki.vn/gen-nit-bap-tay-vai-sau-hut-mo-bap-tay-gel-dinh-hinh-nit-bap-tay-p147217242.html?spid=147217252,36,,,dolot
Combo 4 quần lót nữ không đường may bonding thoáng khí bikini iBasic PANW138,503.000₫,https://tiki.vn/combo-4-quan-lot-nu-khong-duong-may-bonding-thoang-khi-bikini-ibasic-panw138-p230013318.html?spid=230013338,37,,Đã bán 2,dolot
Quần lót nữ dáng Bikini gợi cảm chất liệu cotton Mỹ ONOFF - 16UJ23A034,69.000₫,https://tiki.vn/quan-lot-nu-cotton-my-onoff-h16bu20034-p193152975.html?spid=193153028,38,,Đã bán 22,dolot
Quần Lót Cotton Thoáng Mịn Loirechic QLBK16,89.000₫,https://tiki.vn/quan-lot-cotton-thoang-min-loirechic-ql16-p178768217.html?spid=178768239,39,,Đã bán 4,dolot
Áo lót Triumph D151 HP ( Không gọng không mút),189.000₫,https://tiki.vn/ao-lot-triumph-d151-hp-khong-gong-khong-mut-p273040801.html?spid=273040821,40,,Đã bán 1,dolot
