title,price,link_item,index,discount,sales,category
áo ghile nam lính mỹ túi hộp,250.000₫,https://tiki.vn/ao-ghile-nam-linh-my-tui-hop-p171937334.html?spid=171937338,1,-35%,Đã bán 3,aovest
Áo Khoác Phao Nam Nữ Siêu Ấm Siêu Dày Phong Cách Đường Phố G5006,749.000₫,https://tiki.vn/ao-khoac-phao-nam-nu-sieu-am-sieu-day-phong-cach-duong-pho-g5006-p204403899.html?spid=204403909,2,-35%,Đã bán 2,aovest
Áo Khoác Nam Cao Cấp Cực Kì Sành Điệu,132.000₫,https://tiki.vn/ao-khoac-nam-2-mat-cuc-dep-p34669916.html?spid=74905025,3,-32%,Đã bán 4,aovest
Bộ áo khoác thể thao thu đông cao cấp,505.700₫,https://tiki.vn/bo-ao-khoac-the-thao-thu-dong-cao-cap-p83517269.html?spid=83517481,4,-43%,Đã bán 9,aovest
Áo khoác da nam tay thun lót lông thời trang cao cấp,315.000₫,https://tiki.vn/ao-khoac-da-nam-tay-thun-lot-long-thoi-trang-cao-cap-p76128506.html?spid=76128510,5,-35%,Đã bán 14,aovest
OWEN - Áo khoác gió nam Owen 2 lớp cổ cao 220708 - Áo khoác Owen,1.200.000₫,https://tiki.vn/owen-ao-khoac-gio-nam-owen-chat-da-lon-2-lop-co-cao-220708-ao-khoac-owen-p202494938.html?spid=202494946,6,-35%,,aovest
Áo khoác nỉ nam nữ,85.000₫,https://tiki.vn/ao-khoac-ni-nam-nu-p187841443.html?spid=187841457,7,-5%,Đã bán 3,aovest
Áo Khoác Nam uni nỉ bông màu đen,160.000₫,https://tiki.vn/ao-khoac-nam-uni-ni-bong-mau-den-p5466291.html?spid=5466295,8,-40%,Đã bán 29,aovest
"áo gile nam phong cách châu âu siêu đẳng cấp, phiên bản cổ điển tinh tế và lịch lãm - T7",260.000₫,https://tiki.vn/ao-gile-nam-phong-cach-chau-au-sieu-dang-cap-phien-ban-co-dien-tinh-te-va-lich-lam-t7-p215069917.html?spid=215069923,9,-30%,Đã bán 2,aovest
Áo vest nam ZA09,388.700₫,https://tiki.vn/ao-vest-nam-za09-p14263694.html?spid=51067929,10,-48%,Đã bán 2,aovest
Áo Khoác Nam Áo Khoác Dù Nam Hai Lớp Cổ Cao Chống Nắng Tia Cực Tím Chống Lạnh Giá Tốt AD60 - ShopN6 (Nhiều Màu),159.000₫,https://tiki.vn/ao-khoac-nam-ao-khoac-du-nam-hai-lop-co-cao-chong-nang-tia-cuc-tim-chong-lanh-gia-tot-ad60-shopn6-nhieu-mau-p67548437.html?spid=67548478,11,-25%,Đã bán 6,aovest
"Áo gió chống lớp lót cotton, cản gió, cản nước cho Nam",142.000₫,https://tiki.vn/ao-gio-chong-lop-lot-cotton-can-gio-can-nuoc-cho-nam-p122954535.html?spid=137551170,12,,,aovest
"Áo khoác bomber nam, áo khoác kẻ, 2 màu đen – xanh – AL28",199.000₫,https://tiki.vn/ao-khoac-bomber-nam-ao-khoac-ke-2-mau-den-xanh-al28-p37543335.html?spid=37543339,13,,Đã bán 41,aovest
"áo vest, áo vest nam phối màu phong cách hàn quốc, trẻ trung cá tính và lịch lãm, chất vải dày dặn thoáng mát - N39",357.500₫,https://tiki.vn/ao-vest-ao-vest-nam-phoi-mau-phong-cach-han-quoc-tre-trung-ca-tinh-va-lich-lam-chat-vai-day-dan-thoang-mat-n39-p215838355.html?spid=215838363,14,,,aovest
"áo vest nam phối màu cực chất, phong cách hàn quốc lịch lãm sang trọng, chất vải đứng phom - H56",357.500₫,https://tiki.vn/ao-vest-nam-phoi-mau-cuc-chat-phong-cach-han-quoc-lich-lam-sang-trong-chat-vai-dung-phom-h56-p215069823.html?spid=215069853,15,,,aovest
Áo vest nam cổ tàu màu ghi xước cực cá tính VCT0004 - DUKI STORE,725.000₫,https://tiki.vn/ao-vest-nam-co-tau-mau-ghi-xuoc-cuc-ca-tinh-vct0004-duki-store-p272917007.html?spid=272917019,16,,,aovest
Áo Vest Nam Kaki Fon Phối Túi VP032VPC,189.000₫,https://tiki.vn/ao-vest-nam-kaki-fon-phoi-tui-vp032vpc-p6850847.html?spid=84208630,17,,Đã bán 15,aovest
"ÁO KHOÁC GIÓ Unixex, Áo Khoác Dù Form Rộng Unisex Nam Nữ SOTONTOP Siêu Đẹp, Áo khoác cặp đôi SoTontP Unisex Ulzzang 2 lớp phối màu hàng chuẩn from basic, Áo khoác gió SBBT cao cấp , hàng chuẩn 2 lớp dày dặn mang chống nắng gió",99.000₫,https://tiki.vn/ao-khoac-gio-unixex-ao-khoac-du-form-rong-unisex-nam-nu-sotontop-sieu-dep-ao-khoac-cap-doi-sotontp-unisex-ulzzang-2-lop-phoi-mau-hang-chuan-from-basic-ao-khoac-gio-sbbt-cao-cap-hang-chuan-2-lop-day-dan-mang-chong-nang-gio-p222233151.html?spid=222233192,18,,Đã bán 4,aovest
Áo khoác măng tô nam dáng lửng đẹp dành cho bạn trẻ NMT82,1.250.000₫,https://tiki.vn/ao-khoac-mang-to-nam-dang-lung-dep-danh-cho-ban-tre-nmt82-p273383138.html?spid=273383154,19,,,aovest
Áo Khoác Nỉ Nam Dày Dặn Có Nón,145.000₫,https://tiki.vn/ao-khoac-ni-nam-day-dan-co-non-p25693985.html?spid=78007633,20,,Đã bán 1,aovest
Áo dạ nam dáng ngắn Đẹp ++ sang trọng trẻ trung cao cấp NAD119,2.450.000₫,https://tiki.vn/ao-da-nam-dang-ngan-dep-sang-trong-tre-trung-cao-cap-nad119-p273190638.html?spid=273190654,21,,,aovest
Áo Khoác Dạ Nam Có Đai Áo Dạ Nam Dáng Vừa Kèm Đai Sans06 Sans Shop,599.000₫,https://tiki.vn/ao-khoac-da-nam-co-dai-ao-da-nam-dang-vua-kem-dai-sans06-sans-shop-p101656125.html?spid=101656276,22,,Đã bán 11,aovest
Áo măng tô nam trẻ trung dáng thắt đai ngắn lịch lãm công sở NMT170,1.450.000₫,https://tiki.vn/ao-mang-to-nam-tre-trung-dang-that-dai-ngan-lich-lam-cong-so-nmt170-p273383172.html?spid=273383198,23,,,aovest
"ÁO KHOÁC NỈ HOODIES NAM NỮ PHONG CÁCH SIÊU ĐẸP , HỌA TIẾT CỰC MỚI , DÀNH CHO CÁC BẠN TRẺ THỜI TRANG MỚI KINGSHOP79",49.000₫,https://tiki.vn/ao-khoac-ni-hoodies-nam-nu-phong-cach-sieu-dep-hoa-tiet-cuc-moi-danh-cho-cac-ban-tre-thoi-trang-moi-kingshop79-p109409853.html?spid=109410372,24,,Đã bán 15,aovest
Áo khoác ghi lê không tay,499.000₫,https://tiki.vn/ao-khoac-khong-tay-cho-nam-p75627242.html?spid=75627254,25,,Đã bán 6,aovest
Áo Khoác Big Size Unisex Áo Khoác Kaki Nam Nữ Chống Lạnh Chống Nắng Chống Nóng Chống Gió Có Túi Có Cổ Bẻ Hàn Quốc Thời Trang Cao Cấp QK48 - ShopN6,179.000₫,https://tiki.vn/ao-khoac-big-size-unisex-ao-khoac-kaki-nam-nu-chong-lanh-chong-nang-chong-nong-chong-gio-co-tui-co-co-be-han-quoc-thoi-trang-cao-cap-qk48-p95054026.html?spid=95054030,26,,Đã bán 10,aovest
"ÁO da nam TRAZ phong cách hàn quốc, Áo khoác cổ đứng hai túi kéo lót dù cao cấp",599.000₫,https://tiki.vn/ao-da-nam-traz-phong-cach-han-quoc-ao-khoac-co-dung-hai-tui-keo-lot-du-cao-cap-p201832843.html?spid=201832849,27,,,aovest
"Áo phao nam cao cấp Nhật bản chất gió trơn trần bông siêu nhẹ kiểu dáng nam tính, phong cách trẻ trung, cá tính",660.000₫,https://tiki.vn/ao-phao-nam-cao-cap-nhat-ban-chat-gio-tron-tran-bong-sieu-nhe-kieu-dang-nam-tinh-phong-cach-tre-trung-ca-tinh-p158415576.html?spid=270672355,28,,,aovest
ÁO KHOÁC GIÓ NAM CỰC HOT SIÊU ĐẸP,93.000₫,https://tiki.vn/ao-khoac-gio-nam-cuc-hot-sieu-dep-p131177475.html?spid=249217607,29,,Đã bán 3,aovest
Áo Khoác Vans X Stranger Things HFC Jean Jacket VN0007RVBLK,4.200.000₫,https://tiki.vn/ao-khoac-vans-x-stranger-things-hfc-jean-jacket-vn0007rvblk-p206781743.html?spid=206781749,30,,,aovest
ÁO KHOÁC NỈ NAM CÓ NÓN,210.000₫,https://tiki.vn/ao-khoac-ni-nam-co-non-p59498143.html?spid=78009309,31,,Đã bán 1,aovest
ÁO KHOÁC PHAO NAM BOMBER CHẰN BÔNG 3 LỚP SIÊU ẤM ÁP MÙA ĐÔNG THỜI TRANG NAM 1986,194.000₫,https://tiki.vn/ao-khoac-phao-nam-bomber-chan-bong-3-lop-sieu-am-ap-mua-dong-thoi-trang-nam-1986-p201864435.html?spid=201864492,32,,Đã bán 2,aovest
ÁO KHOÁC THỂ THAO THU ĐÔNG NAM SALOMON MINIM SYNTH JACKET M MATDC- L35935300,2.640.000₫,https://tiki.vn/ao-khoac-the-thao-thu-dong-salomon-minim-synth-jacket-m-matdc-l35935300-p257788612.html?spid=257788616,33,,,aovest
Áo Khoác Nam Lông Cừu Áo Mangto Nam Siêu Cấp Áo Dạ Nam Dáng Vừa Sans14 Sans Shop,1.529.000₫,https://tiki.vn/ao-khoac-nam-long-cuu-ao-mangto-nam-sieu-cap-ao-da-nam-dang-vua-sans14-sans-shop-p101656249.html?spid=101656673,34,,Đã bán 1,aovest
Áo Khoác phao nam thời trang AKD320,790.000₫,https://tiki.vn/ao-khoac-phao-nam-thoi-trang-akd320-p15001762.html?spid=15001770,35,,Đã bán 4,aovest
"Áo khoác da bomber nam đen cao cấp Hàn Quốc LADOS-2057 có túi trong, lót dù, form đẹp",700.000₫,https://tiki.vn/ao-khoac-da-bomber-nam-den-cao-cap-han-quoc-lados-2057-co-tui-trong-lot-du-form-dep-p201384508.html?spid=201384539,36,,,aovest
Áo khoác thể thao nam Under Armour Run Everywhere - 1379293-001,2.219.000₫,https://tiki.vn/ao-khoac-the-thao-nam-under-armour-run-everywhere-1379293-001-p271269361.html?spid=271269363,37,,,aovest
Áo Khoác Bóng Chày Bomber Varsity Nhung Tăm Cao Cấp Nam Nữ Thêu 2 Lớp Màu Đen Tay Xám By Xfire VAR-VER2NT-B/GR322,475.000₫,https://tiki.vn/ao-khoac-bong-chay-bomber-varsity-nhung-tam-cao-cap-nam-nu-theu-2-lop-mau-den-tay-xam-by-xfire-var-ver2nt-b-gr322-p185505856.html?spid=185505887,38,,,aovest
"Áo Khoác Da Nam, Áo Khoác Da Lót Lông Siêu Ấm Mùa Thu Đông Phối Khóa Đồng Cao Cấp Thời Trang DokaFashion ELD26",299.000₫,https://tiki.vn/ao-khoac-da-nam-lot-long-chong-gio-lanh-mua-thu-dong-phoi-khoa-dong-ez26-p207780705.html?spid=207780713,39,,,aovest
"áo gile nam thời trang hiện đại phong cách hàn quốc cực chất, trẻ trung , năng động, phom rộng cực basic - N47",300.000₫,https://tiki.vn/ao-gile-nam-thoi-trang-hien-dai-phong-cach-han-quoc-cuc-chat-tre-trung-nang-dong-phom-rong-cuc-basic-n47-p215069659.html?spid=215069666,40,,Đã bán 1,aovest
