title,price,link_item,index,discount,sales,category
TÃ QUẦN EM BÉ BABY LOVE M48 MIẾNG +2 MIẾNG - Hàng chính hãng Unicharm,165.000₫,https://tiki.vn/ta-quan-em-be-baby-love-m48-mieng-6-mieng-hang-chinh-hang-unicharm-p254146240.html?spid=254146241,1,-41%,Đã bán 1,tabim
Tã dán HUGGIES hương tràm trà M26 - cho bé 6-11kg,95.000₫,https://tiki.vn/ta-dan-huggies-dry-m26-cho-be-6-11kg-p94587991.html?spid=94587992,2,-38%,Đã bán 3,tabim
KHĂN VỆ SINH GIẤY (ƯỚT) KLEANNARA PEPPERMINT WET TISSUE CAP HƯƠNG BẠC HÀ (70 TỜ),48.000₫,https://tiki.vn/khan-ve-sinh-giay-uot-kleannara-peppermint-wet-tissue-cap-huong-bac-ha-70-to-p71092222.html?spid=71092223,3,-36%,Đã bán 12,tabim
Bỉm/Tã dán Merries bịch đại S82 miếng,395.000₫,https://tiki.vn/bim-ta-dan-merries-bich-dai-s82-mieng-p33385709.html?spid=68655750,4,,,tabim
Bỉm/Tã dán Merries bịch đại size M64 miếng,395.000₫,https://tiki.vn/bim-ta-dan-merries-bich-dai-size-m64-mieng-p33392131.html?spid=68647074,5,,,tabim
[COMBO 3 BỊCH] Bỉm Dán Moony natural S 58,1.380.000₫,https://tiki.vn/combo-3-bich-bim-dan-moony-natural-s-58-p57499746.html?spid=115012703,6,,,tabim
Tặng 6 miếng | Tã Dán Trẻ Em Bobby Size M 46 Miếng ( M46 Cho Bé 6 Đến 11 Kg) Êm Mềm Khô Thoáng - Bỉm Dán Bobby Size M,198.900₫,https://tiki.vn/tang-6-mieng-ta-dan-tre-em-bobby-size-m-46-mieng-m46-cho-be-6-den-11-kg-em-mem-kho-thoang-bim-dan-bobby-size-m-p260921437.html?spid=260921438,7,,,tabim
"Combo 3 Tã vải Quần short BabyCute size M, L - Giao mẫu ngẫu nhiên",330.000₫,https://tiki.vn/combo-3-ta-vai-quan-short-babycute-size-m-l-giao-mau-ngau-nhien-p22304697.html?spid=22304703,8,,Đã bán 54,tabim
COMBO 2 GÓI TÃ/BỈM QUẦN/DÁN-Nabizam NỘI ĐỊA HÀN siêu mõng/ siêu mềm,739.500₫,https://tiki.vn/combo-2-goi-ta-bim-quan-dan-nabizam-noi-dia-han-sieu-mong-sieu-mem-p149239927.html?spid=149239952,9,,,tabim
Combo 26 Gói Khăn Ướt Yuniku 90 Tờ Hương Phấn (90 Tờ x 26) - Hồng,637.000₫,https://tiki.vn/combo-26-goi-khan-uot-yuniku-90-to-huong-phan-90-to-x-26-hong-p73362217.html?spid=73362218,10,,Đã bán 12,tabim
Combo 10 Gói Khăn Ướt Max Cool 25 Tờ Hương Trà Xanh ( 25 Tờ x 10 ),85.000₫,https://tiki.vn/combo-10-goi-khan-uot-max-cool-25-to-huong-tra-xanh-25-to-x-10-p65028610.html?spid=65028611,11,,Đã bán 18,tabim
Combo 30 Gói Khăn Ướt Max Cool Không Hương (80 Tờ x 30) - Xanh,597.000₫,https://tiki.vn/combo-30-goi-khan-uot-max-cool-khong-huong-80-to-x-30-xanh-p73320493.html?spid=73320494,12,,Đã bán 2,tabim
(Tặng 2 miếng cùng loại) Tấm đệm lót mỏng nhẹ Caryn kích thước lớn 60x70cm gói 14 miếng,106.000₫,https://tiki.vn/tang-2-mieng-cung-loai-tam-dem-lot-mong-nhe-caryn-kich-thuoc-lon-60x70cm-goi-14-mieng-p270539229.html?spid=270539230,13,,Đã bán 8,tabim
Tã dán Merries bịch siêu đại newborn 90 miếng,335.000₫,https://tiki.vn/ta-dan-merries-bich-sieu-dai-newborn-90-mieng-p33376282.html?spid=207811540,14,,,tabim
com bo 2 bich ta quan goldgi eco nhat ban size m 54 mieng size L 48 mieng size XL 44 mieng size XXL 32 mieng,390.000₫,https://tiki.vn/com-bo-2-bich-ta-quan-yubest-natural-size-xxl-72-mieng-15-17kg-p86010760.html?spid=86010761,15,,Đã bán 1,tabim
"Tã/Bỉm Dán NABIZAM Magic Soft Nội Địa Hàn Mềm Mại, Mỏng Nhẹ, Thấm Hút Nhanh Size L Cho Bé Từ 9-12kg, 36 Miếng",476.000₫,https://tiki.vn/ta-bim-dan-nabizam-magic-soft-noi-dia-han-mem-mai-mong-nhe-tham-hut-nhanh-size-l-cho-be-tu-9-12kg-36-mieng-p207779546.html?spid=207779557,16,,Đã bán 1,tabim
Khăn ướt cho bé SEPTONA Baby Wipes LID SENSITIVE dành cho da nhạy cảm 64 tờ,85.000₫,https://tiki.vn/khan-uot-cho-be-septona-baby-wipes-lid-sensitive-danh-cho-da-nhay-cam-64-to-p197410924.html?spid=197410925,17,,,tabim
"Khăn giấy khô đa năng Wetlaid ENJOY sử dụng một lần mềm mại, dai, không mùi dùng làm khăn ăn, spa, nails salon - Hộp 100 tờ",50.000₫,https://tiki.vn/khan-giay-dung-mot-lan-enjoy-p59134126.html?spid=59134128,18,,Đã bán 6,tabim
Khăn ướt Bebesup Signature 70 tờ,69.000₫,https://tiki.vn/khan-uot-bebesup-signature-70-to-p222680043.html?spid=222680044,19,,,tabim
Combo tã/bỉm quần Dry-Pro L50 (9kg-14kg) + tặng Túi nước rửa bình sữa Pur 450ml,395.000₫,https://tiki.vn/combo-ta-bim-quan-dry-pro-l50-9kg-14kg-tang-tui-nuoc-rua-binh-sua-pur-450ml-p150735349.html?spid=150735350,20,,,tabim
Tã/bỉm quần Dry-Pro siêu thấm hút nhập khẩu Malaysia size XL44 (12kg - 17kg) - Gói 44 miếng,285.000₫,https://tiki.vn/ta-bim-quan-dry-pro-sieu-tham-hut-nhap-khau-malaysia-size-xl44-12kg-17kg-goi-44-mieng-p147328440.html?spid=147328441,21,,Đã bán 1,tabim
Tã/bỉm dán Dry-Pro siêu mềm nhập khẩu Malaysia size M (6kg - 10kg) - Gói 74 miếng,330.000₫,https://tiki.vn/ta-bim-dan-dry-pro-sieu-mem-nhap-khau-malaysia-size-m-6kg-10kg-goi-74-mieng-p147325107.html?spid=147325108,22,,Đã bán 2,tabim
Tã/bỉm quần Dry-Pro siêu thấm hút nhập khẩu Malaysia size XL (12kg - 17kg) - Gói 16 miếng,115.000₫,https://tiki.vn/ta-bim-quan-dry-pro-sieu-tham-hut-nhap-khau-malaysia-size-xl-12kg-17kg-goi-16-mieng-p147328337.html?spid=147328338,23,,,tabim
Tã Quần Siêu Mỏng Size M 60 Miếng Nyna Gold Siêu Thấm Khô Thoáng Cho Bé Cả Ngày Vui Chơi,334.000₫,https://tiki.vn/ta-quan-sieu-mong-size-m-60-mieng-nynagold-sieu-tham-kho-thoang-cho-be-ca-ngay-vui-choi-p171543709.html?spid=171543712,24,,,tabim
Tã Bỉm Quần Kibie M52 (52 Miếng) - Bao Bì Mới,270.000₫,https://tiki.vn/ta-bim-quan-kibie-m52-52-mieng-bao-bi-moi-p78926512.html?spid=78926513,25,,Đã bán 7,tabim
Tã Dán Siêu Mềm Size S 56 Miếng Nyna Gold Chất Lượng Cao Giá Rẻ,240.000₫,https://tiki.vn/ta-dan-sieu-mem-size-s-56-mieng-nynagold-chat-luong-cao-gia-re-p171543697.html?spid=171543699,26,,,tabim
"COMBO 4 Bịch Tã/Bỉm Dán NABIZAM UltraThin Nội Địa Hàn Cao Cấp Size XL Cho Bé Trên 12kg, 32 Miếng",1.940.000₫,https://tiki.vn/combo-4-bi-ch-ta-bim-dan-nabizam-ultrathin-noi-dia-han-cao-cap-size-xl-cho-be-tren-12kg-32-mieng-p207779377.html?spid=207779386,27,,,tabim
"COMBO 4 Tã/Bỉm Quần NABIZAM Magic Soft Nội Địa Hàn Với Công Nghệ Thấm Hút Ngược Size L Cho Bé Từ 8-13kg, 30 Miếng/Bịch",1.680.000₫,https://tiki.vn/combo-4-ta-bim-quan-nabizam-magic-soft-noi-dia-han-voi-cong-nghe-tham-hut-nguoc-size-l-cho-be-tu-8-13kg-30-mieng-bich-p207779215.html?spid=207779216,28,,,tabim
"COMBO 4 Bịch Tã/Bỉm Dán Nabizam UltraThin Nội Địa Hàn Cao Cấp, Mỏng và Thấm Hút Tối Ưu Size M Cho Bé 6-11kg, 40 miếng",1.904.000₫,https://tiki.vn/combo-4-bi-ch-ta-bim-dan-nabizam-ultrathin-noi-dia-han-cao-cap-mong-va-tham-hut-toi-uu-size-m-cho-be-6-11kg-40-mieng-p207779219.html?spid=207779221,29,,,tabim
"Combo 4 Tã/Bỉm Quần Nabizam UltraThin Nội Địa Hàn Cao Cấp Mỏng Vượt Trội, Thấm Hút, Chống Tràn M/6-11kg/32 Miếng/Bịch",1.680.000₫,https://tiki.vn/combo-4-ta-bim-quan-nabizam-ultrathin-noi-dia-han-cao-cap-mong-vuot-troi-tham-hut-chong-tran-m-6-11kg-32-mieng-bich-p207779500.html?spid=207779507,30,,Đã bán 1,tabim
"(Set 10 Gói) Khăn Uớt Bỏ Túi Mang Đi AIKO 20 tờ - Không Mùi/Kháng Khuẩn Mềm Mại, Mịn Màng, Sạch Sẽ, An Toàn Khi Sử Dụng, Tiện Lợi Khi Đi Xa",120.000₫,https://tiki.vn/set-10-goi-khan-uot-bo-tui-mang-di-aiko-20-to-khong-mui-khang-khuan-mem-mai-min-mang-sach-se-an-toan-khi-su-dung-tien-loi-khi-di-xa-p264751688.html?spid=264751698,31,,,tabim
Tã/bỉm quần Molfix Thiên nhiên Ultra M42 (6kg - 11kg) - Gói 42 miếng,215.000₫,https://tiki.vn/ta-bim-quan-molfix-thien-nhien-ultra-m42-6kg-11kg-goi-42-mieng-p225200219.html?spid=225200220,32,,,tabim
COMBO 5 BỊCH TÃ QUẦN ROSE BABY XL26 MIẾNG TỪ 12-17KG,665.000₫,https://tiki.vn/combo-5-bich-ta-quan-rose-baby-xl26-mieng-tu-12-17kg-p273196974.html?spid=273196975,33,,,tabim
Tã/bỉm dán Molfix Thiên nhiên Jumbo S56 (4kg - 8kg) - Gói 56 miếng,225.000₫,https://tiki.vn/ta-bim-dan-molfix-thien-nhien-jumbo-s56-4kg-8kg-goi-56-mieng-p225201220.html?spid=225201221,34,,,tabim
Tã Quần Em Bé Siêu Khô Thoáng Unidry Size M60,284.900₫,https://tiki.vn/ta-quan-em-be-sieu-kho-thoang-unidry-size-m60-p118100091.html?spid=203899283,35,,Đã bán 1,tabim
"Khăn Ướt MAMAMY Không Mùi Hoặc Mùi Dịu Nhẹ Ngừa Hăm, Rôm Sảy Cho Bé (30 tờ/ gói)",44.000₫,https://tiki.vn/khan-uot-mamamy-khong-mui-30-mieng-p249570155.html?spid=263401709,36,,,tabim
Combo 6+4 khăn ướt làm sạch tinh khiết dành cho bé Oma&Baby với công thức chlorhexidine DIgluconate kháng khuẩn an toàn dịu nhẹ (6 gói 85pcs+4 gói 25pcs),259.000₫,https://tiki.vn/combo-6-4-khan-uot-lam-sach-tinh-khiet-danh-cho-be-oma-baby-voi-cong-thuc-chlorhexidine-digluconate-khang-khuan-an-toan-diu-nhe-6-goi-85pcs-4-goi-25pcs-p134310411.html?spid=134310412,37,,Đã bán 2,tabim
Bỉm quần moony M52 miếng,390.000₫,https://tiki.vn/bim-quan-moony-m58-p252794666.html?spid=252794668,38,,,tabim
"Bộ 6 Gói Khăn Vải Khô Đa Năng Nuk (80C X 6 Gói) (Dry Cotton Wipes, 80 Pc/Bag X 6)",549.000₫,https://tiki.vn/bo-6-goi-khan-vai-kho-da-nang-nuk-80c-x-6-goi-dry-cotton-wipes-80-pc-bag-x-6-p36085061.html?spid=36398472,39,,Đã bán 1,tabim
Combo 2 Gói Tã Dán Cao Cấp Moony Nhật Bản M58 (58 Miếng ),578.000₫,https://tiki.vn/combo-2-goi-ta-dan-cao-cap-moony-nhat-ban-m58-58-mieng-p58135703.html?spid=70719591,40,,Đã bán 1,tabim
