title,price,link_item,index,discount,sales,category
Sách - Tomato Toeic Speaking Flow (Kèm 1CD - ROM + 1 MP3),268.000₫,https://tiki.vn/sach-tomato-toeic-speaking-flow-kem-1cd-rom-1-mp3-p81939247.html?spid=81939249,1,-20%,Đã bán 6,dinhduongchobe
"(Tặng bộ đồ chơi ô tô) Combo 2 lon sữa mát tăng cân, cải thiện biếng ăn Babego 0-12 tháng",1.080.000₫,https://tiki.vn/combo-2-lon-sua-mat-tang-can-cai-thien-bieng-an-babego-0-12-thang-p164960453.html?spid=164960454,2,-15%,Đã bán 2,dinhduongchobe
"FITOBIMBI BRONCAMIL, 200ml, Siro giảm ho cho bé của Ý - Y Dược Xanh",320.000₫,https://tiki.vn/mua-fitobimbi-broncamil-200ml-siro-giam-ho-cho-be-y-duoc-xanh-p248380018.html?spid=248380027,3,-20%,,dinhduongchobe
"HARTUS APPETITE, 150ml, Siro ăn ngon cho bé của Ba Lan - Y Dược Xanh",190.000₫,https://tiki.vn/mua-hartus-appetite-150ml-siro-an-ngon-cho-be-y-duoc-xanh-p248367310.html?spid=248367325,4,-10%,Đã bán 15,dinhduongchobe
"Dầu húng chanh lên men Minion gold 30ml tăng đề kháng, giảm ho, khò khè",246.000₫,https://tiki.vn/dau-hung-chanh-len-men-minion-gold-30ml-tang-de-khang-giam-ho-kho-khe-p130780567.html?spid=150989160,5,-10%,Đã bán 48,dinhduongchobe
"Combo 6 Gói Trái cây nghiền vị táo, cherry, quả lý chua và thanh lương trà Fruto Nyanya 90g",221.088₫,https://tiki.vn/combo-6-goi-trai-cay-nghien-vi-tao-cherry-qua-ly-chua-va-thanh-luong-tra-fruto-nyanya-90g-p99417580.html?spid=99417581,6,-20%,Đã bán 9,dinhduongchobe
"Trái cây nghiền vị táo, phô mai tươi và bánh quy Agusha 90g dành cho bé từ 6 tháng trở lên",32.300₫,https://tiki.vn/trai-cay-nghien-vi-tao-pho-mai-tuoi-va-banh-quy-agusha-90g-danh-cho-be-tu-6-thang-tro-len-p249208156.html?spid=249208157,7,-60%,,dinhduongchobe
"Siro Healthza BoneDK bổ sung Vitamin D3, K2(MK7) dạng nhỏ giọt hộp 1 lọ/30ml",149.600₫,https://tiki.vn/healthza-bonedk-dang-giot-30ml-danh-cho-be-p184052667.html?spid=184052668,8,-32%,,dinhduongchobe
Dầu Oliu Nguyên Chất Thuyền Xưa Ăn Dặm cho con 65ml,50.400₫,https://tiki.vn/dau-oliu-nguyen-chat-thuyen-xua-an-dam-cho-con-65ml-p208376766.html?spid=208376767,9,-20%,Đã bán 3,dinhduongchobe
"Sữa ăn dặm tăng đề kháng gạo sữa vị dâu tây, dâu đất và táo Agusha 200ml",26.100₫,https://tiki.vn/sua-an-dam-tang-de-khang-gao-sua-vi-dau-tay-dau-dat-va-tao-agusha-200ml-p235520748.html?spid=235520749,10,-32%,,dinhduongchobe
"Trái cây nghiền vị táo, cherry, quả lý chua và thanh lương trà Fruto Nyanya 90g",37.600₫,https://tiki.vn/trai-cay-nghien-vi-tao-cherry-qua-ly-chua-va-thanh-luong-tra-fruto-nyanya-90g-p113572199.html?spid=113572200,11,-31%,Đã bán 72,dinhduongchobe
Hỗ Trợ chữa ho cho trẻ Brauer Kids Manuka Honey Dry Cough Úc - QuaTangMe Extaste,278.000₫,https://tiki.vn/chua-ho-cho-tre-brauer-kids-manuka-honey-dry-cough-chua-cac-thanh-phan-thao-duoc-lam-giam-cac-con-ho-la-cach-chua-ho-cho-be-hieu-qua-lo-100ml-p71507483.html?spid=71507484,12,-20%,Đã bán 31,dinhduongchobe
SBPS Calokid Gold 180ml ( thùng 48 hộp ),815.280₫,https://tiki.vn/sbps-calokid-gold-180ml-thung-48-hop-p269957742.html?spid=235710466,13,-21%,Đã bán 1,dinhduongchobe
"Sữa Công Thức Hữu Cơ Miwako A+ Nhập Khẩu Malaysia, Gói 30g Vị Vani, Sữa Hạt Cho Bé Từ 1 Tuổi Giúp Bé Ngủ Ngon Tiêu Hóa Tốt",34.000₫,https://tiki.vn/sua-cong-thuc-huu-co-miwako-a-nhap-khau-malaysia-goi-30g-vi-vani-sua-hat-cho-be-tu-1-tuoi-giup-be-ngu-ngon-tieu-hoa-tot-p205113999.html?spid=205114001,14,-20%,Đã bán 18,dinhduongchobe
Men Vi Sinh SySy Pro(2g/gói) - Baby SySy Pro (Từ 0 tuổi) - 60 gói,992.000₫,https://tiki.vn/men-vi-sinh-sysy-pro-lotte-food-han-quoc-2g-goi-p170403281.html?spid=170403285,15,-28%,Đã bán 51,dinhduongchobe
"Trái cây nghiền vị táo, mơ và kem tươi Fruto Nyanya 90g",37.600₫,https://tiki.vn/trai-cay-nghien-vi-tao-mo-va-kem-tuoi-fruto-nyanya-90g-p114140785.html?spid=114140786,16,-52%,Đã bán 59,dinhduongchobe
Sữa bột MAGECARE GOLD GROWPLUS,395.000₫,https://tiki.vn/sua-bot-magecare-gold-growplus-p201598410.html?spid=201598411,17,-31%,,dinhduongchobe
2 Hộp Sữa dinh dưỡng SURE UC – IQ PLUS 3 400G,380.000₫,https://tiki.vn/2-hop-sua-dinh-duong-sure-uc-iq-plus-3-400g-p46219228.html?spid=55660161,18,-52%,,dinhduongchobe
Bánh Ăn Dặm PAPAFOOD PAPAPUFFS STARS - 100% Nguyên Liệu Hữu Cơ,65.000₫,https://tiki.vn/banh-an-dam-papafood-papapuffs-stars-100-nguyen-lieu-huu-co-p249823164.html?spid=249823165,19,,,dinhduongchobe
Sữa công thức OraCare step 3 lon 900g - Dinh dưỡng cho trẻ biếng ăn từ 1 - 10 tuổi.,432.000₫,https://tiki.vn/sua-oracare-pedia-gold-lon-900g-dinh-duong-cho-tre-bieng-an-tu-1-10-tuoi-p176070603.html?spid=176070604,20,,Đã bán 1,dinhduongchobe
Nước Uống Dinh Dưỡng Vị Sữa Dành Cho Trẻ Em Long Dino Mẫu Mới (10 Gói x 120ml),200.000₫,https://tiki.vn/nuoc-uong-dinh-duong-vi-sua-danh-cho-tre-em-long-dino-mau-moi-10-goi-x-120ml-p99158107.html?spid=99158108,21,,Đã bán 2,dinhduongchobe
Sữa bột Vinamilk Pedia Kenji 2+ (cho trẻ từ 2 đến 10 tuổi),520.000₫,https://tiki.vn/sua-bot-vinamilk-pedia-kenji-2-cho-tre-tu-2-den-10-tuoi-p185594412.html?spid=190233274,22,,Đã bán 3,dinhduongchobe
Sữa bột UC2 Platinum Colos 24h 1+ loại 850g,355.000₫,https://tiki.vn/sua-bot-uc2-platinum-colos-24h-1-loai-850g-p273266727.html?spid=273266728,23,,,dinhduongchobe
Sữa Non ILDong Số 2 (1-9 tuổi) - Nhập khẩu Hàn Quốc,265.000₫,https://tiki.vn/sua-non-ildong-so-2-1-9-tuoi-nhap-khau-han-quoc-p126480849.html?spid=270475481,24,,,dinhduongchobe
Dầu Lợi An Bôi Ho - Hết Đờm - Sổ mũi - Khò Khè - Tăng Đề Kháng,230.000₫,https://tiki.vn/dau-loi-an-boi-ho-het-dom-so-mui-kho-khe-tang-de-khang-p242078371.html?spid=242078373,25,,,dinhduongchobe
Bổ sung kẽm cho trẻ dạng lỏng Brauer 200ml,484.000₫,https://tiki.vn/bo-sung-kem-cho-tre-dang-long-brauer-200ml-p155112802.html?spid=155112803,26,,Đã bán 1,dinhduongchobe
"Sữa Mát Lactomin Gain 900g ( Trên 3 tuổi)- Hấp Thụ, Tăng Cân",436.800₫,https://tiki.vn/sua-mat-lactomin-gain-900g-tren-3-tuoi-hap-thu-tang-can-p273353600.html?spid=273353601,27,,,dinhduongchobe
"SBPS Colosbaby Gold 110ml giúp bé tăng cân, miễn dịch khỏe ( lốc 4 hộp ) - VitaDairy",40.844₫,https://tiki.vn/sbps-colosbaby-gold-110ml-giup-be-tang-can-mien-dich-khoe-loc-4-hop-vitadairy-p271580574.html?spid=271580575,28,,,dinhduongchobe
Sữa Meiji Nội Địa Nhật Dạng Thanh Số 1- 3 Tuổi 48 Thanh ( Mẫu Mới ),1.060.000₫,https://tiki.vn/sua-meiji-noi-dia-nhat-dang-thanh-so-1-3-tuoi-48-thanh-mau-moi-p121171295.html?spid=167461856,29,,Đã bán 2,dinhduongchobe
Sữa bột công thức Meiji Hohoemi Milk cho bé 0 đến 12 tháng tuổi (800g) - Nhập khẩu Nhật,595.000₫,https://tiki.vn/sua-bot-cong-thuc-meiji-hohoemi-milk-cho-be-0-den-12-thang-tuoi-800g-nhap-khau-nhat-p11385929.html?spid=167461417,30,,Đã bán 9,dinhduongchobe
Sữa Meiji Nội Địa Số 0 Dạng Thanh (24 Thanh),710.000₫,https://tiki.vn/sua-meiji-noi-dia-so-0-dang-thanh-24-thanh-p2034515.html?spid=167461887,31,,Đã bán 1,dinhduongchobe
COMBO 48 HỘP SỮA BỘT PHA SẴN DIELAC GROW 110ML,384.000₫,https://tiki.vn/combo-48-hop-sua-bot-pha-san-dielac-grow-110ml-p22783498.html?spid=53544736,32,,Đã bán 16,dinhduongchobe
Sữa Bột Meiji Nội Địa Step Milk Số 9 (800g),520.000₫,https://tiki.vn/sua-bot-meiji-noi-dia-step-milk-so-9-800g-p3678043.html?spid=167461489,33,,Đã bán 2,dinhduongchobe
Combo 6 lọ Dinh dưỡng ăn dặm Trái cây nghiền mận đen hỗ trợ tiêu hóa Semper Prune 80g dành cho bé từ 4 tháng tuổi,319.872₫,https://tiki.vn/combo-6-lo-trai-cay-nghien-man-kho-dong-lo-semper-prune-80g-danh-cho-be-tu-4-thang-tro-len-p269952281.html?spid=269952282,34,,,dinhduongchobe
Bánh ăn dặm Agusha vị Quả mọng (30g) dành cho bé từ 12 tháng trở lên,22.320₫,https://tiki.vn/banh-an-dam-agusha-vi-qua-mong-30g-danh-cho-be-tu-12-thang-tro-len-p257779135.html?spid=257779136,35,,,dinhduongchobe
"DHA tinh khiết cho bé Brauer Ultra Pure Úc Giúp phát triển não bộ, khả năng tập trung và ghi nhớ, tốt cho mắt cải thiện thi lực - Massel Official",471.000₫,https://tiki.vn/dha-tinh-khiet-cho-be-brauer-ultra-pure-uc-giup-phat-trien-nao-bo-kha-nang-tap-trung-va-ghi-nho-tot-cho-mat-cai-thien-thi-luc-massel-official-p271588062.html?spid=121106508,36,,Đã bán 8,dinhduongchobe
3 Thùng Sữa Bột Pha Sẵn GrowPLUS+ Đỏ 180ml Suy Dinh Dưỡng (48 Hộp x 180ml),1.680.000₫,https://tiki.vn/3-thung-sua-bot-pha-san-growplus-do-180ml-suy-dinh-duong-48-hop-x-180ml-p44922504.html?spid=44922505,37,,Đã bán 14,dinhduongchobe
"Sữa Nhật Cho Bé Tăng Cân Từ 0 Đến 1 Tuổi Meiji Hỗ Trợ Tăng Hệ Miễn Dịch, Tạo Hệ Tiêu Hóa Tốt Hấp Thụ Dưỡng Chất Hiệu Quả Giúp Bé Phát Triển Cân Đối Nhất Cả Về Chiều Cao, Cân Nặng, Trí Não - 1 Hộp",595.000₫,https://tiki.vn/sua-nhat-cho-be-tang-can-tu-0-toi-1-tuoi-meiji-ho-tro-tang-he-mien-dich-tao-he-tieu-hoa-tot-hap-thu-duong-chat-hieu-qua-giup-be-phat-trien-can-doi-nhat-ca-ve-chieu-cao-can-nang-tri-nao-p122911154.html?spid=167461736,38,,,dinhduongchobe
"Sữa Bột Hoàng Gia Úc Royal Ausnz Premium Gold Số 2 Bổ Sung Vitamin, Khoáng Chất Cho Trẻ 900G",660.000₫,https://tiki.vn/sua-bot-hoang-gia-uc-royal-ausnz-premium-gold-so-2-bo-sung-vitamin-khoang-chat-cho-tre-900g-p43851252.html?spid=47154934,39,,Đã bán 39,dinhduongchobe
"DHA dầu cá tuyết tinh khiết cho trẻ sơ sinh, trẻ nhỏ Brauer DHA Úc giúp phát triển trí não, tăng khả năng tập trung, cải thiện thị lực-OZ Slim Store",471.000₫,https://tiki.vn/dha-dau-ca-tuyet-tinh-khiet-cho-tre-so-sinh-tre-nho-brauer-dha-uc-giup-phat-trien-tri-nao-tang-kha-nang-tap-trung-cai-thien-thi-luc-oz-slim-store-p272368298.html?spid=105321319,40,,Đã bán 34,dinhduongchobe
