title,price,link_item,index,discount,sales,category
"Áo dài bé gái 8-20kg chất tăm nhung cao cấp Baby-S, Áo dài cách tân cho bé họa tiết hoa nhí tay bồng xinh xắn – SAD007",149.000₫,https://tiki.vn/a-o-da-i-be-ga-i-8-20kg-cha-t-tam-nhung-cao-ca-p-baby-s-a-o-da-i-ca-ch-tan-cho-be-ho-a-tie-t-hoa-nhi-tay-bo-ng-xinh-xa-n-sad007-p208130148.html?spid=208130184,1,-32%,Đã bán 2,thoitrangmevabe
Sandal Eva Phun Bé Trai Biti's BEB000800,290.400₫,https://tiki.vn/sandal-eva-phun-be-trai-biti-s-beb000800-p270297006.html?spid=270297016,2,-12%,Đã bán 6,thoitrangmevabe
QUẦN ĐÓNG BỈM CHO BÉ SƠ SINH CÓ SIZE TỪ 3-9kg,3.700₫,https://tiki.vn/quan-dong-bim-cho-be-so-sinh-co-size-tu-3-9kg-p76554345.html?spid=191268429,3,-32%,Đã bán 14,thoitrangmevabe
Đầm Bầu Thiết Kế Chấm Bi Dáng Suông Cổ Bèo Chất Lụa Hàn Mềm Siêu Mát VV51,108.000₫,https://tiki.vn/dam-bau-thiet-ke-cham-bi-dang-suong-co-beo-chat-lua-han-mem-sieu-mat-vv51-p148637269.html?spid=148637291,4,-36%,Đã bán 5,thoitrangmevabe
Áo dài cách tân hạc nhũ phú quý màu vàng bé trai 1-12 tuổi,295.000₫,https://tiki.vn/ao-dai-cach-tan-hac-nhu-phu-quy-mau-vang-be-trai-1-12-tuoi-p76205485.html?spid=76205503,5,-37%,Đã bán 9,thoitrangmevabe
Đầm xoè voan nhiều lớp sang trọng cho bé gái 1-6 tuổi từ 12 đến 22 kg 02610-02612,177.800₫,https://tiki.vn/dam-xoe-voan-nhieu-lop-sang-trong-cho-be-gai-1-6-tuoi-tu-12-den-22-kg-02610-02612-p72622302.html?spid=72622330,6,-12%,Đã bán 4,thoitrangmevabe
Giày thể thao giày đi học Hello Kitty cho bé gái phong cách Hàn Quốc ETT007,109.000₫,https://tiki.vn/giay-the-thao-giay-di-hoc-hello-kitty-cho-be-gai-phong-cach-han-quoc-ett007-p182812718.html?spid=182812726,7,-48%,Đã bán 1,thoitrangmevabe
Đồ bộ croptop cho bé gái từ 10-41kg. Áo croptop bé gái. Quần dạng thể thao -Kiến Lửa,139.000₫,https://tiki.vn/do-bo-croptop-cho-be-gai-tu-10-41kg-ao-croptop-be-gai-quan-dang-the-thao-kien-lua-p102107969.html?spid=102107975,8,-51%,Đã bán 8,thoitrangmevabe
Áo len gile bé trai từ 10 đến 30kg,185.000₫,https://tiki.vn/ao-len-gile-be-trai-tu-10-den-30kg-p119690674.html?spid=119690685,9,-40%,Đã bán 56,thoitrangmevabe
BỘ VEST BÉ TRAI CATRIO PCT112020/17 là bộ đồ suit trẻ em CATRIO từ 2 tuổi 12kg đến 7 tuổi 26kg gồm 3 chi tiết ÁO VEST + QUẦN DÀI BÉ TRAI + ÁO GILET GHILE vải dạ cao cấp mềm mượt tuyệt đẹp cho bé dự tiệc cưới hỏi vest biểu diễn đẹp,769.000₫,https://tiki.vn/bo-vest-be-trai-catrio-pct112020-17-la-bo-complet-veston-tre-em-catrio-tu-2-tuoi-12kg-den-7-tuoi-26kg-thuoc-bst-quan-ao-complet-veston-tre-em-catrio-cho-tiec-cuoi-le-tet-sinh-nhat-p140132535.html?spid=140132537,10,-41%,Đã bán 1,thoitrangmevabe
Quần Legging Bé Gái ️ Quần Legging Cho Bé Cotton Co Giãn Xuất Xịn 9-41kg,49.000₫,https://tiki.vn/quan-legging-be-gai-quan-legging-cho-be-cotton-co-gian-xuat-xin-9-41kg-p103520272.html?spid=103521447,11,-12%,Đã bán 11,thoitrangmevabe
"Đầm liền bé gái xinh xắn, đồng phục học sinh cấp 1 cổ sen, tay bồng, nhiều kiểu rất dễ thương, có dây cột nơ sau eo, size to đến 60kg",131.000₫,https://tiki.vn/dam-lien-be-gai-xinh-xan-dong-phuc-hoc-sinh-cap-1-co-sen-tay-bong-nhieu-kieu-rat-de-thuong-co-day-cot-no-sau-eo-size-to-den-60kg-p253273176.html?spid=253273183,12,,,thoitrangmevabe
VALI PEPPA cho bé trai và bé gái,330.000₫,https://tiki.vn/vali-peppa-cho-be-trai-va-be-gai-p161255971.html?spid=161255973,13,,Đã bán 11,thoitrangmevabe
"Bộ áo sơ sinh tay dài BARU cài nút giữa , chất vải 100% cotton mềm mịn cho bé sơ sinh ( 0-6m )",159.000₫,https://tiki.vn/bo-ao-so-sinh-tay-dai-cai-nut-giua-chat-vai-100-cotton-mem-min-cho-be-so-sinh-b138-p270874412.html?spid=270874420,14,,,thoitrangmevabe
Sandal Biti's Eva Phun Bé Gái DEG010000XAM,308.000₫,https://tiki.vn/sandal-biti-s-eva-phun-be-gai-deg010000xam-p212566262.html?spid=212566272,15,,Đã bán 3,thoitrangmevabe
Quần bầu chất nỉ dáng thể thao bom gấu siêu xinh QB1266,95.000₫,https://tiki.vn/quan-bau-chat-ni-dang-the-thao-bom-gau-sieu-xinh-qb1266-p148641450.html?spid=148641464,16,,Đã bán 30,thoitrangmevabe
"Đầm bé gái liền vai tay quấn bèo Haki, váy thiết kế cho bé gái từ 0-8 tuổi (khoảng 10-27kg), đầm hè cho bé HK516.1",101.000₫,https://tiki.vn/dam-be-gai-lien-vai-tay-quan-beo-haki-vay-thiet-ke-cho-be-gai-tu-0-8-tuoi-khoang-10-27kg-dam-he-cho-be-hk516-1-p101928177.html?spid=101928179,17,,Đã bán 4,thoitrangmevabe
Váy Đầm bầu công sở đẹp 2023- Đầm sau sinh cho con bú ti - Thời trang bà bầu xinh dự tiệc mùa hè Bigsize ẢNH THẬT,289.000₫,https://tiki.vn/vay-dam-bau-cong-so-dep-2023-dam-sau-sinh-cho-con-bu-ti-thoi-trang-ba-bau-xinh-du-tiec-mua-he-bigsize-anh-that-p270239289.html?spid=270239299,18,,,thoitrangmevabe
Đầm voan công chúa cho bé gái dáng dài màu hồng cầu vồng mặc noel dự tiệc hàng Quảng Châu cao cấp,367.000₫,https://tiki.vn/dam-voan-cong-chua-cho-be-gai-dang-dai-mau-hong-cau-vong-mac-noel-du-tiec-hang-quang-chau-cao-cap-p217635487.html?spid=217635503,19,,,thoitrangmevabe
Bộ body cho bé sơ sinh 0-2 tuổi dài tay cotton mềm mại nhiều màu mặt gấu cực xinh cho bé trai bé gái mùa thu đông,145.000₫,https://tiki.vn/bo-body-cho-be-so-sinh-0-2-tuoi-dai-tay-cotton-mem-mai-nhieu-mau-mat-gau-cuc-xinh-cho-be-trai-be-gai-mua-thu-dong-p271516073.html?spid=271516117,20,,Đã bán 1,thoitrangmevabe
Quần thô dài cho bé trai từ 13-40kg,185.000₫,https://tiki.vn/quan-tho-dai-cho-be-trai-tu-13-40kg-p194860261.html?spid=194860305,21,,Đã bán 2,thoitrangmevabe
"Áo ngực cho bé gái có đệm co dãn 4 chiều cao cấp, Áo ngực trẻ em thoáng mát , Áo lá học sinh",26.000₫,https://tiki.vn/ao-nguc-cho-be-gai-co-dem-co-dan-4-chieu-cao-cap-ao-nguc-tre-em-thoang-mat-ao-la-hoc-sinh-p112552815.html?spid=112552889,22,,Đã bán 105,thoitrangmevabe
Đồ bộ bé gái tay dài quần dài chấm bi đỏ,100.000₫,https://tiki.vn/do-bo-be-gai-tay-dai-quan-dai-cham-bi-do-p208421998.html?spid=208422004,23,,,thoitrangmevabe
Áo khoác kaki cho bé trai kaki dày 2 lớp thêu Smile,195.000₫,https://tiki.vn/ao-khoac-kaki-cho-be-trai-kaki-day-2-lop-theu-smile-p149554223.html?spid=149554549,24,,Đã bán 1,thoitrangmevabe
Giày sneaker trẻ em Fila Fila Raytle - 3XM01849E,1.077.000₫,https://tiki.vn/giay-sneaker-tre-em-fila-fila-raytle-3xm01849e-p205365752.html?spid=205365785,25,,Đã bán 1,thoitrangmevabe
"Đồ Bộ Bé Gái, Quần Áo Trẻ Em Gái Habi Fashion HB2319 Họa Tiết Lamlick Phong Cách Cá Tính, Cho Bé 18-50Kg",189.000₫,https://tiki.vn/do-bo-be-gai-quan-ao-tre-em-gai-habi-fashion-hb2319-hoa-tiet-lamlick-phong-cach-ca-tinh-cho-be-18-50kg-p272167937.html?spid=272167971,26,,Đã bán 1,thoitrangmevabe
Váy Bầu Công Sở Thu Đông Azuno AZ1811 Chất Liệu Nhung Ép Cao Cấp Mẫu Mới,295.000₫,https://tiki.vn/vay-bau-cong-so-thu-dong-azuno-az1811-chat-lieu-nhung-ep-cao-cap-mau-moi-p72949957.html?spid=210280559,27,,,thoitrangmevabe
Sandal Cao Su Bé Trai Biti's BTB000200 Siêu Bền,259.600₫,https://tiki.vn/sandal-cao-su-be-trai-biti-s-btb000200-sieu-ben-p259512110.html?spid=259512118,28,,,thoitrangmevabe
"Combo 5 quần thun bé trai, quần mặc ở nhà, mặc ngủ, quần thun trẻ em cotton - 5 màu ngẫu nhiên",45.000₫,https://tiki.vn/combo-5-qua-n-thun-be-trai-quan-mac-o-nha-mac-ngu-quan-thun-tre-em-cotton-5-ma-u-nga-u-nhien-p175526117.html?spid=175526119,29,,Đã bán 6,thoitrangmevabe
"Quần Áo Bé Trai, Đồ Bộ BéTrai Ba Lỗ Sát Nách Thể Thao Quần Kẻ Sọc Chất Cotton Mềm Mịn",75.000₫,https://tiki.vn/quan-ao-be-trai-do-bo-betrai-ba-lo-sat-nach-the-thao-quan-ke-soc-chat-cotton-mem-min-p175652181.html?spid=175652240,30,,Đã bán 8,thoitrangmevabe
Bộ Quần Áo Trẻ Em - Bé Trai In 3D 01,104.760₫,https://tiki.vn/bo-quan-ao-tre-em-be-trai-in-3d-01-p7944797.html?spid=7944801,31,,Đã bán 55,thoitrangmevabe
TA102 Chân váy cho bé gái AmbbKids V024-S001 từ 4-10T,182.000₫,https://tiki.vn/ta102-chan-vay-cho-be-gai-ambbkids-v024-s001-tu-4-10t-gia-tot-p221222886.html?spid=221222997,32,,,thoitrangmevabe
Váy đầm bé gái Pony màu đen - Size 11-45kg - K133,150.000₫,https://tiki.vn/vay-dam-be-gai-pony-mau-den-size-11-45kg-k133-p90526593.html?spid=90526599,33,,Đã bán 203,thoitrangmevabe
Áo khoác kaki cho bé trai hàng Quảng Châu form lớn từ 15 đến 32 kg 01475,156.800₫,https://tiki.vn/ao-khoac-kaki-cho-be-trai-hang-quang-chau-form-lon-tu-15-den-32-kg-01475-p46191113.html?spid=46191123,34,,Đã bán 16,thoitrangmevabe
"Sandal bé gái kẻ caro đế mềm họa tiết công chúa , xăng đan mùa hè ( Mẫu mới ) TTL104",169.000₫,https://tiki.vn/sandal-be-gai-ke-caro-de-mem-hoa-tiet-cong-chua-xang-dan-mua-he-mau-moi-ttl104-p187622320.html?spid=187622356,35,,Đã bán 2,thoitrangmevabe
Bà ba bé gái cam xanh tím,100.000₫,https://tiki.vn/ba-ba-be-gai-cam-xanh-tim-p272287673.html?spid=272287703,36,,Đã bán 1,thoitrangmevabe
"Quần dài cotton,Quần legging cho bé gái Chất liệu cotton inin hình thỏ đẹp (SZ 10-23KG)",58.650₫,https://tiki.vn/quan-dai-cotton-qua-n-legging-cho-be-ga-i-cha-t-lie-u-cotton-inin-hinh-tho-dep-sz-10-23kg-p178827975.html?spid=178828021,37,,Đã bán 4,thoitrangmevabe
Đồ bơi bé gái dài tay dáng váy,185.000₫,https://tiki.vn/do-boi-be-gai-dai-tay-dang-vay-p207493431.html?spid=207493449,38,,Đã bán 6,thoitrangmevabe
"Áo khoác chống nắng GOKING, vải da cá dày 100% cotton thoáng mát, thấm hút mồ hôi, khử mùi, kháng khuẩn, chống tia UV dành cho nam nữ, trẻ em",290.000₫,https://tiki.vn/ao-khoac-chong-nang-goking-vai-da-ca-day-100-cotton-thoang-mat-tham-hut-mo-hoi-khu-mui-khang-khuan-chong-tia-uv-danh-cho-nam-nu-tre-em-p48586032.html?spid=48586070,39,,Đã bán 58,thoitrangmevabe
Bộ đồ áo thun và quần đùi bò cho bé gái từ 3 đến 14 tuổi,179.000₫,https://tiki.vn/bo-do-ao-thun-va-quan-dui-bo-cho-be-gai-tu-3-den-14-tuoi-p52142476.html?spid=52142478,40,,Đã bán 7,thoitrangmevabe
