title,price,link_item,index,discount,sales,category
ÁO CHỐNG NẮNG U NAM 2019,549.000₫,https://tiki.vn/ao-chong-nang-u-nam-2019-p89714507.html?spid=89714617,1,-11%,,aovest
Áo Khoác DirtyCoins Fur Collar Spray Paint Denim Jacket,799.000₫,https://tiki.vn/a-o-khoa-c-dirtycoins-fur-collar-spray-paint-denim-jacket-p271760909.html?spid=271760913,2,-50%,,aovest
Áo khoác thời trang nam Oneill Fifty Two - FA2110109-CRM,550.000₫,https://tiki.vn/ao-khoac-thoi-trang-nam-oneill-fifty-two-fa2110109-crm-p253063250.html?spid=253063264,3,-20%,,aovest
Áo bomber Jacket M nam nữ khoác ngoài from rộng dày dặn kiểu dáng thời trang hiện đại hottrend,148.000₫,https://tiki.vn/ao-bomber-jacket-m-nam-nu-khoac-ngoai-from-rong-day-dan-kieu-dang-thoi-trang-hien-dai-hottrend-p178504584.html?spid=178504590,4,-50%,,aovest
áo khoác Bomber,93.000₫,https://tiki.vn/a-o-khoa-c-bomber-p138563568.html?spid=156955380,5,-40%,Đã bán 37,aovest
"Áo Vest , Áo Vest Nam thời trang phong cách,chất vải dày mềm mịn,giá cả hợp lý,hàng thiết kế cao cấp H52",360.000₫,https://tiki.vn/ao-vest-ao-vest-nam-thoi-trang-phong-cach-chat-vai-day-mem-min-gia-ca-hop-ly-hang-thiet-ke-cao-cap-h52-p175904827.html?spid=175904841,6,-25%,Đã bán 2,aovest
COUPLE TX - Áo Khoác Nam Thun Gân Chéo MOK 1041,649.000₫,https://tiki.vn/couple-tx-ao-khoac-nam-thun-gan-cheo-mok-1041-p253198075.html?spid=253198087,7,,Đã bán 4,aovest
Bộ gió nam cao cấp,559.000₫,https://tiki.vn/bo-gio-nam-cao-cap-p201522795.html?spid=201523268,8,,Đã bán 1,aovest
[NEW] Timberland Áo Khoác Nam Packable Summer Benton TB0A6R9S - L,5.990.000₫,https://tiki.vn/new-timberland-ao-khoac-nam-packable-summer-benton-tb0a6r9s-p252949020.html?spid=252949026,9,,,aovest
áo khoác dù 2 lớp BB nam bigsize tới 130kg,350.000₫,https://tiki.vn/a-o-khoac-du-2-lo-p-bb-nam-bigsize-toi-130kg-p246851684.html?spid=246851690,10,,,aovest
"Áo phao nam, dáng dài, dày dặn, ôm sát, chất thoáng mát, phong cách Hàn Quốc, xu hướng thời trang, mẫu mới nhất NAP67",940.000₫,https://tiki.vn/ao-phao-nam-dang-dai-day-dan-om-sat-chat-thoang-mat-phong-cach-han-quoc-xu-huong-thoi-trang-mau-moi-nhat-nap67-p273363492.html?spid=273363494,11,,,aovest
"Áo vest nam, áo blazer nam 2 cúc Hàn Quốc màu đen thanh lịch LZB0053",374.000₫,https://tiki.vn/ao-vest-nam-ao-blazer-nam-2-cuc-han-quoc-mau-den-thanh-lich-lzb0053-p272918528.html?spid=272918538,12,,,aovest
Áo khoác phao nam có mũ đẹp thời trang hàn quốc 3 lớp vải dù cao cấp chống nước không bám bẩn giữ nhiệt mùa đông được nhập bởi công ty Xuân Anh,440.000₫,https://tiki.vn/ao-khoac-phao-nam-co-mu-thoi-trang-han-quoc-3-lop-vai-cao-cap-chong-nuoc-khong-bam-ban-giu-nhiet-mua-dong-duoc-nhap-boi-cong-ty-xuan-anh-p72861351.html?spid=94188892,13,,Đã bán 4,aovest
Áo cardigan nỉ khoác ngoài nam nữ thêu viền logo chú gấu cực xịn - Hàng chuẩn shop,99.000₫,https://tiki.vn/ao-cardigan-ni-khoac-ngoai-nam-nu-theu-vien-logo-chu-gau-cuc-xin-hang-chuan-shop-p176384855.html?spid=176384869,14,,,aovest
"Áo Gile nam, Áo Gile vạt chéo phối màu vàng chất vải tôn Form, không phai màu, không nhăn mã H54",275.000₫,https://tiki.vn/ao-gile-nam-ao-gile-vat-cheo-phoi-mau-vang-chat-vai-ton-form-khong-phai-mau-khong-nhan-ma-h54-p184070321.html?spid=184070331,15,,Đã bán 8,aovest
"Bộ vest nam 1 nút và gile ôm body màu đen chất liệu co dãn , thoáng mát tặng kèm combo phụ kiện",1.050.000₫,https://tiki.vn/bo-vest-nam-1-nut-va-gile-om-body-mau-xanh-den-chat-lieu-co-dan-thoang-mat-tang-kem-combo-phu-kien-p53284152.html?spid=53284160,16,,Đã bán 1,aovest
"Áo khoác nam, ôm sát, chất liệu bò, phong cách học sinh, phù hợp cho mùa xuân TA98",223.658₫,https://tiki.vn/ao-khoac-nam-om-sat-chat-lieu-bo-phong-cach-hoc-sinh-phu-hop-cho-mua-xuan-ta98-p52087908.html?spid=52087914,17,,Đã bán 1,aovest
Áo Vans Kelton Shacket VN0004512N1,1.800.000₫,https://tiki.vn/ao-vans-kelton-shacket-vn0004512n1-p262456401.html?spid=262456407,18,,,aovest
Áo Vans x ONE PIECE STATION JACKET VN00062QBLK,5.400.000₫,https://tiki.vn/ao-vans-x-one-piece-station-jacket-vn00062qblk-p203890322.html?spid=203890328,19,,,aovest
Áo Khoác Da Nam Đen Trơn Lót Dù CAO CẤP,390.000₫,https://tiki.vn/ao-khoac-da-nam-den-tron-lot-du-cao-cap-p117583159.html?spid=117583216,20,,,aovest
Áo chống nắng nam thông hơi cao cấp,90.000₫,https://tiki.vn/ao-chong-nang-nam-thong-hoi-cao-cap-p117580026.html?spid=117580080,21,,,aovest
Áo Khoác Bommber/ Áo Khoác Dù 7ZIA Ulzzang Nam Nữ Unisex Form Rộng Vải Mero 2 Lớp Ulzzang,97.000₫,https://tiki.vn/ao-khoac-bommber-ao-khoac-du-7zia-ulzzang-nam-nu-unisex-form-rong-vai-mero-2-lop-ulzzang-p198543791.html?spid=216097499,22,,,aovest
() Áo Khoác Bomber Nam Nữ - Áo Khoác Unisex Gấu Vải Nỉ Bông dày Siêu Hot - AZ.STORE,99.000₫,https://tiki.vn/ao-khoac-bomber-nam-nu-ao-khoac-unisex-gau-vai-ni-bong-day-sieu-hot-az-store-p112990846.html?spid=114700130,23,,Đã bán 19,aovest
Áo Khoác Bomber Nỉ Nam Nữ Phối Chữ R Tay Trắng Phong Cách Thời Trang Hàn Quốc,96.000₫,https://tiki.vn/ao-khoac-bomber-ni-nam-nu-phoi-chu-r-tay-trang-phong-cach-thoi-trang-han-quoc-p177995458.html?spid=177995488,24,,,aovest
Áo khoác dù nam chống thấm chuyển đổi thành balo,364.000₫,https://tiki.vn/ao-khoac-du-nam-chong-tham-chuyen-doi-thanh-balo-p83518505.html?spid=83519142,25,,Đã bán 2,aovest
"Áo khoác gió nam 2 lớp chống lạnh cực tốt, phong cách đơn giản ,lịch sự, túi có dây kéo và túi trong tiện ích",139.000₫,https://tiki.vn/ao-khoac-gio-nam-2-lop-chong-lanh-cuc-tot-phong-cach-don-gian-lich-su-tui-co-day-keo-va-tui-trong-tien-ich-p74349316.html?spid=74349332,26,,,aovest
Áo khoát dù nam nữ,115.000₫,https://tiki.vn/ao-khoat-du-nam-nu-p273057694.html?spid=273057706,27,,,aovest
Áo Kangol Unisex Jacket 6355142020,720.000₫,https://tiki.vn/ao-kangol-unisex-jacket-6355142020-p273261933.html?spid=273263979,28,,,aovest
Áo vest Nam Titishop VN300,1.312.000₫,https://tiki.vn/ao-vest-nam-titishop-vn300-p14872748.html?spid=14872756,29,,Đã bán 5,aovest
"AK012 Áo bomber R 2 màu xanh đen tay trắng unisex dáng rộng, áo khoác nam nữ mùa đông form to tay bo cúc bấm cá tính",125.000₫,https://tiki.vn/ak012-ao-bomber-r-2-mau-xanh-den-tay-trang-unisex-dang-rong-ao-khoac-nam-nu-mua-dong-form-to-tay-bo-cuc-bam-ca-tinh-p129768582.html?spid=129768597,30,,,aovest
ÁO KHOÁC KAKI NAM PHỐI CHỮ 4 MÀU,239.000₫,https://tiki.vn/ao-khoac-kaki-nam-phoi-chu-4-mau-p87411430.html?spid=87411433,31,,Đã bán 2,aovest
Áo khoác nam chất kaki 2 lớp xịn xò Julido Store mẫu mới theo xu hướng thời trang Trend MQ11,149.000₫,https://tiki.vn/ao-khoac-nam-chat-kaki-2-lop-xin-xo-julido-store-mau-moi-theo-xu-huong-thoi-trang-trend-mq11-p72309285.html?spid=72309291,32,,Đã bán 78,aovest
Áo khoác nỉ nam nữ,79.000₫,https://tiki.vn/ao-khoac-ni-nam-nu-p187841769.html?spid=187841801,33,,,aovest
"Áo khoác cardigan len nam cổ trụ kéo khóa 2 lớp trần bông ấm áp, thời trang thu đông 2022",250.000₫,https://tiki.vn/ao-khoac-cardigan-len-nam-co-tru-keo-khoa-2-lop-tran-bong-am-ap-lahstore-thoi-trang-thu-dong-2022-p199541710.html?spid=199541746,34,,Đã bán 1,aovest
ÁO KHOÁC UNISEX NAM NỮ IN CYM PHONG CÁCH TRẺ NĂNG ĐỘNG HOT CỦA NĂM,45.000₫,https://tiki.vn/ao-khoac-unisex-nam-nu-in-cym-phong-cach-tre-nang-dong-hot-cua-nam-p253219651.html?spid=253219653,35,,,aovest
"Áo khoác Blazer nam, Áo Vest Blazer Nam Phối màu Xanh Cô Ban phong cách Hot Trend trẻ trung. Mã N44",340.000₫,https://tiki.vn/ao-khoac-blazer-nam-ao-vest-blazer-nam-phoi-mau-xanh-co-ban-phong-cach-hot-trend-tre-trung-ma-n44-p184075392.html?spid=184075414,36,,Đã bán 1,aovest
Áo khoác dù unisex form rộng PIKa Chiến nam nữ phong cách ulzzang KUN,93.000₫,https://tiki.vn/ao-khoac-du-unisex-form-rong-pika-chien-nam-nu-phong-cach-ulzzang-kun-p137668375.html?spid=173443210,37,,Đã bán 2,aovest
"Vest nam Áo vest nam chất liệu Polyester ít nhăn ít nhàu kiểu dáng thể thao, trẻ trung năng động lịch lãm T19",355.000₫,https://tiki.vn/vest-nam-ao-vest-nam-chat-lieu-polyester-it-nhan-it-nhau-kieu-dang-the-thao-tre-trung-nang-dong-lich-lam-t19-p272190327.html?spid=272190337,38,,,aovest
Áo khoác dù nam nữ một sọc,105.000₫,https://tiki.vn/ao-khoac-du-nam-nu-mot-soc-p71940592.html?spid=73803360,39,,Đã bán 5,aovest
Áo hoodie form rộng phong cách Hàn Quốc năng động cho cặp đôi,112.000₫,https://tiki.vn/ao-hoodie-form-rong-phong-cach-han-quoc-nang-dong-cho-cap-doi-p87217546.html?spid=87217550,40,,,aovest
