title,price,link_item,index,discount,sales,category
"ÁO HÔM DOODIES LOANG NAM NỮ,MÀU SẮC ĐA DẠNG VÔ CÙNG XINH XẮN",120.000₫,https://tiki.vn/ao-hom-doodies-loang-nam-nu-mau-sac-da-dang-vo-cung-xinh-xan-p114318289.html?spid=114978800,1,-30%,,aohoodie
Áo Hoodie Local Brand SABAGE nỉ bông dày form rộng nam nữ Unisex (HD9200L - Full Box - Kèm Video Ảnh Thật),219.000₫,https://tiki.vn/ao-hoodie-local-brand-sabage-ni-bong-day-form-rong-nam-nu-unisex-hd9200l-full-box-kem-video-anh-that-p263312993.html?spid=263313068,2,-12%,,aohoodie
HÀNG MỚIBỘ NỈ BÔNG TÚI ZIP LOẠI 1,39.000₫,https://tiki.vn/hang-moi-bo-ni-bong-tui-zip-loai-1-p150715312.html?spid=150715348,3,-12%,,aohoodie
Bộ nỉ ALIGRO cổ tròn màu xanh rêu BN.12,595.000₫,https://tiki.vn/bo-ni-aligro-co-tron-mau-xanh-reu-bn-12-p213495247.html?spid=213495257,4,-19%,,aohoodie
ÁO HOODIE FORM RỘNG NAM NỮ SEKING,125.100₫,https://tiki.vn/ao-hoodie-form-rong-nam-nu-seking-p261901354.html?spid=261901358,5,,,aohoodie
"Áo Hoodie Nam Nữ LUFFY 3 Vải Nỉ Ngoại Dầy Nón 2 Lớp Tay Bo Gân, Anam Store",125.100₫,https://tiki.vn/ao-hoodie-nam-nu-luffy-3-vai-ni-ngoai-day-non-2-lop-tay-bo-gan-anam-store-p261901472.html?spid=261901480,6,,,aohoodie
ÁO HOODIE FORM RỘNG NAM NỮ JOKERR,125.100₫,https://tiki.vn/ao-hoodie-form-rong-nam-nu-jokerr-p261900711.html?spid=261900724,7,,,aohoodie
"Áo Hoodie Nam Nữ Nỉ Ngoại Nam Nữ anime dấu ấn Naruto, Áo khoác thu đông vải dày, Anam Store",125.100₫,https://tiki.vn/ao-hoodie-nam-nu-ni-ngoai-nam-nu-anime-dau-an-naruto-ao-khoac-thu-dong-vai-day-anam-store-p261900182.html?spid=261900228,8,,,aohoodie
"Áo Hoodie Nam Nữ LUFFY Vải Nỉ Ngoại Dầy Nón 2 Lớp Tay Bo Gân, Anam Store",125.100₫,https://tiki.vn/ao-hoodie-nam-nu-luffy-vai-ni-ngoai-day-non-2-lop-tay-bo-gan-anam-store-p261900336.html?spid=261900404,9,,,aohoodie
Áo Hoodie Nam Nữ HUNTER Form Rộng Unisex Vải Xịn,125.100₫,https://tiki.vn/ao-hoodie-nam-nu-hunter-form-rong-unisex-vai-xin-p261900453.html?spid=261900469,10,,,aohoodie
ÁO HOODIE FORM RỘNG NAM NỮ ANGEL 4,125.100₫,https://tiki.vn/ao-hoodie-form-rong-nam-nu-angel-4-p261900306.html?spid=261900315,11,,,aohoodie
"Áo Hoodie Nam Nữ NARUTO 2 Vải Nỉ Ngoại Dầy Nón 2 Lớp Tay Bo Gân, Anam Store",125.100₫,https://tiki.vn/ao-hoodie-nam-nu-naruto-2-vai-ni-ngoai-day-non-2-lop-tay-bo-gan-anam-store-p261900596.html?spid=261900624,12,,,aohoodie
"Áo Hoodie Đen Trắng Nam Nữ PHI HÀNH GIA cool , Vải Nỉ Ngoại Dầy Dặn",125.100₫,https://tiki.vn/ao-hoodie-den-trang-nam-nu-phi-hanh-gia-cool-vai-ni-ngoai-day-dan-p261900534.html?spid=261900555,13,,,aohoodie
"Áo Hoodie Đen Trắng Nam Nữ 7 Viên Ngọc Rồng , Vải Nỉ Ngoại Dầy Dặn",125.100₫,https://tiki.vn/ao-hoodie-den-trang-nam-nu-7-vien-ngoc-rong-vai-ni-ngoai-day-dan-p261900601.html?spid=261900625,14,,,aohoodie
Áo hoodie Nam Nữ Vải Nỉ Ngoại Dầy Dặn Phản Quang 7 màu King Anam Store,125.100₫,https://tiki.vn/ao-hoodie-nam-nu-vai-ni-ngoai-day-dan-phan-quang-7-mau-king-anam-store-p261900723.html?spid=261900746,15,,,aohoodie
"Áo hoodie nam nữ Mèo Và Chuột, vải nỉ ngoại dầy dặn, Anam Store",144.480₫,https://tiki.vn/ao-hoodie-nam-nu-meo-va-chuot-vai-ni-ngoai-day-dan-anam-store-p261900721.html?spid=261900756,16,,,aohoodie
"Áo hoodie Đen nam nữ Squid Game nhiều mẫu, Vải Nỉ Ngoại Dầy Dặn, Anam Store",116.100₫,https://tiki.vn/ao-hoodie-den-nam-nu-squid-game-nhieu-mau-vai-ni-ngoai-day-dan-anam-store-p261900750.html?spid=261900911,17,,,aohoodie
ÁO HOODIE FORM RỘNG NAM NỮ PRESSURE,125.100₫,https://tiki.vn/ao-hoodie-form-rong-nam-nu-pressure-p261900700.html?spid=261900714,18,,,aohoodie
Áo hoodie Nam Nữ Bò Sữa Form rộng,126.000₫,https://tiki.vn/ao-hoodie-nam-nu-bo-sua-form-rong-p261900773.html?spid=261900797,19,,,aohoodie
"Áo hoodie Trắng Squid game nhiều mẫu, Vải Nỉ Ngoại Dầy Dặn, Anam Store",128.459₫,https://tiki.vn/ao-hoodie-trang-squid-game-nhieu-mau-vai-ni-ngoai-day-dan-anam-store-p261900760.html?spid=261900845,20,,,aohoodie
"Áo Hoodie Nam Nữ, Trơn, Vải Nỉ Ngoại, Anam Store",104.000₫,https://tiki.vn/ao-hoodie-nam-nu-tron-vai-ni-ngoai-anam-store-p261900990.html?spid=261901040,21,,,aohoodie
Áo Hoodie nam nữ vải nỉ dầy Phản Quang Quỷ Oni 07 Anam Store,119.200₫,https://tiki.vn/ao-hoodie-nam-nu-vai-ni-day-phan-quang-quy-oni-07-anam-store-p261900962.html?spid=261900976,22,,,aohoodie
Áo hoodie Form Rộng Naruto Nam Nữ,112.000₫,https://tiki.vn/ao-hoodie-form-rong-naruto-nam-nu-p261901541.html?spid=261901547,23,,,aohoodie
ÁO HOODIE FORM RỘNG NAM NỮ YOUNG,125.100₫,https://tiki.vn/ao-hoodie-form-rong-nam-nu-young-p261901147.html?spid=261901158,24,,,aohoodie
Áo hoodie nam nữ phản quang Blackss,119.000₫,https://tiki.vn/ao-hoodie-nam-nu-phan-quang-blackss-p261901188.html?spid=261901216,25,,,aohoodie
Áo Hoodie Nam Nữ HIPHOP LEGENDS Form Rộng Unisex Vải Xịn,125.100₫,https://tiki.vn/ao-hoodie-nam-nu-hiphop-legends-form-rong-unisex-vai-xin-p261901264.html?spid=261901270,26,,,aohoodie
Áo Sweater - Nỉ Chui Trơn NHIỀU MÀU SẮC LỰA CHỌN,158.000₫,https://tiki.vn/ao-sweater-ni-chui-tron-nhieu-mau-sac-lua-chon-p160399195.html?spid=160399231,27,,,aohoodie
Áo Nỉ Chui Trơn Màu Trắng,210.000₫,https://tiki.vn/ao-ni-chui-tron-mau-trang-p160399902.html?spid=160399938,28,,,aohoodie
Áo khoác hoodie nam from rộng trend,199.000₫,https://tiki.vn/ao-khoac-hoodie-nam-from-rong-trend-p149118488.html?spid=197186772,29,,Đã bán 1,aohoodie
Áo bomber bóng chày chữ A nam nữ CoolZ brand Áo bomber nữ nỉ kiểu bóng chày thời trang Hàn Quốc,149.000₫,https://tiki.vn/ao-bomber-bong-chay-chu-a-nam-nu-coolz-brand-ao-bomber-nu-ni-kieu-bong-chay-thoi-trang-han-quoc-p162359083.html?spid=162359095,30,,,aohoodie
Áo Sweater Thỏ phong cách Ulzzang Hàn Quốc Áo thun dài tay phong cách cá tính CoolZ C009,59.000₫,https://tiki.vn/ao-sweater-tho-phong-cach-ulzzang-han-quoc-ao-thun-dai-tay-phong-cach-ca-tinh-coolz-c009-p162358550.html?spid=162358563,31,,,aohoodie
MẪU ÁO SWEATER POLO BA MÀU UNISEX NỈ HỌA TIẾT MỚI FORM RỘNG cổ bẻ cài cúc tay dài in chữ Brnad,77.500₫,https://tiki.vn/mau-ao-sweater-polo-ba-mau-unisex-ni-hoa-tiet-moi-form-rong-co-be-cai-cuc-tay-dai-in-chu-brnad-p262517023.html?spid=262517025,32,,,aohoodie
XẢ KHO ÁO Khoác in hình ANIME NARUTO AKATSUKI độc đẹp giá siêu rẻ,142.000₫,https://tiki.vn/xa-kho-ao-khoac-in-hinh-anime-naruto-akatsuki-doc-dep-gia-sieu-re-p263290846.html?spid=263290928,33,,,aohoodie
Áo nỉ mũ xanh EZL HS6,513.000₫,https://tiki.vn/ao-ni-mu-xanh-ezl-hs6-p158474066.html?spid=158474074,34,,,aohoodie
Hoodie zip cao cấp,350.000₫,https://tiki.vn/hoodie-zip-cao-cap-p151233562.html?spid=151233566,35,,,aohoodie
SWEATER NAM NỮ S6 - TRUST ME,295.000₫,https://tiki.vn/sweater-nam-nu-s6-trust-me-p102048617.html?spid=102048627,36,,,aohoodie
áo nỉ bông,480.000₫,https://tiki.vn/ao-ni-bong-p162977311.html?spid=162977317,37,,,aohoodie
Áo khoác nỉ ngoại họa tiết chữ A có nón phía sau cho nam nữ unisex || Hany Shop,238.000₫,https://tiki.vn/ao-khoac-ni-ngoai-hoa-tiet-chu-a-co-non-phia-sau-cho-nam-nu-unisex-hany-shop-p151489460.html?spid=151489492,38,,,aohoodie
ÁO KHOÁC HOODEI TRÒNG ĐẦU TECH NAM NỮ - Nỉ,280.000₫,https://tiki.vn/ao-khoac-hoodei-trong-dau-tech-nam-nu-ni-p174535648.html?spid=174535729,39,,,aohoodie
ÁO KHOÁC HOODEI GALAXY CHẤT NỈ COTTON DÀY DẶN,320.000₫,https://tiki.vn/ao-khoac-hoodei-galaxy-chat-ni-cotton-day-dan-p174535134.html?spid=174535152,40,,,aohoodie
