title,price,link_item,index,discount,sales,category
QUẦN LÓT ROSSO NAM DỆT KIM,110.000₫,https://tiki.vn/quan-lot-rosso-nam-det-kim-p59518446.html?spid=59518454,1,,Đã bán 220,dolotnam
"QUẦN LÓT NAM CAO CẤP, QUẦN SỊP NAM chất cotton thấm hút mồ hôi, khử mùi kháng khuẩn L-28990",69.000₫,https://tiki.vn/quan-lot-nam-cao-cap-quan-sip-nam-chat-cotton-tham-hut-mo-hoi-khu-mui-khang-khuan-l-28990-p52274294.html?spid=102550295,2,,Đã bán 24,dolotnam
Quần lót boxer nam thun lạnh thời trang QSHOP QX778,100.000₫,https://tiki.vn/quan-lot-boxer-nam-thun-lanh-thoi-trang-qshop-qx778-p271544219.html?spid=271544231,3,-10%,,dolotnam
"Quần lót nam boxer Sexy Vải Ren Manvenbeck MK068 Kháng Khuẩn Khử Mùi, Thoáng Mát",73.000₫,https://tiki.vn/quan-lot-nam-boxer-sexy-vai-ren-manvenbeck-mk068-khang-khuan-khu-mui-hang-chinh-hang-manvenbeck-p270704134.html?spid=270704166,4,,,dolotnam
,,https://tiki.vn/quan-lot-nam-sieu-sexy-brave-person-b1159-thiet-ke-doc-dao-ca-tinh-mau-sac-da-dang-phu-hop-xu-huong-thoi-trang-p84284210.html?spid=84284226,5,-42%,,dolotnam
Combo 3 Quần Lót Boxer Nam Freeman 6517-CB3 (Size,213.300₫,https://tiki.vn/combo-3-quan-lot-boxer-nam-freeman-6517-cb3-p3715005.html?spid=3791663,6,,Đã bán 79,dolotnam
Quần lót nam đùi chật su cao cấp mát lạnh siêu mỏng,132.000₫,https://tiki.vn/quan-lot-nam-dui-chat-su-cao-cap-mat-lanh-sieu-mong-p273128370.html?spid=273128382,7,,,dolotnam
Quần lót nam quyến rũ lưới,65.000₫,https://tiki.vn/quan-lot-nam-quyen-ru-luoi-p199940178.html?spid=199940182,8,,,dolotnam
"Quần Lót Nam Boxers Thương Hiệu Brave Person B1176 - Thiết kế cá tính, form dáng tinh tế, hợp thời trang, chất vải siêu mát mẻ, thoáng và thấm hút mồ hôi tốt, 3 màu cho bạn thoải mái lựa chọn",136.000,https://tiki.vn/quan-lot-nam-boxers-thuong-hieu-brave-person-b1176-thiet-ke-ca-tinh-form-dang-tinh-te-hop-thoi-trang-chat-vai-sieu-mat-me-thoang-va-tham-hut-mo-hoi-tot-3-mau-cho-ban-thoai-mai-lua-chon-p94351100.html?spid=94351114,9,-41%,,dolotnam
,,https://tiki.vn/quan-boxer-quan-sip-dui-in-hinh-3d-thun-lanh-men-05-le-1-san-pham-p128934216.html?spid=128934252,10,-39%,,dolotnam
Quần lót nam boxer hoạt hình CITYMEN cao cấp vải thun lạnh 4 chiều sịp đùi nam,28.000₫,https://tiki.vn/quan-lot-nam-boxer-hoat-hinh-citymen-cao-cap-vai-thun-lanh-4-chieu-sip-dui-nam-p204419863.html?spid=204419881,11,-46%,Đã bán 49,dolotnam
"Quần Lót Tam Giác Nam Không Viền, Không Đường May N431 - Chất Liệu Thoáng Mát, From Dáng Sexy Phong Cách Cho Nam Giới",83.000₫,https://tiki.vn/quan-sip-nam-tam-giac-quan-lot-nam-khong-duong-may-n431-p208603419.html?spid=208603434,12,-45%,Đã bán 1,dolotnam
,,https://tiki.vn/combo-3-chiec-quan-lot-nam-thoi-trang-aristino-abf16-06-p14997350.html?spid=14997354,13,-13%,,dolotnam
Quần Lót Nam cao cấp Boxer thun lạnh SH - Quần Sịp Nam boxer thun lạnh Cotton Mềm Mịn Co Giãn 4 Chiều SD06 - PROMAN,25.000₫,https://tiki.vn/quan-lot-nam-cao-cap-boxer-thun-lanh-sh-quan-sip-nam-boxer-thun-lanh-cotton-mem-min-co-gian-4-chieu-sd06-proman-p214162845.html?spid=214162877,14,,,dolotnam
Set 10 Quần lót nam đai in chữ Danjoo,150.000₫,https://tiki.vn/set-10-quan-lot-nam-dai-in-chu-danjoo-mau-ngau-nhien-p15622238.html?spid=269900437,15,-45%,,dolotnam
"combo 3 quần lót nam dệt kim cao cấp relaxstore, quần boxer dệt nam",60.000₫,https://tiki.vn/combo-3-quan-lot-nam-det-kim-cao-cap-relaxstore-quan-boxer-det-nam-p200676284.html?spid=200676285,16,,Đã bán 1,dolotnam
Quần Lót Nam - Quần Độn Mông và Độn Trước - DẠNG TAM GIÁC,159.000,https://tiki.vn/quan-lot-nam-quan-don-mong-va-don-truoc-dang-tam-giac-p151802747.html?spid=151802783,17,,,dolotnam
,,https://tiki.vn/combo-3-qua-n-lo-t-nam-tam-gia-c-bamboo-organic-me-m-mi-n-thoa-ng-ma-t-mrm-manlywear-ma-u-nga-u-nhien-p34148045.html?spid=34148061,18,,,dolotnam
"Quần Boxers Nam Brave Person B1005 - Thiết Kế Phối Hợp Màu Mang Đến Sự Trẻ Trung, Năng Động - Chất Liệu Cao Cấp Co Dãn 4 Chiều Siêu Thoáng Mát",119.000₫,https://tiki.vn/quan-boxers-nam-brave-person-b1005-thiet-ke-phoi-hop-mau-mang-den-su-tre-trung-nang-dong-chat-lieu-cao-cap-co-dan-4-chieu-sieu-thoang-mat-p84401235.html?spid=84401588,19,,Đã bán 1,dolotnam
Quần lót nam dệt ONOFF mềm mại và đàn hồi cao - A27BU2109047,169.000₫,https://tiki.vn/quan-lot-nam-det-onoff-mem-mai-va-dan-hoi-cao-a27bu2109047-p161702480.html?spid=161702817,20,,Đã bán 38,dolotnam
Quần Lót Cotton Siêu Mỏng Thiết Kế Quyến Rũ Cho Nam,49.000₫,https://tiki.vn/quan-lot-cotton-sieu-mong-thiet-ke-quyen-ru-cho-nam-p210145761.html?spid=210145765,21,,Đã bán 2,dolotnam
Sịp đùi nam cạp SH chất liệu thun lạnh co giãn 4 chiều,23.000₫,https://tiki.vn/sip-dui-nam-cap-sh-chat-lieu-thun-lanh-co-gian-4-chieu-p271848996.html?spid=271849022,22,,,dolotnam
"Combo 5 Quần Lót Nam nhiều lưng co giãn 2 chiều vải cotton hiệu CITYMEN, màu ngẫu nhiên, đồ lót - LMTK-MULTI2C",49.000₫,https://tiki.vn/combo-5-quan-lot-nam-cao-cap-quan-xi-nam-quan-sip-nam-nhieu-lung-vai-cotton-2-chieu-hieu-cm-lung-lon-cap-to-kieu-brief-tam-giac-truyen-thong-do-lot-nam-p73742258.html?spid=73742260,23,,Đã bán 810,dolotnam
Quần lót boxer nam thun lưới thoáng mát - A037,85.000₫,https://tiki.vn/quan-lot-boxer-nam-thun-luoi-thoang-mat-a037-p87053075.html?spid=87053079,24,,Đã bán 45,dolotnam
Quần lót Nam thoáng mát mẫu mới - QL05A,95.000₫,https://tiki.vn/quan-lot-nam-thoang-mat-mau-moi-ql05a-p47101189.html?spid=137854330,25,,,dolotnam
,,https://tiki.vn/quan-lot-nam-lot-khe-sexy-p162210555.html?spid=162210561,26,,,dolotnam
Quần lót nam Tam giác chất thun mềm LADOS - 4113,21.000₫,https://tiki.vn/quan-lot-nam-tam-giac-chat-thun-mem-lados-4113-p134490721.html?spid=134490766,27,,Đã bán 268,dolotnam
Bộ 4 Quần Sịp Đùi Xuất Nhật Chất Lụa Cao Cấp (Giao màu ngẫu nhiên),90.000₫,https://tiki.vn/bo-4-quan-sip-dui-xuat-nhat-chat-lua-cao-cap-giao-mau-ngau-nhien-p7178021.html?spid=7178033,28,,Đã bán 306,dolotnam
Quần lót nam thun Brief iBasic PANM090,69.000₫,https://tiki.vn/quan-lot-nam-thun-brief-ibasic-panm090-p195962125.html?spid=208905867,29,,Đã bán 10,dolotnam
Quần Lót Nam Thun Lạnh - Q006,99.000₫,https://tiki.vn/quan-lot-nam-thun-lanh-p22559187.html?spid=75345646,30,,,dolotnam
,,https://tiki.vn/quan-lot-nam-dang-luoi-goi-cam-chu-t-mau-den-p68962426.html?spid=68962428,31,,,dolotnam
Quần lót nam lọt khe gợi cảm thoải mái,65.000₫,https://tiki.vn/quan-lot-nam-lot-khe-goi-cam-thoai-mai-p201429759.html?spid=201429765,32,,,dolotnam
Quần lót nam dạng lưới trong suốt gợi cảm - Màu tím,45.000₫,https://tiki.vn/quan-lot-nam-dang-luoi-trong-suot-goi-cam-mau-tim-p25965097.html?spid=25965098,33,,Đã bán 30,dolotnam
Combo 10 Quần Sịp Nam Tam Giác Thông Hơi Xuất Nhật Cao Cấp,145.000₫,https://tiki.vn/combo-10-quan-sip-nam-tam-giac-thong-hoi-xuat-nhat-cao-cap-p57083703.html?spid=87094280,34,,Đã bán 4,dolotnam
Quần lót lưới nam sexy hở mông HP04 - 1 cái màu đỏ,45.000₫,https://tiki.vn/quan-lot-luoi-nam-sexy-ho-mong-hp04-1-cai-mau-do-p42227940.html?spid=48088340,35,,,dolotnam
,,https://tiki.vn/quan-lot-nam-brief-rltk057-quan-sip-nam-thoang-mat-mem-mai-cao-cap-co-gian-tot-om-gon-relax-p184899796.html?spid=184899854,36,,,dolotnam
QUẦN LÓT NAM - Dạng Dây Nâng Mông - JOCKSTRAP,49.000₫,https://tiki.vn/quan-lot-nam-dang-day-nang-mong-jockstrap-p151802223.html?spid=151802498,37,,Đã bán 33,dolotnam
"(Che tên SP) Quần lót nam, sịp Lọt Khe thun Cotton TOBA Boutique, co giãn kháng khuẩn thoáng mát TBTGT04",65.000₫,https://tiki.vn/che-ten-sp-quan-lot-nam-sip-lot-khe-thun-cotton-co-gian-khang-khuan-thoang-mat-toba-tgt04-p270449618.html?spid=270449626,38,,,dolotnam
Quần Lót Nam B1124 - Chất Liệu Spandex Cao Cấp Co Giãn 4 Chiều Thoáng Mát Thoáng Khí Thoải Mái Vận Động,104.000₫,https://tiki.vn/quan-lot-nam-briefs-cao-cap-b1124-p208196719.html?spid=208196721,39,,Đã bán 6,dolotnam
"Quần Lót Nam, Quần Sịp Nam Dạng Đùi Boxer Pink Hero Original 1982 - Hàng Nhập Khẩu",64.000₫,https://tiki.vn/quan-lot-nam-quan-sip-nam-dang-dui-boxer-pink-hero-original-1982-hang-nhap-khau-p262821677.html?spid=262821685,40,,Đã bán 6,dolotnam
