title,price,link_item,index,discount,sales,brand
"Quần Âu Nam ALIGRO Ghi Sáng, chuẩn form slimfit vải cotton cao cấp, tôn dáng, thoáng mát ALGO1026",690.000₫,https://tiki.vn/quan-au-nam-aligro-algo1026-p90744552.html?spid=90744560,1,,,Aligro
ÁO PHÔNG CỘC TAY CÓ CỔ ALIGRO DÁNG SLIM MÃ APLOUA004,400.400₫,https://tiki.vn/ao-phong-coc-tay-co-co-aligro-dang-slim-ma-aploua004-p63427437.html?spid=63427443,2,,,Aligro
Áo sơ mi trắng dài tay Slimfit mã ALGS180,607.200₫,https://tiki.vn/ao-so-mi-dai-tay-nam-aligro-algs180-p52886908.html?spid=52886914,3,-10%,,Aligro
Áo sơ mi cộc tay nam công sở Aligro hoạ tiết con cua dáng Custom ALGS-C86 ( SIZE M),511.500,https://tiki.vn/ao-so-mi-coc-tay-nam-aligro-algs-c86m-size-m-p52719806.html?spid=52719807,4,-40%,,Aligro
,,https://tiki.vn/ao-so-mi-dai-tay-nam-aligro-algs187-p52894082.html?spid=52894090,5,,,Aligro
Áo Sơ Mi Cộc Tay Nam Aligro ALGS-C63-L,565.000₫,https://tiki.vn/ao-so-mi-coc-tay-nam-aligro-algs-c63-p23075775.html?spid=23075781,6,,,Aligro
Áo phông cổ tim ALIGRO ALGAPC061,215.600₫,https://tiki.vn/ao-phong-co-tim-aligro-algapc061-p66107603.html?spid=66107605,7,,,Aligro
"Quần Âu Nam Aligro Màu grey chất liệu cao Cấp, chuẩn Form Slimfit, Tôn Dáng màu grey ALGO1034",690.000₫,https://tiki.vn/quan-au-aligro-algo1034-mau-grey-p63852488.html?spid=63852498,8,,Đã bán 3,Aligro
Áo phông cổ tim ALIGRO ALGAPC060,269.500,https://tiki.vn/ao-phong-co-tim-aligro-algapc060-p66107428.html?spid=66107432,9,,,Aligro
,,https://tiki.vn/ao-phong-nam-co-tron-aligro-algapc050-p66090251.html?spid=66090255,10,,,Aligro
"Quần âu nam ALIGRO màu navy chấm trắng form chuẩn slimfit, vải cotton cao cấp cực tôn dáng, lịch sự ALGO1028",690.000₫,https://tiki.vn/quan-tay-nam-aligro-algo1028-p56959947.html?spid=56959951,11,,Đã bán 1,Aligro
Quần short nam ALIGRO chất liệu kaki dáng basic trẻ trung năng động ALGQS1082,374.000,https://tiki.vn/quan-shorts-nam-aligro-algqs1082-p56955659.html?spid=56955667,12,,,Aligro
,,https://tiki.vn/ao-so-mi-nam-ngan-tay-aligro-algs-c72-p23074033.html?spid=23074035,13,,,Aligro
Quần shorts nam Aligro màu be sáng ALGQS1077,455.000₫,https://tiki.vn/quan-shorts-nam-aligro-algqs1077-p56954299.html?spid=56954308,14,,,Aligro
Quần short nam ALIGRO chất liệu kaki dáng basic trẻ trung năng động ALGQS1081,374.000₫,https://tiki.vn/quan-shorts-nam-aligro-algqs1081-p56955449.html?spid=56955461,15,,Đã bán 3,Aligro
Áo sơ mi cộc tay nam Aligro ALGS-C87,465.000₫,https://tiki.vn/ao-so-mi-coc-tay-nam-aligro-algs-c87-p52870648.html?spid=52870650,16,,,Aligro
"Quần âu nam ALIGRO màu navy kẻ vuông to chất liệu cao cấp, chuẩn form, tôn dáng ALGO1031",690.000,https://tiki.vn/quan-au-aligro-algo1031-mau-navy-p63848456.html?spid=63848462,17,,,Aligro
,,https://tiki.vn/ao-so-mi-coc-tay-nam-aligro-algs-c93-p52881525.html?spid=52881529,18,,,Aligro
Quần short nam ALGQS1070,396.000₫,https://tiki.vn/quan-short-nam-algqs1070-p63834909.html?spid=63834917,19,,,Aligro
ÁO SƠ MI NAM TRẮNG DÀI TAY ALIGRO MÃ ALGS196,607.200₫,https://tiki.vn/ao-so-mi-nam-trang-dai-tay-aligro-ma-algs196-p90022177.html?spid=90022181,20,,,Aligro
Áo sơ mi nam kẻ cộc tay Custom Fit mã ALGS-C82,565.000₫,https://tiki.vn/ao-so-mi-nam-ke-coc-tay-custom-fit-ma-algs-c82-p95276095.html?spid=95276103,21,,,Aligro
Áo sơ mi nam dài tay ALIGRO cổ bẻ dáng ôm body 100% chất cotton navy vân ô ALGS223,545.000₫,https://tiki.vn/ao-so-mi-slimfit-dai-tay-navy-van-o-aligro-algs223-p191410957.html?spid=191410967,22,,,Aligro
"Áo Thun Nam Dài Tay Aligro Chất Liệu Cotton Cao Cấp, Siêu Mềm Mại, Dày Dặn, Cực Dễ Chịu, Thấm Hút Tốt ALGAPD055",425.000₫,https://tiki.vn/ao-thun-nam-dai-tay-aligro-chat-lieu-cotton-cao-cap-sieu-mem-mai-day-dan-cuc-de-chiu-tham-hut-tot-algapd055-p201594583.html?spid=201594593,23,,,Aligro
Áo sơ mi slimfit dài tay navy Aligro ALGS226,545.000₫,https://tiki.vn/ao-so-mi-slimfit-dai-tay-navy-aligro-algs226-p191412413.html?spid=191412419,24,,Đã bán 1,Aligro
"Áo sơ mi nam ngắn tay ALIGRO kẻ caro sợi tre bamboo mềm mại, hạn chế nhăn nhàu form slim vừa sang trọng ALGS-C117",535.000,https://tiki.vn/ao-so-mi-coc-tay-ke-caro-xanh-navy-aligro-algs-c117-p198261486.html?spid=198261490,25,,,Aligro
,,https://tiki.vn/quan-short-mogway-mau-navy-qsmog-10-p198261985.html?spid=198261997,26,,,Aligro
Quần short mogway màu đen kẻ nhỏ QSMOG.12,790.000₫,https://tiki.vn/quan-short-mogway-mau-den-ke-nho-qsmog-12-p198261580.html?spid=198261621,27,,,Aligro
"Quần kaki nam, quần thô dáng SlimFit, chất liệu vải kaki cao cấp bền đẹp, thiết kế cạp đính đỉa, ống đứng ALIGRO ALGK060",552.000₫,https://tiki.vn/quan-kaki-nam-quan-tho-dang-slimfit-chat-lieu-vai-kaki-cao-cap-ben-dep-thiet-ke-cap-dinh-dia-ong-dung-aligro-algk060-p198261944.html?spid=198261956,28,,,Aligro
Quần short mogway màu xanh QSMOG.22,790.000₫,https://tiki.vn/quan-short-mogway-qsmog-22-p198261954.html?spid=198261987,29,,,Aligro
Áo sơ mi nam dài tay ALIGRO 100% chất bamboo phẩy xanh cổ bẻ dáng ôm body ALGS218,476.000,https://tiki.vn/ao-so-mi-dai-tay-bamboo-phay-xanh-aligro-algs218-p198261893.html?spid=198261910,30,,,Aligro
,,https://tiki.vn/ao-polo-nam-ngan-tay-ke-ngang-ghi-trang-algplo89-p270801692.html?spid=270801696,31,,,Aligro
"Quần short golf nam ALIGRO nhiều màu chất vải co giãn chống nhăn cực tốt, thoáng khí, thấm hút tốt QSMOG.10",632.000₫,https://tiki.vn/quan-short-golf-nam-aligro-nhieu-mau-chat-vai-co-gian-chong-nhan-cuc-tot-thoang-khi-tham-hut-tot-qsmog-10-p253787922.html?spid=253787932,32,,,Aligro
Bộ nỉ nam dài tay ALIGRO cổ tròn chất liệu nỉ 100% cotton màu ghi nhạt ALGBN.14,850.000₫,https://tiki.vn/bo-ni-nam-dai-tay-aligro-co-tron-chat-lieu-ni-100-cotton-mau-ghi-nhat-algbn-14-p261984732.html?spid=261984745,33,,,Aligro
Áo thun nam ALIGRO chất liệu cotton cổ tròn kiểu dáng thể thao thấm hút tốt co giãn thoải mái ALGAPC072,280.000₫,https://tiki.vn/ao-thun-nam-aligro-chat-lieu-cotton-co-tron-kieu-dang-the-thao-tham-hut-tot-co-gian-thoai-mai-algapc072-p253357576.html?spid=253357578,34,,,Aligro
Áo Polo nam ngắn tay kẻ ngang xanh dương-navy ALGPLO86,472.500,https://tiki.vn/ao-polo-nam-ngan-tay-ke-ngang-xanh-duong-navy-algplo86-p270802003.html?spid=270802005,35,,,Aligro
,,https://tiki.vn/quan-short-golf-nam-aligro-nhieu-mau-chat-vai-co-gian-chong-nhan-cuc-tot-thoang-khi-tham-hut-tot-qsmog-8-p253865947.html?spid=253865951,36,,,Aligro
"Quần short golf nam ALIGRO nhiều màu chất vải co giãn chống nhăn cực tốt, thoáng khí, thấm hút tốt QSMOG.13",612.000₫,https://tiki.vn/quan-short-golf-nam-aligro-nhieu-mau-chat-vai-co-gian-chong-nhan-cuc-tot-thoang-khi-tham-hut-tot-qsmog-13-p253838401.html?spid=253838409,37,,,Aligro
Áo Polo nam ngắn tay phối 2 màu sợi ghi-đen ALGPLO93,472.500₫,https://tiki.vn/ao-polo-nam-ngan-tay-phoi-2-mau-soi-ghi-den-algplo93-p270801559.html?spid=270801563,38,,,Aligro
ÁO POLO NAM CỔ DỆT MÀU HỒNG TƯƠI ALGPLO41,299.000₫,https://tiki.vn/ao-polo-nam-co-det-mau-hong-tuoi-algplo41-p87531995.html?spid=87532014,39,,,Aligro
Quần short nam ALIGRO chất liệu kaki dáng bassic trẻ trung năng động ALGQS1071,347.600,https://tiki.vn/quan-shorts-nam-aligro-algqs1071-p56953923.html?spid=56953925,40,,,Aligro
