title,price,link_item,index,discount,sales,category
"Quần Short Nam Mặc Ngủ, Quần Thun Nam Mặc Nhà Brave Person B1164 - Form dáng trẻ trung, năng động, nam tính - Chất liệu thoáng mát, co dãn 4 chiều",115.000₫,https://tiki.vn/quan-short-nam-mac-ngu-quan-thun-nam-mac-nha-brave-person-b1164-form-dang-tre-trung-nang-dong-nam-tinh-chat-lieu-thoang-mat-co-dan-4-chieu-p98675410.html?spid=98675416,1,-54%,Đã bán 57,quannam
"Quần tây Amazing, form công sở truyền thống, ống đứng, không ly, màu xám chuột có vân chìm",245.000₫,https://tiki.vn/quan-tay-amazing-form-cong-so-truyen-thong-ong-dung-khong-ly-mau-xam-chuot-co-van-chim-p205299837.html?spid=205299881,2,-42%,Đã bán 5,quannam
"Quần jogger unisex thể thao, quần ống rộng kiểu dáng jogger mặc nhà nam nữ vải TỔ ONG 3 màu năng động",80.000₫,https://tiki.vn/quan-jogger-unisex-the-thao-quan-ong-rong-kieu-dang-jogger-mac-nha-nam-nu-vai-to-ong-3-mau-nang-dong-p141259191.html?spid=141259199,3,-30%,Đã bán 66,quannam
Bộ 5 Chiếc Quần Đùi Nam Mắc Nhà Phối Sọc,96.000₫,https://tiki.vn/bo-5-chiec-quan-dui-nam-mac-nha-phoi-soc-p19242497.html?spid=84307218,4,,,quannam
,,https://tiki.vn/quan-kaki-nam-kieu-dang-han-quoc-ong-con-phong-cach-the-thao-ket-hop-giay-sneaker-cuc-dep-p105735946.html?spid=133898929,5,,,quannam
Quần Jean nam Leman xanh wash bụi JD11 - Slim Form,384.000₫,https://tiki.vn/quan-jean-nam-leman-xanh-wash-bui-jd11-slim-form-p194284327.html?spid=194284355,6,-32%,Đã bán 27,quannam
Quần Âu Nam Hàn Quốc Màu Đen Mẫu Mới 2022,115.000₫,https://tiki.vn/quan-au-nam-han-quoc-mau-den-mau-moi-nhat-kem-bang-size-p183691492.html?spid=190316992,7,,Đã bán 97,quannam
Quần đùi nam mặc nhà vải cotton mát form rộng rãi in hình cây dừa size dưới 75kg,25.000₫,https://tiki.vn/quan-dui-nam-mac-nha-vai-cotton-mat-form-rong-rai-in-hinh-cay-dua-size-duoi-75kg-p83394132.html?spid=105394323,8,-5%,Đã bán 16,quannam
"Quần Jogger kaki nam Amazing, dáng thể thao năng động, vải co giãn nhẹ, màu sắc trung tính, lai bo",239.000,https://tiki.vn/quan-jogger-kaki-nam-amazing-dang-the-thao-nang-dong-vai-co-gian-nhe-mau-sac-trung-tinh-lai-bo-p208410791.html?spid=208410861,9,-39%,Đã bán 4,quannam
,,https://tiki.vn/quan-short-jeans-nam-cao-cap-lados-4033-vai-day-dep-khong-bay-mau-nang-dong-de-phoi-do-p185524989.html?spid=249575484,10,-24%,,quannam
"Amazing, quần Jogger kaki nam, phong cách thể thao khỏe khoắn, chất liệu nhập khẩu, co giãn nhẹ",239.000₫,https://tiki.vn/amazing-quan-jogger-kaki-nam-phong-cach-the-thao-khoe-khoan-chat-lieu-nhap-khau-co-gian-nhe-p208432186.html?spid=208432250,11,-62%,Đã bán 4,quannam
QUẦN SHORT NGỦ 100% COTTON THOÁNG MÁT QS181,100.000,https://tiki.vn/quan-short-ngu-100-cotton-thoang-mat-qs181-p87480507.html?spid=87481297,12,-35%,,quannam
,,https://tiki.vn/quan-jeans-nam-co-dan-quan-bo-nam-kieu-tron-va-xuoc-thiet-ke-tre-trung-don-dieu-pha-cach-gom-5-kich-thuoc-28-32-julido-mau-qjn099703-mau-xanh-phoi-bac-p53515490.html?spid=53515498,13,,,quannam
"Keo dán gắn kính ô tô bị vỡ phục hồi như mới chuyên dụng loại tốt, phụ kiện xe hơi",129.200₫,https://tiki.vn/keo-dan-gan-kinh-o-to-bi-vo-phuc-hoi-nhu-moi-chuyen-dung-loai-tot-phu-kien-xe-hoi-p176451795.html?spid=176451796,14,,Đã bán 4,quannam
Quần Sọt Kaki Nam Túi Hộp Phối Họa Tiết Lính,188.000₫,https://tiki.vn/quan-sot-kaki-nam-tui-hop-phoi-hoa-tiet-linh-p82643340.html?spid=82644374,15,-61%,Đã bán 15,quannam
"Quần đùi mặc nhà lưng thun, đi ngủ hay ra biển, dáng boxer, có 2 túi, unisex, nhiều hoạ tiết vui mắt",79.000₫,https://tiki.vn/quan-dui-mac-nha-lung-thun-di-ngu-hay-ra-bien-dang-boxer-co-2-tui-unisex-nhieu-hoa-tiet-vui-mat-p273011120.html?spid=273011132,16,-32%,Đã bán 4,quannam
Quần Đùi Đũi Nam SZone SQ501B,89.000₫,https://tiki.vn/quan-dui-dui-nam-szone-sq501b-p55238819.html?spid=55238835,17,-59%,,quannam
,,https://tiki.vn/quan-jean-nam-xanh-dam-s20-p9354828.html?spid=28738873,18,,,quannam
Quần nỉ nam trung niên trung tuổi PISHOPquần ngủ nam trung tuổi thu đông,58.800₫,https://tiki.vn/quan-ni-nam-trung-nien-trung-tuoi-pishop-quan-ngu-nam-trung-tuoi-thu-dong-p148605580.html?spid=148605618,19,,Đã bán 42,quannam
Quần đũi nam sọc ngang phong cách SQ502,98.000₫,https://tiki.vn/quan-dui-nam-soc-ngang-phong-cach-sq502-p25196817.html?spid=269958334,20,,Đã bán 2,quannam
Quần dài kaki nam túi hộp,210.000₫,https://tiki.vn/quan-dai-kaki-nam-tui-hop-p174004141.html?spid=174004161,21,,Đã bán 4,quannam
"Quần dài nam, Quần chiến thuật lính cao cấp ARM-1217",550.000₫,https://tiki.vn/quan-dai-nam-quan-chien-thuat-linh-cao-cap-arm-1217-p197970542.html?spid=197970634,22,,Đã bán 4,quannam
Quần Dài Kaki Nam Slim Tapered Giordano 01122002,679.000₫,https://tiki.vn/quan-dai-kaki-nam-slim-tapered-giordano-01122002-p194124865.html?spid=194124905,23,,Đã bán 9,quannam
Quần jean không co giãn Q63 MuiDoi,159.000₫,https://tiki.vn/quan-jean-khong-co-gian-q63-muidoi-p28298338.html?spid=28298792,24,,Đã bán 29,quannam
"Quần jogger kaki nam dáng thể thao cao cấp, quần jogger nam kaki thời trang chất vải dày dặn, ống bo chun thời trang",82.000₫,https://tiki.vn/quan-jogger-kaki-nam-dang-the-thao-cao-cap-quan-jogger-nam-kaki-thoi-trang-chat-vai-day-dan-ong-bo-chun-thoi-trang-p73668044.html?spid=111083442,25,,Đã bán 3,quannam
,,https://tiki.vn/quan-short-jean-nam-xanh-den-q413-muidoi-p22595534.html?spid=22595538,26,,,quannam
Quần short jean Q393 MuiDoi,114.000₫,https://tiki.vn/quan-short-jean-q393-muidoi-p31264440.html?spid=31264480,27,,Đã bán 45,quannam
Quần Kaki Nam Khatoco Q2M528S0-CNMA003-2006-0- Nâu,199.000₫,https://tiki.vn/quan-kaki-nam-khatoco-q2m528s0-cnma003-2006-nau-p20518713.html?spid=20518782,28,,Đã bán 21,quannam
"Quần tây âu nam dài vải cao cấp co giãn LADOS - 4091 kiểu dáng basic, Hàn Quốc, lịch lãm, trẻ trung",259.000₫,https://tiki.vn/quan-tay-au-nam-dai-vai-cao-cap-co-gian-lados-4091-kieu-dang-basic-han-quoc-lich-lam-tre-trung-p249482866.html?spid=249482896,29,,Đã bán 14,quannam
Quần Short Nam Khatoco Q3M378R0-CNMK005-2103-021,149.000,https://tiki.vn/quan-short-nam-khatoco-q3m378r0-cnmk005-2103-021-den-p20518136.html?spid=20518145,30,,,quannam
,,https://tiki.vn/quan-kaki-nam-khatoco-ma-q2m528r1-inma001-p54761961.html?spid=54761967,31,,,quannam
Quần Short Nam Khatoco Q3M378R0-CNMA003-2009-009,149.000₫,https://tiki.vn/quan-short-nam-khatoco-q3m378r0-cnma003-2009-009-nau-dom-p20526933.html?spid=20527013,32,,Đã bán 130,quannam
Quần Jean Nam- co giãn-CAO CẤP-thời tran Phong Cách Hàn Quốc -00-J4B,115.000₫,https://tiki.vn/quan-jean-nam-co-gian-cao-cap-thoi-tran-phong-cach-han-quoc-00-j4b-p50723696.html?spid=56387249,33,,Đã bán 290,quannam
Quần kaki nam sống suông thời trang VICERO,239.000₫,https://tiki.vn/quan-kaki-nam-song-suong-thoi-trang-vicero-p11345710.html?spid=11345748,34,,Đã bán 612,quannam
Combo 5 Quần Đùi Nam Mặc Nhà Vải Cotton Thông Thoáng - giao màu ngẫu nhiên,96.000₫,https://tiki.vn/combo-5-quan-dui-nam-mac-nha-vai-cotton-thong-thoang-giao-mau-ngau-nhien-p70327515.html?spid=269844909,35,,Đã bán 5,quannam
,,https://tiki.vn/quan-dai-nam-the-thao-goking-lung-thun-va-day-rut-co-gian-thoai-mai-hang-hieu-cao-cap-xuat-khau-p54446837.html?spid=54446853,36,,,quannam
Quần khaki nam không ply ống ôm xanh dương pha tím nhạt Khatoco Q2M528S0-CNMA006-2006-0,528.000₫,https://tiki.vn/quan-khaki-nam-khong-ply-ong-om-xanh-duong-pha-tim-nhat-khatoco-q2m528s0-cnma006-2006-0-p76166657.html?spid=76166663,37,,Đã bán 68,quannam
Quần kaki nam 1 ply ống đứng Khatoco Q2M468R1-VNMA013-1908-1,468.000₫,https://tiki.vn/quan-kaki-nam-khatoco-1-ply-ong-dung-q2m468r1-vnma013-1908-1-p30763822.html?spid=30763828,38,,Đã bán 40,quannam
Quần Short Nam Khatoco Q3M318R0-VNMA030-2009-018,129.000₫,https://tiki.vn/quan-short-nam-khatoco-q3m318r0-vnma030-2009-018-nau-p20527249.html?spid=20527289,39,,Đã bán 258,quannam
"Quần jean nam đen trơn chất bò mỏng nhẹ ống côn cao cấp, phù hợp mùa hè, alex cool",129.000,https://tiki.vn/quan-jean-nam-den-tron-chat-bo-mong-nhe-ong-con-cao-cap-phu-hop-mua-he-alex-cool-p82518270.html?spid=101256787,40,,,quannam
