title,price,link_item,index,discount,sales,category
Áo Thun Gia Đình Có Cổ Màu Đen,75.000₫,https://tiki.vn/ao-thun-gia-dinh-co-co-mau-den-p207330065.html?spid=207330087,1,,,dodoi
Đồ đôi đi biển dành cho gia đình quần sọc đa sắc áo in họa tiết Happy Holidays xinh xắn (giá 1 bộ gồm 1quần+1 áo),119.000₫,https://tiki.vn/do-doi-di-bien-danh-cho-gia-dinh-quan-soc-da-sac-ao-in-hoa-tiet-happy-holidays-xinh-xan-gia-1-bo-gom-1quan-1-ao-p248272512.html?spid=248274773,2,,,dodoi
"ÁO THUN ĐỒNG PHỤC ĐI BIỂN NHÓM, CTY, TEAMBUIDING, GIA ĐÌNH",48.000₫,https://tiki.vn/ao-thun-dong-phuc-di-bien-nhom-cty-teambuiding-gia-dinh-p248270538.html?spid=248270679,3,,,dodoi
Áo Thun Đồng Phục Sẵn Hàng - Đen - Xám Tro - Trắng,90.000₫,https://tiki.vn/ao-thun-dong-phuc-san-hang-den-xam-tro-trang-p195236501.html?spid=195236570,4,,,dodoi
,,https://tiki.vn/do-gia-dinh-xinh-xan-di-choi-noel-dep-khoi-che-gia-1-bo-gom-1-quan-1-ao-p248269569.html?spid=248269946,5,,,dodoi
Áo Thun Gia Đình 3 Người Có Cổ Màu Đỏ In Logo Trái Tim Ngộ Nghĩnh .Chất Liệu Poly Thái 4 Chiều Đủ Size Từ 8 Đến 100kg,80.000₫,https://tiki.vn/ao-thun-gia-dinh-3-nguoi-co-co-mau-do-in-logo-trai-tim-ngo-nghinh-chat-lieu-poly-thai-4-chieu-du-size-tu-8-den-100kg-p207329297.html?spid=207329548,6,,,dodoi
Áo Polo Đồng Phục . Áo Thun Cá Sấu,85.000₫,https://tiki.vn/ao-polo-dong-phuc-ao-thun-ca-sau-p207328593.html?spid=207328692,7,,,dodoi
Áo Phông Gia Đình Logo Nhí Chữ CHESS đơn giản,26.100₫,https://tiki.vn/ao-phong-gia-dinh-logo-nhi-chu-chess-don-gian-p202486936.html?spid=202487206,8,,,dodoi
"Đồ nhóm , áo đi biển , đồng phục gia đình .Chất liệu thun cotton loại 1 đủ size từ 8 đến 100kg",39.000₫,https://tiki.vn/do-nhom-ao-di-bien-dong-phuc-gia-dinh-chat-lieu-thun-cotton-loai-1-du-size-tu-8-den-100kg-p207327972.html?spid=207327978,9,,,dodoi
,,https://tiki.vn/do-gia-dinh-so-cute-in-hoa-tiet-xinh-xan-de-thuong-gia-1-bo-gom-1-quan-1-ao-p248270844.html?spid=248273138,10,,,dodoi
Áo thun gia đình in họa tiết xinh xắn chất thun đẹp ( giá 1 áo),65.000₫,https://tiki.vn/ao-thun-gia-dinh-in-hoa-tiet-xinh-xan-chat-thun-dep-gia-1-ao-p248271033.html?spid=248273288,11,,,dodoi
Đồ đôi đi biển cho gia đình xinh xắn- HÀNG LOẠI 1 (giá 1 bộ luôn quần và áo),99.000₫,https://tiki.vn/do-doi-di-bien-cho-gia-dinh-xinh-xan-hang-loai-1-gia-1-bo-luon-quan-va-ao-p248273123.html?spid=248274993,12,,,dodoi
,,https://tiki.vn/do-doi-di-bien-xinh-xan-cho-gia-dinh-chat-vai-dep-hang-loai-1-gia-1-bo-luon-quan-va-ao-p248271912.html?spid=248274211,13,,,dodoi
Áo Gia Đình . Đồ Gia Đình . Đồng Phục Gia Đình,85.000₫,https://tiki.vn/ao-gia-dinh-do-gia-dinh-dong-phuc-gia-dinh-p207326010.html?spid=207326072,14,,Đã bán 10,dodoi
"Áo gia đình , Đồ đi biển . Chất liệu vải Cotton loại 1 thoáng mát đủ size từ 8 đến 100kg",39.000₫,https://tiki.vn/ao-gia-dinh-do-di-bien-chat-lieu-vai-cotton-loai-1-thoang-mat-du-size-tu-8-den-100kg-p207329404.html?spid=207329583,15,,Đã bán 5,dodoi
Áo gia đình Tết .Đồ đôi,39.000₫,https://tiki.vn/ao-gia-dinh-tet-do-doi-p207327224.html?spid=207327280,16,,,dodoi
"Áo Thun Gia Đình Nhiều Màu, Áo Phông Trơn Nam Nữ Đi Chơi Nhóm",60.000₫,https://tiki.vn/ao-thun-gia-dinh-nhieu-mau-ao-phong-tron-nam-nu-di-choi-nhom-p207268938.html?spid=207269153,17,,,dodoi
,,https://tiki.vn/do-doi-di-bien-da-ngoai-xinh-lung-linh-danh-cho-gia-dinh-gia-1bo-luon-quan-va-ao-mau-y-hinh-p248272215.html?spid=248274205,18,,,dodoi
"Đồ đôi đi biển, dã ngoại cho cặp đội, gia đinh chất vải đẹp- HÀNG LOẠI 1",109.000₫,https://tiki.vn/do-doi-di-bien-da-ngoai-cho-cap-doi-gia-dinh-chat-vai-dep-hang-loai-1-p248272552.html?spid=248274905,19,,,dodoi
"Áo gia đình có cổ 4 màu : Trắng , Vàng , Đỏ , Cam .Chất liệu poly thái co giản 4 chiều đủ size từ 8 đến 100kg",80.000₫,https://tiki.vn/ao-gia-dinh-co-co-4-mau-trang-vang-do-cam-chat-lieu-poly-thai-co-gian-4-chieu-du-size-tu-8-den-100kg-p207329602.html?spid=207329709,20,,Đã bán 5,dodoi
"[MUA 1 TẶNG 1] ÁO COUPLE THỂ THAO NAM NỮ VNANAVP05 VINA AUTHENTIC CO GIẢN, MỀM MẠI, THẤM HÚT MỒ HÔI, HỢP THỜI TRANG, CHUẨN THƯƠNG HIỆU",379.000₫,https://tiki.vn/mua-1-tang-1-ao-couple-the-thao-nam-nu-vnanavp05-vina-authentic-co-gian-mem-mai-tham-hut-mo-hoi-hop-thoi-trang-chuan-thuong-hieu-p154245287.html?spid=154245291,21,,,dodoi
"ÁO SƠ MI ĐŨI CĂP ĐÔI SIÊU NGẦU,THIẾT KẾ HỌA TIẾT HOA HỢP THỜI TRANG,CHẤT LIỆU VÃI THOÁNG MÁT THỜI TRANG KING STORE",149.000₫,https://tiki.vn/ao-so-mi-dui-cap-doi-sieu-ngau-thiet-ke-hoa-tiet-hoa-hop-thoi-trang-chat-lieu-vai-thoang-mat-thoi-trang-king-store-p109407033.html?spid=109407098,22,,,dodoi
QUẦN ÁO TẾT GIA ĐÌNH (Giá 1 bộ luôn quần và áo),119.000₫,https://tiki.vn/quan-ao-tet-gia-dinh-gia-1-bo-luon-quan-va-ao-p248270659.html?spid=248272505,23,,,dodoi
Bộ Áo Thun Đôi Nam Nữ Màu Vàng A353,159.000₫,https://tiki.vn/bo-ao-thun-doi-nam-nu-mau-vang-a353-p12264712.html?spid=12264740,24,,,dodoi
Bộ Áo Thun Đôi Nam Nữ Màu Vàng A355 - XL,159.000,https://tiki.vn/bo-ao-thun-doi-nam-nu-mau-vang-a355-p12264858.html?spid=12264906,25,,,dodoi
,,https://tiki.vn/bo-ao-thun-doi-nam-nu-mau-vang-a330-p12263319.html?spid=12263381,26,,,dodoi
Bộ Áo Thun Đôi Nam Nữ Màu Vàng A328,159.000₫,https://tiki.vn/bo-ao-thun-doi-nam-nu-mau-vang-a328-p12263173.html?spid=12263181,27,,,dodoi
Bộ Áo Thun Đôi Nam Nữ Màu Vàng A386,159.000₫,https://tiki.vn/bo-ao-thun-doi-nam-nu-mau-vang-a386-p12267128.html?spid=12267180,28,,,dodoi
Bộ Áo Thun Đôi Nam Nữ Màu Vàng A345 - XL,159.000₫,https://tiki.vn/bo-ao-thun-doi-nam-nu-mau-vang-a345-p12264124.html?spid=12264172,29,,,dodoi
Bộ Áo Thun Đôi Nam Nữ Màu Vàng A300 - XL,159.000,https://tiki.vn/bo-ao-thun-doi-nam-nu-mau-vang-a300-p12261114.html?spid=12261160,30,,,dodoi
,,https://tiki.vn/bo-ao-thun-doi-nam-nu-mau-vang-a329-p12263246.html?spid=12263280,31,,,dodoi
Bộ Áo Thun Đôi Nam Nữ Màu Vàng A393,159.000₫,https://tiki.vn/bo-ao-thun-doi-nam-nu-mau-vang-a393-p12267639.html?spid=12267661,32,,,dodoi
Bộ Áo Thun Đôi Nam Nữ Màu Vàng A387,159.000₫,https://tiki.vn/bo-ao-thun-doi-nam-nu-mau-vang-a387-p12267201.html?spid=12267221,33,,,dodoi
Bộ Áo Thun Đôi Nam Nữ Màu Vàng A396,159.000₫,https://tiki.vn/bo-ao-thun-doi-nam-nu-mau-vang-a396-p12267858.html?spid=12267880,34,,,dodoi
Áo gia đình đẹp cotton dày dặn mềm mát đủ size 5-110kg - GĐ001,80.000₫,https://tiki.vn/ao-gia-dinh-dep-cotton-day-dan-mem-mat-du-size-5-110kg-gd001-p12342277.html?spid=12342327,35,,,dodoi
,,https://tiki.vn/ao-gia-dinh-dep-cotton-day-dan-mem-mat-du-size-5-110kg-gd009-p12344058.html?spid=12344106,36,,,dodoi
Bộ Áo Thun Đôi Nam Nữ Màu Vàng A11209,159.000₫,https://tiki.vn/bo-ao-thun-doi-nam-nu-mau-vang-a11209-p12462407.html?spid=168989683,37,,,dodoi
Bộ Áo Thun Đôi Nam Nữ Màu Vàng A11214,159.000₫,https://tiki.vn/bo-ao-thun-doi-nam-nu-mau-vang-a11214-p12462777.html?spid=12462819,38,,,dodoi
Bộ Áo Thun Đôi Nam Nữ Màu Vàng A11203,159.000₫,https://tiki.vn/bo-ao-thun-doi-nam-nu-mau-vang-a11203-p12461954.html?spid=12462020,39,,,dodoi
Bộ Áo Thun Đôi Nam Nữ Màu Vàng A11234 - L,159.000,https://tiki.vn/bo-ao-thun-doi-nam-nu-mau-vang-a11234-p12464333.html?spid=12464363,40,,,dodoi
