title,price,link_item,index,discount,sales
Bộ Nước Hoa Nữ Latino N31-N32-N33-N34-N35-N36 (20ml x 6),225.000₫,https://tiki.vn/bo-nuoc-hoa-nu-latino-n31-n32-n33-n34-n35-n36-20ml-x-6-p9021801.html?spid=9021802,1,-40%,Đã bán 9
Combo Nước Hoa Nữ You&Me N11 & N12 (55ml x 2),260.000₫,https://tiki.vn/combo-nuoc-hoa-nu-you-me-n11-n12-55ml-x-2-p9021924.html?spid=9021925,2,,
Nước Hoa Nữ Jeanne Arthes Paris Sultane Noir Velours EDP (100ml),595.000₫,https://tiki.vn/nuoc-hoa-nu-jeanne-arthes-paris-sultane-noir-velours-edp-100ml-p3560417.html?spid=5948203,3,-22%,Đã bán 49
"Nước hoa nữ F-TWO Perfume 10ML, hương gỗ | EVOR",239.000₫,https://tiki.vn/nuoc-hoa-nu-f-two-perfume-10ml-huong-go-evor-p263495078.html?spid=263495079,4,,
,,https://tiki.vn/nuoc-hoa-vung-kin-danh-cho-nu-honey-valley-eau-de-parum-chai-cham-10ml-chai-lan-5ml-loli-the-wolf-p56064154.html?spid=75557942,5,-20%,
"Nước hoa vùng kín nữ Cuddle Blossom LOLI & THE WOLF chai chấm 10ml, Tặng Kèm Mút Rửa Mặt",240.000₫,https://tiki.vn/nuoc-hoa-vung-kin-nu-cuddle-blossom-loli-the-wolf-chai-cham-10ml-tang-kem-mut-rua-mat-p79115906.html?spid=79115907,6,-20%,
Nước hoa Nam OHI-GIO 50ml,600.000₫,https://tiki.vn/nuoc-hoa-nam-ohi-gio-50ml-p198865306.html?spid=20494693,7,,
Nước hoa Pháp dành cho nữ hương thơm đặc biệt dịu ngọt Mademoiselle - Inessance Paris 50ml,249.000₫,https://tiki.vn/nuo-c-hoa-nu-mademoiselle-inessance-50ml-p16375116.html?spid=16375117,8,-27%,Đã bán 4
Nước hoa Nam Dream Love Joy Eau De Parfum for Men 12ml (dạng lăn) Hani Peni,190.000₫,https://tiki.vn/nuoc-hoa-nam-joy-12ml-dang-lan-eau-de-parfum-for-men-roll-p52788349.html?spid=52788352,9,,Đã bán 6
,,https://tiki.vn/nuo-c-hoa-nu-lilly-garden-inessance-50ml-p16375112.html?spid=16375113,10,,
NƯỚC HOA NAM CHARME KING 60ML HƯƠNG THƠM QUYẾN RU,390.000₫,https://tiki.vn/nuo-c-hoa-nam-charme-king-60ml-huong-thom-quye-n-ru-p174551246.html?spid=174551247,11,,Đã bán 1
"Nước Hoa Nữ Adopt' Yummy Candy 30ML Mùi Hương Ngọt Ngào Tươi Mới, Tặng Kèm Băng Đô Thời Trang",429.000₫,https://tiki.vn/nuoc-hoa-nu-adopt-yummy-candy-30ml-mui-huong-ngot-ngao-tuoi-moi-tang-kem-bang-do-thoi-trang-p179949953.html?spid=179949955,12,,
,,https://tiki.vn/nuoc-hoa-nu-adopt-the-blanc-30ml-huong-hoa-tuoi-mat-thanh-lich-tang-kem-bang-do-thoi-trang-p179750155.html?spid=179750156,13,,
"BST Nước Hoa Nữ Adopt' My Lady - Hương thơm quyến rũ bậc nhất của mọi quý cô, Tặng Khăn Ủ Tóc Cực Xinh",1.190.000₫,https://tiki.vn/bst-nuoc-hoa-nu-adopt-my-lady-tang-khan-u-toc-cuc-xinh-p179952634.html?spid=179952635,14,,
"Nước Hoa Nữ Adopt' Lady Glitter 30ML Hương Thơm Mê Hoặc Quyến Rũ, Tặng Kèm Băng Đô Thời Trang",399.000₫,https://tiki.vn/nuoc-hoa-nu-adopt-lady-glitter-30ml-huong-thom-me-hoac-quyen-ru-tang-kem-bang-do-thoi-trang-p179751619.html?spid=179751620,15,,
Nước hoa Nam LONDON hương thơm sang trọng gợi cảm – BEBECO London Deep Eau De Perfume Homme,559.000₫,https://tiki.vn/nuoc-hoa-nam-london-huong-thom-sang-trong-goi-cam-bebeco-london-deep-eau-de-perfume-homme-p209305528.html?spid=209305529,16,,
"Nước hoa nữ Dream Love Euphoria Eau De Parfum for woman (hương hoa cỏ Phương Đông, lưu hương 7 - 12 giờ) Hani Peni",190.000₫,https://tiki.vn/nuoc-hoa-nu-dream-love-euphoria-eau-de-parfum-50ml-huong-hoa-co-phuong-dong-luu-huong-7-12-gio-hani-peni-p199593338.html?spid=199593340,17,,
,,https://tiki.vn/vial-mau-thu-nuoc-hoa-hugo-boss-bottled-1-2ml-p273330691.html?spid=273330692,18,,
NƯỚC HOA NỮ OHI-BOMSHELL 50ML,600.000₫,https://tiki.vn/nuoc-hoa-nu-ohi-bomshell-50ml-p50508847.html?spid=50508848,19,,Đã bán 1
NƯỚC HOA NAM OHI 50ML( HƯƠNG GỖ THƠM LÂU MANG ĐẾN SỰ TỰ TIN ),600.000₫,https://tiki.vn/nuoc-hoa-nam-ohi-50ml-huong-go-thom-lau-mang-den-su-tu-tin-p72820370.html?spid=72820371,20,,Đã bán 4
Nước hoa nữ 50ml,600.000₫,https://tiki.vn/nuoc-hoa-nu-50ml-p23512103.html?spid=23512104,21,,Đã bán 4
Nước Hoa Spring M. Tha Von 30 ml,857.000₫,https://tiki.vn/nuoc-hoa-nu-spring-m-tha-von-p13352800.html?spid=13352801,22,,Đã bán 2
Nước Hoa Nữ Rav W. Tha Von,503.000₫,https://tiki.vn/nuoc-hoa-nu-rav-w-tha-von-p13352794.html?spid=13352795,23,,
Nước Hoa Nam A Polo Sp. Tha Von,372.000₫,https://tiki.vn/nuoc-hoa-nam-a-polo-sp-tha-von-15-ml-p13352727.html?spid=13352728,24,,
Tinh dầu nước hoa OHI B.FLY,550.000₫,https://tiki.vn/tinh-dau-nuoc-hoa-ohi-b-fly-p198859040.html?spid=20494741,25,,Đã bán 2
,,https://tiki.vn/nuoc-hoa-nu-ohi-guty-20ml-p20494720.html?spid=20494721,26,,
Nước hoa nữ OHI-BRIGTH TAL 20ml,290.000₫,https://tiki.vn/nuoc-hoa-nu-ohi-brigth-tal-20ml-p20494726.html?spid=20494727,27,,
Nước hoa nữ OHI-YELLOW 50ml,600.000₫,https://tiki.vn/nuoc-hoa-nu-ohi-yellow-50ml-p20494700.html?spid=20494701,28,,
Nước Hoa Nữ Charme Vanitas 30ml,370.000₫,https://tiki.vn/nuoc-hoa-nu-charme-vanitas-30ml-p22333550.html?spid=139987844,29,,
"Nước hoa Nữ Dream Love MC Girl Eau De Parfum for Women (hương hoa cỏ phương Đông, lưu hương 7 - 12 giờ) Hani Peni",190.000₫,https://tiki.vn/nuoc-hoa-nu-dream-love-mc-girl-eau-de-parfum-for-women-huong-hoa-co-phuong-dong-luu-huong-7-12-gio-hani-peni-p199607526.html?spid=199607528,30,,Đã bán 5
,,https://tiki.vn/nuoc-hoa-bo-tui-dear-body-15ml-sieu-tien-loi-gon-nhe-de-su-dung-phu-hop-hoc-sinh-sinh-vien-viet-nam-p249384009.html?spid=249384019,31,,
Nước Hoa Charme SEXY MEN 100ml,399.000₫,https://tiki.vn/nuoc-hoa-charme-nam-sexy-men-100ml-p169385754.html?spid=169385755,32,,Đã bán 1
Vial mẫu thử nước hoa Burberry Hero EDT 1.5ml,32.000₫,https://tiki.vn/vial-mau-thu-nuoc-hoa-burberry-hero-edt-1-5ml-p273329901.html?spid=273329902,33,,
Nước Hoa Mini Warm & Pleasant Perfume 30ml,92.800₫,https://tiki.vn/nuoc-hoa-mini-warm-pleasant-perfume-30ml-p207925650.html?spid=207925651,34,,
Nước Hoa Mini Rocking Fantasy Perfume 30ml For Men,92.800₫,https://tiki.vn/nuoc-hoa-mini-rocking-fantasy-perfume-30ml-for-men-p207924258.html?spid=207924259,35,,Đã bán 2
,,https://tiki.vn/nuoc-hoa-mini-summer-freshes-perfume-30ml-p207924399.html?spid=207924400,36,,
[HOT SALES] Nước Hoa Nam Ohi - Sang Chảnh - Phong Cách Thể Hiện Sự Lịch Lãm Và Mãnh Mẽ Của Đàn Ông,600.000₫,https://tiki.vn/hot-sales-nuoc-hoa-nam-ohi-50ml-mui-huong-doc-dao-phong-cach-the-hien-su-manh-me-cua-dan-ong-p128912840.html?spid=128912841,37,,
Nước Hoa Nữ DSQUARED2 RED WOOD 100ml,1.650.000₫,https://tiki.vn/nuoc-hoa-nu-dsquared2-red-wood-100ml-p75831135.html?spid=75831136,38,,Đã bán 2
Nước hoa charme Giò 80ml Sang trong lịch lãm,404.000₫,https://tiki.vn/nuoc-hoa-charme-80ml-p153075927.html?spid=169385817,39,,Đã bán 2
Vial mẫu thử nước hoa YSL Libre 1.2ml,42.000₫,https://tiki.vn/vial-mau-thu-nuoc-hoa-ysl-libre-1-2ml-p273318153.html?spid=273318154,40,,
