title,price,link_item,index,discount,sales,category
Đồ đôi đi biển cho gia đình- giá 1 bộ luôn quần và áo,94.700₫,https://tiki.vn/do-doi-di-bien-cho-gia-dinh-gia-1-bo-luon-quan-va-ao-p169568012.html?spid=169568361,1,,Đã bán 7,doboi
ĐỒ ĐÔI ĐI BIỂN- Giá 1 bộ luôn quần và áo,136.800₫,https://tiki.vn/do-doi-di-bien-gia-1-bo-luon-quan-va-ao-p169569745.html?spid=169570268,2,-48%,,doboi
"Quần đùi 2 lớp đi bơi đi biển, quần tập gym Minatex",129.000₫,https://tiki.vn/quan-dui-2-lop-di-boi-di-bien-quan-tap-gym-minatex-p172670344.html?spid=172670744,3,,Đã bán 13,doboi
Quần đi biển nam Oneill Heat Fade 19'' Boardshort - 2800093-19010,799.000,https://tiki.vn/quan-di-bien-nam-oneill-heat-fade-19-boardshort-2800093-19010-p249156224.html?spid=249156228,4,-10%,,doboi
,,https://tiki.vn/do-boi-cap-nang-dong-tay-dai-che-nang-bien-xanh-ati72-mayblue-couple-swimsuit-long-sleeves-upf50-sun-protection-do-boi-nam-nu-p72625960.html?spid=72625972,5,-10%,,doboi
Quần bơi nam Lan Hạnh 50123-DE0102,238.000₫,https://tiki.vn/quan-boi-nam-lan-hanh-50123-de0102-p68629983.html?spid=68629985,6,,Đã bán 4,doboi
Quần bơi tam giác nam cao cấp QSHOP QT437,190.000₫,https://tiki.vn/quan-boi-tam-giac-nam-cao-cap-qshop-qt437-p163136092.html?spid=163136100,7,-45%,Đã bán 4,doboi
Cây lộn vải loại nhỏ cán màu đen,7.000₫,https://tiki.vn/cay-lon-vai-loai-nho-can-mau-den-p149453358.html?spid=149453361,8,-30%,Đã bán 2,doboi
Quần bơi tam giác nam hỡ sườn có móc khóa QSHOP QT513,190.000,https://tiki.vn/quan-boi-tam-giac-nam-ho-suon-co-moc-khoa-qshop-qt513-p272382919.html?spid=272382933,9,,,doboi
,,https://tiki.vn/quan-boi-tam-giac-nam-don-gian-cao-cap-qshop-qt488-p247892448.html?spid=247892458,10,,,doboi
"Quần Bơi Nam S3937 - Thiết Kế Kèm Miếng Độn Giúp Tự Tin Nổi Bật, Chất Liệu Thoáng Khí Thoải Mái Vận Động",210.000₫,https://tiki.vn/quan-boi-nam-cao-cap-thiet-ke-day-rut-s3937-p208622916.html?spid=208622920,11,,Đã bán 1,doboi
"Quần bơi nam Speedo Sport 2 Panel 16"" - 8-1353515590",802.000,https://tiki.vn/quan-boi-nam-speedo-sport-2-panel-16-8-1353515590-p271094406.html?spid=271094420,12,,,doboi
,,https://tiki.vn/do-boi-nam-nu-doi-dep-p198112625.html?spid=198112641,13,,,doboi
Bộ đồ đi biển nhóm gia đình cặp đôi gồm áo thun và quần hoạ tiết nổi bật độc đáo DDB111 | DONGPHUCSG,99.000₫,https://tiki.vn/do-di-bien-nam-nu-cao-cap-ao-quan-du-size-ddb111-p132131209.html?spid=132131615,14,,,doboi
Quần Short Nam Đi Bơi Đi Biển Thoáng Khí Mềm Mịn Nhẹ Nhàng,261.000₫,https://tiki.vn/quan-short-nam-di-boi-di-bien-thoang-khi-mem-min-nhe-nhang-p272372337.html?spid=272372339,15,,,doboi
Quần Short Nam Đi Bơi Đi Biển Thoáng Khí Nhanh Khô Mềm Mịn Nhẹ Nhàng,261.000₫,https://tiki.vn/quan-short-nam-di-boi-di-bien-thoang-khi-nhanh-kho-mem-min-nhe-nhang-p272394420.html?spid=272394433,16,,,doboi
"Quần bơi nam Speedo Hyperboosplice 16"" - 8-00236415570",697.000,https://tiki.vn/quan-boi-nam-speedo-hyperboosplice-16-8-00236415570-p271094220.html?spid=271094232,17,,,doboi
,,https://tiki.vn/quan-boi-nam-boxer-lung-form-dai-giua-dui-do-boi-nam-cao-cap-tre-trung-phoi-mau-dep-qbl00110-p213541798.html?spid=262732629,18,,,doboi
Quần bơi Nam BIKINI PASSPORT kiểu dáng Dài- màu Xanh Indigo - BS179_IN,270.000₫,https://tiki.vn/quan-boi-nam-bikini-passport-kieu-dang-dai-mau-xanh-indigo-bs179_in-p202347524.html?spid=239634623,19,,Đã bán 2,doboi
Đồ đi biển xinh xắn- giá 1 bộ luôn quần và áo,136.800₫,https://tiki.vn/do-di-bien-xinh-xan-gia-1-bo-luon-quan-va-ao-p169568874.html?spid=169569367,20,,,doboi
Đồ đôi đi biển mẫu mới xinh xắn- giá 1 bộ luôn quần và áo,126.300₫,https://tiki.vn/do-doi-di-bien-mau-moi-xinh-xan-gia-1-bo-luon-quan-va-ao-p169568907.html?spid=169569477,21,,,doboi
Bộ đồ đi biển cho gia đình cặp đôi hội nhóm gồm áo và quần hoạ tiết nổi bật DDB131 | DONGPHUCSG,99.000₫,https://tiki.vn/ao-quan-di-bien-doc-dao-an-tuong-du-size-ao-quan-cao-cap-ddb131-p132127801.html?spid=132127914,22,,Đã bán 1,doboi
Đồ bơi nam tay dài quần lửng chống nắng cao cấp BN19,110.000₫,https://tiki.vn/do-boi-nam-tay-dai-quan-lung-chong-nang-cao-cap-bn19-p235877573.html?spid=235877603,23,,Đã bán 3,doboi
Quần Đi Bơi Nam Thời Trang 410,259.000₫,https://tiki.vn/quan-di-boi-nam-thoi-trang-410-p54781910.html?spid=54782552,24,,Đã bán 23,doboi
"Quần bơi nam đẹp phối nhiều màu sắc, trẻ trung và độc đáo",120.000,https://tiki.vn/quan-boi-nam-dep-phoi-nhieu-mau-sac-tre-trung-va-doc-dao-p58300224.html?spid=262732779,25,,,doboi
,,https://tiki.vn/do-boi-nam-tay-dai-day-keo-ca-tinh-18-20-p52702515.html?spid=52702521,26,,,doboi
Quần bơi nam Lan Hạnh 50123-DE0103,238.000₫,https://tiki.vn/quan-boi-nam-lan-hanh-50123-de0103-p68630251.html?spid=68630255,27,,Đã bán 10,doboi
Áo bơi Nam Tay Dài 70073,325.000₫,https://tiki.vn/ao-boi-nam-tay-dai-70073-p272201348.html?spid=272201360,28,,,doboi
Quần short đi biển form ngắn màu trơn QSHOP QS24,250.000₫,https://tiki.vn/quan-short-di-bien-form-ngan-mau-tron-qshop-qs24-p273212500.html?spid=273212508,29,,,doboi
Quần bơi nam boxer sọc ngựa vằn QSHOP QT484,190.000,https://tiki.vn/quan-boi-nam-boxer-soc-ngua-van-qshop-qt484-p249513743.html?spid=249513749,30,,,doboi
,,https://tiki.vn/quan-boi-tam-giac-nam-thoi-trang-qshop-qt521-p272415808.html?spid=272415822,31,,,doboi
Quần bơi tam giác nam đơn giản QSHOP QT507,170.000₫,https://tiki.vn/quan-boi-tam-giac-nam-don-gian-qshop-qt507-p271335884.html?spid=271335888,32,,,doboi
"Quần bơi nam Speedo Sport Solid 16"" - 8-1144414433",662.000₫,https://tiki.vn/quan-boi-nam-speedo-sport-solid-16-8-1144414433-p271095290.html?spid=271095298,33,,,doboi
Quần bơi lửng nam nhiều màu form chuẩn,69.000₫,https://tiki.vn/quan-boi-lung-nam-nhieu-mau-form-chuan-p158758456.html?spid=158758529,34,,,doboi
THỜI TRANG BIỂN CAO CẤP- giá 1 bộ luôn quần và áo,126.300,https://tiki.vn/thoi-trang-bien-cao-cap-gia-1-bo-luon-quan-va-ao-p169567461.html?spid=169567707,35,,,doboi
,,https://tiki.vn/quan-boi-nam-speedo-hyperboosplice-16-8-00236415569-p271093442.html?spid=271093452,36,,,doboi
"Bộ đồ bơi nam ngắn tay + quần boxer 2 lớp, họa tiết mạnh mẽ, set quần áo đi biển, đi bơi cho nam giới, chất thun bơi dày dặn mịn mát đẹp | BN031",450.000₫,https://tiki.vn/bo-do-boi-nam-ngan-tay-quan-boxer-2-lop-hoa-tiet-manh-me-set-quan-ao-di-bien-di-boi-cho-nam-gioi-chat-thun-boi-day-dan-min-mat-dep-bn031-p270474726.html?spid=270502574,37,,Đã bán 1,doboi
"Áo bơi nam dài tay & ngắn tay rời, hoạ tiết da cá nam tính, phom ôm gọn gàng, thun bơi lạnh dày mịn thoáng mát, áo bơi nam lẻ | BN028",220.000₫,https://tiki.vn/ao-boi-nam-dai-tay-ngan-tay-roi-hoa-tiet-da-ca-nam-tinh-phom-om-gon-gang-thun-boi-lanh-day-min-thoang-mat-ao-boi-nam-le-bn028-p252160562.html?spid=270467909,38,,,doboi
Quần bơi nam Lan Hạnh 50123-DE0104,238.000₫,https://tiki.vn/quan-boi-nam-lan-hanh-50123-de0104-p68642102.html?spid=68642104,39,,Đã bán 5,doboi
Quần Bơi Nam 50021,298.000,https://tiki.vn/quan-boi-nam-50021-p272225587.html?spid=272225591,40,,,doboi
