title,price,link_item,index,discount,sales,brand
Bộ thể thao nam Fasvin AT22504.HN cổ tròn chất vải mềm nhẹ co giãn thoải mái,185.000₫,https://tiki.vn/bo-the-thao-nam-fasvin-at22504-hn-co-tron-chat-vai-mem-nhe-co-gian-thoai-mai-p188916255.html?spid=188916325,1,-48%,Đã bán 1,Fasvin
Áo thun thể thao nam fasvin DTS241.20 áo thể thao nam vải cotton trẻ trung mạnh mẽ,99.500₫,https://tiki.vn/ao-thun-the-thao-nam-fasvin-dts241-20-ao-the-thao-nam-vai-cotton-tre-trung-manh-me-p100368800.html?spid=100369294,2,-44%,,Fasvin
Quần Lót Nam Big Size FASVIN Vải Cotton Chun Co Giãn Mềm Mát Hàng Nhà Máy Phom Dáng Đẹp LSV22174.HN,89.000₫,https://tiki.vn/quan-lot-nam-big-size-fasvin-vai-cotton-chun-co-gian-mem-mat-hang-nha-may-phom-dang-dep-lsv22174-hn-p221277132.html?spid=221277159,3,-10%,,Fasvin
Tất Nam cổ ngắn Fasvin mềm mịn co giãn tốt TN22903.HN,14.000₫,https://tiki.vn/tat-nam-co-ngan-fasvin-mem-min-co-gian-tot-tn22903-hn-p188914106.html?spid=188914119,4,,,Fasvin
,,https://tiki.vn/quan-dui-the-thao-nam-fasvin-s21435-hn-chat-lieu-cao-cap-mem-min-mau-sac-tuoi-tan-p100366914.html?spid=100367008,5,,,Fasvin
Quần short thể thao nam Fasvin T21438.HN vải co giãn thoải mái thiết kế mạnh mẽ khoẻ khoắn năng động,169.000₫,https://tiki.vn/quan-short-the-thao-nam-fasvin-t21438-hn-vai-co-gian-thoai-mai-thiet-ke-manh-me-khoe-khoan-nang-dong-p100367720.html?spid=100368847,6,-19%,,Fasvin
Bộ thun thể thao nam Fasvin AB20271.HN cổ bẻ vải thể thao mềm nhẹ co giãn thoải mái khi vận động,229.000₫,https://tiki.vn/bo-thun-the-thao-nam-fasvin-ab20271-hn-co-be-vai-the-thao-mem-nhe-co-gian-thoai-mai-khi-van-dong-p100367358.html?spid=100367637,7,-50%,Đã bán 1,Fasvin
Quần lót nam Fasvin SV05.HN chất liệu mềm mịn co giãn thoải mái,39.000₫,https://tiki.vn/quan-lot-nam-fasvin-sv05-hn-chat-lieu-mem-min-co-gian-thoai-mai-p188915822.html?spid=188915848,8,-50%,Đã bán 3,Fasvin
Áo thể thao nam Fasvin AC22519.HN cổ tàu chất Melanger vải mềm mại co giãn thoải mái,149.000,https://tiki.vn/ao-the-thao-nam-fasvin-ac22519-hn-co-tau-chat-melanger-vai-mem-mai-co-gian-thoai-mai-p205943826.html?spid=205943836,9,,Đã bán 1,Fasvin
,,https://tiki.vn/quan-gio-the-thao-nam-fasvin-ong-suong-02-lop-vai-co-gian-cao-cap-qbc23610-hn-p273866385.html?spid=273866407,10,,,Fasvin
Bộ quần áo thể thao nam Fasvin AB20279.HN cộc tay cổ bẻ vải thể thao mềm nhẹ co giãn tốt,229.000₫,https://tiki.vn/bo-quan-ao-the-thao-nam-fasvin-ab20279-hn-coc-tay-co-be-vai-the-thao-mem-nhe-co-gian-tot-p188915059.html?spid=188915085,11,-50%,,Fasvin
Áo thun thể thao nam Fasvin DTS217.HN cộc tay cổ tròn vải cotton thấm hút mồ hôi tốt,99.500₫,https://tiki.vn/ao-thun-the-thao-nam-fasvin-dts217-hn-coc-tay-co-tron-vai-cotton-tham-hut-mo-hoi-tot-p100367526.html?spid=100368182,12,,,Fasvin
,,https://tiki.vn/bo-quan-ao-the-thao-nam-fasvin-ab20289-hn-co-be-chat-vai-mem-nhe-co-gian-thoai-mai-p188914286.html?spid=188914321,13,,,Fasvin
Quần lót nam fasvin LSV10.HN vải cotton chun mềm mại co giãn,55.000₫,https://tiki.vn/quan-lot-nam-fasvin-lsv10-hn-vai-cotton-chun-mem-mai-co-gian-p188914762.html?spid=188914793,14,-20%,,Fasvin
Quần lót nam FASVIN mềm mát co giãn LSD2121.HN,63.000₫,https://tiki.vn/quan-lot-nam-fasvin-mem-mat-co-gian-lsd2121-hn-p253181098.html?spid=253181122,15,-9%,Đã bán 6,Fasvin
Áo thun nam Fasvin TS20242.HN chất vải mềm mịn thoáng mát,99.500₫,https://tiki.vn/ao-thun-nam-fasvin-ts20242-hn-chat-vai-mem-min-thoang-mat-p100366804.html?spid=100367502,16,-50%,Đã bán 4,Fasvin
Áo thể thao Big Size nam Fasvin DTS20149.HN vải mềm mại thoải mái,159.000,https://tiki.vn/ao-the-thao-big-size-nam-fasvin-dts20149-hn-vai-mem-mai-thoai-mai-p100367212.html?spid=100367689,17,,Đã bán 1,Fasvin
,,https://tiki.vn/quan-dui-the-thao-nam-fasvin-q20809-hn-vai-gio-chun-mem-mai-co-gian-thoai-mai-van-dong-p100369541.html?spid=100369736,18,,,Fasvin
Bộ quần áo thể thao nam Fasvin BG20429.HN chất vải gió 02 lớp mềm mại cao cấp,399.000₫,https://tiki.vn/bo-quan-ao-the-thao-nam-fasvin-bg20429-hn-chat-vai-gio-02-lop-mem-mai-cao-cap-p195192553.html?spid=195192555,19,-50%,,Fasvin
Bộ quần áo thể thao nam FASVIN AT22511.HN chất vải mềm nhẹ co giãn thoải mái,419.000₫,https://tiki.vn/bo-quan-ao-the-thao-nam-fasvin-at22511-hn-chat-vai-mem-nhe-co-gian-thoai-mai-p200929235.html?spid=200929251,20,-9%,Đã bán 2,Fasvin
Combo 03 Áo Thun nam FASVIN TS23572.2.HN chất Vải COOLMAX Mềm Mát co giãn thoải mái không bai không xù,351.000₫,https://tiki.vn/combo-03-ao-thun-nam-fasvin-ts23572-2-hn-chat-vai-coolmax-mem-mat-co-gian-thoai-mai-khong-bai-khong-xu-p253180728.html?spid=253180815,21,-48%,Đã bán 1,Fasvin
