title,price,link_item,index,discount,sales,category
"Bộ bóc dán thông minh cho bé 17 chủ đề (loại cao cấp), dùng nhiều lần, giúp bé vừa chơi, vừa học tiếng Anh",99.000₫,https://tiki.vn/bo-boc-dan-thong-minh-cho-be-17-chu-de-loai-cao-cap-dung-nhieu-lan-giup-be-vua-choi-vua-hoc-tieng-anh-p153820898.html?spid=153820899,1,-50%,Đã bán 214,dochoi
Bảng Viết Điện Tử Thông Minh Tự Xóa VNBoard Đa Sắc 12 inch,280.000₫,https://tiki.vn/bang-viet-dien-tu-thong-minh-tu-xoa-vnboard-da-sac-12-inch-p59131835.html?spid=59131837,2,-16%,Đã bán 566,dochoi
Bộ Bài Ma Sõi Ultimate Deluxe Edition 64 Lá Đầy Đủ Chức Năng,60.000₫,https://tiki.vn/bo-bai-ma-soi-ultimate-deluxe-edition-64-la-day-du-chuc-nang-p76198177.html?spid=227570018,3,-4%,Đã bán 31,dochoi
"(Ảnh thật) Xe đạp 3 bánh khung kim loại trẻ em mã 520 - vừa làm xe đạp, vừa làm xe đẩy",479.000₫,https://tiki.vn/xe-dap-3-banh-khung-kim-loai-tre-em-ma-520-vua-lam-xe-dap-vua-lam-xe-day-p269960842.html?spid=270960125,4,-32%,Đã bán 8,dochoi
XE CẦN ĐẨY 306 MÀU HỒNG CHO BÉ,430.000₫,https://tiki.vn/xe-can-day-306-mau-hong-cho-be-p217476031.html?spid=217476037,5,-34%,Đã bán 183,dochoi
Quây cũi kiêm nhà bóng cho bé (100 bóng nhựa cho bé),189.000₫,https://tiki.vn/quay-cui-kiem-nha-bong-cho-be-100-bong-nhua-cho-be-p23542945.html?spid=69020719,6,-21%,Đã bán 161,dochoi
"Đồ chơi mô hình máy bay chiến đấu F-18, F-35 và Su-35 có nhạc đèn KAVY-124 chạy cót vỏ hợp kim",132.000₫,https://tiki.vn/do-choi-mo-hinh-may-bay-chien-dau-f-18-f-35-va-su-35-co-nhac-den-kavy-124-chay-cot-vo-hop-kim-p184879862.html?spid=184879864,7,-20%,Đã bán 18,dochoi
"Đồ Chơi Cát Ma Thuật Mideer Magic Sand Play Set Dành Cho Bé 3 Tuổi, Đồ Chơi Cảm Giác Cho Bé",169.000₫,https://tiki.vn/do-choi-hat-cat-ma-thuat-mideer-magic-sand-play-set-danh-cho-be-3-tuoi-do-choi-cam-giac-cho-be-p191621159.html?spid=191621163,8,-35%,Đã bán 24,dochoi
Bạn Gấu Slime (Slime Trong) - BST Thú Cưng. Đã Được Chứng Nhận Hợp Quy An Toàn Cho Trẻ Em,35.000₫,https://tiki.vn/ban-gau-slime-slime-trong-bst-thu-cung-da-duoc-chung-nhan-hop-quy-an-toan-cho-tre-em-p259534005.html?spid=259534007,9,-50%,Đã bán 17,dochoi
"Tên lửa đồ chơi giáo dục vật lý cho bé mẫu giáo - mầm non, tiểu học phát triển trí tuệ thông minh MySun",9.900₫,https://tiki.vn/bo-do-choi-khoa-hoc-phong-ten-lua-ngoai-troi-cho-be-mau-giao-mam-non-hoc-tap-phat-trien-van-dong-p273217424.html?spid=273228648,10,-18%,Đã bán 6,dochoi
Bộ xếp hình valy Mideer 104 mảnh ghép dành cho bé từ 4 tuổi (Puzzle) - Chủ đề Garage xe ô tô,257.000₫,https://tiki.vn/bo-xep-hinh-valy-mideer-104-manh-ghep-danh-cho-be-tu-3-tuoi-puzzle-chu-de-garage-xe-oto-p114537444.html?spid=114537445,11,-22%,Đã bán 21,dochoi
Minifigures Batman Người Dơi Superman Lắp Ráp Mô Hình Nhân Vật Siêu Anh Hùng Phim Truyện Justice League Kopf KF6168,22.500₫,https://tiki.vn/minifigures-batman-nguoi-doi-superman-lap-rap-mo-hinh-nhan-vat-sieu-anh-hung-phim-truyen-justice-league-kopf-kf6168-p253419738.html?spid=253419740,12,-52%,Đã bán 4,dochoi
"Đồ chơi tô màu tranh mút xốp,Tranh tô màu bọt xốp Slime Gỗ 3D, Gỗ Slime cho bé tự ý sáng tạo",35.000₫,https://tiki.vn/hang-san-tp-hcm-do-choi-to-mau-tranh-mut-xop-tranh-to-mau-bot-xop-slime-go-3d-go-slime-cho-be-tu-y-sang-tao-p261811067.html?spid=261811101,13,-25%,Đã bán 10,dochoi
"Xe trượt scooter Babyfast 3 bánh an toàn cho trẻ em của Babyhop chịu lực 80kg phù hợp cho cả bé trai và gái, bánh xe phát sáng vĩnh cửu",599.000₫,https://tiki.vn/xe-truot-scooter-babyfast-2019-cua-babyhop-p33893853.html?spid=33893856,14,-20%,Đã bán 2.3k,dochoi
Đồ Chơi Cờ Trí Tuệ UNO W2085,109.900₫,https://tiki.vn/do-choi-co-tri-tue-uno-w2085-p25982539.html?spid=25982540,15,-6%,Đã bán 697,dochoi
Bộ cờ vua loại 25cm dành cho học sinh,89.000₫,https://tiki.vn/bo-co-vua-loai-25cm-danh-cho-hoc-sinh-p273023238.html?spid=273023236,16,-24%,Đã bán 4,dochoi
Bộ Tranh Tương Tác Cô Tiên Xanh - Ăn Khuya,29.600₫,https://tiki.vn/bo-tranh-tuong-tac-co-tien-xanh-an-khuya-p272419857.html?spid=272419858,17,-7%,Đã bán 6,dochoi
"Đồ chơi mô hình xe cứu hỏa phun nước KAVY NO.8827 chất liệu hợp kim và nhựa nguyên sinh an toàn, chi tiết sắc sảo",70.000₫,https://tiki.vn/do-choi-mo-hinh-xe-cuu-hoa-phun-nuoc-kavy-no-8827-chat-lieu-hop-kim-va-nhua-nguyen-sinh-an-toan-chi-tiet-sac-sao-p74816689.html?spid=74816691,18,-41%,Đã bán 214,dochoi
Đồ chơi mô hình xe cảnh sát Ford F-150 bằng hợp kim mở được cửa chạy cót,119.000₫,https://tiki.vn/do-choi-mo-hinh-xe-canh-sat-ford-f-150-bang-hop-kim-mo-duoc-cua-chay-cot-p248394476.html?spid=248394483,19,-10%,Đã bán 18,dochoi
Thú Bông Lạc Đà A Đán Bá Đạo Alpaca 38cm Quà Tặng Cưng Xỉu Siêu Hot,180.000₫,https://tiki.vn/thu-bong-lac-da-a-dan-ba-dao-alpaca-38cm-qua-tang-cung-xiu-sieu-hot-p199031791.html?spid=199031792,20,-10%,Đã bán 41,dochoi
Bộ bàn cờ vua 25cm loại cao cấp ( quân cờ màu Vàng -Bạc ) - Henrysa,135.000₫,https://tiki.vn/bo-ban-co-vua-25cm-loai-cao-cap-quan-co-mau-vang-bac-henrysa-p206572770.html?spid=206572771,21,-25%,Đã bán 22,dochoi
Tranh Xếp Hình 100 Mảnh Khổ A3 Minh Châu – Chủ đề Thế Giới Muôn Màu – Đồ Chơi Trí Tuệ Cho Bé,36.000₫,https://tiki.vn/tranh-xep-hinh-100-manh-kho-a3-minh-chau-chu-de-the-gioi-muon-mau-do-choi-tri-tue-cho-be-p273283150.html?spid=273283152,22,-37%,Đã bán 8,dochoi
Đồ chơi mô hình xe cứu hộ vận chuyển ô tô KAVY No.8809 gồm 2 xe có nhạc và đèn,165.000₫,https://tiki.vn/do-choi-mo-hinh-xe-cuu-ho-van-chuyen-o-to-kavy-no-8809-gom-2-xe-co-nhac-va-den-p106058243.html?spid=106058247,23,-45%,Đã bán 216,dochoi
Boardgame Ma Sói Character Việt Hóa,106.400₫,https://tiki.vn/boardgame-ma-soi-character-viet-hoa-p558552.html?spid=32722768,24,-20%,Đã bán 178,dochoi
Đồ Chơi Trang Điểm Cho Bé Gái Từ 3 Tuổi BOWA 8252,299.000₫,https://tiki.vn/do-choi-bo-trang-diem-32-chi-tiet-cho-be-gai-tu-3-tuoi-bowa-8252-p254022633.html?spid=254022634,25,,Đã bán 10,dochoi
Lều công chúa lều hoàng tử cao cấp cỡ đại cho bé,204.000₫,https://tiki.vn/leu-cong-chua-leu-hoang-tu-cao-cap-co-dai-cho-be-p114264109.html?spid=117927150,26,,Đã bán 152,dochoi
"Cờ tỷ phú Monopoly Ultimate Banking , Monopoly Here & Now The World Edition",450.000₫,https://tiki.vn/co-ty-phu-monopoly-ultimate-banking-monopoly-here-now-the-world-edition-p118962950.html?spid=118962952,27,,Đã bán 209,dochoi
BỘ CÂN BẰNG ĐỒ CHƠI THIẾT KẾ CÓ CÁC PHI HÀNH GIA NHỎ NHẮN SIÊU HOT-JL,70.000₫,https://tiki.vn/bo-can-bang-do-choi-thiet-ke-co-cac-phi-hanh-gia-nho-nhan-sieu-hot-jl-p272046883.html?spid=272046884,28,,Đã bán 9,dochoi
Đồ chơi lắp ráp gỗ 3D Mô hình Nhà Warm House,89.000₫,https://tiki.vn/do-choi-lap-rap-go-3d-mo-hinh-nha-go-warm-house-p16856677.html?spid=16856681,29,,Đã bán 216,dochoi
"Đồ chơi mô hình súng bắn bóng khủng long kèm bia mục tiêu, bắn xa 8 mét, nhiều màu sắc",45.000₫,https://tiki.vn/do-choi-mo-hinh-sung-ban-bong-khung-long-kem-bia-muc-tieu-ban-xa-8-met-nhieu-mau-sac-p258567548.html?spid=258567584,30,,Đã bán 39,dochoi
Bộ thẻ kích thích thị giác cho trẻ sơ sinh Ziczac,33.600₫,https://tiki.vn/bo-the-kich-thich-thi-giac-cho-tre-so-sinh-ziczac-p213573148.html?spid=271889710,31,,Đã bán 8,dochoi
"Cờ Vây Nam Châm Chọn size, Cờ Caro Cao Cấp, Có Bàn Là Hộp Đựng Rộng 28.5cm Và 37cm - Hàng chính hãng Amalife",131.000₫,https://tiki.vn/co-vay-nam-cham-a1-19-dong-ke-co-caro-cao-cap-co-ban-la-hop-dung-rong-28-5cm-hang-chinh-hang-amalife-p255174867.html?spid=255174870,32,,Đã bán 992,dochoi
Thú nhún bơm hơi Toyshouse (KÈM BƠM)- Tiêu chuẩn xuất khẩu Mỹ (ASTM) và Châu Âu (EN71)- Đồ chơi vận động cho bé từ 8 tháng,439.000₫,https://tiki.vn/thu-nhun-bom-hoi-toyshouse-kem-bom-tieu-chuan-xuat-khau-my-astm-va-chau-au-en71-do-choi-van-dong-cho-be-tu-8-thang-p26270885.html?spid=263826694,33,,Đã bán 167,dochoi
"Thảm xốp lót sàn cho bé - đơn màu Pastel (10 miếng, diện tích 1m2)",117.000₫,https://tiki.vn/tham-xop-lot-san-cho-be-don-mau-pastel-10-mieng-dien-tich-1m2-p15787852.html?spid=15787858,34,,Đã bán 2.3k,dochoi
Đồ Chơi LEGO Hộp Gạch Classic Chủ Đề Đại Dương Sáng Tạo 11018 (333 chi tiết),447.000₫,https://tiki.vn/do-choi-lego-hop-gach-classic-chu-de-dai-duong-sang-tao-11018-333-chi-tiet-p169715993.html?spid=185918432,35,,Đã bán 37,dochoi
Đồ Chơi LEGO TECHNIC Chiến Xe Monster Jam Megalodon 42134,628.000₫,https://tiki.vn/do-choi-lego-technic-chien-xe-monster-jam-megalodon-42134-p152738126.html?spid=180365731,36,,Đã bán 57,dochoi
"Đồ chơi mô hình xe ô tô biến hình robot người máy Transformer Optimus Prime, Bumblebee MySun",149.000₫,https://tiki.vn/do-choi-mo-hinh-xe-o-to-bien-hinh-robot-nguoi-may-transformer-optimus-prime-bumblebee-mysun-p201632326.html?spid=201632328,37,,Đã bán 44,dochoi
Đồ Chơi Lắp Ráp Khủng Long Qman 42106 Khủng Long Biến Đổi (287 Mảnh Ghép) Dành Cho Bé Trai Trên 6 Tuổi,138.000₫,https://tiki.vn/do-choi-lap-rap-khung-long-qman-42106-khung-long-bien-doi-287-manh-ghep-danh-cho-be-trai-tren-6-tuoi-p273495793.html?spid=138838056,38,,Đã bán 135,dochoi
Bộ đồ chơi nấu ăn cho bé,178.999₫,https://tiki.vn/bo-do-choi-nau-an-cho-be-p217138374.html?spid=252701583,39,,,dochoi
Đồ chơi lắp ráp mô hình Máy bay tiêm kích siêu thanh Qman 22013 (376 mảnh ghép),299.000₫,https://tiki.vn/do-choi-lap-rap-mo-hinh-may-bay-tiem-kich-sieu-thanh-qman-22013-376-manh-ghep-p125803655.html?spid=125803656,40,,Đã bán 62,dochoi
