title,price,link_item,index,discount,sales,category
Áo Khoác Kaki Nam Hai Lớp Phối Dây Kéo Ngực Giả Vest Hàn Quốc Cao Cấp KK45 - ShopN6 (Nhiều Màu),179.000₫,https://tiki.vn/ao-khoac-kaki-nam-hai-lop-phoi-day-keo-nguc-gia-vest-han-quoc-cao-cap-kk45-shopn6-nhieu-mau-p57829951.html?spid=57829959,1,-27%,Đã bán 11,aovest
Áo Blazer Nam Form Rộng dài tay dáng unisex màu đen nâu phong cách Hàn Quốc,499.000₫,https://tiki.vn/ao-blazer-nam-form-rong-dai-tay-dang-unisex-mau-den-nau-phong-cach-han-quoc-p182552404.html?spid=182552408,2,-45%,Đã bán 2,aovest
"Áo khoác sentinials JACKET áo khoác dù, ÁO KHOÁT DÙ UNISEX - NAM NỮ ĐỀU MẶC ĐƯỢC, ÁO BOMBER TAY DA CHỮ FORGE UNISEX FROM RỘNG Chống nắng Kiểu Bomber Jacket",99.000₫,https://tiki.vn/ao-khoac-sentinials-jacket-ao-khoac-du-ao-khoat-du-unisex-nam-nu-deu-mac-duoc-ao-bomber-tay-da-chu-forge-unisex-from-rong-chong-nang-kieu-bomber-jacket-p191420858.html?spid=191420868,3,-37%,Đã bán 2,aovest
Áo Khoác Dù Mỏng Viền Sọc Tay Áo Có Nón Phong Cách Hàn Quốc,200.000₫,https://tiki.vn/ao-khoac-du-mong-vien-soc-tay-ao-co-non-phong-cach-han-quoc-p76829078.html?spid=76829082,4,-46%,,aovest
Hàng cao cấp | Bộ vest nam 6 cúc Hàn Quốc màu đen sang trọng - DUKI STORE,959.000₫,https://tiki.vn/hang-cao-cap-bo-vest-nam-6-cuc-han-quoc-mau-den-sang-trong-duki-store-p78968170.html?spid=78968232,5,,Đã bán 6,aovest
"Bộ Phụ Kiện Áo Quạt Điều Hòa Nhật Bản DOKY PIN 30.000 MAH, Quạt Không Chổi Than 12V, Thời Gian Chạy 17-19h Ở Mức Cao Nhất - Bảo Hành 12 Tháng",550.000₫,https://tiki.vn/bo-phu-kien-ao-quat-dieu-hoa-nhat-ban-doky-pin-30-000-mah-quat-khong-choi-than-12v-thoi-gian-chay-17-19h-o-muc-cao-nhat-bao-hanh-12-thang-p249213207.html?spid=249213208,6,,Đã bán 5,aovest
Áo Khoác Bomber UNDER 84 Vietnam Varsity Jacket - UJK001,325.000₫,https://tiki.vn/ao-khoac-bomber-under-84-vietnam-varsity-jacket-ujk001-p181916087.html?spid=181916089,7,,,aovest
Bộ vest nam form ôm body dáng chuẩn,548.900₫,https://tiki.vn/product-p77602335.html?spid=77602352,8,,Đã bán 3,aovest
Áo Khoác Phao Nam đẹp AKD341,720.000₫,https://tiki.vn/ao-khoac-phao-nam-dep-akd341-p14958388.html?spid=14958396,9,,Đã bán 4,aovest
Aó vest da nam đẹp AKD345,720.000₫,https://tiki.vn/ao-vest-da-nam-dep-akd345-p19455735.html?spid=19455737,10,,Đã bán 6,aovest
ÁO KHOÁC DÙ NAM 2 MẶT REAL,225.000₫,https://tiki.vn/ao-khoac-du-nam-2-mat-real-p17577823.html?spid=44050697,11,,Đã bán 8,aovest
Áo Khoác Dù Nam Có Nón Phối Dây Kéo,145.000₫,https://tiki.vn/ao-khoac-du-nam-co-non-phoi-day-keo-p2611557.html?spid=79940293,12,,Đã bán 3,aovest
"Bộ Vest Nam, Đồ Veston Màu Xanh Đen, Đen, Xanh Navy, Cổ Vịt Cao Cấp - Trần(1 Quần Và 1 Aó Vest)",1.900.000₫,https://tiki.vn/bo-vest-nam-do-veston-mau-xanh-den-den-xanh-navy-co-vit-cao-cap-tran-1-quan-va-1-ao-vest-p164052445.html?spid=164052480,13,,,aovest
Áo khoác bomber jacket nam nữ hình in undertrap khoác varsity undertrap chất nỉ cotton cao cấp hany shop,119.000₫,https://tiki.vn/ao-khoac-bomber-jacket-nam-nu-hinh-in-undertrap-khoac-varsity-undertrap-chat-ni-cotton-cao-cap-hany-shop-p157206405.html?spid=174427528,14,,Đã bán 2,aovest
Áo Khoác Dù Sevenzia Bomber Unisex Nam Nữ cực phẩm hóa nam thần,62.000₫,https://tiki.vn/ao-khoac-du-sevenzia-bomber-unisex-nam-nu-cuc-pham-hoa-nam-than-p180397275.html?spid=180397343,15,,Đã bán 6,aovest
"Áo Khoác dù nam form rộng chất dày dặn thiết kế dây kéo có nẹp logo in TEE.LAB nón rộng đẹp, áo khoác bomber cổ sơ mi thể thao",103.000₫,https://tiki.vn/ao-khoac-du-nam-form-rong-chat-day-dan-thiet-ke-day-keo-co-nep-logo-in-tee-lab-non-rong-dep-ao-khoac-bomber-co-so-mi-the-thao-p270102672.html?spid=270102674,16,,,aovest
Áo khoác da lì nam đỏ,750.000₫,https://tiki.vn/ao-khoac-da-li-nam-do-p82946522.html?spid=82946532,17,,Đã bán 1,aovest
ÁO KHOÁC JEAN NAM CỰC CHẤT,650.000₫,https://tiki.vn/ao-khoac-jean-nam-cuc-chat-p151763855.html?spid=151763866,18,,,aovest
ÁO KHOÁC KAKI NAM CÓ NÓN PHỐI MÀU,239.000₫,https://tiki.vn/ao-khoac-kaki-nam-co-non-phoi-mau-p79461302.html?spid=79461308,19,,Đã bán 5,aovest
"Áo jean nam xám cúc trắng in chữ paris, áo khoác bò nam cao cấp",309.750₫,https://tiki.vn/ao-bo-jean-nam-xam-cuc-trang-in-chu-paris-cao-cap-p76600851.html?spid=113226582,20,,Đã bán 1,aovest
Áo khoác jean nam cao cấp thời trang,288.750₫,https://tiki.vn/ao-khoac-jean-nam-cao-cap-thoi-trang-p15065890.html?spid=113228439,21,,,aovest
áo khoác viền tay THOM siêu hot hit 2 màu ảnh thật,90.000₫,https://tiki.vn/freeship-ao-khoac-vien-tay-thom-sieu-hot-hit-2-mau-anh-that-p173639614.html?spid=197324190,22,,Đã bán 3,aovest
"Áo khoác kaki nam phong cách lính, hàng nhập Quảng Châu",550.000₫,https://tiki.vn/ao-khoac-kaki-nam-phong-cach-linh-hang-nhap-quang-chau-p111586121.html?spid=111586160,23,,Đã bán 1,aovest
ÁO KHOÁC DÙ NAM 2 LỚP CÓ NÓN -XÁM,323.700₫,https://tiki.vn/ao-khoac-du-nam-2-lop-co-non-xam-p83517156.html?spid=83517175,24,,Đã bán 2,aovest
Áo khoác nam A24,130.000₫,https://tiki.vn/ao-khoac-nam-a24-p23452967.html?spid=23765933,25,,Đã bán 6,aovest
Áo khoác jeans nam phong cách,195.000₫,https://tiki.vn/ao-khoac-jeans-nam-phong-cach-p212461628.html?spid=212461634,26,,Đã bán 2,aovest
"Áo khoác nam nữ chất liệu gió cao cấp 2 lớp dày dặn, bên trong lót lưới, áo khoác dù chống nước",180.000₫,https://tiki.vn/ao-khoac-nam-nu-chat-lieu-gio-cao-cap-2-lop-day-dan-ben-trong-lot-luoi-ao-khoac-du-chong-nuoc-p124765809.html?spid=137948775,27,,Đã bán 3,aovest
Áo Khoác BLUE OCEAN VARSITY iMA God Breaker (iGB Blue Ocean Varsity),529.000₫,https://tiki.vn/ao-khoac-blue-ocean-varsity-ima-god-breaker-igb-blue-ocean-varsity-p169685190.html?spid=169685196,28,,,aovest
áo khoác jean nam sước,175.000₫,https://tiki.vn/ao-khoac-jean-nam-suoc-p52132212.html?spid=72737171,29,,Đã bán 7,aovest
Áo quạt điều hòa theo công nghệ Nhật Bản,690.000₫,https://tiki.vn/ao-quat-dieu-hoa-theo-cong-nghe-nhat-ban-p84315745.html?spid=84315773,30,,Đã bán 93,aovest
Áo Phao Nam AKD311,790.000₫,https://tiki.vn/ao-khoac-phao-nam-akd311-p9828456.html?spid=9828464,31,,Đã bán 1,aovest
"Áo khoác nam chống nắng gió thu đông Doka (NBLS201) chất liệu nỉ giữ ấm cao cấp có màu đen , xám đậm , xám lợt",189.000₫,https://tiki.vn/ao-khoac-nam-chong-nang-gio-thu-dong-doka-nbls201-chat-lieu-ni-giu-am-cao-cap-co-mau-den-xam-dam-xam-lot-p17912183.html?spid=48536094,32,,Đã bán 31,aovest
"[BEST JACKET] - Áo 2 Lớp M'S Resolve Tabalo Jacket Chống Nước, Áo Khoác Cản Gió Cực Tốt - 1 Đổi 1 Trong 7 Ngày",499.000₫,https://tiki.vn/best-jacket-ao-2-lop-m-s-resolve-tabalo-jacket-chong-nuoc-ao-khoac-can-gio-cuc-tot-1-doi-1-trong-7-ngay-p109220528.html?spid=109220532,33,,Đã bán 3,aovest
Áo Khoác Nam Enkoni K850T001,850.000₫,https://tiki.vn/ao-khoac-nam-enkoni-t001-p206677733.html?spid=206677737,34,,,aovest
"Áo Khoác Dù Nam Nữ Unisex , thời trang thu đông thương hiệu Chandi chất liệu thấm hút mồ hôi dày dặn mặc thoáng mát 2 màu Trắng-Đen CDK1",109.000₫,https://tiki.vn/ao-khoac-du-nam-nu-unisex-thoi-trang-thu-dong-thuong-hieu-chandi-chat-lieu-tham-hut-mo-hoi-day-dan-mac-thoang-mat-2-mau-trang-den-cdk1-p272935694.html?spid=272935696,35,,Đã bán 1,aovest
Áo Khoác Da Nam Lót Lông Cao Cấp AKD20 (Màu Đen) (Size,298.000₫,https://tiki.vn/ao-khoac-da-nam-lot-long-cao-cap-akd20-p2681757.html?spid=46820358,36,,Đã bán 2,aovest
Áo khoác da cho nam cao cấp J10,299.000₫,https://tiki.vn/ao-khoac-da-cho-nam-cao-cap-j10-p44273223.html?spid=76169544,37,,Đã bán 35,aovest
áo khoác nam jean,190.000₫,https://tiki.vn/ao-khoac-nam-jean-p31917991.html?spid=31917995,38,,,aovest
Áo Khoác Da Nam Thái AKD125,199.000₫,https://tiki.vn/ao-khoac-da-nam-thai-akd125-den-p8822029.html?spid=77735631,39,,,aovest
"Áo khoác dù nam nữ mặc , áo khoác gió",103.000₫,https://tiki.vn/ao-khoac-du-nam-nu-mac-ao-khoac-gio-p90066029.html?spid=91755442,40,,Đã bán 7,aovest
