title,price,link_item,index,discount,sales,category
Bộ Áo Thun Đôi Nam Nữ A224,159.000₫,https://tiki.vn/bo-ao-thun-doi-nam-nu-a224-p11977062.html?spid=11977080,1,-5%,,dodoi
"áo thun cặp hoạt hình, Áo Thun đôi Form Rộng Unisex, Áo đôi nam Nữ Mùa Hè Hoạt Hình Thun Thời Trang Nữ, Áo đôi Hoạt hình Freesize Phong Cách Ulzzang Cực Xịn",170.000₫,https://tiki.vn/ao-thun-cap-hoat-hinh-ao-thun-doi-form-rong-unisex-ao-doi-nam-nu-mua-he-hoat-hinh-thun-thoi-trang-nu-ao-doi-hoat-hinh-freesize-phong-cach-ulzzang-cuc-xin-p91533013.html?spid=91533017,2,,Đã bán 5,dodoi
"Áo Đôi Nam Nữ MM03, Áo Đôi Nỉ Có Mũ In 2 Mèo Sấy Tóc Hạnh Phúc, Vải Nỉ Bông In Hình Dễ Thương - HAI DA",129.000₫,https://tiki.vn/ao-doi-nam-nu-mm03-ao-doi-ni-co-mu-in-2-meo-say-toc-hanh-phuc-vai-ni-bong-in-hinh-de-thuong-p248326812.html?spid=248326824,3,,Đã bán 2,dodoi
"Áo Thun, Áo Gia ĐÌnh",50.000₫,https://tiki.vn/ao-thun-ao-gia-dinh-p97102733.html?spid=97102763,4,,,dodoi
,,https://tiki.vn/bo-ao-vay-so-mi-cap-cao-cap-do-doi-thoi-trang-thiet-ke-nam-nu-chat-dep-couple-tina-p87234293.html?spid=87234301,5,,,dodoi
Set váy áo đôi màu vàng chanh chụp ảnh cưới nổi bật - Áo đôi Tina,299.000₫,https://tiki.vn/set-vay-ao-doi-mau-vang-chanh-chup-anh-cuoi-noi-bat-ao-doi-tina-p194181888.html?spid=194181900,6,,,dodoi
"Áo Thun cặp Nam-Nữ in HÌNH BƯỚM ĐÊM cực dễ thương , thích hợp cho các cặp đôi trẻ trung, năng động, cho các nhóm bạn đi đêm, đi phượt, bão, nhìn đã mắt, bao ngầu, bao chất! (mặc định Nam đen nữ trắng) - S",140.000₫,https://tiki.vn/ao-thun-cap-nam-nu-in-hinh-buom-dem-cuc-de-thuong-thich-hop-cho-cac-cap-doi-tre-trung-nang-dong-cho-cac-nhom-ban-di-dem-di-phuot-bao-nhin-da-mat-bao-ngau-bao-chat-mac-dinh-nam-den-nu-trang-p75935072.html?spid=75935074,7,,Đã bán 7,dodoi
Áo Thun Cặp Dễ Thương Cho Cặp Đôi,32.000₫,https://tiki.vn/ao-thun-cap-de-thuong-cho-cap-doi-p81187080.html?spid=81187358,8,,Đã bán 3,dodoi
Áo thun gia đình 3/4/5 người Đồ đôi mẹ và bé giá rẻ Đồng phục cả nhà Màu trắng GD290T2,49.000₫,https://tiki.vn/ao-gia-dinh-cute-thun-cotton-mau-trang-gd290t2-p132129011.html?spid=132134684,9,,,dodoi
,,https://tiki.vn/do-gia-dinh-quan-den-ao-xanh-in-hoa-tiet-love-nhe-nhang-nhung-day-lang-man-gia-1-bo-gom-1-quan-1-ao-p248268872.html?spid=248269169,10,,,dodoi
Set đồ đôi phối màu cực đỉnh cho cặp đôi Couple Tina 1 - AV009,299.000₫,https://tiki.vn/set-do-doi-phoi-mau-cuc-dinh-cho-cap-doi-couple-tina-1-av009-p264018100.html?spid=264018108,11,,,dodoi
Áo gia đình là số 1,45.500₫,https://tiki.vn/ao-gia-dinh-la-so-1-p96999576.html?spid=99147372,12,,,dodoi
,,https://tiki.vn/do-di-bien-hoi-nhom-du-size-nguyen-bo-ddb52-p132127114.html?spid=132127194,13,,,dodoi
Set đồ đi biển cho gia đình gồm áo thun và quần hoạ tiết nổi bật thun dày dặn DDB57 | DONGPHUSG,99.000₫,https://tiki.vn/set-di-bien-gia-dinh-an-tuong-du-size-nguyen-bo-ddb57-p132137004.html?spid=132141431,14,,,dodoi
Bộ đồ gia đình đi biển set gồm áo thun và quần nổi bật có thể mặc cặp đôi hội nhóm DDB19 | DONGPHUCSG,99.000₫,https://tiki.vn/bo-do-gia-dinh-di-bien-du-size-nguyen-bo-ddb19-p132138392.html?spid=132138843,15,,,dodoi
Áo thun đôi nam nữ,73.000₫,https://tiki.vn/ao-thun-doi-nam-nu-p98655544.html?spid=98655785,16,,Đã bán 2,dodoi
Bộ Áo Thun Đôi Nam Nữ Màu Vàng A365,159.000,https://tiki.vn/bo-ao-thun-doi-nam-nu-mau-vang-a365-p12265595.html?spid=12265599,17,,Đã bán 4,dodoi
,,https://tiki.vn/bo-ao-thun-doi-nam-nu-a223-p11976924.html?spid=11976968,18,,,dodoi
Bộ Áo Thun Đôi Nam Nữ A216 L,159.000₫,https://tiki.vn/bo-ao-thun-doi-nam-nu-a216-p11975885.html?spid=11975915,19,,Đã bán 6,dodoi
Bộ Áo Thun Đôi Nam Nữ A831,159.000₫,https://tiki.vn/bo-ao-thun-doi-nam-nu-a831-p15553132.html?spid=15553152,20,,Đã bán 1,dodoi
Bộ Áo Thun Đôi Nam Nữ A862,159.000₫,https://tiki.vn/bo-ao-thun-doi-nam-nu-a862-p15552913.html?spid=15552919,21,,,dodoi
Bộ Áo Thun Đôi Nam Nữ A743 - XXXL,159.000₫,https://tiki.vn/bo-ao-thun-doi-nam-nu-a743-p15543036.html?spid=15543108,22,,,dodoi
Bộ Áo Thun Đôi Nam Nữ A705 - L,159.000₫,https://tiki.vn/bo-ao-thun-doi-nam-nu-a705-p15542087.html?spid=15542118,23,,,dodoi
Bộ Áo Thun Đôi Nam Nữ A760,159.000₫,https://tiki.vn/bo-ao-thun-doi-nam-nu-a760-p15546395.html?spid=15546419,24,,,dodoi
Bộ Áo Thun Đôi Nam Nữ Màu Đen A923,269.000,https://tiki.vn/bo-ao-thun-doi-nam-nu-mau-den-a923-p21319476.html?spid=21319518,25,,,dodoi
,,https://tiki.vn/ao-so-mi-cap-trang-den-p73924846.html?spid=73924856,26,,,dodoi
Áo sơ mi đôi phối màu búng tim,110.000₫,https://tiki.vn/ao-so-mi-doi-phoi-mau-bung-tim-p91928028.html?spid=91928119,27,,,dodoi
Áo Sơ Mi Cặp Đôi Cổ Trụ Chữ Love,273.000₫,https://tiki.vn/ao-so-mi-cap-doi-co-tru-chu-love-p90414874.html?spid=90414982,28,,,dodoi
Áo Gia Đình Tết Tân Sửu 2021 Siêu Độc | Hàng Chất Đẹp | Áo Bé Trai | Bé Gái TET9,69.000₫,https://tiki.vn/ao-gia-dinh-tet-tan-suu-2021-sieu-doc-hang-chat-dep-ao-be-trai-be-gai-tet9-p104115993.html?spid=104116308,29,,,dodoi
Áo thun Cặp Đôi Nam Nữ Couple - Mèo đen - trắng (Giá 65k 1 cái) Có size tay lỡ,40.000₫,https://tiki.vn/ao-thun-cap-doi-nam-nu-couple-meo-den-trang-gia-65k-1-cai-co-size-tay-lo-p91107290.html?spid=92471419,30,,,dodoi
,,https://tiki.vn/bo-ao-thun-doi-nam-nu-a47-p11522675.html?spid=11522681,31,,,dodoi
"Áo Đôi Nam Nữ TT13, Áo Đôi Phông Rộng In Mèo Sẩy Tóc Hạnh Phúc - HAI VÀNG",98.000₫,https://tiki.vn/ao-doi-nam-nu-tt13-ao-doi-phong-rong-in-meo-say-toc-hanh-phuc-p248326963.html?spid=248326967,32,,,dodoi
Áo Nỉ Chui Trơn Màu Xanh Đen,256.500₫,https://tiki.vn/ao-ni-chui-tron-mau-xanh-den-p160399190.html?spid=160399213,33,,,dodoi
Áo thun gia đình ngôi sao đồ đồng phục gia đình 3/4/5 người thun mềm mịn màu trắng GD339T DONGPHUCSG,25.000₫,https://tiki.vn/ao-thun-gia-dinh-ngoi-sao-mau-trang-gd339t-p132132730.html?spid=132132899,34,,,dodoi
"Đồ đôi nam nữ, bộ ngủ đôi dài tay cotton 100% không bai xù, bộ mặc nhà đẹp thu đông",219.000,https://tiki.vn/do-doi-nam-nu-bo-ngu-doi-dai-tay-cotton-100-khong-bai-xu-bo-mac-nha-dep-thu-dong-p141075873.html?spid=141075880,35,,Đã bán 4,dodoi
,,https://tiki.vn/ao-thun-cap-doi-nam-nu-couple-cap-doi-nam-nu-de-thuong-gia-1-cai-65k-co-size-tay-lo-p92467256.html?spid=92467338,36,,,dodoi
"Áo Đôi Nam Nữ TT14, Áo Đôi Phông Rộng In Yêu Là Cưới Kèm Hình Dễ thương - HAI XÁM",98.000₫,https://tiki.vn/ao-doi-nam-nu-tt14-ao-doi-phong-rong-in-yeu-la-cuoi-kem-hinh-de-thuong-p248326942.html?spid=248326946,37,,,dodoi
Đồ đi biển đẹp -150K BAO GỒM 1 BỘ ( 1 ÁO+1 QUẦN),157.800₫,https://tiki.vn/do-di-bien-dep-150k-bao-gom-1-bo-1-ao-1-quan-p169568600.html?spid=169568872,38,,Đã bán 1,dodoi
️Áo thun đôi Miss ️ (có nhiều màu),65.000₫,https://tiki.vn/ao-thun-doi-miss-co-nhieu-mau-p113244394.html?spid=113245277,39,,,dodoi
"Đồ bộ trái cây đi biển(ảnh thật, chất kate thái) trái cam",58.000₫,https://tiki.vn/do-bo-trai-cay-di-bien-anh-that-chat-kate-thai-trai-cam-p97929869.html?spid=97930010,40,,Đã bán 7,dodoi
