title,price,link_item,index,discount,sales,category
QUẦN BẦU HÈ THU CHẤT VẢI PHONG CÁCH CÔNG SỞ TRẺ TRUNG QBN1225,355.000₫,https://tiki.vn/quan-bau-he-thu-chat-vai-phong-cach-cong-so-tre-trung-qbn1225-p113125508.html?spid=113125514,1,,,thoitrangbau
QUẦN BẦU JEAN DÁNG ÔM MÀI RÁCH SÁNG MÀU QBN1213,395.000₫,https://tiki.vn/quan-bau-jean-dang-om-mai-rach-sang-mau-qbn1213-p113192277.html?spid=113192285,2,,,thoitrangbau
Áo bầu thu đông áo bầu len dáng dài ABL85,320.000₫,https://tiki.vn/ao-bau-thu-dong-ao-bau-len-dang-dai-abl85-p141582451.html?spid=141582453,3,,,thoitrangbau
Chân váy bầu thu đông xòe QBN1038,355.000,https://tiki.vn/chan-vay-bau-thu-dong-xoe-qbn1038-p126915440.html?spid=126915448,4,,,thoitrangbau
,,https://tiki.vn/chan-vay-om-bau-thu-dong-chan-vay-len-om-p143342015.html?spid=143342021,5,,,thoitrangbau
Áo bầu thu đông áo bầu dáng dài len ABL42,290.000₫,https://tiki.vn/ao-bau-thu-dong-ao-bau-dang-dai-len-abl42-p141526437.html?spid=141526438,6,,,thoitrangbau
QUẦN BẦU JEAN BAGGY CÁ TÍNH QBN1337,435.000₫,https://tiki.vn/quan-bau-jean-baggy-ca-tinh-qbn1337-p253392132.html?spid=253392138,7,,,thoitrangbau
XẢ SỐC Áo bầu cotton dài tay hàng new ghi chú màu,55.000₫,https://tiki.vn/xa-soc-ao-bau-cotton-dai-tay-hang-new-ghi-chu-mau-p92321002.html?spid=92321003,8,,,thoitrangbau
Váy hoa nhí cánh tiên,199.000,https://tiki.vn/vay-hoa-nhi-canh-tien-p92321338.html?spid=92321344,9,,,thoitrangbau
,,https://tiki.vn/ao-bau-hong-ren-p92322764.html?spid=92322788,10,,,thoitrangbau
Sooc jean bầu quảng châu,150.000₫,https://tiki.vn/sooc-jean-bau-quang-chau-p92322499.html?spid=92322522,11,,,thoitrangbau
quần legging bầu chễ( có chun chỉnh bụng)(full size 40-90kg),150.000,https://tiki.vn/quan-legging-bau-che-co-chun-chinh-bung-full-size-40-90kg-p92318982.html?spid=92319000,12,,Đã bán 1,thoitrangbau
,,https://tiki.vn/bo-tho-dai-tay-bau-va-sau-sinh-co-khoa-keo-cho-be-bu-tien-loi-p92319685.html?spid=92319691,13,,,thoitrangbau
váy bầu - đầm bầu chấm bi tay bèo tiểu thư,150.000₫,https://tiki.vn/vay-bau-dam-bau-cham-bi-tay-beo-tieu-thu-p92320730.html?spid=92320731,14,,,thoitrangbau
Váy bi bầu chân bèo,99.000₫,https://tiki.vn/vay-bi-bau-chan-beo-p92319858.html?spid=92319862,15,,,thoitrangbau
Áo bầu cotton da cá nơ eo,195.000₫,https://tiki.vn/ao-bau-cotton-da-ca-no-eo-p92322549.html?spid=92322568,16,,Đã bán 3,thoitrangbau
sooc dạ gân bầu,130.000,https://tiki.vn/sooc-da-gan-bau-p92322463.html?spid=92322475,17,,,thoitrangbau
,,https://tiki.vn/vay-lanh-free-size-duoi-60kg-p92322468.html?spid=92322541,18,,,thoitrangbau
Áo sơ mi bầu công sở trẻ trung Korean style - Tổng kho đồ bầu,104.000₫,https://tiki.vn/ao-so-mi-bau-cong-so-tre-trung-korean-style-tong-kho-do-bau-p98366589.html?spid=112985660,19,,Đã bán 2,thoitrangbau
ÁO LÓT CÀI KHUY,55.000₫,https://tiki.vn/ao-lot-cai-khuy-p247900822.html?spid=247900840,20,,,thoitrangbau
"Quần mặc trong váy cho bà bầu đẹp rẻ, thiết kế cạp cao, tốt cho bà bầu",40.000₫,https://tiki.vn/quan-mac-trong-vay-cho-ba-bau-dep-re-thiet-ke-cap-cao-tot-cho-ba-bau-p114404348.html?spid=114404452,21,,,thoitrangbau
Quần tất bầu loại dày vừa,162.500₫,https://tiki.vn/quan-tat-bau-loai-day-vua-p95249071.html?spid=95249087,22,,,thoitrangbau
Váy bầu công sở THÊU HOA - Đầm sau sinh cho con bú ti thiết kế đẹp - Đồ thời trang xinh dự tiệc mùa hè Bigsize ẢNH THẬT,289.000₫,https://tiki.vn/vay-bau-cong-so-theu-hoa-dam-sau-sinh-cho-con-bu-ti-thiet-ke-dep-do-thoi-trang-xinh-du-tiec-mua-he-bigsize-anh-that-p114403732.html?spid=114403828,23,,,thoitrangbau
"Bộ đồ bầu CỔ TIM - Quần áo nữ mặc nhà cho mẹ sau sinh và cho con bú ti - Thời trang mùa hè, thu đông đẹp Bigsize Giá Rẻ 2022",165.000₫,https://tiki.vn/bo-do-bau-co-tim-quan-ao-nu-mac-nha-cho-me-sau-sinh-va-cho-con-bu-ti-thoi-trang-mua-he-thu-dong-dep-bigsize-gia-re-2022-p191577174.html?spid=191577193,24,,,thoitrangbau
Áo Lót Bầu (Áo Ngực Cho Con Bú) 2 Nút Mở - Mềm Mịn Thoáng Mát,89.000₫,https://tiki.vn/ao-lot-bau-ao-nguc-cho-con-bu-2-nut-mo-mem-min-thoang-mat-p191577110.html?spid=191577119,25,,,thoitrangbau
,,https://tiki.vn/bo-do-bau-sau-sinh-va-cho-con-bu-ti-xo-nhat-tho-dui-dep-mat-pijama-thoi-trang-pizama-mac-nha-dai-tay-cho-me-bigsize-2022-p191576917.html?spid=191577082,26,,,thoitrangbau
Váy Đầm ngủ bầu - Đầm váy mặc nhà sau sinh cho con bú ti NHIỀU MẪU - Quần áo bà bầu thời trang đẹp mùa hè Bigsize,145.000₫,https://tiki.vn/vay-dam-ngu-bau-dam-vay-mac-nha-sau-sinh-cho-con-bu-ti-nhieu-mau-quan-ao-ba-bau-thoi-trang-dep-mua-he-bigsize-p114404466.html?spid=263932372,27,,Đã bán 3,thoitrangbau
Áo Lót Bầu Sau Sinh Cho Con Bú Chống Chảy Xệ Cao Cấp Chất Liệu Cotton Alb06,170.000₫,https://tiki.vn/ao-lot-bau-sau-sinh-cho-con-bu-chong-chay-xe-cao-cap-chat-lieu-cotton-alb06-p164582599.html?spid=164582647,28,,Đã bán 1,thoitrangbau
Quần lót bầu cạp chéo kháng khuẩn cotton chất đẹp QL04,169.000₫,https://tiki.vn/quan-lot-bau-cap-cheo-khang-khuan-cotton-chat-dep-ql04-p164582416.html?spid=164582449,29,,,thoitrangbau
Quần lót bầu cotton cạp cao có chun chỉnh bụng Ql02,169.000,https://tiki.vn/quan-lot-bau-cotton-cap-cao-co-chun-chinh-bung-ql02-p164582396.html?spid=164582450,30,,Đã bán 1,thoitrangbau
,,https://tiki.vn/dam-bau-ke-soc-form-rong-vai-tho-dui-hb132-p105673912.html?spid=105673914,31,,,thoitrangbau
Quần Gen Nịt BụngFREESIZEQuần Gen Bụng Chống Cuộn Viền Ren Cao Cho Bà Bầu Sau Sinh QR02,199.000₫,https://tiki.vn/quan-gen-nit-bung-freesize-quan-gen-bung-chong-cuon-vien-ren-cao-cho-ba-bau-sau-sinh-qr02-p164582536.html?spid=164582548,32,,,thoitrangbau
"Đầm bầu yếm, đầm bầu kaki vàng đi chơi",420.000₫,https://tiki.vn/dam-bau-yem-dam-bau-kaki-vang-di-choi-p252639637.html?spid=252639638,33,,,thoitrangbau
Vịt Phun Nước Bánh Xe Quay Đồ Chơi Cực Kỳ Hấp Dẫn Cho Bé,135.000₫,https://tiki.vn/vit-phun-nuoc-banh-xe-quay-do-choi-cuc-ky-hap-dan-cho-be-p198123627.html?spid=198123628,34,,Đã bán 6,thoitrangbau
Quần Legging Cotton Cho Mẹ Bầu Freesize Cho Mẹ Dưới 65kg,94.000₫,https://tiki.vn/quan-legging-cotton-cho-me-bau-freesize-cho-me-duoi-65kg-p84079169.html?spid=84079183,35,,,thoitrangbau
,,https://tiki.vn/bo-do-bau-thiet-ke-tieu-thu-chat-dui-han-chau-co-khoa-mo-nguc-cho-be-ti-bd907-p146572275.html?spid=146572304,36,,,thoitrangbau
Váy bầu thiết kế cổ viền đen ( có khuy chỉnh & túi),94.500₫,https://tiki.vn/vay-bau-thiet-ke-co-vien-den-co-khuy-chinh-tui-p146572468.html?spid=146572558,37,,Đã bán 2,thoitrangbau
Set 5 Quần lót giấy baby hiền trang hàng ngày cho mẹ bầu - S13,21.000₫,https://tiki.vn/set-5-quan-lot-giay-baby-hien-trang-hang-ngay-cho-me-bau-s13-p191710813.html?spid=271455445,38,,,thoitrangbau
VÁY BẦU CỔ BUỘC NƠ MVB081,202.800₫,https://tiki.vn/vay-bau-co-buoc-no-mvb081-p107278978.html?spid=107278987,39,,,thoitrangbau
Váy Bầu Hoa Nhí Có Cổ Cúc Thật Cho Bé Bú HD2838 Honey Mommy Đầm Bầu Hè Cộc Tay Đi Làm Đi Chơi Công Sở,364.000,https://tiki.vn/vay-bau-hoa-nhi-co-co-cuc-that-cho-be-bu-hd2838-honey-mommy-dam-bau-he-coc-tay-di-lam-di-choi-cong-so-p95583640.html?spid=95583661,40,,,thoitrangbau
