title,price,link_item,index,discount,sales,category
Combo Tiết Kiệm 2 Muối Chườm Bụng Thảo Dược Săn Bụng định hình eo Mờ Thâm Rạn Bảo Nhiên Kèm Túi Quấn Muối - định hình eo Sau Sinh An Toàn Và Hiệu Quả,350.000₫,https://tiki.vn/combo-tiet-kiem-2-muoi-chuom-bung-thao-duoc-san-bung-dinh-hinh-eo-mo-tham-ran-bao-nhien-kem-tui-quan-muoi-dinh-hinh-eo-sau-sinh-an-toan-va-hieu-qua-p51061503.html?spid=73257345,1,-18%,,chamsocme
Máy hút sữa tay Fatzbaby Handy 1 FB1007SL,172.000₫,https://tiki.vn/may-hut-sua-tay-fatzbaby-handy-1-fb1007sl-p56942582.html?spid=72853559,2,-20%,Đã bán 46,chamsocme
Áo Lót Ren Không Gọng Có Đệm Mỏng,110.000₫,https://tiki.vn/ao-lot-ren-khong-gong-co-dem-mong-p109915965.html?spid=109916028,3,-9%,,chamsocme
"Bộ Chăm Sóc Mẹ Là Siêu Nhân, Khử Mùi, Phục Hồi Năng Lượng Cho Mẹ Sau Sinh Wonmom (1 Lá Xông + 1 Hộp Thảo Mộc Vệ Sinh Mẹ)",165.000₫,https://tiki.vn/bo-cham-soc-me-la-sieu-nhan-khu-mui-phuc-hoi-nang-luong-cho-me-sau-sinh-wonmom-1-la-xong-1-hop-thao-moc-ve-sinh-me-p76041736.html?spid=76041737,4,-6%,Đã bán 13,chamsocme
Quần mặc váy cho mẹ bầu QV,80.000₫,https://tiki.vn/quan-mac-vay-cho-me-bau-qv-p12581757.html?spid=13319337,5,-8%,Đã bán 9,chamsocme
Bộ cup hút sữa rảnh tay Spectra Handsfree 28mm,720.000₫,https://tiki.vn/bo-cup-hut-sua-ranh-tay-spectra-handsfree-28mm-p19814093.html?spid=19814094,6,-15%,Đã bán 28,chamsocme
Gel Gừng Tan Mỡ - Tặng Gen Nịt Bụng Wonmom,365.000₫,https://tiki.vn/gel-gung-tan-mo-tang-gen-nit-bung-wonmom-p34167899.html?spid=139956837,7,-17%,Đã bán 2,chamsocme
Máy Hút Sữa Đôi Spectra 9 Plus,2.480.000₫,https://tiki.vn/may-hut-sua-doi-spectra-9-plus-p1227001.html?spid=19448148,8,-11%,Đã bán 5,chamsocme
"Gừng toàn thân hạ thổ massage giảm đau nhức, lưu thông khí huyết Wonmom 200ml",167.000₫,https://tiki.vn/gung-toan-than-ha-tho-massage-giam-dau-nhuc-luu-thong-khi-huyet-wonmom-200ml-p221251758.html?spid=260640349,9,,,chamsocme
"Cup hút sữa rảnh tay Spectra Hàn Quốc dùng cho các loại máy hút sữa Spectra, Medela, Cimilre, Avent, Rozabi",677.000₫,https://tiki.vn/cup-hut-sua-ranh-tay-spectra-han-quoc-dung-cho-cac-loai-may-hut-sua-spectra-medela-cimilre-avent-rozabi-p46275616.html?spid=111055942,10,,,chamsocme
Bộ giảm eo sau sinh dưới 3 tháng Wonmom ( 1 Cốt gừng hạ thổ + 1 Gen nịt bụng ),299.000₫,https://tiki.vn/bo-giam-eo-sau-sinh-duoi-3-thang-wonmom-1-cot-gung-ha-tho-1-gen-nit-bung-p221251855.html?spid=260647277,11,,,chamsocme
"Bộ đánh bay thâm rạn, dưỡng trắng toàn thân Wonmom ( 1 Dầu rạn + 1 Kem sữa nghệ toàn thân )",305.000₫,https://tiki.vn/bo-danh-bay-tham-ran-duong-trang-toan-than-wonmom-1-dau-ran-1-kem-sua-nghe-toan-than-p221251677.html?spid=260667987,12,,,chamsocme
"Bộ trắng da, sạch nám cơ bản ngày đêm Wonmom (1 Kem cấp ẩm + 1 Serum vitamin C + 1 Kem nghệ tươi",580.000₫,https://tiki.vn/bo-trang-da-sach-nam-co-ban-ngay-dem-wonmom-1-kem-cap-am-1-serum-vitamin-c-1-kem-nghe-tuoi-p221251740.html?spid=260795051,13,,,chamsocme
"Bộ trắng da, sạch mụn và nám chuyên sâu Wonmom ( 1 Sữa rửa mặt + 1 Kem nghệ tươi + 1 Serum mụn )",560.000₫,https://tiki.vn/bo-trang-da-sach-mun-va-nam-chuyen-sau-wonmom-1-sua-rua-mat-1-kem-nghe-tuoi-1-serum-mun-p221251689.html?spid=260795049,14,,,chamsocme
Bộ đánh bay mụn cứng đầu chuyên sâu Wonmom ( 1 sữa rửa mặt + 1 serum mụn + 1 kem cấp ẩm ),550.000₫,https://tiki.vn/bo-danh-bay-mun-cung-dau-chuyen-sau-wonmom-1-sua-rua-mat-1-serum-mun-1-kem-cap-am-p221251809.html?spid=260795050,15,,,chamsocme
MÁY HÚT SỮA ĐIỆN ĐÔI FATZ BABY - CHORUS 2 - FB1182MX,670.000₫,https://tiki.vn/may-hut-sua-dien-doi-fatz-baby-chorus-2-fb1182mx-p174153673.html?spid=270593399,16,,,chamsocme
Máy hút sữa điện đôi Chorus 2 FATZ - FB1182MX (KHÔNG BAO GỒM ADAPTOR 5V-2A),670.000₫,https://tiki.vn/may-hut-sua-dien-doi-chorus-2-fatz-fb1182mx-khong-bao-gom-adaptor-5v-2a-p177502219.html?spid=270593381,17,,,chamsocme
Bộ tái tạo và phục hồi da Wonmom ( 1 Scrub nghệ tẩy mặt + 1 Mặt nạ nghệ ),335.000₫,https://tiki.vn/bo-tai-tao-va-phuc-hoi-da-wonmom-1-scrub-nghe-tay-mat-1-mat-na-nghe-p221251771.html?spid=260669045,18,,,chamsocme
Kem sữa nghệ toàn thân 150g Wonmom,205.000₫,https://tiki.vn/kem-sua-nghe-toan-than-150g-wonmom-p8490453.html?spid=73738962,19,,Đã bán 5,chamsocme
"Lều Xông Hơi Tự Bung 3 Lớp Và Nồi Xông Hơi 2,6L Cao Cấp Dùng Tại Nhà Spa",698.000₫,https://tiki.vn/leu-xong-hoi-tu-bung-3-lop-va-noi-xong-hoi-2-6l-cao-cap-dung-tai-nha-spa-p133772094.html?spid=143979044,20,,Đã bán 2,chamsocme
"Dây đeo cốc hứng sữa Haakaa. Chất liệu silicone cao cấp. Không chứa BPA, PVC và phthalate",179.000₫,https://tiki.vn/day-deo-co-c-hu-ng-su-a-silicone-haakaa-phu-kien-p129742591.html?spid=129742595,21,,Đã bán 7,chamsocme
"Cốc hứng sữa Gen.3 Haakaa. Chất liệu silicone cao cấp. Không chứa BPA, PVC và phthalate. Có thể chuyển đổi thành Bình sữa, Bình trữ sữa",589.000₫,https://tiki.vn/coc-hung-sua-da-nang-silicone-gen3-haakaa-160-250ml-co-the-chuyen-doi-thanh-binh-sua-binh-tru-sua-p129742419.html?spid=129742421,22,,Đã bán 2,chamsocme
Miếng lót sơ sinh tấm lót mềm mại với làn da thông thoáng khí có thể giặt được,155.000₫,https://tiki.vn/mieng-lot-so-sinh-tam-lot-mem-mai-voi-lan-da-thong-thoang-khi-co-the-giat-duoc-p153789765.html?spid=153789781,23,,,chamsocme
Quần lót cạp cao kháng khuẩn cho mẹ (màu ghi),31.000₫,https://tiki.vn/quan-lot-cap-cao-khang-khuan-cho-me-mau-ghi-p43768941.html?spid=57298047,24,,,chamsocme
Đá khô bảo quản sữa mẹ hộp 3 rãnh - 02 hộp,82.000₫,https://tiki.vn/da-kho-bao-quan-sua-me-hop-3-ranh-02-hop-p33759408.html?spid=47264182,25,,Đã bán 23,chamsocme
Túi Đựng Đồ Đa Năng Vải Không Dệt,29.000₫,https://tiki.vn/tui-dung-do-da-nang-vai-khong-det-p124276022.html?spid=124276024,26,,,chamsocme
Túi trữ sữa Miracle Baby 250ml chính hãng có vòi rót,74.000₫,https://tiki.vn/tui-tru-sua-miracle-baby-250ml-chinh-hang-co-voi-rot-p273870413.html?spid=273870419,27,,,chamsocme
Combo quần lót cho bà bầu,116.000₫,https://tiki.vn/combo-quan-lot-cho-ba-bau-p19919809.html?spid=94653446,28,,,chamsocme
Combo 2 Hộp túi trữ sữa Pur + Bộ 3 bình trữ sữa,444.000₫,https://tiki.vn/combo-2-hop-tui-tru-sua-pur-bo-3-binh-tru-sua-p143040874.html?spid=143040877,29,,,chamsocme
Đai nịt bụng thông hơi chống cuộn chữ M,31.000₫,https://tiki.vn/dai-nit-bung-thong-hoi-chu-m-p93962650.html?spid=193771195,30,,Đã bán 119,chamsocme
Combo 5 quần lót bầu cotton cạp chéo túi zip,115.000₫,https://tiki.vn/combo-5-quan-lot-bau-cotton-cap-cheo-tui-zip-kem-da-2xl-p53530378.html?spid=105698449,31,,Đã bán 7,chamsocme
Túi đựng đồ tre vuông to,690.000₫,https://tiki.vn/tui-dung-do-tre-vuong-to-p22909395.html?spid=22909397,32,,,chamsocme
Quần tất bầu lót lông đại hàn,160.000₫,https://tiki.vn/quan-tat-bau-lot-long-dai-han-p116776502.html?spid=116776512,33,,,chamsocme
Áo Lót Bầu Và Sau Sinh MGS127 Phối Ren Đẹp,279.500₫,https://tiki.vn/ao-lot-bau-va-sau-sinh-mgs127-phoi-ren-dep-p89914859.html?spid=89914928,34,,,chamsocme
BỘ CUP HÚT SỮA RẢNH TAY (SIZE 25/28MM) HQ,1.318.900₫,https://tiki.vn/bo-cup-hut-sua-ranh-tay-size-25-28mm-hq-p107619669.html?spid=107619670,35,,,chamsocme
Vương năng tán Athena 30g Hiệu quả vượt trội Hàng chuẩn,168.000₫,https://tiki.vn/vuong-nang-tan-athena-30g-hieu-qua-vuot-troi-hang-chuan-p90915847.html?spid=90915941,36,,Đã bán 9,chamsocme
quần tất bầu lót nỉ chất dày dặn,90.000₫,https://tiki.vn/quan-tat-bau-lot-ni-chat-day-dan-p116775757.html?spid=116775763,37,,,chamsocme
[NHẬT BẢN] Miếng Lót Thấm Sữa ChuChu Baby (90 Pc),319.000₫,https://tiki.vn/nhat-ban-mieng-lot-tham-sua-chuchu-baby-90-pc-p94761929.html?spid=94761948,38,,,chamsocme
"Khăn choàng voan cho con bú, che đi đường ( giao màu ngẫu nhiên)",325.000₫,https://tiki.vn/khan-choang-voan-cho-con-bu-che-di-duong-giao-mau-ngau-nhien-p95171306.html?spid=95171327,39,,,chamsocme
Ty chống cốp sau Captiva SX CX LX 2006-2007-2008-2009-2010-2012-2013-2014-2015-2016,251.230₫,https://tiki.vn/ty-chong-cop-sau-captiva-sx-cx-lx-2006-2007-2008-2009-2010-2012-2013-2014-2015-2016-p249141852.html?spid=249141862,40,,,chamsocme
