title,price,link_item,index,discount,sales,category
Áo Lót Không Gọng AB20C,57.750₫,https://tiki.vn/ao-lot-khong-gong-ab20c-p34809421.html?spid=56865300,1,-8%,Đã bán 2,chamsocme
️️gen bụng,85.000₫,https://tiki.vn/gen-bung-p99671423.html?spid=99671429,2,-20%,,chamsocme
Áo lót cho bà bầu AL18,38.000₫,https://tiki.vn/ao-lot-cho-ba-bau-al18-p45389383.html?spid=82865696,3,-13%,Đã bán 2,chamsocme
Áo Lót Không Gọng AB27,42.900₫,https://tiki.vn/ao-lot-khong-gong-ab27-p34809913.html?spid=57297892,4,-20%,Đã bán 1,chamsocme
Cốc Hứng Sữa Hichito Nhật Bản Chất liệu silicon cao cấp,250.000₫,https://tiki.vn/coc-hung-sua-hichito-nhat-ban-chat-lieu-silicon-cao-cap-p127697894.html?spid=155306617,5,-20%,Đã bán 9,chamsocme
"Ống hút sữa, bón thuốc cho bé bằng silicon độ bền cao và an toàn cho các bé, ống hút sữa 5ml thay thế ti bình",6.000₫,https://tiki.vn/ong-hut-sua-bon-thuoc-cho-be-bang-silicon-do-ben-cao-va-an-toan-cho-cac-be-ong-hut-sua-5ml-thay-the-ti-binh-p146364510.html?spid=272136017,6,-36%,,chamsocme
"Gối Ôm Bà Bầu Chữ U vải nhung mềm mại hỗ trợ giảm đau lưng, gối đa năng cực tiện hàng cao cấp - Màu hồng ghi",261.000₫,https://tiki.vn/goi-om-ba-bau-chu-u-vai-nhung-mem-mai-ho-tro-giam-dau-lung-goi-da-nang-cuc-tien-hang-cao-cap-mau-hong-ghi-p130042055.html?spid=163428313,7,-5%,Đã bán 5,chamsocme
"Đệm giảm size Phễu 17mm/19mm/21mm Cho phễu Avent, Sanity, unimom, Concung",220.000₫,https://tiki.vn/dem-giam-size-pheu-17mm-19mm-21mm-cho-pheu-avent-sanity-unimom-concung-p88058727.html?spid=90501090,8,,,chamsocme
Túi Đựng Đồ Hình Bầu Dục - Vải Thổ Cẩm - Size Lớn,139.000₫,https://tiki.vn/tui-dung-do-hinh-bau-duc-vai-tho-cam-size-lon-p263294834.html?spid=263294842,9,,,chamsocme
Combo xông vùng kín và chậu xông Bảo Nhiên,351.000₫,https://tiki.vn/combo-xong-vung-kin-va-chau-xong-bao-nhien-p179445575.html?spid=179445576,10,,,chamsocme
Van máy hút sữa Horigen + FATZBABY FREEMAX 4,33.000₫,https://tiki.vn/van-may-hut-sua-horigen-fatzbaby-freemax-4-p216949324.html?spid=216949365,11,,Đã bán 12,chamsocme
Bộ dưỡng trắng hồng da mặt và body sau sinh Wonmom ( Kem nghệ tươi + cốt nghệ + kem sữa nghệ ),788.000₫,https://tiki.vn/bo-duong-trang-hong-da-mat-va-body-sau-sinh-wonmom-kem-nghe-tuoi-cot-nghe-kem-sua-nghe-p191320813.html?spid=191320814,12,,Đã bán 1,chamsocme
Áo hút sữa rảnh tay có dây cao cấp,88.000₫,https://tiki.vn/ao-hut-sua-ranh-tay-co-day-cao-cap-p272961468.html?spid=272961472,13,,,chamsocme
Gối bầu hình lưỡi liềm dành cho mẹ bầu - Họa tiết ngẫu nhiên,106.000₫,https://tiki.vn/goi-bau-hinh-luoi-liem-danh-cho-me-bau-hoa-tiet-ngau-nhien-p26334569.html?spid=86143027,14,,Đã bán 1,chamsocme
Balo cho Mẹ và Bé màu đỏ trắng,86.400₫,https://tiki.vn/balo-cho-me-va-be-mau-do-trang-p12384115.html?spid=136203485,15,,,chamsocme
Quần lót bầu beauty túi zip,45.500₫,https://tiki.vn/quan-lot-bau-beauty-tui-zip-p95246861.html?spid=95246879,16,,,chamsocme
Balo bỉm sữa đa năng cho mẹ và bé,93.000₫,https://tiki.vn/balo-bi-m-su-a-da-nang-cho-me-va-be-p23567134.html?spid=111725765,17,,,chamsocme
COMBO 5 QUẦN LÓT BẦU,124.000₫,https://tiki.vn/combo-5-quan-lot-bau-p96107103.html?spid=96107122,18,,,chamsocme
Combo 3 Hộp Miếng Dán Tan Mỡ Đùi Mymi,210.000₫,https://tiki.vn/combo-3-hop-mieng-dan-tan-mo-dui-mymi-p72455148.html?spid=72455149,19,,Đã bán 3,chamsocme
BA LÔ CHO MẸ BỈM SỮA - BA LÔ ĐA NĂNG,94.998₫,https://tiki.vn/ba-lo-cho-me-bim-sua-ba-lo-da-nang-p24539345.html?spid=35955998,20,,Đã bán 2,chamsocme
Áo lót bầu liền bản to ôm bầu ngực ALB06,119.000₫,https://tiki.vn/ao-lot-bau-lien-ban-to-om-bau-nguc-alb06-p91105294.html?spid=91105302,21,,Đã bán 1,chamsocme
"HỘP 30 TÚI TRỮ SỮA CHÍNH HÃNG SANITY CỦA ĐỨC TÚI 2 ZIPPẺ 210ML, KHÔNG CHỨA BPA",179.000₫,https://tiki.vn/hop-30-tui-tru-sua-chinh-hang-sanity-cua-duc-tui-2-zippe-210ml-khong-chua-bpa-p20467654.html?spid=28122820,22,,Đã bán 28,chamsocme
Bộ trắng da mặt và body toàn diện Wonmom ( Serum vitamin C + Kem nghệ tươi + Kem sữa nghệ toàn thân + Scrub café body ),1.000.000₫,https://tiki.vn/bo-trang-da-mat-va-body-toan-dien-wonmom-serum-vitamin-c-kem-nghe-tuoi-kem-sua-nghe-toan-than-scrub-cafe-body-p221251797.html?spid=221251798,23,,,chamsocme
"Đai quấn muối có dây kéo, dùng đựng muối quấn bụng Wonmom ( 200g )",82.650₫,https://tiki.vn/dai-quan-muoi-co-day-keo-dung-dung-muoi-quan-bung-wonmom-200g-p221251734.html?spid=221251735,24,,Đã bán 1,chamsocme
"Bộ trắng da, sạch mụn cao cấp Wonmom ( Sữa rửa mặt + Scrub nghệ + Kem cấp ẩm + Serum mụn + Mặt nạ nghệ + Xông mặt )",1.211.200₫,https://tiki.vn/bo-trang-da-sach-mun-cao-cap-wonmom-sua-rua-mat-scrub-nghe-kem-cap-am-serum-mun-mat-na-nghe-xong-mat-p221251874.html?spid=221251875,25,,,chamsocme
"Bộ sạch mụn, trắng da mặt và body toàn diện Wonmom ( 1 Serum mụn + 1 Kem cấp ẩm + 1 Kem sữa nghệ + 1 Scrub cafe body )",1.000.000₫,https://tiki.vn/bo-sach-mun-trang-da-mat-va-body-toan-dien-wonmom-1-serum-mun-1-kem-cap-am-1-kem-sua-nghe-1-scrub-cafe-body-p221251671.html?spid=221251673,26,,,chamsocme
Quần Lót Giấy 1 gói 5 chiếc (MSP: Đáy Cotton - 2lớp đấy),11.017₫,https://tiki.vn/quan-lot-giay-1-goi-5-chiec-msp-day-cotton-2lop-day-p273479676.html?spid=273479682,27,,,chamsocme
"Quần Lót Mặc Trong Váy Cho Mẹ Bầu Bamboo Light Cạp V, Không Siết Bụng, Co Dãn Tốt - Thương Hiệu Mothersbaby Hàn Quốc",290.000₫,https://tiki.vn/quan-lot-mac-trong-vay-cho-me-bau-bamboo-light-cap-v-khong-siet-bung-co-dan-tot-thuong-hieu-mothersbaby-han-quoc-p272885434.html?spid=272885438,28,,,chamsocme
Áo hút sữa rảnh tay cao cấp xuất xịn 100% cotton điều chỉnh kích cỡ,70.000₫,https://tiki.vn/ao-hut-sua-ranh-tay-cao-cap-xuat-xin-100-cotton-dieu-chinh-kich-co-p73214926.html?spid=272151920,29,,,chamsocme
Quần lót bầu nữ Dv04,46.550₫,https://tiki.vn/quan-lot-bau-nu-dv04-p130546335.html?spid=130546341,30,,,chamsocme
Ống khí dùng cho máy hút sữa Tommee Tippee Made for Me,115.000₫,https://tiki.vn/ong-khi-dung-cho-may-hut-sua-tommee-tippee-made-for-me-p272365029.html?spid=272365032,31,,,chamsocme
Cổ Máy Hút Sữa Điện Tommee Tippee Made For Me,295.000₫,https://tiki.vn/co-may-hut-sua-dien-tommee-tippee-made-for-me-p262681115.html?spid=262681116,32,,,chamsocme
Gối ôm chữ U đă năng cho bà bầu loại mới 2020 (giao màu ngẫu nhiên),155.652₫,https://tiki.vn/goi-om-chu-u-da-nang-cho-ba-bau-loai-moi-2020-giao-mau-ngau-nhien-p56690071.html?spid=142021801,33,,,chamsocme
Màng ngăn sữa Spectra - Phụ kiện thay cho chặn sữa / Protector,39.000₫,https://tiki.vn/mang-ngan-sua-spectra-phu-kien-thay-cho-chan-sua-protector-p196582075.html?spid=196582076,34,,Đã bán 1,chamsocme
Máy hút sữa điện đôi Resonance 5 Fatzbaby FB1180VN (Hồng),1.179.000₫,https://tiki.vn/may-hut-sua-dien-doi-resonance-5-fatzbaby-fb1180vn-hong-p170780085.html?spid=254411381,35,,,chamsocme
Van silicon cho máy hút sữa Freemax 2 Fatz baby FB1202CW,59.000₫,https://tiki.vn/van-silicon-cho-may-hut-sua-freemax-2-fatz-baby-fb1202cw-p242075814.html?spid=255074923,36,,,chamsocme
MÁY HÚT SỮA ĐIỆN RẢNH TAY VÀ KHÔNG DÂY FREEMAX 4 FATZ BABY FB1276RH (1 CHIẾC),1.295.000₫,https://tiki.vn/may-hut-sua-dien-ranh-tay-va-khong-day-freemax-4-fatzbaby-fb1276rh-1-chiec-p202958589.html?spid=255076506,37,,,chamsocme
MÁY HÚT SỮA ĐIỆN ĐÔI SPECTRA 9 PLUS - TẶNG ÁO HÚT SỮA RẢNH TAY,2.895.000₫,https://tiki.vn/may-hut-sua-dien-doi-spectra-9-plus-tang-ao-hut-sua-ranh-tay-p49262906.html?spid=98155806,38,,,chamsocme
Đai quấn muối cho mẹ sau sinh,39.900₫,https://tiki.vn/dai-quan-muoi-giam-mo-sau-sinh-p119932335.html?spid=149495849,39,,Đã bán 3,chamsocme
Van chân không dành cho máy hút sữ Rozabi,25.000₫,https://tiki.vn/van-chan-khong-danh-cho-may-hut-su-rozabi-p11977772.html?spid=11977773,40,,Đã bán 282,chamsocme
