title,price,link_item,index,discount,sales,category
"Bộ 2 Sữa Bột Dinh Dưỡng Meiji Dành Cho Bé Từ 1-3 Tuổi, hỗ trợ tăng cường hấp thụ, sức đề kháng, giúp trẻ phát triển toàn diện",970.000₫,https://tiki.vn/bo-2-sua-bot-dinh-duong-meiji-danh-cho-be-tu-1-3-tuoi-ho-tro-tang-cuong-hap-thu-suc-de-khang-giup-tre-phat-trien-toan-dien-p110208740.html?spid=199913113,1,-14%,Đã bán 13,dinhduongchobe
Sữa Morinaga Số 1 - Hagukumi (850g),490.000₫,https://tiki.vn/sua-morinaga-so-1-hagukumi-850g-p49884584.html?spid=177211141,2,-31%,Đã bán 15,dinhduongchobe
Thùng sữa nước Nutricare Metacare ECO - phát triển toàn diện cho trẻ từ 1 tuổi (180ml x 48 hộp),395.000₫,https://tiki.vn/thung-sua-nuoc-nutricare-metacare-eco-phat-trien-toan-dien-cho-tre-tu-1-tuoi-180ml-x-48-hop-p10907761.html?spid=46254862,3,-28%,Đã bán 90,dinhduongchobe
Thùng sữa nước Nutricare Care 100 Gold - phát triển toàn diện cho trẻ từ 1 tuổi (110ml x 48 hộp),390.000₫,https://tiki.vn/thung-sua-nuoc-nutricare-care-100-gold-phat-trien-toan-dien-cho-tre-tu-1-tuoi-110ml-x-48-hop-p10930965.html?spid=46252921,4,-2%,Đã bán 24,dinhduongchobe
Combo 4 hộp Sữa Morinaga Số 2 Chilmil (850g) và đồ chơi tắm Toys House,1.796.000₫,https://tiki.vn/combo-4-hop-sua-morinaga-so-2-chilmil-850g-va-do-choi-tam-toys-house-p53976386.html?spid=53976387,5,-5%,Đã bán 26,dinhduongchobe
3 Thùng Sữa Bột Pha Sẵn GrowPLUS+ Đỏ 110ml Suy Dinh Dưỡng (48 Hộp x 110ml),1.139.000₫,https://tiki.vn/3-thung-sua-bot-pha-san-growplus-do-110ml-suy-dinh-duong-48-hop-x-110ml-p44922042.html?spid=44922043,6,-6%,Đã bán 6,dinhduongchobe
"Sữa Non ILDong Foodis Choyumeal Plus Số 1, Hàng Nội Địa Hàn Quốc, Hộp 100 Gói Nhỏ - Bổ Sung Kháng Thể Tự Nhiên, Tăng Sức Đề Kháng và Miễn Dịch Giúp Bé Từ Sơ Sinh- 12 Tháng Khỏe Mạnh, Hạn Chế Ốm Vặt",285.000₫,https://tiki.vn/sua-non-ildong-foodis-choyumeal-plus-so-1-ha-ng-no-i-di-a-ha-n-quo-c-hop-100-goi-nho-bo-sung-kha-ng-the-tu-nhien-tang-su-c-de-kha-ng-va-mie-n-di-ch-giu-p-be-tu-so-sinh-12-tha-ng-kho-e-ma-nh-ha-n-che-o-m-va-t-p114436805.html?spid=270963190,7,-2%,Đã bán 1,dinhduongchobe
Sữa Bột A2 Mk7.DHA HiBaby- Phát triển toàn diện,213.796₫,https://tiki.vn/sua-bot-a2-mk7-dha-hibaby-phat-trien-toan-dien-p262450265.html?spid=262450267,8,-17%,,dinhduongchobe
"TPBVSK Special Kid Immunité - Hỗ trợ tăng cường sức đề kháng, hỗ trợ giảm nguy cơ mắc các bệnh do nhiễm khuẩn (125ml)[Siro - Nhập khẩu Pháp]",249.000₫,https://tiki.vn/tpbvsk-special-kid-immunite-ho-tro-tang-cuong-suc-de-khang-ho-tro-giam-nguy-co-mac-cac-benh-do-nhiem-khuan-125ml-siro-nhap-khau-phap-p73633079.html?spid=73633080,9,,Đã bán 41,dinhduongchobe
Combo 2 hộp Sữa Morinaga Số 2 Chilmil (850g) nguyên đai và bộ quần áo Nous 18-24M,949.000₫,https://tiki.vn/combo-2-hop-sua-morinaga-so-2-chilmil-850g-nguyen-dai-va-bo-quan-ao-nous-18-24m-p55954077.html?spid=55954081,10,,Đã bán 21,dinhduongchobe
Combo 2 hộp sữa Morinaga Số 2 Chilmil (850g) và đồ chơi tắm Toys House,897.900₫,https://tiki.vn/combo-2-hop-sua-morinaga-so-2-chilmil-850g-va-do-choi-tam-toys-house-p53976117.html?spid=53976118,11,,Đã bán 31,dinhduongchobe
"Sữa bột Nutricare Care 100 Gold cho trẻ biếng ăn, suy dinh dưỡng 400g",212.073₫,https://tiki.vn/sua-bot-nutricare-care-100-gold-cho-tre-bieng-an-suy-dinh-duong-400g-p199216490.html?spid=199216491,12,,,dinhduongchobe
Sữa bột Vitadairy Colos Gain 1+ 800g từ 1 đến 10 tuổi giúp trẻ tăng cân nhanh+miễn dịch khỏe,354.000₫,https://tiki.vn/sua-bot-vitadairy-colos-gain-1-800g-tu-1-den-10-tuoi-giup-tre-tang-can-nhanh-mien-dich-khoe-p206874479.html?spid=206874484,13,,Đã bán 2,dinhduongchobe
HỘP SỮA BỘT VINAMILK DIELAC ALPHA GOLD IQ 2 900G (CHO TRẺ TỪ 6 - 12 THÁNG TUỔI),365.000₫,https://tiki.vn/hop-sua-bot-vinamilk-dielac-alpha-gold-iq-2-900g-cho-tre-tu-6-12-thang-tuoi-p22747464.html?spid=53082919,14,,Đã bán 22,dinhduongchobe
"Thùng sữa pha sẵn Oramilk GROWPLUS 180ml - Tiêu hoá khoẻ, hấp thu tốt - Phát triển chiều cao, trí não - Dành cho trẻ trên 1 tuổi",585.000₫,https://tiki.vn/thung-sua-pha-san-oramilk-grow-180ml-tieu-hoa-khoe-hap-thu-tot-phat-trien-chieu-cao-tri-nao-danh-cho-tre-tren-1-tuoi-p252167185.html?spid=252167186,15,,,dinhduongchobe
Viên Uống Dầu Cá Nature's Way Omega-3 Fish Oil Trio Giúp Bổ Sung DHA Phát Triển Trí Tuệ Cho Bé 60 Viên,490.000₫,https://tiki.vn/vien-uong-dau-ca-nature-s-way-omega-3-fish-oil-trio-giup-bo-sung-dha-phat-trien-tri-tue-cho-be-60-vien-p124087941.html?spid=124087942,16,,Đã bán 18,dinhduongchobe
"Thực phẩm bảo vệ sức khỏe Dầu cá Omega 3 Kids hỗ trợ tăng cường thị lực, phát triển não bộ ở trẻ (Lọ 60 viên)",113.000₫,https://tiki.vn/thuc-pham-bao-ve-suc-khoe-dau-ca-omega-3-kids-ho-tro-tang-cuong-thi-luc-phat-trien-nao-bo-o-tre-lo-60-vien-p78633138.html?spid=78633139,17,,Đã bán 25,dinhduongchobe
Thùng 48 Hộp Sữa Bột Pha Sẵn VPMilk IQLac Pro Advance Premium (110ml/ Hộp),456.000₫,https://tiki.vn/thung-48-hop-sua-bot-pha-san-vpmilk-iqlac-pro-advance-premium-110ml-hop-p55647864.html?spid=67430781,18,,Đã bán 53,dinhduongchobe
"Viên Uống Milk Calcium Healthy Care Bổ Sung Canxi Cho Trẻ Trên 4 Tháng Tuổi, 60 viên, Hỗ Trợ Phát Triển Xương và Răng Giúp Cao Lớn và Khỏe Mạnh, Bé Hết Khóc Đêm, Rụng Tóc, Tóc Dựng Ngược - Ăn Ngon Ngủ Ngoan",216.600₫,https://tiki.vn/vien-uong-milk-calcium-healthy-care-bo-sung-canxi-cho-tre-tren-4-thang-tuoi-60-vien-ho-tro-pha-t-trie-n-xuong-va-rang-giu-p-cao-lo-n-va-kho-e-ma-nh-be-he-t-kho-c-dem-ru-ng-to-c-to-c-du-ng-nguo-c-an-ngon-ngu-ngoan-p113299654.html?spid=118760199,19,,Đã bán 27,dinhduongchobe
"Dinh dưỡng 100% Trái cây nghiền Organic HiPPiS Dâu rừng, Táo, Đào",60.000₫,https://tiki.vn/dinh-duong-100-trai-cay-nghien-organic-hippis-dau-rung-tao-dao-p95035879.html?spid=95035881,20,,Đã bán 284,dinhduongchobe
"Sữa mát tăng cân, cải thiện biếng ăn và táo bón Babego từ 0 - 12 tháng, 800G",540.000₫,https://tiki.vn/sua-mat-tang-can-cai-thien-bieng-an-va-tao-bon-babego-tu-0-12-thang-800g-p55663617.html?spid=55663618,21,,Đã bán 13,dinhduongchobe
Sữa Meiji nội địa số 0 - 800gr ( 0-1T),539.000₫,https://tiki.vn/sua-meiji-noi-dia-so-0-800gr-p174207561.html?spid=174207562,22,,Đã bán 22,dinhduongchobe
"Bột Ăn Dặm FRUTONANNY Organic Vị Ngũ Cốc Táo Sữa Nho Đen Anh Đào - Không Biến Đổi Gen GMO, Bé Từ 4 Tháng Tuổi (200g)",82.000₫,https://tiki.vn/bot-an-dam-frutonanny-organic-vi-ngu-coc-tao-sua-nho-den-anh-dao-khong-bien-doi-gen-gmo-be-tu-4-thang-tuoi-200g-p215396742.html?spid=215396743,23,,Đã bán 2,dinhduongchobe
Sữa Dê Công Thức DG2 800gr Tặng 1 chiếc túi vải DG xinh xắn,689.000₫,https://tiki.vn/sua-de-cong-thuc-dg-2-goat-milk-follow-on-formula-800gr-p95280846.html?spid=95280847,24,,Đã bán 117,dinhduongchobe
Combo 2 lon Sữa Morinaga số 3 Kodomil 850g - Hương Dâu cho bé từ 3 tuổi trở lên (Không tem),790.000₫,https://tiki.vn/combo-2-lon-sua-morinaga-so-3-kodomil-850g-huong-dau-cho-be-tu-3-tuoi-tro-len-khong-tem-p92145527.html?spid=180576385,25,,Đã bán 5,dinhduongchobe
"Combo 2 hộp Vitamin LineaBon K2 + D3 hỗ trợ chống còi xương, tăng chiều cao cho trẻ sơ sinh và trẻ nhỏ",590.000₫,https://tiki.vn/combo-2-hop-vitamin-lineabon-k2-d3-ho-tro-chong-coi-xuong-tang-chieu-cao-cho-tre-so-sinh-va-tre-nho-p50825857.html?spid=272472186,26,,,dinhduongchobe
"￼CỐM BỔ CANXI Viphar -Bồi dưỡng cơ thể cho trẻ biếng ăn, giúp tăng cường chiều cao",7.000₫,https://tiki.vn/com-bo-canxi-viphar-boi-duong-co-the-cho-tre-bieng-an-giup-tang-cuong-chieu-cao-p263336372.html?spid=263336373,27,,Đã bán 9,dinhduongchobe
BioAmicus Vitamin D3 K2 10ml,330.000₫,https://tiki.vn/bioamicus-vitamin-d3k2-mk7-10ml-p171254452.html?spid=171254453,28,,Đã bán 3,dinhduongchobe
Sữa Bột Friso Gold 2 400g,270.000₫,https://tiki.vn/sua-bot-friso-gold-2-400g-p598355.html?spid=37456450,29,,Đã bán 69,dinhduongchobe
COMBO 3 HỘP SỮA BỘT DIELAC ALPHA 4 900G (CHO TRẺ TỪ 2- 6 TUỔI),685.000₫,https://tiki.vn/combo-3-hop-sua-bot-dielac-alpha-4-900g-cho-tre-tu-2-6-tuoi-p44486305.html?spid=149959657,30,,Đã bán 15,dinhduongchobe
Bột canxi cá tuyết Fine cho trẻ em Nhật Bản (140g),149.940₫,https://tiki.vn/bot-canxi-ca-tuyet-fine-cho-tre-em-nhat-ban-140g-p7256041.html?spid=272892624,31,,Đã bán 1,dinhduongchobe
"Combo 05 Gói Súp Dinh Dưỡng Cây Thị: Nui Thịt Bằm Bí Đỏ, Nui Óc Heo Cà Rốt, Hải Sản Tóc Tiên, Hải Sản Măng Tây, Bắp Cua Hạt Sen",125.000₫,https://tiki.vn/combo-05-goi-sup-dinh-duong-cay-thi-nui-thit-bam-bi-do-nui-oc-heo-ca-rot-hai-san-toc-tien-hai-san-mang-tay-bap-cua-hat-sen-p196205339.html?spid=196205340,32,,Đã bán 21,dinhduongchobe
Sữa bột Nutricare ColosCare 0+ - sữa non tăng cường miễn dịch (800g),420.000₫,https://tiki.vn/sua-bot-nutricare-coloscare-0-sua-non-tang-cuong-mien-dich-800g-p53756902.html?spid=54509425,33,,Đã bán 54,dinhduongchobe
Combo 3 lon Sữa bột công thức HiPP 1 Organic Combiotic 350g,1.005.000₫,https://tiki.vn/sua-bot-cong-thuc-hipp-1-organic-combiotic-350g-p93828004.html?spid=93828005,34,,Đã bán 2,dinhduongchobe
"Imukids giúp trẻ ăn ngon, tăng đề kháng - hộp 30 ống",165.000₫,https://tiki.vn/imukids-giup-tre-an-ngon-tang-de-khang-hop-30-ong-p225914375.html?spid=225914376,35,,,dinhduongchobe
Bột ăn dặm tốt cho bé Nutricare Metacare Gạo sữa dinh dưỡng & olive Special (200g),57.000₫,https://tiki.vn/bot-an-dam-tot-cho-be-nutricare-metacare-gao-sua-dinh-duong-olive-special-200g-p112229034.html?spid=112229035,36,,Đã bán 96,dinhduongchobe
[Mua 11 lốc tặng 1] Sữa nước Nutricare Metacare ECO phát triển toàn diện (180ml),410.388₫,https://tiki.vn/sua-nuoc-nutricare-metacare-eco-phat-trien-toan-dien-180ml-p199053561.html?spid=199053562,37,,Đã bán 3,dinhduongchobe
Sữa Bột Bellamy's Organic Số 2 (900g),850.000₫,https://tiki.vn/sua-bot-bellamy-s-organic-so-2-900g-p35236673.html?spid=99718400,38,,Đã bán 11,dinhduongchobe
"HỘP SỮA BỘT VINAMILK DIELAC ALPHA GOLD IQ 4 ̣(1,5KG) (CHO TRẺ TỪ 2- 6 TUỔI)",460.000₫,https://tiki.vn/hop-sua-bot-vinamilk-dielac-alpha-gold-iq-4-1-5kg-cho-tre-tu-2-6-tuoi-p22764836.html?spid=54041041,39,,Đã bán 35,dinhduongchobe
Sữa bột Vinamilk Optimum Gold Step 3 Hộp Thiếc 1450g,699.000₫,https://tiki.vn/sua-bot-vinamilk-optimum-gold-step-3-hop-thiec-1450g-p76121711.html?spid=187354287,40,,Đã bán 1,dinhduongchobe
