title,price,link_item,index,discount,sales,category
Áo thun lót trắng nam loại đẹp cổ tròn,30.000₫,https://tiki.vn/ao-thun-lot-trang-nam-loai-dep-p217146525.html?spid=217146545,1,-29%,Đã bán 25,aothun
Áo Thun Cá Sấu Sọc Cao Cấp VIỆT PHÁP / Form Suông- Chất liệu cotton co dãn và thấm hút mồ hôi tốt 8803,369.000₫,https://tiki.vn/ao-thun-ca-sau-soc-cao-cap-viet-phap-form-suong-chat-lieu-cotton-co-dan-va-tham-hut-mo-hoi-tot-8803-p272940872.html?spid=272940874,2,-44%,,aothun
"Áo thun polo thời trang nam thanh lịch, style trẻ trung, phù hợp mọi lứa tuổi - FORMEN SHOP - FMPS174",139.000₫,https://tiki.vn/ao-thun-polo-thoi-trang-nam-thanh-lich-style-tre-trung-phu-hop-moi-lua-tuoi-formen-shop-fmps174-p161979053.html?spid=161979075,3,,Đã bán 9,aothun
Áo thun dài tay nam cổ bẻ màu xanh đen ALIGRO chất liệu Cotton cao cấp mềm nhẹ ALGAPD004,205.000,https://tiki.vn/ao-phong-dai-tay-algapd004-ol-p146632694.html?spid=146632696,4,-33%,,aothun
,,https://tiki.vn/ao-tanktop-tap-gym-nam-do-gym-shop-chat-thun-cotton-thoang-mat-khi-choi-the-thao-mac-nha-p270252562.html?spid=270252574,5,-40%,,aothun
Áo Thun Free Fire Cổ Tròn Màu Trắng logo Rank Huyền Thoại Cực Chất,82.000₫,https://tiki.vn/ao-thun-free-fire-co-tron-mau-trang-logo-rank-huyen-thoai-cuc-chat-p71344731.html?spid=71344733,6,-31%,Đã bán 22,aothun
ÁO THUN UNISEX NAM NỮ saigonese tôi la người sài gòn,155.000₫,https://tiki.vn/ao-thun-unisex-nam-nu-saigonese-toi-la-nguoi-sai-gon-p248670637.html?spid=248670796,7,,,aothun
Áo Thun Nam Cổ Polo Phối Màu Viền VTC,125.000₫,https://tiki.vn/ao-thun-nam-co-polo-phoi-mau-vien-vtc-p105951051.html?spid=105951842,8,,Đã bán 8,aothun
"Khi 2 ta về chung 1 nhà, mã LV1. Áo thun cặp đôi tình yêu siêu đẹp. Áo phông chụp ảnh cưới",99.000₫,https://tiki.vn/khi-2-ta-ve-chung-1-nha-ma-lv1-ao-thun-cap-doi-tinh-yeu-sieu-dep-ao-phong-chup-anh-cuoi-p205991477.html?spid=205991942,9,-36%,,aothun
,,https://tiki.vn/ao-thun-wash-nhat-ban-thuong-hieu-goking-khong-dung-hang-cho-nam-nu-ao-cap-doi-sieu-dep-p61393910.html?spid=61393912,10,-24%,,aothun
"Áo thun nam cổ bẻ vải cá sấu, Combo 2 áo – EZ232",179.000₫,https://tiki.vn/ao-thun-nam-co-be-vai-ca-sau-combo-2-ao-ez232-p22492016.html?spid=22492018,11,,Đã bán 6,aothun
Áo thun UNDER Sài Gòn - Saigonese Tee - UTS006,180.000,https://tiki.vn/ao-thun-under-sai-gon-saigonese-tee-uts006-p181916038.html?spid=181916045,12,,,aothun
,,https://tiki.vn/ao-thun-teeworld-outer-space-t-shirt-form-rong-unisex-nam-nu-p98642493.html?spid=98642509,13,-37%,,aothun
Áo thun nam nữ chibi hoạt hình form rộng vải dày mịn 2020T2804,24.900₫,https://tiki.vn/ao-thun-nam-nu-chibi-hoat-hinh-form-rong-vai-day-min-2020t2804-p190365990.html?spid=190366157,14,,,aothun
Áo thun nam nữ tay lỡ Los angeles vải dày mịn 20T2757,24.900₫,https://tiki.vn/ao-thun-nam-nu-tay-lo-los-angeles-vai-day-min-20t2757-p190440137.html?spid=190441796,15,,Đã bán 1,aothun
Áo thun tay ngắn thời trang unisex Fila Beach Party Oversize F Box - FW2RSF1003X-CBL,537.000₫,https://tiki.vn/ao-thun-tay-ngan-thoi-trang-unisex-fila-beach-party-oversize-f-box-fw2rsf1003x-cbl-p251788796.html?spid=251788808,16,,,aothun
Áo Thun Polo Tay Ngắn Valentino Creations - VSSP-23041-C-BL8,5.990.000,https://tiki.vn/ao-thun-polo-tay-ngan-valentino-creations-vssp-23041-c-bl8-p270527157.html?spid=270527159,17,,,aothun
,,https://tiki.vn/ao-thun-cao-cap-voi-hoa-tiet-chu-dinh-hat-ben-chac-p42866400.html?spid=42866406,18,,,aothun
Áo Kangol T-Shirt 6325102531,700.000₫,https://tiki.vn/ao-kangol-t-shirt-6325102531-p253617529.html?spid=253617535,19,,,aothun
Áo Thun Nam Cổ Polo Phối Viền Logo Đẹp,105.000₫,https://tiki.vn/ao-thun-nam-co-polo-phoi-vien-logo-dep-p57983963.html?spid=85378454,20,,Đã bán 2,aothun
Áo Thun Dệt Kim Cao Cấp VIỆT PHÁP / Form Suông - chất liệu cotton co dãn và thấm hút mồ hôi tốt 35810,329.000₫,https://tiki.vn/ao-thun-det-kim-cao-cap-viet-phap-form-suong-chat-lieu-cotton-co-dan-va-tham-hut-mo-hoi-tot-35810-p270992650.html?spid=270992692,21,,,aothun
Áo thun trơn ️️ nam form rộng phong cách hàn quốc vải poly cotton mịn MÀU XÁM aothunphong,11.000₫,https://tiki.vn/ao-thun-tron-freeship-nam-form-rong-phong-cach-han-quoc-vai-poly-cotton-min-mau-xam-aothunphong-p97861148.html?spid=115783342,22,,Đã bán 15,aothun
Áo thun nam tay dài - hàng VNXK,125.000₫,https://tiki.vn/ao-thun-nam-tay-dai-hang-vnxk-p147665110.html?spid=197186116,23,,,aothun
Viettien - Áo thun nam có cổ màu trắng 6R3270 phom regular thoải mái - Áo thun nam polo cao cấp Việt Tiến chất liệu cotton mịn mượt thoáng mát,580.000₫,https://tiki.vn/viettien-ao-thun-nam-co-co-mau-trang-6r3270-phom-regular-thoai-mai-ao-thun-nam-polo-cao-cap-viet-tien-chat-lieu-cotton-min-muot-thoang-mat-p195773481.html?spid=195773485,24,,,aothun
Quần Áo bigsize - Áo thun nam in họa tiết - ÁO Thun RộNg,76.000₫,https://tiki.vn/quan-ao-bigsize-ao-thun-nam-in-hoa-tiet-a-o-thun-ro-ng-p167183988.html?spid=167184003,25,,Đã bán 2,aothun
,,https://tiki.vn/ao-thun-cao-cap-day-ca-tinh-p45736156.html?spid=45736158,26,,,aothun
Aó cổ lọ nam TY13,175.000₫,https://tiki.vn/ao-co-lo-nam-ty13-p4138447.html?spid=122962392,27,,,aothun
"Áo phông Overisze Universe, JACKLANE, Áo cộc tay Unisex Jack Lane",160.000₫,https://tiki.vn/ao-phong-overisze-universe-jacklane-ao-coc-tay-unisex-jack-lane-p160517454.html?spid=160517671,28,,,aothun
Áo thun tay dài nam loại tốt,249.000₫,https://tiki.vn/ao-thun-tay-dai-nam-loai-tot-p196726698.html?spid=196726700,29,,,aothun
"Áo thun nam cao cấp dài tay cổ tim vải cotton dáng ôm đơn giản, sang trọng, lịch lãm ( Ảnh thật )",95.880₫,https://tiki.vn/ao-thun-nam-cao-cap-dai-tay-co-tim-vai-cotton-dang-om-don-gian-sang-trong-lich-lam-anh-that-p192217752.html?spid=192220128,30,,,aothun
,,https://tiki.vn/owen-ao-polo-nam-ngan-tay-owen-chat-thun-lanh-ao-thun-nam-ngan-tay-co-co-p240891633.html?spid=240891638,31,,,aothun
Áo Thể Thao Nam TSIMPLE cổ tròn tay ngắn tập gym vải thun lạnh thoáng mát co giãn chuẩn form MSSAHP7,95.000₫,https://tiki.vn/mua-1-tang-1-ao-the-thao-nam-tsimple-co-tron-tay-ngan-tap-gym-vai-thun-lanh-thoang-mat-co-gian-chuan-form-mssahp7-p205224186.html?spid=205224190,32,,Đã bán 63,aothun
"Combo 2 Áo Thun 3 Lỗ Nam Body, Sợi Cotton Mềm Mịn Siêu Thoáng Mát, Thấm Hút Mồ Hôi Cực Tốt, Co Giãn 4 Chiều MRM FASHION Cùng Màu",189.000₫,https://tiki.vn/combo-2-ao-ba-lo-nam-ao-lot-nam-cao-cap-mrm-fashion-cung-mau-p43333515.html?spid=68356288,33,,Đã bán 166,aothun
"Move fast and break things, mã G96. Áo thun nam nữ in chữ siêu đẹp. Áo phông GOKING hàng hiệu, quà tặng cao cấp cho gia đình, cặp đôi, hội nhóm, doanh nghiệp",69.000₫,https://tiki.vn/move-fast-and-break-things-ma-g96-ao-thun-nam-nu-in-sieu-dep-ao-phong-thoat-nhiet-goking-hang-hieu-cao-cap-p164311146.html?spid=252665842,34,,Đã bán 24,aothun
"Áo thun nam cổ tròn chất vải cotton 4 chiều định lượng cao xuất xịn, mát mẻ, dày mịn sang trọng - ZAVAS",169.000,https://tiki.vn/ao-thun-nam-co-tron-chat-vai-cotton-4-chieu-dinh-luong-cao-xuat-xin-mat-me-day-min-sang-trong-zavas-p273400176.html?spid=273400180,35,,,aothun
,,https://tiki.vn/ao-thun-cotton-lanh-cao-cap-viet-phap-form-luxury-thoang-mat-co-dan-tot-chat-lieu-cotton-mem-min-tham-hut-mo-hoi-tot-34334-p272855120.html?spid=272855146,36,,,aothun
"Áo thun POLO nam, Áo thun cá sấu có cổ bẻ kẻ sọc ngang big size 3xl TRẺ TRUNG cao cấp PL16",155.000₫,https://tiki.vn/ao-thun-polo-nam-ao-thun-ca-sau-co-co-be-ke-soc-ngang-big-size-3xl-tre-trung-cao-cap-pl16-p216205156.html?spid=216205158,37,,,aothun
Áo thun unisex tay lỡ form rộng - phông thêu 4 logo,79.000₫,https://tiki.vn/co-anh-that-ao-thun-unisex-tay-lo-form-rong-phong-theu-4-logo-p74493882.html?spid=74493890,38,,Đã bán 113,aothun
Áo Thun Nam Thái Lan - 22A,270.000₫,https://tiki.vn/ao-thun-nam-thai-lan-22a-p204042378.html?spid=204042384,39,,,aothun
ÁO PHÔNG BÓNG RỔ 11,65.000₫,https://tiki.vn/ao-phong-bong-ro-11-p171684763.html?spid=171684792,40,,,aothun
