title,price,link_item,index,discount,sales,category
Áo Thun Nam có túi form suông Khatoco A2MN438R2-VNCR216-2411-N,363.540₫,https://tiki.vn/ao-thun-nam-co-tui-form-suong-khatoco-a2mn438r2-vncr216-2411-n-p268736387.html?spid=268736389,1,-17%,,aothun
"Áo thun cổ bẻ nam phối màu trẻ trung, chất thun mềm mịn thoải mái hoạt động - FORMEN SHOP - FMPS162",159.000₫,https://tiki.vn/ao-thun-co-be-nam-phoi-mau-tre-trung-chat-thun-mem-min-thoai-mai-hoat-dong-formen-shop-fmps162-p146360819.html?spid=146360821,2,-36%,Đã bán 4,aothun
Áo Thun DirtyCoins Casual T-shirt,199.000₫,https://tiki.vn/a-o-thun-dirtycoins-casual-t-shirt-p271760820.html?spid=271760828,3,-26%,Đã bán 1,aothun
Áo thun tay lỡ form rộng unisex THE BAD GOD chất lượng,98.000₫,https://tiki.vn/ao-thun-tay-lo-form-rong-unisex-the-bad-god-chat-luong-p197686514.html?spid=197686518,4,,,aothun
,,https://tiki.vn/never-say-lose-ma-g43-ao-thun-nam-nu-sieu-dep-ao-phong-thoat-nhiet-goking-hang-hieu-p164251213.html?spid=164252000,5,,,aothun
"[MUA 1 TẶNG 1] AO THỂ THAO AVP04NEW VINA AUTHENTIC CAO CẤP, CO GIẢN, DỄ HOẠT ĐỘNG, THẤM HÚT MỒ HÔI, HỢP THỜI TRANG",10.000₫,https://tiki.vn/mua-1-tang-1-ao-the-thao-avp04new-vina-authentic-cao-cap-co-gian-de-hoat-dong-tham-hut-mo-hoi-hop-thoi-trang-p252401548.html?spid=253189441,6,-20%,,aothun
Áo Thun Nam Cổ Bẻ Viền Tay Thời Trang Poniva,157.000₫,https://tiki.vn/ao-thun-nam-co-be-vien-tay-thoi-trang-poniva-p83161336.html?spid=83161706,7,,Đã bán 16,aothun
"Áo Thun Tay Dài Nam Nữ Form Rộng Cổ Tròn Đủ 5 Màu Basic Đen, Trắng, Xanh, Hồng Chất Phông Cao Cấp Unisex GUF",83.000₫,https://tiki.vn/ao-thun-tay-dai-nam-nu-form-rong-co-tron-du-5-mau-basic-den-trang-xanh-hong-chat-phong-cao-cap-unisex-guf-p75637055.html?spid=78019860,8,-50%,Đã bán 25,aothun
"Áo Thun Dài Tay Unisex nam nữ form rộng Oversize, Sweater chất nỉ da cá cao cấp trơn basic, GENZ, Thương hiệu Việt",99.000₫,https://tiki.vn/ao-thun-dai-tay-unisex-nam-nu-form-rong-oversize-sweater-chat-ni-da-ca-cao-cap-tron-basic-genz-thuong-hieu-viet-p170270037.html?spid=170270049,9,-5%,,aothun
,,https://tiki.vn/ao-thun-cotton-in-cao-cap-viet-phap-form-luxury-thoang-mat-co-dan-tot-chat-lieu-cotton-mem-min-tham-hut-mo-hoi-34564-p272857275.html?spid=272857313,10,-45%,,aothun
Áo Thun Ba Lỗ Nam Phong Cách Hàn Nhiều Màu,84.000₫,https://tiki.vn/ao-thun-ba-lo-nam-phong-cach-han-nhieu-mau-p78544461.html?spid=78544467,11,-11%,Đã bán 36,aothun
Áo Phông Nam có cổ tay ngắn mẫu đẹp chất vải thun Cotton 100% - ATN0510,79.000₫,https://tiki.vn/ao-phong-nam-co-co-tay-ngan-mau-dep-chat-vai-thun-cotton-100-atn0510-p136150696.html?spid=247863591,12,,Đã bán 2,aothun
,,https://tiki.vn/hot-trend-ao-giu-nhiet-nam-dai-tay-ao-thu-dong-cho-nam-co-3-cm-hang-cao-cap-p213714401.html?spid=273041645,13,,,aothun
Áo Thun Ba Lỗ Nam Khatoco A4MN170R2-VNMA004-2407-N,136.000₫,https://tiki.vn/ao-thun-ba-lo-nam-khatoco-a4mn170r2-vnma004-2407-n-p243044570.html?spid=243044578,14,,Đã bán 1,aothun
Áo Đồng Phục Quán Cafe Mẫu Đẹp - Áo Cá Sấu Đen Trơn Phối Màu,87.000₫,https://tiki.vn/ao-dong-phuc-quan-cafe-mau-den-phoi-mau-p70283045.html?spid=70283085,15,,Đã bán 4,aothun
Áo Thun Ngắn Tay Cổ Tròn Trơn người lớn và trẻ em,49.000₫,https://tiki.vn/ao-thun-ngan-tay-co-tron-tron-nguoi-lon-va-tre-em-p184822412.html?spid=184824235,16,,Đã bán 21,aothun
"Quần Áo Bảo Vệ, Đồng Phục Bảo Vệ BV01, BV02, BV03",120.000,https://tiki.vn/quan-ao-bao-ve-dong-phuc-bao-ve-bv01-bv02-bv03-p196374826.html?spid=196374914,17,,,aothun
,,https://tiki.vn/bst-dac-biet-biti-s-x-kiey-ao-thun-cotton-biti-s-kiey-unisex-universe-t-shirt-bou000100trg-trang-p217482745.html?spid=217482749,18,,,aothun
Áo thun polo nam Columbia Utilizer - 1772051010,445.000₫,https://tiki.vn/ao-thun-polo-nam-columbia-utilizer-1772051010-p271236825.html?spid=271236831,19,,,aothun
Áo phông trắng nam cổ tròn,26.000₫,https://tiki.vn/ao-phong-trang-nam-co-tron-p116775291.html?spid=116775303,20,,Đã bán 13,aothun
Áo Polo Nam Trung Niên Có Túi -Áo polo Nam Bước Sọc Lich Lãm Cổ Có viền phối bắt mắt . Không Đẹp Hoàn Tiền,188.000₫,https://tiki.vn/ao-polo-nam-trung-nien-co-tui-ao-polo-nam-buoc-soc-lich-lam-co-co-vien-phoi-bat-mat-khong-dep-hoan-tien-p99933331.html?spid=99935073,21,,,aothun
[BST đặc biệt BITI'S X KIEY] Áo Thun Cotton Biti's Kiey Unisex Teal Ocean T-Shirt BOU000900XLC (Xanh Lá Cây) - XL 57->63 kg,354.000₫,https://tiki.vn/bst-dac-biet-biti-s-x-kiey-ao-thun-cotton-biti-s-kiey-unisex-teal-ocean-t-shirt-bou000900xlc-xanh-la-cay-p217513516.html?spid=217513524,22,,,aothun
Áo polo nam cổ bẻ trơn 4 màu cá tính chất cá sấu cao cấp APL01 Micado,55.000₫,https://tiki.vn/ao-polo-nam-co-be-tron-4-mau-ca-tinh-chat-ca-sau-cao-cap-apl01-micado-p169327817.html?spid=169327906,23,,Đã bán 2,aothun
Áo Thun Ba Lỗ Nam Tập Thể Thao,129.000₫,https://tiki.vn/ao-thun-ba-lo-nam-tap-the-thao-p173092703.html?spid=173092755,24,,Đã bán 1,aothun
Áo thun phông rộng tay ngắn LADOS - 9079 in họa tiết đơn giản phù hợp cho cả nam và nữ,179.000,https://tiki.vn/ao-thun-phong-rong-tay-ngan-lados-9079-in-hoa-tiet-don-gian-phu-hop-cho-ca-nam-va-nu-p172307358.html?spid=172307381,25,,,aothun
,,https://tiki.vn/dau-cung-duoc-mien-la-di-cung-nhau-ma-lv5-ao-thun-cap-doi-in-hinh-sieu-dep-ao-phong-thoat-nhiet-goking-hang-hieu-cao-cap-p205991982.html?spid=205992038,26,,,aothun
Áo phông Cộng Boo Thần thái Gen Z,399.000₫,https://tiki.vn/ao-phong-cong-boo-than-thai-gen-z-p161310337.html?spid=161310374,27,,,aothun
"Áo thun polo nam, áo thun cá sấu nam hoạ tiết caro có cổ bẻ trẻ trung CB04",155.000₫,https://tiki.vn/ao-thun-polo-nam-ao-thun-ca-sau-nam-hoa-tiet-caro-co-co-be-tre-trung-cb04-p263028120.html?spid=263028126,28,,,aothun
"NEW DOORS, mã G33. Áo thun hàng hiệu Goking, form unisex cho nam nữ, trẻ em, bé trai gái. Áo phông in đẹp, quà tặng cao cấp cho gia đình, cặp đôi, doanh nghiệp, hội nhóm",69.000₫,https://tiki.vn/old-ways-won-t-open-new-doors-ma-g33-ao-thun-nam-nu-sieu-dep-p164083115.html?spid=249092821,29,,Đã bán 27,aothun
"Áo thun nam cổ tròn tay ngắn, chất thun cao cấp, trẻ trung, năng động – FORMEN SHOP – FMPS101",149.000,https://tiki.vn/ao-thun-nam-co-tron-tay-ngan--chat-thun-cao-cap--tre-trung--nang-dong---formen-shop---fmps101-p48636494.html?spid=48636518,30,,,aothun
,,https://tiki.vn/ao-thun-nam-tay-lo-cotton-phong-unisex-phong-cach-ulzzang-h1002-p177055375.html?spid=177055391,31,,,aothun
Áo thun nam form ôm body sang trọng lịch lãm 2 màu đen trắng dễ phối đồ H73,199.000₫,https://tiki.vn/ao-thun-nam-form-om-body-sang-trong-lich-lam-2-mau-den-trang-de-phoi-do-h73-p263296872.html?spid=263296878,32,,,aothun
Áo thun 3d - Áo thun polo big size - Các kiểu Áo thun cho người mập nam,73.000₫,https://tiki.vn/ao-thun-3d-ao-thun-polo-big-size-cac-kieu-ao-thun-cho-nguoi-map-nam-p98655711.html?spid=98656126,33,,Đã bán 40,aothun
ÁO THUN NAM DÀI TAY NỈ DA CÁ PHỐI MÀU,297.700₫,https://tiki.vn/ao-thun-nam-dai-tay-ni-da-ca-phoi-mau-p83517309.html?spid=83517393,34,,Đã bán 7,aothun
Áo Polo Teeworld Bến Thành Market Unisex Nam Nữ Form Rộng,318.000,https://tiki.vn/ao-polo-teeworld-ben-thanh-market-unisex-nam-nu-form-rong-p212427576.html?spid=199167529,35,,Đã bán 3,aothun
,,https://tiki.vn/ao-thun-nam-cotton-spandex-cao-cap-co-tron-co-gian-4-chieu-tham-hut-kho-thoang-regular-fit-thuong-hieu-viet-badbird-p170488436.html?spid=170488450,36,,,aothun
Áo thun Polo nam Novelty 200022N,269.000₫,https://tiki.vn/ao-thun-polo-nam-novelty-200022n-p76688255.html?spid=76688257,37,,Đã bán 2,aothun
Áo thun nam tay dài thời trang Hàn Quốc MT-01,75.000₫,https://tiki.vn/ao-thun-nam-tay-dai-thoi-trang-han-quoc-mt-01-p14838760.html?spid=56105427,38,,Đã bán 114,aothun
Áo phông nam nữ unisex tay lỡ thun form rộng teen cổ tròn oversize cotton giá rẻ basic đen trắng tee pull MAGMANS,55.000₫,https://tiki.vn/ao-phong-nam-nu-unisex-tay-lo-thun-form-rong-teen-co-tron-oversize-cotton-gia-re-basic-den-trang-tee-pull-magmans-p117919594.html?spid=193110742,39,,Đã bán 6,aothun
Áo Thun Nam Polo Có Cổ Tay Ngắn Cao Cấp ZERO 5 Màu Hàn Quốc,189.000,https://tiki.vn/ao-thun-nam-polo-co-co-tay-ngan-cao-cap-zero-5-mau-han-quoc-p105297516.html?spid=105297544,40,,,aothun
