title,price,link_item,index,discount,sales,category
"Áo phông nam, áo thun nam cộc tay Denimii 8293",150.000₫,https://tiki.vn/ao-phong-nam-ao-thun-nam-coc-tay-denimii-8293-p97555213.html?spid=97555222,1,,,aothun
ÁO THUN NAM,300.000₫,https://tiki.vn/ao-thun-nam-nhap-khau-thuong-hieu-everlast-p60787236.html?spid=60787240,2,,,aothun
"Áo Thun Nam Ngắn Tay Tổ Ong Cổ Tròn, Áo Cộc Tay Nam Form Rộng Đẹp Cao cấp AT08 - MINHSTORE",74.000₫,https://tiki.vn/ao-thun-nam-ngan-tay-to-ong-co-tron-ao-coc-tay-nam-form-rong-dep-cao-cap-at08-minhstore-p249698274.html?spid=249698290,3,-17%,,aothun
Áo Thun Marshall Vintage - Chính Hãng,600.000,https://tiki.vn/ao-thun-marshall-vintage-chinh-hang-p140423348.html?spid=140423350,4,-46%,,aothun
,,https://tiki.vn/ao-thun-nam-cao-cap-chat-vai-thun-lanh-cao-cap-xuong-may-p72168876.html?spid=196003372,5,-10%,,aothun
Áo T-SHIRT Cổ Chữ V Dài Tay Henley_Raglan Casual T-Shirt_Phong cách thể thao đơn giản_Hàng US chất lượng cao_ZIMEGO,599.000₫,https://tiki.vn/ao-t-shirt-dai-tay_phong-cach-the-thao-don-gian_hang-us-chat-luong-cao_zimego-p271211555.html?spid=271211557,6,,,aothun
áo polo nam,75.000₫,https://tiki.vn/ao-polo-nam-p263484444.html?spid=263484460,7,,,aothun
ÁO THUN KIỂU NAM VẢI COTTON ÁO THUN NAM CỔ TRÒN PHỐI MÀU,66.000₫,https://tiki.vn/ao-thun-kieu-nam-vai-cotton-ao-thun-nam-co-tron-phoi-mau-p207308427.html?spid=207308563,8,,,aothun
Áo Thun Polo Tay Dài Valentino Creations - VLST-22008-A-BL8,5.590.000,https://tiki.vn/ao-thun-polo-tay-dai-valentino-creations-vlst-22008-a-bl8-p273295440.html?spid=273295442,9,,,aothun
,,https://tiki.vn/ao-thun-co-tron-nam-fm-pack-m-m-chat-cotton-cao-cap-formen-shop-fmps230-p273374566.html?spid=273374576,10,,,aothun
"Lục sắc, mã Goking1. Áo thun hàng hiệu cao cấp cho nam nữ, form unisex. Áo phông cho teen và trung niên, thời trang hiện đại",69.000₫,https://tiki.vn/goking-luc-sac-ma-goking1-ao-thun-thoat-nhiet-nam-nu-tre-em-ao-phong-hang-hieu-cao-cap-p160884282.html?spid=252711397,11,,Đã bán 11,aothun
"Áo thun nam cổ tròn SUNDAY chất vải cotton 4 chiều xuất xịn, mát mẻ, dày mịn sang trọng - ZAVAS",169.000,https://tiki.vn/ao-thun-nam-co-tron-sunday-chat-vai-cotton-4-chieu-xuat-xin-mat-me-day-min-sang-trong-zavas-p273399284.html?spid=273399290,12,,,aothun
,,https://tiki.vn/ao-ba-lo-tap-gym-nam-day-nho-khong-vien-gasp-om-sat-co-the-ton-len-duoc-ve-dep-nam-tinh-day-quyen-ru-p272238015.html?spid=272238021,13,,,aothun
"Áo polo nam ngắn tay, chất thun poly cực mát, co giãn tốt, họa tiết bo phối đường kẻ lạ mắt - FORMENSHOP - FMPS193",350.000₫,https://tiki.vn/ao-polo-nam-ngan-tay-chat-thun-poly-cuc-mat-co-gian-tot-hoa-tiet-bo-phoi-duong-ke-la-mat-formenshop-fmps193-p196296710.html?spid=196296715,14,,Đã bán 1,aothun
ÁO THUN NAM THỜI TRANG HỌA TIẾT NỔI CỰC ĐẸP - FMPS119,180.000₫,https://tiki.vn/ao-thun-nam-thoi-trang-hoa-tiet-noi-cuc-dep-fmps119-p57152763.html?spid=57152783,15,,Đã bán 3,aothun
Áo thun nam Áo thun nam cổ bẻ phối màu xanh đen mẫu FV01 Thời trang nam cá tính,105.000₫,https://tiki.vn/ao-thun-nam-freeship-ao-thun-nam-co-be-phoi-mau-xanh-den-mau-fv01-thoi-trang-nam-ca-tinh-p111709607.html?spid=111709659,16,,Đã bán 1,aothun
Áo Thun Tay Lỡ In Basic Tee,122.200,https://tiki.vn/ao-thun-tay-lo-in-basic-tee-p84377023.html?spid=84377059,17,,,aothun
,,https://tiki.vn/ao-thun-nam-nu-big-size-cotton-luffy-mac-do-tau-rong-p174163242.html?spid=174163270,18,,,aothun
ÁO THUN NAM NỮ (BIG SIZE) cho cool bị còng tay,155.000₫,https://tiki.vn/ao-thun-nam-nu-big-size-cho-cool-bi-cong-tay-p248659714.html?spid=248659762,19,,Đã bán 1,aothun
Áo Thun Tay Lỡ In Sirdrock,122.200₫,https://tiki.vn/ao-thun-tay-lo-in-sirdrock-p84377056.html?spid=84377103,20,,,aothun
"Áo thun cổ tròn cotton NASA SPACE tay lỡ chất mát ( Đen, Trắng )",69.000₫,https://tiki.vn/ao-thun-co-tron-cotton-nasa-space-tay-lo-chat-mat-den-trang-p82746035.html?spid=82746946,21,,,aothun
"Áo thun nam cộc tay chất liệu Cotton siêu mịn, siêu xịn, phối màu đẳng cáp, sành điệu H71",199.000₫,https://tiki.vn/ao-thun-nam-coc-tay-chat-lieu-cotton-sieu-min-sieu-xin-phoi-mau-dang-cap-sanh-dieu-h71-p263369696.html?spid=263369705,22,,,aothun
"Áo Sweater Nam Nữ Cổ Bẻ Khóa Kéo Odiclub Vải Nỉ Bông Dày Dặn Mềm Mịn 2 Màu, Áo chui đầu hoodie Polo oversize Odin Club ODC, Áo thun tay dài có cổ form rộng nam nữ Local Brand",137.000₫,https://tiki.vn/ao-sweater-nam-nu-co-be-khoa-keo-odiclub-vai-ni-bong-day-dan-mem-min-2-mau-ao-chui-dau-hoodie-polo-oversize-odin-club-odc-ao-thun-tay-dai-co-co-form-rong-nam-nu-local-brand-p272620419.html?spid=272620427,23,,,aothun
"JAPAN, mã G55. Áo thun nam nữ siêu đẹp. Áo phông thoát nhiệt Goking hàng hiệu",168.000₫,https://tiki.vn/japan-ma-g55-ao-thun-nam-nu-sieu-dep-ao-phong-thoat-nhiet-goking-hang-hieu-p158893978.html?spid=158893998,24,,Đã bán 5,aothun
Áo thun polo nữ dệt kim tay ngắn cổ bẻ thời trang Hàn Quốc Hàn Quốc 2021 New Arival,99.000₫,https://tiki.vn/ao-thun-polo-nu-det-kim-tay-ngan-co-be-thoi-trang-han-quoc-han-quoc-2021-new-arival-p184829332.html?spid=184829334,25,,,aothun
,,https://tiki.vn/qua-n-short-kaki-du-ma-u-big-size-nam-to-i-130kg-p179163608.html?spid=179165713,26,,,aothun
ÁO POLO NAM TAY NGẮN PHỐI MÀU CỔ FORM FITTED - 10F22POL023R1 | LASTORE MENSWEAR,480.000₫,https://tiki.vn/ao-polo-nam-tay-ngan-phoi-mau-co-form-fitted-10f22pol023r1-lastore-menswear-p217740955.html?spid=217740965,27,,,aothun
"Áo ba lỗ tập gym nam Body engineers vạt chéo/Kiểu dáng bắt mắt, mới nhất",220.000₫,https://tiki.vn/ao-ba-lo-tap-gym-nam-body-engineers-vat-cheo-kieu-dang-bat-mat-moi-nhat-p272219174.html?spid=272219178,28,,,aothun
"Áo thun Pikachu cosplay Jinbe dễ thương cho nam nữ teen trẻ em, mã PK7. Áo phông Anime hàng hiệu Goking cao cấp",69.000₫,https://tiki.vn/ao-thun-pikachu-cosplay-jinbe-de-thuong-cho-nam-nu-teen-tre-em-ma-pk7-ao-phong-anime-hang-hieu-goking-cao-cap-p273437587.html?spid=273437611,29,,,aothun
Áo thun polo big size họa tiết hoa lá đến,250.000,https://tiki.vn/ao-thun-polo-big-size-hoa-tiet-hoa-la-den-p206255619.html?spid=206255622,30,,Đã bán 1,aothun
,,https://tiki.vn/ao-thun-ngan-tay-spf-co-tui-nguc-vo-cung-tien-loi-p195698776.html?spid=195698782,31,,,aothun
Bộ Quần Áo Thun Nam Nữ Thiết Kế FEAR Chất Liệu Cottom Cao Cấp Form Rộng Tay Lỡ Phong Cách Trẻ Trung Năng Động Cá Tính Unisex,189.000₫,https://tiki.vn/bo-quan-ao-thun-nam-nu-thiet-ke-fear-chat-lieu-cottom-cao-cap-form-rong-tay-lo-phong-cach-tre-trung-nang-dong-ca-tinh-unisex-p252283058.html?spid=252283166,32,,,aothun
Áo thun nam nữ form rộng - Áo thun 3d nam big size - Áo phông nữ dành cho người béo,73.000₫,https://tiki.vn/ao-thun-nam-nu-form-rong-ao-thun-3d-nam-big-size-ao-phong-nu-danh-cho-nguoi-beo-p98664232.html?spid=98664271,33,,Đã bán 23,aothun
Áo thun nam nữ cặp - Áo big size cho nam - Quần Áo cho người béo bụng nam,73.000₫,https://tiki.vn/ao-thun-nam-nu-cap-ao-big-size-cho-nam-quan-ao-cho-nguoi-beo-bung-nam-p98655152.html?spid=98655440,34,,Đã bán 6,aothun
Áo Thun Logo One.Piece Đơn Giản 100% Cotton Cao Cấp,207.000,https://tiki.vn/ao-thun-logo-one-piece-don-gian-100-cotton-cao-cap-p193114854.html?spid=193115040,35,,,aothun
,,https://tiki.vn/ao-thun-nam-graphic-tee-size-m-p180604863.html?spid=180604865,36,,,aothun
"Áo ba lỗ nam MDLON - Tank top thể thao chất cotton co dãn tốt, mềm mịn mát mẻ",69.000₫,https://tiki.vn/ao-ba-lo-nam-mdlon-tank-top-the-thao-chat-cotton-co-dan-tot-mem-min-mat-me-p83472238.html?spid=93854440,37,,Đã bán 11,aothun
Áo Thun Nam Có Cổ Phối Một Sọc Thẳng Nam Tính,157.000₫,https://tiki.vn/ao-thun-nam-co-co-phoi-mot-soc-thang-nam-tinh-p83161435.html?spid=83161934,38,,Đã bán 3,aothun
"Áo polo, áo phông, áo thun cổ bẻ nam màu navy in thân Aligro chất liệu cotton, không xù, không bám dính ALGPLO68",409.500₫,https://tiki.vn/ao-polo-ao-phong-ao-thun-co-be-nam-mau-navy-in-than-aligro-chat-lieu-cotton-khong-xu-khong-bam-dinh-algplo68-p249227355.html?spid=249227360,39,,,aothun
áo thun nam với họa tiết chữ kiểu cực chất,126.300,https://tiki.vn/ao-thun-nam-voi-hoa-tiet-chu-kieu-cuc-chat-p43130629.html?spid=43130639,40,,,aothun
