title,price,link_item,index,discount,sales,brand
Áo len dài tay ALEND053,599.500₫,https://tiki.vn/ao-len-dai-tay-aligro-alend053-p9820538.html?spid=9820544,1,,Đã bán 1,Aligro
ÁO SƠ MI NAM DÀI TAY TRƠN MÀU XANH DƯƠNG ALIGRO DÁNG SLIMFIT MÃ ALGS198,567.600₫,https://tiki.vn/ao-so-mi-nam-dai-tay-tron-mau-xanh-duong-aligro-dang-slimfit-ma-algs198-p90339053.html?spid=90339062,2,,,Aligro
Áo thun nam dài tay Aligro màu navy co giãn 4 chiều chất thun cao cấp ALGAPD059,245.000₫,https://tiki.vn/ao-phong-dai-tay-aligro-mau-navy-chat-lieu-thun-cao-cap-nhe-co-gian-4-chieu-algapd059-p198262015.html?spid=198262019,3,-41%,,Aligro
Bộ nỉ kéo khóa ALIGRO có mũ màu ghi nhạt BN.18,805.000,https://tiki.vn/bo-ni-keo-khoa-aligro-co-mu-mau-ghi-nhat-bn-18-p213525610.html?spid=213525618,4,,,Aligro
,,https://tiki.vn/ao-polo-nam-co-det-mau-xanh-co-vit-algplo39-p87531955.html?spid=87532005,5,-50%,,Aligro
Quần kaki nam Aligro ALGK052,759.000₫,https://tiki.vn/quan-kaki-nam-aligro-algk052-p56958321.html?spid=56958333,6,,Đã bán 9,Aligro
Quần kaki nam màu be Aligro ALGK055,607.200₫,https://tiki.vn/quan-kaki-nam-aligro-algk055-p56958910.html?spid=56958920,7,,,Aligro
Áo sơ mi cộc tay nam công sở Aligro kẻ xanh ALGS-C82 ( SIZE M),621.500₫,https://tiki.vn/ao-so-mi-coc-tay-nam-aligro-algs-c82m-size-m-p52780150.html?spid=52780151,8,,,Aligro
Bộ nỉ kéo khóa nam Aligro màu đen BN10,1.045.000,https://tiki.vn/bo-ni-keo-khoa-nam-aligro-bn10-mau-den-p145388566.html?spid=145388568,9,,,Aligro
,,https://tiki.vn/ao-khoac-long-vu-algalv-14-mau-xanh-reu-dam-p121678021.html?spid=121678023,10,,,Aligro
Áo thun polo nam cộc tay trơn màu xanh aligro ALGPLO26,299.000₫,https://tiki.vn/ao-thun-polo-nam-coc-tay-tron-mau-xanh-aligro-algplo26-p249227698.html?spid=249227704,11,,,Aligro
Áo len dài tay Aligro ALEND034 - Ghi,759.000,https://tiki.vn/ao-len-dai-tay-aligro-alend034-p9820186.html?spid=9820188,12,,,Aligro
,,https://tiki.vn/ao-khoac-long-vu-aligro-algalv-18-p9796432.html?spid=9796434,13,,,Aligro
Áo sơ mi nam dài tay ALIGRO chất liệu cotton cổ bẻ dáng ôm body trắng phối cổ ALGS191,759.000₫,https://tiki.vn/ao-so-mi-dai-tay-nam-aligro-algs191-p56902123.html?spid=56902133,14,,Đã bán 3,Aligro
Quần kaki nam Aligro ALGK048,759.000₫,https://tiki.vn/quan-kaki-nam-aligro-algk048-p56958262.html?spid=56958270,15,,,Aligro
Quần kaki nam công sở ALGK059,690.000₫,https://tiki.vn/quan-kaki-nam-cong-so-algk059-p191378104.html?spid=191378110,16,,,Aligro
Áo phông nam Aligro Algplo49 cổ dệt màu hồng,299.000,https://tiki.vn/ao-phong-nam-aligro-algplo49-co-det-mau-xanh-p249227629.html?spid=249227638,17,,,Aligro
,,https://tiki.vn/bo-ni-keo-khoa-nam-dai-tay-aligro-chat-lieu-ni-100-cotton-mau-ghi-dam-algbn-20-p261984733.html?spid=261984748,18,,,Aligro
Quần kaki nam ALIGRO chất liệu kaki mềm mịn cao cấp dáng slimfit màu vàng ALGK019,382.250₫,https://tiki.vn/quan-kaki-nam-mau-vang-aligro-algk019-p116144232.html?spid=116144242,19,,,Aligro
"Áo sơ mi nam dài tay ALIGRO chất liệu pirma cotton mềm mịn, kiểu dáng đơn giản, tinh tế ALGS156",607.200₫,https://tiki.vn/ao-so-mi-dai-tay-aligro-algs156-p11720679.html?spid=11720683,20,,,Aligro
Áo Sơ Mi Nam Ngắn Tay Aligro ALGS-C74-L (Size,665.000₫,https://tiki.vn/ao-so-mi-nam-ngan-tay-aligro-algs-c74-p23074024.html?spid=23074030,21,,,Aligro
"Áo sơ mi nam dài tay ALIGRO cổ bẻ dáng ôm body, 100% cotton kẻ sọc xanh trắng ALGS164",797.500₫,https://tiki.vn/ao-so-mi-nam-ngan-tay-aligro-algs164-p23074059.html?spid=23074062,22,,,Aligro
Áo Sơ Mi Nam Ngắn Tay Aligro ALGS-C71-S (Size,525.000₫,https://tiki.vn/ao-so-mi-nam-ngan-tay-aligro-algs-c71-p23073944.html?spid=23073948,23,,,Aligro
"Áo sơ mi nam dài tay ALIGRO cổ bẻ dáng ôm body, 100% chất cotton xanh kẻ caro ALGS177",607.200₫,https://tiki.vn/ao-so-mi-dai-tay-nam-aligro-algs177-p54825172.html?spid=54825174,24,,,Aligro
ÁO SƠ MI NAM DÀI TAY DÁNG SLIMFIT MÃ ALGS181,607.200,https://tiki.vn/ao-so-mi-dai-tay-nam-aligro-algs181-p52890309.html?spid=52890315,25,,,Aligro
,,https://tiki.vn/ao-so-mi-coc-tay-nam-aligro-algs-c102-p56854550.html?spid=56854556,26,,,Aligro
Áo sơ mi cộc tay nam Aligro ALGS-C92,525.000₫,https://tiki.vn/ao-so-mi-coc-tay-nam-aligro-algs-c92-p54814690.html?spid=54814696,27,,,Aligro
Áo phông nam Aligro ALGPLO59,299.000₫,https://tiki.vn/ao-phong-nam-aligro-algplo59-p56938010.html?spid=56938014,28,,,Aligro
Áo phông cổ tim ALIGRO ALGAPC056,215.600₫,https://tiki.vn/ao-phong-co-tim-aligro-algapc056-p66104957.html?spid=66104959,29,,,Aligro
Áo phông cổ tròn ALIGRO ALGAPC040,269.500,https://tiki.vn/ao-phong-co-tron-aligro-algapc040-p66078550.html?spid=66078552,30,,,Aligro
,,https://tiki.vn/ao-polo-aligro-algplo23-xanh-da-troi-phoi-trang-p121681543.html?spid=121681545,31,,,Aligro
"Quần âu nam ALIGRO màu nâu bò, chuẩn form slimfit vải nano cao cấp, tôn dáng, thoáng mát ALGO1013",690.000₫,https://tiki.vn/quan-au-algo1013-p121680627.html?spid=121680631,32,,,Aligro
"Quần âu nam ALIGRO màu đen, ống đứng tôn dáng thanh lịch, trang trọng ALGO1036",690.000₫,https://tiki.vn/quan-au-aligro-algo1036-mau-den-p64230920.html?spid=64230924,33,,,Aligro
Áo sơ mi nam dài tay kẻ dáng Slimfit mã ALGS178,759.000₫,https://tiki.vn/ao-so-mi-dai-tay-nam-aligro-algs178-p52886875.html?spid=52886879,34,,,Aligro
Áo sơ mi cộc tay nam Aligro ALGS-C82,621.500,https://tiki.vn/ao-so-mi-coc-tay-nam-aligro-algs-c82-p54804735.html?spid=54804737,35,,,Aligro
,,https://tiki.vn/ao-so-mi-coc-tay-nam-aligro-algs-c91-p52881434.html?spid=52881438,36,,,Aligro
Áo sơ mi nam họa tiết hoa xanh cộc tay mã ALGS-C88,409.200₫,https://tiki.vn/ao-so-mi-nam-hoa-tiet-hoa-xanh-coc-tay-ma-algs_c88-p95285026.html?spid=95285032,37,,,Aligro
Áo phông cổ tròn ALIGRO ALGAPC048,269.500₫,https://tiki.vn/ao-phong-co-tron-aligro-algapc048-p66089227.html?spid=66089229,38,,,Aligro
Quần kaki nam ống đứng - Aligro ALGK050,607.200₫,https://tiki.vn/quan-kaki-nam-ong-dung-aligro-algk050-p90752743.html?spid=90752755,39,,,Aligro
QUẦN KAKI NAM ỐNG ĐỨNG ALGK034,585.200,https://tiki.vn/quan-kaki-nam-ong-dung-algk034-p90752509.html?spid=90752513,40,,,Aligro
