title,price,link_item,index,discount,sales,category
Hàng đẹp- Quần Sịp Chéo Nam Cotton - Quần Sịp Chéo Cotton,27.600₫,https://tiki.vn/hang-dep-quan-sip-cheo-nam-cotton-quan-sip-cheo-cotton-p102500734.html?spid=102500777,1,,,dolotnam
Quần Lót Nam Brief Cao Cấp MS:6055 (Freeman),62.300₫,https://tiki.vn/quan-lot-nam-cao-cap-ms-6055-5f06-p127357369.html?spid=127357401,2,,Đã bán 4,dolotnam
Quần đùi sịp nam xuất nhật ĐATSUMY,35.000₫,https://tiki.vn/quan-dui-sip-nam-xuat-nhat-datsumy-p116776307.html?spid=116776322,3,,,dolotnam
Quần Sịp Nam Boxer Thun Lạnh Giá Rẻ,30.000₫,https://tiki.vn/quan-sip-nam-boxer-thun-lanh-gia-re-p117786584.html?spid=117786595,4,,,dolotnam
,,https://tiki.vn/sip-tam-giac-zakado-tron-cap-cung-p172833597.html?spid=172833609,5,,,dolotnam
Sịp đùi Zakado cạp nhỏ,85.000₫,https://tiki.vn/sip-dui-zakado-cap-nho-p172838976.html?spid=172838978,6,,,dolotnam
"Quần sịp nam, quần boxer thun lạnh họa tiết cute",55.000₫,https://tiki.vn/quan-sip-nam-quan-boxer-thun-lanh-hoa-tiet-cute-p170131817.html?spid=170131827,7,,Đã bán 2,dolotnam
COMBO 3 Quần Lót Nam Cao Cấp Chất Bambo Dáng Thể Thao Thấm Hút Mồ Hôi LOGO Thương Hiệu BABOYKA,345.000₫,https://tiki.vn/combo-3-quan-lot-nam-cao-cap-chat-bambo-dang-the-thao-tham-hut-mo-hoi-logo-thuong-hieu-baboyka-p175867598.html?spid=175867670,8,,,dolotnam
COMBO 3 Quần Lót Nam Phối Kẻ Cao Cấp Dệt Liền Trẻ Trung Năng Động Thoáng Khí Khi Mặc Thương Hiệu BABOYKA,375.000,https://tiki.vn/combo-3-quan-lot-nam-phoi-ke-cao-cap-det-lien-tre-trung-nang-dong-thoang-khi-khi-mac-thuong-hieu-baboyka-p175867769.html?spid=175867991,9,,Đã bán 7,dolotnam
,,https://tiki.vn/quan-lot-nam-baboyka-chat-bambo-co-gian-4-chieu-sip-tam-giac-det-lien-moi-p175867559.html?spid=175867594,10,,,dolotnam
Quần lót Sport mix viền cá tính,54.000₫,https://tiki.vn/quan-lot-sport-mix-vien-ca-tinh-p119641341.html?spid=119641348,11,,Đã bán 1,dolotnam
Quần sịp nam Aristino ABX16-07,110.000,https://tiki.vn/quan-sip-nam-aristino-abx16-07-p10016786.html?spid=34139133,12,,,dolotnam
,,https://tiki.vn/ho-p-4-qua-n-sip-du-i-thong-hoi-men-p138900180.html?spid=138900190,13,,,dolotnam
CHUYÊN SỈ: QUẦN SỊP ĐÙI THÔNG HƠI,250.000₫,https://tiki.vn/chuyen-si-quan-sip-dui-thong-hoi-p122234697.html?spid=122234702,14,,,dolotnam
Quần lót nam sexy STUD Underwear U1047LB09,1.235.000₫,https://tiki.vn/quan-lot-nam-sexy-stud-underwear-u1047lb09-p160607944.html?spid=160607952,15,,,dolotnam
Quần lót nam lưới cao cấp chất liệu cotton STUD màu Xanh/Vàng U1050BLT04,965.000₫,https://tiki.vn/qua-n-lo-t-nam-luoi-cao-cap-chat-lieu-cotton-stud-mau-xanh-vang-u1050blt04-p160609523.html?spid=160609533,16,,,dolotnam
Quần lót nam Private Structure Underwear Trunk HBOMU3550 Royal,765.000,https://tiki.vn/quan-lot-nam-private-structure-underwear-trunk-hbomu3550-royal-p160609587.html?spid=160609621,17,,,dolotnam
,,https://tiki.vn/quan-lot-nam-tam-giac-stud-mau-vang-den-men-s-fashion-underwear-gold-black-u1044ajs22-p160609797.html?spid=160609807,18,,,dolotnam
Quần lót nam sexy STUD Jock U1063BJS12,965.000₫,https://tiki.vn/quan-lot-nam-sexy-stud-jock-u1063bjs12-p160609570.html?spid=160609607,19,,,dolotnam
Sỉ Quần Lót Nam Chất Thun Lạnh Đẹp Thoáng Khí Quần Sịp Nam Thun Lạnh Thấm Mồ Hôi Co Giãn 4 Chiều,35.000₫,https://tiki.vn/si-quan-lot-nam-chat-thun-lanh-dep-thoang-khi-quan-sip-nam-thun-lanh-tham-mo-hoi-co-gian-4-chieu-p152691159.html?spid=152691482,20,,Đã bán 3,dolotnam
☆ Quần lót nam sịp tam giác thông hơi lưới vải nhập khẩu cao cấp,46.200₫,https://tiki.vn/quan-lot-nam-sip-tam-giac-thong-hoi-luoi-vai-nhap-khau-cao-cap-p150373201.html?spid=150373215,21,,,dolotnam
☆ Quần lót nam tam giác vải nhập khẩu hàng xuất dư,64.680₫,https://tiki.vn/quan-lot-nam-tam-giac-vai-nhap-khau-hang-xuat-du-p150373162.html?spid=150373196,22,,,dolotnam
☆ Quần lót nam sịp tam giác cotton cao cấp chun lụa mềm nhẹ ôm,64.680₫,https://tiki.vn/quan-lot-nam-sip-tam-giac-cotton-cao-cap-chun-lua-mem-nhe-om-p150373385.html?spid=150373471,23,,,dolotnam
"Quần lót boxer nam chất liệu Cotton Organic kháng khuẩn, thấm hút và khử mùi ABX056",110.000₫,https://tiki.vn/quan-lot-boxer-nam-aristino-chat-lieu-cotton-organic-khang-khuan-tham-hut-va-khu-mui-cuc-tot-abx056-p162575346.html?spid=162575348,24,,,dolotnam
Hộp 3 quần lót nam đùi 3A sợi tre co giãn 4 chiều kháng khuẩn,52.650₫,https://tiki.vn/hop-3-quan-lot-nam-dui-3a-soi-tre-co-gian-4-chieu-khang-khuan-p192700796.html?spid=192700803,25,,,dolotnam
,,https://tiki.vn/quan-lot-nam-boxer-co-dan-4-chieu-quan-sip-nam-dui-freesize-45-70kg-men01-proman-p192794949.html?spid=192794953,26,,,dolotnam
Combo 5 quần) Quần sịp nam tam giác thông hơi cạp chữ nhật hàng xuất,159.000₫,https://tiki.vn/combo-5-quan-quan-sip-nam-tam-giac-thong-hoi-cap-chu-nhat-hang-xuat-p190155977.html?spid=190155981,27,,,dolotnam
Quần lót nam tam giác chất vải mát lỗ nhỏ thông hơi cao cấp,34.000₫,https://tiki.vn/quan-lot-nam-tam-giac-chat-vai-mat-lo-nho-thong-hoi-cao-cap-p79937537.html?spid=197494909,28,,,dolotnam
Quần lót nam mềm mại Jockstrap Art.7209,85.000₫,https://tiki.vn/quan-lot-nam-mem-mai-jockstrap-art-7209-p239484185.html?spid=239484191,29,,,dolotnam
Quần lót nam sexy ADANNU vải Cotton gợi cảm phong cách Gay Art.7382,99.000₫,https://tiki.vn/quan-lot-nam-sexy-adannu-vai-cotton-goi-cam-phong-cach-gay-art-7382-p239409576.html?spid=239409578,30,,,dolotnam
,,https://tiki.vn/quan-lot-nam-juelang-hoa-tiet-soc-chat-luong-cao-p201430795.html?spid=201430799,31,,,dolotnam
Quần lót nam ôm sát co giãn và quyến rũ,49.000₫,https://tiki.vn/quan-lot-nam-om-sat-co-gian-va-quyen-ru-p201423154.html?spid=201423162,32,,,dolotnam
"Quần lót nam Boxer thông hơi siêu mát lạnh, Quần sịp đùi nam thông hơi DM siêu dãn ST02 PROMAN",21.000₫,https://tiki.vn/quan-lot-nam-boxer-thong-hoi-sieu-mat-lanh-quan-sip-dui-nam-thong-hoi-dm-sieu-dan-st02-proman-p201116687.html?spid=201116763,33,,,dolotnam
"Quần lót nam boxer lụa in hình co dãn 4 chiều, quần sịp đùi nam hoạt hình chất lụa thấm hút SL03 - PROMAN",27.000₫,https://tiki.vn/quan-lot-nam-boxer-lua-in-hinh-co-dan-4-chieu-quan-sip-dui-nam-hoat-hinh-chat-lua-tham-hut-sl03-proman-p201117650.html?spid=201117775,34,,,dolotnam
Quần lót nam Cotton kẻ sọc thời trang,45.000₫,https://tiki.vn/quan-lot-nam-cotton-ke-soc-thoi-trang-p199932175.html?spid=199932176,35,,,dolotnam
,,https://tiki.vn/quan-lot-nam-ca-tinh-soc-thoang-khi-u-loi-that-lung-thap-p199932738.html?spid=199932740,36,,,dolotnam
Quần lót nam phong cách Sumo Bear Nhật bản,45.000₫,https://tiki.vn/quan-lot-nam-phong-cach-sumo-bear-nhat-ban-p199931593.html?spid=199931595,37,,Đã bán 6,dolotnam
Quần lót nam Sexy kim tuyến,45.000₫,https://tiki.vn/quan-lot-nam-sexy-kim-tuyen-p199941186.html?spid=199941189,38,,,dolotnam
"(Giá Sỉ)Quần Xịp Nam Cao Cấp️Chất Coton Co Giãn Thoáng Mát, Thoải Mái Vận Động, Màu Sắc Nam Tính",14.000₫,https://tiki.vn/gia-si-quan-xip-nam-cao-cap-chat-coton-co-gian-thoang-mat-thoai-mai-van-dong-mau-sac-nam-tinh-p208200187.html?spid=208200190,39,,,dolotnam
Combo 5 Quần Boxer Nam Hoa Văn Vazco,250.000,https://tiki.vn/combo-5-quan-boxer-nam-hoa-van-vazco-p252093179.html?spid=252093199,40,,,dolotnam
