title,price,link_item,index,discount,sales,category
Đầm xòe thiết kế trung niên cao cấp Cổ tròn tay ngắn thêu hoa màu Đen TTV STORE TTV1393,495.000₫,https://tiki.vn/dam-xoe-thiet-ke-trung-nien-cao-cap-co-tron-tay-ngan-theu-hoa-mau-den-ttv-store-ttv1393-p263567466.html?spid=263567468,1,-3%,,thoitrangtrungnien
"Quần Trung Niên Nữ Tà Đính Đá Kiểu Dáng Cao Cấp Châu Linh, Chất Liệu Mango Mềm Mịn Thoáng Mát Quý Phái Uyển C",320.000₫,https://tiki.vn/quan-trung-nien-nu-ta-dinh-da-kieu-dang-cao-cap-chau-linh-chat-lieu-mango-mem-min-thoang-mat-quy-phai-uyen-c-p153416174.html?spid=153416180,2,,,thoitrangtrungnien
Bộ Lanh Trung Niên Cao Cấp Đã Qua Xử Lý Co Đủ Size Từ 47 Tới 70kg - Tuấn Tú Store 68,167.000₫,https://tiki.vn/bo-lanh-trung-nien-cao-cap-da-qua-xu-ly-co-du-size-tu-47-toi-70kg-tuan-tu-store-68-p253118969.html?spid=263509144,3,,Đã bán 1,thoitrangtrungnien
ĐỒ BỘ TRUNG NIÊN TAY LƠ-QUẦN ÁO TRUNG NIÊN_Bộ quần áo nữ,250.000,https://tiki.vn/do-bo-trung-nien-tay-lo-quan-ao-trung-nien_bo-quan-ao-nu-p177787997.html?spid=177788005,4,,Đã bán 3,thoitrangtrungnien
,,https://tiki.vn/dam-xoe-trung-nien-ttv-store-ttv1183-co-vuong-no-tay-loe-thiet-ke-mau-den-sang-trong-p206203655.html?spid=206203659,5,,,thoitrangtrungnien
Bộ Bông_B2 (Áo Bà Ba Bông + Quần Đen Rộng),135.000₫,https://tiki.vn/bo-bong_b2-ao-ba-ba-bong-quan-den-rong-p261830636.html?spid=261830780,6,,,thoitrangtrungnien
Áo Sơ Mi Nữ Trung Niên A85 - Áo kiểu trung tuổi U40 U50 cho mẹ thời trang mùa hè Đẹp sang trọng cao cấp Bigsize giá rẻ - Be,129.000₫,https://tiki.vn/ao-so-mi-nu-trung-nien-a85-ao-kieu-trung-tuoi-u40-u50-cho-me-thoi-trang-mua-he-dep-sang-trong-cao-cap-bigsize-gia-re-p270805537.html?spid=270805573,7,,,thoitrangtrungnien
Đầm xòe thiết kế trung niên cao cấp sang trọng Cổ tim tay ngắn màu Xanh hoa TTV STORE TTV1326,480.000₫,https://tiki.vn/dam-xoe-thiet-ke-trung-nien-cao-cap-sang-trong-co-tim-tay-ngan-mau-xanh-hoa-ttv-store-ttv1326-p252284163.html?spid=252284171,8,,Đã bán 1,thoitrangtrungnien
Bộ Đũi Trung Niên Hoa Thêu Cực Đẹp Vải Mát Đường May Tinh Xảo Chắc Chắn - Tuấn Tú Store 68,235.000,https://tiki.vn/bo-dui-trung-nien-hoa-theu-cuc-dep-vai-mat-duong-may-tinh-xao-chac-chan-tuan-tu-store-68-p249728584.html?spid=249728603,9,,Đã bán 1,thoitrangtrungnien
,,https://tiki.vn/bo-do-nhung-gan-hoa-am-ap-cho-mua-thu-dong-p135113145.html?spid=135113351,10,,,thoitrangtrungnien
Áo sơ mi trung niên nữ cao cấp kiểu dáng sang trọng-áo cho mẹ,220.000₫,https://tiki.vn/ao-so-mi-trung-nien-nu-cao-cap-kieu-dang-sang-trong-ao-cho-me-p185440237.html?spid=185440249,11,,,thoitrangtrungnien
Đầm xòe trung niên TTV1207 TTV Store thiết kế Cổ tim xếp li tay ngắn màu Xanh cổ vịt thời trang trẻ trung,470.000,https://tiki.vn/dam-xoe-trung-nien-ttv1207-ttv-store-thiet-ke-co-tim-xep-li-tay-ngan-mau-xanh-co-vit-thoi-trang-tre-trung-p213522754.html?spid=213522758,12,,,thoitrangtrungnien
,,https://tiki.vn/ao-thun-nu-trung-nien-p167128597.html?spid=167128601,13,,,thoitrangtrungnien
Áo sơ mi lụa trung niên nữ cho bà cho mẹ- áo kiểu nữ sang trọng,219.000₫,https://tiki.vn/ao-so-mi-lua-trung-nien-nu-cho-ba-cho-me-ao-kieu-nu-sang-trong-p182318013.html?spid=182318021,14,,,thoitrangtrungnien
Bộ Đũi Trung Niên 2021 - Áo kiểu đũi cao cấp phối quần đũi lụa cực đẹp,259.000₫,https://tiki.vn/bo-dui-trung-nien-2021-ao-kieu-dui-cao-cap-phoi-quan-dui-lua-cuc-dep-p108650972.html?spid=108651000,15,,,thoitrangtrungnien
ÁO SƠ MI TRUNG NIÊN,157.000₫,https://tiki.vn/ao-so-mi-trung-nien-p118125562.html?spid=118125673,16,,,thoitrangtrungnien
Áo trung niên Long Châu A2,95.000₫,https://tiki.vn/ao-trung-nien-long-chau-a2-p198515337.html?spid=198515338,17,,,thoitrangtrungnien
,,https://tiki.vn/do-bo-trung-nien-tay-lo-lua-han-chau-quan-dui-cao-cap-sieu-mem-sieu-mat-danh-cho-quy-ba-trung-tuoi-tuan-tu-store-68-p77650506.html?spid=77650518,18,,,thoitrangtrungnien
Bộ quần áo trung niên nữ_ đồ bộ mặc nhà chất vải lanh siêu mát họa tiết sang trọng cho bà cho mẹ,149.000₫,https://tiki.vn/bo-quan-ao-trung-nien-nu_-do-bo-mac-nha-chat-vai-lanh-sieu-mat-hoa-tiet-sang-trong-cho-ba-cho-me-p170437684.html?spid=170437688,19,,Đã bán 3,thoitrangtrungnien
set đồ bộ trung niên ( thời trang trung niên anitagreen) L04-621,239.200₫,https://tiki.vn/set-do-bo-trung-nien-thoi-trang-trung-nien-anitagreen-l04-621-p135531691.html?spid=135531699,20,,,thoitrangtrungnien
Áo Kiểu trung niên,250.000₫,https://tiki.vn/ao-kieu-trung-nien-p142632295.html?spid=142632304,21,,,thoitrangtrungnien
GOTI - Đầm Trung Niên Dáng Dài Xoè Rộng In Hoa Đính Hạt Eo Kiểu Thiết Kế Dự Tiệc Sang Trọng 3337,299.000₫,https://tiki.vn/goti-dam-trung-nien-dang-dai-xoe-rong-in-hoa-dinh-hat-eo-kieu-thiet-ke-du-tiec-sang-trong-3337-p198451490.html?spid=198451502,22,,,thoitrangtrungnien
Đầm trung niên 2 lớp cực đẹp,299.000₫,https://tiki.vn/dam-trung-nien-2-lop-cuc-dep-p105618257.html?spid=105618379,23,,,thoitrangtrungnien
Đầm xòe thiết kế trung niên sang trọng Cổ vuông kết nút tay bo màu Đen kem TTV STORE TTV1268,480.000₫,https://tiki.vn/dam-xoe-thiet-ke-trung-nien-sang-trong-co-vuong-ket-nut-tay-bo-mau-den-kem-ttv-store-ttv1268-p216408555.html?spid=216408565,24,,,thoitrangtrungnien
Váy Đầm cho người trung niên Dáng Dài họa tiết V4a - Thời trang cho mẹ lớn tuổi trung tuổi mùa hè đẹp Bigsize,99.000₫,https://tiki.vn/vay-dam-cho-nguoi-trung-nien-dang-dai-hoa-tiet-v4a-thoi-trang-cho-me-lon-tuoi-trung-tuoi-mua-he-dep-bigsize-p114403931.html?spid=114404256,25,,,thoitrangtrungnien
,,https://tiki.vn/bo-do-trung-nien-nu-cao-cap-he-b58-bo-mac-nha-cho-me-sang-trong-quan-ao-kieu-thoi-trang-trung-tuoi-chat-lua-dep-p114404119.html?spid=114404326,26,,,thoitrangtrungnien
Đầm xòe thiết kế trung niên cao cấp sang trọng Cổ tròn tay ngắn màu Đen phối kem TTV STORE TTV1341,475.000₫,https://tiki.vn/dam-xoe-thiet-ke-trung-nien-cao-cap-sang-trong-co-tron-tay-ngan-mau-den-phoi-kem-ttv-store-ttv1341-p253402701.html?spid=253402711,27,,,thoitrangtrungnien
"Đầm dự tiệc trung niên , đầm dáng suông kiểu hoạ tiết hoa chân tôn dáng - mã 283",187.500₫,https://tiki.vn/dam-du-tiec-trung-nien-dam-dang-suong-kieu-hoa-tiet-hoa-chan-ton-dang-ma-283-p135114298.html?spid=135114358,28,,,thoitrangtrungnien
Đầm suông thiết kế trung niên quý phái cao cấp Cổ tròn đính ngọc tay lỡ kết hoa màu Hồng ruốc TTV STORE TTV1368,470.000₫,https://tiki.vn/dam-suong-thiet-ke-trung-nien-quy-phai-cao-cap-co-tron-dinh-ngoc-tay-lo-ket-hoa-mau-hong-ruoc-ttv-store-ttv1368-p262404630.html?spid=262404634,29,,,thoitrangtrungnien
Đầm xòe thiết kế trung niên cao cấp Cổ tròn kết hoa tay ngắn màu Hồng ruốc TTV STORE TTV1282,515.000,https://tiki.vn/dam-xoe-thiet-ke-trung-nien-cao-cap-co-tron-ket-hoa-tay-ngan-mau-hong-ruoc-ttv-store-ttv1282-p225932690.html?spid=225932700,30,,,thoitrangtrungnien
,,https://tiki.vn/dam-form-a-thiet-ke-trung-nien-cao-cap-sang-trong-co-dap-cheo-dinh-da-mau-nau-ca-phe-ttv-store-ttv1260-p216206571.html?spid=216206579,31,,,thoitrangtrungnien
Bộ Lụa Gấm Cao Cấp Tay Lỡ Cho Mẹ Trung Niên Đủ Size Từ 45kg Tới 68kg - Tuấn Tú Store 68,295.000₫,https://tiki.vn/bo-lua-gam-cao-cap-tay-lo-cho-me-trung-nien-du-size-tu-45kg-toi-68kg-tuan-tu-store-68-p270275979.html?spid=270275987,32,,,thoitrangtrungnien
Áo thun nữ trung niên 55-80kg,220.000₫,https://tiki.vn/ao-thun-nu-trung-nien-55-80kg-p158809711.html?spid=158809715,33,,,thoitrangtrungnien
"Đồ bộ trung niên LỤA cho Mẹ & Bà chất LỤA Ngọc Trai - quần dài rộng Hoạ Tiết HOA thoải mái, mềm mịn đủ Size từ 38-80kg",297.000₫,https://tiki.vn/do-bo-trung-nien-lua-cho-me-ba-chat-lua-ngoc-trai-quan-dai-rong-hoa-tiet-hoa-thoai-mai-mem-min-du-size-tu-38-80kg-p157315994.html?spid=157316006,34,,,thoitrangtrungnien
"Áo trung niên nữ, Áo bà ngoại bà nội, Áo sơ mi trung niên thêu họa tiết nút cài sang trọng bigsize tới 80kg",249.000,https://tiki.vn/ao-trung-nien-nu-ao-ba-ngoai-ba-noi-ao-so-mi-trung-nien-theu-hoa-tiet-nut-cai-sang-trong-bigsize-toi-80kg-p248933174.html?spid=248933180,35,,,thoitrangtrungnien
,,https://tiki.vn/ao-kieu-trung-nien-tay-coc-chat-lieu-lua-satin-cao-cap-danh-cho-nguoi-trung-tuoi-2022-tuan-tu-store-p169193130.html?spid=169193150,36,,,thoitrangtrungnien
Quần Áo cho mẹ (bộ),59.950₫,https://tiki.vn/quan-ao-cho-me-bo-p88085979.html?spid=88086005,37,,Đã bán 3,thoitrangtrungnien
( HÀNG SẴN) Áo Voan Trung Niên Tay Lỡ Đẹp SM54 - Hàng Quảng Châu Cao Cấp,225.000₫,https://tiki.vn/hang-san-ao-voan-trung-nien-tay-lo-dep-sm54-hang-quang-chau-cao-cap-p86880605.html?spid=86880629,38,,Đã bán 3,thoitrangtrungnien
( HÀNG SẴN) Bộ Đồ Lụa Mặc Nhà Phối Ren Trung Niên Cho Mẹ Mềm Đẹp AB38 - Hàng Quảng Châu Cao Cấp,285.000₫,https://tiki.vn/hang-san-bo-do-lua-mac-nha-phoi-ren-trung-nien-cho-me-mem-dep-ab38-hang-quang-chau-cao-cap-p125021541.html?spid=125021626,39,,,thoitrangtrungnien
Áo khoác len trung niên nữ áo len thu đông cho bà cho mẹ,199.000,https://tiki.vn/ao-khoac-len-trung-nien-nu-ao-len-thu-dong-cho-ba-cho-me-p196375024.html?spid=196375033,40,,,thoitrangtrungnien
