title,price,link_item,index,discount,sales
Bao cao su Power Men Ngọc trai gai hộp 12 bao,99.000₫,https://tiki.vn/bao-cao-su-power-men-ngoc-trai-gai-hop-12-bao-p53132587.html?spid=53132588,1,-17%,Đã bán 17
Bao Cao Su Sagami Xtreme Feel Up - Hộp 10 Gói,81.000₫,https://tiki.vn/bao-cao-su-sagami-xtreme-feel-up-hop-10-goi-p389657.html?spid=71070860,2,-10%,Đã bán 39
Bao cao su cỡ lớn size to 55mm siêu mỏng Sagami Original 0.02 - Hộp 12 chiếc - Không mùi cao su - Tặng Kèm Gel Jex Nhật - Hàng chính hãng 100% - Che tên sản phẩm,500.000₫,https://tiki.vn/bao-cao-su-co-lon-sieu-mong-sagami-original-0-02-hop-12-chiec-khong-mui-cao-su-tang-kem-gel-jex-nhat-hang-chinh-hang-100-che-ten-san-pham-p76815167.html?spid=76815168,3,-31%,Đã bán 6
Bcs Durex Kingtex - Cỡ Nhỏ 49mm - Ôm Khít - Nhập Khẩu Thái Lan- H12,190.000₫,https://tiki.vn/bcs-durex-kingtex-co-nho-49mm-om-khit-nhap-khau-thai-lan-h12-p197366270.html?spid=197366271,4,-40%,
,,https://tiki.vn/bao-cao-su-okamoto-dot-hot-10-s-gai-nong-am-cam-giac-hung-phan-p13120728.html?spid=13120729,5,-22%,
"Bao cao su gân gai kéo dài, trị xuất tinh sớm Powermen Longer Plus",42.000₫,https://tiki.vn/bao-cao-su-gan-gai-keo-dai-tri-xuat-tinh-som-powermen-longer-plus-p273408475.html?spid=273410836,6,-41%,
Bao cao su Powermen INVI 0.03 - 3 Cái,70.000₫,https://tiki.vn/bao-cao-su-powermen-invi-0-03-3-cai-p2324069.html?spid=2357495,7,-5%,Đã bán 62
Bộ 3 hộp Bao Cao Su LifeStyles Classic Thiết Kế Mỏng Ôm Sát Cao Cấp - Hộp 12 bao,282.000₫,https://tiki.vn/bo-3-hop-bao-cao-su-lifestyles-classic-thiet-ke-mong-om-sat-cao-cap-hop-12-bao-p195874435.html?spid=195874439,8,-3%,
Combo Bao Cao Su LifeStyles Classic Ôm Sát Cao Cấp Hộp 12 bao + Gel Bôi Trơn LifeStyles Warm Lovin Tăng Cảm Giác Ấm Nóng,195.000₫,https://tiki.vn/combo-bao-cao-su-lifestyles-classic-om-sat-cao-cap-hop-12-bao-gel-boi-tron-lifestyles-warm-lovin-tang-cam-giac-am-nong-p126945353.html?spid=126945355,9,-20%,Đã bán 44
,,https://tiki.vn/hop-3-cai-bao-cao-su-masculan-pur-p2255125.html?spid=2290621,10,-30%,
Gel Bôi Trơn Durex Play Warming Chai 100ml,220.000₫,https://tiki.vn/gel-boi-tron-durex-play-warming-chai-100ml-p271860201.html?spid=271860203,11,-19%,
"Bao cao su Fiesta ôm sát, siêu mỏng – hộp 3 cái",35.000₫,https://tiki.vn/bao-cao-su-om-sat-sieu-mong-fiesta-form-fit-ultra-thin-hop-3-cai-p133733425.html?spid=133733426,12,-24%,Đã bán 1
,,https://tiki.vn/bao-cao-su-tam-thien-chi-ice-sieu-mat-lanh-bac-ha-keo-dai-thoi-gian-quan-he-hop-10-chiec-p89198407.html?spid=169208794,13,-54%,
BCS DUREX +XỊT LÂU RA,450.000₫,https://tiki.vn/bcs-durex-xit-hamme-p273393432.html?spid=273393433,14,-10%,
Bao cao su Okamoto 0.03 Platinum (3 cái/hộp),148.000₫,https://tiki.vn/cao-che-vang-loi-sua-bao-nhien-75g-p184444843.html?spid=184444844,15,,
Bộ 2 Hộp Bao Cao Su LifeStyles SKYN ELITE Non-latex Siêu Mỏng Siêu Mềm Cao Cấp Hộp 3 bao,117.000₫,https://tiki.vn/bo-2-hop-bao-cao-su-lifestyles-skyn-elite-non-latex-sieu-mong-sieu-mem-cao-cap-hop-3-bao-p217638587.html?spid=217638590,16,,Đã bán 7
"Bao cao su Sagami Xtreme Spearmint - thương hiệu Nhật Bản hương Bạc Hà, kiểu truyền thống",66.500₫,https://tiki.vn/bao-cao-su-sagami-xtreme-spearmint-thuong-hieu-nhat-ban-huong-bac-ha-kieu-truyen-thong-hop-3-cai-p136087137.html?spid=187874599,17,,
,,https://tiki.vn/bao-cao-su-co-gan-gai-durex-pleasuremax-nhap-khau-thai-lan-12s-che-ten-san-pham-p253298957.html?spid=253298958,18,,
Bcs Durex Fetherlite Mỏng Trơn - Hàng Chính Hãng - Nhập Khẩu Thái Lan - 12s,260.000₫,https://tiki.vn/bcs-durex-fetherlite-mong-tron-hang-chinh-hang-nhap-khau-thai-lan-12s-p196390118.html?spid=196390119,19,,
[Hộp 10 cái] Bao cao su Shell Intense - Siêu mỏng 0.04mm,180.000₫,https://tiki.vn/hop-10-cai-bao-cao-su-shell-intense-sieu-mong-0-04mm-p121243035.html?spid=121243037,20,,
"Bao cao su Powermen Ôm sát, Size Việt, Tăng khoái cảm, Kéo dài thời gian",163.000₫,https://tiki.vn/bao-cao-su-powermen-om-sat-size-viet-tang-khoai-cam-keo-dai-thoi-gian-p249029370.html?spid=249029373,21,,Đã bán 9
"[Hộp 12 cái] Bao cao su Durex Kingtex - Size nhỏ 49mm, ôm sát",95.000₫,https://tiki.vn/hop-12-cai-bao-cao-su-durex-kingtex-size-nho-49mm-om-sat-p130744169.html?spid=212956588,22,,Đã bán 2
Bao cao su Sagami Spearmint 003 mm - kéo dài thời gian - bcs hương bạc hà hộp 10 bao,39.000₫,https://tiki.vn/bao-cao-su-sagami-spearmint-003-mm-keo-dai-thoi-gian-bcs-huong-bac-ha-hop-10-bao-p242079075.html?spid=242079077,23,,
Bcs Mỏng Trơn Kéo Dài Thời Gian Quan Hệ Power Men Viagra Type (H12) - Hàng Chính Hãng 100% - Che Tên Sản Phẩm,100.000₫,https://tiki.vn/bcs-mong-tron-keo-dai-thoi-gian-quan-he-power-men-viagra-type-h12-gel-goi-jex-nhat-hang-chinh-hang-100-che-ten-san-pham-p160073270.html?spid=160073271,24,,Đã bán 9
Bao cao su Powermen,150.000₫,https://tiki.vn/bao-cao-su-powermen-p11519837.html?spid=11519839,25,,Đã bán 29
,,https://tiki.vn/bao-cao-su-okamoto-0-03-h-a-3-s-p868921.html?spid=7198587,26,,
Bao cao su zero 12s + bcs powermen 3s,120.000₫,https://tiki.vn/bao-cao-su-zero-12s-bcs-powermen-3s-p273496088.html?spid=273496089,27,,
Combo 1 Hộp Bao Cao Su LifeStyles Fantasy 12 bao + 1 Hộp Bao Cao Su LifeStyles Mixed Berry 3 bao,128.000₫,https://tiki.vn/combo-1-hop-bao-cao-su-lifestyles-fantasy-12-bao-1-hop-bao-cao-su-lifestyles-mixed-berry-3-bao-p126945354.html?spid=126945358,28,,Đã bán 38
Bao cao su Tâm Thiện Chí Four In Love (hộp 12 chiếc) và 1 tuýp gel KLY 42gr,125.000₫,https://tiki.vn/bao-cao-su-tam-thien-chi-four-in-love-hop-12-chiec-va-1-tuyp-gel-kly-42gr-p5472255.html?spid=5472257,29,,Đã bán 30
Gel bôi trơn cho quan hệ đường hậu Pjur Backdoor Moisturising Anal Glide 100ml cấp ẩm tốt làm dịu da an toàn,449.000₫,https://tiki.vn/chat-boi-tron-cho-quan-he-duong-hau-pjur-backdoor-moisturising-anal-glide-100ml-cap-am-tot-lam-diu-da-an-toan-p247940611.html?spid=247940617,30,,Đã bán 1
,,https://tiki.vn/hop-10-cai-bao-cao-su-olo-0-01-do-sieu-mong-nong-am-kem-1-chiec-bcs-gun-super-thin-p144201457.html?spid=144201459,31,,
Bao Cao Su Kéo Dài Thời Gian Có Gai Sagami Xtreme Feel Long - 10s Và Xịt Cho Nam - Che Tên Sản Phẩm,450.000₫,https://tiki.vn/bao-cao-su-keo-dai-thoi-gian-co-gai-sagami-xtreme-feel-long-10s-va-xit-cho-nam-che-ten-san-pham-p186312649.html?spid=186312650,32,,Đã bán 5
Bcs Size Nhỏ Chống Xuất Tinh Sớm Power Men Longer Ultrathin (H12) - Siêu Mỏng - Cỡ 49mm Ôm Khít - Che Tên Sản Phẩm,119.000₫,https://tiki.vn/bcs-size-nho-chong-xuat-tinh-som-power-men-longer-ultrathin-h12-sieu-mong-co-49mm-om-khit-che-ten-san-pham-p167940993.html?spid=167940994,33,,Đã bán 13
"Bao cao su Ritex Feeling, siêu mỏng ôm sát, hộp 8 chiếc",156.000₫,https://tiki.vn/bao-cao-su-ritex-feeling-om-sat-hop-8-chiec-p74763873.html?spid=74763874,34,,Đã bán 7
Gel bôi trơn massage - Durex Lô Hội - Chai 200ml,1.015.000₫,https://tiki.vn/400ml-bo-2-tuyp-gel-boi-tron-durex-massage-lo-hoi-tang-do-tron-tru-duong-am-co-be-cham-soc-da-mem-mai-200ml-tuyp-p55344718.html?spid=212991279,35,,Đã bán 1
,,https://tiki.vn/bao-cao-su-sieu-mong-huong-dau-okamoto-skinless-skin-strawberry-hop-10-chiec-p20225885.html?spid=50377039,36,,
[1 cái dùng thử] Bao Cao Su Kéo Dài Thời Gian Quan Hệ Chống Xuất Tinh Sớm LifeStyles Love Time,13.000₫,https://tiki.vn/1-cai-dung-thu-bao-cao-su-keo-dai-thoi-gian-quan-he-chong-xuat-tinh-som-lifestyles-love-time-p217559689.html?spid=217559690,37,,Đã bán 7
Bao cao su size nhỏ 49mm Sagami Miracle Fit Hộp 10 chiếc - Hàng chính hãng 100% - Đóng hộp kín đáo và che tên sản phẩm,120.000₫,https://tiki.vn/bao-cao-su-size-nho-49mm-sagami-miracle-fit-hop-10-chiec-hang-chinh-hang-100-dong-hop-kin-dao-va-che-ten-san-pham-p76794378.html?spid=76794379,38,,Đã bán 34
[Hộp 10 cái] Bao cao su Shell Performax 6 in 1 - Kéo dài thời gian kèm 1 chiếc BCS Gun Super Thin,180.000₫,https://tiki.vn/hop-10-cai-bao-cao-su-shell-performax-6-in-1-keo-dai-thoi-gian-p143335849.html?spid=143335851,39,,Đã bán 13
"[Hộp 10 cái] Bao cao su Shell Sensitive Prolong - Siêu mỏng 0.03mm, kéo dài thời gian",252.000₫,https://tiki.vn/hop-10-cai-bao-cao-su-shell-sensitive-prolong-sieu-mong-0-03mm-keo-dai-thoi-gian-p172906863.html?spid=172906865,40,,Đã bán 5
