title,price,link_item,index,discount,sales,category
Đầm Ngủ Thun Lạnh Loại 1 Size 65_75kg,70.000₫,https://tiki.vn/dam-ngu-thun-lanh-loai-1-size-65_75kg-p125174821.html?spid=215915316,1,-7%,Đã bán 3,dongunu
Váy ngủ Cosplay hầu gái sexy cao cấp 1449,129.000₫,https://tiki.vn/vay-ngu-cosplay-hau-gai-sexy-cao-cap-1449-p152631492.html?spid=152631511,2,-5%,,dongunu
"Đồ Ngủ Thun Lạnh Loại 1 Giá Xưởng Size(04,05)",80.000₫,https://tiki.vn/do-ngu-thun-lanh-loai-1-gia-xuong-size-04-05-p125174120.html?spid=186756506,3,-66%,,dongunu
đồ bộ mặc nhà chất lụa hàn,212.500,https://tiki.vn/do-bo-mac-nha-chat-lua-han-p170443484.html?spid=170443492,4,-58%,Đã bán 4,dongunu
,,https://tiki.vn/do-bo-lung-mac-nha-soc-caro-sieu-xinh-p176749828.html?spid=176749834,5,,,dongunu
"Bộ Đồ Nữ Mặc Nhà, Bộ Đồ Ngủ Thiết Kế Tole (Lanh) Cổ Ngang Quần Dài – 3COSTY. B3DCN Nhiều Họa Tiết",179.000₫,https://tiki.vn/bo-do-nu-mac-nha-bo-do-ngu-thiet-ke-tole-lanh-co-ngang-quan-dai-3costy-b3dcn-nhieu-hoa-tiet-p71177927.html?spid=71177943,6,,Đã bán 63,dongunu
Váy ngủ lụa phối ren mi mềm mịn mát xẻ tà Hantu-VSXD,280.000₫,https://tiki.vn/vay-ngu-lua-phoi-ren-mi-mem-min-mat-xe-ta-hantu-vsxd-p126932572.html?spid=126932584,7,,Đã bán 2,dongunu
Đầm Thun Lạnh Phối Ren Loại 1 (1.2.3),70.000₫,https://tiki.vn/dam-thun-lanh-phoi-ren-loai-1-1-2-3-p125625169.html?spid=186937061,8,,Đã bán 1,dongunu
"Bộ đồ ngủ hai dây sexy hở lưng quần dài, set đồ ngủ nữ đẹp vải satin",117.480,https://tiki.vn/bo-do-ngu-hai-day-sexy-ho-lung-quan-dai-set-do-ngu-nu-dep-vai-satin-p228993024.html?spid=228993032,9,,,dongunu
,,https://tiki.vn/63-75kg-lien-he-chon-mau-moi-do-bo-bigsize-dui-in-3d-hoat-hinh-chat-thun-lanh-do-bo-dui-bigsize-do-bo-thun-lanh-bigsize-meo-kitty-tho-melody-bobigsizedui4thunlanh-p160754450.html?spid=160754455,10,,,dongunu
Áo ngủ lưới liền vớ sexy TK2729,100.000₫,https://tiki.vn/ao-ngu-luoi-lien-vo-sexy-tk2729-p112602963.html?spid=112602965,11,,,dongunu
Bodysuit lưới sexy nóng bỏng TK2951,100.000,https://tiki.vn/bodysuit-luoi-sexy-nong-bong-tk2951-p152297080.html?spid=152297081,12,,,dongunu
,,https://tiki.vn/set-do-lot-cosplay-ren-xuyen-thau-kep-vo-sexy-tk2767-p115012368.html?spid=115012369,13,,,dongunu
Bộ mặc nhà bigsize nữ thun mát đồ bộ cotton BC11,103.000₫,https://tiki.vn/bo-mac-nha-bigsize-nu-thun-mat-do-bo-cotton-bc11-p147124085.html?spid=147124155,14,,Đã bán 14,dongunu
Bộ Đồ thú Khủng Long xanh liền thân lông mịn Pijama dành Cho Người Lớn và Trẻ Em kiểu dáng Động Vật Hoạt Hình Cosplay,256.000₫,https://tiki.vn/bo-do-thu-khung-long-xanh-lien-than-long-min-pijama-danh-cho-nguoi-lon-va-tre-em-kieu-dang-dong-vat-hoat-hinh-cosplay-p119669726.html?spid=119669885,15,,Đã bán 7,dongunu
COMBO 3 QUẦN NGỦ NỮ THUN LẠNH MÀU NGẪU NHIÊN NHÃ DUNG STORE,94.050₫,https://tiki.vn/combo-3-quan-ngu-nu-thun-lanh-mau-ngau-nhien-nha-dung-store-p261996339.html?spid=261996345,16,,,dongunu
"Bộ Đồ Cho Người Trung Niên, Người Lớn Tuổi NGT07",350.000,https://tiki.vn/bo-do-cho-nguoi-trung-nien-nguoi-lon-tuoi-ngt07-p13668334.html?spid=13668336,17,,Đã bán 4,dongunu
,,https://tiki.vn/trang-phuc-cosplay-quyen-ru-p52338184.html?spid=52338185,18,,,dongunu
"Đồ Bộ Ngủ Nữ Sét Đồ Pijama Mặc Nhà Chất Satin Lụa Phối Viền Tay Dễ Thương, Giặt Không Nhắn, Form Dưới 60kg Mặc Thoải Mái",142.000₫,https://tiki.vn/do-bo-ngu-nu-set-do-pijama-mac-nha-chat-satin-lua-phoi-vien-tay-de-thuong-giat-khong-nhan-form-duoi-60kg-mac-thoai-mai-p66663666.html?spid=85624863,19,,Đã bán 17,dongunu
Bộ mặc nhà lanh (tole) Vicci BS3D.069.16 quần short vải Thái 3D cao cấp,105.000₫,https://tiki.vn/bo-mac-nha-lanh-tole-vicci-bs3d-069-16-quan-short-vai-thai-3d-cao-cap-hoa-tiet-la-nhieu-mau-p16681703.html?spid=16681705,20,,Đã bán 14,dongunu
Váy ngủ Cosplay cô dâu quyến rũ,210.000₫,https://tiki.vn/vay-ngu-cosplay-co-dau-quyen-ru-p69302814.html?spid=109344305,21,,,dongunu
"Đồ Mặc Ở Nhà Nữ Đùi 100% Tole/ Lanh Loại 1 - Bộ Quần Áo Ngủ Nữ 2 Dây Mặc Nhà Mùa Hè, Nhiều Mẫu Dễ Thương",299.000₫,https://tiki.vn/do-mac-o-nha-nu-dui-100-tole-lanh-loai-1-bo-quan-ao-ngu-nu-2-day-mac-nha-mua-he-nhieu-mau-de-thuong-p140412850.html?spid=173971044,22,,Đã bán 29,dongunu
Váy ngủ ren dây cột sexy kèm chip T305. SHIP HOẢ TỐC TPHCM. Đồ ngủ cosplay sexy ThaoBonita,115.000₫,https://tiki.vn/vay-ngu-ren-day-cot-sexy-kem-chip-t305-ship-hoa-toc-tphcm-do-ngu-cosplay-sexy-thaobonita-p155705723.html?spid=155705763,23,,,dongunu
"Váy ngủ ren lưới sexy, nóng bỏng kèm quần lót T151 GIAO HOẢ TỐC HCM",149.000₫,https://tiki.vn/vay-ngu-ren-luoi-sexy-nong-bong-kem-quan-lot-t151-giao-hoa-toc-hcm-p145180358.html?spid=145180366,24,,,dongunu
Bộ liền thân xẻ đáy ngực nơ độc đáo Y8504. Giao hoả tốc HCM,130.000,https://tiki.vn/bo-lien-than-xe-day-nguc-no-doc-dao-y8504-giao-hoa-toc-hcm-p208633446.html?spid=208633458,25,,,dongunu
,,https://tiki.vn/bodysuit-cosplay-nang-hau-hoc-sinh-dang-yeu-giao-hoa-toc-tphcm-p178604150.html?spid=178604157,26,,,dongunu
Miếng dán ngực gợi cảm GIAO HOẢ TỐC HCM,19.000₫,https://tiki.vn/mieng-dan-nguc-goi-cam-giao-hoa-toc-hcm-p165250934.html?spid=165250946,27,,,dongunu
Đồ ngủ cosplay kèm chân váy sexy P14 - Đầm ngủ cosplay gợi cảm - Đồ ngủ nữ quyến rũ,489.000₫,https://tiki.vn/do-ngu-cosplay-kem-chan-vay-sexy-p14-dam-ngu-cosplay-goi-cam-do-ngu-nu-quyen-ru-p192990224.html?spid=248884236,28,,,dongunu
Đồ sexy cosplay - Set ngủ da báo gợi cảm,491.000₫,https://tiki.vn/do-sexy-cosplay-set-ngu-da-bao-goi-cam-p96080083.html?spid=248884488,29,,,dongunu
Bộ Đồ Ngủ Hoạt Hình Dài Tay DND18 (Size,180.000,https://tiki.vn/bo-do-ngu-hoat-hinh-dai-tay-dnd18-p6774189.html?spid=6774193,30,,,dongunu
,,https://tiki.vn/do-bo-nu-quan-ao-nu-xinh-quan-ao-mac-nha-chat-tho-mem-mat-p203558573.html?spid=203558592,31,,,dongunu
Bộ Cosplay Nữ Y Tá (Không kèm tất và phụ kiện) - B.Lingerie,250.000₫,https://tiki.vn/bo-cosplay-nu-y-ta-khong-kem-tat-va-phu-kien-b-lingerie-p270846131.html?spid=270846132,32,,,dongunu
Đồ Mặc Nhà Nữ Sát Nách Thun Lụa Cao Cấp Natural Blow Miley Lingerie_DBC0501,240.000₫,https://tiki.vn/do-mac-nha-nu-sat-nach-thun-lua-cao-cap-natural-blow-miley-lingerie_dbc0501-p75979697.html?spid=75979699,33,,Đã bán 14,dongunu
"Đầm ngủ lụa WANNABE DNS43 váy ngủ 2 dây cổ yếm lưng phối ren xinh xắn, xẻ 2 giữa 2 đùi làm tăng nét nữ tính quyến rũ của bạn gái",450.000₫,https://tiki.vn/dam-ngu-phi-lua-cao-cap-wannabe-dns43-co-yem-phoi-ren-co-la-mat-nu-tinh-xinh-xan-p197901907.html?spid=197901915,34,,,dongunu
Bộ Đồ Kate Lửng Nữ Vincy Thoáng Mát BKL050S31,569.000,https://tiki.vn/bo-do-kate-lung-nu-vincy-thoang-mat-bkl050s31-p251255419.html?spid=251255423,35,,,dongunu
,,https://tiki.vn/vay-ngu-ren-xe-ta-b-lingerie-p271136054.html?spid=271136055,36,,,dongunu
"Váy Ngủ Lụa Dáng Xòe Xếp Tầng Có 4 Màu Trắng, Đen, Đỏ và Hồng Pastel-DREAMY-VX04",187.000₫,https://tiki.vn/vay-ngu-lua-dang-xoe-xep-tang-co-4-mau-trang-den-do-va-hong-pastel-dreamy-vx04-p69226347.html?spid=69226359,37,,Đã bán 40,dongunu
Đồ bộ Pijama nữ lụa mặc nhà cánh dơi mango cao cấp,155.000₫,https://tiki.vn/do-bo-pijama-nu-lua-mac-nha-canh-doi-mango-cao-cap-p207554953.html?spid=207554958,38,,,dongunu
ĐỒ BỘ THUN LẠNH THỜI TRANG 3 SIZE 50-75KG TÙY CHIỀU CAO (79),99.000₫,https://tiki.vn/do-bo-thun-lanh-thoi-trang-3-size-50-75kg-tuy-chieu-cao-79-p150312774.html?spid=186756510,39,,,dongunu
Váy ngủ 2 dây sexy với ren xuyên thấu phối trong suốt - SMS467,99.000₫,https://tiki.vn/vay-ngu-2-day-sexy-voi-ren-xuyen-thau-phoi-trong-suot-sms467-p271533818.html?spid=271533828,40,,,dongunu
