title,price,link_item,index,discount,sales,category
"Đồ bộ pijama mặc nhà nữ, lụa latin",370.000₫,https://tiki.vn/do-bo-pijama-mac-nha-nu-lua-latin-p140563312.html?spid=140563313,1,-40%,Đã bán 2,dongunu
"Đầm ngủ WANNABE DNS18 váy ngủ lụa cut out eo mông đan dây lưng xxx nóng bỏng, có thể tự do mở dây thật quyến rũ",420.000₫,https://tiki.vn/dam-ngu-phi-lua-cao-cap-wannabe-dns18-dan-lung-nong-bong-quyen-ru-p174849270.html?spid=174849278,2,-19%,,dongunu
"Bộ Đồ Mặc Nhà Cho Người Trung Niên, Người Lớn Tuổi NG42",290.000₫,https://tiki.vn/bo-do-mac-nha-cho-nguoi-trung-nien-nguoi-lon-tuoi-ng42-p13685091.html?spid=13685095,3,-12%,Đã bán 15,dongunu
"Bộ Pijama Nữ Mặc Ở Nhà chất lụa mịn mát, ít nhăn. Hoa văn và màu sắc trẻ trung, sang trọng. Mặc ở nhà hoặc đi dạo đều xinh. Size free dưới 60kg",145.000,https://tiki.vn/bo-pijama-nu-mac-o-nha-chat-lua-min-mat-it-nhan-p271518713.html?spid=271518717,4,-12%,,dongunu
,,https://tiki.vn/vay-ngu-ren-goi-cam-trong-suot-kem-quan-chip-p57719741.html?spid=57719742,5,-10%,,dongunu
"Bộ Ngủ Nữ Tay Ngắn Bồng Mặc Mùa Hè - Đồ Bộ Lụa Tơ Cao Cấp Quần Đùi Mặc Ở Nhà Nữ, Nhiều Họa Tiết Dễ Thương",459.000₫,https://tiki.vn/bo-ngu-nu-tay-ngan-bong-mac-mua-he-do-bo-lua-to-cao-cap-quan-dui-mac-o-nha-nu-nhieu-hoa-tiet-de-thuong-p148556553.html?spid=148556561,6,,Đã bán 6,dongunu
Váy ngủ quảng châu cao cấp G13- Váy ngủ sexy gợi cảm - Áo choàng sexy - Đầm ngủ sexy - Váy ngủ mặc nhà - Váy ngủ đẹp,104.000₫,https://tiki.vn/vay-ngu-quang-chau-cao-cap-g13-vay-ngu-sexy-goi-cam-ao-choang-sexy-dam-ngu-sexy-vay-ngu-mac-nha-vay-ngu-dep-p103358480.html?spid=103358573,7,,Đã bán 9,dongunu
Set cosplay học sinh siêu xinh sexy,159.000₫,https://tiki.vn/set-cosplay-hoc-sinh-sieu-xinh-sexy-p145179146.html?spid=145179194,8,,Đã bán 1,dongunu
Set nữ cảnh siêu xinh sexy GIAO HOẢ TỐC HCM,103.000,https://tiki.vn/set-nu-canh-sieu-xinh-sexy-giao-hoa-toc-hcm-p155705438.html?spid=155705445,9,,,dongunu
,,https://tiki.vn/ao-choang-ngu-nu-chat-voan-lua-mem-mai-kem-bo-lot-den-xanh-p48319064.html?spid=48319065,10,,,dongunu
Dreamy VX20 Váy Ngủ Lụa Cao Cấp Hai Dây Phối Ren Dáng Xòe Trẻ Trung Quyến Rũ,112.200₫,https://tiki.vn/dreamy-vx20-vay-ngu-lua-cao-cap-hai-day-phoi-ren-dang-xoe-tre-trung-quyen-ru-p111956986.html?spid=111957007,11,,Đã bán 7,dongunu
"Bộ 2 dây nữ, bộ đồ mặc nhà vải đũi mềm nhẹ, thoáng mát, nhiều màu size từ 40 - 75 kg, phong cách năng động dễ thương",160.000,https://tiki.vn/bo-2-day-nu-bo-do-mac-nha-vai-dui-mem-nhe-thoang-mat-nhieu-mau-size-tu-40-75-kg-phong-cach-nang-dong-de-thuong-p191298492.html?spid=191298509,12,,Đã bán 2,dongunu
,,https://tiki.vn/vay-ngu-hai-day-ren-doc-xuyen-thau-form-ngan-sexy-q99-dam-ngu-form-ngan-ren-doc-goi-cam-vay-ngu-p207882663.html?spid=207882664,13,,,dongunu
Đồ Bộ Ngủ Pijama Mặc Nhà Tay Dài Quần Dài Hàng Thiết Kế Chất Liệu Lụa Cao Cấp,225.000₫,https://tiki.vn/do-bo-ngu-pijama-mac-nha-tay-dai-quan-dai-hang-thiet-ke-chat-lieu-lua-cao-cap-p158815494.html?spid=158815496,14,,Đã bán 4,dongunu
Đồ Ngủ Sexy Nữ|Váy 2 Dây Quyến Rũ️ ️ Chất Phi Lụa Mềm Mịn Sang Chảnh,79.000₫,https://tiki.vn/do-ngu-sexy-nu-vay-2-day-quyen-ru-chat-phi-lua-mem-min-sang-chanh-p109860034.html?spid=104303802,15,,Đã bán 19,dongunu
Hantu Sleepwear-Đầm ngủ lụa cao cấp dáng tiểu thư mặc nhà sang chảnh,390.000₫,https://tiki.vn/hantu-sleepwear-dam-ngu-lua-cao-cap-dang-tieu-thu-mac-nha-sang-chanh-p189837117.html?spid=189837121,16,,,dongunu
Đầm ngủ WANNABE DNS05 váy ngủ 2 dây phối bèo ngực che vòng 1 kín đáo nhưng vẫn nữ tính mang lại vẻ xinh tươi cho bạn gái,400.000,https://tiki.vn/dam-ngu-phi-lua-wannabe-dns05-phoi-beo-nguc-nu-tinh-sang-trong-p71509419.html?spid=271126184,17,,,dongunu
,,https://tiki.vn/dam-ngu-phi-lua-cao-cap-wannabe-dns29-phoi-ren-suon-nu-tinh-nhe-nhang-p168705404.html?spid=168705413,18,,,dongunu
Bộ pizama nữ áo dài quần dài chất nhung cao cấp tay ren màu Hồng Xumaki Store BO135A,419.000₫,https://tiki.vn/bo-pizama-nu-ao-dai-quan-dai-chat-nhung-cao-cap-tay-ren-mau-hong-xumaki-store-bo135a-p213558454.html?spid=213558456,19,,,dongunu
Đồ Bộ Nữ Thun Cát Hàn Mặc Nhà Thời Trang Có Size Lớn,121.000₫,https://tiki.vn/do-bo-nu-thun-cat-han-mac-nha-thoi-trang-co-size-lon-p140753749.html?spid=174211982,20,,Đã bán 6,dongunu
"Váy ngủ hai dây nữ, đầm ngủ mặc nhà nữ cổ V dáng chữ A rộng rãi chất vải lanh lụa cotton thoáng mát nhiều màu mã V0251",69.000₫,https://tiki.vn/vay-ngu-hai-day-nu-dam-ngu-mac-nha-nu-co-v-dang-chu-a-rong-rai-chat-vai-lanh-lua-cotton-thoang-mat-nhieu-mau-ma-v0251-p155789312.html?spid=186080235,21,,Đã bán 2,dongunu
Set choàng + yếm Cosplay mỹ nhân Trung Hoa MS1314,140.000₫,https://tiki.vn/set-choang-yem-cosplay-my-nhan-trung-hoa-ms1314-p99158733.html?spid=113224722,22,,Đã bán 2,dongunu
Bộ ngủ 2 dây nữ có đệm ngực tiện lợi đồ ngủ mặc nhà mặc đi biển dễ thương [BC18,134.000₫,https://tiki.vn/bo-ngu-2-day-nu-co-dem-nguc-tien-loi-do-ngu-mac-nha-mac-di-bien-de-thuong-bc18-p96342807.html?spid=114856652,23,,Đã bán 38,dongunu
"Đầm ngủ, đầm mặc nhà, đầm 2 dây đuôi cá có mút ngực, chất vải mềm mại AH01",131.000₫,https://tiki.vn/dam-ngu-dam-mac-nha-dam-2-day-duoi-ca-co-mut-nguc-chat-vai-mem-mai-ah01-p179438624.html?spid=179438634,24,,Đã bán 1,dongunu
"Đầm ngủ Wacoal ILN4913 2 dây, vải thun co giãn thoáng mát",599.000,https://tiki.vn/dam-ngu-wacoal-iln4913-2-day-vai-thun-co-gian-thoang-mat-p263763838.html?spid=263763848,25,,,dongunu
,,https://tiki.vn/vay-ngu-lua-hai-day-phoi-ren-nguc-xe-ta-cao-cap-bt0169-dam-ngu-nu-2-day-quyen-ru-do-ngu-nu-sexy-vay-ngu-nu-goi-cam-p176788809.html?spid=176788815,26,,,dongunu
Đầm Ngủ SexyVáy ngủ Ren 2 Dây Quyến Rũ ️Kèm Quần Chip️ MỎNG Gợi Cảm Quyến Rũ,38.000₫,https://tiki.vn/dam-ngu-sexy-vay-ngu-ren-2-day-quyen-ru-kem-quan-chip-mong-goi-cam-quyen-ru-p109859384.html?spid=104302778,27,,Đã bán 5,dongunu
Váy ngủ 2 dây lụa mặc nhà nữ liền thân xẻ 1 bên cao cấp gợi cảm 1 màu đen,89.000₫,https://tiki.vn/vay-ngu-2-day-lua-mac-nha-nu-lien-than-xe-1-ben-cao-cap-goi-cam-1-mau-den-p107155254.html?spid=107155259,28,,Đã bán 1,dongunu
"Bộ ngủ 2 dây,đồ bộ nữ mặc nhà đùi vải xô dễ thương size 45-57kg",135.450₫,https://tiki.vn/bo-ngu-2-day-do-bo-nu-mac-nha-dui-vai-xo-de-thuong-size-45-57kg-p140775816.html?spid=140775871,29,,Đã bán 4,dongunu
Đồ bộ Ngủ Nữ Hisexy Lụa Satin Trơn Dáng Xuông Liền Thân MS07,139.000,https://tiki.vn/do-bo-ngu-nu-hisexy-lua-satin-tron-dang-xuong-lien-than-ms07-p124323548.html?spid=124323646,30,,,dongunu
,,https://tiki.vn/dam-ngu-phi-lua-cao-cap-wannabe-dns25-phoi-ren-than-tren-quyen-ru-quy-phai-p252869420.html?spid=252869432,31,,,dongunu
"Bộ Đồ Mặc Nhà Cho Người Trung Niên, Người Lớn Tuổi NG11",370.000₫,https://tiki.vn/bo-do-mac-nha-cho-nguoi-trung-nien-nguoi-lon-tuoi-ng11-p13411302.html?spid=13411308,32,,Đã bán 22,dongunu
"Bộ Nữ Umi SANAHA Mặc Ở Nhà, Co Dãn 4 Chiều, Thoáng Mát",199.000₫,https://tiki.vn/bo-nu-umi-sanaha-mac-o-nha-co-dan-4-chieu-thoang-mat-p132783571.html?spid=137133350,33,,,dongunu
[HCM] (40-55kg) Đồ bộ pijama/pizama/pyjama đùi nữ chất satin. Đồ bộ mặc nhà nữ. Đồ bộ mặc ngủ nữ. Ảnh thật sản phẩm. Họa tiết: mặt trăng - ngôi sao - cô bé - gấu brown thỏ cony - hồng hạc flamingo - mèo kitty,119.000₫,https://tiki.vn/40-55kg-do-bo-pijama-pizama-pyjama-dui-nu-chat-satin-do-bo-mac-nha-nu-do-bo-mac-ngu-nu-anh-that-san-pham-hoa-tiet-mat-trang-ngoi-sao-co-be-gau-brown-tho-cony-hong-hac-flamingo-meo-kitty-p80635520.html?spid=80635847,34,,Đã bán 24,dongunu
Váy ngủ pha ren xuyên thấu - Tím,45.000₫,https://tiki.vn/vay-ngu-pha-ren-xuyen-thau-tim-p73514230.html?spid=73514231,35,,,dongunu
,,https://tiki.vn/vay-ngu-hai-day-quyen-ru-bo-do-mac-nha-bo-do-ngu-hai-day-nu-chat-lieu-lua-phong-cach-han-quoc-phu-hop-cho-mua-he-v164-p19908405.html?spid=50875445,36,,,dongunu
Bộ Đồ Ngủ Tay Voan Nhún Bèo Loirechic LPD12 (Áo dài & Quần dài),629.100₫,https://tiki.vn/bo-do-ngu-tay-voan-nhun-beo-loirechic-lpd12-ao-dai-quan-dai-p155644720.html?spid=155644728,37,,Đã bán 2,dongunu
"Bộ lửng lụa thiết kế 40-60kg, bộ nữ pijama mặc nhà L05",155.000₫,https://tiki.vn/bo-lung-lua-thiet-ke-40-60kg-bo-nu-pijama-mac-nha-l05-p249579873.html?spid=249579874,38,,,dongunu
đồ bộ mặc nhà đẹp,212.500₫,https://tiki.vn/do-bo-mac-nha-dep-p140921965.html?spid=140922181,39,,Đã bán 2,dongunu
[RẺ VÔ ĐỊCH] Dài Bigsize Pijama 50-70kg Lụa Hàn cao cấp - Đồ bộ nữ đồ ngủ mặc nhà xịn,169.000,https://tiki.vn/re-vo-dich-dai-bigsize-pijama-50-70kg-lua-han-cao-cap-do-bo-nu-do-ngu-mac-nha-xin-p141678347.html?spid=141678348,40,,,dongunu
