title,price,link_item,index,discount,sales,category
Váy ngủ 2 dây lụa satin siêu quyến rũ - Trắng,115.000₫,https://tiki.vn/vay-ngu-2-day-lua-satin-sieu-quyen-ru-trang-p57721951.html?spid=57721952,1,,Đã bán 32,dongunu
Váy Ngủ Ren Siêu Sexy Ăm Ắp Gợi Cảm - Váy Ngủ Ren Tặng Kèm 1 Quần Chip Hàng Loại 1,79.000₫,https://tiki.vn/-mau-do--vay-dam-ngu-chat-lieu-ren--sieu-sexy-am-ap-goi-cam---tang-kem-1-quan-chip-cho-ban-gai-40-58kg-hang-loai-1-p59109039.html?spid=59109040,2,-25%,Đã bán 17,dongunu
Bộ Đồ Ngủ Họa Tiết Đáng Yêu - B.Lingerie,240.000₫,https://tiki.vn/bo-do-ngu-hoa-tiet-dang-yeu-b-lingerie-p197218203.html?spid=197218204,3,-3%,,dongunu
Áo choàng ngủ quảng châu cao cấp Ren phối voan thun kèm quần lót lọt khe quyến rũ g13,153.000,https://tiki.vn/ao-choang-ngu-quang-chau-cao-cap-ren-phoi-voan-thun-kem-quan-lot-lot-khe-quyen-ru-g13-p85903044.html?spid=85903051,4,,,dongunu
,,https://tiki.vn/vay-ngu-voan-sieu-mat-vay-ngu-sexy-g37-dam-ngu-mac-nha-do-ngu-mac-nha-vay-ngu-mac-nha-ao-so-mi-mac-nha-p103358039.html?spid=103358073,5,,,dongunu
Váy ngủ quảng châu cao cấp – Váy ngủ sexy ren G9 – Váy ngủ gợi cảm – Đầm ngủ ren hoa – Đồ ngủ sexy – Váy ngủ sexy,147.000₫,https://tiki.vn/vay-ngu-quang-chau-cao-cap-vay-ngu-sexy-ren-g9-vay-ngu-goi-cam-dam-ngu-ren-hoa-do-ngu-sexy-vay-ngu-sexy-p103358070.html?spid=103358135,6,,Đã bán 1,dongunu
BỘ ĐỒ THIẾT KẾ ĐỘC LẠ _ TB 200.130,819.000₫,https://tiki.vn/bo-do-thiet-ke-doc-la-_-tb-200-130-p136178121.html?spid=206873316,7,,,dongunu
"Đầm/ váy ngủ cosplay nữ sinh quyến rũ VN24 , đầm ngủ gợi cảm, váy ngủ cosplay, đồ lót sexy, Freesize",149.000₫,https://tiki.vn/dam-vay-ngu-cosplay-nu-sinh-quyen-ru-vn24-dam-ngu-goi-cam-vay-ngu-cosplay-do-lot-sexy-freesize-p105700149.html?spid=105700153,8,,Đã bán 1,dongunu
Bộ ngủ thể dục cosplay phòng the quyến rũ T110 GIAO HOẢ TỐC HCM,88.000₫,https://tiki.vn/bo-ngu-the-duc-cosplay-phong-the-quyen-ru-t110-giao-hoa-toc-hcm-p155705964.html?spid=155705981,9,,,dongunu
,,https://tiki.vn/bo-quan-ao-len-tam-giu-nhiet-om-body-cho-nu-p67631286.html?spid=68843791,10,,,dongunu
Bodysuit xẻ đáy hở lưng phối ngọc độc đáo quyến rũ. Giao hỏa tốc HCM,110.000₫,https://tiki.vn/bodysuit-xe-day-ho-lung-phoi-ngoc-doc-dao-quyen-ru-giao-hoa-toc-hcm-p197866425.html?spid=197866438,11,,Đã bán 1,dongunu
"Bộ Đồ Mặc Nhà Nữ Cho Người Trung Niên, Người Lớn Tuổi NG19 - Size",315.000,https://tiki.vn/bo-do-mac-nha-nu-cho-nguoi-trung-nien-nguoi-lon-tuoi-ng19-p8448045.html?spid=69764373,12,,Đã bán 4,dongunu
,,https://tiki.vn/vay-ngu-nu-2-day-ay-mac-nha-hinh-dau-cute-v41-p109981970.html?spid=109982030,13,,,dongunu
Sét bộ thun hàng bigsize cho người mập - 01,143.000₫,https://tiki.vn/set-bo-thun-hang-bigsize-cho-nguoi-map-p269899732.html?spid=269899761,14,,Đã bán 5,dongunu
Bộ Đồ Ngủ 2 Dây Basic BHDN01,299.000₫,https://tiki.vn/bo-do-ngu-2-day-basic-bhdn01-p243096363.html?spid=243096367,15,,,dongunu
Bộ Đồ Thun Lửng Nữ Vincy Thoáng Mát BTL026S11,529.000₫,https://tiki.vn/bo-do-thun-lung-nu-vincy-thoang-mat-btl026s11-p269986554.html?spid=269986558,16,,,dongunu
Đầm ngủ phi lụa cao cấp WANNABE DNS50 váy ngủ hai dây cut-out lưng trang trí 4 dây hình chữ M khoe eo quyến rũ gợi cảm,350.000,https://tiki.vn/dam-ngu-phi-lua-cao-cap-wannabe-dns50-kieu-dam-hai-day-cut-out-lung-quyen-ru-goi-cam-p180590331.html?spid=180590333,17,,Đã bán 3,dongunu
,,https://tiki.vn/dam-ngu-phi-lua-cao-cap-wannabe-dns68-co-tim-phoi-ren-don-gian-trang-nha-p225970682.html?spid=225970694,18,,,dongunu
Váy ngủ satin hai dây đan hông sexy Q01 - Đầm ngủ lụa satin gợi cảm - Đồ ngủ nữ quyến rũ,220.000₫,https://tiki.vn/vay-ngu-satin-hai-day-dan-hong-sexy-bt0028-dam-ngu-lua-satin-goi-cam-do-ngu-nu-quyen-ru-p185225579.html?spid=185225581,19,,Đã bán 2,dongunu
Set váy ngủ lụa hai dây cao cấp kèm áo choàng lụa Q141 - Áo choàng lụa kèm váy ngủ lụa - Đồ ngủ nữ,350.000₫,https://tiki.vn/set-vay-ngu-lua-hai-day-cao-cap-kem-ao-choang-lua-q141-ao-choang-lua-kem-vay-ngu-lua-do-ngu-nu-p207360554.html?spid=207360555,20,,,dongunu
Váy ngủ ren xuyên thấu sexy gợi cảm Q162 - Đồ ngủ sexy - Đầm ngủ nữ - Váy ngủ mặc nhà,199.000₫,https://tiki.vn/vay-ngu-ren-xuyen-thau-sexy-goi-cam-bt0075-do-ngu-sexy-dam-ngu-nu-vay-ngu-mac-nha-p173885852.html?spid=173885860,21,,Đã bán 2,dongunu
"Set Đồ Ngủ Sexy Nữ Đồ Bộ Nữ Hai Dây Chéo Lưng, Ngực Thêu Hoa Tạo Sự Gợi Cảm Hấp Dẫn Cho Bạn Gái",39.000₫,https://tiki.vn/set-do-ngu-sexy-nu-do-bo-nu-hai-day-cheo-lung-nguc-theu-hoa-tao-su-goi-cam-hap-dan-cho-ban-gai-p70261545.html?spid=70261553,22,,Đã bán 7,dongunu
Bộ ngủ Cosplay lưới liền thân có tay sexy MS81,32.000₫,https://tiki.vn/bo-ngu-cosplay-luoi-lien-than-co-tay-sexy-ms81-p152633250.html?spid=152633251,23,,,dongunu
Bộ đồ ngủ cosplay nữ học sinh áo croptop với chân váy ngắn - SMS034,160.000₫,https://tiki.vn/bo-do-ngu-cosplay-nu-hoc-sinh-ao-croptop-voi-chan-vay-ngan-sms034-p271532022.html?spid=271532031,24,,,dongunu
Bộ thu đông nữ Sambi nỉ dài tay quần kẻ họa tiết cao cấp,350.000,https://tiki.vn/bo-thu-dong-nu-sambi-ni-dai-tay-quan-ke-hoa-tiet-cao-cap-p148819421.html?spid=148819427,25,,,dongunu
,,https://tiki.vn/hantu-se-vay-ngu-lua-cao-cap-vay-ngu-nu-vay-ngu-2-day-vay-ngu-goi-cam-vay-ngu-sexy-dam-ngu-lua-mac-nha-hai-day-phoi-ren-nguc-co-4-mau-den-xanh-den-do-hong-cam-p126934335.html?spid=126934345,26,,,dongunu
Áo liền thân Bodysuit sexy gợi cảm,79.000₫,https://tiki.vn/ao-lien-than-bodysuit-sexy-goi-cam-p181449290.html?spid=181449294,27,,,dongunu
Bịt Mắt Ngủ Dễ Thương - Bịt Mắt Ngủ Hoạt Hình Loại Xịn Kèm Túi Nước Mát Dưỡng Mắt Ngủ,31.500₫,https://tiki.vn/bit-mat-ngu-de-thuong-bit-mat-ngu-hoat-hinh-loai-xin-kem-tui-nuoc-mat-duong-mat-ngu-p153986113.html?spid=153986121,28,,Đã bán 1,dongunu
"Đồ bộ nữ,đồ ngủ mặc nhà lửng 9 tấc vải lụa mango BL 47 họa tiết hoa nhí dễ thương size 47-65kg",152.250₫,https://tiki.vn/do-bo-nu-do-ngu-mac-nha-lung-9-tac-vai-lua-mango-bl-47-hoa-tiet-hoa-nhi-de-thuong-size-47-65kg-p157427306.html?spid=157427347,29,,Đã bán 1,dongunu
Váy Ngủ Gợi Cảm ️FreeShip - Chất Đẹp️Ren Mềm Mát Mịn Quyến Rũ,89.000₫,https://tiki.vn/vay-ngu-goi-cam-chat-dep-ren-mem-mat-min-quyen-ru-p104303429.html?spid=104303462,30,,,dongunu
,,https://tiki.vn/bodysuit-chat-lieu-ren-quyen-ru-danh-cho-cac-nang-p162205208.html?spid=162205212,31,,,dongunu
Váy ngủ lụa phối ren cực sexy,125.000₫,https://tiki.vn/vay-ngu-lua-phoi-ren-cuc-sexy-p68962006.html?spid=68962051,32,,Đã bán 2,dongunu
BỘ NỈ MÙA ĐÔNG SIÊU ẤM ÁP,455.000₫,https://tiki.vn/bo-ni-mua-dong-sieu-am-ap-p117185210.html?spid=117185286,33,,Đã bán 3,dongunu
"Mã T1x Bộ Đồ Ngủ 2 Dây Quần Cộc Nữ, Váy Ngủ 2 Dây HISEXY Chất Lụa Satin Cao Cấp Mặc Nhà Đủ Size Dưới 65Kg",300.000₫,https://tiki.vn/ma-t1x-bo-do-vay-ngu-2-day-quan-coc-nu-hisexy-chat-lua-satin-cao-cap-mac-nha-p73911227.html?spid=73911281,34,,Đã bán 17,dongunu
Đồ Bộ Ngủ Phối Ren Chất Thun Lạnh Cao Cấp Anh Phúc + Bộ Bản Ren,80.000₫,https://tiki.vn/do-bo-ngu-phoi-ren-chat-thun-lanh-cao-cap-anh-phuc-bo-ban-ren-p81762030.html?spid=225194809,35,,,dongunu
,,https://tiki.vn/vay-ngu-vien-ren-goi-cam-quyen-ru-lylylorem-sx46-p157260203.html?spid=157260207,36,,,dongunu
"[XẢ KHO, GIẢM GIÁ] Đồ bộ pijama mặc nhà lụa cao cấp",425.000₫,https://tiki.vn/do-bo-pijama-mac-nha-lua-cao-cap-p103215779.html?spid=103215849,37,,,dongunu
Bộ Đồ Pijama Nữ Mặc Nhà Ngắn Tay Azuno BN0405 Chất Liệu Cotton Lụa Có Lót Ngực Tiện Lợi Cho Mùa Hè,360.000₫,https://tiki.vn/bo-do-pijama-nu-mac-nha-ngan-tay-azuno-bn0405-chat-lieu-cotton-lua-co-lot-nguc-tien-loi-cho-mua-he-p178100393.html?spid=178100399,38,,Đã bán 9,dongunu
"Đồ bộ mặc nhà WANNABE BDS54 đồ bộ quần dài áo bản vai 2 cm đính nơ xinh xắn, cổ áo hình chữ M phối ren nữ tính",500.000₫,https://tiki.vn/do-bo-mac-nha-phi-lua-cao-cap-wannabe-bo-dai-bds54-xinh-xan-nu-tinh-p221713236.html?spid=221713248,39,,Đã bán 1,dongunu
Đầm Ngủ Lụa Satin Cổ Tròn - Cổ Sơ Mi (P2),251.500,https://tiki.vn/dam-ngu-lua-satin-co-tron-co-so-mi-p2-p120791094.html?spid=120791146,40,,,dongunu
