title,price,link_item,index,discount,sales,category
Bộ Quần Áo Nam SE74,282.000₫,https://tiki.vn/bo-quan-ao-nam-se74-p22254293.html?spid=22254299,1,-50%,Đã bán 11,dongunam
Bộ Quần Áo Nam SE50,282.000₫,https://tiki.vn/bo-quan-ao-nam-se50-p22254780.html?spid=22254786,2,,Đã bán 11,dongunam
Bộ Thể Thao Nam Sọc Tay Thiết Kế Cao Cấp Thời Trang AVIANO,269.000₫,https://tiki.vn/bo-the-thao-nam-soc-tay-thiet-ke-cao-cap-thoi-trang-aviano-p222677337.html?spid=222677355,3,-50%,Đã bán 7,dongunam
"Sét đồ bộ nam, chất cotton mềm mịn, sang trọng mẫu mới OB1",332.500,https://tiki.vn/set-do-bo-nam-chat-cotton-mem-min-sang-trong-mau-moi-ob1-p272382986.html?spid=272382988,4,-50%,,dongunam
,,https://tiki.vn/bo-do-the-thao-nam-mua-he-chat-lieu-thun-mem-min-thoang-mat-co-du-mau-in-hoat-hinh-space-p261024860.html?spid=261024864,5,-26%,,dongunam
Đồ đi chùa nam đồ lam đồ thời trang nam bigsize,203.000₫,https://tiki.vn/do-di-chua-nam-do-lam-do-thoi-trang-nam-bigsize-p118038882.html?spid=118040840,6,,Đã bán 1,dongunam
Set Bộ quần áo thể thaoThể Thao Nam Kẻ Sọc Cực Chất Cao Cấp,109.000₫,https://tiki.vn/set-bo-quan-ao-the-thaothe-thao-nam-ke-soc-cuc-chat-cao-cap-p67296166.html?spid=67296168,7,,Đã bán 3,dongunam
Đồ Lam Đi Chùa # Tim Tâm # Nam Nữ,206.000₫,https://tiki.vn/do-lam-di-chua-tim-tam-nam-nu-p118019993.html?spid=118025193,8,,Đã bán 4,dongunam
Đồ Bộ Thể Thao Nam Nữ LITTLE BOY- Set Quần Áo bốn mùa đẹp cao cấp mặc nhà đi chơi thoải mái 04 (TÂM SHOP),49.000₫,https://tiki.vn/do-bo-the-thao-nam-nu-little-boy-set-quan-ao-bon-mua-dep-cao-cap-mac-nha-di-choi-thoai-mai-04-tam-shop-p249230359.html?spid=249230444,9,,,dongunam
,,https://tiki.vn/bo-the-thao-nam-mua-he-do-bo-nam-coc-tay-co-tron-thoang-mat-p249235499.html?spid=249235553,10,,,dongunam
Bộ quần áo nam kaki phong cách lính mỹ (xanh),1.700.000₫,https://tiki.vn/bo-quan-ao-nam-kaki-phong-cach-linh-my-xanh-p114775100.html?spid=114775310,11,,Đã bán 3,dongunam
-Bộ nỉ nam thể thao xuất dư phom Âu tới 90kg( ảnh thật shop chụp),269.000,https://tiki.vn/bo-ni-nam-the-thao-xuat-du-phom-au-toi-90kg-anh-that-shop-chup-p205518818.html?spid=205518838,12,,Đã bán 1,dongunam
,,https://tiki.vn/quan-ao-linh-thuy-quan-luc-chien-my-quan-tui-hop-nam-gia-re-kieu-linh-ao-linh-my-p103030445.html?spid=103030568,13,,,dongunam
Bộ thun thể thao nam Fasvin AB20221.HN cộc tay cổ bẻ vải thể thao mềm nhẹ co giãn tốt,229.000₫,https://tiki.vn/bo-thun-the-thao-nam-fasvin-ab20221-hn-coc-tay-co-be-vai-the-thao-mem-nhe-co-gian-tot-p100367478.html?spid=100367879,14,,,dongunam
"Bộ thun thể thao nam fasvin AB20288.HN cổ bẻ vải thể thao mềm nhẹ co giãn thoải mái, trẻ trung",229.000₫,https://tiki.vn/bo-thun-the-thao-nam-fasvin-ab20288-hn-co-be-vai-the-thao-mem-nhe-co-gian-thoai-mai-tre-trung-p100369039.html?spid=100369170,15,,,dongunam
Set bộ đồ Thun Nam Thể Thao Mùa Hè in mặt Gấu Kiểu Dáng Năng Động Hàn Quốc Hot,93.000₫,https://tiki.vn/set-bo-do-thun-nam-the-thao-mua-he-in-mat-gau-kieu-dang-nang-dong-han-quoc-hot-p195454644.html?spid=195454649,16,,,dongunam
"Bộ Quần Áo Thun Nam Nữ Unisex Mùa Hè Ngắn Tay Cổ Tròn Phối Quần Đùi Họa Tiết Thời Trang, Set đồ bộ nam chất thun cotton co giản thoáng mát, thời trang đồ bộ thể thao nam, Set Bộ Quần Áo Thể Thao Nam Mùa hè Co Dãn",99.000₫,https://tiki.vn/bo-quan-ao-thun-nam-nu-unisex-mua-he-ngan-tay-co-tron-phoi-quan-dui-hoa-tiet-thoi-trang-set-do-bo-nam-chat-thun-cotton-co-gian-thoang-mat-thoi-trang-do-bo-the-thao-nam-set-bo-quan-ao-the-thao-nam-mua-he-co-dan-p185943431.html?spid=185943437,17,,,dongunam
,,https://tiki.vn/bo-quan-ao-dui-nam-trang-tron-dang-om-settrang99-p57061795.html?spid=57061797,18,,,dongunam
ĐỒ THỂ THAO CẶP ĐÔI NGUYÊN BỘ THỂ THAO CHẤT THUN LẠNH NHIỀU MÀU,86.000₫,https://tiki.vn/do-the-thao-cap-doi-nguyen-bo-the-thao-chat-thun-lanh-nhieu-mau-p68722263.html?spid=70798508,19,,Đã bán 2,dongunam
Bộ pyjamas nam dài tay vải bamboo tự nhiên cao cấp Chou's - màu ghi,575.000₫,https://tiki.vn/bo-pyjamas-nam-dai-tay-vai-bamboo-tu-nhien-cao-cap-chou-s-mau-ghi-p93933663.html?spid=93933669,20,,Đã bán 1,dongunam
BỘ ĐỒ PIJAMA NAM CAO CẤP QM124,350.000₫,https://tiki.vn/bo-do-pijama-nam-cao-cap-qm124-p87476965.html?spid=87477128,21,,,dongunam
Bộ đồ nam vải đũi cao cấp mặc mát sang trọng 4 MÀU,105.000₫,https://tiki.vn/bo-do-nam-vai-dui-cao-cap-mac-mat-sang-trong-4-mau-p207303927.html?spid=207304055,22,,,dongunam
"Bộ đồ mặc nhà, mặc ngủ nam tay ngắn QSHOP QM676 - QM679",350.000₫,https://tiki.vn/bo-do-mac-nha-mac-ngu-nam-tay-ngan-qshop-qm676-qm679-p247359151.html?spid=247359157,23,,Đã bán 1,dongunam
"Bộ đồ pijama nam quần dài, tay ngắn QM504",290.000₫,https://tiki.vn/bo-do-pijama-nam-quan-dai-tay-ngan-qm504-p178953343.html?spid=178953353,24,,,dongunam
Bộ đồ pijama nam Luxury quần dài tay dài QSHOP QM812,490.000,https://tiki.vn/bo-do-pijama-nam-luxury-quan-dai-tay-dai-qshop-qm812-p273212343.html?spid=273212345,25,,,dongunam
,,https://tiki.vn/do-bo-nam-mua-he-chat-thun-cotton-mat-tham-hut-mo-hoi-don-gian-thoi-trang-phong-cach-p114316865.html?spid=138826735,26,,,dongunam
Bộ đồ pijama nam ngắn tay mẫu mới QSHOP QM696,300.000₫,https://tiki.vn/bo-do-pijama-nam-ngan-tay-mau-moi-qshop-qm696-p252662311.html?spid=252662313,27,,,dongunam
"Bộ đồ pijama nam quần dài, tay dài QSHOP QM707",300.000₫,https://tiki.vn/bo-do-pijama-nam-quan-dai-tay-dai-qshop-qm707-p253099441.html?spid=253099443,28,,,dongunam
Đồ Bộ Thể Thao Nam Nữ LITTLE BOY- Set Quần Áo bốn mùa đẹp cao cấp mặc nhà đi chơi thoải mái 01 (TÂM SHOP),38.000₫,https://tiki.vn/do-bo-the-thao-nam-nu-little-boy-set-quan-ao-bon-mua-dep-cao-cap-mac-nha-di-choi-thoai-mai-01-tam-shop-p249234320.html?spid=249234467,29,,,dongunam
Set bộ nỉ da cá,319.000,https://tiki.vn/set-bo-ni-da-ca-p167611925.html?spid=167611928,30,,,dongunam
,,https://tiki.vn/bo-the-thao-nam-coc-tay-mau-he-thun-lanh-co-dan-bo-nam-he-phong-cach-tre-trung-thoang-mat-bo03-proman-p214162734.html?spid=214162808,31,,,dongunam
Đồ Lam Đi Chùa # Xéo Nhật Viền Nam # Đồ Bộ Nam # Quần Áo Nam,210.000₫,https://tiki.vn/do-lam-di-chua-xeo-nhat-vien-nam-do-bo-nam-quan-ao-nam-p118020324.html?spid=118026481,32,,Đã bán 9,dongunam
# đồ bộ đi chùa#đồ nam phật tử nam thêu,216.000₫,https://tiki.vn/do-bo-di-chua-do-nam-phat-tu-nam-theu-p134373396.html?spid=134373624,33,,Đã bán 2,dongunam
Bộ thể thao Big Size nam Fasvin AB162.HN cộc tay không cổ chất vải mềm mịn,399.000₫,https://tiki.vn/bo-the-thao-big-size-nam-fasvin-ab162-hn-coc-tay-khong-co-chat-vai-mem-min-p100366780.html?spid=100366977,34,,,dongunam
bộ thun lạnh huido đồ bộ thể thao quần thun áo thun in đẹp chất mát,69.000₫,https://tiki.vn/bo-thun-lanh-huido-do-bo-the-thao-quan-thun-ao-thun-in-dep-chat-mat-p249234535.html?spid=249234549,35,,,dongunam
,,https://tiki.vn/bo-quan-bo-sua-phoi-ao-tay-lo-form-rong-unisex-set-bo-thun-nu-nam-unisex-bo-sua-thoitrangteenthienha-p105699944.html?spid=125168992,36,,,dongunam
"SET ĐỒ MẶC NHÀ NAM , ĐỒ BỘ NAM CỰC ĐẸP HOT NHẤT 2021 LANA FASHION",90.000₫,https://tiki.vn/set-do-mac-nha-nam-do-bo-nam-cuc-dep-hot-nhat-2021-lana-fashion-p158666967.html?spid=171816305,37,,,dongunam
Bộ quần áo thể thao nam nữ logo ba sọc,90.000₫,https://tiki.vn/bo-quan-ao-the-thao-nam-nu-logo-ba-soc-p71942072.html?spid=73419832,38,,Đã bán 13,dongunam
Bộ Thể Thao Nam Cộc Tay Cổ Tròn Chất Thun Co Giãn Thấm Hút Mồ Hôi Form Body,165.000₫,https://tiki.vn/bo-the-thao-nam-coc-tay-co-tron-chat-thun-co-gian-tham-hut-mo-hoi-form-body-p86379759.html?spid=95861300,39,,,dongunam
Đồ bộ thun thể thao nam,249.000,https://tiki.vn/do-bo-thun-the-thao-nam-p148845327.html?spid=148845329,40,,,dongunam
