title,price,link_item,index,discount,sales,brand
Bộ quần áo dài bé gái họa tiết Bi đỏ viền xanh lá cotton - AICDBGVQ5JJB - AIN Closet,155.000₫,https://tiki.vn/bo-quan-ao-dai-be-gai-hoa-tiet-bi-do-vien-xanh-la-cotton-aicdbgvq5jjb-ain-closet-p186862692.html?spid=186862701,1,-26%,Đã bán 13,AIN_Closet
Bộ quần áo Dài bé gái họa tiết Quả Cherry Đỏ nền Hồng thun cotton - AICDBGKJXXUW - AIN Closet,145.000₫,https://tiki.vn/bo-quan-ao-dai-be-gai-hoa-tiet-qua-cherry-do-nen-hong-thun-cotton-aicdbgkjxxuw-ain-closet-p273355746.html?spid=273355748,2,-26%,,AIN_Closet
Bộ quần áo dài bé gái họa tiết Hoa Anh Thảo quần vàng cotton - AICDBGZJELE6 - AIN Closet,155.000₫,https://tiki.vn/bo-quan-ao-dai-be-gai-hoa-tiet-hoa-anh-thao-quan-vang-cotton-aicdbgzjele6-ain-closet-p199053947.html?spid=199053953,3,-26%,,AIN_Closet
Bộ quần áo dài bé gái họa tiết Bi Nhí nâu thun cotton - AICDBGLUIRSG - AIN Closet,145.000,https://tiki.vn/bo-quan-ao-dai-be-gai-hoa-tiet-bi-nhi-nau-thun-cotton-aicdbgluirsg-ain-closet-p205974682.html?spid=205974696,4,,,AIN_Closet
,,https://tiki.vn/dam-be-gai-len-do-theu-hoa-aicdbggslshh-ain-closet-p94789975.html?spid=94789981,5,,,AIN_Closet
Đầm bé gái họa tiết Hoa hồng tím cotton - AICDBGGCSAV1 - AIN Closet,175.000₫,https://tiki.vn/dam-be-gai-hoa-tiet-hoa-hong-tim-cotton-aicdbggcsav1-ain-closet-p191436388.html?spid=191436394,6,-24%,Đã bán 5,AIN_Closet
Đầm bé gái họa tiết Hoa Lan cam cotton linen - AICDBGRGTBCI - AIN Closet,175.000₫,https://tiki.vn/dam-be-gai-hoa-tiet-hoa-lan-cam-cotton-linen-aicdbgrgtbci-ain-closet-p170877620.html?spid=170877632,7,-27%,,AIN_Closet
Bộ quần áo Ngắn bé gái họa tiết Cầu Vồng Gấu Vàng cotton - AICDBGJPCOKD - AIN Closet,155.000₫,https://tiki.vn/bo-quan-ao-ngan-be-gai-hoa-tiet-cau-vong-gau-vang-cotton-aicdbgjpcokd-ain-closet-p273679898.html?spid=273679904,8,-24%,,AIN_Closet
Bộ quần áo Dài tay ngắn bé gái họa tiết Gấu Cam cotton - AICDBGQW6GUJ - AIN Closet,155.000,https://tiki.vn/bo-quan-ao-dai-tay-ngan-be-gai-hoa-tiet-gau-cam-cotton-aicdbgqw6guj-ain-closet-p273679684.html?spid=273679706,9,,,AIN_Closet
,,https://tiki.vn/bo-quan-dai-ao-tay-ngan-be-gai-hoa-tiet-hoa-nhi-vang-xanh-xo-muslin-aicdbgqfyejs-ain-closet-p134236034.html?spid=134236036,10,,,AIN_Closet
Bộ quần áo ngắn bé gái họa tiết Hoa nhí cam túi tim - AICDBGE0BBDV - AIN Closet,155.000₫,https://tiki.vn/bo-quan-ao-ngan-be-gai-hoa-tiet-hoa-nhi-cam-tui-tim-aicdbge0bbdv-ain-closet-p107420867.html?spid=107420871,11,-18%,Đã bán 1,AIN_Closet
Áo khoác có nón bé gái họa tiết Cún Nâu thun cotton. - AICDBGZMIJ5B - AIN Closet,165.000,https://tiki.vn/ao-khoac-co-non-be-gai-hoa-tiet-cun-nau-thun-cotton-aicdbgzmij5b-ain-closet-p271946864.html?spid=271946876,12,,,AIN_Closet
,,https://tiki.vn/bo-quan-ao-dai-be-gai-hoa-tiet-hoa-bi-cam-cotton-aicdbgfkz6am-ain-closet-p273214174.html?spid=273214176,13,,,AIN_Closet
Bộ quần dài áo tay ngắn họa tiết Caro tím cổ sen cotton - AICDBGNZJKIH - AIN Closet,155.000₫,https://tiki.vn/bo-quan-dai-ao-tay-ngan-hoa-tiet-caro-tim-co-sen-cotton-aicdbgnzjkih-ain-closet-p148802822.html?spid=148802826,14,-21%,,AIN_Closet
Bộ quần áo ngắn bé gái họa tiết Gấu Ted Đỏ cotton - AICDBGNWIUYJ - AIN Closet,155.000₫,https://tiki.vn/bo-quan-ao-ngan-be-gai-hoa-tiet-gau-ted-do-cotton-aicdbgnwiuyj-ain-closet-p250032823.html?spid=250032832,15,-24%,,AIN_Closet
Bộ quần áo ngắn bé gái họa tiết Cherry hồng nơ - AICDBGKVMHS0 - AIN Closet,155.000₫,https://tiki.vn/bo-quan-ao-ngan-be-gai-hoa-tiet-cherry-hong-no-aicdbgkvmhs0-ain-closet-p107420648.html?spid=107420654,16,-18%,Đã bán 1,AIN_Closet
Bộ quần áo ngắn bé gái Cam trơn xô muslin - AICDBGBBYYJC - AIN Closet,145.000,https://tiki.vn/bo-quan-ao-ngan-be-gai-cam-tron-xo-muslin-aicdbgbbyyjc-ain-closet-p194821512.html?spid=194821518,17,,Đã bán 2,AIN_Closet
,,https://tiki.vn/bo-quan-ao-dai-be-gai-hoa-tiet-hoa-o-vang-cotton-det-aicdbgyu82pc-ain-closet-p273301210.html?spid=273301214,18,,,AIN_Closet
Bộ quần áo Dài tay ngắn bé gái họa tiết Con Vịt Vàng xô muslin - AICDBGIYCOSM - AIN Closet,155.000₫,https://tiki.vn/bo-quan-ao-dai-tay-ngan-be-gai-hoa-tiet-con-vit-vang-xo-muslin-aicdbgiycosm-ain-closet-p273355645.html?spid=273355657,19,-26%,,AIN_Closet
Bộ quần áo Dài bé gái họa tiết Unicorn Xanh Tím thun lụa - AICDBGGCMCSK - AIN Closet,145.000₫,https://tiki.vn/bo-quan-ao-dai-be-gai-hoa-tiet-unicorn-xanh-tim-thun-lua-aicdbggcmcsk-ain-closet-p263041773.html?spid=263041775,20,-26%,,AIN_Closet
Bộ quần áo lửng bé gái họa tiết Hoa hồng nền xám cotton boi - AICDBGGI8BFM - AIN Closet,145.000₫,https://tiki.vn/bo-quan-ao-lung-be-gai-hoa-tiet-hoa-hong-nen-xam-cotton-boi-aicdbggi8bfm-ain-closet-p107421714.html?spid=107421716,21,-22%,Đã bán 3,AIN_Closet
Bộ áo váy bé gái họa tiết Hoa trắng cotton boi thêu - AICDBGBHTOYU - AIN Closet,165.000₫,https://tiki.vn/bo-ao-vay-be-gai-hoa-tiet-hoa-trang-cotton-boi-theu-aicdbgbhtoyu-ain-closet-p136066961.html?spid=136066963,22,-25%,Đã bán 2,AIN_Closet
Bộ quần áo Dài tay ngắn bé gái họa tiết Bé Mũ Vàng cotton - AICDBGMYHA1K - AIN Closet,155.000₫,https://tiki.vn/bo-quan-ao-dai-tay-ngan-be-gai-hoa-tiet-be-mu-vang-cotton-aicdbgmyha1k-ain-closet-p271995362.html?spid=271995375,23,-26%,,AIN_Closet
Bộ quần áo ngắn bé gái họa tiết hoa Hải đằng hồng quần váy thun giấy - AICDBGF0GHFB - AIN Closet,145.000₫,https://tiki.vn/bo-quan-ao-ngan-be-gai-hoa-tiet-hoa-hai-dang-hong-quan-vay-thun-giay-aicdbgf0ghfb-ain-closet-p190540051.html?spid=190540054,24,-24%,Đã bán 8,AIN_Closet
Bộ quần áo dài bé gái họa tiết Cam Trơn túi tim cotton - AICDBGQEUNJT - AIN Closet,155.000,https://tiki.vn/bo-quan-ao-dai-be-gai-hoa-tiet-cam-tron-tui-tim-cotton-aicdbgqeunjt-ain-closet-p199053723.html?spid=199053736,25,,,AIN_Closet
,,https://tiki.vn/bo-quan-ao-dai-unisex-do-tron-thun-tre-aicdbgvkued1-ain-closet-p94789157.html?spid=94789162,26,,,AIN_Closet
Bộ quần áo Dài tay ngắn bé gái họa tiết Thỏ Trái Tim Hồng cotton - AICDBGY3G8WX - AIN Closet,155.000₫,https://tiki.vn/bo-quan-ao-dai-tay-ngan-be-gai-hoa-tiet-tho-trai-tim-hong-cotton-aicdbgy3g8wx-ain-closet-p273679683.html?spid=273679703,27,-26%,,AIN_Closet
Bộ quần áo ngắn bé gái họa tiết Nhí nơ đỏ quần váy cotton - AICDBTANNNYJ - AIN Closet,145.000₫,https://tiki.vn/bo-quan-ao-ngan-be-gai-hoa-tiet-nhi-no-do-quan-vay-cotton-aicdbtannnyj-ain-closet-p142265851.html?spid=142265855,28,-24%,Đã bán 4,AIN_Closet
Bộ quần áo lửng unisex cho bé họa tiết Hoạt Hình xô sợi tre - AICDBTYQGNWA - AIN Closet,155.000₫,https://tiki.vn/bo-quan-ao-lung-unisex-cho-be-hoa-tiet-hoat-hinh-xo-soi-tre-aicdbtyqgnwa-ain-closet-p205974716.html?spid=205974742,29,-37%,Đã bán 9,AIN_Closet
Bộ quần áo dài unisex Nâu gạch thun tre - AICDBGG2IOVS - AIN Closet,145.000,https://tiki.vn/bo-quan-ao-dai-unisex-nau-gach-thun-tre-aicdbgg2iovs-ain-closet-p94789069.html?spid=94789074,30,,,AIN_Closet
,,https://tiki.vn/bo-quan-ao-ngan-be-gai-hoa-tiet-dau-hong-no-xo-soi-tre-aicdbgyhcpyz-ain-closet-p185997241.html?spid=185997250,31,,,AIN_Closet
Bộ quần áo Lửng bé gái họa tiết Trái Tim viền hồng thun cotton - AICDBG7NGBBR - AIN Closet,155.000₫,https://tiki.vn/bo-quan-ao-lung-be-gai-hoa-tiet-trai-tim-vien-hong-thun-cotton-aicdbg7ngbbr-ain-closet-p272474409.html?spid=272474411,32,-24%,,AIN_Closet
Bộ quần áo ngắn bé gái họa tiết hoa Mai Hồng Cam cotton - AICDBGUWBTZJ - AIN Closet,165.000₫,https://tiki.vn/bo-quan-ao-ngan-be-gai-hoa-tiet-hoa-mai-hong-cam-cotton-aicdbguwbtzj-ain-closet-p242411018.html?spid=242411032,33,-23%,Đã bán 1,AIN_Closet
Bộ quần áo Ngắn bé gái họa tiết Chữ Cute Vàng cotton - AICDBGX4HZNX - AIN Closet,155.000₫,https://tiki.vn/bo-quan-ao-ngan-be-gai-hoa-tiet-chu-cute-vang-cotton-aicdbgx4hznx-ain-closet-p272474379.html?spid=272474389,34,-24%,,AIN_Closet
Bộ quần áo dài bé gái họa tiết Hoa hồng vàng cotton boi - AICDBTY6KYUS - AIN Closet,155.000,https://tiki.vn/bo-quan-ao-dai-be-gai-hoa-tiet-hoa-hong-vang-cotton-boi-aicdbty6kyus-ain-closet-p142320700.html?spid=142320715,35,,,AIN_Closet
,,https://tiki.vn/bo-quan-ao-dai-be-gai-tho-tim-no-thun-cotton-aicdbgpx0qqt-ain-closet-p270492567.html?spid=270492577,36,,,AIN_Closet
Bộ quần áo lửng bé gái họa tiết Sọc xám linen cotton - AICDBGO2C8RB - AIN Closet,155.000₫,https://tiki.vn/bo-quan-ao-lung-be-gai-hoa-tiet-soc-xam-linen-cotton-aicdbgo2c8rb-ain-closet-p184857887.html?spid=184857891,37,-31%,Đã bán 8,AIN_Closet
Bộ quần áo ngắn bé gái họa tiết Cherry Đỏ Thêu cotton - AICDBGVDLUQJ - AIN Closet,155.000₫,https://tiki.vn/bo-quan-ao-ngan-be-gai-hoa-tiet-cherry-do-theu-cotton-aicdbgvdluqj-ain-closet-p248182218.html?spid=248182220,38,-24%,Đã bán 2,AIN_Closet
Bộ quần dài áo tay ngắn bé gái họa tiết Caro xanh lá cotton - AICDBG2TKW9Z - AIN Closet,155.000₫,https://tiki.vn/bo-quan-dai-ao-tay-ngan-be-gai-hoa-tiet-caro-xanh-la-cotton-aicdbg2tkw9z-ain-closet-p148802863.html?spid=148802867,39,-21%,Đã bán 5,AIN_Closet
Bộ quần áo ngắn bé gái hoạ tiết Lá vàng nơ - AICDBG7FSRJH - AIN Closet,155.000,https://tiki.vn/bo-quan-ao-ngan-be-gai-hoa-tiet-la-vang-no-aicdbg7fsrjh-ain-closet-p107419773.html?spid=107419781,40,,,AIN_Closet
