title,price,link_item,index,discount,sales,category
Váy ĐI Biển Nữ 2 Mảnh,489.000₫,https://tiki.vn/vay-di-bien-nu-2-manh-p263406875.html?spid=263406892,1,-11%,,trangphucboi
Bộ Bikini Ba Mảnh Gợi Cảm MAY_MFAT117,150.000₫,https://tiki.vn/bo-bikini-ba-manh-goi-cam-may_mfat117-p14929060.html?spid=54753161,2,-25%,,trangphucboi
Bộ đồ bơi bikini nữ 1 mảnh đi tắm biển màu xanh kèm áo croptop trắng sang chảnh tôn dáng phong cách Hàn quốc - B04,158.000₫,https://tiki.vn/bo-do-boi-bikini-nu-1-manh-di-tam-bien-mau-xanh-kem-ao-croptop-trang-sang-chanh-ton-dang-phong-cach-han-quoc-b04-p95945442.html?spid=95945444,3,-24%,,trangphucboi
Áo Bikini đa năng Gym-to-swim LMcation Lola - Xanh Cánh Quạt,222.000₫,https://tiki.vn/ao-bikini-the-thao-lmcation-lola-xanh-canh-quat-p83580764.html?spid=83580772,4,-11%,,trangphucboi
Bikini Tam Giác 3 Món Nhiều Size,256.500₫,https://tiki.vn/bikini-tam-giac-3-mon-nhieu-size-p271126090.html?spid=271126096,5,-10%,,trangphucboi
Váy Bơi Đồ Bơi Đồ Tắm Biển Nữ,276.000₫,https://tiki.vn/vay-boi-do-boi-do-tam-bien-nu-p178476422.html?spid=178476433,6,-11%,Đã bán 1,trangphucboi
Bộ đồ bơi bikini nữ 2 mảnh dài tay chống nắng kín đáo đi tắm biển - B.34,158.000₫,https://tiki.vn/bo-do-boi-bikini-nu-2-manh-dai-tay-chong-nang-kin-dao-di-tam-bien-b-34-p243025715.html?spid=243025718,7,-25%,,trangphucboi
Váy Bơi Liền Thân Sát Nách Nữ,178.000₫,https://tiki.vn/vay-boi-lien-than-sat-nach-nu-p263407808.html?spid=263407819,8,-21%,,trangphucboi
Áo Choàng Đi Biển Áo Khoát Nhẹ Đi Biển,160.000₫,https://tiki.vn/ao-choang-di-bien-ao-khoat-nhe-di-bien-p167461154.html?spid=167461158,9,-11%,,trangphucboi
Đồ Tắm Biển Bikini Thời Trang,254.000₫,https://tiki.vn/do-tam-bien-bikini-thoi-trang-p271323674.html?spid=271323678,10,-11%,,trangphucboi
Váy Tắm Thời Trang Nữ Cao Cấp,400.000₫,https://tiki.vn/vay-tam-thoi-trang-nu-cao-cap-p271474144.html?spid=271474154,11,-11%,,trangphucboi
Váy Tắm Đi Biển Đi Bơi Nữ 2 Mảnh Size Từ 45-72Kg,280.000₫,https://tiki.vn/vay-tam-di-bien-di-boi-nu-2-manh-size-tu-45-72kg-p260920940.html?spid=260920948,12,-11%,,trangphucboi
Đồ Bơi Đồ Tắm Biển Liền Thân Nữ,226.000₫,https://tiki.vn/do-boi-do-tam-bien-lien-than-nu-p263408142.html?spid=263408221,13,-21%,,trangphucboi
Bộ đồ bơi bikini nữ 1 mảnh kín đáo đi tắm biển giấu bụng váy liền áo dài tay chống nắng - B.51,165.000₫,https://tiki.vn/bo-do-boi-bikini-nu-1-manh-kin-dao-di-tam-bien-giau-bung-vay-lien-ao-dai-tay-chong-nang-b-51-p261992788.html?spid=261992790,14,-25%,Đã bán 1,trangphucboi
Bikini Hai Mảnh Gợi Cảm AT066 MayHomes Đồ Bơi Hai Mảnh Dễ Thương,148.000₫,https://tiki.vn/bikini-hai-manh-goi-cam-at066-mayhomes-do-boi-hai-manh-de-thuong-p55121928.html?spid=55121930,15,-7%,Đã bán 16,trangphucboi
Váy Bơi Liền Thân Che Khuyết Điểm Nữ,194.000₫,https://tiki.vn/vay-boi-lien-than-che-khuyet-diem-nu-p263407570.html?spid=263407580,16,-21%,,trangphucboi
Bikini Thời Trang Đi Biển Đi Bơi,254.000₫,https://tiki.vn/bikini-thoi-trang-di-bien-di-boi-p271323642.html?spid=271323644,17,-11%,,trangphucboi
Váy Bơi Liền Nữ Đi Biển Đi Bơi Size Từ 40 Đến 65 KG,231.000₫,https://tiki.vn/vay-boi-lien-nu-di-bien-di-boi-size-tu-40-den-65-kg-p186254900.html?spid=186254940,18,-11%,,trangphucboi
Đồ Bơi Đồ Tắm Biển Nữ - Chat Shop Gửi Màu - Freesize,249.000₫,https://tiki.vn/do-boi-do-tam-bien-nu-p176805181.html?spid=176805183,19,-11%,Đã bán 1,trangphucboi
Đồ Tắm Biển Nữ 2 Mảnh Yếm,178.000₫,https://tiki.vn/do-tam-bien-nu-2-manh-yem-p270506541.html?spid=270506547,20,-21%,Đã bán 1,trangphucboi
Set Vay Bơi Nữ Dài Tay Size Từ 45 đến 72 KG,312.000₫,https://tiki.vn/set-vay-boi-nu-dai-tay-size-tu-45-den-72-kg-p184134502.html?spid=184134512,21,-11%,Đã bán 2,trangphucboi
Đồ Bơi Đồ Tắm Biển Bikini 2 Mảnh,214.000₫,https://tiki.vn/do-boi-do-tam-bien-bikini-2-manh-p167953384.html?spid=167953388,22,-11%,,trangphucboi
Đồ Bơi Đồ tắm Biển - Chat Shop Gửi Màu - Freesize,249.000₫,https://tiki.vn/do-boi-do-tam-bien-p176810351.html?spid=176810353,23,-11%,Đã bán 1,trangphucboi
Set Váy Tắm Croptop Ba Lỗ Tắm Biển Bơi Lội Kèm Áo Lưới,418.500₫,https://tiki.vn/set-vay-tam-croptop-ba-lo-tam-bien-boi-loi-kem-ao-luoi-p271232984.html?spid=271232990,24,-10%,,trangphucboi
Bikini Tam Giác Cánh Tiên Có Gọng,186.000₫,https://tiki.vn/bikini-tam-giac-canh-tien-co-gong-p262080124.html?spid=262080126,25,-21%,,trangphucboi
Đồ Bơi Một Mảnh Lệch Vai LMcation Angela - Màu Xanh Đen,355.000₫,https://tiki.vn/do-boi-mot-manh-lech-vai-lmcation-angela-mau-xanh-den-p149677672.html?spid=149677674,26,-11%,,trangphucboi
Sét Đồ Bơi Quần Đùi Áo Ngắn Tay,300.000₫,https://tiki.vn/set-do-boi-quan-dui-ao-ngan-tay-p263409426.html?spid=263409433,27,-11%,,trangphucboi
Áo bikini đa năng Gym-to-swim LMcation Abby - Thổ Cẩm,222.000₫,https://tiki.vn/ao-bikini-the-thao-lmcation-abby-tho-cam-p77767819.html?spid=77767823,28,-11%,Đã bán 11,trangphucboi
Váy Tắm Bơi lội Liền Dài Tay,218.000₫,https://tiki.vn/vay-tam-boi-loi-lien-dai-tay-p271772651.html?spid=271772653,29,-11%,,trangphucboi
Đồ Bơi Nữ Crotpop Dài Tay Quần Đùi,200.000₫,https://tiki.vn/do-boi-nu-crotpop-dai-tay-quan-dui-p263408897.html?spid=263408902,30,-11%,,trangphucboi
Bộ đồ bơi bikini kín đáo nữ giấu bụng đi tắm biển - B.37,150.000₫,https://tiki.vn/bo-do-boi-bikini-kin-dao-nu-giau-bung-di-tam-bien-b-37-p192713612.html?spid=192713614,31,-25%,Đã bán 1,trangphucboi
Bikini Thời Trang Đi Biển Bơi Bội,400.000₫,https://tiki.vn/bikini-thoi-trang-di-bien-boi-boi-p271365954.html?spid=271365960,32,-11%,,trangphucboi
Áo bikini LMcation Lola - Màu Hồng,222.000₫,https://tiki.vn/ao-bikini-the-thao-lmcation-lola-mau-hong-p77768147.html?spid=77768153,33,-11%,,trangphucboi
Bikini Tắm Biển Nữ Kèm Váy Dây Rút,186.000₫,https://tiki.vn/bikini-tam-bien-nu-kem-vay-day-rut-p270966467.html?spid=270966469,34,-21%,,trangphucboi
Bộ Bơi Nữ Kèm Khăn Quấn,290.000₫,https://tiki.vn/bo-boi-nu-kem-khan-quan-p20955203.html?spid=20955205,35,,Đã bán 5,trangphucboi
Bikini Nữ - Hồng (Size 2XL),350.000₫,https://tiki.vn/bikini-nu-p20953668.html?spid=20953676,36,,Đã bán 8,trangphucboi
Tryphena Chân váy bơi nữ lưng cao SOBIE,360.000₫,https://tiki.vn/tryphena-chan-vay-boi-nu-lung-cao-sobie-p273398913.html?spid=273398921,37,,,trangphucboi
Bikini 2 mảnh tam giác basic trắng tinh khôi,150.000₫,https://tiki.vn/bikini-2-manh-tam-giac-basic-trang-tinh-khoi-p178318934.html?spid=178318935,38,,,trangphucboi
Bikini 1 mảnh liền thân viền trắng gạo xếp ly cách điệu,320.000₫,https://tiki.vn/bikini-1-manh-lien-than-vien-trang-gao-xep-ly-cach-dieu-p178318923.html?spid=178318929,39,,,trangphucboi
Đồ bơi bikini áo cup ngang lệch vai váy đuôi cá,165.000₫,https://tiki.vn/do-boi-bikini-ao-cup-ngang-lech-vai-vay-duoi-ca-p187863800.html?spid=187863818,40,,,trangphucboi
