title,price,link_item,index,discount,sales,category
LEMME-Đầm sơ mi tay ngắn fom rộng xẻ tà,265.000₫,https://tka.tiki.vn/pixel/pixel?data=mh09wO5nDwAPC_O3ayrbcx4N0rZgt3VPQKKRQmlc2_T9rrPMVUQb5HB1DFGL6eaQVtV5_OumGCm_GzwtmRY0-DPKiBQIoirAWGOSToTbAycDgsNjxj7z4zmTpwXQoA6wxAQmURcVayLcn2_yWv9J2Y46LydKn6IESYMpJrsfTjkCP7GvC2v4s3qZbR9D7gf4XDhOLTXSa-jkdIfLkhPdJJLbIh4WH7V92dLW5ggPxrRlGjH9r2mLjD8KdXeoBCGQy8DshXIo0qL9CU9daFQ_TXLJEiV43ZDICIedT0aLkJTbwp1uMXAK9RuqSyFpYSFTExpFYHN_vpECm05KerRVjJzrmHJgdFhaW2lGmBPY7Mhgjcmm_ADadY9Hqi5ubEMeGHCSxFRmGtfeYeSLm65w_YGJKS5RlvdpgIAOPqhGIHZCJAjjVdlVixR-0yq8y-xJVRrQqaFVgQ9IK6_LwuorPh5dLx4EdGY_LY3QDVljakgwqhew9aamqj8fPmsphigzhVGlFEQVXjYNzIXKQ-xVYwNPkNAb7AAf2uq51tpukrYglibMAIhTrCvP7eXRoKFYnenTrZBPeUMqbpxqRHitrNx2tQY9qQwMJFvFKjvNhmTg9ZSybQTR8MBi5CmViAkbEtOpnXLBsusPF5Pl_9QA5XfPcVcrAKbXwhwc3AF51B0VmJ8nR9WCXw6eduiLZoTBAM8XM4w-CvPw6LTjqn2QGBwhvUnE_SK0l8rjMpjALUKGP1jdWwTlB8w24r1yS-2eeYnjSE5W_nMg1ks7Wf5guqgJV3htonXaFpNU7_7lDtHi5tBX5mAsFXdF1SrAdFFJOgAaG6BcveIjoXivlJm_vFHyv_kQO1iaJLWXE9QszISMI17sqUgEERuJ79Fk_2KJG_9TtxS0-apGUQXqXQn9Idfp_3Y2WjP1rjkYgxmxGK7jL-Idq8fgUNpuAjsPCyJyKa9F9oaYocE9rqsXM_UYmYgkrSRnVxgV3XZlC-GxwLPLyoykfsuo-XK6rRImUWoYUrGfmRTYwEYhssNxJjs6-4r1R29WQkl4Edo0AkNtmZU3Mn7YkWn0AR_cPDd0cIpthQbmxl0oMnpj1g5jhVcURxFOlOO5exZK1GwjI1v3R3TOQ7y2QDeELSzQI_bjL_uzwYWDDa22qTIBvTxotFK9_lSrxn1N78nxNqr5zngcycXLBIYXKwgnDwtIANc-ApRMN8YxhIOc4DUtDiiKUg&reqid=qVS1lhKWvGJvBbu0&type=CLICK&pos=41,1,,Đã bán 1,damnu
Đầm gấm kết hoa xinh sang trọng MS 2597,440.000₫,https://tka.tiki.vn/pixel/pixel?data=lWt0rZ2O3K7TzMW8xzh2fUzcP_0GE-QOy6OAPfwgr1Edsqxv-2cyr6bpfNpQBBK7Ci9kmXb2xfPiEZfeSrgeD5YsnvBRMiLElkkzzB-EF98ukXteQ5r7qcxnzM5ZnuhRTwQzz_uQVJhE89hWqBMf7q8kB0O7CC8fkJWKA9SF_02xV904NlkIUAN1wHBWMgBe7a24GlK2SWyLsZOYmIJC0GuLlGGTjmLjBYQcvs_XPoxAQfEacIAT8vucPRhPeuvbc34uvN6w2Ar_SxPGGiN6j5tAByb0MCAPuQpx2RkJar-D_YW1OQfyvITFcqZFEc38oPfpcBfIWpqhZX0SY4qGIu6pQv0vPFEh0plyUx70ZTw3qFKDhXo0rsmoV6RuSAHjJRYyBE4Mc7hMjjlIYEM9BJs2vIigMBio45qGGZ7pR_FWsNUvAtneqqI6lEwZzV6rbrdeJaKYHxuRoXBygJr5yleHgKyHRwHMHFB9zz-YZN7lO383YjUp4CllCthTgqcTaodB5OcoKYI1AClNMDPDLtK51lnJzi2LY5zmw3iuEfk6MIzdMkeXEoFIjhhEcrNeTkYqv_-9eVGsUhyp4DyqHYi13a9eNhErD9zRUUlRCb0bvJDFHTtvvytBCM-Pmdu3MovgulvUpaA5BEoN6JnMZPKTM3zbIpqhn4sb55E-1HrHaT08iX1Rwae-VSM3NVc4bWepscFBWYU3_NPC38TN4Xg8WOxgTGU6C2zOluwMxnheTKkGGZBFVzMlshM9DIJ8dXNXHVYyG0jJNf3R6tA_wohQSN9-fSk2nCkgtuRrFOiHzKICsK20C2ud4KE0aQloLcSmW110ALIuC-dOX7ppSAq2m3Tz29_Fq6C_qGRXs6nM7v7mIaUMSEAcEkzzFXvInxUnL7z92qTqSV3IMamWD-zMxbQlAykjSwaCVLGc-DUjk8Xp3RiIw4TKZiqQ0K6zZos6JIuHPD0GRIO6pFdBvCitjdnpZndjNxAJPtuEItANe54KddkfjxTRYC8UKTf9DS8_p_q5zJ_xB7eoAVkar7KfNHE-9GtYfoiqGrJEEfczB3NkG4a-t9QSgTpStKNYpFM-v3u9We4sDLuqSbovOr_av0Tx8lae-OM1&reqid=qVS1lhKWvGJvBbu0&type=CLICK&pos=42,2,-50%,,damnu
Đầm nữ dự tiệc màu trắng dáng xòe cổ V,300.000₫,https://tiki.vn/dam-nu-du-tiec-mau-trang-dang-xoe-co-v-p180590012.html?spid=180590016,3,,Đã bán 37,damnu
"Đầm suông nữ Đũi Việt dáng dài 2 túi sườn, đầm form rộng cổ sơ mi phong cách cá tính thời trang thương hiệu chính hãng DV61",263.000,https://tiki.vn/dam-dui-dang-suong-dai-form-rong-dam-dui-mix-kieu-so-mi-phong-cach-ca-tinh-dv61-p180247331.html?spid=180247339,4,-12%,,damnu
,,https://tiki.vn/vay-len-suong-dai-tay-bo-tay-dam-suong-nu-len-gan-dang-dai-thu-dong-3-mau-ca-tinh-p147043717.html?spid=147043719,5,-11%,,damnu
"Đầm suông linen cổ đức bổ trụ 2 túi ốp ngực ArcticHunter, thời trang thương hiệu chính hãng",250.000₫,https://tiki.vn/dam-suong-linen-co-duc-bo-tru-2-tui-op-nguc-arctichunter-thoi-trang-thuong-hieu-chinh-hang-p100287951.html?spid=100287959,6,,Đã bán 57,damnu
[HCM] Đầm maxi phối ren tầng duyên dáng D081 - Lady Fashion -Khánh Linh Style,240.000₫,https://tiki.vn/hcm-dam-maxi-phoi-ren-tang-duyen-dang-d081-lady-fashion-khanh-linh-style-p263487572.html?spid=263487584,7,-12%,Đã bán 3,damnu
Đầm body khoét ngực dây rút 2 bên hông chất zip cotton cá tính,89.000₫,https://tiki.vn/dam-body-khoet-nguc-day-rut-2-ben-hong-chat-zip-cotton-ca-tinh-p114538960.html?spid=114538964,8,,Đã bán 72,damnu
váy suông nữ dáng dài cộc tay LA đan lưng 3 màu,85.000₫,https://tiki.vn/vay-suong-nu-dang-dai-coc-tay-la-dan-lung-3-mau-p93060435.html?spid=116402641,9,-41%,,damnu
,,https://tiki.vn/vay-len-2-day-body-ke-ngang-dang-dai-qua-goi-hang-qc-p157096872.html?spid=157096879,10,-49%,,damnu
"Đầm maxi đi biển, váy xoè dự tiệc (SN052)",189.000₫,https://tiki.vn/dam-maxi-di-bien-vay-xoe-du-tiec-sn052-p270475243.html?spid=270475245,11,-12%,Đã bán 3,damnu
"Đầm suông linen nữ form rộng, cổ búp bê phối cúc siêu xinh, phù hợp đi học, đi làm, đi chơi Đũi Việt Dv158 xanh ngọc",263.000,https://tiki.vn/dam-suong-linen-nu-form-rong-co-bup-be-phoi-cuc-sieu-xinh-phu-hop-di-hoc-di-lam-di-choi-dui-viet-dv158-xanh-ngoc-p247719275.html?spid=247719277,12,,,damnu
,,https://tiki.vn/dam-thiet-ke-vay-co-vuong-tay-phong-dam-du-tiec-sang-trong-mau-do-vang-xanh-ngoc-hang-bigsize-p210766493.html?spid=210766522,13,,,damnu
"váy trễ vai trắng tay bồng dáng dài, đầm trễ vai tiểu thư dự tiệc màu trắng điệu đà",80.000₫,https://tiki.vn/vay-tre-vai-trang-tay-bong-dang-dai-dam-tre-vai-tieu-thu-du-tiec-mau-trang-dieu-da-p151425630.html?spid=151425632,14,,Đã bán 132,damnu
Đầm Hoa Trung Niên đẹp Che Bụng VH64 - Hàng Quảng Châu Cao Cấp,345.000₫,https://tiki.vn/dam-hoa-trung-nien-dep-che-bung-vh64-hang-quang-chau-cao-cap-p195708587.html?spid=195708593,15,,Đã bán 8,damnu
"Đầm suông linen tay lỡ kèm đai rời túi sườn ArcticHunter, thời trang trẻ, phong cách Hàn - Trắng",250.000₫,https://tiki.vn/dam-suong-linen-tay-lo-kem-dai-roi-tui-suon-arctichunter-thoi-trang-tre-phong-cach-han-trang-p77029858.html?spid=77029860,16,,Đã bán 299,damnu
"Đầm suông linen cổ V túi hộp thắt eo ArcticHunter, thời trang thương hiệu chính hãng",280.000,https://tiki.vn/dam-suong-linen-co-v-tui-hop-that-eo-arctichunter-thoi-trang-thuong-hieu-chinh-hang-p67241193.html?spid=67241209,17,,,damnu
,,https://tiki.vn/set-vay-len-body-2-day-ke-mix-ao-len-dai-tay-hang-loai-day-dep-p115552983.html?spid=115552994,18,,,damnu
Đầm váy nữ trung niên voan hoa tay lửng cổ V dự tiệc đám cưới xanh ngọc cao cấp,264.000₫,https://tiki.vn/dam-vay-nu-trung-nien-voan-hoa-tay-lung-co-v-du-tiec-dam-cuoi-xanh-ngoc-cao-cap-p248199258.html?spid=248199262,19,,Đã bán 6,damnu
"Váy Hoa Nhí Vintage Đầm Dự Tiệc Nữ Vải Voan Dáng Dài thiết kế kiểu Hàn Quốc cao cấp, đi chơi công sở",109.000₫,https://tiki.vn/vay-hoa-nhi-vintage-dam-du-tiec-nu-vai-voan-dang-dai-thiet-ke-kieu-han-quoc-cao-cap-di-choi-cong-so-p201678620.html?spid=201678626,20,,Đã bán 2,damnu
Đầm len nữ Haint Boutique mẫu mới sang chảnh dự tiệc AL73,351.000₫,https://tiki.vn/dam-len-nu-haint-boutique-mau-moi-sang-chanh-du-tiec-al73-p73572882.html?spid=273596603,21,,Đã bán 10,damnu
Sét Đầm Hoa Midi Hoa Nhí 2 Dây Nữ Tính Nhẹ Nhàng Kèm ÁO Khoác,317.000₫,https://tiki.vn/set-dam-hoa-p173969346.html?spid=173969348,22,,Đã bán 7,damnu
(HÀNG SẴN) Đầm Len Công Sở Trung Niên Lịch Sự AL57 - Hàng Quảng Châu Cao Cấp,289.000₫,https://tiki.vn/hang-san-dam-len-cong-so-trung-nien-lich-su-al57-hang-quang-chau-cao-cap-p125021985.html?spid=125022160,23,,Đã bán 25,damnu
Đầm Xinh Thắt Nơ Duyên Dáng DN074 MayHomes Form Suông Họa Tiết Cá Tính,168.210₫,https://tiki.vn/dam-xinh-that-no-duyen-dang-dn074-mayhomes-form-suong-hoa-tiet-ca-tinh-p53868533.html?spid=53868537,24,,Đã bán 14,damnu
Đầm suông cổ sơ mi Haint Boutique,175.000,https://tiki.vn/dam-suong-co-so-mi-haint-boutique-p10679661.html?spid=56369571,25,,,damnu
,,https://tiki.vn/dam-nu-voan-babydoll-hoa-nhi-sieu-xinh-dam-duoi-ca-dang-xoe-co-v-arctic-hunter-ah177-p192151194.html?spid=192151204,26,,,damnu
"Đầm váy sơ mi nữ công sở ngắn tay, Đầm Linen cổ sơ mi nữ kèm dây rút eo Haint Boutique",263.000₫,https://tiki.vn/dam-vay-so-mi-nu-cong-so-ngan-tay-dam-linen-co-so-mi-nu-kem-day-rut-eo-haint-boutique-p269247134.html?spid=269247140,27,,Đã bán 1,damnu
váy suông cộc tay cổ tim dáng dài xẻ tà in chữ LA 3 màu,89.000₫,https://tiki.vn/vay-suong-coc-tay-co-tim-dang-dai-xe-ta-in-chu-la-3-mau-p105616492.html?spid=105616496,28,,Đã bán 22,damnu
ĐẦM LỤA HOA NỮ CỰC HOT SANG TRỌNG CHO CÁC NÀNG KME FASHION,130.000₫,https://tiki.vn/dam-lua-hoa-nu-cuc-hot-sang-trong-cho-cac-nang-kme-fashion-p165898975.html?spid=165899031,29,,Đã bán 3,damnu
Đầm trung niên,331.200,https://tiki.vn/dam-trung-nien-p248371193.html?spid=248371201,30,,Đã bán 2,damnu
,,https://tiki.vn/da-m-voan-thie-t-ke-khoe-t-vai-da-ng-chua-n-du-size-tu-40-65kg-ke-m-ni-t-p247219464.html?spid=247219468,31,,,damnu
"Set đầm ống kèm áo tay dài dễ thương, sang trọng Size từ 40kg đến 52kg Chất liệu thun gân siêu co giãn, mềm mại",160.000₫,https://tiki.vn/set-dam-ong-kem-ao-tay-dai-de-thuong-sang-trong-size-tu-40kg-den-52kg-chat-lieu-thun-gan-sieu-co-gian-mem-mai-p208017099.html?spid=208017105,32,,Đã bán 1,damnu
váy suông - đầm suông nữ cộc tay in chữ blank phom rộng dáng dài,79.000₫,https://tiki.vn/vay-suong-dam-suong-nu-coc-tay-in-chu-blank-phom-rong-dang-dai-p113956155.html?spid=113956157,33,,Đã bán 52,damnu
Đầm suông dài hoa lá Haint Boutique da143,175.000₫,https://tiki.vn/dam-suong-dai-hoa-la-haint-boutique-da143-p11198460.html?spid=56366828,34,,Đã bán 27,damnu
Váy suông in hình cá sấu xẻ tà chất cotton cá tính,72.000₫,https://tiki.vn/vay-suong-nu-in-hinh-ca-sau-xe-ta-chat-cotton-ca-tinh-p93044590.html?spid=108151228,35,,,damnu
,,https://tiki.vn/hang-san-dam-mua-xuan-dai-tay-khi-chat-cho-me-vh96-hang-quang-chau-cao-cap-p271285937.html?spid=271285941,36,,,damnu
{HCM}Đầm voan Hàn hoa nhí sang trọng D073 -Lady Fashion - Khánh Linh Style,230.000₫,https://tiki.vn/hcm-dam-voan-han-hoa-nhi-sang-trong-d073-lady-fashion-khanh-linh-style-p253612799.html?spid=253612855,37,,Đã bán 1,damnu
"Váy sơ mi dáng suông cổ V,Đầm sơ mi đũi túi ngực kèm dây thắt eo,phong cách mùa hè Hàn Quốc thương hiệu chính hãng Đũi Việt Dv72",308.000₫,https://tiki.vn/vay-so-mi-dang-suong-co-v-dam-so-mi-dui-tui-nguc-kem-day-that-eo-phong-cach-mua-he-han-quoc-dui-viet-dv72-p180396501.html?spid=180396511,38,,Đã bán 14,damnu
Váy Hoa Cotton Mùa Hè Mềm Mát Cho Mẹ VH11 - Hàng Quảng Châu Cao Cấp,198.000₫,https://tiki.vn/vay-hoa-cotton-mua-he-mem-mat-cho-me-vh11-hang-quang-chau-cao-cap-p195481098.html?spid=270701705,39,,Đã bán 4,damnu
"Đầm xòe voan họa tiết hoa nhí cổ sen cách điệu (có lót trong) - nhiều size, form dang chuẩn thích hợp mặc dạo phố, đi làm hoặc dự tiệc",230.000,https://tiki.vn/dam-xoe-voan-hoa-tiet-hoa-nhi-co-sen-cach-dieu-co-lot-trong-nhieu-size-form-dang-chuan-thich-hop-mac-dao-pho-di-lam-hoac-du-tiec-p89153334.html?spid=89153340,40,,,damnu
,,https://tiki.vn/dam-trung-nien-bigsize-mau-sac-tre-trung-tuoi-sang-hoa-tiet-sang-trong-di-lam-di-tiec-cho-ba-p252013051.html?spid=252013055,41,,,damnu
"Đầm xòe cổ vuông tiểu thư điệu đà, thời trang xuân hè 2021 - Đen",59.000₫,https://tiki.vn/dam-xoe-co-vuong-tieu-thu-dieu-da-thoi-trang-xuan-he-2021-den-p75414850.html?spid=75414856,42,,Đã bán 2,damnu
