title,price,link_item,index,discount,sales,category
Quần bầu hè thu ngố QBD1520,285.000₫,https://tiki.vn/quan-bau-he-thu-ngo-qbn1174-p258863197.html?spid=258863199,1,,Đã bán 1,thoitrangbau
QUẦN BẦU HÈ THU CHÂN VÁY HÈ THU DÁNG DÀI QBV-QBN1087,355.000₫,https://tiki.vn/quan-bau-he-thu-chan-vay-he-thu-dang-dai-qbv-qbn1087-p262463147.html?spid=262463149,2,-42%,,thoitrangbau
Đầm bầu sơ mi công sở dáng dài DR3122,435.000₫,https://tiki.vn/dam-bau-so-mi-cong-so-dang-dai-dr3122-p262450718.html?spid=262450722,3,-41%,,thoitrangbau
Áo sơ mi bầu mùa hè-thu dáng rộng AB3138,325.000,https://tiki.vn/ao-so-mi-bau-mua-he-thu-dang-rong-ab3138-p262718236.html?spid=262718252,4,,,thoitrangbau
,,https://tiki.vn/quan-bau-jean-phong-cach-tre-trung-dang-dai-qbn1325-p253382928.html?spid=253382934,5,,,thoitrangbau
Áo bầu thu đông denim sơ mi dáng dài AB1201,325.000₫,https://tiki.vn/ao-bau-thu-dong-denim-so-mi-dang-dai-ab1201-p141474609.html?spid=141474611,6,,,thoitrangbau
QUẦN BẦU HÈ THU- QUẦN NGỐ ĐÙI JEAN NĂNG ĐỘNG QBN1215,365.000₫,https://tiki.vn/quan-bau-he-thu-quan-ngo-dui-jean-nang-dong-qbn1215-p258863184.html?spid=258863190,7,,,thoitrangbau
Quần bầu hè thu JEAN dáng ngố đùi phong cách trẻ trung QBN1355,355.000₫,https://tiki.vn/quan-bau-he-thu-jean-dang-ngo-dui-phong-cach-tre-trung-qbn1355-p253284861.html?spid=253284865,8,,,thoitrangbau
Đầm bầu thun cotton dáng dài DR3121,385.000,https://tiki.vn/dam-bau-thun-cotton-dang-dai-dr3121-p262450664.html?spid=262450672,9,,,thoitrangbau
,,https://tiki.vn/quan-bau-he-thu-ke-o-vuong-qbs1420-p255143799.html?spid=255143811,10,,,thoitrangbau
Quần bầu xuông thun cotton dáng lỡ xẻ cá tính QBS1414,285.000₫,https://tiki.vn/quan-bau-xuong-thun-cotton-dang-lo-xe-ca-tinh-qbs1414-p253391628.html?spid=253391632,11,,,thoitrangbau
Quần bầu jean dáng lỡ cực xinh QBN1345,395.000,https://tiki.vn/quan-bau-jean-dang-lo-cuc-xinh-qbn1345-p255165000.html?spid=255165014,12,,,thoitrangbau
,,https://tiki.vn/quan-bau-jean-xuong-sanh-dieu-qbn1343-qbn1342-p258201445.html?spid=258201491,13,,,thoitrangbau
Áo lót ngực bầu cho bé con bú LỤA TĂM không gọng nâng ngực đồ lót chip bà bầu A35,32.000₫,https://tiki.vn/ao-lot-nguc-bau-cho-be-con-bu-lua-tam-khong-gong-nang-nguc-do-lot-chip-ba-bau-a35-p117973118.html?spid=192720943,14,,Đã bán 17,thoitrangbau
Bộ mở nắp ngực cho mẹ sau sinh,69.000₫,https://tiki.vn/bo-mo-nap-nguc-cho-me-sau-sinh-p101252938.html?spid=101252960,15,,,thoitrangbau
quần dài bầu suông đũi,180.000₫,https://tiki.vn/quan-dai-bau-suong-dui-p92320769.html?spid=92320772,16,,,thoitrangbau
set yếm kẻ bầu - váy thiết kế,200.000,https://tiki.vn/set-yem-ke-bau-vay-thiet-ke-p92322091.html?spid=92322108,17,,,thoitrangbau
,,https://tiki.vn/bo-lung-cotton-mac-bau-va-sinh-p92319029.html?spid=92319031,18,,,thoitrangbau
Váy bầu thiết kế đen chân ren,320.000₫,https://tiki.vn/vay-bau-thiet-ke-den-chan-ren-p92319621.html?spid=92319627,19,,,thoitrangbau
Đầm bầu (yếm + áo ) hoa,135.000₫,https://tiki.vn/dam-bau-yem-ao-hoa-p92319270.html?spid=92319276,20,,,thoitrangbau
Váy ren bầu,350.000₫,https://tiki.vn/vay-ren-bau-p92320102.html?spid=92320104,21,,,thoitrangbau
Quần bầu nâng mông,156.000₫,https://tiki.vn/quan-bau-nang-mong-p92320269.html?spid=92320297,22,,,thoitrangbau
tất bầu dày vừa có chun chỉnh bụng dày dặn,117.000₫,https://tiki.vn/tat-bau-day-vua-co-chun-chinh-bung-day-dan-p92320228.html?spid=92320238,23,,,thoitrangbau
Bộ đồ bầu mùa hè tay bồng chất đũi hàn freesize từ 45 đến 70kg,167.000₫,https://tiki.vn/bo-do-bau-mua-he-tay-bong-chat-dui-han-freesize-tu-45-den-70kg-p103097352.html?spid=116458788,24,,,thoitrangbau
Đồ bộ bầu lửng CỔ TIM 2 MÀU - Đồ ngủ bà bầu sau sinh cho con bú ti - Quần áo bầu cho mẹ thời trang mùa hè Bigsize,179.000,https://tiki.vn/do-bo-bau-lung-co-tim-2-mau-do-ngu-ba-bau-sau-sinh-cho-con-bu-ti-quan-ao-bau-cho-me-thoi-trang-mua-he-bigsize-p114404023.html?spid=114404100,25,,,thoitrangbau
,,https://tiki.vn/ao-phong-bau-coc-tay-do-sau-sinh-cho-con-bu-ti-quan-ao-thoi-trang-quang-chau-mua-he-dep-gia-re-bigsize-p248774633.html?spid=248774680,26,,,thoitrangbau
"Váy bầu, đầm bầu thu đông nơ tiểu thư 2 màu",259.000₫,https://tiki.vn/vay-bau-dam-bau-thu-dong-no-tieu-thu-2-mau-p114404694.html?spid=114404909,27,,,thoitrangbau
Pijama bầu sau sinh cho con bú ti - Đồ bộ ngủ Pizama đẹp mặc nhà CÁO - Quần áo thời trang Pyjama dài tay giá rẻ Bigsize,199.000₫,https://tiki.vn/pijama-bau-sau-sinh-cho-con-bu-ti-do-bo-ngu-pizama-dep-mac-nha-cao-quan-ao-thoi-trang-pyjama-dai-tay-gia-re-bigsize-p270692706.html?spid=270692740,28,,,thoitrangbau
"Áo Ngực Bầu Cho Con Bú Không Gọng, Chất Liệu Cotton Mềm Nhẹ, Mở Cúc Tiện Lợi Cho Con Bú ALB07",219.000₫,https://tiki.vn/ao-nguc-bau-cho-con-bu-khong-gong-chat-lieu-cotton-mem-nhe-mo-cuc-tien-loi-cho-con-bu-alb07-p164582388.html?spid=164582415,29,,,thoitrangbau
Quần bầu mèo lót lông thu đông,170.000,https://tiki.vn/quan-bau-meo-lot-long-thu-dong-p73592257.html?spid=73592261,30,,,thoitrangbau
,,https://tiki.vn/dam-bau-hoa-tiet-hinh-sao-db10-p86773610.html?spid=86773620,31,,,thoitrangbau
Áo lót bầu Haint Boutique họa tiết mặc êm HB05,87.000₫,https://tiki.vn/ao-lot-bau-haint-boutique-hoa-tiet-mac-em-hb05-p103480217.html?spid=104541715,32,,,thoitrangbau
Đầm Váy Bầu Thun Cotton Dáng Suông Xòe Thời Trang Mùa Hè ARCTIC HUNTER AH35,175.000₫,https://tiki.vn/dam-bau-vay-bau-thun-cotton-dang-suong-xoe-sat-nach-thoi-trang-mua-he-arctic-hunter-ah35-p166156503.html?spid=166156505,33,,,thoitrangbau
Set Rơ Lưỡi Và Bàn Chải Đánh Răng Cho Bé Silicon,55.000₫,https://tiki.vn/set-ro-luoi-va-ban-chai-danh-rang-cho-be-silicon-p197851409.html?spid=197851410,34,,Đã bán 7,thoitrangbau
Quần Legging Cotton Cho Mẹ Bầu Freesize Cho Mẹ Dưới 70kg,94.000₫,https://tiki.vn/quan-legging-cotton-cho-me-bau-freesize-cho-me-duoi-70kg-p84080045.html?spid=84080046,35,,,thoitrangbau
,,https://tiki.vn/ao-bau-thun-tre-trung-a178-ao-bau-di-choi-di-lam-p252639893.html?spid=252639907,36,,,thoitrangbau
