title,price,link_item,index,discount,sales,category
Full set Legging Ao/Quần áo thời trang nam/Tôn vinh nét đẹp quý phái,350.000₫,https://tiki.vn/full-set-legging-ao-quan-ao-thoi-trang-nam-ton-vinh-net-dep-quy-phai-p272200673.html?spid=272200679,1,,,dongunam
quần áo mặc nhà cotton 9939,306.000₫,https://tiki.vn/quan-ao-mac-nha-cotton-9939-p51698232.html?spid=51698234,2,,Đã bán 8,dongunam
"Bộ Thể Thao Nam Tay Ngắn Cổ Tròn, Chất Liệu Lỗ Kim, Hót Trend Mẫu Hè 2022 cao cấp",249.000₫,https://tiki.vn/bo-the-thao-nam-tay-ngan-co-tron-chat-lieu-lo-kim-hot-trend-mau-he-2022-cao-cap-p173388513.html?spid=173388521,3,,,dongunam
Đồ Bộ Mặc Nhà Cho Nam,481.950,https://tiki.vn/do-bo-mac-nha-cho-nam-p148063734.html?spid=148063742,4,,,dongunam
,,https://tiki.vn/bo-the-thao-nam-cao-cap-chat-vai-lo-kim-co-gian-thoang-mat-mem-min-4-mau-tre-trung-p171175006.html?spid=171175030,5,,,dongunam
Bộ nỉ nam AM màu ghi BNM221-22 Sport1,1.350.000₫,https://tiki.vn/bo-ni-nam-am-mau-ghi-bnm221-22-sport1-p217773854.html?spid=217773868,6,,,dongunam
Bộ Nam Hè Free Fire Chất Liệu Cotton Set Bộ Quần Áo Nam In Hình B.Học Cực Chất Hot Trend 2020,141.000₫,https://tiki.vn/bo-nam-he-free-fire-chat-lieu-cotton-set-bo-quan-ao-nam-in-hinh-b-hoc-cuc-chat-hot-trend-2020-p87600608.html?spid=87600610,7,,Đã bán 3,dongunam
Bộ đồ pijama nam luxury cao cấp QSHOP QM600,590.000₫,https://tiki.vn/bo-do-pijama-nam-luxury-cao-cap-qshop-qm600-p199262708.html?spid=199262714,8,,Đã bán 3,dongunam
"Bộ đồ pijama quần dài, tay dài mẫu mới QSHOP QM708",300.000,https://tiki.vn/bo-do-pijama-quan-dai-tay-dai-mau-moi-qshop-qm708-p253099459.html?spid=253099463,9,,,dongunam
,,https://tiki.vn/set-bo-quan-ao-nam-mac-nha-vai-dui-cao-cap-mac-mat-bo-dui-nam-p207304596.html?spid=207306155,10,,,dongunam
Bộ Đồ Ngủ Nam Hoạt Hình Dài Tay DND18,180.000₫,https://tiki.vn/bo-do-ngu-nam-hoat-hinh-dai-tay-dnd18-p8143507.html?spid=8143511,11,,Đã bán 8,dongunam
Set Đồ Đi Biển Nam Nữ,273.000,https://tiki.vn/set-do-di-bien-nam-nu-p263407249.html?spid=263407282,12,,,dongunam
,,https://tiki.vn/loai-1-thoi-trang-tre-em-do-bo-be-trai-be-gai-kieu-dang-hiphop-thun-cotton-ngan-tay-sockimall-210570-p204911332.html?spid=204912217,13,,,dongunam
BỘ CƯ SỸ NAM ĐÀI LOAN VẢI THÔ DÀI TAY/NGẮN TAY_QUẦN ÁO ĐI CHÙA PHẬT TỬ NAM,350.000₫,https://tiki.vn/bo-cu-sy-nam-dai-loan-vai-tho-dai-tay-ngan-tay_quan-ao-di-chua-phat-tu-nam-p119258002.html?spid=119258008,14,,Đã bán 1,dongunam
Bộ đồ pijama nam Luxury tay dài mềm mịn trơn láng QSHOP QM841,490.000₫,https://tiki.vn/bo-do-pijama-nam-luxury-tay-dai-mem-min-tron-lang-qshop-qm841-p273699356.html?spid=273699358,15,,,dongunam
Bộ đồ pijama cặp đồi Luxury tay dài QSHOP QM853,500.000₫,https://tiki.vn/bo-do-pijama-cap-doi-luxury-tay-dai-qshop-qm853-p273805017.html?spid=273805029,16,,,dongunam
Bộ đồ pijama nam quần ngắn tay ngắn QSHOP QM839,380.000,https://tiki.vn/bo-do-pijama-nam-quan-ngan-tay-ngan-qshop-qm839-p273699339.html?spid=273699343,17,,,dongunam
,,https://tiki.vn/bo-do-pijama-nam-luxury-tay-dai-mem-min-qshop-qm777-p271588515.html?spid=271588521,18,,,dongunam
"Bộ Pyjama HUONGTAM Phi bóng tay ngắn nam cao cấp(PNP02N). Chất liệu vải polyester mềm mại, thoáng mát, không phai màu",249.000₫,https://tiki.vn/bo-pyjama-huongtam-phi-bong-tay-ngan-nam-cao-cap-pnp02n-chat-lieu-vai-polyester-mem-mai-thoang-mat-khong-phai-mau-p273882272.html?spid=273882705,19,,,dongunam
Bộ quần áo thun cotton unisex nam nữ mặc hè siêu mát tặng kèm khẩu trang có video,120.000₫,https://tiki.vn/bo-quan-ao-thun-cotton-unisex-nam-nu-mac-he-sieu-mat-tang-kem-khau-trang-co-video-p109817098.html?spid=109817126,20,,Đã bán 4,dongunam
Bộ Mặc Nhà Thể Thao Nam Mùa Hè Thun Mỏng,200.000₫,https://tiki.vn/bo-mac-nha-the-thao-nam-mua-he-thun-mong-p174622758.html?spid=174622759,21,,,dongunam
Trang phục H'mông nam,110.000₫,https://tiki.vn/trang-phuc-h-mong-nam-p158210438.html?spid=158210442,22,,,dongunam
Bộ quần áo thui thái CLB Man Xanh 2022,165.000₫,https://tiki.vn/bo-quan-ao-thui-thai-clb-man-xanh-2022-p197280125.html?spid=197280166,23,,,dongunam
Đồ Bộ Thể Thao Nam Nữ LOANG 3 TẦNG- Set Quần Áo bốn mùa đẹp cao cấp mặc nhà đi chơi thoải mái 04 (TÂM SHOP),39.000₫,https://tiki.vn/do-bo-the-thao-nam-nu-loang-3-tang-set-quan-ao-bon-mua-dep-cao-cap-mac-nha-di-choi-thoai-mai-04-tam-shop-p249233130.html?spid=249233201,24,,,dongunam
Quần Đùi Mặc Nhà Nam - SỌC XANH NHỎ - XL(69-77KG),70.000₫,https://tiki.vn/quan-dui-mac-nha-nam-p263060102.html?spid=263060130,25,,,dongunam
,,https://tiki.vn/bo-quan-ao-m_tag-phi-hanh-gia-bo-do-nam-tre-trung-thoang-mat-tham-hut-tot-p260942442.html?spid=260942444,26,,,dongunam
Bộ bà ba áo trắng quần phi đen - Có bộ bà ba Bigsize- may sỉ bà ba toàn quốc - May bộ bà ba theo yêu cầu,320.000₫,https://tiki.vn/bo-ba-ba-phoi-trang-den-co-bigsize-mien-tay-gia-re-ao-ba-ba-trang-phi-bong-quan-phi-den-p269971454.html?spid=269971462,27,,,dongunam
Set đũi dài cho nam đủ size,250.000₫,https://tiki.vn/set-dui-dai-cho-nam-du-size-p187339423.html?spid=187339429,28,,,dongunam
Đồ Lam Đi Chùa#pháp phục Phật Tử-Mẫu Xéo Nhật Nam,210.000₫,https://tiki.vn/do-lam-di-chua-phap-phuc-phat-tu-mau-xeo-nhat-nam-p107037098.html?spid=107037215,29,,Đã bán 1,dongunam
Bộ nỉ trơn áo mũ Cotton H2B,547.000,https://tiki.vn/bo-ni-tron-ao-mu-cotton-h2b-p158475529.html?spid=158475532,30,,,dongunam
,,https://tiki.vn/set-bo-y5k5-p212114550.html?spid=212114551,31,,,dongunam
Bộ thu đông,400.000₫,https://tiki.vn/bo-thu-dong-p162973746.html?spid=162973747,32,,,dongunam
bộ đôi nỉ da cá chất đẹp có bán rời,1.135.000₫,https://tiki.vn/bo-doi-ni-da-ca-chat-dep-co-ban-roi-p162973844.html?spid=162973850,33,,,dongunam
Bộ hoodie Cotton Pana H2B,547.000₫,https://tiki.vn/bo-hoodie-cotton-pana-h2b-p158476732.html?spid=158476735,34,,,dongunam
Bộ áo thun Rank huyền thoại Áo màu trắng quần đen chất liệu siêu mềm mại,165.000,https://tiki.vn/bo-ao-thun-rank-huyen-thoai-ao-mau-trang-quan-den-chat-lieu-sieu-mem-mai-p77622533.html?spid=77622537,35,,,dongunam
,,https://tiki.vn/bo-ao-thun-trang-am-phu-chat-lieu-cotton-mem-mai-ao-thun-trang-quan-den-p77681365.html?spid=77681371,36,,,dongunam
ÁO GIỮ NHIỆT NAM TRƠN MỘT MÀU BÓ NGƯỜI SÀNH ĐIỆU,59.000₫,https://tiki.vn/ao-giu-nhiet-nam-tron-mot-mau-bo-nguoi-sanh-dieu-p201155810.html?spid=201155812,37,,,dongunam
Bộ quần áo thui thái CLB Man Xanh 2022,165.000₫,https://tiki.vn/bo-quan-ao-thui-thai-clb-man-xanh-2022-p192741724.html?spid=192741752,38,,,dongunam
"bộ áo cotton, chân vá xòe bé gái",152.000₫,https://tiki.vn/bo-ao-cotton-chan-va-xoe-be-gai-p179729743.html?spid=179729838,39,,,dongunam
Áo thun ba lỗ nam cotton Tanoshi,36.750₫,https://tiki.vn/ao-thun-ba-lo-nam-cotton-tanoshi-p117832072.html?spid=117832076,40,,,dongunam
