title,price,link_item,index,discount,sales,category
Bộ đồ Nam Thể Thao TDBN2,113.000₫,https://tiki.vn/bo-do-nam-the-thao-tdbn2-p17490261.html?spid=78014678,1,-9%,,dongunam
Áo Đoàn phục thiếu nam GĐPT,180.000₫,https://tiki.vn/ao-doan-phuc-thieu-nam-gdpt-p140861418.html?spid=140861429,2,,,dongunam
"Set bộ thun nam cao cấp - Chất thun lạnh mềm mịn, thoáng mát",215.000₫,https://tiki.vn/set-bo-thun-nam-cao-cap-chat-thun-lanh-mem-min-thoang-mat-p262813938.html?spid=270852200,3,,,dongunam
Set bộ thể tham nam chất thun lạnh họa tiết chữ KGA phối viền,120.000,https://tiki.vn/set-bo-the-tham-nam-chat-thun-lanh-hoa-tiet-chu-kga-phoi-vien-p263800378.html?spid=263800382,4,,,dongunam
,,https://tiki.vn/bo-the-thao-nam-nu-rkicfn-phoi-hinh-cay-cau-cuc-dep-p263802188.html?spid=263802196,5,,,dongunam
Bộ đồ pijama nam Luxury quần dài tay dài thoải mái QSHOP QM855,530.000₫,https://tiki.vn/bo-do-pijama-nam-luxury-quan-dai-tay-dai-thoai-mai-qshop-qm855-p273805034.html?spid=273805040,6,,,dongunam
Bộ Đồ Short Thun Bé Trai Vincy Thoáng Mát STL011W11,328.000₫,https://tiki.vn/bo-do-short-thun-be-trai-vincy-thoang-mat-stl011w11-p198935803.html?spid=198935807,7,,,dongunam
Bộ quần áo thể thao nam FASVIN AT22511.HN chất vải mềm nhẹ co giãn thoải mái,419.000₫,https://tiki.vn/bo-quan-ao-the-thao-nam-fasvin-at22511-hn-chat-vai-mem-nhe-co-gian-thoai-mai-p200929235.html?spid=200929251,8,,Đã bán 2,dongunam
