title,price,link_item,index,discount,sales,category
Vớ tất trẻ em không cổ cho bé trai 5-8 tuồi ELLE KIDS EK29,35.000₫,https://tiki.vn/vo-tat-tre-em-khong-co-cho-be-trai-5-8-tuoi-elle-kids-ek29-p74883583.html?spid=74883589,1,-37%,Đã bán 33,thoitrangmevabe
Quần dài bé trai dáng thể thao chất liệu nỉ cho bé từ 20 đến 52 kg,95.000₫,https://tiki.vn/quan-dai-be-trai-dang-the-thao-chat-lieu-ni-cho-be-tu-20-den-52-kg-p129026479.html?spid=129026511,2,-30%,Đã bán 53,thoitrangmevabe
Tất vớ trẻ em ANBY cotton chống trượt style Hàn Quốc cho bé trai bé gái từ 5 tháng đến 4 tuổi,5.000₫,https://tiki.vn/tat-vo-tre-em-cotton-chong-truot-style-han-quoc-cho-be-trai-be-gai-tu-5-thang-den-4-tuoi-p86569837.html?spid=155924259,3,-25%,Đã bán 340,thoitrangmevabe
"Bộ ( 1 bộ) đồ bộ Bé Gái Tole, Lanh loại 1 | Mẫu đùi Cánh Tiên cài nút sau | Size 1-16 cho bé từ 5-43kg",42.000₫,https://tiki.vn/bo-1-bo-do-bo-be-gai-canh-tien-dui-chat-vai-tole-lanh-2-da-loai-1-mem-min-thoang-mat-p170749463.html?spid=170749465,4,-42%,Đã bán 100,thoitrangmevabe
Mũ gấu lông cừu kèm kính chắn gió 3in1 cho bé trai bé gái,135.000₫,https://tiki.vn/mu-gau-long-cuu-kem-kinh-chan-gio-3in1-cho-be-trai-be-gai-p212981013.html?spid=212981019,5,-30%,Đã bán 26,thoitrangmevabe
[Kèm Video] Mắt Kính Trẻ Em SiPU Chính Hãng Cao Cấp MK02 Chống UV400 + Chống gãy - Bé Trai Bé Gái (Kèm Hộp Ô Tô),99.000₫,https://tiki.vn/kem-video-mat-kinh-tre-em-sipu-chinh-hang-cao-cap-mk02-chong-uv400-chong-gay-be-trai-be-gai-kem-hop-o-to-p190602774.html?spid=190602780,6,-12%,Đã bán 31,thoitrangmevabe
Quần lót đùi bé trai combo 4 quần chip trẻ em nam từ 9-42kg,100.000₫,https://tiki.vn/quan-lot-dui-be-trai-combo-4-quan-chip-tre-em-nam-tu-9-42kg-p131352987.html?spid=131352991,7,-30%,Đã bán 179,thoitrangmevabe
Sét 5 Quần lót cotton cho bé gái kháng khuẩn dễ thương từ 30-52kg,120.000₫,https://tiki.vn/set-5-quan-lot-cotton-cho-be-gai-khang-khuan-de-thuong-tu-30-52kg-p214859958.html?spid=214860027,8,-5%,Đã bán 23,thoitrangmevabe
"Quần kaki bé trai Easy Baby, quần đùi kaki thời trang cho bé từ 10-20kg (JS-432G)",119.000₫,https://tiki.vn/quan-kaki-be-trai-easy-baby-quan-dui-kaki-thoi-trang-cho-be-tu-10-20kg-js-432g-p197536024.html?spid=197536103,9,-45%,Đã bán 14,thoitrangmevabe
Hộp kẹp tóc 780 món cho bé SET 780 CHI TIẾT CỘT KẸP TÓC CHO BÉ-dây buộc tóc bé gái-kẹp tóc bé gái,35.000₫,https://tiki.vn/hop-kep-toc-780-mon-cho-be-set-780-chi-tiet-cot-kep-toc-cho-be-day-buoc-toc-be-gai-kep-toc-be-gai-p105804045.html?spid=251775892,10,,Đã bán 1,thoitrangmevabe
Giày thể thao bé trai trẻ em học sinh nam tiểu trung học siêu nhẹ kháng khuẩn cao cấp 8 - 12 tuổi đi học chạy bộ thể dục chơi bóng rổ phong cách khỏe khoắn năng động NHÍM SHOP GH74,365.000₫,https://tiki.vn/giay-the-thao-be-trai-tre-em-hoc-sinh-nam-tieu-trung-hoc-sieu-nhe-khang-khuan-cao-cap-8-12-tuoi-di-hoc-chay-bo-the-duc-choi-bong-ro-phong-cach-khoe-khoan-nang-dong-nhim-shop-gh74-p272489934.html?spid=272489944,11,,Đã bán 5,thoitrangmevabe
áo khoác lông cừu lót bông dày ấm cho bé trai bé gái hàng đẹp size từ 7-28kg - SUMO KIDS,145.000₫,https://tiki.vn/ao-khoac-long-cuu-lot-bong-day-am-cho-be-trai-be-gai-hang-dep-size-tu-7-28kg-sumo-kids-p201368848.html?spid=201368960,12,,Đã bán 12,thoitrangmevabe
Giày Boot da cho bé gái phong cách hàn quốc (mẫu mới nhất ) - BB109,259.000₫,https://tiki.vn/giay-boot-da-cho-be-gai-phong-cach-han-quoc-mau-moi-nhat-bb109-p125503889.html?spid=208634539,13,,Đã bán 21,thoitrangmevabe
Áo thun cộc tay 4LOVA cho bé trai chất cotton thoáng mát hình dễ thương,49.000₫,https://tiki.vn/ao-thun-coc-tay-4lova-cho-be-trai-chat-cotton-thoang-mat-hinh-de-thuong-p198122155.html?spid=198122175,14,,Đã bán 5,thoitrangmevabe
Giày thể thao sneaker bé gái 3 đến 13 tuổi - TG086,169.000₫,https://tiki.vn/giay-the-thao-sneaker-be-gai-3-den-13-tuoi-tg086-p60107181.html?spid=60107183,15,,Đã bán 87,thoitrangmevabe
"Chăn trâu thổi sáo, mã VN1. Áo thun tranh Đông Hồ Việt Nam siêu đẹp cho cả gia đình. Quà tặng ý nghĩa cho bố mẹ, con cái, bạn bè, doanh nghiệp, hội nhóm",69.000₫,https://tiki.vn/chan-trau-thoi-sao-ma-vn1-ao-thun-viet-nam-dep-cho-nam-nu-ao-thun-thoat-nhiet-hang-hieu-goking-cao-cap-p160882247.html?spid=249786112,16,,Đã bán 21,thoitrangmevabe
Quần Nỉ Thu Đông Thêu Chữ B Cho Bé Trai Bé Gái Mặc Đều Xinh Từ 6-28kg Moon House,75.000₫,https://tiki.vn/quan-ni-thu-dong-theu-chu-b-cho-be-trai-be-gai-mac-deu-xinh-tu-6-28kg-moon-house-p205072239.html?spid=205072306,17,,Đã bán 10,thoitrangmevabe
DÉP TỔ ONG HUYỀN THOẠI CHO BÉ NGÀN LỖ,18.000₫,https://tiki.vn/dep-to-ong-huyen-thoai-cho-be-ngan-lo-p143642978.html?spid=143643015,18,,Đã bán 67,thoitrangmevabe
"Quần áo bé gái quần lửng vải thun hiệu MIMYKID in hình 3D, đồ bộ trẻ em - LMTK-B06GH3",42.000₫,https://tiki.vn/quan-ao-be-gai-quan-lung-vai-thun-hieu-mimykid-in-hinh-3d-do-bo-tre-em-lmtk-b06gh3-p252300932.html?spid=252300944,19,,Đã bán 13,thoitrangmevabe
Quần Bỏ Bỉm 6 lớp dành cho bé có thể giặt được thoáng khí chống rò rỉ chống thấm,37.500₫,https://tiki.vn/quan-bo-bim-6-lop-danh-cho-be-co-the-giat-duoc-thoang-khi-chong-ro-ri-chong-tham-p125247920.html?spid=125247931,20,,Đã bán 174,thoitrangmevabe
"Mũ lưỡi trai cho bé từ 3-18 tháng Easy Baby, nón cho bé hình gấu dễ thương nhiều màu (H-515G)",69.000₫,https://tiki.vn/mu-luoi-trai-cho-be-tu-3-18-thang-easy-baby-non-cho-be-hinh-gau-de-thuong-nhieu-mau-h-515g-p199118120.html?spid=199118124,21,,Đã bán 12,thoitrangmevabe
Quần Legging Bé Gái Lửng Thun Cotton Xuất Xịn Co Giãn Mềm Mịn (21-40kg),55.000₫,https://tiki.vn/quan-legging-be-gai-lung-phoi-ren-cotton-xuat-xin-21-40kg-p103518696.html?spid=103519800,22,,Đã bán 35,thoitrangmevabe
"Áo thun trẻ em IRON MAN CHIBI 3, 4 màu, có size người lớn, Anam Store",65.000₫,https://tiki.vn/ao-thun-tre-em-iron-man-chibi-3-4-mau-co-size-nguoi-lon-anam-store-p263228950.html?spid=263231498,23,,Đã bán 4,thoitrangmevabe
Tất chân bé gái dài họa tiết nơ cao cấp nhiều màu TAT010C,69.300₫,https://tiki.vn/tat-chan-be-gai-dai-hoa-tiet-no-cao-cap-nhieu-mau-tat010c-p206270677.html?spid=206270685,24,,Đã bán 5,thoitrangmevabe
Vớ tất cổ ngắn cho bé trai từ 3-4 tuổi ELLE KIDS EK080,25.000₫,https://tiki.vn/vo-tat-co-ngan-cho-be-trai-tu-3-4-tuoi-elle-kids-ek080-p74856514.html?spid=74856522,25,,Đã bán 17,thoitrangmevabe
COMBO 3 bộ quần áo Tole lanh Bé Gái | Mẫu Tay Dài cài nút sau |Size 1-14 cho bé 5-38kg| Chất vải tole lanh 2 da loại 1 mềm mịn mát cho bé Gái| Hàng Việt Nam | Đồ bộ bé gái |quần áo trẻ em| Đồ tôn trẻ em,156.000₫,https://tiki.vn/combo-3-bo-do-bo-be-gai-chat-vai-tole-lanh-tay-dai-mem-min-mat-tole-tomtom-baby-hang-viet-nam-chat-luong-p52109918.html?spid=52109920,26,,Đã bán 446,thoitrangmevabe
Đầm bé gái gắn nơ trước ngực vải đũi từ 14-34 kg - MEEJENA - 2012,159.000₫,https://tiki.vn/dam-be-gai-gan-no-truoc-nguc-vai-dui-tu-14-34-kg-meejena-2012-p180502061.html?spid=194200357,27,,Đã bán 41,thoitrangmevabe
Áo khoác cho bé 0-4 tuổi 100% cotton hữu cơ tự nhiên không chất tẩy nhuộm cực kỳ mềm mại kèm mũ thời trang,275.000₫,https://tiki.vn/ao-khoac-cho-be-0-4-tuoi-100-cotton-huu-co-tu-nhien-khong-chat-tay-nhuom-cuc-ky-mem-mai-kem-mu-thoi-trang-p107978203.html?spid=107978216,28,,Đã bán 10,thoitrangmevabe
Sandal bé gái 3 - 12 tuổi kiểu dáng Hàn Quốc SG31,169.000₫,https://tiki.vn/sandal-be-gai-3-12-tuoi-kieu-dang-han-quoc-sg31-p50507634.html?spid=54130114,29,,Đã bán 307,thoitrangmevabe
Đầm Bé Gái Cổ Sơ Mi Ngắn Tay Vải POLO 14-38 kg MEEJENA - 1827,129.000₫,https://tiki.vn/dam-be-gai-co-so-mi-ngan-tay-vai-polo-14-38-kg-meejena-1827-p93211274.html?spid=93211313,30,,Đã bán 71,thoitrangmevabe
"Mũ sơ sinh 2 lớp cao cấp CUNCON- Vải thun cotton 4 chiều co giãn tốt, thoáng mát, thấm hút mồ hôi",26.000₫,https://tiki.vn/mu-so-sinh-2-lop-cao-cap-cuncon-vai-thun-cotton-4-chieu-co-gian-tot-thoang-mat-tham-hut-mo-hoi-p270625508.html?spid=270625512,31,,Đã bán 12,thoitrangmevabe
Tất cho bé gái màu hồng họa tiết đáng yêu vớ cổ cao nhiều size cho trẻ em học sinh 4 - 15 tuổi TA16,17.000₫,https://tiki.vn/tat-cho-be-gai-mau-hong-hoa-tiet-dang-yeu-vo-co-cao-nhieu-size-cho-tre-em-hoc-sinh-4-15-tuoi-ta16-p165637876.html?spid=165637880,32,,Đã bán 48,thoitrangmevabe
Quần Bầu SOOC ĐŨI mềm mát quần có chun và cúc điều chỉnh SĐX,54.000₫,https://tiki.vn/quan-bau-sooc-dui-mem-mat-quan-co-chun-va-cuc-dieu-chinh-sdx-p148641791.html?spid=148641841,33,,Đã bán 233,thoitrangmevabe
"Kẹp tóc, cột tóc, dây buộc tóc sét 780 chi tiết kẹp tóc cho bé OLAPLE",99.000₫,https://tiki.vn/kep-toc-cot-toc-day-buoc-toc-set-780-chi-tiet-kep-toc-cho-be-olaple-p99056835.html?spid=99056836,34,,Đã bán 101,thoitrangmevabe
Giày Thể Thao Bé Gái Biti's Disney BSG000697XAM,571.000₫,https://tiki.vn/giay-the-thao-be-gai-biti-s-disney-bsg000697xam-p270863131.html?spid=270863145,35,,Đã bán 4,thoitrangmevabe
"Quần Áo Bé Trai, Bộ Đồ Bé Trai Thu Đông Dễ Thương Cho Bé 16-40KG",179.000₫,https://tiki.vn/quan-ao-be-trai-bo-do-be-trai-thu-dong-de-thuong-cho-be-16-40kg-p204207979.html?spid=204207991,36,,Đã bán 14,thoitrangmevabe
"Kính Trẻ Em Aoron, Mắt Kính Chống Ánh Sáng Xanh Bảo Vệ Thị Lực Cho Bé Trai/Bé Gái 5-13 Tuổi Khung Silicone Dẻo Bền, Kiểu Dáng Dễ Thương- AK070",210.000₫,https://tiki.vn/kinh-tre-em-aoron-mat-kinh-chong-anh-sang-xanh-bao-ve-thi-luc-cho-be-trai-be-gai-5-13-tuoi-khung-silicone-deo-ben-kieu-dang-de-thuong-ak070-p200010750.html?spid=200010752,37,,Đã bán 7,thoitrangmevabe
"Vớ Ren Cho Bé Gái Đi Múa, Vớ Đi Múa Cho Bé, Tất Mang Giày Thể Thao",26.600₫,https://tiki.vn/vo-ren-cho-be-gai-di-mua-vo-di-mua-cho-be-tat-mang-giay-the-thao-p205986391.html?spid=205986397,38,,Đã bán 15,thoitrangmevabe
Vớ tất lưới cổ cao cho bé 0-3 tuổi chất cotton chống muỗi chống trơn trượt hình thú đủ màu sắc bắt mắt – T019,16.000₫,https://tiki.vn/vo-tat-luoi-co-cao-cho-be-0-3-tuoi-chat-cotton-chong-muoi-chong-tron-truot-hinh-thu-du-mau-sac-bat-mat-t019-p76065535.html?spid=76065539,39,,Đã bán 43,thoitrangmevabe
10 Quần Dài Sơ Sinh Trắng Cho Bé 2kg - 11kg,105.000₫,https://tiki.vn/10-quan-dai-so-sinh-trang-cho-be-2kg-11kg-p20648584.html?spid=20648586,40,,Đã bán 586,thoitrangmevabe
