,title,price,link_item,discount,sales,revenue
762,"Phấn Phủ Dạng Nén Dưỡng Ẩm Nhật Bản Sử Dụng 24h Club Suppin Powder Hương Hoa Trắng Cực Mịn, Kiềm Dầu",428000,https://tiki.vn/phan-phu-dang-nen-duong-am-nhat-ban-su-dung-24h-club-suppin-powder-huong-hoa-trang-cuc-min-kiem-dau-p75830647.html?spid=75830648,,7.0,2996000.0
763,LÔNG MI GIẢ KUN 5D-01,35000,https://tiki.vn/long-mi-gia-kun-5d-01-p134293113.html?spid=134293123,,2.0,70000.0
764,Son Tẩy Tế Bào Chết Coco Scrubbie Sense Plus Dưỡng Ẩm Môi 3.5g,99000,https://tiki.vn/son-tay-te-bao-chet-coco-scrubbie-sense-5g-p4163921.html?spid=4163923,,644.0,63756000.0
765,"Kẹp Gắp, Nhíp Gắp Nguyên Liệu, Vật Liệu, Phụ Kiện Chất Liệu Thép",5999,https://tiki.vn/kep-gap-nhip-gap-nguyen-lieu-vat-lieu-phu-kien-chat-lieu-thep-p101894104.html?spid=170181626,,3.0,17997.0
766,Phấn nền trang điểm siêu mịn lâu trôi Naris Ailus Lasting Smooth Powder Foundation Nhật Bản 10g + Móc khóa,295000,https://tiki.vn/phan-nen-trang-diem-sieu-min-lau-troi-naris-ailus-lasting-smooth-powder-foundation-nhat-ban-10g-moc-khoa-p19605229.html?spid=19605237,,7.0,2065000.0
767,Nhíp Inox Đầu Xéo Nhổ Lông Mày Vỉ Giấy KỀM NGHĨA N.407,23920,https://tiki.vn/nhip-vi-giay-n-407-p15656288.html?spid=15656289,,247.0,5908240.0
768,"Kem Chăm Sóc Môi Khô, Nứt Nẻ Uriage Bariederm Cica Levres Baume Protecteur 15ml",217000,https://tiki.vn/kem-cham-soc-moi-kho-nut-ne-uriage-bariederm-cica-levres-baume-protecteur-15ml-p130772703.html?spid=130772711,,14.0,3038000.0
769,Gel kẻ mắt Bbia Last Auto Gel Eyeliner 0.3g (10 màu),101000,https://tiki.vn/gel-ke-mat-bbia-last-auto-gel-eyeliner-0-3g-10-mau-p42662579.html?spid=42662593,,302.0,30502000.0
770,Kem Nền Siêu Mịn Lâu Trôi BB Benew ốc sên Cream Cao Cấp Hàn Quốc ( 50ml),185000,https://tiki.vn/kem-nen-sieu-min-lau-troi-bb-benew-oc-sen-cream-cao-cap-han-quoc-50ml-p184216691.html?spid=253058342,,1.0,185000.0
771,Phấn Nền Chống Nắng BB Organic SPF25/PA++ L'ocean,659000,https://tiki.vn/phan-nen-chong-nang-bb-organic-spf25-pa-p5984773.html?spid=5984785,-10%,12.0,7908000.0
772,Mascara PINKFLASH dài chống nước 4.5g,49000,https://tiki.vn/mascara-pinkflash-dai-chong-nuoc-4-5g-p271628487.html?spid=271628488,-26%,,
773,Son thỏi mềm môi Naris Ailus Smooth Lipstick Moisture Rich Nhật Bản 3.7g (#678 Ruby Rose) + Móc khóa,175000,https://tiki.vn/son-thoi-mem-moi-naris-ailus-smooth-lipstick-moisture-rich-nhat-ban-3-7g-678-ruby-rose-moc-khoa-p19373307.html?spid=19373308,-8%,15.0,2625000.0
774,Phấn Phủ Tinh Chất Ngọc Trai Nâng Tone Dạng Bột Dưỡng Da Sáng Trắng Phấn Nụ Hoàng Cung (25gr) Kèm Bông Phấn - Hàng Chính Hãng,375000,https://tiki.vn/phan-phu-tinh-chat-ngoc-trai-nang-tone-dang-bot-duong-da-sang-trang-phan-nu-hoang-cung-25gr-kem-bong-phan-hang-chinh-hang-p50493950.html?spid=91831575,,40.0,15000000.0
775,Son môi Kiko Gossamer Emotion Creamy Lipstick 109,209000,https://tiki.vn/son-moi-kiko-gossamer-emotion-creamy-lipstick-109-p106745777.html?spid=106745778,-8%,4.0,836000.0
776,Combo 2 Gương Tròn Mini Bỏ Túi Tiện Lợi MP079 - giao hình và màu ngẫu nhiên,18000,https://tiki.vn/combo-2-guong-tron-mini-bo-tui-tien-loi-mp079-giao-hinh-va-mau-ngau-nhien-p46059224.html?spid=93225097,-31%,77.0,1386000.0
777,Phấn mắt Cezanne Toneup Eye Shadow (2.7g),229500,https://tiki.vn/phan-mat-cezannetoneup-eye-shadow-2-7g-p11682968.html?spid=11682972,,,
778,Phấn nước Aprilskin Hero Cushion 12g,379000,https://tiki.vn/phan-nuoc-aprilskin-hero-cushion-12g-p208218662.html?spid=208218666,-10%,3.0,1137000.0
779,Phấn Phủ Dạng Bột Vacosi Loose Powder Natural Studio 10g,184000,https://tiki.vn/phan-phu-dang-bot-vacosi-loose-powder-natural-studio-10g-p9872034.html?spid=9872044,-6%,43.0,7912000.0
780,"Combo 4 món lược và gương cao cấp thiết kế sang trọng ,có thể tháo lắp dễ dàng ,giúp bàn trang điểm trở nên gọn gàng ",91000,https://tiki.vn/combo-4-mon-luoc-va-guong-cao-cap-thiet-ke-sang-trong-co-the-thao-lap-de-dang-giup-ban-trang-diem-tro-nen-gon-gang-p271494857.html?spid=271494858,,,
781,SON LÌ # 203 ELLA,590000,https://tiki.vn/son-li-203-ella-cam-dat-chay-bong-p90524344.html?spid=90524345,-12%,8.0,4720000.0
782,KEM TRANG ĐIỂM CHỐNG NẮNG CHYAKI NHẬT BẢN,550000,https://tiki.vn/kem-trang-diem-chong-nang-chyaki-nhat-ban-p87457506.html?spid=87457507,,48.0,26400000.0
783,Kem Nền FOX Dưỡng Ẩm Làm Sáng Da - SPF30★★ Stunning Liquid Foundation 30ml,620000,https://tiki.vn/kem-nen-duong-am-lam-sang-da-f-o-x-spf30-p24388750.html?spid=24408975,,96.0,59520000.0
784,Phấn Bột Whoo Mi Luxury Luminous Powder - Phấn phủ dạng bột siêu mịn.,890000,https://tiki.vn/phan-bot-whoo-mi-luxury-luminous-powder-phan-phu-dang-bot-sieu-min-p263047699.html?spid=263047700,,,
785,Gương trang điểm LAICA PC5003 - Gương hai mặt - tỉ lệ phóng đại x7,720000,https://tiki.vn/guong-trang-diem-laica-pc5003-guong-hai-mat-ti-le-phong-dai-x7-p123353316.html?spid=187275398,,8.0,5760000.0
786,Cây cọ vẽ môi,19000,https://tiki.vn/cay-co-ve-moi-p40455866.html?spid=48599818,,103.0,1957000.0
787,Phấn Phủ Mira Cherry Shine Powder B673,108000,https://tiki.vn/phan-phu-mira-cherry-shine-powder-b673-p271144595.html?spid=271144601,,1.0,108000.0
788,Bộ Cọ Trang Điểm 8 Chi Tiết Trong Túi Zip - giao hình và màu ngẫu nhiên,46000,https://tiki.vn/bo-co-trang-diem-8-chi-tiet-trong-tui-zip-giao-hinh-va-mau-ngau-nhien-p215973653.html?spid=215973655,,4.0,184000.0
789,Cuộn Dán Kích Mí Vân Lưới 600 Cái Tặng Kèm Nhíp Y Kích Mí M1,45000,https://tiki.vn/cuon-dan-kich-mi-van-luoi-600-cai-tang-kem-nhip-y-kich-mi-m1-p46611141.html?spid=52599148,,4.0,180000.0
790,Dao cạo lông mày - Dao tỉa chân mày nhỏ xinh tiện ích (CLM01),5000,https://tiki.vn/dao-cao-long-may-dao-tia-chan-may-nho-xinh-tien-ich-clm01-p251276360.html?spid=251276362,,1.0,5000.0
791,Son Kiko Velvet Passion Matte Lipstick,279000,https://tiki.vn/son-kiko-velvet-passion-matte-lipstick-p37486868.html?spid=146495101,,81.0,22599000.0
792,"Son môi Hanayuki Lips Pink giúp làm hồng giảm thâm, dưỡng mềm",125000,https://tiki.vn/son-moi-hanayuki-lips-pink-giup-lam-hong-giam-tham-duong-mem-p183907878.html?spid=203824498,,8.0,1000000.0
793,Son dưỡng môi Mật ong Phấn Nụ Hoàng Cung,136800,https://tiki.vn/son-duong-moi-mat-ong-phan-nu-hoang-cung-p7941075.html?spid=7941076,,39.0,5335200.0
794,Lõi phấn nước Ohui Ultimate Cover The Couture Cushion 01 Pink Beige,280000,https://tiki.vn/loi-phan-nuoc-ohui-ultimate-cover-the-couture-cushion-01-pink-beige-p269953149.html?spid=269953150,,,
795,Son Dưỡng Lâu Trôi Sidumi - SDM 602,280000,https://tiki.vn/son-duong-lau-troi-sidumi-sdm-602-p137854395.html?spid=137854397,,1.0,280000.0
796,Combo Chì kẻ mày OHUI Real Color Eyebrow Pencil và Sữa rửa mặt OHUI Miracle Foam 40ml,395000,https://tiki.vn/combo-chi-ke-may-ohui-real-color-eyebrow-pencil-va-sua-rua-mat-ohui-miracle-cleansing-foam-40ml-p58547722.html?spid=58547726,,10.0,3950000.0
797,Combo 02 Son tint bóng không dính siêu lỳ Lemonade Mirror Mirror Water Tint,478000,https://tiki.vn/combo-02-son-tint-bong-khong-dinh-sieu-ly-lemonade-mirror-mirror-water-tint-p271395928.html?spid=271395930,,1.0,478000.0
798,Son môi hữu cơ dưỡng ẩm có màu - naturaglacé TREATMENT LIP OIL MORE,888000,https://tiki.vn/son-huu-co-duong-am-co-mau-naturaglace-treatment-lip-oil-more-p36901913.html?spid=36901918,,19.0,16872000.0
799,Bút Tẩy Trắng Răng Giúp Răng Trắng Sáng Nhanh,15000,https://tiki.vn/but-tay-trang-rang-giup-rang-trang-sang-nhanh-p196728456.html?spid=196728457,,16.0,240000.0
800,[ Mua 1 tặng 1] Son Happy kem lì Mini Garden Mattle Lipcream - Bám màu lâu trôi 3.5ml,399000,https://tiki.vn/mua-1-tang-1-son-happy-kem-li-mini-garden-mattle-lipcream-bam-mau-lau-troi-3-5ml-p199976049.html?spid=199976182,,11.0,4389000.0
801,Lông mi giả 3D (số 07),55000,https://tiki.vn/long-mi-gia-3d-so-07-p21711777.html?spid=48602849,,15.0,825000.0
802,Cọ Môi Lông Dài Vỏ Trắng Vacosi L02,44000,https://tiki.vn/co-moi-long-dai-vo-trang-vacosi-l02-p3022383.html?spid=3039375,,70.0,3080000.0
803,Kem Nền Klairs Illuminating Supple Blemish Cream SPF 40 PA++,255000,https://tiki.vn/kem-nen-klairs-illuminating-supple-blemish-cream-spf-40-pa-p10773788.html?spid=10773789,,80.0,20400000.0
804,"Son dưỡng môi DHC Nhật Bản Lip Cream giữ ẩm môi, giảm thâm và trẻ hóa môi JN-DHC-LIP",199000,https://tiki.vn/son-duong-moi-dhc-nhat-ban-lip-cream-giu-am-moi-giam-tham-va-tre-hoa-moi-jn-dhc-lip-p115549866.html?spid=115549867,-9%,33.0,6567000.0
805,Xà Bông rửa & dưỡng cọ The Master made in USA,70300,https://tiki.vn/xa-bong-rua-duong-co-the-master-made-in-usa-p135732683.html?spid=135732765,,5.0,351500.0
806,Son Dưỡng Lì Có Màu YNM Candy Pop Glow Melting Balm Coral Moment 3g/ Đỏ Hồng,250000,https://tiki.vn/son-duong-li-co-mau-ynm-candy-pop-glow-melting-balm-coral-moment-3g-do-hong-p248542369.html?spid=248542370,-7%,2.0,500000.0
807,Son dưỡng môi Cenota Lip Gloss Balm Dưỡng Ẩm Làm Hồng Môi,89000,https://tiki.vn/son-duong-moi-cenota-lip-gloss-balm-duong-am-lam-hong-moi-p74883265.html?spid=74883266,-5%,13.0,1157000.0
808,CHÌ KẺ MÀY NGANG VACCI - VACCI AUTO EYEBROW PENCIL,158000,https://tiki.vn/chi-ke-may-ngang-vacci-vacci-auto-eyebrow-pencil-p76197309.html?spid=76197317,-61%,5.0,790000.0
809,Bộ cọ TRANG ĐIỂM mini 5 MÓN kèm gương,43998,https://tiki.vn/bo-co-trang-diem-mini-5-mon-kem-guong-p217323003.html?spid=225967252,-29%,,
810,Son Xinh Đông Anh Chính Hãng Son Kem Lì Không Trôi Set 3 Màu Đỏ Tươi - Cam Đất - Đỏ Cam Collagen x3,249000,https://tiki.vn/son-moi-my-pham-dong-anh-chinh-hang-son-kem-li-khong-troi-set-3-mau-do-tuoi-cam-dat-do-cam-p272431581.html?spid=272431582,-5%,,
811,KEM LÓT TRANG ĐIỂM KIỀM DẦU VACOSI NATURAL STUDIO OIL-FREE BASE,323950,https://tiki.vn/kem-lot-trang-diem-kiem-dau-vacosi-natural-studio-oil-free-base-01-clear-p123202125.html?spid=140523964,-50%,19.0,6155050.0
812,Gương trang điểm để bàn phong cách Pháp sang trọng điều chỉnh được tư thế (tặng tấm dán trang trí móng nail),139000,https://tiki.vn/guong-trang-diem-de-ban-phong-cach-phap-sang-trong-dieu-chinh-duoc-tu-the-tang-tam-dan-trang-tri-mong-nail-p52248868.html?spid=52248869,-19%,25.0,3475000.0
813,GƯƠNG TRANG ĐIỂM 2 MẶT LÚA MẠCH - XOAY 360 ĐỘ - JL,43900,https://tiki.vn/guong-trang-diem-2-mat-lua-mach-xoay-360-do-jl-p195127515.html?spid=195127516,-36%,,
814,Nước pha Mascara không vón cục Mira Aroma Hàn Quốc 20ml tặng kèm móc khoá,65000,https://tiki.vn/nuoc-pha-mascara-khong-von-cuc-mira-aroma-han-quoc-20ml-tang-kem-moc-khoa-p25068550.html?spid=25068551,-37%,108.0,7020000.0
815,Sữa rửa mặt trẻ em Poro Foam Cleanser Hàn Quốc 120g,175000,https://tiki.vn/sua-rua-mat-tre-em-poro-foam-cleanser-han-quoc-120g-p204318323.html?spid=204318327,,4.0,700000.0
816,Bộ Combo Mỹ Phẩm Makeup Trang Điểm Lucky Bag Daisy Doll Nhật Bản(Bộ 5 Sản Phẩm),1799000,https://tiki.vn/bo-makeup-da-nang-gom-ke-may-3in1-phan-mat-2-mau-dang-thoi-kem-lot-bat-sang-daisy-doll-nhat-ban-p259489439.html?spid=259489440,,,
817,Phấn nước Lemonade Supermatte Cushion 14g,339000,https://tiki.vn/phan-nuoc-lemonade-supermatte-cushion-14g-p184487954.html?spid=184487969,,,
818,Gương Trang Điểm Mini 2 Mặt Phẳng Để Bàn – Một Mặt Có Thể Phóng To Gấp 3 Lần,24999,https://tiki.vn/guong-trang-diem-mini-2-mat-phang-de-ban-mot-mat-co-the-phong-to-gap-3-lan-p20834379.html?spid=206845725,,,
819,"Dưỡng mi DHC Eyelash Tonic hỗ trợ kích thích mọc mi, làm dày, dài và chắc khỏe lông mi - chiết xuất 100% từ thiên nhiên - Massel Official",267000,https://tiki.vn/tinh-chat-duong-mi-dhc-eyelash-tonic-6-5ml-p271306372.html?spid=75765261,,166.0,44322000.0
820,Bộ phấn nước che khuyết điểm mịn da O HUI Ultimate Cover Cushion Satin Finish set,858000,https://tiki.vn/bo-phan-nuoc-che-khuyet-diem-o-hui-ultimate-cover-cushion-satin-finish-set-p128504250.html?spid=128504252,,,
821,Combo 2 Bộ dao cạo tỉa lông mày kèm 2 lưỡi tiện lợi,6000,https://tiki.vn/combo-2-bo-dao-cao-tia-long-may-kem-2-luoi-tien-loi-p48054936.html?spid=148072057,,3.0,18000.0
822,Cọ nhấn đuôi mắt - E09-Y24,57000,https://tiki.vn/co-nhan-duoi-mat-e09-y24-p273407151.html?spid=273407152,,,
823,Bộ 5 cọ trang điểm,45000,https://tiki.vn/bo-5-co-trang-diem-p77718454.html?spid=77718455,,,
824,"Cốm rắc nhiều màu trang trí ốp điện thoại, gương, cặp tóc (Túi loại 3gram)",7000,https://tiki.vn/com-rac-nhieu-mau-trang-tri-op-dien-thoai-guong-cap-toc-tui-loai-3gram-p206117988.html?spid=206118000,,,
825,Bộ 8 Nhíp gắp mụn bằng thép không gỉ tiện dụng,165000,https://tiki.vn/bo-8-nhip-gap-mun-bang-thep-khong-gi-tien-dung-p137253449.html?spid=137253463,,18.0,2970000.0
826,Kẹp mi cong lâu Lemonade Curler 22g,129000,https://tiki.vn/kep-mi-cong-lau-lemonade-curler-22g-p263060530.html?spid=263060531,,2.0,258000.0
827,Lip Smacker - Set 6 Cây Son Coca Coca Vỉ Nhôm Vị Truyền Thống - LipSmaker Coca Cola Vintage Bottle Tint,109500,https://tiki.vn/lip-smacker-set-6-cay-son-coca-coca-vi-nhom-vi-truyen-thong-lipsmaker-coca-cola-vintage-bottle-tint-p73400044.html?spid=73400045,,27.0,2956500.0
828,Phấn Mắt Eyeshadow Dạng Vỉ Mira B619,30000,https://tiki.vn/phan-mat-eyeshadow-dang-vi-mira-b619-p271190536.html?spid=271190542,,1.0,30000.0
829,"Phấn Nước Trang điểm Kiềm dầu Cushion Mini Garden 3 In 1 40+ PA+++, lớp nền mịn, tự nhiên tặng 1 son hapy",359000,https://tiki.vn/tang-1-son-hapy-phan-nuoc-cc-cushion-mini-garden-3-in-1-40-pa-p161242120.html?spid=161242136,,3.0,1077000.0
830,Hộp 4 mút trang điểm - Mút tán kem nền có hộp nhựa đựng tiện dụng,38500,https://tiki.vn/hop-4-mut-trang-diem-mut-tan-kem-nen-co-hop-nhua-dung-tien-dung-p217696790.html?spid=219453564,,1.0,38500.0
831,Dao cạo lông mày đa năng gấp gọn tặng kèm 2 lưỡi cạo chân mày chống rỉ chống sướt da,18000,https://tiki.vn/dao-cao-long-may-da-nang-gap-gon-tang-kem-2-luoi-cao-chan-may-chong-ri-chong-suot-da-ha-song-p198897938.html?spid=207376526,,8.0,144000.0
832,Cọ Che Khuyết Điềm Đầu Tròn PRO VACOSI - FP15 Round Concealer,102600,https://tiki.vn/co-che-khuyet-diem-dau-tron-pro-vacosi-fp15-round-concealer-p209406100.html?spid=209406101,,2.0,205200.0
833,"Son dưỡng Saffron không màu trị thâm môi, phục hồi môi, làm đầy rãnh môi Saffron Lip Balm 4g",145000,https://tiki.vn/son-duong-saffron-khong-mau-tri-tham-moi-phuc-hoi-moi-lam-day-ranh-moi-saffron-lip-balm-4g-p74572921.html?spid=74572922,,1.0,145000.0
834,Son Dưỡng Môi Dầu Dừa Và Sáp Ong TaBaHa 5g,26000,https://tiki.vn/son-duong-moi-dau-dua-va-sap-ong-tabaha-5g-p175110289.html?spid=175110290,,3.0,78000.0
835,"Son Dưỡng Môi Không Màu Origanic Hương Dâu Origani Butterfly Kiss Strawberry Crush Lip Balm (15mL) - Dưỡng Ẩm, Giảm Thâm, Chữa Lành cho Môi",1000000,https://tiki.vn/son-duong-moi-huong-dau-butterfly-kiss-strawberry-crush-lip-balm-p42647837.html?spid=42647838,,21.0,21000000.0
836,Son xăm Berrisom My Lip Tink Pack màu plum berry,189000,https://tiki.vn/son-xam-berrisom-my-lip-tink-pack-mau-plum-berry-p109788426.html?spid=109788429,,13.0,2457000.0
837,SON DƯỠNG CHỐNG NẮNG CHO MÔI SEBAMED pH5.5 (4.8g),141000,https://tiki.vn/son-duong-cho-ng-na-ng-cho-moi-sebamed-ph5-5-4-8g-p55224391.html?spid=141774710,,3.0,423000.0
838,Kem che khuyết điểm Aroma Cover Foundation Hàn Quốc 14g No.23 Beige tặng kèm móc khoá,99000,https://tiki.vn/kem-che-khuyet-diem-aroma-cover-foundation-han-quoc-14g-no-23-beige-tang-kem-moc-khoa-p20805370.html?spid=20805371,-49%,8.0,792000.0
839,Gương trang điểm bầu dục 360 độ mini để bàn 2 mặt Minigood Hàn Quốc DMCTB081,55000,https://tiki.vn/guong-trang-diem-bau-duc-360-do-mini-de-ban-2-mat-minigood-han-quoc-dmctb081-p3793231.html?spid=91457760,-14%,25.0,1375000.0
840,Phấn nước Lagivado Just Perfection Foudation,450000,https://tiki.vn/phan-nuoc-lagivado-chinh-hang-han-quoc-giup-che-nhung-khuyet-diem-tren-da-mang-lai-lan-da-min-mang-mem-mai-p23242831.html?spid=23242833,,398.0,179100000.0
841,Bộ Cọ Trang Điểm BH COSMETICS Poolside Chic 12 Piece Brush Set,410000,https://tiki.vn/bo-co-trang-diem-bh-cosmetics-poolside-chic-12-piece-brush-set-p271377108.html?spid=271377111,-5%,,
842,Gương cầm tay Uncle Bills GM0009 - giao màu ngẫu nhiên,79000,https://tiki.vn/guong-cam-tay-uncle-bills-gm0009-giao-mau-ngau-nhien-p20550880.html?spid=20550881,-29%,9.0,711000.0
843,Phấn trang điểm tạo khối Mik@vonk Hàn Quốc 12g tặng kèm móc khoá,99000,https://tiki.vn/phan-trang-diem-tao-khoi-mik-vonk-han-quoc-12g-tang-kem-moc-khoa-p20244099.html?spid=20244107,-5%,75.0,7425000.0
844,Gương Soi Để Bàn Trang Điểm Gấp Gọn Cao Cấp Dày,24000,https://tiki.vn/guong-soi-de-ban-trang-diem-gap-gon-cao-cap-day-p136117882.html?spid=136117884,-40%,3.0,72000.0
845,KẸP MI NHIỆT 2 CÀNG SIÊU CONG CAO CẤP MAGITECH NHẬT BẢN,375000,https://tiki.vn/kep-mi-nhiet-sieu-cong-magitech-nhat-ban-may-uon-mi-nhiet-magitech-nhap-khau-p117197796.html?spid=230211833,,,
846,Son dưỡng chống khô nứt môi hương cherry màu đỏ đậm Sebamed pH5.5 Sensitive Skin Lip Defense Cherry 4.8g,121000,https://tiki.vn/son-duong-chong-kho-nut-moi-huong-cherry-mau-do-dam-sebamed-ph5-5-sensitive-skin-lip-defense-cherry-4-8g-p55512933.html?spid=55512934,-27%,7.0,847000.0
847,Mút nền Celin,120000,https://tiki.vn/mut-nen-celin-p134293435.html?spid=134293452,-15%,,
848,Bộ Chăm Sóc Môi Mềm - Combo Son Môi Hồng Gồm Son Dưỡng Mềm Môi + Son Lụa Không Chì+ Tẩy Da Chết Môi) Cỏ Mềm,418000,https://tiki.vn/bo-cham-soc-moi-mem-combo-son-moi-hong-gom-son-duong-mem-moi-son-lua-khong-chi-tay-da-chet-moi-co-mem-p210298234.html?spid=210298266,-38%,2.0,836000.0
849,[MAYBELLINE NEW YORK] Bảng Phấn Mắt 6 Màu Xinh Xắn Và Tiện Lợi The City Mini Palette 6.1g,368000,https://tiki.vn/maybelline-new-york-bang-phan-mat-6-mau-xinh-xan-va-tien-loi-the-city-mini-palette-6-1g-p253220823.html?spid=253220837,,1.0,368000.0
850,"Phấn Tạo Khối City Color 3 ô Contour Effects công thức mới, 100g",175000,https://tiki.vn/phan-tao-khoi-city-color-3-o-contour-effects-cong-thuc-moi-100g-p271663864.html?spid=271663865,,,
851,Bộ cọ trang điểm BH COSETICS hello holo 10 piece brush set,349000,https://tiki.vn/bo-co-trang-diem-bh-cosetics-hello-holo-10-piece-brush-set-p271336101.html?spid=271336102,,,
852,Kem nền FOCALLURE dạng lỏng fluid foundation 31g,65500,https://tiki.vn/kem-nen-focallure-dang-long-fluid-foundation-31g-p271538661.html?spid=271538667,,,
853,"Mascara Kissme Không Trôi, Không Lem, Vuốt Dài Và Cong Mi ( 6g)",89000,https://tiki.vn/mascara-kissme-khong-troi-khong-lem-vuot-dai-va-cong-mi-6g-p203183649.html?spid=262862482,,4.0,356000.0
854,Phấn má cao cấp Gucci Blush De Beaute,1033000,https://tiki.vn/phan-ma-cao-cap-gucci-blush-de-beaute-p240476174.html?spid=240476178,,,
855,Phấn mắt 8 ô siêu mịn Mira Aroma Shadow Palette 8 Colors Hàn Quốc (2g x8) No.5 tặng kèm móc khoá,239000,https://tiki.vn/phan-mat-8-o-sieu-min-mira-aroma-shadow-palette-8-colors-han-quoc-2g-x8-no-5-tang-kem-moc-khoa-p20873387.html?spid=20873388,,9.0,2151000.0
856,Kem Lót Trang Điểm Kiềm Dầu Chống Nắng Dưỡng Ẩm Time Secret Mineral Primer Base Trắng Sáng Da,398000,https://tiki.vn/kem-lot-time-secret-mineral-primer-base-p76224645.html?spid=76224646,,6.0,2388000.0
857,Kem Nền – Canmake Perfect Serum BB Cream,425000,https://tiki.vn/kem-nen-canmake-perfect-serum-bb-cream-p36382408.html?spid=82071027,,4.0,1700000.0
858,Nhíp Gắp Mụn Inox Đầu Cong Dài 10cm,7600,https://tiki.vn/nhip-gap-mun-inox-dau-cong-dai-10cm-p148856120.html?spid=148856121,,22.0,167200.0
859,Bộ 6 Bông Phấn Ướt Trang Điểm Tam Giác Vacosi Collection Pro-Makeup - BP14,54000,https://tiki.vn/bo-6-bong-phan-uot-trang-diem-tam-giac-vacosi-collection-pro-makeup-bp14-p9984692.html?spid=9984693,,30.0,1620000.0
860,MIẾNG DÁN KÍCH MÍ LƯỚI VACOSI (SỬ DỤNG NƯỚC) SIZE L,79800,https://tiki.vn/mieng-dan-kich-mi-luoi-vacosi-su-dung-nuoc-size-l-p187149306.html?spid=187149307,,4.0,319200.0
861,Son dưỡng môi Pơ Lang dưỡng mềm môi từ trái bơ - A08,99000,https://tiki.vn/17-son-duong-moi-po-lang-duong-mem-moi-tu-trai-bo-a08-p240460391.html?spid=240460393,,4.0,396000.0
862,Bút Chì Sáp Kẻ Mí Mắt Kissme Heroine Make Không Trôi (Nét Vẽ Tự Nhiên-Dạng Xoay) Màu Nâu,109000,https://tiki.vn/but-chi-sap-ke-mi-mat-kissme-heroine-make-khong-troi-net-ve-tu-nhien-dang-xoay-mau-nau-p271188000.html?spid=271188001,,,
863,BÚT KẺ MẮT NƯỚC SIÊU BỀN LẤP LÁNH TOẢ SÁNG ĐẦY TRANG NHÃ - MÀU XANH LƯU LY #04,219000,https://tiki.vn/but-ke-mat-nuoc-sieu-ben-lap-lanh-toa-sang-day-trang-nha-mau-xanh-luu-ly-04-p247655050.html?spid=247655051,,,
864,Bông Phấn Kem Tròn Nhỏ Vacosi Collection Pro-Makeup BP-22,29000,https://tiki.vn/bong-phan-kem-tron-nho-vacosi-collection-pro-makeup-bp-22-p9984698.html?spid=9984699,,5.0,145000.0
865,Kem nền chống nắng BB ốc sên Ekel,99000,https://tiki.vn/kem-nen-chong-nang-bb-oc-sen-ekel-p63905404.html?spid=63905405,,19.0,1881000.0
866,Gương gập đứng để bàn size to - quả dâu,36000,https://tiki.vn/guong-gap-dung-de-ban-size-to-qua-dau-p153985210.html?spid=153985217,,,
867,Son Givenchy Le Rouge Interdit Intense Silk 306,699000,https://tiki.vn/son-givenchy-le-rouge-interdit-intense-silk-306-p273171773.html?spid=273171774,,,
868,MIRROR MOON - SIÊU PHẨM GƯƠNG KẾT HỢP ĐÈN NGỦ ĐÈN LED MÁY PHÁT NHẠC 3 TRONG 1,2799000,https://tiki.vn/mirror-moon-sieu-pham-guong-ket-hop-den-ngu-den-led-may-phat-nhac-3-trong-1-p43270987.html?spid=43270988,,,
869,Son kem lì PINKFLASH gloss 2.6g,99000,https://tiki.vn/son-kem-li-pinkflash-gloss-2-6g-p271627981.html?spid=271627989,,,
870,BÚT KẺ MẮT NƯỚC NGỌC TRAI - MÀU XÁM BE #05 MỰC SIÊU BỀN LẤP LÁNH TOẢ SÁNG ĐẦY TRANG NHÃ,219000,https://tiki.vn/but-ke-mat-nuoc-ngoc-trai-mau-xam-be-05-muc-sieu-ben-lap-lanh-toa-sang-day-trang-nha-p247654766.html?spid=247654767,-27%,,
871,Kem Che Khuyết Điểm Dạng Tròn L'ocean (16g),379000,https://tiki.vn/kem-che-khuyet-diem-dang-tron-p5981557.html?spid=5981569,-5%,40.0,15160000.0
872,"Kem lót trang điểm kiêm kem dưỡng da - naturaglacé Nu Makeup Base SPF32 PA ++ , 30ml",1900000,https://tiki.vn/kem-lo-t-trang-die-m-kiem-kem-duong-da-naturaglace-nu-makeup-base-spf32-pa-30ml-p83171153.html?spid=83171156,-5%,3.0,5700000.0
873,Kem trang điểm đa năng 3 trong 1 - naturaglacé Touch On Colors,939000,https://tiki.vn/kem-trang-diem-da-nang-3-trong-1-naturaglace-touch-on-colors-p83171211.html?spid=83171217,-30%,2.0,1878000.0
874,Dầu Gội Khô Dạng Xịt Làm Sạch Tóc Không Bết Dính Gội Đầu Khô Không Cần Nước,42750,https://tiki.vn/dau-goi-kho-dang-xit-lam-sach-toc-khong-bet-dinh-goi-dau-kho-khong-can-nuoc-p204711262.html?spid=204711263,,,
875,Chì che khuyết điểm Mira Cover Pencil Hàn Quốc tặng kèm móc khoá,145000,https://tiki.vn/chi-che-khuyet-diem-mira-cover-pencil-han-quoc-tang-kem-moc-khoa-p21181867.html?spid=21181871,-18%,55.0,7975000.0
876,"Bút vẽ chân mày môi mắt, định vị đầu đơn sơn trắng cho ngành thêu phun xăm tattoo eyebrow",50000,https://tiki.vn/but-ve-chan-may-moi-mat-dinh-vi-dau-don-son-trang-cho-nganh-theu-phun-xam-tattoo-eyebrow-p215792007.html?spid=215792008,,1.0,50000.0
877,Phấn nền FOCALLURE kiềm dầu 10g,82500,https://tiki.vn/phan-nen-focallure-kiem-dau-10g-p271537784.html?spid=271537785,,2.0,165000.0
878,Cọ Chân Mày Đầu Cứng VACOSI - BR05 EYEBROW ANGLED BRUSH,44650,https://tiki.vn/co-may-dau-cung-vacosi-br05-p123202430.html?spid=123202434,,,
879,Son Môi Belips Son Thỏi Vẹn Tròn (Phiên Bản Giới Hạn),287600,https://tiki.vn/son-moi-belips-son-thoi-ven-tron-phien-ban-gioi-han-p84177031.html?spid=84177039,,14.0,4026400.0
880,COMBO 3 SON DƯỠNG NAKED KISS BALM SENSE PLUS HƯƠNG CAM + TẶNG 2 MIẾNG MẶT NẠ MÔI,199000,https://tiki.vn/combo-3-son-duong-moi-mem-thien-nhien-sense-plus-huong-cam-p220668872.html?spid=220668873,,,
881,Cọ môi che khuyết điểm HIDATI đa công dụng tiện lợi ( Tặng túi bọc đầu cọ cao cấp ),29450,https://tiki.vn/co-moi-che-khuyet-diem-hidati-da-cong-dung-tien-loi-tang-tui-boc-dau-co-cao-cap-p252099929.html?spid=252099930,,3.0,88350.0
882,Gương Trang Điểm PTA Bỏ Túi Mini Siêu Tiện Lợi,12500,https://tiki.vn/guong-trang-diem-pta-bo-tui-mini-sieu-tien-loi-p148683255.html?spid=148683257,,77.0,962500.0
883,Black Rouge Phấn mắt Colordation 8g,680000,https://tiki.vn/black-rouge-phan-mat-colordation-8g-p229765607.html?spid=229765611,,,
884,Phấn má Revolution Blusher Reloaded Peach Bliss 7.5g (Bill Anh),119000,https://tiki.vn/phan-ma-revolution-blusher-reloaded-peach-bliss-7-5g-bill-anh-p86326996.html?spid=86326997,,4.0,476000.0
885,Nhíp lổ youkiloon cong,35000,https://tiki.vn/nhip-lo-youkiloon-cong-p129527958.html?spid=129527964,,8.0,280000.0
886,Cọ Tán Môi Đầu Tròn Trang Điểm Chuyên Nghiệp,19000,https://tiki.vn/co-tan-moi-dau-tron-trang-diem-chuyen-nghiep-p271306258.html?spid=271306259,,,
887,Bút Chì Kẻ Mày the SAEM Saemmul Wood Eyebrow Black 1.8g,45500,https://tiki.vn/but-chi-ke-may-the-saem-saemmul-wood-eyebrow-black-1-8g-p157198796.html?spid=157198799,,16.0,728000.0
