,title,price,link_item,discount,sales,revenue
1128,Kem Phấn Nước Trang Điểm Mềm Mượt Và Dưỡng Trắng Da It'S Well Plus Snail Calendula 333 Gold CC Cushion SPF50+/PA+++ Essence 15g,162000,https://tiki.vn/kem-phan-nuoc-trang-diem-mem-muot-va-duong-trang-da-it-s-well-plus-snail-calendula-333-gold-cc-cushion-spf50-pa-essence-15g-p9668940.html?spid=72975023,,2.0,324000.0
1129,Son muge leen cô gái meyoco retro matte liquid (Set 5 cây),125000,https://tiki.vn/son-muge-leen-co-gai-meyoco-retro-matte-liquid-set-5-cay-p100000319.html?spid=104717975,,79.0,9875000.0
1130,"Gương trang điểm đèn led ánh sáng 3 cấp độ, Gương trang điểm pin sạc USB",399000,https://tiki.vn/guong-trang-diem-den-led-anh-sang-3-cap-do-guong-trang-diem-pin-sac-usb-p136015482.html?spid=136015488,,,
1131,Bảng Phấn Mắt Nhỏ Absolute Newyork Icon Mini - Aflame AIM02 (8g),258000,https://tiki.vn/bang-phan-mat-nho-absolute-newyork-icon-mini-aflame-aim02-8g-p7101753.html?spid=7181119,,15.0,3870000.0
1132,Phấn Phủ Ngọc Trai BÀ TÙNG - 20g,280000,https://tiki.vn/phan-phu-ngoc-trai-ba-tung-20g-p24244620.html?spid=24244621,,8.0,2240000.0
1133,"Cây Cọ Đánh Thoa Son Môi Tiện Lợi Đánh Lên Màu Chuẩn Nét, Màu Vàng/ Bạc Inox",29000,https://tiki.vn/cay-co-danh-thoa-son-moi-tien-loi-danh-len-mau-chuan-net-mau-vang-bac-inox-p174029918.html?spid=174029922,,4.0,116000.0
1134,Phấn Má Hồng Bà Tùng (15g),150000,https://tiki.vn/phan-ma-hong-ba-tu-ng-15g-p51285960.html?spid=51285961,-28%,9.0,1350000.0
1135,(Combo) Kem nền lâu trôi 24h có khả năng chống nắng phổ rộng MAC Studio Fix Fluid SPF 15 Foundation 30ml - Tặng son MAC Powder Kiss Lipstick - Moisture Matte Lipstick 3g MÀU NGẪU NHIÊN,1900000,https://tiki.vn/combo-kem-nen-lau-troi-24h-co-kha-nang-chong-nang-pho-rong-mac-studio-fix-fluid-spf-15-foundation-30ml-p197648896.html?spid=197648897,,,
1136,Mascara Tẩy Trang Kissme Heroine Make Speedy Mascara Remover,156000,https://tiki.vn/mascara-tay-trang-kissme-heroine-make-speedy-mascara-remover-p262891335.html?spid=262891336,-2%,,
1137,Set phấn nước Sum xanh Su:m37 Water-Full CC Cushion - Dành cho da dầu nhờn da hỗn hợp da mụn (Mẫu mới 2023),1400000,https://tiki.vn/set-phan-nuoc-sum-xanh-su-m37-water-full-cc-cushion-danh-cho-da-dau-nhon-da-hon-hop-da-mun-mau-moi-2023-p270879226.html?spid=270879227,-2%,,
1138,Kẻ mắt nước Mik@vonk siêu đen không lem không trôi Hàn Quốc 3.5ml tặng kèm móc khóa,149000,https://tiki.vn/ke-mat-nuoc-mik-vonk-sieu-den-khong-lem-khong-troi-han-quoc-3-5ml-tang-kem-moc-khoa-p24793120.html?spid=24793121,-39%,34.0,5066000.0
1139,"Miếng Đánh Nền Silicol Trang Điểm, Chức Năng Đánh Nền Makeup Căng Mịn, Đều Màu Ở Các Khu Vực Khác Nhau Trên Khuôn Mặt, Giữ Vẻ Tự Nhiên, Độ Mềm Dẻo Cao, Phù Hợp Mọi Loại Da, Không Gây Khó Chịu Cho Người Dùng, Không Bị Thấm Nhiều, Tiết Kiệm Và Tiện Dụng, Cầ",15000,https://tiki.vn/mieng-danh-nen-silicol-trang-diem-chuc-nang-danh-nen-makeup-cang-min-deu-mau-o-cac-khu-vuc-khac-nhau-tren-khuon-mat-giu-ve-tu-nhien-do-mem-deo-cao-phu-hop-moi-loai-da-khong-gay-kho-chiu-cho-nguoi-dung-khong-bi-tham-nhieu-tiet-kiem-va-tien-dung-cam-thoai-mai-de-dang-su-dung-voi-kem-nen-dang-long-p86276043.html?spid=86276044,-8%,3.0,45000.0
1140,Volume & Curl Mascara Mira - Mascara Làm Cong Và Dày Mi Mira - B690,108000,https://tiki.vn/volume-curl-mascara-mira-mascara-lam-cong-va-day-mi-mira-b690-p19266135.html?spid=19266137,-50%,32.0,3456000.0
1141,Bộ Khuôn Kẻ Chân Mày Mira Aroma Eyebrow Drawing Stencil Set ( 3 miếng/ bịch) C415,14000,https://tiki.vn/bo-khuon-ke-chan-may-mira-aroma-eyebrow-drawing-stencil-set-3-mieng-bich-p9666756.html?spid=19408456,-34%,70.0,980000.0
1142,Bộ 6 Cọ trang điểm chuyên nghiệp kèm hộp đựng có nắp - xanh Green Tube Makeup INGLOT,1635000,https://tiki.vn/bo-co-trang-diem-tube-makeup-inglot-green-6-co-ong-da-dung-co-co-nap-p250075951.html?spid=250075955,,,
1143,Phấn má Revolution Blusher Reloaded Violet Love 7.5g (Bill Anh),119000,https://tiki.vn/phan-ma-revolution-blusher-reloaded-violet-love-7-5g-bill-anh-p86286572.html?spid=86286573,-27%,,
1144,Gương trang điểm tai mèo tròn xoay 360 độ,53000,https://tiki.vn/guong-trang-diem-tai-meo-tron-xoay-360-do-p23424065.html?spid=262028762,,,
1145,Serum dưỡng dài và dày mi Cosnori Long Active Eyelash 9g,375000,https://tiki.vn/serum-duong-dai-va-day-mi-cosnori-long-active-eyelash-9g-p222680726.html?spid=222680727,,1.0,375000.0
1146,Má Hồng Dạng Kem myKella Trang Điểm Má - Môi - Mắt 3in1 - Multi Purpose Balm Peach Màu Hồng 8.5g,293020,https://tiki.vn/kem-trang-diem-ma-hong-moi-mat-mykella-multi-purpose-balm-rose-tone-hong-8-5g-p253182335.html?spid=253182337,,1.0,293020.0
1147,Má Hồng Dạng Kem myKella Trang Điểm Má - Môi - Mắt 3in1 - Multi Purpose Balm Peach Bắt Sáng 8.5g,293020,https://tiki.vn/kem-trang-diem-ma-hong-moi-mat-mykella-multi-purpose-balm-glowy-bat-sang-8-5g-p253182334.html?spid=253182336,,,
1148,Combo son kem lì mỏng mịn mềm môi C01 Muse Orange + C05 Swettie Baby Belips City At Night,499000,https://tiki.vn/combo-son-kem-li-mong-min-mem-moi-c01-muse-orange-c05-swettie-baby-belips-city-at-night-p270758669.html?spid=270758670,,,
1149,Keo kích mí-dán mi giả Eye Cream,33000,https://tiki.vn/keo-kich-mi-dan-mi-gia-eye-cream-p253665021.html?spid=253665022,,1.0,33000.0
1150,Dao Cạo Lông Mày Cán Dài Kai Groom 38531-HC1161,17000,https://tiki.vn/dao-cao-long-may-can-dai-kai-groom-38531-hc1161-p272990656.html?spid=272990659,,67.0,1139000.0
1151,Bảng Màu Kẻ Mày Và Tạo Sống Mũi 3D FOX Brow & Shadow Compact 6.5g,320000,https://tiki.vn/bang-mau-ke-may-va-tao-song-mui-3d-f-o-x-brow-shadow-compact-6-5g-p22563278.html?spid=22563279,,12.0,3840000.0
1152,Bộ đôi son kem lì mỏng mịn mềm môi City At Night C02 Sexy Red + C03 Night Party,539000,https://tiki.vn/bo-doi-son-kem-li-mong-min-mem-moi-city-at-night-c02-sexy-red-c03-night-party-p249774349.html?spid=249774350,,2.0,1078000.0
1153,Phấn nền mỏng mịn lâu trôi Ailus Lasting Smooth Powder Nhật Bản 10g (#140 Trắng hồng) + Móc khóa,295000,https://tiki.vn/phan-nen-mong-min-lau-troi-ailus-lasting-smooth-powder-nhat-ban-10g-140-trang-hong-moc-khoa-p19605823.html?spid=19605824,,,
1154,"Phấn trang điểm khoáng chất vitamin E, kiểm soát dầu MiraCulous Hàn Quốc 22g No.21 Da tự nhiên tặng kèm móc khoá",379000,https://tiki.vn/phan-trang-diem-khoang-chat-vitamin-e-kiem-soat-dau-miraculous-han-quoc-22g-no-21-da-tu-nhien-tang-kem-moc-khoa-p21127373.html?spid=21127374,,12.0,4548000.0
1155,Phấn Mắt 8 Ô Siêu Mịn Mira Aroma C503 (16g),192000,https://tiki.vn/phan-mat-8-o-sieu-min-mira-aroma-c365-04-16g-p1264967.html?spid=1271335,,95.0,18240000.0
1156,Mascara hai đầu Habaria Pro Long Curly,99000,https://tiki.vn/mascara-hai-dau-habaria-pro-long-curly-p248802098.html?spid=248802099,,,
1157,Son môi Charlotte Tilbury - Carina 's Star,849000,https://tiki.vn/son-moi-charlotte-tilbury-carina-s-star-p60224668.html?spid=60224669,,12.0,10188000.0
1158,I69 - I70 Phấn nén IASO Smart Powder Pact Spf30 #21 & #23 14g,654500,https://tiki.vn/i69-i70-phan-nen-iaso-smart-powder-pact-spf30-21-23-14g-p262891927.html?spid=262891929,,3.0,1963500.0
1159,Bông Phấn Nước Mềm Mịn Mira Aroma- C387,36000,https://tiki.vn/bong-phan-nuoc-mem-min-mira-aroma-c387-p19266134.html?spid=19266136,,19.0,684000.0
1160,"SÉT PHẤN NƯỚC SUM XANH DÀNH CHO DA DẦU, NHỜN, HỖN HỢP TONE 1 DA SÁNG",808000,https://tiki.vn/set-phan-nuoc-sum-xanh-danh-cho-da-dau-nhon-hon-hop-tone-1-da-sang-p253361388.html?spid=253361389,,,
1161,Kéo Chuyên Cắt Tỉa Lông Mày,15000,https://tiki.vn/keo-chuyen-cat-tia-long-may-p124208695.html?spid=124208717,,2.0,30000.0
1162,"Cọ tán son môi hiệu ứng ombre, che khuyết điểm mềm mịn môi",20000,https://tiki.vn/co-tan-son-moi-hieu-ung-ombre-che-khuyet-diem-mem-min-moi-p242077676.html?spid=242077678,,39.0,780000.0
1163,Son dưỡng môi Shiseido Men Moisturizing Lip Creator 2g,650000,https://tiki.vn/son-duong-moi-shiseido-men-moisturizing-lip-creator-2g-p184794860.html?spid=184794862,,10.0,6500000.0
1164,Kem che khuyết điểm màu da cho da thường và khô_BB Perfect beauty fluid,2743000,https://tiki.vn/kem-che-khuyet-diem-mau-da-cho-da-thuong-va-kho_bb-perfect-beauty-fluid-p15684119.html?spid=15684120,,1.0,2743000.0
1165,"Kéo cắt tỉa lông mày, lông mi (mũi cong/mũi tròn)",19000,https://tiki.vn/keo-cat-tia-long-may-long-mi-mui-cong-mui-tron-p203961016.html?spid=203961019,,3.0,57000.0
1166,"Kem nền trang điểm chống nắng, chống nhăn - Verobene Rice Recipe Double Wear Foun BB SPF 36+/PA++ 30ml",360000,https://tiki.vn/kem-nen-trang-diem-chong-nang-chong-nhan-verobene-rice-recipe-double-wear-foun-bb-spf-36-pa-30ml-p11555903.html?spid=11555904,,6.0,2160000.0
1167,Phấn Che Khuyết Điểm JENNY HOUSE Self-Up Hair Line Brush 4g - Tạo Khối Chân Mày,427000,https://tiki.vn/phan-che-khuyet-diem-jenny-house-self-up-hair-line-brush-4g-tao-khoi-chan-may-p182457786.html?spid=182457787,-39%,,
1168,Lược Kèm Gương Đầu Cừu/Nơ Gấp Gọn Bỏ Túi 2 in 1,79000,https://tiki.vn/luoc-kem-guong-dau-cuu-no-gap-gon-bo-tui-2-in-1-p272438075.html?spid=272438076,-31%,,
1169,"Gel Che Khuyết Điểm Chàm, Bạch Biến ACM Viticolor Skin Camouflage Gel 50ml",858000,https://tiki.vn/gel-che-khuyet-diem-cham-bach-bien-acm-viticolor-skin-camouflage-gel-50ml-p250538753.html?spid=250538754,-30%,,
1170,"Bút kích mí, Kem tạo kiểu mí mắt Sanuo",39999,https://tiki.vn/but-kich-mi-kem-tao-kieu-mi-mat-sanuo-p155242968.html?spid=155242971,-15%,1.0,39999.0
1171,Kem BB Cream Sun Protect - JIGOTT SPF41 PA++ (70ml),225000,https://tiki.vn/kem-bb-cream-aloe-sun-protect-jigott-spf41-pa-p13336100.html?spid=47275986,-5%,2.0,450000.0
1172,"Gương trang điểm để bàn cho nam và nữ thiết kế hiện đại sang trọng với đèn led gắn trên gương 3 chế độ ánh sáng cho hình ảnh soi rõ nét, chân thực nhất KHUYẾN MÃI SỐC",120866,https://tiki.vn/guong-trang-diem-de-ban-cho-nam-va-nu-thiet-ke-hien-dai-sang-trong-voi-den-led-gan-tren-guong-3-che-do-anh-sang-cho-hinh-anh-soi-ro-net-chan-thuc-nhat-khuyen-mai-soc-p186364177.html?spid=186364178,-30%,,
1173,Mascara Làm Tơi Mi Không Trôi Kissme Heroine Make (1.8G),137000,https://tiki.vn/mascara-la-m-toi-mi-khong-troi-kissme-heroine-make-1-8g-p271424058.html?spid=271424060,-36%,,
1174,"Bút Kẻ Mắt Nước Chống Trôi, Không Lem Nét Kẻ Siêu Mãnh Kissme Eyeline Màu Nâu Đen (0.4mL)",215000,https://tiki.vn/but-ke-mat-nuoc-chong-troi-khong-lem-net-ke-sieu-manh-kissme-eyeline-mau-nau-den-0-4ml-p271980548.html?spid=271980549,-23%,,
1175,Son lì lâu trôi Benew Delux Matte Hàn Quốc 3.5g # M03 Real Ruby tặng kèm móc khóa,240000,https://tiki.vn/son-li-lau-troi-benew-delux-matte-han-quoc-3-5g-m03-real-ruby-tang-kem-moc-khoa-p35526451.html?spid=35526452,,6.0,1440000.0
1176,Kem Lót BB Đa Chức Năng Mira Jewel Wrinkle Care & Whitening Hàn Quốc 30ml tặng kmf móc khoá,245000,https://tiki.vn/kem-lot-bb-da-chuc-nang-mira-jewel-wrinkle-care-whitening-han-quoc-30ml-tang-kmf-moc-khoa-p21154220.html?spid=23890549,-45%,14.0,3430000.0
1177,Keo dán mi siêu chắc JEU kích mí an toàn cho da - Hity Beauty,49000,https://tiki.vn/keo-dan-mi-sieu-chac-jeu-kich-mi-an-toan-cho-da-hity-beauty-p271445526.html?spid=271445527,,,
1178,Tinh chất nuôi dưỡng làn da khỏe mạnh It's Skin Power 10 Formula VE Effector Hàn Quốc 30ml,235000,https://tiki.vn/tinh-chat-nuoi-duong-lan-da-khoe-manh-it-s-skin-power-10-formula-ve-effector-han-quoc-30ml-p204318219.html?spid=204318225,,,
1179,Kiko Milano Coloured Balm - Son Dưỡng Môi Có Màu,169000,https://tiki.vn/kiko-milano-coloured-balm-son-duong-moi-co-mau-p31494250.html?spid=37164190,,67.0,11323000.0
1180,Set 2 Nhíp Nhổ Lông S Select Nhật Bản (02 Chiếc/Gói),75650,https://tiki.vn/set-2-nhip-nho-long-s-select-nhat-ban-02-chiec-goi-p252584827.html?spid=252584828,,1.0,75650.0
1181,Mút tán kem make up hồ lô tiện dụng màu xinh xắn,45000,https://tiki.vn/mut-tan-kem-make-up-ho-lo-tien-dung-mau-xinh-xan-p111285898.html?spid=111285910,,,
1182,Dao Cạo Lông Body,65000,https://tiki.vn/dao-cao-long-body-p193210360.html?spid=193210362,,,
1183,Lõi phấn tạo khói hiệu ứng HD Highlighter Inglot (4.8g),239000,https://tiki.vn/loi-phan-tao-khoi-hieu-ung-hd-highlighter-inglot-4-8g-p247704729.html?spid=247704731,,,
1184,Kem Che Khuyết Điểm Mira Full Coverage Liquid Concealer B776,132000,https://tiki.vn/kem-che-khuyet-diem-mira-full-coverage-liquid-concealer-b776-p271145615.html?spid=271145617,,,
1185,Gương trang điểm gấp gọn cho bạn gái,22000,https://tiki.vn/guong-trang-diem-gap-gon-cho-ban-gai-p135147370.html?spid=185408607,,1.0,22000.0
1186,"COMBO 2 BỊCH BÔNG PHẤN KHÔ TRÒN NHỎ VÀ BÔNG ƯỚT TRÒN NHỎ VACOSI (BỊCH 2 CÁI ) BP01, BP03",41800,https://tiki.vn/combo-2-bich-bong-phan-kho-tron-nho-va-bong-uot-tron-nho-vacosi-bich-2-cai-bp01-bp03-p123202576.html?spid=123202577,,5.0,209000.0
1187,Bộ Dao Cạo Lông Mày Đa Năng,15000,https://tiki.vn/bo-dao-cao-long-may-da-nang-p163024805.html?spid=163024807,,162.0,2430000.0
1188,Phấn phủ nén WH GJH Mi Two Way Pact,1008000,https://tiki.vn/phan-phu-nen-wh-gjh-mi-two-way-pact-p57913125.html?spid=57913127,,8.0,8064000.0
1189,Son Lì Red Cookies Brownie Velcet Lip Hàn Quốc Màu B4 - Đỏ Berry (4gr ),225000,https://tiki.vn/son-li-red-cookies-brownie-velcet-lip-han-quoc-mau-b4-do-berry-4gr-p263046366.html?spid=263046367,,,
1190,Kệ Đựng Đồ Mỹ Phẩm Đa Năng Có Gương Trang Điểm 2 Ngăn Kéo Và 4 Hộc Đựng Đồ Dễ Thương Tự Lắp Dễ Dàng,76000,https://tiki.vn/ke-dung-do-my-pham-da-nang-co-guong-trang-diem-2-ngan-keo-va-4-hoc-dung-do-de-thuong-tu-lap-de-dang-p273568738.html?spid=273568824,,,
1191,KEO HỒNG DÁN MÍ LƯỚI KÈM QUE NHẤN MÍ,91000,https://tiki.vn/keo-hong-dan-mi-luoi-kem-que-nhan-mi-p264002593.html?spid=264002608,,,
1192,Gương Trang Điểm Để Bàn chữ nhật hình tròn siêu xinh và tiện dụng 360 độ có giá đỡ,26000,https://tiki.vn/guong-trang-diem-de-ban-chu-nhat-hinh-tron-sieu-xinh-va-tien-dung-360-do-co-gia-do-p120338695.html?spid=120338699,,,
1193,"Bộ 6 cái Nhíp gắp linh kiện thép không gỉ inox 304 nhíp ghép lông mi, nối tóc, làm móng, gắp lông tổ yến",99000,https://tiki.vn/bo-6-cai-nhip-gap-linh-kien-thep-khong-gi-inox-304-nhip-ghep-long-mi-noi-toc-lam-mong-gap-long-to-yen-p214656735.html?spid=214656736,,3.0,297000.0
1194,MI GIẢ GÂN TRONG BEE B4,40000,https://tiki.vn/mi-gia-gan-trong-bee-b4-p117992428.html?spid=117992430,,,
1195,Son Thỏi Có Dưỡng Nhẹ Absolute Newyork Ultra Slick Lipstick NFA05 - Gorgeous (5g),158000,https://tiki.vn/son-thoi-co-duong-nhe-absolute-newyork-ultra-slick-lipstick-nfa05-gorgeous-5g-p7101905.html?spid=7181305,,1.0,158000.0
1196,SON DƯỠNG ROSEBUD SALVE LIP BALM 22GR,385000,https://tiki.vn/son-duong-rosebud-salve-lip-balm-22gr-p21126689.html?spid=21126690,,24.0,9240000.0
1197,Chì kẻ mắt Orlane Eyelid Balm Ensoleille (3g),720000,https://tiki.vn/but-trang-diem-mi-mat-orlane-eyelid-balm-ensoleille-3g-p1536287.html?spid=1543887,,,
1198,Cọ trang điểm Estee Lauder Double Wear Dual-Ended Foundation Brush,199000,https://tiki.vn/co-trang-diem-estee-lauder-double-wear-dual-ended-foundation-brush-p249669221.html?spid=249669222,,,
1199,Kem Lót Nền BB Petite SPF25/PA++ L'ocean (50g),479000,https://tiki.vn/kem-lot-nen-l-ocean-bb-petite-spf25-pa-50g-p5893895.html?spid=5921741,,7.0,3353000.0
1200,Gương Để Bàn Trang Điểm MakeUp Hình Tròn Màu Xanh Có Đèn Led Cảm Ứng 3 Chế Độ Màu - Tặng Gương Phóng Đại 5 Lần,117300,https://tiki.vn/guong-de-ban-trang-diem-makeup-hinh-tron-mau-xanh-co-den-led-cam-ung-3-che-do-mau-tang-guong-phong-dai-5-lan-p163826921.html?spid=163826922,-49%,1.0,117300.0
1201,"Cọ tém xéo vẽ chân mày, kẻ eyeliner A101, A102 viền mắt cho makeup trang điểm chuyên nghiệp - Hity Beauty",20000,https://tiki.vn/hcm-co-tem-xeo-ve-chan-may-ke-eyeliner-a101-a102-vien-mat-cho-makeup-trang-diem-chuyen-nghiep-hity-beauty-p271439597.html?spid=271439599,-5%,,
1202,"Khay Đựng Son 24 ô, đựng dụng cụ trang điểm 24 Ô",24900,https://tiki.vn/khay-dung-son-24-o-dung-dung-cu-trang-diem-24-o-p109853358.html?spid=109853363,,1.0,24900.0
1203,"Mút đánh nền Cosmetic Wedges cao cấp, bông phấn không chứa cao su, bông trang điểm tam giác nhỏ - Hity Beauty",35000,https://tiki.vn/mut-danh-nen-cosmetic-wedges-cao-cap-bong-phan-khong-chua-cao-su-bong-trang-diem-tam-giac-nho-hity-beauty-p271444945.html?spid=271444946,,,
1204,Kem che khuyết điểm hỗ trợ dưỡng trắng TRANSINO Whitening UV Concealer,684000,https://tiki.vn/kem-che-khuyet-diem-ho-tro-duong-trang-transino-p225209529.html?spid=253058649,-19%,1.0,684000.0
1205,Phấn phủ hữu cơ chống nắng dạng bột size mini-naturaglacé LOOSE POWDER-01:Màu da sáng,776000,https://tiki.vn/phan-phu-huu-co-chong-nang-dang-bot-size-mini-naturaglace-loose-powder-01-mau-da-sang-p50082261.html?spid=50082262,,8.0,6208000.0
1206,Lăn đuổi muỗi cho trẻ em Poro Kids Hàn Quốc 50ml,125000,https://tiki.vn/lan-duoi-muoi-cho-tre-em-poro-kids-han-quoc-50ml-p271535083.html?spid=271535085,-29%,,
1207,Phấn Phủ Mira Aroma Gold Collagen Shine Powder 18g C482,144000,https://tiki.vn/pha-n-phu-mira-aroma-gold-collagen-shine-powder-18g-c482-p271152229.html?spid=271152231,-29%,,
1208,Dao Cạo Lông Mặt Gập Gọn Tiện Dụng Đa Năng Cho Nữ,21500,https://tiki.vn/dao-cao-long-mat-gap-gon-tien-dung-da-nang-cho-nu-p255255869.html?spid=188510024,,1.0,21500.0
1209,"Son Dưỡng Hồng Môi Germaine ET O2 Correction Care Lips Contour - Đào Thải Chì, Dưỡng Ẩm; Giữ Màu Phun Xăm - Kelly Beauty",920000,https://tiki.vn/son-duong-hong-moi-germaine-et-o2-correction-care-lips-contour-dao-thai-chi-duong-am-giu-mau-phun-xam-kelly-beauty-p262656269.html?spid=262656270,,,
1210,Bộ 5 cọ hồng kèm gương trang điểm cao cấp,49999,https://tiki.vn/bo-5-co-hong-kem-guong-trang-diem-cao-cap-p252858890.html?spid=270071404,,,
1211,Kem Lót Nền Dưỡng Da BB L'ocean (15ml),609000,https://tiki.vn/kem-lot-nen-l-ocean-duong-da-10-trong-1-15ml-p5893899.html?spid=5921737,,7.0,4263000.0
1212,Gương Trang Điểm Phóng To 5 Lần Có Đèn Beurer BS 59,1530000,https://tiki.vn/guong-trang-diem-phong-to-5-lan-co-den-beurer-bs-59-p442880.html?spid=190757996,,,
1213,Son Dưỡng Có Màu Watsons Baby Tint Glow Coral Rose SPF15 3.9g,90000,https://tiki.vn/son-duong-co-mau-watsons-baby-tint-glow-coral-rose-spf15-3-9g-p271247962.html?spid=271247963,,2.0,180000.0
1214,"Kéo Cắt Mi Chuyên Nghiệp Lưỡi Cong Thép Cao Cấp Không Gỉ, Kiểu Dáng Nhỏ Gọn Để Mang Theo, Dễ Thao Tác, Sử Dụng Tạo Kiểu Nhanh Chóng",35000,https://tiki.vn/keo-cat-mi-chuyen-nghiep-luoi-cong-thep-cao-cap-khong-gi-kieu-dang-nho-gon-de-mang-theo-de-thao-tac-su-dung-tao-kieu-nhanh-chong-p207357074.html?spid=207357075,,,
1215,Bút Kẻ Mắt Nước Siêu Sắc Mảnh Không Lem Không Trôi Maybelline New York HyperSharp Liner Đen 0.5g,250000,https://tiki.vn/but-ke-mat-nuoc-sieu-sac-manh-khong-lem-khong-troi-maybelline-new-york-hypersharp-liner-den-0-5g-p433801.html?spid=271158317,,,
1216,Kem Lót Ohui Ultimate Cover Primer 02 Rosy Corrector 30ml,590000,https://tiki.vn/kem-lot-ohui-ultimate-cover-primer-02-rosy-corrector-30ml-p273553998.html?spid=273553999,,,
1217,Son Kem Lì Mịn Môi PEKAH WINSOME COTTON TINT Son kem lì Hàn Quốc 4.5g,179000,https://tiki.vn/son-kem-li-min-moi-pekah-winsome-cotton-tint-son-kem-li-han-quoc-4-5g-p96989095.html?spid=96989110,,9.0,1611000.0
1218,Bộ Ngoáy Tai Có Đèn Và Nhíp Gắp Cao Cấp Chuyên Nghiệp Bằng Hợp Kim Có Hộp - Giao mẫu ngẫu nhiên,39000,https://tiki.vn/bo-ngoay-tai-co-den-va-nhip-gap-cao-cap-chuyen-nghiep-bang-hop-kim-co-hop-giao-mau-ngau-nhien-p273317748.html?spid=273317781,,,
1219,Gương trang điểm để bàn khung kim loại xoay 360 độ,149000,https://tiki.vn/guong-trang-diem-de-ban-khung-kim-loai-xoay-360-do-p248263257.html?spid=248263259,,,
1220,Bộ cọ BH Cosmetic (có sẵn),258700,https://tiki.vn/bo-co-bh-cosmetic-p95968698.html?spid=95968708,,,
1221,Cọ Lông Mày Đầu Vát Lustre Pro Makeup Brush - Brow Brush - Gold Edition E105,240000,https://tiki.vn/co-long-may-dau-vat-lustre-pro-makeup-brush-brow-brush-gold-edition-e105-p4494911.html?spid=4518493,,4.0,960000.0
1222,Joseph Joseph - Bàn chải cọ nồi silicon cao cấp CleanTech Washing-up Brush Blue,269000,https://tiki.vn/joseph-joseph-ban-chai-co-noi-silicon-cao-cap-cleantech-washing-up-brush-blue-p220823979.html?spid=220823980,,,
1223,Combo 2 hộp bông tẩy trang Cotton Pads - 2x40 miêng,15000,https://tiki.vn/combo-2-hop-bong-tay-trang-cotton-pads-2x40-mieng-p271889276.html?spid=271889277,,,
1224,BLACK ROUGE Son kem lì Cream Matt Rouge 5g,298000,https://tiki.vn/black-rouge-son-kem-li-cream-matt-rouge-5g-p230019048.html?spid=230019050,,,
1225,"Kéo Cắt Tỉa Lông Mi, Lông Mày Đầu Thẳng Cao Cấp Thép Không Gỉ",28000,https://tiki.vn/keo-cat-tia-long-mi-long-may-dau-thang-cao-cap-thep-khong-gi-p272247981.html?spid=272247982,,,
1226,CHÌ KẺ CHÂN MÀY ĐỊNH HÌNH QUEENIE 0.2G - MỸ PHẨM HÀN QUỐC,130000,https://tiki.vn/chi-ke-chan-may-dinh-hinh-queenie-0-2g-my-pham-han-quoc-p66701491.html?spid=66701492,,7.0,910000.0
1227,Chì Kẻ Môi Mira Auto Lipliner B763,72000,https://tiki.vn/chi-ke-moi-mira-auto-lipliner-b763-p271360436.html?spid=271360444,,,
1228,Chì Kẻ Môi Quyến Rũ Mik@Vonk Professional Lipliner Pencil Hàn Quốc #03 Màu đỏ hồng tặng kèm móc khoá,79000,https://tiki.vn/chi-ke-moi-quyen-ru-mik-vonk-professional-lipliner-pencil-han-quoc-03-mau-do-hong-tang-kem-moc-khoa-p20706613.html?spid=20706614,,1.0,79000.0
1229,Kéo cắt tỉa lông mày Mini sắc bén,48000,https://tiki.vn/keo-cat-tia-long-may-mini-sac-ben-p41537077.html?spid=52152681,,32.0,1536000.0
1230,Chén silicon giặt cọ rửa mút trang điểm GECOMO có thể gấp gọn tiện lợi dành cho makeup - Hity Beauty,29000,https://tiki.vn/chen-silicon-giat-co-rua-mut-trang-diem-gecomo-co-the-gap-gon-tien-loi-danh-cho-makeup-hity-beauty-p271454007.html?spid=271454011,,,
1231,"Mascara Lót Nền Chống Trôi ,Siêu Nâng Dài Mi Kissme Make Curl Keep Mascara Base (6,6 mL)",185000,https://tiki.vn/mascara-lot-nen-sieu-nang-dai-mi-chong-troi-sieu-ben-trong-24h-kissme-heroine-make-dang-mang-film-nang-cao-6-6-ml-p191752910.html?spid=191752916,,,
1232,Bút Chì Sáp Kẻ Mí Mắt Không Trôi Kissme Heroine Make Quick Eyeliner (Nét Vẽ Tự Nhiên-Dạng Xoay),109000,https://tiki.vn/but-chi-sap-ke-mi-mat-khong-troi-kissme-heroine-make-quick-eyeliner-net-ve-tu-nhien-dang-xoay-p182559014.html?spid=182559018,,5.0,545000.0
1233,Gương trang điểm để bàn phóng to 3 lần có đèn led Beurer Bs49 (bảo hành 2 năm),892000,https://tiki.vn/guong-trang-diem-de-ban-phong-to-3-lan-co-den-led-beurer-bs49-bao-hanh-2-nam-p195649456.html?spid=195649458,-34%,,
1234,Phấn nước Ohui Ultimate Cover LIFTING Cushion bản cao nhất của Ohui TẶNG SON,990000,https://tiki.vn/phan-nuoc-ohui-ultimate-cover-lifting-cushion-ban-cao-nhat-cua-ohui-tang-son-p273472130.html?spid=273472131,-10%,,
1235,Mascara dày và dài mi Juice Beauty Phyto-Pigments Ultra-Natural Mascara (8.5g),1088000,https://tiki.vn/mascara-day-va-dai-mi-juice-beauty-phyto-pigments-ultra-natural-mascara-8-5g-p25146072.html?spid=25146073,-30%,2.0,2176000.0
1236,Hộp Đựng Cọ Trang Điểm Đế Xoay 360 Độ Có Nắp Đậy Trong Suốt Chống Bụi Để Bàn Tiện Lợi - Hàng chính hãng,69000,https://tiki.vn/ho-dung-co-trang-diem-de-xoay-360-do-co-nap-day-trong-suot-chong-bui-de-ban-tien-loi-hang-chinh-hang-p273134343.html?spid=273177944,-49%,,
1237,[Combo 2 sản phẩm] Kem che khuyết điểm tone 1.25 Light Beige (6.5g) + Kem nền the SAEM 02 Natural Beige (30ml),420000,https://tiki.vn/combo-2-san-pham-kem-che-khuyet-diem-tone-1-75-middle-beige-6-5g-kem-nen-the-saem-01-light-beige-30ml-p128633663.html?spid=128633679,,10.0,4200000.0
1238,Máy uốn mi điện. Kẹp mi điện. Máy uốn mi nhiệt siêu cong và cong lâu gấp 10 lần kẹp uốn mi thông thường,51000,https://tiki.vn/may-uon-mi-dien-cao-cap-kep-mi-dien-cao-cap-p248616046.html?spid=260406237,-28%,,
1239,BỘ TRANG ĐIỂM - CHỐNG NẮNG CHYAKI,1230000,https://tiki.vn/bo-trang-diem-chong-nang-chyaki-p91985192.html?spid=91985193,-15%,3.0,3690000.0
1240,"Dao Cạo Lông Mày Tặng Kèm Lưỡi Dao, Tỉa Chân Mày Gấp Gọn An Toàn",54000,https://tiki.vn/dao-cao-long-may-tang-kem-luoi-dao-tia-chan-may-gap-gon-an-toan-p216218363.html?spid=216218365,,,
1241,Phấn Nước Absolute Newyork Cushion Foundation Sand ACF03.5 (8g),585000,https://tiki.vn/phan-nuoc-absolute-newyork-cushion-foundation-sand-acf03-5-8g-p7101693.html?spid=7181083,,,
1242,"Dao cạo chân mày, cạo lông mặt",12000,https://tiki.vn/dao-cao-chan-may-cao-long-mat-p193758837.html?spid=193758855,,,
1243,Son môi Dâu Tây Phấn Nụ Hoàng Cung,146700,https://tiki.vn/son-moi-dau-tay-phan-nu-hoang-cung-p5816433.html?spid=5816435,,25.0,3667500.0
1244,Phấn Nước Căng Mướt Da Ohui Ultimate Cover Lifting Cushion Tone 1,1050000,https://tiki.vn/phan-nuoc-cang-muot-da-ohui-ultimate-cover-lifting-cushion-tone-1-p273553982.html?spid=273553983,,,
1245,SON DƯỠNG SU:M37 TIME ENERGY MOIST LIP BALM,455000,https://tiki.vn/son-duong-sum-time-energy-moist-lip-balm-p188837378.html?spid=188837379,,,
