,title,price,link_item,discount,sales,revenue
400,Son kem Nars Airmatte Lip Color,590000,https://tiki.vn/son-kem-nars-airmatte-lip-color-p240035708.html?spid=248196955,,3.0,1770000.0
401,Son dưỡng ẩm Su:m37 Time Energy Moist Lip Balm,487500,https://tiki.vn/son-duong-am-su-m37-time-energy-moist-lip-balm-p181919745.html?spid=181919747,,,
402,"HỘP CỌ DU LỊCH VACOSI, MY DARLING 6 CÂY - BC23",178600,https://tiki.vn/hop-co-du-lich-vacosi-my-darling-6-cay-bc23-p123202616.html?spid=123202619,,16.0,2857600.0
403,"TOTAL BEAUTY MAKE UP KEM NỀN CHE KHUYẾT ĐIỂM + HÌNH XĂM, KIỀM DẦU DƯỠNG ẨM DA (SIÊU MỊN) 30ml LANGCE DÀNH CHO NAM",276450,https://tiki.vn/total-beauty-make-up-kem-nen-che-khuyet-diem-hinh-xam-kiem-dau-duong-am-da-sieu-min-30ml-langce-danh-cho-nam-p125729527.html?spid=125729528,,9.0,2488050.0
404,Phấn Mắt Absolute NewYork Pure Metal Veil AMV04 - Candied Rose (5g),138000,https://tiki.vn/phan-mat-absolute-newyork-pure-metal-veil-amv04-candied-rose-5g-p7101779.html?spid=7181129,,12.0,1656000.0
405,Son xăm lì siêu mịn không trôi Mira Aroma Tattoo Liptint Hàn Quốc 6g No.2 Sweet Tomato tặng kèm móc khoá,139000,https://tiki.vn/son-xam-li-sieu-min-khong-troi-mira-aroma-tattoo-liptint-han-quoc-6g-no-2-sweet-tomato-tang-kem-moc-khoa-p20891827.html?spid=20891828,,9.0,1251000.0
406,Bút kẻ mắt PINKFLASH lâu trôi 0.1g,69000,https://tiki.vn/but-ke-mat-pinkflash-lau-troi-0-1g-p271628426.html?spid=271628430,,,
407,"Son dưỡng môi DHC Lip Cream giúp dưỡng ẩm, giảm thâm môi (1.5g)",199000,https://tiki.vn/son-duong-moi-dhc-lip-cream-giup-duong-am-giam-tham-moi-1-5g-p110802589.html?spid=190085891,,1.0,199000.0
408,"Gương trang điểm mini YEELIGHT 4 trong 1 (sạc dự phòng 5000mAh, gương HD 3x, đèn chỉnh sáng, sưởi ấm tay)",355000,https://tiki.vn/guong-trang-diem-mini-yeelight-4-trong-1-sac-du-phong-5000mah-guong-hd-3x-den-chinh-sang-suoi-am-tay-p196912452.html?spid=196912453,-45%,22.0,7810000.0
409,Bộ cọ trang điểm makeup cá nhân combo bộ 5 món kèm hộp gương,53999,https://tiki.vn/bo-co-trang-diem-makeup-ca-nhan-combo-bo-5-mon-kem-hop-guong-p214813548.html?spid=270071360,-32%,2.0,107998.0
410,Bút chì kẻ mắt đầu mảnh chống thấm nước lâu trôi nhiều màu Inglot,399000,https://tiki.vn/but-chi-ke-mat-dau-manh-chong-tham-nuoc-lau-troi-nhieu-mau-inglot-p225242879.html?spid=225242883,-26%,1.0,399000.0
411,Kem Nền Kiềm Dầu Che Phủ Lỗ Chân Lông the SAEM Saemmul Perfect Pore BB 01 Light Beige 30g,182000,https://tiki.vn/kem-nen-kiem-dau-che-phu-lo-chan-long-the-saem-saemmul-perfect-pore-bb-01-light-beige-30g-p163027326.html?spid=163027327,-5%,13.0,2366000.0
412,Lip Môi Dầu Dừa Siêu Tinh Khiết Neop Dưỡng Môi Mềm Mịn (8ml),19000,https://tiki.vn/lip-moi-dau-dua-sieu-tinh-khiet-neop-duong-moi-mem-min-8ml-p720370.html?spid=721643,-50%,1100.0,20900000.0
413,Kẻ bọng mắt Bbia Last Powder Pencil (3 màu),120000,https://tiki.vn/ke-bong-mat-bbia-last-powder-pencil-3-mau-p198239934.html?spid=198239936,-28%,10.0,1200000.0
414,Son dưỡng ẩm Pharmacity Lip Balm,60000,https://tiki.vn/son-duong-am-pharmacity-lip-balm-p160561966.html?spid=160561968,-32%,9.0,540000.0
415,￼Hộp Đựng Bông Tẩy Trang Thông Minh Thiết Kế Nhỏ Gọn Tinh Tế,150000,https://tiki.vn/-hop-dung-bong-tay-trang-thong-minh-thiet-ke-nho-gon-tinh-te-p206322799.html?spid=199569927,-10%,13.0,1950000.0
416,Son Quyễn Rũ BELIPS Sexy Lipstick,224000,https://tiki.vn/son-quyen-ru-belips-sexy-lipstick-p24312036.html?spid=24312044,,1100.0,246400000.0
417,Nhíp Ebelin - hàng nội địa Đức,139000,https://tiki.vn/nhip-ebelin-hang-noi-dia-duc-p243060714.html?spid=243060715,,1.0,139000.0
418,Bộ 5 cọ trang điểm,29000,https://tiki.vn/bo-5-co-trang-diem-p204065467.html?spid=204065468,,2.0,58000.0
419,"Phấn Phủ Chống Nắng Che Khuyết Điểm , Siêu Mịn Và Lâu Trôi Kissme Powder High Cover 4.8G (Combo 4.8g Và Set 24ml)",233000,https://tiki.vn/phan-phu-chong-nang-che-khuyet-diem-kissme-heroine-make-long-stay-powder-high-cover-hop-4-8g-p191752869.html?spid=191752871,,,
420,Bộ cọ TRANG ĐIỂM mini 5 MÓN kèm gương,44998,https://tiki.vn/bo-co-trang-diem-mini-5-mon-kem-guong-p214494383.html?spid=225967257,,,
421,Gương Cầm Tay,160000,https://tiki.vn/guong-cam-tay-p216225710.html?spid=216225711,,1.0,160000.0
422,Son kem lì FOCALLURE true matte liquid 2.5g,52000,https://tiki.vn/son-kem-li-focallure-true-matte-liquid-2-5g-p271537697.html?spid=271537699,,2.0,104000.0
423,[HB Gift] Kem lót hiệu chỉnh sắc da kiểm soát dầu Essance Veil Fit Green Base SPF20 PA++ 30ml,139000,https://tiki.vn/hb-gift-kem-lot-hieu-chinh-sac-da-kiem-soat-dau-essance-veil-fit-green-base-spf20-pa-30ml-p266743500.html?spid=266743503,,,
424,Kẻ Mắt Absolute Newyork Perfect Wear Eye Liner Siren ABPW16 (5g),138000,https://tiki.vn/ke-mat-absolute-newyork-perfect-wear-eye-liner-siren-abpw16-5g-p7101643.html?spid=7181053,,1.0,138000.0
425,Hộp 36 cụm lông mi giả tự nhiên mềm nhẹ 5D Ovo Lash - Mỹ,380000,https://tiki.vn/hop-36-cum-long-mi-gia-tu-nhien-mem-nhe-5d-ovo-lash-my-p272001470.html?spid=272001480,,,
426,Son Thỏi Lì Absolute Newyork Matte Lipstick NFA51 - Cadmium Red (5g),158000,https://tiki.vn/son-thoi-li-absolute-newyork-matte-lipstick-nfa51-cadmium-red-5g-p7101913.html?spid=7181313,,5.0,790000.0
427,Bông Mút Đánh Kem Nền Thông Minh- Mút trang điểm IMAGIC- Hàng Chính Hãng(Màu ngẫu nhiên),45000,https://tiki.vn/bong-mut-danh-kem-nen-thong-minh-mut-trang-diem-imagic-hang-chinh-hang-mau-ngau-nhien-p72221816.html?spid=72221817,,61.0,2745000.0
428,Phấn Má Cezanne Cheek Stick (5g),315000,https://tiki.vn/phan-ma-cezanne-cheek-stick-5g-p11682401.html?spid=11682407,,10.0,3150000.0
429,"Combo 4 dao cạo lông mày siêu bén , dao tự tỉa chân mày có 2 đầu thay thế TD03-DCCM-4",39000,https://tiki.vn/combo-4-dao-cao-long-may-sieu-ben-dao-tu-tia-chan-may-co-2-dau-thay-the-td03-dccm-4-p171437962.html?spid=171437963,,1.0,39000.0
430,"Tinh Chất Dưỡng Mi Dài Dày Khỏe DHC Eyelash Tonic Mi Dài, Dày, Cong Vút Chỉ Sau 4 Tuần 6.5ml",285000,https://tiki.vn/duong-mi-dai-day-khoe-dhc-eyelash-tonic-mi-dai-day-cong-vut-chi-sau-4-tuan-p170959833.html?spid=170959834,,14.0,3990000.0
431,Lemonade gương lược gấp gọn 2 trong 1 35g,79000,https://tiki.vn/lemonade-guong-luoc-gap-gon-2-trong-1-35g-p272341116.html?spid=272341117,,1.0,79000.0
432,Son Dưỡng Mềm Môi YNM Đầy Đủ Màu 3g,137500,https://tiki.vn/son-duong-mem-moi-ynm-day-du-mau-3g-p273347797.html?spid=273347809,,,
433,Chì Đa Năng Absolute NewYork All PurposePencil APP02 - Medium (3g),138000,https://tiki.vn/chi-da-nang-absolute-newyork-all-purposepencil-app02-medium-3g-p7101811.html?spid=7181155,,11.0,1518000.0
434,Combo 2 Mascara Dầu Dừa Siêu Tinh Khiết Neop Dưỡng Mi (8ml / Chai),38000,https://tiki.vn/combo-2-mascara-dau-dua-sieu-tinh-khiet-neop-duong-mi-8ml-chai-p720384.html?spid=721645,,338.0,12844000.0
435,Kem nền trang điểm WHoo GJH Mi Essential FDN 40ml Renew,931000,https://tiki.vn/kem-nen-trang-diem-whoo-gjh-mi-essential-fdn-40ml-renew-p71196840.html?spid=71196841,,,
436,Miếng rửa mặt trị mụn Scrubby Facial Cleansing Pad,12500,https://tiki.vn/mieng-rua-mat-tri-mun-scrubby-facial-cleansing-pad-p203992274.html?spid=203992279,,4.0,50000.0
437,BÔNG PHẤN VACOSI KHÔ TRÒN TRUNG PRO (BỊCH 1 CÁI) - PK03,34000,https://tiki.vn/bong-phan-vacosi-kho-tron-trung-pro-bich-1-cai-pk03-p49920791.html?spid=50711945,,,
438,Bộ Cọ Trang Điểm Guimisi Set 13 Món Túi Đựng Vải,90000,https://tiki.vn/bo-co-trang-diem-guimisi-set-13-mon-tui-dung-vai-p263516913.html?spid=263516917,,1.0,90000.0
439,Serum dưỡng mi và mày 2in1 Coboté - Mi dày và dài sau 4 tuần sử dụng,89100,https://tiki.vn/serum-duong-mi-va-may-2in1-cobote-mi-day-va-dai-sau-4-tuan-su-dung-p247316581.html?spid=247316583,,3.0,267300.0
440,"Son lì hộp hoa hồng IONI Matt Lipstick (3 tông màu thời trang, không lem, không trôi) Hani Peni",68000,https://tiki.vn/son-li-hoa-hong-ioni-matt-lipstick-p74316318.html?spid=74316320,,45.0,3060000.0
441,"Bộ cọ trang điểm make up 10 chi tiết, dụng cụ trang điểm cá nhân kèm hộp đựng sang trọng",135000,https://tiki.vn/bo-co-trang-diem-make-up-10-chi-tiet-dung-cu-trang-diem-ca-nhan-kem-hop-dung-sang-trong-p141990991.html?spid=141990992,-59%,9.0,1215000.0
442,BBIA Ready To Wear Downy Cheek,134000,https://tiki.vn/bbia-ready-to-wear-downy-cheek-p191123286.html?spid=191123292,-39%,5.0,670000.0
443,Son Thỏi Lì Mịn Chotto Matte Yumeisakura Đỏ Rượu Sẫm Burgundy Red Lipstick YMS17 3.5g,215000,https://tiki.vn/son-thoi-li-min-chotto-matte-yumeisakura-do-ruou-sam-burgundy-red-lipstick-yms17-3-5g-p202862632.html?spid=202862633,-28%,13.0,2795000.0
444,Gương điêu khắc 2 mặt- Gương trang điểm - Gương để bàn - Gương bàn phấn - Gương mini - Gương lược - Gương soi -gấp gọn,31360,https://tiki.vn/guong-dieu-khac-2-mat-guong-trang-diem-guong-de-ban-guong-ban-phan-guong-mini-guong-luoc-guong-soi-gap-gon-p202414384.html?spid=202414403,,1.0,31360.0
445,[MAYBELLINE NEW YORK] Son Kem Mịn Lì Như Nhung Hiệu Ứng Lì Đa Chiều Cushion Matte 6.4ml,180000,https://tiki.vn/maybelline-new-york-son-kem-min-li-nhu-nhung-hieu-ung-li-da-chieu-cushion-matte-6-4ml-p253233412.html?spid=253233422,-20%,11.0,1980000.0
446,Chì kẻ viền môi Mira Auto Lipliner Hàn Quốc No. 204 tặng kèm móc khoá,95000,https://tiki.vn/chi-ke-vien-moi-mira-auto-lipliner-han-quoc-no-204-tang-kem-moc-khoa-p21219592.html?spid=23923080,-5%,10.0,950000.0
447,Gương soi toàn thân cao cấp treo tường JACKIE màu nâu nhạt | Index Living Mall - Phân phối độc quyền tại Việt Nam,639200,https://tiki.vn/guong-soi-toan-than-cao-cap-treo-tuong-jackie-mau-nau-nhat-index-living-mall-phan-phoi-doc-quyen-tai-viet-nam-p199048283.html?spid=199048284,-2%,3.0,1917600.0
448,Combo 2 Son Dưỡng Môi Vaseline Lip 7g,119000,https://tiki.vn/combo-2-son-duong-moi-vaseline-lip-7g-p146935810.html?spid=146935811,-28%,5.0,595000.0
449,Xịt lót Makeup Revolution Conceal & Define Infinite Mattifying Setting Spray 100ml,309000,https://tiki.vn/xit-lot-makeup-revolution-conceal-define-infinite-mattifying-setting-spray-100ml-p247844573.html?spid=247844574,-35%,,
450,Son Thạch Ướp Hoa Vỏ Hồng00,38000,https://tiki.vn/son-thach-uop-hoa-vo-hong00-p138382938.html?spid=179949965,,50.0,1900000.0
451,Combo 6 Miếng Mút Trang Điểm,42750,https://tiki.vn/combo-6-mieng-mut-trang-diem-p44714151.html?spid=74532628,-64%,63.0,2693250.0
452,Son dưỡng môi Vaseline Colour+Care Kissing Red 3g,89000,https://tiki.vn/son-duong-moi-vaseline-kissing-red-color-care-3g-p245771624.html?spid=245771625,-37%,12.0,1068000.0
453,Son lì mềm môi Beauskin Luxury Darling Matte Hàn Quốc 3.5g (#01 Hồng cánh sen) tặng kèm móc khoá,225000,https://tiki.vn/son-li-mem-moi-beauskin-luxury-darling-matte-han-quoc-3-5g-01-hong-canh-sen-tang-kem-moc-khoa-p19510361.html?spid=20146473,,49.0,11025000.0
454,Bộ 5 cọ tỉa nhỏ,15000,https://tiki.vn/bo-5-co-tia-nho-p142720684.html?spid=142720687,-8%,7.0,105000.0
455,Mascara Định Hình và Tạo Màu Chân Mày Etude House Color My Brows 9g,129000,https://tiki.vn/mascara-dinh-hinh-va-tao-mau-chan-may-etude-house-color-my-brows-9g-tang-kem-1-bang-do-tai-meo-mau-ngau-nhien-p100201024.html?spid=100201026,,15.0,1935000.0
456,"Son Kem Lì myKella Thuần Chay, Mịn Mượt, Dưỡng Môi Chống Thâm - KISSABLE MATTE LIP CREAM 5ml",293020,https://tiki.vn/son-li-kissable-matte-lip-cream-5ml-p253182301.html?spid=253182309,,2.0,586040.0
457,Son thỏi lì Nars PowerMatte Lipstick,650000,https://tiki.vn/son-thoi-li-nars-powermatte-lipstick-p240066969.html?spid=246163435,,1.0,650000.0
458,Bộ Phấn nước tinh chất vàng OHUI The First G Ampoule Cover Cushion 15g * 3 lõi,1971000,https://tiki.vn/bo-phan-nuoc-tinh-chat-vang-ohui-the-first-g-ampoule-cover-cushion-15g-3-loi-p128481173.html?spid=128481174,,,
459,Son thỏi Bbia Last Powder Lipstick Classy Edition (2 màu) 3.5g,145000,https://tiki.vn/son-thoi-bbia-last-powder-lipstick-classy-edition-2-mau-3-5g-p219147175.html?spid=219147179,,2.0,290000.0
460,Bộ Cọ Trang Điểm BH Travel Series 7 Piece Face & Eye Brush Set With Bag,320000,https://tiki.vn/bo-co-trang-diem-bh-travel-series-7-piece-face-eye-brush-set-with-bag-p271376437.html?spid=271376440,,,
461,Kẹp Bấm Mi Watson Eyelash Curler,36000,https://tiki.vn/kep-bam-mi-watson-eyelash-curler-p271254373.html?spid=271254374,,,
462,Bộ Phấn nước ngừa lão hóa The history of Whoo Mi Luxury Golden Cushion Glow set #21,1218000,https://tiki.vn/bo-phan-nuoc-ngua-lao-hoa-wh-mi-luxury-golden-cushion-glow-set-21-p248935153.html?spid=248935154,,1.0,1218000.0
463,Bút kẻ lông mày Nhật Bản dễ dàng tiện lợi với đầu kẻ mảnh 727 EyeBrow Pencil,236000,https://tiki.vn/but-ke-long-may-nhat-ban-de-dang-tien-loi-voi-dau-ke-manh-727-eyebrow-pencil-p8082745.html?spid=8082746,,12.0,2832000.0
464,"Son dưỡng môi HERA mềm mịn, cấp ẩm cho môi 3.5g Gomi Mall",295000,https://tiki.vn/son-duong-hera-sensual-spicy-nude-balm-3-5g-p271617644.html?spid=271617648,,,
465,Son Xăm Môi BERRISOM MY LIP TINT PACK màu brick rose,189000,https://tiki.vn/son-xam-moi-berrisom-my-lip-tint-pack-mau-brick-rose-p111152308.html?spid=111152309,,7.0,1323000.0
466,Lõi Phấn Nước Trang Điểm Mềm Mướt & Dưỡng Trắng Da it's Well plus Snail Calendula 333 Gold CC Cushion SPF50+/PA+++ Essence (15g),91000,https://tiki.vn/loi-phan-nuoc-trang-diem-mem-muot-duong-trang-da-it-s-well-plus-snail-calendula-333-gold-cc-cushion-spf50-pa-essence-15g-p12109544.html?spid=72974870,,36.0,3276000.0
467,Chì Kẻ Môi Mik@Vonk Professional Lipliner Pencil,60000,https://tiki.vn/chi-ke-moi-mik-vonk-professional-lipliner-pencil-p1191665.html?spid=1192627,,63.0,3780000.0
468,Combo 3 Son Dưỡng Môi Hồng Xinh Vaseline Lip Therapy Rosy Lip (7g),155000,https://tiki.vn/combo-3-son-duong-moi-hong-xinh-vaseline-lip-therapy-rosy-lip-7g-p146935818.html?spid=146935819,,29.0,4495000.0
469,"SET 6 Mút Trang Điểm, Tán Kem Trang Điểm Nhiều Màu Sắc",16900,https://tiki.vn/set-6-mut-trang-diem-tan-kem-trang-diem-nhieu-mau-sac-p204616015.html?spid=204616019,,,
470,PHẤN NƯỚC WHOO TRẮNG GIÚP DA BÓNG MỊN TRẮNG SÁNG VÀ CHE KHUYẾT ĐIỂM TỐT TONE 21,1050000,https://tiki.vn/phan-nuoc-whoo-trang-giup-da-bong-min-trang-sang-va-che-khuyet-diem-tot-tone-21-p260931540.html?spid=260931541,,1.0,1050000.0
471,Phấn nước Su:m37 Losec Summa Elixir Golden Cushion tone 1 (hộp chính + lõi),990000,https://tiki.vn/phan-nuoc-su-m37-losec-summa-elixir-golden-cushion-tone-1-hop-chinh-loi-p270117165.html?spid=270117166,,1.0,990000.0
472,Son kem mịn lì thuần chay Lemonade Perfect Couple 5 Years 3.5g,239000,https://tiki.vn/son-kem-min-li-2-dau-lemonade-perfect-couple-lip-5-years-3-5g-p272195645.html?spid=272195649,,6.0,1434000.0
473,Phấn bột kiềm dầu Laura Mercier Translucent,699000,https://tiki.vn/phan-bot-kiem-dau-laura-mercier-translucent-p61885741.html?spid=61885742,,12.0,8388000.0
474,Son Tint Bóng Lebelage Deep Kiss Fixing Lip Tint 1.4g,109000,https://tiki.vn/son-tint-bong-lebelage-deep-kiss-fixing-lip-tint-1-4g-p273410553.html?spid=273410555,-45%,,
475,Son Thỏi Lì Mịn Chotto Matte Yumeisakura Hồng Đất Love Me Tonys Pink Lipstick YMS15 3.5g,207000,https://tiki.vn/son-thoi-li-min-chotto-matte-yumeisakura-cam-hong-dao-love-me-tonys-pink-lipstick-yms15-3-5g-p202862634.html?spid=202862635,-31%,12.0,2484000.0
476,Son Thỏi -Stay-On Balm Rouge,315000,https://tiki.vn/son-thoi-canmake-stay-on-balm-rouge-p25494793.html?spid=83180656,-21%,7.0,2205000.0
477,Chì Kẻ Mày 2 Đầu Lemonade Want It Got It Dual Eyebrow 4g,199000,https://tiki.vn/chi-ke-may-2-dau-lemonade-want-it-got-it-dual-eyebrow-4g-p46769663.html?spid=272135515,-20%,636.0,126564000.0
478,Phấn Nước Che Khuyết Điểm Nâng Tone Kiềm Dầu Chống Nắng Dưỡng Da Dewytree Urban Shade Cover & Fit Sun Cushion SPF50+ PA++++(14g),410000,https://tiki.vn/phan-nuoc-che-khuyet-diem-nang-tone-kiem-dau-chong-nang-duong-da-dewytree-urban-shade-cover-fit-sun-cushion-spf50-pa-14g-p197378660.html?spid=197378661,-46%,92.0,37720000.0
479,Bộ Cọ Trang Điểm Chuyên Nghiệp 26 Cây Cán Gỗ Lông Ngựa Pha Lông Nhân Tạo Bao Da Khóa,490000,https://tiki.vn/bo-co-cay-can-go-long-ngua-26-mon-p36085668.html?spid=36085669,,14.0,6860000.0
480,Son Thỏi Màu Hồng San Hô Lì Mịn Siêu Dưỡng Yumeisakura Chotto Matte YMS19 3.5g,239000,https://tiki.vn/son-thoi-mau-hong-san-ho-li-min-sieu-duong-yumeisakura-chotto-matte-sweetie-coral-pink-yms19-3-5g-p257786994.html?spid=257786995,-5%,1.0,239000.0
481,Phấn Nụ Dưỡng Da Trang Điểm Bà Tùng (20g),150000,https://tiki.vn/phan-nu-duong-da-trang-die-m-ba-tu-ng-20g-p51285954.html?spid=51285955,-31%,29.0,4350000.0
482,Gương Để Bàn Trang Điểm Kiểu Dáng Tròn Hiện Đại,479000,https://tiki.vn/guong-de-ban-trang-diem-kieu-dang-tron-hien-dai-p85082350.html?spid=113394283,-14%,12.0,5748000.0
483,Kem Nền Thiên Nhiên Dạng Lỏng Hây Hây An Toàn Cho Da Nâng Tone Nhẹ Nhàng Kháng Nước Cỏ Mềm 30g,210000,https://tiki.vn/kem-nen-thien-nhien-dang-long-hay-hay-an-toan-cho-da-nang-tone-nhe-nhang-khang-nuoc-co-mem-30g-p100158363.html?spid=100158368,-28%,66.0,13860000.0
484,Bộ Cọ Trang Điểm Hello Kitty,42000,https://tiki.vn/bo-co-trang-diem-hello-kitty-p51046592.html?spid=67445500,-2%,19.0,798000.0
485,naturaglacé MOIST BB CREAM / KEM NỀN HỮU CƠ BB DƯỠNG DA ĐA NĂNG,882000,https://tiki.vn/naturaglace-moist-bb-cream-kem-nen-bb-duong-da-da-nang-p25773331.html?spid=25773339,,30.0,26460000.0
486,Bbia Last Velvet Tint - V Edition - Version 8 (5 màu) 5g Bbia Official Store,157000,https://tiki.vn/bbia-last-velvet-tint-v-edition-version-8-5-mau-5g-bbia-official-store-p251266026.html?spid=251266028,-26%,16.0,2512000.0
487,Phấn Trang Điểm Trắng Da Thorakao Two Way Cake 13g,195000,https://tiki.vn/phan-trang-diem-trang-da-thorakao-two-way-cake-13g-p20370542.html?spid=48516137,,53.0,10335000.0
488,Bông Giọt Nước VACOSI PRS PRO CLASSIC BLENDER - Dòng Chuyên nghiệp,60800,https://tiki.vn/bong-blender-giot-nuoc-vacosi-prs-pro-classic-blender-dong-chuyen-nghiep-p146368539.html?spid=146368540,,12.0,729600.0
489,Kem AZCLEAR action lotion AZELAIC ACID 20% Úc 25gr,278000,https://tiki.vn/kem-azclear-action-lotion-azelaic-acid-20-uc-25gr-p213970442.html?spid=213970444,,9.0,2502000.0
490,Kem nền nhung lì bền màu Whoo Gongjinhyang Mi Velvet Liquid Foundation 40ml,938000,https://tiki.vn/kem-nen-nhung-li-ben-mau-whoo-gongjinhyang-mi-velvet-liquid-foundation-40ml-p90685062.html?spid=90685070,,2.0,1876000.0
491,Son lì siêu mướt mịn môi Organic LNC Hàn Quốc màu đỏ hồng không chì 3.5g (LNC RED PINK LIPSTICK),320000,https://tiki.vn/son-li-lnc-han-quoc-mau-do-hong-khong-chi-lnc-red-pink-lipstick-01-red-pink-p173727103.html?spid=173727104,,4.0,1280000.0
492,KEM CHỐNG NẮNG VÀ LÓT TRANG ĐIỂM BB VACOSI BASE SPF50 PA+++,323950,https://tiki.vn/kem-chong-nang-va-lot-trang-diem-bb-vacosi-base-spf50-pa-p123202371.html?spid=123202386,,10.0,3239500.0
493,Kem nền Nars Sheer Glow Foundation,1099000,https://tiki.vn/kem-nen-nars-sheer-glow-foundation-p44006988.html?spid=44006992,,3.0,3297000.0
494,SON VITAMIN TINT VACCI DƯỠNG MÔI LÂU PHAI,348000,https://tiki.vn/son-tint-vitamin-vacci-duong-moi-lau-phai-p48260692.html?spid=48260696,,90.0,31320000.0
495,Son cao cấp Kilian Le Rouge Parfum Lipstick Matte,1150000,https://tiki.vn/son-cao-cap-kilian-le-rouge-parfum-lipstick-matte-p43866944.html?spid=43866946,,8.0,9200000.0
496,Bút Kẻ Mắt Nét Siêu Mảnh Không Trôi Suri Waterproof Eyeliner Pen,72000,https://tiki.vn/but-ke-mat-net-sieu-manh-khong-troi-suri-waterproof-eyeliner-pen-p1192875.html?spid=1193857,,926.0,66672000.0
497,Bộ Cọ Trang Điểm Bh Cosmetics Pretty In Pink 10 Piece,349000,https://tiki.vn/bo-co-trang-diem-bh-cosmetics-pretty-in-pink-10-piece-p271418761.html?spid=271418762,,,
498,"Son Dưỡng Môi, Làm Hồng và Mềm Mại Môi Cho Mẹ Bầu Wonmom ( Màu Đỏ, Cam, Hồng )",129000,https://tiki.vn/son-duong-moi-lam-hong-va-mem-mai-moi-cho-me-bau-wonmom-mau-do-cam-hong-p101627610.html?spid=101627616,,38.0,4902000.0
499,Mascara FOCALLURE dài và cong mi 4.5g,60000,https://tiki.vn/mascara-focallure-dai-va-cong-mi-4-5g-p271539241.html?spid=271539242,,,
500,Son Thỏi Lì Mịn Chotto Matte Yumeisakura Đỏ Cam Candy Apple Lipstick YMS07 3.5g,215000,https://tiki.vn/son-thoi-li-min-chotto-matte-yumeisakura-do-cam-candy-apple-lipstick-yms07-3-5g-p202862628.html?spid=202862630,,20.0,4300000.0
501,Son môi Hồ Ngọc Hà MOI Tropical Edition (Giới Hạn) 2022,323100,https://tiki.vn/son-moi-ho-ngoc-ha-moi-tropical-edition-gioi-han-2022-p197537875.html?spid=197537877,,4.0,1292400.0
502,"Phấn Nước myKella Che Phủ Khuyết Điểm, Dưỡng Da Mềm Mịn - PERFECTION CUSHION 15g",489020,https://tiki.vn/phan-nuoc-trang-diem-perfection-cushion-15g-p253182312.html?spid=253182320,,,
503,Kem lót Cle De Peau Beaute Spf 38,1050000,https://tiki.vn/kem-lot-cle-de-peau-beaute-spf-38-p240747096.html?spid=240747100,,,
504,[Bộ trang điểm] Bộ đôi bút kẻ mắt nước siêu sắc mảnh + Mascara Dưỡng Mi Collagen Dày gấp 10 lần Colossal Maybelline New York,350000,https://tiki.vn/bo-trang-diem-bo-doi-but-ke-mat-nuoc-sieu-sac-manh-mascara-duong-mi-collagen-day-gap-10-lan-colossal-maybelline-new-york-p78021380.html?spid=132815479,,18.0,6300000.0
505,Son tint bóng lì Hapy Glow Lip Tint 3.5ml kháng nước lâu trôi không khô môi căng bóng,159000,https://tiki.vn/son-tint-bong-li-hapy-glow-lip-tint-3-5ml-khang-nuoc-lau-troi-khong-kho-moi-cang-bong-p217292418.html?spid=217292420,,2.0,318000.0
506,Mặt Nạ Ngủ Trẻ Hóa Môi GILAA Vegan B5 Super Lip Sleeping Mask 10ml,300000,https://tiki.vn/mat-na-ngu-tre-hoa-moi-gilaa-vegan-b5-super-lip-sleeping-mask-10ml-p203812389.html?spid=203812390,,3.0,900000.0
507,Phấn Highlight Dior Forever Couture Luminizer,1280000,https://tiki.vn/phan-highlight-dior-forever-couture-luminizer-p273078538.html?spid=273078542,-52%,,
508,Dường Mi- Kích mọc lông mi dài- FKN,179000,https://tiki.vn/duong-mi-kich-moc-long-mi-dai-fkn-p206781404.html?spid=206781405,-9%,1.0,179000.0
509,Kem che khuyết điểm Aroma Cover Foundation Hàn Quốc 14g No.21 Light Beige tặng kèm móc khoá,99000,https://tiki.vn/kem-che-khuyet-diem-aroma-cover-foundation-han-quoc-14g-no-21-light-beige-tang-kem-moc-khoa-p20805523.html?spid=20805526,-33%,13.0,1287000.0
510,Phấn nền hữu cơ trang điểm chống nắng - naturaglacé CLEAR POWDER FOUNDATION,1282000,https://tiki.vn/phan-nen-trang-diem-chong-nang-naturaglace-clear-powder-foundation-p25978441.html?spid=25978453,-31%,6.0,7692000.0
511,SON LÌ # 201 ROSE,590000,https://tiki.vn/son-li-201-rose-do-man-huyen-bi-p90524252.html?spid=90524253,-2%,1.0,590000.0
512,"Kem Nền BB Collagen Nagano 20ml - BB Cream 20ml - Chứa chất chống nắng với chỉ số SPF35 bảo vệ da, Collagen giúp dưỡng ẩm và nuôi dưỡng da",475000,https://tiki.vn/kem-nen-bb-collagen-nagano-20ml-bb-cream-20ml-chua-chat-chong-nang-voi-chi-so-spf35-bao-ve-da-collagen-giup-duong-am-va-nuoi-duong-da-p173831987.html?spid=173831988,-25%,2.0,950000.0
513,Gương Trang Điểm Để Bàn Có Đèn LED Tắt/Bật Cảm Ứng,48000,https://tiki.vn/guong-trang-diem-de-ban-co-den-led-tat-bat-cam-ung-p196029741.html?spid=272646402,-5%,,
514,Phấn Phủ Cezanne UV Clear Face Powder (10g),360000,https://tiki.vn/phan-phu-cezanne-uv-clear-face-powder-10g-p11683311.html?spid=11683315,-20%,8.0,2880000.0
515,"Mi giả tự nối dạng chùm Nesura độ dài 8-10mm dành cho makeup cá nhân, chuyên nghiệp - Hity Beauty",56000,https://tiki.vn/mi-gia-tu-noi-dang-chum-nesura-do-dai-8-10mm-danh-cho-makeup-ca-nhan-chuyen-nghiep-hity-beauty-p271454073.html?spid=271454079,-27%,,
516,Lông mi giả nối dạng chùm mềm mượt siêu nhẹ không nặng mắt dành cho makeup chuyên nghiệp - Hity Beauty,57000,https://tiki.vn/long-mi-gia-noi-dang-chum-mem-muot-sieu-nhe-khong-nang-mat-danh-cho-makeup-chuyen-nghiep-hity-beauty-p271454367.html?spid=271454371,-16%,,
517,"Kính lúp chuyên dụng làm nail, cắt móng tay có đèn K8028 (Tặng móc khoa tô vít 3in1)",227000,https://tiki.vn/kinh-lup-chuyen-dung-lam-nail-cat-mong-tay-co-den-k8028-tang-moc-khoa-to-vit-3in1-p102820624.html?spid=102820625,,,
518,"Bộ trang điểm phong cách Hàn Quốc, siêu tiện lợi It's Well Plus",381000,https://tiki.vn/bo-trang-diem-phong-cach-han-quoc-sieu-tien-loi-it-s-well-plus-p82646645.html?spid=82646651,,3.0,1143000.0
519,Son Dưỡng Môi Không Phai Black Pearl Phiên Bản Mới 2023,289000,https://tiki.vn/son-duong-moi-khong-phai-black-pearl-phien-ban-moi-2023-p272852370.html?spid=272852371,,3.0,867000.0
520,Son kem nhung lì Whoo GJH Mi Velvet Liquid Lip Rouge 6g,695000,https://tiki.vn/son-kem-nhung-li-whoo-gjh-mi-velvet-liquid-lip-rouge-6g-p128509575.html?spid=128509579,,5.0,3475000.0
521,Combo 192 miếng kích mí lụa vân lưới siêu tự nhiên,65000,https://tiki.vn/combo-192-mieng-kich-mi-lua-van-luoi-sieu-tu-nhien-p264441770.html?spid=264441772,,,
522,Combo 3 Bông Phấn Đánh Kem Nền Thông Minh 6*4 CM (Màu ngẫu nhiên),60000,https://tiki.vn/combo-3-bong-phan-danh-kem-nen-thong-minh-6-4-cm-mau-ngau-nhien-p28314950.html?spid=54414314,,24.0,1440000.0
523,"Kem Lót myKella Trang Điểm Kiềm Dầu, Mịn Da 30ml",293020,https://tiki.vn/kem-lot-poreless-smooth-skin-primer-30ml-p255427325.html?spid=255427326,,,
