title,price,link_item,index,discount,sales,brand
"Hộp 10 Túi Lọc Thảo Mộc Tắm Cho Bé Wonmom 120Gr Ngừa Ham Ngứa, Mát Da, Tăng Cường Sức Đề Kháng Da Trẻ - Chăm Sóc Làn Da Trẻ Nhỏ",80.000₫,https://tiki.vn/hop-10-tui-loc-thao-moc-tam-cho-be-wonmom-120gr-ngua-ham-ngua-mat-da-tang-cuong-suc-de-khang-da-tre-cham-soc-lan-da-tre-nho-p51296017.html?spid=71083601,1,,,wonmom
Bộ gừng nghệ ở cữ và 5 túi xông Wonmom,565.000₫,https://tiki.vn/bo-gung-nghe-o-cu-va-5-tui-xong-wonmom-p8490467.html?spid=139956734,2,-16%,Đã bán 2,wonmom
"Combo 2 Muối Thảo Mộc Ngâm Chân Giảm Đau Nhức, Phù Nề Wonmom",116.000₫,https://tiki.vn/combo-2-muoi-thao-moc-ngam-chan-giam-dau-nhuc-phu-ne-wonmom-p108918403.html?spid=108918560,3,-21%,Đã bán 79,wonmom
Gel gừng toàn thân Wonmom,289.000,https://tiki.vn/gel-gung-toan-than-wonmom-p2791813.html?spid=71081886,4,,,wonmom
,,https://tiki.vn/cot-gung-ha-tho-tan-mo-bung-giu-am-toan-than-cho-me-sau-sinh-wonmom-chai-200ml-p116414068.html?spid=139716259,5,-21%,,wonmom
Dầu tràm Wonmom cho bé,69.000₫,https://tiki.vn/dau-tram-wonmom-cho-be-p116930880.html?spid=139956832,6,,Đã bán 3,wonmom
Dầu chống rạn 70g,85.000₫,https://tiki.vn/dau-chong-ran-70g-p51273326.html?spid=92512733,7,,,wonmom
Hộp 10 Túi Thảo Mộc Xông Vùng Kín Cho Mẹ Sau Sinh Wonmom,128.000₫,https://tiki.vn/hop-10-tui-thao-moc-xong-vung-kin-cho-me-sau-sinh-wonmom-p116409457.html?spid=157832651,8,,Đã bán 1,wonmom
Combo kem sữa nghệ toàn thân và thảo mộc vệ sinh cho mẹ Wonmom,420.000,https://tiki.vn/combo-kem-sua-nghe-toan-than-va-thao-moc-ve-sinh-cho-me-wonmom-p221251880.html?spid=260671787,9,,,wonmom
,,https://tiki.vn/sua-tam-thao-moc-mem-mai-sang-hong-da-cho-me-bau-wonmom-250ml-p221251788.html?spid=260629349,10,,,wonmom
"Kem Sữa Nghệ Dưỡng Trắng Hồng Tự Nhiên, Mịn Màng Da Toàn Thân Wonmom 180g",220.000₫,https://tiki.vn/kem-sua-nghe-duong-trang-hong-tu-nhien-min-mang-da-toan-than-wonmom-180g-p221251752.html?spid=260640659,11,,Đã bán 1,wonmom
"Bộ trắng da, sạch nám cao cấp Wonmom ( Sữa rửa mặt+ Scrub nghệ+ Kem nghệ tươi+ Serum vitamin C+ Mặt nạ nghệ+ Xông mặt )",1.199.000,https://tiki.vn/bo-trang-da-sach-nam-cao-cap-wonmom-sua-rua-mat-scrub-nghe-kem-nghe-tuoi-serum-vitamin-c-mat-na-nghe-xong-mat-p221251707.html?spid=221251708,12,,Đã bán 1,wonmom
,,https://tiki.vn/bo-tam-goi-thom-tho-cua-minh-wonmom-1-dau-goi-cot-bo-ket-1-dung-dich-ve-sinh-p221251801.html?spid=257842838,13,,,wonmom
"Mặt Nạ Nghệ Hữu Cơ Se Khít Chân Lông, Mờ Thâm, Liền Sẹo, Sáng Da Wonmom 50g",225.000₫,https://tiki.vn/mat-na-nghe-huu-co-se-khit-chan-long-mo-tham-lien-seo-sang-da-wonmom-50g-p221251773.html?spid=260640643,14,,,wonmom
Bộ dưỡng trắng hồng da toàn thân Wonmom (1 kem sữa nghệ + 1 scrub cafe tẩy tế bào chết toàn thân),395.000₫,https://tiki.vn/bo-duong-trang-hong-da-toan-than-wonmom-1-kem-sua-nghe-1-scrub-cafe-tay-te-bao-chet-toan-than-p221251827.html?spid=260673469,15,,,wonmom
"Bộ xông hơi thải độc, tái tạo và làm sạch da chuyên sâu Wonmom",399.000₫,https://tiki.vn/bo-xong-hoi-thai-doc-tai-tao-va-lam-sach-da-chuyen-sau-wonmom-p221251645.html?spid=260673147,16,,,wonmom
"Dầu Gội Cốt Bồ Kết Sạch Gàu, Nuôi Dưỡng Tóc Đen Mượt Wonmom 250ml",132.000,https://tiki.vn/dau-goi-cot-bo-ket-sach-gau-nuoi-duong-toc-den-muot-wonmom-250ml-p221251843.html?spid=257842755,17,,,wonmom
,,https://tiki.vn/kem-cap-am-duong-trang-da-va-ngan-ngua-mun-wonmom-50g-p221251717.html?spid=260640554,18,,,wonmom
Bộ tắm gội toàn diện từ thảo mộc Wonmom ( 1 Dầu gội cốt bồ kết + 1 Sữa tắm cho mẹ + 1 Scrub café tẩy body ),420.000₫,https://tiki.vn/bo-tam-goi-toan-dien-tu-thao-moc-wonmom-1-dau-goi-cot-bo-ket-1-sua-tam-cho-me-1-scrub-cafe-tay-body-p221251640.html?spid=260673546,19,,,wonmom
"Cốt Bồ Kết Đánh Bay Gàu, Kích Thích Mọc Tóc Wonmom 250ml",125.000₫,https://tiki.vn/cot-bo-ket-danh-bay-gau-kich-thich-moc-toc-wonmom-250ml-p221251840.html?spid=260451936,20,,,wonmom
"Bộ xông hơi thải độc, tái tạo da cơ bản Wonmom ( 1 Hộp xông mặt + 1 Scrub nghệ tẩy mặt )",245.000₫,https://tiki.vn/bo-xong-hoi-thai-doc-tai-tao-da-co-ban-wonmom-1-hop-xong-mat-1-scrub-nghe-tay-mat-p221251701.html?spid=260640673,21,,,wonmom
Combo 2 hộp thảo mộc xông tắm sau sinh Wonmom 150Gr ( Loại mới: 6 Túi/Hộp ),320.000₫,https://tiki.vn/combo-2-hop-thao-moc-xong-tam-sau-sinh-wonmom-150gr-loai-moi-6-tui-hop-p221251861.html?spid=221251863,22,,Đã bán 2,wonmom
Bộ chăm sóc sắc đẹp toàn diện Wonmom (kem nghệ tươi+ kem sữa nghệ+ sữa tắm+ dầu gội + DDVSPN ),935.000₫,https://tiki.vn/bo-cham-soc-sac-dep-toan-dien-wonmom-kem-nghe-tuoi-kem-sua-nghe-sua-tam-dau-goi-ddvspn-p221251721.html?spid=221251723,23,,,wonmom
Dầu tràm Wonmom tặng kèm vòng Phong Thủy Cho Em Bé,90.000₫,https://tiki.vn/dau-tram-wonmom-tang-kem-vong-phong-thuy-cho-em-be-p57449697.html?spid=71159461,24,,Đã bán 1,wonmom
Bộ dưỡng trắng hồng da mặt và body sau sinh Wonmom ( Kem nghệ tươi + cốt nghệ + kem sữa nghệ ),788.000,https://tiki.vn/bo-duong-trang-hong-da-mat-va-body-sau-sinh-wonmom-kem-nghe-tuoi-cot-nghe-kem-sua-nghe-p191320813.html?spid=191320814,25,,,wonmom
,,https://tiki.vn/thao-moc-xong-tam-sau-sinh-wonmom-p197856324.html?spid=197856326,26,,,wonmom
"Túi Xông Mặt Thảo Dược Hỗ Trợ Điều Trị Mụn, Trị Thâm, Liền Sẹo, Sáng Da Wonmom 100gr (10 Túi)",130.000₫,https://tiki.vn/tui-xong-mat-thao-duoc-tri-mun-tri-tham-lien-seo-sang-da-wonmom-100gr-10-tui-p72089739.html?spid=73190235,27,,Đã bán 2,wonmom
Dầu Tràm Wonmom Nguyên Chất Chăm Sóc Da Bé Và Cả Gia Đình Chai 15ml,71.000₫,https://tiki.vn/dau-tram-wonmom-nguyen-chat-cham-soc-da-be-va-ca-gia-dinh-chai-15ml-p115288413.html?spid=139947479,28,,,wonmom
"Bộ Phòng Hỗ Trợ Trị Thâm Rạn, Dưỡng Trắng Toàn Thân Wonmom",480.000₫,https://tiki.vn/bo-phong-tri-tham-ran-duong-trang-toan-than-wonmom-p8490465.html?spid=139956834,29,,,wonmom
"Cốt Nghệ Hạ Thổ Trắng Da Mặt, Da Bụng Và Toàn Thân Cho Mẹ Sau Sinh Wonmom Chai 200ml",165.000,https://tiki.vn/cot-nghe-ha-tho-trang-da-mat-da-bung-va-toan-than-cho-me-sau-sinh-wonmom-chai-200ml-p116413962.html?spid=139711001,30,,Đã bán 2,wonmom
,,https://tiki.vn/serum-tri-mun-mo-tham-cho-me-bau-va-sau-sinh-wonmom-chai-20ml-p116407894.html?spid=139990039,31,,,wonmom
Bộ dưỡng trắng da mặt chuyên sâu Wonmom ( 1 sữa rửa mặt + 1 serum vitamin C + 1 kem nghệ tươi ),560.000₫,https://tiki.vn/bo-duong-trang-da-mat-chuyen-sau-wonmom-1-sua-rua-mat-1-serum-vitamin-c-1-kem-nghe-tuoi-p221251639.html?spid=260795048,32,,,wonmom
"Bộ chăm sóc tình mẫu tử giúp mẹ thơm, bé khỏe Wonmom ( 1 hộp thảo mộc xông cửa mình cho mẹ + 1 dầu tràm )",190.000₫,https://tiki.vn/bo-cham-soc-tinh-mau-tu-giup-me-thom-be-khoe-wonmom-1-hop-thao-moc-xong-vung-kin-cho-me-1-dau-tram-p221251704.html?spid=260640578,33,,,wonmom
Bộ đánh tan mỡ bụng lâu năm Wonmom ( 1 Gel gừng giảm eo + 1 Gen nịt bụng ),355.000₫,https://tiki.vn/bo-danh-tan-mo-bung-lau-nam-wonmom-1-gel-gung-giam-eo-1-gen-nit-bung-p221251742.html?spid=260669116,34,,,wonmom
Bộ trắng da mặt và body toàn diện Wonmom ( Serum vitamin C + Kem nghệ tươi + Kem sữa nghệ toàn thân + Scrub café body ),990.000,https://tiki.vn/bo-trang-da-mat-va-body-toan-dien-wonmom-serum-vitamin-c-kem-nghe-tuoi-kem-sua-nghe-toan-than-scrub-cafe-body-p221251797.html?spid=221251798,35,,,wonmom
,,https://tiki.vn/bo-duong-day-mun-an-duong-trang-hong-da-mat-wonmom-1-kem-nghe-tuoi-1-hop-xong-mat-thao-duoc-p221251663.html?spid=260667990,36,,,wonmom
Bộ tắm và tẩy tế bào chết toàn thân Wonmom ( 1 Scrub café tẩy toàn thân + 1 Sữa tắm cho mẹ ),290.000₫,https://tiki.vn/bo-tam-va-tay-te-bao-chet-toan-than-wonmom-1-scrub-cafe-tay-toan-than-1-sua-tam-cho-me-p221251829.html?spid=260667974,37,,,wonmom
"Acne serum đánh bay mụn, sạch thâm sẹo, dưỡng trắng da Wonmom 20ml",240.000₫,https://tiki.vn/acne-serum-danh-bay-mun-sach-tham-seo-duong-trang-da-wonmom-20ml-p221251765.html?spid=260640662,38,,,wonmom
"Bộ trắng da, sạch mụn cao cấp Wonmom ( Sữa rửa mặt + Scrub nghệ + Kem cấp ẩm + Serum mụn + Mặt nạ nghệ + Xông mặt )",1.199.000₫,https://tiki.vn/bo-trang-da-sach-mun-cao-cap-wonmom-sua-rua-mat-scrub-nghe-kem-cap-am-serum-mun-mat-na-nghe-xong-mat-p221251874.html?spid=221251875,39,,,wonmom
"Đai quấn muối có dây kéo, dùng đựng muối quấn bụng Wonmom ( 200g )",82.000₫,https://tiki.vn/dai-quan-muoi-co-day-keo-dung-dung-muoi-quan-bung-wonmom-200g-p221251734.html?spid=221251735,40,,Đã bán 1,wonmom
