title,price,link_item,index,discount,sales,category
Set Body Kẻ Ngang Áo Croptop Phối Chân Váy Dài,595.000₫,https://tiki.vn/set-body-ke-ngang-ao-croptop-phoi-chan-vay-dai-p262728774.html?spid=262728778,1,-5%,,botrangphuc
Baciami-Bộ Áo Dài Ren Tay Phồng,1.690.000₫,https://tiki.vn/baciami-bo-ao-dai-ren-tay-phong-p92714493.html?spid=92714521,2,-5%,,botrangphuc
"Fullset golf nữ DKGOLF D-SN23047-D-KN23070 - Set thể thao xanh trắng hòa nhã, chất liệu vải thun thoáng mát, thấm hút mồ hôi cực tốt",1.520.000₫,https://tiki.vn/fullset-golf-nu-dkgolf-d-sn23047-d-kn23070-set-the-thao-xanh-trang-hoa-nha-chat-lieu-vai-thun-thoang-mat-tham-hut-mo-hoi-cuc-tot-p262991249.html?spid=262991259,3,-4%,,botrangphuc
Set bộ váy sọc lửng HA80,245.000,https://tiki.vn/set-bo-vay-soc-lung-ha80-p255179487.html?spid=255179489,4,,,botrangphuc
,,https://tiki.vn/ao-dai-may-san-mau-xanh-mint-anh-that-kem-quan-p176054750.html?spid=176054786,5,,,botrangphuc
SÉT ÁO DÀI CÁCH TÂN HOẠ TIẾT LÁ,375.000₫,https://tiki.vn/set-ao-dai-cach-tan-hoa-tiet-la-p153501005.html?spid=153501019,6,,,botrangphuc
"Áo Dài Cưới Mẹ Cấp Đính Đá Pha Lê, Ren Lưới, Hoa Thêu Tay Thủ Công 4 Tà M03 Đỏ Đô",950.000₫,https://tiki.vn/ao-dai-cuoi-me-cap-dinh-da-pha-le-ren-luoi-hoa-theu-tay-thu-cong-4-ta-m03-do-do-p185996371.html?spid=185996413,7,,,botrangphuc
Áo dài cách tân nữ tết 4 tà tơ ánh màu đỏ và hồng,119.000₫,https://tiki.vn/ao-dai-cach-tan-nu-tet-4-ta-to-anh-mau-do-va-hong-p176052116.html?spid=176052496,8,,Đã bán 5,botrangphuc
Áo dài may sẵn in 3D (ảnh thật kèm video),106.000,https://tiki.vn/ao-dai-may-san-in-3d-anh-that-kem-video-p176052268.html?spid=176052387,9,,,botrangphuc
,,https://tiki.vn/suon-xam-lua-thuong-uyen-hoa-mau-don-cao-cap-sang-trong-noi-bat-s01xanh-ao-dai-xuan-quynh-p213815900.html?spid=213815963,10,,,botrangphuc
"Set bộ đi chơi linen áo cộc kèm quần dáng lửng ArcticHunter, thời trang phong cách trẻ",350.000₫,https://tiki.vn/set-bo-di-choi-linen-ao-coc-kem-quan-dang-lung-arctichunter-thoi-trang-phong-cach-tre-p163793682.html?spid=163793684,11,,Đã bán 12,botrangphuc
SET VEST NỮ SANG TRỌNG HIỆN ĐIỆN,390.000,https://tiki.vn/set-vest-nu-sang-trong-hien-dien-p63803817.html?spid=63803829,12,,,botrangphuc
,,https://tiki.vn/jumpsuit-co-yem-phoi-trang-co-mut-nguc-hau-nguyen-store-p91257080.html?spid=103339579,13,,,botrangphuc
Đồ lam đi chùa Bộ Thư Pháp Phật Tử Cài Chéo Tay Nỡ vải Kate mịn nhập ngoại không nhăn - Anle Store,185.000₫,https://tiki.vn/do-lam-di-chua-bo-thu-phap-phat-tu-cai-cheo-tay-no-vai-kate-min-nhap-ngoai-khong-nhan-anle-store-p67480735.html?spid=67480749,14,,Đã bán 4,botrangphuc
Áo dài cách tân kèm quần,399.000₫,https://tiki.vn/ao-dai-cach-tan-kem-quan-p164356875.html?spid=164356918,15,,,botrangphuc
Áo dài kèm quần,456.000₫,https://tiki.vn/ao-dai-kem-quan-p164356923.html?spid=164356933,16,,,botrangphuc
Jumpsuit 2 dây phong cách (4 màu thời trang),137.000,https://tiki.vn/jumpsuit-2-day-phong-cach-4-mau-thoi-trang-p67319839.html?spid=67319845,17,,Đã bán 1,botrangphuc
,,https://tiki.vn/set-ao-vay-bien-xanh-la-wabisabi-n3004-p189201342.html?spid=189201348,18,,,botrangphuc
Bộ Đi Lễ Chùa - Đồ Lam Nữ Đi Chùa Đẹp Cao Cấp Trang Nhã Vải Lụa Tay Xòe 2021 Dành Cho Phật Tử Mới - AL003,228.000₫,https://tiki.vn/bo-di-le-chua-do-lam-nu-di-chua-dep-cao-cap-trang-nha-vai-lua-tay-xoe-2021-danh-cho-phat-tu-moi-al003-p118035848.html?spid=118035925,19,,Đã bán 4,botrangphuc
Đồ Lam Đi Chùa # Nam # Lãnh Tụ Thêu Túi Áo,235.000₫,https://tiki.vn/do-lam-di-chua-nam-lanh-tu-theu-tui-ao-p118026019.html?spid=118030067,20,,Đã bán 4,botrangphuc
Set đồ Wabisabi N2711,790.000₫,https://tiki.vn/set-do-wabisabi-n2711-p193578360.html?spid=193578377,21,,,botrangphuc
ÁO DÀI CÁCH TÂN BIGSIZE 2022 (BIGSIZE_GIARE),280.000₫,https://tiki.vn/ao-dai-cach-tan-bigsize-2022-bigsize_giare-p155886812.html?spid=155886861,22,,,botrangphuc
Áo Dài Mẹ đính pha lê,249.000₫,https://tiki.vn/ao-dai-me-dinh-pha-le-p132783400.html?spid=132783406,23,,,botrangphuc
Áo Dài Truyền Thống Áo Dài Cách Tân May Sẵn Đính Hoa Mai Hoa Đào Nhẹ Nhàng Cho Nữ Tone Dáng Nâng Da,100.000₫,https://tiki.vn/ao-dai-truyen-thong-ao-dai-cach-tan-may-san-dinh-hoa-mai-hoa-dao-nhe-nhang-cho-nu-tone-dang-nang-da-p190582159.html?spid=190582183,24,,,botrangphuc
Bộ Ống Rộng Nữ Cực Xinh,169.000,https://tiki.vn/bo-ong-rong-nu-cuc-xinh-p206289431.html?spid=206289433,25,,,botrangphuc
,,https://tiki.vn/ao-dai-cach-tan-gam-theu-hoa-khong-kem-chan-vay-qa00100-p110688928.html?spid=110689008,26,,,botrangphuc
Áo dài xưa dáng suông - màu Cam đất,110.000₫,https://tiki.vn/ao-dai-xua-dang-suong-mau-cam-dat-p219459112.html?spid=219459529,27,,,botrangphuc
"SET BỘ ĐI CHƠI, SET 2 MÓN ÁO BABYDOLL REN HOA 2S PHỐI QUẦN ĐÙI CỰC SANG - Brown",180.000₫,https://tiki.vn/set-bo-di-choi-set-2-mon-ao-babydoll-ren-hoa-2s-phoi-quan-dui-cuc-sang-p270059421.html?spid=270059426,28,,,botrangphuc
"SET BỘ ĐI CHƠI, SET 2 MÓN ÁO ỐNG CROPTOP 2 DÂY PHỐI QUẦN SUÔNG ỐNG RỘNG CỰC NĂNG ĐỘNG - xanh da trời",219.000₫,https://tiki.vn/set-bo-di-choi-set-2-mon-ao-ong-croptop-2-day-phoi-quan-suong-ong-rong-cuc-nang-dong-p259564286.html?spid=259564288,29,,,botrangphuc
Sét váy yếm và áo siêu xinh dễ mặc,229.000,https://tiki.vn/set-vay-yem-va-ao-sieu-xinh-de-mac-p118139911.html?spid=118139979,30,,,botrangphuc
,,https://tiki.vn/vai-may-ao-dai-may-dam-p201701688.html?spid=201701707,31,,,botrangphuc
"Áo dài Tết Hạnh, thiết kế cao cấp, xuất khẩu Âu - Mỹ, áo dài cách tân sát nách kèm váy phong cách hiện đại",1.500.000₫,https://tiki.vn/ao-dai-tet-hanh-thiet-ke-cao-cap-xuat-khau-au-my-ao-dai-cach-tan-sat-nach-kem-vay-phong-cach-hien-dai-p210439163.html?spid=210439165,32,,,botrangphuc
"Bộ đũi cộc sát nách mặc nhà cho nữ, hàng đẹp chất liệu thoáng mát",189.000₫,https://tiki.vn/bo-dui-coc-sat-nach-mac-nha-cho-nu-hang-dep-chat-lieu-thoang-mat-p153553913.html?spid=153554383,33,,,botrangphuc
#đồ lam đi chùa #mẫu bé gái,102.000₫,https://tiki.vn/do-lam-di-chua-mau-be-gai-p134373926.html?spid=134375092,34,,Đã bán 10,botrangphuc
Đồ phật tử .áo lam Đi chùa. la hán phối,183.000,https://tiki.vn/do-phat-tu-ao-lam-di-chua-la-han-phoi-p134375024.html?spid=134377062,35,,,botrangphuc
,,https://tiki.vn/bo-long-mac-nha-nu-ao-hoodies-tui-truoc-sieu-am-set-bo-do-nu-long-cuu-hinh-gau-dang-yeu-sang-chanh-p196002690.html?spid=196002698,36,,,botrangphuc
Đồ Lam Nữ Đi Chùa - Bộ Đi Lễ Chùa Thêu Cá Ngọc Vải Lụa Cao Cấp AL018 Trang Nhã Kín Đáo Dành Cho Phật Tử,275.000₫,https://tiki.vn/do-lam-nu-di-chua-bo-di-le-chua-theu-ca-ngoc-vai-lua-cao-cap-al018-trang-nha-kin-dao-danh-cho-phat-tu-p118035829.html?spid=118035956,37,,Đã bán 3,botrangphuc
Set Bộ Dạo Phố Kiểu Set Áo Tay Con Cột Eo Phối Quần Ống Rộng GOTI 3131,249.000₫,https://tiki.vn/set-bo-dao-pho-kieu-set-ao-tay-con-cot-eo-phoi-quan-ong-rong-goti-3131-p51333527.html?spid=51333532,38,,,botrangphuc
Áo dài nữ hồng vàng họa tiết hoa hồng,400.000₫,https://tiki.vn/ao-dai-nu-hong-vang-hoa-tiet-hoa-hong-p74676031.html?spid=74676035,39,,Đã bán 1,botrangphuc
BỘ THỜI TRANG CÔNG SỞ NỮ PHỐI MÀU,432.000,https://tiki.vn/bo-thoi-trang-cong-so-nu-phoi-mau-p56084645.html?spid=56084671,40,,,botrangphuc
