title,price,link_item,index,discount,sales,category
GIÁ XƯỞNG - Áo dài cách tân gấm,69.000₫,https://tiki.vn/gia-xuong-ao-dai-cach-tan-gam-p108290749.html?spid=108291704,1,-11%,,botrangphuc
GIÁ XƯỞNG - Áo dài cách tân gấm in 3D,50.000₫,https://tiki.vn/gia-xuong-ao-dai-cach-tan-gam-in-3d-p108290739.html?spid=108292505,2,,,botrangphuc
ÁO CHO NGƯỜI GIÀ (tuyet),219.000₫,https://tiki.vn/ao-cho-nguoi-gia-tuyet-p67207881.html?spid=71069722,3,-5%,Đã bán 3,botrangphuc
[Có sẵn + Vải Form đẹp] Set Jumpsuits Áo liền quần túi hộp dài tay có tách ống rời phối dây dù cực chất cho Nam Nữ,1.155.000,https://tiki.vn/co-san-vai-form-dep-set-jumpsuits-ao-lien-quan-tui-hop-dai-tay-co-tach-ong-roi-phoi-day-du-cuc-chat-cho-nam-nu-p165773919.html?spid=165773929,4,,,botrangphuc
,,https://tiki.vn/set-quan-ao-phat-tu-di-chua-do-lam-phap-phuc-nu-mau-linen-ngoc-phoi-gam-cao-cap-xuong-may-lien-cuc-p164938375.html?spid=164938722,5,-25%,,botrangphuc
Jumpsuit nữ cổ yếm quần ống rộng phối màu trắng chất liệu umi mẫu có mút ngực 1 màu như hình ( đen ),128.000₫,https://tiki.vn/jumpsuit-nu-co-yem-quan-ong-rong-phoi-mau-trang-chat-lieu-umi-mau-co-mut-nguc-1-mau-nhu-hinh-den-p187845468.html?spid=187845493,6,,,botrangphuc
Áo dài xanh hoa nhí trắng - 191108,975.000₫,https://tiki.vn/ao-dai-xanh-hoa-nhi-trang-191108-p212328028.html?spid=212328109,7,,,botrangphuc
"Áo dài Cách tân Nắng mới Hồng phối tay ren, Áo dài thiết kế 4 tà Voan tơ cao cấp",735.000₫,https://tiki.vn/ao-dai-cach-tan-nang-moi-hong-phoi-tay-ren-ao-dai-thiet-ke-4-ta-voan-to-cao-cap-p132959278.html?spid=132959282,8,,,botrangphuc
Set Áo Sơ Mi Cổ Vest Mix Chân Váy Dáng Dài,255.000,https://tiki.vn/set-ao-so-mi-co-vest-mix-chan-vay-dang-dai-p159011957.html?spid=159011962,9,,,botrangphuc
,,https://tiki.vn/jumpsuit-ong-rong-thiet-ke-mac-duoc-2-kieu-p171086490.html?spid=171086500,10,,,botrangphuc
Sét áo trắng trơn + quần Kaki đen TT12,214.000₫,https://tiki.vn/set-ao-trang-tron-quan-kaki-den-tt12-p160399648.html?spid=160399663,11,,,botrangphuc
Ạ HỘI ÁO DÀI TRUNG NIÊN CAO CẤP XANH ĐEN LUXURY SAPPHIRE DRESS,890.000,https://tiki.vn/da-hoi-ao-dai-tiec-cuoi-cao-cap-p194787942.html?spid=194787952,12,,,botrangphuc
,,https://tiki.vn/ao-dai-gam-kem-quan-p164357835.html?spid=164357836,13,,,botrangphuc
Áo dài cách tân nam gấm thái tuấn cao cấp,741.000₫,https://tiki.vn/ao-dai-cach-tan-nam-gam-thai-tuan-cao-cap-p164356822.html?spid=164356849,14,,Đã bán 2,botrangphuc
Đồ Lam Đi Chùa # La Hán Phối # Quần Áo Nữ # Đồ Bộ Nữ,196.000₫,https://tiki.vn/do-lam-di-chua-la-han-phoi-quan-ao-nu-p111914505.html?spid=107046803,15,,Đã bán 6,botrangphuc
jumpsuit tay lưới thời trang sang trọng,157.000₫,https://tiki.vn/jumpsuit-tay-luoi-thoi-trang-sang-trong-p95474015.html?spid=95474033,16,,Đã bán 17,botrangphuc
Sét đồ bộ nữ quần da beo phối áo màu năng động,99.000₫,https://tiki.vn/set-do-bo-nu-quan-da-beo-phoi-ao-mau-nang-dong-p66580038.html?spid=66580056,17,,,botrangphuc
,,https://tiki.vn/set-do-nu-mix-chan-vay-tui-hop-sn126-p272336740.html?spid=272336742,18,,,botrangphuc
áo dài in cô gái phối ren cao cấp - KHÔNG KÈM VÁY,357.500₫,https://tiki.vn/ao-dai-in-co-gai-phoi-ren-cao-cap-khong-kem-vay-p142264757.html?spid=142264783,19,,Đã bán 19,botrangphuc
Áo dài truyền thống in hoa vàng cao cấp - KHÔNG KÈM QUẦN,412.500₫,https://tiki.vn/ao-dai-truyen-thong-in-hoa-vang-cao-cap-khong-kem-quan-p142211052.html?spid=142211094,20,,Đã bán 2,botrangphuc
sét bộ đồ nữ áo tay phồng xếp ly eo phối quần đùi thời trang thiết kế phù họp mọi phong cách,160.000₫,https://tiki.vn/set-bo-do-nu-ao-tay-phong-xep-ly-eo-phoi-quan-dui-thoi-trang-thiet-ke-phu-hop-moi-phong-cach-p171856689.html?spid=171856706,21,,,botrangphuc
GIÁ XƯỞNG - Áo dài cách tân lụa in 3D con công,450.000₫,https://tiki.vn/gia-xuong-ao-dai-cach-tan-lua-in-3d-con-cong-p108287760.html?spid=108288714,22,,Đã bán 1,botrangphuc
giá xưởng - Áo dài truyền thống lụa nhật,250.000₫,https://tiki.vn/gia-xuong-ao-dai-truyen-thong-lua-nhat-p108288239.html?spid=108288392,23,,,botrangphuc
LM14 Bộ áo dài siêu lụa xẻ vai đính hạt cao cấp,850.000₫,https://tiki.vn/lm14-bo-ao-dai-sieu-lua-xe-vai-dinh-hat-cao-cap-p208741385.html?spid=208741391,24,,,botrangphuc
Set bộ Đầm suông Linen bột Premium 2 cổ tim kèm quần ống rộng (Đầm Xanh lá - Quần trắng),280.000,https://tiki.vn/set-bo-dam-suong-linen-bot-premium-2-co-tim-kem-quan-ong-rong-lahstore-dam-xanh-la-quan-trang-p200729605.html?spid=200729619,25,,,botrangphuc
,,https://tiki.vn/ao-dai-hoa-nhi-xanh-com-4-ta-201206-p212328023.html?spid=212328116,26,,,botrangphuc
Áo dài hoa nhí màu cà phê nền voan tơ 201211,1.050.000₫,https://tiki.vn/ao-dai-hoa-nhi-mau-ca-phe-nen-voan-to-201211-p212328048.html?spid=212328105,27,,,botrangphuc
"Set bộ đi chơi Linen thô Hàn Premium Áo cổ tròn tay bom kèm quần sóc xắn gấu trẻ trung, chất vải Linen thô mềm mát thích hợp mùa hè",410.000₫,https://tiki.vn/set-bo-di-choi-linen-tho-han-premium-ao-co-tron-tay-bom-kem-quan-soc-xan-gau-tre-trung-chat-vai-linen-tho-mem-mat-thich-hop-mua-he-p262784807.html?spid=262784809,28,,,botrangphuc
Bộ Đi Lễ Chùa - Đồ Lam Nữ Đi Chùa Đẹp Cao Cấp Trang Nhã Vải Lụa Hoa Nổi 2021 Dành Cho Phật Tử AL002 - HỒNG,260.000₫,https://tiki.vn/bo-di-le-chua-do-lam-nu-di-chua-dep-cao-cap-trang-nha-vai-lua-hoa-noi-2021-danh-cho-phat-tu-al002-p269899867.html?spid=269899889,29,,Đã bán 15,botrangphuc
Sét bộ maxi mocking áo tay phồng mặc 2 kiểu và chân váy xoè dài,178.000,https://tiki.vn/set-bo-maxi-mocking-ao-tay-phong-mac-2-kieu-va-chan-vay-xoe-dai-p253355457.html?spid=253355466,30,,,botrangphuc
,,https://tiki.vn/jumpsuit-linen-day-xuat-xin-klngst0n-2163-p105924756.html?spid=105924763,31,,,botrangphuc
Cosplay Jumpsuit người phục vụ hộp đêm nam,85.000₫,https://tiki.vn/cosplay-jumpsuit-nguoi-phuc-vu-hop-dem-nam-p217264561.html?spid=217264563,32,,Đã bán 1,botrangphuc
Pháp phục Áo hậu - áo hải thanh vải hải thanh,539.000₫,https://tiki.vn/phap-phuc-ao-hau-ao-hai-thanh-vai-hai-thanh-p107035848.html?spid=107037026,33,,Đã bán 4,botrangphuc
Đồ Lam Đi Chùa # Sẫm 2Nút Hoa Thêu Phối Vải Đũi,300.000₫,https://tiki.vn/do-lam-di-chua-sam-2nut-hoa-theu-phoi-vai-dui-p118019464.html?spid=118027371,34,,Đã bán 5,botrangphuc
Set áo babydoll xanh tầng cổ viền bèo phối quần short trắng lưng thun,165.000,https://tiki.vn/set-ao-babydoll-xanh-tang-co-vien-beo-phoi-quan-short-trang-lung-thun-p178251258.html?spid=178251272,35,,,botrangphuc
,,https://tiki.vn/do-lam-di-chua-mau-la-han-do-bo-nam-nu-quan-ao-nam-nu-p118022777.html?spid=118024380,36,,,botrangphuc
Đồ Lam Đi Chùa # Thun Bà Lai Lắc Sao # Quần Áo Nữ # Đồ Bộ Nữ,186.000₫,https://tiki.vn/do-lam-di-chua-thun-ba-lai-lac-sao-quan-ao-nu-do-bo-nu-p118031217.html?spid=118031577,37,,Đã bán 11,botrangphuc
Sale Sườn Xám Cách Tân ( hàng có sẵn ),342.000₫,https://tiki.vn/sale-suon-xam-cach-tan-hang-co-san-p98641267.html?spid=98641280,38,,Đã bán 2,botrangphuc
"SET DỆT KIM QUẢNG CHÂU LOẠI 1, Áo len mỏng + chân váy xếp ly",228.000₫,https://tiki.vn/set-det-kim-quang-chau-loai-1-ao-len-mong-chan-vay-xep-ly-p142565246.html?spid=142565247,39,,,botrangphuc
ÁO DÀI TRUYỀN THỐNG IN CÚC ASTRA CAO CẤP - KHÔNG KÈM QUẦN,375.000,https://tiki.vn/ao-dai-truyen-thong-in-cuc-astra-cao-cap-khong-kem-quan-p138569432.html?spid=138569448,40,,,botrangphuc
