title,price,link_item,index,discount,sales,brand
Bếp nướng điện vân đá Nagakawa NAG3103(1500W) - Hàng chính hãng,1.170.000₫,https://tiki.vn/bep-nuong-dien-van-da-nagakawa-nag3103-1500w-hang-chinh-hang-p125638244.html?spid=201182392,1,-20%,,Nagakawa
Nồi áp suất Nagakawa NAG1471 - Hàng chính hãng,519.000₫,https://tiki.vn/noi-ap-suat-nagakawa-nag1471-hang-chinh-hang-p272393386.html?spid=272393387,2,-53%,Đã bán 5,Nagakawa
Miễn phí giao và lắp đặt toàn quốc - Bếp đôi điện từ Nagakawa UltraSlim NK2C29MB - Made in Malaysia - Bảo hành 5 năm - Hàng chính hãng,6.990.000₫,https://tiki.vn/mien-phi-giao-va-lap-dat-toan-quoc-bep-doi-dien-tu-nagakawa-ultraslim-nk2c29mb-made-in-malaysia-bao-hanh-5-nam-p270989794.html?spid=270989995,3,-45%,,Nagakawa
Ấm siêu tốc Nagakawa NAG0315 (Đen/Đỏ/Đồng) dung tích 1.8L hàng chính hãng,350.000,https://tiki.vn/am-sieu-toc-nagakawa-nag0315-den-do-dong-dung-tich-1-8l-p273386418.html?spid=273386857,4,-23%,,Nagakawa
,,https://tiki.vn/bep-doi-dien-tu-cao-cap-nagakawa-ultraslim-nk2c29mb-made-in-malaysia-bao-hanh-5-nam-p273386716.html?spid=273386717,5,,,Nagakawa
Máy sấy tóc Nagakawa NAG1606 (đen) - Hàng chính hãng,339.000₫,https://tiki.vn/may-say-toc-nagakawa-nag1606-den-hang-chinh-hang-p272407172.html?spid=272407173,6,,Đã bán 2,Nagakawa
Nồi cơm điện cao tần Nagakawa NAG0140 (1.2L) - 12 chế độ nấu - Giảm tinh bột,2.669.000₫,https://tiki.vn/noi-com-dien-cao-tan-nagakawa-nag0140-1-2l-12-che-do-nau-giam-tinh-bot-hang-chinh-hang-p136853927.html?spid=136853929,7,-28%,Đã bán 3,Nagakawa
Máy làm mát không khí Nagakawa NFC888 ( 200W - 14L ) Tặng kèm 2 Đá khô và điều khiển từ xa - Bảo hành 12 tháng- Hàng chính hãng,5.790.000₫,https://tiki.vn/may-lam-mat-khong-khi-nagakawa-nfc888-200w-14l-tang-kem-2-da-kho-va-dieu-khien-tu-xa-bao-hanh-12-thang-hang-chinh-hang-p22095624.html?spid=171013256,8,-44%,Đã bán 2,Nagakawa
Bếp đôi điện từ Nagakawa NK2C01M - Hàng chính hãng,7.390.000,https://tiki.vn/bep-doi-dien-tu-nagakawa-nk2c01m-hang-chinh-hang-p151489083.html?spid=151489085,9,-52%,,Nagakawa
,,https://tiki.vn/am-sieu-toc-2-lop-inox-304-nagakawa-nag0320-1-8l-1800w-hang-chinh-hang-p201843855.html?spid=201843856,10,-40%,,Nagakawa
Nồi Cơm Điện Nắp Gài Nagakawa NAG0110 (1.8 Lít),404.000₫,https://tiki.vn/noi-com-dien-nap-gai-nagakawa-nag0110-mau-ngau-nhien-1-8-lit-hang-chinh-hang-p31252886.html?spid=3934725,11,-15%,Đã bán 8,Nagakawa
Bếp 3 Âm 2 Từ - 1 Hồng Ngoại Premium Nagakawa NAG1253M (59 cm) - Hàng Chính Hãng,10.060.000,https://tiki.vn/bep-3-am-2-tu-1-hong-ngoai-premium-nagakawa-nag1253m-59-cm-hang-chinh-hang-p66773855.html?spid=66773857,12,-19%,,Nagakawa
,,https://tiki.vn/mien-phi-giao-lap-toan-quoc-bep-doi-dien-tu-inverter-nagakawa-nag1213m-bao-hanh-5-nam-made-in-malaysia-hang-chinh-hang-p271376487.html?spid=271376504,13,-41%,,Nagakawa
Máy khử khuẩn thực phẩm treo tường Nagakawa NAG3904 - Công nghệ Hydroxyl - Hàng Chính Hãng,2.889.000₫,https://tiki.vn/may-khu-khuan-thuc-pham-treo-tuong-nagakawa-nag3904-cong-nghe-hydroxyl-hang-chinh-hang-p205921973.html?spid=206205274,14,-21%,,Nagakawa
Bếp đôi điện từ Nagakawa NK2C06MS - Made in Malaysia - Hàng chính hãng,11.669.000₫,https://tiki.vn/bep-doi-dien-tu-nagakawa-nk2c06ms-made-in-malaysia-hang-chinh-hang-p146081704.html?spid=156274057,15,-49%,Đã bán 1,Nagakawa
Bếp Âm Đôi Từ Hồng Ngoại Premium Nagakawa NAG1252M - Hàng Chính Hãng,8.700.000₫,https://tiki.vn/bep-am-doi-tu-hong-ngoai-premium-nagakawa-nag1252m-59-cm-hang-chinh-hang-p66773861.html?spid=89820980,16,,,Nagakawa
Bếp Âm Từ Đôi Premium Nagakawa NAG1202M (73 cm) - Hàng Chính Hãng,7.700.000,https://tiki.vn/bep-am-tu-doi-premium-nagakawa-nag1202m-73-cm-hang-chinh-hang-p66773856.html?spid=91341042,17,,,Nagakawa
,,https://tiki.vn/bep-doi-dien-tu-nagakawa-ultraslim-nk2c28m-hang-chinh-hang-p272728571.html?spid=272728572,18,,,Nagakawa
Bếp đôi điện từ Nagakawa UltraSlim NK2C28M- Made in Malaysia - Hàng chính hãng,6.219.000₫,https://tiki.vn/bep-doi-dien-tu-nagakawa-ultraslim-nk2c28m-made-in-malaysia-hang-chinh-hang-p248807313.html?spid=270875885,19,,,Nagakawa
Bếp điện từ 3 vùng nấu thông minh Nagakawa NK3C05MSF - Hàng chính hãng,15.330.000₫,https://tiki.vn/bep-dien-tu-3-vung-nau-thong-minh-nagakawa-nk3c05msf-hang-chinh-hang-p155924131.html?spid=155924132,20,,Đã bán 7,Nagakawa
Máy Hút Mùi Than Hoạt Tính Cỡ Lớn Nagakawa NAG1857-70Cm - Bộ Lọc 5 Lớp Inox - Hàng Chính Hãng,4.290.000₫,https://tiki.vn/may-hut-mui-than-hoat-tinh-co-lon-nagakawa-nag1857-70cm-bo-loc-5-lop-inox-hang-chinh-hang-p87960846.html?spid=129937498,21,,,Nagakawa
Máy Hút Mùi Cao Cấp Nagakawa NKCH09M70 - Hàng Nhập Khẩu Malaysia,5.784.000₫,https://tiki.vn/may-hut-mui-cao-cap-nagakawa-nkch09m70-hang-nhap-khau-malaysia-p199844414.html?spid=199964535,22,,,Nagakawa
Máy hút mùi kính cong Nagakawa NKCH05M70 Tích hợp công nghệ NaSYNC - Tự động đồng bộ điều khiển với bếp điện từ Nagakawa Điều khiển chuyển động Leap Motion và Touch Control siêu nhạy bằng cách vẫy tay - Hàng Chính Hãng,6.081.000₫,https://tiki.vn/may-hut-mui-kinh-cong-nagakawa-nkch05m70-tich-hop-cong-nghe-nasync-tu-dong-dong-bo-dieu-khien-voi-bep-dien-tu-nagakawa-dieu-khien-chuyen-dong-leap-motion-va-touch-control-sieu-nhay-bang-cach-vay-tay-hang-chinh-hang-p205576603.html?spid=205576604,23,,,Nagakawa
"[HỘP QUÀ TẾT] Nồi cơm điện cơ Nagakawa NAG0145 (1,8L - 900W) - Lòng nồi dạng niêu, hợp kim nhôm - Bảo hành 1 năm - Hàng chính hãng",1.299.000₫,https://tiki.vn/noi-com-dien-co-nagakawa-nag0145-1-8l-900w-long-noi-dang-nieu-hop-kim-nhom-bao-hanh-1-nam-hang-chinh-hang-p273385184.html?spid=273385185,24,,,Nagakawa
Máy xay sinh tố Nagakawa NAG0802 (1.5L) - Hàng chính hãng,1.159.000,https://tiki.vn/may-xay-sinh-to-nagakawa-nag0802-1-5l-hang-chinh-hang-p4012219.html?spid=50226722,25,,,Nagakawa
,,https://tiki.vn/may-hut-mui-cao-cap-nagakawa-nkch08m70-hang-nhap-khau-malaysia-p199844366.html?spid=199964564,26,,,Nagakawa
Nồi Cơm Điện Nắp Gài Lòng Niêu Nagakawa NAG0132 (1.8 Lít) - Hàng Chính Hãng,1.000.000₫,https://tiki.vn/noi-com-dien-nap-gai-long-nieu-nagakawa-nag0132-1-8-lit-hang-chinh-hang-p53729308.html?spid=122655644,27,,Đã bán 2,Nagakawa
Bếp điện từ cảm ứng Nagakawa NAG0714 (2000W) - Hàng chính hãng,1.150.000₫,https://tiki.vn/bep-dien-tu-cam-ung-nagakawa-nag0714-2000w-hang-chinh-hang-p183290524.html?spid=183290525,28,,Đã bán 1,Nagakawa
Nồi cơm điện Nagakawa NAG0143 - Dung tích 1.8L - Bảo hành 12 tháng - Hàng chính hãng,790.000₫,https://tiki.vn/noi-com-dien-nagakawa-nag0143-dung-tich-1-8l-bao-hanh-12-thang-p217190530.html?spid=217190534,29,,Đã bán 17,Nagakawa
Máy hút mùi chữ T Nagakawa NKTH02M70 Tích hợp công nghệ NaSYNC - Tự động đồng bộ điều khiển với bếp điện từ Nagakawa Điều khiển chuyển động Leap Motion và Touch Control siêu nhạy bằng cách vẫy tay - Hàng Chính Hãng,6.081.000,https://tiki.vn/may-hut-mui-chu-t-nagakawa-nkth02m70-tich-hop-cong-nghe-nasync-tu-dong-dong-bo-dieu-khien-voi-bep-dien-tu-nagakawa-dieu-khien-chuyen-dong-leap-motion-va-touch-control-sieu-nhay-bang-cach-vay-tay-hang-chinh-hang-p205576436.html?spid=205576437,30,,Đã bán 1,Nagakawa
,,https://tiki.vn/bep-doi-dien-tu-inverter-nagakawa-nag1213m-hang-chinh-hang-p87961829.html?spid=91341046,31,,,Nagakawa
Lõi Lọc Nước Cao Cấp Post Carbon Nagakawa LKG0505FB19 (Lõi số 7) - Hàng Chính Hãng,173.000₫,https://tiki.vn/loi-loc-nuoc-cao-cap-post-carbon-nagakawa-lkg0505fb19-loi-so-7-hang-chinh-hang-p53789691.html?spid=53789692,32,,Đã bán 3,Nagakawa
Bếp điện từ đôi lắp âm Nagakawa NK2C08MS - Hàng chính hãng,8.200.000₫,https://tiki.vn/bep-dien-tu-doi-lap-am-nagakawa-nk2c08ms-hang-chinh-hang-p191216242.html?spid=195824787,33,,,Nagakawa
Miễn phí giao lắp toàn quốc - Bếp đôi điện từ Nagakawa NK2C03M (4400W) - Made in Malaysia - Bảo hành 5 năm - Hàng Chính Hãng,15.000.000₫,https://tiki.vn/mien-phi-giao-lap-toan-quoc-bep-doi-dien-tu-nagakawa-nk2c03m-4400w-made-in-malaysia-bao-hanh-5-nam-hang-chinh-hang-p271411145.html?spid=271411146,34,,,Nagakawa
Máy làm mát NAGAKAWA NFC668 - Hàng chính hãng,3.390.000,https://tiki.vn/may-lam-mat-nagakawa-nfc668-hang-chinh-hang-p12722541.html?spid=12722550,35,,,Nagakawa
,,https://tiki.vn/bep-dien-tu-da-nang-nagakawa-nag0716-hang-chinh-hang-p213998968.html?spid=213998969,36,,,Nagakawa
Nồi lẩu điện nhôm nguyên khối Nagakawa NAG1905 (5 Lít) - Hàng chính hãng,948.000₫,https://tiki.vn/noi-lau-dien-nhom-nguyen-khoi-nagakawa-nag1905-5-lit-hang-chinh-hang-p201843638.html?spid=247463380,37,,,Nagakawa
Bếp đôi điện từ Nagakawa NK2C02M - Hàng chính hãng,7.559.000₫,https://tiki.vn/bep-doi-dien-tu-nagakawa-nk2c02m-hang-chinh-hang-p151489086.html?spid=151489087,38,,Đã bán 2,Nagakawa
Bếp từ đôi Nagakawa NAG1202M - Hàng Chính Hãng - Chỉ Giao Hồ Chí Minh,7.700.000₫,https://tiki.vn/bep-tu-doi-nagakawa-nag1202m-hang-chinh-hang-chi-giao-ho-chi-minh-p195973038.html?spid=205414767,39,,,Nagakawa
Bếp từ Nagakawa NAG1202M - Hàng chính hãng,7.700.000,https://tiki.vn/bep-tu-nagakawa-nag1202m-hang-chinh-hang-p87545038.html?spid=91341040,40,,,Nagakawa
