title,price,link_item,index,discount,sales,category
Quần shorts thể thao nam dạng sọt sport đùi chất thun lạnh 4 chiều cao cấp phù hợp tập gym hay mặc nhà có màu trắng và đen DUI-P101,78.800₫,https://tiki.vn/quan-shorts-the-thao-nam-dang-sot-sport-dui-chat-thun-lanh-4-chieu-cao-cap-phu-hop-tap-gym-hay-mac-nha-co-mau-trang-va-den-dui-p101-p47811534.html?spid=47811540,1,-31%,Đã bán 1.2k,quannam
"Quần đùi nam xuất khẩu mặc nhà, quần đùi nam, quần short, quần sọc nam vải kate cotton 100% thương hiệu Fezzio",69.000₫,https://tiki.vn/quan-short-kate-spandex-fezzio-chinh-hang-fz-05-neo-p109545851.html?spid=130864940,2,-47%,Đã bán 31,quannam
Quần Short Nam Rách️️ Quần Short Bò Nam Cao Cấp - Sọt Jean Co Giãn Mẫu Mới Hàng VNXK Tô Tồ Shop QSJN05 -Mã 218,139.000₫,https://tiki.vn/quan-short-nam-rach-freeship-quan-short-bo-nam-cao-cap-sot-jean-co-gian-mau-moi-hang-vnxk-to-to-shop-qsjn05-ma-218-p98623473.html?spid=109182682,3,,Đã bán 29,quannam
Quần jean rách nam,165.000,https://tiki.vn/quan-jean-rach-nam-p244173990.html?spid=244173996,4,,,quannam
,,https://tiki.vn/quan-dui-nam-cao-cap-chat-cotton-quan-short-nam-phoi-mau-day-dan-thoang-mat-du-mau-big-size-mua-he-qd03-proman-p201115975.html?spid=201116303,5,,,quannam
Quần tây nam việt tiến màu đen có 1ly regular 495,495.000₫,https://tiki.vn/quan-tay-nam-viet-tien-mau-den-co-1ly-regular-495-p119639482.html?spid=119639500,6,-45%,Đã bán 23,quannam
Quần Thể Thao Nam Đen Dáng Ôm SOCLUNG03,125.000₫,https://tiki.vn/quan-the-thao-nam-den-soc-dang-om-soclung03-p45815099.html?spid=45815101,7,-42%,Đã bán 128,quannam
QUẦN THUN NAM DÀI THỂ THAO NĂNG ĐỘNG,189.000₫,https://tiki.vn/quan-thun-nam-dai-the-thao-nang-dong-p81075193.html?spid=81075284,8,-30%,Đã bán 11,quannam
Quần đùi nam từ 70kg-85kg Quần sọt nam vải bố thô caro - QDN19,32.550₫,https://tiki.vn/quan-dui-nam-tu-70kg-85kg-quan-sot-nam-vai-bo-tho-caro-qdn19-p94564171.html?spid=94564753,9,-30%,,quannam
,,https://tiki.vn/quan-jean-nam-nu-ong-rong-2n-unisex-cai-nut-bam-hai-ben-mau-xanh-xam-q04-p270771649.html?spid=270771657,10,-37%,,quannam
"Quần đùi short gió nam thể thao Basic trẻ trung năng động, thoáng mát co giãn tốt đủ màu QD01 PROMAN",118.000₫,https://tiki.vn/qua-n-du-i-short-gio-nam-the-thao-basic-tre-trung-nang-do-ng-thoa-ng-ma-t-co-gia-n-tot-du-mau-qd01-proman-p191006317.html?spid=191006341,11,-44%,Đã bán 4,quannam
Quần kaki nam lửng túi hợp,145.000,https://tiki.vn/quan-kaki-nam-lung-tui-hop-p126679273.html?spid=126679350,12,,,quannam
,,https://tiki.vn/quan-dui-nam-fasvin-q20263-hn-vai-gio-chun-co-gian-mem-mai-thoai-mai-p100368290.html?spid=100368505,13,,,quannam
Quần kaki nam việt tiến 8N6020 regular fit màu khaki,630.000₫,https://tiki.vn/quan-kaki-nam-viet-tien-8n6020-regular-fit-mau-khaki-p94880272.html?spid=94880279,14,,Đã bán 2,quannam
Quần KaKi Kiểu Dáng Jogger Nam Co Giãn 4 Chiều Cao Cấp M05,95.000₫,https://tiki.vn/quan-kaki-kieu-dang-jogger-ran-ri-nam-co-gian-4-chieu-cao-cap-m05-p28634116.html?spid=50328789,15,,Đã bán 25,quannam
"Quần Jean baggy nam , jeans unisex - Quần bò dáng suông rộng -Top xu hướng 2021",49.000₫,https://tiki.vn/quan-jean-baggy-nam-jeans-unisex-quan-bo-dang-suong-rong-top-xu-huong-2021-p125997551.html?spid=205357394,16,,,quannam
Quần Kaki Nam Không Ly VIỆT PHÁP / Hoạ Tiết Chìm Cao Cấp 9008,459.000,https://tiki.vn/quan-kaki-nam-khong-ly-viet-phap-hoa-tiet-chim-cao-cap-9008-p273061444.html?spid=273377298,17,,Đã bán 3,quannam
,,https://tiki.vn/quan-short-jean-nam-ngan-quan-bo-lung-nam-co-gian-sieu-chat-obok-fashion-qsn45-p99191877.html?spid=99191910,18,,,quannam
Quần thun dài jogger nam Phúc An 1011 màu xám,82.800₫,https://tiki.vn/quan-thun-dai-jogger-nam-phuc-an-1011-mau-xam-p6927817.html?spid=6927821,19,,Đã bán 43,quannam
Quần short kaki nam BLOOK chất vải kaki mềm mịn phom lửng ngang gối 30058,469.000₫,https://tiki.vn/quan-short-kaki-nam-blook-chat-vai-kaki-mem-min-phom-lung-ngang-goi-30058-p197708928.html?spid=197708965,20,,,quannam
Quần tây nam Novelty 0Ply 1804530 màu xám nhạt,249.000₫,https://tiki.vn/quan-tay-nam-novelty-0ply-1804530-mau-nau-nhat-p110477285.html?spid=110477293,21,,Đã bán 38,quannam
Quần Tây Đũi Dài Nam Dáng Suông Co Giãn Thoáng Mát Cạp - Khuy - Lưng Thun- Hot Hè 2020,112.000₫,https://tiki.vn/quan-tay-dui-dai-nam-dang-suong-co-gian-thoang-mat-cap-khuy-lung-thun-hot-he-2020-p66644120.html?spid=207252942,22,,Đã bán 7,quannam
Quần kaki dài nam việt tiến màu be không ly 6R6020 Regular,665.000₫,https://tiki.vn/quan-kaki-dai-nam-viet-tien-mau-be-khong-ly-6r6020-regular-p183736730.html?spid=183736746,23,,Đã bán 5,quannam
"QUẦN KAKI NAM - Màu nâu,31-55-58kg",156.000₫,https://tiki.vn/quan-kaki-nam-p154203599.html?spid=154203873,24,,Đã bán 4,quannam
Quần Ống Rộng Baggy Kaki Nhung Tăm Ulzzang Unisex Nam Nữ 5 Màu Siêu Hot Trend,117.000,https://tiki.vn/quan-ong-rong-baggy-kaki-nhung-tam-ulzzang-unisex-nam-nu-5-mau-sieu-hot-trend-p198543222.html?spid=213959931,25,,Đã bán 1,quannam
,,https://tiki.vn/quan-jogger-quan-the-thao-nam-quan-nam-dai-quan-nu-dai-quan-the-thao-nam-nu-deu-mac-duoc-quan-thun-nam-nu-quan-thun-dai-quan-phat-sang-ban-dem-quan-du-nam-nu-p76402265.html?spid=76402267,26,,,quannam
Quần Squat nhập khẩu GYM WEAR -Quần chuyên dụng cho các bài tập Squat,220.000₫,https://tiki.vn/quan-squat-nhap-khau-gym-wear-quan-chuyen-dung-cho-cac-bai-tap-squat-p272299045.html?spid=272299061,27,,,quannam
"Quần tây Amazing, hoạ tiết vân chìm, không ly, ống suông, màu xám trung",245.000₫,https://tiki.vn/quan-tay-amazing-hoa-tiet-van-chim-khong-ly-ong-suong-mau-xam-trung-p205302540.html?spid=205302580,28,,Đã bán 3,quannam
Quần tây học sinh việt tiến cấp 2 - 3 loại tốt,223.000₫,https://tiki.vn/quan-tay-hoc-sinh-viet-tien-cap-2-3-loai-tot-p178102021.html?spid=178102023,29,,Đã bán 17,quannam
Quần Sọt Jean Ông Địa,180.000,https://tiki.vn/quan-sot-jean-ong-dia-p270868880.html?spid=270868902,30,,Đã bán 2,quannam
,,https://tiki.vn/quan-tay-nam-chat-vai-day-dan-co-gian-nhe-quan-au-dang-ong-con-nhieu-mau-nh-shop-p105259468.html?spid=207311139,31,,,quannam
Quần Jean nam Leman xanh trơn JD04 - Slim Form,384.000₫,https://tiki.vn/quan-jean-nam-leman-xanh-tron-jd04-slim-form-p173998078.html?spid=173998090,32,,Đã bán 7,quannam
Quần Short Jean nam Leman xanh trơn JL05 - Slim Form,318.000₫,https://tiki.vn/quan-short-jean-nam-leman-xanh-tron-jl05-slim-form-p174016999.html?spid=174017009,33,,Đã bán 16,quannam
"Quần short nam trắng trơn chất bò co dãn Julido, dáng đứng form đẹp mẫu mới KK04",139.000₫,https://tiki.vn/quan-short-nam-trang-tron-chat-bo-co-dan-julido-dang-dung-form-dep-mau-moi-kk04-p62325784.html?spid=62325792,34,,Đã bán 94,quannam
Viettien - Quần kaki nam màu xám sáng không ly 6R6024 regular,665.000,https://tiki.vn/viettien-quan-kaki-nam-mau-xam-sang-khong-ly-6r6024-regular-p182303911.html?spid=182303923,35,,,quannam
,,https://tiki.vn/quan-jean-nam-trung-nien-vardino-vai-min-lanh-cao-cap-nhap-khau-nguyen-chiec-kieu-cong-so-giat-khong-phai-khong-bai-gian-p197534663.html?spid=197534782,36,,,quannam
Quần Jean nam cao cấp ống đứng le511 màu xanh trung vải xuất khẩu xướt nhẹ dáng slimfit vải co giãn,410.000₫,https://tiki.vn/quan-jean-nam-cao-cap-ong-dung-le511-mau-xanh-trung-vai-xuat-khau-xuot-nhe-dang-slimfit-vai-co-gian-p249723132.html?spid=249723134,37,,,quannam
Quần kaki nam trơn basic cao cấp vải kaki xịn hàng xuất dư Phuongnamshop20 z31,199.000₫,https://tiki.vn/quan-kaki-nam-tron-basic-cao-cap-vai-kaki-xin-hang-xuat-du-phuongnamshop20-z31-p99482495.html?spid=106983055,38,,Đã bán 23,quannam
Original Quần Dài Nam Timberland DWR Windbreaker Jogger TB0A26NSDH,1.945.000₫,https://tiki.vn/original-quan-dai-nam-timberland-dwr-windbreaker-jogger-tb0a26nsdh-p214935154.html?spid=214935162,39,,,quannam
Quần đùi nam thể thao 3 sọc,80.000₫,https://tiki.vn/quan-dui-nam-the-thao-3-soc-p112620810.html?spid=263034899,40,,Đã bán 2,quannam
