title,price,link_item,index,discount,sales,category
Bộ Áo Thun Đôi Nam Nữ A961 - XXL,159.000₫,https://tiki.vn/bo-ao-thun-doi-nam-nu-a961-p15559693.html?spid=15559751,1,,,dodoi
Bộ Áo Thun Đôi Nam Nữ Màu Vàng A11248,159.000₫,https://tiki.vn/bo-ao-thun-doi-nam-nu-mau-vang-a11248-p12465456.html?spid=12465496,2,,,dodoi
Bộ Áo Thun Đôi Nam Nữ Màu Vàng A11297,159.000₫,https://tiki.vn/bo-ao-thun-doi-nam-nu-mau-vang-a11297-p12469174.html?spid=12469216,3,,,dodoi
Bộ Áo Thun Đôi Nam Nữ Màu Vàng A11283,159.000,https://tiki.vn/bo-ao-thun-doi-nam-nu-mau-vang-a11283-p12468134.html?spid=12468148,4,,,dodoi
,,https://tiki.vn/bo-ao-thun-doi-nam-nu-mau-vang-a11275-p12467539.html?spid=12467553,5,,,dodoi
Bộ Áo Thun Đôi Nam Nữ Màu Vàng A11302,159.000₫,https://tiki.vn/bo-ao-thun-doi-nam-nu-mau-vang-a11302-p12469545.html?spid=12469611,6,,,dodoi
Bộ Áo Thun Đôi Nam Nữ Màu Vàng A11272,159.000₫,https://tiki.vn/bo-ao-thun-doi-nam-nu-mau-vang-a11272-p12467307.html?spid=12467311,7,,,dodoi
Bộ Áo Thun Đôi Nam Nữ Màu Vàng A11274,159.000₫,https://tiki.vn/bo-ao-thun-doi-nam-nu-mau-vang-a11274-p12467453.html?spid=12467475,8,,,dodoi
Bộ Áo Thun Đôi Nam Nữ A773,159.000,https://tiki.vn/bo-ao-thun-doi-nam-nu-a773-p15546614.html?spid=15546618,9,,,dodoi
,,https://tiki.vn/ao-thun-nam-nu-meo-ca-tinh-sieu-ngau-form-rong-vai-day-min-2020t2833-p190364977.html?spid=190365738,10,,,dodoi
Áo thun gia đình đẹp in cha dạy con khám phá dễ thương cao cấp,139.150₫,https://tiki.vn/ao-thun-gia-dinh-dep-in-cha-day-con-kham-pha-de-thuong-cao-cap-p190368032.html?spid=190368107,11,,,dodoi
Áo thun nam thời trang dog pubg chất,39.900₫,https://tiki.vn/ao-thun-nam-thoi-trang-dog-pubg-chat-p190367841.html?spid=190368243,12,,,dodoi
,,https://tiki.vn/ao-phong-nam-in-hinh-ma-vach-p190366030.html?spid=190367739,13,,,dodoi
Áo thun nam nữ siêu anh hùng đội trưởng Mỹ form rộng vải dày mịn 2020T2843,53.000₫,https://tiki.vn/ao-thun-nam-nu-sieu-anh-hung-doi-truong-my-form-rong-vai-day-min-2020t2843-p190367946.html?spid=190368640,14,,,dodoi
Áo thun tay lỡ Hàn Quốc form rộng in hình chibi V BTS vải dày mịn TEEWO134,53.000₫,https://tiki.vn/ao-thun-tay-lo-han-quoc-form-rong-in-hinh-chibi-v-bts-vai-day-min-teewo134-p190368362.html?spid=190369075,15,,,dodoi
Áo phông nam nữ thor về già form rộng vải dày mịn 2020T2873,53.000₫,https://tiki.vn/ao-phong-nam-nu-thor-ve-gia-form-rong-vai-day-min-2020t2873-p190370201.html?spid=190370352,16,,,dodoi
Áo phông tay lỡ nam nữ Limited Edition vải dày mịn,59.900₫,https://tiki.vn/ao-phong-tay-lo-nam-nu-limited-edition-vai-day-min-p190369184.html?spid=190370781,17,,,dodoi
,,https://tiki.vn/ao-thun-unisex-logo-ca-tinh-mau-trang-2019t843-p190372351.html?spid=190373597,18,,,dodoi
Áo thun tay lỡ họa tiết phong cảnh form rộng vải dày mịn 2020T2637,53.000₫,https://tiki.vn/ao-thun-tay-lo-hoa-tiet-phong-canh-form-rong-vai-day-min-2020t2637-p190375003.html?spid=190375305,19,,,dodoi
Áo thun unisex cờ mỹ form rộng vải dày mịn 2019T900,53.000₫,https://tiki.vn/ao-thun-unisex-co-my-form-rong-vai-day-min-2019t900-p190375828.html?spid=190377290,20,,,dodoi
Áo thun gia đình đẹp in chibi family dễ thương cao cấp,139.150₫,https://tiki.vn/ao-thun-gia-dinh-dep-in-chibi-family-de-thuong-cao-cap-p190378271.html?spid=190378358,21,,,dodoi
Áo phông nam fly to space phong cách unisex màu xám,53.000₫,https://tiki.vn/ao-phong-nam-fly-to-space-phong-cach-unisex-mau-xam-p190377548.html?spid=190377912,22,,,dodoi
Áo thun unisex logo cách điệu đẹp rẻ 2019S557,53.000₫,https://tiki.vn/ao-thun-unisex-logo-cach-dieu-dep-re-2019s557-p190360363.html?spid=190360980,23,,,dodoi
Áo phông nam nữ gấu đu mặt trăng form rộng vải dày mịn 2020T2862,53.000₫,https://tiki.vn/ao-phong-nam-nu-gau-du-mat-trang-form-rong-vai-day-min-2020t2862-p190360458.html?spid=190361345,24,,,dodoi
Áo thun unisex thỏ dabbing màu trắng 2019T837,53.000₫,https://tiki.vn/ao-thun-unisex-tho-dabbing-mau-trang-2019t837-p190361280.html?spid=190362401,25,,,dodoi
,,https://tiki.vn/ao-thun-unisex-phong-cach-ca-tinh-dep-re-2019s520-p190360917.html?spid=190361562,26,,,dodoi
Áo thun tay lỡ nam nữ samurai form rộng vải dày mịn 2020T2657,53.000₫,https://tiki.vn/ao-thun-tay-lo-nam-nu-samurai-form-rong-vai-day-min-2020t2657-p190363562.html?spid=190364899,27,,Đã bán 1,dodoi
Áo thun unisex form rộng oẳn tù tì thời trang cá tính vải dày mịn 2019T1381,53.000₫,https://tiki.vn/ao-thun-unisex-form-rong-oan-tu-ti-thoi-trang-ca-tinh-vai-day-min-2019t1381-p190364821.html?spid=190364996,28,,,dodoi
Album 6 - bst áo thun unisex PINEAPPLE Nhật Bản thời trang chất độc lạ,39.900₫,https://tiki.vn/album-6-bst-ao-thun-unisex-pineapple-nhat-ban-thoi-trang-chat-doc-la-p190365455.html?spid=190366380,29,,,dodoi
Áo thun nam nữ form rộng sói hú vải dày mịn 20T2771,24.900₫,https://tiki.vn/ao-thun-nam-nu-form-rong-soi-hu-vai-day-min-20t2771-p190365760.html?spid=190368598,30,,,dodoi
,,https://tiki.vn/ao-thun-form-rong-unisex-phong-cach-hypebeast-vai-day-min-2019t22071-p190368821.html?spid=190369230,31,,,dodoi
Áo thun unisex oxygen form rộng vải dày mịn 2019T911,53.000₫,https://tiki.vn/ao-thun-unisex-oxygen-form-rong-vai-day-min-2019t911-p190368939.html?spid=190370232,32,,,dodoi
Áo thun unisex thời trang MARVEL,53.000₫,https://tiki.vn/ao-thun-unisex-thoi-trang-marvel-p190369708.html?spid=190370709,33,,,dodoi
Áo thun tay lỡ nam nữ vô diệm và bạn vải dày mịn 2020T3067,53.000₫,https://tiki.vn/ao-thun-tay-lo-nam-nu-vo-diem-va-ban-vai-day-min-2020t3067-p190370107.html?spid=190371211,34,,,dodoi
Áo thun trắng đen unisex form rộng nam nữ chữ kiều MAN vải dày mịn,53.000₫,https://tiki.vn/ao-thun-trang-den-unisex-form-rong-nam-nu-chu-kieu-man-vai-day-min-p190370668.html?spid=190373400,35,,,dodoi
,,https://tiki.vn/ao-thun-unisex-form-rong-do-hoa-rubic-vai-day-min-2019t1712-p190371970.html?spid=190372277,36,,,dodoi
Áo thun nam nữ mèo đại ca dabbing form rộng vải dày mịn 2020T2824,53.000₫,https://tiki.vn/ao-thun-nam-nu-meo-dai-ca-dabbing-form-rong-vai-day-min-2020t2824-p190378305.html?spid=190378627,37,,,dodoi
Áo thun gia đình đẹp in chibi family dễ thương cao cấp,139.150₫,https://tiki.vn/ao-thun-gia-dinh-dep-in-chibi-family-de-thuong-cao-cap-p190388370.html?spid=190388447,38,,,dodoi
Áo thun chữ R mtt154,53.000₫,https://tiki.vn/ao-thun-chu-r-mtt154-p190391432.html?spid=190391590,39,,,dodoi
Áo thun tay lỡ nam form rộng in hình chibi thần tượng BTS vải dày mịn TEEWO127,53.000₫,https://tiki.vn/ao-thun-tay-lo-nam-form-rong-in-hinh-chibi-than-tuong-bts-vai-day-min-teewo127-p190426927.html?spid=190427340,40,,,dodoi
