title,price,link_item,index,discount,sales,category
Bộ Áo Thun Đôi Nam Nữ Màu Đen A956 - S,269.000₫,https://tiki.vn/bo-ao-thun-doi-nam-nu-mau-den-a956-p21320206.html?spid=21320208,1,,,dodoi
Áo Thun Đôi Tình Nhân Màu Xám In Hẹn Ước I LOVE YOU,89.000₫,https://tiki.vn/ao-thun-doi-tinh-nhan-mau-xam-in-hen-uoc-i-love-you-p42531749.html?spid=42531791,2,,Đã bán 5,dodoi
Áo đôi nam nữ Áo cặp váy sơ mi thời trang couple hàn quốc sọc kẻ caro màu đỏ đuôi cá đẹp AV34,299.000₫,https://tiki.vn/ao-doi-nam-nu-ao-cap-vay-so-mi-thoi-trang-couple-han-quoc-soc-ke-caro-mau-do-duoi-ca-dep-av34-p96238899.html?spid=100516442,3,,,dodoi
Set Áo váy đôi sơ mi CoupleTina,299.000,https://tiki.vn/set-ao-vay-doi-so-mi-coupletina-p85084123.html?spid=85084133,4,,,dodoi
,,https://tiki.vn/ao-thun-cap-nam-nu-in-meo-ami-cuc-de-thuong-thich-hop-cho-cac-cap-doi-tre-trung-nang-dong-cho-cac-nhom-ban-di-dem-di-phuot-bao-nhin-da-mat-bao-ngau-bao-chat-p68853999.html?spid=72192298,5,,,dodoi
Áo sơ mi cặp đôi họa tiết bồ công anh cực đẹp | Áo đôi nam nữ chất đẹp | Áo Chất Store,135.000₫,https://tiki.vn/ao-so-mi-cap-doi-hoa-tiet-bo-cong-anh-cuc-dep-ao-doi-nam-nu-chat-dep-ao-chat-store-p104145091.html?spid=104145206,6,,,dodoi
(HOT) Áo sơ mi đôi nam nữ chữ LOVE cao cấp | Áo cặp sơ mi đẹp | Áo Chất Store,293.000₫,https://tiki.vn/hot-ao-so-mi-doi-nam-nu-chu-love-cao-cap-ao-cap-so-mi-dep-ao-chat-store-p104111566.html?spid=104111602,7,,,dodoi
Sơ Mi Đôi Nam Nữ TODAY IS THE DAYY Cao Cấp | Áo Đôi Nam Nữ Đẹp SMC44,125.000₫,https://tiki.vn/so-mi-doi-nam-nu-today-is-the-dayy-cao-cap-ao-doi-nam-nu-dep-smc44-p104134036.html?spid=104134478,8,,,dodoi
áo đôi chụp cưới áo váy đôi sơ mi nam nữ màu trắng cố vuông đính nút gỗ chụp cưới đẹp AV42,299.000,https://tiki.vn/a-o-doi-chu-p-cuo-i-freeship-a-o-va-y-doi-so-mi-nam-nu-ma-u-tra-ng-co-vuong-di-nh-nu-t-go-chu-p-cuo-i-de-p-av42-p96239271.html?spid=100531909,9,,,dodoi
,,https://tiki.vn/set-vay-nu-so-mi-nam-doi-han-quoc-couple-av28-p96238568.html?spid=100543401,10,,,dodoi
Áo Đôi Sơ Mi Cổ Tàu Họa Tiết,258.700₫,https://tiki.vn/ao-doi-so-mi-co-tau-hoa-tiet-p91943680.html?spid=91943767,11,,,dodoi
ÁO SƠ MI ĐÔI NAM NỮ ĐẸP,140.000,https://tiki.vn/ao-so-mi-doi-nam-nu-dep-p91945866.html?spid=91945890,12,,,dodoi
,,https://tiki.vn/ao-so-mi-doi-hoa-tiet-cao-cap-p91945751.html?spid=91945792,13,,,dodoi
Áo sơ mi đôi nam nữ LOVE,110.000₫,https://tiki.vn/ao-so-mi-doi-nam-nu-love-p91924113.html?spid=91924213,14,,,dodoi
Áo Sơ Mi Cặp Đôi Love You So Much,110.000₫,https://tiki.vn/ao-so-mi-cap-doi-love-you-so-much-p91924588.html?spid=91924646,15,,Đã bán 1,dodoi
"ÁO KHOÁC HOODIE NAM NỮ MẶC , ÁO KHOÁC CẶP , ĐÔI",96.000₫,https://tiki.vn/product-p90071327.html?spid=98087287,16,,,dodoi
Đồ đôi đi biển cute - HÀNG LOẠI 1 ( giá 1 bộ luôn quần và áo),109.000,https://tiki.vn/do-doi-di-bien-cute-hang-loai-1-gia-1-bo-luon-quan-va-ao-p248268748.html?spid=248268896,17,,,dodoi
,,https://tiki.vn/ao-so-mi-doi-xe-dap-cao-cap-so-mi-cap-gia-re-p146872730.html?spid=146872994,18,,,dodoi
[GIÁ ƯU ĐÃI] [ MUA 2 Áo Người lớn TẶNG 1 Áo cho bé ] Combo Gia Đình Áo Thun Hana Mascot Full Week - Áo thun Unisex - Trắng,640.000₫,https://tiki.vn/gia-uu-dai-mua-2-ao-nguoi-lon-tang-1-ao-cho-be-combo-gia-dinh-ao-thun-hana-mascot-full-week-ao-thun-unisex-p201602063.html?spid=201602065,19,,,dodoi
"Áo thun, áo phông đôi nam nữ trắng trơn",49.000₫,https://tiki.vn/ao-thun-ao-phong-doi-nam-nu-trang-tron-p217111114.html?spid=217111117,20,,,dodoi
"Áo cặp đôi , Áo thun nam nữ form rộng sadboizz khủng long đáng yêu",88.000₫,https://tiki.vn/ao-cap-doi-ao-thun-nam-nu-form-rong-sadboizz-khung-long-dang-yeu-p193193042.html?spid=193193046,21,,,dodoi
"ÁO SƠ MI ĐŨI CĂP ĐÔI SIÊU NGẦU,THIẾT KẾ HỌA TIẾT HOA HỢP THỜI TRANG,CHẤT LIỆU VÃI THOÁNG MÁT",119.000₫,https://tiki.vn/ao-so-mi-dui-cap-doi-sieu-ngau-thiet-ke-hoa-tiet-hoa-hop-thoi-trang-chat-lieu-vai-thoang-mat-p114325126.html?spid=114981267,22,,,dodoi
ÁO HOODIES NAM NỮ FOM RỘNG UNISEX,79.000₫,https://tiki.vn/ao-hoodies-nam-nu-fom-rong-unisex-p114323804.html?spid=115200937,23,,,dodoi
Áo sau sinh cotton,69.000₫,https://tiki.vn/ao-sau-sinh-cotton-p150715734.html?spid=150715736,24,,,dodoi
Bộ Áo Thun Đôi Người Tuyêt Màu Trắng Nam Nữ,225.000,https://tiki.vn/bo-ao-thun-doi-nguoi-tuyet-mau-trang-nam-nu-p11095308.html?spid=11095348,25,,,dodoi
,,https://tiki.vn/bo-ao-thun-doi-chipi-huou-buom-mau-trang-nam-nu-p11098219.html?spid=11098261,26,,,dodoi
Bộ Áo Thun Đôi ChiPi Hôn Cute Màu Trắng,159.000₫,https://tiki.vn/bo-ao-thun-doi-chipi-hon-cute-mau-trang-p11119882.html?spid=11119886,27,,,dodoi
Bộ Áo Thun Đôi Happy Family Cute Màu Trắng Nam Nữ M,159.000₫,https://tiki.vn/bo-ao-thun-doi-happy-family-cute-mau-trang-nam-nu-p11107030.html?spid=11107064,28,,,dodoi
Bộ Áo Thun Đôi Vân Tay Tim Màu Trắng Nam Nữ,159.000₫,https://tiki.vn/bo-ao-thun-doi-van-tay-tim-mau-trang-nam-nu-p11121456.html?spid=11121484,29,,,dodoi
Bộ Áo Thun Đôi The New Fashion Màu Trắng Nam Nữ XS,270.000,https://tiki.vn/bo-ao-thun-doi-the-new-fashion-mau-trang-nam-nu-p10891727.html?spid=10891729,30,,,dodoi
,,https://tiki.vn/bo-ao-thun-doi-mot-trai-tim-yeu-mau-trang-nam-nu-p10945418.html?spid=10945438,31,,,dodoi
Áo Đôi Chữ Love Xanh Hồng Nam Nữ S,159.000₫,https://tiki.vn/ao-doi-chu-love-xanh-hong-nam-nu-p10816415.html?spid=10816429,32,,,dodoi
Bộ Áo Thun Đôi Vợ Là Nhất Màu Trắng Nam Nữ,225.000₫,https://tiki.vn/bo-ao-thun-doi-vo-la-nhat-mau-trang-nam-nu-p10964843.html?spid=10964893,33,,,dodoi
Bộ Áo Thun Đôi Cowboy Màu Trắng Nam Nữ,270.000₫,https://tiki.vn/bo-ao-thun-doi-cowboy-mau-trang-nam-nu-p10890707.html?spid=10890739,34,,,dodoi
Bộ Áo Thun Đôi Bạn Hữu Đường Xa Màu Vàng Nam Nữ,225.000,https://tiki.vn/bo-ao-thun-doi-ban-huu-duong-xa-mau-vang-nam-nu-p11027410.html?spid=11027416,35,,,dodoi
,,https://tiki.vn/bo-ao-thun-doi-love-mau-trang-nam-nu-p10961776.html?spid=10961780,36,,,dodoi
Bộ Áo Thun Đôi Vợ là Cục Nợ của riêng Anh Màu Trắng Nam Nữ,225.000₫,https://tiki.vn/bo-ao-thun-doi-vo-la-cuc-no-cua-rieng-anh-mau-trang-nam-nu-p10963853.html?spid=10963880,37,,,dodoi
Bộ Áo Thun Đôi Chipi Cá Tính Màu Vàng Nam Nữ XL,225.000₫,https://tiki.vn/bo-ao-thun-doi-chipi-ca-tinh-mau-vang-nam-nu-p11028142.html?spid=11028209,38,,,dodoi
Bộ Áo Thun Đôi Em là Vk Anh là Ck Màu Vàng Nam Nữ S,225.000₫,https://tiki.vn/bo-ao-thun-doi-em-la-vk-anh-la-ck-mau-vang-nam-nu-p11015022.html?spid=11015036,39,,Đã bán 3,dodoi
Bộ Áo Thun Đôi I Love Hem Heart Màu Trắng Nam Nữ,225.000,https://tiki.vn/bo-ao-thun-doi-i-love-hem-heart-mau-trang-nam-nu-p11050694.html?spid=11050716,40,,,dodoi
