title,price,link_item,index,discount,sales,category
DOTTIE - Chân váy mini - Hồng - S0184,439.000₫,https://tiki.vn/dottie-chan-vay-mini-hong-s0184-p270315838.html?spid=270315844,1,,,chanvay
Chân váy tennis xếp ly có lót hình thật,146.000₫,https://tiki.vn/chan-vay-tennis-xep-ly-co-lot-hinh-that-p192364819.html?spid=192364831,2,,,chanvay
"Chân váy cạp cao chữ A, váy dạ ngắn, chân váy kèm lót trong_v34",69.000₫,https://tiki.vn/chan-vay-cap-cao-chu-a-vay-da-ngan-chan-vay-kem-lot-trong_v34-p193243790.html?spid=193243920,3,,Đã bán 3,chanvay
"Váy sơ mi dài tay form rộng phong cách, váy sơ mi 3 màu xanh đen và trắng_a20",149.000,https://tiki.vn/vay-so-mi-dai-tay-form-rong-phong-cach-vay-so-mi-3-mau-xanh-den-va-trang_a20-p193244919.html?spid=193244954,4,,,chanvay
,,https://tiki.vn/chan-vay-cap-cao-tui-hop-phong-cach-moi-p193242749.html?spid=193242764,5,,,chanvay
Váy cạp cao dài qua gối phong cách,139.000₫,https://tiki.vn/vay-cap-cao-dai-qua-goi-phong-cach-p193244665.html?spid=193244701,6,,,chanvay
Chân Váy Ngắn Chữ A Cạp Cap Phong Cách Đơn Giản_Kèm Quần Trong V10,99.000₫,https://tiki.vn/chan-vay-ngan-chu-a-cap-cap-phong-cach-don-gian_kem-quan-trong-v10-p193244185.html?spid=193244234,7,,,chanvay
Chân váy cạp cao dài qua gối xẻ trước phong cách_A12,148.570₫,https://tiki.vn/chan-vay-cap-cao-dai-qua-goi-xe-truoc-phong-cach_a12-p193246217.html?spid=193246241,8,,,chanvay
Chân Váy Bút Chì Vân Nổi,249.000,https://tiki.vn/chan-vay-but-chi-van-noi-zart-p10953128.html?spid=10953134,9,,,chanvay
,,https://tiki.vn/vay-bc-xe-ta-truoc-rb12-x-copan-p14549209.html?spid=14549217,10,,,chanvay
Váy BC 2L xếp ly 2 bên xanh rêu,638.000₫,https://tiki.vn/vay-bc-2l-xep-ly-2-ben-xanh-reu-p14549182.html?spid=14549184,11,,,chanvay
Chân váy xếp ly giữa NN100602,245.000,https://tiki.vn/chan-vay-xep-ly-giua-nn100602-p19807472.html?spid=19807474,12,,,chanvay
,,https://tiki.vn/chan-vay-the-thao-nu-fila-tennis-club-x-smiley-fw2skf4s10f-dbl-p273346390.html?spid=273346397,13,,,chanvay
Chân váy lưới midi xuyên thấu Mã: VN711,130.000₫,https://tiki.vn/chan-vay-luoi-midi-xuyen-thau-ma-vn711-p4819057.html?spid=13949400,14,,,chanvay
Chân váy jeans ceniceni Mã: VN781 - XANH ĐẬM,210.000₫,https://tiki.vn/chan-vay-jeans-ceniceni-ma-vn781-xanh-dam-p12669917.html?spid=14381734,15,,,chanvay
Chân váy jeans rách hoa hồng Mã: VN719,285.000₫,https://tiki.vn/chan-vay-jeans-rach-hoa-hong-ma-vn719-p4621531.html?spid=13951706,16,,,chanvay
Chân Váy Trắng Đính Nút - Zerasy Fashion - MS 2019036,200.000,https://tiki.vn/chan-vay-trang-dinh-nut-zerasy-fashion-p11435325.html?spid=11435331,17,,Đã bán 5,chanvay
,,https://tiki.vn/vay-but-chi-hity-ski031-den-huyen-bi-p31678839.html?spid=31678857,18,,,chanvay
Chân váy bút chì dài qua gối-Đen,199.000₫,https://tiki.vn/chan-vay-but-chi-dai-qua-goi-den-p28079732.html?spid=28079738,19,,Đã bán 7,chanvay
Chân váy xòe- Wemeet-S03C1W6701022286,423.750₫,https://tiki.vn/chan-vay-xoe-wemeet-s03c1w6701022286-den-f-p28099018.html?spid=28935087,20,,,chanvay
Váy công sở nhún lệch lai ( đỏ),115.000₫,https://tiki.vn/vay-cong-so-nhun-lech-lai-chat-lua-do-p38217319.html?spid=38217325,21,,,chanvay
Chân váy Victoria Skirt,250.000₫,https://tiki.vn/chan-vay-skirt-p104739960.html?spid=104739985,22,,,chanvay
Chân váy Caramel Skirt,250.000₫,https://tiki.vn/chan-vay-caramel-skirt-p104740586.html?spid=104740594,23,,,chanvay
Chân Váy Dài Vải Lanh Nữ Tính,564.000₫,https://tiki.vn/chan-vay-dai-vai-lanh-nu-tinh-p59497843.html?spid=59497887,24,,,chanvay
Chân Váy Cơ Bản Vải Lanh,377.000,https://tiki.vn/chan-vay-co-ban-vai-lanh-p59524733.html?spid=59525087,25,,,chanvay
,,https://tiki.vn/chan-vay-kaki-lung-cao-thoi-trang-mua-he-cho-hoc-sinh-p171104966.html?spid=171104979,26,,,chanvay
Chân váy ngắn xếp ly-TSX1221 Vienne Tran V62L20H003,369.000₫,https://tiki.vn/chan-vay-ngan-xep-ly-tsx1221-vienne-tran-v62l20h003-p192113772.html?spid=192113784,27,,,chanvay
"Váy dập ly bay, Peace House Clothing",480.000₫,https://tiki.vn/vay-dap-ly-bay-peace-house-clothing-p94634960.html?spid=94635002,28,,,chanvay
CV08 Chân Váy Jean dáng chứ A dài qua gối phong cách trẻ trung,180.000₫,https://tiki.vn/cv08-chan-vay-jean-dang-chu-a-dai-qua-goi-phong-cach-tre-trung-p273364921.html?spid=273364923,29,,,chanvay
Váy Công Sở Đuôi Cá Eo Cột Nơ Vải Đẹp Form Chuẩn,145.000,https://tiki.vn/vay-cong-so-duoi-ca-eo-cot-no-vai-dep-form-chuan-p51709742.html?spid=51709750,30,,,chanvay
,,https://tiki.vn/vay-xep-li-hoa-la-p128312405.html?spid=128312481,31,,,chanvay
Chân váy bút chì xẻ trước( đỏ),169.000₫,https://tiki.vn/chan-vay-but-chi-xe-truoc-do-p41131473.html?spid=41131500,32,,,chanvay
Váy Ôm Hoa Phối Da,365.000₫,https://tiki.vn/vay-om-hoa-phoi-da-p6697363.html?spid=6697367,33,,,chanvay
Váy đuôi cá satin quý phái (size nhỏ),535.000₫,https://tiki.vn/vay-duoi-ca-satin-quy-phai-size-nho-p249273775.html?spid=249273779,34,,,chanvay
Váy satin chữ A,597.000,https://tiki.vn/vay-satin-chu-a-p253242291.html?spid=253242293,35,,,chanvay
,,https://tiki.vn/chan-vay-dap-ly-dai-freesize-den-sooyoung-p110023639.html?spid=110023655,36,,,chanvay
Chân náy nữ cao cấp kiểu dáng công sở thanh lịch - NP1692,424.000₫,https://tiki.vn/chan-nay-nu-cao-cap-kieu-dang-cong-so-thanh-lich-np1692-p68557441.html?spid=68557445,37,,Đã bán 1,chanvay
Chân váy ngắn phối hoa văn thời trang 601,249.000₫,https://tiki.vn/chan-vay-ngan-phoi-hoa-van-thoi-trang-p193177291.html?spid=193177292,38,,,chanvay
Chân Váy Kaki Cạp Cao Dài Chạm Gối Xẻ Trước Nút Cài,99.000₫,https://tiki.vn/chan-vay-kaki-cap-cao-dai-cham-goi-xe-truoc-nut-cai-p180048100.html?spid=180048101,39,,,chanvay
Chân Váy Bút Chì Lưng Cao Dáng Cơ Bản Mariposa,149.000,https://tiki.vn/chan-vay-but-chi-lung-cao-dang-co-ban-mariposa-p179564975.html?spid=179564976,40,,,chanvay
