title,price,link_item,index,discount,sales,category
Chân váy ngắn dáng a,230.000₫,https://tiki.vn/chan-vay-ngan-dang-a-p272378306.html?spid=272378314,1,,,chanvay
CHÂN VÁY THÊU HOA CAO CẤP ĐỦ SIZE NT8090,238.000₫,https://tiki.vn/chan-vay-theu-hoa-cao-cap-du-size-nt8090-p48574859.html?spid=48574877,2,,Đã bán 5,chanvay
Chân Váy A dài/ ngắn xẻ tà màu đen cá tính,90.000₫,https://tiki.vn/chan-vay-a-dai-ngan-xe-ta-mau-den-ca-tinh-p101532131.html?spid=101533517,3,,Đã bán 2,chanvay
OLV - Chân váy Kaylin White Skirt,336.000,https://tiki.vn/olv-chan-vay-kaylin-white-skirt-p263959456.html?spid=263959460,4,,,chanvay
,,https://tiki.vn/chan-vay-nau-sale-p167210606.html?spid=167210614,5,,,chanvay
Chân váy giả bò,145.000₫,https://tiki.vn/chan-vay-gia-bo-p144045632.html?spid=144045652,6,,,chanvay
Chân váy midi cúc hoạ mi cao cấp,290.000₫,https://tiki.vn/chan-vay-midi-cuc-hoa-mi-cao-cap-p104678108.html?spid=104678109,7,,,chanvay
Chân váy chữ A đỏ nút sắt Enrose Skirt,250.000₫,https://tiki.vn/chan-vay-chu-a-do-nut-sat-enrose-skirt-p130996671.html?spid=130996680,8,,,chanvay
AIMEE_CHÂN VÁY KAKI (CÓ LÓT QUẦN),235.000,https://tiki.vn/aimee_chan-vay-kaki-co-lot-quan-p134560829.html?spid=134560842,9,,,chanvay
,,https://tiki.vn/chan-vay-chu-a-den-tron-p130996596.html?spid=130996616,10,,,chanvay
Chân Váy Dáng Xòe Cao Cấp Ảnh Thật,129.000₫,https://tiki.vn/chan-vay-dang-xoe-cao-cap-anh-that-p125174142.html?spid=125174155,11,,,chanvay
chân váy ngắn dập ly 2 tầng có size SML chất đẹp có quần trong,180.000,https://tiki.vn/chan-vay-ngan-dap-ly-2-tang-co-size-sml-chat-dep-co-quan-trong-p124243646.html?spid=124243655,12,,,chanvay
,,https://tiki.vn/chan-vay-dai-midi-den-chan-vay-ulzzang-de-phoi-do-cuc-xinh-p124243318.html?spid=124243332,13,,,chanvay
Chân váy chữ A lưng cao phong cách hàn quốc 3 màu,99.000₫,https://tiki.vn/chan-vay-chu-a-lung-cao-phong-cach-han-quoc-3-mau-p108510043.html?spid=108510059,14,,Đã bán 3,chanvay
Chân váy xếp tầng cho bé iu xếp li siêu xinh (nhiều màu),65.000₫,https://tiki.vn/chan-vay-xep-tang-cho-be-iu-xep-li-sieu-xinh-nhieu-mau-p179517613.html?spid=179517640,15,,,chanvay
"CHÂN VÁY KAKI CHỮ A KÈM DÂY NỊT (S,M,L)",99.000₫,https://tiki.vn/chan-vay-kaki-chu-a-kem-day-nit-s-m-l-p207946810.html?spid=207946823,16,,,chanvay
váy chữ A xẻ vạt,69.000₫,https://tiki.vn/vay-chu-a-xe-vat-p111748964.html?spid=111749002,17,,,chanvay
,,https://tiki.vn/chan-vay-jean-bo-den-xe-ta-cap-cao-p170126850.html?spid=170126859,18,,,chanvay
CHÂN VÁY ĐẮP CHÉO CHO NỮ,100.000₫,https://tiki.vn/chan-vay-dap-cheo-cho-nu-p122394538.html?spid=122394548,19,,,chanvay
(HÀNG SẴN) Chân Váy Phối Ren Chữ A Sang Trọng VH76 - Hàng Quảng Châu Cao Cấp,245.000₫,https://tiki.vn/hang-san-chan-vay-phoi-ren-chu-a-sang-trong-vh76-hang-quang-chau-cao-cap-p150693689.html?spid=150693704,20,,,chanvay
Chân váy tầng Ulzzang eo chun - Chân váy xòe tầng dài qua gối,129.000₫,https://tiki.vn/chan-vay-tang-ulzzang-eo-chun-chan-vay-xoe-tang-dai-qua-goi-p124238896.html?spid=124238914,21,,,chanvay
Váy Hoa Chiffon Phong Cách Vintage HOYANG D126,1.215.000₫,https://tiki.vn/vay-hoa-chiffon-phong-cach-vintage-hoyang-d126-p248465440.html?spid=248465452,22,,,chanvay
Chân váy chữ A họa tiết kẻ caro SYO V6820016,520.000₫,https://tiki.vn/chan-vay-chu-a-hoa-tiet-ke-caro-syo-v6820016-p161412286.html?spid=161412325,23,,,chanvay
Q550620 CHÂN VÁY SỌC MAXI LƯNG THUN,360.000₫,https://tiki.vn/q550620-chan-vay-soc-maxi-lung-thun-p135525847.html?spid=135525991,24,,,chanvay
Chân váy xếp ly caro hàng QC có lót quần đùi bên trong,208.000,https://tiki.vn/chan-vay-xep-ly-caro-hang-qc-co-lot-quan-dui-ben-trong-p100512874.html?spid=100512898,25,,,chanvay
,,https://tiki.vn/chan-vay-xep-ly-co-tui-2-ben-oxatyl-m457-chat-vai-day-phong-cach-thoi-trang-cong-so-p253618547.html?spid=253618559,26,,,chanvay
chân vấy bút chì xẻ sau chất liệu co dán tốt,60.000₫,https://tiki.vn/chan-vay-but-chi-xe-sau-chat-lieu-co-dan-tot-p192800739.html?spid=192800749,27,,,chanvay
Chân váy JEAN xẻ đùi midi thời trang 561,190.000₫,https://tiki.vn/chan-vay-jean-xe-dui-midi-thoi-trang-561-p194446739.html?spid=194446747,28,,,chanvay
Chân váy nữ đuôi cá cạp cao dáng dài có lớp lót form công sở cao cấp mặc tôn dáng màu đen nâu,300.000₫,https://tiki.vn/chan-vay-nu-duoi-ca-cap-cao-dang-dai-co-lop-lot-form-cong-so-cao-cap-mac-ton-dang-mau-den-nau-p175948894.html?spid=175948904,29,,,chanvay
Chân váy bút chì ngắn hàng thiết kế kèm khóa xi cao cấp chân váy công sở form chuẩn thanh lịch BC15,279.000,https://tiki.vn/chan-vay-but-chi-ngan-hang-thiet-ke-kem-khoa-xi-cao-cap-chan-vay-cong-so-form-chuan-thanh-lich-bc15-p145290226.html?spid=145290242,30,,,chanvay
,,https://tiki.vn/chan-vay-ren-dang-dai-kieu-song-bien-cao-cap-mau-moi-vay34-free-size-p46562528.html?spid=46562536,31,,,chanvay
Chân váy nữ thời trang chữ A túi chéo vải kaki cao cấp free size VAY04,197.000₫,https://tiki.vn/chan-vay-nu-thoi-trang-chu-a-tui-cheo-vai-kaki-cao-cap-free-size-vay04-p90321831.html?spid=90321854,32,,Đã bán 4,chanvay
Chân váy lưới lót nhung sọc óng ánh dễ thương free size VÂY115,215.000₫,https://tiki.vn/chan-vay-luoi-lot-nhung-soc-ong-anh-de-thuong-free-size-vay115-p76042669.html?spid=76042677,33,,,chanvay
Chân váy nhung xếp ly kèm thắt lưng đồng mầu VAY93 free size,185.000₫,https://tiki.vn/chan-vay-nhung-xep-ly-kem-that-lung-dong-mau-vay93-free-size-p71206217.html?spid=71206229,34,,Đã bán 8,chanvay
Chân váy len dáng ôm basic dễ phối đồ VAY96,155.000,https://tiki.vn/chan-vay-len-dang-om-basic-de-phoi-do-vay96-p73493520.html?spid=80958984,35,,,chanvay
,,https://tiki.vn/chan-vay-tutu-luoi-cuc-hoa-mi-de-thuong-free-size-vay60-p90323155.html?spid=90323159,36,,,chanvay
Chân Váy Bút Chì Dài Qua Gối MOLA Màu Đen,260.000₫,https://tiki.vn/chan-vay-but-chi-dai-qua-goi-mola-mau-den-p165236427.html?spid=165236476,37,,Đã bán 1,chanvay
Chân váy công sở dài bigsize CR63V06 màu đen xẻ sau D63 thun umi co dãn từ 45kg-85kg,181.300₫,https://tiki.vn/chan-vay-cong-so-dai-bigsize-cr63v06-mau-den-xe-sau-d63-thun-umi-co-dan-tu-45kg-85kg-p155193239.html?spid=155193411,38,,,chanvay
Chân váy len xòe dập ly dáng dài cao cấp – DL47234,351.000₫,https://tiki.vn/chan-vay-len-xoe-dap-ly-dang-dai-cao-cap-dl47234-p130787578.html?spid=130787582,39,,Đã bán 4,chanvay
Váy Ngắn Miniskirt Hity SKI028 (Denim),699.000,https://tiki.vn/vay-ngan-miniskirt-hity-ski028-denim-p14294379.html?spid=14294387,40,,,chanvay
