title,price,link_item,index,discount,sales,category
Bộ 5 Quần lót giấy cao cấp- đáy 2 lớp cotton- Sunbaby,30.000₫,https://tiki.vn/bo-5-quan-lot-giay-cao-cap-day-2-lop-cotton-sunbaby-p21443735.html?spid=21443739,1,,Đã bán 47,chamsocme
Túi đựng đồ đa năng treo sau ghế chất liệu da Nappa,540.000₫,https://tiki.vn/tui-dung-do-da-nang-treo-sau-ghe-chat-lieu-da-nappa-p206308313.html?spid=206308317,2,,,chamsocme
Túi Giữ Nhiệt 2 Ngăn Giữ Lạnh,100.000₫,https://tiki.vn/tui-giu-nhiet-2-ngan-giu-lanh-p53064813.html?spid=53064815,3,,Đã bán 23,chamsocme
Áo bú mở nắp (giao màu ngẫu nhiên),35.000₫,https://tiki.vn/ao-bu-mo-nap-giao-mau-ngau-nhien-p101253776.html?spid=101253788,4,,Đã bán 1,chamsocme
Combo 2 quần lót bầu cql04 giao màu ngẫu nhiên,57.000₫,https://tiki.vn/combo-2-quan-lot-bau-cql04-giao-mau-ngau-nhien-p6279331.html?spid=57298591,5,,,chamsocme
Quần lót bầu và sau sinh cạp chéo chất SU ĐÚC thông hơi kháng khuẩn đồ lót chip bà bầu bigsize 9090,29.000₫,https://tiki.vn/quan-lot-bau-va-sau-sinh-cap-cheo-chat-su-duc-thong-hoi-khang-khuan-do-lot-chip-ba-bau-bigsize-9090-p185296134.html?spid=185296138,6,,,chamsocme
ÁO NGỰC BẦU VÀ CHO BÉ BÚ,45.000₫,https://tiki.vn/ao-nguc-bau-va-cho-be-bu-p173872065.html?spid=173872066,7,,,chamsocme
Gối chữ U và J massage cho bà bầu vải nhung 3D cao cấp cho mom,150.000₫,https://tiki.vn/goi-chu-u-va-j-massage-cho-ba-bau-vai-nhung-3d-cao-cap-cho-mom-p188716923.html?spid=257866224,8,,,chamsocme
Túi hâm nóng bình sữa không cần điện Babymoov,549.000₫,https://tiki.vn/tui-ham-nong-binh-sua-khong-can-dien-babymoov-p7774292.html?spid=71134367,9,,Đã bán 8,chamsocme
Quần lót bầu,23.000₫,https://tiki.vn/quan-lot-bau-p216464187.html?spid=216464233,10,,,chamsocme
Quần lót bầu hoạ tiết,15.000₫,https://tiki.vn/quan-lot-bau-hoa-tiet-p92318860.html?spid=92318886,11,,,chamsocme
QUẦN CHIP COTTON LẠNH -1 set 3 quần Tặng kèm Ví y hình,60.000₫,https://tiki.vn/quan-chip-cotton-lanh-1-set-3-quan-tang-kem-vi-y-hinh-p216464338.html?spid=216464339,12,,,chamsocme
Sản phẩm hữu ích dành cho bé yêu 3in1 có 2màu.ghi .đỏ,197.100₫,https://tiki.vn/san-pham-huu-ich-danh-cho-be-yeu-3in1-co-2mau-ghi-do-p121331546.html?spid=121331566,13,,Đã bán 1,chamsocme
Gừng hạ thổ toàn thân Wonmom tặng kèm vòng Phong Thủy Cho Em Bé,200.000₫,https://tiki.vn/gung-ha-tho-toan-than-wonmom-tang-kem-vong-phong-thuy-cho-em-be-p57448035.html?spid=71082669,14,,Đã bán 3,chamsocme
Dầu chống rạn Wonmom tặng kèm vòng Phong Thủy Cho Em Bé,110.000₫,https://tiki.vn/dau-chong-ran-wonmom-tang-kem-vong-phong-thuy-cho-em-be-p57449739.html?spid=71084128,15,,Đã bán 2,chamsocme
Áo ngực bầu bé bú cotton lưới combo 5 cái,135.000₫,https://tiki.vn/ao-nguc-bau-be-bu-cotton-luoi-combo-5-cai-p24630262.html?spid=57298198,16,,,chamsocme
Gối ôm chữ U đa năng cho bà bầu - Voi Xanh - Tặng kèm 1 móc khóa Houston,240.000₫,https://tiki.vn/goi-om-chu-u-da-nang-cho-ba-bau-voi-xanh-tang-kem-1-moc-khoa-houston-p15209326.html?spid=263709480,17,,,chamsocme
Túi Xách Phối Sọc U & YABY 023/2 (32cm) - Đỏ Đen,177.000₫,https://tiki.vn/tui-xach-phoi-soc-u-yaby-023-2-32cm-do-den-p1593271.html?spid=1593717,18,,Đã bán 3,chamsocme
Bóp Gắn Bông Mai U & YABY 017 - Tím,66.000₫,https://tiki.vn/bop-gan-bong-mai-u-yaby-017-tim-p1593251.html?spid=1593697,19,,,chamsocme
Bóp Gắn Bông Mai U & YABY 017 - Xanh Dương,68.000₫,https://tiki.vn/bop-gan-bong-mai-u-yaby-017-xanh-duong-p1593267.html?spid=1593713,20,,Đã bán 3,chamsocme
Bóp Gắn Bông Mai U & YABY 017 - Vàng,66.000₫,https://tiki.vn/bop-gan-bong-mai-u-yaby-017-vang-p1593257.html?spid=1593703,21,,Đã bán 3,chamsocme
Hộp Giấy Dưa Hấu U & YABY 057/4,185.000₫,https://tiki.vn/hop-giay-dua-hau-u-yaby-057-4-p1593325.html?spid=1593771,22,,Đã bán 2,chamsocme
Máy Hút Sữa Spectra M1- Tặng 2 khăn tắm xô 4 lớp(70cmx70cm),2.080.000₫,https://tiki.vn/may-hut-sua-spectra-m1-tang-2-khan-tam-xo-4-lop-70cmx70cm-p16295144.html?spid=36367419,23,,,chamsocme
Lều Xông Hơi Tự Bung 3 Lớp Và Nồi Xông 2.8L Cao Cấp Khử Trùng Toàn Thân Tại Nhà - Màu Ngẫu Nhiên,799.000₫,https://tiki.vn/leu-xong-hoi-tu-bung-3-lop-va-noi-xong-2-8l-cao-cap-khu-trung-toan-than-tai-nha-tang-chai-tinh-dau-10ml-mau-ngau-nhien-p136317578.html?spid=147865653,24,,Đã bán 2,chamsocme
"Balo Bỉm Sữa, Balo đựng đồ giữ nhiệt đa năng 13 ngăn tiện lợi, thời trang cho Mẹ Và Bé- BL303",139.999₫,https://tiki.vn/balo-bim-sua-balo-dung-do-giu-nhie-t-da-nang-13-ngan-tie-n-lo-i-tho-i-trang-cho-me-va-be-bl303-p85920667.html?spid=159779742,25,,,chamsocme
"Balo bỉm sữa đựng đồ đa năng cho mẹ và bé , balo giữ nhiệt đựng đồ cho bé sơ sinh",95.999₫,https://tiki.vn/balo-bim-sua-dung-do-da-nang-cho-me-va-be-balo-giu-nhiet-dung-do-cho-be-so-sinh-p134560687.html?spid=159773363,26,,Đã bán 5,chamsocme
Balo Bỉm Sữa Cho Mẹ Và Bé,97.999₫,https://tiki.vn/balo-bim-sua-cho-me-va-be-p94458164.html?spid=159773350,27,,,chamsocme
Balo Bỉm Sữa Đa Năng Cao Cấp - Loại Tốt,149.999₫,https://tiki.vn/balo-bim-sua-da-nang-cao-cap-loai-tot-p129622351.html?spid=159785680,28,,,chamsocme
Quần lót cotton Thái cạp chéo combo 5 cái,120.000₫,https://tiki.vn/quan-lot-cotton-thai-cap-cheo-combo-5-cai-p24592437.html?spid=80978099,29,,,chamsocme
COBOTÉ - Bơ ngừa rạn da Stretch Mark Treatment Butter,325.000₫,https://tiki.vn/cobote-bo-ngua-ran-da-stretch-mark-treatment-butter-p270472054.html?spid=270472055,30,,,chamsocme
Áo Lót Latex áo mặc bên trong đai nịt bụng,88.000₫,https://tiki.vn/ao-lot-latex-ao-mac-ben-trong-dai-nit-bung-p124764977.html?spid=124764978,31,,Đã bán 3,chamsocme
Lều xông hơi tự bung Trúc Linh,179.998₫,https://tiki.vn/leu-xong-hoi-tu-bung-truc-linh-mau-ngau-nhien-p118082329.html?spid=127345946,32,,Đã bán 2,chamsocme
Lều xông hơi tự bung cao cấp loại 1 có nắp chui đầu ra ngoài,198.000₫,https://tiki.vn/leu-xong-hoi-tu-bung-cao-cap-loai-1-co-nap-chui-dau-ra-ngoai-p36309015.html?spid=155227840,33,,,chamsocme
Cuống silicone Fatz Resonance 3 -Resonance 4 - Phụ kiện thay thế cho máy hút sữa điện Fatz FatzBaby - 1 cái,25.000₫,https://tiki.vn/cuong-silicone-fatz-resonance-3-resonance-4-phu-kien-thay-the-cho-may-hut-sua-dien-fatz-fatzbaby-1-cai-p273053687.html?spid=273053688,34,,,chamsocme
Nắp trên phễu chụp- Phụ kiện máy hút sữa FatzBaby,50.000₫,https://tiki.vn/nap-tren-pheu-chup-phu-kien-may-hut-sua-fatzbaby-p273165562.html?spid=273165564,35,,,chamsocme
Bộ Dưỡng Da Mụn Chuyên Sâu Cho Mẹ Bầu Và Sau Sinh Wonmom + Tặng 01 Sữa Tắm & 01 Kem Sữa Nghệ Toàn Thân,1.577.000₫,https://tiki.vn/bo-duong-da-mun-chuyen-sau-cho-me-bau-va-sau-sinh-wonmom-tang-01-sua-tam-01-kem-sua-nghe-toan-than-p247535291.html?spid=247535292,36,,,chamsocme
Combo 3 quần lót bầu su gân cạp chéo siêu đẹp-màu ngẫu nhiên,125.000₫,https://tiki.vn/combo-3-quan-lot-bau-su-gan-cap-cheo-sieu-dep-mau-ngau-nhien-p102511872.html?spid=105698127,37,,,chamsocme
Áo ngực cho bé bú mở cúc ngang mút nhẹ,49.000₫,https://tiki.vn/ao-nguc-cho-be-bu-mo-cuc-ngang-mut-nhe-p101897996.html?spid=105698149,38,,Đã bán 2,chamsocme
Chai xanh Gel tắm gội thảo dược cho mẹ Yaocare mama gel - DK PHARMA,233.000₫,https://tiki.vn/gel-tam-goi-thao-duoc-cho-me-yaocare-mama-gel-dk-pharma-p214598772.html?spid=214598773,39,,Đã bán 1,chamsocme
Chậu Xông Hơi Vùng Kín Phụ nữ Sau Sinh / Gấp Gọn Gắn bồn cầu Tiện Lợi kèm Vòi xịt / Bô xông hơ phụ khoa sản phụ,93.000₫,https://tiki.vn/chau-xong-hoi-vung-kin-phu-nu-sau-sinh-gap-gon-gan-bon-cau-tien-loi-kem-voi-xit-bo-xong-ho-phu-khoa-san-phu-p138359575.html?spid=262427174,40,,Đã bán 1,chamsocme
