title,price,link_item,index,discount,sales,category
Túi chườm nóng lạnh Microlife,100.000₫,https://tiki.vn/tui-chuom-nong-lanh-microlife-p272300614.html?spid=272300615,1,-17%,,chamsocme
"Bộ chăm sóc mẹ là siêu nhân, khử mùi, phục hồi năng lượng cho mẹ sau sinh Wonmom (1 lá xông + 1 hộp thảo mộc vệ sinh vùng kín cho mẹ)",159.000₫,https://tiki.vn/bo-cham-soc-me-la-sieu-nhan-khu-mui-phuc-hoi-nang-luong-cho-me-sau-sinh-wonmom-1-la-xong-1-hop-thao-moc-ve-sinh-vung-kin-cho-me-p86155534.html?spid=139685443,2,-2%,Đã bán 1,chamsocme
"Kem sữa nghệ toàn thân dưỡng trắng da body, đánh bay thâm rạn hiệu quả Wonmom 180g",240.000₫,https://tiki.vn/kem-sua-nghe-toan-than-duong-trang-da-body-danh-bay-tham-ran-hieu-qua-wonmom-180g-p2790325.html?spid=64266164,3,-31%,Đã bán 24,chamsocme
Hộp 2 miếng trợ ti Pur cho mẹ,79.000₫,https://tiki.vn/hop-2-mieng-tro-ti-pur-cho-me-p143040713.html?spid=143040717,4,-41%,Đã bán 39,chamsocme
Máy Khuếch Tán Tinh Dầu 4 IN 1 WILIT 961502 Màu Xám hàng chính hãng,1.290.000₫,https://tiki.vn/may-khuech-tan-tinh-dau-4-in-1-wilit-961502-mau-xam-hang-chinh-hang-p252978779.html?spid=252978780,5,,,chamsocme
Xông hơi Mini Homesteam Model MA-440HS,6.000.000₫,https://tiki.vn/xong-hoi-mini-homesteam-model-ma-440hs-p247757648.html?spid=247757649,6,,,chamsocme
MÁY HÚT SỮA ĐIỆN ĐÔI MOAZ BÉBÉ MB – 029 TẶNG KÈM TÚI ĐỰNG VÀ ĐÁ KHÔ,2.166.000₫,https://tiki.vn/may-hut-sua-dien-doi-moaz-bebe-mb-029-tang-kem-tui-dung-va-da-kho-p162171386.html?spid=162171387,7,,,chamsocme
Gối cho bà bầu chữ U - UB57,619.000₫,https://tiki.vn/goi-cho-ba-bau-chu-u-ub57-p35923958.html?spid=35923959,8,,Đã bán 8,chamsocme
"gối bà bầu Zcare - dài 1,35x0.82m",619.000₫,https://tiki.vn/goi-ba-bau-zcare-dai-1-35x0-82m-p52884544.html?spid=52884548,9,,Đã bán 88,chamsocme
Túi trữ sữa mẹ Pigeon (25 túi/ hộp),175.000₫,https://tiki.vn/tui-tru-sua-me-pigeon-25-tui-hop-p10575899.html?spid=10575900,10,,Đã bán 308,chamsocme
Gen nịt bụng giảm eo,100.000₫,https://tiki.vn/gen-nit-bung-giam-eo-p114933672.html?spid=114933678,11,,Đã bán 1,chamsocme
Áo lót cho con bú chấm bi,39.000₫,https://tiki.vn/ao-lot-cho-con-bu-cham-bi-p114932711.html?spid=114932721,12,,Đã bán 9,chamsocme
Áo ngực cho con bú áo lót bà bầu có khuy cài trước dễ dàng tháo cài tiện dụng Lylylorem Al079,600.000₫,https://tiki.vn/ao-nguc-cho-con-bu-ao-lot-ba-bau-co-khuy-cai-truoc-de-dang-thao-cai-tien-dung-lylylorem-al079-p157522723.html?spid=217641297,13,,Đã bán 4,chamsocme
"Xông sản phụ, dạng túi lọc Taco",190.000₫,https://tiki.vn/xong-san-phu-dang-tui-loc-taco-p110025225.html?spid=110025226,14,,Đã bán 4,chamsocme
Máy hút sữa không dây Moaz BéBé MB – 052,2.599.000₫,https://tiki.vn/may-hut-sua-khong-day-moaz-bebe-mb-052-p216394918.html?spid=216394919,15,,,chamsocme
"Medela - Van trắng bình sữa cho trẻ bú yếu, hở hàm ếch, sinh non thiếu tháng",60.000₫,https://tiki.vn/medela-van-trang-binh-sua-cho-tre-bu-yeu-ho-ham-ech-sinh-non-thieu-thang-p176945930.html?spid=176945931,16,,,chamsocme
Hộp 20 Túi Trữ Sữa Mẹ Kuku KU5447 (160ml),170.050₫,https://tiki.vn/hop-20-tui-tru-sua-me-kuku-ku5447-160ml-p440523.html?spid=46910224,17,,,chamsocme
"Nút Chuyển Đổi Maymom, Giúp Chặn Sữa Ngắn Thành Chặn Sữa Dài, Kết Nối Được Với Cổ Nối Phễu Cổ Hẹp - 1 cái",88.000₫,https://tiki.vn/nut-chuyen-doi-maymom-giup-chan-sua-ngan-thanh-chan-sua-dai-ket-noi-duoc-voi-co-noi-pheu-co-hep-1-cai-p11607374.html?spid=11607375,18,,,chamsocme
"Gel vệ sinh phụ nữ Lotuphil 125ml, Làm sạch và hết mùi hôi - Hàng Chính Hãng",68.000₫,https://tiki.vn/gel-ve-sinh-phu-nu-lotuphil-lotus-pharma-125ml-p101971349.html?spid=101971350,19,,Đã bán 4,chamsocme
Máy Hút Sữa Điện Đôi Cimilre S5,4.015.000₫,https://tiki.vn/may-hut-sua-dien-doi-cimilre-s5-p3667939.html?spid=4404125,20,,,chamsocme
Quần Lót Bầu Cạp Chéo,45.000₫,https://tiki.vn/quan-lot-bau-cap-cheo-p83032985.html?spid=83033015,21,,Đã bán 1,chamsocme
Combo Ghế xông hơi vùng kín váy xông hơi và thảo dược xông hơi vùng kín,440.000₫,https://tiki.vn/combo-ghe-xong-hoi-vung-kin-vay-xong-hoi-va-thao-duoc-xong-hoi-vung-kin-p23377908.html?spid=23377909,22,,Đã bán 29,chamsocme
Gối Ôm Chữ U Đa Năng Cho Bà Bầu Berry Xanh Blue,490.000₫,https://tiki.vn/goi-om-chu-u-da-nang-cho-ba-bau-berry-xanh-blue-p47255637.html?spid=47255638,23,,Đã bán 31,chamsocme
Áo lót bầu và cho con bú chống chảy xệ,100.000₫,https://tiki.vn/ao-lot-bau-va-cho-con-bu-chong-chay-xe-p23878777.html?spid=23878793,24,,Đã bán 68,chamsocme
"Gối cho bé bú kê tay Rototo Bebe - Gối bú sữa giúp bố, mẹ đỡ mỏi tay",520.000₫,https://tiki.vn/goi-cho-be-bu-ke-tay-rototo-bebe-goi-bu-sua-giup-bo-me-do-moi-tay-p52178168.html?spid=52178170,25,,Đã bán 13,chamsocme
"Gối bầu cánh tiên cao cấp, giúp nâng đỡ bụng bầu giảm đau lưng, vải cotton satin hàn quốc mềm mát",229.000₫,https://tiki.vn/goi-bau-canh-tien-cao-cap-giup-nang-do-bung-bau-giam-dau-lung-vai-cotton-satin-han-quoc-mem-mat-p248543596.html?spid=248543626,26,,Đã bán 2,chamsocme
MÁY HÚT SỮA ĐIỆN ĐÔI RESONANCE 3 PLUS + FB1161VN,1.827.000₫,https://tiki.vn/may-hut-sua-dien-doi-resonance-3-plus-fb1161vn-p175154612.html?spid=177340497,27,,,chamsocme
Túi Trữ Sữa Cảm Ứng Nhiệt Mother-K Hàn Quốc KM13066 - 30 Cái,229.000₫,https://tiki.vn/tui-tru-sua-cam-ung-nhiet-mother-k-han-quoc-km13066-30-cai-p491418.html?spid=1103520,28,,Đã bán 12,chamsocme
Áo Lót Bầu cho con bú Không Gọng Viền Su Cài Khóa Trước Phối Ren Thoáng Khí,79.000₫,https://tiki.vn/ao-lot-bau-cho-con-bu-khong-gong-vien-su-cai-khoa-truoc-phoi-ren-thoang-khi-p270702240.html?spid=270702250,29,,Đã bán 2,chamsocme
"Túi giữ nhiệt đựng hộp cơm, bảo quản sữa mẹ chống thấm cao cấp",75.000₫,https://tiki.vn/tui-giu-nhiet-dung-hop-com-bao-quan-sua-me-chong-tham-cao-cap-p83525305.html?spid=83525318,30,,,chamsocme
Đai Hỗ trợ thoát vị đĩa đệm và cột sống lưng DR-B021 Sản xuất tại Hàn Quốc,780.000₫,https://tiki.vn/dai-ho-tro-thoat-vi-dia-dem-va-cot-song-lung-dr-b021-san-xuat-tai-han-quoc-p91129788.html?spid=91129804,31,,Đã bán 2,chamsocme
[MUA 3 TẶNG 1] Combo áo lót sau sinh và cho con bú- Sunbaby,124.000₫,https://tiki.vn/combo-bo-ao-lot-sau-sinh-va-cho-con-bu-sunaby-p21715511.html?spid=21715541,32,,Đã bán 177,chamsocme
Máy hút sữa cầm tay BEREX cổ rộng 150ml,420.000₫,https://tiki.vn/may-hut-sua-cam-tay-berex-co-rong-150ml-p71102592.html?spid=71102593,33,,Đã bán 4,chamsocme
Áo hút sữa rảnh tay,200.000₫,https://tiki.vn/ao-hut-sua-ranh-tay-p83682501.html?spid=83682512,34,,Đã bán 2,chamsocme
Balo Bỉm Sữa Giữ nhiệt cao cấp Cho Mẹ Và Bé,215.000₫,https://tiki.vn/balo-bim-sua-giu-nhiet-cao-cap-cho-me-va-be-p55240465.html?spid=133162600,35,,,chamsocme
"Lều Xông Hơi Tại Nhà Sau Sinh Cao Cấp - Lều Xông Hơi Toàn Thân Tự Bung Chống Thấm Tốt, Độ Bền Cao",249.000₫,https://tiki.vn/leu-xong-hoi-tai-nha-sau-sinh-cao-cap-leu-xong-hoi-toan-than-tu-bung-chong-tham-tot-do-ben-cao-p128152437.html?spid=128152442,36,,Đã bán 6,chamsocme
Unilove Vỏ gối đa năng 7 trong 1 cho mẹ bầu và em bé Hopo,890.000₫,https://tiki.vn/hopo-vo-goi-thay-the-goi-da-nang-cho-me-va-be-unilove-p272162198.html?spid=272162206,37,,,chamsocme
Balo Đa Năng Đựng Đồ Bỉm Sữa Gọn Gàng Cho Mẹ Và Bé Siêu Hot BL24,98.700₫,https://tiki.vn/balo-da-nang-dung-do-bim-sua-gon-gang-cho-me-va-be-sieu-hot-bl24-p48544741.html?spid=77633648,38,,,chamsocme
"Lều Xông Hơi Tại Nhà Sau Sinh Cao Cấp - Lều Xông Hơi Toàn Thân Tự Bung Chống Thấm Tốt, Độ Bền Cao",349.000₫,https://tiki.vn/leu-xong-hoi-tai-nha-sau-sinh-cao-cap-leu-xong-hoi-toan-than-tu-bung-chong-tham-tot-do-ben-cao-p129502302.html?spid=129502303,39,,Đã bán 5,chamsocme
Combo 2 hộp miếng dán tan mỡ bụng MyMi Wonder Patch( 1 hộp 5 miếng),54.000₫,https://tiki.vn/combo-2-hop-mieng-dan-tan-mo-bung-mymi-wonder-patch-1-hop-5-mieng-p72030009.html?spid=121162688,40,,Đã bán 3,chamsocme
