title,price,link_item,index,discount,sales,category
Quần Legging,120.000₫,https://tiki.vn/quan-legging-p174650544.html?spid=174650545,1,,,quannu
"Quần đùi mặc nhà nữ, quần short cotton nữ siêu mát có túi quần",59.000₫,https://tiki.vn/quan-dui-mac-nha-nu-quan-short-cotton-nu-sieu-mat-co-tui-quan-p201907244.html?spid=201907286,2,,,quannu
Quần Sooc Quần Short Nữ Vải Xước X.0 Hàn Chất Vải Thoáng Mát Phong Cách Thời Trang Hàn Quốc 621,55.000₫,https://tiki.vn/quan-sooc-quan-short-nu-vai-xuoc-x-0-han-chat-vai-thoang-mat-phong-cach-thoi-trang-han-quoc-621-p183750269.html?spid=183750417,3,-43%,Đã bán 2,quannu
"Quần sọc caro ống rộng - Sọc xanh,Freesize từ40-58kg",100.000,https://tiki.vn/quan-soc-caro-ong-rong-p126678766.html?spid=126678780,4,,,quannu
,,https://tiki.vn/quan-dui-lung-thun-quan-lung-thun-quan-lung-9-tac-lovi-p179539970.html?spid=179539978,5,,,quannu
quần short cạp cao,60.000₫,https://tiki.vn/quan-short-cap-cao-p111748618.html?spid=111748648,6,,Đã bán 2,quannu
Quần baggy kaki SIB Clothing ống rộng nam nữ unisex SIB040,129.000₫,https://tiki.vn/quan-baggy-kaki-sib-clothing-ong-rong-nam-nu-unisex-sib040-p159245009.html?spid=159245043,7,,,quannu
Quần đùi nữ - quần short chất thô mềm mát,69.500₫,https://tiki.vn/quan-dui-nu-quan-short-chat-tho-mem-mat-p115133234.html?spid=104665141,8,,,quannu
"Quần yếm jean nữ( có ảnh thật ) dây phối kiểu mới ( size : S, M, L )vải jean mịn, mẫu siêu thời trang d3",125.000,https://tiki.vn/quan-yem-jean-nu-co-anh-that-day-phoi-kieu-moi-size-s-m-l-vai-jean-min-mau-sieu-thoi-trang-d3-p111069868.html?spid=111069909,9,,,quannu
,,https://tiki.vn/quan-ong-loe-chat-poly-han-mau-nau-trendy-hack-dang-nang-mong-ong-ru-de-mix-do-di-hoc-di-choi-p195541733.html?spid=195541743,10,,,quannu
Quần tây baggy xám ghi nhạt công sở hot hit,123.500₫,https://tiki.vn/quan-tay-baggy-xam-ghi-nhat-cong-so-hot-hit-p90193632.html?spid=90193748,11,,Đã bán 3,quannu
Quần đùi lửng vải thông hơi sịn co giãn thoáng mát,95.000₫,https://tiki.vn/quan-dui-lung-vai-thong-hoi-sin-co-gian-thoang-mat-p158757332.html?spid=158757404,12,,Đã bán 1,quannu
,,https://tiki.vn/quan-cong-so-ong-rong-ke-khoa-suon-lich-su-kieu-moi-p90193646.html?spid=90193824,13,,,quannu
"Quần Baggy Công Sở, Quần nữ cạp cao đủ size từ 40- 65kg",145.000₫,https://tiki.vn/quan-baggy-cong-so-quan-nu-cap-cao-du-size-tu-40-65kg-p138360663.html?spid=138360708,14,,,quannu
VIPÁSSI Quần Short Cotton Sọc Lưng Thun Dây Rút Túi Xẻ Họa Tiết Ren,330.000₫,https://tiki.vn/vipassi-quan-short-cotton-soc-lung-thun-day-rut-tui-xe-hoa-tiet-ren-p272283931.html?spid=272283940,15,,,quannu
"Quần short nữ SBORG quần đùi chất vải tapta trơn cao cấp có túi dễ thương cute đáng yêu có túi freesize dưới 55kg quà tặng vợ, thoải mái thuận tiện đi chơi với bạn bè",185.000₫,https://tiki.vn/quan-short-nu-sborg-quan-dui-chat-vai-tapta-tron-cao-cap-co-tui-de-thuong-cute-dang-yeu-co-tui-freesize-duoi-55kg-qua-tang-vo-thoai-mai-thuan-tien-di-choi-voi-ban-be-p122260252.html?spid=122260278,16,,,quannu
"Quần jeans nữ cạp cao dáng dài ống rộng, thiết kế rách đùi bụi bậm, thời trang phong cách Hàn Quốc",79.000₫,https://tiki.vn/quan-jeans-nu-cap-cao-dang-dai-ong-rong-thiet-ke-rach-dui-bui-bam-thoi-trang-phong-cach-han-quoc-p129828331.html?spid=129828468,17,,,quannu
,,https://tiki.vn/quan-short-jean-lai-cuon-lat-lai-tui-hop-cung-xiu-from-chuan-phoi-do-hoi-bi-ngau-p248801690.html?spid=248801696,18,,,quannu
Quần ống rộng khóa trước hot nhất năm 2021,89.000₫,https://tiki.vn/quan-ong-rong-khoa-truoc-hot-nhat-nam-2021-p109659118.html?spid=109659140,19,,Đã bán 32,quannu
Quần sooc đùi nữ cạp cao 6 cúc _ SN006,65.000₫,https://tiki.vn/quan-sooc-dui-nu-cap-cao-6-cuc-_-sn006-p93601827.html?spid=93601838,20,,Đã bán 1,quannu
Quần ống rộng công sở cạp cao tôn dáng khoá sườn,79.000₫,https://tiki.vn/quan-ong-rong-cong-so-cap-cao-ton-dang-khoa-suon-p93600491.html?spid=93601330,21,,Đã bán 2,quannu
QUẦN SỚ CÔNG SỞ ỐNG RỘNG,79.000₫,https://tiki.vn/quan-so-cong-so-ong-rong-p93603077.html?spid=93603250,22,,,quannu
Quần đũi phối lưới bo gấu,69.000₫,https://tiki.vn/quan-dui-phoi-luoi-bo-gau-p93598810.html?spid=93598878,23,,,quannu
Quần tất lót nỉ mỏng Gys giữ nhiệt siêu ấm - Quần legging xuất Nhật 3 màu,95.000₫,https://tiki.vn/quan-tat-lot-ni-mong-gys-giu-nhiet-sieu-am-quan-legging-xuat-nhat-3-mau-p270298436.html?spid=270298440,24,,Đã bán 1,quannu
Quần Jean Xanh Thẫm Chất Dày Dặn Rách Nhẹ From Đẹp Tôn Dáng Thời Trang,70.000₫,https://tiki.vn/quan-jean-xanh-tham-chat-day-dan-rach-nhe-from-dep-ton-dang-thoi-trang-p272529496.html?spid=272529497,25,,,quannu
,,https://tiki.vn/quan-short-nu-kieu-2nddate-tr011w-p187826907.html?spid=187826909,26,,,quannu
"Quần Tây Nữ Công Sở Cao Cấp LUPERI LFQD2117 Khóa Sườn, Cạp Cao Tôn Dáng, Phong Cách Thanh Lịch",435.000₫,https://tiki.vn/quan-tay-nu-cong-so-cao-cap-luperi-lfqd2117-khoa-suon-cap-cao-ton-dang-phong-cach-thanh-lich-p163563731.html?spid=163563764,27,,Đã bán 11,quannu
"Quần jean nữ Lưng Cao Julido Store, chất jean co dãn 4 chiều ống ôm chân mẫu Ms505",159.000₫,https://tiki.vn/quan-jean-nu-lung-cao-julido-store-chat-jean-co-dan-4-chieu-ong-om-chan-mau-ms505-p179409785.html?spid=179409795,28,,Đã bán 4,quannu
Quần ống loe 4Lova nữ lưng cạp cao co giãn form đẹp legging bigsize chất cotton dày dặn dáng dài Q13,165.000₫,https://tiki.vn/quan-ong-loe-4lova-nu-lung-cap-cao-co-gian-form-dep-legging-bigsize-chat-cotton-day-dan-dang-dai-q13-p198352492.html?spid=198352663,29,,,quannu
Quần đùi nữ ống loe lưng cao siêu mềm mại thoáng mát Lylylorem QL145,300.000,https://tiki.vn/quan-dui-nu-ong-loe-lung-cao-sieu-mem-mai-thoang-mat-lylylorem-ql145-p189641346.html?spid=189641348,30,,Đã bán 1,quannu
,,https://tiki.vn/quan-jeans-rach-phong-cach-j63-p271129065.html?spid=271129071,31,,,quannu
QUẦN JEAN NỮ QUẦN BÒ LOE RÁCH GẤU SIÊU CO DÃN 461,98.000₫,https://tiki.vn/quan-jean-nu-quan-bo-loe-rach-gau-sieu-co-dan-461-p192421939.html?spid=192422022,32,,,quannu
Quần đùi bò giấy cạp cao - gen bụng 2 màu đen trắng có BIGSIZE,84.000₫,https://tiki.vn/quan-dui-bo-giay-cap-cao-gen-bung-2-mau-den-trang-co-bigsize-p270790736.html?spid=270790738,33,,,quannu
Quần Dài Ống Rộng Nữ họa tiết siêu hot,75.500₫,https://tiki.vn/quan-dai-ong-rong-nu-hoa-tiet-sieu-hot-p249256639.html?spid=249256693,34,,,quannu
QUẦN ỐNG RỘNG LƯNG CAO CÁ TÍNH THEO PHONG CÁCH HÀN QUỐC CHÂN DÀI MIÊN MAN THỜI TRANG,83.000₫,https://tiki.vn/quan-ong-rong-lung-cao-ca-tinh-theo-phong-cach-han-quoc-chan-dai-mien-man-thoi-trang-p194444436.html?spid=194444558,35,,,quannu
,,https://tiki.vn/quan-dai-linen-nu-cao-cap-p207761539.html?spid=207761583,36,,,quannu
Quần Ống Rộng Dáng Suông Âu Tà Bong Dây Vắt Chất Tuytsi Cao Cấp 53QDS2016ST,580.000₫,https://tiki.vn/quan-ong-rong-dang-suong-au-ta-bong-day-vat-chat-tuytsi-cao-cap-53qds2016st-p263394594.html?spid=263394598,37,,,quannu
Quần suông nữ ống đứng,220.000₫,https://tiki.vn/quan-suong-nu-ong-dung-p190605902.html?spid=190605924,38,,,quannu
"Quần đùi nữ 2 lớp ĐI BIỂN, ĐI BƠI, THỂ DỤC, THỂ THAO cho nữ đủ màu",129.000₫,https://tiki.vn/quan-dui-nu-2-lop-di-bien-di-boi-the-duc-the-thao-cho-nu-du-mau-p172669540.html?spid=172669613,39,,Đã bán 1,quannu
Quần Suông Nữ Thời Trang HNOSS Phối Lai Nẹp Trụ HNQDA021,199.000,https://tiki.vn/quan-suong-nu-thoi-trang-hnoss-phoi-lai-nep-tru-hnqda021-p204988872.html?spid=204988889,40,,,quannu
