title,price,link_item,index,discount,sales,category
Quần lót nữ chất liệu lưới thoáng khí nhiều màu mã QL12,52.000₫,https://tiki.vn/quan-lot-nu-chat-lieu-luoi-thoang-khi-nhieu-mau-ma-ql12-p188837389.html?spid=188837397,1,-14%,Đã bán 4,dolotnu
Áo Lót Nữ Áo Ngực Nữ Su Đúc Không Gọng Nâng Ngực Thông Hơi Không Hằn Mỡ Cao Cấp,15.500₫,https://tiki.vn/ao-lot-nu-ao-nguc-nu-su-duc-khong-gong-nang-nguc-thong-hoi-khong-han-mo-cao-cap-al2-p191500992.html?spid=191501017,2,-55%,Đã bán 44,dolotnu
Quần Lót Băng Lụa Siêu Mỏng Không Đường May P344,38.000₫,https://tiki.vn/quan-lot-bang-lua-sieu-mong-khong-duong-may-p344-p84821877.html?spid=242716408,3,-55%,Đã bán 7,dolotnu
"Miếng Ren Yếm che Áo Ngực Tiện Dụng Loạt Xịn, chất ren mềm mịn, co dãn mát mẻ, áo lót định hình, áo ngực đa năng",41.000₫,https://tiki.vn/mieng-ren-yem-che-ao-nguc-tien-dung-loat-xin-chat-ren-mem-min-co-dan-mat-me-ao-lot-dinh-hinh-ao-nguc-da-nang-p207760030.html?spid=207759509,4,-30%,Đã bán 10,dolotnu
Combo 10 Quần Lót Nữ Modal Trơn Comfort BCS-04 - Giao màu ngẫu nhiên,359.000₫,https://tiki.vn/combo-10-quan-lot-nu-modal-tron-comfort-bcs-04-giao-mau-ngau-nhien-p73278835.html?spid=73278837,5,-32%,Đã bán 145,dolotnu
Combo 4 Quần Lót Nữ Lưng Cao Modal Phối Ren Active Miley Lingerie FDS0125-0225-0925-1225 - Giao màu ngẫu nhiên,171.000₫,https://tiki.vn/combo-4-quan-lot-nu-lung-cao-modal-phoi-ren-active-miley-lingerie-fds0125-0225-0925-1225-giao-mau-ngau-nhien-p58255254.html?spid=58255262,6,-29%,Đã bán 392,dolotnu
Bộ 10 Quần Lót Nữ Thun Lạnh Fashion Miley Lingerie - BMS_01 - Giao Màu Ngẫu Nhiên,553.000₫,https://tiki.vn/bo-10-quan-lot-nu-thun-lanh-fashion-miley-lingerie-bms_01-giao-mau-ngau-nhien-p13745082.html?spid=56330603,7,-39%,Đã bán 575,dolotnu
Combo 2 Quần Lót Nữ Lưng Cao Modal Phối Ren Active Miley Lingerie FDS0925-1425,122.000₫,https://tiki.vn/combo-2-quan-lot-nu-lung-cao-modal-phoi-ren-active-miley-lingerie-mau-da-kem-fds0925-1425-p58230363.html?spid=58230369,8,-64%,Đã bán 87,dolotnu
"Hộp 5 Đôi 10 Miếng Dán Ti, Dán Ti Silicon Sử Dụng Nhiều Lần Dính Cực Chắc DT01",113.000₫,https://tiki.vn/hop-5-doi-10-mieng-dan-ti-dan-ti-silicon-su-dung-nhieu-lan-dinh-cuc-chac-dt01-p106002718.html?spid=106002720,9,-50%,Đã bán 511,dolotnu
Quần Lót Đùi Nữ Su Đúc Mặc Trong Váy - Không Đường May. Không Lộ Viền. Nhiều size từ 40 - 70kg,32.000₫,https://tiki.vn/quan-lot-dui-nu-su-duc-mac-trong-vay-khong-duong-may-khong-lo-vien-nhieu-size-tu-40-70kg-p142322427.html?spid=183677391,10,-68%,Đã bán 71,dolotnu
Quần lót nữ thun lạnh iBasic V199-3,42.000₫,https://tiki.vn/quan-lot-nu-thun-lanh-ibasic-v199-3-p143861102.html?spid=143861136,11,-58%,Đã bán 92,dolotnu
Áo bralette ren iBasic BRAY042,129.000₫,https://tiki.vn/ao-bralette-ren-ibasic-bray042-p176021615.html?spid=176021667,12,-6%,Đã bán 121,dolotnu
"Combo 5 Quần Lót Nữ Thun Lạnh Phối Ren Atuner QL012, Hàng Đẹp, Co Giãn Đàn Hồi Tốt - Hàng Chính Hãng",170.000₫,https://tiki.vn/combo-5-quan-lot-nu-thun-lanh-phoi-ren-atuner-ql012-hang-dep-co-gian-dan-hoi-tot-hang-chinh-hang-p74039214.html?spid=74039218,13,-35%,Đã bán 143,dolotnu
Áo ngực có gọng mút vừa cup demi hoạ tiết iBasic BRAW150,159.000₫,https://tiki.vn/ao-nguc-co-gong-mut-vua-cup-demi-hoa-tiet-ibasic-braw150-p195436263.html?spid=195436269,14,-51%,Đã bán 33,dolotnu
Bộ 4 quần lót nữ ren sexy Miley Lingerie FLS_06,189.000₫,https://tiki.vn/bo-4-quan-lot-nu-ren-sexy-miley-lingerie-fls_06-p7776892.html?spid=7776894,15,-26%,Đã bán 72,dolotnu
"Quần Lót Nữ, Quần Gen Nịt Bụng Eo Thon, Quần Ghen Chống Cuộn Cạp Cao Giảm Eo Và Mỡ Bụng Sau Sinh QG3",121.000₫,https://tiki.vn/quan-lot-nu-quan-gen-nit-bung-eo-thon-quan-ghen-chong-cuon-cap-cao-giam-eo-va-mo-bung-sau-sinh-qg3-p105657199.html?spid=105657205,16,-21%,Đã bán 416,dolotnu
"Áo lót nữ cotton không gọng đệm mỏng cao cấp, áo lót nữ sinh",68.000₫,https://tiki.vn/ao-lot-nu-cotton-khong-gong-dem-mong-cao-cap-ao-lot-nu-sinh-p143117503.html?spid=143117521,17,-25%,Đã bán 113,dolotnu
Combo 5 Quần Lót Nữ Modern Brief Miley Lingerie BC042 - Màu Ngẫu Nhiên,192.000₫,https://tiki.vn/combo-5-quan-lot-nu-modern-brief-miley-lingerie-bc042-mau-ngau-nhien-p979203.html?spid=4722033,18,-50%,Đã bán 95,dolotnu
Quần lót lọt khe MIUHOME đúc su viền cạp ép Angel không đường may,29.000₫,https://tiki.vn/quan-lot-lot-khe-miuhome-duc-su-vien-cap-ep-angel-khong-duong-may-p270805621.html?spid=270805635,19,-45%,Đã bán 21,dolotnu
"Quần Độn Mông Nữ, Quần Độn Mông Lưng Ren Thông Hơi Siêu Thoáng Mát Mềm Mại Thương Hiệu Baw DM01",139.000₫,https://tiki.vn/quan-don-mong-nu-quan-don-mong-lung-ren-thong-hoi-sieu-thoang-mat-mem-mai-thuong-hieu-baw-dm01-p166533565.html?spid=166533579,20,-41%,Đã bán 111,dolotnu
Quần Lót Nữ Băng Lụa Siêu Mỏng Nhẹ Thoáng Khí Nhanh Khô P529,38.000₫,https://tiki.vn/quan-lot-nu-bang-lua-sieu-mong-nhe-thoang-khi-nhanh-kho-p529-p221237084.html?spid=221237092,21,-24%,Đã bán 140,dolotnu
"Áo Ngực - Áo Lót Định Hình Bản To Chống Hằn,Giảm Mỡ Lưng, Không Gọng Nâng Ngực Chống Chảy Xệ Hàng Cao Cấp",159.000₫,https://tiki.vn/ao-nguc-ao-lot-dinh-hinh-ban-to-chong-han-giam-mo-lung-khong-gong-nang-nguc-chong-chay-xe-hang-cao-cap-p129427556.html?spid=129427581,22,-60%,Đã bán 141,dolotnu
"Quần lót nữ sexy, lọt khe gợi cảm màu đen",25.000₫,https://tiki.vn/quan-lot-nu-sexy-lot-khe-goi-cam-mau-den-p39159456.html?spid=50328607,23,-16%,Đã bán 231,dolotnu
Quần đùi mặc bên trong váy quần lót đùi viền ren hàng Việt Nam cao cấp,35.000₫,https://tiki.vn/quan-dui-mac-ben-trong-vay-quan-lot-dui-vien-ren-hang-viet-nam-cao-cap-p120858121.html?spid=120858361,24,-10%,Đã bán 108,dolotnu
"Bộ Đồ Lót Nữ Phối Ren, Áo Ngực Đệm Dày Nâng Ngực Tạo Khe Siêu Quyến Rũ Thương Hiêu Baw mã AN35",158.000₫,https://tiki.vn/bo-do-lot-nu-phoi-ren-ao-nguc-dem-day-nang-nguc-tao-khe-sieu-quyen-ru-thuong-hieu-baw-ma-an35-p97678516.html?spid=97678544,25,-41%,Đã bán 158,dolotnu
"Bộ 5 Quần Lót Nữ Cotton Lót May Chống Viêm, Quần Chip Nữ Kháng Khuẩn Cao Cấp Thương Hiệu BAW NT737",149.000₫,https://tiki.vn/bo-5-quan-lot-nu-cotton-lot-may-chong-viem-quan-chip-nu-khang-khuan-cao-cap-thuong-hieu-baw-nt737-p97732361.html?spid=97732363,26,-40%,Đã bán 151,dolotnu
"Áo lót Wacoal ISFB332 không gọng, nâng đẩy, ren, chống chảy xệ - Lecien",349.500₫,https://tiki.vn/ao-lot-wacoal-isfb332-khong-gong-nang-day-ren-chong-chay-xe-lecien-p270196820.html?spid=270196824,27,-36%,Đã bán 7,dolotnu
Quần lót lọt khe nữ C56 – Quần lọt khe ren sexy - Quần chíp ren sexy - Quần lót lọt khe nữ sexy - Quần lót nữ xẻ dáy,31.200₫,https://tiki.vn/quan-lot-lot-khe-nu-c56-quan-lot-khe-ren-sexy-quan-chip-ren-sexy-quan-lot-lot-khe-nu-sexy-quan-lot-nu-xe-day-p85904779.html?spid=85904796,28,-50%,Đã bán 137,dolotnu
"Quần lót nữ cotton trơn cạp cao Vicci 105 ôm gọn vòng 3, mềm mại, thấm hút mồ hôi, kháng khuẩn, khử mùi (có bigsize)",36.000₫,https://tiki.vn/quan-lot-nu-cotton-tron-cap-cao-vicci-105-om-gon-vong-3-mem-mai-tham-hut-mo-hoi-khang-khuan-khu-mui-co-bigsize-p263974964.html?spid=263974998,29,-20%,Đã bán 73,dolotnu
Áo ngực GOMTAT mút xốp bàn tay siêu nâng ngực chống xệ - AOSU-005,59.000₫,https://tiki.vn/ao-nguc-gomtat-mut-xop-ban-tay-sieu-nang-nguc-chong-xe-aosu-005-p253272137.html?spid=253272161,30,,Đã bán 5,dolotnu
Quần Mặc Váy Cho Bạn Gái 2 Lớp,61.000₫,https://tiki.vn/quan-mac-vay-cho-ban-gai-2-lop-p194448419.html?spid=194448423,31,,Đã bán 40,dolotnu
Áo ngực có gọng mút mỏng trơn iBasic BRAW020-1,199.000₫,https://tiki.vn/ao-nguc-co-gong-mut-mong-tron-ibasic-braw020-1-p182544904.html?spid=247856346,32,,Đã bán 15,dolotnu
Cặp Miếng Dán Ngực Miley Lingerie GSB0100,21.000₫,https://tiki.vn/cap-mieng-dan-nguc-miley-lingerie-gsb0100-p178062830.html?spid=178062831,33,,Đã bán 254,dolotnu
Quần lót nữ mặc váy không đường may bonding iBasic V187,89.000₫,https://tiki.vn/quan-lot-nu-mac-vay-khong-duong-may-bonding-ibasic-v187-p194406809.html?spid=194406811,34,,Đã bán 53,dolotnu
"Áo lót nữ nâng ngực mút mỏng Triumph 2475 có gọng, cúp quả sâu, rộng bản lưng to 4 móc dành cho người ngực lớn",729.000₫,https://tiki.vn/ao-lot-nu-nang-nguc-mut-mong-triumph-2475-co-gong-cup-qua-sau-rong-ban-lung-to-4-moc-danh-cho-nguoi-nguc-lon-p215601923.html?spid=215601935,35,,Đã bán 11,dolotnu
Áo ngực học sinh tròng cổ viền ren iBasic BRAT005,129.000₫,https://tiki.vn/ao-nguc-hoc-sinh-trong-co-vien-ren-ibasic-brat005-p157059924.html?spid=157059928,36,,Đã bán 79,dolotnu
Áo Ngực Sớ Gỗ Không Gọng Lưng Logo Sporty Chic Miley Lingerie BRW,199.000₫,https://tiki.vn/ao-nguc-so-go-khong-gong-lung-logo-sporty-chic-miley-lingerie-brw-p72225788.html?spid=72225806,37,,Đã bán 52,dolotnu
"Áo lót nữ nâng ngực tạo khe Triumph 623-039 cúp xéo có gọng, đệm mút dày giúp nâng và định hình ngực tối đa (Da - Be)",549.000₫,https://tiki.vn/ao-lot-nu-nang-nguc-tao-khe-triumph-623-039-cup-xeo-co-gong-dem-mut-day-giup-nang-va-dinh-hinh-nguc-toi-da-da-be-p189931703.html?spid=189931718,38,,Đã bán 36,dolotnu
Bộ 2 Quần Lót Nữ Melagne Sporty Chic Miley Lingerie FCB_0700_1000,116.000₫,https://tiki.vn/bo-2-quan-lot-nu-melagne-sporty-chic-miley-lingerie-fcb_0700_1000-p21102753.html?spid=21102757,39,,Đã bán 40,dolotnu
"Combo 6 Bao Quần Lót Tiện Lợi TRAVEL-MATE Nữ, 5 Cái/Bao",130.000₫,https://tiki.vn/combo-6-quan-lot-tien-loi-travel-mate-nu-5-cai-bao-p271390708.html?spid=271390710,40,,Đã bán 20,dolotnu
