title,price,link_item,index,discount,sales,category
Váy Đầm Công Chúa Bé Gái Cao trắng tay lỡ 001,310.000₫,https://tiki.vn/vay-dam-cong-chua-be-gai-cao-trang-tay-lo-001-p167345293.html?spid=167345326,1,-11%,Đã bán 14,thoitrangmevabe
Bộ quần áo bộ đội trẻ em kèm nón tai bèo,140.000₫,https://tiki.vn/bo-quan-ao-bo-doi-tre-em-kem-non-tai-beo-p181785903.html?spid=181785917,2,-50%,Đã bán 15,thoitrangmevabe
Áo dài cách tân đỏ cho bé gái diện Tết thêu Hoa chất gấm,165.000₫,https://tiki.vn/ao-dai-cach-tan-do-cho-be-gai-dien-tet-theu-hoa-chat-gam-p76054643.html?spid=76054645,3,-10%,Đã bán 25,thoitrangmevabe
"Bộ bé trai công tử, set sơmi quần âu kèm dây đai lịch lãm, dùng cho sinh nhật, sự kiện, dịp lễ tết | MB10",330.000₫,https://tiki.vn/bo-be-trai-cong-tu-set-somi-quan-au-kem-day-dai-lich-lam-dung-cho-sinh-nhat-su-kien-dip-le-tet-mb10-p66608827.html?spid=74218245,4,-20%,Đã bán 19,thoitrangmevabe
Sandal Eva Phun Bé Gái Biti's BEG001500TRG (Trắng),319.000₫,https://tiki.vn/sandal-eva-phun-be-gai-biti-s-beg001500trg-trang-p273472584.html?spid=273472600,5,-47%,Đã bán 3,thoitrangmevabe
Mũ Len Trùm Đầu Kèm Khăn Quàng Cổ Hình Gấu Trúc Đáng Yêu Cho Bé Từ 1-4 Tuổi,55.000₫,https://tiki.vn/mu-len-trum-dau-kem-khan-quang-co-hinh-gau-truc-dang-yeu-cho-be-tu-1-4-tuoi-p201081843.html?spid=201081851,6,-38%,Đã bán 13,thoitrangmevabe
Dép sục cheerful mario cho bé gái 1 - 6 tuổi D34,119.000₫,https://tiki.vn/dep-suc-cheerful-mario-cho-be-gai-1-6-tuoi-d34-p58088968.html?spid=95057202,7,-38%,Đã bán 80,thoitrangmevabe
"Nón kết cho bé trai cao cấp logo chữ Z, chất liệu vải kaki cao cấp oát mềm mại, dành cho bé từ 5 đến 10 tuổi",156.000₫,https://tiki.vn/non-ket-cho-be-trai-cao-cap-logo-chu-z-chat-lieu-vai-kaki-cao-cap-oat-mem-mai-danh-cho-be-tu-5-den-10-tuoi-p66578487.html?spid=160813359,8,-5%,Đã bán 10,thoitrangmevabe
Che thóp cho bé sơ sinh,10.000₫,https://tiki.vn/che-thop-cho-be-so-sinh-p101253994.html?spid=101253996,9,-13%,Đã bán 21,thoitrangmevabe
Quần áo trẻ em (combo 5 bộ quần áo sơ sinh quần áo trẻ sơ sinh như hình),118.000₫,https://tiki.vn/quan-ao-tre-em-combo-5-bo-quan-ao-so-sinh-quan-ao-tre-so-sinh-nhu-hinh-p114682265.html?spid=114682325,10,-10%,Đã bán 37,thoitrangmevabe
Giày búp bê bé gái giày đi học bé gái da mềm đế êm THQ122,169.000₫,https://tiki.vn/giay-bup-be-be-gai-giay-di-hoc-be-gai-da-mem-de-em-thq122-p251997827.html?spid=251997865,11,-50%,Đã bán 3,thoitrangmevabe
️️ Giày thể thao sneaker cho bé trai thời trang 21192,150.000₫,https://tiki.vn/freeship-giay-the-thao-sneaker-cho-be-trai-thoi-trang-21192-p161873557.html?spid=161873889,12,-50%,Đã bán 1,thoitrangmevabe
Giày Thể Thao Bé Gái Biti's BSG002400TRG (Trắng),457.000₫,https://tiki.vn/giay-the-thao-be-gai-biti-s-bsg002400trg-trang-p270859994.html?spid=270860004,13,-40%,Đã bán 4,thoitrangmevabe
"Bộ đồ bộ bé gái Cánh Tiên chất vải tole, lanh 2 da mềm, min, thoáng mát - Giao màu ngẫu nhiên",42.000₫,https://tiki.vn/bo-do-bo-be-gai-canh-tien-chat-vai-tole-lanh-2-da-mem-min-thoang-mat-giao-mau-ngau-nhien-p72093920.html?spid=72093922,14,,Đã bán 631,thoitrangmevabe
[Kèm Video] Mắt Kính Trẻ Em SiPU Chính Hãng Cao Cấp MK26 Chống UV400 + Chống gãy - Bé Trai Bé Gái (Kèm Hộp Ô Tô),169.000₫,https://tiki.vn/kem-video-mat-kinh-tre-em-sipu-chinh-hang-cao-cap-mk26-chong-uv400-chong-gay-be-trai-be-gai-kem-hop-o-to-p193274042.html?spid=193274046,15,,Đã bán 13,thoitrangmevabe
Giày nhựa trẻ em Crocs Classic Lightning - 208307-001,548.000₫,https://tiki.vn/giay-nhua-tre-em-crocs-classic-lightning-208307-001-p270497852.html?spid=270497860,16,,Đã bán 1,thoitrangmevabe
Băng đô/ Cài nơ đỏ Bạch tuyết dễ thương cho bé gái,25.000₫,https://tiki.vn/bang-do-cai-no-do-bach-tuyet-de-thuong-cho-be-gai-p248943810.html?spid=248943816,17,,Đã bán 5,thoitrangmevabe
"SEC 03 QUẦN LÓT BÉ TRAI CAO CẤP, COTTON",79.000₫,https://tiki.vn/sec-03-quan-lot-be-trai-cao-cap-cotton-p81827376.html?spid=81827385,18,,Đã bán 11,thoitrangmevabe
"Áo lót bé gái 2 dây mảnh hoạ tiết siêu xinh, áo lá học sinh từ 20-42kg",16.000₫,https://tiki.vn/ao-lot-be-gai-2-day-manh-hoa-tiet-sieu-xinh-ao-la-hoc-sinh-tu-20-42kg-p126005372.html?spid=126005373,19,,Đã bán 141,thoitrangmevabe
Giày công chúa Elsa búp bê cao gót cho bé gái 3-10 tuổi,349.000₫,https://tiki.vn/giay-cong-chua-elsa-bup-be-cao-got-cho-be-gai-3-10-tuoi-p117691067.html?spid=117691128,20,,Đã bán 15,thoitrangmevabe
Set 5 Đôi Tất vớ trẻ em cotton mềm mịn thoáng mái cho bé trai bé gái - Tất cao cổ cho bé phong cách Hàn Quốc,55.000₫,https://tiki.vn/set-5-doi-tat-vo-tre-em-cotton-mem-min-thoang-mai-cho-be-trai-be-gai-tat-cao-co-cho-be-phong-cach-han-quoc-p198127326.html?spid=198127330,21,,Đã bán 62,thoitrangmevabe
Set 100 Kẹp Tóc Mini Nhiều Màu Dễ Thương Cho Bé Gái kẹp tóc cho bé kẹp tóc cho bé gái kẹp càng cua mini,39.000₫,https://tiki.vn/set-100-kep-toc-mini-nhieu-mau-de-thuong-cho-be-gai-ke-p-to-c-cho-be-ke-p-to-c-cho-be-ga-i-kep-cang-cua-mini-p272484522.html?spid=272484523,22,,Đã bán 3,thoitrangmevabe
Balo teen Mr Vui BLTEEN958 phù hợp cho học sinh cấp 2 (41 x 29 x 14 cm),391.500₫,https://tiki.vn/balo-teen-mr-vui-blteen958-phu-hop-cho-hoc-sinh-cap-2-41-x-29-x-14-cm-p271735010.html?spid=271735031,23,,Đã bán 3,thoitrangmevabe
Balo siệu nhẹ Hasun HS 805,248.000₫,https://tiki.vn/balo-sieu-nhe-hasun-hs-805-p25189130.html?spid=59418342,24,,,thoitrangmevabe
"Cặp balo học sinh nam nữ đi học cấp 1, cấp 2 chất liệu vải dù chống thấm, chống xước cao cấp size 42cm có nhiều màu sắc",149.000₫,https://tiki.vn/cap-balo-hoc-sinh-nam-nu-di-hoc-cap-1-cap-2-chat-lieu-vai-du-chong-tham-chong-xuoc-cao-cap-size-42cm-co-nhieu-mau-sac-p155551263.html?spid=155551268,25,,Đã bán 42,thoitrangmevabe
"Đồ bộ dài tay cho bé Easy Baby, bộ ngủ cho bé chất vải cotton từ 7-20kg (ASS-424)",79.000₫,https://tiki.vn/do-bo-dai-tay-cho-be-easy-baby-bo-ngu-cho-be-chat-vai-cotton-tu-7-20kg-ass-424-p198898862.html?spid=198898868,26,,Đã bán 4,thoitrangmevabe
"Quần thể dục 3 sọc cho bé gái, đồ thể thao nam nữ các cấp, vải thun co giãn, thương hiệu Amazing",71.000₫,https://tiki.vn/quan-the-duc-3-soc-cho-be-gai-do-the-thao-nam-nu-cac-cap-vai-thun-co-gian-thuong-hieu-amazing-p113232481.html?spid=113232483,27,,Đã bán 48,thoitrangmevabe
"Quần legging bé gái, Quần dài bé gái chất nỉ cotton lót lông dày dặn không bị xù khi mặc size 12kg đến 30kg",88.000₫,https://tiki.vn/quan-legging-be-gai-quan-dai-be-gai-chat-ni-cotton-lot-long-day-dan-khong-bi-xu-khi-mac-size-12kg-den-30kg-qdn1-p272553862.html?spid=272553890,28,,Đã bán 2,thoitrangmevabe
Quần bầu Jean thật co giãn thoải mái có chun chỉnh JEAN-04,167.000₫,https://tiki.vn/quan-bau-jean-that-co-gian-thoai-mai-co-chun-chinh-jean-04-p148638530.html?spid=148638579,29,,Đã bán 22,thoitrangmevabe
"Sét Kẹp Tóc 14 Chi Tiết Nhiều Hình Kute Cho Bé Gái siêu cute, dễ thương",34.000₫,https://tiki.vn/set-kep-toc-14-chi-tiet-nhieu-hinh-kute-cho-be-gai-sieu-cute-de-thuong-p273522065.html?spid=273522069,30,,Đã bán 8,thoitrangmevabe
Bộ sơ sinh cài giữa tay dài vải visco siêu mềm mại cho bé,95.000₫,https://tiki.vn/bo-so-sinh-cai-giua-tay-dai-vai-visco-sieu-mem-mai-cho-be-p161925317.html?spid=161925325,31,,Đã bán 26,thoitrangmevabe
COMBO 5 QUẦN DÀI TRẮNG CHO BÉ - 5,93.100₫,https://tiki.vn/combo-5-quan-dai-trang-cho-be-p38064055.html?spid=38064062,32,,Đã bán 183,thoitrangmevabe
"Quần Chip Bé Gái, Combo 5 Quần Lót Lưng Thun Cho Bé, Quần Lót Cotton Họa Tiết Đáng Yêu Xinh Xắn Cho Bé Gái QLTE06",129.000₫,https://tiki.vn/quan-chip-be-gai-combo-5-quan-lot-lung-thun-cho-be-quan-lot-cotton-hoa-tiet-dang-yeu-xinh-xan-cho-be-gai-qlte06-p106983124.html?spid=106983130,33,,Đã bán 72,thoitrangmevabe
Balo học sinh tiểu học siêu nhẹ chống gù chống nước cao cấp phong cách mới,423.000₫,https://tiki.vn/balo-hoc-sinh-tieu-hoc-sieu-nhe-chong-gu-chong-nuoc-cao-cap-phong-cach-moi-p249574806.html?spid=249574812,34,,Đã bán 10,thoitrangmevabe
Set 4 Đôi Vớ Không Cổ Dành Cho Trẻ Em 5-8 Tuổi Thương Hiệu ELLE EK29,63.000₫,https://tiki.vn/set-4-doi-vo-khong-co-danh-cho-tre-em-5-8-tuoi-thuong-hieu-elle-ek29-p130308094.html?spid=130308105,35,,Đã bán 5,thoitrangmevabe
[ TIKI TRỢ GIÁ ] Balo trẻ em American Tourister Zoodle 2.0 Backpack R,550.000₫,https://tiki.vn/balo-tre-em-american-tourister-zoodle-2-0-backpack-r-p271626128.html?spid=271626132,36,,Đã bán 1,thoitrangmevabe
Giày công chúa Elsa cao gói 3 phân mũi tròn,275.000₫,https://tiki.vn/giay-cong-chua-elsa-cao-goi-3-phan-mui-tron-p20789384.html?spid=20789392,37,,Đã bán 192,thoitrangmevabe
"Bộ ( 1 bộ) Quần áo Tole, lanh bé trai | Mẫu đùi cộc tay, cài 2 nút trước | Size 1-16 cho bé 5-55kg | Chất vải tole, lanh 2 da loại 1 mềm, mịn, mát cho bé trai | Hàng Việt Nam | Đồ bộ bé trai |quần áo trẻ em| Đồ tôn trẻ em",42.000₫,https://tiki.vn/bo-1-bo-quan-ao-tole-lanh-be-trai-mau-dui-coc-tay-cai-2-nut-truoc-size-1-16-cho-be-5-55kg-chat-vai-tole-lanh-2-da-loai-1-mem-min-mat-cho-be-trai-hang-viet-nam-do-bo-be-trai-quan-ao-tre-em-do-ton-tre-em-p106361609.html?spid=106361611,38,,Đã bán 376,thoitrangmevabe
"Áo khoác bé trai BIGFOX - MISS MEOW thu đông, áo nỉ cho bé dài tay có mũ hoodie size đại in cờ caro 22-40 kg",155.000₫,https://tiki.vn/ao-khoac-be-trai-bigfox-miss-meow-thu-dong-ao-ni-cho-be-dai-tay-co-mu-hoodie-size-dai-in-co-caro-22-40-kg-p144234314.html?spid=144234322,39,,Đã bán 2,thoitrangmevabe
Váy múa bale co dãn 4 chiều và thấm hút mồ hôi cực tốt cho bé DT108,96.000₫,https://tiki.vn/vay-mua-bale-co-dan-4-chieu-va-tham-hut-mo-hoi-cuc-tot-cho-be-dt108-p146248132.html?spid=146248168,40,,Đã bán 76,thoitrangmevabe
