title,price,link_item,index,discount,sales,category
Đồ bộ bé trai hình Ben 10 từ 10-58kg. Chất thun cotton thấm hút mồ hôi-Kiến Lửa,139.000₫,https://tiki.vn/do-bo-be-trai-hinh-ben-10-tu-10-58kg-chat-thun-cotton-tham-hut-mo-hoi-kien-lua-p102663793.html?spid=102663815,1,-23%,,thoitrangmevabe
"Set Quà Tặng Đồ Sơ Sinh Đầy Tháng 15 Chi Tiết Cho Bé Trai Và Bé Gái ( Gồm 3 Bộ Đồ, 1 Khăn Tắm Lớn, 4 Khăn Sữa, 1 Mũ, 1 Tất Tay, 1 Tất Chân)",459.000₫,https://tiki.vn/set-qua-tang-day-thang-cho-be-trai-va-be-gai-p270853043.html?spid=270853047,2,-50%,Đã bán 1,thoitrangmevabe
"Áo khoác len cardigan bé gái cao cấp, chất len dày dặn mềm mịn, giữ ấm tốt, dáng thời trang | MA22",230.000₫,https://tiki.vn/ao-khoac-len-cardigan-be-gai-cao-cap-chat-len-day-dan-mem-min-giu-am-tot-dang-thoi-trang-ma22-p71920571.html?spid=73575429,3,-41%,Đã bán 48,thoitrangmevabe
Sandal đính nơ đáng yêu cho bé gái từ 3 đến 15 tuổi Sad26,169.000₫,https://tiki.vn/sandal-dinh-no-dang-yeu-cho-be-gai-tu-3-den-15-tuoi-sad26-p67438360.html?spid=67438377,4,-44%,Đã bán 90,thoitrangmevabe
"Váy, Đầm Bầu Công Sở Dự Tiệc Dáng Suông Azuno AZ102 Họa Tiết Kẻ Caro Mặc Mùa Hè Rất Mát",237.000₫,https://tiki.vn/vay-dam-bau-cong-so-du-tiec-dang-suong-azuno-az102-hoa-tiet-ke-caro-mac-mua-he-rat-mat-p77154403.html?spid=77154405,5,-52%,Đã bán 15,thoitrangmevabe
Giày lười trẻ em Crocs Classic Butterfly - 208300-94S,448.000₫,https://tiki.vn/giay-luoi-tre-em-crocs-classic-butterfly-208300-94s-p222664344.html?spid=222664350,6,-20%,Đã bán 1,thoitrangmevabe
"Đồ bộ bé trai cộc tay BIGFOX - MISS MEOW size đại, bộ hè bé trai vải cotton phong cách Âu Mỹ in Robot cỡ 3 - 11 tuổi 11 - 40 kg QATE",169.000₫,https://tiki.vn/do-bo-be-trai-coc-tay-bigfox-miss-meow-size-dai-chat-cotton-phong-cach-au-my-in-robot-11-40-kg-qate-p120390183.html?spid=120390185,7,-5%,Đã bán 2,thoitrangmevabe
"Bộ bơi bé gái lớn, dáng 2 mảnh cộc tay quần sooc đùi thể thao, màu sắc trẻ trung, áo tắm trẻ em nữ size đại từ 25 đến 60kg | BT37",314.420₫,https://tiki.vn/bo-boi-be-gai-lon-dang-2-manh-coc-tay-quan-sooc-dui-the-thao-mau-sac-tre-trung-ao-tam-tre-em-nu-size-dai-tu-25-den-60kg-bt37-p89752727.html?spid=98963854,8,-25%,Đã bán 170,thoitrangmevabe
"Quần lót bé trai ATUNER QLN024, quần chip bé trai từ 2-8 tuổi, vải cotton co giãn, chất liệu kháng khuẩn, an toàn với làn da, họa tiết dễ thương, tươi sáng – Hàng Chính Hãng",35.000₫,https://tiki.vn/quan-lot-be-trai-atuner-qln024-quan-chip-be-trai-tu-2-8-tuoi-vai-cotton-co-gian-chat-lieu-khang-khuan-an-toan-voi-lan-da-hoa-tiet-de-thuong-tuoi-sang-hang-chinh-hang-p141755342.html?spid=141755346,9,-50%,Đã bán 71,thoitrangmevabe
Quần áo trẻ em (combo 5bộ quần áo sơ sinh quần áo trẻ sơ sinh như hình),105.000₫,https://tiki.vn/quan-ao-tre-em-combo-5bo-quan-ao-so-sinh-quan-ao-tre-so-sinh-nhu-hinh-p114681896.html?spid=114682037,10,-49%,Đã bán 27,thoitrangmevabe
Đầm thun cho bé gái size 8-40kg chất cotton mềm mịn đẹp,163.000₫,https://tiki.vn/dam-thun-cho-be-gai-size-8-40kg-chat-cotton-mem-min-dep-p250065459.html?spid=250065504,11,-40%,Đã bán 4,thoitrangmevabe
Sandal Bé Trai Biti's DRB031900XAM,268.000₫,https://tiki.vn/sandal-be-trai-biti-s-drb031900xam-p192296860.html?spid=192296870,12,-7%,,thoitrangmevabe
áo dài bé trai chất gấm lụa,147.250₫,https://tiki.vn/ao-dai-be-trai-chat-gam-lua-p121645620.html?spid=121645869,13,-51%,Đã bán 8,thoitrangmevabe
Đồ bộ bé trai hiệu MIMYKID vải thun in số quần lửng quần áo trẻ em - LMTK-B09TH2,42.000₫,https://tiki.vn/do-bo-be-trai-hieu-mimykid-vai-thun-in-so-quan-lung-quan-ao-tre-em-lmtk-b09th2-p255349449.html?spid=255349469,14,-25%,Đã bán 21,thoitrangmevabe
Dép sandal bé gái siêu nhẹ size 27 - 39 phong cách - SD71,159.000₫,https://tiki.vn/dep-sandal-be-gai-sieu-nhe-size-27-39-phong-cach-sd71-p56265656.html?spid=56265680,15,-55%,Đã bán 55,thoitrangmevabe
áo khoác cho bé trai bé gái size đại dù 2 lớp in hình cá tính 0318 T,109.000₫,https://tiki.vn/ao-khoac-cho-be-trai-be-gai-size-dai-du-2-lop-in-hinh-ca-tinh-0318-t-p178004393.html?spid=178004395,16,-40%,Đã bán 4,thoitrangmevabe
"Bộ túi xách cột tóc cho bé - Hộp phụ kiện nơ kẹp tóc phong cách Hàn Quốc cho bé , nhiều màu xinh xắn cute rất đẹp cho bé yêu",54.000₫,https://tiki.vn/bo-tui-xach-cot-toc-cho-be-hop-phu-kien-no-kep-toc-phong-cach-han-quoc-cho-be-nhieu-mau-xinh-xan-cute-rat-dep-cho-be-yeu-p205161265.html?spid=251920860,17,,,thoitrangmevabe
Giày lười trẻ em Crocs Classic - 206990-2Y2,795.000₫,https://tiki.vn/giay-luoi-tre-em-crocs-classic-206990-2y2-p249156153.html?spid=249156155,18,,Đã bán 1,thoitrangmevabe
Đồ bộ bé gái quần áo 2 dây hình bò sữa QATE745 - Đồ bộ cho bé gái xinh xắn,30.000₫,https://tiki.vn/do-bo-be-gai-quan-ao-2-day-hinh-bo-sua-qate745-do-bo-cho-be-gai-xinh-xan-p160879473.html?spid=160879488,19,,Đã bán 41,thoitrangmevabe
Dép cho bé gái quai ngang Thái Lan Adda Bare Bears 31T48,150.000₫,https://tiki.vn/dep-cho-be-gai-quai-ngang-thai-lan-adda-bare-bears-31t48-p133236175.html?spid=133236201,20,,Đã bán 7,thoitrangmevabe
"Bộ Quần Áo Bé Trai Chất Thô Đũi, Bộ Cộc Tay Bé Trai Họa Tiết Vòng Cổ, Bộ Cộc Tay Cho Bé Từ 6-27kg",119.000₫,https://tiki.vn/bo-quan-ao-be-trai-chat-tho-dui-bo-coc-tay-be-trai-hoa-tiet-vong-co-bo-coc-tay-cho-be-tu-6-27kg-p157213225.html?spid=157213253,21,,Đã bán 28,thoitrangmevabe
Combo 3 quần dài bé trai từ 7- 30 kg - vải nỉ co giãn - mặt trong có lớp bông giữ ấm cực tốt - 3 màu ngẫu nhiên,69.000₫,https://tiki.vn/combo-3-quan-dai-be-trai-tu-7-30-kg-vai-ni-co-gian-mat-trong-co-lop-bong-giu-am-cuc-tot-3-mau-ngau-nhien-p153771246.html?spid=153771248,22,,Đã bán 6,thoitrangmevabe
Giày búp bê công chúa Elsa cho bé gái 2-8 tuổi mẫu mới 2023 siêu xinh,339.000₫,https://tiki.vn/gia-y-bu-p-be-cong-chua-elsa-cho-be-gai-2-8-tuoi-mau-moi-2023-sieu-xinh-p271046254.html?spid=271046268,23,,Đã bán 1,thoitrangmevabe
"Set 5 quần lót tam giác bé trai ATUNER QLN025, quần chip bé trai từ 2-8 tuổi, vải cotton co giãn, chất liệu kháng khuẩn, an toàn với làn da, họa tiết dễ thương, tươi sáng ( giao màu ngẫu nhiên)- HÀNG CHÍNH HÃNG",33.000₫,https://tiki.vn/set-5-quan-lot-tam-giac-be-trai-atuner-qln025-quan-chip-be-trai-tu-2-8-tuoi-vai-cotton-co-gian-chat-lieu-khang-khuan-an-toan-voi-lan-da-hoa-tiet-de-thuong-tuoi-sang-giao-mau-ngau-nhien-hang-chinh-hang-p141009426.html?spid=141009448,24,,Đã bán 34,thoitrangmevabe
Vòng Dâu Tằm mix bi bạc cho bé - cho bé từ sơ sinh đến 2 tuổi. Tặng dây thay và hạt dâu dự phòng,99.000₫,https://tiki.vn/vong-dau-tam-mix-bi-bac-cho-be-cho-be-tu-so-sinh-den-2-tuoi-tang-day-thay-va-hat-dau-du-phong-p74162259.html?spid=74162260,25,,Đã bán 6,thoitrangmevabe
"Váy bé gái cúc sau 3 tầng, đầm sát nách cho bé từ 2 đến 12 tuổi, size đại 40kg",159.000₫,https://tiki.vn/vay-be-gai-cuc-sau-3-tang-dam-sat-nach-cho-be-tu-2-den-12-tuoi-size-dai-40kg-p179555067.html?spid=179555112,26,,Đã bán 5,thoitrangmevabe
"Bộ cotton dài tay cho bé Easy Baby, đồ ngủ cho bé gái chất vải cotton từ 7-17kg (ASS-305)",75.000₫,https://tiki.vn/bo-cotton-dai-tay-cho-be-easy-baby-do-ngu-cho-be-gai-chat-vai-cotton-tu-7-17kg-ass-305-p198895426.html?spid=198895438,27,,Đã bán 8,thoitrangmevabe
Máy Hút Mũi Điện Tử Đầu Mềm Cho Bé LittleBees,161.000₫,https://tiki.vn/may-hut-mui-dien-tu-dau-mem-cho-be-littlebees-p173678979.html?spid=262779894,28,,Đã bán 2,thoitrangmevabe
Giày thể thao Bitis bé trai,381.300₫,https://tiki.vn/giay-the-thao-bitis-be-trai-p194083592.html?spid=194083600,29,,Đã bán 1,thoitrangmevabe
Giày Bánh Xe Loại 2 Bánh Cho Bé Trai 4 - 10 Tuổi Kiểu Dáng Thể Thao GA06,400.000₫,https://tiki.vn/giay-banh-xe-loai-2-banh-cho-be-trai-4-10-tuoi-kieu-dang-the-thao-ga06-xanh-p5827915.html?spid=5827919,30,,Đã bán 160,thoitrangmevabe
Balo chống gù cho bé gái đi học cặp sách học sinh tiểu học form hộp vải chống nước bền đẹp 63201,510.000₫,https://tiki.vn/balo-chong-gu-cho-be-gai-di-hoc-cap-sach-hoc-sinh-tieu-hoc-form-hop-vai-chong-nuoc-ben-dep-63201-p193416489.html?spid=193416493,31,,Đã bán 8,thoitrangmevabe
Chân váy xếp ly cho bé gái màu trắng đen phối đồ phong cách Hàn Quốc size 12-40kg mẫu mới (kèm chip),171.000₫,https://tiki.vn/chan-vay-xep-ly-cho-be-gai-mau-trang-den-phoi-do-phong-cach-han-quoc-size-12-40kg-mau-moi-kem-chip-p271137767.html?spid=271137805,32,,Đã bán 3,thoitrangmevabe
Đồ Bơi Bé Gái Hai Mảnh Áo Ngắn Tay Quần Váy BB031 MayHomes Họa Tiết Hình Dễ Thương,112.000₫,https://tiki.vn/do-boi-be-gai-hai-manh-ao-ngan-tay-quan-vay-bb031-mayhomes-hoa-tiet-hinh-de-thuong-p73243587.html?spid=73243591,33,,Đã bán 14,thoitrangmevabe
ÁO DÀI CÁCH TÂN CHO BÉ TRAI - ÁO DÀI NHUNG ĐÁP RỒNG,265.000₫,https://tiki.vn/ao-dai-cach-tan-cho-be-trai-ao-dai-nhung-dap-rong-p123248329.html?spid=123248809,34,,Đã bán 14,thoitrangmevabe
Áo Khoác Trẻ Em Chất Kaki Dày 2 Lớp Cho Bé Trai và Bé Gái,250.000₫,https://tiki.vn/ao-khoac-tre-em-chat-kaki-day-2-lop-cho-be-trai-va-be-gai-p149554126.html?spid=149554405,35,,Đã bán 2,thoitrangmevabe
Combo 5 chiếc áo sơ sinh size dưới 10kg,120.000₫,https://tiki.vn/combo-5-chiec-ao-so-sinh-size-duoi-10kg-p56577749.html?spid=56577763,36,,Đã bán 63,thoitrangmevabe
Đồ thể thao bé trai và bé gái chất thun lạnh mát mẻ mẫu ba lỗ đội bóng rổ golden state warriors cho bé từ 8-22kg,84.000₫,https://tiki.vn/do-the-thao-tre-em-doi-bong-ro-golden-state-warriors-chat-vai-thun-lanh-thoai-mai-me-cho-mua-he-nang-dong-size-8kg-den-45kg-p54749736.html?spid=55001561,37,,Đã bán 103,thoitrangmevabe
Giày sneaker trẻ em Fila Eagle Knit Kd - 3XM02306F,837.000₫,https://tiki.vn/giay-sneaker-tre-em-fila-eagle-knit-kd-3xm02306f-p244302649.html?spid=244302653,38,,,thoitrangmevabe
Balo Thú Bông Hình Heo Cho Bé Đi Học Mầm Non,95.000₫,https://tiki.vn/balo-thu-bong-hinh-heo-cho-be-di-hoc-mam-non-p70656252.html?spid=205262762,39,,Đã bán 85,thoitrangmevabe
"[KÈM QUÀ] Ti Ngậm, Ti Giả BIBS DELUX Silicon Chính Hãng Đan Mạch Cao Cấp, Chất Liệu Silicon An Toàn Cho Bé Từ 0-3 Tuổi, Tặng Kèm Hộp Đựng Ti Cho Bé",245.000₫,https://tiki.vn/kem-qua-ti-ngam-ti-gia-bibs-delux-silicon-chinh-hang-dan-mach-cao-cap-chat-lieu-silicon-an-toan-cho-be-tu-0-3-tuoi-tang-kem-hop-dung-ti-cho-be-p170756739.html?spid=170756771,40,,Đã bán 9,thoitrangmevabe
