title,price,link_item,index,discount,sales,category
Bông tăm Moby cỡ bông nhỏ 150 chiếc,65.000₫,https://tka.tiki.vn/pixel/pixel?data=RsWyctYycUzHw4YgozgLEPsJXeSKggRxycQ2Z3L7aFaTMdbMoPEnM_KEevjIxRrn1pFdwC1zRuS3VP-tWUXMnQ71YKLcv7OiUyVReBFJxU7ywP7ciXL5XShXTtUPd7bBXbgITUvoi92GuPuy6JguPcuvwUy0lOvZrAS2Jv4xO3v2_0HS2qzI9XRqexXlYcNLbSCpvmtXfqY5oT3KmQLS3uTknvJa8wLfc1XDYJJbuFK4_mSa8eGdblNY41yxs-TLc6oZG7cqYvahiP30AqqBes9mzDXAz4FHiWqbVWv0Bs1RsIREslwtmqP6puS6la93zKb0oF39o_HdvqtsQLTeskmEykB6uVlT0nRAB18tokR06ny0-a7KHD0nZVtry3QPK0zLpOy-fvGXLWWUsrlsCEAJMX4-QqXyrVvGMpoCLq0V1Hc3pOmxpeP-rrCB7vx7iXCcyZ3Wx72QfyzzG2RyKZMXNpkhHLO97miHdPf1bg_OnjUiRkfX_xADsLsiiTeTmWTSbBIGspcrkXyn_e0p3p0gmHNwr8W29ALESAceW8tCkft8RTv8HHQWN16LrCg-Y5aYaT3WkQjP4lwnjFjg7kK0_An-YWTsU_Mk-FFmtYBq4iPKcLJ5anC3wgIb6bmXt8fwED1XLQns4-U6sMkTp71mxFqM8_8YzGTrpYq8tfFq00p6zzR0O8wF1v7rAOviw9vqgCm82jOMbEA6kezpIdMhHWrAJtSijdCO643-YbLVknI6h5aMeeLrky9NcWDcafqbEOnkZwvzEYeo7e8j6GMtyc8stA0VqGrZnuFGWU_ySsGXegMACcdUiyZEwQ6dEqa9giNwj-iKD-SIRSKo0Xv4ZCXkT8kvoFkKIGZwF1cF7W-vfMJt0TnUd1vxp4P1cGgfMIuslsDu-0pO5U5hSgs1Ol7TojcOFamC15wUy3y82VKniKXZ2TXzWN6NohEMkKZXmIEqSxdP-bhdHNLKMlh5jFA5f5cZF-k7-ByuaA&reqid=HVuQBmpqTAtL2glI&type=CLICK&pos=1,1,-11%,Đã bán 3,thucphamandam
Bánh Ăn Dặm Gạo Lứt Phô Mai Bebedang Cho Bé Nhập Khẩu Hàn Quốc,55.000₫,https://tiki.vn/banh-gao-lut-pho-mai-an-dam-huu-co-bebedang-p49957356.html?spid=205287519,2,-37%,Đã bán 1.2k,thucphamandam
Yến mạch nguyên hạt cán mỏng DK Harvset nhập khẩu ÚC - Thích hợp cho bé ăn dặm từ 6 tháng tuổi - Túi 500g,39.000₫,https://tiki.vn/yen-mach-nguyen-hat-can-mong-dk-harvset-nhap-khau-uc-thich-hop-cho-be-an-dam-tu-6-thang-tuoi-p89565445.html?spid=89565446,3,-20%,Đã bán 245,thucphamandam
Nước Mắm Cho Bé Ăn Dặm Maguzt Cá Cơm Than 150ml,58.600₫,https://tiki.vn/nuoc-mam-cho-be-an-dam-maguzt-ca-com-than-150ml-p116407422.html?spid=116407423,4,-19%,Đã bán 20,thucphamandam
Combo 2 gói mì MUG Nhật Bản cho bé - vị hải sản,138.000₫,https://tiki.vn/combo-2-goi-mi-mug-nhat-ban-cho-be-vi-hai-san-p7061645.html?spid=7061647,5,-20%,Đã bán 478,thucphamandam
Cháo hạt vỡ cho bé ăn dặm MBeFood Bột cháo gạo Nhật Hokkaido cải bó xôi (Hộp 4 gói x 18g),77.000₫,https://tiki.vn/chao-hat-vo-gao-nhat-hokkaido-cai-bo-xoi-mbefood-cho-be-an-dam-hop-4-goi-x-18g-p262779774.html?spid=262779775,6,-2%,Đã bán 6,thucphamandam
Cháo hạt vỡ cho bé ăn dặm MbeFood Cháo gạo Nhật Hokkaido (Hộp 4 gói x 18g),77.000₫,https://tiki.vn/chao-hat-vo-gao-nhat-hokkaido-mbefood-cho-be-an-dam-hop-4-goi-x-18g-p262799288.html?spid=262799289,7,-10%,Đã bán 8,thucphamandam
Mỳ ăn dặm Baby Spaghetti HakuBaku 100g (Dành cho bé từ 9 tháng),50.000₫,https://tiki.vn/my-an-dam-baby-spaghetti-hakubaku-100g-danh-cho-be-tu-9-thang-p15857915.html?spid=17451500,8,-37%,Đã bán 57,thucphamandam
"Chà bông Lươn thượng hạng Phamnghiafood 40gr - Ruốc lươn 92.4% thịt Lươn chuẩn VietGap. Cho bé dinh dưỡng, cho mẹ nhàn tênh",105.000₫,https://tiki.vn/cha-bong-luon-thuong-hang-phamnghiafood-40gr-ruoc-luon-92-4-thit-luon-chuan-vietgap-cho-be-dinh-duong-cho-me-nhan-tenh-p196141562.html?spid=196141563,9,-8%,Đã bán 11,thucphamandam
Dầu Cá Hồi Ăn Dặm Maguzt Nguyên Chất,56.800₫,https://tiki.vn/dau-ca-hoi-an-dam-maguzt-nguyen-chat-p252534402.html?spid=252534404,10,-44%,Đã bán 4,thucphamandam
"Gia vị rắc cơm cho bé Enzy, Không Bột Ngọt, Phụ Gia, Thuần Tự Nhiên, Vị Rau Củ Gói 30g",38.000₫,https://tiki.vn/gia-vi-rac-com-cho-be-enzy-khong-bot-ngot-phu-gia-thuan-tu-nhien-vi-rau-cu-goi-30g-p204110487.html?spid=204110491,11,,Đã bán 10,thucphamandam
RUỐC CÁ HỒI MEIWA CHÍNH HÃNG NHẬT BẢN,72.000₫,https://tiki.vn/ruoc-ca-hoi-meiwa-chinh-hang-nhat-ban-p109711257.html?spid=194026823,12,,Đã bán 15,thucphamandam
"Phô mai tách muối Mămmy dạng bột rắc cơm, cháo cho bé ăn dặm, hộp 10 ống (3g/ ống)",105.000₫,https://tiki.vn/pho-mai-tach-muoi-mammy-dang-bot-rac-com-chao-cho-be-an-dam-hop-10-ong-3g-ong-p263594255.html?spid=263594256,13,,Đã bán 3,thucphamandam
Combo 2 gói mì MUG Nhật Bản cho bé - vị thịt heo,139.000₫,https://tiki.vn/combo-2-goi-mi-mug-nhat-ban-cho-be-vi-thit-heo-p11505774.html?spid=11505775,14,,Đã bán 125,thucphamandam
Bột ăn dặm Mămmy bổ sung vitamin khoáng chất cho bé,139.000₫,https://tiki.vn/bot-an-dam-mammy-bo-sung-vitamin-khoang-chat-cho-be-p263592000.html?spid=263592006,15,,,thucphamandam
"Thùng 35 Gói - 7 Vị Cháo Tươi Cây Thị: Gà Ác Đậu Xanh, Cá Hồi, Cá Lóc, Lươn Đậu Xanh, Thịt Bò, Rau Củ, Thịt Heo",670.225₫,https://tiki.vn/thung-35-goi-7-vi-chao-tuoi-cay-thi-ga-ac-dau-xanh-ca-hoi-ca-loc-luon-dau-xanh-thit-bo-rau-cu-thit-heo-p56699120.html?spid=56699121,16,,Đã bán 75,thucphamandam
Gạo hữu cơ cho bé ăn dặm mix hạt dinh dưỡng Ý cao cấp Bébi Rice Organic Shop,48.000₫,https://tiki.vn/gao-huu-co-cho-be-an-dam-mix-hat-dinh-duong-y-cao-cap-bebi-rice-organic-shop-p271335198.html?spid=271335200,17,,,thucphamandam
Cháo Gạo Koshihikari Ăn Dặm Với Cà Chua Chín Và Nấm Matsuya 60g,73.000₫,https://tiki.vn/chao-gao-koshihikari-an-dam-voi-ca-chua-chin-va-nam-matsuya-60g-p48632332.html?spid=50643514,18,,Đã bán 16,thucphamandam
Combo 2 lọ ruốc cà hồi Meiwa cho bé và gia đình,140.000₫,https://tiki.vn/combo-2-lo-ruoc-ca-hoi-meiwa-cho-be-va-gia-dinh-p59201403.html?spid=59201409,19,,Đã bán 32,thucphamandam
"Combo 3 gói gia vị cho bé, 1 gói hạt nêm ăn dặm, 1 hạt nêm thuần chay, không bột ngọt thuần tự nhiên",170.000₫,https://tiki.vn/combo-3-goi-gia-vi-cho-be-1-goi-hat-nem-an-dam-1-hat-nem-thuan-chay-khong-bot-ngot-thuan-tu-nhien-p205539420.html?spid=205539421,20,,,thucphamandam
"Đậu hạt hữu cơ cho bé ăn dặm Mămmy: Đậu lăng đỏ, đậu hà lan, yến mạch, hạt kê...Mămmy",82.000₫,https://tiki.vn/dau-hat-huu-co-cho-be-an-dam-mammy-dau-lang-do-dau-ha-lan-yen-mach-hat-ke-mammy-p263584755.html?spid=263584759,21,,Đã bán 1,thucphamandam
Cháo nhuyễn cho bé ăn dặm MbeFood Cháo gạo Nhật Hokkaido (Hộp 4 gói x 18g),77.000₫,https://tiki.vn/chao-nhuyen-gao-nhat-hokkaido-mbefood-cho-be-an-dam-hop-4-goi-x-18g-p262799990.html?spid=262799991,22,,Đã bán 3,thucphamandam
Cháo nhuyễn cho bé ăn dặm MBeFood Bột cháo gạo Nhật Hokkaido cải bó xôi cho bé ăn dặm (Hộp 4 gói x 18g),72.000₫,https://tiki.vn/chao-nhuyen-gao-nhat-hokkaido-cai-bo-xoi-mbefood-cho-be-an-dam-hop-4-goi-x-18g-p262800958.html?spid=262800959,23,,Đã bán 21,thucphamandam
Mỳ ăn dặm Baby Udon HakuBaku 100g (Dành cho bé từ 7 tháng),62.000₫,https://tiki.vn/my-an-dam-baby-udon-hakubaku-100g-danh-cho-be-tu-7-thang-p15857912.html?spid=17451104,24,,Đã bán 163,thucphamandam
Mì ăn dặm tách muối Hakubaku - Thực phẩm ăn dặm kiểu Nhật tiện lợi Baby Somen cho bé từ 6 tháng tuổi,70.000₫,https://tiki.vn/mi-an-dam-tach-muoi-hakubaku-thuc-pham-an-dam-kieu-nhat-tien-loi-baby-somen-cho-be-tu-6-thang-tuoi-p272413553.html?spid=272413555,25,,,thucphamandam
"Nước tương mật hoa dừa Sokfarm - Nước tương ăn dặm cho bé với hàm lượng muối thấp, khoáng chất cao, không gluten, không đường và không chất bảo quản",30.000₫,https://tiki.vn/nuoc-tuong-mat-hoa-dua-sokfarm-nuoc-tuong-an-dam-cho-be-voi-ham-luong-muoi-thap-khoang-chat-cao-khong-gluten-khong-duong-va-khong-chat-bao-quan-p270687511.html?spid=270687513,26,,Đã bán 22,thucphamandam
Mỳ ăn dặm Baby Somen HakuBaku 100g (Dành cho bé từ 5 tháng),62.000₫,https://tiki.vn/my-an-dam-baby-somen-hakubaku-100g-danh-cho-be-tu-5-thang-p15857904.html?spid=17451200,27,,Đã bán 108,thucphamandam
Thùng 33 Gói Đủ Vị Cháo Tươi Cây Thị,700.935₫,https://tiki.vn/thung-33-goi-du-vi-chao-tuoi-cay-thi-p145630407.html?spid=145630408,28,,Đã bán 25,thucphamandam
Hạt nêm ăn dặm cho bé nội địa Nhật Bản (Tặng trà sữa macca),213.000₫,https://tiki.vn/hat-nem-an-dam-cho-be-noi-dia-nhat-ban-tang-tra-sua-macca-p35226708.html?spid=35226709,29,,Đã bán 328,thucphamandam
Combo 5 hũ Babi Bird 42g - Nước Yến Sào Chưng Đường Phèn Sợi Yến Thật 100%,325.000₫,https://tiki.vn/bao-bi-moi-combo-5-hu-babi-bird-42g-nuoc-yen-sao-chung-duong-phen-soi-yen-that-100-p48623345.html?spid=48623346,30,,Đã bán 31,thucphamandam
Ruốc cá hồi Meiwa,70.000₫,https://tiki.vn/ruoc-ca-hoi-meiwa-p59200081.html?spid=59200083,31,,Đã bán 69,thucphamandam
Ruốc cá hồi trộn trứng cá tuyết Okawari Nhật Bản 120g,131.320₫,https://tiki.vn/ruoc-ca-hoi-tron-trung-ca-tuyet-okawari-nhat-ban-120g-p125393262.html?spid=141300597,32,,Đã bán 2,thucphamandam
Phô Mai Hoa Quả Sấy Lạnh YOMIT Cho Bé Nhập Khẩu Hàn Quốc,82.000₫,https://tiki.vn/pho-mai-hoa-qua-say-lanh-yomit-cho-be-nhap-khau-han-quoc-p116142695.html?spid=116142699,33,,Đã bán 44,thucphamandam
Dầu óc chó Nguyên chất Thuyền Xưa ăn dặm cho con 250ml,189.000₫,https://tiki.vn/dau-oc-cho-nguyen-chat-thuyen-xua-an-dam-cho-con-250ml-p208314782.html?spid=208314783,34,,Đã bán 2,thucphamandam
Chà bông ghẹ thượng hạng 40gr - Ruốc Ghẹ với trên 70% thịt ghẹ chuẩn VietGap cho bé dinh dưỡng cho mẹ nhàn tênh,170.000₫,https://tiki.vn/cha-bong-ghe-thuong-hang-40gr-ruoc-ghe-voi-tren-70-thit-ghe-chuan-vietgap-cho-be-dinh-duong-cho-me-nhan-tenh-p196094160.html?spid=196094161,35,,Đã bán 3,thucphamandam
"Gia vị rắc cơm Enzy, Gia Vị Rắc Cơm Cho Bé, Không Bột Ngọt, Phụ Gia, Thuần Tự Nhiên, Vị Cá Hồi, Gói 30gr",38.000₫,https://tiki.vn/gia-vi-rac-com-enzy-gia-vi-rac-com-cho-be-khong-bot-ngot-phu-gia-thuan-tu-nhien-vi-ca-hoi-goi-30gr-p198509331.html?spid=198509332,36,,Đã bán 3,thucphamandam
"Combo 2 Gói Mì ăn dặm cho trẻ trên 1 tuổi Nissin MUG Cup Noodle 96g (4 gói nhỏ bên trong, 2 hương vị)",145.360₫,https://tiki.vn/combo-2-goi-mi-an-dam-cho-tre-tren-1-tuoi-nissin-mug-cup-noodle-96g-4-goi-nho-ben-trong-2-huong-vi-p31581454.html?spid=49408723,37,,Đã bán 141,thucphamandam
Cháo Gạo Koshihikari Ăn Dặm Matsuya Cá Thịt Trắng Và Rau Gói 60g - Dành Cho Bé Từ 6 Tháng,73.000₫,https://tiki.vn/chao-gao-koshihikari-an-dam-matsuya-ca-thit-trang-va-rau-goi-60g-danh-cho-be-tu-6-thang-p53224206.html?spid=60736960,38,,Đã bán 19,thucphamandam
Bánh Gạo Hữu Cơ Hương Việt Quất và Dâu APPLE MONKEY 30G,79.000₫,https://tiki.vn/banh-gao-huu-co-huong-viet-quat-va-dau-apple-monkey-30g-p93820185.html?spid=93820243,39,,Đã bán 2,thucphamandam
"Granola Siêu Hạt, Siêu Dinh Dưỡng KHÔNG Yến Mạch VIETTIN MART",65.000₫,https://tiki.vn/granola-sieu-hat-sieu-dinh-duong-khong-yen-mach-viettin-mart-p273511478.html?spid=273511482,40,,,thucphamandam
"Hạt Diêm Mạch Quinoa Hữu Cơ Mămmy 110g - Dẻo Mịn Sánh Cho Bé Ăn Dặm, Tặng kèm vòng tay may mắn",69.000₫,https://tiki.vn/hat-diem-mach-quinoa-huu-co-mammy-110g-deo-min-sanh-cho-be-an-dam-tang-kem-vong-tay-may-man-p183513203.html?spid=183513204,41,,,thucphamandam
