title,price,link_item,index,discount,sales,brand
"Set đồ ngủ, bộ đùi mặc nhà, pijama chất mặc mát, thấm hút mồ hôi Haint Boutique",141.550₫,https://tiki.vn/set-do-ngu-bo-dui-mac-nha-pijama-chat-mac-mat-tham-hut-mo-hoi-haint-boutique-p56201134.html?spid=56492596,1,-5%,Đã bán 4,HaintBoutique
"Đầm linen suông đuôi cá, váy midi mẫu mới mùa hè, chất vải mềm mát cao cấp Da80 đen",299.000₫,https://tiki.vn/dam-linen-suong-duoi-ca-vay-midi-mau-moi-mua-he-chat-vai-mem-mat-cao-cap-da80-den-p193723584.html?spid=193723590,2,,,HaintBoutique
Áo len nữ họa tiết hình trái tim siêu xinh Al52,249.000₫,https://tiki.vn/ao-len-nu-hoa-tiet-hinh-trai-tim-sieu-xinh-al52-p195456319.html?spid=195456327,3,,,HaintBoutique
Áo len nữ cột dây freesize al16,220.000,https://tiki.vn/ao-len-nu-cot-day-freesize-al16-p133892467.html?spid=134514977,4,-5%,,HaintBoutique
,,https://tiki.vn/dam-nu-thiet-ke-hoa-tiet-hoa-eo-that-phong-cach-nhe-nhang-hb21-p110202954.html?spid=110202960,5,-27%,,HaintBoutique
Áo sơ mi nữ công sở ngắn tay phối màu sm31,159.000₫,https://tiki.vn/ao-so-mi-nu-cong-so-ngan-tay-phoi-mau-sm31-p110201972.html?spid=110202130,6,,,HaintBoutique
"Bộ vest thiết kế kiểu mới, cao cấp, sang chảnh vừa có thể mặc đi làm, đi chơi",550.000₫,https://tiki.vn/bo-vest-thiet-ke-kieu-moi-cao-cap-sang-chanh-vua-co-the-mac-di-lam-di-choi-p273289636.html?spid=273289638,7,,,HaintBoutique
Quần caro kẻ suông Haint Boutique QT32,128.700₫,https://tiki.vn/quan-caro-ke-suong-haint-boutique-qt32-p52324827.html?spid=57656188,8,-40%,Đã bán 15,HaintBoutique
Áo len cổ lọ ấm áp Haint Boutique al10,158.000,https://tiki.vn/ao-len-co-lo-am-ap-haint-boutique-al10-p42755651.html?spid=56460671,9,-13%,,HaintBoutique
,,https://tiki.vn/ao-thun-ngan-tay-form-rong-in-chu-thoi-trang-he-nu-ma-06-p175525784.html?spid=175525788,10,-17%,,HaintBoutique
Áo sơ mi nữ kẻ caro tay bồng dáng thụng ulzzang/ Áo chống nắngthời trang hàn quốc Mã 59,179.000₫,https://tiki.vn/ao-so-mi-nam-nu-ke-caro-tay-bong-dang-thung-ulzzang-ao-chong-nangthoi-trang-han-quoc-ma-59-p174259046.html?spid=174259062,11,,,HaintBoutique
Áo sơ mi nữ màu hồng dài tay áo cổ trụ phối bèo S06,149.000,https://tiki.vn/hang-nhap-ao-nu-co-tru-06-hong-p110201764.html?spid=110201817,12,-12%,,HaintBoutique
,,https://tiki.vn/ao-len-cao-co-tron-mau-den-sang-trong-haint-boutique-57-p42205295.html?spid=59176191,13,-37%,,HaintBoutique
Áo sơ mi nữ công sở thiết kế vintage xinh xắn CS169,159.000₫,https://tiki.vn/ao-so-mi-nu-cong-so-thiet-ke-vintage-xinh-xan-cs169-p196161469.html?spid=196161479,14,,,HaintBoutique
Áo sơ mi kiểu cổ trụ họa tiết lạ 154,159.000₫,https://tiki.vn/hang-nhap-ao-kieu-co-tru-hoa-tiet-la-154-p110201450.html?spid=110201479,15,,,HaintBoutique
"Áo sơ mi nữ dài tay cố đức kín đáo, họa tiết nổi bật đặc sắc, lên form đẹp NH23",149.000₫,https://tiki.vn/ao-so-mi-nu-dai-tay-co-duc-kin-dao-hoa-tiet-noi-bat-dac-sac-len-form-dep-nh23-p252913566.html?spid=252913570,16,-55%,,HaintBoutique
"Đầm linen cổ tròn, đầm thiết kế mẫu mới năm nay, thời trang nữ cao cấp NH192 hồng",350.000,https://tiki.vn/dam-linen-co-tron-dam-thiet-ke-mau-moi-nam-nay-thoi-trang-nu-cao-cap-nh192-hong-p216903469.html?spid=216903471,17,-18%,,HaintBoutique
,,https://tiki.vn/ao-len-nu-tron-dai-tay-co-v-day-rut-croptop-cach-dieu-xinh-xan-al35-p194421098.html?spid=194421099,18,-50%,,HaintBoutique
Quần tây công sở Haint Boutique qt06,141.550₫,https://tiki.vn/quan-tay-cong-so-haint-boutique-qt06-p10682968.html?spid=59176416,19,,,HaintBoutique
Đầm len nữ ôm body phối cúc mẫu mới AL103,188.000₫,https://tiki.vn/dam-len-nu-dam-yem-om-body-phoi-cuc-xinh-xan-al103-p133889349.html?spid=133889362,20,,,HaintBoutique
"Áo blazer nữ- Áo vest linen công sở kiểu dáng cơ bản dễ mặc, phù hợp môi trường đi làm CS04",299.000₫,https://tiki.vn/ao-blazer-nu-ao-vest-linen-cong-so-kieu-dang-co-ban-de-mac-phu-hop-moi-truong-di-lam-cs04-p200913586.html?spid=200913602,21,,,HaintBoutique
"Hàng sẵn Đầm nữ linen nữ tính nhẹ nhàng, lịch thiệp, tao nhã màu xanh đen da199",299.000₫,https://tiki.vn/hang-san-dam-nu-linen-nu-tinh-nhe-nhang-lich-thiep-tao-nha-mau-xanh-den-da199-p273263744.html?spid=273263748,22,,,HaintBoutique
Áo sơ mi nữ công sở kẻ sọc caro thiết kế tay dài phong cách thời trang công sở Hàn Quốc Mã 11,249.000₫,https://tiki.vn/ao-so-mi-nu-cong-so-ke-soc-caro-thiet-ke-tay-dai-phong-cach-thoi-trang-cong-so-han-quoc-ma-11-p174557439.html?spid=174557449,23,,,HaintBoutique
"Áo nữ thiết kế Haint Boutique, áo thun nữ ngắn tay freesize A03",109.000₫,https://tiki.vn/ao-nu-thiet-ke-haint-boutique-ao-thun-nu-ngan-tay-freesize-a03-p158714481.html?spid=158714482,24,,,HaintBoutique
Đầm ôm kẻ sọc ngang sát nách phối ren da09,99.000₫,https://tiki.vn/dam-om-ke-soc-ngang-sat-nach-phoi-ren-da09-p110201911.html?spid=110202055,25,,,HaintBoutique
,,https://tiki.vn/bo-pijama-coc-nu-suong-freesize-kem-anh-that-vn25-p86772152.html?spid=86772163,26,,,HaintBoutique
Bộ Đồ Pijama Nữ Cao Cấp Mặc Nhà Ngắn Tay Chất Liệu Cotton Mặc Mùa Hè Rất Mát,119.000₫,https://tiki.vn/bo-do-pijama-nu-cao-cap-mac-nha-ngan-tay-chat-lieu-cotton-mac-mua-he-rat-mat-p102163805.html?spid=102163809,27,,,HaintBoutique
"Váy 2 dây, váy mặc nhà dáng suông hình dứa siu xinh HB20",129.000₫,https://tiki.vn/vay-2-day-vay-mac-nha-dang-suong-hinh-dua-siu-xinh-hb20-p108030361.html?spid=108030385,28,,,HaintBoutique
Áo sơ mi nữ kẻ caro phối màu cực xinh Sm02,149.000₫,https://tiki.vn/ao-so-mi-nu-ke-caro-phoi-mau-cuc-xinh-sm02-p113047548.html?spid=113047570,29,,,HaintBoutique
Áo Sơ Mi Kẻ Caro Nữ Haint Boutique HB157,149.000,https://tiki.vn/ao-so-mi-ke-caro-nu-haint-boutique-hb157-p54780078.html?spid=56511589,30,,,HaintBoutique
,,https://tiki.vn/ao-dui-tay-lo-nhe-nhang-p11652538.html?spid=57800137,31,,,HaintBoutique
Quần nữ ôm chân công sở Haint Boutique qt09,149.000₫,https://tiki.vn/quan-nu-om-chan-cong-so-haint-boutique-qt09-p10798532.html?spid=56533203,32,,Đã bán 6,HaintBoutique
"váy đầm suông thêu cổ tàu cao cấp, đầm đỏ mặc tết HB02",175.000₫,https://tiki.vn/vay-dam-suong-theu-co-tau-cao-cap-dam-do-mac-tet-hb02-p75481448.html?spid=75481449,33,,,HaintBoutique
Đầm suông phối cúc kèm dây thắt eo dự tiệc 9.7,175.000₫,https://tiki.vn/dam-suong-phoi-cuc-kem-day-that-eo-du-tiec-9-7-p42634638.html?spid=69707479,34,,Đã bán 3,HaintBoutique
"Áo khoác len nữ ,áo cardigan len dày ấm thiết kế 2 túi phối cúc nhiều màu AK03",175.000,https://tiki.vn/ao-khoac-len-nu-ao-khoac-cardigan-phoi-cuc-nhieu-mau-ak03-p125791461.html?spid=213842901,35,,,HaintBoutique
,,https://tiki.vn/ao-len-nu-haint-boutique-freesize-al57-p121751852.html?spid=121751853,36,,,HaintBoutique
Áo len nữ thu đông,122.000₫,https://tiki.vn/ao-len-tron-thu-dong-a24-p42670992.html?spid=42670997,37,,Đã bán 1,HaintBoutique
Áo len dài tay kèm dây rút Haint Boutique Al35,131.000₫,https://tiki.vn/ao-len-dai-tay-kem-day-rut-haint-boutique-al35-p23026222.html?spid=56445302,38,,,HaintBoutique
"Áo sơ mi nữ thô đũi viền cổ, áo kiểu nữ cộc tay cổ vest viền chỉ freesize s21",131.000₫,https://tiki.vn/ao-so-mi-nu-tho-dui-vien-co-ao-kieu-nu-coc-tay-co-vest-vien-chi-freesize-s21-p108030340.html?spid=108030363,39,,Đã bán 1,HaintBoutique
Sơ mi nữ cổ trụ sọc kẻ chất mềm Sm187,140.000,https://tiki.vn/so-mi-nu-co-tru-soc-ke-chat-mem-sm187-p90642786.html?spid=90642802,40,,,HaintBoutique
