title,price,link_item,index,discount,sales,category
Quần thể thao nam Fasvin S20204.HN vải gió chun mềm mại co giãn thoải mái,149.000₫,https://tiki.vn/quan-the-thao-nam-fasvin-s20204-hn-vai-gio-chun-mem-mai-co-gian-thoai-mai-p100367932.html?spid=100368943,1,-35%,Đã bán 1,quannam
Quần Tây Nam Công Sở - Đen,95.000₫,https://tiki.vn/quan-tay-nam-cong-so-den-p15931582.html?spid=81319644,2,-21%,Đã bán 13,quannam
"Quần Kaki Nam ALIGRO Màu Xanh Da Trời Chất Liệu Kaki Mềm, Mịn, Không Bai Xù, Co Giãn Tốt, Chuẩn Form, ALGK020",438.900₫,https://tiki.vn/quan-kaki-nam-xanh-da-troi-aligro-algk020-p116147690.html?spid=116147698,3,-50%,,quannam
Quần Jogger Lót Nỉ Nam Nữ Kiểu Dáng Thể Thao,58.000₫,https://tiki.vn/quan-jogger-lot-ni-nam-nu-kieu-dang-the-thao-p22550650.html?spid=211926771,4,,,quannam
,,https://tiki.vn/quan-jean-suong-ong-rong-kha-banh-majn686-p118119840.html?spid=118119843,5,-12%,,quannam
Quần short kaki nam thể thao có size lớn big size 36 vải cao cấp QS02,169.000₫,https://tiki.vn/quan-short-kaki-nam-the-thao-co-size-lon-big-size-36-vai-cao-cap-qs02-p186619906.html?spid=186619908,6,,Đã bán 2,quannam
"Quần Jogger Nam thể thao túi hộp thương hiệu Chandi, chất kaki bo chân xu hướng mới nhất MS19",149.000₫,https://tiki.vn/quan-jogger-nam-the-thao-tui-hop-thuong-hieu-chandi-chat-kaki-bo-chan-xu-huong-moi-nhat-2023-ms19-p249204441.html?spid=249204447,7,-47%,,quannam
Quần Sọt Jean Nam M1,82.000₫,https://tiki.vn/quan-sot-jean-nam-m1-p31591532.html?spid=198869190,8,,Đã bán 8,quannam
Quần Dài Jogger Nam form rộng 1060,95.000₫,https://tiki.vn/quan-dai-jogger-nam-form-rong-1060-p4401897.html?spid=4401905,9,,,quannam
,,https://tiki.vn/product-p91004591.html?spid=100265352,10,,,quannam
Bộ quần áo thể thao nam Fasvin AV20294.HN cổ tim chất vải mềm nhẹ co giãn thoải mái,84.500₫,https://tiki.vn/bo-quan-ao-the-thao-nam-fasvin-av20294-hn-co-tim-chat-vai-mem-nhe-co-gian-thoai-mai-p188914420.html?spid=188914479,11,,Đã bán 2,quannam
"Quần tây âu cao cấp, thời trang công sở không ly, form dáng chuẩn, họa tiết vân chìm, có size đại, Amazing",325.000,https://tiki.vn/quan-tay-au-cao-cap-thoi-trang-cong-so-khong-ly-form-dang-chuan-hoa-tiet-van-chim-co-size-dai-amazing-p203177188.html?spid=203177222,12,,,quannam
,,https://tiki.vn/quan-baggy-kaki-nam-tron-ong-con-unisex-phoi-do-thoai-mai-p110696030.html?spid=152690928,13,,,quannam
Quần Jeans nam dáng regular fit 6Q7092 - thương hiệu Viettien,645.000₫,https://tiki.vn/quan-jeans-nam-dang-regular-fit-6q7092-thuong-hieu-viettien-p189467654.html?spid=189467666,14,,Đã bán 3,quannam
QUẦN JEAN NAM SUÔNG ỐNG RỘNG KHÁ BẢNH - MÃ JN017,199.000₫,https://tiki.vn/quan-jean-nam-suong-ong-rong-kha-banh-ma-jn017-p118119643.html?spid=118119704,15,,Đã bán 17,quannam
"Quần Jean Nam Suông, Quần Jean Ống Rộng - Mã 1303",189.000₫,https://tiki.vn/quan-jean-nam-suong-quan-jean-ong-rong-ma-1303-p118119619.html?spid=118119639,16,,Đã bán 7,quannam
Quần Tây Âu Màu Trơn Cho Nam,90.000₫,https://tiki.vn/quan-tay-au-mau-tron-cho-nam-p24864749.html?spid=50509084,17,,,quannam
,,https://tiki.vn/quan-jogger-nam-p6707617.html?spid=6707721,18,,,quannam
Quần kaki nam phong cách jogger thời trang đẹp,93.000₫,https://tiki.vn/quan-kaki-nam-phong-cach-jogger-thoi-trang-dep-p26081106.html?spid=75349456,19,,Đã bán 12,quannam
Quần jean nam rách gối - đen,178.000₫,https://tiki.vn/quan-jean-nam-rach-goi-den-p16591043.html?spid=26398799,20,,Đã bán 27,quannam
"Quần jogger nam chất vải kaki co giãn 4 chiều , bo chun ống chân cá tính trẻ trung, dáng ôm body thời trang, freesize từ 45-76kg, nhiều màu lựa chọn",94.000₫,https://tiki.vn/quan-jogger-nam-chat-vai-kaki-co-gian-4-chieu-bo-chun-ong-chan-ca-tinh-tre-trung-dang-om-body-thoi-trang-freesize-tu-45-76kg-nhieu-mau-lua-chon-p72301525.html?spid=97990569,21,,Đã bán 33,quannam
"Quần Short Đũi Nam Thời Trang Cao Cấp, Quần Ngố Nam Chất Đũi Trẻ Trung",163.000₫,https://tiki.vn/quan-short-dui-nam-thoi-trang-cao-cap-quan-ngo-nam-chat-dui-tre-trung-nang-dong-p16873146.html?spid=56069051,22,,Đã bán 7,quannam
Quần Đùi Nam Đen Chất Đũi SHORTDEN55 (Short Đen),99.000₫,https://tiki.vn/quan-dui-nam-chat-dui-shortden55-p54548393.html?spid=54548401,23,,Đã bán 28,quannam
Quần đùi đũi nam ngắn thời trang Arctic Hunter QD06,122.000₫,https://tiki.vn/quan-dui-dui-nam-ngan-thoi-trang-arctic-hunter-qd06-p122559328.html?spid=122559338,24,,Đã bán 4,quannam
Quần Short Nỉ Lưng Thun Nam Novelty NQNMHTMT3R200046Q - Xám Nhạt,249.000,https://tiki.vn/quan-short-ni-lung-thun-nam-novelty-nqnmhtmt3r200046q-xam-nhat-p53481385.html?spid=53481387,25,,,quannam
,,https://tiki.vn/qua-n-dirtycoins-slimfit-jeans-blue-p271978638.html?spid=271978640,26,,,quannam
Tất nam cổ trung Fasvin mềm mịn co giãn tốt TN21902.HN,19.000₫,https://tiki.vn/tat-nam-co-trung-fasvin-mem-min-co-gian-tot-tn21902-hn-p188916571.html?spid=188916588,27,,Đã bán 15,quannam
Quần Jogger túi hộp 1 khóa kéo dài ống bo gấu - Chất Vải Kaki Kiểu Thể Thao UNISEX một Màu Đen. 02x,117.000₫,https://tiki.vn/quan-jogger-tui-hop-1-khoa-keo-dai-ong-bo-gau-chat-vai-kaki-kieu-the-thao-unisex-mot-mau-den-02x-p249247699.html?spid=249247703,28,,Đã bán 1,quannam
Quần Jean Nam Chất Bò Màu Đen Rách Gối Cao Cấp Co Giản Phong Cách Thời Trang ms960,145.000₫,https://tiki.vn/quan-jean-nam-chat-bo-mau-den-rach-goi-cao-cap-co-gian-phong-cach-thoi-trang-ms960-p104065300.html?spid=104067034,29,,Đã bán 2,quannam
"Quần Jogger Nam thể thao túi hộp thương hiệu Chandi, chất kaki bo chân xu hướng mới nhất CD2",299.000,https://tiki.vn/quan-jogger-nam-the-thao-tui-hop-thuong-hieu-chandi-chat-kaki-bo-chan-xu-huong-moi-nhat-2021-cd2-p86868118.html?spid=86868122,30,,,quannam
,,https://tiki.vn/quan-tay-nam-cong-so-faja-tre-trung-chat-lieu-cao-cap-mau-xanh-than-p16050095.html?spid=16050119,31,,,quannam
Viettien - Quần jeans nam smart casual regular fit 6Q7119,720.000₫,https://tiki.vn/viettien-quan-jeans-nam-smart-casual-regular-fit-6q7119-p155701494.html?spid=155701514,32,,Đã bán 4,quannam
Quần Tây ( Âu ) Nam Dáng Hàn Quốc - Đen - 31,95.150₫,https://tiki.vn/quan-tay-au-nam-dang-han-quoc-den-31-p12705466.html?spid=23247434,33,,Đã bán 171,quannam
Quần Đùi Nam Lưng Thun Bản Rộng - Mẫu Basic,119.000₫,https://tiki.vn/quan-dui-nam-lung-thun-ban-rong-mau-basic-p58841969.html?spid=58841991,34,,Đã bán 40,quannam
"Quần tây âu big size dành cho nam trung niên, form truyền thống, mỗi bên xếp 1 ly, dáng rộng, thương hiệu cao cấp Amazing",379.000,https://tiki.vn/quan-tay-au-big-size-danh-cho-nam-trung-nien-form-truyen-thong-moi-ben-xep-1-ly-dang-rong-thuong-hieu-cao-cap-amazing-p272839497.html?spid=272839527,35,,,quannam
,,https://tiki.vn/quan-tay-nam-novelty-0ply-classic-xanh-den-nqtmmdmprc2210010-p213913785.html?spid=213913795,36,,,quannam
Quần Tây Nam Vải Tuyết Mưa DEN98 (Đen) - 32,102.300₫,https://tiki.vn/quan-tay-nam-vai-tuyet-mua-den98-den-32-p14272845.html?spid=33957044,37,,Đã bán 369,quannam
Quần short túi hộp rằn ri nam ARM-1277,650.000₫,https://tiki.vn/quan-short-tui-hop-ran-ri-nam-arm-1277-p208905525.html?spid=271661181,38,,,quannam
"Quần đùi nam chất đũi thể thao, Quần short nam phong cách trẻ trung năng động QD05 - PROMAN",120.000₫,https://tiki.vn/quan-dui-nam-chat-dui-the-thao-quan-short-nam-phong-cach-tre-trung-nang-dong-qd05-proman-p195881155.html?spid=195881181,39,,Đã bán 3,quannam
Quần short jean nam ống suông Q415 MuiDoi,132.000,https://tiki.vn/quan-short-jean-nam-ong-suong-q415-muidoi-p31265339.html?spid=31265356,40,,,quannam
