title,price,link_item,index,discount,sales,brand
"Máy Ép Trái Cây, Máy Ép Chậm XIAOMI BUD BJ36 Ép Kiệt 95% Lượng Nước Dung Tích 0.75 Lít Công Suất Ép 250 W - Hàng Chính Hãng",1.699.000₫,https://tiki.vn/may-ep-trai-cay-may-ep-cham-xiaomi-bud-bj36-ep-kiet-95-luong-nuoc-dung-tich-0-75-lit-cong-suat-ep-250-w-hang-chinh-hang-p272619066.html?spid=272619067,1,-50%,,Xiaomi
Máy lọc không khí Xiaomi Air Purifier 4 Compact – Bản Quốc Tế - Hàng chính hãng,1.990.000₫,https://tiki.vn/may-loc-khong-khi-xiaomi-air-purifier-4-compact-ban-quoc-te-hang-chinh-hang-p201548779.html?spid=271679150,2,-31%,,Xiaomi
Máy lọc không khí Xiaomi Smart Air Purifier 4 Compact BHR5860EU AC-M18-SC - Hàng chính hãng,1.779.000₫,https://tiki.vn/may-loc-khong-khi-xiaomi-smart-air-purifier-4-compact-bhr5860eu-ac-m18-sc-hang-chinh-hang-p268353381.html?spid=268353382,3,,,Xiaomi
Máy lọc không khí Xiaomi Mi Smart Air Purifier 4 Lite/3H/3H EU 2021 - Hàng chính hãng,2.539.000,https://tiki.vn/may-loc-khong-khi-xiaomi-mi-smart-air-purifier-4-lite-3h-3h-eu-2021-hang-chinh-hang-p196047624.html?spid=196047627,4,,Đã bán 1,Xiaomi
,,https://tiki.vn/robot-hut-bui-lau-nha-xiaomi-vacuum-mop-x10-plus-ban-2023-tu-dong-hut-bui-do-rac-giat-gie-lau-say-kho-bang-khi-nong-va-tu-dong-bo-sung-nuoc-tu-dong-toi-uu-don-dep-camera-ai-thong-minh-luc-hut-4000-pa-cong-suat-46-w-hang-chinh-hang-p250004462.html?spid=250004475,5,-29%,,Xiaomi
Máy Hút Bụi Cầm Tay Deerma Vacuum Cleaner DX700S (Xám đen) - Hàng chính hãng,699.000₫,https://tiki.vn/may-hut-bui-cam-tay-deerma-vacuum-cleaner-dx700s-xam-den-hang-chinh-hang-p71983526.html?spid=72307203,6,,Đã bán 22,Xiaomi
Máy lọc không khí Xiaomi Smart Air Purifier 4 lite - Hàng chính hãng,3.889.000₫,https://tiki.vn/may-loc-khong-khi-xiaomi-smart-air-purifier-4-lite-hang-chinh-hang-p169876641.html?spid=170693720,7,,Đã bán 2,Xiaomi
Lõi lọc không khí Xiaomi Hàng Chính Hãng,619.000₫,https://tiki.vn/loi-loc-khong-khi-xiaomi-hang-chinh-hang-p113337253.html?spid=113337257,8,-50%,Đã bán 10,Xiaomi
Ấm siêu tốc thông minh 1.7L Xiaomi MJDSH03YM - Hàng Chính Hãng,399.000,https://tiki.vn/am-sieu-toc-thong-minh-1-7l-xiaomi-mjdsh03ym-hang-chinh-hang-p192291450.html?spid=192291451,9,,,Xiaomi
,,https://tiki.vn/may-phun-suong-tao-am-khuech-tan-tinh-dau-xiaomi-deerma-f628s-5l-hang-chinh-hang-p262305727.html?spid=184697655,10,-50%,,Xiaomi
"Nồi Cơm Điện XIAOMI GEN 3 Thông Minh Cao Tần, Công Nghệ Vi Áp Suất, 15 Chế Độ Nấu, Kết Nối App, Dung Tích 4L, Công Suất 1100W - Hàng Chính Hãng",2.299.000₫,https://tiki.vn/noi-com-dien-xiaomi-gen-3-thong-minh-cao-tan-cong-nghe-vi-ap-suat-15-che-do-nau-ket-noi-app-dung-tich-4l-cong-suat-1100w-hang-chinh-hang-p196892009.html?spid=196892010,11,-38%,Đã bán 3,Xiaomi
"Robot hút bụi lau nhà thông minh Xiaomi Mop2 pro, có lau rung, có camera AI, lực hút 4000PA, pin 5200mah- Hàng nhập khẩu",6.900.000,https://tiki.vn/robot-hut-bui-lau-nha-thong-minh-xiaomi-mop2-pro-co-lau-rung-co-camera-ai-luc-hut-4000pa-pin-5200mah-hang-nhap-khau-p248743801.html?spid=248743814,12,-41%,,Xiaomi
,,https://tiki.vn/quat-tich-dien-khong-day-xiaomi-gen-3-pro-cong-nghe-xoay-3d-ngang-doc-su-dung-40-gio-lien-tuc-100-toc-do-gio-ai-thong-minh-co-remote-ket-noi-app-cong-suat-35-w-hang-quoc-te-p263020715.html?spid=205507017,13,-50%,,Xiaomi
"Robot Hút Bụi Lau Nhà thông minh Xiaomi Dreame D9 lực hút 3000Pa, pin 5200mah - Hàng Nhập Khẩu",7.400.000₫,https://tiki.vn/robot-hut-bui-lau-nha-thong-minh-xiaomi-dreame-d9-luc-hut-3000pa-pin-5200mah-hang-nhap-khau-p87942532.html?spid=201829146,14,,Đã bán 1,Xiaomi
Nồi cơm điện cao tần Xiaomi Mijia IH gen 2 4L rice cooker - Hàng Nhập Khẩu,2.148.000₫,https://tiki.vn/noi-com-dien-cao-tan-xiaomi-mijia-ih-gen-2-4l-rice-cooker-hang-nhap-khau-p87887698.html?spid=87887699,15,,Đã bán 2,Xiaomi
Robot Bút Bụi Lau Nhà Xiaomi Mijia 3S - 2023 Công Nghệ Lau Xoay 360 Độ Lực Hút 4000 Pa - Hàng Nhập Khẩu,7.499.000₫,https://tiki.vn/robot-hut-bui-lau-nha-xiaomi-imilab-v1-tu-len-ke-hoach-ve-sinh-tu-dong-rua-khay-rac-dien-tich-hoat-dong-200m2-luc-hut-2700-pa-cong-suat-50w-hang-chinh-hang-p203547701.html?spid=203547704,16,-24%,,Xiaomi
Robot hút bụi lau nhà thông minh Xiaomi Mop 2 Ultra tự động đổ rác- Hàng nhập khẩu,8.900.000,https://tiki.vn/robot-hut-bui-lau-nha-thong-minh-xiaomi-mop-2-ultra-tu-dong-do-rac-hang-nhap-khau-p249646326.html?spid=249646338,17,-14%,,Xiaomi
,,https://tiki.vn/may-loc-khong-khi-xiaomi-smart-air-purifier-4-lite-hang-chinh-hang-p206566691.html?spid=206566694,18,-50%,,Xiaomi
Quạt tháp Xiaomi Mi Smart Tower Fan - Hàng Chính Hãng,2.490.000₫,https://tiki.vn/quat-thap-xiaomi-mi-smart-tower-fan-hang-chinh-hang-p262031057.html?spid=262031058,19,,,Xiaomi
Máy Uốn Mi Nhiệt Xiaomi BOMIDI EC1 - Hàng nhập khẩu,179.000₫,https://tiki.vn/may-uon-mi-nhiet-xiaomi-bomidi-ec1-hang-nhap-khau-p222713817.html?spid=222713821,20,,Đã bán 3,Xiaomi
"Máy hút bụi đệm giường Xiaomi diệt khuẩn bằng tia UV dùng cho sofa, gấu bông, gối ôm - Hàng chính hãng",769.000₫,https://tiki.vn/may-hut-bui-dem-giuong-xiaomi-diet-khuan-bang-tia-uv-dung-cho-sofa-gau-bong-goi-om-p194788820.html?spid=194788823,21,-34%,Đã bán 2,Xiaomi
"Lưỡi thay cho Máy cạo râu Xiaomi Mijia S300, S500 - Hàng nhập khẩu",268.000₫,https://tiki.vn/luoi-thay-cho-may-cao-rau-xiaomi-mijia-s300-s500-hang-nhap-khau-p203803250.html?spid=203803251,22,,Đã bán 2,Xiaomi
"Quạt Tích Điện, Quạt Đứng Thông Minh XIAOMI Smartmi Gen 3 Pro/ Smartmi Gen 2S/ Smartmi Gen 2 Lite Tốc Độ Gió Quạt Siêu Êm, Kết Nối App Mihome - Hàng Chính Hãng",1.789.000₫,https://tiki.vn/quat-dung-thong-minh-xiaomi-smartmi-gen-3-pro-smartmi-gen-2s-smartmi-gen-2-lite-toc-do-gio-quat-sieu-em-ket-noi-app-mihome-hang-chinh-hang-p212559533.html?spid=212559536,23,,Đã bán 3,Xiaomi
Phụ kiện thay thế Robot hút bụi Xiaomi Mijia Vacuum Mop - Hàng chính hãng,220.000₫,https://tiki.vn/phu-kien-thay-the-robot-hut-bui-xiaomi-mijia-vacuum-mop-hang-chinh-hang-p178001282.html?spid=178001284,24,,Đã bán 1,Xiaomi
"Máy Ép Trái Cây, Máy Ép Chậm Xiaomi BUD BJ-V10 Ép Kiệt 95% Lượng Nước Dung Tích 0.3 Lít Công Suất Ép 150 W - Hàng Chính Hãng Chờ duyệt",1.299.000,https://tiki.vn/may-ep-trai-cay-may-ep-cham-xiaomi-bud-bj-v10-ep-kiet-95-luong-nuoc-dung-tich-0-3-lit-cong-suat-ep-150-w-hang-chinh-hang-cho-duyet-p270625774.html?spid=270625775,25,,,Xiaomi
,,https://tiki.vn/noi-chien-khong-dau-dien-tu-xiaomi-smart-air-fryer-pro-4-lit-bhr6943eu-maf05-hang-chinh-hang-p262977814.html?spid=262977815,26,,,Xiaomi
[Hàng Nhập Khẩu] Máy hút ẩm Xiaomi New Widetech 12L / 18L / 30L 【Điều khiển giọng nói qua app ◆ Sấy khô ◆ Lọc kháng khuẩn,3.019.000₫,https://tiki.vn/hang-nhap-khau-may-hut-am-xiaomi-new-widetech-12l-18l-30l-dieu-khien-giong-noi-qua-app-say-kho-loc-khang-khuan-p249651912.html?spid=213721733,27,,,Xiaomi
"Robot hút bụi lau nhà Xiaomi Lydsto G2D - Lực hút 3000Pa, làm sạch 3 trong 1, điều khiển giọng nói, tránh vật cản - Hàng chính hãng",5.150.000₫,https://tiki.vn/robot-hut-bui-lau-nha-xiaomi-lydsto-g2d-luc-hut-3000pa-lam-sach-3-trong-1-dieu-khien-giong-noi-tranh-vat-can-hang-chinh-hang-p253285157.html?spid=253285161,28,,Đã bán 1,Xiaomi
Máy Hút Bụi Không Dây Cầm Tay XIAOMI Viomi A9 Pin Rời Thuận Tiện Sạc Điện Siêu Nhẹ Thời Gian Làm Việc 60 Phút Lực Hút 23KPa Công Suất 120 W - Hàng Chính Hãng,4.199.000₫,https://tiki.vn/may-hut-bui-khong-day-cam-tay-xiaomi-viomi-a9-pin-roi-thuan-tien-sac-dien-sieu-nhe-thoi-gian-lam-viec-60-phut-cong-suat-120w-luc-hut-23kpa-hang-chinh-hang-p207747746.html?spid=207747747,29,,,Xiaomi
"Máy Lọc Không Khí XIAOMI Jya Fjord Pro Air Purifier, Hiển Thị Thông Số Không Khí, Cảm Ứng Khử UV, Kết Nối App, Phù Hợp Không Gian 70 m2, Lọc Sạch Tới 99.99% Vi Khuẩn, Công Suất Lọc 550 m3/Giờ - Hàng Chính Hãng",6.559.000,https://tiki.vn/may-loc-khong-khi-xiaomi-jya-fjord-pro-air-purifier-hien-thi-thong-so-khong-khi-cam-ung-khu-uv-ket-noi-app-phu-hop-khong-gian-70-m2-loc-sach-toi-99-99-vi-khuan-cong-suat-loc-550-m3-gio-hang-chinh-hang-p196180084.html?spid=196180085,30,,Đã bán 3,Xiaomi
,,https://tiki.vn/quat-dung-xiaomi-smart-fan-2-lite-hang-chinh-hang-p171992172.html?spid=251772638,31,,,Xiaomi
Bếp điện từ đôi XIAOMI MDCLD01ACM - Hàng nhập khẩu,5.990.000₫,https://tiki.vn/bep-dien-tu-doi-xiaomi-mdcld01acm-hang-nhap-khau-p127046434.html?spid=216204522,32,,,Xiaomi
Tông đơ Xiaomi Enchen Boost / Enchen Hummingbird,209.000₫,https://tiki.vn/tong-do-xiaomi-enchen-boost-enchen-hummingbird-p117969828.html?spid=148848650,33,,Đã bán 16,Xiaomi
"Máy Hút bụi Cầm tay Xiaomi Redkey P7 / Redkey F10 – Lực Hút Khủng 22,000, Pin Rời Tiện Dụng - Hàng chính hãng",3.780.000₫,https://tiki.vn/may-hut-bui-cam-tay-xiaomi-redkey-p7-redkey-f10-luc-hut-khung-22-000-pin-roi-tien-dung-hang-chinh-hang-p196795696.html?spid=190759371,34,,Đã bán 7,Xiaomi
Bàn Ủi Hơi Nước Cầm Tay XIAOMI ZANJIA GT-306W Công Suất 1200 W - Hàng Chính Hãng,639.000,https://tiki.vn/ban-ui-hoi-nuoc-cam-tay-xiaomi-zanjia-gt-306w-cong-suat-1200-w-hang-chinh-hang-p272624441.html?spid=184476521,35,,,Xiaomi
,,https://tiki.vn/loi-loc-khong-khi-xiaomi-smart-air-purifier-4-compact-hang-chinh-hang-p217887588.html?spid=217887589,36,,,Xiaomi
Máy sấy diệt khuẩn quần áo Xiaomi Lydsto HD-YWHL02 (35L) - Hàng nhập khẩu,3.990.000₫,https://tiki.vn/may-say-diet-khuan-quan-ao-xiaomi-lydsto-hd-ywhl02-35l-hang-nhap-khau-p252727144.html?spid=252727145,37,,,Xiaomi
Phụ kiện thay thế Robot hút bụi Xiaomi Mijia Vacuum Mop Pro - Hàng chính hãng,250.000₫,https://tiki.vn/phu-kien-thay-the-robot-hut-bui-xiaomi-mijia-vacuum-mop-pro-hang-chinh-hang-p178100509.html?spid=178100519,38,,Đã bán 28,Xiaomi
"[Hàng Nhập Khẩu] Máy Hút Bụi Cầm Tay Không Dây Xiaomi DEM VC20 Plus【Bình chứa bụi 0,6L ◆ Thời lượng pin 30 phút 】",1.249.000₫,https://tiki.vn/hang-nhap-khau-may-hut-bui-cam-tay-khong-day-deerma-vc20-plus-binh-chua-bui-0-6l-thoi-luong-pin-30-phut-p222389657.html?spid=222389658,39,,,Xiaomi
"Máy Sưởi XIAOMI Smartmi Heater 1S DNQZNB05ZM, Điều Khiển Cảm Ứng, Kết Nối App Mihome, Diện Tích Hoạt Động 20 m2, Công Suất 2200 W - Hàng Chính Hãng - Bản Quốc Tế",2.699.000,https://tiki.vn/may-suoi-xiaomi-smartmi-heater-1s-dnqznb05zm-dieu-khien-cam-ung-ket-noi-app-mihome-dien-tich-hoat-dong-20-m2-cong-suat-2200-w-hang-chinh-hang-p199991285.html?spid=199991286,40,,,Xiaomi
