title,price,link_item,index,discount,sales,category
Tinh dầu nước hoa thơm phòng lọ khuếch tán nước hoa thiên nhiên Hotel Series mùi sang trọng,15.000₫,https://tiki.vn/tinh-dau-nuoc-hoa-thom-phong-lo-khuech-tan-nuoc-hoa-thien-nhien-hotel-series-mui-sang-trong-p262454509.html?spid=262454511,1,-18%,Đã bán 3,chamsocnhacua
Combo Bột rửa bát finish 2.5kg+Muối rửa chén finish 1.2kg+nước bóng 1150ml,299.000₫,https://tiki.vn/combo-bot-rua-bat-finish-2-5kg-muoi-rua-chen-finish-1-2kg-nuoc-bong-1150ml-p205973325.html?spid=273532082,2,-30%,Đã bán 77,chamsocnhacua
Chai Xịt Đuổi Chuột RAT OFF ANTI RAT SPRAY 200ml - Thái Lan,55.000₫,https://tiki.vn/chai-xit-duoi-chuot-rat-off-anti-rat-spray-200ml-thai-lan-p185765587.html?spid=196671821,3,-7%,Đã bán 43,chamsocnhacua
"Hantox 200 thuốc diệt ruồi, muỗi, ve, bọ chét, mạt gà",23.000₫,https://tiki.vn/hantox-200-thuoc-diet-ruoi-muoi-ve-bo-chet-mat-ga-p198640027.html?spid=198640029,4,-18%,Đã bán 99,chamsocnhacua
Nước lau nhà sả chanh Fuwa3e hữu cơ lau sàn đuổi muỗi kiến đậm đặc 1L,125.000₫,https://tiki.vn/nuoc-lau-nha-sa-chanh-fuwa3e-huu-co-lau-san-duoi-muoi-kien-dam-dac-1l-p161211991.html?spid=161211992,5,-21%,Đã bán 71,chamsocnhacua
Nước giặt đồ lót xuất Nhật 300ml,120.000₫,https://tiki.vn/nuoc-giat-do-lot-xuat-nhat-300ml-p272366541.html?spid=272366542,6,-41%,Đã bán 1,chamsocnhacua
"Tinh dầu xịt phòng sả chanh, khử mùi xua đuổi muỗi 100ml",66.000₫,https://tiki.vn/tinh-dau-xit-phong-sa-chanh-khu-mui-xua-duoi-muoi-100ml-p13317674.html?spid=13317675,7,-12%,Đã bán 391,chamsocnhacua
Nước thơm lau sàn nhà Hando 5L hương Quế,95.000₫,https://tiki.vn/nuoc-thom-lau-san-nha-hando-5l-huong-que-p171950062.html?spid=171950063,8,-5%,Đã bán 121,chamsocnhacua
Hút ẩm tủ quần áo tủ giầy tủ bếp phòng ngủ hộp hút ẩm nhật bản tránh nấm mốc khử mùi hôi PU001,40.500₫,https://tiki.vn/hut-am-tu-quan-ao-tu-giay-tu-bep-phong-ngu-hop-hut-am-nhat-ban-tranh-nam-moc-khu-mui-hoi-pu001-p185584398.html?spid=215123933,9,-5%,Đã bán 4,chamsocnhacua
"Chai Xịt Tẩy Rửa Đa Năng 500ML Tẩy Cặn Canxi Trên Vòi INOX, Vách Kính, Gạch Men Nhà Tắm Siêu Sạch, Sáng Bóng",36.899₫,https://tiki.vn/chai-xit-tay-rua-da-nang-500ml-tay-can-canxi-tren-voi-inox-vach-kinh-gach-men-nha-tam-sieu-sach-sang-bong-p221245877.html?spid=253327415,10,-35%,Đã bán 13,chamsocnhacua
Nước ngâm rửa rau củ quả enzyme sinh học từ vỏ dứa Fuwa3e 1000ml / 100ml,11.200₫,https://tiki.vn/nuoc-ngam-rua-rau-cu-qua-enzyme-sinh-hoc-tu-vo-dua-fuwa3e-1000ml-100ml-p271319220.html?spid=271319224,11,-11%,Đã bán 8,chamsocnhacua
"Khăn giấy ăn Oulu 3 lớp, sợi tre tự nhiên siêu dai, thấm hút tốt, thân thiện với môi trường, bảo vệ tài nguyên rừng - Thùng 30 gói 240 tờ - Màu vàng",349.000₫,https://tiki.vn/khan-giay-an-dulu-3-lop-soi-tre-tu-nhien-sieu-dai-tham-hut-tot-than-thien-voi-moi-truong-bao-ve-tai-nguyen-rung-thung-30-goi-240-to-mau-vang-p49636456.html?spid=49636457,12,,Đã bán 349,chamsocnhacua
"Chai tẩy xịt rửa đa năng vệ sinh bếp Kitchen 500ml ,tẩy dầu mỡ , các chất bẩn cứng đầu, hương chanh thơm mát dịu dàng ",92.000₫,https://tiki.vn/chai-tay-xit-rua-da-nang-ve-sinh-bep-kitchen-500ml-tay-dau-mo-cac-chat-ban-cung-dau-huong-chanh-thom-mat-diu-dang-p271517203.html?spid=271517204,13,,Đã bán 2,chamsocnhacua
"bột rửa bát Somat 2,4kg chuyên dùng cho máy",380.000₫,https://tiki.vn/bot-rua-bat-somat-2-4kg-chuyen-dung-cho-may-p121326710.html?spid=125755034,14,,Đã bán 17,chamsocnhacua
Giấy vệ sinh PREMIER VinaRoll Có Lõi - Combo 3 lốc,158.000₫,https://tiki.vn/giay-ve-sinh-premier-vinaroll-co-loi-combo-3-loc-p137228145.html?spid=137228146,15,,Đã bán 58,chamsocnhacua
Combo 03 chai Nước Tẩy Nhà Tắm Mao Bao 600ml,118.000₫,https://tiki.vn/combo-03-chai-nuoc-tay-nha-tam-mao-bao-600ml-c-p10091269.html?spid=10091270,16,,Đã bán 45,chamsocnhacua
"Máy khử mùi tủ lạnh CTFAST : Công nghệ ozone, khử mùi hôi, nấm mốc, loại bỏ dư lượng thuốc trừ sâu, thanh lọc không khí, bảo vệ sức khỏe gia đình",235.000₫,https://tiki.vn/may-khu-mui-tu-lanh-ctfast-cong-nghe-ozone-khu-mui-hoi-nam-moc-loai-bo-du-luong-thuoc-tru-sau-thanh-loc-khong-khi-bao-ve-suc-khoe-gia-dinh-p160693982.html?spid=160693987,17,,Đã bán 195,chamsocnhacua
"Nước tẩy xi măng HT 1,8LIT",138.000₫,https://tiki.vn/nuoc-tay-xi-mang-tvs-h-t01-p2540045.html?spid=56957581,18,,Đã bán 176,chamsocnhacua
"Dung dịch tẩy rửa đa năng Kio Cleaner Kiotool tẩy rửa đầu bò, lốc máy, tẩy rỉ sét, vỏ xe 500 ml",49.000₫,https://tiki.vn/dung-dich-tay-rua-da-nang-kio-cleaner-kiotool-tay-rua-dau-bo-loc-may-tay-ri-set-vo-xe-500-ml-p248770226.html?spid=248770227,19,,Đã bán 8,chamsocnhacua
"Tinh Dầu Khuếch Tán Thơm Phòng Lọ Thủy Tinh Đen , Lọ Hoa Tinh Dầu Khuếch Tán",13.900₫,https://tiki.vn/tinh-dau-khuech-tan-thom-phong-lo-thuy-tinh-den-lo-hoa-tinh-dau-khuech-tan-p170521079.html?spid=273378947,20,,Đã bán 50,chamsocnhacua
"Xịt đuổi chuột Run Away -Thuốc xịt Không mùi, an toàn - Xua đuổi chuột, gián, côn trùng",23.000₫,https://tiki.vn/freeship-xit-duoi-chuot-run-away-thuoc-xit-khong-mui-an-toan-xua-duoi-chuot-gian-con-trung-p198097439.html?spid=249204221,21,,Đã bán 6,chamsocnhacua
Nước làm bóng finish 1150ml+100 Viên rửa bát Finish All in 1+Muối rửa bát Finish 1.5kg,589.000₫,https://tiki.vn/nuoc-lam-bong-finish-1150ml-100-vien-rua-bat-finish-all-in-1-muoi-rua-bat-finish-1-5kg-p205293779.html?spid=273949868,22,,Đã bán 189,chamsocnhacua
Khăn giấy ướt vịt vàng 10 gói kèm thùng nhựa tiện dụng siêu đáng yêu,80.900₫,https://tiki.vn/khan-giay-uot-vit-vang-10-goi-kem-thung-nhua-tien-dung-sieu-dang-yeu-p169324612.html?spid=190547469,23,,Đã bán 14,chamsocnhacua
"Miếng Dán Khử Mùi Than Hoạt Tính, Khử Mùi Toilet - Miếng Dán Khử Mùi Bồn Cầu Nhà Vệ Sinh Siêu Kute",11.900₫,https://tiki.vn/mieng-dan-khu-mui-than-hoat-tinh-khu-mui-toilet-mieng-dan-khu-mui-bon-cau-nha-ve-sinh-sieu-kute-p198448875.html?spid=198448877,24,,Đã bán 18,chamsocnhacua
"Hộp Khăn Giấy Rút ALPHA, 2 Lớp 150 Tờ/hộp",19.000₫,https://tiki.vn/hop-khan-giay-rut-alpha-2-lop-150-to-hop-p57549624.html?spid=57549625,25,,Đã bán 273,chamsocnhacua
"Hộp hút ẩm khử mùi tủ quần áo , tủ giày (3 hộp *500ml) Than hoạt tính Nhật Bản tránh ẩm mốc khử mùi hôi siêu hiệu quả",120.000₫,https://tiki.vn/hop-hut-am-khu-mui-tu-quan-ao-tu-giay-3-hop-500ml-than-hoat-tinh-nhat-ban-tranh-am-moc-khu-mui-hoi-sieu-hieu-qua-p188662662.html?spid=188662666,26,,Đã bán 20,chamsocnhacua
Nước rửa chén On1 hương kiwi và aloe vera 1.4 Kg - gel rửa bát sạch bóng vết dầu mỡ N5007,56.050₫,https://tiki.vn/nuoc-rua-chen-on1-huong-kiwi-va-aloe-vera-1-4-kg-gel-rua-bat-sach-bong-vet-dau-mo-n5007-p222000904.html?spid=222000905,27,,Đã bán 5,chamsocnhacua
"Chất tẩy sơn, tẩy trên bề mặt kim loại Hudson 350cc",32.000₫,https://tiki.vn/chat-tay-son-tay-tren-be-mat-kim-loai-hudson-350cc-p215921785.html?spid=215921786,28,,Đã bán 11,chamsocnhacua
"Hộp Sáp Thơm Phòng Khử Mùi Để Nhà Vệ Sinh, Phòng Ngủ, Nhà Tắm, Ô Tô Cỡ Lỡn 260g",23.999₫,https://tiki.vn/hop-sap-thom-phong-khu-mui-de-nha-ve-sinh-phong-ngu-nha-tam-o-to-co-lon-260g-p186286349.html?spid=197029627,29,,Đã bán 2,chamsocnhacua
Giấy vệ sinh không lõi bịch 36 cuộn 4 lớp nặng 1.8kg dai mềm mịn dễ phân hủy.,74.000₫,https://tiki.vn/giay-ve-sinh-khong-loi-bich-36-cuon-4-lop-nang-1-8kg-dai-mem-min-de-phan-huy-p166102275.html?spid=166102276,30,,Đã bán 69,chamsocnhacua
"Dây lò xo thông ống thoát nước, thông bồn cầu vệ sinh bằng thép dài 2 mét, 5 mét, 10 mét, 15 mét",35.000₫,https://tiki.vn/day-thong-duong-ong-thoat-nuoc-thong-bon-cau-ve-sinh-bang-thep-dai-2-met-5-met-10-met-15-met-p182741544.html?spid=182741558,31,,Đã bán 3,chamsocnhacua
COMBO (10 bịch/ 100 cuộn) Giấy vệ sinh Ero giá sỉ chất lượng (10 cuộn/ bịch),155.000₫,https://tiki.vn/combo-10-bich-100-cuon-giay-ve-sinh-ero-gia-si-chat-luong-10-cuon-bich-p176050461.html?spid=176050466,32,,Đã bán 15,chamsocnhacua
1 thùng (30 gói) Giấy ăn gấu trúc SAKARA mặt cười 1 tờ 4 lớp mềm dai không bụi giấy lau an toàn cho sức khoẻ...,148.000₫,https://tiki.vn/1-thung-30-goi-giay-an-gau-truc-sakara-mat-cuoi-1-to-4-lop-mem-dai-khong-bui-giay-lau-an-toan-cho-suc-khoe-p146893376.html?spid=183570637,33,,Đã bán 110,chamsocnhacua
Nước hoa thơm phòng Areon Home Peony Blossom - hương Hoa Mẫu Đơn ( Dịu Nhẹ - Đằm Thắm ),430.000₫,https://tiki.vn/nuoc-hoa-thom-phong-areon-peony-blossom-huong-hoa-mau-don-diu-nhe-dam-tham-p181902963.html?spid=181902964,34,,Đã bán 5,chamsocnhacua
"Combo 27 Gói Khăn Giấy Bỏ Túi LET-GREEN, 10 Tờ/Gói",36.500₫,https://tiki.vn/combo-27-goi-khan-giay-bo-tui-let-green-10-to-goi-p271385697.html?spid=271385698,35,,Đã bán 3,chamsocnhacua
"Bột SODIUM PERCACBONAT 100g Tẩy Vết Bẩn Ố Vàng, Tẩy Sạch Hiệu Quả Quần Áo, Đồ Gia Dụng, Lồng Máy Giặt...",39.000₫,https://tiki.vn/bot-sodium-percacbonat-100g-tay-vet-ban-o-vang-tay-sach-hieu-qua-quan-ao-do-gia-dung-long-may-giat-p170083720.html?spid=170083725,36,,Đã bán 12,chamsocnhacua
"Khăn giấy lụa cao cấp Arosa Túi 10 Gói 300 tờ 3 lớp Trắng tự nhiên, Đa công dụng và tiện lợi, Phù hợp cho cả mẹ bầu và em bé, 100% bột giấy nguyên sinh rừng trồng",59.000₫,https://tiki.vn/khan-giay-lua-cao-cap-arosa-tui-10-goi-300-to-3-lop-trang-tu-nhien-da-cong-dung-va-tien-loi-phu-hop-cho-ca-me-bau-va-em-be-100-bot-giay-nguyen-sinh-rung-trong-p194954221.html?spid=194954222,37,,Đã bán 21,chamsocnhacua
Dung Dịch Tẩy Rửa Vết Bẩn Ghế Sofa Nội Thất Bằng Vải Nỉ Cao Cấp 500ml,95.000₫,https://tiki.vn/dung-dich-tay-rua-vet-ban-ghe-sofa-noi-that-bang-vai-ni-cao-cap-500ml-p76478510.html?spid=185215682,38,,Đã bán 4,chamsocnhacua
Nước xả vải Hygiene Thái Lan đậm đặc Túi 1150ml,131.000₫,https://tiki.vn/nuoc-xa-vai-hygiene-thai-lan-dam-dac-tui-1150ml-p270062834.html?spid=271829423,39,,Đã bán 2,chamsocnhacua
Nước hoa xịt thơm phòng Auramax 300ml,69.300₫,https://tiki.vn/nuoc-hoa-xit-phong-auramax-300ml-p12352409.html?spid=12352439,40,,Đã bán 1.0k,chamsocnhacua
