title,price,link_item,index,discount,sales,category
combo đồ chơi gỗ cho bé 6 - 7 món,108.000₫,https://tiki.vn/combo-do-choi-go-cho-be-6-7-mon-p171613055.html?spid=190792377,1,-5%,Đã bán 28,dochoi
Robot biến hình ôtô Transformer cao 20cm mẫu Optimus Prime OP-20,207.100₫,https://tiki.vn/robot-bien-hinh-oto-transformer-cao-20cm-mau-optimus-prime-op-20-p104488381.html?spid=104488383,2,-8%,Đã bán 45,dochoi
"Xe đạp 3 bánh, xe đạp trẻ em có giỏ đựng đồ cao cấp dành cho bé từ 1-6 tuổi",249.000₫,https://tiki.vn/xe-dap-3-banh-xe-dap-tre-em-co-gio-dung-do-cao-cap-danh-cho-be-tu-1-6-tuoi-p160881403.html?spid=250723951,3,-5%,Đã bán 2,dochoi
Gấu bông Búp Bê Váy Nhung Tim Đủ Size Cao Cấp Gấu Bông City,145.000₫,https://tiki.vn/gau-bong-bup-be-vay-nhung-tim-du-size-cao-cap-gau-bong-city-p118666210.html?spid=198350284,4,-16%,Đã bán 13,dochoi
"Xe Trượt Scooter Trẻ Em Có Ghế Gấp Gọn 3 Bánh Phát Sáng, Có Nhạc Và Đèn Báo, Dành Cho Bé Từ 2-12 Tuổi",212.000₫,https://tiki.vn/xe-truot-scooter-tre-em-co-ghe-gap-gon-3-banh-phat-sang-co-nhac-va-den-bao-danh-cho-be-tu-2-12-tuoi-p74190242.html?spid=185913736,5,-29%,Đã bán 44,dochoi
Đồ chơi Pop it thế hệ mới - máy game giải trí bấm nút theo đèn nhạc với nhiều level giảm stress cho mọi lứa tuổi,95.000₫,https://tiki.vn/do-choi-pop-it-the-he-moi-may-game-giai-tri-bam-nut-theo-den-nhac-voi-nhieu-level-giam-stress-cho-moi-lua-tuoi-p271290961.html?spid=273893703,6,-35%,,dochoi
Bộ đồ chơi lắp ráp xếp hình xe tăng,320.000₫,https://tiki.vn/bo-lego-lap-rap-xep-hinh-xe-tang-lewan-block-99a-945-chi-tiet-p168856200.html?spid=168856204,7,-26%,Đã bán 5,dochoi
"Bộ 4 tấm Thảm xốp trải sàn cho bé ECOBABY, thảm xốp eva đạt tiệu chuẩn Mỹ và Châu Âu - kích thước 1 tấm 60x60cm, độ dày 1cm - màu xanh ngọc",134.900₫,https://tiki.vn/bo-4-tam-tham-xop-lot-san-an-toan-thoai-tan-thanh-mau-xanh-ngoc-60x60cm-p13781813.html?spid=13781814,8,-32%,Đã bán 157,dochoi
"Xe trượt Scooter cho bé, có 5 nấc chỉnh độ cao, bánh chống truợt phát sáng cơ,cho bé từ 3-15 tuổi",567.000₫,https://tiki.vn/xe-truot-scooter-cho-be-co-5-nac-chinh-do-cao-banh-chong-truot-phat-sang-co-cho-be-tu-3-15-tuoi-p262905626.html?spid=262905632,9,-15%,Đã bán 18,dochoi
"Bộ đồ chơi bác sĩ KAVY kèm cặp đựng tiện lợi, giúp bé nhận biết dụng cụ, quan sát học hỏi",129.000₫,https://tiki.vn/bo-do-choi-bac-si-kavy-kem-cap-dung-tien-loi-giup-be-nhan-biet-dung-cu-quan-sat-hoc-hoi-p74880858.html?spid=74880859,10,-10%,Đã bán 110,dochoi
Đồ chơi lắp ráp gỗ 3D Mô hình Hộp nhạc Secret Garden DIY Mechanical Music Box AMK52,569.000₫,https://tiki.vn/do-choi-lap-rap-go-3d-mo-hinh-hop-nhac-secret-garden-diy-mechanical-music-box-amk52-p75048811.html?spid=75048812,11,-27%,Đã bán 42,dochoi
Sách vải tương tác PiPo - Khám phá đại dương,75.000₫,https://tiki.vn/sach-vai-tuong-tac-pipo-kham-pha-dai-duong-p101579404.html?spid=101579410,12,-23%,Đã bán 61,dochoi
Đồ chơi cờ vua quốc tế,129.000₫,https://tiki.vn/do-choi-co-vua-quoc-te-sato058-p120475834.html?spid=120475836,13,-35%,Đã bán 6,dochoi
"Quây cũi, nhà banh, lều chơi bóng cho bé, Nhà bóng cho bé khung inox loại tốt",244.000₫,https://tiki.vn/quay-cui-nha-banh-leu-choi-bong-cho-be-nha-bong-cho-be-khung-inox-loai-tot-p212358041.html?spid=212358042,14,-35%,Đã bán 11,dochoi
Đồ chơi chong chóng xoay có đèn led bay siêu cao,7.000₫,https://tiki.vn/do-choi-chong-chong-xoay-co-den-led-bay-sieu-cao-p169935914.html?spid=169935918,15,-5%,Đã bán 120,dochoi
Đồ Chơi Lắp Ráp Pokemon Pikachu Rồng Charizard 273 Chi Tiết B0108 Cho Trẻ Từ 6 Tuổi,359.000₫,https://tiki.vn/do-choi-lap-rap-pokemon-pikachu-rong-charizard-273-chi-tiet-b0108-cho-tre-tu-6-tuoi-p200742851.html?spid=200742853,16,-18%,Đã bán 1,dochoi
"Đồ chơi gỗ cao cấp Bản đồ Việt Nam, kích thích các giác quan của bé, rèn luyện sự khéo léo, đồng thời cho bé làm quen với những kiến thức cơ bản về địa lý Việt Nam - Sản xuất tại Việt Nam",99.000₫,https://tiki.vn/do-choi-go-ban-do-viet-nam-kich-thich-cac-giac-quan-cua-be-ren-luyen-su-kheo-leo-dong-thoi-cho-be-lam-quen-voi-nhung-kien-thuc-co-ban-ve-dia-ly-viet-nam-san-xuat-tai-viet-nam-p193418821.html?spid=193418822,17,,Đã bán 5,dochoi
Hộp quà tặng búp bê công chúa băng giá Elsa ( kèm 12 bộ váy),299.000₫,https://tiki.vn/hop-qua-tang-bup-be-cong-chua-bang-gia-elsa-kem-12-bo-vay-p180401223.html?spid=205279853,18,,Đã bán 4,dochoi
Bộ Trò Chơi Thẻ Bài Board Game The Settlers of Catan Chất Lượng Cao,345.000₫,https://tiki.vn/bo-tro-choi-the-bai-board-game-the-settlers-of-catan-chat-luong-cao-p205059901.html?spid=205059902,19,,Đã bán 9,dochoi
Xe scooter trẻ em Scoot and Ride Highwaykick 1 màu Blueberry,1.870.000₫,https://tiki.vn/xe-scooter-tre-em-scoot-and-ride-highwaykick-1-mau-blueberry-p185189909.html?spid=185189910,20,,Đã bán 3,dochoi
Đi Tìm Kho Báu Mini 1 Foxi,48.000₫,https://tiki.vn/di-tim-kho-bau-mini-1-foxi-p1343555.html?spid=1114092,21,,Đã bán 425,dochoi
Tranh xếp hình Tia Sáng Phóng viên tập sự ( 108 mảnh),24.300₫,https://tiki.vn/tranh-xep-hinh-tia-sang-phong-vien-tap-su-108-manh-p19757375.html?spid=19757376,22,,Đã bán 25,dochoi
Xe Trượt Scooter Globber Flow Foldable 125 - Xanh Dương,2.880.000₫,https://tiki.vn/xe-truot-scooter-globber-flow-foldable-125-xanh-duong-p9839364.html?spid=9839365,23,,Đã bán 14,dochoi
Mô Hình Máy Bay Trưng Bày Airbus A380 Singapore Airlines Everfly (Trắng Xanh Đậm),169.000₫,https://tiki.vn/mo-hinh-may-bay-trung-bay-airbus-a380-singapore-airlines-everfly-trang-xanh-dam-p1473443.html?spid=1474523,24,,Đã bán 47,dochoi
"Ảo Thuật Dây Đứt Hóa Lành, Đạo Cụ Biểu Diễn Đường Phố, Đồ Chơi Thông Minh, Sáng Tạo Dành Cho Bé,Broken Rope Magic Trick",10.000₫,https://tiki.vn/ao-thuat-day-dut-hoa-lanh-dao-cu-bieu-dien-duong-pho-do-choi-thong-minh-sang-tao-danh-cho-be-broken-rope-magic-trick-p184240229.html?spid=184240233,25,,Đã bán 10,dochoi
Đồ Chơi Xếp Hình Nam Châm Cầu Vồng Đa Sắc Mideer Colorful Magnetic Tiles,469.000₫,https://tiki.vn/do-choi-xep-hinh-nam-cham-cau-vong-da-sac-mideer-colorful-magnetic-tiles-p189428170.html?spid=273235789,26,,Đã bán 4,dochoi
Con Quay Delta Spinner Dạ Quang 3 Cánh,337.500₫,https://tiki.vn/con-quay-delta-spinner-da-quang-3-canh-p146414036.html?spid=146414040,27,,Đã bán 21,dochoi
"Đồ chơi DIY - Xe đua, lắp ghép, khoa học tự làm",100.000₫,https://tiki.vn/do-choi-diy-xe-dua-lap-ghep-khoa-hoc-tu-lam-p252880178.html?spid=252880180,28,,Đã bán 2,dochoi
Trò chơi trí tuệ nhật bản,39.000₫,https://tiki.vn/tro-choi-tri-tue-nhat-ban-p252387908.html?spid=252387909,29,,Đã bán 112,dochoi
"Bộ Bảng Số Thông Minh Bằng Gỗ , Bộ Đồ Chơi Câu Cá Và Ghép Số Học Đếm 63 Chi Tiết Cho Bé",88.800₫,https://tiki.vn/bo-bang-so-thong-minh-bang-go-bo-do-choi-cau-ca-va-ghep-so-hoc-dem-63-chi-tiet-cho-be-p103259221.html?spid=172155040,30,,Đã bán 19,dochoi
Đồ chơi Nhân vật Mô hình Quái Vật Khổng Lồ Venom Carnage Bigfig X0327,42.000₫,https://tiki.vn/do-choi-nhan-vat-mo-hinh-quai-vat-khong-lo-venom-carnage-bigfig-x0327-p181929027.html?spid=181929033,31,,Đã bán 7,dochoi
Đồ chơi ghép hình chính hãng Mideer Huge Animal Dinosaur World MD3083 - Thế giới khủng long (280 mảnh ghép),299.000₫,https://tiki.vn/do-choi-ghep-hinh-chinh-hang-mideer-huge-animal-dinosaur-world-md3083-the-gioi-khung-long-280-manh-ghep-p152618921.html?spid=152618922,32,,Đã bán 13,dochoi
Quây Bóng Vuông Cho Bé Kèm Rổ Bóng Tặng Kèm Bóng 10 Quả,279.000₫,https://tiki.vn/quay-bong-vuong-cho-be-kem-ro-bong-tang-kem-bong-10-qua-p90852568.html?spid=90852575,33,,Đã bán 3,dochoi
CẦU TRƯỢT CHO BÉ ( KM TẶNG BÓNG VÀ RỔ),390.000₫,https://tiki.vn/cau-truot-cho-be-km-tang-bong-va-ro-p217476123.html?spid=217476133,34,,Đã bán 1,dochoi
Đồ chơi gỗ Bảng nam châm học phép toán và que tính - HG2034,91.000₫,https://tiki.vn/do-choi-go-bang-nam-cham-hoc-phep-toan-va-que-tinh-hg2034-p13605144.html?spid=103109310,35,,Đã bán 5,dochoi
Đồ Chơi Xếp Hình 7 cấp độ Mideer puzzles Level Up 3 Natural Scenery Đồ chơi phát triển cho bé,265.000₫,https://tiki.vn/do-choi-xep-hinh-7-cap-do-mideer-puzzles-level-up-3-natural-scenery-do-choi-phat-trien-cho-be-p225255034.html?spid=225255045,36,,Đã bán 1,dochoi
"Bộ đồ chơi dụng cụ xây dựng cho bé từ 2 tuổi - Luyện tập kĩ năng cơ bản cho bé - Đồ Chơi Gỗ, Đồ Chơi Mầm Non An Toàn Bé Phát Triển",181.000₫,https://tiki.vn/bo-do-choi-dung-cu-xay-dung-cho-be-tu-2-tuoi-luyen-tap-ki-nang-co-ban-cho-be-do-choi-go-do-choi-mam-non-an-toan-be-phat-trien-p270371278.html?spid=270371279,37,,Đã bán 2,dochoi
Đồ Chơi Giáo Dục STEM – Giàn Nâng Thủy Lực,61.750₫,https://tiki.vn/do-choi-giao-duc-stem-gian-nang-thuy-luc-p203843201.html?spid=203843202,38,,Đã bán 6,dochoi
Bộ tranh xếp hình ghép hình Mideer 280 mảnh ghép - Vỏ sò cá heo,295.000₫,https://tiki.vn/bo-tranh-xep-hinh-ghep-hinh-mideer-280-manh-ghep-vo-so-ca-heo-p137955473.html?spid=137955474,39,,Đã bán 10,dochoi
Sách Vải Cho Bé Kích Thích Thị Giác Phát Triển Kĩ Năng Đa Dạng Chủ Đề,29.000₫,https://tiki.vn/sach-vai-cho-be-kich-thich-thi-giac-phat-trien-ki-nang-da-dang-chu-de-p201125397.html?spid=201125409,40,,Đã bán 24,dochoi
