title,price,link_item,index,discount,sales,category
Áo thun Nam tay dài ATN90 Sọc Trắng,99.000₫,https://tiki.vn/ao-thun-nam-tay-dai-atn90-soc-trang-p53708144.html?spid=53708148,1,-50%,Đã bán 6,aoni
Áo thun len dài nam ATN78 ( Phối màu đỏ ),99.000₫,https://tiki.vn/ao-thun-len-dai-nam-atn78-phoi-mau-do-p9149205.html?spid=9149207,2,-34%,Đã bán 2,aoni
Áo gile len sọc màu hoạ tiết kim cương phong cách thời trang hàn quốc,139.000₫,https://tiki.vn/ao-gile-len-soc-mau-hoa-tiet-kim-cuong-phong-cach-thoi-trang-han-quoc-p190582763.html?spid=190582767,3,,Đã bán 1,aoni
Áo Len Nam Chất Lông Cừu dày dặn Fom Hàn Quốc,200.000,https://tiki.vn/ao-len-nam-chat-long-cuu-day-dan-fom-han-quoc-p144537635.html?spid=144537650,4,,,aoni
,,https://tiki.vn/hcm-ao-khoac-ni-form-rong-hinh-in-theu-phong-cach-han-quoc-unisex-sieu-dep-cho-cac-ban-p201878943.html?spid=201879000,5,,,aoni
Áo Nỉ Dài Tay Generos MF010123011 AP073,495.000₫,https://tiki.vn/ao-ni-dai-tay-generos-mf010123011-ap073-p273121210.html?spid=273121212,6,,,aoni
Áo Len Nam thời trang AE01,239.000₫,https://tiki.vn/ao-len-nam-thoi-trang-ae01-p14901032.html?spid=14901048,7,,,aoni
Áo Sweater Trơn Chất Nỉ Lót Bông Màu Nude - Sweater Unisex - MM,109.000₫,https://tiki.vn/ao-sweater-tron-chat-ni-lot-bong-mau-nude-sweater-unisex-mm-p108410186.html?spid=108410194,8,,,aoni
Áo len nam xù form ôm BS80,199.000,https://tiki.vn/ao-len-nam-xu-form-om-bs80-p45153946.html?spid=45153962,9,,,aoni
,,https://tiki.vn/ao-len-nam-long-tho-co-tron-quang-chau-p98834201.html?spid=197879142,10,,,aoni
Áo Nỉ Tay Dài Nam DAIZ PSG Big Logo Sweatshirt - SIZE L-XL,190.000₫,https://tiki.vn/ao-ni-tay-dai-nam-daiz-psg-big-logo-sweatshirt-size-xl-xxl-p178583030.html?spid=212079926,11,,,aoni
Áo len nam cổ tròn chất đẹp - xuongaolen.com,250.000,https://tiki.vn/ao-len-nam-co-tron-chat-dep-xuongaolen-com-p98834757.html?spid=272272134,12,,,aoni
,,https://tiki.vn/ao-len-nam-co-tim-soi-pha-cotton-xuongaolen-com-p98834108.html?spid=98834116,13,,,aoni
Áo Khoác Free Fire BooYah [ HÀNG MỚI VỀ ] Màu Đen Có Nón Cực Chất 2021,141.000₫,https://tiki.vn/ao-khoac-free-fire-booyah-hang-moi-ve-mau-den-co-non-cuc-chat-2021-p84760204.html?spid=84760212,14,,Đã bán 1,aoni
Áo Len Nam AE81,199.000₫,https://tiki.vn/ao-len-nam-ae81-p8120727.html?spid=57988335,15,,Đã bán 1,aoni
Áo Len Nam Cổ Tròn Mùa Đông - Vàng,458.000₫,https://tiki.vn/ao-len-nam-co-tron-mua-dong-p272467886.html?spid=272467940,16,,,aoni
Áo Chất Liệu Nỉ Cao Cấp,910.000,https://tiki.vn/ao-chat-lieu-ni-cao-cap-p94840566.html?spid=94840597,17,,,aoni
,,https://tiki.vn/hang-san-ao-len-det-kim-co-cao-cho-nu-al03-hang-quang-chau-cao-cap-p270717125.html?spid=270717127,18,,,aoni
Áo len nam cổ tim lông cừu xịn- xuongaolen.com,325.000₫,https://tiki.vn/ao-len-nam-co-tim-long-cuu-xin-xuongaolen-com-p98835112.html?spid=98835265,19,,Đã bán 1,aoni
Áo len cổ lọ nam KING Áo len cổ cao vân nhẹ dày T11,229.000₫,https://tiki.vn/ao-len-co-lo-nam-king-ao-len-co-cao-van-nhe-day-t11-p243091535.html?spid=243097599,20,,,aoni
"Áo len nam cổ lọ tay dài Hàn Quốc chất len dệt kim đẹp,mềm mịn, không xù giữ nhiệt tốt thời trang cao cấp ABABA ABA-LOM9",230.000₫,https://tiki.vn/ao-len-nam-co-lo-tay-dai-han-quoc-chat-len-det-kim-dep-mem-min-khong-xu-giu-nhiet-tot-thoi-trang-cao-cap-ababa-aba-lom9-p206230809.html?spid=206230831,21,,,aoni
Áo Len Nam Đẹp AE118,219.000₫,https://tiki.vn/ao-len-nam-dep-ae118-p11850473.html?spid=11850481,22,,,aoni
Aó len nam ấm đẹp thời trang,275.000₫,https://tiki.vn/ao-len-nam-am-dep-thoi-trang-p17460590.html?spid=17460596,23,,Đã bán 4,aoni
Bộ nỉ kéo khóa nam Aligro BN8,1.045.000₫,https://tiki.vn/bo-ni-keo-khoa-nam-aligro-bn8-p145371822.html?spid=145371826,24,,Đã bán 1,aoni
Áo Len Nam Cổ Lọ Number5 Mẫu Mới Nhất 2021,190.000,https://tiki.vn/ao-len-nam-co-lo-number5-mau-moi-nhat-2021-p132816166.html?spid=146112260,25,,,aoni
,,https://tiki.vn/ao-polo-vai-ca-sau-unisex-nam-nu-form-rong-co-co-the-craft-house-p271979819.html?spid=271979831,26,,,aoni
Áo len dài tay ALEND053,599.500₫,https://tiki.vn/ao-len-dai-tay-aligro-alend053-p9820538.html?spid=9820544,27,,Đã bán 1,aoni
Áo len nam cổ cài cúc lông thỏ,220.000₫,https://tiki.vn/ao-len-nam-co-cai-cuc-long-tho-p130814869.html?spid=130815019,28,,Đã bán 2,aoni
Áo Sweater kẻ đen trắng 100% cotton mềm mịn nam nữ mặc được ulzzang - ẢNH THẬT,205.000₫,https://tiki.vn/ao-sweater-ke-den-trang-100-cotton-mem-min-nam-nu-mac-duoc-ulzzang-anh-that-p158764274.html?spid=158764398,29,,,aoni
Áo len nam cổ tim chữ lông chuột,325.000,https://tiki.vn/ao-len-nam-co-tim-chu-long-chuot-p98834442.html?spid=98834448,30,,,aoni
,,https://tiki.vn/ao-hoodie-nam-nu-chat-lieu-ni-day-dan-chat-luong-p146273352.html?spid=146273410,31,,,aoni
Áo len nam cổ tròn kẻ m9,195.000₫,https://tiki.vn/ao-len-nam-co-tron-ke-m9-p98834315.html?spid=98834339,32,,,aoni
"áo nỉ sweater thu đông nam nữ trơn, áo nỉ bông da cá siêu đẹp",85.000₫,https://tiki.vn/ao-sweater-nam-nu-tron-ni-bong-da-ca-sieu-dep-p96880034.html?spid=196409761,33,,,aoni
Áo len nam cadigan hàn quốc,195.000₫,https://tiki.vn/ao-len-nam-cadigan-han-quoc-p98834110.html?spid=98834143,34,,Đã bán 1,aoni
"Áo len nam cổ tròn dài tay ô vuông, áo len nam cao cấp phong cách trẻ trung AL05 - MINHSTORE",156.000,https://tiki.vn/ao-len-nam-co-tron-dai-tay-o-vuong-ao-len-nam-cao-cap-phong-cach-tre-trung-al05-minhstore-p214152307.html?spid=214152322,35,,,aoni
,,https://tiki.vn/ao-ni-da-ca-nam-dai-tay-t41-p131417965.html?spid=131419605,36,,,aoni
"Áo nỉ - thời trang cho phái mạnh, kiểu dáng dài tay (T41)",169.000₫,https://tiki.vn/ao-ni-thoi-trang-cho-phai-manh-kieu-dang-dai-tay-t41-p131418343.html?spid=131418636,37,,Đã bán 3,aoni
"ÁO LEN NAM CỔ TIM HÀN QUỐC CAO CẤP, ÁO LEN CỔ TIM THỜI THƯỢNG TRẺ TRUNG LỊCH LÃM AL02 - PROMAN",110.000₫,https://tiki.vn/ao-len-nam-co-tim-han-quoc-cao-cap-ao-len-co-tim-thoi-thuong-tre-trung-lich-lam-al02-proman-p214162498.html?spid=214162522,38,,Đã bán 1,aoni
Aó len nam ấm đẹp thời trang,219.000₫,https://tiki.vn/ao-len-nam-am-dep-thoi-trang-p17465324.html?spid=17465328,39,,,aoni
"Áo Sweater JL Oversize Charging, JACKLANE, Áo nỉ chui đầu unisex Jack Lane",220.000,https://tiki.vn/ao-sweater-jl-oversize-charging-jacklane-ao-ni-chui-dau-unisex-jack-lane-p160516779.html?spid=160516792,40,,,aoni
