title,price,link_item,index,discount,sales,category
"Bộ Pijama nữ cộc tay quần dài họa tiết phối trắng đen độc đáo, chất cotton 100% mềm thoáng",400.000₫,https://tiki.vn/bo-pijama-nu-coc-tay-quan-dai-hoa-tiet-phoi-trang-den-doc-dao-chat-cotton-100-mem-thoang-p185262356.html?spid=185262363,1,,Đã bán 1,dongu
"Đồ bộ pijama mặc nhà nữ, lụa latin",370.000₫,https://tiki.vn/do-bo-pijama-mac-nha-nu-lua-latin-p140563312.html?spid=140563313,2,-40%,Đã bán 2,dongu
"Đầm ngủ WANNABE DNS18 váy ngủ lụa cut out eo mông đan dây lưng xxx nóng bỏng, có thể tự do mở dây thật quyến rũ",420.000₫,https://tiki.vn/dam-ngu-phi-lua-cao-cap-wannabe-dns18-dan-lung-nong-bong-quyen-ru-p174849270.html?spid=174849278,3,-19%,,dongu
"Bộ Đồ Mặc Nhà Cho Người Trung Niên, Người Lớn Tuổi NG42",290.000,https://tiki.vn/bo-do-mac-nha-cho-nguoi-trung-nien-nguoi-lon-tuoi-ng42-p13685091.html?spid=13685095,4,,,dongu
,,https://tiki.vn/bo-pijama-nu-mac-o-nha-chat-lua-min-mat-it-nhan-p271518713.html?spid=271518717,5,,,dongu
Váy ngủ ren gợi cảm trong suốt kèm quần chip,89.000₫,https://tiki.vn/vay-ngu-ren-goi-cam-trong-suot-kem-quan-chip-p57719741.html?spid=57719742,6,-29%,Đã bán 17,dongu
"Bộ Ngủ Nữ Tay Ngắn Bồng Mặc Mùa Hè - Đồ Bộ Lụa Tơ Cao Cấp Quần Đùi Mặc Ở Nhà Nữ, Nhiều Họa Tiết Dễ Thương",459.000₫,https://tiki.vn/bo-ngu-nu-tay-ngan-bong-mac-mua-he-do-bo-lua-to-cao-cap-quan-dui-mac-o-nha-nu-nhieu-hoa-tiet-de-thuong-p148556553.html?spid=148556561,7,-23%,Đã bán 6,dongu
Váy ngủ quảng châu cao cấp G13- Váy ngủ sexy gợi cảm - Áo choàng sexy - Đầm ngủ sexy - Váy ngủ mặc nhà - Váy ngủ đẹp,104.000₫,https://tiki.vn/vay-ngu-quang-chau-cao-cap-g13-vay-ngu-sexy-goi-cam-ao-choang-sexy-dam-ngu-sexy-vay-ngu-mac-nha-vay-ngu-dep-p103358480.html?spid=103358573,8,,Đã bán 9,dongu
Set cosplay học sinh siêu xinh sexy,159.000,https://tiki.vn/set-cosplay-hoc-sinh-sieu-xinh-sexy-p145179146.html?spid=145179194,9,,Đã bán 1,dongu
,,https://tiki.vn/set-nu-canh-sieu-xinh-sexy-giao-hoa-toc-hcm-p155705438.html?spid=155705445,10,,,dongu
Áo choàng ngủ nữ chất voan lụa mềm mại kèm bộ lót - Đen xanh,85.000₫,https://tiki.vn/ao-choang-ngu-nu-chat-voan-lua-mem-mai-kem-bo-lot-den-xanh-p48319064.html?spid=48319065,11,,Đã bán 6,dongu
Váy ngủ hai dây ren dọc xuyên thấu form ngắn sexy Q99 - Đầm ngủ form ngắn ren dọc gợi cảm - Váy ngủ,149.000,https://tiki.vn/vay-ngu-hai-day-ren-doc-xuyen-thau-form-ngan-sexy-q99-dam-ngu-form-ngan-ren-doc-goi-cam-vay-ngu-p207882663.html?spid=207882664,12,,,dongu
,,https://tiki.vn/pijama-lua-gam-cao-cap-du-size-p67517401.html?spid=71004839,13,,,dongu
Dreamy VX20 Váy Ngủ Lụa Cao Cấp Hai Dây Phối Ren Dáng Xòe Trẻ Trung Quyến Rũ,112.200₫,https://tiki.vn/dreamy-vx20-vay-ngu-lua-cao-cap-hai-day-phoi-ren-dang-xoe-tre-trung-quyen-ru-p111956986.html?spid=111957007,14,,Đã bán 7,dongu
"Bộ 2 dây nữ, bộ đồ mặc nhà vải đũi mềm nhẹ, thoáng mát, nhiều màu size từ 40 - 75 kg, phong cách năng động dễ thương",160.000₫,https://tiki.vn/bo-2-day-nu-bo-do-mac-nha-vai-dui-mem-nhe-thoang-mat-nhieu-mau-size-tu-40-75-kg-phong-cach-nang-dong-de-thuong-p191298492.html?spid=191298509,15,,Đã bán 2,dongu
Đồ Bộ Ngủ Pijama Mặc Nhà Tay Dài Quần Dài Hàng Thiết Kế Chất Liệu Lụa Cao Cấp,225.000₫,https://tiki.vn/do-bo-ngu-pijama-mac-nha-tay-dai-quan-dai-hang-thiet-ke-chat-lieu-lua-cao-cap-p158815494.html?spid=158815496,16,,Đã bán 4,dongu
Đồ Ngủ Sexy Nữ|Váy 2 Dây Quyến Rũ️ ️ Chất Phi Lụa Mềm Mịn Sang Chảnh,79.000₫,https://tiki.vn/do-ngu-sexy-nu-vay-2-day-quyen-ru-chat-phi-lua-mem-min-sang-chanh-p109860034.html?spid=104303802,17,,,dongu
,,https://tiki.vn/hantu-sleepwear-dam-ngu-lua-cao-cap-dang-tieu-thu-mac-nha-sang-chanh-p189837117.html?spid=189837121,18,,,dongu
Đầm ngủ WANNABE DNS05 váy ngủ 2 dây phối bèo ngực che vòng 1 kín đáo nhưng vẫn nữ tính mang lại vẻ xinh tươi cho bạn gái,400.000₫,https://tiki.vn/dam-ngu-phi-lua-wannabe-dns05-phoi-beo-nguc-nu-tinh-sang-trong-p71509419.html?spid=271126184,19,,,dongu
Đầm ngủ phi lụa cao cấp Wannabe DNS29 phối ren sườn nữ tính nhẹ nhàng,420.000₫,https://tiki.vn/dam-ngu-phi-lua-cao-cap-wannabe-dns29-phoi-ren-suon-nu-tinh-nhe-nhang-p168705404.html?spid=168705413,20,,,dongu
Bộ pizama nữ áo dài quần dài chất nhung cao cấp tay ren màu Hồng Xumaki Store BO135A,419.000₫,https://tiki.vn/bo-pizama-nu-ao-dai-quan-dai-chat-nhung-cao-cap-tay-ren-mau-hong-xumaki-store-bo135a-p213558454.html?spid=213558456,21,,,dongu
Đồ Bộ Nữ Thun Cát Hàn Mặc Nhà Thời Trang Có Size Lớn,121.000₫,https://tiki.vn/do-bo-nu-thun-cat-han-mac-nha-thoi-trang-co-size-lon-p140753749.html?spid=174211982,22,,Đã bán 6,dongu
"Váy ngủ hai dây nữ, đầm ngủ mặc nhà nữ cổ V dáng chữ A rộng rãi chất vải lanh lụa cotton thoáng mát nhiều màu mã V0251",69.000₫,https://tiki.vn/vay-ngu-hai-day-nu-dam-ngu-mac-nha-nu-co-v-dang-chu-a-rong-rai-chat-vai-lanh-lua-cotton-thoang-mat-nhieu-mau-ma-v0251-p155789312.html?spid=186080235,23,,Đã bán 2,dongu
Set choàng + yếm Cosplay mỹ nhân Trung Hoa MS1314,140.000₫,https://tiki.vn/set-choang-yem-cosplay-my-nhan-trung-hoa-ms1314-p99158733.html?spid=113224722,24,,Đã bán 2,dongu
Bộ ngủ 2 dây nữ có đệm ngực tiện lợi đồ ngủ mặc nhà mặc đi biển dễ thương [BC18,134.000,https://tiki.vn/bo-ngu-2-day-nu-co-dem-nguc-tien-loi-do-ngu-mac-nha-mac-di-bien-de-thuong-bc18-p96342807.html?spid=114856652,25,,,dongu
,,https://tiki.vn/dam-ngu-dam-mac-nha-dam-2-day-duoi-ca-co-mut-nguc-chat-vai-mem-mai-ah01-p179438624.html?spid=179438634,26,,,dongu
"Đầm ngủ Wacoal ILN4913 2 dây, vải thun co giãn thoáng mát",599.000₫,https://tiki.vn/dam-ngu-wacoal-iln4913-2-day-vai-thun-co-gian-thoang-mat-p263763838.html?spid=263763848,27,,,dongu
Váy ngủ lụa hai dây phối ren ngực xẻ tà cao cấp Q79 - Đầm ngủ nữ 2 dây quyến rũ - Đồ ngủ nữ sexy - Váy ngủ nữ gợi cảm,149.000₫,https://tiki.vn/vay-ngu-lua-hai-day-phoi-ren-nguc-xe-ta-cao-cap-bt0169-dam-ngu-nu-2-day-quyen-ru-do-ngu-nu-sexy-vay-ngu-nu-goi-cam-p176788809.html?spid=176788815,28,,Đã bán 4,dongu
Đồ ngủ cosplay kèm chân váy sexy P14 - Đầm ngủ cosplay gợi cảm - Đồ ngủ nữ quyến rũ,229.000₫,https://tiki.vn/do-ngu-cosplay-kem-chan-vay-sexy-p14-dam-ngu-cosplay-goi-cam-do-ngu-nu-quyen-ru-p192990224.html?spid=192990225,29,,Đã bán 1,dongu
Đầm Ngủ SexyVáy ngủ Ren 2 Dây Quyến Rũ ️Kèm Quần Chip️ MỎNG Gợi Cảm Quyến Rũ,38.000₫,https://tiki.vn/dam-ngu-sexy-vay-ngu-ren-2-day-quyen-ru-kem-quan-chip-mong-goi-cam-quyen-ru-p109859384.html?spid=104302778,30,,,dongu
,,https://tiki.vn/vay-ngu-2-day-lua-mac-nha-nu-lien-than-xe-1-ben-cao-cap-goi-cam-1-mau-den-p107155254.html?spid=107155259,31,,,dongu
"Bộ ngủ 2 dây,đồ bộ nữ mặc nhà đùi vải xô dễ thương size 45-57kg",135.450₫,https://tiki.vn/bo-ngu-2-day-do-bo-nu-mac-nha-dui-vai-xo-de-thuong-size-45-57kg-p140775816.html?spid=140775871,32,,Đã bán 4,dongu
Đồ bộ Ngủ Nữ Hisexy Lụa Satin Trơn Dáng Xuông Liền Thân MS07,139.000₫,https://tiki.vn/do-bo-ngu-nu-hisexy-lua-satin-tron-dang-xuong-lien-than-ms07-p124323548.html?spid=124323646,33,,Đã bán 135,dongu
Đầm ngủ phi lụa cao cấp Wannabe DNS25 váy ngủ dài phối ren thân trên cột nợ quyến rũ quý phái,600.000₫,https://tiki.vn/dam-ngu-phi-lua-cao-cap-wannabe-dns25-phoi-ren-than-tren-quyen-ru-quy-phai-p252869420.html?spid=252869432,34,,Đã bán 1,dongu
"Bộ Đồ Mặc Nhà Cho Người Trung Niên, Người Lớn Tuổi NG11",370.000,https://tiki.vn/bo-do-mac-nha-cho-nguoi-trung-nien-nguoi-lon-tuoi-ng11-p13411302.html?spid=13411308,35,,,dongu
,,https://tiki.vn/bo-nu-umi-sanaha-mac-o-nha-co-dan-4-chieu-thoang-mat-p132783571.html?spid=137133350,36,,,dongu
[HCM] (40-55kg) Đồ bộ pijama/pizama/pyjama đùi nữ chất satin. Đồ bộ mặc nhà nữ. Đồ bộ mặc ngủ nữ. Ảnh thật sản phẩm. Họa tiết: mặt trăng - ngôi sao - cô bé - gấu brown thỏ cony - hồng hạc flamingo - mèo kitty,119.000₫,https://tiki.vn/40-55kg-do-bo-pijama-pizama-pyjama-dui-nu-chat-satin-do-bo-mac-nha-nu-do-bo-mac-ngu-nu-anh-that-san-pham-hoa-tiet-mat-trang-ngoi-sao-co-be-gau-brown-tho-cony-hong-hac-flamingo-meo-kitty-p80635520.html?spid=80635847,37,,Đã bán 24,dongu
Váy ngủ pha ren xuyên thấu - Tím,45.000₫,https://tiki.vn/vay-ngu-pha-ren-xuyen-thau-tim-p73514230.html?spid=73514231,38,,Đã bán 39,dongu
"Váy Ngủ Hai Dây Quyến Rũ Bộ đồ mặc nhà,Bộ Đồ ngủ hai dây nữ chất liệu lụa, phong cách Hàn Quốc, phù hợp cho mùa hè V164",158.000₫,https://tiki.vn/vay-ngu-hai-day-quyen-ru-bo-do-mac-nha-bo-do-ngu-hai-day-nu-chat-lieu-lua-phong-cach-han-quoc-phu-hop-cho-mua-he-v164-p19908405.html?spid=50875445,39,,Đã bán 137,dongu
Bộ Đồ Ngủ Tay Voan Nhún Bèo Loirechic LPD12 (Áo dài & Quần dài),629.100,https://tiki.vn/bo-do-ngu-tay-voan-nhun-beo-loirechic-lpd12-ao-dai-quan-dai-p155644720.html?spid=155644728,40,,,dongu
