title,price,link_item,index,discount,sales,brand
Áo Khoác Cardigan Bomber Nỉ Bông IN LOGO R Sọc Viển Tay Form Rộng Basic Nam Nữ Unisex Ulzzang,100.000₫,https://tiki.vn/ao-khoac-cardigan-bomber-ni-bong-in-logo-r-soc-vien-tay-form-rong-basic-nam-nu-unisex-ulzzang-nupakachi-p183920689.html?spid=183920708,1,,,NHUH20
"Áo Khoác Dù Nam Nữ Phối Tay Ulzzang Unisex Thời Trang, Áo Khoác Dù sọc tay ĐEN TRẮNG Nam Cực xịn,Nữ Cao Cấp,Chống Nắng",95.000₫,https://tiki.vn/ao-khoac-du-nam-nu-phoi-tay-ulzzang-unisex-thoi-trang-ms001-p183917377.html?spid=183917407,2,,,NHUH20
áo khoác nữ hoodie nỉ hoạ tiết chữ cùng logo siêu đẹp phong cách hiện đại thời thượng hót,99.000₫,https://tiki.vn/ao-khoac-nu-hoodie-ni-hoa-tiet-chu-cung-logo-sieu-dep-phong-cach-hien-dai-thoi-thuong-hot-p157414695.html?spid=157414757,3,,,NHUH20
Áo khoác cadigan nam nữ chất thun nỉ ngoại màu sắc nhẹ nhàng trang nhã phối hình gấu siêu cute,113.000,https://tiki.vn/ao-khoac-cadigan-nam-nu-chat-thun-ni-ngoai-mau-sac-nhe-nhang-trang-nha-phoi-hinh-gau-sieu-cute-p157414791.html?spid=157414801,4,,,NHUH20
,,https://tiki.vn/ao-sweater-nu-super-fashion-chat-ni-day-min-chui-dau-in-xuong-form-rong-mac-dep-thoai-mai-p198764887.html?spid=198764901,5,,,NHUH20
"Áo khoác form dáng bóng chày rộng rãi thoải mái chất nỉ cao cấp,Áo khoác hoodie dáng rộng in hình phong cách thu đông cho nam",105.000₫,https://tiki.vn/ao-khoac-form-dang-bong-chay-rong-rai-thoai-mai-chat-ni-cao-cap-p176420309.html?spid=176420319,6,,Đã bán 4,NHUH20
Áo Flannel sơ mi sọc caro đen trắng,84.000₫,https://tiki.vn/ao-flannel-so-mi-soc-caro-den-trang-p156188955.html?spid=156188973,7,,,NHUH20
Áo khoác hoodie nữ nỉ ngoại có dây kéo thêu Biboo gấu - Form Nữ Unisex mặc siêu xinh,93.000₫,https://tiki.vn/ao-hoodie-ni-bong-ao-khoac-ni-keo-unisex-nam-nu-han-quoc-biboo-5-mau-hot-trend-ulzzang-nupakachi-p169348261.html?spid=169348407,8,,Đã bán 1,NHUH20
Áo Sơ Mi NHUNG GÂN️ Áo Sơ Mi Unisex Form rộng Unisex Nam/Nữ Phong Cách Hàn Quốc Ulzzang,165.000,https://tiki.vn/ao-so-mi-nhung-gan-ao-so-mi-unisex-form-rong-unisex-nam-nu-phong-cach-han-quoc-ulzzang-nupakachi-p169347637.html?spid=169347737,9,,,NHUH20
,,https://tiki.vn/ao-khoac-hoodie-nu-thun-ni-ngoai-in-hinh-con-gau-im-bea-y-non-2-lop-sieu-dep-cai-tinh-hien-dai-p157414169.html?spid=157414239,10,,,NHUH20
"Quần DÀI Ống Rộng IN HÌNH SA.JA Ulzzang Unisex, ống loe cạp cao dài 100cm hack chân tôn dáng màu đen thời trang",100.000₫,https://tiki.vn/quan-dai-ong-rong-in-hinh-sa-ja-ulzzang-unisex-f-s-shop68-p178577300.html?spid=178577308,11,,,NHUH20
Áo Khoác Zip Kéo Form Rộng SKILLWINNER 3 màu,108.000,https://tiki.vn/ao-khoac-zip-keo-form-rong-skillwinner-pqk-3-mau-p204847589.html?spid=204847611,12,,,NHUH20
,,https://tiki.vn/ao-khoac-bomber-ao-ni-cardigan-ao-khoac-ni-khoa-nut-cotton-cao-cap-2-lop-bong-day-min-form-rong-unisex-nam-nu-aq-p156936503.html?spid=156936572,13,,,NHUH20
Áo Khoác Dù BOMBER 7ZIA Ulzzang Nam Nữ Unisex Form Rộng Vải 2 Lớp Ulzzang,100.000₫,https://tiki.vn/ao-khoac-du-bomber-7zia-ulzzang-nam-nu-unisex-form-rong-vai-2-lop-ulzzang-nupakachi-p169347867.html?spid=169347946,14,,Đã bán 1,NHUH20
"Áo Thun Tay Lỡ SAIGON BOBUI Cotton Unisex Nam Nữ (Ảnh Thật/Có Sẵn), Áo thun tay lỡ form rộng in hoạ tiết chữ phông ulzzang unisex nam nữ đều mặc được",79.000₫,https://tiki.vn/ao-thun-tay-lo-saigon-bobui-cotton-unisex-nam-nu-anh-that-co-san-p178577740.html?spid=178577759,15,,,NHUH20
Áo khoác dù 2 lớp form rộng ROTC unisex (nam nữ mặc được),87.000₫,https://tiki.vn/ao-khoac-du-2-lop-form-rong-rotc-unisex-nam-nu-mac-duoc-p199644902.html?spid=199644907,16,,,NHUH20
Áo Khoác Nữ Nam Da Lộn kiểu BOMBER Họa Tiết Thêu Chữ R Cao Cấp chất vải da lộn dày dặn mềm mịn (ảnh thật/có sẳn),159.000,https://tiki.vn/ao-khoac-nu-nam-da-lon-kieu-bomber-hoa-tiet-theu-chu-r-cao-cap-chat-vai-da-lon-day-dan-mem-min-anh-that-co-san-p178577501.html?spid=178577507,17,,,NHUH20
,,https://tiki.vn/ao-khoac-ni-form-dai-mu-hai-lop-mat-cuoi-reg-ao-khoac-hoodie-khoa-keo-rengos-chat-vai-ni-thiet-ke-in-hinh-va-chu-form-ao-rong-kieu-dang-tre-trung-phong-cach-thoi-trang-ao-khoac-cap-doi-day-keo-clob-mat-cuoi-non-rong-ulzzang-han-quoc-mau-reu-hot-tred-p216203388.html?spid=216203394,18,,,NHUH20
Áo Khoác nữ Chất da lộn vải 2 lớp dày dặn chất vải mịn form rộn rất thích hợp đi học đi chơi,160.000₫,https://tiki.vn/ao-khoac-nu-chat-da-lon-vai-2-lop-day-dan-chat-vai-min-form-ron-rat-thich-hop-di-hoc-di-choi-p225263856.html?spid=225263858,19,,,NHUH20
Áo Khoác CARDIGIAN Nỉ 2022 ️ Nhiều Mẫu Bomber Nữ Phong Cách Năng Động Trẻ Trung Siêu Hot,100.000₫,https://tiki.vn/ao-khoac-cardigian-ni-2022-nhieu-mau-bomber-nu-phong-cach-nang-dong-tre-trung-sieu-hot-guvia-p193367747.html?spid=193367759,20,,,NHUH20
Áo Khoác Bomber Fashion Nam Nữ Nỉ Fom Rộng Dày Đẹp Phối Chữ G Hot Trend,102.000₫,https://tiki.vn/ao-khoac-bomber-super-fashion-nam-nu-ni-fom-rong-day-dep-phoi-chu-g-hot-trend-p197288894.html?spid=197289119,21,,,NHUH20
Áo Hoodie - Áo Khoác Nỉ Bông in Ly Trà Sữa 3 Màu Unisex Nam Nữ Form Rộng Ulzzang Áo Nỉ Hoodie Nam Nữ Chất Vải Nỉ Dầy Ấm Mềm Mịn Dáng Rộng Thoải Mái Phong Cách Ulzzang Mẫu Mới,100.000₫,https://tiki.vn/ao-hoodie-ao-khoac-ni-bong-in-ly-tra-sua-3-mau-unisex-nam-nu-form-rong-ulzzang-nupakachi-p169347870.html?spid=169347926,22,,,NHUH20
"Áo Khoác Dù PENTA.Q 2 Lớp Form Rộng Nam Nữ Unisex, Áo Gió Bomber Bóng Chày Chống Nắng Ulzzang",100.000₫,https://tiki.vn/ao-khoac-du-penta-q-2-lop-form-rong-nam-nu-unisex-ao-gio-bomber-bong-chay-chong-nang-ulzzang-guvia-p193368141.html?spid=193368163,23,,Đã bán 4,NHUH20
Áo KHOÁC Hoodie XANH LÁ UNDER BROKEN và Ulzzang Unisex,89.000₫,https://tiki.vn/ao-khoac-hoodie-xanh-la-under-broken-va-ulzzang-unisex-f-s-shop68-p197172545.html?spid=197172569,24,,,NHUH20
Áo Khoác Dù Bomber Jacket Ullzang F4-26 Cao Cấp Chống Nắng Hiệu Quả,150.000,https://tiki.vn/ao-khoac-du-bomber-jacket-ullzang-f4-26-cao-cap-chong-nang-hieu-qua-p183917275.html?spid=183917282,25,,,NHUH20
,,https://tiki.vn/ao-khoac-bomber-du-tcri-cndy-unisex-ulzzang-nam-nu-2-lop-jacket-bomber-zalofa-p174296991.html?spid=174296999,26,,,NHUH20
Áo Khoác Nỉ Dây Kéo In O Trước Ngực Fom Rộng Chất Liệu Thun Nỉ Ngoại Mềm Mịn,147.000₫,https://tiki.vn/ao-khoac-ni-day-keo-in-o-truoc-nguc-fom-rong-chat-lieu-thun-ni-ngoai-mem-min-tp443-p183916727.html?spid=183916762,27,,,NHUH20
Áo Khoác Bomber Cardigan Nỉ Bông LAB Form Rộng Basic Varsity Nam Nữ Unisex Couple Phong Cách Ulzzang,100.000₫,https://tiki.vn/ao-khoac-bomber-cardigan-ni-bong-lab-form-rong-basic-varsity-nam-nu-unisex-couple-phong-cach-ulzzang-nupakachi-p176310556.html?spid=176310583,28,,,NHUH20
Quần đùi mặc nhà quần ngủ nữ lưng thun dây rút kiểu dáng dễ thương chất thun co dãn thoáng mát,86.000₫,https://tiki.vn/quan-dui-mac-nha-quan-ngu-nu-lung-thun-day-rut-kieu-dang-de-thuong-chat-thun-co-dan-thoang-mat-p176402745.html?spid=176402754,29,,,NHUH20
"Áo khoác dù cổ bẻ phối Đen Phối Màu form rộng năng động chất liệu dù 2 lớp cao cấp, Áo Khoác Dù Nam Nữ Cổ Trụ Màu Trắng Phối Sọc Tay Form Rộng Mặc Đẹp Che Nắng, áo khoác đôi, áo khoác cặp",99.000₫,https://tiki.vn/ao-khoac-du-co-be-phoi-den-phoi-mau-form-rong-nang-dong-chat-lieu-du-2-lop-cao-cap-ao-khoac-du-nam-nu-co-tru-mau-trang-phoi-soc-tay-form-rong-mac-dep-che-nang-ao-khoac-doi-ao-khoac-cap-p220681207.html?spid=220681213,30,,,NHUH20
,,https://tiki.vn/set-ao-tanktop-bra-gnash-unisex-trang-den-p186285081.html?spid=186285093,31,,,NHUH20
Áo khoác Jacket Trơn form rộng vải dù 2 lớp in chữ SLC unisex nam nữ (Ảnh thật/Có sẵn),89.000₫,https://tiki.vn/ao-khoac-jacket-tron-form-rong-vai-du-2-lop-in-chu-slc-unisex-nam-nu-anh-that-co-san-p199644946.html?spid=199644960,32,,,NHUH20
Áo khoác sơ mi nhung nữ in họa tiết mặt cười cực đẹp phong cách Hàn quốc Unisex Dễ Thương 2021,150.000₫,https://tiki.vn/ao-khoac-so-mi-nhung-nu-in-hoa-tiet-mat-cuoi-cuc-dep-phong-cach-han-quoc-unisex-de-thuong-2021-p156188999.html?spid=156189039,33,,,NHUH20
Áo Khoác Nữ da lộn vải 2 lớp dày mịn form Rộng Tay Phồng Basic Có Dây Kéo Mũ thích hợp đi học đi chơi (NHIỀU MÀU ),159.000₫,https://tiki.vn/ao-khoac-nu-da-lon-vai-2-lop-day-min-form-rong-tay-phong-basic-co-day-keo-mu-thi-ch-ho-p-di-ho-c-di-choi-nhieu-mau-p178577641.html?spid=178577670,34,,,NHUH20
"Áo khoác hoodie giá rẻ form unisex chất nỉ cotton dày dặn nam nữ rộng, áo hoodie hoạt hình cặp đôi, Áo Hoodie Insane l Universe",152.000,https://tiki.vn/ao-khoac-hoodie-gia-re-form-unisex-chat-ni-cotton-day-dan-nam-nu-rong-ao-hoodie-hoat-hinh-cap-doi-ao-hoodie-insane-l-universe-p271978856.html?spid=271978860,35,,,NHUH20
,,https://tiki.vn/quan-short-nu-mat-cuoi-thun-cotton-da-ca-cap-chun-unisex-the-thao-ong-rong-bigsize-kieu-ngan-ulzzang-kun-p176310660.html?spid=176310672,36,,,NHUH20
Áo khoác dù bomber cúc bấm 2 lớp in logo G mùa hè phong cách Hàn Quốc,98.000₫,https://tiki.vn/ao-khoac-du-bomber-cuc-bam-2-lop-in-logo-g-mua-he-phong-cach-han-quoc-p176403014.html?spid=176403018,37,,,NHUH20
Áo Bomber Nhung Gân Thêu Chữ Chất Nhung Mịn Đẹp Form rộng Unisex Nam Nữ Couple CHOSE CHOSE,159.000₫,https://tiki.vn/ao-bomber-nhung-gan-theu-chu-chat-nhung-min-dep-form-rong-unisex-nam-nu-couple-chose-chose-p178578095.html?spid=178578097,38,,,NHUH20
"Áo phông tay lỡ form rộng in hình gấu Lee phong cách Ulzzang Hàn Quốc mặc cặp, nhóm",100.001₫,https://tiki.vn/ao-phong-tay-lo-form-rong-in-hinh-gau-lee-phong-cach-ulzzang-han-quoc-mac-cap-nhom-p242699081.html?spid=242699083,39,,,NHUH20
Áo Jacket Bombers ZOMBIF/ Áo Bomber Nhung gân mịn đẹp Zombies rất cá tính - Form rộng Unisex Nam Nữ Couple,157.000,https://tiki.vn/ao-jacket-bombers-zombif-ao-bomber-nhung-gan-min-dep-zombies-rat-ca-tinh-form-rong-unisex-nam-nu-couple-p169348581.html?spid=169348592,40,,,NHUH20
