title,price,link_item,index,discount,sales,category
"Áo Vắt Sữa, Áo Lót Hút Sữa Rảnh Tay Và Cho Con Bú 2 Trong 1 KUNBE Mặc Được Cả Ngày Thay Áo Ngực Thông Thường",89.000₫,https://tiki.vn/ao-vat-sua-ao-lot-hut-sua-ranh-tay-va-cho-con-bu-2-trong-1-kunbe-mac-duoc-ca-ngay-thay-ao-nguc-thong-thuong-p75313942.html?spid=75313952,1,-41%,Đã bán 33,thoitrangbau
QUẦN BẦU JEAN PHONG CÁCH TRẺ TRUNG QBN1199,455.000₫,https://tiki.vn/quan-bau-jean-phong-cach-tre-trung-qbn1199-p78892646.html?spid=78892656,2,-14%,Đã bán 6,thoitrangbau
CHÂN VÁY BẦU MÙA HÈ DÁNG XẾP LY XÒE QBN1181,325.000₫,https://tiki.vn/chan-vay-bau-mua-he-dang-xep-ly-xoe-qbn1181-p253264784.html?spid=78625796,3,,Đã bán 13,thoitrangbau
Váy Đầm Trung Niên Nữ Cho Mẹ V15 - Thời trang trung niên cho mẹ trung tuổi U40 U50 đẹp giá rẻ Bigsize - Váy xuông cho mẹ,124.000,https://tiki.vn/vay-dam-trung-nien-nu-cho-me-v15-thoi-trang-trung-nien-cho-me-trung-tuoi-u40-u50-dep-gia-re-bigsize-vay-xuong-cho-me-p270800742.html?spid=270800791,4,,,thoitrangbau
,,https://tiki.vn/dam-bau-lime-sang-mat-tham-hut-mo-hoi-hop-thoi-trang-cho-bau-tu-50kg-den-75kg-cao-1m57-qua-goi-5-8cm-p99869784.html?spid=99869802,5,-14%,,thoitrangbau
"Quần bầu dài ống rộng, dáng suông có chun chỉnh bụng - quần bầu thiết kế cao cấp QB999",74.340₫,https://tiki.vn/quan-bau-dai-ong-rong-dang-suong-co-chun-chinh-bung-quan-bau-thiet-ke-cao-cap-qb999-p146573739.html?spid=146573823,6,,Đã bán 6,thoitrangbau
"Ngũ cốc bầu siêu dinh dưỡng Lạc Lạc giảm ốm nghén, giúp xương của bé phát triển toàn diện, vào con nhiều hơn vào mẹ",257.140₫,https://tiki.vn/ngu-coc-bau-sieu-dinh-duong-lac-lac-giam-om-nghen-giup-xuong-cua-be-phat-trien-toan-dien-vao-con-nhieu-hon-vao-me-p208122526.html?spid=208122527,7,,,thoitrangbau
Quần bầu NỈ SỌC THỂ THAO TRẺ TRUNG NĂNG ĐỘNG QB1289,107.100₫,https://tiki.vn/quan-bau-ni-soc-the-thao-tre-trung-nang-dong-qb1289-p146571846.html?spid=146571917,8,,,thoitrangbau
ĐẦM BẦU VÁY BẦU CÔNG SỞ THÊU BÔNG HỒNG,380.000,https://tiki.vn/dam-bau-vay-bau-cong-so-theu-bong-hong-p163581433.html?spid=163581454,9,,,thoitrangbau
,,https://tiki.vn/quan-bau-jean-dang-om-phong-cach-tre-trung-qbn1195-p113070653.html?spid=113070657,10,,,thoitrangbau
QUẦN BẦU BÒ CO GIÃN THOẢI-Quần Bầu Xinh Quần Jean Bầu Quần Baggy Bầu Trẻ Trung Năng Động,375.000₫,https://tiki.vn/quan-bau-bo-co-gian-thoai-quan-bau-xinh-quan-jean-bau-quan-baggy-bau-tre-trung-nang-dong-p103097978.html?spid=166319731,11,,Đã bán 1,thoitrangbau
"Váy Đầm bầu công sở đẹp - Đầm sau sinh cho con bú ti - Thời trang bà bầu xinh đi chơi, dự tiệc mùa hè Bigsize ẢNH THẬT",268.000,https://tiki.vn/vay-dam-bau-cong-so-dep-dam-sau-sinh-cho-con-bu-ti-thoi-trang-ba-bau-xinh-di-choi-du-tiec-mua-he-bigsize-anh-that-p114404282.html?spid=114405643,12,,,thoitrangbau
,,https://tiki.vn/do-bo-sau-sinh-lat-nap-quan-dai-tay-dai-70kg-p83666526.html?spid=83666531,13,,,thoitrangbau
"Váy bầu hoa nhí phong cách vintage, đầm bầu thiết kế siêu xinh V271",162.540₫,https://tiki.vn/vay-bau-hoa-nhi-phong-cach-vintage-dam-bau-thiet-ke-sieu-xinh-v271-p146572445.html?spid=146572498,14,,Đã bán 1,thoitrangbau
Bộ đồ bầu cộc tay chất kate thái có khóa mở cho bé ti,109.620₫,https://tiki.vn/bo-do-bau-coc-tay-chat-kate-thai-co-khoa-mo-cho-be-ti-p146573688.html?spid=146573778,15,,,thoitrangbau
Combo bo sau sinh 1060,1.060.000₫,https://tiki.vn/combo-bo-sau-sinh-1060-p101253290.html?spid=101253295,16,,,thoitrangbau
Quần Bầu Suông Ống Rộng Cạp Chéo AZ555 Chất Liệu Thun Gân Lên Dáng Cực Xinh Mặc Hè Siêu Mát,195.000,https://tiki.vn/quan-bau-suong-ong-rong-cap-cheo-az555-chat-lieu-thun-gan-len-dang-cuc-xinh-mac-he-sieu-mat-p243059729.html?spid=243059747,17,,Đã bán 10,thoitrangbau
,,https://tiki.vn/set-4-quan-lot-bau-cotton-gan-sieu-gian-sieu-mat-ql07-p252639882.html?spid=252639890,18,,,thoitrangbau
"Quần bầu baggy, quần áo bầu công sở, MLEE",125.000₫,https://tiki.vn/quan-bau-baggy-quan-ao-bau-cong-so-mlee-p254903361.html?spid=254903363,19,,,thoitrangbau
QUẦN CHIP BẦU TÚI ZIP 9005,30.240₫,https://tiki.vn/quan-chip-bau-tui-zip-9005-p146572594.html?spid=146572620,20,,,thoitrangbau
QUẦN LÓT GEN BỤNG CAO CẤP NHẬT BẢN SIÊU THON GỌN,21.420₫,https://tiki.vn/quan-lot-gen-bung-cao-cap-nhat-ban-sieu-thon-gon-p146573846.html?spid=146573880,21,,Đã bán 2,thoitrangbau
ẢNH THẬT SHOP CHỤP Váy voan cho con bú,364.000₫,https://tiki.vn/anh-that-shop-chup-vay-voan-cho-con-bu-p95170363.html?spid=95170414,22,,,thoitrangbau
"Váy bầu dự tiệc, Váy bầu body xoắn eo M&M MM184",350.000₫,https://tiki.vn/vay-bau-du-tiec-vay-bau-body-xoan-eo-m-m-mm184-p83777652.html?spid=83777665,23,,,thoitrangbau
Áo giấu quần cho con bú sz M-2xl,325.000₫,https://tiki.vn/ao-giau-quan-cho-con-bu-sz-m-2xl-p95173375.html?spid=95173438,24,,,thoitrangbau
Váy Kiwi chấm bi hồng khoá dọc con bú sz S-XL,429.000,https://tiki.vn/vay-kiwi-cham-bi-hong-khoa-doc-con-bu-sz-s-xl-p95172560.html?spid=95172569,25,,,thoitrangbau
,,https://tiki.vn/ao-lot-bau-thong-hoi-co-cuc-mo-cho-be-ti-al183-p146575549.html?spid=146575587,26,,,thoitrangbau
"Váy bầu hoa nhí phong cách vintage, đầm bầu thiết kế tay bồng tiểu thư V273",162.540₫,https://tiki.vn/vay-bau-hoa-nhi-phong-cach-vintage-dam-bau-thiet-ke-tay-bong-tieu-thu-v273-p146574227.html?spid=146574247,27,,,thoitrangbau
Áo Lót Nữ ĐÚC Không Gọng Nâng ngực mềm mại thoáng mát tôn vòng 1 gợi cảm quyến rũ cho phái đẹp,45.360₫,https://tiki.vn/ao-lot-nu-duc-khong-gong-nang-nguc-mem-mai-thoang-mat-ton-vong-1-goi-cam-quyen-ru-cho-phai-dep-p146572220.html?spid=146572274,28,,Đã bán 3,thoitrangbau
Bộ đồ bầu thiết kế chất đũi hàn châu BD905,162.540₫,https://tiki.vn/bo-do-bau-thiet-ke-chat-dui-han-chau-bd905-p146574201.html?spid=146574220,29,,,thoitrangbau
Váy nhung phối ren cho con bú ️ẢNH VÀ VIDEO SHOP CHỤP,546.000,https://tiki.vn/vay-nhung-phoi-ren-cho-con-bu-anh-va-video-shop-chup-p95170969.html?spid=95171070,30,,,thoitrangbau
,,https://tiki.vn/quan-bau-nang-mong-p146575367.html?spid=146575404,31,,,thoitrangbau
Chân váy bầu xếp ly Umi Hàn cao cấp CV06,86.940₫,https://tiki.vn/chan-vay-bau-xep-ly-umi-han-cao-cap-cv06-p146572056.html?spid=146572089,32,,,thoitrangbau
Quần Bầu dài Chất NHUNG TĂM CÓ CHỮ ấm áp quần có chun chỉnh tiện lợi cho mẹ QB1282,134.820₫,https://tiki.vn/quan-bau-dai-chat-nhung-tam-co-chu-am-ap-quan-co-chun-chinh-tien-loi-cho-me-qb1282-p146571782.html?spid=146571787,33,,,thoitrangbau
"Quần bầu LỬNG ỐNG RỘNG CHẤT TĂM cho mẹ ,Quần ỐNG SỚ thoải mái Cho Mẹ Bầu ngotam 1320",120.960₫,https://tiki.vn/quan-bau-lung-ong-rong-chat-tam-cho-me-quan-ong-so-thoai-mai-cho-me-bau-ngotam-1320-p146573853.html?spid=146573983,34,,,thoitrangbau
Quần Bầu Nỉ Azuno AZ32 Dáng Bo Gấu Có Đáp và Chun Chỉnh Bụng Mặc Thu Đông,185.000,https://tiki.vn/quan-bau-ni-azuno-az32-dang-bo-gau-co-dap-va-chun-chinh-bung-mac-thu-dong-p73591732.html?spid=73591740,35,,,thoitrangbau
,,https://tiki.vn/vay-bau-xinh-thoi-trang-thiet-ke-dang-suong-chat-cotton-mat-dam-bau-mua-he-p129500609.html?spid=129500616,36,,,thoitrangbau
Bộ đồ bầu và sau sinh,142.000₫,https://tiki.vn/bo-do-bau-va-sau-sinh-p129499308.html?spid=129499312,37,,,thoitrangbau
"Ngũ cốc lợi sữa Lạc Lạc Plus mới cao cấp 39 loại hạt giúp mẹ bổ sung vitamin và khoáng chất, canxi giúp xương chắc khỏe 600g (hộp 30 gói)",257.140₫,https://tiki.vn/ngu-coc-loi-sua-lac-lac-plus-moi-cao-cap-39-loai-hat-giup-me-bo-sung-vitamin-va-khoang-chat-canxi-giup-xuong-chac-khoe-600g-hop-30-goi-p208299975.html?spid=208299976,38,,Đã bán 1,thoitrangbau
Quần bầu mùa thu đông | Quần bầu lót nỉ lông | Đồ bầu thu đông,99.000₫,https://tiki.vn/quan-bau-mua-thu-dong-quan-bau-lot-ni-long-do-bau-thu-dong-p205233528.html?spid=205233532,39,,,thoitrangbau
"Đầm bầu suông cotton dáng dài, váy xuông đuôi cá co giãn 4 chiều, MLEE SHOP",159.000,https://tiki.vn/dam-bau-suong-cotton-dang-dai-vay-xuong-duoi-ca-co-gian-4-chieu-mlee-shop-p254903279.html?spid=254903287,40,,,thoitrangbau
