title,price,link_item,index,discount,sales,category
váy đỏ cổ V cho con bú,468.000₫,https://tiki.vn/vay-do-co-v-cho-con-bu-p95172654.html?spid=95172658,1,,,thoitrangbau
đầm dạ nhung cho con bú sz M- xxl KÈM ẢNH THẬT,507.000₫,https://tiki.vn/dam-da-nhung-cho-con-bu-sz-m-xxl-kem-anh-that-p95171555.html?spid=95171606,2,,,thoitrangbau
"Váy bầu 2 dây sang chảnh,chất kẻ thô siêu mềm thoáng mát (Hàng loại 1 ) V277",124.740₫,https://tiki.vn/vay-bau-2-day-sang-chanh-chat-ke-tho-sieu-mem-thoang-mat-hang-loai-1-v277-p146574538.html?spid=146574604,3,,,thoitrangbau
Bộ bầu và sau sinh Pink cổ chéo,179.000,https://tiki.vn/bo-bau-va-sau-sinh-pink-co-cheo-p107279015.html?spid=107279045,4,,Đã bán 1,thoitrangbau
,,https://tiki.vn/bo-do-bau-va-sau-sinh-lung-chat-lanh-thai-sieu-mat-co-khoa-nguc-cho-be-ti-bl836-p146573520.html?spid=146573599,5,,,thoitrangbau
Quần bầu jean thật cạp chéo có chun chỉnh,137.340₫,https://tiki.vn/quan-bau-jean-that-cap-cheo-co-chun-chinh-p146574349.html?spid=146574374,6,,,thoitrangbau
Quần Bầu Baggy Đũi Siêu Mềm Mịn CÓ TAG MÈO (Vạt chéo có chun chỉnh),152.460₫,https://tiki.vn/quan-bau-baggy-dui-sieu-mem-min-co-tag-meo-vat-cheo-co-chun-chinh-p146573763.html?spid=146573807,7,,,thoitrangbau
ÁO BẦU CÔNG SỞ SIZE NHỎ VA SIZE TO,45.000₫,https://tiki.vn/ao-bau-cong-so-size-nho-va-size-to-p105799987.html?spid=105800002,8,,,thoitrangbau
"QUẦN LÓT NỮ THÔNG HƠI PHA REN CẠP CAO CHẤT ĐẸP 5885, (ảnh thật phía sau các bạn nhé)",13.734₫,https://tiki.vn/quan-lot-nu-thong-hoi-pha-ren-cap-cao-chat-dep-5885-anh-that-phia-sau-cac-ban-nhe-p146572061.html?spid=146572072,9,,Đã bán 1,thoitrangbau
,,https://tiki.vn/vay-bau-cotton-cao-cap-thiet-ke-sang-chanh-chat-cotton-sieu-dep-v222-p146572541.html?spid=146572570,10,,,thoitrangbau
Váy Bầu giả yếm phối sơ mi V36,149.940₫,https://tiki.vn/vay-bau-gia-yem-phoi-so-mi-v36-p146574992.html?spid=146575017,11,,,thoitrangbau
Quần bầu mèo (555),84.420₫,https://tiki.vn/quan-bau-meo-555-p146573015.html?spid=146573078,12,,,thoitrangbau
,,https://tiki.vn/vay-tole-lanh-duoi-ca-size-to-cho-nguoi-bau-va-beotren-60ky-p105799480.html?spid=105799578,13,,,thoitrangbau
Quần Bầu Lót Lông Cạp Cao Trùm Bụng Quần Bầu Có Chun Chỉnh Bụng HX4604 Honey Mommy,192.400₫,https://tiki.vn/quan-bau-lot-long-cap-cao-trum-bung-quan-bau-co-chun-chinh-bung-hx4604-honey-mommy-p95584275.html?spid=95584284,14,,,thoitrangbau
XẢ HÀNGVáy suông 4C cho con ti sz s-XL,128.700₫,https://tiki.vn/xa-hang-vay-suong-4c-cho-con-ti-sz-s-xl-p95172344.html?spid=95172548,15,,,thoitrangbau
Áo bầu nhỏ vải tơ đũi cho bầu từ 40kg đến 60kg,135.000₫,https://tiki.vn/ao-bau-nho-vai-to-dui-cho-bau-tu-40kg-den-60kg-p99869828.html?spid=99869848,16,,,thoitrangbau
Bộ mở nắp ngực cho mẹ sau sinh,156.000,https://tiki.vn/bo-mo-nap-nguc-cho-me-sau-sinh-p93245431.html?spid=93245513,17,,,thoitrangbau
,,https://tiki.vn/quan-bau-dai-cap-cheo-cotton-p146574719.html?spid=146574775,18,,,thoitrangbau
Quần Lót bầu cạp chéo thông hơi siêu mềm siêu mát cho mẹ bầu QL9090,33.894₫,https://tiki.vn/quan-lot-bau-cap-cheo-thong-hoi-sieu-mem-sieu-mat-cho-me-bau-ql9090-p146571961.html?spid=146572002,19,,,thoitrangbau
"Váy bầu, đầm bầu thiết kế công sở đuôi cá cổ nơ V226",149.940₫,https://tiki.vn/vay-bau-dam-bau-thiet-ke-cong-so-duoi-ca-co-no-v226-p146575609.html?spid=146575673,20,,,thoitrangbau
set đồ lót bầu hoạ tiết gấu chất cotton 100% MẶC BẦU VÀ SAU SINH CHO BÉ TI,124.740₫,https://tiki.vn/set-do-lot-bau-hoa-tiet-gau-chat-cotton-100-mac-bau-va-sau-sinh-cho-be-ti-p146572329.html?spid=146572377,21,,,thoitrangbau
A02 Áo tim xích cho con bú ẢNH THẬT,193.700₫,https://tiki.vn/a02-ao-tim-xich-cho-con-bu-anh-that-p95170744.html?spid=95170810,22,,,thoitrangbau
Combo đồ lót bầu 2 áo thông hơi 2 quần,142.380₫,https://tiki.vn/combo-do-lot-bau-2-ao-thong-hoi-2-quan-p146572847.html?spid=146572960,23,,,thoitrangbau
ĐẦM BẦU BÉO SUÔNG V589,310.400₫,https://tiki.vn/dam-bau-beo-suong-v589-p252639760.html?spid=252639770,24,,,thoitrangbau
Quần bầu kaki baggy đi làm đi chơi,343.000,https://tiki.vn/quan-bau-kaki-baggy-di-lam-di-choi-p252639757.html?spid=252639818,25,,,thoitrangbau
,,https://tiki.vn/vay-bau-dang-suong-mac-he-chat-lieu-linen-dam-bau-so-mi-nu-kem-dai-eo-b161-p185990156.html?spid=185990158,26,,,thoitrangbau
"Đầm bầu, đầm trơn xếp tầng đơn giản nhưng không kém phần sang trọng Db16",219.000₫,https://tiki.vn/dam-bau-dam-tron-xep-tang-don-gian-nhung-khong-kem-phan-sang-trong-db16-p196971443.html?spid=196971451,27,,,thoitrangbau
"Đầm bầu dự tiệc dáng suông dài, Đầm maxi nữ ngắn tay chất thun B35",199.000₫,https://tiki.vn/dam-bau-du-tiec-dang-suong-dai-dam-maxi-nu-ngan-tay-chat-thun-b35-p183521303.html?spid=183521305,28,,,thoitrangbau
"Áo Lót Bầu Loại Trơn (Cúc Mở, Mặc Cả Sau Sinh Cho Con Bú) ALB01",189.000₫,https://tiki.vn/ao-lot-bau-loai-tron-cuc-mo-mac-ca-sau-sinh-cho-con-bu-alb01-p164582805.html?spid=164582824,29,,,thoitrangbau
[ 1 hộp - 30 gói ] Ngũ cốc bầu Lạc Lạc plus hộp 30 gói/600gram - Tặng quà cho bé,257.140,https://tiki.vn/1-hop-30-goi-ngu-coc-bau-lac-lac-plus-hop-30-goi-600gram-tang-qua-cho-be-p230110789.html?spid=230110790,30,,,thoitrangbau
,,https://tiki.vn/ao-bau-xinh-co-so-mi-pha-ren-ke-caro-tay-lung-duoi-tom-ab05-p183701356.html?spid=183701358,31,,,thoitrangbau
"Đầm bầu suông linen thiết kế kiểu dáng sơ mi, có túi chéo db61",320.000₫,https://tiki.vn/dam-bau-suong-linen-thiet-ke-kieu-dang-so-mi-co-tui-cheo-db61-p196991992.html?spid=196992010,32,,,thoitrangbau
"Áo choàng cho con bú, áo choàng khi đi ra ngoài",58.000₫,https://tiki.vn/ao-choang-cho-con-bu-ao-choang-khi-di-ra-ngoai-p87534644.html?spid=87909511,33,,Đã bán 1,thoitrangbau
"Váy bầu cao cấp LOVELY & DIARY màu xám xinh xắn, nhìn xao xuyến (Quà tặng: 1 quần lót cotton 100%)",200.000₫,https://tiki.vn/vay-bau-cao-cap-lovely-diary-mau-xam-xinh-xan-nhin-xao-xuyen-qua-tang-1-quan-lot-cotton-100-p186123408.html?spid=186123409,34,,,thoitrangbau
ĐẦM BẦU VÁY BẦU HOA CÚC DỄ THƯƠNG,94.000₫,https://tiki.vn/dam-bau-vay-bau-hoa-cuc-de-thuong-p163581405.html?spid=163581425,35,,,thoitrangbau
,,https://tiki.vn/vay-bau-thiet-ke-du-tiec-cong-so-mua-he-dang-suong-chan-vay-xoe-co-canh-sen-vb3-p119112344.html?spid=119112379,36,,,thoitrangbau
Váy lanh bầu,95.000₫,https://tiki.vn/vay-lanh-bau-p129494412.html?spid=129494421,37,,,thoitrangbau
Váy bầu xinh chất cotton dáng suông thời trang,242.000₫,https://tiki.vn/vay-bau-xinh-chat-cotton-dang-suong-thoi-trang-p129493274.html?spid=129493299,38,,,thoitrangbau
Váy suông bầu thời trang dáng dài đầm bầu thiết kế chất cotton,158.000₫,https://tiki.vn/vay-suong-bau-thoi-trang-dang-dai-dam-bau-thiet-ke-chat-cotton-p129495733.html?spid=129495743,39,,,thoitrangbau
Bộ bầu thời trang bigsize mùa hè màu hồng hoa nhí chất mát đẹp hàng đẹp giá rẻ,142.000,https://tiki.vn/bo-bau-thoi-trang-bigsize-mua-he-mau-hong-hoa-nhi-chat-mat-dep-hang-dep-gia-re-p129495698.html?spid=129495704,40,,,thoitrangbau
