title,price,link_item,index,discount,sales,category
Đồ bộ nữ mặc ở nhà bộ lửng co giãn thoáng mát,88.000₫,https://tiki.vn/do-bo-nu-mac-o-nha-bo-lung-co-gian-thoang-mat-p124874010.html?spid=173449039,1,,Đã bán 31,dongunu
Váy ngủ sexy xẻ tà cao cấp - đầm ngủ gợi cảm B1035,121.500₫,https://tiki.vn/vay-ngu-sexy-xe-ta-cao-cap-dam-ngu-goi-cam-b1035-p186447667.html?spid=186447685,2,-25%,,dongunu
Váy ngủ nữ 4LOVA lụa satin mặc nhà trơn dáng suông 2 dây liền thân,79.000₫,https://tiki.vn/vay-ngu-nu-4lova-lua-satin-mac-nha-tron-dang-suong-2-day-lien-than-p198351551.html?spid=198352182,3,-32%,,dongunu
Váy ngủ lụa 2 dây phối ren cao cấp tặng kèm quần chip ren gợi cảm,280.000,https://tiki.vn/vay-ngu-lua-2-day-phoi-ren-cao-cap-p127313528.html?spid=127313645,4,-3%,,dongunu
,,https://tiki.vn/do-ngu-cosplay-hoa-trang-hoc-sinh-ao-so-mi-xuyen-thau-kem-chan-vay-sexy-bt6225-dam-ngu-vay-ngu-p203200629.html?spid=203200633,5,,,dongunu
Váy ngủ 2 dây lụa satin siêu quyến rũ - Trắng,115.000₫,https://tiki.vn/vay-ngu-2-day-lua-satin-sieu-quyen-ru-trang-p57721951.html?spid=57721952,6,,Đã bán 32,dongunu
Váy Ngủ Ren Siêu Sexy Ăm Ắp Gợi Cảm - Váy Ngủ Ren Tặng Kèm 1 Quần Chip Hàng Loại 1,79.000₫,https://tiki.vn/-mau-do--vay-dam-ngu-chat-lieu-ren--sieu-sexy-am-ap-goi-cam---tang-kem-1-quan-chip-cho-ban-gai-40-58kg-hang-loai-1-p59109039.html?spid=59109040,7,,Đã bán 17,dongunu
Bộ Đồ Ngủ Họa Tiết Đáng Yêu - B.Lingerie,240.000₫,https://tiki.vn/bo-do-ngu-hoa-tiet-dang-yeu-b-lingerie-p197218203.html?spid=197218204,8,,,dongunu
Áo choàng ngủ quảng châu cao cấp Ren phối voan thun kèm quần lót lọt khe quyến rũ g13,153.000,https://tiki.vn/ao-choang-ngu-quang-chau-cao-cap-ren-phoi-voan-thun-kem-quan-lot-lot-khe-quyen-ru-g13-p85903044.html?spid=85903051,9,,,dongunu
,,https://tiki.vn/vay-ngu-voan-sieu-mat-vay-ngu-sexy-g37-dam-ngu-mac-nha-do-ngu-mac-nha-vay-ngu-mac-nha-ao-so-mi-mac-nha-p103358039.html?spid=103358073,10,,,dongunu
Váy ngủ quảng châu cao cấp – Váy ngủ sexy ren G9 – Váy ngủ gợi cảm – Đầm ngủ ren hoa – Đồ ngủ sexy – Váy ngủ sexy,147.000₫,https://tiki.vn/vay-ngu-quang-chau-cao-cap-vay-ngu-sexy-ren-g9-vay-ngu-goi-cam-dam-ngu-ren-hoa-do-ngu-sexy-vay-ngu-sexy-p103358070.html?spid=103358135,11,,Đã bán 1,dongunu
BỘ ĐỒ THIẾT KẾ ĐỘC LẠ _ TB 200.130,819.000,https://tiki.vn/bo-do-thiet-ke-doc-la-_-tb-200-130-p136178121.html?spid=206873316,12,,,dongunu
,,https://tiki.vn/dam-vay-ngu-cosplay-nu-sinh-quyen-ru-vn24-dam-ngu-goi-cam-vay-ngu-cosplay-do-lot-sexy-freesize-p105700149.html?spid=105700153,13,,,dongunu
Bộ ngủ thể dục cosplay phòng the quyến rũ T110 GIAO HOẢ TỐC HCM,88.000₫,https://tiki.vn/bo-ngu-the-duc-cosplay-phong-the-quyen-ru-t110-giao-hoa-toc-hcm-p155705964.html?spid=155705981,14,,,dongunu
BỘ QUẦN ÁO LEN TĂM GIỮ NHIỆT ÔM BODY CHO NỮ,135.000₫,https://tiki.vn/bo-quan-ao-len-tam-giu-nhiet-om-body-cho-nu-p67631286.html?spid=68843791,15,,Đã bán 1,dongunu
Bodysuit xẻ đáy hở lưng phối ngọc độc đáo quyến rũ. Giao hỏa tốc HCM,110.000₫,https://tiki.vn/bodysuit-xe-day-ho-lung-phoi-ngoc-doc-dao-quyen-ru-giao-hoa-toc-hcm-p197866425.html?spid=197866438,16,,Đã bán 1,dongunu
"Bộ Đồ Mặc Nhà Nữ Cho Người Trung Niên, Người Lớn Tuổi NG19 - Size",315.000,https://tiki.vn/bo-do-mac-nha-nu-cho-nguoi-trung-nien-nguoi-lon-tuoi-ng19-p8448045.html?spid=69764373,17,,Đã bán 4,dongunu
,,https://tiki.vn/vay-ngu-nu-2-day-ay-mac-nha-hinh-dau-cute-v41-p109981970.html?spid=109982030,18,,,dongunu
Sét bộ thun hàng bigsize cho người mập - 01,143.000₫,https://tiki.vn/set-bo-thun-hang-bigsize-cho-nguoi-map-p269899732.html?spid=269899761,19,,Đã bán 5,dongunu
Bộ Đồ Ngủ 2 Dây Basic BHDN01,299.000₫,https://tiki.vn/bo-do-ngu-2-day-basic-bhdn01-p243096363.html?spid=243096367,20,,,dongunu
Bộ Đồ Thun Lửng Nữ Vincy Thoáng Mát BTL026S11,529.000₫,https://tiki.vn/bo-do-thun-lung-nu-vincy-thoang-mat-btl026s11-p269986554.html?spid=269986558,21,,,dongunu
Đầm ngủ phi lụa cao cấp WANNABE DNS50 váy ngủ hai dây cut-out lưng trang trí 4 dây hình chữ M khoe eo quyến rũ gợi cảm,350.000₫,https://tiki.vn/dam-ngu-phi-lua-cao-cap-wannabe-dns50-kieu-dam-hai-day-cut-out-lung-quyen-ru-goi-cam-p180590331.html?spid=180590333,22,,Đã bán 3,dongunu
Đầm ngủ phi lụa cao cấp WANNABE DNS68 váy ngủ bản vai 4cm cổ tim phối ren đơn giản trang nhã,395.000₫,https://tiki.vn/dam-ngu-phi-lua-cao-cap-wannabe-dns68-co-tim-phoi-ren-don-gian-trang-nha-p225970682.html?spid=225970694,23,,,dongunu
"Sét Bộ Nữ SS13, Sét Đồ Nữ Đi Chơi Đẹp In Hình Cún Vàng Dễ Thương, Sét Áo Vải Cotton Và Quần Kẻ Màu Cá Tính - LẺ ÁO TRẮNG",49.000₫,https://tiki.vn/set-bo-nu-ss13-set-do-nu-di-choi-dep-in-hinh-cun-vang-de-thuong-set-ao-vai-cotton-va-quan-ke-mau-ca-tinh-p248330428.html?spid=248330478,24,,,dongunu
Set váy ngủ lụa hai dây cao cấp kèm áo choàng lụa Q141 - Áo choàng lụa kèm váy ngủ lụa - Đồ ngủ nữ,350.000,https://tiki.vn/set-vay-ngu-lua-hai-day-cao-cap-kem-ao-choang-lua-q141-ao-choang-lua-kem-vay-ngu-lua-do-ngu-nu-p207360554.html?spid=207360555,25,,,dongunu
,,https://tiki.vn/vay-ngu-ren-xuyen-thau-sexy-goi-cam-bt0075-do-ngu-sexy-dam-ngu-nu-vay-ngu-mac-nha-p173885852.html?spid=173885860,26,,,dongunu
Váy ngủ satin hai dây đan hông sexy Q01 - Đầm ngủ lụa satin gợi cảm - Đồ ngủ nữ quyến rũ,149.000₫,https://tiki.vn/vay-ngu-satin-hai-day-dan-hong-sexy-bt0028-dam-ngu-lua-satin-goi-cam-do-ngu-nu-quyen-ru-p185225579.html?spid=185225581,27,,Đã bán 2,dongunu
"Set Đồ Ngủ Sexy Nữ Đồ Bộ Nữ Hai Dây Chéo Lưng, Ngực Thêu Hoa Tạo Sự Gợi Cảm Hấp Dẫn Cho Bạn Gái",39.000₫,https://tiki.vn/set-do-ngu-sexy-nu-do-bo-nu-hai-day-cheo-lung-nguc-theu-hoa-tao-su-goi-cam-hap-dan-cho-ban-gai-p70261545.html?spid=70261553,28,,Đã bán 7,dongunu
Bộ ngủ Cosplay lưới liền thân có tay sexy MS81,32.000₫,https://tiki.vn/bo-ngu-cosplay-luoi-lien-than-co-tay-sexy-ms81-p152633250.html?spid=152633251,29,,,dongunu
Bộ đồ ngủ cosplay nữ học sinh áo croptop với chân váy ngắn - SMS034,160.000,https://tiki.vn/bo-do-ngu-cosplay-nu-hoc-sinh-ao-croptop-voi-chan-vay-ngan-sms034-p271532022.html?spid=271532031,30,,,dongunu
,,https://tiki.vn/bo-thu-dong-nu-sambi-ni-dai-tay-quan-ke-hoa-tiet-cao-cap-p148819421.html?spid=148819427,31,,,dongunu
"Hantu SE-Váy ngủ lụa cao cấp, váy ngủ nữ, váy ngủ 2 dây, váy ngủ gợi cảm, váy ngủ sexy, đầm ngủ lụa mặc nhà hai dây phối ren ngực có 4 màu đen xanh đen đỏ hồng cam",280.000₫,https://tiki.vn/hantu-se-vay-ngu-lua-cao-cap-vay-ngu-nu-vay-ngu-2-day-vay-ngu-goi-cam-vay-ngu-sexy-dam-ngu-lua-mac-nha-hai-day-phoi-ren-nguc-co-4-mau-den-xanh-den-do-hong-cam-p126934335.html?spid=126934345,32,,Đã bán 2,dongunu
Áo liền thân Bodysuit sexy gợi cảm,79.000₫,https://tiki.vn/ao-lien-than-bodysuit-sexy-goi-cam-p181449290.html?spid=181449294,33,,,dongunu
Bịt Mắt Ngủ Dễ Thương - Bịt Mắt Ngủ Hoạt Hình Loại Xịn Kèm Túi Nước Mát Dưỡng Mắt Ngủ,31.500₫,https://tiki.vn/bit-mat-ngu-de-thuong-bit-mat-ngu-hoat-hinh-loai-xin-kem-tui-nuoc-mat-duong-mat-ngu-p153986113.html?spid=153986121,34,,Đã bán 1,dongunu
"Đồ bộ nữ,đồ ngủ mặc nhà lửng 9 tấc vải lụa mango BL 47 họa tiết hoa nhí dễ thương size 47-65kg",152.250,https://tiki.vn/do-bo-nu-do-ngu-mac-nha-lung-9-tac-vai-lua-mango-bl-47-hoa-tiet-hoa-nhi-de-thuong-size-47-65kg-p157427306.html?spid=157427347,35,,Đã bán 1,dongunu
,,https://tiki.vn/vay-ngu-goi-cam-chat-dep-ren-mem-mat-min-quyen-ru-p104303429.html?spid=104303462,36,,,dongunu
Bodysuit chất liệu ren quyến rũ dành cho các nàng,49.000₫,https://tiki.vn/bodysuit-chat-lieu-ren-quyen-ru-danh-cho-cac-nang-p162205208.html?spid=162205212,37,,Đã bán 8,dongunu
Váy ngủ lụa phối ren cực sexy,125.000₫,https://tiki.vn/vay-ngu-lua-phoi-ren-cuc-sexy-p68962006.html?spid=68962051,38,,Đã bán 2,dongunu
BỘ NỈ MÙA ĐÔNG SIÊU ẤM ÁP,455.000₫,https://tiki.vn/bo-ni-mua-dong-sieu-am-ap-p117185210.html?spid=117185286,39,,Đã bán 3,dongunu
"Mã T1x Bộ Đồ Ngủ 2 Dây Quần Cộc Nữ, Váy Ngủ 2 Dây HISEXY Chất Lụa Satin Cao Cấp Mặc Nhà Đủ Size Dưới 65Kg",300.000,https://tiki.vn/ma-t1x-bo-do-vay-ngu-2-day-quan-coc-nu-hisexy-chat-lua-satin-cao-cap-mac-nha-p73911227.html?spid=73911281,40,,,dongunu
