title,price,link_item,index,discount,sales,category
Đầm ngủ sơ mi in hoa văn dễ thương Q157 - Váy ngủ sơ mi sexy - Đầm ngủ,189.000₫,https://tiki.vn/dam-ngu-so-mi-in-hoa-van-de-thuong-q157-vay-ngu-so-mi-sexy-dam-ngu-p207914863.html?spid=207914869,1,-24%,Đã bán 8,dongunu
Váy ngủ ren xuyên thấu cao cấp Q08 - Đầm ngủ hở lưng sexy gợi cảm - Đồ ngủ nữ quyến rũ - Váy ngủ nữ,169.000₫,https://tiki.vn/vay-ngu-ren-xuyen-thau-cao-cap-bt0059-dam-ngu-ho-lung-sexy-goi-cam-do-ngu-nu-quyen-ru-vay-ngu-nu-p173418654.html?spid=173418662,2,-32%,Đã bán 3,dongunu
Váy ngủ sườn xám tà lệch dây cột chéo sexy cao cấp Q452 - Đầm ngủ cosplay sườn xám quyến rũ - Đồ ngủ mạc nhà,260.000₫,https://tiki.vn/vay-ngu-suon-xam-ta-lech-day-cot-cheo-sexy-cao-cap-bt0186-dam-ngu-cosplay-suon-xam-quyen-ru-do-ngu-mac-nha-p177639265.html?spid=177639267,3,,,dongunu
"DREAMY-DN09-Đồ Bộ Ngủ Lụa Cao Cấp, Đồ Mặc Nhà, Đồ Bộ Ngủ, Đồ Ngủ Lụa Phối Ren Ngực Quyến Rủ, Đồ Ngủ Gợi Cảm Sexy Tay cánh Tiên Phối Ren Ngực Màu Đen và Đỏ Đô",112.200,https://tiki.vn/dreamy-dn09-do-bo-ngu-lua-cao-cap-do-mac-nha-do-bo-ngu-do-ngu-lua-phoi-ren-nguc-quyen-ru-do-ngu-goi-cam-sexy-tay-canh-tien-phoi-ren-nguc-mau-den-va-do-do-p71160416.html?spid=71160418,4,,,dongunu
,,https://tiki.vn/do-bo-nu-lua-mango-size-lon-58-75kg-tay-dai-quan-dai-bd13-p216359744.html?spid=216359745,5,-41%,,dongunu
sét 3 món đồ ngủ nội y nữ áo choàng + đồ nội y + quần lót,125.000₫,https://tiki.vn/set-3-mon-do-ngu-noi-y-nu-ao-choang-do-noi-y-quan-lot-p68961691.html?spid=68961713,6,-50%,Đã bán 10,dongunu
"Bộ đồ ngủ nam nữ hình gấu trúc Pan Da Chất lông cừu Siêu Ấm Áp, Bộ mặc Nhà Unisex hình thú đáng yêu sang chảnh",195.000₫,https://tiki.vn/bo-do-ngu-nam-nu-hinh-gau-truc-pan-da-chat-long-cuu-sieu-am-ap-bo-mac-nha-unisex-hinh-thu-dang-yeu-sang-chanh-p195301432.html?spid=195301440,7,-25%,Đã bán 1,dongunu
Set áo choàng + váy ngủ lụa dáng dài quá gối Hantu Sleepwear sang trọng đủ size 40-100kg,750.000₫,https://tiki.vn/set-ao-choang-vay-ngu-lua-dang-dai-qua-goi-hantu-sleepwear-sang-trong-du-size-40-100kg-p127312513.html?spid=127312768,8,-30%,Đã bán 1,dongunu
đồ bộ nữ chất kate hàn,190.000,https://tiki.vn/do-bo-nu-chat-kate-han-p208269876.html?spid=208269940,9,,Đã bán 3,dongunu
,,https://tiki.vn/dam-ngu-phi-lua-cao-cap-wannabe-dns46-ho-lung-phoi-ren-nu-tinh-quyen-ru-p177721850.html?spid=177721854,10,,,dongunu
Đầm ngủ ren có mút ngực sexy TK2961,200.000₫,https://tiki.vn/dam-ngu-ren-co-mut-nguc-sexy-tk2961-p154292879.html?spid=154292880,11,,,dongunu
"Đồ bộ mặc nhà phi lụa Wannabe, bộ sọt bss06 tay áo phối ren nữ tính",420.000,https://tiki.vn/do-bo-mac-nha-phi-lua-wannabe-bo-sot-bss06-tay-ao-phoi-ren-nu-tinh-p97551702.html?spid=114467599,12,,,dongunu
,,https://tiki.vn/dam-ngu-lua-satin-co-so-mi-p1-p105229699.html?spid=105229737,13,,,dongunu
"Đồ Bộ Lụa/Satin Dài Mặc Ở Nhà Nữ - Bộ Quần Áo Ngủ Nữ Mặc Mùa Hè, Nhiều Màu Dễ Thương - MND1004",299.000₫,https://tiki.vn/do-bo-lua-satin-dai-mac-o-nha-nu-bo-quan-ao-ngu-nu-mac-mua-he-nhieu-mau-de-thuong-p134294309.html?spid=166439258,14,,,dongunu
"Đồ Mặc Ở Nhà Nữ Đùi Chất Lụa/Lanh/Tole - Bộ Quần Áo Ngủ Nữ 2 Dây Mặc Nhà Mùa Hè, Nhiều Họa Tiết Dễ Thương",299.000₫,https://tiki.vn/do-mac-o-nha-nu-dui-chat-lua-lanh-tole-bo-quan-ao-ngu-nu-2-day-mac-nha-mua-he-nhieu-hoa-tiet-de-thuong-p137596397.html?spid=173972916,15,,Đã bán 12,dongunu
Đồ ngủ hóa thân lưới,55.000₫,https://tiki.vn/do-ngu-hoa-than-luoi-p199526656.html?spid=199526657,16,,Đã bán 1,dongunu
"(40kg - 70kg) Đồ Bộ Mặc Nhà, Đồ Bộ Nữ Quần Lửng Tay Ngắn Tole (Lanh) 2 Da",145.000,https://tiki.vn/40kg-70kg-do-bo-mac-nha-do-bo-nu-quan-lung-tay-ngan-tole-lanh-2-da-p199244227.html?spid=199244263,17,,,dongunu
,,https://tiki.vn/bo-do-ngu-lua-cao-cap-lady-nature-miley-lingerie-css0102-p95734532.html?spid=95734536,18,,,dongunu
"Đồ bộ Pyjama lụa, đồ mặc nhà nữ VILADY - B134 kiểu quần đùi tay cộc, họa tiết siêu dễ thương, chất liệu lụa Pháp ( lụa latin) - Màu cam",266.000₫,https://tiki.vn/bo-do-pyjama-mac-nha-nu-vilady-lua-phap-cao-cap-quan-dui-tay-coc-nhieu-hoa-tiet-sieu-de-thuong-b123-p175816576.html?spid=175816578,19,,Đã bán 7,dongunu
"Áo giữ nhiệt nữ dài tay cổ tròn Vicci vải cotton co giãn, mềm mịn ôm dáng màu",85.000₫,https://tiki.vn/ao-giu-nhiet-nu-dai-tay-co-tron-vicci-vai-cotton-co-gian-mem-min-om-dang-p6991569.html?spid=7033277,20,,Đã bán 50,dongunu
Bộ Đồ Ngủ 2 Dây Phối Ren Basic BHDN02,335.000₫,https://tiki.vn/bo-do-ngu-2-day-phoi-ren-basic-bhdn02-p243094568.html?spid=243094578,21,,,dongunu
Bộ Cosplay Váy Sườn Xám Quyến Rũ - B.Lingerie,220.000₫,https://tiki.vn/bo-cosplay-vay-suon-xam-quyen-ru-b-lingerie-p215126129.html?spid=215126130,22,,,dongunu
"Bộ Đồ Ngủ, Mặc Nhà Nữ Pijama - Vải Lụa Mango Loại 1 Cao Cấp, Nhiều Họa Tiết Dễ Thương - 02",181.000₫,https://tiki.vn/bo-do-ngu-mac-nha-nu-pijama-vai-lua-mango-loai-1-cao-cap-nhieu-hoa-tiet-de-thuong-p270251892.html?spid=270251910,23,,Đã bán 114,dongunu
Váy ngủ lụa hai dây hở lưng sexy Q17 - Đầm ngủ nữ gợi cảm - đồ ngủ nử mặc nhà,189.000₫,https://tiki.vn/vay-ngu-lua-hai-day-ho-lung-sexy-bt0033-dam-ngu-nu-goi-cam-do-ngu-nu-mac-nha-p169468021.html?spid=169468031,24,,Đã bán 3,dongunu
Đồ ngủ hai dây phối ren chất mịn quyến rũ,139.000,https://tiki.vn/do-ngu-hai-day-phoi-ren-chat-min-quyen-ru-p142811136.html?spid=142811142,25,,,dongunu
,,https://tiki.vn/do-bo-ngu-nu-set-do-pijama-mac-nha-hoa-tiet-soc-dang-yeu-chat-lua-tao-cam-giac-em-ai-dam-bao-giat-khong-nhan-form-duoi-60kg-mac-dep-thoai-mai-p66836513.html?spid=66836519,26,,,dongunu
Đồ Ngủ Nữ|Váy Ngủ Gợi Cảm️FreeShip - Tặng Quần Chip Xinh️ Voan Ren 2 Lớp Mềm Mịn Quyến Rũ (TL),109.000₫,https://tiki.vn/vay-ngu-goi-cam-tl-p104303751.html?spid=104303758,27,,Đã bán 12,dongunu
"Đồ bộ nữ,đồ ngủ mặc nhà vải lụa BD 48 họa tiết hoa nhí dễ thương size 45-57kg",131.250₫,https://tiki.vn/do-bo-nu-do-ngu-mac-nha-vai-lua-bd-48-hoa-tiet-hoa-nhi-de-thuong-size-45-57kg-p158807931.html?spid=158807937,28,,,dongunu
Bộ ngủ liền thân lưới cực SEXY,55.000₫,https://tiki.vn/bo-ngu-lien-than-luoi-cuc-sexy-p107154444.html?spid=107154449,29,,Đã bán 15,dongunu
Đồ Ngủ Mặc Nhà Bộ Đồ Ngủ Lụa Satin Hisexy Không Mút Ngực MS03,139.000,https://tiki.vn/do-ngu-mac-nha-bo-do-ngu-lua-satin-hisexy-khong-mut-nguc-ms03-p124324957.html?spid=124325828,30,,,dongunu
,,https://tiki.vn/dam-ngu-cosplay-bodysuit-lien-than-ren-hai-day-sexy-bt42215-vay-ngu-sexy-do-ngu-sexy-p204052361.html?spid=204052362,31,,,dongunu
Bộ Đồ thú Khủng Long xanh liền thân lông mịn Pijama dành Cho Người Lớn và Trẻ Em kiểu dáng Động Vật Hoạt Hình Cosplay,269.000₫,https://tiki.vn/bo-do-thu-khung-long-xanh-lien-than-long-min-pijama-danh-cho-nguoi-lon-va-tre-em-kieu-dang-dong-vat-hoat-hinh-cosplay-p119670023.html?spid=119670051,32,,Đã bán 2,dongunu
"BỘ ĐỒ NỮ BỘ ĐỒ MẶC NHÀ NỮ , ĐỒ BỘ THUN NỮ",108.000₫,https://tiki.vn/bo-do-nu-bo-do-mac-nha-nu-do-bo-thun-nu-p90066421.html?spid=91750670,33,,Đã bán 5,dongunu
"Đồ Ngủ Pijama Ngắn Cộc Tay Quần Đùi Chất Kate Cao Cấp Loại 1, Sét Đồ Bộ Nữ Đẹp Mặc Nhà Thoáng Mát",140.000₫,https://tiki.vn/do-ngu-pijama-ngan-coc-tay-quan-dui-chat-kate-cao-cap-loai-1-set-do-bo-nu-dep-mac-nha-thoang-mat-p121481013.html?spid=162161268,34,,Đã bán 12,dongunu
Đồ Ngủ Cosplay Y Tá - B.Lingerie,280.000,https://tiki.vn/do-ngu-cosplay-y-ta-b-lingerie-p147269798.html?spid=147269799,35,,,dongunu
,,https://tiki.vn/vay-ngu-cao-cap-phi-lua-phoi-ren-co-mut-nguc-cdanp27-p125097732.html?spid=125097738,36,,,dongunu
"Bộ pijama tay dài chất liệu mango cao cấp, bộ đồ ngủ nữ họa tiết rằn ri mát mẻ sang trọng DD03",330.000₫,https://tiki.vn/bo-pijama-tay-dai-chat-lieu-mango-cao-cap-bo-do-ngu-nu-hoa-tiet-ran-ri-mat-me-sang-trong-dd03-p184787748.html?spid=184787752,37,,,dongunu
"Bộ ngủ nhung liền thân bodysuit (kèm 1 tai thỏ nhung + 1 vòng cổ gắn nơ + 2 vòng tay + 4 kẹp vớ) vô cùng sexy BS04, Đồ ngủ cosplay gợi cảm, Freesize",149.000₫,https://tiki.vn/bo-ngu-nhung-lien-than-bodysuit-kem-1-tai-tho-nhung-1-vong-co-gan-no-2-vong-tay-4-kep-vo-vo-cung-sexy-bs04-do-ngu-cosplay-goi-cam-freesize-p54497404.html?spid=54497408,38,,Đã bán 30,dongunu
Váy ngủ ren sexy quai chéo lưng Cao cấp MS1710,99.000₫,https://tiki.vn/vay-ngu-ren-sexy-quai-cheo-lung-cao-cap-ms1710-p47114594.html?spid=57050282,39,,Đã bán 83,dongunu
Set bộ ngủ 2 dây ren cực SEXY T189 GIAO HOẢ TỐC HCM,108.000,https://tiki.vn/set-bo-ngu-2-day-ren-cuc-sexy-t189-giao-hoa-toc-hcm-p155706124.html?spid=155706149,40,,Đã bán 1,dongunu
