title,price,link_item,index,discount,sales,category
"Áo polo nam nữ phối 4 màu, đủ size , chất cotton poly form áo đẹp, trẻ trung",95.000₫,https://tiki.vn/ao-polo-nam-nu-phoi-4-mau-du-size-chat-cotton-poly-form-ao-dep-tre-trung-p270702997.html?spid=270703021,1,-23%,,aothun
Áo thun Luffy mũ rơm Áo phông cotton tay ngắn hoạt hình One piece đảo hải tặc unisex nam nữ bận đều đẹp,59.000₫,https://tiki.vn/product-p91281538.html?spid=133164791,2,-47%,Đã bán 11,aothun
BST 6 Áo LUFFY ONE PIECE Cao Cấp| Áo One Piece Luffy Đảo Hải Tặc Đẹp OP10 | Áo Chất Store,59.000₫,https://tiki.vn/bst-6-ao-luffy-one-piece-cao-cap-ao-one-piece-luffy-dao-hai-tac-dep-op10-ao-chat-store-p90416575.html?spid=273445873,3,-49%,,aothun
"Áo Thun Nam Sọc Dọc Cổ Tròn, Vải Trơn Mát Cao Cấp Form Thể Thao (Nhiều màu)",180.000₫,https://tiki.vn/ao-thun-nam-soc-doc-co-tron-vai-tron-mat-cao-cap-form-the-thao-nhieu-mau-p75370678.html?spid=75370738,4,,,aothun
,,https://tiki.vn/onways-ao-thun-nam-graphic-no-5-p195185849.html?spid=195185871,5,-24%,,aothun
"Áo Thun Polo Nam Hoạ Tiết Chữ BASIC AKUBA form slimfit, kiểu dáng trẻ trung, dễ phối 01JW189",429.000₫,https://tiki.vn/ao-thun-polo-nam-hoa-tiet-chu-basic-akuba-form-slimfit-kieu-dang-tre-trung-de-phoi-01jw189-p155043296.html?spid=155043308,6,,Đã bán 1,aothun
Áo Kangol UNISEX T-SHIRT 6225101989,850.000₫,https://tiki.vn/ao-kangol-unisex-t-shirt-6225101989-p197622350.html?spid=197622352,7,,,aothun
Áo Kangol Unisex T-Shirt 6325101831,800.000₫,https://tiki.vn/ao-kangol-unisex-t-shirt-6325101831-p261798731.html?spid=261798739,8,,,aothun
Áo Thun Nam Thái Lan - 1A,270.000₫,https://tiki.vn/ao-thun-nam-thai-lan-chinh-hang-1a-p203933253.html?spid=203933277,9,,,aothun
,,https://tiki.vn/big-size-115kg-ao-thun-nam-ngan-tay-khong-co-big-size-p179163690.html?spid=179164015,10,,,aothun
Áo Thun Tay Lỡ In Heo Mạc Chược,122.200₫,https://tiki.vn/ao-thun-tay-lo-in-heo-mac-chuoc-p84382967.html?spid=84382978,11,,,aothun
Áo thun unisex siêu hot chuẩn chất lượng GMT,31.360₫,https://tiki.vn/ao-thun-unisex-sieu-hot-chuan-chat-luong-gmt-p105306030.html?spid=105306080,12,,,aothun
,,https://tiki.vn/ao-thun-nam-co-tru-cao-cap-p45485819.html?spid=197211829,13,,,aothun
Áo thun nam cổ tim dài tay đẹp nhiều màu ( hàng cao cấp ),76.140₫,https://tiki.vn/ao-thun-nam-co-tim-dai-tay-dep-nhieu-mau-hang-cao-cap-p138749504.html?spid=138751293,14,,Đã bán 10,aothun
"Áo thun nam dài tay ALIGRO chất cotton thấm hút mồ hôi, mềm mại màu ghi ALGAPD051",425.000₫,https://tiki.vn/ao-thun-nam-dai-tay-aligro-chat-lieu-cotton-cao-cap-sieu-mem-mai-day-dan-cuc-de-chiu-tham-hut-tot-algapd051-p201593844.html?spid=201593848,15,,,aothun
Áo Thun Local Brand Teeworld Đúng Nhận Sai Cãi Nam Nữ Form Rộng Unisex,279.000₫,https://tiki.vn/ao-thun-local-brand-teeworld-dung-nhan-sai-cai-nam-nu-form-rong-unisex-p217440155.html?spid=217440159,16,,Đã bán 9,aothun
Áo thun 5THEWAY PHIÊN BẢN ĐẶC BIỆT aka /STREETWEAR for ALL/ SQUARE TEE in WHITE,490.000₫,https://tiki.vn/ao-thun-5theway-phien-ban-dac-biet-aka-streetwear-for-all-square-tee-in-white-p71506715.html?spid=71506721,17,,Đã bán 12,aothun
,,https://tiki.vn/ao-polo-nam-spl03-08-p247656366.html?spid=247656370,18,,,aothun
SWE - Áo phông unisex cổ tròn BASIC RAGLAN TEE ngắn tay cotton thoáng mát thời trang chính hãng,380.000₫,https://tiki.vn/swe-ao-phong-unisex-co-tron-basic-raglan-tee-ngan-tay-cotton-thoang-mat-thoi-trang-chinh-hang-p205850241.html?spid=205850260,19,,,aothun
"Áo 3 lỗ nam thể thao DO GYM SHOP form body đẹp, thun lạnh 4 chiều thoáng mát",139.000₫,https://tiki.vn/ao-3-lo-nam-the-thao-do-gym-shop-form-body-dep-thun-lanh-4-chieu-thoang-mat-p270220699.html?spid=270220711,20,,,aothun
"TOKYO, mã G58. Áo thun siêu đẹp cho cả gia đình. Form unisex cho nam nữ, trẻ em, bé trai gái. Quà tặng ý nghĩa cho bố mẹ, con cái, bạn bè, doanh nghiệp, hội nhóm. Áo phông hàng hiệu Goking cao cấp in hình chữ 3D",69.000₫,https://tiki.vn/tokyo-ma-g58-ao-thun-nam-nu-in-sieu-dep-ao-phong-thoat-nhiet-goking-hang-hieu-cao-cap-p251579306.html?spid=251579506,21,,,aothun
Áo thun nam mẫu mới ( Xám Chì ),89.000₫,https://tiki.vn/ao-thun-nam-mau-moi-xam-chi-p252913622.html?spid=252913628,22,,Đã bán 2,aothun
Áo Thun Water Law Siêu Đẹp - Áo Đảo Hải Tặc One Piece LAW Đẹp OP164,59.000₫,https://tiki.vn/ao-thun-water-law-sieu-dep-ao-dao-hai-tac-one-piece-law-dep-op164-p90423344.html?spid=273446116,23,,,aothun
Áo Thun MONKEY LUFFY THƯ PHÁP ONE PIECE Cực Đẹp | Áo Đảo Hải Tặc Luffy Mũ Rơm OP88,59.000₫,https://tiki.vn/ao-thun-monkey-luffy-thu-phap-one-piece-cuc-dep-ao-dao-hai-tac-luffy-mu-rom-op88-p91914368.html?spid=273420564,24,,,aothun
áo thun nam họa tiét độc đáo,157.800₫,https://tiki.vn/ao-thun-nam-hoa-tiet-doc-dao-p48504476.html?spid=48504480,25,,,aothun
,,https://tiki.vn/video-anh-that-ao-thun-nam-tay-ngan-lv-snoopy-dog-sieu-dep-ao-phong-lv-unisex-nam-nu-at57-p104145492.html?spid=104146637,26,,,aothun
Áo Thun Monkey Luffy Thư Pháp One Piece,59.000₫,https://tiki.vn/ao-thun-monkey-luffy-thu-phap-one-piece-p91925460.html?spid=91926685,27,,Đã bán 5,aothun
"Áo Phông Oversize Halloween, JACKLANE, Áo thun cộc tay Unisex Jack Lane",160.000₫,https://tiki.vn/ao-phong-oversize-halloween-jacklane-ao-thun-coc-tay-unisex-jack-lane-p160517071.html?spid=160517157,28,,,aothun
"Áo thun nam trơn Gold Rhino cao cấp, 2 màu Trắng / Đen, hàng xuất khẩu Nhật Bản, 100% cotton chất xịn, áo phông nam trơn mềm mịn, thấm hút mồ hôi, kháng khuẩn, khử mùi hôi triệt để - Hàng chính hãng - Đen",179.000₫,https://tiki.vn/ao-thun-nam-tron-gold-rhino-cao-cap-2-mau-trang-den-hang-xuat-khau-nhat-ban-100-cotton-chat-xin-ao-phong-nam-tron-mem-min-tham-hut-mo-hoi-khang-khuan-khu-mui-hoi-triet-de-hang-chinh-hang-p94794850.html?spid=94794862,29,,Đã bán 365,aothun
Áo thun nam áo phông in hình Luffy onepie,45.000₫,https://tiki.vn/ao-thun-nam-ao-phong-in-hinh-luffy-onepie-p66903386.html?spid=66903393,30,,Đã bán 3,aothun
,,https://tiki.vn/ao-polo-the-thao-nam-under-armour-iso-chill-charged-camo-1373692-001-p271094512.html?spid=271094531,31,,,aothun
Áo Thun Nam Khatoco A2MN398R2-VNCR278-2412-N,398.000₫,https://tiki.vn/ao-thun-nam-khatoco-a2mn398r2-vncr278-2412-n-p273585003.html?spid=273585013,32,,,aothun
Áo thun Phong Cận Hero Team,59.000₫,https://tiki.vn/ao-thun-phong-can-hero-team-p91937614.html?spid=91937710,33,,Đã bán 2,aothun
Áo thun thu đông nam dài tay cổ tim nhiều màu chất cotton co giãn dáng body thời trang,75.200₫,https://tiki.vn/ao-thun-thu-dong-nam-dai-tay-co-tim-nhieu-mau-chat-cotton-co-gian-dang-body-thoi-trang-p138749841.html?spid=138753030,34,,,aothun
ONWAYS - Áo thun No.5 Graphic - Kid,259.000₫,https://tiki.vn/onways-ao-thun-no-5-graphic-kid-p195186051.html?spid=195186059,35,,Đã bán 1,aothun
,,https://tiki.vn/ao-thun-trafalgar-d-water-law-cuc-doc-ao-dao-hai-tac-one-piece-mu-rom-team-p90427626.html?spid=273423128,36,,,aothun
MLB - Áo thun unisex cổ tròn tay ngắn Paisley Big Logo One Point 3ATSI0133,1.790.000₫,https://tiki.vn/mlb-ao-thun-unisex-co-tron-tay-ngan-paisley-big-logo-one-point-3atsi0133-07sbl-p270448631.html?spid=270448635,37,,,aothun
Áo Vans Surf Shirt Ss Surf Mule Trk VN0007VEWHT,900.000₫,https://tiki.vn/ao-vans-surf-shirt-ss-surf-mule-trk-vn0007vewht-p267340242.html?spid=267340248,38,,,aothun
Áo Sneaker Buzz T-Shirt Logo Buzz 2311SB3_003,495.000₫,https://tiki.vn/ao-sneaker-buzz-t-shirt-logo-buzz-2311sb3_003-p273584159.html?spid=273600334,39,,,aothun
Áo thun nam áo phông có đai phối màu cá tính độc đáo siêu hot T21,205.000₫,https://tiki.vn/ao-thun-nam-ao-phong-co-dai-phoi-mau-ca-tinh-doc-dao-sieu-hot-t21-p263358834.html?spid=263358838,40,,,aothun
