title,price,link_item,index,discount,sales,category
Áo sơ mi nam màu trắng ngắn tay vải chống nhăn,108.000₫,https://tiki.vn/ao-so-mi-nam-mau-trang-ngan-tay-vai-chong-nhan-p85086740.html?spid=85087037,1,,Đã bán 175,aosomi
Áo sơ mi nam ngắn tay vải sơ mi chống nhăn cao cấp,108.000₫,https://tiki.vn/ao-so-mi-nam-ngan-tay-vai-so-mi-chong-nhan-cao-cap-p28634261.html?spid=28634276,2,-65%,Đã bán 228,aosomi
Sơ mi nam cộc tay May 10 form SlimFit mã 010121135 354,196.000₫,https://tiki.vn/so-mi-nam-coc-tay-may-10-form-slimfit-ma-010121135-354-p271537829.html?spid=271537831,3,,Đã bán 2,aosomi
Áo Sơ Mi Nam Trơn Ngắn Tay Form Chuẩn,138.000,https://tiki.vn/ao-so-mi-nam-tron-ngan-tay-form-chuan-p51638534.html?spid=51638548,4,,,aosomi
,,https://tiki.vn/ao-so-mi-coc-tay-nam-mau-trang-kem-adino-vai-nen-lua-soi-soi-modal-dang-cong-so-slimfit-hoi-om-tre-trung-ct01-p195947291.html?spid=195947297,5,-50%,,aosomi
Áo Sơ Mi Nam Dài Tay Họa Tiết Sọc 621 Thời Trang Cao Cấp PONIVA Chất Vải Cao Cấp Mềm Mại Thấm Hút Mồ Hôi Tốt,145.000₫,https://tiki.vn/ao-so-mi-nam-dai-tay-hoa-tiet-soc-621-thoi-trang-cao-cap-poniva-chat-vai-cao-cap-mem-mai-tham-hut-mo-hoi-tot-p111711467.html?spid=111711493,6,-35%,Đã bán 57,aosomi
Áo Sơ Mi Nam Form Rộng Kẻ Caro,139.000₫,https://tiki.vn/ao-so-mi-nam-form-rong-ke-caro-p3058475.html?spid=58895521,7,,Đã bán 18,aosomi
Áo Đũi Nam Mát Mẻ Mùa Hè SZone SA501,79.000₫,https://tiki.vn/ao-dui-nam-mat-me-mua-he-szone-sa501-p246730347.html?spid=246730461,8,,Đã bán 9,aosomi
Áo sơ mi nam cổ trụ chui đàu màu trắng ngắn tay,142.800,https://tiki.vn/ao-so-mi-nam-ngan-tay-co-tru-p85087124.html?spid=113167881,9,-35%,,aosomi
,,https://tiki.vn/ao-dui-nam-coc-tay-co-tau-chui-dau-arctichunter-thoi-trang-thuong-hieu-chinh-hang-p73622511.html?spid=73622523,10,-17%,,aosomi
Áo Sơ Mi Nam Tay Ngắn Khatoco A1MN538T2-CNCR112-2009-N,189.000₫,https://tiki.vn/ao-so-mi-nam-tay-ngan-khatoco-a1mn538t2-cncr112-2009-n-p20523891.html?spid=20523918,11,-18%,Đã bán 12,aosomi
Áo Sơ Mi Nam Tay Ngắn Khatoco A1MN568T2-ININ003-2011-N,189.000,https://tiki.vn/ao-so-mi-nam-tay-ngan-khatoco-a1mn568t2-inin003-2011-n-p20521840.html?spid=20521847,12,-34%,,aosomi
,,https://tiki.vn/ao-so-mi-nam-tay-dai-form-slim-khatoco-a1md468s1-cnmk020-2011-d-p30684772.html?spid=30684774,13,,,aosomi
Áo sơ mi dài tay nam Columbia Silver Ridge™ Utility Lite Plaid - 2012941100,845.000₫,https://tiki.vn/ao-so-mi-dai-tay-nam-columbia-silver-ridge-utility-lite-plaid-2012941100-p263492087.html?spid=263492097,14,,Đã bán 3,aosomi
Áo sơ mi nam tay dài trắng công sở vải oxford cao cấp ND02,229.000₫,https://tiki.vn/ao-so-mi-nam-tay-dai-trang-cong-so-vai-oxford-cao-cap-nd02-p74767209.html?spid=74767231,15,-20%,Đã bán 252,aosomi
Áo sơ mi nam tay ngắn form suông LAI BẰNG Khatoco A1MN388T2-ININ012-2210-N-HỌA TIẾT XANH,252.200₫,https://tiki.vn/ao-so-mi-nam-tay-ngan-form-suong-lai-bang-khatoco-a1mn388t2-inin012-2210-n-hoa-tiet-xanh-p198585506.html?spid=198585516,16,-20%,Đã bán 13,aosomi
Sơ Mi Nam Ngắn Tay Công Sở Trung Niên Thương Hiệu Anton Vải Sợi Tre Xanh Dương Họa Tiết In GD561,265.000,https://tiki.vn/so-mi-nam-ngan-tay-cong-so-trung-nien-thuong-hieu-anton-vai-soi-tre-xanh-duong-hoa-tiet-in-gd561-p162817668.html?spid=162817670,17,,,aosomi
,,https://tiki.vn/ao-so-mi-nam-tay-dai-khatoco-a1md388s1-cnsc009-2102-d-trang-phoi-xanh-p20573904.html?spid=20573964,18,-27%,,aosomi
Áo sơ mi nam tay ngắn form suông lai bằng caro xanh Khatoco A1MN438T2-CNCR119-2112-N,284.700₫,https://tiki.vn/ao-so-mi-nam-tay-ngan-form-suong-lai-bang-caro-xanh-khatoco-a1mn438t2-cncr119-2112-n-p92393846.html?spid=92393850,19,,Đã bán 41,aosomi
"Áo sơ mi trắng dài tay không túi ARISTINO với thành phần 100% Micro Polyester cho bề mặt trơn bóng, mềm mại, ít bám bụi, dáng Slim fit gọn gàng lịch sự",695.000₫,https://tiki.vn/ao-so-mi-trang-dai-tay-aristino-voi-thanh-phan-100-micro-polyester-cho-be-mat-tron-bong-mem-mai-it-bam-bui-dang-slim-fit-gon-gang-lich-su-alsr18-p145423130.html?spid=145423136,20,-32%,Đã bán 19,aosomi
Áo Sơ Mi Nam Trắng Trơn Dài Tay Công Sở Trung Niên Thương Hiệu Anton Vải Nano Chống Nhăn - SRD05,295.000₫,https://tiki.vn/ao-so-mi-nam-trang-tron-dai-tay-cong-so-trung-nien-thuong-hieu-anton-vai-nano-chong-nhan-srd05-p163896997.html?spid=163896999,21,-35%,Đã bán 7,aosomi
Áo sơ mi nam tay dài hai túi công sở màu trắng vải oxford denim cao cấp NS035,249.000₫,https://tiki.vn/ao-so-mi-nam-tay-dai-hai-tui-cong-so-mau-trang-vai-oxford-denim-cao-cap-ns035-p82984729.html?spid=82984765,22,-30%,Đã bán 36,aosomi
Áo Sơ Mi Nam Trung Niên Công Sở Anton Somianton Dài Tay Vải Sợi Tre Kẻ Caro - AC26,265.000₫,https://tiki.vn/ao-so-mi-nam-trung-nien-cong-so-anton-somianton-dai-tay-vai-soi-tre-ke-caro-ac26-p248632967.html?spid=248632973,23,,Đã bán 2,aosomi
Áo Sơ Mi Nam Công Sở Trung Niên Thương Hiệu Anton Xanh Than Có Túi Ngắn Tay Trơn Vải Cotton - XSN13,195.000₫,https://tiki.vn/ao-so-mi-nam-cong-so-trung-nien-thuong-hie-u-anton-xanh-than-co-tui-ngan-tay-tron-va-i-cotton-xsn13-p200002662.html?spid=200002664,24,,Đã bán 14,aosomi
Áo Sơ Mi Nam Xanh Dương Ngắn Tay Thương Hiệu Anton Công Sở Trung Niên Vải Sợi Tre Họa Tiết In YGD561,265.000,https://tiki.vn/ao-so-mi-nam-xanh-duong-ngan-tay-thuong-hieu-anton-cong-so-trung-nien-vai-soi-tre-hoa-tiet-in-ygd561-p162838969.html?spid=162838977,25,,,aosomi
,,https://tiki.vn/ao-so-mi-nam-trang-cong-so-thuong-hieu-anton-dai-tay-hoa-tiet-ke-soc-cotton-at205-p164017356.html?spid=164017360,26,,,aosomi
Áo sơ mi nam abd,95.000₫,https://tiki.vn/ao-so-mi-nam-abd-p23453099.html?spid=23453105,27,,Đã bán 262,aosomi
Áo sơ mi nam tay dài form suông Khatoco A1MD498T1-CNIN028-2410-D,398.400₫,https://tiki.vn/ao-so-mi-nam-tay-dai-form-suong-khatoco-a1md498t1-cnin028-2410-d-p243057272.html?spid=243057274,28,,Đã bán 1,aosomi
Áo Sơ Mi Nam Tay Dài Khatoco A1MD468T1-CNTR010-2408-D-Trắng,374.400₫,https://tiki.vn/ao-so-mi-nam-tay-dai-khatoco-a1md468t1-cntr007-2006-d-trang-p20525822.html?spid=20525835,29,,Đã bán 31,aosomi
Áo sơ mi nam cổ trụ chui đầu dài tay,159.000,https://tiki.vn/ao-so-mi-nam-co-tru-chui-dau-dai-tay-p29939062.html?spid=29939068,30,,,aosomi
,,https://tiki.vn/ao-so-mi-nam-tay-ngan-form-suong-lai-bang-khatoco-a1mn438t2-cntr010-2401-n-trang-tron-p198519026.html?spid=198519036,31,,,aosomi
"Áo sơ mi lụa nam dài tay có túi cao cấp LADOS 8097 co giãn nhẹ, thấm hút",219.000₫,https://tiki.vn/ao-so-mi-lua-nam-dai-tay-co-tui-cao-cap-lados-8097-co-gian-nhe-tham-hut-p208125217.html?spid=208125223,32,,Đã bán 6,aosomi
"Áo sơ Mi, Áo sơ Mi Nam cổ Vest, dài tay, mới lạ và sang trọng. Chất liệu Cotton cao cấp, nhẹ, mát mẻ, thấm mồ hôi, không nhăn, không nhàu,mã N34",199.000₫,https://tiki.vn/ao-so-mi-ao-so-mi-nam-co-vest-dai-tay-moi-la-va-sang-trong-chat-lieu-cotton-cao-cap-nhe-mat-me-tham-mo-hoi-khong-nhan-khong-nhau-ma-n34-p183718179.html?spid=183718189,33,,Đã bán 11,aosomi
Sơ mi nam cộc tay May 10 form Regular mã 010121194LT 471,175.000₫,https://tiki.vn/so-mi-nam-coc-tay-may-10-form-regular-ma-010121194lt-471-p271538093.html?spid=271538095,34,,Đã bán 3,aosomi
"Áo sơ mi dài tay nam vải chéo Hàn cao cấp LADOS - 8107 không nhăn, form đẹp",159.000,https://tiki.vn/ao-so-mi-dai-tay-nam-vai-cheo-han-cao-cap-lados-8107-khong-nhan-form-dep-p249482932.html?spid=249482959,35,,Đã bán 4,aosomi
,,https://tiki.vn/ao-so-mi-nam-dai-tay-cong-so-chat-lieu-chong-nhan-cao-cap-p23014297.html?spid=23014329,36,,,aosomi
"Áo sơ mi nam họa tiết ngắn tay, form rộng, vạt ngang, size đại tới 110 kg, thiết kế hoa văn nho nhỏ, hiệu Amazing",229.000₫,https://tiki.vn/ao-so-mi-nam-hoa-tiet-ngan-tay-form-rong-vat-ngang-size-dai-toi-110-kg-thiet-ke-hoa-van-nho-nho-hieu-amazing-p244169153.html?spid=244169155,37,,Đã bán 7,aosomi
Áo sơ mi nam tay dài form ôm Khatoco A1MD468S1-CNIN014-2106-D - Xanh dương họa tiết,304.200₫,https://tiki.vn/ao-so-mi-nam-tay-dai-form-om-khatoco-a1md468s1-cnin014-2106-d-xanh-duong-hoa-tiet-p54762444.html?spid=54762463,38,,Đã bán 2,aosomi
Áo sơ mi nam tay dài caro to trắng xanh Khatoco A1MD568T1- CNCR045-2205-D,397.600₫,https://tiki.vn/ao-so-mi-nam-tay-dai-caro-to-trang-xanh-khatoco-a1md568t1-cncr045-2205-d-p86395340.html?spid=86395348,39,,Đã bán 5,aosomi
Áo Sơ Mi Nam Tay Ngắn Khatoco A1MN438S1-CNCR016-2102-N,284.700,https://tiki.vn/ao-so-mi-nam-tay-ngan-khatoco-a1mn438s1-cncr016-2102-n-hong-p20526282.html?spid=20526299,40,,,aosomi
